{
    "case_id": "",
    "court": "HIGH COURT OF KERALA AT ERNAKULAM\nPRESENT\nTHE HONOURABLE MR",
    "date": "2020",
    "judge": "P.B.SURESH KUMAR",
    "petitioners": [
        "(P.O.), KOYILANDY, KOZHIKODE (DIST) - 673 307.",
        "MOODADI (P.O.), KOYILANDY,",
        "KOZHIKODE (DIST) 673 307.",
        "S/ACCUSED NOS.1 TO 3:",
        "P.B.SURESH KUMAR",
        "D/O.RAMANKUTTY, KAIPPURATH HOUSE,",
        "AGED 46 YEARS",
        "Annexure Il",
        "PETER",
        "1 BIJU K.,",
        "3 SUMA,",
        "AGED 37 YEARS",
        "s/o. RAMANKUTTY, KATPPURATH (NANDANAM) HOUSE,",
        "AGED 41 YEARS",
        "KOZHIKODE (DIST) - 673 307.",
        "MALAYIL HOUSE",
        "2 PREMAN,",
        "MOODADI (P.0O.), KOYILANDY,",
        "s/o. RAMANKUTTY, KAIPPURATH HOUSE, MOODADTI"
    ],
    "respondents": [
        "S /STATE & COMPLAINANT:",
        "Vatakara",
        "1 STATE OF KERALA",
        "REP. BY THE PUBLIC PROSECUTOR,",
        "HIGH COURT OF KERALA, ERNAKULAM - 682 031."
    ],
    "sections": [
        "482",
        "406",
        "498A read with Section 34\nof the Indian Penal Code"
    ],
    "outcome": "In the result, the Crl.M.C. is allowed",
    "full_text": "Cll art ater |\nRaces\nElz mie\n2020/KER/331\nIN THE HIGH COURT OF KERALA AT ERNAKULAM\nPRESENT\nTHE HONOURABLE MR. JUSTICE P.B.SURESH KUMAR\nTUESDAY, THE O7TH DAY OF JANUARY 2020 / 17TH POUSHA, 1941\nCr1.MC.No.24 OF 2020 (C)\nAGAINST C.C.NO.284/2019 OF THE JUDICIAL FIRST CLASS\nMAGISTRATE COURT, VATAKARA\nCRIME NO.1192/2018 OF THE VATAKARA POLICE STATION,\nKOZHIKODE RURAL\nPETITIONERS/ACCUSED NOS.1 TO 3:\n1 BIJU K.,\nAGED 37 YEARS\ns/o. RAMANKUTTY, KAIPPURATH HOUSE, MOODADTI\n(P.O.), KOYILANDY, KOZHIKODE (DIST) - 673 307.\n2 PREMAN,\nAGED 46 YEARS\ns/o. RAMANKUTTY, KATPPURATH (NANDANAM) HOUSE,\nMOODADI (P.0O.), KOYILANDY,\nKOZHIKODE (DIST) - 673 307.\n3 SUMA,\nAGED 41 YEARS\nD/O.RAMANKUTTY, KAIPPURATH HOUSE,\nMOODADI (P.O.), KOYILANDY,\nKOZHIKODE (DIST) 673 307.\nBY ADV. SMT.K.DEEPA (PAYYANUR)\nRESPONDENTS /STATE & COMPLAINANT:\n1 STATE OF KERALA\nREP. BY THE PUBLIC PROSECUTOR,\nHIGH COURT OF KERALA, ERNAKULAM - 682 031.\n\nEee\na\nElz a\n2020/KER/331\nCrl.M.C. No.24 of 2020 2\n2 LINISHA.P.M\n35 YEARS, D/O. BALAN,\nPADINJARA MALAYIL HOUSE,\nNADAKKUTHAZHA (P.O.), VATAKARA,\nKOZHIKODE (DIST) - 673 104.\nR2 BY ADV. AKHILA K NAMBIAR\nR1 BY SRI.SANTHOSH PETER, SR.PUBLIC PROSECUTOR\nTHIS CRIMINAL MISC. CASE HAVING COME UP FOR ADMISSION\nON 07.01.2020, THE COURT ON THE SAME DAY PASSED THE\nFOLLOWING :\n\nrig el\nae\n2020/KER/331\nCrl.M.C. No.24 of 2020 3\nORDER\n\nThis is a proceedings instituted under Section 482 of\nthe Code of Criminal Procedure for quashing Annexure - | final\nreport and all further proceedings pursuant thereto now\npending as C.C.No.284 of 2019 on the files of the Court of the\nJudicial Magistrate of First Class, Vatakara.\n\n2. The petitioners are the accused in the said case.\nThe case was one instituted at the instance of the second\nrespondent under Sections 406 and 498A read with Section 34\nof the Indian Penal Code.\n\n3. It is seen that the second respondent has settled\nher disputes with the petitioners, and an affidavit to that effect\nhas been filed as Annexure II.\n\n4. The learned counsel for the second respondent\naffirmed that Annexure Il is an affidavit sworn to by the second\nrespondent and submitted that the second respondent has no\n\nrig el\nae\n2020/KER/331\nCrl.M.C. No.24 of 2020 4\nobjection in granting the relief sought for by the petitioners.\n\n5. In the light of the decision of the Apex Court in\nGian singh v. State of Punjab, (2012) 10 SCC 303, | am of\nthe view that this is an appropriate case where this court has to\ninvoke the jurisdiction under Section 482 of the Code of\nCriminal Procedure to quash the proceedings against the\npetitioners.\n\nIn the result, the Crl.M.C. is allowed and Annexure - |\nfinal report and all further proceedings pursuant thereto against\nthe petitioners, pending as C.C.No.284 of 2019 on the files of\nthe Court of the Judicial Magistrate of First Class, Vatakara are\nquashed.\n\nSd/-\nP.B.SURESH KUMAR, JUDGE.\nDK\n\nEee\n[ca] 2 ara\n2020/KER/331\nCrl.M.C. No.24 of 2020 5\nAPPENDIX\nPETITIONERS' EXHIBITS:\nANNEXURE 1 CERTIFIED COPY OF THE FINAL REPORT OF\nCRIME NO. 1192/2018 OF THE VATAKARA\nPOLICE STATION, KOZHIKODE RURAL.\nANNEXURE II AFFIDAVIT FILED BY THE 2ND RESPONDENT\nTO THE EFFECT OF SETTLEMENT.\nRESPONDENTS' EXHIBITS: NIL\n//TRUE CoPpy//\nPA TO JUDGE\nDK\n\n"
}