{
    "case_id": "",
    "court": "HIGH COURT OF KERALA AT ERNAKULAM\nPRESENT\nTHE HONOURABLE MRS",
    "date": "2024",
    "judge": "THOMAS",
    "petitioners": [
        "1 SHAMEEM P.V",
        "Gian Singh v. State of Punjab",
        "AGED 52 YEARS",
        "AGED 36 YEARS",
        "W/O MUHAMMED.N, ' AL DURRA', CHERUKUNNU P.O, KANNUR",
        "S /ACCUSED NOS.1 TO 3:",
        "AGED 60 YEARS",
        "2 MUHAMMED .N",
        "670301",
        "Laxmi Narayan",
        "S/O MUHAMMED.N, 'AL DURRA', CHERUKUNNU P.O, KANNUR",
        "DIST, PIN - 670301",
        "3 SAINABA",
        "' Al DURRA' CHERUKUNNU P.O, KANNUR DIST-, PIN -"
    ],
    "respondents": [
        "1 STATE OF KERALA",
        "D/O A.C ABDUL KHADER, \"SUJOOD MANZIL\", MAMMAKUNNU",
        "SR.PP-SRI.VIPIN NARAYAN",
        "REPRESENTED BY PUBLIC PROSECUTOR, HIGH COURT OF",
        "S /COMPLAINANTS :",
        "ROAD, KADACHIRA P.O, KANNUR DIST, PIN - 670621",
        "2 JUMANA HASEEN",
        "KERALA, PIN - 682031",
        "AGED 26 YEARS"
    ],
    "sections": [
        "482",
        "498A\nr/w Section 34 of IPC"
    ],
    "outcome": "petitioners can be quashed",
    "full_text": "BES\nce\nHise\nBe ait Tere\n2024/KER/4888\nIN THE HIGH COURT OF KERALA AT ERNAKULAM\nPRESENT\nTHE HONOURABLE MRS. JUSTICE SOPHY THOMAS\nMONDAY, THE 22°” DAY OF JANUARY 2024 / 2ND MAGHA, 1945\nCRL.MC NO. 16 OF 2024\nCRIME NO.1490/2023 OF Kannur Town, Kannur\nPETITIONERS /ACCUSED NOS.1 TO 3:\n1 SHAMEEM P.V\nAGED 36 YEARS\nS/O MUHAMMED.N, 'AL DURRA', CHERUKUNNU P.O, KANNUR\nDIST, PIN - 670301\n2 MUHAMMED .N\nAGED 60 YEARS\n' Al DURRA' CHERUKUNNU P.O, KANNUR DIST-, PIN -\n670301\n3 SAINABA\nAGED 52 YEARS\nW/O MUHAMMED.N, ' AL DURRA', CHERUKUNNU P.O, KANNUR\nDIST, PIN - 670301\nBY ADV P.K.MOHAMED JAMEEL\nRESPONDENTS /COMPLAINANTS :\n1 STATE OF KERALA\nREPRESENTED BY PUBLIC PROSECUTOR, HIGH COURT OF\nKERALA, PIN - 682031\n2 JUMANA HASEEN\nAGED 26 YEARS\nD/O A.C ABDUL KHADER, \"SUJOOD MANZIL\", MAMMAKUNNU\nROAD, KADACHIRA P.O, KANNUR DIST, PIN - 670621\nSR.PP-SRI.VIPIN NARAYAN\nTHIS CRIMINAL MISC. CASK HAVING COME UP FOR ADMISSION ON\n22.01.2024, THER COURT ON THE SAMBR DAY PASSED THE FOLLOWING:\n\n=\nDaan\n2024/KER/4888\nCRL.MC NO.16 OF 2024\n2\nORDER\nDated this the 22\"! day of January , 2024\n\nThis Crl.M.C., under Section 482 of CrP.C., is filed by\naccused Nos.1 to 3 in Crime No.1490 of 2023 of Kannur\nTown Police Station, Kannur, registered under Section 498A\nr/w Section 34 of IPC, for quashing Annexure Ai FIR.\n2. The prosecution allegation is that, accused Nos.1 to\n3, who are the husband and in-laws of the defacto\ncomplainant/2™ respondent, subjected her to matrimonial\ncruelties, demanding more gold and money.\n3. When the matter is taken up for consideration,\nlearned counsel for the petitioners submitted that the\nmatter stands settled between themselves and the defacto\ncomplainant/2™ respondent. The defacto complainant\nentered appearance through counsel, and submitted that\nthe matter is settled, and Annexure A2 is the affidavit filed\nby her, endorsing the settlement. She has no intention to\n\nDaan\n2024/KER/4888\nCRL.MC NO.16 OF 2024\nproceed with the prosecution. She has no objection in\nquashing the proceedings pending against the petitioners\npursuant to Crime No.1490 of 2023 of Kannur Town Police\nStation.\n4. On instructions, learned Public Prosecutor submitted\nthat the matter is settled, and he produced signed\nstatement of the 2™ respondent, to the effect that she is\nnot intending to proceed with the prosecution, and she has\nno objection in quashing Annexure Ai FIR in Crime\nNo.1490 of 2023 of Kannur Town Police Station.\n5. Since the matter stands settled, no purpose would be\nserved by continuing the prosecution against the\npetitioners.\n6. In the light of the principles laid down by the Apex\nCourt in Gian Singh v. State of Punjab and Another;\n[(2012) 10 SCC 303) ], and State of Madhya Pradesh\nv. Laxmi Narayan and Others; [(2019) 5 SCC 688],\nthis Court is of the view that the proceedings against the\n\nea tal\nReon es\ncape sat Tere\n2024/KER/4888\nCRL.MC NO.16 OF 2024\n4\npetitioners can be quashed on the basis of settlement.\nMoreover, the dispute is purely personal in nature, and no\npublic interest is involved in it.\nIn the result, this Crl.M.C. is allowed and Annexure\nAl FIR in Crime No.1490 of 2023 of Kannur Town Police\nStation, stands quashed.\nSd/-\nSOPHY THOMAS\nJUDGE\nSSK/22/01\n\nobra\nce\nHise\nEe ake Tere\n2024/KER/4888\nCRL.MC NO.16 OF 2024\n5\nAPPENDIX OF CRL.MC 16/2024\nPETITIONER ANNEXURES\nAnnexure Al THE COPY OF THE F.I.R IN CRIME\nNO:1490/2023 OF KANNUR TOWN POLICE STATION\nAnnexure A2 THE ORIGINAL AFFIDAVIT SWORN IN BY THE 2ND\nRESPONDENT\n\n"
}