{
    "case_id": "",
    "court": "Court",
    "date": "Saturday",
    "judge": "Sri",
    "petitioners": [
        "Addl",
        "This Crl.M.C having been finally heard on 27..02..2025 and",
        "Excise Inspector, Excise Range, Neyyattinkara, represented by Public",
        "Pradeep.V, S/o.Viswambaran, aged 34 years, Puthuval Puthen Veedu,",
        "By Addl.Public Prosecutor A.R. Shaji",
        "Punnakkadu, Perumpazhuthoor.P.O, Pin — 695126.",
        "Puthuval Puthen Veedu",
        "Perumpazhuthoor",
        "Jurisdictional Magistrate",
        "A.R. Shaji",
        "Neyyattinkara",
        "Prosecutor, Thiruvananthapuram.",
        "Excise Range",
        "RESPONDENT/COUNTER PETITIONER:-",
        "-VI\n",
        "JACCUSED :",
        "the Court on 01..03..2025 passed the following :"
    ],
    "respondents": [
        "COUNTER PETITIONER:-",
        "Excise Inspector, Excise Range, Neyyattinkara, represented by Public",
        "Prosecutor, Thiruvananthapuram."
    ],
    "sections": [
        "67B",
        "483",
        "55(i)",
        "2023"
    ],
    "outcome": "In the result, Criminal MC is allowed",
    "full_text": "1\nIN THE COURT OF THE SESSIONS JUDGE - VI, THIRUVANANTHAPURAM.\nPresent : Sri. VISHNU K., ADDITIONAL SESSIONS JUDGE -VI\nSaturday, the 1 day of March, 2025\nCRIMINAL M.C.No.529/2025\n(Crime No.7/2025 of Excise Range Office, Neyyattinkara)\nPETITIONER/JACCUSED :\nPradeep.V, S/o.Viswambaran, aged 34 years, Puthuval Puthen Veedu,\nPunnakkadu, Perumpazhuthoor.P.O, Pin — 695126.\nBy Adv.S.Lekha\nRESPONDENT/COUNTER PETITIONER:-\nExcise Inspector, Excise Range, Neyyattinkara, represented by Public\nProsecutor, Thiruvananthapuram.\nBy Addl.Public Prosecutor A.R. Shaji\nThis Crl.M.C having been finally heard on 27..02..2025 and\nthe Court on 01..03..2025 passed the following :\nORDER\nThe above application has been filed by the petitioner under Section 483 of\nBharatiya Nagarik Suraksha Sanhita (for short, BNSS), 2023 seeking regular bail in\nconnection with Crime No.07/2025 of Excise Range office, Neyyattinkara, registered\nfor the offences punishable under sections 55(i) and 67B of Kerala Abkrai Act | of\n1077.\n2.Petitioner is the sole accused in the above crime.\n3.The prosecution allegation is that on 13/02/2025 at 08:40 am, the accused was\nfound in possession of 8 litres of Indian Made Foreign Liquor for the purpose of sale\nin contravention of the provisions of the Abkari Act. Thus, the accused is said to have\ncommitted the above offences.\n\n2\n4, Heard both sides.\n5.The learned counsel for the petitioner submitted that the petitioner was arrested\n\non 13/02/2025 and he has been in judicial custody. The counsel appeared for the\npetitioner further submitted that the petitioner is innocent and he is falsely implicated in\nthe case. He has not committed any offence as alleged by the prosecution.\n\n6.On the other hand, the learned Additional Public Prosecutor opposed the bail\napplication.\n\n7.It is seen from the report filed by the Investigating Officer that the accused is in\ncustody since 13/02/2025. Major part of the investigation is completed. The\ncontraband articles are also taken into custody and produced before Court. Therefore,\nthis court is of the view that further detention of the accused is not warranted, rather,\nthe petitioner can be released on bail by imposing conditions.\n\nIn the result, Criminal MC is allowed on the following conditions;\n\n(i). The petitioner shall be released on bail on his executing bond for\nRs.50,000/- with two solvent sureties each for the like sum to the satisfaction of the\nJurisdictional Magistrate.\n\n(ii). The petitioner shall report before the Investigating Officer every Monday\nuntil further orders or until final report is filed.\n\nDictated to the Confidential Assistant, typewritten by her in the computer, corrected by\n\nme and pronounced in open Court on the 1* day of March, 2025.\nVISHNU K.,\nADDITIONAL SESSIONS JUDGE - VI\n\nCompared by: Abirami Ps.\nBence Cler-sindh.G.\n\n3\nORDER IN\nCRIMINAL M.C.No.529/2025\nDATED:01/03/2025\n\n4\n\n5\n\n"
}