{
    "case_id": "",
    "court": "HIGH COURT OF KERALA AT ERNAKULAM\nPRESENT",
    "date": "2018",
    "judge": "B.KEMAL PASHA",
    "petitioners": [
        "3 THANVEER,",
        "AGED 26 YEARS, S/O.IBRAHIM, PARAKKAIL HOUSE,",
        "J.\nDated",
        "2 RAMSHAD,",
        "AGED 25 YEARS, S/O.SOOPY, MALAYIL HOUSE,",
        "1 SHAMSEER,",
        "4 JALALUDHEEN,",
        "5 RAHEEM,",
        "THAROPOYIL PO, THIRUVALLOOR, AYANCHERI,",
        "AGED 26 YEARS, S/O.MOIDHU, MADOL HOUSE,",
        "POOLAKKUL PO, PALLIYATH, VADAKARA, KOZHIKODE DISTRICT.",
        "/ACCUSED 1 TO 5",
        "AGED 28 YEARS, S/O.SOOPY PALLIYATH KUNI HOUSE,",
        "VADAKARA, KOZHIKODE DISTRICT.",
        "AGED 25 YEARS, S/O.ABDULLA, PARAMBATH HOUSE,",
        "MALAYIL HOUSE",
        "AGED 24 YEARS, S/O.MOIDHU, EROTHKANDY HOUSE,",
        "Beigel",
        "PALLIYATH, POOLAKKUL PO, VADAKARA, KOZHIKODE DISTRICT.",
        "6 SAMEER,",
        "KAKKATHIL, MANIMALA, POOLAKKUL PO,"
    ],
    "respondents": [
        "KOZHIKODE DISTRICT, PIN-673541.",
        "Rl BY PUBLIC PROSECUTOR SRI.ALEX M.THOMBRA",
        "HIGH COURT OF KERALA, ERNAKULAM, PIN-682031.",
        "(S) /COMPLAINANTS :",
        "2.BABU,",
        "R2 BY ADV. SRI.AJOY VENU",
        "1.STATE OF KERALA,",
        "THIRUVALLOOR, THAROPOYIL PO, VADAKARA,",
        "REPRESENTED BY PUBLIC PROSECUTOR,",
        "AGED 38 YEARS, S/O.CHEKKOTTI, KULAGARTH HOUSE,"
    ],
    "sections": [
        "323",
        "143",
        "147",
        "294(b)",
        "324",
        "148",
        "506(ii) read with\nSection 149 IPC"
    ],
    "outcome": "Badakara Police Station, can be quashed",
    "full_text": "Beigel\nce\nPap ie\ncen\n2018/KER/282\nIN THE HIGH COURT OF KERALA AT ERNAKULAM\nPRESENT :\nTHE HONOURABLE MR. JUSTICE B.KEMAL PASHA\nTHURSDAY, THE 4TH DAY OF JANUARY 2018 / 14TH POUSHA, 1939\nCr1.MC.No. 8883 of 2017\nC.C.NO.630/2014 of JUDICIAL FIRST CLASS MAGISTRATE COURT. , VATAKARA\nCRIME NO. 1552/2013 OF VATAKARA POLICE STATION , KOZHIKODE\nPETITIONER(S) /ACCUSED 1 TO 5\n1 SHAMSEER,\nAGED 24 YEARS, S/O.MOIDHU, EROTHKANDY HOUSE,\nTHAROPOYIL PO, THIRUVALLOOR, AYANCHERI,\nVADAKARA, KOZHIKODE DISTRICT.\n2 RAMSHAD,\nAGED 26 YEARS, S/O.MOIDHU, MADOL HOUSE,\nPOOLAKKUL PO, PALLIYATH, VADAKARA, KOZHIKODE DISTRICT.\n3 THANVEER,\nAGED 25 YEARS, S/O.SOOPY, MALAYIL HOUSE,\nKAKKATHIL, MANIMALA, POOLAKKUL PO,\nVADAKARA, KOZHIKODE DISTRICT.\n4 JALALUDHEEN,\nAGED 26 YEARS, S/O.IBRAHIM, PARAKKAIL HOUSE,\nPALLIYATH, POOLAKKUL PO, VADAKARA, KOZHIKODE DISTRICT.\n5 RAHEEM,\nAGED 25 YEARS, S/O.ABDULLA, PARAMBATH HOUSE,\nPALLIYATH, POOLAKKUL PO, VADAKARA, KOZHIKODE DISTRICT.\n6 SAMEER,\nAGED 28 YEARS, S/O.SOOPY PALLIYATH KUNI HOUSE,\nPALLIYATH, POOLAKKUL PO, VADAKARA, KOZHIKODE DISTRICT.\nBY ADVS.SRI.J.R.PREM NAVAZ\nSRI.P.T.SHEEJISH\nTS\n\nBleieee\nPa sore} ie\noe\n2018/KER/282\nCr1.MC.No. 8883 of 2017 ()\nRESPONDENT (S) /COMPLAINANTS :\n1.STATE OF KERALA,\nREPRESENTED BY PUBLIC PROSECUTOR,\nHIGH COURT OF KERALA, ERNAKULAM, PIN-682031.\n2.BABU,\nAGED 38 YEARS, S/O.CHEKKOTTI, KULAGARTH HOUSE,\nTHIRUVALLOOR, THAROPOYIL PO, VADAKARA,\nKOZHIKODE DISTRICT, PIN-673541.\nRl BY PUBLIC PROSECUTOR SRI.ALEX M.THOMBRA\nR2 BY ADV. SRI.AJOY VENU\nTHIS CRIMINAL MISC. CASE HAVING COME UP FOR ADMISSION ON 04-01-2018,\nTHE COURT ON THE SAME DAY PASSED THE FOLLOWING:\nTS\n\nPlein ssl\nce\nSa\noe\n2018/KER/282\nCr1.MC.No. 8883 of 2017 ()\nAPPENDIX\nPETITIONER(S)' ANNEXURES\nANNEXURE A THE TRUE COPY OF THE FINAL REPORT IN CRIME\nNO.1552 OF 2013, OF BADAKARA POLICE STATION IN\nKOZHIKODE DISTRICT.\nANNEXURE B THE AFFIDAVIT SOLEMNLY AFFIRMED BY THE SECOND\nRESPONDENT/DEFACTO COMPLAINANT.\nRESPONDENT (S)' ANNEXURES - NIL\n/TRUE COPY/\nPS TO JUDGE\nTS\n\nB. KEMAL PASHA, J.\nDated this the 4\" day of January, 2018\nORDER\n\nPetitioners are the accused in CC No.630/2014 of\nthe Judicial First Class Magistrate's Court-l, Vadakara,\nwhich has arisen from Crime No.1552/2013 of Badakara\nPolice Station for the offences punishable under Sections\n143, 147, 148, 323, 324, 294(b) and 506(ii) read with\nSection 149 IPC.\n\n2. It seems that the matter has been amicably\nsettled between the petitioners and the de_ facto\ncomplainant, who is the 2\"? respondent herein.\n\n3. The 2â„¢ respondent has filed Annexure-B affidavit\naffirming that the matter has been amicably settled between\nhim and the petitioners and presently, he has no complaints\nagainst the petitioners. No purpose would be served in\nproceeding with the matter further. Matters being so, all\n\nCrl.M.C.8883/2017 >.\n\nfurther proceedings against the petitioners in CC\nNo.630/2014 of the Judicial First Class Magistrate's Court-l,\nVadakara, which has arisen from Crime No.1552/2013 of\nBadakara Police Station, can be quashed.\n\nIn the result, this Crl.M.C. is allowed and all further\nproceedings against the petitioners in CC No.630/2014 of\nthe Judicial First Class Magistrate's Court-l, Vadakara,\nwhich has arisen from Crime No.1552/2013 of Badakara\nPolice Station, are quashed.\n\nSd/-\n(B.KEMAL PASHA, JUDGE)\naks/04/01\n// True Copy /\nPS to Judge\n\n"
}