{
    "case_id": "Crl.MC.No. 40 of 2019",
    "court": "HIGH COURT OF KERALA AT ERNAKULAM\nPRESENT\nTHE HONOURABLE MR",
    "date": "2019",
    "judge": "K.ABRAHAM MATHEW",
    "petitioners": [
        "S:",
        "KOLLAM .",
        "KUNNUVILLA PUTHENVEEDU",
        "MC.No",
        "S/O.SIVADASAN, KUZHUVILLA VEEDU, PARIPPALLY",
        "KUZHUVILLA VEEDU",
        "Sd/-\nK.ABRAHAM MATHEW",
        "BATJU",
        "AGED 45 YEARS"
    ],
    "respondents": [
        "S:",
        "S/O.BABU, KUNNUVILLA PUTHENVEEDU KULMADA",
        "PARTPPALLY KOLLAM-691001.",
        "COURT OF KERALA, ERNAKULAM-682031.",
        "AGED 27 YEARS",
        "REPRESENTED BY THE PUBLIC PROSECUTOR, HIGH",
        "1 THE STATE OF KERALA",
        "2 HAREESH"
    ],
    "sections": [
        "482",
        "323",
        "324",
        "341"
    ],
    "outcome": "In the result, this Crl.M.C. is allowed",
    "full_text": "stern\noy\nBer\n2019/KER/218\nIN THE HIGH COURT OF KERALA AT ERNAKULAM\nPRESENT\nTHE HONOURABLE MR. JUSTICE K.ABRAHAM MATHEW\nFRIDAY, THE 04TH DAY OF JANUARY 2019 / 14TH POUSHA, 1940\nCr1.MC.No. 40 of 2019\nCRIME NO. 1106/2018 OF PARIPPALLY POLICE STATION, KOLLAM\nPETITIONER/S:\nBATJU\nAGED 45 YEARS\nS/O.SIVADASAN, KUZHUVILLA VEEDU, PARIPPALLY\nKOLLAM .\nBY ADV. SRI.M.R.SARIN\nRESPONDENT/S:\n1 THE STATE OF KERALA\nREPRESENTED BY THE PUBLIC PROSECUTOR, HIGH\nCOURT OF KERALA, ERNAKULAM-682031.\n2 HAREESH\nAGED 27 YEARS\nS/O.BABU, KUNNUVILLA PUTHENVEEDU KULMADA\nPARTPPALLY KOLLAM-691001.\nBY ADV. SRI.V.VINAR\nOTHER PRESENT:\nSRI.C.S.HRITHWIK SR PP\nTHIS CRIMINAL MISC. CASE HAVING COME UP FOR ADMISSION ON\n04.01.2019, THE COURT ON THE SAME DAY PASSED THE\nFOLLOWING:\n\noo\n2019/KER/218\n\nCrl.MC.No. 40 of 2019\n\n1i2..\nORDER\nPetition filed under Section 482 Cr.P.C.\n\n2. The petitioner is the accused in Crime No.\n1106 of 2018 of Parippally Police Station\nregistered for the offences under Sections\n323, 324, 341 & 447 of the Indian Penal Code.\nThe second respondent is the victim. It is\nsubmitted that the matter has been settled and\nthe proceedings in the criminal case may be\nquashed.\n\n3. Heard the learned counsel for the petitioner\nand the second respondent and the learned\nPublic Prosecutor.\n\n4. I have perused the affidavit filed by the\nsecond respondent, who has entered appearance\nthrough counsel. I am satisfied that the\nallegation of settlement is true and no public\ninterest is involved. There is no impediment\nfor granting the prayer of the petitioner.\n\noe\nBIER\n2019/KER/218\nCrl.MC.No. 40 of 2019\n1.3..\nIn the result, this Crl.M.C. is allowed. The\nproceedings in Crime No. 1106 of 2018 of\nParippally Police Station are quashed. The\nlearned magistrate may pass appropriate orders\nfor the disposal of the material objects, if\nany, produced in the case.\nSd/-\nK.ABRAHAM MATHEW\nJUDGE\nAPPENDIX\nPETITIONER'S/S EXHIBITS:\nANNEXURE Al THE TRUE COPY OF THE FIR IN CRIME\nNO.1106/18 OF PARIPPALLY POLICE\nSTATION PENDING BEFORE JUDICIAL FIRST\nCLASS MAGISTRATE COURT (TEMPORARY)\nPARAVOOR.\nANNEXURE A2 AFFIDAVIT SINGED BY THE 2ND\nRESPONDENT.\nBka/07.01.2019\n\n"
}