{
    "case_id": "Crl.MC.No. 7843 of 2015",
    "court": "HIGH COURT OF KERALA AT ERNAKULAM\nPRESENT",
    "date": "MONDAY",
    "judge": "B.KEMAL PASHA",
    "petitioners": [
        "SON OF GOPALAKRISHNAN, KOMARAPILLI VEETIL,",
        "Annexures A2",
        "CHAPAYAPARAMBU",
        "7. GIREESH KUMAR, AGED 33 YEARS,",
        "CHETITHARA VEETIL, EZHIKKARA.",
        "SON OF GOPI, KANJIRAPPARAMBIL VEETIL,",
        "Caroma\nORDER\n\nPetitioners",
        "LANKAYIL HOUSE",
        "SON OF KRISHNAN, VALIYAPURAKKAL VEETIL,",
        "6. DINESHAN @ PAINAPPAN, AGED 44 YEARS,",
        "10. JOMY JOSEPH, AGED 33 YEARS,",
        "3. NISHAD, AGED 36 YEARS,",
        "EZHIKKARA KARA, EZHIKKARA VILLAGE.",
        "5. MUJEEB, SON OF ALI,",
        "MC.No",
        "4. RAJEEV, AGED 33 YEARS,",
        "1. PRAMOD, AGED 36 YEARS,",
        "SON OF SUBRAMANIAN, THEKKIDNEDATH VEETIL,",
        "LANKAYIL VEETTIL",
        "SON OF JOSEPH, THADIKKARAN VEETIL, EZHIKKARA.",
        "JOSEPH",
        "9. GOPALAKRISHNAN, AGED 36 YEARS,",
        "SHYAM MOHAN",
        "8. ABILASH, SON OF BABU,",
        "ANEESH",
        "MANNITTU THARAYIL, EZHIKKARA.",
        "SON OF MOHANAN, PANEERATHIL VEETIL,",
        "SRILSANU MATHEW",
        "ADVS.SRI.GEO PAUL",
        "NIKATHIL VEETIL, EZHIKKARA.",
        "2. SANTOSH, SON OF PURUSHAN,",
        "EZHIKKARA.",
        "EZHIKKARA KARA",
        "SON OF RAJAN, NADITHARA, EZHIKKARA.",
        "MEMOOKURUPARAMBU"
    ],
    "respondents": [
        "2. SUJITH, AGED 30 YEARS,",
        "REPRESENTED BY ITS PUBLIC PROSECUTOR,",
        "1. STATE OF KERALA,",
        "SON OF GOPALAN, LANKAYIL HOUSE, EZHIKKARA.",
        "SON OF LALAN, KALLACHIRAYIL, EZHIKKARA.",
        "HIGH COURT OF KERALA.",
        "SON OF SUGUNAN, KALLACHIRA HOUSE, EZHIKKARA.",
        "3. GIREESH, AGED 37 YEARS,",
        "4. MIDHUNLAL, AGED 28 YEARS,"
    ],
    "sections": [
        "506\n(ii) read with Section 149 of the Indian Penal Code",
        "143",
        "147",
        "447",
        "324",
        "148"
    ],
    "outcome": "North Paravoor Police Station, can be quashed",
    "full_text": "Bee\n2016/KER/62\nIN THE HIGH COURT OF KERALA AT ERNAKULAM\nPRESENT:\nTHE HONOURABLE MR. JUSTICE B.KEMAL PASHA\nMONDAY, THE 4TH DAY OF JANUARY 2016/14TH POUSHA, 1937\nCri.MC.No. 7843 of 2015 ()\nCC. NO.497/2009 OF JUDICIAL FIRST CLASS MAGISTRATE COURT-I,\nNORTH PARAVUR.\nPETITIONER(S):\n1. PRAMOD, AGED 36 YEARS,\nSON OF KRISHNAN, VALIYAPURAKKAL VEETIL,\nEZHIKKARA KARA, EZHIKKARA VILLAGE.\n2. SANTOSH, SON OF PURUSHAN,\nNIKATHIL VEETIL, EZHIKKARA.\n3. NISHAD, AGED 36 YEARS,\nSON OF GOPI, KANJIRAPPARAMBIL VEETIL,\nEZHIKKARA.\n4. RAJEEV, AGED 33 YEARS,\nSON OF MOHANAN, PANEERATHIL VEETIL,\nEZHIKKARA.\n5. MUJEEB, SON OF ALI,\nMANNITTU THARAYIL, EZHIKKARA.\n6. DINESHAN @ PAINAPPAN, AGED 44 YEARS,\nSON OF RAJAN, NADITHARA, EZHIKKARA.\n7. GIREESH KUMAR, AGED 33 YEARS,\nSON OF GOPALAKRISHNAN, KOMARAPILLI VEETIL,\nEZHIKKARA.\n8. ABILASH, SON OF BABU,\nCHETITHARA VEETIL, EZHIKKARA.\n9. GOPALAKRISHNAN, AGED 36 YEARS,\nSON OF SUBRAMANIAN, THEKKIDNEDATH VEETIL,\nEZHIKKARA.\n10. JOMY JOSEPH, AGED 33 YEARS,\nSON OF JOSEPH, THADIKKARAN VEETIL, EZHIKKARA.\n\nBee\n2016/KER/62\nCri.MC.No. 7843 of 2015\n11. VIKRAMAN, AGED 46 YEARS,\nSON OF KUTTAPPAN, MAMPAYATHU VEETIL,\nKEDAMANGALAM KARA, EZHIKKARA.\n12. SONY, AGED 36 YEARS,\nSON OF ANTONY, THADIKKARAN VEETIL, EZHIKKARA.\n13. SNIN, AGED 33 YEARS,\nSON OF MOHANAN, CHETITHARA VEETIL, EZHIKKARA.\n14. SHINOJ, AGED 33 YEARS,\nSON OF GOPI, VALIYAPURAKKAL, EZHIKKARA.\n15. RAJU, AGED 49 YEARS,\nSON OF MADHAVAN, LAKSHAM VEETIL, EZHIKKARA.\n16. SHAN, AGED 29 YEARS,\nSON OF CHELLAPPAN, THUNDIPARAMBIL, EZHIKKARA.\n17. NASH, AGED 33 YEARS,\nSON OF NARAYANAN, KOTTAZHATHU VEETIL, EZHIKKARA.\n18. LENIN, AGED 28 YEARS,\nSON OF SUKUMARAN, CHAPAYAPARAMBU,\nNANDYATTUKUNNAMKARAYIL, PARAVUR VILLAGE.\n19. HAMSA, AGED 39 YEARS,\nSON OF BEERAVU, PULLOLI VEETIL, EZHIKKARA.\nBY ADVS.SRI.GEO PAUL,\nSRILSANU MATHEW,\nSRILRADHIKA RAJASEKHARAN P.,\nSRIC.R.PRAMOD,\nSRILS.ASHOK KUMAR.\nRESPONDENT(S):\n1. STATE OF KERALA,\nREPRESENTED BY ITS PUBLIC PROSECUTOR,\nHIGH COURT OF KERALA.\n2. SUJITH, AGED 30 YEARS,\nSON OF SUGUNAN, KALLACHIRA HOUSE, EZHIKKARA.\n3. GIREESH, AGED 37 YEARS,\nSON OF GOPALAN, LANKAYIL HOUSE, EZHIKKARA.\n4. MIDHUNLAL, AGED 28 YEARS,\nSON OF LALAN, KALLACHIRAYIL, EZHIKKARA.\n\nBee\n2016/KER/62\nCri.MC.No. 7843 of 2015\n5. SHYAM MOHAN, AGED 30 YEARS,\nSON OF MOHANAN, TALIPARAMBU, EZHIKKARA.\n6. ANEESH, AGED 31 YEARS,\nSON OF ABDL REHMAN, KALAKKASERRY HOUSE,\nEZHIKKARA.\n7. SAJEESH, AGED 33 YEARS,\nSON OF SASI, KALATHIPARAMBU, EZHIKKARA.\n8. SUMANGALA, AGED 56 YEARS,\nWIFE OF SASI, KALATHIPARAMBU, EZHIKKARA.\n9. AMBIKA, W/O.CHANDRAN,\nMAMMUKKURU PARAMBIL, EZHIKKARA KARA,\nEZHIKKARA VILLAGE.\n10. GIRIJA, AGED 51 YEARS,\nWIFE OF MOHANAN, TALAPARAMBU, EZHIKKARA.\n11. RANJITH, AGED 34 YEARS,\nSON OF CHANDRAN, MEMOOKURUPARAMBU,\nEZHIKKARA.\n12. JEEMON, S/O.RAJAN, AGED 39 YEARS,\nLANKAYIL VEETTIL, EZHIKKARA KARA,\nEZHIKKARA VILLAGE, ERNAKULAM.\n13. PRATHAPAN, S/O. THANKAPPAN,\nAGED 51 YEARS, KALLUCHIRAYIL VEETIL,\nEZHIKKARA KARA, EZHIKKARA VILLAGE.\nR1 BY PUBLIC PROSECUTOR SMT.P. MAYA.\nR2 TO R13 BY ADV. SRILK.S.SREENATH\nTHIS CRIMINAL MISC. CASE HAVING COME UP FOR ADMISSION\nON 04-01-2016, THE COURT ON THE SAME DAY PASSED THE\nFOLLOWING:\nrs.\n\nBee\n2016/KER/62\nCrl.MC.No. 7843 of 2015\nAPPENDIX\n\nPETITIONER'S ANNEXURES:-\nANNEXURE A1: CERTIFIED COPY OF THE FINAL REPORT IN CC.NO.497/2009\n\nON THE FILES OF THE JUDICIAL FIRST CLASS MAGISTRATE\n\nCOURT I, NPARAVOOR AND AFFIDAVIT FILED BY\n\n1ST RESPONDENT.\nANNEXURE A 2: AFFIDAVIT FILED BY THE 2ND RESPONDENT.\nANNEXURE A3 : AFFIDAVIT FILED BY THE 3RD RESPONDENT.\nANNEXURE AÃ©4 : AFFIDAVIT FILED BY THE 4TH RESPONDENT.\nANNEXURE A5: AFFIDAVIT FILED BY THE 5TH RESPONDENT.\nANNEXURE AG : AFFIDAVIT FILED BY THE 6TH RESPONDENT.\nANNEXURE A7 : AFFIDAVIT FILED BY THE 7TH RESPONDENT.\nANNEXURE A8: AFFIDAVIT FILED BY THE 8TH RESPONDENT.\nANNEXURE AQ: AFFIDAVIT FILED BY THE 9TH RESPONDENT.\nANNEXURE A10: AFFIDAVIT FILED BY THE 10TH RESPONDENT.\nANNEXURE A11: AFFIDAVIT FILED BY THE 11TH RESPONDENT.\nANNEXURE A12 :AFFIDAVIT FILED BY THE 12TH RESPONDENT.\nANNEXURE A113 :AFFIDAVIT FILED BY THE 13TH RESPONDENT.\nRESPONDENT'S ANNEXURES:- NIL.\n\nHfTRUE COPY//\nP.S. TO JUDGE\n\nrs.\n\nsoleikER62\nB. KEMAL PASHA, J.\naE Caroma\nORDER\n\nPetitioners are accused in C.C. No.497/2009 of the\nJudicial First Class Magistrate's Court-l, North Paravoor,\nwhich has arisen from Crime No.804/2006 of the North\nParavoor Police Station, registered for the offences\npunishable under Sections 143, 147, 148, 324, 447 and 506\n(ii) read with Section 149 of the Indian Penal Code.\n\n2. The matter has been amicably settled between\nthe petitioners and the defacto complainant, who is the\nsecond respondent herein and the other affected parties,\nwho are respondents 2 to 13. They have filed separate\naffidavits as Annexures A2 to A13 affirming that the matter\nhas been amicably settled between them and the petitioners\nand they have no complaints against the petitioners.\n\nsoleikER62\nCRL.M.C.No. 7843 of 2015 uoe\n\n3. No criminal antecedents have been reported\nagainst the petitioners. When the matter has been amicably\nsetiled, no purpose would be served in proceeding with the\nmatter further, and therefore, all further proceedings in\nC.C. No.497/2009 of the Judicial First Class Magistrate's\nCourt-l, North Paravoor, as against the petitioners, based on\nAnnexure Ai Final Report in Crime No.804/2006 of the\nNorth Paravoor Police Station, can be quashed.\n\nIn the result, this Crl.M.C. is allowed and all further\nproceedings in C.C. No.497/2009 of the Judicial First Class\nMagistrate's Court-l, North Paravoor, as against the\npetitioners, based on Annexure A1 Final Report in Crime\nNo.804/2006 of the North Paravoor Police Station, are\nhereby quashed.\n\nSd/- B.KEMAL PASHA, JUDGE\nul/-\n\n[True copy] PS. to Judge\n\n"
}