{
    "case_id": "Crl.MC.No. 8940 of 2018",
    "court": "HIGH COURT OF KERALA AT ERNAKULAM",
    "date": "2019",
    "judge": "K.ABRAHAM MATHEW",
    "petitioners": [
        "ZARA MANZIL",
        "ZARA MANZIL,",
        "NAZAR MANZIL",
        "AGED 32 YEARS, S/O. SHAHUL HAMEED,",
        "Sd/-\nK.ABRAHAM MATHEW",
        "THURAVOOR P.O.,",
        "1 NAZAR",
        "MC.No",
        "NAZAR MANZIL,",
        "Ble al",
        "3 SHAFEED",
        "S /ACCUSED :-",
        "C. SOMAN\nAGED",
        "CHERTHALA ,",
        "THATTAPARAMBIL, CHERTHALA,",
        "K.ABRAHAM MATHEW",
        "ALAPPUZHA DISTRICT",
        "AGED 51 YEARS, S/O. HAMMEED KUNJU,",
        "2 SHAJEED",
        "AGED 35 YEARS, S/O. SHAHUL HAMEED,"
    ],
    "respondents": [
        "HIGH COURT OF KERALA, ERNAKULAM 682 031",
        "AGED 30 YEARS, S/O. V.C. SOMAN,",
        "ALAPPUZHA DISTRICT 688 006",
        "2 STATE OF KERALA",
        "1 ABHILASH. C. SOMAN",
        "MIDHILA, AVALOOKUNNU P.O.,",
        "THROUGH THE PUBLIC PROSECUTOR,",
        "CHERTHALA",
        "REPRESENTED BY THE CHIEF SECRETARY,",
        "S/STATE :-"
    ],
    "sections": [
        "482",
        "341",
        "506",
        "353",
        "188",
        "294(b)"
    ],
    "outcome": "may be quashed",
    "full_text": "Ble al\na ree eae\nCpe\nIN THE HIGH COURT OF KERALA AT ERNAKULAM 2019/KER/167\nPRESENT\nTHE HONOURABLE MR. JUSTICE K.ABRAHAM MATHEW\nTHURSDAY ,THE 03RD DAY OF JANUARY 2019 / 13TH POUSHA, 1940\nCr1.MC.No. 8940 of 2018\nCRIME NO. 1344/2018 OF Kuthiyathode Police Station, Alappuzha\nPETITIONERS /ACCUSED :-\n1 NAZAR\nAGED 51 YEARS, S/O. HAMMEED KUNJU,\nNAZAR MANZIL,\nTHURAVOOR P.O.,\nCHERTHALA ,\nALAPPUZHA DISTRICT\n2 SHAJEED\nAGED 35 YEARS, S/O. SHAHUL HAMEED,\nZARA MANZIL,\nTHATTAPARAMBIL, CHERTHALA,\nALAPPUZHA DISTRICT\n3 SHAFEED\nAGED 32 YEARS, S/O. SHAHUL HAMEED,\nZARA MANZIL,\nTHATTAPARAMBIL, CHERTHALA,\nALAPPUZHA DISTRICT\nBY ADV. SRI.VISHNURAJ SUGATHAN\nRESPONDENTS/STATE :-\n1 ABHILASH. C. SOMAN\nAGED 30 YEARS, S/O. V.C. SOMAN,\nMIDHILA, AVALOOKUNNU P.O.,\nALAPPUZHA DISTRICT 688 006\n2 STATE OF KERALA\nREPRESENTED BY THE CHIEF SECRETARY,\nTHROUGH THE PUBLIC PROSECUTOR,\nHIGH COURT OF KERALA, ERNAKULAM 682 031\nBY ADV. SRI.GOKUL DAS V.V.H.\nR2 BY SRI C S HRITHWIK-PUBLIC PROSECUTOR\nTHIS CRIMINAL MISC. CASE HAVING COME UP FOR ADMISSION ON\n03.01.2019, THE COURT ON THE SAME DAY PASSED THE FOLLOWING:\n\nCrl.MC.No. 8940 of 2018 2019/KERITO?\n2\nORDER\n\nPetition filed under section 482 Cr.P.C.\n\n2. Petitioners are accused in Crime\nNo.1344 of 2018 of Kuthiyathode Police Station\nregistered for the offences under sections 188,\n294(b), 341, 353 and 506 IPC. The first respondent\nis the victim. It is submitted that the matter has\nbeen settled and the proceedings in the trial court\nmay be quashed.\n\n3. Heard the learned counsel forâ€™ the\npetitioners and first respondent and the learned\nPublic Prosecutor.\n\n4. I have perused the affidavit filed by\nthe first respondent, who has entered appearance\nthrough counsel. I am satisfied that the matter has\nbeen settled and no public interest is involved in\nthis case. There is no impediment for granting the\nprayer of the petitioners.\n\nIn the result, this Crl.M.C is allowed.\nThe proceedings in Crime No.1344 of 2018 of\n\nee\nCrl.MC.No. 8940 of 2018 2019/KERITO?\n3\nKuthiyathode Police Station are quashed. If any\nmaterial objects have been produced in this case,\nthe trial court may pass appropriate orders for\ntheir disposal.\nSd/-\nK.ABRAHAM MATHEW,\nJUDGE\nSMA\n\na ree eae\nPOPS\nCr1.MC.No. 8940 of 2018 2019/KER/167\nA\nAPPENDIX\nPETITIONER'S/S ANNEXURES :-\nANNEXURE 1 CERTIFIED COPY OF FIR IN CRIME NO.\n1344/2018 OF KUTHIYATHODE P.S. ON THE\nFILE OF J.F.C.M.-1, CHERTHALA\nANNEXURE II AFFIDAVIT OF 1ST RESPONDENT\nRESPONDENT (S)' ANNEXURES :- NIL\n//TRUE COPY//\nPA TO JUDGE\nSMA\n\n"
}