{
    "case_id": "",
    "court": "HIGH COURT OF KERALA AT ERNAKULAM\nPRESENT",
    "date": "17 day of April, 2015",
    "judge": "K.SURENDRA MOHAN",
    "petitioners": [
        "3. BINDU PUTHIYADATH, AGED 37 YEARS,",
        "VIJESH KUTTAN P",
        "2. KARTHIYAYINI PUTHIYADATH, AGED 62 YEARS,",
        "J.\nDated",
        "1. VIJESH KUTTAN P, AGED 35 YEARS,",
        "THIMIRI AMSOM, ALAKKODU.",
        "S/O.APPUKUTTAN, CHITTADI,",
        "[ACCUSED:"
    ],
    "respondents": [
        "R1 BY PUBLIC PROSECUTOR SMT.P.A.RAZIYA",
        "PILIKODU VILLAGE, HOSUDURG TALUK,",
        "D/O.P.KRISHNAN, VARUKKOLU VAYAL, PILIKODU P.O.,",
        "REPRESENTED BY THE PUBLIC PROSECUTOR,",
        "1. STATE OF KERALA,",
        "STATE/DEFACTO COMPLAINANT:",
        "KASARAGOD DISTRICT-671 310.",
        "HIGH COURT OF KERALA, ERNAKULAM-682 031.",
        "R2 BY ADV. SRILA.-AARUNKUMAR",
        "2. DHANYAA.V., AGED 29 YEARS,"
    ],
    "sections": [
        "482"
    ],
    "outcome": "In view of the above, this petition is allowed",
    "full_text": "bos ee)\n3\nBE] 4 :\n2015/KER/17188\nIN THE HIGH COURT OF KERALA AT ERNAKULAM\nPRESENT:\nTHE HONOURABLE MR.JUSTICE K.SURENDRA MOHAN\nFRIDAY, THE 17TH DAY OF APRIL 2015/27TH CHAITHRA, 1937\nCri.MC.No. 6587 of 2014\nCC 1707/2014 OF JUDICIAL FIRST CLASS MAGISTRATE COURT -I, HOSDRUG.\nCRIME NO. 7737/2012 OF CHANDERA POLICE STATION , KASARAGOD.\nPETITIONER(S)/[ACCUSED:\n1. VIJESH KUTTAN P, AGED 35 YEARS,\nS/O.APPUKUTTAN, CHITTADI,\nTHIMIRI AMSOM, ALAKKODU.\n2. KARTHIYAYINI PUTHIYADATH, AGED 62 YEARS,\nS/O.APPUKUTTAN, CHITTADI,\nTHIMIRI AMSOM, ALAKKODU.\n3. BINDU PUTHIYADATH, AGED 37 YEARS,\nS/O.APPUKUTTAN, CHITTADI,\nTHIMIRI AMSOM, ALAKKODU.\nBY ADVS.SRI.P.K.SUBHASH\nSRIL.K.REEHA KHADER\nRESPONDENT(S)/STATE/DEFACTO COMPLAINANT:\n1. STATE OF KERALA,\nREPRESENTED BY THE PUBLIC PROSECUTOR,\nHIGH COURT OF KERALA, ERNAKULAM-682 031.\n2. DHANYAA.V., AGED 29 YEARS,\nD/O.P.KRISHNAN, VARUKKOLU VAYAL, PILIKODU P.O.,\nPILIKODU VILLAGE, HOSUDURG TALUK,\nKASARAGOD DISTRICT-671 310.\nR1 BY PUBLIC PROSECUTOR SMT.P.A.RAZIYA\nR2 BY ADV. SRILA.-AARUNKUMAR\nTHIS CRIMINAL MISC. CASE HAVING COME UP FOR ADMISSION\nON 17-04-2015, THE COURT ON THE SAME DAY PASSED THE\nFOLLOWING:\nmbr/\n\nbe ee\n3\nBE] 4 :\n2015/KER/17188\nCri.MIC.No. 6587 of 2014\nAPPENDIX\nPETITIONER(S)' ANNEXURES:\nANNEXURE-A1. ATRUE COPY OF THE FIR IN CRIME NO.737/2012 OF\nCHANDERA POLICE STATION.\nANNEXURE-A II. ATRUE COPY OF THE FINAL REPORT.\nANNEXURE-AIII. ATRUE COPY OF THE AFFIDAVIT SWORN BY THE\n2ND RESPONDENT ENDORSING THE FACTUM OF\nSETTLEMENT.\nANNEXURE-AIV. A TRUE COPY OF THE AFFIDAVIT.\nRESPONDENT(S)â€™ ANNEXURES: - NIL\n{TRUE COPY/\nP.S. TO JUDGE\nmbr/\n\noe\n2015/KER/17188\nK.SURENDRA MOHAN, J.\nDated this the 17 day of April, 2015\nORDER\n\nThe petitioners, accused in Crime No.737/2012 of Chandera\nPolice Station, Kasaragode District, pending as C.C.No.1707/2014\nof the Judicial First Class Magistrate-l, Hosdurg, have filed this\npetition under Section 482 of the Code of Criminal Procedure, to\nquash all further proceedings in the matter. According to the\npetitioners, the defacto complainant is the wife of the 1*\npetitioner. The case had originated out of matrimonial disputes\nthat were pending between the 1* petitioner and the defacto\ncomplainant. According to the petitioners, they are innocent of all\nthe charges levelled against them. They have settled the\ndisputes among themselves and seek the issue of appropriate\norders quashing the criminal proceedings, since the matter has\nbeen settled.\n\n2. Pursuant to the directions issued by this Court, affidavits\nhave been filed by the 1* petitioner as well as the defacto\ncomplainant stating that, their disputes have already been settled\nand that, they are living separately. The learned Public\nProsecutor also reports that, there is no objection in quashing the\ncriminal proceedings.\n\nmaa\n2015/KER/17188\n\nCrl.M.C.No0.6587 of 2014\n\n2\n\nIn view of the above, this petition is allowed. All further\nproceedings in Crime No.737/2012 of Chandera Police Station,\nKasaragode District now pending as C.C.No.1707/2014 of the\nJudicial First Class Magistrate-], Hosdurg are quashed.\nSd/-\n\nK.SURENDRA MOHAN, JUDGE.\n\nAV\n\n"
}