{
    "case_id": "Crl.MC.No.142 OF 2020(G)",
    "court": "HIGH COURT OF KERALA AT ERNAKULAM",
    "date": "2020",
    "judge": "Drie 2\nSve",
    "petitioners": [
        "S:",
        "BILE Tal",
        "AGED 49 YEARS",
        "1 SYAMALA",
        "W/O.JAGATHAMMA, MAHARAJAS GARDEN, KADAPPATHALA NAGAR,",
        "xa",
        "D/O.SYAMALA, MAHARAJAS GARDEN, KADAPPATHALA NAGAR,",
        "AGED 25 YEARS",
        "KADAPPATHALA NAGAR",
        "2 SALINI,",
        "PEROORKARA, THIRUVANANTHAPURAM."
    ],
    "respondents": [
        "S:",
        "KERALA, ERNAKULAM, PIN-682031.",
        "2 THE SUB INSPECTOR OF POLICE,",
        "THE PUBLIC PROSECUTOR, PIN-695301.",
        "MALAYINKIL POLICK STATION, TRIVANDRUM, REPRESENTED BY",
        "OTHER PRESENT:",
        "1 STATE OF KERALA,",
        "REPRESENTED BY THE PUBLIC PROSECUTOR, HIGH COURT OF"
    ],
    "sections": [
        "511 of\n306 r/w Section 34 of IPC"
    ],
    "outcome": "With these observations, the Crl.M.C is disposed",
    "full_text": "Drie 2\nSve\nata the\nBaer\nIN THE HIGH COURT OF KERALA AT ERNAKULAM 2020/KER/942\nPRESENT\nTHE HONOURABLE MR. JUSTICE ASHOK MENON\nTHURSDAY, THE 09TH DAY OF JANUARY 2020 / 19TH POUSHA, 1941\nCr1.MC.No.142 OF 2020(G)\nAGAINST THE ORDER/JUDGMENT IN CP 56/2018 OF JUDICIAL MAGISTRATE OF\nFIRST CLASS ,KATTAKADA\nCRIME NO.1168/2017 OF Malayinkeezh Police Station ,\nThiruvananthapuram\nPETITIONER/S:\n1 SYAMALA\nAGED 49 YEARS\nW/O.JAGATHAMMA, MAHARAJAS GARDEN, KADAPPATHALA NAGAR,\nPEROORKARA, THIRUVANANTHAPURAM.\n2 SALINI,\nAGED 25 YEARS\nD/O.SYAMALA, MAHARAJAS GARDEN, KADAPPATHALA NAGAR,\nPEROORKARA, THIRUVANANTHAPURAM.\nBY ADV. SRI.M.R.SARIN\nRESPONDENT/S:\n1 STATE OF KERALA,\nREPRESENTED BY THE PUBLIC PROSECUTOR, HIGH COURT OF\nKERALA, ERNAKULAM, PIN-682031.\n2 THE SUB INSPECTOR OF POLICE,\nMALAYINKIL POLICK STATION, TRIVANDRUM, REPRESENTED BY\nTHE PUBLIC PROSECUTOR, PIN-695301.\nOTHER PRESENT:\nSRI.B.JAYASURYA SR PP\nTHIS CRIMINAL MISC. CASE HAVING COME UP FOR ADMISSION ON\n09.01.2020, THE COURT ON THE SAME DAY PASSED THE FOLLOWING:\n\nBp ts ial\nCrl.MC.No.142 OF 2020(G) 2 2020/KERI942\nORDER\nDated this the 9th day of January 2020\n\nPetitioners are accused in C.P.No.56/2018 on the files of\nthe Judicial First Class Magistrate Court, Kattakada for having\nallegedly committed offences punishable under Sections 511 of\n306 r/w Section 34 of IPC.\n\n2. Petitioners could not appear on time as a result of\nwhich non bailable warrant was issued against them.\nPetitioners are willing to surrender but apprehends that they\nmay be incarcerated. Petitioners are willing to co-operate with\nthe trial.\n\nHence petitioners are directed to surrender before the\nJudicial First Class Magistrate Court, Kattakada within a period\nof two weeks and apply for bail. The bail petition shall be\nconsidered and orders passed preferably on the very same\ndate.\n\nWith these observations, the Crl.M.C is disposed of.\n\nSD/-\nASHOK MENON\nJUDGE\nrmm\n\nBILE Tal\nee\n= ence xa\neee\nnee:\nCrl.MC.No.142 OF 2020(G) 3 2020/KERI942\nAPPENDIX\nPETITIONER'S/S EXHIBITS:\nANNEXURE Al THE TRUE COPY OF FINAL REPORT IN CP\nNO.56/18 ON THE FILE OF JUDICIAL FIRST\nCLASS MAGISTRATE COURT, KATTAKADA.\n\n"
}