{
    "case_id": "Crl.MC.No. 83 of 2015",
    "court": "HIGH COURT OF KERALA AT ERNAKULAM\nPRESENT",
    "date": "THE 8TH DAY",
    "judge": "B.KEMAL PASHA",
    "petitioners": [
        "K.M. HARIS",
        "MC.No",
        "ITTAMMAL, BALLA VILLAGE,",
        "S/O.MOIDU HAJEE, K.H.HOUSE,",
        "J.\nCril",
        "K.M. HARIS, AGED 28 YEARS,",
        "B. KEMAL PASHA",
        "ACCUSED:",
        "HOSDURG TALUK, KASARAGOD DISTRICT."
    ],
    "respondents": [
        "1. THE STATE OF KERALA,",
        "HOSDURG TALUK, KASARAGODE DISTRICT, PIN - 671 001.",
        "2. M.FAHAD, AGED 26 YEARS, S/O.HAMEED,",
        "STATE, DEFACTO-COMPLAINANT & INJURED:",
        "RESIDING AT FATHIMATH RAYILA QUARTERS,",
        "VADAKARA MUKJKU, BALLA VILLAGE,",
        "R1 BY PUBLIC PROSECUTOR SRI.JIBU P. THOMAS",
        "R2 BY ADV. SRI.V.VINAY MENON",
        "RESIDING AT FASIL MANZIL, VADAKARA MUKKU,",
        "BALLA VILLAGE, HOSDURG TALUK,",
        "REPRESENTED BY PUBLIC PROSECUTOR,",
        "HIGH COURT OF KERALA, ERNAKULAM, PIN - 682 031.",
        "KASARAGODE DISTRICT, PIN - 671 001.",
        "3. P.AYISHA, AGED 28 YEARS, W/O.MUSTAFA,"
    ],
    "sections": [],
    "outcome": "permission to withdraw the Crl.M.C. Permission is granted",
    "full_text": "aa\nA Pi mits â€˜\nBlea\n2015/KER/782\nIN THE HIGH COURT OF KERALA AT ERNAKULAM\nPRESENT:\nTHE HONOURABLE MR. JUSTICE B.KEMAL PASHA\nTHURSDAY, THE 8TH DAY OF JANUARY 2015/18TH POUSHA, 1936\nCrl.MC.No. 83 of 2015\nSC 638/2014 OF ADDITIONAL DISTRICT & SESSIONS COURT - III], KASARAGOD WHICH\nCASE WAS ORIGINALLY NUMBERED AS SC 68/2014 OF ADDITIONAL DISTRICT &\nSESSIONS COURT - Ill, KASARAGOD.\nPETITIONER(S)/ACCUSED:\nK.M. HARIS, AGED 28 YEARS,\nS/O.MOIDU HAJEE, K.H.HOUSE,\nITTAMMAL, BALLA VILLAGE,\nHOSDURG TALUK, KASARAGOD DISTRICT.\nBY ADV. SRILJAWAHAR JOSE\nRESPONDENT(S)/STATE, DEFACTO-COMPLAINANT & INJURED:\n1. THE STATE OF KERALA,\nREPRESENTED BY PUBLIC PROSECUTOR,\nHIGH COURT OF KERALA, ERNAKULAM, PIN - 682 031.\n2. M.FAHAD, AGED 26 YEARS, S/O.HAMEED,\nRESIDING AT FASIL MANZIL, VADAKARA MUKKU,\nBALLA VILLAGE, HOSDURG TALUK,\nKASARAGODE DISTRICT, PIN - 671 001.\n3. P.AYISHA, AGED 28 YEARS, W/O.MUSTAFA,\nRESIDING AT FATHIMATH RAYILA QUARTERS,\nVADAKARA MUKJKU, BALLA VILLAGE,\nHOSDURG TALUK, KASARAGODE DISTRICT, PIN - 671 001.\nR1 BY PUBLIC PROSECUTOR SRI.JIBU P. THOMAS\nR2 BY ADV. SRI.V.VINAY MENON\nTHIS CRIMINAL MISC. CASE HAVING COME UP FOR ADMISSION ON\n08-01-2015, THE COURT ON THE SAME DAY PASSED THE FOLLOWING:\nmsv/\n\nEen\nape\n2015/KER/782\nB. KEMAL PASHA, J.\nCril.M.C. No.83 of 2015\nDated this the 8\" day of January, 2015\nORDER\nLearned counsel for the petitioner seeks\npermission to withdraw the Crl.M.C. Permission is granted.\nAccordingly, this Crl.M.C. is dismissed as withdrawn, with\nliberty to move other Crl.M.C., if so advised, at appropriate\nstage.\nThe documents produced by the petitioner are ordered\nto be returned to the petitioner.\nSd/-\n(B.KEMAL PASHA, JUDGE)\naks/08/01\n1! True Copy //\nPA to Judge\n\n"
}