{
    "case_id": "Crl.MC.No. 8978 of 2017",
    "court": "HIGH COURT OF KERALA AT ERNAKULAM",
    "date": "2018",
    "judge": "B.KEMAL PASHA",
    "petitioners": [
        "1  KRIPESH.K,",
        "AGED 24 YEARS, S/O.KUNHIKRISHNAN,",
        "MC.No",
        "Crl",
        "AGED 24 YEARS, S/O.MUHAMMED,",
        "PROSECUTOR SRI.B.JAYASURYA\nR2",
        "(S) /ACCUSED_:",
        "J.\nDated",
        "Drea",
        "R/AT PAZHAYA KADAPPURAM, KANHANGAD VILLAGE,",
        "R/AT VANIYAM VEEDU, ERIYA, HOSDURG TALUK.",
        "2 ASKER ALI,",
        "rari\nRade",
        "HOSDURG TALUK."
    ],
    "respondents": [
        "3. RISHAD M.A,",
        "HIGH COURT OF KERALA, ERNAKULAM.682 031.",
        "2. RIYAS M.A,",
        "AGED 22 YEARS, S/O.ASEEZ,",
        "4. RASHID M.A,",
        "AVIYIL HOUSE, KANHANGAD VILLAGE, HOSDURG TALUK- 671 315.",
        "(S) /STATE/COMPLAINANT :",
        "AGED 20 YEARS, S/O.ASEEZ,",
        "R1 BY SR.PUBLIC PROSECUTOR SRI.B.JAYASURYA",
        "1. STATE OF KERALA,",
        "AVIYIL HOUSE, KANHANGAD VILLAGE, HOSDURG TALUK.671 315.",
        "R2 TO R4 BY ADV. SRI.A.ARUNKUMAR",
        "AGED 19 YEARS, S/O.ASEEZ,",
        "REPRESENTED BY PUBLIC PROSECUTOR,"
    ],
    "sections": [
        "323",
        "341",
        "324 read with Section 34 IPC"
    ],
    "outcome": "be quashed",
    "full_text": "fede\naoe\nIN THE HIGH COURT OF KERALA AT ERNAKULAM 2018/KER/743\nPRESENT:\nTHE HONOURABLE MR. JUSTICE B.KEMAL PASHA\nMONDAY, THE 8TH DAY OF JANUARY 2018 / 18TH POUSHA, 1939\nCrl.MC.No. 8978 of 2017\nC.C.NO. 1990/2017 OF JUDICIAL FIRST CLASS MAGISTRATE COURT-I,HOSDURG\nCRIME NO. 408/2017 OF AMBALATHARA POLICE STATION\nPETITIONER (S) /ACCUSED_:\n1  KRIPESH.K,\nAGED 24 YEARS, S/O.KUNHIKRISHNAN,\nR/AT VANIYAM VEEDU, ERIYA, HOSDURG TALUK.\n2 ASKER ALI,\nAGED 24 YEARS, S/O.MUHAMMED,\nR/AT PAZHAYA KADAPPURAM, KANHANGAD VILLAGE,\nHOSDURG TALUK.\nBY ADV.SRI.P.K.SUBHASH\nRESPONDENT (S) /STATE/COMPLAINANT :\n1. STATE OF KERALA,\nREPRESENTED BY PUBLIC PROSECUTOR,\nHIGH COURT OF KERALA, ERNAKULAM.682 031.\n2. RIYAS M.A,\nAGED 22 YEARS, S/O.ASEEZ,\nAVIYIL HOUSE, KANHANGAD VILLAGE, HOSDURG TALUK- 671 315.\n3. RISHAD M.A,\nAGED 19 YEARS, S/O.ASEEZ,\nAVIYIL HOUSE, KANHANGAD VILLAGE, HOSDURG TALUK- 671 315.\n4. RASHID M.A,\nAGED 20 YEARS, S/O.ASEEZ,\nAVIYIL HOUSE, KANHANGAD VILLAGE, HOSDURG TALUK.671 315.\nR1 BY SR.PUBLIC PROSECUTOR SRI.B.JAYASURYA\nR2 TO R4 BY ADV. SRI.A.ARUNKUMAR\nTHIS CRIMINAL MISC. CASE HAVING COME UP FOR ADMISSION\nON 08-01-2018, THE COURT ON THE SAME DAY PASSED\nTHE FOLLOWING:\nMsd.\n\nDrea\nrari\nRade deals\naoe\nCrl.MC.No. 8978 of 2017 2018/KER/743\nAPPENDIX\nPETITIONER(S)' ANNEXURES :\nANNEXURE AIL A TRUE COPY OF THE F.I.R IN CRIME NO.408 OF 2017 OF\nAMBALATHARA POLICE STATION.\nANNEXURE AIT A TRUE COPY OF THE FINAL REPORT IN\nCRIME NO.408 OF 2017 OF AMBALATHARA POLICE STATION.\nANNEXURE AIII A TRUE COPY OF THE AFFIDAVIT SWORN TO BY\nTHE 2ND RESPONDENT.\nANNEXURE AIV A TRUE COPY OF THE AFFIDAVIT SWORN TO BY\nTHE 3RD RESPONDENT.\nANNEXURE AV A TRUE COPY OF THE AFFIDAVIT SWORN TO BY\nTHE 4TH RESPONDENT.\nRESPONDENT (S) ' ANNEXURES :\nNIL\n//TRUE COPY//\nP.S.TO JUDGE\nMsd.\n\n2018/KER/743\nB. KEMAL PASHA, J.\nDated this the 8\" day of January, 2018\nORDER\n\nPetitioners are the accused in CC No.1990/2017\nof the Judicial First Class Magistrate's Court-l, Hosdurg,\nwhich has arisen from Crime No.408/2017 of Ambalathara\nPolice Station for the offences punishable under Sections\n341, 323 and 324 read with Section 34 IPC.\n\n2. It seems that the matter has been amicably\nsettled between the petitioners and the de_ facto\ncomplainant, who is the 2â„¢ respondent herein.\nRespondents 3 and 4 are the other injured.\n\n3. Respondents 2 to 4 have filed Annexures-Alll,\nAlV and AV affidavits respectively, affirming that the matter\nhas been amicably settled between them and the petitioners\nand presently, they have no complaints against the\npetitioners. When the matter is settled between the\n\n2018/KER/743\n\nCrl.M.C.8978/2017 5.\n\nparties, no purpose would be served in proceeding with the\nmatter further. Matters being so, all further proceedings\nagainst the petitioners in CC No.1990/2017 of the Judicial\n\nFirst Class Magistrate's Court-l, Hosdurg, which has arisen\n\nfrom Crime No.408/2017 of Ambalathara Police Station, can\n\nbe quashed.\n\nIn the result, this Crl.M.C. is allowed and all further\nproceedings against the petitioners in CC No.1990/2017 of\nthe Judicial First Class Magistrate's Court-l, Hosdurg, which\nhas arisen from Crime No.408/2017 of Ambalathara Police\nStation, are quashed.\n\nSd/-\n(B.KEMAL PASHA, JUDGE)\naks/08/01\n// True Copy //\nPS to Judge\n\n"
}