{
    "case_id": "",
    "court": "HIGH COURT OF KERALA AT ERNAKULAM\nPRESENT\nTHE HONOURABLE MR",
    "date": "2019",
    "judge": "K.ABRAHAM MATHEW",
    "petitioners": [
        "CHARIPPAN VILAYIL THALIRADY MURI",
        "VALLIKUNNAM VILLAGE.",
        "Kayamkulam",
        "S/O ABDUL KALAM, CHARIPPAN VILAYIL THALIRADY MURI,",
        "2 HARRIS ,AGED 29 YEARS",
        "S :",
        "VALLIKUNNAM.",
        "Sd/-\nK.ABRAHAM MATHEW",
        "1 NAUFAL,AGED 31 YEARS",
        "S/O ABDHUL SALAM, NAUFAL MANSIL, THALAIRADIMURI,"
    ],
    "respondents": [
        "REP. BY THE PUBLIC PROSECUTOR, HIGH COURT OF KERALA,",
        "SATE OF KERALA,",
        "ERNAKULAM- 682031."
    ],
    "sections": [
        "482",
        "323",
        "143",
        "147",
        "324",
        "326 r/w Section 149 IPC",
        "148"
    ],
    "outcome": "are sought to be quashed",
    "full_text": "ape\nBere\n2019/KER/1019\nIN THE HIGH COURT OF KERALA AT ERNAKULAM\nPRESENT\nTHE HONOURABLE MR. JUSTICE K.ABRAHAM MATHEW\nWEDNESDAY ,THE O9TH DAY OF JANUARY 2019 / 19TH POUSHA, 1940\nCr1.MC.No. 140 of 2019\nAGAINST THE ORDER IN CC 436/2017 of J.M.F.C., KAYAMKULAM\nCRIME NO. 269/2007 OF Vallikunnam Police Station , Alappuzha\nPETITIONERS :\n1 NAUFAL,AGED 31 YEARS\nS/O ABDHUL SALAM, NAUFAL MANSIL, THALAIRADIMURI,\nVALLIKUNNAM VILLAGE.\n2 HARRIS ,AGED 29 YEARS\nS/O ABDUL KALAM, CHARIPPAN VILAYIL THALIRADY MURI,\nVALLIKUNNAM.\nBY ADVS.\nSRI.R.SUNIL KUMAR\nSMT.A.SALINI LAL\nRESPONDENT:\nSATE OF KERALA,\nREP. BY THE PUBLIC PROSECUTOR, HIGH COURT OF KERALA,\nERNAKULAM- 682031.\nSRI.C.S HRITHWIK SR PP\nTHIS CRIMINAL MISC. CASE HAVING COME UP FOR ADMISSION ON\n09.01.2019, THE COURT ON THE SAME DAY PASSED THE FOLLOWING:\n\n2019/KER/1019\nCr1.MC.No. 140 of 2019 2\nORDER\n\nPetition filed under Section 482 Cr.P.C.\n\n2. Petitioners were accused 1 and 4 in\nC.C.No.189 of 2011 on the file of the Judicial First\nClass Magistrate Court, Kayamkulam. The accused\nallegedly committed the offences under Sections 143,\n147, 148, 323, 324 and 326 r/w Section 149 IPC. As\nthe petitioners were absconding, only the others were\ntried. They were acquitted by Annexure-II judgment.\nThe petitioners have surrendered and their case is\nnow pending as C.C.No.436 of 2017. The proceedings\nare sought to be quashed in the light of the\nacquittal of the co-accused.\n\n3. Heard the learned counsel for the petitioners\nand the learned Public Prosecutor.\n\n4. I have perused Annexure-2 judgment by which\nthe co-accused were acquitted. T am satisfied that\nthe trial of the petitioners will not serve any\n\n2019/KER/1019\nCr1.MC.No. 140 of 2019 3\npurpose.\n\nIn the result, this Crl.M.C is allowed. The\nproceedings in C.C.No.436 of 2017 on the file of the\nJudicial First Class Magistrate Court, Kayamkulam are\nquashed.\n\nSd/-\nK.ABRAHAM MATHEW\nJUDGE\npm\n\ner oe a\nEe\n2019/KER/1019\nCrl1.MC.No. 140 of 2019 4\nAPPENDIX\n\nPETITIONERS' EXHIBITS:\n\nANNEXURE 1 COPY OF THE FINAL REPORT\n\nANNEXURE 2 COPY OF THE JUDGMENT IN C.C.716/2008\n\nRESPONDENT'S EXHIBITS: NIL\n\n// TRUE COPY // PA TO JUDGE\n\n"
}