{
    "case_id": "",
    "court": "HIGH COURT OF KERALA AT ERNAKULAM\nPRESENT",
    "date": "2014",
    "judge": "Kasaragod.\n\nHARUN-UL-RASHID",
    "petitioners": [
        "2. VENKTRAMANA BHAT, AGED 68 YEARS",
        "SRI.ANEESH JOSEPH\nRESPONDENTS/COMPLAINANT",
        "Resp Be\nBlears",
        "KONDOLU MOOLE, HAUDODI, POST-MELANTHABETTU-574214",
        "S /ACCUSED:",
        "D.K.DISTRICT, KARNATAKA.",
        "S/O.VENKTRAMANA BHAT, RESIDING AT BENAKA NILAYA",
        "W/O. VENKTRAMANA BHAT, RESIDING AT BENAKA NILAYA",
        "KOCHI-31",
        "RESIDING AT BENAKA NILAYA, KONDOLU MOOLE, HAUDODI",
        "MC.No",
        "Petsise Be",
        "1. K.GURUVAYURAPPA, AGED 32 YEARS",
        "S/O. LATE GOPALAKRISHNA BHAT",
        "POST-MELANTHABETTU-574214, BELTHANGADI TALUK",
        "DPS Tal\nFi",
        "J.\nCrl",
        "3. VENKATESHWARI, AGED 61 YEARS",
        "BELTHANGADI TALUK, D.K.DISTRICT, KARNATAKA."
    ],
    "respondents": [
        "RESIDING AT BANPUTHADKA HOUSE, POST-UKKINADKA",
        "REPRESENTED BY THE PUBLIC PROSECUTOR",
        "HIGH COURT OF KERALA, KOCHI-31.",
        "BADTADKA VILLAGE, KASARAGOD TALUK AND DISTRICT.",
        "D/O. RAMACHANDRA BHAT, W/O. K.GURUVAYURAPPA",
        "1. SREELEELA, AGED 27 YEARS",
        "S/COMPLAINANT AND STATE:",
        "R1 BY ADV. SMT.DENNIS VARGHESE",
        "2. STATE OF KERALA",
        "R BY PUBLIC PROSECUTOR SMT. SAREENA GEORGE"
    ],
    "sections": [
        "498"
    ],
    "outcome": "Crl.M.C is disposed",
    "full_text": "DPS Tal\nFi rena\nPetsise Be\nre\nares\n2014/KER/224\nIN THE HIGH COURT OF KERALA AT ERNAKULAM\nPRESENT:\nTHE HONOURABLE MR.JUSTICE HARUN-UL-RASHID\nTHURSDAY, THE 2ND DAY OF JANUARY 2014/12TH POUSHA, 1935\nCr1.MC.No. 43 of 2014 ()\n(CMP 7810/2013 OF JUDICIAL FIRST CLASS MAGISTRATE COURT-1, KASARAGOD\nCRIME NO.730/2013 OF BADIADUKKA POLICE STATION, KASARGOD)\nPETITIONERS /ACCUSED:\n1. K.GURUVAYURAPPA, AGED 32 YEARS\nS/O.VENKTRAMANA BHAT, RESIDING AT BENAKA NILAYA\nKONDOLU MOOLE, HAUDODI, POST-MELANTHABETTU-574214\nBELTHANGADI TALUK, D.K.DISTRICT, KARNATAKA.\n2. VENKTRAMANA BHAT, AGED 68 YEARS\nS/O. LATE GOPALAKRISHNA BHAT\nRESIDING AT BENAKA NILAYA, KONDOLU MOOLE, HAUDODI\nPOST-MELANTHABETTU-574214, BELTHANGADI TALUK\nD.K.DISTRICT, KARNATAKA.\n3. VENKATESHWARI, AGED 61 YEARS\nW/O. VENKTRAMANA BHAT, RESIDING AT BENAKA NILAYA\nKONDOLU MOOLE, HAUDODI, POST-MELANTHABETTU-574214\nBELTHANGADI TALUK, D.K.DISTRICT, KARNATAKA.\nBY ADVS.SRI.M.RAMESH CHANDER (SR.)\nSRI.ANEESH JOSEPH\nRESPONDENTS/COMPLAINANT AND STATE:\n1. SREELEELA, AGED 27 YEARS\nD/O. RAMACHANDRA BHAT, W/O. K.GURUVAYURAPPA\nRESIDING AT BANPUTHADKA HOUSE, POST-UKKINADKA\nBADTADKA VILLAGE, KASARAGOD TALUK AND DISTRICT.\n2. STATE OF KERALA\nREPRESENTED BY THE PUBLIC PROSECUTOR\nHIGH COURT OF KERALA, KOCHI-31.\nR1 BY ADV. SMT.DENNIS VARGHESE\nR BY PUBLIC PROSECUTOR SMT. SAREENA GEORGE\nTHIS CRIMINAL MISC. CASE HAVING COME UP FOR ADMISSION ON\n02-01-2014, THE COURT ON THE SAME DAY PASSED THE FOLLOWING:\n\nBh\nFi rena\nResp Be\nBlears\n2014/KER/224\nCr1l.MC.No. 43 of 2014 ()\nAPPENDIX\nPETITIONER(S)' EXHIBITS\nANNEXURE Al- TRUE COPY OF THE CMP 7810/2013 ON THE FILE OF THE\nJUDICIAL MAGISTRATE OF FIRST CLASS-I, KASARGOD FILED BY 18ST\nRESPONDENT DATED 17-12-2013.\nANNEXURE A2- PHOTOSTAT COPY OF THE AGREEMENT ENTERED BETWEEN THE\nPETITIONERS HEREIN AND THE FIRST RESPONDENT ON 31-12-2013.\nANNEXURE A3- THE ORIGINAL OF THE AFFIDAVIT OF THE 1ST RESPONDENT\nSTATING THAT THE MATTER HAS BEEN SETTLED BETWEEN THE PRTIES.\nRESPONDENT (S)' EXHIBITS: NIL\nTRUE COPY\nPA TO JUDGE\nSCL.\n\neee\n2014/KER/224\nHARUN-UL-RASHID, J.\nCrl.M.C No.43 of 2014\nDated this the 2\" day of January, 2014.\nORDER\n\nHeard the learned counsel for the petitioners and\nrespondents.\n\n2. Accused in Crime No.730/2013 of Badiadka Police\nStation, pending as C.M.P.No.7810 of 2013 on the file of the Judicial\nFirst Class Magistrate Court-I, Kasaragod are the petitioners. The\npetition is filed seeking to quash further proceedings against the\npetitioners in C.M.P.No.7810 of 2013 on the file of the Judicial First\nClass Magistrate Court-I, Kasaragod.\n\n3. The offence alleged is punishable under Section 498 A\nIPC.\n\n4. The learned counsel on both sides submit that the\ndisputes between the parties have been amicably settled and having\nregard to the resolution of the disputes between the parties,\ncontinuance of the criminal prosecution against the petitioners is an\navoidable irritant.\n\nIn view of the settlement arrived at between the parties, the\nCrl.M.C is disposed of quashing all further proceedings in\nC.M.P.No.7810 of 2013 on the file of the Judicial First Class\nMagistrate Court-I, Kasaragod.\n\nHARUN-UL-RASHID,\nJudge.\nscl.\n\n"
}