{
    "case_id": "Crl.MC.No. 7364 of 2017",
    "court": "HIGH COURT OF KERALA AT ERNAKULAM",
    "date": "2018",
    "judge": "PADANNA",
    "petitioners": [
        "ADVS.SRIT.MADHU",
        "1 ANAS,",
        "ACCUSED 2 TO 8:",
        "PADANNA",
        "KANTHILOT",
        "KASARAGOD"
    ],
    "respondents": [
        "STATE:"
    ],
    "sections": [],
    "outcome": "Accordingly, Crl.M.C is dismissed",
    "full_text": "Elz fave aH\nIN THE HIGH COURT OF KERALA AT ERNAKULAM 2018/KER/496\nPRESENT:\nTHE HONOURABLE MR. JUSTICE SUNIL THOMAS\nFRIDAY, THE 5TH DAY OF JANUARY 2018 / 15TH POUSHA, 1939\nCrl.MC.No. 7364 of 2017\nAGAINST THE ORDER/JUDGMENT IN SC 536/2016 of D.C. & SESSIONS & MACT,KASARAGOD\nCRIME NO. 571/2012 OF CHANDERA POLICE STATION , KASARGOD\n\nPETITIONER(S)/ACCUSED 2 TO 8:\n1 ANAS,\n\nS/0.ABOOBACKER ABDULLA, AGED 25 YEARS, RESIDING AT DARUL\n\nHAND, KODENTHAR, PADANNA VILLAGE, HOSDURG TALUK,\n\nKASARAGOD DISTRICT.\n2 NOUSHAD,\n\nS/O.HAMEED @ HERO HAMEED, AGED 35 YEARS, RESIDING AT\n\nMADAPPURAM, KODENTHAR, PADANNA VILLAGE, HOSDURG\n\nTALUK, KASARAGOD DISTRICT.\n3 SHAMSEER P.,\n\nS/0.K.M.C.MOUHAMMED, AGED 26 YEARS, RESIDING AT FATHIMA\n\nMANZIL, NEAR OLD MOSQUE, PADANNA, PADANNA VILLAGE,\n\nHOSDURG TALUK, KASARAGOD DISTRICT.\n4 L.K.VAHID,\n\nS/O.IDDIN ABBA, AGED 26 YEARS, RESIDING AT KANTHILOTTU,\n\nPADANNA, PADANNA VILLAGE, HOSDURG TALUK, KASARAGOD\n\nDISTRICT.\n5 L.K.BADUSHA,\n\nS/O.IDDIN ABBA, AGED 28 YEARS, RESIDING NEAR PADANNA HIGH\n\nSCHOOL, KANTHILOTTU, PADANNA, PADANNA VILLAGE, HOSDURG\n\nTALUK, KASARAGOD DISTRICT.\n6 THAJUDHEEN,\n\nS/0.A.K.KHALID, AGED 27 YEARS, RESIDING NEAR PADANNA HIGH\n\nSCHOOL, KANTHILOT, PADANNA, PADANNA VILLAGE, HOSDURG\n\nTALUK, KASARAGOD DISTRICT.\n7 T.K.ABDULLA,\n\n8/O.JABBAR, AGED 27 YEARS, RESIDING AT VADAKKEPURAM,\n\nPADANNA, PADANNA VILLAGE, HOSDURG TALUK, KASARAGOD\n\nDISTRICT.\n\nBY ADVS.SRIT.MADHU\n\nSMT.C.R.SARADAMANI\n\nElz fave aH\n2018/KER/496\n\nRESPONDENT(S)/STATE:\n\n1. THE STATE OF KERALA THROUGH THE STATION HOUSE OFFICER,\nCHANDERA POLICE STATION, KASARAGOD DISTRICT, REPRESENTED\nBY THE PUBLIC PROSECUTOR, HIGH COURT OF KERALA,\nERNAKULAM-682031.\n\n2. THE DEPUTY SUPERINTENDENT OF POLICE,\n\nSPECIAL MOBILE SQUAD, KASARAGOD, KASARAGOD DISTRICT,\nREPRESENTED BY THE PUBLIC PROSECUTOR, HIGH COURT OF\nKERALA, ERNAKULAM-682031.\n\n3. RATHEESH,\n\nAGED 34 YEARS, S/O.KUNHIRAMAN, RESIDING AT EDAKKAN HOUSE,\nKANTHILOT, PADNE VILLAGE, HOSDURG TALUK, KASARAGOD\nDISTRICT.\n\n4. DASAN,\n\nS/O0.GOVINDAN, AGED 37 YEARS, RESIDING AT KANTHILOT, PADNE\nVILLAGE, HOSDURG TALUK, KASARAGOD DISTRICT.\n\n5. PRAMOD,\n\nAGED 36 YEARS, S/O.POKKAN, RESIDING AT KANTHILOT, PADNE\nVILLAGE, HOSDURG TALUK, KASARAGOD DISTRICT.\n6. E.VALSALA,\nW/0O.KUNHIRAMAN, AGED 51 YEARS, RESIDING AT KANTHILOT,\nPADNE VILLAGE, HOSDURG TALUK, KASARAGOD DISTRICT.\n7. VELLACHI,\nAGED 68 YEARS, W/O.KUNHIRAMAN, RESIDING AT KANTHILOT,\nPADNE VILLAGE, HOSDURG TALUK, KASARAGOD DISTRICT.\nR3-7 BY ADV. SMT.G.SANGEETHA\nRBY PUBLIC PROSECUTOR:SRI C N PRABHAKARAN\nTHIS CRIMINAL MISC. CASE HAVING COME UP FOR ADMISSION ON 05-01-2018, THE COURT\nON THE SAME DAY PASSED THE FOLLOWING:\n\nBz hie 4\nCrl.MC.No. 7364 of 2017 0 2018/KER/496\nAPPENDIX\n\nPETITIONER(S)' EXHIBITS:\nANNEXURE A1- THE TRUE COPY OF THE FIR IN CRIME NO.571/2012 OF CHANDERA POLICE\nSTATION.\nANNEXURE A2- THE TRUE COPY OF THE FINAL REPORT IN CRIME NO.571/2012 OF\nCHANDERA POLICE STATION.\nANNEXURE A3- THE TRUE COPY OF THE JUDGMENT DATED 13/01/2016 IN C.C.NO.951/2013 ON\nTHE FILES OF THE LEARNED JUDICIAL FIRST CLASS MAGISTRATE'S COURT-I,\nHOSDURG.\nANNEXURE A4- THE AFFIDAVIT DATED 24/09/2017 SWORN IN BY THE 3RD RESPONDENT.\nANNEXURE A5- THE AFFIDAVIT DATED 24/09/2017 SWORN IN BY THE 4TH RESPONDENT.\nANNEXURE A6- THE AFFIDAVIT DATED 24/09/2017 SWORN IN BY THE 5TH RESPONDENT.\nANNEXURE A7- THE AFFIDAVIT DATED 24/09/2017 SWORN IN BY THE 6TH RESPONDENT.\nANNEXURE A8- THE AFFIDAVIT DATED 24/09/2017 SWORN IN BY THE 7TH RESPONDENT.\nANNEXURE A9- THE TRUE COPY OF THE MEMO OF EVIDENCE IN CRIME NO.571/2012 OF\nCHANDERA POLICE STATION.\nANNEXURE A10- THE TRUE COPY OF THE PROCEEDINGS DATED 26/12/2015 OF THE\nADDITIONAL CHIEF SECRETARY TO GOVERNMENT (HOME AND VIGILANCE),\nGOVERNMENT OF KERALA.\nANNEXURE A11- THE TRUE COPY OF THE ORDER DATED 30/03/2017 IN  CRL.M.C.NO.1820/2016\nOF THIS HONOURABLE COURT.\nRESPONDENTS EXHIBITS:NIL\n\nTrue Copy /P A to Judge\n\n2018/KER/496\nSUNIL THOMAS, J.\nCrL.M.C.No.7364 of 2017\nDated this the 5\" day of January, 2018\nORDER\nWhen the matter was taken up and after hearing for\nsome time, learned counsel for the petitioners sought permission to\nwithdraw the Crl.M.C with liberty to move at the appropriate stage.\n2. Permitted.\nAccordingly, Crl.M.C is dismissed as withdrawn.\nSd/-\nSUNIL THOMAS\nJudge\nSbna/5/1/18\nTrue Copy / P A to Judge\n\n"
}