{
    "case_id": "Crl.MC.No.9283 OF 2019 (A)",
    "court": "HIGH COURT OF KERALA AT ERNAKULAM\nPRESENT\nTHE HONOURABLE MR",
    "date": "2020",
    "judge": "P.B.SURESH KUMAR",
    "petitioners": [
        "V.K.",
        "AGED 19 YEARS, S/O. SURESH, KAKKODE HOUSE,",
        "AGED 46 YEARS, S/O. MANI, KAKKODE HOUSE,",
        "P.B.SURESH KUMAR",
        "HASSAN",
        "S/ACCUSED 1 «& 2:",
        "1 SURESH,",
        "Alathur",
        "PALAKKAD DISTRICT 678 543.",
        "2 VISHNU K.S,",
        "ELAVAMPADAM, KIZHAKKENCHERRY, ALATHUR,"
    ],
    "respondents": [
        "2 THE SUB INSPECTOR OF POLICE,",
        "VADAKKENCHERRY POLICE STATION,",
        "PALAKKAD DISTRICT 678 683.",
        "1 STATE OF KERALA",
        "KERALA, ERNAKULAM, KOCHI 682 031",
        "S /COMPLAINANTS :",
        "REPRESENTED BY THE PROSECUTOR, HIGH COURT OF"
    ],
    "sections": [
        "482",
        "323 read with Section 34 of the Indian Penal Code",
        "447",
        "323 read with\nSection 34 of the Indian Penal Code",
        "294(b)"
    ],
    "outcome": "In the result, the Crl.M.C. is allowed",
    "full_text": "EI ‘ iw\n2020/KER/891\nIN THE HIGH COURT OF KERALA AT ERNAKULAM\nPRESENT\nTHE HONOURABLE MR. JUSTICE P.B.SURESH KUMAR\nWEDNESDAY, THE O8TH DAY OF JANUARY 2020 / 18TH POUSHA,\n1941\nCrl.MC.No.9283 OF 2019 (A)\nAGAINST THE ORDER IN ST 2268/2018 OF JUDICIAL MAGISTRATE\nOF FIRST CLASS, ALATHUR\nCRIME NO.1637/2017 OF VADAKKANCHERRY POLICE STATION,\nPALAKKAD\nPETITIONERS/ACCUSED 1 «& 2:\n1 SURESH,\nAGED 46 YEARS, S/O. MANI, KAKKODE HOUSE,\nELAVAMPADAM, KIZHAKKENCHERRY, ALATHUR,\nPALAKKAD DISTRICT 678 543.\n2 VISHNU K.S,\nAGED 19 YEARS, S/O. SURESH, KAKKODE HOUSE,\nELAVAMPADAM, KIZHAKKENCHERRY, ALATHUR,\nPALAKKAD DISTRICT 678 543.\nBY ADVS.\nSRI.SAIJO HASSAN\nSRI.BENOJ C AUGUSTIN\nSRI.RAFEEK. V.K.\nSRI.U.M.HASSAN\nSMT. P. PARVATHY\nSMT.SURYA P SHAJI\nRESPONDENTS /COMPLAINANTS :\n1 STATE OF KERALA\nREPRESENTED BY THE PROSECUTOR, HIGH COURT OF\nKERALA, ERNAKULAM, KOCHI 682 031\n2 THE SUB INSPECTOR OF POLICE,\nVADAKKENCHERRY POLICE STATION,\nPALAKKAD DISTRICT 678 683.\n\nEI ‘ iw\n2020/KER/891\nCrl.M.C. No.9283 of 2019 2\n3 SUNDARI,\nAGED 51 YEARS, D/O. KOYU, KAKKODE HOUSE,\nELAVAMPADAM, KIZHAKKENCHERRY, ALATHUR,\nPALAKKAD DISTRICT 678 543.\n4 BHAVADASAN @ MURUKAN,\nAGED 56 YEARS, S/O. KOYU, KAKKODE HOUSE,\nELAVAMPADAM, KIZHAKKENCHERRY, ALATHUR,\nPALAKKAD DISTRICT 678 543.\n5 ANJALI,\nAGED 32 YEARS, W/O. BHAVADASAN, KAKKODE HOUSE,\nELAVAMPADAM, KIZHAKKENCHERRY, ALATHUR,\nPALAKKAD DISTRICT 678 543.\nR3-5 BY ADV. SMT.S.LEKHA\nSRI.T.R.RENJITH PP\nTHIS CRIMINAL MISC. CASE HAVING COME UP FOR ADMISSION\nON 08.01.2020, THE COURT ON THE SAME DAY PASSED THE\nFOLLOWING:\n\nEge el\naa\n2020/KER/891\nCrl.M.C. No.9283 of 2019 3\nCri.M.C.No.9283 of 2019\nORDER\n\nThis is a proceedings instituted under Section 482 of\nthe Code of Criminal Procedure for quashing Annexure - 2 final\nreport and all further proceedings pursuant thereto now\npending as ST No.2268 of 2018 on the files of the Court of the\nJudicial Magistrate of First Class, Alathur.\n\n2. The petitioners are accused Nos.1 and 2 in the\nsaid case. The case was one instituted at the instance of the\nthird respondent under Sections 294(b), 447 and 323 read with\nSection 34 of the Indian Penal Code.\n\n3. Respondents 3 to 5 are the victims of the\naforesaid crime. It is seen that respondents 3 to 5 had settled\ntheir disputes with the petitioners and affidavits to that effect\nhave been produced as Annexures 3 to 5.\n\n4. Heard the learned counsel for the petitioners,\nthe learned Public Prosecutor as also the learned counsel for\nrespondents 3 to 5.\n\n2020/KER/891\n\nCrl.M.C. No.9283 of 2019 4\n\n5. In the light of the decisions of the Apex\nCourt in Gian singh v. State of Punjab, (2012) 10 SCC 303,\ninsofar as the offences alleged against the accused in the case\nare only offences punishable under Sections 294(b), 447 and\n323 read with Section 34 of the Indian Penal Code, | am of the\nview that this is an appropriate case where this court has to\ninvoke the jurisdiction under Section 482 of the Code of\nCriminal Procedure to quash the proceedings against the\npetitioners.\n\nIn the result, the Crl.M.C. is allowed and Annexure-2\nfinal report and all further proceedings pursuant thereto against\nthe petitioners pending as ST No.2268 of 2018 on the files of\nthe Court of the Judicial Magistrate of First Class, Alathur are\nquashed.\n\nSd/-\nP.B.SURESH KUMAR, JUDGE.\nYKB\n\nCi} ‘ ia\n2020/KER/891\nCril.M.C. No.9283 of 2019 5\nAPPENDIX\nPETITIONER'S/S EXHIBITS:\nANNEXURE 1 FREE COPY OF THE FIR\nANNEXURE 2 TRUE COPY OF THE FINAL REPORT.\nANNEXURE 3 TRUE COPY OF THE AFFIDAVIT FILED BY\n3RD RESPONDENT DATED 18.12.2019.\nANNEXURE 4 TRUE COPY OF THE AFFIDAVIT FILED BY\nATH RESPONDENT DATED 18.12.2019.\nANNEXURE 5 TRUE COPY OF THE AFFIDAVIT FIELD BY\n5TH RESPONDENT DATED 18.12.2019.\nRESPONDENT'S/S EXHIBITS:\nNIL\n//TRUE COPY//\nPA TO JUDGE\n\n"
}