{
    "case_id": "Crl.MC.No. 13 of 2016 ()",
    "court": "HIGH COURT OF KERALA AT ERNAKULAM\nPRESENT",
    "date": "MONDAY",
    "judge": "B.KEMAL PASHA",
    "petitioners": [
        "ANEESH KUMAR, AGED 35 YEARS,",
        "MC.No",
        "al\nB)ER Eien\n",
        "ANNEXURE A2 COPY",
        "MALIANKARA, MOOTHAKUNNAM P.O,",
        "S/O. ANANDAN, PAZHAYIDATHU VEEDU,",
        "ACCUSED:",
        "Ernakulam",
        "ERNAKULAM DISTRICT."
    ],
    "respondents": [
        "COMPLAINANT:",
        "REPRESENTED BY PUBLIC PROSECUTOR,",
        "HIGH COURT OF KERALA.",
        "STATE OF KERALA,"
    ],
    "sections": [
        "Section 7 read with\nSection 8 of Protection of Children from Sexual\nOffences Act",
        "354A(1)"
    ],
    "outcome": "Crl.M.C. is disposed",
    "full_text": "al\nB)ER Eien\n2016/KER/46\nIN THE HIGH COURT OF KERALA AT ERNAKULAM\nPRESENT:\nTHE HONOURABLE MR. JUSTICE B.KEMAL PASHA\nMONDAY, THE 4TH DAY OF JANUARY 2016/14TH POUSHA, 1937\nCrl.MC.No. 13 of 2016 ()\nSC. NO.251/2015 OF ADDITIONAL DISTRICT & SESSIONS COURT, ERNAKULAM.\nPETITIONER/ACCUSED:\nANEESH KUMAR, AGED 35 YEARS,\nS/O. ANANDAN, PAZHAYIDATHU VEEDU,\nMALIANKARA, MOOTHAKUNNAM P.O,\nERNAKULAM DISTRICT.\nBY ADV. SRILV.A.PRADEEP KUMAR.\nRESPONDENT/COMPLAINANT:\nSTATE OF KERALA,\nREPRESENTED BY PUBLIC PROSECUTOR,\nHIGH COURT OF KERALA.\nBY PUBLIC PROSECUTOR SMTP. MAYA.\nTHIS CRIMINAL MISC. CASE HAVING COME UP FOR ADMISSION\nON 04-01-2016, THE COURT ON THE SAME DAY PASSED THE\nFOLLOWING:\nrs.\n\nal\nB)ER Eien\n2016/KER/46\nCri.MC.No. 13 of 2016\nAPPENDIX\nPETITIONER'S ANNEXURES:-\nANNEXURE A1 COPY OF THE FIR NO.119/2015 ALLEGED OFFENCE UNDER\nSEC. 354(A) (1) OF IPC, 7 & 8 OF POSCO ACT ON THE FILE\nOF THE POLICE STATION, VADAKKEKKARA.\nANNEXURE A2 COPY OF THE CHARGE SC NO.251/2015 ON THE FILE OF\nTHE ADDL. SESSIONS COURT, ERNAKULAM.\nRESPONDENT'S ANNEXURES:- NIL.\nHTRUE COPY//\nP.S. TO JUDGE\nrs.\n\n2016/KER/46\nB.KEMAL PASHA, J.\nâ€œCrLM.C. No. 13 of 2016\nDated this the 4\" day of January, 2016\nORDER\n\nHeard the learned counsel for the petitioner and\nthe learned Public Prosecutor.\n\n2. Annexure-A2 final report in Sessions Case\nNo.251/2015 of the Additional Sessions Court,\nErnakulam (for the trial of cases relating to atrocities\nand sexual violence against women and children) is\nunder challenge.\n\n3. It seems that charge has been framed in the\nmatter. The offences alleged against the petitioner is\none under Section 354A(1) IPC and Section 7 read with\nSection 8 of Protection of Children from Sexual\nOffences Act.\n\n4. On hearing the learned counsel for the\n\nil\na\n2016/KER/46\nCrl.M.C. No. 13 of 2016\n= 2:\npetitioner, it has come out that the present stage is too\npremature to take a view that the charges against the\npetitioner will not lie in the matter. This Court is\nsatisfied that the matters pointed out by the learned\ncounsel for the petitioner can be taken up before the\ncourt below during trial.\n\nWith liberty to the petitioner to take up the very\nsame questions before the court below during trial, this\nCrl.M.C. is disposed of.\n\nSd/-\nB.KEMAL PASHA, JUDGE\nstu/04.01.2016\n\n"
}