{
    "case_id": "",
    "court": "HIGH COURT OF KERALA AT ERNAKULAM\nPRESENT\nTHE HONOURABLE MRS",
    "date": "2024",
    "judge": "THOMAS",
    "petitioners": [
        "Gian Singh v. State of Punjab",
        "Kozhikode",
        "Narayan",
        "RIYAS AGED 43 YEARS S/O MAMMAD, CHORIYAN CHALIL HOUSE,",
        "KURUNNAYIL HOUSE",
        "ACCUSED:",
        "AYANTKKAD, KERALA, KOZHIKODE RURAL, PIN - 673521"
    ],
    "respondents": [
        "2 THE ASSISTANT SUB INSPECTOR OF POLICE ATHOLI POLICE",
        "POST, MOODADI, KOZHIKODE RURAL, PIN - 673529",
        "SR.PP-SRI.RENJIT GEORGE",
        "ULLOOR KADAV, KUNNATHARA POST, PIN - 673620",
        "1 STATE OF KERALA REPRESENTED BY PUBLIC PROSECUTOR, HIGH",
        "S /RESPONDENT NO.1/INVESTIGATION OFFICER/DEFACTO",
        "4 SUHARA AGED 53 YEARS W/O MAJEED, OTTOL HOUSE, KATALUR",
        "COMPLAINANT/2ND WITNESS:",
        "STATION, ATHOLI (PO), ATHOLI (VIA), PIN - 673315",
        "3 JASEERA AGED 32 YEARS D/O MAJEED, KURUNNAYIL HOUSE,",
        "COURT OF KERALA, PIN - 682031"
    ],
    "sections": [
        "482",
        "323",
        "341",
        "506",
        "448",
        "294(b)"
    ],
    "outcome": "petitioner can be quashed",
    "full_text": "B53 s\nls? NT eee\n2024/KER/5245\nIN THE HIGH COURT OF KERALA AT ERNAKULAM\nPRESENT\nTHE HONOURABLE MRS. JUSTICE SOPHY THOMAS\nND\nMONDAY, THE 22 DAY OF JANUARY 2024 / 2ND MAGHA, 1945\nCRL.MC NO. 20 OF 2024\nCRIME NO.189/2022 OF Atholy Police Station, Kozhikode\nAGAINST THE ORDER/JUDGMENT CC 465/2022 OF JUDICIAL MAGISTRATE OF\nFIRST CLASS - II, PERAMBRA\nPETITIONER/ACCUSED:\nRIYAS AGED 43 YEARS S/O MAMMAD, CHORIYAN CHALIL HOUSE,\nAYANTKKAD, KERALA, KOZHIKODE RURAL, PIN - 673521\nBY ADVS. M.P.SHAMEEM AHAMED AKHTiV PHILIP MANITHOTTIYIL\nRESPONDENTS /RESPONDENT NO.1/INVESTIGATION OFFICER/DEFACTO\nCOMPLAINANT/2ND WITNESS:\n1 STATE OF KERALA REPRESENTED BY PUBLIC PROSECUTOR, HIGH\nCOURT OF KERALA, PIN - 682031\n2 THE ASSISTANT SUB INSPECTOR OF POLICE ATHOLI POLICE\nSTATION, ATHOLI (PO), ATHOLI (VIA), PIN - 673315\n3 JASEERA AGED 32 YEARS D/O MAJEED, KURUNNAYIL HOUSE,\nULLOOR KADAV, KUNNATHARA POST, PIN - 673620\n4 SUHARA AGED 53 YEARS W/O MAJEED, OTTOL HOUSE, KATALUR\nPOST, MOODADI, KOZHIKODE RURAL, PIN - 673529\nSR.PP-SRI.RENJIT GEORGE\nTHIS CRIMINAL MISC. CASE HAVING COME UP FOR ADMISSION ON\n22.01.2024, THR COURT ON THE SAMBR DAY PASSED THE FOLLOWING:\n\n2024/KER/5245\nCRL.MC NO.20 OF 2024\n2\nORDER\nDated this the 22\" day of January , 2024\n\nThis Crl.M.C., under Section 482 of Cr.P.C., is filed by\nthe sole accused in Crime No.189 of 2022 of Atholy Police\nStation, Kozhikode, registered under Sections 448, 341,\n323, 506 and 294(b) of IPC, for quashing all proceedings in\nC.C.No.465 of 2022 on the file of Judicial First Class\nMagistrate Court-II, Perambra.\n2. The prosecution allegation is that on 06.06.2022, the\naccused, in a fit of rage, against the 3rd respondent, who\nwas his ex-wife, trespassed into the house of respondents\n3 and 4, and physically assaulted and verbally abused\nthem.\n3. When the matter is taken up for consideration,\nlearned counsel for the petitioner submitted that the\nmatter stands settled between himself and respondents 3\nand 4. The defacto complainant and 4th respondent\nentered appearance through counsel, and submitted that\n\n2024/KER/5245\nCRL.MC NO.20 OF 2024\n\nthe matter stands settled. \" Annexures A3 and A4 are\naffidavits filed by them, endorsing the settlement. They\nhave no intention to proceed with the prosecution, and\nthey have no objection in quashing the proceedings in\nC.C.No.465 of 2022.\n\n4. On instructions, learned Public Prosecutor submitted\nthat the matter is settled and he produced signed\nstatement of respondents 3 and 4. In that statements\nalso, they have stated that they are not intending to\nproceed with the prosecution, and they have no objection\nin quashing the proceedings in C.C.No.465 of 2022.\n\n5. Since the matter stands settled, no purpose would be\nserved by continuing the prosecution against the petitioner.\n6. In the light of the principles laid down by the Apex\nCourt in Gian Singh v. State of Punjab and Another;\n[(2012) 10 SCC 303) ], and State of Madhya Pradesh\nvy. Laxmi Narayan and Others; [(2019) 5 SCC 688],\nthis Court is of the view that the proceedings against the\n\nles Lent\nEH Neer e\n2024/KER/5245\nCRL.MC NO.20 OF 2024\n4\npetitioner can be quashed on the basis of settlement.\nMoreover, the dispute is purely personal in nature and no\npublic interest is involved in it.\n\nIn the result, this Crl.MC is allowed, and the\nproceedings in C.C.No.465 of 2022 on the file of Judicial\nFirst Class Magistrate Court-II, Perambra, stands quashed.\n\nSd/-\nSOPHY THOMAS\nJUDGE\nSSK/23/01\n\nEr sous\nls? Tere\n2024/KER/5245\nCRL.MC NO.20 OF 2024\n5\nAPPENDIX OF CRL.MC 20/2024\nPETITIONER ANNEXURES\nAnnexure Al THE CERTIFIED COPY OF FIR IN CRIME NO. 189/2022 OF\nATHOLY POLICE STATION\nAnnexure A2 THE CERTIFIED COPY OF THE FINAL REPORT FILED BY THE\nASSISTANT SUB-INSPECTOR OF POLICE, ATHOLY BEFORE THE\nJFCM COURT-II PERAMBRA ALONG WITH THE MEMORANDUM OF\nEVIDENCE\nAnnexure A3 THE AFFIDAVIT FILED BY THE RESPONDENT NO.3\nAnnexure A4 THE AFFIDAVIT FILED BY THE RESPONDENT NO. 4\n\n"
}