{
    "case_id": "",
    "court": "HIGH COURT OF KERALA AT HERNAKULAM\nPRESENT\nTHE HONOURABLE MR",
    "date": "2020",
    "judge": "P.B.SURESH KUMAR",
    "petitioners": [
        "UMMUHABEEBA K.P.,",
        "CHUNGATHARA P.O., MALAPPURAM - 679 334.",
        "Nilambur",
        "Malappuram",
        "Manjeri",
        "Judicial Magistrate",
        "PETER",
        "Magistrate",
        "UMMUHABEEBA K.P.",
        "D/O.MIKHDAD, KIZHAKKEPARAMBAN HOUSE,",
        "P.B.SURESH KUMAR",
        "AGED 30 YEARS"
    ],
    "respondents": [
        "REPRESENTED BY PUBLIC PROSECUTOR,",
        "STATE OF KERALA,",
        "HIGH COURT OF KERALA, ERNAKULAM - 682 031."
    ],
    "sections": [
        "164"
    ],
    "outcome": "Crl. M.C. is disposed",
    "full_text": "Bees Ta]\nZee\nBeer?\n2020/KER/822\nIN THE HIGH COURT OF KERALA AT HERNAKULAM\nPRESENT\nTHE HONOURABLE MR. JUSTICE P.B.SURESH KUMAR\nWEDNESDAY, THE O8TH DAY OF JANUARY 2020 / 18TH POUSHA, 1941\nCr1.MC.No.8592 OF 2019 (D)\nCRIME NO.776/2019 OF ANCHALUMMOODU POLICE STATION, KOLLAM\nPETITIONER:\nUMMUHABEEBA K.P.,\nAGED 30 YEARS\nD/O.MIKHDAD, KIZHAKKEPARAMBAN HOUSE,\nCHUNGATHARA P.O., MALAPPURAM - 679 334.\nBY ADVS.\nSRI.P.S.ABDUL KAREEM\nSRI.R.ABDUL AHAD\nRESPONDENT:\nSTATE OF KERALA,\nREPRESENTED BY PUBLIC PROSECUTOR,\nHIGH COURT OF KERALA, ERNAKULAM - 682 031.\nBY SRI.SANTHOSH PETER, PUBLIC PROSECUTOR\nTHIS CRIMINAL MISC. CASE HAVING COME UP FOR ADMISSION ON\n08.01.2020, THE COURT ON THE SAME DAY PASSED THE FOLLOWING:\n\nPall\nCrl.M.C.No.8592 of 2019 2020/KERI822\n2\nORDER\n\nThe Court of the Judicial Magistrate of the first class â€” Il,\nKollam has issued Annexure - B notice informing the petitioner\nthat the Chief Judicial Magistrate, Kollam has authorized that court\nto record the statement of the petitioner under Section 164 of the\nCode of Criminal Procedure in connection with Crime No.776 of\n2019 of Anchalummoodu Police Station and directing the\npetitioner to appear before the court for the said purpose on\n25.11.2019. Annexure - B notice is under challenge in this\nCrl.M.C.\n\n2. Heard the learned counsel for the petitioner as\nalso the learned Public Prosecutor.\n\n3. The learned counsel for the petitioner submits that\nthe petitioner is residing in Malappuram district, and if her\nstatement is necessary under Section 164 of the Code of Criminal\nProcedure, she is prepared to appear before any Magistrate in\nMalappuram district, if not inconvenient, before the Judicial\nMagistrate of the First Class Nilambur, for the said purpose.\n\n4. A statement under Section 164 of the Code of\nCriminal Procedure can be taken by any Magistrate. As such, the\nCrl. M.C. is disposed of directing the Chief Judicial Magistrate,\nManjeri to authorize the Judicial Magistrate of the first class,\n\npe ata\nCrl.M.C.No.8592 of 2019 2020/KERI822\n3\nNilambur to record the statement of the petitioner under Section\n164 of the Code of Criminal Procedure required in connection with\nCrime No.776 of 2019 of Anjalumoodu Police Station. The\ninvestigating officer in the case shall take appropriate steps for\nthe same.\nSd/-\nP.B.SURESH KUMAR, JUDGE.\nDK\n\nBees Ta]\nZoe\nBee\n2020/KER/822\nCri.M.C.No.8592 of 2019 VKER/\n4\nAPPENDIX\nPETITIONER'S EXHIBITS:\nANNEXURE A TRUE COPY OF THE FIR ALONG WITH FIS IN\nCRIME NO.776/2019 OF ANCHALUMMOODU\nPOLICE STATION DATED 27/06/2019.\nANNEXURE B TRUE COPY OF THE NOTICE ISSUED BY THE\nHONORABLE JUDICIAL FIRST CLASS\nMAGISTRATE COURT-II, KOLLAM TO THE\nPETITIONER DATED 18/11/2019.\nANNEXURE C TRUE COPY OF MEDICAL CERTIFICATE ISSUED\nBY DR.SALEEMA MBBS, DCH, CONSULTANT\nPAEDIATRICIAN, MAR THOMA HOSPITAL\nCHUNGATHARA, DATED 23/11/2019.\nRESPONDENT'S EXHIBITS: NIL\n//TRUE CoPyY//\nPA TO JUDGE\nDK\n\n"
}