{
    "case_id": "",
    "court": "HIGH COURT OF KERALA AT ERNAKULAM",
    "date": "2018",
    "judge": "B. KEMAL PASHA",
    "petitioners": [
        "AGED 54 YEARS, S/O.HEMACHANDRAN,",
        "KOLLAM-5.",
        "MAMBILLIKKUZHIYIL HOUSE",
        "J.\nDated",
        "SRI.M.AJITH",
        "Beene",
        "IPC",
        "SREEPADMAM, T.K.M.C. P.O, PEROOR,",
        "SURESH BABU,",
        "SURESH BABU",
        "B.KEMAL PASHA"
    ],
    "respondents": [
        "2 PAUL MATHEW,",
        "R2 BY ADV. SRI.T.R.RAJESH.",
        "(S) :",
        "MAMBILLIKKUZHIYIL HOUSE, SOUTH MARADY P.O,",
        "AGED 38 YEARS, S/O.M.C. MATHEW,",
        "R1 BY PUBLIC PROSECUTOR SRI.T.R. RENJITH",
        "MUVATTUPUZHA, ERNAKULAM -686 673.",
        "1 STATE OF KERALA,",
        "HIGH COURT OF KERALA, ERNAKULAM-682 031.",
        "REPRESENTED BY PUBLIC PROSECUTOR,"
    ],
    "sections": [
        "506(i)"
    ],
    "outcome": "CrIl.M.C. is disposed",
    "full_text": "a ae\nIN THE HIGH COURT OF KERALA AT ERNAKULAM 2018/KER/475\nPRESENT:\nTHE HONOURABLE MR. JUSTICE B.KEMAL PASHA\nFRIDAY, THE 5TH DAY OF JANUARY 2018 / 15TH POUSHA, 1939\nCr1.MC.No. 1630 of 2017\ncc. NO.827/2016 OF JUDICIAL FIRST CLASS MAGISTRATE COURT, MUVATTUPUZHA.\nCRIME NO. 561/2016 OF MUVATTUPUZHA POLICE STATION.\nPETITIONER:\nSURESH BABU,\nAGED 54 YEARS, S/O.HEMACHANDRAN,\nSREEPADMAM, T.K.M.C. P.O, PEROOR,\nKOLLAM-5.\nBY ADVS.SRI.R.MOHANA BABU,\nSRI.M.AJITH (KARICODE) .\nRESPONDENT (S) :\n1 STATE OF KERALA,\nREPRESENTED BY PUBLIC PROSECUTOR,\nHIGH COURT OF KERALA, ERNAKULAM-682 031.\n2 PAUL MATHEW,\nAGED 38 YEARS, S/O.M.C. MATHEW,\nMAMBILLIKKUZHIYIL HOUSE, SOUTH MARADY P.O,\nMUVATTUPUZHA, ERNAKULAM -686 673.\nR1 BY PUBLIC PROSECUTOR SRI.T.R. RENJITH\nR2 BY ADV. SRI.T.R.RAJESH.\nTHIS CRIMINAL MISC. CASE HAVING BEEN FINALLY HEARD\nON 05-01-2018, THE COURT ON THE SAME DAY PASSED THE\nFOLLOWING:\nrs.\n\nes\nBeene\n2018/KER/475\nCr1l.MC.No. 1630 of 2017 ()\nAPPENDIX\nPETITIONER'S ANNEXURES:\nANNX.A TRUE COPY OF THE FIR IN CRIME NO.561/2016 OF\nMUVATTUPUZHA POLICE STATION AND COMPLAINT OF\n2ND RESPONDENT.\nANNX .B TRUE COPY OF THE FINAL REPORT IN CRIME\nNO.561/2016 OF THE MUVATTUPUZHA POLICE STATION\nDATED 14.06.2016.\nANNX.C TRUE COPY OF THE PETITION DATED 21.02.2016 FILED\nBY PETITIONER TO THE SI OF POLICE, KILIKOLLUR.\nRESPONDENT'S ANNEXURES: NIL.\n//TRUE copy//\nP.S. TO JUDGE\nrs.\n\nREALE\nDO1s/RERIATS\nB. KEMAL PASHA, J.\nDated this the 5Â® day of January, 2018\nORDER\n\nPetitioner is the accused in C.C.No.827/2016 of the\nJudicial First Class Magistrate's Court, Muvattupuzha based on\nAnnexure-B final report in Crime No.561/2016 of the\nMuvattupuzha Police Station for the offence under Section\n506(i) IPC. On hearing either sides, it seems that the\narguments forwarded by the learned counsel for the petitioner\ncannot be considered at present, since those arguments are\nbased on the merits of the case. The petitioner can take up all\nthese contentions before the trial court at appropriate stage.\n\nWith liberty to the petitioner to take up these\ncontentions at appropriate stage before the trial court, this\nCrIl.M.C. is disposed of. As far as practicable, the court below\nshall grant exemption to the petitioners from _ personal\nappearance.\n\nSd/-\nB. KEMAL PASHA, JUDGE.\n\nse // True Copy // P.A. to Judge\n\n"
}