{
    "case_id": "",
    "court": "HIGH COURT OF KERALA AT ERNAKULAM\nPRESENT",
    "date": "2015",
    "judge": "Blige\nSe\npeas\n",
    "petitioners": [
        "3. ANUSMITHA,",
        "J.\nCr.M.C.No.6761",
        "W/O.MADHUSOODANAPANICKER, AGED 58 YEARS,",
        "1. AJULAL, SiO.MADHUSOODANAPANICKER, AGED 30 YEARS,",
        "2. SREEMATHY,",
        "NANDANAM, POOCHEDIVILA,KATTAI CODE,",
        "Blige",
        "D/O.MADHUSOODANAPANICKER,AGED 25 YEARS,",
        "KATTAKKADA, THIRUVANANTHAPURAM DISTRICT.",
        "ACCUSED:",
        "KATTAKKADA THIRUVANANTHAPURAM DISTRICT.",
        "NANDANAM, POOCHEDIVILA, KATTAI CODE,"
    ],
    "respondents": [
        "REPRESENTED BY THE DIRECTOR OF PUBLIC PROSECUTIONS,",
        "KATTAKKADA POLICE STATION, THIRUVANANTHAPURAM-695 004",
        "PLAVODU P.O, KODUNGANOOR, THIRUVANANTHAPURAM DISTRICT.",
        "HIGH COURT OF KERALA, ERNAKULAM - 682 031",
        "1. STATE OF KERALA,",
        "2. SUB INSPECTOR OF POLICE,",
        "3. RENJITHA, AGED 26 YEARS, D/O.SULOCHANA,",
        "STATE & COMPLAINANT:",
        "R1 & R2 BY PUBLIC PROSECUTOR SRI.JIBU P. THOMAS",
        "R3 BY ADV. SRILR.ARUN",
        "ORUMUGHATH PUTHEN VEEDU, VATTIYOORKAVU VILLAGE,"
    ],
    "sections": [
        "2015/KER/N274",
        "498A"
    ],
    "outcome": "proceedings in the criminal case may be quashed",
    "full_text": "Blige\nSe\npeas\n2015/KER/1274\nIN THE HIGH COURT OF KERALA AT ERNAKULAM\nPRESENT:\nTHE HONOURABLE MR. JUSTICE K.ABRAHAM MATHEW\nMONDAY, THE 12TH DAY OF JANUARY 2015/22ND POUSHA, 1936\nCri.MC.No. 6761 of 2014 ()\nCRIME NO. 785/2013 OF KATTAKKADA POLICE STATION ,\nTHIRUVANANTHAPURAM DISTRICT\nPETITIONER(S)/ACCUSED:\n1. AJULAL, SiO.MADHUSOODANAPANICKER, AGED 30 YEARS,\nNANDANAM, POOCHEDIVILA, KATTAI CODE,\nKATTAKKADA, THIRUVANANTHAPURAM DISTRICT.\n2. SREEMATHY,\nW/O.MADHUSOODANAPANICKER, AGED 58 YEARS,\nNANDANAM, POOCHEDIVILA,KATTAI CODE,\nKATTAKKADA THIRUVANANTHAPURAM DISTRICT.\n3. ANUSMITHA,\nD/O.MADHUSOODANAPANICKER,AGED 25 YEARS,\nNANDANAM, POOCHEDIVILA, KATTAI CODE,\nKATTAKKADA THIRUVANANTHAPURAM DISTRICT.\nBY ADV. SRILLATHEESH SEBASTIAN\nRESPONDENT(S)/STATE & COMPLAINANT:\n1. STATE OF KERALA,\nREPRESENTED BY THE DIRECTOR OF PUBLIC PROSECUTIONS,\nHIGH COURT OF KERALA, ERNAKULAM - 682 031\n2. SUB INSPECTOR OF POLICE,\nKATTAKKADA POLICE STATION, THIRUVANANTHAPURAM-695 004\n3. RENJITHA, AGED 26 YEARS, D/O.SULOCHANA,\nORUMUGHATH PUTHEN VEEDU, VATTIYOORKAVU VILLAGE,\nPLAVODU P.O, KODUNGANOOR, THIRUVANANTHAPURAM DISTRICT.\nR1 & R2 BY PUBLIC PROSECUTOR SRI.JIBU P. THOMAS\nR3 BY ADV. SRILR.ARUN\nTHIS CRIMINAL MISC. CASE HAVING COME UP FOR ADMISSION\nON 12-01-2015, THE COURT ON THE SAME DAY PASSED THE FOLLOWING:\nsts\n\nBlige\nSe\nrapt\n2015/KER/1274\nCri.MC.No. 6761 of 2014 ()\nAPPENDIX\nPETITIONER(S)' ANNEXURES:\nANNEX.A1- CERTIFIED COPY OF THE FIR IN CRIME NO.785 OF 2013 OF\nKATTAKKADA POLICE STATION.\nANNEX.A2- COPY OF THE AFFIDAVIT OF THE 3RD RESPONDENT.\nRESPONDENT(S)’ ANNEXURES: NIL\n/TRUE COPY/\nP.A.TO.JUDGE\nsts\n\n2015/KER/1274\nK.ABRAHAM MATHEW, J.\nCr.M.C.No.6761 of 2014.\nDated this the 12™ day of January, 2015.\nORDER\n\nThe petitioners are the accused in Crime No.785/2013\nof Kattakkada Police Station registered for the offence\nunder Section 498A IPC. The first petitioner is the husband\nof the 3 respondent and the second petitioner is his mother\nand the third petitioner is his sister. It is submitted that the\nmatter has been settled between the parties and the\nproceedings in the criminal case may be quashed.\n\n2. Heard, the learned counsel for the petitioners and\nof the 3 respondent and also the learned Public Prosecutor.\n\n3. The third respondent has appeared through a\ncounsel and filed an affidavit to the effect that the matter\nhas been settled and she has no objection to the\nproceedings in the criminal case being quashed. Having\nregard to the nature of the case I am satisfied that this is a\nfit case to invoke the jurisdiction of this Court under Section\n\n2015/KER/N274\nCrl.M.C.No.6761/2014.\n2\n482 Cr.PC.\n\n4. In the result, this petition is allowed. The\nproceedings in Crime No.785/2013 of Kattakkada Police\nStation are quashed.\n\nSd/-\nK.ABRAHAM MATHEW,\n(judge)\nKvs/-\n( true copy )\n\n"
}