{
    "case_id": "",
    "court": "HIGH COURT OF KERALA AT ERNAKULAM\nPRESENT",
    "date": "2017",
    "judge": "B.KEMAL PASHA",
    "petitioners": [
        "J.\nDated",
        "EDAPPATTU HOUSE, CHANDANAKKAMPARA P.O.,",
        "2. VINOD. E.G., S/O. GOPI, AGED 28 YEARS,",
        "THONDU CHIRAYIL HOUSE, PAYYAVOOR P.O.,",
        "DENNIS",
        "5. ANASYOOTH, S/O. JOY PRASAD, AGED 22 YEARS,",
        "KADUKAPARAYIL HOUSE, NELLIKUTTY P.O., ETTUPARA,",
        "4. JIBIN GEORGE, S/O. GEORGE, AGED 28 YEARS,",
        "6. DENNIS. V.A., S/O. BENNY, AGED 23 YEARS,",
        "3. ANJITH. E.R., S/O. RAVINDRAN, AGED 23 YEARS,",
        "KANNUR DISTRICT - 670 632.",
        "KANNUR DISTRICT - 670 633.",
        "EDAPPATTU HOUSE, CHANDANAKKAMPARAP.O.,",
        "ACCUSED NO. 1 TO 6:",
        "JOHN",
        "THONDU CHIRAYIL HOUSE",
        "1. SHEEN AUGUSTINE, S/O. AUGUSTINE, AGED 28 YEARS,",
        "JIBIN GEORGE",
        "MUTHALAKKUZHIYIL HOUSE, CHANDANAKKAMPARA P.O.,",
        "ERUVESSIL AMSOM, TALIPARAMBA TALUK,",
        "DOWNLOADED",
        "PAYYAVOOR AMSOM, TALIPARAMBA TALUK,",
        "THAPAPPIL HOUSE, CHANDANAKKAMPARA P.O.,"
    ],
    "respondents": [
        "KANNUR DISTRICT - 670 633.",
        "3. JOHN, S/O. JOSEPH, AGED 62 YEARS,",
        "2. ROOPESH N.J, S/O. JOHN, AGED 37 YEARS,",
        "R1 BY PUBLIC PROSECUTOR SRI.ALEX M. THOMBRA",
        "HIGH COURT OF KERALA AT ERNAKULAM",
        "REP. BY THE PUBLIC PROSECUTOR,",
        "1. STATE OF KERALA,",
        "STATE & AGGRIEVED PERSONS:",
        "THROUGH S.H.O PAYYAVOOR POLICE STATION,",
        "NADAKKAL HOUSE, MAVUMCHAL, PAYYAVOOR P.O.,",
        "PAYYAVOOR AMSOM DESOM, TALIPARAMBA TALUK,",
        "R2 &R3 BY ADV. SRILVA.SATHEESH",
        "KANNUR DISTRICT."
    ],
    "sections": [
        "323",
        "341",
        "143",
        "147",
        "452",
        "324",
        "148",
        "506(ii) read with\nSection 149 IPC"
    ],
    "outcome": "In the result, this Crl.M.C. is allowed",
    "full_text": "Es t, eae a\nPena\n2017/KER/49323\nIN THE HIGH COURT OF KERALA AT ERNAKULAM\nPRESENT:\nTHE HONOURABLE MR. JUSTICE B.KEMAL PASHA\nWEDNESDAY, THE 6TH DAY OF DECEMBER 2017/15TH AGRAHAYANA, 1939\nCri.MC.No. 8201 of 2017 ()\nCC.NO. 498/2017 OF JUDICIAL FIRST CLASS MAGISTRATE COURT, TALIPARAMBA\nCRIME NO. 1183/2016 OF PAYYAVOOR POLICE STATION,KANNUR DISTRICT\nPETITIONER(S)/ACCUSED NO. 1 TO 6:\n1. SHEEN AUGUSTINE, S/O. AUGUSTINE, AGED 28 YEARS,\nMUTHALAKKUZHIYIL HOUSE, CHANDANAKKAMPARA P.O.,\nPAYYAVOOR AMSOM, TALIPARAMBA TALUK,\nKANNUR DISTRICT - 670 633.\n2. VINOD. E.G., S/O. GOPI, AGED 28 YEARS,\nEDAPPATTU HOUSE, CHANDANAKKAMPARA P.O.,\nPAYYAVOOR AMSOM, TALIPARAMBA TALUK,\nKANNUR DISTRICT - 670 633.\n3. ANJITH. E.R., S/O. RAVINDRAN, AGED 23 YEARS,\nEDAPPATTU HOUSE, CHANDANAKKAMPARAP.O.,\nPAYYAVOOR AMSOM, TALIPARAMBA TALUK,\nKANNUR DISTRICT - 670 633.\n4. JIBIN GEORGE, S/O. GEORGE, AGED 28 YEARS,\nTHAPAPPIL HOUSE, CHANDANAKKAMPARA P.O.,\nPAYYAVOOR AMSOM, TALIPARAMBA TALUK,\nKANNUR DISTRICT - 670 633.\n5. ANASYOOTH, S/O. JOY PRASAD, AGED 22 YEARS,\nTHONDU CHIRAYIL HOUSE, PAYYAVOOR P.O.,\nPAYYAVOOR AMSOM, TALIPARAMBA TALUK,\nKANNUR DISTRICT - 670 633.\n6. DENNIS. V.A., S/O. BENNY, AGED 23 YEARS,\nKADUKAPARAYIL HOUSE, NELLIKUTTY P.O., ETTUPARA,\nERUVESSIL AMSOM, TALIPARAMBA TALUK,\nKANNUR DISTRICT - 670 632.\nBY ADV. SRI.V.T.MADHAVANUNNI\n2I-\n\nEs t, eae a\nSaas\n2017/KER/49323\n~2-\nCri.MC.No. 8201 of 2017 ()\nRESPONDENT(S)/STATE & AGGRIEVED PERSONS:\n1. STATE OF KERALA,\nREP. BY THE PUBLIC PROSECUTOR,\nHIGH COURT OF KERALA AT ERNAKULAM\nTHROUGH S.H.O PAYYAVOOR POLICE STATION,\nKANNUR DISTRICT.\n2. ROOPESH N.J, S/O. JOHN, AGED 37 YEARS,\nNADAKKAL HOUSE, MAVUMCHAL, PAYYAVOOR P.O.,\nPAYYAVOOR AMSOM DESOM, TALIPARAMBA TALUK,\nKANNUR DISTRICT - 670 633.\n3. JOHN, S/O. JOSEPH, AGED 62 YEARS,\nNADAKKAL HOUSE, MAVUMCHAL, PAYYAVOOR P.O.,\nPAYYAVOOR AMSOM DESOM, TALIPARAMBA TALUK,\nKANNUR DISTRICT - 670 633.\nR1 BY PUBLIC PROSECUTOR SRI.ALEX M. THOMBRA\nR2 &R3 BY ADV. SRILVA.SATHEESH\nTHIS CRIMINAL MISC. CASE HAVING COME UP FOR ADMISSION\nON 06-12-2017, THE COURT ON THE SAME DAY PASSED THE FOLLOWING:\nsts\n\nEe r, ot C]\nBER aas\n2017/KER/49323\nCri.MC.No. 8201 of 2017 ()\nAPPENDIX\nPETITIONER(S)' ANNEXURES:\nANNEXURE A1 CERTIFIED COPY OF FIR IN CRIME NO. 1183/2016 OF PAYYAVOOR\nPOLICE STATION.\nANNEXURE A2 TRUE COPY OF THE FIRST INFORMATION STATEMENT GIVEN BY\nTHE 2ND RESPONDENT IN CRIME NO. 1183/2016 OF PAYYAVOOR\nPOLICE STATION.\nANNEXURE A3_ CERTIFIED COPY OF THE FINAL REPORT IN C.C.NO. 498/2017 IN\nCRIME NO. 1183/2016 OF PAYYAVOOR POLICE STATION.\nANNEXURE A4 COPY OF THE CASE DETAILS IN C.C.NO. 498/2017 DOWNLOADED\nFROM INTERNET.\nRESPONDENT(S)' ANNEXURES: NIL\nITRUE COPY/\nP.A.TO JUDGE\nsts\n\nBla\n2017/KER/49323\nB. KEMAL PASHA, J.\nDated this the 6\" day of December, 2017\nORDER\n\nPetitioners are the accused in CC No.498/2017 of\nthe Judicial First Class Magistrate's Court, Taliparamba,\nwhich has arisen from Crime No.1183/2016 of Payyavoor\nPolice Station for the offences punishable under Sections\n143, 147, 148, 452, 341, 323, 324 and 506(ii) read with\nSection 149 IPC.\n\n2. It seems that the matter has been amicably\nsettled between the petitioners and the de_ facto\ncomplainant, who is the 2\" respondent herein. The 3”\nrespondent is the other injured.\n\n3. Respondents 2 and 3 have filed separate\naffidavits, affirming that the matter has been amicably\nsettled between them and the petitioners and presently, they\nhave no complaints against the petitioners. No purpose\n\nBla\n2017/KER/49323\n\nCrl.M.C.8201/2017 >.\nwould be served in proceeding with the matter further.\nMatters being so, all further proceedings against the\npetitioners in CC No.498/2017 of the Judicial First Class\nMagistrate's Court, Taliparamba, which has arisen from\nCrime No.1183/2016 of Payyavoor Police Station, can be\nquashed.\n\nIn the result, this Crl.M.C. is allowed and all further\nproceedings against the petitioners in CC No.498/2017 of\nthe Judicial First Class Magistrate's Court, Taliparamba,\nwhich has arisen from Crime No.1183/2016 of Payyavoor\nPolice Station, are quashed.\n\nSd/-\n(B.KEMAL PASHA, JUDGE)\naks/06/12\n// True Copy //\nPS to Judge\n\n"
}