{
    "case_id": "Crl.MC.No. 8844 of 2017",
    "court": "HIGH COURT OF KERALA AT ERNAKULAM",
    "date": "2018",
    "judge": "B.KEMAL PASHA",
    "petitioners": [
        "Annexure-Il",
        "/ACCUSED NO.1-6 :",
        "S/O.MUJEEB, KARIMBANAKAL HOUSE, KAITHACHIRA,",
        "Crl",
        "S/O.HANIFA, PULIAKODE HOUSE, MANNARKKAD.",
        "J.\nDated",
        "MANNARKKAD .",
        "CHANGALIRI, MANNARKKAD.",
        "S/O.ABDUL SALAM, MEALATHATHIL HOUSE,",
        "MC.No",
        "5 SAINUL ABID K.,",
        "S/O.ABDUL SALEEM, VELLIYAMKODAN HOUSE,",
        "VELLAKADAN HOUSE",
        "3 SHANHAR P.K.,",
        "4 MUHAMMED SHIHAS V.,",
        "CHISHATHADAYAN HOUSE",
        "PAYYANETTAM, MANNARKKAD .",
        "S/O.ISMAIL, CHISHATHADAYAN HOUSE, MUKKANNAM,",
        "1 MUHAMMED NAVAS VELLAKADAN,",
        "Peg",
        "KARIMBANAKAL HOUSE",
        "S/O.ABDUL NAZAR, VELLAKADAN HOUSE, KOLPADAM,",
        "6 MUHAMMAD SUFAIL M.,",
        "THENKARA P.O., MANNARKKAD.",
        "2 MUHAMMED SINSAR C.,"
    ],
    "respondents": [
        "1. ANEEZ RAHMAN",
        "S/O.AKSHAR, KAMMATTIL HOUSE, KANJIRAMPUZHA,",
        "PALAKKAD DISTRICT, PIN-678 582.",
        ".-2/-",
        "S/O.MUHAMMADALI, PARAPPUVAL HOUSE, MANNARKKAD,",
        "MANNARKKAD, PALAKKAD DISTRICT, PIN-678 582.",
        "(S):",
        "2. MUHAMMED AJMAL K.,"
    ],
    "sections": [
        "323\nIPC read with Section 149 IPC",
        "341",
        "147",
        "143"
    ],
    "outcome": "as against the petitioners, are liable to be quashed",
    "full_text": "Pg\nas\ncarne\nIN THE HIGH COURT OF KERALA AT ERNAKULAM 2018/KER/273\nPRESENT:\nTHE HONOURABLE MR. JUSTICE B.KEMAL PASHA\nTHURSDAY, THE 4TH DAY OF JANUARY 2018 / 14TH POUSHA, 1939\nCr1.MC.No. 8844 of 2017\nCRIME NO. 531/2017 OF MANNARKKAD POLICE STATION, PALAKKAD DISTRICT\nPETITIONER(S) /ACCUSED NO.1-6 :\n1 MUHAMMED NAVAS VELLAKADAN,\nS/O.ABDUL NAZAR, VELLAKADAN HOUSE, KOLPADAM,\nTHENKARA P.O., MANNARKKAD.\n2 MUHAMMED SINSAR C.,\nS/O.ISMAIL, CHISHATHADAYAN HOUSE, MUKKANNAM,\nMANNARKKAD .\n3 SHANHAR P.K.,\nS/O.HANIFA, PULIAKODE HOUSE, MANNARKKAD.\n4 MUHAMMED SHIHAS V.,\nS/O.ABDUL SALEEM, VELLIYAMKODAN HOUSE,\nPAYYANETTAM, MANNARKKAD .\n5 SAINUL ABID K.,\nS/O.MUJEEB, KARIMBANAKAL HOUSE, KAITHACHIRA,\nMANNARKKAD .\n6 MUHAMMAD SUFAIL M.,\nS/O.ABDUL SALAM, MEALATHATHIL HOUSE,\nCHANGALIRI, MANNARKKAD.\nBY ADVS.SRI.JOJU KYNADY\nSRI.TOM THOMAS (KAKKUZHIYIL)\nDE-FACTO COMPLAINANTS/1ST & 2ND RESPONDENT (S):\n1. ANEEZ RAHMAN\nS/O.MUHAMMADALI, PARAPPUVAL HOUSE, MANNARKKAD,\nPALAKKAD DISTRICT, PIN-678 582.\n2. MUHAMMED AJMAL K.,\nS/O.AKSHAR, KAMMATTIL HOUSE, KANJIRAMPUZHA,\nMANNARKKAD, PALAKKAD DISTRICT, PIN-678 582.\n.-2/-\n\ngaat\ncore\nsey\ncarne\n2 2018/KER/273\nCrl.MC.No. 8844 of 2017\n3. STATE OF KERALA,\nREPRESENTED BY THE PUBLIC PROSECUTOR,\nOFFICE OF THE ADVOCATE GENERAL,\nHIGH COURT BUILDINGS, ERNAKULAM-682 018.\n4. STATE OF KERALA,\nREPRESENTED BY THE SUB INSPECTOR OF POLICE,\nMANNARKKAD POLICE STATION, PALAKKAD DISTRICT,\nPIN-678 582.\nRl & R2 BY ADV. SRI.S.NIDHEESH\nR3 & R4 BY PUBLIC PROSECUTOR SRI.C.S.HRITHWIK\nTHIS CRIMINAL MISC. CASE HAVING COME UP FOR ADMISSION\nON 04-01-2018, THE COURT ON THE SAME DAY PASSED\nTHE FOLLOWING:\nMsd.\n\nPg\npane\nsey\ncarne\nCrl.MC.No. 8844 of 2017 2018/KER/273\nAPPENDIX\nPETITIONER(S)' ANNEXURES :\nANNEXURE I TRUE COPY OF THE FIR.\nANNEXURE IT NOTARIZED AFFIDAVIT SWORN TO BY THE 1ST RESPONDENT.\nANNEXURE IIT NOTARIZED AFFIDAVIT SWORN TO BY THE 2ND RESPONDENT.\nRESPONDENT (S) ' ANNEXURES :\nNIL\n/ / TRUE COPyY/ /\nP.S.TO JUDGE\nMsd.\n\nPal\n| re!\n2018/KER/273\nB.KEMAL PASHA, J.\nDated this the 4\" day of January, 2018\nORDER\nPetitioners are accused Nos.1 to 6 in Crime No.531 of\n2017 of the Mannarkkad Police Station, registered for the\noffences punishable under Sections 143, 147, 341 and 323\nIPC read with Section 149 IPC.\n2. It seems that the matter has been amicably seitled\nbetween the parties.\n3. On going through the facts and circumstances of\nthe case, it seems that the matter can be permitted to be\nsettled. lt has been reported that no criminal antecedents\nhave been reported against the petitioners. The defacto\ncomplainant and the other affected person have filed\nAnnexure-Il and Annexure-lll affidavits affirming that the\nmatter has been amicably settled between them and the\npetitioners and they have no complaints against the\npetitioners. Considering the fact that the matter has already\nbeen settled amicably between the parties, this court is\n\nPeg\napa\n2018/KER/273\nCrl.M.C.No.8844 of 2017 2\nsatisfied that no purpose would be served in proceeding with\nthe trial of the case. Matters being so, Annexure-I First\nInformation Report in Crime No.531 of 2017 of the\nMannarkkad Police Station, and all further proceedings in it,\nas against the petitioners, are liable to be quashed.\nIn the result, this Cri.M.C. is allowed and Annexure-!\nFirst Information Report in Crime No.531 of 2017 of the\nMannarkkad Police Station, and all further proceedings in it,\nas against the petitioners, are hereby quashed.\nSd/-\nB.KEMAL PASHA\nJUDGE\nDSV/4/1/18\nâ€œTrue Copy /\nP.A.To Judge\n\n"
}