{
    "case_id": "Crl.MC.No. 3130 of 2016 ()",
    "court": "HIGH COURT OF KERALA AT ERNAKULAM",
    "date": "2018",
    "judge": "B. KEMAL PASHA",
    "petitioners": [
        "MC.No",
        "KOLLAM-5.",
        "PAUL MATHEW",
        "MAMBILLIKKUZHIYIL HOUSE",
        "SRI.M.AJITH",
        "21/02/2016",
        "AGED:54 YEARS, s/o HEMACHANDRAN ,",
        "SURESH BABU,",
        "ACCUSED:",
        "B.KEMAL PASHA",
        "SURESH BABU",
        "SREEPADMAM, T.K.M.C.P.O, PEROOR,"
    ],
    "respondents": [
        "S /COMPLAINANT :",
        "R1 BY PUBLIC PROSECUTOR SRI.T.R. RENJITH.",
        "R2 BY ADV. SRI.SINU.G.NATH.",
        "MAMBILLIKKUZHIYIL HOUSE, SOUTH MARADY P.O,",
        "1. STATE OF KERALA,",
        "2. PAUL MATHEW,",
        "HIGH COURT OF KERALA, ERNAKULAM-682 031.",
        "AGED:38 YEARS, S/O. M.C. MATHEW,",
        "REPRESENTED BY PUBLIC PROSECUTOR,",
        "MUVATTUPUZHA, ERNAKULAM-686 673."
    ],
    "sections": [
        "41(A)CRPC"
    ],
    "outcome": "Crl.M.C.No.1630/2017. Therefore, this Crl.M.C. is dismissed",
    "full_text": "rapa\nIN THE HIGH COURT OF KERALA AT ERNAKULAM 2018/KERIA81\nPRESENT:\nTHE HONOURABLE MR. JUSTICE B.KEMAL PASHA\nFRIDAY, THE 5TH DAY OF JANUARY 2018 / 15TH POUSHA, 1939\nCr1.MC.No. 3130 of 2016\nCRIME NO.561/2016 OF MUVATTUPUZHA POLICE STATION.\nPETITIONER/ACCUSED:\nSURESH BABU,\nAGED:54 YEARS, s/o HEMACHANDRAN ,\nSREEPADMAM, T.K.M.C.P.O, PEROOR,\nKOLLAM-5.\nBY ADVS.SRI.R.MOHANA BABU,\nSRI.M.AJITH (KARICODE) .\nRESPONDENTS /COMPLAINANT :\n1. STATE OF KERALA,\nREPRESENTED BY PUBLIC PROSECUTOR,\nHIGH COURT OF KERALA, ERNAKULAM-682 031.\n2. PAUL MATHEW,\nAGED:38 YEARS, S/O. M.C. MATHEW,\nMAMBILLIKKUZHIYIL HOUSE, SOUTH MARADY P.O,\nMUVATTUPUZHA, ERNAKULAM-686 673.\nR1 BY PUBLIC PROSECUTOR SRI.T.R. RENJITH.\nR2 BY ADV. SRI.SINU.G.NATH.\nTHIS CRIMINAL MISC. CASE HAVING BEEN FINALLY HEARD\nON 05-01-2018, THE COURT ON THE SAME DAY PASSED THE\nFOLLOWING:\nrs.\n\nEy. Â° Be\nPDR ai\n2018/KER/481\nCrl.MC.No. 3130 of 2016 ()\nAPPENDIX\n\nPETITIONER'S ANNEXURES:\nANNEXURE A A TRUE COPY OF THE NOTICE UNDER SECTION 41(A)CRPC.\nANNEXURE B CERTIFIED COPY OF THE FIR IN CRIME NO. 561/2016 OF\n\nMUVATTUPUZHA POLICE STATION AND COMPLAINT OF\n\n2ND RESPONDENT WITH SANCTION APPLICATION AND ORDER.\nANNEXURE C A TRUE COPY OF THE JUDGMENT DT. 26/02/2013 IN\n\nW.P.(C)NO. 27645/2012.\nANNEXURE D A TRUE COPY OF THE PETITION DT. 21/02/2016 FILED BY\n\nPETITIONER TO THE SI OF POLICE KILIKOLLUR.\nANNEXURE E A TRUE COPY OF THE FINAL REPORT IN CRIME NO.561/2016\n\nOF THE MUVATTUPUZHA POLICE STATION DATED 14/06/2016.\nRESPONDENT'S ANNEXURES: NIL.\n\n//TRUE COPY//\nP.S. TO JUDGE\n\nrs.\n\nail\n2018/KER/481\nB. KEMAL PASHA, J.\nDated this the 5\" day of January, 2018\nORDER\nThis Crl.M.C. has become infructuous in view of\nCrl.M.C.No.1630/2017. Therefore, this Crl.M.C. is dismissed as\ninfructuous.\nSd/-\nB. KEMAL PASHA, JUDGE.\nse // True Copy // P.A. to Judge\n\n"
}