{
    "case_id": "Crl.MC.No.86 OF 2020 (A)",
    "court": "HIGH COURT OF KERALA AT ERNAKULAM\nPRESENT\nTHE HONOURABLE MR",
    "date": "2020",
    "judge": "P.B.SURESH KUMAR",
    "petitioners": [
        "AGED 56 YEARS, S/O.KRISHNAN, CHEMMANDA HOUSE,",
        "PULIPPARAKKUNNU DESOM, MANAKULANGARA P.O.,",
        "THRISSUR DISTRICT.",
        "THRISSUR DISTRICT- 680713",
        "CHEMMANDA HOUSE",
        "MUTHUPARAMBIL HOUSE, PULIPPARAKKUNNU DESOM,",
        "P.B.SURESH KUMAR",
        "ALUKKAL HOUSE",
        "AGED 42 YEARS, S/O.SHANMUGHAN,",
        "2 SHANAJAN,",
        "AGED 30 YEARS, S/O.CHANDRAN, ALUKKAL HOUSE,",
        "ITTITHARA HOUSE, PULIPPARAKKUNNU DESOM,",
        "S/ACCUSED PERSON 1 TO 5:",
        "4 BINOY,",
        "THRISSUR DISTRICT-680713",
        "1 MANITHAN,",
        "CHALAKUDY TALUK, THRISSUR DISTRICT.",
        "AGED 40 YEARS, S/O.MANOHARAN,",
        "5 LALU,",
        "AGED 41 YEARS, S/O.NARAYANAN, MALAYADAN HOUSE,",
        "3 SANOOP,",
        "MANITHAN",
        "MANAKULANGARA P.O., CHALAKUDY TALUK,"
    ],
    "respondents": [
        "POLICE STATION, THROUGH THE PUBLIC PROSECUTOR,",
        "PULIPPARAKKUNNU DESOM, MANAKULANGARA P.O.,",
        "S/STATE OF KERALA AND THE COMPLAINANT:",
        "AGED 41 YEARS, W/O.SUBRAMANYAN, KAKKANADAN",
        "SANTHOSH PETER PP",
        "1 THE STATE OF KERALA,",
        "2 KALYANI,",
        "REP. BY THE SUB INSPECTOR OF POLICE, KODAKARA",
        "CHALAKUDY TALUK, THRISSUR DISTRICT - 680 713.",
        "3 SALEESH,",
        "MUKUNDAPURAM TALUK, THRISSUR DISTRICT- 680713.",
        "AGED 41 YEARS, S/O.VASU, KORATTIKKADAN HOUSE,",
        "R2-4 BY ADV. K.SUDHINKUMAR",
        "CHALAKUDY TALUK, THRISSUR DISTRICT-680713.",
        "AGED 75 YEARS, W/O.VASU, KORATTIKKADAN HOUSE,",
        "4 PREETHI,",
        "HIGH COURT OF KERALA AT ERNAKULAM-682031.",
        "HOUSE, KUZHIKKATTUKONAM, MADAYIKONAM VILLAGE,"
    ],
    "sections": [
        "482",
        "323",
        "506",
        "143",
        "149",
        "379",
        "147",
        "452",
        "294(b)",
        "148",
        "427"
    ],
    "outcome": "In the result, the Crl.M.C. is allowed",
    "full_text": "ReENe\npeat\na\nCAPE eet\n2020/KER/684\nIN THE HIGH COURT OF KERALA AT ERNAKULAM\nPRESENT\nTHE HONOURABLE MR. JUSTICE P.B.SURESH KUMAR\nWEDNESDAY, THE 08TH DAY OF JANUARY 2020 / 18TH POUSHA,\n1941\nCrl.MC.No.86 OF 2020 (A)\nCRIME NO.549/2019 OF KODAKARA POLICE STATION, THRISSUR\nPETITIONERS/ACCUSED PERSON 1 TO 5:\n1 MANITHAN,\nAGED 40 YEARS, S/O.MANOHARAN,\nMUTHUPARAMBIL HOUSE, PULIPPARAKKUNNU DESOM,\nMANAKULANGARA P.O., CHALAKUDY TALUK,\nTHRISSUR DISTRICT.\n2 SHANAJAN,\nAGED 42 YEARS, S/O.SHANMUGHAN,\nITTITHARA HOUSE, PULIPPARAKKUNNU DESOM,\nMANAKULANGARA P.O., CHALAKUDY TALUK,\nTHRISSUR DISTRICT.\n3 SANOOP,\nAGED 30 YEARS, S/O.CHANDRAN, ALUKKAL HOUSE,\nPULIPPARAKKUNNU DESOM, MANAKULANGARA P.O.,\nCHALAKUDY TALUK, THRISSUR DISTRICT.\n4 BINOY,\nAGED 41 YEARS, S/O.NARAYANAN, MALAYADAN HOUSE,\nPULIPPARAKKUNNU DESOM, MANAKULANGARA P.O.,\nCHALAKUDY TALUK, THRISSUR DISTRICT.\n5 LALU,\nAGED 56 YEARS, S/O.KRISHNAN, CHEMMANDA HOUSE,\nPULIPPARAKKUNNU DESOM, MANAKULANGARA P.O.,\nCHALAKUDY TALUK, THRISSUR DISTRICT.\nBY ADV. SRI.N.L.BITTO\n\nmes\narate\nBS otis\nEULER TE\na\nCAPE eet\n2020/KER/684\nCrl.M.C. No.86 of 2020 2\nRESPONDENTS/STATE OF KERALA AND THE COMPLAINANT:\n1 THE STATE OF KERALA,\nREP. BY THE SUB INSPECTOR OF POLICE, KODAKARA\nPOLICE STATION, THROUGH THE PUBLIC PROSECUTOR,\nHIGH COURT OF KERALA AT ERNAKULAM-682031.\n2 KALYANI,\nAGED 75 YEARS, W/O.VASU, KORATTIKKADAN HOUSE,\nPULIPPARAKKUNNU DESOM, MANAKULANGARA P.O.,\nCHALAKUDY TALUK, THRISSUR DISTRICT-680713.\n3 SALEESH,\nAGED 41 YEARS, S/O.VASU, KORATTIKKADAN HOUSE,\nPULIPPARAKKUNNU DESOM, MANAKULANGARA P.O.,\nCHALAKUDY TALUK, THRISSUR DISTRICT - 680 713.\n4 PREETHI,\nAGED 41 YEARS, W/O.SUBRAMANYAN, KAKKANADAN\nHOUSE, KUZHIKKATTUKONAM, MADAYIKONAM VILLAGE,\nMUKUNDAPURAM TALUK, THRISSUR DISTRICT- 680713.\nR2-4 BY ADV. K.SUDHINKUMAR\nSANTHOSH PETER PP\nTHIS CRIMINAL MISC. CASE HAVING COME UP FOR ADMISSION\nON 08.01.2020, THE COURT ON THE SAME DAY PASSED THE\nFOLLOWING:\n\neee\non\n2020/KER/684\nCrl.M.C. No.86 of 2020 3\nCri.M.C.No.86 of 2020\nORDER\n\nThis is a proceedings instituted under Section 482 of\nthe Code of Criminal Procedure for quashing Annexure - | first\ninformation report and all further proceedings pursuant thereto\nin Crime No.549 of 2019 of Kodakara Police Station.\n\n2. The petitioners are accused Nos.1 to 5 in the said\ncase. The case was one instituted at the instance of the second\nrespondent under Sections 143, 147, 148, 323, 427, 452,\n294(b), 506, 379 and 149 of the Indian Penal Code.\n\n3. Respondents 2 to 4 are the victims of the\naforesaid crime and they have settled their disputes with the\npetitioners, and affidavits sworn to by them to that effect have\nbeen produced as Annexures II to IV.\n\n4. Heard the learned counsel for the petitioners,\nthe learned Public Prosecutor as also the learned counsel for\nthe second respondent.\n\nere\n2020/KER/684\nCrl.M.C. No.86 of 2020 4\n\n5. In the light of the decision of the Apex Court in\nGian singh v. State of Punjab, (2012) 10 SCC 303, insofar as\nthe offences alleged against the accused in the case are only\noffences punishable under Sections 143, 147, 148, 323, 427,\n452, 294(b), 506, 379 and 149 of the Indian Penal Code, | am of\nthe view that this is an appropriate case where this court has to\ninvoke the jurisdiction under Section 482 of the Code of\nCriminal Procedure to quash the proceedings against the\npetitioners.\n\nIn the result, the Crl.M.C. is allowed and Annexure-|\nfirst information report and all further proceedings pursuant\nthereto in Crime No.549 of 2019 of Kodakara Police Station are\nquashed.\n\nSd/-\nP.B.SURESH KUMAR, JUDGE.\nYKB\n\nrate Cl\nate\niz: â€˜ ia\n2020/KER/684\nAPPENDIX\nPETITIONER'S/S EXHIBITS:\nANNEXURE I A TRUE COPY OF THE FIR IN CRIME NO.549\nOF 2019 DATED 03.12.2019 OF THE\nKODAKKAD POLICE STATION.\nANNEXURE II ORIGINAL AFFIDAVIT OF THE 2ND\nRESPONDENT DATED 04.01.2020.\nANNEXURE III ORIGINAL AFFIDAVIT OF THE 3RD\nRESPONDENT DATED 04.01.2020.\nANNEXURE IV ORIGINAL AFFIDAVIT OF THE 2ND\nRESPONDENT DATED 04.01.2020.\nRESPONDENT'S/S EXHIBITS:\nNIL\n//TRUE COPY//\nPA TO JUDGE\n\n"
}