{
    "case_id": "",
    "court": "HIGH COURT OF KERALA AT ERNAKULAM",
    "date": "2020",
    "judge": "P.B.SURESH KUMAR",
    "petitioners": [
        "KUZHIKKATTILL HOUSE,",
        "MUVATTUPUZHA TALUK",
        "HARIKUMAR K.K.",
        "AGED 43,",
        "THOTTUNGAL PEEDIKA BHAGOM,",
        "S/O.KRISHNAN NAIR,",
        "RAMANGALAM KARA, MARADY VILLAGE,",
        "Bieeaee",
        "PETER",
        "Rane",
        "Annexure - A3 Final Report",
        "ACCUSED:",
        "P.B.SURESH KUMAR",
        "RAMANGALAM KARA"
    ],
    "respondents": [
        "D/O.VIJAYAN, FACE 2,",
        "ERNAKULAM — PIN 682305",
        "THROUGH, PUBLIC PROSECUTOR, HIGH COURT OF KERALA",
        "AGED 36 YEARS",
        "1 STATE OF KERALA",
        "R1 BY ADV. SRI.AJEESH S.BRITE",
        "HILL PALACE APARTMENT,",
        "S/COMPLAINANT & DEFACTO COMPLAINANT:",
        "KESAVAMPADI, THIRUVANKULAM,",
        "2 AMBILI",
        "REPRESENTED BY SUB INSPECTOR OF POLICE,",
        "Ernakulam",
        "CHOTTANIKKARA POLICE STATION,",
        "Muvattupuzha"
    ],
    "sections": [
        "482",
        "498A",
        "420"
    ],
    "outcome": "In the result, the Crl.M.C. is allowed",
    "full_text": "pees\nrroysecaercne\na\neae\nIN THE HIGH COURT OF KERALA AT ERNAKULAM 2020/KERI947\nPRESENT\nTHE HONOURABLE MR. JUSTICE P.B.SURESH KUMAR\nTHURSDAY, THE OSTH DAY OF JANUARY 2020 / 19TH POUSHA, 1941\nCr1.MC.No.3590 OF 2018\nAGAINST THE ORDER/JUDGMENT IN CC 35/2017 OF JUDICIAL MAGISTRATE OF FIRST\nCLASS -I MOOVATUPUZHA\nCRIME NO.2764/2016 OF Moovattupuzha Police Station , Ernakulam\nPETITIONER/ACCUSED:\nHARIKUMAR K.K.\nAGED 43,\nS/O.KRISHNAN NAIR,\nKUZHIKKATTILL HOUSE,\nTHOTTUNGAL PEEDIKA BHAGOM,\nRAMANGALAM KARA, MARADY VILLAGE,\nMUVATTUPUZHA TALUK\nBY ADVS.\nSRI .M.B.SANDEEP\nSMT .R.ANJANA\nSRI .M.J.KTIRANKUMAR\nSMT .R.PRIYA\nSRI .B.SURJITH\nSMT .K.P.SREEJA\nSMT .SHERIN VARGHESE\nRESPONDENTS/COMPLAINANT & DEFACTO COMPLAINANT:\n1 STATE OF KERALA\nREPRESENTED BY SUB INSPECTOR OF POLICE,\nCHOTTANIKKARA POLICE STATION,\nTHROUGH, PUBLIC PROSECUTOR, HIGH COURT OF KERALA\n2 AMBILI\nAGED 36 YEARS\nD/O.VIJAYAN, FACE 2,\nHILL PALACE APARTMENT,\nKESAVAMPADI, THIRUVANKULAM,\nERNAKULAM — PIN 682305\nR1 BY ADV. SRI.AJEESH S.BRITE\nSRI.SANTHOSH PETER —- SR.PP\nTHIS CRIMINAL MISC. CASE HAVING COME UP FOR ADMISSION ON\n09.01.2020, THE COURT ON THE SAME DAY PASSED THE FOLLOWING:\n\nwee\nBieeaee\n2020/KER/947\nCr1.MC.No.3590 OF 2018\n2\nCriI.M.C.No.3590 of 2018\nORDER\n\nThis is a proceedings under Section 482 of the Code\nof Criminal Procedure for quashing Annexure - A3 Final Report\npending trial before the Judicial First Class Magistrate Court - lI,\nMuvattupuzha in C.C.No.35 of 2017.\n\n2. The petitioner is the accused in the said case.\nThe case was one registered under Sections 420 and 498A of\nthe Indian Penal Code.\n\n3. It is stated that the petitioner and the de facto\ncomplainant have amicably settled the disputes and an\naffidavit sworn to by the de facto complainant is part of the\nrecords.\n\n4. Heard the learned counsel for the petitioner,\nthe learned Public Prosecutor as also the learned counsel for\nthe de facto complainant.\n\n5. In the light of the decision of the Apex Court in\nGian singh v. State of Punjab, (2012) 10 SCC 303, insofar\n\nwee\nBieeaee\n2020/KER/947\nCr1.MC.No.3590 OF 2018\n3\nas the offences alleged against the petitioner are only\noffences punishable under Sections 420 and 498A of the\nIndian Penal Code, | am of the view that this is an appropriate\ncase where this court has to invoke the jurisdiction under\nSection 482 of the Code of Criminal Procedure to quash the\nproceedings.\nIn the result, the Crl.M.C. is allowed and Annexure -\nA3 Final Report pending trial before the Judicial First Class\nMagistrate Court - I, Muvattupuzha in C.C.No.35 of 2017 is\nquashed.\nSd/-\nP.B.SURESH KUMAR, JUDGE.\nPV\n\nRane\nrroysecaercne\nLa\neae\n2020/KER/947\nCr1.MC.No.3590 OF 2018\n4\nAPPENDIX\nPETITIONER'S EXHIBITS:\nANNEXURE Al TRUE COPY OF THE CHARGE SHEET IN\nS.C.NO.82/2017 ON THE FILES OF\nADDITIONAL DISTRICT AND SESSIONS\nCOURT, ERNAKULAM (FOR THE TRIAL OF\nCASES RELATING TO ATROCITIES AND\nSEXUAL VIOLENCE AGAINST WOMEN AND\nCHILDREN) .\nANNEXURE A2 TRUE COPY OF THE FIRST INFORMATION\nSTATEMENT IN CRIME NO.2764/2016 OF\nMOOVATTUPUZHA POLICE STATION.\nANNEXURE A3 CERTIFIED COPY OF THE FINAL REPORT IN\ncc NO.35/2017 ON THE FILES OF\nHONOURABLE JUDICIAL FIRST CLASS\nMAGISTRATE COURT- I, MUVATTUPUZHA.\nANNEXURE A4 THE AFFIDAVIT FILED BY THE 2ND\nRESPONDENT\nRESPONDENTS' EXHIBITS: NIL\n\n"
}