{
    "case_id": "",
    "court": "HIGH COURT OF KERALA AT ERNAKULAM\nPRESENT\nTHE HONOURABLE MR",
    "date": "2024/KER/2897",
    "judge": "Sreeja V.",
    "petitioners": [
        "D/O INDIRA DEVI, VATTAPARAPADINJARAEATHIL,",
        "EAST OF YMCA, CHENGANNUR, ALAPPUZHA, PIN - 689121",
        "ACCUSED NO.1:",
        "Baa",
        "LU",
        "SARITHA.S. NAIR",
        "AGED 45 YEARS"
    ],
    "respondents": [
        "HIGH COURT OF KERALA, ERNAKULAM, PIN - 682031",
        "OTHER PRESENT:",
        "STATE OF KERALA",
        "REPRESENTED BY THE PUBLIC PROSECUTOR,"
    ],
    "sections": [
        "1860",
        "468",
        "420",
        "419",
        "406",
        "120B",
        "471"
    ],
    "outcome": "/JUDGMENT IN CC 2734/2015 OF JUDICIAL MAGISTRATE\nOF FIRST CLASS, THALASSERY\nPETITIONER/ACCUSED NO.1:\nSARITHA.S. NAIR\nAGED 45 YEARS\nD/O INDIRA DEVI, VATTAPARAPADINJARAEATHIL,\nEAST OF YMCA, CHENGANNUR,",
    "full_text": "ahal\nic\n2024/KER/2897\nIN THE HIGH COURT OF KERALA AT ERNAKULAM\nPRESENT\nTHE HONOURABLE MR. JUSTICE BECHU KURIAN THOMAS\nTHURSDAY, THE 11â„¢ DAY OF JANUARY 2024 / 21ST POUSHA, 1945\nCRL.MC NO. 241 OF 2024\nCRIME NO.1647/2012 OF THALASSERY EXCISE RANGE OFFICE, KANNUR\nAGAINST THE ORDER/JUDGMENT IN CC 2734/2015 OF JUDICIAL MAGISTRATE\nOF FIRST CLASS, THALASSERY\nPETITIONER/ACCUSED NO.1:\nSARITHA.S. NAIR\nAGED 45 YEARS\nD/O INDIRA DEVI, VATTAPARAPADINJARAEATHIL,\nEAST OF YMCA, CHENGANNUR, ALAPPUZHA, PIN - 689121\nBY ADV M.R.SARIN\nRESPONDENT:\nSTATE OF KERALA\nREPRESENTED BY THE PUBLIC PROSECUTOR,\nHIGH COURT OF KERALA, ERNAKULAM, PIN - 682031\nOTHER PRESENT:\nSMT. V. SREEJA (PP)\nTHIS CRIMINAL MISC. CASE HAVING COME UP FOR ADMISSION ON\n11.01.2024, THE COURT ON THE SAME DAY PASSED THE FOLLOWING:\n\nmo)\nCRL.MC NO. 241 OF 2024 ELIZ\nBECHU KURIAN THOMAS, J.\n~ Cri.M.C. No. 241 of 2024\nDated this the 11\" day of January, 2024\nORDER\n\nPetitioner is the 1* accused in C.C No.2734 of 2015 on the\nfiles of the Judicial First Class Magistrate Court, Thalassery,\nfacing prosecution for the offences under Sections 406, 419,\n420, 468, 471 and 120B of the Indian Penal Code, 1860.\n\n2. Petitioner contends that, on 20.01.2023, due to the\nfailure of the petitioner to appear before the court, a non\nbailable warrant has been issued, after canceling the bail. The\npetitioner seeks for a direction to consider his applications for\nrecall of warrant and grant of bail on the day of appearance\nitself.\n\n3. Sri. Sarin, learned counsel for the petitioner contends\nthat, petitioner is suffering from various health issues and that,\nshe is undergoing medical treatment and hence, failure on\n20.01.2023 was not willful.\n\n4. | heard Smt. Sreeja V., learned Public Prosecutor as\nwell.\n\nail\ni . ee]\npat\n2024/KER/2897\nCRL.MC NO. 241 OF 2024\n\n5. Since a non bailable warrant has been issued against\nthe petitioner for her failure to appear on 20.01.2023 and she\nhas undertaken to appear before the court within the next 15\ndays. | am of the view that, a liberal approach can be adopted\nand the application, if any filed by her can be directed to be\nconsidered on the same day itself.\n\n6. Accordingly, there will be a direction to the the\nJudicial First Class Magistrate Court, Thalassery to consider the\napplication, if any filed by the petitioner for recall of warrant\nand for bail on the same day of her appearance itself provided\nsuch applications are filed within 15 days from today. The non\nbailable warrant issued against the petitioner will be kept in\nabeyance for a period of 15 days from today, to enable the\npetitioner to comply with the above directions.\n\nThe Criminal Miscellaneous Case is disposed of.\n\nSd/-\nBECHU KURIAN THOMAS\nJUDGE\nLU\n\nnel\nBaa\n2024/KER/2897\nCRL.MC NO. 241 OF 2024\ner\nAPPENDIX OF CRL.MC 241/2024\nPETITIONER ANNEXURES :\nANNEXURE A21 THE TRUE COPY OF THE RELEVANT PAGES OF\nCOURT PROCEEDINGS IN CC NO 2734/2015\nPUBLISHED IN E COURTS\nANNEXURE A2 THE TRUE COPY OF THE PRESCRIPTION\nDETAILS ISSUED BY THE DR SRUTHI S. NAIR\nADDITIONAL PROFESSOR SREE CHITHIRA\nTHIRUNNAL INSTITUTE OF MEDICAL SCIENCE\nAND TECHNOLOGY TRIVANDRUM DATED\n8 .01.2024\n// True Copy // PA To Judge\n\n"
}