{
    "case_id": "Crl.MC.No. 8546 of 2017 ()",
    "court": "HIGH COURT OF KERALA AT ERNAKULAM\nPRESENT",
    "date": "8 day of December, 2017",
    "judge": "B.KEMAL PASHA",
    "petitioners": [
        "MC.No",
        "AGED 26 YEARS, S/O.MOIDU,",
        "J.\nCril",
        "RESIDING AT PUTHIYOTTIL,",
        "KUTTIYADI, KOILANDI TALUK,",
        "ABDUL JALEEL,",
        "KOILANDI",
        "KELOTH HOUSE, MUTHUVANNACHA P.O,",
        "ACCUSED:",
        "KOZHIKODE DISTRICT."
    ],
    "respondents": [
        "STATE OF KERALA,",
        "REPRESENTED BY PUBLIC PROSECUTOR",
        "R BY PUBLIC PROSECUTOR SMT .SHEEBA",
        ":",
        "HIGH COURT OF KERALA, ERNAKULAM - 682 031."
    ],
    "sections": [],
    "outcome": "This Crl.M.C.is allowed",
    "full_text": "Berl\npee\nPlz a ielt 4\n2017/KER/49784\nIN THE HIGH COURT OF KERALA AT ERNAKULAM\nPRESENT:\nTHE HONOURABLE MR. JUSTICE B.KEMAL PASHA\nFRIDAY, THE 8TH DAY OF DECEMBER 2017/17TH AGRAHAYANA, 1939\nCr1.MC.No. 8546 of 2017 ()\nLP 10/2017 OF ASSISTANT ADDITIONAL SESSIONS COURT, KOZHIKODE (II-A\nSUB) , KOZHIKODE\nCRIME NO. 566/2012 OF PERAMBRA POLICE STATION, KOZHIKODE\nPETITIONER/ACCUSED:\nABDUL JALEEL,\nAGED 26 YEARS, S/O.MOIDU,\nRESIDING AT PUTHIYOTTIL,\nKELOTH HOUSE, MUTHUVANNACHA P.O,\nKUTTIYADI, KOILANDI TALUK,\nKOZHIKODE DISTRICT.\nBY ADVS.SRI.J.R.PREM NAVAZ\nSRI.P.T.SHEEJISH\nRESPONDENT :\nSTATE OF KERALA,\nREPRESENTED BY PUBLIC PROSECUTOR\nHIGH COURT OF KERALA, ERNAKULAM - 682 031.\nR BY PUBLIC PROSECUTOR SMT .SHEEBA\nTHIS CRIMINAL MISC. CASE HAVING COME UP FOR ADMISSION ON\n08-12-2017, THE COURT ON THE SAME DAY PASSED THE FOLLOWING:\n\njo e340)\nE es Prt\nElz i tt aH\n2017/KER/49784\nCrl.MC.No. 8546 of 2017 ()\nAPPENDIX\nPETITIONER(S)'S EXHIBITS:\nANNEXUR A: THE TRUE COPY OF THE MARRIAGE INVITATION LETTER OF THE\nPETITIONER.\nRESPONDENT'S EXHIBITS: NIL\nTRUE COPY\nPA TO JUDGE\nScl.\n\nBISA\n2017/KER/49784\nB. KEMAL PASHA, J.\nCril.M.C. No. 8546 of 2017\nDated this the 8 day of December, 2017\nORDER\nIn case of surrender the petitioner before the court below\nwithin 15 days from today, the court below shall consider and\ndispose of the application seeking bail that may be filed by the\npetitioner with advance notice to the learned Public Prosecutor\nin charge of the case, preferably on the same day itself.\nThis Crl.M.C.is allowed as above.\nSd/-\nB.KEMAL PASHA\nJUDGE\nScl/08.12.2017\n\n"
}