{
    "case_id": "Crl.MC.No. 8315 of 2018",
    "court": "HIGH COURT OF KERALA AT ERNAKULAM\nPRESENT\nTHE HONOURABLE MR",
    "date": "2019",
    "judge": "K.ABRAHAM MATHEW",
    "petitioners": [
        "S:",
        "2 ROKKI.V.S.",
        "S/O.STEPHAN, VALIYAVEETIL, PALLIPURAM P.O.,",
        "S/O.SANTHOSH, PARUTHIYEZHATHU HOUSE,",
        "Sd/-\nK.ABRAHAM MATHEW",
        "AGED 19 YEARS",
        "S/O.VIJAYAN, THUNDATHIL HOUSE, PALLIPURAM",
        "MC.No",
        "S/O.DILEEP, THAIYIL HOUSE, CONVENT BEACH,",
        "KOCHI TALUK",
        "AGED 20 YEARS",
        "P.O., ERNAKULAM DISTRICT, PIN-683 515.",
        "S/O.GIREESH, PATHAYAPURAKKAL HOUSE, PALLIPURAM",
        "4 UNNI.P.S.",
        "PALLIPURAM P.O., HRNAKULAM DISTRICT, PIN-683",
        "ERNAKULAM DISTRICT, PIN-683 515.",
        "PALLIPURAM P.O., ERNAKULAM DISTRICT, PIN-683",
        "5 VIVEK.T.V.",
        "3 RAHUL.P.G.",
        "1 SAAHIL T.D.",
        "515.",
        "AGED 21 YEARS"
    ],
    "respondents": [
        "S:",
        "2 SARATH KUMAR,",
        "ADDL. VINU, AGED 21, S/O KALAPANI, MADATHITHARA",
        "ERNAKULAM DISTRICT, PIN-",
        "NORTH PARAUR — 683522",
        "ADDL. AKSHY O.M. AGED 19, S/O MANIKUTTAN,",
        "ADDL.R3 & ADDL.R4 ARE IMPLEADED AS PER ORDER",
        "DATED 04.01.2019 IN CRL.M.A NO.1/2018",
        "R3 HOUSE, KUNJITHAI DESOM, CHITTATTUKARA VILLAGE,",
        "1 STATE OF KERALA",
        "AGED 22 YEARS, S/O.UNNIKRISHNAN, KOLOTHUPARAMB",
        "REPRESENTING SUB INSPECTOR OF POLICE,",
        "HOSUE, KEDAMANGALAM P.O., NORTH PARAVUR,",
        "NJARAKKAL POLICE STATION THROUGH THE PUBLIC",
        "R4 OLATTUPURAM HOUSE, CHERATI P.O., PALLIPPURAM",
        "VILLAGE, KOCHI TALUK, PIN — 683 514",
        "PROSECUTOR, HIGH COURT OF KERALA, ERNKAULAM."
    ],
    "sections": [
        "482",
        "143",
        "149",
        "308",
        "147",
        "326",
        "324",
        "148",
        "144"
    ],
    "outcome": "criminal case may be quashed",
    "full_text": "meee\nrca ay\n2019/KER/347\nIN THE HIGH COURT OF KERALA AT ERNAKULAM\nPRESENT\nTHE HONOURABLE MR. JUSTICE K.ABRAHAM MATHEW\nFRIDAY, THE O4TH DAY OF JANUARY 2019 / 14TH POUSHA, 1940\nCrl1.MC.No. 8315 of 2018\nCRIME NO. 1284/2018 OF MUNAMBOM POLICE STATION, ERNAKULAM\nPETITIONER/S:\n1 SAAHIL T.D.\nAGED 20 YEARS\nS/O.DILEEP, THAIYIL HOUSE, CONVENT BEACH,\nPALLIPURAM P.O., ERNAKULAM DISTRICT, PIN-683\n515.\n2 ROKKI.V.S.\nAGED 20 YEARS\nS/O.STEPHAN, VALIYAVEETIL, PALLIPURAM P.O.,\nERNAKULAM DISTRICT, PIN-683 515.\n3 RAHUL.P.G.\nAGED 19 YEARS\nS/O.GIREESH, PATHAYAPURAKKAL HOUSE, PALLIPURAM\nP.O., ERNAKULAM DISTRICT, PIN-683 515.\n4 UNNI.P.S.\nAGED 19 YEARS\nS/O.SANTHOSH, PARUTHIYEZHATHU HOUSE,\nPALLIPURAM P.O., HRNAKULAM DISTRICT, PIN-683\n515.\n5 VIVEK.T.V.\nAGED 21 YEARS\nS/O.VIJAYAN, THUNDATHIL HOUSE, PALLIPURAM\nP.O., ERNAKULAM DISTRICT, PIN-683 515.\n\n|\npanier Lt\nrca ay\n2019/KER/347\nCrl.MC.No. 8315 of 2018\n6 MIDHUN UNNIKRISHNAN\nAGED 21 YEARS\nS/O.UNNIKRISHNAN, CHEKKANGATTU HOUSE,\nPALLIPURAM P.O., ERNAKULAM DISTRICT, PIN-683\n515.\n7 ASHIK.T.J.\nAGED 19 YEARS\nS/O.JOHNSON, THAADALIPARAMBIL HOUSE,\nPALLIPURAM P.O., ERNAKULAM DISTRICT, PIN-683\n515.\n8 RAHUL JOHNSON\nAGED 20 YEARS\nS/O. JOHNSON, ARAKKAI HOUSE, PALLIPURAM P.O.,\nERNAKULAM DISTRICT, PIN-683 515.\n9 MANU @ IMMANUEL SEBASTIAN\nAGED 19 YEARS\nS/O.SEBASTIAN, ARAKKAL HOUSE, PALLIPURAM P.O.,\nERNAKULAM DISTRICT, PIN-683 515.\n10 ABRUDESON ,\nAGED 18 YEARS\nS/O.SABU, KALLARAKKAL HOUSE, CONVENT BEACH,\nPALLIPURAM P.O., ERNAKULAM DISTRICT, PIN-683\n515.\n11 YESUDASAN\nAGED 18 YEARS\nS/O.SEBASTIAN, PAALAKKAL HOUSE, CONVENT BEACH,\nPALLIPURAM P.O., ERNAKULAM DISTRICT, PIN-683\n515.\n12 JUSVIN @ SURAJ\nAGED 19 YEARS\nS/O.BENADICT, THANNIPILLY HOUSE, CONVENT\nBEACH, PALLIPURAM P.O., ERNAKULAM DISTRICT,\nPIN-683 515.\nBY ADVS.\nSRI.T.N.SURESH\nSMT.A.S.CHINJU DUTH\nSMT .DHANUJA VETTATHU\nSRI.V.S.ANU MON\n\n|\npanier Lt\nrca ay\n2019/KER/347\nCrl.MC.No. 8315 of 2018\nRESPONDENT/S:\n1 STATE OF KERALA\nREPRESENTING SUB INSPECTOR OF POLICE,\nNJARAKKAL POLICE STATION THROUGH THE PUBLIC\nPROSECUTOR, HIGH COURT OF KERALA, ERNKAULAM.\n2 SARATH KUMAR,\nAGED 22 YEARS, S/O.UNNIKRISHNAN, KOLOTHUPARAMB\nHOSUE, KEDAMANGALAM P.O., NORTH PARAVUR,\nERNAKULAM DISTRICT, PIN-\nADDL. VINU, AGED 21, S/O KALAPANI, MADATHITHARA\nR3 HOUSE, KUNJITHAI DESOM, CHITTATTUKARA VILLAGE,\nNORTH PARAUR — 683522\nADDL. AKSHY O.M. AGED 19, S/O MANIKUTTAN,\nR4 OLATTUPURAM HOUSE, CHERATI P.O., PALLIPPURAM\nVILLAGE, KOCHI TALUK, PIN — 683 514\nADDL.R3 & ADDL.R4 ARE IMPLEADED AS PER ORDER\nDATED 04.01.2019 IN CRL.M.A NO.1/2018\nBY ADV. SMT.MINI.V.A.\nOTHER PRESENT:\nSRI ALEX M THOMBRA-SR PP\nTHIS CRIMINAL MISC. CASE HAVING COME UP FOR ADMISSION ON\n04.01.2019, THE COURT ON THE SAME DAY PASSED THE\nFOLLOWING:\n\n2019/KER/347\nCrl.MC.No. 8315 of 2018\n14..\nORDER\nPetition filed under Section 482 Cr.P.C.\n\n2. Petitioners are the accused in Crime No. 1284\nof 2018 of Munambam Police Station registered\nfor the offences under Sections 143, 144, 147,\n148, 308, 324, 326 & 452 r/w Section 149 of\nthe Indian Penal Code. Respondents 2 to 4 are\nthe victims. It is submitted that the matter\nhas been settled and the proceedings in the\ncriminal case may be quashed.\n\n3. Heard the learned counsel for the petitioners\nand respondents 2 to 4 and the learned Public\nProsecutor.\n\n4. I have perused the affidavits filed by\nrespondents 2 to 4, who have entered\nappearance through counsel. I am satisfied\nthat the allegation of settlement is true and\nno public interest is involved. There is no\n\n2019/KER/347\nCrl.MC.No. 8315 of 2018\n1.5e.\nimpediment for granting the prayer of the\npetitioners.\nIn the result, this Crl.M.C. is allowed. The\nproceedings in Crime No. 1284 of 2018 of\nMunambam Police Station are quashed. The\nlearned magistrate may pass appropriate orders\nfor the disposal of the material objects, if\nany, produced in the case.\nSd/-\nK.ABRAHAM MATHEW\nJUDGE\nBka/05.01.2019\n\nfel BES\nrca ay\n2019/KER/347\nCrl.MC.No. 8315 of 2018\nAPPENDIX\nPETITIONER'S/S EXHIBITS:\nANNEXURE A-1: THE CERTIFIED COPY OF THE FI STATEMENT\nAND FIR IN CRIME NO.1284/.2018 OF\nMUNAMBAM POLICE.\nANNEXURE A-2: THE TRUE COPY OF THE AFFIDAVIT SWORN\nBY THE 2ND RESPONDENT.\nANNEXURE A-3 ORIGINAL AFFIDAVIT VOLUNTARILY SWORN\nBY THE 3RD RESPONDENT\nANNEXURE A-4 ORIGINAL AFFIDAVIT VOLUNTARILY SWORN\nBY THE 4 TH RESPONDENT\n\n"
}