{
    "case_id": "CrL.MC.No. 5 of 2014",
    "court": "HIGH COURT OF KERALA AT ERNAKULAM\nPRESENT",
    "date": "THE 2ND DAY",
    "judge": "HARUN-UL-RASHID",
    "petitioners": [
        "1. MUHAMMED FAISAL AGED 28 YEARS",
        "2. ABDUL SATHAR AGED 58 YEARS",
        "KUDLU VILLAGE, KASARAGOD TALUK, KASARAGOD DISTRICT.",
        "JOSEPH\nR2",
        "S/O.ABDUL SATHAR, RESIDING AT BAITHUL AJPATH",
        "S/O.MUHAMMED, RESIDING AT BAITHUL AJPATH, ISATH NAGAR",
        "KASARAGOD DISTRICT.",
        "ISATH NAGAR, KUDLU VILLAGE, KASARAGOD TALUK",
        "MELPARAMBA",
        "S/ACCUSED 1 AND 2:"
    ],
    "respondents": [
        "R2 BY PUBLIC PROSECUTOR SMT.SAREENA GEORGE",
        "REPRESENTED BY THE PUBLIC PROSECUTOR",
        "R1 BY ADV.SMT.BINDUMOL JOSEPH",
        "S/DEFACTO COMPLAINANT & STATE :",
        "2. THE STATE OF KERALA",
        "KASARAGOD POLICE STATION",
        "KASARAGOD DISTRICT 671317",
        "THROUGH THE STATION HOUSE OFFICER",
        "HIGH COURT OF KERALA, ERNAKULAM - 682 031.",
        "1. FASEELA, AGED 24 YEARS",
        "MELPARAMBA, KALANAD PO, KASARAGOD TALUK",
        "D/O.BASHEER, NOW RESIDING ATKAINOTH"
    ],
    "sections": [
        "323",
        "498(A)",
        "324 read with Section 34 of IPC"
    ],
    "outcome": "Cri.M.C is disposed",
    "full_text": "para\noes cre oH\n2014/KER/201\nIN THE HIGH COURT OF KERALA AT ERNAKULAM\nPRESENT:\nTHE HONOURABLE MR.JUSTICE HARUN-UL-RASHID\nTHURSDAY, THE 2ND DAY OF JANUARY 2014/12TH POUSHA, 1935\nCrL.MC.No. 5 of 2014 0\nCC 374/2013 of CHIEF JUDICIAL MAGISTRATE COURT, KASARAGOD\nCRIME NO. 359/2011 OF KASARAGOD POLICE STATION , KASARGOD\nPETITIONERS/ACCUSED 1 AND 2:\n1. MUHAMMED FAISAL AGED 28 YEARS\nS/O.ABDUL SATHAR, RESIDING AT BAITHUL AJPATH\nISATH NAGAR, KUDLU VILLAGE, KASARAGOD TALUK\nKASARAGOD DISTRICT.\n2. ABDUL SATHAR AGED 58 YEARS\nS/O.MUHAMMED, RESIDING AT BAITHUL AJPATH, ISATH NAGAR\nKUDLU VILLAGE, KASARAGOD TALUK, KASARAGOD DISTRICT.\nBY ADV.SRI.T.MADHU\nRESPONDENTS/DEFACTO COMPLAINANT & STATE :\n1. FASEELA, AGED 24 YEARS\nD/O.BASHEER, NOW RESIDING ATKAINOTH\nMELPARAMBA, KALANAD PO, KASARAGOD TALUK\nKASARAGOD DISTRICT 671317\n2. THE STATE OF KERALA\nTHROUGH THE STATION HOUSE OFFICER\nKASARAGOD POLICE STATION\nREPRESENTED BY THE PUBLIC PROSECUTOR\nHIGH COURT OF KERALA, ERNAKULAM - 682 031.\nR1 BY ADV.SMT.BINDUMOL JOSEPH\nR2 BY PUBLIC PROSECUTOR SMT.SAREENA GEORGE\nTHIS CRIMINAL MISC. CASE HAVING COME UP FOR ADMISSION ON\n02-01-2014, THE COURT ON THE SAME DAY PASSED THE FOLLOWING:\n\nElser\noe: are aH\n2014/KER/201\nCrLMC.No. 5 of 2014 (\nAPPENDIX\nPETITIONER(S) EXHIBITS :\nANNX.A1 - THE TRUE CERTIFIED COPY OF THE FIR IN CRIME NO.359/2011 OF\nKASARAGOD POLICE STATION.\nANNX.A2 - THE TRUE CERTIFIED COPY OF THE FINAL REPORT IN CRIME\nNO.359/2011 OF KASARAGOD POLICE STATION.\nANNX.A3 - THE AFFIDAVIT DATED 22-10-2013 SWORN IN BY THE 1ST\nRESPONDENT.\nRESPONDENT(S)' EXHIBITS : NIL\n/TRUE COPY/\nPATO JUDGE\nAV\n\nan\nHARUN-UL-RASHID, J. 2014/KER/201\nDated this the 2\" day of January, 2014\nORDER\n\nHeard the learned counsel for the petitioners and respondents.\n\n2. Accused Nos.1 & 2 in Crime No.359/2011 of the Kasaragod\nPolice Station now pending as C.C.No.374/2013 before the Chief\nJudicial Magistrate Court, Kasaragod are the petitioners. The\npetition is filed seeking to quash further proceedings against the\npetitioners in C.C.No.374/2013 on the file of the Chief Judicial First\nClass Magistrate Court, Kasaragod.\n\n3. The offences alleged are punishable under Sections 498(A),\n323, 324 read with Section 34 of IPC.\n\n4. The learned counsel on both sides submit that the dispute\nbetween the parties have been amicably settled and having regard\nto the resolution of the disputes between the parties, continuance of\nthe criminal prosecution against the petitioners is an avoidable\nirritant.\n\nIn view of the settlement arrived at between the parties, the\nCri.M.C is disposed of quashing further proceedings against the\npetitioners in C.C.No.374/2013 on the file of the Chief Judicial First\nClass Magistrate Court, Kasaragod.\n\nSd/-\nHARUN-UL-RASHID, JUDGE.\nAV\n\n"
}