{
    "case_id": "",
    "court": "HIGH COURT OF KERALA AT ERNAKULAM\nPRESENT\nTHE HONOURABLE MRS",
    "date": "2024",
    "judge": "SOPHY THOMAS",
    "petitioners": [
        "AGED 46 YEARS",
        "EDARIKKODE P.O., TIRUR TALUK, MALAPPURAM",
        "S/O. BEERAN EDAVATH, EDAVATH HOUSE, KLARI SOUTH,",
        "DISTRICT, PIN - 676501",
        "THOMAS",
        "Judicial Magistrate",
        "MANSOOR ALI AHAMMED",
        "EDAVATH HOUSE"
    ],
    "respondents": [
        "MALAPPURAM DISTRICT, PIN — 676503",
        "PIN —- 673006",
        "REGIONAL PASSPORT OFFICE, ERANHIPALAM, KOZHIKODE,",
        "1 STATE OF KERALA",
        "KOTTAKKAL POLICE STATION, KOTTAKKAL P.O.,",
        "S :",
        "2 THE STATION HOUSE OFFICER",
        "REPRESENTED BY PUBLIC PROSECUTOR, HIGH COURT OF",
        "3 THE REGIONAL PASSPORT OFFICER",
        "KERALA, ERNAKULAM, KOCHI, PIN —- 682031"
    ],
    "sections": [
        "482",
        "406",
        "498A",
        "34"
    ],
    "outcome": "order dated 6.1.2024, the learned Magistrate granted",
    "full_text": "ae\nEleaaaert\n2024/KER/3552\nCrl.M.C.No.522 of 2024 1\nIN THE HIGH COURT OF KERALA AT ERNAKULAM\nPRESENT\nTHE HONOURABLE MRS. JUSTICE SOPHY THOMAS\nTHURSDAY, THE 1st pay OF JANUARY 2024 / 28TH POUSHA, 1945\nCRL.MC NO. 522 OF 2024\nAGAINST THE ORDER IN CC 1141/2020 OF JUDICIAL MAGISTRATE\nOF FIRST CLASS ,MALAPPURAM\nPETITIONER:\nMANSOOR ALI AHAMMED\nAGED 46 YEARS\nS/O. BEERAN EDAVATH, EDAVATH HOUSE, KLARI SOUTH,\nEDARIKKODE P.O., TIRUR TALUK, MALAPPURAM\nDISTRICT, PIN - 676501\nBY ADV K.RAKESH\nRESPONDENTS :\n1 STATE OF KERALA\nREPRESENTED BY PUBLIC PROSECUTOR, HIGH COURT OF\nKERALA, ERNAKULAM, KOCHI, PIN —- 682031\n2 THE STATION HOUSE OFFICER\nKOTTAKKAL POLICE STATION, KOTTAKKAL P.O.,\nMALAPPURAM DISTRICT, PIN — 676503\n3 THE REGIONAL PASSPORT OFFICER\nREGIONAL PASSPORT OFFICE, ERANHIPALAM, KOZHIKODE,\nPIN —- 673006\nBY PP-SRI.PRASANTH M.P.\nTHIS CRIMINAL MISC. CASE HAVING COME UP FOR ADMISSION\nON 18.01.2024, THE COURT ON THE SAME DAY PASSED THE\nFOLLOWING:\n\n2024/KER/3552\nCrl.M.C.No.522 of 2024 2\nSOPHY THOMAS, J.\n\"Dated this the 18\" day of January, 2024.\nORDER\n\nThis Crl.M.C. under Section 482 of Cr.P.C. is filed\nat the instance of the sole accused in C.C. No.1141 of\n2021 on the file of Chief Judicial Magistrate of First Class,\nMalappuram, to direct the learned Magistrate to enlarge\nthe validity of passport stipulated in Annexure B order\ndated 6.1.2024 by three years.\n\n2. Learned counsel for the petitioner would\ncontend that the petitioner was facing the trial for\noffences punishable under Section 406 and 498A read\nwith Section 34 of the Indian Penal Code. He filed C.M.P.\nNo.30 of 2024 before the learned Magistrate for renewing\nhis passport for a period of three years for the purpose of\ngoing abroad for employment. But as per Annexure B\n\nsae\nBla\n2024/KER/3552\nCrl.M.C.No.522 of 2024 3\norder dated 6.1.2024, the learned Magistrate granted\npermission for renewal and to obtain a new passport valid\nfor one year only. According to the petitioner, he is\nintending to go to Europe, for which, he should have a\npassport valid for minimum three years. But the learned\nMagistrate overlooked that fact, and granted permission\nfor renewal and to get a new passport, valid for one year\nonly.\n\n3. Heard learned counsel for the petitioner and\nlearned Public Prosecutor.\n\n4. Based on the facts pleaded and the purpose of\nthe petition, this Court is inclined to allow this Crl.M.C.,\ndirecting the JFCM, Malappuram to revisit his order dated\n6.1.2024 in C.M.P.No.30 of 2024 and to pass appropriate\norders, taking note of the purpose for which the renewal\nof the passport was asked for, within a period of one\nweek from the date of receipt of a copy of this order. The\nRegistry of this Court is directed to forward a copy of this\n\n=\niano\n2024/KER/3552\nCrl.M.C.No.522 of 2024 4\norder to the JFCM, Malappuram, for compliance.\nWith these directions, the Crl.M.C. stands allowed.\nSd/-\nSOPHY THOMAS,\nJUDGE\n\nsmv\n\n=\ny ria\nBet\n2024/KER/3552\nCrl.M.C.No.522 of 2024 5\nAPPENDIX OF CRL.MC 522/2024\nPETITIONER’ S ANNEXURES\nAnnexure A A TRUE COPY OF THE APPLICATION SUBMITTED BY THE\nPETITIONER DATED 5-1-2024 AS C.M.P.NO.30/2024\nAnnexure B CERTIFIED COPY OF THE ORDER DATED 6-1-2024\nPASSED BY J.F.C.M, MALAPPURAM IN\nC.M.P.NO.30/2024 IN C.C.NO.1141/2020\nAnnexure C A TRUE COPY OF THE ORDER IN CRL.M.C.319/2024 OF\nTHIS HON'BLE COURT DATED 12-01-2024\n\n"
}