{
    "case_id": "CRL.MC.NO. 8791 OF 2019",
    "court": "HIGH COURT OF KERALA AT ERNAKULAM\nPRESENT\nTHE HONOURABLE MR",
    "date": "06 day of January, 2020",
    "judge": "Bl Lee\nBe",
    "petitioners": [
        "AGED 24 YEARS,",
        "Rl C.S.HRITHWIK-SR.P.P",
        "SOUTH KONAM, ERNAKULAM-06",
        "S/O.M.S.KOCHANIYAN, RESIDING AT MOOLE PARAMBIL HOUSE,",
        "Ernakulam",
        "1 VINEETH,",
        "3 JESLIN JOSEPH,",
        "KONAM ROAD",
        "PETER",
        "NEAR VVLP SCHOOL KONAM, PALLURUTHY.P.O, PERUMBADAPPU",
        "S/O.SENSILA VOOS, RESIDING AT KUZHIVILI HOUSE,",
        "JOSEPH",
        "PALLURUTHY.P.O, PERUBADAPPU SOUTH KONAM,",
        "2 SHYAM KUMAR,",
        "AGED 23 YEARS,",
        "AGED 25 YEARS,",
        "06",
        "PALLURUTHY.P.O., PERUMBADAPPU SOUTH KONAM, ERNAKULAM-",
        "ERNAKULAM-06",
        "$/O.THILAKAN, RESIDING AT KALATHIPARAMBIL HOUSE,",
        "S/ACCUSED 1 TO 3:"
    ],
    "respondents": [
        "S:",
        "3 ALDRIN ANTONY,",
        "S/O. PETER",
        "P.O, PERUMPADAPPY SOUTH KONAM, ERNAKULAM-06",
        "AGED 22 YEARS,",
        "2 TIBIN PETER,",
        "HIGH COURT OF KERALA, ERNAKULAM PIN-682 031",
        "Kochi",
        "Pease",
        "1 STATE OF KERALA,",
        "REPRESENTED BY PUBLIC PROSECUTOR,",
        "RESIDING AT PULIVEZH HOUSE, KONAM ROAD, PALLURUTHY"
    ],
    "sections": [
        "323",
        "482",
        "341",
        "324",
        "294(b) read with Section 34 of the IPC"
    ],
    "outcome": "/JUDGMENT IN CC.NO.173/2019 OF JUDICIAL\nMAGISTRATE OF FIRST CLASS -II, KOCHI\nCRIME NO.40/2019 OF Palluruthy Police Station , Ernakulam\nNAME AND ADDRESS OF THE PETITIONERS/ACCUSED 1 TO 3:\n1 VINEETH,\nAG",
    "full_text": "Bl Lee\nBe\n2020/KER/191\nIN THE HIGH COURT OF KERALA AT ERNAKULAM\nPRESENT\nTHE HONOURABLE MR. JUSTICE ASHOK MENON\nMONDAY, THE O6TH DAY OF JANUARY 2020 / 16TH POUSHA, 1941\nCri1.MC.No.8791 OF 2019 (H)\nAGAINST THE ORDER/JUDGMENT IN CC.NO.173/2019 OF JUDICIAL\nMAGISTRATE OF FIRST CLASS -II, KOCHI\nCRIME NO.40/2019 OF Palluruthy Police Station , Ernakulam\nNAME AND ADDRESS OF THE PETITIONERS/ACCUSED 1 TO 3:\n1 VINEETH,\nAGED 24 YEARS,\n$/O.THILAKAN, RESIDING AT KALATHIPARAMBIL HOUSE,\nPALLURUTHY.P.O, PERUBADAPPU SOUTH KONAM,\nERNAKULAM-06\n2 SHYAM KUMAR,\nAGED 23 YEARS,\nS/O.M.S.KOCHANIYAN, RESIDING AT MOOLE PARAMBIL HOUSE,\nPALLURUTHY.P.O., PERUMBADAPPU SOUTH KONAM, ERNAKULAM-\n06\n3 JESLIN JOSEPH,\nAGED 25 YEARS,\nS/O.SENSILA VOOS, RESIDING AT KUZHIVILI HOUSE,\nNEAR VVLP SCHOOL KONAM, PALLURUTHY.P.O, PERUMBADAPPU\nSOUTH KONAM, ERNAKULAM-06\nBY ADVS.\nSHRI .MITHUN P.\nSMT .PARVATHY S.KRISHNAN\nNAME AND ADDRESS OF THE RESPONDENTS:\n1 STATE OF KERALA,\nREPRESENTED BY PUBLIC PROSECUTOR,\nHIGH COURT OF KERALA, ERNAKULAM PIN-682 031\n2 TIBIN PETER,\nAGED 22 YEARS,\nS/O. PETER\nRESIDING AT PULIVEZH HOUSE, KONAM ROAD, PALLURUTHY\nP.O, PERUMPADAPPY SOUTH KONAM, ERNAKULAM-06\n3 ALDRIN ANTONY,\n\nBe\n\nCRL.MC.NO. 8791 OF 2019 2 2020/KER/191\n\nAGED 21 YEARS,\n\nS/O.ANTONY, RESIDING AT PALLI PARAMBIL, CULTUS\n\nROAD, PALLURUTHY.P.O, PERUMBADAPPU, ERNAKULAM-06\n\n4 TENNISON,\n\nAGED 23 YEARS,\n\nS/O.JOSEPH, RESIDING AT PUTHENPURAKKAL HOUSE,\n\nPERUMPADAPPU, ERNAKULAM DISTRICT, PIN-682,006\n\nRl C.S.HRITHWIK-SR.P.P\n\nR2-4 BY ADV. SHRI.RAIEEZ M ASHRAF\n\nTHIS CRIMINAL MISC. CASE HAVING COME UP FOR ADMISSION ON\n\n06.01.2020, THE COURT ON THE SAME DAY PASSED THE FOLLOWING:\n\n_\nCRL.MC.NO. 8791 OF 2019 3 2020/KER/191\nORDER\nDated this the 06 day of January, 2020\n\nThe petitioners are accused in C.C.No. 173/2019 on\nthe files of the Judicial First Class Magistrate Court Il, Kochi for\nhaving allegedly committed offences punishable under Sections\n341, 323, 324 and 294(b) read with Section 34 of the IPC. The\ndefacto complainant and injured are respondents 2 to 4 who\nhave appeared through counsel and filed affidavits to the effect\nthat the matter has been amicably settled with the petitioners\nand that they have no grievance against them. A report has\nbeen submitted by the Investigating Officer through the learned\nSenior Public Prosecutor to the said effect. The petitioners do\nnot have any criminal antecedents.\n\nIn the result, the Crl.MC is allowed and the entire\nproceedings as against the petitioners in C.C.No.173/2019 on\nthe files of the Judicial First Class Magistrate Court Il, Kochi\nstands quashed under Section 482 of the Cr.P.C and the accused\nare discharged.\n\nSd/-\nASHOK MENON\nJUDGE\nasm\n\nPease eet\nBy\nCRL.MC.NO. 8791 OF 2019 4 2020/KER/191\nAPPENDIX\nEXHIBITS:\nANNEXURE Al THE CERTIFIED COPY OF THE FINAL\nREPORT/CHARGE SHEET, IN CRIME\nNO.40/2019 OF PALLURUTHY KAASABA POLICE\nSTATION ERNARULAM DISTRICT.\nANNEXURE A2 THE AFFIDAVIT, SOLEMNLY AFFIRMED BY THE\n2ND RESPONDENT/DEFACTO COMPLAINANT.\nANNEXURE A3 THE AFFIDAVIT, SOLEMNLY AFFIRMED BY THE\n3RD RESPONDENT/DEFACTO COMPLAINANT.\nANNEXURE A4 THE AFFIDAVIT, SOLEMNLY AFFIRMED BY THE\n4TH RESPONDENT/DEFACTO COMPLAINANT.\n//True Copy// PA to Judge\n\n"
}