{
    "case_id": "Crl.MC.No.4927 OF 2019 (E)",
    "court": "HIGH COURT OF KERALA AT ERNAKULAM\nPRESENT\nTHE HONOURABLE MR",
    "date": "2020",
    "judge": "Pirie El\nEl",
    "petitioners": [
        "Kasaragod",
        "C.S.HRITHWIK",
        "ACCUSED :",
        "KASARAGOD DISTRICT.",
        "AYAMBARA ROAD, PERIA VILLAGE, HOSDURG TALUK,",
        "KAPPANAKKAL HOUSE",
        "SATHEESHAN .M",
        "K.P.ANTONY BINU\nSRI",
        "S/O. NARAYANAN, KAPPANAKKAL HOUSE, KUNIYA",
        "KAPPANAKKAL",
        "AGED 34 YEARS"
    ],
    "respondents": [
        "NEAR PLYWOOD COMPANY, KUNIYA, PERIA VILLAGE,",
        "S/O. NARAYANAN, R./AT KAPPANAKKAL,",
        "REPRESENTED BY THE PUBLIC PROSECUTOR,",
        "S/STATE/DE FACTO COMPLAINANT:",
        "1 STATE OF KERALA",
        "R2 BY ADV. K.P.ANTONY BINU",
        "2 BHARATHAN,",
        "HIGH COURT OF KERALA, ERNAKULAM 682 031",
        "HOSDURG TALUK, KASARAGOD DISTRICT 671 315",
        "AGED 44 YEARS"
    ],
    "sections": [
        "323",
        "482",
        "341",
        "448",
        "324 r/w Section\n34 of the IPC"
    ],
    "outcome": "/JUDGMENT IN CC 1172/2018 OF JUDICIAL\nMAGISTRATE OF FIRST CLASS -II,HOSDURG\nCRIME NO.483/2011 OF Bekal Police Station , Kasaragod\nPETITIONER/ACCUSED :\nSATHEESHAN .M\nAGED 34 YEARS\nS/O. NARAYANAN, KAPPA",
    "full_text": "Pirie El\nEl? 4 te\n2020/KER/413\nIN THE HIGH COURT OF KERALA AT ERNAKULAM\nPRESENT\nTHE HONOURABLE MR. JUSTICE ASHOK MENON\nTUESDAY, THE 07TH DAY OF JANUARY 2020 / 17TH POUSHA, 1941\nCr1.MC.No.4927 OF 2019 (E)\nAGAINST THE ORDER/JUDGMENT IN CC 1172/2018 OF JUDICIAL\nMAGISTRATE OF FIRST CLASS -II,HOSDURG\nCRIME NO.483/2011 OF Bekal Police Station , Kasaragod\nPETITIONER/ACCUSED :\nSATHEESHAN .M\nAGED 34 YEARS\nS/O. NARAYANAN, KAPPANAKKAL HOUSE, KUNIYA\nAYAMBARA ROAD, PERIA VILLAGE, HOSDURG TALUK,\nKASARAGOD DISTRICT.\nBY ADVS.\nSMT . HEMALATHA\nSRI.BINU GEORGE\nRESPONDENTS/STATE/DE FACTO COMPLAINANT:\n1 STATE OF KERALA\nREPRESENTED BY THE PUBLIC PROSECUTOR,\nHIGH COURT OF KERALA, ERNAKULAM 682 031\n2 BHARATHAN,\nAGED 44 YEARS\nS/O. NARAYANAN, R./AT KAPPANAKKAL,\nNEAR PLYWOOD COMPANY, KUNIYA, PERIA VILLAGE,\nHOSDURG TALUK, KASARAGOD DISTRICT 671 315\nR2 BY ADV. K.P.ANTONY BINU\nSRI. C.S.HRITHWIK, SR.PP\nTHIS CRIMINAL MISC. CASE HAVING COME UP FOR ADMISSION\nON 07.01.2020, THE COURT ON THE SAME DAY PASSED THE\nFOLLOWING:\n\n2020/KER/413\nCrl.MC.No.4927 OF 2019 (E)\n2\nORDER\nDated this the 7th day of January 2020\n\nThe petitioner is the 2™ accused in\nCrime No.483/2011 of Bekal Police Station, for\nhaving allegedly committed offences punishable\nunder Sections 448, 341, 323, 324 r/w Section\n34 of the IPC. There were two more accused and\nthe case against them proceeded and ended in\nacquittal. The petitioner was absconding and\nhence, this case was split up and refiled as\nCC No.1172/2018 on the files of Judicial First\nClass Magistrate-II, Hosdurg.\n\n2. The defacto complainant and injured is\nthe 2™¢ respondent, who has appeared through\ncounsel and filed an affidavit to the effect\nthat the matter has been amicably settled with\nthe petitioner and that he has no grievance\nagainst the petitioner. A report has been\ncalled for from the Investigating Officer\n\n2020/KER/413\nCrl.MC.No.4927 OF 2019 (E)\n3\nthrough the senior Public Prosecutor. The\npetitioner does not have any criminal\nantecedents. There is no public interest\ninvolved.\n\nIn the result the Crl.M.C is allowed, and\nthe entire proceedings against the petitioner\nin CC No.1172/2018 on the file of Judicial\nFirst Class Magistrate-II, Hosdurg, stands\nquashed under Section 482 of the Cr.P.C and the\naccused is discharged.\n\nSd/-\nASHOK MENON\nJUDGE\nSPK\n\nBERET\nPeat\nOE: 4 ie\n2020/KER/413\nCr1.MC.No.4927 OF 2019(E)\n4\nAPPENDIX\nPETITIONER'S/S EXHIBITS:\nANNEXURE Al CERTIFIED COPY OF FIR IN CRIME NO.\n483/2011 OF BEKAL POLICE STATION\nANNEXURE A2 CERTIFIED COPY OF FINAL REPORT IN CRIME\nNO. 483/2011 OF BEKAL POLICE STATION\nANNEXURE A3 AFFIDAVIT DATED 6/07/2019 SWORN BY THE\n2ND RESPONDENT\nRESPONDENT'S/S EXHIBITS: NIL\n//TRUE COPY//\nPA TO JUDGE\n\n"
}