{
    "case_id": "Crl.MC.No. 5744 of 2013 ()",
    "court": "HIGH COURT OF KERALA AT ERNAKULAM\nPRESENT",
    "date": "2014",
    "judge": "and to dispose of the case within a\nperiod of four months from the date of framing the charge.\n\nHARUN-UL-RASHID",
    "petitioners": [
        "MC.No",
        "A3:",
        "HARIKUMAR @ HARI AGED 29 YEARS",
        "$/O.KUNJIKRISHNAN, SHUBHA NIVAS, KODANGAVILA",
        "S.HAMEED\nRESPONDENT",
        "ADDL.CHIEF JUDICIAL\nMAGISTRATE COURT",
        "NEYYATTINKARA TALUK, THIRUVANANTHAPURAM",
        "Blt",
        "ATHIYANOOR WARD, ATHIYANOOR VILLAGE",
        "J.\nCrl"
    ],
    "respondents": [
        "REPRESENTED BY THE DEPUTY POLICE COMMISSIONER",
        "STATE OF KERALA",
        "HIGH COURT OF KERALA, ERNAKULAM",
        "STATE:",
        "THIRUVANANTHAPURAM CITY",
        "REPRESENTED THROUGH PUBLIC PROSECUTOR"
    ],
    "sections": [
        "16",
        "34"
    ],
    "outcome": "/JUDGMENT IN CC 595/2009 of ADDL.CHIEF JUDICIAL\nMAGISTRATE COURT,TRIVANDRUM DATED\nCRIME NO. 598/2009 OF MECICAL COLLEGE POLICE STATION ,\nTHIRUVANANDAPURAM\nPETITIONER/A3:\nHARIKUMAR @ HARI AGED 29 YEARS",
    "full_text": "pee\n\" G \"1\n13:\nBlt a\n2014/KER/58\nIN THE HIGH COURT OF KERALA AT ERNAKULAM\nPRESENT:\nTHE HONOURABLE MR.JUSTICE HARUN-UL-RASHID\nWEDNESDAY, THE 1ST DAY OF JANUARY 2014/11TH POUSHA, 1935\nCr1.MC.No. 5744 of 2013 ()\nAGAINST THE ORDER/JUDGMENT IN CC 595/2009 of ADDL.CHIEF JUDICIAL\nMAGISTRATE COURT,TRIVANDRUM DATED\nCRIME NO. 598/2009 OF MECICAL COLLEGE POLICE STATION ,\nTHIRUVANANDAPURAM\nPETITIONER/A3:\nHARIKUMAR @ HARI AGED 29 YEARS\n$/O.KUNJIKRISHNAN, SHUBHA NIVAS, KODANGAVILA\nATHIYANOOR WARD, ATHIYANOOR VILLAGE\nNEYYATTINKARA TALUK, THIRUVANANTHAPURAM\nBY ADV. SRI.SHAJIN S.HAMEED\nRESPONDENT/STATE:\nSTATE OF KERALA\nREPRESENTED BY THE DEPUTY POLICE COMMISSIONER\nTHIRUVANANTHAPURAM CITY\nREPRESENTED THROUGH PUBLIC PROSECUTOR\nHIGH COURT OF KERALA, ERNAKULAM\nBY PUBLIC PROSECUTOR SMI.S.HYMA\nTHIS CRIMINAL MISC. CASE HAVING COME UP FOR ADMISSION ON\n01-01-2014, THE COURT ON THE SAME DAY PASSED THE FOLLOWING:\n\n| pee ae |\n\" G \"1\nrk :\nBlt a\n2014/KER/58\nCrl.MC.No. 5744 of 2013 ()\nAPPENDIX\nPETITIONERS ANNEXURES\nANNEXURE A COPY OF THE FINAL REPORT IN CRIME NO. 598/2009 OF MEDICAL\nCOLLEGE POLICE STATION\nANNEXURE B COPY OF THE FINAL GRADE REPORT DATED 5/8/2013 ISSUED FROM\nTHE SREE SANKARACHARYA UNIVERSITY OF SANSKRIT, KALADY\nRESPONDENT (S)' EXHIBITS : NIL\n\\\\ TRUE COPY \\\\\nPA TO JUDGE\njm/\n\nise a\n2014/KER/S58\nHARUN-UL-RASHID, J.\nCrl.M.C No.5744 of 2013\nDated this the 01* day of January, 2014.\nORDER\nPetitioner is the third accused in C.C No. 595/2009 on the\nfile of the Additional Chief Judicial Magistrate Court,\nThiruvananthapuram. The offence alleged is punishable under Section\n16 of the Kerala Anti-Social Activities Prevention Act, 2007 and Section\n34 of IPC. The cognizance of the case was taken on 21.12.2009. All the\naccused appeared and took bail on 15.092011. The Crl.M.C is filed\nseeking a direction to the Addl.Chief Judicial Magistrate,\nThiruvananthapuram to expedite the trial in C. C No. 595/2009 and to\ndispose of the same at an earlier date.\n\n2. The Addl. Chief Judicial Magistrate, Thiruvananthapuram in\nthe report dated 18.11.2013 reported that the case is posted to\n18.02.2014 for framing charge that, prosecution has cited 27 witnesses\nin the said case and that four months time is necessary for disposal of\ncase after framing charge.\n\nIn the light of the report, the Crl.M.C is disposed of\ndirecting the Addl.Chief Judicial Magistrate, Thiruvananthapuram to\nexpedite the trial in C.C No. 595/09 and to dispose of the case within a\nperiod of four months from the date of framing the charge.\n\nHARUN-UL-RASHID, JUDGE.\nIsn\n\n"
}