{
    "case_id": "Crl.MC.No. 20 of 2019",
    "court": "HIGH COURT OF KERALA AT ERNAKULAM",
    "date": "2019",
    "judge": "ra Rs",
    "petitioners": [
        "MC.No",
        "Crl",
        "AGED 32 YEARS",
        "KANNUR-670001",
        "DINESH",
        "S/O.THINNAYYA, CHIKKALALE,",
        "CHIKKAMANGALORE, KARNATAKA STATE.",
        "K.ABRAHAM MATHEW"
    ],
    "respondents": [
        "SRI C S HRITHWIK-PUBLIC PROSECUTOR",
        "REPRESENTED BY THE PUBLIC PROSECUTOR,",
        "CIVIL STATION, KANNUR-670001.",
        "S :",
        "1 THE SUB INSPECTOR OF POLICE",
        "3 THE GEOLOGIST,",
        "HIGH COURT OF KERALA ERNAKULAM -682031.",
        "PAYYANNUR POLICE STATION,",
        "2 STATE OF KERALA,",
        "MINING GEOLOGY, DISTRICT OFFICE,",
        "KANNUR DISTRICT-670307."
    ],
    "sections": [
        "22",
        "21",
        "1957"
    ],
    "outcome": "proceedings are sought to be quashed",
    "full_text": "ra Rs lal\na meen\nByer\nIN THE HIGH COURT OF KERALA AT ERNAKULAM 2019/KERI27\nPRESENT\nTHE HONOURABLE MR. JUSTICE K.ABRAHAM MATHEW\nTHURSDAY, THE 03RD DAY OF JANUARY 2019 / 13TH POUSHA, 1940\nCri.MC.No. 20 of 2019\nAGAINST STC 750/2018 of J.M.F.C.,PAYYANNUR\nCRIME NO. 72/2018 of Payyannur Police Station , Kannur\nPETITIONER:\nDINESH\nAGED 32 YEARS\nS/O.THINNAYYA, CHIKKALALE,\nCHIKKAMANGALORE, KARNATAKA STATE.\nBY ADV. SRI.O.D.SIVADAS\nRESPONDENTS :\n1 THE SUB INSPECTOR OF POLICE\nPAYYANNUR POLICE STATION,\nKANNUR DISTRICT-670307.\n2 STATE OF KERALA,\nREPRESENTED BY THE PUBLIC PROSECUTOR,\nHIGH COURT OF KERALA ERNAKULAM -682031.\n3 THE GEOLOGIST,\nMINING GEOLOGY, DISTRICT OFFICE,\nCIVIL STATION, KANNUR-670001.\nSRI C S HRITHWIK-PUBLIC PROSECUTOR\nTHIS CRIMINAL MISC. CASE HAVING BEEN FINALLY HEARD ON 03.01.2019,\nTHE COURT ON THE SAME DAY PASSED THE FOLLOWING:\n\nS\nCrl.MC.No. 20 of 2019 2 201HKER/2T\nORDER\n\nIn STC No.750 of 2018 on the file of the\nJudicial Magistrate of First Class, Payyannur has\ntaken cognizance of the offences under Section\n21 (1) of the Mines and Minerals (Development and\nRegulation) Act 1957 against the petitioner. The\nproceedings are sought to be quashed on the\nground that taking cognizance of the offence on\npolice report is illegal.\n\n2. Heard the learned counsel for the\npetitioner and the learned Public Prosecutor.\n\n3. Section 22 of the Mines and Minerals\n(Development and Regulation) Act 1957 provides\nthat cognizance can be taken only on a complaint\nin writing made by a person authorized in this\nbehalf by the Central Government or the State\nGovernment. The learned Magistrate's taking\ncognizance on police report is illegal. The\norder is liable to be quashed.\n\nCrl.MC.No. 20 of 2019 3 2019/KERI27\nIn the result, this Crl.M.C. is allowed. The\n\nproceedings in STC No.750 of 2018 on the file of\nthe Judicial Magistrate of First Class, Payyannur\nare quashed. This is not a bar for the\nauthorized person to file a complaint if he is so\nadvised.\n\nSd/-\n\nK.ABRAHAM MATHEW\n\nJUDGE\n\nM/03.01.19\n\nra Rs lal\na meen\nmeee\nCrl.MC.No. 20 of 2019 4 2019/KER/27\nAPPENDIX\nPETITIONER'S/S EXHIBITS:\nANNEXURE Al TRUE COPY OF THE GST REGISTRATION\nISSUED M/S. SHA TRADERS AND MINERALS.\nANNEXURE A2 TRUE COPY OF THE TRANSIT PASS ISSUED\nTO THE CONSIGNMENT.\nANNEXURE A3 TRUE COPY OF THE E-WAY BILL GENERATED\nFOR TRANSPORTATION TO KERALA.\nANNEXURE A4 TRUE COPY OF THE FINAL REPORT IN STC\nNO.750 OF 2018 ON THE FILE OF JUDICIAL\nFIRST CLASS MAGISTRATE COURT,\nPAYYANNUR IN CRIME NO. 72/2018 OF\nPAYYANNUR POLICE.\nRESPONDENT'S/S EXHIBITS:\nNIL\nMC\n(TRUE COPY) PA TO JUDGE\n\n"
}