{
    "case_id": "",
    "court": "HIGH COURT OF KERALA AT ERNAKULAM\nPRESENT\nTHE HONOURABLE MR",
    "date": "2020",
    "judge": "KOTTAYAM-686587",
    "petitioners": [
        "S/ACCUSED 1 TO 4:",
        "VAZHAKKALA BHAGAM",
        "JOSE\nS",
        "KOTTAYAM-686572",
        "KOTTAYAM-686583"
    ],
    "respondents": [
        "Kottayam",
        "S/STATE & DEFACTO COMPLAINANT:"
    ],
    "sections": [
        "323",
        "482",
        "341",
        "326 read with Section 34 IPC",
        "294(b)"
    ],
    "outcome": "Petitioners are accused in Crime No.1162/2019 of\nKuravilangadu Police Station for having allegedly\ncommitted offences punishable under Sections 294(b),\n341, 323 and 326 read with Section 34 IPC.\n\n2. T",
    "full_text": "ie eel\nEl ‘ iw\n2020/KER/1355\nIN THE HIGH COURT OF KERALA AT ERNAKULAM\nPRESENT\nTHE HONOURABLE MR. JUSTICE ASHOK MENON\nFRIDAY, THE 10TH DAY OF JANUARY 2020 / 20TH POUSHA, 1941\nCr1.MC.No.8539 OF 2019(F)\nCRIME NO.1162/2019 OF Kuravilangadu Police Station ,\nKottayam\nPETITIONERS/ACCUSED 1 TO 4:\n\n1 GIREESH\nAGED 28 YEARS\nS/O KUNJUMON , KANNALAPARAMBIL HOUSE,\nVATTUKULAM.P.O, KADAPOOR,KOTTAYAM-686587.\n\n2 SANDEEP @ SONUMON,\nAGED 29 YEARS\nS/O SAJEEV,PARAYANATTU HOUSE,\nKOODALLOOR.P.O, KOTTAYAM-686572.\n\n3 ANURAJ P.S,\nAGED 28 YEARS\nS/O SHIVARAMA PERUMAL, PARAYANATTU HOUSE,\nKOODALLOOR.P.O, KOTTAYAM-686587\n\n4 NITHIN GEORGE,\nAGED 28 YEARS\nS/O GEORGE T.M, THOTTIKULANGARA HOUSE , KADAPPOOR\nKARA, VATTUPURA,\nKOTTAYAM-686583.\nBY ADVS.\nSRI.C.¥.VINOD KUMAR\nSRI.P.M.MANASH\n\nRESPONDENTS/STATE & DEFACTO COMPLAINANT:\n\n1 STATE OF KERALA\nREP.BY PUBLIC PROSECUTOR,HIGH COURT OF\nKERALA , ERNAKULAM- 682031.\n\nipsa rl\nEl ‘ iw\n2020/KER/1355\nCrLMC 8539/2019\n2\n2 SUB INSPECTOR OF POLICE\nKURAVILANGADU POLICE STATION,\nKURAVILANGADU , KOTTAYAM- 686633.\n3 ABIN JOSE\nS/O JOSE, AGED 35 YEARS, VADAKKEMATTAPPALLY,\nVAZHAKKALA BHAGAM, KURAVILANGADU , KOTTAYAM-\n686633.\nR3 BY ADV. V.C.MADHAVANKUTTY\nOTHER PRESENT:\nSRI.C.S.HRITHWIK SR PP\nTHIS CRIMINAL MISC. CASE HAVING COME UP FOR ADMISSION\nON 10.01.2020, THE COURT ON THE SAME DAY PASSED THE\nFOLLOWING :\n\nBp stl\n—\n2020/KER/1355\nCrL.MC 8539/2019\n3\nASHOK MENON, J.\n—¢rT.MC No.8539 of 2019\nDated this the 10% day of January, 2020\nORDER\n\nPetitioners are accused in Crime No.1162/2019 of\nKuravilangadu Police Station for having allegedly\ncommitted offences punishable under Sections 294(b),\n341, 323 and 326 read with Section 34 IPC.\n\n2. The only defacto complainant/injured is the\nthird respondent herein. He has appeared through\ncounsel and filed an affidavit to the effect that the\nmatter has been amicably settled with the petitioners\nand that he has no grievance against them. A report to\nthat effect has also been obtained from the\ninvestigating officer through the learned Senior Public\nProsecutor. The petitioners do not have any criminal\nantecedents. No public interest is involved. The\ninjury sustained by the third respondent is not life\nthreatening.\n\nIn the result, the Criminal M.cC. is allowed and\n\n2020/KER/1355\nCr. MC 8539/2019\n4\n\nthe entire proceedings as against the petitioners\nherein in Crime No.1162/2019 of Kuravilangadu Police\nStation shall stand quashed under Section 482 cr.PcC and\nthe petitioners/accused are discharged.\n\nSd/-\n\nASHOK MENON\n\nJUDGE\n\n59\n\nipsa rl\naes a\nEl ‘ iw\n2020/KER/1355\nCrl.MC 8539/2019\n5\nAPPENDIX\nPETITIONER'S/S EXHIBITS:\nANNEXURE Al CERTIFIED COPY OF THE FIR IN CRIME\nNO.1162/19 OF KURAVILANGADU POLICE\nSTATION ON THE FILE OF THE HON'BLE\nJUDICIAL FIRST CLASS MAGISTRATE-\n1,PALA,KOTTAYAM DISTRICT.\nANNEXURE A2 AFFIDAVIT SWORN BY THE 3RD\nRESPONDENT/DEFACTO COMPLAINANT.\n\n"
}