{
    "case_id": "",
    "court": "HIGH COURT OF KERALA AT ERNAKULAM\nPRESENT\nTHE HONOURABLE MRS",
    "date": "2024",
    "judge": "THOMAS",
    "petitioners": [
        "Fes Eel\nTl",
        "PUTHUKKATTU PARFEKUTTY ALIYAR,",
        "PERUMBAVOOR, ERNAKULAM, PIN - 683540.",
        "S/O PAREEKUTTY , ALZARA, PUTHUKKATTU HOUSE, A M ROAD,",
        "AGED 71 YEARS,",
        "ACCUSED NO.5:"
    ],
    "respondents": [
        "Annexure Al COPY",
        "/COMPLAINANT :",
        "STATE OF KERALA",
        "PUBLIC PROSECUTOR SRI.PRASANTH M.P.",
        "Ernakulam",
        "REPRESENTED BY THE PUBLIC PROSECUTOR, HIGH COURT OF",
        "KERALA, ERNAKULAM, PIN - 682031."
    ],
    "sections": [
        "482"
    ],
    "outcome": "2023, this Crl.M.C. is disposed",
    "full_text": "GLa\nae\neae\n2024/KER/4916\nIN THE HIGH COURT OF KERALA AT ERNAKULAM\nPRESENT\nTHE HONOURABLE MRS. JUSTICE SOPHY THOMAS\nMONDAY, THE 22%? pay oF JANUARY 2024 / 2ND MAGHA, 1945\nCRL.MC NO. 652 OF 2024\nCRIME NO.111/2011 OF CBCID, ERNAKULAM, Ernakulam\nSC 682/2023 OF II ADDITIONAL DISTRICT COURT, ERNAKULAM\nCP 36/2022 OF JUDICIAL MAGISTRATE OF FIRST CLASS - I, NORTH\nPARAVUR\nPETITIONER/ACCUSED NO.5:\nPUTHUKKATTU PARFEKUTTY ALIYAR,\nAGED 71 YEARS,\nS/O PAREEKUTTY , ALZARA, PUTHUKKATTU HOUSE, A M ROAD,\nPERUMBAVOOR, ERNAKULAM, PIN - 683540.\nBY ADV P.A.MUJEEB\nRESPONDENT /COMPLAINANT :\nSTATE OF KERALA\nREPRESENTED BY THE PUBLIC PROSECUTOR, HIGH COURT OF\nKERALA, ERNAKULAM, PIN - 682031.\nPUBLIC PROSECUTOR SRI.PRASANTH M.P.\nTHIS CRIMINAL MISC. CASE HAVING COME UP FOR ADMISSION\nON 22.01.2024, THE COURT ON THE SAME DAY PASSED THE\nFOLLOWING:\n\nCrl.M.C.No.652/2024 2 SOD4IKERIMOIG\nORDER\n\nThe petitioner herein is the 5th accused in Crime\nNo.111/CR/EKM/2011, CBCID, Ernakulam, invoking inherent\njurisdiction of this Court under Section 482 of CrP.C. for a\ndirection for an early disposal of SC No.682 of 2023, pending\nbefore the IInd Additional District and Sessions Court,\nErnakulam.\n\n2. Learned counsel for the petitioner would submit that\nthe petitioner is a 71 year old man, and so trial of the case\nhas to be expedited for disposing it on an early date.\n\n3. Learned Public Prosecutor would point out that the\nsessions case is of the year 2023 and so, the trial court may\nnot be able to give an early posting for this case,\nsuperseding the old cases pending consideration of that\ncourt.\n\n4. Since the petitioner is aged 71 years, the trial court\nhas to see whether any priority can be given to that case for\ndisposal on an early date, as he is a senior citizen.\n\neae\nserait\nCrl.M.C.No.652/2024 3 D024/KERIA916\nHence, directing the trial court to consider the request\nof the petitioner (A5) for early disposal of SC No.682 of\n2023, this Crl.M.C. is disposed of.\nSd/-\nSOPHY THOMAS\nJUDGE\nDSV/-\n\nler Fes Eel\nTl.M.C.No.652/2024 4 ani\nC C.No.652/ 2024/KER/4916\nAPPENDIX OF CRL.MC 652/2024\nPETITIONER’ S ANNEXURES :\nAnnexure Al COPY OF THE FINAL REPORT IN S.C.No.682/2023\nBEFORE THE 2ND ADDITIONAL SESSIONS COURT,\nERNAKULAM DATED 08.12.2022.\nAnnexure A2 THE TRUE COPY OF THE MEDICAL CERTIFICATE.\nRESPONDENT’ S ANNEXURES : NIL\n\n"
}