{
    "case_id": "Crl.MC.No.9295 OF 2019(B)",
    "court": "HIGH COURT OF KERALA AT ERNAKULAM",
    "date": "9th day of January, 2020",
    "judge": "Cri .MC.No.9295",
    "petitioners": [
        "RAHUL BHAVAN, MANICKKAL VILLAGE, THIRUVANANTHAPURAM",
        "THIRUVANANTHAPURAM .",
        "KOCHI-682031",
        "S /ACCUSED :",
        "5 SAJAN",
        "SAJAN MANZIL MANICKKAL VILLAGE, THIRUVANANTHAPURAM",
        "4 RAHUL",
        "S/O.SHAJAHAN, SAFA MANZIL, MANICKKAL VILLAGE,",
        "S/O.KRISHNANKUTTY SHYLAJA BHAVAN, THEKKADA VILLAGE",
        "TRIVANDRUM",
        "AGED 25 YEARS",
        "AGED 29 YEARS",
        "AGED 28 YEARS",
        "2 ASHIQ",
        "3 SHAMSEER",
        "THIRUVANANTHAPURAM",
        "1 SYAM,",
        "S/O.BADSHAW, A.N.MANZIL, VEMBAYAN VILLAGE,",
        "AGED 24 YEARS"
    ],
    "respondents": [
        "S/STATE & DEFACTO COMPLAINANTS :",
        "S/O.ABHUL AZEEZ KUNNUVILA PUTHEN VEEDU PONGUMMOODU,",
        "AGED 35 YEARS",
        "1 STATE OF KERALA,",
        "2 ASEEM",
        "KERALA, ERNAKULAM, KOCHI-682031",
        "REPRESENTED BY THE PUBLIC PROSECUTOR, HIGH COURT OF"
    ],
    "sections": [
        "482",
        "143",
        "149",
        "147",
        "294",
        "109",
        "148"
    ],
    "outcome": "/JUDGMENT IN CC 1517/2016 OF JUDICIAL MAGISTRATE\nOF FIRST CLASS -I,NEDUMANGAD UNDER SECTION 143, 147, 148, 149,\n294[B]324 OF IPC\nCRIME NO.647/2016 OF Venjaramoodu Police Station ,\nThiruvananthapuram\nP",
    "full_text": "El ES 46\nBe\noH 4 te\nIN THE HIGH COURT OF KERALA AT ERNAKULAM 2020/KER/1163\nPRESENT\nTHE HONOURABLE MR. JUSTICE ASHOK MENON\nTHURSDAY, THE 09TH DAY OF JANUARY 2020 / 19TH POUSHA, 1941\nCri .MC.No.9295 OF 2019 (B)\nAGAINST THE ORDER/JUDGMENT IN CC 1517/2016 OF JUDICIAL MAGISTRATE\nOF FIRST CLASS -I,NEDUMANGAD UNDER SECTION 143, 147, 148, 149,\n294[B]324 OF IPC\nCRIME NO.647/2016 OF Venjaramoodu Police Station ,\nThiruvananthapuram\nPETITIONERS /ACCUSED :\n1 SYAM,\nAGED 29 YEARS\nS/O.KRISHNANKUTTY SHYLAJA BHAVAN, THEKKADA VILLAGE\nTRIVANDRUM\n2 ASHIQ\nAGED 28 YEARS\nS/O.BADSHAW, A.N.MANZIL, VEMBAYAN VILLAGE,\nTHIRUVANANTHAPURAM .\n3 SHAMSEER\nAGED 25 YEARS\nS/O.SHAJAHAN, SAFA MANZIL, MANICKKAL VILLAGE,\nTHIRUVANANTHAPURAM\n4 RAHUL\nAGED 24 YEARS\nRAHUL BHAVAN, MANICKKAL VILLAGE, THIRUVANANTHAPURAM\n5 SAJAN\nAGED 24 YEARS\nSAJAN MANZIL MANICKKAL VILLAGE, THIRUVANANTHAPURAM\nBY ADV. SRI.M.R.SARIN PANICKER\nRESPONDENTS/STATE & DEFACTO COMPLAINANTS :\n1 STATE OF KERALA,\nREPRESENTED BY THE PUBLIC PROSECUTOR, HIGH COURT OF\nKERALA, ERNAKULAM, KOCHI-682031\n2 ASEEM\nAGED 35 YEARS\nS/O.ABHUL AZEEZ KUNNUVILA PUTHEN VEEDU PONGUMMOODU,\n\nEl ES 46\nBe\n[OH 4 ie\nCrl.MC.No.9295 OF 2019(B) 2020/KER/II63\n2\nMANIKKAL NEDUMANGAD TALUK, THIRUVANANTHAPURAM\nR2 BY ADV. RANJITH EN\nOTHER PRESENT:\nSRI.C.S.HRITHWIK SR PP\nTHIS CRIMINAL MISC. CASE HAVING COME UP FOR ADMISSION ON\n09.01.2020, THE COURT ON THE SAME DAY PASSED THE FOLLOWING:\n\nPisin\nCrl.MC.No.9295 OF 2019(B) 2020/KER/II63\n3\nORDER\nDated this the 9th day of January, 2020\n\nThe petitioners are accused in C.C No. 1517/2016 on the\nfiles of the Judicial First Class Magistrate Court-1, Nedumagad for\nhaving allegedly committed offences punishable under Sections 143,\n147, 148, 149, 294[b] and 324 read with Section 109 of the IPC. The\ndefacto complainant-injured is the 2\"? respondent who has appeared\nthrough counsel and filed an affidavit to the effect that the matter has\nbeen amicably settled with the petitioners and that he did not not\nhave any grievance against them. A report also has been obtained\nfrom the Investigating Officer to that effect. The petitioners do not\nhave any criminal antecedents. There is no public interest involved.\n\nIn the result, the Crl.M.C is allowed and the entire\nproceedings in C.C No.1517/2016 on the files of the Judicial First\nClass Magistrate Court-1, Nedumagad stands quashed under Section\n482 Cr.P.C and the accused are discharged.\n\nSd/-\nASHOK MENON\nJUDGE\n\nNR/09/01/20\n\nlB 46\nTE\n[OH 4 ie\nCrl.MC.No.9295 OF 2019(B) 2020/KER/II63\n4\nAPPENDIX\nPETITIONERS' EXHIBITS:\nANNEXURE Al COPY OF FIR IN CRIME NO.647/16 OF\nVENJARAMOODU POLICE STATION\nANNEXURE A2 FINAL REPORT IN CC NO.1517/16 PENDING\nBEFORE THE JUDICIAL FIRST CLASS\nMAGISTRATE COURT -1- NEDUMANGAD\nANNEXURE A3 AFFIDAVIT SWORN BY THE 2ND RESPONDENT\nRESPONDENTS ' EXHIBITS: NIL\n//TRUE CoPYy// PA TO JUDGE\n\n"
}