{
    "case_id": "Crl.MC.No. 8665 of 2017",
    "court": "HIGH COURT OF KERALA AT ERNAKULAM",
    "date": "2018",
    "judge": "Pee",
    "petitioners": [
        "JOSEPH",
        "MC.No",
        "/ACCUSED :",
        "J.\nDated",
        "ELVIN @ SIJO,",
        "S/O EVEREST, BRIJIT BHAVAN, KAIKULANGARA CHERRY,",
        "KOLLAM WEST VILLAGE, KOLLAM.",
        "Annexure-A3"
    ],
    "respondents": [
        "HIGH COURT OF KERALA, ERNAKULAM.",
        "S/O JOSEPH, ISTHAQUIR PARAMBU, KAIKULANGARA CHERRY,",
        "REPRESENTED BY THE PUBLIC PROSECUTOR,",
        "R2 BY ADV. SRI.B.K.GOPALAKRISHNAN",
        "1. STATE OF KERALA,",
        "Ri BY PUBLIC PROSECUTOR SRI.ALEX M.THOMBRA",
        "(S) /STATH/DEFACTO COMPLAINANT :",
        "KOLLAM WEST VILLAGE, KOLLAM.",
        "2. IGNASIUS@JOY,"
    ],
    "sections": [
        "323",
        "341",
        "294(b)"
    ],
    "outcome": "are liable to be quashed",
    "full_text": "RSs\nPee\noak es\nIN THE HIGH COURT OF KERALA AT ERNAKULAM 2018/KER/735\nPRESENT :\nTHE HONOURABLE MR. JUSTICE B.KEMAL PASHA\nMONDAY, THE 8TH DAY OF JANUARY 2018 / 18TH POUSHA, 1939\nCr1.MC.No. 8665 of 2017\nC.C.NO. 1654/2015 OF JUDICIAL FIRST CLASS MAGISTRATE COURT-II, KOLLAM\nPETITIONER(S) /ACCUSED :\nELVIN @ SIJO,\nS/O EVEREST, BRIJIT BHAVAN, KAIKULANGARA CHERRY,\nKOLLAM WEST VILLAGE, KOLLAM.\nBY ADV.SRI.C.RAJENDRAN\nRESPONDENT (S) /STATH/DEFACTO COMPLAINANT :\n1. STATE OF KERALA,\nREPRESENTED BY THE PUBLIC PROSECUTOR,\nHIGH COURT OF KERALA, ERNAKULAM.\n2. IGNASIUS@JOY,\nS/O JOSEPH, ISTHAQUIR PARAMBU, KAIKULANGARA CHERRY,\nKOLLAM WEST VILLAGE, KOLLAM.\nRi BY PUBLIC PROSECUTOR SRI.ALEX M.THOMBRA\nR2 BY ADV. SRI.B.K.GOPALAKRISHNAN\nTHIS CRIMINAL MISC. CASE HAVING COME UP FOR ADMISSION\nON 08-01-2018, THE COURT ON THE SAME DAY PASSED\nTHE FOLLOWING:\nMsd.\n\nRSs\nrae\noak es\nCrl.MC.No. 8665 of 2017 2018/KER/735\nAPPENDIX\nPETITIONER(S)' ANNEXURES :\nANNEXURE AL A TRUE PHOTOCOPY OF THE FIR IN CRIME NO.130/2014\nOF THE PALLITHOTTAM POLICE STATION.\nANNEXURE A2 A TRUE PHOTOCOPY OF THE FINAL REPORT IN\nC.C.NO.1654/2015 OF JUDICIAL FIRST CLASS MAGISTRATE\nCOURT-II, KOLLAM.\nANNEXURE A3 ORIGINAL COPY OF THE AFFIDAVIT OF THE 2ND\nRESPONDENT DATED 30.11.2017.\nRESPONDENT (S) ' ANNEXURES :\nNIL\n//'TRUE COPY//\nP.S.TO JUDGE\nMsd.\n\n2018/KER/735\nB.KEMAL PASHA, J.\nDated this the 8\" day of January, 2018\nORDER\n\nPetitioner is the accused in C.C.No.1654 of 2015 of the\nJudicial First Class Magistrate’s Court-Il, Kollam, which has\narisen from Crime No.130 of 2014 of the Pallithottam Police\nStation, registered for the offences punishable under Sections\n294(b), 341 and 323 IPC.\n\n2. It seems that the matter has been amicably seitled\nbetween the parties.\n\n3. On going through the facts and circumstances of\nthe case, it seems that the matter can be permitted to be\nsettled. It has been reported that no criminal antecedents\nhave been reported against the petitioner. The defacto\ncomplainant has filed Annexure-A3, affidavit affirming that the\nmatter has been amicably settled between him and the\npetitioner and he has no complaints against the petitioner.\nConsidering the fact that the matter has already been settled\namicably between the parties, this court is satisfied that no\n\n2018/KER/735\n\nCrl.M.C.No.8665 of 2017 2\npurpose would be served in proceeding with the trial of the\ncase. Matters being so, Annexure-Al First Information Report,\nAnnexure-A2 Final Report and all further proceedings in\nC.C.No.1654 of 2015 of the Judicial First Class Magistrate’s\nCourt-Il, Kollam, which has arisen from Crime No.130 of 2014\nof the Pallithottam Police Station, as against the petitioner,\nare liable to be quashed.\n\nIn the result, this Crl.M.C. is allowed and Annexure-Al\nFirst Information Report, Annexure-A2 Final Report and all\nfurther proceedings in C.C.No.1654 of 2015 of the Judicial\nFirst Class Magistrate’s Court-ll, Kollam, which has arisen\nfrom Crime No.130 of 2014 of the Pallithottam Police Station,\nas against the petitioner, are hereby quashed.\n\nSd/-\nB.KEMAL PASHA\nJUDGE\nDSV/8/1/18\n// True Copy //\nP.A.To Judge\n\n"
}