{
    "case_id": "Crl.MC.No. 4365 of 2016 ()",
    "court": "HIGH COURT OF KERALA AT ERNAKULAM\nPRESENT",
    "date": "MONDAY",
    "judge": "RAJA VIJAYARAGHAVAN.YV.",
    "petitioners": [
        "MC.No",
        "M.P. MANI",
        "Palakkad",
        "ACCUSED NO.4:",
        "PALAKKAD",
        "JUSTICE RAJA VJAYARAGHAVAN V\n"
    ],
    "respondents": [
        "ISTATE:"
    ],
    "sections": [
        "420 read with Section 34 of the\nIPC",
        "248(1)"
    ],
    "outcome": "Petition is disposed",
    "full_text": "Baha\nBER eie eA\n2016/KER/33663\nIN THE HIGH COURT OF KERALA AT ERNAKULAM\nPRESENT:\nTHE HONOURABLE MR. JUSTICE RAJA VJAYARAGHAVAN V\nMONDAY, THE 1ST DAY OF AUGUST 2016/10TH SRAVANA, 1938\nCrl.MC.No. 4365 of 2016 ()\nCC. NO.255/2016 OF JUDICIAL FIRST CLASS MAGISTRATE COURT-I, PALAKKAD.\n\nPETITIONER/ACCUSED NO.4:\n\nM.P. MANI,\n\nSON OF PAKKAN,\n\nMALANCHITTI HOUSE, KUTHANUR.\n\nBY ADVS.SRIP.K.NIJOY,\n\nSMT.C.PRABITHA.\n\nRESPONDENTISTATE:\n\nSTATE OF KERALA,\n\nREPRESENTED BY THE PUBLIC PROSECUTOR,\n\nHIGH COURT OF KERALA, ERNAKULAM.\n\nBY PUBLIC PROSECUTOR SRI,AMJAD ALI.\n\nTHIS CRIMINAL MISC. CASE HAVING COME UP FOR ADMISSION\n\nON 01-08-2016, THE COURT ON THE SAME DAY PASSED THE\n\nFOLLOWING:\nrs¢\n\nBaha\nzis ae am\nraat\n2016/KER/33663\nCri.MC.No. 4365 of 2016\nAPPENDIX\nPETITIONER'S ANNEXURES:-\nANNEXURE | CERTIFIED COPY OF THE JUDGMENT DATED 19.03.2016\nOF THE JUDICIAL FIRST CLASS MAGISTRATE COURT I,\nPALAKKAD.\nRESPONDENT'S ANNEXURES:- NIL.\n/TTRUE COPY//\nP.S. TO JUDGE\nrs¢\n\nPagel\ns016ikERa3663\nRAJA VIJAYARAGHAVAN.YV., J\n~ CrLM.C. No. 4365 of 2016\nDated 1* August, 2016\nORDER\n\n1.The petitioner is the 3 accused in C.C.No.255 of 2016 on\nthe files of the Judicial Magistrate of 1* Class I, Palakkad.\nHe faces allegations for having committed offences\npunishable under Section 420 read with Section 34 of the\nIPC.\n\n2.This is a split up case from C.C.No.14 of 2008 in which the\npetitioner was arrayed as 4\" accused. The case was\nproceeded with and as per judgment dated 19.3.2016,\naccused 2 and 5 were acquitted under Section 248(1) of\nthe Code of Criminal Procedure (hereinafter referred to as\nthe “Code”).\n\n3.The learned counsel submits that coercive steps are\npending against the petitioner and prays that necessary\ndirections be given to the learned Magistrate to consider\nhis application for recall of warrant and grant of bail.\n\nEase\nwae 1\nisaare\n2016/KER/33663\nCrl.M.C. No. 4365 of 2016 -2-\n4.Heard the learned Public Prosecutor as well.\n5.It is for the petitioner to approach the court below and\nappraise the reasons for his absence and to seek for\nrecalling the warrant and grant of Bail. There is no reason\nfor this Court to assume that the learned Magistrate will\nnot exercise his discretion judicially and in accordance\nwith law.\n6.In the result, the petitioner is directed to surrender before\nthe learned Magistrate within 2 weeks from the date of\nthis order and prefer application for recall of warrant and\nalso for grant of bail with advance notice to the prosecutor\nconcerned. In that event the learned Magistrate is directed\nto consider and dispose of the said application, preferably\non the same day itself, on its merits and in accordance\nwith law.\nPetition is disposed off as above.\nSd/-\nRAJA VIJAYARAGHAVAN.YV.,\nJUDGE\nkp/-3.8.16\n\n"
}