{
    "case_id": "",
    "court": "HIGH COURT OF KERALA AT ERNAKULAM\nPRESENT",
    "date": "02 day of January, 2014",
    "judge": "CHEKKUTTU VEEDU",
    "petitioners": [
        "DHANESH MATHEW\n",
        "D/O.AYYAPPAN, DOOR NO.22, VADIPETTI DESHAM,",
        "2. AACHI, AGED 26 YEARS,",
        "SMT.RESMI]",
        "W/O.SENTHIL, DOOR NO.22, VADIPETTI DESHAM,",
        "ACCUSED:",
        "MADURAI, TAMIL NADU.",
        "1. PONNATHA, AGED 27 YEARS,"
    ],
    "respondents": [
        "1. STATE OF KERALA",
        "HIGH COURT OF KERALA, ERNAKULAM.",
        "S/COMPLAINANT:",
        "KODAKARA VILLAGE, THRISSUR DISTRICT.",
        "W/O.SANDEEP, CHEKKUTTU VEEDU, PAZHAMBILLI DESOM,",
        "2. NISHA, AGED 33 YEARS,",
        "R1 BY PUBLIC PROSECUTOR SMT. DHANESH MATHEW",
        "R2 BY ADV. SMT.RESMI] THOMAS",
        "REPRESENTED BY PUBLIC PROSECUTOR,"
    ],
    "sections": [
        "482",
        "379",
        "34"
    ],
    "outcome": "2013 of Chalakkudy Police Station quashed",
    "full_text": "ue\nPate\n2014/KER/210\nIN THE HIGH COURT OF KERALA AT ERNAKULAM\nPRESENT:\nTHE HONOURABLE MR.JUSTICE PBHAVADASAN\nTHURSDAY, THE 2ND DAY OF JANUARY 2014/12TH POUSHA, 1935\nCri.MC.No. 23 of 2014\nCRIME NO. 3128/2013 OF CHALAKKUDY POLICE STATION , THRISSUR DISTRICT.\nPETITIONER/ACCUSED:\n1. PONNATHA, AGED 27 YEARS,\nW/O.SENTHIL, DOOR NO.22, VADIPETTI DESHAM,\nMADURAI, TAMIL NADU.\n2. AACHI, AGED 26 YEARS,\nD/O.AYYAPPAN, DOOR NO.22, VADIPETTI DESHAM,\nMADURAI, TAMIL NADU.\nBY ADV. SRI.K.S.ARUN KUMAR\nRESPONDENTS/COMPLAINANT:\n1. STATE OF KERALA\nREPRESENTED BY PUBLIC PROSECUTOR,\nHIGH COURT OF KERALA, ERNAKULAM.\n2. NISHA, AGED 33 YEARS,\nW/O.SANDEEP, CHEKKUTTU VEEDU, PAZHAMBILLI DESOM,\nKODAKARA VILLAGE, THRISSUR DISTRICT.\nR1 BY PUBLIC PROSECUTOR SMT. DHANESH MATHEW\nR2 BY ADV. SMT.RESMI] THOMAS\nTHIS CRIMINAL MISC. CASE HAVING COME UP FOR ADMISSION\nON 02-01-2014, THE COURT ON THE SAME DAY PASSED THE FOLLOWING:\nMsd.\n\nae\nPate\n2014/KER/210\nCri.MC.No. 23 of 2014\nAPPENDIX\nPETITIONER(S)’ ANNEXURE:\nANNEXURE-!I: TRUE COPY OF THE FIR IN CRIME NO.3128/2013 OF CHALAKKUDY\nPOLICE STATION, THRISSUR.\nANNEXURE-II: TRUE COPY OF THE AFFIDAVIT SWORN BY THE SECOND\nRESPONDENT.\nRESPONDENT(S)’ ANNEXURE:\nNIL\nTRUE COPY\\\\\nP.A.TO JUDGE.\nMsd.\n\numl\n2014/KER/210\nP.BHAVADASAN, J.\n~— CrLM.C. No. 23 of 2014\nDated this the 02 day of January, 2014\nORDER\n\nThis is a petition filed under Section 482 of Cr.P.C.\nseeking to have all further proceedings in Crime No. 3128 of\n2013 of Chalakkudy Police Station quashed.\n\n2. The petitioner stands accused of having\ncommitted the offence punishable under Section 379 read\nwith Section 34 of IPC.\n\n3. It is unnecessary to go into the facts and details of\nthe case for the simple reason that the petitioners have\nimpleaded the defacto complaint/victim as the second\nrespondent who has entered appearance through a counsel\nand the learned counsel appearing for the second\nrespondent has accepted that the Annexure-ll affidavit filed\nalong with this petition is one sworn to by the defacto\ncomplainant herself and she stands by the statements\ncontained therein.\n\nan\na\n2014/KER/210\nCrl.M.C. No.23/2014\n-2-\n\nOn going through Annexure-ll affidavit, it is seen that\nthe parties have settled all their differences and issues\nbetween them and no further grievance remains to be\nresolved between the victim and the accused. It is pointed\nout that the victim is disinterested in continuing the matter.\n\nIn the light of the statement made in the affidavit, it is felt\nthat continuance of the proceedings will only be an exercise\nin futility.\n\nIn the result, this petition is allowed. All further\nproceedings in Crime No. 3128 of 2013 of Chalakkudy Police\nStation including the FIR shall stand quashed and the\npetitioner shall stand discharged and all further proceedings\nshall stand dropped.\n\nP.BHAVADASAN\nJUDGE\nds\n\n"
}