{
    "case_id": "Crl.MC.No. 7858 of 2015",
    "court": "HIGH COURT OF KERALA AT ERNAKULAM\nPRESENT",
    "date": "MONDAY",
    "judge": "B. KEMAL PASHA",
    "petitioners": [
        "2. SUNI @ LAWRANCE, AGED 44,",
        "MC.No",
        "S/ACCUSED:",
        "S/O.ALPHONSE, PALLIIKKATHIYIL VEEDU,",
        "THUMPOLY WARD, THUMPOLY P.O., ALAPPUZHA.",
        "S/O.ELIAS, ARAYASSERY VEEDU,",
        "1. SIBICHAN @ STALIN, AGED 46,",
        "S/O.JOSEPH, KAKKARIYIL, THUMPOLY WARD,",
        "3. KUTTAPPAN @ JACKSON, AGED 46,",
        "SIBICHAN @ STALIN",
        "SUNI @ LAWRANCE",
        "B.KEMAL PASHA",
        "J.\nORDER\nPetitioners",
        "THUMPOLY P.O., ALAPPUZHA."
    ],
    "respondents": [
        "R2 BY ADV. SRI.LP.SHANES METHAR",
        "PALLIIKKATHIYIL VEEDU, THUMPOLY WARD,",
        "REPRESENTED BY THE PUBLIC PROSECUTOR,",
        "R1 BY PUBLIC PROSECUTOR SMT.SAREENA GEORGE",
        "1. STATE OF KERALA,",
        "STATE AND COMPLAINANT:",
        "2. SITTAS , AGED 52, S/O.SEBASTIAN,",
        "THUMPOLY P.O., ALAPPUZHA - 688 126.",
        "HIGH COURT OF KERALA, ERNAKULAM - 682 031."
    ],
    "sections": [
        "323",
        "324",
        "341 of the Indian\nPenal Code read with Section 34 IPC"
    ],
    "outcome": "Station, Alappuzha, can be quashed",
    "full_text": "BE\n2016/KER/66\nIN THE HIGH COURT OF KERALA AT ERNAKULAM\nPRESENT:\nTHE HONOURABLE MR. JUSTICE B.KEMAL PASHA\nMONDAY, THE 4TH DAY OF JANUARY 2016/14TH POUSHA, 1937\nCrl.MC.No. 7858 of 2015\nCC 1736/2015 OF JUDICIAL FIRST CLASS MAGISTRATE COURT-, ALAPPUZHA.\nCRIME NO. 543/2015 OF ALAPPUZHA NORTH POLICE STATION, ALAPPUZHA.\nPETITIONERS/ACCUSED:\n1. SIBICHAN @ STALIN, AGED 46,\nS/O.ELIAS, ARAYASSERY VEEDU,\nTHUMPOLY WARD, THUMPOLY P.O., ALAPPUZHA.\n2. SUNI @ LAWRANCE, AGED 44,\nS/O.ALPHONSE, PALLIIKKATHIYIL VEEDU,\nTHUMPOLY WARD, THUMPOLY P.O., ALAPPUZHA.\n3. KUTTAPPAN @ JACKSON, AGED 46,\nS/O.JOSEPH, KAKKARIYIL, THUMPOLY WARD,\nTHUMPOLY P.O., ALAPPUZHA.\nBY ADV. SRILRAJAN JACOB MUNDACKAL\nRESPONDENT(S)/STATE AND COMPLAINANT:\n1. STATE OF KERALA,\nREPRESENTED BY THE PUBLIC PROSECUTOR,\nHIGH COURT OF KERALA, ERNAKULAM - 682 031.\n2. SITTAS , AGED 52, S/O.SEBASTIAN,\nPALLIIKKATHIYIL VEEDU, THUMPOLY WARD,\nTHUMPOLY P.O., ALAPPUZHA - 688 126.\nR1 BY PUBLIC PROSECUTOR SMT.SAREENA GEORGE\nR2 BY ADV. SRI.LP.SHANES METHAR\nTHIS CRIMINAL MISC. CASE HAVING COME UP FOR ADMISSION\nON 04-01-2016, THE COURT ON THE SAME DAY PASSED THE\nFOLLOWING:\nmbr/\n\nBarrie\nornare\n2016/KER/66\nCri.MC.No. 7858 of 2015\nAPPENDIX\nPETITIONER(S)’ ANNEXURES:\nANNEXURE I. TRUE COPY OF THE FIR IN CRIME NO.543/2015 OF ALAPPUZHA\nNORTH POLICE STATION, ALAPPUZHA DISTRICT.\nANNEXURE II. TRUE COPY OF THE FINAL REPORT/CHARGE SHEET IN\nCC NO.1736/2015 ON THE FILE OF JFCM COURT-I, ALAPPUZHA\nIN CRIME NO.543/2015 OF ALAPPUZHA POLICE STATION,\nALAPPUZHA DISTRICT.\nANNEXURE III. AFFIDAVIT SWORN BY THE 3RD RESPONDENT.\nRESPONDENT(S)’ ANNEXURES: NIL\nHTRUE COPY//\nP.S. TO JUDGE\nmbr/\n\na\n2016/KER/66\nB. KEMAL PASHA, J.\nORDER\nPetitioners are accused in C.C. No.1736 of 2015 of the\nJudicial First Class Magistrate's Court-l, Alappuzha, which\nhas arisen from Crime No.543 of 2015 of the Alappuzha\nNorth Police Station, Alappuzha, registered for the offences\npunishable under Sections 323, 324 and 341 of the Indian\nPenal Code read with Section 34 IPC.\n\n2. The matter has been amicably settled between\nthe petitioners and the defacto complainant, who is the 2\"\nrespondent herein. The defacto complainant has filed\n\nasi\n2016/KER/66\nCRL.M.C.No. 7858 of 2015 uoe\nAnnexure-lll affidavit affirming that the matter has been\namicably settled between him and the petitioners and he\nhas no complaints against the petitioners.\n\n3. There is a connected case also in the matter\nregistered as Crime No.430 of 2015 of the same Police\nStation. The matter involved in the said crime has also been\nsettled between the parties. No criminal antecedents have\nbeen reported against the petitioners. When the matter has\nbeen amicably settled, no purpose would be served in\nproceeding with the matter further, and therefore, all further\nproceedings in C.C. No.1736 of 2015 pending before the\nJudicial First Class Magistrate's Court-l, Alappuzha, as\nagainst the petitioners, based on Annexure-Il Final Report in\nCrime No.543 of 2015 of the Alappuzha North Police\nStation, Alappuzha, can be quashed.\n\nIn the result, this Crl.M.C. is allowed and all further\nproceedings in C.C. No.1736 of 2015 pending before the\nJudicial First Class Magistrate's Court-l, Alappuzha, as\n\nee\na\n2016/KER/66\nCRL.M.C.No. 7858 of 2015\n-3:-\nagainst the petitioners, based on Annexure-Il Final Report in\nCrime No.543 of 2015 of the Alappuzha North Police\nStation, Alappuzha, are hereby quashed.\nSd/- B. KEMAL PASHA,\nJUDGE.\nDSV/4/1/16\n[True copy] PS. to Judge\n\n"
}