{
    "case_id": "",
    "court": "HIGH COURT OF KERALA AT HERNAKULAM",
    "date": "2018",
    "judge": "Digeaeras",
    "petitioners": [
        "JOSEPH",
        "S/O RAVEENDRAN NAIR, AGED 36,",
        "J.\nDated",
        "RAJEESH,",
        "ANNEXURE A3 COPY OF COMPROMISE",
        "Cherthala",
        "PATTANAKAD P/W-7, CHERTHALA, ALAPPUZHA.",
        "ACCUSED:",
        "PULIMOODVELI HOUSE, PATTANAKAD P.O,",
        "CHERTHALA"
    ],
    "respondents": [
        "PATTANAKAD, THROUGH PUBLIC PROSECUTOR,",
        "HIGH COURT OF KERALA, ERNAKULAM.",
        "S/STATE/DEFACTO COMPLAINANT. :",
        "REPRESENTED BY S.I. OF POLICE,",
        "1. STATE OF KERALA,",
        "2. RAJAN,"
    ],
    "sections": [
        "447",
        "427 IPC read with Section 34 IPC"
    ],
    "outcome": "petitioner, are liable to be quashed",
    "full_text": "fl iq\nDigeaeras\nIN THE HIGH COURT OF KERALA AT HERNAKULAM 2018/KER/268\nPRESENT:\nTHE HONOURABLE MR. JUSTICE B.KEMAL PASHA\nTHURSDAY, THE 4TH DAY OF JANUARY 2018 / 14TH POUSHA, 1939\nCr1.MC.No. 8812 of 2017\nCC. NO.702/2014 OF JUDICIAL FIRST CLASS MAGISTRATE COURT-I, CHERTHALA.\nCRIME NO. 764/2013 OF PATTANAKAD POLICE STATION, ALAPPUZHA DISTRICT.\n\nPETITIONER/ACCUSED:\nRAJEESH,\nS/O RAVEENDRAN NAIR, AGED 36,\nPULIMOODVELI HOUSE, PATTANAKAD P.O,\nPATTANAKAD P/W-7, CHERTHALA, ALAPPUZHA.\nBY ADVS.SRI.P.ANUROOP,\n\nSMT .V.K.SREENA.\nRESPONDENTS/STATE/DEFACTO COMPLAINANT. :\n1. STATE OF KERALA,\nREPRESENTED BY S.I. OF POLICE,\nPATTANAKAD, THROUGH PUBLIC PROSECUTOR,\nHIGH COURT OF KERALA, ERNAKULAM.\n2. RAJAN,\n\nS/O VELUPANICKER, AGED 69,\nRADHA NIVAS, PATTANAKAD P/W NO-4,\nCHERTHALA, ALAPPUZHA.\nR1 BY PUBLIC PROSECUTOR SRI.C.S. HRITHWIK.\nR2 BY ADV. SRI.SEBASTIAN JOSEPH (KURISUMMOOTTIL)\nTHIS CRIMINAL MISC. CASE HAVING COME UP FOR ADMISSION\nON 04-01-2018, THE COURT ON THE SAME DAY PASSED THE\nFOLLOWING :\n\nrs.\n\nates\n2018/KER/268\nCrl1.MC.No. 8812 of 2017 ()\nAPPENDIX\nPETITIONER'S ANNEXURES:\nANNEUXRE AL CERTIFIED COPY OF THE FIR IN PATTANAKAD POLICE\nSTATION CRIME NO.764/13 DATED 25.09.2013.\n\nANNEXURE A2 CERTIFIED COPY OF FINAL REPORT.\nANNEXURE A3 COPY OF COMPROMISE DATED 06.07.2017.\nANNEXURE A4 AFFIDAVIT OF THE 2ND RESPONDENT.\nRESPONDENT'S ANNEXURES: NIL.\n\n//TRUE COPY//\n\nP.S. TO JUDGE\nrs.\n\n2018/KER/268\nB.KEMAL PASHA, J.\nDated this the 4\" day of January, 2018\nORDER\n\nPetitioner is the accused in C.C.No.702 of 2014 of the\nJudicial First Class Magistrate’s Court-l, Cherthala, which has\narisen from Crime No.764 of 2013 of the Pattanakadu Police\nStation, registered for the offences punishable under Sections\n447 and 427 IPC read with Section 34 IPC.\n\n2. It seems that the matter has been amicably seitled\nbetween the parties.\n\n3. On going through the facts and circumstances of\nthe case, it seems that the matter can be permitted to be\nsettled. It has been reported that no criminal antecedents\nhave been reported against the petitioner. The defacto\ncomplainant has filed Annexure-A4 affidavit affirming that the\nmatter has been amicably settled between him and the\npetitioner and he has no complaints against the petitioner.\nConsidering the fact that the matter has already been settled\namicably between the parties, this court is satisfied that no\n\neee\naie\n2018/KER/268\nCrl.M.C.No.8412 of 2017 2\npurpose would be served in proceeding with the trial of the\ncase. Matters being so, Annexure-A11 First Information Report,\nAnnexure-A2 Final Report and all further proceedings in\nC.C.No.702 of 2014 of the Judicial First Class Magistrate’s\nCourt-l, Cherthala, which has arisen from Crime No.764 of\n2013 of the Pattanakadu Police Station, as against the\npetitioner, are liable to be quashed.\nIn the result, this Crl.M.C. is allowed and Annexure-A1\nFirst Information Report, Annexure-A2 Final Report and all\nfurther proceedings in C.C.No.702 of 2014 of the Judicial First\nClass Magistrate’s Court-l, Cherthala, which has arisen from\nCrime No.764 of 2013 of the Pattanakadu Police Station, as\nagainst the petitioner, are hereby quashed.\nSd/-\nB.KEMAL PASHA\nJUDGE\nDSV/A/1/18\n//True Copy //\nP.A.To Judge\n\n"
}