{
    "case_id": "",
    "court": "HIGH COURT OF KERALA AT ERNAKULAM\nPRESENT\nTHE HONOURABLE MR",
    "date": "2020",
    "judge": "Cri .MC.No.8553",
    "petitioners": [
        "S/O GEORGE, RESIDING AT UPPANIYIL VEEDU, NEAR",
        "MANICHAN @ IMMANUEL,",
        "ACCUSED :",
        "VADAYAR VILLAGE, VAIKOM,",
        "R.RAJESH",
        "KOTTAYAM DISTRICT-686 605.",
        "MARSLEEBA SCHOOL, KIZHAKKEKARA,",
        "AGED 55 YEARS",
        "Kottayam"
    ],
    "respondents": [
        "HIGH COURT OF KERALA, HERNAKULAM",
        "R2 BY ADV. R.RAJESH (PULLIKADA)",
        "1 STATE OF KERALA",
        "C.S.HRITHWIK-SR.PP",
        "Vaikom",
        "KOTTAYAM DISTRICT-686 605.",
        "S/STATE/DEFACTO COMPLAINANT:",
        "REPRESENTED BY GOVERNMENT PLEADER,",
        "S/O JOHN, RESIDING AT MANAGALATH VEEDU,",
        "2 JOSE",
        "THALAYOLAPARAMBU, VADAYAR VILLAGE, VAIKOM,"
    ],
    "sections": [
        "482",
        "409"
    ],
    "outcome": "/JUDGMENT IN LP 25/2015 OF JUDICIAL\nMAGISTRATE OF FIRST CLASS ,VAIKOM\nCRIME NO.311/2003 OF Vaikom Police Station , Kottayam\nPETITIONER/ACCUSED :\nMANICHAN @ IMMANUEL,\nAGED 55 YEARS\nS/O GEORGE, RESIDING",
    "full_text": "Dear)\nBe Sener\nPEERS\nBeer\n2020/KER/175\nIN THE HIGH COURT OF KERALA AT ERNAKULAM\nPRESENT\nTHE HONOURABLE MR. JUSTICE ASHOK MENON\nMONDAY, THE O6TH DAY OF JANUARY 2020 / 16TH POUSHA, 1941\nCri .MC.No.8553 OF 2019 (H)\nAGAINST THE ORDER/JUDGMENT IN LP 25/2015 OF JUDICIAL\nMAGISTRATE OF FIRST CLASS ,VAIKOM\nCRIME NO.311/2003 OF Vaikom Police Station , Kottayam\nPETITIONER/ACCUSED :\nMANICHAN @ IMMANUEL,\nAGED 55 YEARS\nS/O GEORGE, RESIDING AT UPPANIYIL VEEDU, NEAR\nMARSLEEBA SCHOOL, KIZHAKKEKARA,\nVADAYAR VILLAGE, VAIKOM,\nKOTTAYAM DISTRICT-686 605.\nBY ADV. SRI.S.SREEKUMAR (KOLLAM)\nRESPONDENTS/STATE/DEFACTO COMPLAINANT:\n1 STATE OF KERALA\nREPRESENTED BY GOVERNMENT PLEADER,\nHIGH COURT OF KERALA, HERNAKULAM\n2 JOSE\nS/O JOHN, RESIDING AT MANAGALATH VEEDU,\nTHALAYOLAPARAMBU, VADAYAR VILLAGE, VAIKOM,\nKOTTAYAM DISTRICT-686 605.\nR2 BY ADV. R.RAJESH (PULLIKADA)\nC.S.HRITHWIK-SR.PP\nTHIS CRIMINAL MISC. CASE HAVING COME UP FOR ADMISSION\nON 06.01.2020, THE COURT ON THE SAME DAY PASSED THE\nFOLLOWING:\n\neee\n2020/KER/175\nCrl1.MC.No.8553 OF 2019 (H)\n2\nORDER\nDated this the 6th day of January 2020\n\nThe petitioner is the sole accused in\nCrime No.311/2003 of Vaikom Police Station, he\nwas absconding and a case against him is\npresently pending as LP No.25/2015 on the file\nof the Judicial First Class Magistrate Court,\nVaikom, for having allegedly committed offence\npunishable under Section 409 of the IPC.\n\n2. The defacto complainant is the 2‚Äù\nrespondent, who has appeared through counsel\nand filed an affidavit to the effect that the\nmatter has been amicably settled with the\npetitioner and that he has no grievance against\nhim. A report has been called for from the\nInvestigating Officer through the senior Public\nProsecutor. The petitioner does not have any\ncriminal antecedents. The matter has been fully\nand finally settled. There is a civil dispute\n\nBeal\nBie anny\npe\n2020/KER/175\nCrl1.MC.No.8553 OF 2019 (H)\n3\nwhich also had been disposed of.\nIn the result, the Crl.M.C is allowed and\nthe entire proceedings in Crime No.311/2003 of\nVaikom Police Station, presently pending as\nLP No.25/2015 on the file of the Judicial First\nClass Magistrate Court, Vaikom, stands quashed\nunder Section 482 of the Cr.P.C and the accused\nis discharged.\nSd/-\nASHOK MENON\nJUDGE\nSPK\n\nBie Bl\nBe Sener\nFEE Bobo\n|\n2020/KER/175\nCr1.MC.No.8553 OF 2019 (H)\n4\nAPPENDIX\nPETITIONER'S/S EXHIBITS:\nANNEXURE Al THE CERTIFICATE COPY OF FIR NO 311/03\nOF VAIKOM POLICE STATION\nANNEXURE A2 THE CERTIFICATE COPY OF THE FINAL\nREPORT AND CONNECTED DOCUMENTS IN CRIME\nNO 311/03 OF VAIKOM POLICE STATION\nANNEXURE A3 AFFIDAVIT\nRESPONDENT'S/S EXHIBITS: NIL\n/TRUE COPY/\nPA TO JUDGE\n\n"
}