{
    "case_id": "",
    "court": "Jurisdictional Court",
    "date": "Monday",
    "judge": "A.U. Nivas, Mavinmoodu",
    "petitioners": [
        "T. Geenakumari",
        "Laiju Bhavan",
        "Lalumon",
        "Clavar",
        "Counter Petitioner:-\nState",
        "Advocate S. Shameel"
    ],
    "respondents": [],
    "sections": [
        "482",
        "115(2)",
        "296(b)",
        "117(2) r/w Section\n3(5)of the Bharatiya Nyaya Sanhita",
        "126(2)"
    ],
    "outcome": "In the result, the petition is dismissed",
    "full_text": "IN THE COURT OF THE SESSIONS JUDGE,\nTHIRUVANANTHAPURAM\nPRESENT : SMT. NAZEERA.S, SESSIONS JUDGE\nMonday, 3% day of March, 2025/ 12â„¢ day of Phalguna, 1946.\nCRIMINAL M.C. No.614/2025\n(Crime No.190/2025 of Kallambalam Police Station)\nPetitioners /Accused :-\n1 Akhiljith A.U., aged 28 years,\nS/o.Ajithkumar, 6/196,\nA.U. Nivas, Mavinmoodu,\nKallambalam, Thiruvannathapuram.\n2 Liju Lal, aged 22 years, S/o Lalumon,\nLaiju Bhavan, Clavar, Vadasserikonam.\n(By Advocate S. Shameel)\nCounter Petitioner:-\nState of Kerala\n(By Public Prosecutor Dr. T. Geenakumari)\nThis Crl.M.C. came up for hearing on 1/3/2025 and the court on the\n3/3/2025 passed the following :\nORDER\nThis is an application filed under Section 482 of the Bharatiya\nNagarik Suraksha Sanhita, seeking pre-arrest bail.\n\n2. The petitioners are alleged to have committed the offences\npunishable under Sections 296(b), 126(2), 115(2) and 117(2) r/w Section\n3(5)of the Bharatiya Nyaya Sanhita and Crime No.190/2025 of\nCriminal M.C.No.614/2025 1/2\n\nKallambalam Police Station is registered against the petitioners, arraying\nthem as accused.\n\n3. Heard. On a perusal of the report submitted by the Investigating\nOfficer, it is found that all the offences alleged against the petitioners are\nbailable. As per section 482 of the Bharatiya Nyaya Sanhita, the condition\nprecedent for invoking the powers provided under the said provision is that\nthe petitioner apprehends that he might be arrested on accusation of having\ncommitted a non-bailable offence. In this circumstance, the application\ncannot be entertained.\n\nIn the result, the petition is dismissed as not maintainable,\nwithout prejudice to the right of the petitioners to take bail from the\nJurisdictional Court.\n\nDictated to the Confidential Assistant, transcribed and typed by him, corrected and\npronounced by me in Open Court on this the 3\" day of March, 2025.\nSd/-\nNAZEERA.S\nSESSIONS JUDGE\n(Copies : 4) True Copy By Order\nTyped by: Anupama\nCompared by: Rifa FCS : SHERISTADAR\nCriminal M.C.No.614/2025 2/2\n\nCopy of Order in\nCriminal M.C.No.614/2025\nDated:3/3/2025\nCriminal M.C.No.614/2025 3/2\n\n"
}