{
    "case_id": "",
    "court": "HIGH COURT OF KERALA AT ERNAKULAM\nPRESENT\nTHE HONOURABLE MRS",
    "date": "2024",
    "judge": "THOMAS",
    "petitioners": [
        "1 MUHAMMED SHAFI N.U",
        "KOLAPARAMBU, P.O PANDIKKAD, MALAPPURAM DISTRICT.,",
        "NEDUMBA HOUSE",
        "Malappuram",
        "S /ACCUSED:",
        "PIN - 676521",
        "Reta",
        "w/o. YUSUF, NEDUMBA HOUSE, PULIKKALPARAMBIL,",
        "Laxmi Narayan",
        "Annexure A3",
        "AGED 38 YEARS",
        "3 NASEERA N",
        "lea el\nee RG\noe\n",
        "AGED 37 YEARS",
        "AGED 57 YEARS",
        "W/O SUNEER BABU, PATTIKKADAN HOUSE, MALIYEKKAL,",
        "S/O. YUSUF, NEDUMBA HOUSE, PULIKKALPARAMBIL,",
        "Gian Singh v. State of Punjab",
        "KOORAD, KALIKAVU P.O, MALAPPURAM DISTRICT., PIN -",
        "676525",
        "alan\n",
        "2 SULAIKHA P"
    ],
    "respondents": [
        "SR.PP-SRI.RENJIT GEORGE",
        "REPRESENTED BY PUBLIC PROSECUTOR,HIGH COURT OF",
        "2 AGED 20 YEARS",
        "1 STATE OF KERALA",
        "D/O KABEER, KARAKKADAN HOUSE, KARUTHENI, KEEPPADA,",
        "S/STATE AND DEFACTO COMPLAINANT:",
        "RAFVANA THASNI",
        "KERALA, PIN - 682031",
        "VANIYAMBALAM, MALAPPURAM DISTRICT., PIN - 679339"
    ],
    "sections": [
        "482",
        "498A",
        "406 r/w Section 34 of IPC"
    ],
    "outcome": "petitioners can be quashed",
    "full_text": "BENS\nee\nBEMeaears\n2024/KER/4886\nIN THE HIGH COURT OF KERALA AT ERNAKULAM\nPRESENT\nTHE HONOURABLE MRS. JUSTICE SOPHY THOMAS\nMONDAY, THE 22™° DAY OF JANUARY 2024 / 2ND MAGHA, 1945\nCRL.MC NO. 19 OF 2024\nCRIME NO.829/2023 OF Pandikad Police Station, Malappuram\nAGAINST THE ORDER/JUDGMENT CC 1641/2023 OF JUDICIAL MAGISTRATE OF\nFIRST CLASS -II, PERINTHALMANNA\nPETITIONERS /ACCUSED:\n1 MUHAMMED SHAFI N.U\nAGED 37 YEARS\nS/O. YUSUF, NEDUMBA HOUSE, PULIKKALPARAMBIL,\nKOLAPARAMBU, P.O PANDIKKAD, MALAPPURAM DISTRICT.,\nPIN - 676521\n2 SULAIKHA P\nAGED 57 YEARS\nw/o. YUSUF, NEDUMBA HOUSE, PULIKKALPARAMBIL,\nKOLAPARAMBU, P.O PANDIKKAD, MALAPPURAM DISTRICT.,\nPIN - 676521\n3 NASEERA N\nAGED 38 YEARS\nW/O SUNEER BABU, PATTIKKADAN HOUSE, MALIYEKKAL,\nKOORAD, KALIKAVU P.O, MALAPPURAM DISTRICT., PIN -\n676525\nBY ADV P.SAMSUDIN\nRESPONDENTS/STATE AND DEFACTO COMPLAINANT:\n1 STATE OF KERALA\nREPRESENTED BY PUBLIC PROSECUTOR,HIGH COURT OF\nKERALA, PIN - 682031\nRAFVANA THASNI\n2 AGED 20 YEARS\nD/O KABEER, KARAKKADAN HOUSE, KARUTHENI, KEEPPADA,\nVANIYAMBALAM, MALAPPURAM DISTRICT., PIN - 679339\nSR.PP-SRI.RENJIT GEORGE\nTHIS CRIMINAL MISC. CASK HAVING COME UP FOR ADMISSION ON\n22.01.2024, THR COURT ON THE SAMR DAY PASSED THE FOLLOWING:\n\n[alan\n2024/KER/4886\nCRL.MC NO.19 OF 2024\n2\nORDER\nDated this the 22\" day of January , 2024\n\nThis Crl.M.C., under Section 482 of CrP.C., is filed by\naccused Nos.1 to 3 in Crime No.829 of 2023 of Pandikkad\nPolice Station, Malappuram, registered under Sections\n498A and 406 r/w Section 34 of IPC, for quashing\nAnnexure Ail FIR and Annexure A2 final report in\nC.C.No.1641 of 2023 on the file of Judicial First Class\nMagistrate Court-II, Perinthalmanna.\n2. The prosecution allegation is that, accused Nos.1 to\n3, who are the husband and in-laws of the defacto\ncomplainant/2™ respondent, subjected her to matrimonial\ncruelties, demanding more gold and money.\n3. When the matter is taken up for consideration,\nlearned counsel for the petitioners submitted that the\nmatter stands settled between themselves and the defacto\ncomplainant/2™ respondent. The defacto complainant\nentered appearance through counsel, and submitted that\n\n[alan\n2024/KER/4886\nCRL.MC NO.19 OF 2024\nthe matter is settled, and Annexure A3 is the affidavit filed\nby her, endorsing the settlement. She has no intention to\nproceed with the prosecution. She has no objection in\nquashing the proceedings pending against the petitioners\npursuant to Crime No.829 of 2023 of Pandikkad Police\nStation.\n4. On instructions, learned Public Prosecutor submitted\nthat the matter is settled, and produced the signed\nstatement of the 2\" respondent, to the effect that she is\nnot intending to proceed with the prosecution, and she has\nno objection in quashing Annexure Al FIR and Annexure\nA2 final report in Crime No.829 of 2023 of Pandikkad Police\nStation pending as C.C.No.1641 of 2023.\n5. Since the matter stands settled, no purpose would be\nserved by continuing the prosecution against the\npetitioners.\n6. In the light of the principles laid down by the Apex\nCourt in Gian Singh v. State of Punjab and Another;\n\nReta\noe\nEa Pa\n2024/KER/4886\nCRL.MC NO.19 OF 2024\n4\n[(2012) 10 SCC 303) ], and State of Madhya Pradesh\nv. Laxmi Narayan and Others; [(2019) 5 SCC 688],\nthis Court is of the view that the proceedings against the\npetitioners can be quashed on the basis of settlement.\nMoreover, the dispute is purely personal in nature, and no\npublic interest is involved in it.\nIn the result, this Crl.M.C. is allowed and Annexures\nAl and A2, the FIR and final report respectively, in Crime\nNo.829 of 2023 of Pandikkad Police Station, pending as\nC.C.No.1641 of 2023 on the file of Judicial First Class\nMagistrate Court-II, Perinthalmanna, stand quashed.\nSd/-\nSOPHY THOMAS\nJUDGE\nSSK/22/01\n\nlea el\nee RG\noe\nHR eerire\n2024/KER/4886\nCRL.MC NO.19 OF 2024\n5\nAPPENDIX OF CRL.MC 19/2024\nPETITIONER ANNEXURES\nAnnexure -Al CERTIFIED COPY OF FIR IN CRIME NO.\n829/2023 OF PANDIKKAD POLICE STATION DATED\n02-11-2023.\nAnnexure -A2 CERTIFIED COPY OF FINAL REPORT IN CRIME\nNO. 829/2023 OF PANDIKKAD POLICE STATION\nDATED 30-11-2023.\nAnnexure -A3 THE ORIGINAL AFFIDAVIT DATED 15-12-2023\nSWORN BY THE 2ND RESPONDENT\n\n"
}