{
    "case_id": "",
    "court": "HIGH COURT OF KERALA AT ERNAKULAM\nPRESENT",
    "date": "MONDAY",
    "judge": "B.KEMAL PASHA",
    "petitioners": [
        "C.C. No.2208/2014",
        "$/O.SUBASH CHANDRA BOSE, POURNAMI,",
        "SAKTHIKULANGARA VILLAGE, KOLLAM.",
        "CHANDRA BOSE",
        "GEORGE\nR2",
        "MIDHUN BOSE, AGED 34 YEARS,",
        "MIDHUN BOSE",
        "Ble",
        "Annexure-2 affidavit",
        "ACCUSED:"
    ],
    "respondents": [
        "HIGH COURT OF KERALA, ERNAKULAM.",
        "S/O. THULASIDHARAN, PLAVELITHARA VEEDU,",
        "REPRESENTED BY THE PUBLIC PROSECUTOR,",
        "1. STATE OF KERALA,",
        "2. SAJAYAN, AGED 31 YEARS,",
        "PADINJARE KALLADA VILLAGE, KOLLAM- 691 001",
        "STATE/DEFACTO COMPLAINANT:",
        "R2 BY ADV. SRI.M.R.SARIN",
        "R1 BY PUBLIC PROSECUTOR SMT. SAREENA GEORGE"
    ],
    "sections": [
        "323",
        "294(b)"
    ],
    "outcome": "In the result, this Crl.M.C. is allowed",
    "full_text": "Bahl\nElz i mi\n2016/KER/64\nIN THE HIGH COURT OF KERALA AT ERNAKULAM\nPRESENT:\nTHE HONOURABLE MR. JUSTICE B.KEMAL PASHA\nMONDAY, THE 4TH DAY OF JANUARY 2016/14TH POUSHA, 1937\nCri.MC.No. 7846 of 2015 ()\nCRIME NO. 1546/2013 OF KOLLAM WEST POLICE STATION , KOLLAM DISTRICT\nPETITIONER/ACCUSED:\nMIDHUN BOSE, AGED 34 YEARS,\n$/O.SUBASH CHANDRA BOSE, POURNAMI,\nSAKTHIKULANGARA VILLAGE, KOLLAM.\nBY ADV. SRILAJAYA KUMAR. G\nRESPONDENT(S)/STATE/DEFACTO COMPLAINANT:\n1. STATE OF KERALA,\nREPRESENTED BY THE PUBLIC PROSECUTOR,\nHIGH COURT OF KERALA, ERNAKULAM.\n2. SAJAYAN, AGED 31 YEARS,\nS/O. THULASIDHARAN, PLAVELITHARA VEEDU,\nPADINJARE KALLADA VILLAGE, KOLLAM- 691 001\nR1 BY PUBLIC PROSECUTOR SMT. SAREENA GEORGE\nR2 BY ADV. SRI.M.R.SARIN\nTHIS CRIMINAL MISC. CASE HAVING COME UP FOR ADMISSION\nON 04-01-2016, THE COURT ON THE SAME DAY PASSED THE FOLLOWING:\nsts\n\na bel\neer ca\nBle in te\n2016/KER/64\nCri.MC.No. 7846 of 2015 ()\nAPPENDIX\nPETITIONER(S)’ ANNEXURES:\nANNEX I: CERTIFIED COPY OF THE FINAL REPORT IN CRIME NO.1546/2013 OF\nKOLLAM WEST POLICE STATION.\nANNEX 2: AFFIDAVIT SWORN BY THE 2ND RESPONDENT\nRESPONDENT(S)’ ANNEXURES: NIL\nITRUE COPY/\nP.S.TO JUDGE\nsis\n\n2016/KER/64\nB. KEMAL PASHA, J.\nee eaten\nORDER\nPetitioner is the accused in C.C. No.2208/2014 of the\nJudicial First Class Magistrate's Couri-Il, Kollam, which has\narisen from Crime No.1546/2013 of the Kollam West\nPolice Station, registered for the offences punishable under\nSections 323 and 294(b) of the Indian Penal Code.\n2. The matter has been amicably settled between\nthe petitioner and the defacto complainant, who is the 2\"\nrespondent herein. The defacto complainant has filed\nAnnexure-2 affidavit affirming that the matter has been\namicably settled between him and the petitioner and he has\nno complaints against the petitioner.\n3. No criminal antecedents have been reported\nagainst the petitioner. When the matter has been amicably\n\nrapa ss\n\n2016/KER/64\nCRL.M.C. No. 7846 of 2015 uoe\nsetiled, no purpose would be served in proceeding with the\nmatter further, and therefore, all further proceedings in\nC.C. No.2208/2014 pending before the Judicial First Class\nMagistrate's Court-ll, Kollam, as against the petitioner,\nbased on Annexure-1 Final Report, are liable to be\nquashed.\n\nIn the result, this Crl.M.C. is allowed and all further\nproceedings in C.C. No.2208/2014 pending before the\nJudicial First Class Magistrate's Court-Il, Kollam, as against\nthe petitioner, based on Annexure-1 Final Report, are\nhereby quashed.\n\nSd/- B.KEMAL PASHA, JUDGE.\nStu/04.01.2016.\n[True copy] PS. to Judge\n\n"
}