{
    "case_id": "",
    "court": "HIGH COURT OF KERALA AT ERNAKULAM\nPRESENT\nTHE HONOURABLE MR",
    "date": "2021",
    "judge": "Baers",
    "petitioners": [
        "S:",
        "KARAVALOOR P.O., PUNALUR VILLAGE, KOLLAM",
        "S/O.MEHABOOB, THANZEER MANZIL, PAKIDIYIL,",
        "P.O., PUNALUR VILLAGE, KOLLAM DISTRICT-691",
        "S/O.RAJESH.V., SARADHAS, MANALIL, MANALIPACHA",
        "Mohan Abbot v. State of Punjab",
        "305.",
        "CHEMMANTHOOR, PUNALUR P.O., AND VILLAGE,",
        "AGED 19 YEARS",
        "5 AAKHIL SALIM,",
        "S/O.SALIM, ASHIK MANZIL, KUTHIRACHIRA, PUNALUR",
        "6 LIJOY OOMMEN,",
        "DISTRICT-691 333.",
        "BER",
        "AGED 20 YEARS",
        "2 THANZEER,",
        "KOLLAM DISTRICT-691 305.",
        "ASHIK MANZIL",
        "THANZEER MANZIL",
        "1 KARTHI",
        "S/O.OOMMEN K.VARGHESE, KOZHIDASSERIL HOUSE,",
        "S/O.RAVEENDRAN.K., MARAMCODE CHARUVILA VEEDU,",
        "Gian Singh v. State of",
        "AGED 22 YEARS",
        "VALACKODE P.O., PUNALUR VILLAGE, KOLLAM",
        "S/O.RAJU.T., KARTHIK BHAVAN, PAKIDIYIL,",
        "4 JISHNU.R.,",
        "DISTRICT-691 331.",
        "3 SARATH,",
        "312.",
        "AGED 21 YEARS",
        "Bienen"
    ],
    "respondents": [
        "S:",
        "R3 BY ADV. ANSU VARGHESE",
        "2 THE SUB INSPECTOR OF POLICE,",
        "PP T.R.RENJITH",
        "POLICE STATION OF PUNALUR, KOLLAM DISTRICT-691",
        "S/O. ANILOKUMAR, S.N.NIVAS, KAVALPURAM,",
        "KUNNICODE P.O., VILAKUDY VILLAGE, PATHANAPURAM",
        "TALUK, KOLLAM DISTRICT-691 508.",
        "3 AKSHAY ANIL,",
        "OTHER PRESENT:",
        "REPRESENTED BY PUBLIC PROSECUTOR, HIGH COURT",
        "Kollam",
        "AGED 20 YEARS",
        "OF KERALA, ERNAKULAM-682 031.",
        "1 THE STATE OF KERALA",
        "305."
    ],
    "sections": [
        "323",
        "341",
        "143",
        "149",
        "147",
        "294"
    ],
    "outcome": "In the result, this Crl.M.C is allowed",
    "full_text": "Bees hl\na\nae\nBaers\n2021/KER/1524\nIN THE HIGH COURT OF KERALA AT ERNAKULAM\nPRESENT\nTHE HONOURABLE MR.JUSTICE V.G.ARUN\nMONDAY, THE 11TH DAY OF JANUARY 2021 / 21TH POUSHA, 1942\nCr1.MC.No.2146 OF 2020(G)\nCRIME NO.213/2020 OF Punalur Police Station, Kollam\nPETITIONER/S:\n1 KARTHI\nAGED 22 YEARS\nS/O.RAJU.T., KARTHIK BHAVAN, PAKIDIYIL,\nCHEMMANTHOOR, PUNALUR P.O., AND VILLAGE,\nKOLLAM DISTRICT-691 305.\n2 THANZEER,\nAGED 21 YEARS\nS/O.MEHABOOB, THANZEER MANZIL, PAKIDIYIL,\nCHEMMANTHOOR, PUNALUR P.O., AND VILLAGE,\nKOLLAM DISTRICT-691 305.\n3 SARATH,\nAGED 19 YEARS\nS/O.RAJESH.V., SARADHAS, MANALIL, MANALIPACHA\nP.O., PUNALUR VILLAGE, KOLLAM DISTRICT-691\n312.\n4 JISHNU.R.,\nAGED 20 YEARS\nS/O.RAVEENDRAN.K., MARAMCODE CHARUVILA VEEDU,\nVALACKODE P.O., PUNALUR VILLAGE, KOLLAM\nDISTRICT-691 331.\n5 AAKHIL SALIM,\nAGED 19 YEARS\nS/O.SALIM, ASHIK MANZIL, KUTHIRACHIRA, PUNALUR\nP.O., PUNALUR VILLAGE, KOLLAM DISTRICT-691\n305.\n6 LIJOY OOMMEN,\nAGED 19 YEARS\nS/O.OOMMEN K.VARGHESE, KOZHIDASSERIL HOUSE,\nKARAVALOOR P.O., PUNALUR VILLAGE, KOLLAM\nDISTRICT-691 333.\n\nBees hl\nes\nae\nBER\n2021/KER/1524\nCri.M.C. No.2146 of 2020\n-2-\nBY ADVS.\nSRI.MANU RAMACHANDRAN\nSRI .M.KIRANLATL\nSRI.T.S.SARATH\nSRI.R.RAJESH (VARKALA)\nSHRI .SAMEER M NAIR\nRESPONDENT/S:\n1 THE STATE OF KERALA\nREPRESENTED BY PUBLIC PROSECUTOR, HIGH COURT\nOF KERALA, ERNAKULAM-682 031.\n2 THE SUB INSPECTOR OF POLICE,\nPOLICE STATION OF PUNALUR, KOLLAM DISTRICT-691\n305.\n3 AKSHAY ANIL,\nAGED 20 YEARS\nS/O. ANILOKUMAR, S.N.NIVAS, KAVALPURAM,\nKUNNICODE P.O., VILAKUDY VILLAGE, PATHANAPURAM\nTALUK, KOLLAM DISTRICT-691 508.\nR3 BY ADV. ANSU VARGHESE\nOTHER PRESENT:\nPP T.R.RENJITH\nTHIS CRIMINAL MISC. CASE HAVING COME UP FOR\nADMISSION ON 11.01.2021, THE COURT ON THE SAME DAY PASSED\nTHE FOLLOWING:\n\nBRS\nBienen\n2021/KER/1524\nCrl.M.C. No.2146 of 2020\n-3-\nORDER\nDated this the 11% day of January, 2021\nPetitioners are the accused in Crime No.\n213 of 2020 registered at the Punaloor Police\nStation for offences punishable under Sections\n143, 147, 294 (b), 341, 323 and 149 of IPC. The\nde facto complainant, at whose instance the crime\nwas registered, is arrayed as the third\nrespondent. Annexure A2 affidavit has been filed\nby the third respondent stating that the dispute\nwhich led to registration of the crime, has been\nsettled amicably and he has _ no_- subsisting\ngrievance in the matter.\n\n2. Heard the learned Public Prosecutor also,\nwho, on instructions, submits that the\npetitioners have no criminal antecedents.\n\n3. Having considered the gravity of the\n\nBRS\nBienen\n2021/KER/1524\nCrl.M.C. No.2146 of 2020\n-4-\n\noffences alleged, nature of the injury caused\nand having perused the affidavit filed by the\nthird respondent, the contents of which are\nsubmitted to be true and voluntary, I am\nsatisfied that the dispute is settled and that no\npublic interest is involved in this matter.\nMoreover, in view of the settlement, possibility\nof the criminal proceedings ending in conviction\nis remote. As such, continuance of the\nproceedings will amount to an abuse of process of\ncourt and hence, in view of the legal position\nset out by the Honourable Supreme Court in Madan\nMohan Abbot v. State of Punjab [(2008) 4 SCC 582]\nand Gian Singh v. State of Punjab and another\n[(2012) 10 SCC 303], there is no impediment in\ngranting the relief sought.\n\nIn the result, this Crl.M.C is allowed.\nAnnexure AI FIR and all proceedings in Crime\n\nBRS\nBienen\n2021/KER/1524\nCrl.M.C. No.2146 of 2020\n-5-\nNo.213 of 2020 registered at the Punaloor Police\nStation is quashed.\nSd/-\nV.G.ARUN\nJUDGE\n\n$c1/11.01.2021\n\nEle e101\nee\naaa\nEs i\n2021/KER/1524\nCrI.M.C. No.2146 of 2020\n-6-\nAPPENDIX\nPETITIONER'S/S EXHIBITS:\nANNEXURE AL THE TRUE COPY OF THE FIR IN CRIME\nNO.213/2020 OF POLICE STATION OF\nPUNALUR, KOLLAM DISTRICT.\nANNEXURE A2 THE ORIGINAL OF THE AFFIDAVIT DATED\n20.02.2020 SWORN BY THE 3RD\nRESPONDENT / DEFACTO COMPLAINANT.\n\n"
}