{
    "case_id": "Crl.MC.No. 2874 of 2016 ()",
    "court": "HIGH COURT OF KERALA AT ERNAKULAM\nPRESENT",
    "date": "2016",
    "judge": "SUNIL THOMAS",
    "petitioners": [
        "MC.No",
        "KOCHI-682031",
        "MANJERTI",
        "(S) /ACCUSED:"
    ],
    "respondents": [
        "(S) /STATE&DEFACTO COMPLAINANT:"
    ],
    "sections": [
        "482"
    ],
    "outcome": "this is not a matter to be quashed",
    "full_text": "Beas\n2016/KER/23861\nIN THE HIGH COURT OF KERALA AT ERNAKULAM\nPRESENT:\nTHE HONOURABLE MR. JUSTICE SUNIL THOMAS\nWEDNESDAY, THE 1ST DAY OF JUNE 2016/11TH JYAISHTA, 1938\nCrl.MC.No. 2874 of 2016 ()\nsc NO.638/2015 OF ADDL. DISTRICT COURT, MANJERI\nCRIME NO.168/2013 OF TIRUR POLICE STATION, MALAPPURAM\n\nPETITIONER (S) /ACCUSED:\n\nIBRAHIM,\n\nAGED: 34 YEARS, s/o. MUHAMMED, PUTHUPARAMBIL HOUSE,\n\nKAINIKKARA (PO), POILISSERY, MALAPPURAM DISTRICT\n\nBY ADV. SRI.R.RANJITH (MANJERTI)\nRESPONDENT (S) /STATE&DEFACTO COMPLAINANT:\n\n1. THE STATE OF KERALA\n\nREPRESENTED BY THE PUBLIC PROSECUTOR,\n\nHIGH COURT OF KERALA, ERNAKULAM,\n\nKOCHI-682031-FOR\n\nTHE SUB INSPECTOR OF POLICE,\n\nCHANGARAMKULAMI POLICE STATION, MALAPPURAM DISTRICT\n\n2. SABIRA\n\nw/o BEERANKUTTY, PARAMMEL HOUSE,\n\nKAINIKKARA, POILISSERI, TIRUR TALUK,\n\nMALAPPURAM DISTRICT-676 101\n\nR2 BY ADV. SMT.M.LISHA\n\nR1 BY PUBLIC PROSECUTOR SMT.M.T.SHEEBA\n\nTHIS CRIMINAL MISC. CASE HAVING COME UP FOR ADMISSION ON\n\n01-06-2016, THE COURT ON THE SAME DAY PASSED THE FOLLOWING:\n\nBeas\n2016/KER/23861\nCr1.MC.No. 2874 of 2016 ()\nAPPENDIX\n\nPETITIONER (S) ' EXHIBITS\nANNEXURE A: COPY OF THE FINAL REPORT /CHARGE IN CRIME NO.168/13 OF\nTTRUR POLICE STATION.\nANNEXURE B: COPY OF THE AFFIDAVIT SWORN TO BY THE 2ND RESPONDENT\nDT. 16/4/16.\nRESPONDENTS EXHIBITS: NIL\n\n/TRUE coPy/\n\nP.A. TO JUDGE\nSKV\n\nDh\n2016/KER/23861\nSUNIL THOMAS, J.\nDated this the 1* day of June, 2016\nORDER\n\nThe matter was argued at length by both sides.\n\n2. | Having regard to the nature of allegations, | feel that,\nthis is not a matter to be quashed in exercise of powers under\nSection 482 Cr.P.C. In the above circumstances, both sides\nsubmitted that, direction may be given to the court below to\nexpedite the proceedings to avoid agony of both sides. 3.\nHaving regard to this, | am inclined to direct the court below to\ntake up the Sessions Case No.638/2015 and to dispose it of, at\nthe earliest, having regard to the pendency of the cases and also\nother matters which require priority.\n\nCrl.M.C. stands closed with the above observation.\n\nSd/-\nSUNIL THOMAS, JUDGE.\n/true copy/\nP, A. to Judge\nPn\n\n"
}