{
    "case_id": "",
    "court": "HIGH COURT OF KERALA AT ERNAKULAM\nPRESENT",
    "date": "2015",
    "judge": "B.KEMAL PASHA",
    "petitioners": [
        "PATHANAPURAM TALUK, KOLLAM DISTRICT,",
        "ALANCHERY MURI, YEROOR VILLAGE,",
        "ANCHAL VILLAGE, PATHANAPURAM TALUK,",
        "NOW RESIDING AT ANIL BHAVAN, NETTAYAM MURI,",
        "KOLLAM DISTRICT.",
        "S.K. NIVAS",
        "ACCUSED:",
        "S/O. KUTTAPPAN, S.K. NIVAS, CHILLING PLANT,",
        "PRASANTH KUMAR, AGED 35 YEARS,"
    ],
    "respondents": [
        "2. THE SUB INSPECTOR OF POLICE,",
        "Ber",
        "S/STATE & COMPLAINANT:",
        "REPRESENTED BY THE PUBLIC PROSECUTOR,",
        "3. SUSHA, D/O. CHELLAMMA,",
        "4. STATE OF KERALA,",
        "R1 & R2 BY PUBLIC PROSECUTOR SRI.JIBU P.THOMAS.",
        "MANJU NIVAS, EDATHARA MURI,",
        "YEROOR POLICE STATION, KOLLAM DISTRICT-691 306.",
        "KADAKKAL VILLAGE, KOTTARAKKARA TALUK,",
        "HIGH COURT OF KERALA, ERNAKULAM-682 031.",
        "KOLLAM DISTRICT-691 121.",
        "R3 BY ADV. SRI.K.V.ANIL KUMAR."
    ],
    "sections": [
        "482",
        "3",
        "420",
        "17"
    ],
    "outcome": "Court-l, Punalur as C.C.1153/2014, quashed",
    "full_text": "eee\nSeen\n2015/KER/33\nIN THE HIGH COURT OF KERALA AT ERNAKULAM\nPRESENT:\nTHE HONOURABLE MR. JUSTICE B.KEMAL PASHA\nMONDAY, THE 5TH DAY OF JANUARY 2015/15TH POUSHA, 1936\nCri.MC.No. 6817 of 2014 ()\nCC. NO.1153/2014 OF JUDICIAL FIRST CLASS MAGISTRATE COURT-I, PUNALUR.\nCRIME NO. 546/2014 OF YEROOR POLICE STATION, KOLLAM DISTRICT.\nPETITIONER/ACCUSED:\nPRASANTH KUMAR, AGED 35 YEARS,\nS/O. KUTTAPPAN, S.K. NIVAS, CHILLING PLANT,\nALANCHERY MURI, YEROOR VILLAGE,\nPATHANAPURAM TALUK, KOLLAM DISTRICT,\nNOW RESIDING AT ANIL BHAVAN, NETTAYAM MURI,\nANCHAL VILLAGE, PATHANAPURAM TALUK,\nKOLLAM DISTRICT.\nBY ADV. SRI.P.VDILEEP.\nRESPONDENTS/STATE & COMPLAINANT:\n4. STATE OF KERALA,\nREPRESENTED BY THE PUBLIC PROSECUTOR,\nHIGH COURT OF KERALA, ERNAKULAM-682 031.\n2. THE SUB INSPECTOR OF POLICE,\nYEROOR POLICE STATION, KOLLAM DISTRICT-691 306.\n3. SUSHA, D/O. CHELLAMMA,\nMANJU NIVAS, EDATHARA MURI,\nKADAKKAL VILLAGE, KOTTARAKKARA TALUK,\nKOLLAM DISTRICT-691 121.\nR1 & R2 BY PUBLIC PROSECUTOR SRI.JIBU P.THOMAS.\nR3 BY ADV. SRI.K.V.ANIL KUMAR.\nTHIS CRIMINAL MISC. CASE HAVING COME UP FOR ADMISSION\nON 05-01-2015, THE COURT ON THE SAME DAY PASSED THE\nFOLLOWING:\nrs.\n\neee\nSeen\n2015/KER/33\nCri.MC.No. 6817 of 2014\nAPPENDIX\nPETITIONER'S ANNEXURES:-\nANNEXURE A‘ COPY OF THE FINAL REPORT IN CRIME NO.546/2014\nOF YEROOR POLICE STATION.\nANNEXURE A2 AFFIDAVIT OF THE 3RD RESPONDENT.\nRESPONDENT'S ANNEXURES:- NIL.\nTRUE COPY//\nP.S. TO JUDGE\nrs.\n\nBer sel\n2015/KER/33\nB.KEMAL PASHA, J.\neee eae es een\nORDER\n\nPetitioner is the accused in C.C.No.1153/2014 of the\nJudicial First Class Magistrate's Court-l, Punalur which has\narisen from Crime No.546/14 of the Yeroor Police Station,\nKollam. The case relates to the offences punishable under\nSection 420 of the Indian Penal Code and Sections 3 and\n17 of the Kerala Money Lender's Act.\n\n2. The petitioner has come up with this Crl.M.C.\nunder Section 482 CrPC. for getting Annexure A1 final\nreport in Crime No.546/2014 of the Yeroor Police Station,\nnow pending before the Judicial First Class Magistrate's\nCourt-l, Punalur as C.C.1153/2014, quashed.\n\n3. The allegation against the petitioner is that the\ndefacto complainant had borrowed an amount of %3 lakhs\n\nBer sel\n\n2015/KER/33\nCRL.M.C.No.6817 of 2014 oe\nfrom the petitioner on 05.05.2010 by furnishing signed blank\ncheque leaves, signed blank stamp papers etc. as security.\nEven though the defacto complainant had paid an amount of\n~14,40,000/- to the petitioner by way of repayment towards\nthe said transaction, the petitioner has not cared to return\nthe documents obtained by him from the defacto\ncomplainant. According to the petitioner, the matter has\nbeen amicably settled between him and the defacto\ncomplainant and presently the defacto complainant has no\ncomplaints against him.\n\n4. Heard learned counsel for the petitioner, the\nlearned counsel for the defacto complainant, who is the 3°\nrespondent herein, and the learned Public Prosecutor.\n\n5. The defacto complainant, who is the 3\"\nrespondent herein, has filed an affidavit affirming that the\nmatter has been amicably settled between her and the\npetitioner and, therefore, she does not want to proceed\nagainst the petitioner. As the matter relates to a money\ntransaction and when the matter has been settled, there is\n\nBer sel\n\n2015/KER/33\nCRL.M.C.No.6817 of 2014 uae\nno meaning in further proceeding with the matter in\nquestion. The 3 respondent has entered appearance\nthrough her counsel. The learned counsel for the 3°\nrespondent also endorses the fact that the affidavit has\nbeen sworn in by the defacto complainant on her own\nvolition and that the matter has been amicably settled.\nMatters being so, it is only just and proper in the interest of\njustice to quash all further proceedings in Annexure A1 final\nreport in Crime No.546/2014 of the Yeroor Police Station\nnow pending before the Judicial First Class Magistrate's\nCourt-l, Punalur as C.C.1153/2014.\n\nIn the result, this Crl.M.C is allowed and Annexure A1\nfinal report in Crime No.546/2014 of the Yeroor Police\nStation, and all proceedings pending before the Judicial\nFirst Class Magistrate's Court-l, Punalur on it as\nC.C.1153/2014, are hereby quashed.\n\nSd/- B.KEMAL PASHA, JUDGE\nul/-\n\n[True copy] PS. to Judge\n\n"
}