{
    "case_id": "Crl.MC.No. 8168 of 2017 ()",
    "court": "HIGH COURT OF KERALA AT ERNAKULAM\nPRESENT",
    "date": "2017",
    "judge": "B.KEMAL PASHA",
    "petitioners": [
        "Plt",
        "Annexure A3",
        "AGED 30 YEARS,(A4), S/O. CHATTHU MANIYANI,",
        "KASARAGOD TALUK AND DISTRICT.",
        "1. GOVINDAN.T,",
        "AGED 39 YEARS, (A2), S/O. CHATTHU MANIYANI,",
        "AGED 33 YEARS(A3), S/O. K. KRISHNAN,",
        "MC.No",
        "J.\nDated",
        "AGED 41 YEARS, (A1) S/O. CHATTHU MANIYANI,",
        "JOHN",
        "3. SURESH KUMAR,",
        "THORANAM HOUSE, PARAYAMPALLAM, MUNNAD VILLAGE,",
        "4, ULLAS K,",
        "2. NARAYANAN.T,",
        "ACCUSED 1 TO 4:"
    ],
    "respondents": [
        "STATE - DEFACTO COMPLAINANT:",
        "REPRESENTED BY THE PUBLIC PROSECUTOR,",
        "HIGH COURT OF KERALA,",
        "1. STATE OF KERALA,",
        "ERNAKULAM-682 031",
        "2/-"
    ],
    "sections": [
        "323",
        "324",
        "506 (ii) read with Section 34 of the Indian Penal\nCode"
    ],
    "outcome": "2014 of the Bedakam Police Station, are liable to be quashed",
    "full_text": "pune\na oes uJ\nBeer\n2017/KER/49569\nIN THE HIGH COURT OF KERALA AT ERNAKULAM\nPRESENT:\nTHE HONOURABLE MR. JUSTICE B.KEMAL PASHA\nTHURSDAY, THE 7TH DAY OF DECEMBER 2017/16TH AGRAHAYANA, 1939\nCri.MC.No. 8168 of 2017 ()\nCC.NO. 3705/2014 OF JUDICIAL FIRST CLASS MAGISTRATE COURT-1, KASARAGOD\nCRIME NO. 357/2014 OF BEDAKOM POLICE STATION, KASARGOD DISTRICT\nPETITIONER(S)/ACCUSED 1 TO 4:\n1. GOVINDAN.T,\nAGED 41 YEARS, (A1) S/O. CHATTHU MANIYANI,\nTHORANAM HOUSE, PARAYAMPALLAM, MUNNAD VILLAGE,\nKASARAGOD TALUK AND DISTRICT.\n2. NARAYANAN.T,\nAGED 39 YEARS, (A2), S/O. CHATTHU MANIYANI,\nTHORANAM HOUSE, PARAYAMPALLAM, MUNNAD VILLAGE,\nKASARAGOD TALUK AND DISTRICT.\n3. SURESH KUMAR,\nAGED 33 YEARS(A3), S/O. K. KRISHNAN,\nTHORANAM HOUSE, PARAYAMPALLAM, MUNNAD VILLAGE,\nKASARAGOD TALUK AND DISTRICT.\n4, ULLAS K,\nAGED 30 YEARS,(A4), S/O. CHATTHU MANIYANI,\nTHORANAM HOUSE, PARAYAMPALLAM, MUNNAD VILLAGE,\nKASARAGOD TALUK AND DISTRICT.\nBY ADVS.SMT.HEMALATHA\nSRI.BINU GEORGE\nRESPONDENT(S)/STATE - DEFACTO COMPLAINANT:\n1. STATE OF KERALA,\nREPRESENTED BY THE PUBLIC PROSECUTOR,\nHIGH COURT OF KERALA,\nERNAKULAM-682 031\n2/-\n\npune\na a ]\n2017/KER/49569\n2.\nCri. MiC.No. 8168 of 2017 ()\n2. RAJAN.T,\nAGED 46 YEARS, S/O. K. KRISHNAN,\nTHORANAM HOUSE, PARAYANPALLAM, MUNNAD VILLAGE,\nKASARAGOD TALUK AND DISTRICT - 671 315.\nR1 BY PUBLIC PROSECUTOR SRI.C.S.HRITHWIK\nR2 BY ADV. SRI.JOY JOHN (POTTAKKATTIL)\nTHIS CRIMINAL MISC. CASE HAVING COME UP FOR ADMISSION\nON 07-12-2017, THE COURT ON THE SAME DAY PASSED THE FOLLOWING:\nsts\n\npune\nbm 27 a UJ\npees\n2017/KER/49569\nCrl.MC.No. 8168 of 2017 ()\nAPPENDIX\nPETITIONER(S)' ANNEXURES:\nANNEXURE A1_ CERTIFIED COPY OF FIR IN CRIME NO. 357/2014 OF BEDAKAM\nPOLICE STATION.\nANNEXURE A2_ CERTIFIED COPY OF FINAL REPORT IN CRIME NO. 357/2014 OF\nBEDAKAM POLICE STATION.\nANNEXURE A3_ AFFIDAVIT DATED 16.11.2017 SWORN BY THE 2ND RESPONDENT.\nRESPONDENT(S)' ANNEXURES: NIL\nITRUE COPY!\nP.A.TO JUDGE\nsts\n\nPlt)\n2017/KER/49569\nB. KEMAL PASHA, J.\nDated this the 7‚Äù day of December, 2017\nORDER\n\nPetitioners are accused in Crime No.357 of 2014 of\nBedakam Police Station, which is now pending as C.C.No.3705\nof 2014 of the Judicial First Class Magistrate's Court-I,\nKasaragod, for the offences punishable under Sections 323,\n324 and 506 (ii) read with Section 34 of the Indian Penal\nCode.\n\n2. It seems that the matter has been amicably settled\nbetween the parties.\n\n3. On going through the facts and circumstances of the\ncase, it seems that the matter can be permitted to be settled.\nNo criminal antecedents have been reported against the\npetitioners. The second respondent has filed separate affidavits\nas Annexure A3, affirming that the matter has been amicably\nsettled between him and the petitioners and he has_ no\ncomplaint against the petitioners. Considering the fact that\n\nEi aael\natee|\nBae\n2017/KER/49569\nCri.M.C. No.8168 of 2017\n-2-\n\nthe matter has already been settled amicably between the\n\nparties, this court is satisfied that no purpose would be served\n\nin proceeding with the trial of the case. Matters being so, all\n\nfurther proceedings in C.C.No.3705 of 2014 of the Judicial First\n\nClass Magistrate's Court-I, Kasaragod, in Crime No.357 of\n\n2014 of the Bedakam Police Station, are liable to be quashed.\n\nIn the result, this Crl.M.C. is allowed and all further\nproceedings in C.C.No.3705 of 2014 of the Judicial First Class\nMagistrate's Court-I, Kasaragod, in Crime No.357 of 2014 of\nthe Bedakam Police Station, are hereby quashed.\n\nSd/-\nB.KEMAL PASHA\nJUDGE\nScl/07.12.2017\n\n"
}