{
    "case_id": "Crl.MC.No. 4937 of 2016 ()",
    "court": "HIGH COURT OF KERALA AT ERNAKULAM\nPRESENT",
    "date": "WEDNESDAY",
    "judge": "MC.No",
    "petitioners": [
        "BCG GOLDEN ORCHID",
        "ACCUSED :",
        "Kochi",
        "DIVYA SANJU",
        "J.\nCrl"
    ],
    "respondents": [
        "/COMPLAINANT :"
    ],
    "sections": [
        "138"
    ],
    "outcome": "Crl.M.C is disposed",
    "full_text": "leery\nBas\n2016/KER/33895\nIN THE HIGH COURT OF KERALA AT ERNAKULAM\nPRESENT :\nTHE HONOURABLE MR. JUSTICE SUNIL THOMAS\nWEDNESDAY, THE 3RD DAY OF AUGUST 2016/12TH SRAVANA, 1938\nCrl.MC.No. 4937 of 2016 ()\nAGAINST THE ORDER/JUDGMENT IN CC 2692/2015 of JUDICIAL FIRST\nCLASS MAGISTRATE COURT (SPL. COURT FOR TRIAL OF SEC.138, NI ACT\nCASES\n\nPETITIONER/ACCUSED :\n\nDIVYA SANJU\n\nAGED 31, W/o. SANJU, BCG GOLDEN ORCHID,\n\nFLAT NO.4B, THAMMANAM, KOCHI-17.\n\nBY ADV. SRI.K.V.SABU\nRESPONDENT /COMPLAINANT :\n\nSTATE OF KERALA\n\nREPRESENTED BY THE PUBLIC PROSECUTOR,\n\nHIGH COURT OF KERALA, ERNAKULAM-682 031.\n\nBY PUBLIC PROSECUTOR: SMT M T SHEEBA\n\nTHIS CRIMINAL MISC. CASE HAVING BEEN FINALLY HEARD ON\n\n03-08-2016, THE COURT ON THE SAME DAY PASSED THE FOLLOWING:\n\nPlein lal\n2016/KER/33895\nSUNIL THOMAS, J.\nCrl.M.C.No.4937 of 2016\nDated this the 3\" day of August, 2016\nORDER\nNotice given to the learned Public Prosecutor.\n\n2. Heard.\n\n3. Petitioner herein stands arrayed as the accused in\nC.C.No.2692 of 2016 of N.I. Special Court, Kochi for offence\npunishable under section 138 of the Negotiable Instruments Act.\n\n4. Petitioner herein was issued with summons for\nappearance. She failed to appear before the court below and\nconsequently, warrant was issued to her. Petitioner contends that\nsummons was not served on her. Petitioner submits that she is\nready and willing to surrender before the jurisdiction of the court\nbelow and to seek bail. However, only apprehension of the\npetitioner is that in the event of she surrendering before the learned\nmagistrate, bail application is not likely to be considered on the\nsame day and she is likely to be remanded.\n\n5, Having regard to the apprehension of the petitioner\nherein, I am inclined to dispose of the petition with a direction that\nin the event of the petitioner herein surrendering before the learned\n\nBIE h\nRec red\nElz a aH\n2016/KER/33895\nCri.M.C.4937/16\n2\nmagistrate and filing an application for bail, it shall be considered\nby the learned magistrate on the same day itself, having regard to\nthe nature of contentions and all attending circumstances.\nCrl.M.C is disposed of.\nSd/-\nSUNIL THOMAS\nJudge\nSbna/4/3/16\nTrue Copy /\nPA to Judge\n\n"
}