{
    "case_id": "Crl.MC.No. 3 of 2019",
    "court": "HIGH COURT OF KERALA AT ERNAKULAM",
    "date": "2019",
    "judge": "K.ABRAHAM MATHEW",
    "petitioners": [
        "JOMY",
        "MC.No",
        "Tes Tal",
        "S /ACCUSED :-",
        "K.ABRAHAM MATHEW",
        "KANNIMELVILAYIL VEEDU",
        "JOMY LNAD, KOYIVILA MURI, KOYIVILA P.O, THEVALAKKARA",
        "Sd/-\nK.ABRAHAM MATHEW",
        "VILLAGE, KOLLAM DISTRICT.",
        "S/O. JAMES,",
        "AGED 39 YEARS"
    ],
    "respondents": [
        "REPRESENTED BY THE PUBLIC PROSECUTOR,",
        "KOLLAM DISTRICT 690 524",
        "3 ANTONY",
        "1 STATE OF KERALA",
        "2 THE SUB INSPECTOR OF POLICE",
        "KOLLAM DISTRICT 691 O01",
        "s/o. PETER, KANNIMELVILAYIL VEEDU, KOYIVILA P.O,",
        "S/STATE & COMPLAINANT :-",
        "CHAVARA THEKKUMBHAGAM POLICE STATION,",
        "AGED 53 YEARS",
        "HIGH COURT OF KERALA, ERNAKULAM 682 031.",
        "KOYIVILA MURI, THEVALAKKARA VILLAGE,"
    ],
    "sections": [
        "482",
        "323",
        "341",
        "324",
        "294(b)"
    ],
    "outcome": "the trial court may be quashed",
    "full_text": "lets Da\na\nBle ant\nIN THE HIGH COURT OF KERALA AT ERNAKULAM 2019/KER/S\nPRESENT\nTHE HONOURABLE MR. JUSTICE K.ABRAHAM MATHEW\nTHURSDAY ,THE O3RD DAY OF JANUARY 2019 / 13TH POUSHA, 1940\nCr1.MC.No. 3 of 2019\nIN cc 260/2017 of JUDICIAL FIRST CLASS MAGISTRATE COURT, CHAVARA\nCRIME NO. 291/2017 OF THEKKUMBHAGOM POLICE STATION , Kollam\nPETITIONERS /ACCUSED :-\nJOMY\nAGED 39 YEARS\nS/O. JAMES,\nJOMY LNAD, KOYIVILA MURI, KOYIVILA P.O, THEVALAKKARA\nVILLAGE, KOLLAM DISTRICT.\nBY ADV. SRI.K.V.ANIL KUMAR\nRESPONDENTS/STATE & COMPLAINANT :-\n1 STATE OF KERALA\nREPRESENTED BY THE PUBLIC PROSECUTOR,\nHIGH COURT OF KERALA, ERNAKULAM 682 031.\n2 THE SUB INSPECTOR OF POLICE\nCHAVARA THEKKUMBHAGAM POLICE STATION,\nKOLLAM DISTRICT 691 O01\n3 ANTONY\nAGED 53 YEARS\ns/o. PETER, KANNIMELVILAYIL VEEDU, KOYIVILA P.O,\nKOYIVILA MURI, THEVALAKKARA VILLAGE,\nKOLLAM DISTRICT 690 524\nBY ADV. SRI.P.V.DILEEP\nRL & R2 BY SRI ALEX M THOMBRA-PUBLIC PROSECUTOR\nTHIS CRIMINAL MISC. CASE HAVING BEEN FINALLY HEARD ON 03.01.2019,\nTHE COURT ON THE SAME DAY PASSED THE FOLLOWING:\n\nDes Tal\nOa\nCrl.MC.No. 3 of 2019 2019 KERIS\n2\nORDER\n\nPetition filed under section 482 Cr.P.C.\n\n2. Petitioner is the accused in C.C.No.260\nof 2017 on the file of the Judicial Magistrate of\nFirst Class, Chavara registered for the offences\nunder sections 294(b), 323, 324 and 341 IPC. The\nthird respondent is the victim. It is submitted that\nthe matter has been settled and the proceedings in\nthe trial court may be quashed.\n\n3. Heard the learned counsel for the\npetitioner and third respondent and the learned\nPublic Prosecutor.\n\n4. I have perused the affidavit filed by\nthe third respondent, who has entered appearance\nthrough counsel. I am satisfied that the matter has\nbeen settled and no public interest is involved in\nthis case. There is no impediment for granting the\nprayer of the petitioners.\n\nIn the result, this Crl.M.C is allowed. The\nproceedings in C.C.No.260 of 2017 on the file of the\n\nDes Tal\nF can\n|\nop\nCrl.MC.No. 3 of 2019 2019 KERIS\n3\nJudicial Magistrate of First Class, Chavara are\nquashed. If any material objects have been produced\nin this case, the trial court may pass appropriate\norders for their disposal.\nSd/-\nK.ABRAHAM MATHEW,\nJUDGE\nSMA\n\nTes Tal\n|\nieee\nCri.MC.No. 3 of 2019 2019/KER/S\nA\nAPPENDIX\nPETITIONER'S/S ANNEXURES :-\nANNEXURE A A TRUE COPY OF THE FINAL REPORT IN CRIME\nNO. 2911/2017 OF CHAVARA THERKKUMBHAGAM\nPOLICE STATION.\nANNEXURE B AFFIDAVIT OF THE RESPONDENT NO. 3\nRESPONDENT (S)' ANNEXURES :- NIL\n//TRUE copy//\nPA TO JUDGE\nSMA\n\n"
}