{
    "case_id": "",
    "court": "HIGH COURT OF KERALA AT ERNAKULAM\nPRESENT\nTHE HONOURABLE MR",
    "date": "2019",
    "judge": "K.ABRAHAM MATHEW",
    "petitioners": [
        "PERALAYIL HOUSE,",
        "MARAMPILLY VILLAGE ,MANJAPPETTY KARA,",
        "AGED 41 YEARS, S/O VEERAN,",
        "ERNARULAM DISTRICT.",
        "ERNAKULAM DISTRICT",
        "VENGOLA VILLAGE ,ALLAPRA KARA,",
        "3 SUDHEESH,",
        "S /ACCUSED NO.1 TO 3:",
        "KARIMBANACKAL HOUSE",
        "AGED 36 YEARS, S/O NARAYANAN,",
        "PERUMBAVOOR,",
        "K.ABRAHAM MATHEW",
        "2 SALIM,",
        "1 JALAL,",
        "AGED 41 YEARS, S/O SULAIMAN,",
        "MANIYAMKUDY KARA",
        "KARIMBANACKAL HOUSE,",
        "CHIRACKAKUDY HOUSE,",
        "MANJAPPETTY KARA"
    ],
    "respondents": [
        "ERNAKULAM",
        "S/STATE & COMPLAINANT:",
        "HIGH COURT OF KERALA,",
        "KULASEKHARAN VILLAGE ,MANIYAMKUDY KARA,",
        "AGED 39 YEARS, S/O SUKUMARAN,",
        "KANNYAKUMARI DISTRICT,",
        "2 SURESH",
        "STATE OF TAMILNADU.",
        "1 STATE OF KERALA,",
        "REPRESENTED BY PUBLIC PROSECUTOR,",
        "AMBALATHVILA HOUSE,"
    ],
    "sections": [
        "482",
        "341",
        "308",
        "427"
    ],
    "outcome": "proceedings in the trial court may be quashed",
    "full_text": "ees\nSeen\nBeast\n2019/KER/29\nIN THE HIGH COURT OF KERALA AT ERNAKULAM\nPRESENT\nTHE HONOURABLE MR. JUSTICE K.ABRAHAM MATHEW\nTHURSDAY ,THE 03RD DAY OF JANUARY 2019 / 13TH POUSHA, 1940\nCrl1.MC.No. 22 of 2019\nAGAINST CP 30/2017 of J.M.F.C-I, PERUMBAVOOR\nCRIME NO. 1349/2017 OF Perumbavoor Police Station ,\nErnakulam\nPETITIONERS /ACCUSED NO.1 TO 3:\n1 JALAL,\nAGED 41 YEARS, S/O SULAIMAN,\nCHIRACKAKUDY HOUSE,\nVENGOLA VILLAGE ,ALLAPRA KARA,\nPERUMBAVOOR,\nERNARULAM DISTRICT.\n2 SALIM,\nAGED 41 YEARS, S/O VEERAN,\nKARIMBANACKAL HOUSE,\nVENGOLA VILLAGE ,ALLAPRA KARA,\nPERUMBAVOOR,\nERNARULAM DISTRICT.\n3 SUDHEESH,\nAGED 36 YEARS, S/O NARAYANAN,\nPERALAYIL HOUSE,\nMARAMPILLY VILLAGE ,MANJAPPETTY KARA,\nERNAKULAM DISTRICT\nBY ADV. SRI.P.P.BIJU\n\nSeen\nElz\n2019/KER/29\nCrL.M.C, 22/19 -122-\nRESPONDENTS/STATE & COMPLAINANT:\n1 STATE OF KERALA,\nREPRESENTED BY PUBLIC PROSECUTOR,\nHIGH COURT OF KERALA,\nERNAKULAM\n2 SURESH\nAGED 39 YEARS, S/O SUKUMARAN,\nAMBALATHVILA HOUSE,\nKULASEKHARAN VILLAGE ,MANIYAMKUDY KARA,\nKANNYAKUMARI DISTRICT,\nSTATE OF TAMILNADU.\nBY ADV. SRI.ANISH PAUL\nSRI.ALEX M.THOMBRA, SR. PUBLIC PROSECUTOR\nTHIS CRIMINAL MISC. CASE HAVING COME UP FOR ADMISSION ON\n03.01.2019, THE COURT ON THE SAME DAY PASSED THE FOLLOWING:\n\nBSE\nor,\n2019/KER/29\nCrl.M.C. 22/19 -:3:-\nORDER\n\nPetition filed under Section 482 Cr.P.C.\n\n2. Petitioners are accused in C.P. No.30 of 2017 on the file of\nthe Judicial Magistrate of First Class-l, Perumbavoor registered for the\noffences under Sections 308, 341 and 427 IPC. The 2â„¢ respondent is the\nvictim. It is submitted that the matter has been settled and the\nproceedings in the trial court may be quashed.\n\n3. Heard the learned counsel for the petitioners and the second\nrespondeni and the learned Public Prosecutor.\n\n4. | have perused the affidavit filed by the second respondent,\nwho has entered appearance through counsel. | am satisfied that the\nmatter has been settled and no public interest is involved in this case.\nThere is no impediment for granting the prayer of the petitioners.\n\nIn the result, this Crl.M.C is allowed. The proceedings in C.P. No.30\nof 2017 on the file of the Judicial Magistrate of First Class-l, Perumbavoor\nare quashed. If any material objects have been produced in this case, the\ntrial court may pass appropriate orders for their disposal.\n\nSdi/-\nK.ABRAHAM MATHEW,\nJUDGE\nvps 4/1\n\nBoe\nBre pment Le A\nUa\nrea\n2019/KER/29\nCrl.M.C. 22/19 -:4:-\nAPPENDIX\nPETITIONER'S/S EXHIBITS:\nANNEXURE 1 TRUE COPY OF THE FINAL REPORT IN CRIME\nNO 1349/2017 OF PERUMBAVOOR, POLICE\nSTATION, ERNAKULAM DISTRICT\nANNEXURE 11 ORIGINAL OF THE AFFIDAVIT SWORN BY THE\n2ND RESPONDENT\nRESPONDENT'S/S' EXHIBITS:\nNIL\n/True Copy/\nvps PS to Judge\n\n"
}