{
    "case_id": "Crl.MC.No.8373 OF 2017",
    "court": "HIGH COURT OF KERALA AT HRNARULAM\nPRESENT\nTHE HONOURABLE MR",
    "date": "2021",
    "judge": "KOZHIKODE-673001",
    "petitioners": [
        "AGED 68 YEARS, S/O. PADMANABHAN KUTTY , CHULLIYAMKANDI",
        "1 SATHYAPALAN",
        "PARAMBU, ARAKKINAR P.O.,MAARAD, KOZHIKODE DISTRICT.",
        "2 PUSHPAMANT A.",
        "KOZHIKODE DSITRICT-\n",
        "PETER",
        "S/ACCUSED NOS.1 & 2:",
        "Sd/-\nP.V.KUNHIKRISHNAN",
        "AGED 52 YEARS, W/O. SATHYAPALAN ,CHULLIYAMKANDI"
    ],
    "respondents": [
        "2 LAL KRISHNA",
        "1 STATE OF KERALA",
        "AGED 20 YEARS, S/O. BABU, KATTUPARMBATH",
        "S/STATE & DEFACTO COMPLAINANT:",
        "KERALA, REPRESENTING SUB INSPECTOR OF POLICE MAARAD",
        "673028.",
        "POLICE STATION, KOZHIKODE-673001.",
        "HOUSE ,ARAKKINAR P.O., MAARAD, KOZHIKODE DSITRICT-",
        "REPRESENTED BY THE PUBLIC PROSECUTOR, HIGH COURT OF"
    ],
    "sections": [],
    "outcome": "Therefore, this Cr1.M.C is dismissed",
    "full_text": "Beer\naise\ner\n2021/KER/1241\nIN THE HIGH COURT OF KERALA AT HRNARULAM\nPRESENT\nTHE HONOURABLE MR. JUSTICE P.V.KUNHIKRISHNAN\nFRIDAY, THE O8TH DAY OF JANUARY 2021 / 18TH POUSHA, 1942\nCr1.MC.No.8373 OF 2017\nCRIME NO.25/2017 OF MAARAD POLICE STATION , KOZHIKODE\nPETITIONERS/ACCUSED NOS.1 & 2:\n1 SATHYAPALAN\nAGED 68 YEARS, S/O. PADMANABHAN KUTTY , CHULLIYAMKANDI\nPARAMBU, ARAKKINAR P.O.,MAARAD, KOZHIKODE DISTRICT.\n2 PUSHPAMANT A.\nAGED 52 YEARS, W/O. SATHYAPALAN ,CHULLIYAMKANDI\nPARAMBU, ARAKKINAR P.O.,MAARAD, KOZHIKODE DISTRICT.\nBY ADV. SRI.S.K.SAJU\nRESPONDENTS/STATE & DEFACTO COMPLAINANT:\n1 STATE OF KERALA\nREPRESENTED BY THE PUBLIC PROSECUTOR, HIGH COURT OF\nKERALA, REPRESENTING SUB INSPECTOR OF POLICE MAARAD\nPOLICE STATION, KOZHIKODE-673001.\n2 LAL KRISHNA\nAGED 20 YEARS, S/O. BABU, KATTUPARMBATH\nHOUSE ,ARAKKINAR P.O., MAARAD, KOZHIKODE DSITRICT-\n673028.\nSRI.SANTOSH PETER, SR.PP\nTHIS CRIMINAL MISC. CASE HAVING BEEN FINALLY HEARD ON\n08.01.2021, THE COURT ON THE SAME DAY PASSED THE FOLLOWING:\n\nBerl\nBer\nCrl.MC.No.8373 OF 2017 202 1KER/T241\n2\nORDER\nDated this the 8 day of January 2021\nWhen this case came up for consideration, the\nlearned counsel appearing for the petitioners\nsubmitted that the petitioners are no more.\nTherefore, this Cr1.M.C is dismissed recording\nthe submission of the learned counsel for the\npetitioners.\nSd/-\nP.V.KUNHIKRISHNAN\nJUDGE\nDM\n\nDeere\nStee\nPeet\nCrl.MC.No.8373 OF 2017 2021/KER/1241\n3\nAPPENDIX\nPETITIONERS' EXHIBITS:\nANNEXURE Al TRUE COPY OF THE FIR IN CRIME\nNO.25/2017 REGISTERED BY THE 18ST\nRESPONDENT.\nANNEXURE A2 ANNEXURETRUE COPY OF THE 1ST\nINFORMATION STATEMENT DATED 02.01.2017\nGIVEN BY THE 2ND RESPONDENT TO THE\nPOLICE.\nANNEXURE A3 CERTIFIED COPY OF THE FINAL REPORT\nDATED 15.02.2017 IN CRIME NO.25/2017.\nANNEXURE A4 TRUE COPY OF THE MEMO OF EVIDENCE ALONG\nWITH DEPOSITION OF ALL WITNESSES.\nRESPONDENTS' EXHIBITS :NIL\n//TRUE COPY//\nPA TO JUDGE\n\n"
}