{
    "case_id": "",
    "court": "HIGH COURT OF KERALA AT ERNAKULAM\nPRESENT\nTHE HONOURABLE MR",
    "date": "TUESDAY",
    "judge": "Kozhikode District",
    "petitioners": [
        "S:",
        "AGED 31 YEARS",
        "Singh v. State",
        "AGED 76 YEARS",
        "1 GOKULDAS",
        "2 BABU",
        "Rs.1,50,000/-",
        "Gian Singh v. State of",
        "Others",
        "Kozhikode District",
        "KOZHIKODE, PIN - 673005",
        "PIN - 673005",
        "S/0 SIVANANDAN, VAISHNAVAM, PEEDIKAKANDY, EDAKKAD PO,",
        "S/0 UNNIPPACHCHU, PEEDIKAKANDY, EDAKKAD PO, KOZHIKODE,",
        "Yogendra Yadav"
    ],
    "respondents": [
        "S:",
        "VALIYAPARAMB, KODUVALLTI PO, KOZHIKODE, PIN - 673572",
        "Kozhikode",
        "AGED 58 YEARS",
        "1 STATE OF KERALA",
        "S/0 SEYTHUTTY HAJI, MUTHUVATTUSERI (VEEDU),",
        "2 THE STATION HOUSE OFFICER",
        "OTHER PRESENT:",
        "DISTRICT, PIN - 673303",
        "PIN - 682031",
        "REPRESENTED BY PUBLIC PROSECUTOR, HIGH COURT OF KERALA,",
        "3 ABDUL NAZAR M",
        "ELATHOOR POLICE STATION, ELATHOOR PO, KOZHIKODE"
    ],
    "sections": [
        "482",
        "506 r/w Section\n34 of the Indian Penal Code",
        "1860",
        "447",
        "427"
    ],
    "outcome": "petitioners ought to be quashed",
    "full_text": "Biel\npe eer ea\nBeer\n2024/KER/8030\nCRL.MC NO. 168 OF 2024\n2\nIN THE HIGH COURT OF KERALA AT ERNAKULAM\nPRESENT\nTHE HONOURABLE MR. JUSTICE BECHU KURIAN THOMAS\nTUESDAY, THE 2382 DAY OF JANUARY 2024 / 3RD MAGHA, 1945\nCRL.MC NO. 168 OF 2024\nCRIME NO.609/2023 OF Elathur Police Station, Kozhikode\nPETITIONER/S:\n1 GOKULDAS\nAGED 31 YEARS\nS/0 SIVANANDAN, VAISHNAVAM, PEEDIKAKANDY, EDAKKAD PO,\nKOZHIKODE, PIN - 673005\n2 BABU\nAGED 76 YEARS\nS/0 UNNIPPACHCHU, PEEDIKAKANDY, EDAKKAD PO, KOZHIKODE,\nPIN - 673005\nBY ADV C.R.JAYAKUMAR\nRESPONDENT/S:\n1 STATE OF KERALA\nREPRESENTED BY PUBLIC PROSECUTOR, HIGH COURT OF KERALA,\nPIN - 682031\n2 THE STATION HOUSE OFFICER\nELATHOOR POLICE STATION, ELATHOOR PO, KOZHIKODE\nDISTRICT, PIN - 673303\n3 ABDUL NAZAR M\nAGED 58 YEARS\nS/0 SEYTHUTTY HAJI, MUTHUVATTUSERI (VEEDU),\nVALIYAPARAMB, KODUVALLTI PO, KOZHIKODE, PIN - 673572\nOTHER PRESENT:\nSMT. SREEJA V. (PP)\nTHIS CRIMINAL MISC. CASE HAVING COME UP FOR ADMISSION ON\n23.01.2024, THE COURT ON THE SAME DAY PASSED THE FOLLOWING:\n\n2024/KER/8030\nCRL.MC NO. 168 OF 2024\n2\nBECHU KURIAN THOMAS, J.\n~ Cri.M.C.No.168 of 2024\nDated this the 23° day of January, 2024\nORDER\n\nPetitioners have invoked the jurisdiction under Section 482\nCr.P.C to quash all proceedings against them.\n\n2. Petitioners are the accused in Crime No.609/2023 of\nElathoor Police Station, Kozhikode District. According to the\nprosecution, on 06.07.2023, the accused demolished the compound\nwall of the defacto complainant’s property and damaged an electric\nmeter causing a loss of Rs.1,50,000/- and threatened to kill the\nworkers of the defacto complainant and thereby alleged to have\ncommitted the offences under Sections 447, 427 and 506 r/w Section\n34 of the Indian Penal Code, 1860. The 3% respondent is the defacto\ncomplainant\n\n3. Heard the learned Counsel for the petitioners and the\nlearned Counsel for the respondents, apart from the learned Public\nProsecutor.\n\n5. The learned Counsel for the petitioners submitted that the\nmatter has been settled and hence the proceedings against the\npetitioners ought to be quashed. It was also submitted that,\nconsidering the nature of offences alleged, no purpose would be\nserved by continuing the proceedings.\n\nDales\nHe ecg eee\nBiPaa rr\n2024/KER/8030\nCRL.MC NO. 168 OF 2024\n3\n6. In Gian Singh v. State of Punjab and another [(2012)\n10 SCC 303], the Apex Court has held that in appropriate cases, the\nHigh Court can take note of the amicable resolution of disputes\nbetween the victim and the wrongdoer to put an end to the criminal\nproceedings. This view was reiterated in Narinder Singh v. State of\nPunjab [(2014) 6 SCC 466] and Yogendra Yadav and Others v.\nState of Jharkhand and Another [(2014) 9 SCC 653].\n\n7. | have perused Annexure A2 affidavit filed by the 3”\nrespondent. The learned Public Prosecutor has submitted that upon\nverification, it is understood that the affidavit is genuine, and the\ndefacto complainant stands by the contens thereof. | am satisfied\nthat the matter has been settled and no public interest is involved in\nthis case. There is no impediment for granting the prayer for\nquashing. The continuance of the proceedings will only be an\nexercise in futility.\n\n8. Accordingly, all proceedings against the petitioners in Crime\nNo.609/2023 of Elathoor Police Station, Kozhikode District are\nquashed.\n\nThis Crl.M.C is allowed as above.\nsd/\nBECHU KURIAN THOMAS\nJUDGE\njm/\n\nal\ntere\napt\n2024/KER/8030\nCRL.MC NO. 168 OF 2024\n4\nAPPENDIX OF CRL.MC 168/2024\nPETITIONER ANNEXURES\nAnnexure Ai TRUE COPY OF THE FIR IN CRIME NO. 609/2023 OF\nELATHOOR POLICE STATION, KOZHIKODE DATED\n11.07.2023\nAnnexure A2 THE AFFIDAVIT PREPARED BY THE 3RD RESPONDENT\nDATED 09/12/2023\n\n"
}