{
    "case_id": "Crl.MC.No.3939 OF 2020(B)",
    "court": "HIGH COURT OF KERALA AT ERNAKULAM",
    "date": "2021",
    "judge": "KOCHUVIAHALIL HOUSE",
    "petitioners": [
        "SRI.JOSEPH GEORGE",
        "AGED 56 YEARS",
        "S/ACCUSED NOS.1 TO 3:",
        "THOMAS GEORGE\nSRI.P.A.REJIMON\nRESPONDENTS/COMPLAINANT & STATE",
        "AGED 42 YEARS",
        "S/O. C.M VARGHESE, KOCHUVIAHALIL HOUSE,",
        "PIN 689 542.",
        "NEDUMPURATHUMALA, THOTTAPUZHA,",
        "KOCHUVIAHALIL HOUSE",
        "2 BINDU VARGHESE,",
        "W/O. SAJI VARGHESE, KOCHUVIAHALIL HOUSE,",
        "AGED 80 YEARS",
        "3 VARGHESE MAMMEN @ RAJAN,",
        "ERAVIPEROOR VILLAGE,",
        "1 C.M. VARGHESE",
        "THIRUVALLA TALUK, PATHANAMTHITTA DISTRICT,",
        "P.C.",
        "ERAVIPEROOR VILLAGE, THIRUVALLA TALUK,",
        "PIN 689 542",
        "PATHANAMTHITTA DISTRICT,",
        "PATHANAMTHITTA DISTRICT, PIN 689 542",
        "S/O. LATE MAMMEN, KOCHUVIZHALIL HOUSE,"
    ],
    "respondents": [
        "1 K.A. VARGHESE",
        "PIN 689 541",
        "AGED 65 YEARS",
        "THOTTAPUZHA, NEDUMPRATHUMALA,",
        "S/O. K.V ABRAHAM, KALLOOTHARA HOUSE,",
        "ERAVIPEROOR VILLAGE AND P.O,",
        "S/COMPLAINANT & STATE:"
    ],
    "sections": [
        "200"
    ],
    "outcome": "The Crl.M.C. is dismissed",
    "full_text": "pte |\nEle 4 te\nIN THE HIGH COURT OF KERALA AT ERNAKULAM 2021/KER/TOO4\nPRESENT\nTHE HONOURABLE MR. JUSTICE P.SOMARAJAN\nMONDAY, THE 11TH DAY OF JANUARY 2021 / 21TH POUSHA, 1942\nCri.MC.No.3939 OF 2020 (B)\nAGAINST THE ORDER/JUDGMENT IN CC 1916/2016 OF JUDICIAL MAGISTRATE\nOF FIRST CLASS ,THIRUVALLA\nPETITIONERS/ACCUSED NOS.1 TO 3:\n1 C.M. VARGHESE\nAGED 80 YEARS\nS/O. LATE MAMMEN, KOCHUVIZHALIL HOUSE,\nNEDUMPURATHUMALA, THOTTAPUZHA,\nERAVIPEROOR VILLAGE, THIRUVALLA TALUK,\nPATHANAMTHITTA DISTRICT, PIN 689 542\n2 BINDU VARGHESE,\nAGED 42 YEARS\nW/O. SAJI VARGHESE, KOCHUVIAHALIL HOUSE,\nNEDUMPURATHUMALA, THOTTAPUZHA,\nERAVIPEROOR VILLAGE,\nTHIRUVALLA TALUK, PATHANAMTHITTA DISTRICT,\nPIN 689 542\n3 VARGHESE MAMMEN @ RAJAN,\nAGED 56 YEARS\nS/O. C.M VARGHESE, KOCHUVIAHALIL HOUSE,\nNEDUMPURATHUMALA, THOTTAPUZHA,\nERAVIPEROOR VILLAGE, THIRUVALLA TALUK,\nPATHANAMTHITTA DISTRICT,\nPIN 689 542.\nBY ADVS.\nSRI.JOSEPH GEORGE\nSRI.BIJO THOMAS GEORGE\nSRI.P.A.REJIMON\nRESPONDENTS/COMPLAINANT & STATE:\n1 K.A. VARGHESE\nAGED 65 YEARS\nS/O. K.V ABRAHAM, KALLOOTHARA HOUSE,\nTHOTTAPUZHA, NEDUMPRATHUMALA,\nERAVIPEROOR VILLAGE AND P.O,\nPIN 689 541\n\noe\nEl: 4 ie\nCr1.MC.No.3939 OF 2020 (B) 2021/KER/1604\n2\n2 STATE OF KERLA\nREPRESENTED BY PUBLIC PROSECUTOR,\nHIGH COURT OF KERALA,\nERNAKULAM PIN 682 031\nRl BY ADV. SRI.MANU RAMACHANDRAN\nR1l BY ADV. SRI.T.S.SARATH\nR1 BY ADV. SRI.M.KIRANLAL\nRl BY ADV. SRI.R.RAJESH (VARKALA)\nR1 BY ADV. SHRI.SAMEER M NAIR\nR2 BY ADV. SRI.M.S.BREEZ, PUBLIC PROSECUTOR\nTHIS CRIMINAL MISC. CASE HAVING BEEN FINALLY HEARD ON\n11.01.2021, THE COURT ON THE SAME DAY PASSED THE FOLLOWING:\n\nee\nCrl.MC.No.3939 OF 2020(B) 2021/KER/1604\n3\nORDER\n\nThe challenge is against Annexure Al private\ncomplaint and the cognizances taken by the\nMagistrate thereof mainly on the reason that no\nsworn statement of the defacto complainant was\ntaken under Section 200 Cr.P.C. When the matter\ntaken up today, the learned counsel fairly\nsubmitted that the statement was recorded on the\nreverse side of the original complaint and hence\nthey are not pressing the Crl.M.C.\n\nThe Crl.M.C. is dismissed as notâ€™ pressed.\nwithout prejudice to the right of the petitioners\nto take all their contentions and remedies at the\nvarious stages of the proceedings.\n\nSd/-\nP. SOMARAJAN\nJUDGE\nSPV\n\noe\nEl: 4 ie\nCr1.MC.No.3939 OF 2020 (B) 2021/KER/1604\n4\nAPPENDIX\nPETITIONERS' EXHIBITS:\nANNEXURE A-1 CERTFIED COPY OF THE COMPLAINT IN C.C\n1916/2016 OF THE HON'BLE JUDICIAL iST\nCLASS MAGISTRATE COURT, THIRUVALLA\nANNEXURE A-2 CERTIFIED COPY OF SWORN STATEMENT OF\nCW-1 IN CMP 4244/2014 ON THE FILE OF\nTHE HON'BLE JUDICIAL 1ST CLASS\nMAGISTRATE COURT THIRUVALLA\nANNEXURE A-3 CERTIFIED COPY OF SWORN STATEMENT OF\nCW-2 IN CMP 4244/2014 ON THE FILE OF\nTHE HON'BLE JUDICIAL 1ST CLASS\nMAGISTRATE COURT THIRUVALLA\nANNEXURE A-4 THE PHOTOCOPY OF JUDGMENT DATED 14-11-\n2019 IN SC 529/2014 OF THE HON'BLE\nADDITIONAL SESSIONS JUDGE 1,\nPATHANAMTHITTA.\nRESPONDENTS' EXHIBITS: NIL\n//TRUE COPY//\nPA TO JUDGE\n\n"
}