{
    "case_id": "Crl.MC.No. 2603 of 2015 ()",
    "court": "HIGH COURT OF KERALAAT ERNAKULAM\nPRESENT",
    "date": "2015",
    "judge": "ANIL K.NARENDRAN",
    "petitioners": [
        "S/O.DASAYYAN, B L SADANAM, NELLIVILA",
        "MC.No",
        "BIJU D.R. AGED 38 YEARS",
        "ABDUL RASHEED",
        "SAJU\nSRI.C.PAULOSE\n",
        "MULLUVILA P.O., THIRUVANANTHAPURAM.",
        "ANNEXURE-2",
        "ACCUSED:",
        "Ernakulam",
        "Cap"
    ],
    "respondents": [
        "HIGH COURT OF KERALA, ERNAKULAM.",
        "REPRESENTED BY THE PUBLIC PROSECUTOR",
        "COMPLAINANT:",
        "STATE OF KERALA",
        "R BY PUBLIC PROSECUTOR SRI A.J.JOSE AEDAIOD!"
    ],
    "sections": [
        "468",
        "471"
    ],
    "outcome": "The petitioner is the accused in Crime No.1539 of 2014 of\nErnakulam Central Police Station, which is now pending as\nC.C.No.30 of 2015 on the file of the Chief Judicial Magistrate Court,\nErnakulam. The",
    "full_text": "Pale are\nas\n2015/KER/17452\nIN THE HIGH COURT OF KERALAAT ERNAKULAM\nPRESENT:\nTHE HONOURABLE MR. JUSTICE ANIL KINARENDRAN\nTUESDAY, THE 28TH DAY OF APRIL 2015/8TH VAISAKHA, 1937\nCrl.MC.No. 2603 of 2015 ()\nCC 30/2015 of CHIEF JUDL.MAGISTRATE, ERNAKULAM\nCRIME NO. 1539/2014 OF ERNAKULAM CENTRAL POLICE STATION, ERNAKULAM\nPETITIONER/ACCUSED:\nBIJU D.R. AGED 38 YEARS\nS/O.DASAYYAN, B L SADANAM, NELLIVILA\nMULLUVILA P.O., THIRUVANANTHAPURAM.\nBY ADVS.SRILSHABU SREEDHARAN\nSRI.S. VIJAYAN\nSRIN.MUHAMMAD SAJU\nSRI.C.PAULOSE\nSRI.SREEDHARAN KARATTA\nSMT.RESHMA ABDUL RASHEED\nRESPONDENT/COMPLAINANT:\nSTATE OF KERALA\nREPRESENTED BY THE PUBLIC PROSECUTOR\nHIGH COURT OF KERALA, ERNAKULAM.\nR BY PUBLIC PROSECUTOR SRI A.J.JOSE AEDAIOD!\nTHIS CRIMINAL MISC, CASE HAVING COME UP FOR ADMISSION ON\n28-04-2015, THE COURT ON THE SAME DAY PASSED THE FOLLOWING:\n\n[Cap ere I\nope\n2015/KER/17452\nCri.MC.No. 2603 of 2015 ()\nAPPENDIX\nPETITIONER(S)' EXHIBITS\nANNEXURE-1: THE TRUE COPY OF THE FIR WITH THE FIS DATED 7.7.2014.\nANNEXURE-2: THE TRUE COPY OF THE CHARGE SHEET DATED 14.1.2015.\nRESPONDENT(SY EXHIBITS: NIL\nTRUE COPY\nPS.TO JUDGE\ndsn\n\n.\n2015/KER/17452\nANIL K.NARENDRAN, J\nORDER\n\nThe petitioner is the accused in Crime No.1539 of 2014 of\nErnakulam Central Police Station, which is now pending as\nC.C.No.30 of 2015 on the file of the Chief Judicial Magistrate Court,\nErnakulam. The offence alleged against the petitioner is punishable\nunder Sections 468 and 471 of IPC. The grievance of the petitioner\nis that, the Magistrate Court has already issued non-bailable\nwarrant against him and if he surrenders before the Magistrate\nCourt there is every likelihood of the application not being\nconsidered on the very same day. Therefore, the petitioner seeks a\ndirection to consider his bail application on the day of surrender\nitself.\n\n2. Heard the learned counsel for the petitioner and the\nlearned Public Prosecutor.\n\n3. Considering the facts and circumstances of the case, this\nCrI.M.C. is disposed of directing the petitioner to surrender before\nthe Magistrate Court within a period of two weeks from today and\n\nce\nie\n2015/KER/17452\nCrl.M.C.No.2603/15 ~2-\nthe Magistrate Court is further directed to consider his bail\napplication on the day of surrender itself, strictly in accordance\nwith law. The non-bailable warrant already issued against the\npetitioner shall be kept in abeyance for a period of two weeks.\nThe Crl.M.C. is disposed of as above.\nSd/-\nANIL K.NARENDRAN,\nJUDGE\ndsn\n\n"
}