{
    "case_id": "Crl.MC.No.8941 OF 2019(Gc)",
    "court": "HIGH COURT OF KERALA AT ERNAKULAM",
    "date": "7th day of January, 2020",
    "judge": "Malappuram",
    "petitioners": [
        "MALAPPURAM",
        "MALAPPURAM DISTRICT.",
        "C.S. HRITHWIK",
        "AGED 47 YEARS,",
        "MULLAMBARA ROAD, P.O.MANJERI,",
        "MUJEEB RAHMAN,",
        "MILE",
        "S/O.ABDURAHMAN ,",
        "ALIYATHODI HOUSE, 22ND MILE,"
    ],
    "respondents": [
        "S:",
        "HIGH COURT OF KERALA, ERNAKULAM.",
        "REPRESENTED BY THE PUBLIC PROSECUTOR,",
        "S/O.ABDULLA,",
        "1 STATE OF KERALA",
        "OTHER PRESENT:",
        "MALAPPURAM DISTRICT-676 552.",
        "AGED 37 YEARS,",
        "R2 BY ADV. PRINSUN PHILIP",
        "F.I.S.IN CRIME NO.385/2019",
        "Manjeri",
        "2 JAMSHEER ,",
        "AARUVEETTIL HOUSE,",
        "N.S.S.COLLEGE P.O., MANJERI,"
    ],
    "sections": [
        "323",
        "482"
    ],
    "outcome": "/JUDGMENT IN CC 622/2019 OF JUDICIAL MAGISTRATE\nOF FIRST CLASS-—I ,MANJERI\nCRIME NO.385/2019 OF Manjeri Police Station , Malappuram\nPETITIONER:\nMUJEEB RAHMAN,\nAGED 47 YEARS,\nS/O.ABDURAHMAN ,\nALIYATHOD",
    "full_text": "Bl Eee CI\nBle te\nIN THE HIGH COURT OF KERALA AT ERNAKULAM 2020/KER/S66\nPRESENT\nTHE HONOURABLE MR. JUSTICE ASHOK MENON\nTUESDAY, THE 07TH DAY OF JANUARY 2020 / 17TH POUSHA, 1941\nCrl1.MC.No.8941 OF 2019 (G)\nAGAINST THE ORDER/JUDGMENT IN CC 622/2019 OF JUDICIAL MAGISTRATE\nOF FIRST CLASS-—I ,MANJERI\nCRIME NO.385/2019 OF Manjeri Police Station , Malappuram\nPETITIONER:\nMUJEEB RAHMAN,\nAGED 47 YEARS,\nS/O.ABDURAHMAN ,\nALIYATHODI HOUSE, 22ND MILE,\nMULLAMBARA ROAD, P.O.MANJERI,\nMALAPPURAM DISTRICT.\nBY ADV. SRI.U.K.DEVIDAS\nRESPONDENTS:\n1 STATE OF KERALA\nREPRESENTED BY THE PUBLIC PROSECUTOR,\nHIGH COURT OF KERALA, ERNAKULAM.\n2 JAMSHEER ,\nAGED 37 YEARS,\nS/O.ABDULLA,\nAARUVEETTIL HOUSE,\nN.S.S.COLLEGE P.O., MANJERI,\nMALAPPURAM DISTRICT-676 552.\nR2 BY ADV. PRINSUN PHILIP\nOTHER PRESENT:\nSRI. C.S. HRITHWIK, SR. PUBLIC PROSECUTOR\nTHIS CRIMINAL MISC. CASE HAVING COME UP FOR ADMISSION ON\n07.01.2020, THE COURT ON THE SAME DAY PASSED THE FOLLOWING:\n\nCrl.MC.No.8941 OF 2019(Gc) 2020/KERIS66\n2\nORDER\nDated this the 7th day of January, 2020\n\nThe petitioner is the sole accused in C.C. No. 622 of 2019 on\nthe files of the Judicial First Class Magistrate Court-I, Manjeri, for\nhaving allegedly committed offences punishable under Sections 323 &\n324 of the IPC. The 27? respondent who is the defacto complainant and\ninjured. He appeared through counsel and filed an affidavit to the effect\nthat the matter has been amicably settled with the petitioner and that he\nhas no further grievance against the petitioner. A report has been\nobtained from the investigating Officer through the Senior Public\nprosecutor. The petitioner has no criminal antecedents. No public\ninterest is involved.\n\nHence, the Crl.M.C is allowed and the entire proceedings in\nC.C No.622/2019 on the files of the Judicial First Class Magistrate\nCourt-I, Manjeri stands quashed under Section 482 Cr.P.C and the\naccused is discharged.\n\nSd/-\nASHOK MENON\nJUDGE\n\nNR/07/01/20\n\nBl Eee CI\nEi ie\nCrl.MC.No.8941 OF 2019(Gc) 2020/KERIS66\n3\nAPPENDIX\nPETITIONER'S EXHIBITS:\nANNEXURE I CERTIFIED COPY OF THE FIRST INFORMATION\nREPORT AND F.I.S.IN CRIME NO.385/2019 OF\nMANJERI POLICE STATION DATED 17.08.2019.\nANNEXURE II CERTIFIED COPY OF THE FINAL REPORT IN\nCRIME NO.385/2019 OF VALANCHERI POLICE\nSTATION DATED 26.08.2019.\nANNEXURE III THE ORIGINAL OF THE AFFIDAVIT DATED\n03.12.2019 EXECUTED BY THE SECOND\nRESPONDENT.\nRESPONDENTS' EXHIBITS: NIL\n//TRUE COPY// PA TO JUDGE\n\n"
}