{
    "case_id": "",
    "court": "HIGH COURT OF KERALA AT ERNAKULAM\nPRESENT",
    "date": "THE 12TH DAY",
    "judge": "JUSTICE",
    "petitioners": [
        "VENGANELLUR DESOM, THRISSUR.",
        "S/O, RAMAN NAIR",
        "ANNX.II - COPY",
        "ACCUSED:",
        "DHEERENDRAKRISHNAN\nRESPONDENTS",
        "CHAKKUNNATHU HOUSE, VENGANELLUR VILLAGE,",
        "GOPI, AGED 50 YEARS"
    ],
    "respondents": [
        "14/02/2014 IN CRL.M.A.NO.1731/2014.",
        "S /COMPLAINANT/ STATE",
        "ERNAKULAM-682 031 (CRIME NO.624/2012 OF CHELAKKARA",
        "ADDITIONAL RESPONDENT",
        "KERALA STATE ELECTRICITY BOARD",
        "ELECTRICAL SECTION, CHELAKKARA",
        "THRISSUR DIST. - 680 586",
        "STATE OF KERALA",
        "R2 BY ADV. SRI.K.M.SATHYANATHA MENON ,SC,KSEB",
        "RL BY PUBLIC PROSECUTOR SMT.MAYA M.N.",
        "ASSISTANT ENGINEER",
        "POLICE STATION, THRISSUR DISTRICT)",
        "* ADDITIONAL RESPONDENT IS IMPLEADED AS PER ORDER DATED",
        "REP. BY PUBLIC PROSECUTOR, HIGH COURT OF KERALA,",
        "Chelakara"
    ],
    "sections": [
        "135",
        "379",
        "05",
        "136(e)",
        "2007",
        "138",
        "150"
    ],
    "outcome": "DATED\n14/02/2014 IN CRL.M.A.NO.1731/2014.\nR2 BY ADV. SRI.K.M.SATHYANATHA MENON ,SC,KSEB\nRL BY PUBLIC PROSECUTOR SMT.MAYA M.N.\nTHIS CRIMINAL MISC. CASE HAVING BEEN FINALLY HEARD ON\n12-01-2017, THE COUR",
    "full_text": "a\n= tate\nBee\n2017/KER/1800\nIN THE HIGH COURT OF KERALA AT ERNAKULAM\nPRESENT:\nTHE HONOURABLE MR. JUSTICE K.P.JYOTHINDRANATH\nTHURSDAY, THE 12TH DAY OF JANUARY 2017/22ND POUSHA, 1938\nCr1.MC.No. 5121 of 2013 ()\n( cc 68/2013 of J.M.F.C.,VADAKKANCHERRY)\nPETITIONER/ACCUSED:\nGOPI, AGED 50 YEARS\nS/O, RAMAN NAIR\nCHAKKUNNATHU HOUSE, VENGANELLUR VILLAGE,\nVENGANELLUR DESOM, THRISSUR.\nBY ADVS.SRI.S.RAJEEV\nSRI.K.K. DHEERENDRAKRISHNAN\nRESPONDENTS /COMPLAINANT/ STATE\nSTATE OF KERALA\nREP. BY PUBLIC PROSECUTOR, HIGH COURT OF KERALA,\nERNAKULAM-682 031 (CRIME NO.624/2012 OF CHELAKKARA\nPOLICE STATION, THRISSUR DISTRICT)\nADDITIONAL RESPONDENT\nASSISTANT ENGINEER\nKERALA STATE ELECTRICITY BOARD\nELECTRICAL SECTION, CHELAKKARA\nTHRISSUR DIST. - 680 586\n* ADDITIONAL RESPONDENT IS IMPLEADED AS PER ORDER DATED\n14/02/2014 IN CRL.M.A.NO.1731/2014.\nR2 BY ADV. SRI.K.M.SATHYANATHA MENON ,SC,KSEB\nRL BY PUBLIC PROSECUTOR SMT.MAYA M.N.\nTHIS CRIMINAL MISC. CASE HAVING BEEN FINALLY HEARD ON\n12-01-2017, THE COURT ON THE SAME DAY PASSED THE FOLLOWING:\n\naac\nEe\n7)\n[Eee\n2017/KER/1800\nCr1.MC.No. 5121 of 2013 ()\nAPPENDIX\nPETITIONER'S EXHIBITS\nANNX.1 - COPY OF THE FINAL REPORT IN CRIME\nNO.624/2012 OF CHELAKKARA POLICE STATION, THRISSUR.\nANNX.II - COPY OF THE ORDER IN DCE-IJK/AEII/9-A04/2012-13/290 DATED\n30-04-2013\nANNX.III - COPY OF THE LETTER ISSUED BY ASSISTANT ENGINEER,\nELECTRICAL SECTION CHELAKARA, DATED 05-06-2013\n/TRUE COPY/\nPS TO JUDGE\n\n2017/KER/1800\nK.P.JYOTHINDRANATH, J.\n\" Cr-M.C.No.5121 OF 2013\nDated this the12th day of January, 2017\nORDER\n\nThe facts in a nut shell for consideration of this case is as\nfollows :\n\nThe petitioner is the accused in C.C.No.68/2013 on the files of\nthe Judicial First Class Magistrate, Wadakkanchery. The offences\nalleged are under Sections 379 of IPC and Sections 135, 138, 150 of\nKerala Electricity Act and Section 136(e) of Electricity Amendment\nAct, 2007. The allegation is that by tapping electricity from consumer\nconnection No.271 of Chelakara section, which is a domestic\nconnection, petitioner committed theft of electricity for industrial\npurpose and thereby the Board sustained a loss of Rs.19,376/-. A\ncomplaint was filed by the Assistant Engineer before the Police on\nwhich crime No.624/2012 was registered by the Police. It is the case of\nthe petitioner that thereafter the bill for the above referred amount was\ncancelled by the Deputy Chief Engineer in an appellate proceeding and\nfurther the case is that when the allegation of loss of Rs.19.376/- goes,\na complaint will not lie.\n\n2017/KER/1800\nCrl.M.C.No.5121/2013 2\n\n2. I heard the learned Public Prosecutor. The learned Public\nProsecutor submitted before me that it is the Electricity Board which\nhas to decide the fate of the case. On a perusal of the proceeding of\nthis court, it is seen that Assistant Engineer of the KSEB, Chelakara\nsection is also seen impleaded as additional respondent No.2 by order\ndated 14/02/2014. Additional respondent No.2 is represented by\nAdv.Sri.P.Ahammed.\n\n3. The learned counsel appearing for the KSEB submitted that\nthere is no objection in quashing the case as the appellate authority has\nalready quashed the bill demanding the above referred amount.\n\nThus, recording the submission that there is no objection by the\ndefacto complainant in quashing all the proceeding in C.C.No.68/2013,\nall the proceedings in C.C.No.68/2013 on the files of the Judicial First\nClass Magistrate, Wadakkanchery is hereby quashed.\n\nK.P.JYOTHINDRANATH\nJUDGE\nSV.\n\n"
}