{
    "case_id": "",
    "court": "HIGH COURT OF KERALA AT ERNAKULAM\nPRESENT",
    "date": "2017",
    "judge": "SUNIL THOMAS",
    "petitioners": [
        "GOPI.K.K",
        "(S) /ACCUSED :",
        "S/O KRISHNAN, AGED:31 YEARS,",
        "ATTINGAL HOUSE, THIRUVALATHOOR PO, CANAL",
        "CANAL",
        "K.XAVIER\nRESPONDENT",
        "PALAKKAD"
    ],
    "respondents": [
        "REPRESENTED BY PUBLIC PROSECUTOR,",
        "(S) /COMPLAINANT :",
        "STATE OF KERALA",
        "HIGH COURT OF KERALA, ERNAKULAM"
    ],
    "sections": [
        "55(a)"
    ],
    "outcome": "Hence, Crl.M.C. is disposed",
    "full_text": "na\nv3 Smtr\n* an\nTj Ets\noe\nBiz hess\n2017/KER/2063\nIN THE HIGH COURT OF KERALA AT ERNAKULAM\nPRESENT:\nTHE HONOURABLE MR. JUSTICE SUNIL THOMAS\nFRIDAY, THE 13TH DAY OF JANUARY 2017/23RD POUSHA, 1938\nCr1.MC.No. 295 of 2017 ()\nAGAINST THE ORDER/JUDGMENT IN LP 139/2016 of J.M.F.C.-III, THRISSUR\nCRIME NO. 40/2013 OF EXCISE RANGE OFFICE, THRISSUR\nPETITIONER (S) /ACCUSED :\nGOPI.K.K\nS/O KRISHNAN, AGED:31 YEARS,\nATTINGAL HOUSE, THIRUVALATHOOR PO, CANAL\nPALAKKAD\nBY ADVS.SRI.C.A.CHACKO\nSMT .C.M. CHARISMA\nSMT .MEGHA K.XAVIER\nRESPONDENT (S) /COMPLAINANT :\nSTATE OF KERALA\nREPRESENTED BY PUBLIC PROSECUTOR,\nHIGH COURT OF KERALA, ERNAKULAM\nBY PUBLIC PROSECUTOR SRI.AMJAD ALI\nTHIS CRIMINAL MISC. CASE HAVING COME UP FOR ADMISSION ON\n13-01-2017, THE COURT ON THE SAME DAY PASSED THE FOLLOWING:\n\nao)\n2017/KER/2063\nSUNIL THOMAS, J.\nDated this the 13\" day of January, 2017\nORDER\n\nThe petitioner herein is the accused in Crime No.40/2013 of\nExcise Range Office, Thrissur for offence punishable under Section\n55(a) of the Abkari Act. He was proposed to has been prosecuted\non an allegation of transporting 510 liters of spirit in a vehicle on\n09.05.2013. There was no on the spot arrest of the petitioner.\nThe case against the petitioner herein is now pending as\nL.P.No.139/2016 of the Judicial First Class Magistrate Court-lll,\nThrissur, since procuring his presence in court was unsuccessful.\nThe petitioner contends that, he was not aware of the\nproceedings and had come to know of it only recently. He has\napproached this Court seeking relief with an offer that he is ready\nand willing to appear before the court below and to seek bail. The\napprehension of the petitioner is that, the bail application is not\nlikely to be taken up on the same day and he is likely to be\nremanded.\n\n2. Having considered these facts, | feel that though the\nallegation against the petitioner herein is serious, since essential\n\n2017/KER/2063\nCri. M. C. No. 295 of 2017 2\nattempt is to procure the presence of the accused before the\ncourt of law to face the trial, | feel that a lenient view is liable to\nbe taken.\n\nHence, Crl.M.C. is disposed of with a direction that in the\nevent of the petitioner herein surrendering before the court below\nwithin 10 days from today and filing an application for bail, it shall\nbe considered by the court below on the same day itself having\nregard to the above facts. The warrant, if any, issued by the court\nbelow will be kept in abeyance till the actual date of his\nappearance within the above mentioned period.\n\nSd/-\nSUNIL THOMAS, JUDGE.\n/true copy/\nP, A. to Judge\nPn\n\n"
}