{
    "case_id": "",
    "court": "HIGH COURT OF KERALA AT BERNAKULAM",
    "date": "2018",
    "judge": "B-KEMAL PASHA",
    "petitioners": [
        "RAVUF",
        "KER/502\nCr1.MC.No",
        "MALAPPURAM",
        "Malappuram",
        "J.\nveneeneee",
        "ALEX M. THOMBRA.",
        "KER/502\nB. KEMAL PASHA",
        "1ST ACCUSED",
        "KER/502\nCrl",
        "B.KEMAL PASHA"
    ],
    "respondents": [
        "/COMPLAINANT"
    ],
    "sections": [
        "12B",
        "1967",
        "464",
        "471 read with\nSection 34 IPC",
        "465"
    ],
    "outcome": "Tirur Police Station are liable to be quashed",
    "full_text": "iy Geis 1\noch cor os\nSon\nBe es\nIN THE HIGH COURT OF KERALA AT BERNAKULAM 2018/KER/S02\nPRESENT:\nTHE HONOURABLE MR. JUSTICE B.KEMAL PASHA\nFRIDAY, THE 5TH DAY OF JANUARY 2018 / 15TH POUSHA, 1939\nCr1.MC.No. 8455 of 2017\nCRIME NO. 714/2014 OF TIRUR POLICE STATION , MALAPPURAM\nPETITIONER/1ST ACCUSED\n\nABDUL SALAM PALAKKAVALAPPIL,\n\ns/o. ABDULLAKUTTY, AGED 33 YEARS, PALAKKAVALAPPIL HOUSE,\n\nPACHATHIRI, TIRUR - 676 105, MALAPPURAM DISTRICT.\n\nBY ADV.SRI. K.K.MOHAMED RAVUF\n\nRESPONDENT /COMPLAINANT\n\nSTATE OF KERALA, REPRESENTED BY THE PUBLIC PROSECUTOR,\n\nHIGH COURT OF KERALA, ERNAKULAM.\n\nBY PUBLIC PROSECUTOR SRI. ALEX M. THOMBRA.\n\nTHIS CRIMINAL MISC. CASE HAVING COME UP FOR ADMISSION ON 05-01-2018,\n\nTHE COURT ON THE SAME DAY PASSED THE FOLLOWING:\n\niy Geis 1\noch cor os\neS el,\n2018/KER/502\nCr1.MC.No. 8455 of 2017\nAPPENDIX\nPETITIONER (S)' EXHIBITS\nANNEXURE Al TRUE COPY OF THE FIR IN CRIME NO. 714/2014 OF TIRUR\nPOLICE STATION, MALAPPURAM.\nANNEXURE A2 TRUE COPY OF THE LETTER NO. D1/67977/13 MM DATED\n25.04.2014 OF DISTRICT POLICE CHIEF, MALAPPURAM.\nANNEXURE A3 TRUE COPY OF THE ORDER DATED 08.11.2016 IN\nCRL.M.C.NO. 1634/2016 OF THIS HON'BLE COURT.\nANNEXURE A4 TRUE COPY OF THE ORDER DATED 06.04.2016 IN\nCRL.M.C.NO.2035/2016 OF THIS HON'BLE COURT.\nRESPONDENT (S)' EXHIBITS\nNIL\n// TRUE COPY//\nP.S TO JUDGE.\nHr...\n\nnl\n2018/KER/502\nB. KEMAL PASHA, J.\nveneeneee CTEM, NO-8455 Of 2047\nDated this the 5“ day of January, 2018\n\nORDER\nPetitioner is the 1% accused in Crime\nNo.714/2014 of Tirur Police Station for the offences\npunishable under Sections 464, 465 and 471 read with\nSection 34 IPC and Section 12B of the Passports Act, 1967.\nlt is alleged that the petitioner had consented to his brother,\nwho is the 2™ accused, to acquire a passport by using the\n\nname and address of the petitioner.\n2. According to the petitioner, his brother had made\nthe mischief by showing the name and address of the\npetitioner for acquiring a passport. Annexure-A2 letter of\nthe District Police Chief, Malappuram, clearly shows that the\nenquiry conducted revealed that the brother of the petitioner\nhad earlier obtained an Indian passport E2658676\nimpersonating him as the petitioner and performed journey\n\nBear\n2018/KER/502\nCrl.M.C.8455/2017\n:2:\nabroad. When the said fact have come to light, the\npetitioner cannot be an accused in the crime.\n\n3. The registration of the crime as against the\npetitioner is not legally sustainable and all further\nproceedings against the petitioner in Crime No.714/2014 of\nTirur Police Station are liable to be quashed.\n\nIn the result, this Crl.M.C. is allowed and Annexure-A1\nFirst Information Report in Crime No.714/2014 of Tirur\nPolice Station and all further proceedings as against the\npetitioner in it, are quashed.\n\nSd/-\n(B-KEMAL PASHA, JUDGE)\naks/05/01\n1 True Copy //\nPS to Judge\n\n"
}