{
    "case_id": "Crl.MC.No. 7186 of 2014 ()",
    "court": "HIGH COURT OF KERALA AT ERNAKULAM\nPRESENT",
    "date": "JANUARY 2015/16TH",
    "judge": "B.KEMAL PASHA",
    "petitioners": [
        "3. K MADHAVAN, AGED 43 YEARS,S/O.JANAKI,",
        "MALAPPURAM DIST",
        "CHERUVAYOOR P. O.",
        "MC.No",
        "S/O.KRISHNAN, MEENANGODE HOUSE, EDAVANNAPPARA",
        "Bl Pala",
        "1. PHALGUNAN, AGED 37 YEARS,",
        "BREE",
        "S/ACCUSED :",
        "Baa",
        "2. LOHITAKSHAN, AGED 48 YEARS,",
        "KANIMANGALAM P. O.",
        "MEENANGODE HOUSE, CHERUVAYOOR P. O.,",
        "CHERUVAYOOR P.O, MALAPPURAM DIST",
        "S/O.KRISHNAN, MEENANGODE HOUSE, EDAVANNAPPARA,",
        "CHERUVAYOOR P. O., CHERUVAYOOR P.O., MALAPPURAM DIST"
    ],
    "respondents": [
        "R1 BY ADV. SRI.M.REVIKRISHNAN",
        "HIGH COURT OF KERALA, ERNAKULAM, 682031",
        "UPPUTHURUTHY HOUSE, KANIMANGALAM P. O.,",
        "S/DEFACTO COMPLAINANT & STATE :",
        "R2 BY PUBLIC PROSECUTOR SRI. SREEJITH V.S.",
        "THRISSUR DIST, PIN-680027",
        "2. STATE OF KERALA",
        "REP BY THE PUBLIC PROSECUTOR,",
        "1. SREEDEVI, D/O.SUBRAMANIAN,"
    ],
    "sections": [
        "482",
        "406",
        "498A",
        "498A read with\nSection 34 of the Indian Penal Code"
    ],
    "outcome": "Magistrate's Court-Il, Manjeri, quashed",
    "full_text": "Baa\n2015/KER/244\nIN THE HIGH COURT OF KERALA AT ERNAKULAM\nPRESENT:\nTHE HONOURABLE MR. JUSTICE B.KEMAL PASHA\nTUESDAY, THE 6TH DAY OF JANUARY 2015/16TH POUSHA, 1936\nCri.MC.No. 7186 of 2014 ()\nCC 717/2014 of JUDICIAL FIRST CLASS MAGISTRATE COURT-I(FOREST OFFENCES),\nMANJERI\nPETITIONERS/ACCUSED :\n1. PHALGUNAN, AGED 37 YEARS,\nS/O.KRISHNAN, MEENANGODE HOUSE, EDAVANNAPPARA\nCHERUVAYOOR P.O, MALAPPURAM DIST\n2. LOHITAKSHAN, AGED 48 YEARS,\nS/O.KRISHNAN, MEENANGODE HOUSE, EDAVANNAPPARA,\nCHERUVAYOOR P. O., CHERUVAYOOR P.O., MALAPPURAM DIST\n3. K MADHAVAN, AGED 43 YEARS,S/O.JANAKI,\nMEENANGODE HOUSE, CHERUVAYOOR P. O.,\nMALAPPURAM DIST\nBY ADVS.SRI.P.SANTHOSH (PODUVAL)\nSMT.R.RAJITHA\nSRI.K.D.SREEVISAKH\nRESPONDENTS/DEFACTO COMPLAINANT & STATE :\n1. SREEDEVI, D/O.SUBRAMANIAN,\nUPPUTHURUTHY HOUSE, KANIMANGALAM P. O.,\nTHRISSUR DIST, PIN-680027\n2. STATE OF KERALA\nREP BY THE PUBLIC PROSECUTOR,\nHIGH COURT OF KERALA, ERNAKULAM, 682031\nR1 BY ADV. SRI.M.REVIKRISHNAN\nR2 BY PUBLIC PROSECUTOR SRI. SREEJITH V.S.\nTHIS CRIMINAL MISC. CASE HAVING COME UP FOR ADMISSION\nON 06-01-2015, THE COURT ON THE SAME DAY PASSED THE\nFOLLOWING:\nbp\n\nlane\ncera\nBaa\n2015/KER/244\nCrl.MC.No. 7186 of 2014 ()\nAPPENDIX\nPETITIONER(S)' EXHIBITS\nANNEXURE A:- CERTIFIED COPY OF FINAL REPORT IN CRIME NO 254/2011 OF\nVAZHAKKAD POLICE STATION.\nANNEXURE B:- AN AFFIDAVAIT SWORN BY THE IST RESPONDENT\nRESPONDENT(S)' EXHIBITS NIL.\nITRUE COPY//\nP.S. TO JUDGE\nbp\n\nBl Pala]\n2015/KER/244\nB.KEMAL PASHA, J.\neen een\nORDER\n\nPetitioners are A1 to A3 in Crime No.254/11 of the\nVazhakkad Police Station, Malappuram registered for the\noffences punishable under Sections 406 and 498A read with\nSection 34 of the Indian Penal Code.\n\n2. Petitioners have come up with this Crl.M.C. under\nSection 482 CrPC. for getting Annexure-A Final Report in\nCrime No.254/11 of the Vazhakkad Police Station,\nMalappuram and all further proceedings based on it in\nC.C.No.717/14 pending before the Judicial First Class\nMagistrate's Court-Il, Manjeri, quashed.\n\n3. The allegation against the petitioners is that they\nhave tortured and harassed the defacto complainant, who is\nthe wife of the 1* accused, and treated her with cruelty\n\nBREE\n2015/KER/244\nCRL.M.C.No.7186 of 2014 oe\nwithin the meaning of Section 498A IPC, by demanding\nmore dowry, after misappropriating her entire gold\nornaments and money.\n\n4. Heard learned counsel for the petitioners, the\nlearned counsel for the defacto complainant, who is the 1*\nrespondent herein, and the learned Public Prosecutor.\n\n5. According to the petitioners, all the matters in\ndispute between the petitioners and the defacto complainant\nhave been amicably settled and presently the defacto\ncomplainant has no complaints against the petitioners and,\ntherefore, the proceedings against the petitioners may be\nquashed.\n\n6. The defacto complainant, who is the 1*\nrespondent herein, has filed an affidavit affirming that all the\nmatters in dispute between her and the petitioners have\nbeen amicably settled and, therefore, she has no complaints\nagainst the petitioners, and, hence, all further proceedings\nin the matter referred to above can be quashed. She has\n\nBl Pala]\n2015/KER/244\n\nCRL.M.C.No.7186 of 2014 uae\nentered appearance through her counsel. The learned\ncounsel for the defacto complainant also endorses the fact\nthat the affidavit has been sworn in by the defacto\ncomplainant on her own volition.\n\n7. When all the matrimonial disputes have been\nsettled between the parties and as the defacto complainant\nhas no complaints against the petitioners, it is only just and\nexpedient in the interest of justice to quash the proceedings\nreferred to above.\n\nIn the result, this Crl.M.C. is allowed and Annexure-A\nFinal Report in Crime No.254/11 of the Vazhakkad Police\nStation, Malappuram and all further proceedings based on it\nin C.C.No.717/14 pending before the Judicial First Class\nMagistrate's Court-ll, Manjeri, are hereby quashed.\n\nSd/- B.KEMAL PASHA, JUDGE\n\nul/-\n\n[True copy] PS. to Judge\n\n"
}