{
    "case_id": "",
    "court": "HIGH COURT OF KERALA AT ERNAKULAM\nPRESENT\nTHE HONOURABLE MR",
    "date": "2019",
    "judge": "K.ABRAHAM MATHEW",
    "petitioners": [
        "S:",
        "Sd/-\nK. ABRAHAM MATHEW",
        "RENJITH",
        "AGED 37 YEARS",
        "NAALUVETUKARA, MURINGOOR THEKKUMURI VILLAGE,",
        "S/O. RAMAKRISHNAN, RESIDING AT VATTOLIL VEEDU,",
        "KORATTI PANCHAYATH, THRISSUR DISTRICT."
    ],
    "respondents": [
        "S:",
        "PUBLIC PROSECUTOR, HIGH COURT OF KERALA,",
        "ERNAKULAM, KOCHI 682 031.",
        "STATE OF KERALA",
        "OTHER PRESENT:",
        "REPRESENTED BY SUB INSPECTOR OF POLICE,",
        "PALA POLICE STATION, REPRESENTED THROUGH"
    ],
    "sections": [
        "482"
    ],
    "outcome": "In the result, this Crl.M.C. is allowed",
    "full_text": "Deere\nÂ¥ eee\nBAe\n2019/KER/1041\nIN THE HIGH COURT OF KERALA AT ERNAKULAM\nPRESENT\nTHE HONOURABLE MR. JUSTICE K.ABRAHAM MATHEW\nWEDNESDAY ,THE O9TH DAY OF JANUARY 2019 / 19TH POUSHA,\n1940\nCr1.MC.No. 169 of 2019\ncc 198/2013 OF J.M.F.C.,PALA\nCRIME NO. 493/2009 OF PALA POLICE STATION , KOTTAYAM\nPETITIONER/S:\nRENJITH\nAGED 37 YEARS\nS/O. RAMAKRISHNAN, RESIDING AT VATTOLIL VEEDU,\nNAALUVETUKARA, MURINGOOR THEKKUMURI VILLAGE,\nKORATTI PANCHAYATH, THRISSUR DISTRICT.\nBY ADVS.\nSRI .PREMCHAND R.NAIR\nSMT .K.SREEKALA DEVI\nSRI .GEORGE BRISTON\nSRI.R.SARACHANDRA KUMAR\nSRI .V.P.PRASANTH\nRESPONDENT/S:\nSTATE OF KERALA\nREPRESENTED BY SUB INSPECTOR OF POLICE,\nPALA POLICE STATION, REPRESENTED THROUGH\nPUBLIC PROSECUTOR, HIGH COURT OF KERALA,\nERNAKULAM, KOCHI 682 031.\nOTHER PRESENT:\nSRI. ALEX M THOMBRA SR PP\n\nEger\nBaar\n2019/KER/1041\n\nCr1.MC.No. 169 of 2019\n\n1i2..\n\nTHIS CRIMINAL MISC. CASE HAVING COME UP FOR ADMISSION ON\n\n09.01.2019, THE COURT ON THE SAME DAY PASSED THE\n\nFOLLOWING :\n\nORDER\nPetition filed under Section 482 Cr.P.C.\n\n2. The petitioner is the accused in CC No. 198 of\n2013 on the file of the Judicial First Class\nMagistrate Court-I, Pala. He prays that the\nlearned magistrate be directed to dispose of\nthe case without further delay.\n\n3. I have perused Annexure A copy of the\nproceedings sheet of the trial court. The case\nis ripe for trial. The learned magistrate has\nalready issued summons to CW1 to CW12. Having\nregard to these facts, I am inclined to allow\nthe request of the petitioner.\n\nIn the result, this Crl.M.C. is allowed. The\nlearned magistrate is directed to dispose of\n\nEger\n* are 4\nae\nBeas\n2019/KER/1041\nCri.MC.No. 169 of 2019\n1.3...\nthe case within six months from the date of\nreceipt or production of a copy of this order,\nwhichever is earlier.\nSd/-\nK. ABRAHAM MATHEW\nJUDGE\nAPPENDIX\nPETITIONER'S/S EXHIBITS:\nANNEXURE A A TRUE READABLE COPY OF THE ORDER\nSHEET IN C.C NO. 198/2013 ON THE FILES\nOF JFCM-1,PALA\nBka/10.01.2019\n\n"
}