{
    "case_id": "Crl.MC.No. 13 of 2019",
    "court": "HIGH COURT OF KERALA AT ERNAKULAM",
    "date": "JANUARY 2019 / 13TH",
    "judge": "K.ABRAHAM MATHEW",
    "petitioners": [
        "S:",
        "MC.No",
        "MADHUMMAL HOUSE",
        "Sd/-\nK. ABRAHAM MATHEW",
        "KANDI HOUSE"
    ],
    "respondents": [
        "S:"
    ],
    "sections": [
        "482",
        "323",
        "341",
        "448",
        "294(b)",
        "427"
    ],
    "outcome": "In the result, this Crl.M.C. is allowed",
    "full_text": "bers sl\nEl: Te\nIN THE HIGH COURT OF KERALA AT ERNAKULAM 201/KER/22\nPRESENT\nTHE HONOURABLE MR. JUSTICE K.ABRAHAM MATHEW\nTHURSDAY, THE O3RD DAY OF JANUARY 2019 / 13TH POUSHA, 1940\nCr1.MC.No. 13 of 2019\nAGAINST CC 1428/2017 of J.M.F.C.-II, KANNUR\nCRIME NO. 436/2017 of Kannur City Police Station, Kannur\nPETITIONERS:\n\n1 PRADEEP KUMAR M\nAGED 42 YEARS\n$/O. KUNJI RAMAN,\nMADHUMMAL HOUSE,\nADI KADALAI POST,\nKANNUR DISTRICT - 670 002\n\n2 SHINIL.K.,\nAGED 28 YEARS\nS/O. MANOHARAN, AYILYANTHOL KANDI HOUSE,\nTHOTTADA, ADI KADALAT POST,\nKANNUR DISTRICT 670 002\n\n3 RISOON .M.,\nAGED 28 YEARS\nS/O. RAMESAN,\nPARAKKETTIL HOUSE,\nADI KADALAT POST,\nKANNUR DISTRICT - 670 002\nBY ADV. SRI.P.K.RAVISANKAR\n\nRESPONDENTS:\n\n1 STATE OF KERALA\nREPRESENTED BY PUBLIC PROSECUTOR,\nHIGH COURT OF KERALA,\nERNAKULAM\n\n2 GIREESHAN K.\nAGED 51 YEARS\nS/O. CHANDRAN, 51 YEARS, KANOTH HOUSE,\nADI KADALAI POST,\nKANNUR DISTRICT - 670 002\n\nit sf]\nEl: ret\nCr1.MC.No. 13 of 2019 2 2019/KER/22\nBY ADV. SRI.D.ANIL KUMAR\nSRI ALEX M THOMBRA- PUBLIC PROSECUTOR\nTHIS CRIMINAL MISC. CASE HAVING BEEN FINALLY HEARD ON\n03.01.2019, THE COURT ON THE SAME DAY PASSED THE FOLLOWING:\n\nCrl.MC.No. 13 of 2019 3 201KERL22\nORDER\n\nPetition filed under Section 482 Cr.P.C.\n\n2. Petitioners are the accused in\nC.C.No.1428 of 2017 on the file of the Judicial\nMagistrate of First Class-II, Kannur. They are\nalleged to have committed the offences under\nSections 294(b), 323, 341, 427 and 448 IPC.\nSecond respondent is the victim. It is\nsubmitted that the matter has been settled and\nthe proceedings in the trial court may be\nquashed.\n\n3. Heard the learned counsel for the\npetitioners and second respondent and _ the\nlearned Public Prosecutor.\n\n4. I have perused the affidavit filed by\nthe second respondent, who has entered\nappearance through counsel. T am satisfied that\nthe matter has been settled and no _ public\ninterest is involved in this case. There is no\n\nrasan\nEl: Te\nCr1.MC.No. 13 of 2019 4 2019/KER(22\nimpediment for granting the prayer of the\npetitioners.\n\nIn the result, this Crl.M.C. is allowed. The\nproceedings in C.C.No.1428 of 2017 on the file\nof the Judicial Magistrate of First Class-II,\nKannur are quashed. If any material objects have\nbeen produced in this case, the trial court may\npass appropriate orders for their disposal.\n\nSd/-\nK. ABRAHAM MATHEW\nJUDGE\nMC/04.01.19\n\nit sf]\nEl: ret\nCr1.MC.No. 13 of 2019 5 2019/KER/22\nAPPENDIX\nPETITIONER'S/S EXHIBITS:\nANNEXURE A CERTIFIED COPY OF THE FINAL REPORT IN\nCRIME NO. 436 OF 2017 OF KANNUR CITY\nPOLICE STATION NUMBERED AS C.C. NO.\n1428 OF 2017 OF JUDICIAL FIRST CLASS\nMAGISTRATE COURT-11, KANNUR\nANNEXURE B AFFIDAVIT DATED 20.12.2018 EXECUTED BY\nTHE 2ND RESPONDENT\nRESPONDENT'S/S EXHIBITS:\nNIL\nMC\n(TRUE COPY) PA TO JUDGE\n\n"
}