{
    "case_id": "Crl.MC.No. 6043 of 2013 ()",
    "court": "HIGH COURT OF KERALA AT ERNAKULAM\nPRESENT",
    "date": "2 day of January, 2014",
    "judge": "HARUN-UL-RASHID",
    "petitioners": [
        "(S) /PETITIONER/1ST ACCUSED:",
        "S/O. RAJAPPAN, THURUTHEL HOUSE, MRAVANTHURUTHU",
        "MC.No",
        "PIN-686608.",
        "KULASEKHARAMANGALAM, VAIKOM, KOTTAYAM DISTRICT",
        "P. A.",
        "SUNIL AGED 44 YEARS"
    ],
    "respondents": [
        "HIGH COURT OF KERALA, ERNAKULAM, COCHIN-31.",
        "STATE OF KERALA",
        "COMPLAINANT AND STATE:",
        "REPRESENTED BY THE PUBLIC PROSECUTOR,"
    ],
    "sections": [
        "5",
        "482",
        "4",
        "13",
        "3"
    ],
    "outcome": "In the result, this Crl.M.C is allowed",
    "full_text": "ae aes\n2014/KER/246\nIN THE HIGH COURT OF KERALA AT ERNAKULAM\nPRESENT:\nTHE HONOURABLE MR.JUSTICE HARUN-UL-RASHID\nTHURSDAY, THE 2ND DAY OF JANUARY 2014/12TH POUSHA, 1935\nCrl.MC.No. 6043 of 2013 ()\nAGAINST THE ORDER/JUDGMENT IN CC 38/2010 of ADDL.C.J.M. (E&O),\nERNAKULAM\nCRIME NO. 1927/2009 OF ERNAKULAM NORTH POLICE STATION, ERNAKULAM\nPETITIONER (S) /PETITIONER/1ST ACCUSED:\nSUNIL AGED 44 YEARS\nS/O. RAJAPPAN, THURUTHEL HOUSE, MRAVANTHURUTHU\nKULASEKHARAMANGALAM, VAIKOM, KOTTAYAM DISTRICT\nPIN-686608.\nBY ADV. SRI.P.A.MUJEEB\nCOMPLAINANT (S) /RESPONDENT/COMPLAINANT AND STATE:\nSTATE OF KERALA\nREPRESENTED BY THE PUBLIC PROSECUTOR,\nHIGH COURT OF KERALA, ERNAKULAM, COCHIN-31.\nBY PUBLIC PROSECUTOR SMT.SAREENA GEORGE\nTHIS CRIMINAL MISC. CASE HAVING COME UP FOR ADMISSION ON\n02-01-2014, THE COURT ON THE SAME DAY PASSED THE FOLLOWING:\n\nBRA\n2014/KER/246\nCr1l.MC.No. 6043 of 2013 ()\nAPPENDIX\nPETITIONER(S)' EXHIBITS\nANNEXURE A1- PHOTOCOPY OF THE F.I.R IN CRIME NO. 1927/2009 OF\nERNAKULAM TOWN NORTH POLICE STATION ERNAKULAM,\nERNAKULAM DISTRICT.\nANNEXURE A2- PHOTOCOPY OF THE CHARGE SHEET IN C.C.NO. 38/2010\nNOW PENDING BEFORE THE HON'BLE ADDITIONAL CHIEF\nJUDICIAL MAGISTRATE COURT (EO), ERNAKULAM\nRESPONDENT (S)' EXHIBITS : NIL\n/TRUE COPY/\nP. A. TO JUDGE\nPn\n\nees\n2014/KER/246\nHARUN-UL-RASHID, J.\nCIILM.C. No. 6043 OF 2013\nDated this the 2 day of January, 2014\nORDER\n\nThe petitioner is the 1* accused in Crime No.1927/2009 of\nErnakulam Town North Police Station, Ernakulam. The offences\nalleged are punishable under Sections 3,4,5 & 7 of Immoral Traffic\nPrevention Act. The police, after investigation, laid the charge\nsheet before the Additional Chief Judicial Magistrate Court (EO),\nErnakulam and is numbered as C.C.No.38/2010.\n\n3. The respondent Circle Inspector of Police conducted the\nsearch and arrested the accused. As per provisions under Section\n13 of the Act, he is not an officer competent to conduct search\nbecause, the detecting officer is neither a Traffic Police Officer nor\na Special Officer, who has the authority to search and conduct\narrest as per the provisions of the Immoral Traffic Prevention Act.\n\n4. In the facts and circumstances of the case, the search and\narrest were not effected in accordance with the provisions of the\nAct. There is no possibility of the case to end in conviction.\n\n5. In view of the admitted position in this case, that the\nsearch was not effected by the Special Police Officer and the\n\nEle ae\n2014/KER/246\nCrl.M.C. No. 6043 OF 2013 ;\narrest was also not in accordance with law, same has to be held\nper se illegal. This is a fit case wherein, this Court should invoke\nthe inherent power vested under Section 482 of Cr.P.C. to\nterminate the procedure.\nIn the result, this Crl.M.C is allowed. All further proceedings\nin C.C.No.38/2010 pending before the Additional Chief Judicial\nMagistrate Court (EO), Ernakulam is quashed.\nSd/-\nHARUN-UL-RASHID, JUDGE.\nAV\n\n"
}