{
    "case_id": "",
    "court": "HIGH COURT OF KERALA AT ERNAKULAM\nPRESENT",
    "date": "THE 2ND DAY",
    "judge": "HARUN-UL-RASHID",
    "petitioners": [
        "1. RIYAS,",
        "MALAPPURAM",
        "2. SHOWKATH",
        "PALLIPPADI, PANDIKKAD, MALAPPURAM DISTRICT.",
        "POOVATHIKKAL HOUSE",
        "P. A.",
        "PANDIKKAD, MALAPPURAM DISTRICT.",
        "J. OLN",
        "S/O. ABOOBACKER, POOVATHIKKAL HOUSE, PANTHALLOOR",
        "S/O. SAIDUTTY, KUTTITHARA HOUSE, PANTHALLOOR AMSOM,",
        "(S) /PETITIONERS/ACCUSED:"
    ],
    "respondents": [
        "REPRESENTED BY THE PUBLIC PROSECUTOR",
        "STATE OF KERALA",
        "HIGH COURT OF KERALA",
        "ERNAKULAM-682031. (SUB INSPECTOR OF POLICE PANDIKKAD",
        "STATE:",
        "MALAPPURAM DISTRICT)."
    ],
    "sections": [
        "160",
        "294(b)",
        "283"
    ],
    "outcome": "prosecuting the petitioner. Hence, the Crl.M.C is allowed",
    "full_text": "8 pine os\n* woqh Fc\nsears\nBe analy 4\n2014/KER/206\nIN THE HIGH COURT OF KERALA AT ERNAKULAM\nPRESENT:\nTHE HONOURABLE MR.JUSTICE HARUN-UL-RASHID\nTHURSDAY, THE 2ND DAY OF JANUARY 2014/12TH POUSHA, 1935\nCr1.MC.No. 18 of 2014 ()\nAGAINST THE ORDER/JUDGMENT IN CC 489/2009 of J.M.F.C.-II,\nPERINTHALMANNA\nCRIME NO. 137/2009 OF PANDIKKAD POLICE STATION, MALAPPURAM\nPETITIONER (S) /PETITIONERS/ACCUSED:\n1. RIYAS,\nS/O. SAIDUTTY, KUTTITHARA HOUSE, PANTHALLOOR AMSOM,\nPANDIKKAD, MALAPPURAM DISTRICT.\n2. SHOWKATH\nS/O. ABOOBACKER, POOVATHIKKAL HOUSE, PANTHALLOOR\nPALLIPPADI, PANDIKKAD, MALAPPURAM DISTRICT.\nBY ADVS.SRI.P.SHAMSUDIN\nSMT .NIMA JACOB\nCOMPLAINANT (S) /RESPONDENT/STATE:\nSTATE OF KERALA\nREPRESENTED BY THE PUBLIC PROSECUTOR\nHIGH COURT OF KERALA\nERNAKULAM-682031. (SUB INSPECTOR OF POLICE PANDIKKAD\nMALAPPURAM DISTRICT).\nBY PUBLIC PROSECUTOR SMT.S.HYMA\nTHIS CRIMINAL MISC. CASE HAVING COME UP FOR ADMISSION ON\n02-01-2014, THE COURT ON THE SAME DAY PASSED THE FOLLOWING:\n\nte ze Be\nee\nBa ies\n2014/KER/206\nCr1.MC.No. 18 of 2014 ()\nAPPENDIX\nPETITIONER(S)' EXHIBITS\nANNEXURE Al1- TRUE COPY OF THE FINAL REPORT IN CRIME NO. 137/2009\nOF PANDIKKAD POLICE STATION.\nANNEXURE A2- TRUE COPY OF THE ORDER DATED 29-02-2012 IN cc\n489/2009 ON THE FILES OF JUDICIAL FIRST CLASS\nMAGISTRATE COURT-II PERINTHALMANNA.\nRESPONDENT (S)' EXHIBITS : NIL\n/TRUE COPY/\nP. A. TO JUDGE\nPn\n\nate tas\nHARUN-UL-RASHID, J. OLN\nDated this the 2\" day of January, 2014\nORDER\n\nPetitioners were the 4\" and 7\" accused in Crime\nNo.137/2009 of Pandikkad Police Station pending as L.P.No.7/2013\nin C.C.No.144/2012 on the file of Judicial First Class Magistrate\nCourt-ll, Perinthalmanna. The offences alleged are punishable\nunder Sections 160, 283 and 294(b) of IPC.\n\n2. There are altogether seven accused. Four out of seven\nwere acquitted in C.C.No.489/ 2009 on the file of the same court.\nLearned Judge acquitted four of them for want of any independent\nevidence. It was held that none of the members of the public were\npresent in the scene of occurrence is fatal to the prosecution case\nand that in the absence of any public in the public place, it cannot\nbe said that the accused have created obstruction or caused\nannoyance to them by uttering filthy words.\n\nIn the facts and circumstances, no purpose will be served by\nprosecuting the petitioner. Hence, the Crl.M.C is allowed. All\nfurther proceedings in Crime No.137/2009 of Pandikkad Police\nStation pending as L.P.No.7/2013 in C.C.No.144/2012 on the file of\nJudicial First Class Magistrate Court-ll, Perinthalmanna is quashed.\n\nSd/-\nHARUN-UL-RASHID, JUDGE.\nAV\n\n"
}