{
    "case_id": "Crl.MC.No.8253 OF 2019(B)",
    "court": "HIGH COURT OF KERALA AT ERNAKULAM",
    "date": "THE 07TH DAY",
    "judge": "MALAPPURAM DISTRICT-679327\n2 SUBAIR\nAGED",
    "petitioners": [
        "S:",
        "1 MURATH",
        "C.S.HRITHWIK",
        "2 SUBAIR",
        "MALAPPURAM DISTRICT-679327\nR3",
        "S/O.MUHAMMED, VALLIKAPARAMBIL HOUSE, KUNDLAMPADAN,",
        "AGED 39 YEARS",
        "ARIMANAL, MALAPPURAM DISTRICT-676525",
        "NEELANCHERY, TUVUR AMSOM, MALAPPURAM DISTRICT-679327",
        "S/O.KOYAPPU, CHELAKODAN HOUSE, OOTHALKUNNU,",
        "AGED 34 YEARS"
    ],
    "respondents": [
        "S:",
        "MALAPPURAM",
        "3 NASAR",
        "R3 BY ADV. MUHAMMED SHABEERALI.V",
        "676523",
        "S/O.MUHAMMED, RESIDING AT MANNAYATH HOUSE,",
        "Malappuram",
        "1 STATE OF KERALA",
        "KARUVARAKUNUD POLICE STATION, MALAPPURAM DISTRICT-—",
        "2 THE SUB INSPECTOR OF POLICE",
        "KERALA, ERNAKULAM-31",
        "OTHER PRESENT:",
        "AGED 35 YEARS",
        "Manjeri",
        "NEELANCHERY, TUVUR AMSOM, MALAPPURAM DISTRICT-679327",
        "REPRESENTED BY THE PUBLIC PROSECUTOR, HIGH COURT OF"
    ],
    "sections": [
        "323",
        "482",
        "341",
        "324 r/w Section 149 of IPC along with\nseveral other accused",
        "143",
        "147",
        "148"
    ],
    "outcome": "/JUDGMENT IN CC 1068/2017 OF JUDICIAL FIRST CLASS\nMAGISTRATE COURT -I,MANJERI\nCRIME NO.121/2015 OF Karuvarakundu Police Station , Malappuram\nPETITIONER/S:\n1 MURATH\nAGED 34 YEARS\nS/O.MUHAMMED, VALLIKAP",
    "full_text": "Biegeash\nareas]\noe\nOa\nIN THE HIGH COURT OF KERALA AT ERNAKULAM 2020/KER/S06\nPRESENT\nTHE HONOURABLE MR. JUSTICE ASHOK MENON\nTUESDAY, THE 07TH DAY OF JANUARY 2020 / 17TH POUSHA, 1941\nCr1.MC.No.8253 OF 2019 (B)\nAGAINST THE ORDER/JUDGMENT IN CC 1068/2017 OF JUDICIAL FIRST CLASS\nMAGISTRATE COURT -I,MANJERI\nCRIME NO.121/2015 OF Karuvarakundu Police Station , Malappuram\nPETITIONER/S:\n1 MURATH\nAGED 34 YEARS\nS/O.MUHAMMED, VALLIKAPARAMBIL HOUSE, KUNDLAMPADAN,\nNEELANCHERY, TUVUR AMSOM, MALAPPURAM DISTRICT-679327\n2 SUBAIR\nAGED 39 YEARS\nS/O.KOYAPPU, CHELAKODAN HOUSE, OOTHALKUNNU,\nARIMANAL, MALAPPURAM DISTRICT-676525\nBY ADVS.\nSRI.C.IJLAL\nSMT .UMMUL FIDA\nRESPONDENT/S:\n1 STATE OF KERALA\nREPRESENTED BY THE PUBLIC PROSECUTOR, HIGH COURT OF\nKERALA, ERNAKULAM-31\n2 THE SUB INSPECTOR OF POLICE\nKARUVARAKUNUD POLICE STATION, MALAPPURAM DISTRICT-—\n676523\n3 NASAR\nAGED 35 YEARS\nS/O.MUHAMMED, RESIDING AT MANNAYATH HOUSE,\nNEELANCHERY, TUVUR AMSOM, MALAPPURAM DISTRICT-679327\nR3 BY ADV. MUHAMMED SHABEERALI.V\nOTHER PRESENT:\nSRI. C.S.HRITHWIK, SR.PP\nTHIS CRIMINAL MISC. CASE HAVING COME UP FOR ADMISSION ON\n07.01.2020, THE COURT ON THE SAME DAY PASSED THE FOLLOWING:\n\nial\nCrl.MC.No.8253 OF 2019(B) 2 2020/KERISO6\nORDER\n\nDated this the 7th day of January 2020\n\nPetitioners are accused 1 and 8 in Crime No.121/2015\nof Karuvarakundu Police Station for having allegedly\ncommitted offences punishable under Sections 143, 147,\n148, 341, 323 and 324 r/w Section 149 of IPC along with\nseveral other accused. Petitioners are absconding and the\ncase against them was split up and refiled as C.C.\nNo.1068/2017 on the files of the Judicial First Class\nMagistrate Court-I, Manjeri. The co-accused who faced trial\nwere found not guilty and acquitted vide judgment dated\n31.10.2017 at Annexure A2 and the petitioners are\npresently facing trial.\n\n2. There is only one injured, who is the 3% respondent.\nHe is appeared through counsel and filed affidavit to the\neffect that the matter has been amicably settled and that he\nhas no grievance whatsoever against the petitioners. A\nreport has been called for from the investigating officer\nthrough the Senior Public Prosecutor. The petitioners do not\nhave criminal antecedents. There is no public interest\n\nigi eal\nCrl.MC.No.8253 OF 2019(B) 3 2020/KERISO6\ninvolved. All the co-accused have been acquitted and that\nacquittal has become final.\nIn the result, the Crl.M.C is allowed and the entire\nproceedings in CC No.1068/2017 on the files of the Judicial\nFirst Class Magistrate Court-I, Manjeri stands quashed under\nSection 482 of Cr.P.C.and the accused are discharged.\nSd/-\nASHOK MENON\nJUDGE\n\ncee\naed\na\n[\nCrl.MC.No.8253 OF 2019(B) 4 2020/KERISO6\nAPPENDIX\nPETITIONER'S/S EXHIBITS:\nANNEXURE Al THE CERTIFIED COPY OF THE FINAL\nREPORT IN CRIME NO.121/2015 oF\nKARUVARAKUNDU POLICE STATION,\nMALAPPURAM DISTRICT\nANNEXURE A2 CERTIFIED COPY OF THE JUDGMENT DATED\n31.10.2017 IN CC NO.342/2015 PASSED\nBY THE JUDICIAL FIRST CLASS\nMAGISTRATE COURT-I, MANJERI\nANNEXURE A3 AN AFFIDAVIT SWORN BY THE THIRD\nRESPONDENT STATING THE SETTLEMENT OF\nALL THE DISPUTES.\n\n"
}