{
    "case_id": "",
    "court": "HIGH COURT OF KERALA AT ERNAKULAM\nPRESENT\nTHE HONOURABLE MR",
    "date": "2020",
    "judge": "Kasargod",
    "petitioners": [
        "Kasaragod",
        "PADINHARE VEEDU, HOUSE NO.KMC-35/69, KALLURAVI,",
        "Kasargod",
        "AGED 30 YEARS, S/O.NARAYANAN,",
        "RAHUL,",
        "K.P.ANTONY BINU",
        "RAJESH T.\nAGED",
        "KANHANGAD VILLAGE, KASARAGOD DISTRICT.",
        "ACCUSED:",
        "VIJESH T.",
        "Elz mt\nCri"
    ],
    "respondents": [
        "S /STATE-DEFACTO COMPLAINANT/VICTIM:",
        "AGED 34 YEARS, S/O.BALAKRISHNAN,",
        "REPRESENTED BY THE PUBLIC PROSECUTOR,",
        "HIGH COURT OF KERALA, ERNAKULAM-682031",
        "R/AT MURIYANAVI, KANHANGAD VILLAGE,",
        "2 RAJESH.T.,",
        "1 STATE OF KERALA,",
        "KASARAGOD DISTRICT-671315."
    ],
    "sections": [
        "323",
        "482",
        "143",
        "147",
        "308 read with\nSection 149",
        "324",
        "148"
    ],
    "outcome": "accused was quashed",
    "full_text": "ee ah\n+ et\nieee\nBloat\n2020/KER/808\nIN THE HIGH COURT OF KERALA AT ERNAKULAM\nPRESENT\nTHE HONOURABLE MR. JUSTICE ASHOK MENON\nWEDNESDAY, THE O8TH DAY OF JANUARY 2020 / 18TH POUSHA, 1941\nCr1.MC.No.8296 OF 2019(F)\nAGAINST THE ORDER/JUDGMENT IN SC 388/2019 OF ADDITIONAL DISTRICT\nCOURT-III, KASARAGOD\nCRIME NO.369/2016 OF Hosdurg Police Station, Kasargod\nPETITIONER/ACCUSED:\nRAHUL,\nAGED 30 YEARS, S/O.NARAYANAN,\nPADINHARE VEEDU, HOUSE NO.KMC-35/69, KALLURAVI,\nKANHANGAD VILLAGE, KASARAGOD DISTRICT.\nBY ADVS.\nSMT . HEMALATHA\nSRI.BINU GEORGE\nRESPONDENTS /STATE-DEFACTO COMPLAINANT/VICTIM:\n1 STATE OF KERALA,\nREPRESENTED BY THE PUBLIC PROSECUTOR,\nHIGH COURT OF KERALA, ERNAKULAM-682031\n2 RAJESH.T.,\nAGED 34 YEARS, S/O.BALAKRISHNAN,\nR/AT MURIYANAVI, KANHANGAD VILLAGE,\nKASARAGOD DISTRICT-671315.\n\nao eo]\nieee\nElz mt\nCri.M.C.Nos.8296 & 8314 of 2019 2020/KER/808\n2\n3 VIJESH.T.,\nAGED 31 YEARS, S/O.BALAKRISHNAN,\nR/AT MURIYANAVI, KANHANGAD VILLAGE,\nKASARAGOD DISTRICT-671315.\n4 RATHEESH.A,\nAGED 32 YEARS, S/O. KANNAN,\nR/AT KANDAMKADAVU, AVIYIL,\nKANHANAGAD VILLAGE,\nKASARAGOD DISTRICT-671315.\nR1 BY SRI.B.JAYASURYA SR.PP.\nR2-R4 BY ADV. SRI.K.P.ANTONY BINU\nOTHER PRESENT:\nTHIS CRIMINAL MISC. CASE HAVING COME UP FOR ADMISSION ON\n08.01.2020, ALONG WITH Cr1.MC.8314/2019(H), THE COURT ON THE\nSAME DAY PASSED THE FOLLOWING:\n\nao eo]\naaa\nBeer?\nCr1.M.C.Nos.8296 & 8314 of 2019 2020/KER/808\n3\nIN THE HIGH COURT OF KERALA AT ERNAKULAM\nPRESENT\nTHE HONOURABLE MR. JUSTICE ASHOK MENON\nWEDNESDAY, THE O8TH DAY OF JANUARY 2020 / 18TH POUSHA, 1941\nCrl1.MC.No.8314 OF 2019(H\nAGAINST THE ORDER/JUDGMENT IN CP 33/2018 OF JUDICIAL MAGISTRATE\nOF FIRST CLASS -I,HOSDURG\nCRIME NO.369/2016 OF Hosdurg Police Station, Kasargod\nPETITIONER/1ST ACCUSED:\nRATHEESH K.\nAGED 35 YEARS, S/O.RAGHAVAN KARATTU,\nHOUSE NO. KMC-36/308, SOUTH SCHOOL ROAD,\nKALLURAVI, KANHANGAD VILLAGE, HOSDURG TALUK,\nKASARAGOD DISTRICT.\nBY ADVS.\nSMT . HEMALATHA\nSRI.BINU GEORGE\nRESPONDENTS /STATE-DEFACTO COMPLAINANT/VICTIM:\n1 STATE OF KERALA\nREPRESENTED BY THE PUBLIC PROSECUTOR,\nHIGH COURT OF KERALA, ERNAKULAM-682031.\n2 RAJESH T.\nAGED 34 YEARS, S/O.BALAKRISHNAN,\nR/AT MURIYANAVI, KANHANGAD VILLAGE,\nKASARAGOD DISTRICT-671315.\n3 VIJESH T.,\nAGED 31 YEARS, S/O.BALAKRISHNAN,\nR/AT MURIYANAVI, KANHANGAD VILLAGE,\nKASARAGOD DISTRICT-671315.\n\nao eo]\nieee\nElz mt\nCri.M.C.Nos.8296 & 8314 of 2019 2020/KER/808\n4\n4 RATHERSH A.\nAGED 32 YEARS, S/O. KANNAN,\nR/AT KANDAMKADAVU, AVIYIL,\nKANHANGAD VILLAGE,\nKASARAGOD DISTRICT-671315.\nR1 BY SRI.B.JAYASURYA SR.PP.\nR2-R4 BY ADV. K.P.ANTONY BINU\nTHIS CRIMINAL MISC. CASE HAVING COME UP FOR ADMISSION ON\n08.01.2020, ALONG WITH Crl1.MC.8296/2019 (F), THE COURT ON THE\nSAME DAY PASSED THE FOLLOWING:\n\nCrl.M.C.Nos.8296 & 8314 of 2019 5 2020/KER/808\nCOMMON ORDER\n[ Cr1.MC.8296/2019, Cr1.MC.8314/2019 ]\nDated this the 8th day of January 2020\n\nThe petitioner in Crl.M.C.No.8296/2019 is the 9\naccused; while the petitioner in Crl.M.C.No.8314/2019\nis the 1** accused in Crime No.369/2016 of Hosdurg\nPolice Station. The case against the 1%* accused is\npending as UL.P.No.110/2018 on the file of the\nJudicial First Class Magistrate Court-I, Hosdurg;\nwhile the case against the 9% accused is pending as\nS.C.No.388/2019 on the file of the Additional\nDistrict and Sessions Judge-III, Kasaragod, for\nhaving allegedly committed the offences punishable\nunder Sections 143, 147, 148, 323, 324, 308 read with\nSection 149, I.P.C. There are three injured, who are\nrespondents 2 to 4 in both the cases, who have\nappeared through a Counsel and have filed affidavits\nstating that the matter has been amicably settled and\nthey have no existing grievance against the\n\nCrl.M.C.Nos.8296 & 8314 of 2019 6 2020/KER/808\npetitioners. A report has been filed by the\ninvestigating officer through the Senior Public\nProsecutor to that effect. The case against other\naccused was quashed by this Court vide order dated\n27.09.2019 in Crl.M.C.No.6571/2019. The petitioners\ndo not have any criminal antecedents and no public\ninterest is involved.\n\nIn the result, the Crl.M.Cs. are allowed and the\nentire proceedings as against the petitioners in\nCrime No.369/2016 of Hosdurg Police Station, now\npending as UL.P.No.110/2018 on the file of the\nJudicial First Class Magistrate Court-I, Hosdurg and\nas ยง.C.No.388/2019 on the file of the Additional\nDistrict and Sessions Judge-III, Kasaragod, shall\nstand quashed under Section 482 of Cr.P.C. and the\npetitioners are discharged.\n\nSd/-\ndkr ASHOK MENON\nJUDGE\n\nao eo]\nieee\nElz mt\nCri.M.C.Nos.8296 & 8314 of 2019 2020/KER/808\n7\nAPPENDIX OF Crl.MC 8296/2019\nPETITIONER'S/S EXHIBITS:\nANNEXURE Al COPY OF FIR IN CRIME NO.369/2016 OF HOSDURG\nPOLICE STATION\nANNEXURE A2 COPY OF FINAL REPORT IN CRIME NO.369/2016\nOF HOSDURG POLICE STATION\nANNEXURE A3 AFFIDAVIT DATED 16.10.2019 SWORN BY 2ND\nRESPONDENT\nANNEXURE A4 AFFIDAVIT DATED 16.10.2019 SWORN BY 3RD\nRESPONDENT\nANNEXURE A5 AFFIDAVIT DATED 16.10.2019 SWORN BY 4TH\nRESPONDENT\n\nao eo]\nieee\nElz mt\nCri.M.C.Nos.8296 & 8314 of 2019 2020/KER/808\n8\nAPPENDIX OF Crl.MC 8314/2019\nPETITIONER'S/S EXHIBITS:\nANNEXURE Al COPY OF FIR IN CRIME NO.369/2016 OF HOSDURG\nPOLICE STATION\nANNEXURE A2 COPY OF FINAL REPORT IN CRIME NO.369/2016\nOF HOSDURG POLICE STATION\nANNEXURE A3 AFFIDAVIT DATED 04.11.2019 SWORN BY 2ND\nRESPONDENT\nANNEXURE A4 AFFIDAVIT DATED 04.11.2019 SWORN BY 3RD\nRESPONDENT\nANNEXURE A5 AFFIDAVIT DATED 04.11.2019 SWORN BY 4TH\nRESPONDENT\n\n"
}