{
    "case_id": "Crl.MC.No. 27 of 2019",
    "court": "HIGH COURT OF KERALA AT ERNAKULAM\nPRESENT\nTHE HONOURABLE MR",
    "date": "2019",
    "judge": "K.ABRAHAM MATHEW",
    "petitioners": [
        "S:",
        "HASSANKUNJU, THONDUKANDATHIL, SOUTH KOCHUMURI,",
        "MC.No",
        "ASLAM MANZIL'",
        "3 SHAMEER, AGED 42 YEARS",
        "S/O.ALI-AKBAR, PALLIYUDE KIZHAKATHIL,",
        "KOLLAM DISTRICT-690525.",
        "OACHIRA, KOLLAM DISTRICT-690525.",
        "S/O.YUNUSKUNJU, SOUTH KOCHUMURI, OACHIRA,",
        "4 SHOUKATH, AGED 43 YEARS",
        "1 SHAJI, AGED 41 YEARS",
        "ERNAKULAM-31",
        "PAYIKUZHI, OACHTRA, KOLLAM DISTRICT-690525.",
        "SRI.A.MUHAMMED RAFFI",
        "2 HASARATH, AGED 44 YEARS",
        "K.ABRAHAM MATHEW"
    ],
    "respondents": [
        "S:",
        "1 STATE OF KERALA",
        "COURT OF KERALA, ERNAKULAM-31.",
        "REPRESENTED BY THE PUBLIC PROSECUTOR, HIGH"
    ],
    "sections": [
        "482",
        "323",
        "341",
        "294(b)"
    ],
    "outcome": "In the result, this Crl.M.C. is allowed",
    "full_text": "Be\nSt rr\npa arlene\nBeer\n2019/KER/1I91\nIN THE HIGH COURT OF KERALA AT ERNAKULAM\nPRESENT\nTHE HONOURABLE MR. JUSTICE K.ABRAHAM MATHEW\nFRIDAY, THE 04TH DAY OF JANUARY 2019 / 14TH POUSHA, 1940\nCr1.MC.No. 27 of 2019\nCRIME NO. 1167/2018 OF OCHIRA POLICE STATION , KOLLAM\nPETITIONER/S:\n1 SHAJI, AGED 41 YEARS\nHASSANKUNJU, THONDUKANDATHIL, SOUTH KOCHUMURI,\nOACHIRA, KOLLAM DISTRICT-690525.\n2 HASARATH, AGED 44 YEARS\nS/O.ALI-AKBAR, PALLIYUDE KIZHAKATHIL,\nPAYIKUZHI, OACHTRA, KOLLAM DISTRICT-690525.\n3 SHAMEER, AGED 42 YEARS\nS/O.ALI-AKBAR, PALLIYUDE KIZHAKATHIL,\nPAYIKUZHI, OACHTRA, KOLLAM DISTRICT-690525.\n4 SHOUKATH, AGED 43 YEARS\nS/O.YUNUSKUNJU, SOUTH KOCHUMURI, OACHIRA,\nKOLLAM DISTRICT-690525.\nBY ADVS.\nSRI.K.SIJU\nSMT .S.SEETHA\nRESPONDENT/S:\n1 STATE OF KERALA\nREPRESENTED BY THE PUBLIC PROSECUTOR, HIGH\nCOURT OF KERALA, ERNAKULAM-31.\n\nBel\nSys a\npa arlene\ncape\n2019/KER/191\nCrl.MC.No. 27 of 2019\nLi2e.\n2 THE STATION HOUSE OFFICER,\nOACHIRA POLICE STATION, KOLLAM DISTRICT, PIN-\n690525.\n3 HIDAYATHULLA, AGED 18 YEARS\nS/O.SHAJI, THONDUKANDATHIL, KOCHUMURI,\nKRISHNAPURAM, OACHIRA, KOLLAM DISTRICT-690525.\n4 AL-AMEEN, AGED 18 YEARS\nS/O.NAZEER N., 'ASLAM MANZIL', KOCHUMURI,\nOACHIRA, KOLLAM DISTRICT-690525.\nBY ADV. SRI.A.MUHAMMED RAFFI\nOTHER PRESENT:\nSRI. ALEX M THOMBRA SR PP\nTHIS CRIMINAL MISC. CASE HAVING COME UP FOR ADMISSION ON\n04.01.2019, THE COURT ON THE SAME DAY PASSED THE\nFOLLOWING:\nORDER\nPetition filed under Section 482 Cr.P.C.\n2. Petitioners are the accused in Crime No. 1167\nof 2018 of Oachira Police Station registered\nfor the offences under Sections 294(b), 323,\n341 & A277] of the Indian Penal Code.\nRespondents 3 & 4 are the victims. It is\nsubmitted that the matter has been settled and\nthe proceedings in the criminal case may be\n\nBel\nBeane\n2019/KER/191\n\nCrl.MC.No. 27 of 2019\n\n1.3..\nquashed.\n\n3. Heard the learned counsel for the petitioners\nand respondents 3 & 4 and the learned Public\nProsecutor.\n\n4. I have perused the affidavits filed by\nrespondents 3 & 4, who have entered appearance\nthrough counsel. I am satisfied that the\nallegation of settlement is true and no public\ninterest is involved. There is no impediment\nfor granting the prayer of the petitioners.\n\nIn the result, this Crl.M.C. is allowed. The\nproceedings in Crime No. 1167 of 2018 of\nOachira Police Station are quashed. The\nlearned magistrate may pass appropriate orders\nfor the disposal of the material objects, if\nany, produced in the case.\n\nSd/-\n\nK.ABRAHAM MATHEW\nJUDGE\nBka/11.01.2019\n\nBe\nSt rr\npa arlene\nBeer\n2019/KER/1I91\nCr1.MC.No. 27 of 2019\n~.4.,.\nAPPENDIX\nPETITIONER'S/S EXHIBITS:\nANNEXURE 1 THE COPY OF FIR IN CRIME NO.1167/2018\nOF OACHIRA POLICE STATION.\nANNEXURE 2 THE COPY OF FIR WITH FIS IN CRIME\nNO.2744/2018 OF KAYAMKULAM POLICE\nSTATION.\nANNEXURE 3 THE AFFIDAVIT SWORN BY THE 3RD\nRESPONDENT REGARDING THE COMPROMISE\nDATED 30.11.2018.\nANNEXURE 4 THE AFFIDAVIT SWORN BY THE 4TH\nRESPONDENT REGARDING THE COMPROMISE\nDATED 30.11.2018.\n\n"
}