{
    "case_id": "Crl.MC.No.7356 OF 2019 (H)",
    "court": "HIGH COURT OF KERALA AT ERNAKULAM",
    "date": "2020",
    "judge": "Bosh",
    "petitioners": [
        "PADINJARU",
        "S/O.LAL, KANNANKULATH HOUSE,P.O PERINJANAM,",
        "THRISSUR DIST.",
        "2 DISAN P.LAL",
        "S/O.SAJEEVAN, NELLIKKATHARA HOSUE,",
        "KODUNGALLUR TALUK, THRISSUR DIST.",
        "AGED 27 YEARS",
        "P.O. KATPAMANGALAM, KODUNGALLUR TALUK,",
        "AGED 25 YEARS",
        "3 VIPIN RAJ",
        "S /ACCUSED 1-3:",
        "S/O.RAJAN, VADAKKOOT HOUSE, PO PERINJANAM WEST,",
        "AGED 26 YEARS",
        "1 SHIVAS"
    ],
    "respondents": [
        "1 STATE OF KERALA",
        "DISTRICT-680686",
        "2 DILJITH",
        "S/O.GOPI, NADUVILTHARA HOUSE, SAMSKARAM SCHOOL,",
        "OTHER PRESENT:",
        "S /STATE & DEFACTO COMPLAINANT:",
        "REPRESENTED BY PUBLIC PROSECUTOR, HIGH COURT OF",
        "R2 BY ADV. C.DHEERAJ RAJAN",
        "AGED 22 YEARS",
        "KERALA, ERNAKULAM-682031",
        "PADINJARU DESOM, PERINJANAM VILLAGE, THRISSUR"
    ],
    "sections": [
        "323",
        "482",
        "341",
        "143",
        "506 read with Section\n149 IPC",
        "308",
        "147",
        "324",
        "363",
        "148"
    ],
    "outcome": "Dated this the 7th day of January 2020\n\nPetitioners are accused in Crime No.516/2019 of\nKaipamangalam Police Station for having allegedly\ncommitted offences punishable under Sections 143, 147,\n148, 36",
    "full_text": "Bosh\nrs 5 af Fr\nieee\nee\nIN THE HIGH COURT OF KERALA AT ERNAKULAM 2020/KER/471\nPRESENT\nTHE HONOURABLE MR. JUSTICE ASHOK MENON\nTUESDAY, THE O7TH DAY OF JANUARY 2020 / 17TH POUSHA, 1941\nCrl.MC.No.7356 OF 2019 (H)\n(CRIME NO.516/2019 OF KAIPAMANGALAM POLICE STATION, THRISSUR)\nPETITIONERS /ACCUSED 1-3:\n1 SHIVAS\nAGED 25 YEARS\nS/O.SAJEEVAN, NELLIKKATHARA HOSUE,\nP.O. KATPAMANGALAM, KODUNGALLUR TALUK,\nTHRISSUR DIST.\n2 DISAN P.LAL\nAGED 26 YEARS\nS/O.LAL, KANNANKULATH HOUSE,P.O PERINJANAM,\nKODUNGALLUR TALUK, THRISSUR DIST.\n3 VIPIN RAJ\nAGED 27 YEARS\nS/O.RAJAN, VADAKKOOT HOUSE, PO PERINJANAM WEST,\nKODUNGALLUR TALUK, THRISSUR DIST.\nBY ADV. SRI.VISHNUPRASAD NAIR\nRESPONDENTS /STATE & DEFACTO COMPLAINANT:\n1 STATE OF KERALA\nREPRESENTED BY PUBLIC PROSECUTOR, HIGH COURT OF\nKERALA, ERNAKULAM-682031\n2 DILJITH\nAGED 22 YEARS\nS/O.GOPI, NADUVILTHARA HOUSE, SAMSKARAM SCHOOL,\nPADINJARU DESOM, PERINJANAM VILLAGE, THRISSUR\nDISTRICT-680686\nR2 BY ADV. C.DHEERAJ RAJAN\nOTHER PRESENT:\nSRI.RAMESH CHAND, PP\nTHIS CRIMINAL MISC. CASE HAVING COME UP FOR ADMISSION ON\n07.01.2020, THE COURT ON THE SAME DAY PASSED THE FOLLOWING:\n\nPeete\nioe ee\na\n2020/KER/471\nCr. MC 7356/2019\n2\nORDER\nDated this the 7th day of January 2020\n\nPetitioners are accused in Crime No.516/2019 of\nKaipamangalam Police Station for having allegedly\ncommitted offences punishable under Sections 143, 147,\n148, 363, 341, 323, 324, 308 and 506 read with Section\n149 IPC.\n\n2. The only defacto complainant/injured is the\nsecond respondent, who has appeared through counsel and\nfiled affidavit to the effect that the matter has been\namicably settled with the petitioners and that he has\nno grievance against them. A report to that effect has\nalso been obtained from the investigating officer\nthrough the learned Public Prosecutor. The injuries\nSustained are not life threatening. Even while\ngranting bail to the petitioners, the Sessions Court\nwas apprehensive of whether an offence under Section\n308 IPC would be attracted. No public interest is\ninvolved. The petitioners do not have any criminal\n\noo\n= me\nrin\n2020/KER/471\nCrl.MC 7356/2019\n3\nantecedents.\n\nIn the result, the Criminal M.c. is allowed and\nthe entire proceedings as against the petitioners\nherein in crime No.516/2019 of Kaipamangalam Police\nStation shall stand quashed under Section 482 Cr.PC and\nthe petitioners/accused are discharged.\n\nSd/-\nASHOK MENON\nJUDGE\njg\n\nco oe, = [a]\nro\niz â€˜ iat\n2020/KER/471\nCri. MC 7356/2019\n4\nAPPENDIX\nPETITIONER'S/S EXHIBITS:\nANNEXURE I THE CERTIFIED COPY OF THE FIRST\nINFORMATION REPORT IN CRIME NO.516/2019\nOF KATPAMANGALAM POLICE STATION DATED\n16.08.2019\nANNEXURE II A TRUE COPY OF THE FIR DATED 16.08.2019\nIN CRIME 515/2019 OF KAIPAMANGALAM\nPOLICE STATION\nANNEXURE III AFFIDAVIT OF THE RESPONDENT/DE-FACTO\nCOMPLAINANT\n\n"
}