{
    "case_id": "Crl.MC.No. 3 of 2014 ()",
    "court": "HIGH COURT OF KERALA AT ERNAKULAM\nPRESENT",
    "date": "2014",
    "judge": "Hosdurg.\n\nHARUN-UL-RASHID",
    "petitioners": [
        "MC.No",
        "S/O.SHAMUSHEEN, R/A.A V HOUSE, MANIKOTH",
        "AJANOOR VILLAGE, HOSDURG TALUK, KASARAGOD DIST",
        "J.\nCri.M.C No.3",
        "6TH ACCUSED:",
        "Bitar",
        "FASALU RAHMAN@ FASALU, AGED 24 YEARS",
        "FASALU"
    ],
    "respondents": [
        "COMPLAINANT:",
        "HIGH COURT OF KERALA, ERNAKULAM-682031",
        "HOSDURG POLICE STATION, REP BY THE PUBLIC PROSECUTOR",
        "THROUGH THE STATION HOUSE OFFICER",
        "THE STATE OF KERALA"
    ],
    "sections": [
        "143",
        "147",
        "324",
        "248(1)",
        "326 r/w Section 149 IPC",
        "148"
    ],
    "outcome": "Accordingly, Crl.M.C is disposed",
    "full_text": "ao ual\nstig ale 1\nElz ere\n2014/KER/44\nIN THE HIGH COURT OF KERALA AT ERNAKULAM\nPRESENT:\nTHE HONOURABLE MR.JUSTICE HARUN-UL-RASHID\nWEDNESDAY, THE 1ST DAY OF JANUARY 2014/11TH POUSHA, 1935\nCrl.MC.No. 3 of 2014 ()\nC.C.NO.2153/2013 OF J.F.C.M-I, HOSDURG.\nCRIME NO. 196/2009 OF HOSDURG POLICE STATION , KASARGOD\nPETITIONER(S)/6TH ACCUSED:\nFASALU RAHMAN@ FASALU, AGED 24 YEARS\nS/O.SHAMUSHEEN, R/A.A V HOUSE, MANIKOTH\nAJANOOR VILLAGE, HOSDURG TALUK, KASARAGOD DIST\nBY ADV. SRI.T.MADHU\nRESPONDENT/COMPLAINANT:\nTHE STATE OF KERALA\nTHROUGH THE STATION HOUSE OFFICER\nHOSDURG POLICE STATION, REP BY THE PUBLIC PROSECUTOR\nHIGH COURT OF KERALA, ERNAKULAM-682031\nBY PUBLIC PROSECUTOR SMT.SAREENA GEORGE\nTHIS CRIMINAL MISC. CASE HAVING COME UP FOR ADMISSION ON\n01-01-2014, THE COURT ON THE SAME DAY PASSED THE FOLLOWING:\n\nBS ual\nstig ale 1\nDk. ies\n2014/KER/44\nCri.MC.No. 3 of 2014 ()\nAPPENDIX\nPETITIONER(S)' EXHIBITS:\nANNEX Ai:-THE TRUE CERTIFIED COPY OF THE FIR IN CRIME NO 196/2009 OF\nHOSDURG POLICE STATION\nANNEX A2:-TRUE CERTIFIED COPY OF THE FINAL REPORT IN CRIME NO 196/2009\nOF HOSDURG POLICE STATION\nANNEX A3:-TRUE COPY CERTIFIED COPY OF THE JUDGMENT DTD 30/7/2013 IN\nCC NO 845/2009 ON THE FILE OF TH ELEARNED JFCM COURT I,HOSDURG\nRESPONDENT(S)' EXHIBITS: NIL\n// TRUE COPY //\nP.A TO JUDGE.\n\nBitar)\n2014/KER/44\nHARUN-UL-RASHID, J.\nCri.M.C No.3 Of 2014\nDated this the 1* day of January, 2014.\nORDER\n\nPetitioner is the 6â„¢ accused in Crime No.196/2009 of\nHosdurg Police Station pending as C.C.No.2153/2013 on the file\nof the Judicial First Class Magistrate Court-I, Hosdurg. The\noffences alleged against the petitioner are punishable under\nSections 143, 147, 148, 324, 326 r/w Section 149 IPC. Crl.M.C\nis filed seeking to quash Annexure-A2 final report and all further\nproceedings pursuant to it in Crime No.196/2009 of Hosdurg\nPolice station.\n\n2. There are altogether seven accused in the crime. Out\nof the seven accused, accused Nos.i to 5 and 7 faced trial and\nthey were acquitted vide judgment dated 30.7.2013 in\nC.C.No.845/2009 on the file of the Judicial First Class Magistrate\nCourt-I, Hosdurg, a copy of which is marked for reference as\nAnnexure-A3. The learned Magistrate after evaluating the\nevidence held that there is no evidence to connect the accused\nwith the alleged offences. None of the eye witness identified the\n\nBitar)\n2014/KER/44\nr:2::\n\nCrl.M.C.No.3 Of 2014\nculprits. The accused were found not guilty of the offence\ncharged and they were acquitted under Section 248(1) Cr.P.C.\nThe remaining accused is the petitioner herein. The case against\nthe petitioner was split up  and_- re-numbered~ as\nC.C.No.2153/2013.\n\n3. Since the other accused except the petitioner were\nacquitted, for the very same set of reasons, this Court is of the\nview that no purpose would be served, even if the petitioner is\nasked to face the trial which will result in waste of judicial time.\nThis Court is of the view that the petitioner is entitled to be\nacquitted as in the case of other accused who were tried and\nacquitted in C.C.No.845/2009.\n\nAccordingly, Crl.M.C is disposed of quashing the Annexure-\nA2 Final Report in Crime No.196/2009 of Hosdurg Police Station\nand all proceedings in C.C.No.2153/2013 on the file of the\nJudicial First Class Magistrate Court-I, Hosdurg.\n\nHARUN-UL-RASHID,\nJudge.\nbkn/-\n\n"
}