{
    "case_id": "Crl.MC.No. 11 of 2019",
    "court": "HIGH COURT OF KERALA AT ERNAKULAM",
    "date": "THE 03RD DAY OF",
    "judge": "K.ABRAHAM MATHEW",
    "petitioners": [
        "1 MUHAMMED JOWHAR",
        "CHALIL HOUSE, EPPIKKAD, EDAPPATTA P.O.,",
        "ERNAKULAM DISTRICT",
        "Crl",
        "MC.No",
        "Malappuram",
        "S /ACCUSED :-",
        "AGED 37 YEARS",
        "SOUTH VALLAM, RAYONPURAM, PERUMBAVOOR,",
        "2 ABDU RAHMAN .M.K.,",
        "S/O. SHOUKATH ALI,",
        "Sd/-\nK.ABRAHAM MATHEW",
        "AGED 22 YEARS",
        "MOOKKADA HOUSE,",
        "MALAPPURAM DISTRICT",
        "K.ABRAHAM MATHEW"
    ],
    "respondents": [
        "CHIRAYIL HOUSE, CHULLIPARAMBU, VENGARA AMSOM, DESOM,",
        "AGED 32 YEARS",
        "2 SIRAJUDHEEN",
        "REPRESENTED BY THE PUBLIC PROSECUTOR,",
        "S/O. MOHAMMED KUTTY,",
        "MALAPPURAM DISTRICT 676 304",
        "HIGH COURT OF KERALA, ERNAKULAM KOCHI 682 031 - FOR",
        "THE SUB INSPECTOR OF POLICE, MELATTOOR POLICE",
        "S/STATE & DEFACTO COMPLAINANT :-",
        "1 THE STATE OF KERALA",
        "STATION, MALAPPURAM DISTRICT",
        "TIRURANGADHI TALUK,"
    ],
    "sections": [
        "482",
        "323",
        "5",
        "506",
        "308",
        "447",
        "324",
        "25(1)(a)",
        "3",
        "427"
    ],
    "outcome": "proceedings in the trial court may be quashed",
    "full_text": "meee\nPoesy\nok,\nIN THE HIGH COURT OF KERALA AT ERNAKULAM 201/KERM4\nPRESENT\nTHE HONOURABLE MR. JUSTICE K.ABRAHAM MATHEW\nTHURSDAY ,THE 03RD DAY OF JANUARY 2019 / 13TH POUSHA, 1940\nCri.MC.No. 11 of 2019\nCRIME NO. 226/2018 OF Melattur Police Station , Malappuram\nPETITIONERS /ACCUSED :-\n1 MUHAMMED JOWHAR\nAGED 22 YEARS\nS/O. SHOUKATH ALI,\nCHALIL HOUSE, EPPIKKAD, EDAPPATTA P.O.,\nMALAPPURAM DISTRICT\n2 ABDU RAHMAN .M.K.,\nAGED 37 YEARS\nMOOKKADA HOUSE,\nSOUTH VALLAM, RAYONPURAM, PERUMBAVOOR,\nERNAKULAM DISTRICT\nBY ADV. SRI.K.RAKESH\nRESPONDENTS/STATE & DEFACTO COMPLAINANT :-\n1 THE STATE OF KERALA\nREPRESENTED BY THE PUBLIC PROSECUTOR,\nHIGH COURT OF KERALA, ERNAKULAM KOCHI 682 031 - FOR\nTHE SUB INSPECTOR OF POLICE, MELATTOOR POLICE\nSTATION, MALAPPURAM DISTRICT\n2 SIRAJUDHEEN\nAGED 32 YEARS\nS/O. MOHAMMED KUTTY,\nCHIRAYIL HOUSE, CHULLIPARAMBU, VENGARA AMSOM, DESOM,\nTIRURANGADHI TALUK,\nMALAPPURAM DISTRICT 676 304\nBY ADV. SRI.K.S.PRAVEEN\nR1 BY SRI ALEX M THOMBRA- PUBLIC PROSECUTOR\nTHIS CRIMINAL MISC. CASE HAVING BEEN FINALLY HEARD ON 03.01.2019,\nTHE COURT ON THE SAME DAY PASSED THE FOLLOWING:\n\nBal\nDe.\nCrl.MC.No. 11 of 2019 2019/KERIT4\n2\nORDER\n\nPetition filed under section 482 Cr.P.C.\n\n2. Petitioners are accused in Crime No.226\nof 2018 of Melattoor Police Station registered for\nthe offences under sections 308, 323, 324, 427, 447\nand 506 IPC and sections 3, 5 and 25(1)(a) of the\nArms Act. The second respondent is the victim. It\nis submitted that the matter has been settled and the\nproceedings in the trial court may be quashed.\n\n3. Heard the learned counsel for _ the\npetitioners and second respondent and the learned\nPublic Prosecutor.\n\n4. I have perused the affidavit filed by\nthe second respondent, who has entered appearance\nthrough counsel. I am satisfied that the matter has\nbeen settled and no public interest is involved in\nthis case. There is no impediment for granting the\nprayer of the petitioners.\n\nIn the result, this Crl.M.C is allowed. The\nproceedings in Crime No.226 of 2018 of Melattoor\n\nBal\noe\nob\nCrl.MC.No. 11 of 2019 201HKERITA\n3\nPolice Station are quashed. If any material objects\nhave been produced in this case, the trial court may\npass appropriate orders for their disposal.\nSd/-\nK.ABRAHAM MATHEW,\nJUDGE\nSMA\n\nneeae\nrier\nok,\nCri.MC.No, 11 of 2019 2019/KER/14\nA\nAPPENDIX\nPETITIONER (S) ' ANNEXURES :-\nANNEXURE A TRUE COPY OF THE F.I.R. AND F.I.S. IN\nCRIME NO. 226/2018 OF MELATTOOR POLICE\nSTATION DATED 27.10.2018\nANNEXURE B AFFIDAVIT SWORN TO BY THE 2ND RESPONDENT\nDATED 20.12.2018\nRESPONDENT (S)' ANNEXURES :- NIL\n//TRUE COPY//\nPA TO JUDGE\nSMA\n\n"
}