{
    "case_id": "Crl.MC.No. 8452 OF 2017",
    "court": "HIGH COURT OF KERALA AT ERNAKULAM\nPRESENT",
    "date": "2018",
    "judge": "SUNIL THOMAS",
    "petitioners": [
        "MC.No",
        "MALAPPURAM",
        "IBRAHIM",
        "LUKOSE",
        "PANTHALINGAL, MAMPAD, MALAPPURAM DISTRICT.",
        "ACCUSED",
        "ABDUL SHUKOOR,",
        "AGED 52 YEARS, S/O. HASSAN, NEERMUNDA HOUSE,"
    ],
    "respondents": [
        "AGED 42 YEARS, W/O. IBRAHIM, KUPPANATH HOUSE,",
        "1. THE STATE OF KERALA,",
        "KERALA, ERNAKULAM-682031.",
        "(IN CRIME NO.334/2017 OF NILAMBUR POLICE STATION) .",
        "MALAPPURAM DISTRICT.",
        "3. IBRAHIM,",
        "PATHALINGAL, MAMPAD P.0.-676542, NILAMBUR TALUK,",
        "AGED 52 YEARS, S/O. ABDULLA, KUPPANATH HOUSE,",
        "eee.",
        "S/STATE AND COMPLAINANT :",
        "2. FATHIMA,",
        "4, SARAFUNNISA,",
        "AGED 41 YEARS, D/O. ABDULLA, KUPPANATH HOUSE,",
        "REPRESENTED BY THE PUBLIC PROSECUTOR, HIGH COURT OF"
    ],
    "sections": [
        "323",
        "482",
        "341",
        "451",
        "324"
    ],
    "outcome": "Accordingly, Crl.M.C. is allowed",
    "full_text": "Dsl\noie\n2018/KER/255\nIN THE HIGH COURT OF KERALA AT ERNAKULAM\nPRESENT :\nTHE HONOURABLE MR. JUSTICE SUNIL THOMAS\nTHURSDAY, THE 4TH DAY OF JANUARY 2018 / 14TH POUSHA, 1939\nCrl.MC.No. 8452 OF 2017\nAGAINST THE ORDER/JUDGMENT IN CC 705/2017 OF J.M.F.C., NILAMBUR\nCRIME NO.334/2017 OF NILAMBUR POLICE STATION, MALAPPURAM\nPETITIONER/ACCUSED\nABDUL SHUKOOR,\nAGED 52 YEARS, S/O. HASSAN, NEERMUNDA HOUSE,\nPANTHALINGAL, MAMPAD, MALAPPURAM DISTRICT.\nBY ADV.SRI.P.SAMSUDIN\nRESPONDENTS/STATE AND COMPLAINANT :\n1. THE STATE OF KERALA,\nREPRESENTED BY THE PUBLIC PROSECUTOR, HIGH COURT OF\nKERALA, ERNAKULAM-682031.\n(IN CRIME NO.334/2017 OF NILAMBUR POLICE STATION) .\n2. FATHIMA,\nAGED 42 YEARS, W/O. IBRAHIM, KUPPANATH HOUSE,\nPATHALINGAL, MAMPAD P.0.-676542, NILAMBUR TALUK,\nMALAPPURAM DISTRICT.\n3. IBRAHIM,\nAGED 52 YEARS, S/O. ABDULLA, KUPPANATH HOUSE,\nPATHALINGAL, MAMPAD P.0.-676542, NILAMBUR TALUK,\nMALAPPURAM DISTRICT.\n4, SARAFUNNISA,\nAGED 41 YEARS, D/O. ABDULLA, KUPPANATH HOUSE,\nPATHALINGAL, MAMPAD P.0.-676542, NILAMBUR TALUK,\nMALAPPURAM DISTRICT.\neee.\n\nisan\noie\n2018/KER/255\n12:\nCrl.MC.No. 8452 OF 2017 ()\n5. AAMINA,\nAGED 32 YEARS, W/O. SARAFUDHEEN, KUPPANATH HOUSE,\nPATHALINGAL, MAMPAD P.0.-676542, NILAMBUR TALUK,\nMALAPPURAM DISTRICT.\nRi BY PUBLIC PROSECUTOR SHRI.C.N.PRABHAKARAN\nR2-R5 BY ADV. SRI.JITHIN LUKOSE\nTHIS CRIMINAL MISC. CASE HAVING COME UP FOR ADMISSION ON 04-01-2018,\nTHE COURT ON THE SAME DAY PASSED THE FOLLOWING:\n\nsist\noie\n13: 2018/KER/255\nCr1.MC.No. 8452 OF 2017 ()\nAPPENDIX\nPETITIONER'S ANNEXURES:\nANNEXURE Al TRUE COPY OF THE FIR AND FINAL REPORT IN CRIME\nNO.334/2017 OF NILAMBUR POLICE STATION.\nANNEXURE A2 THE ORIGINAL OF THE AFFIDAVIT SWORN IN BY THE\n2ND RESPONDENT DATED 25.11.2017.\nANNEXURE A3 THE ORIGINAL OF THE AFFIDAVIT SWORN IN BY THE\n3RD RESPONDENT DATED 25.11.2017.\nANNEXURE A4 THE ORIGINAL OF THE AFFIDAVIT SWORN IN BY THE\n4TH RESPONDENT DATED 25.11.2017.\nANNEXURE A5 THE ORIGINAL OF THE AFFIDAVIT SWORN IN BY THE\n5TH RESPONDENT DATED 25.11.2017.\nRESPONDENTS' EXHIBITS: NIL\n//TRUE COPY//\nvgd PA TO JUDGE\n\nBees\nSUNIL THOMAS, J.\nDated this the 4\" day of January, 2018\nORDER\n\nThe petitioner is the sole accused in C.C. No.705/2017 of\nJudicial First Class Magistrate Court, Nilambur arising from Crime\nNo.334/2017 of Nilambur Police Station for offences punishable\nunder Sections 451, 323, 324, 341 & 354 IPC. It was alleged by\nthe prosecution that on 02.08.2017 at 3.40 p.m., the accused\ntrespassed into the house of the de facto complainant and tore\nher dress with the intention of outraging her modesty. Pursuant\nto the complaint lodged, crime was registered. After investigation\nfinal report was filed.\n\n2. The petitioner has approached this Court contending\nthat the dispute has been settled between the parties and no\nfurther grievance survives. Annexures A2 to A5 are the affidavits\nsworn to by the respondents 2 to 5 reiterating the settlement.\nLearned counsel for the respondents 2 to 5 submitted that the\nparties have resolved their disputes and no further grievance\nsurvives.\n\n3. | Having considered these facts, | am inclined to invoke\n\npas\n2018/KER/255\n\nCri. M. C. No. 8452 of 2017 2\nthe jurisdiction under Section 482 Cr.P.C. to quash the entire\nproceedings.\n\nAccordingly, Crl.M.C. is allowed. All further proceedings in\nC.C. No.705/2017 of Judicial First Class Magistrate Court, Nilambur\nstand quashed.\n\nS d/-\nSUNIL THOMAS, JUDGE.\n\nPn\n\n"
}