{
    "case_id": "Crl.MC.No. 210 of 2019",
    "court": "HIGH COURT OF KERALA AT ERNAKULAM\nPRESENT\nTHE HONOURABLE MR",
    "date": "2019",
    "judge": "BRE",
    "petitioners": [
        "S:",
        "BEARING REGISTRATION NO.KL-04-U-3261).",
        "MC.No",
        "ERNAKULAM DISTRICT (OWNER OF A TAT, HGV TIPPER,",
        "KARUKADOM.P.O, PALLIPADY, KOTHAMANGALAM,",
        "$/O.M.S.SALIM, MECHERIMALIL HOUSE,",
        "K.ABRAHAM MATHEW",
        "Sd/-\nK.ABRAHAM MATHEW",
        "BRE",
        "ANSAR AHAMMED SALIM",
        "AGED 30 YEARS"
    ],
    "respondents": [
        "S:",
        "2 THE SUB INSPECTOR OF POLICE,",
        "SRI C S HRITHWIK-SR PP",
        "1 STATE OF KERALA",
        "OF KERALA, ERNAKULAM-682031.",
        "DISTRICT-683542.",
        "OTHER PRESENT:",
        "REPRESENTED BY PUBLIC PROSECUTOR, HIGH COURT",
        "PERUMBAVOOR POLICE STATION, ERNAKULAM",
        "ERNAKULAM DISTRICT-682030.",
        "3 THE DISTRICT COLLECTOR"
    ],
    "sections": [
        "482",
        "457"
    ],
    "outcome": "",
    "full_text": "BRE\noa x A\nPEER SE Ten\nBiaeee\n2019/KER/1028\nIN THE HIGH COURT OF KERALA AT ERNAKULAM\nPRESENT\nTHE HONOURABLE MR. JUSTICE K.ABRAHAM MATHEW\nWEDNESDAY ,THE O9TH DAY OF JANUARY 2019 / 19TH POUSHA,\n1940\nCr1.MC.No. 210 of 2019\nPETITIONER/S:\nANSAR AHAMMED SALIM\nAGED 30 YEARS\n$/O.M.S.SALIM, MECHERIMALIL HOUSE,\nKARUKADOM.P.O, PALLIPADY, KOTHAMANGALAM,\nERNAKULAM DISTRICT (OWNER OF A TAT, HGV TIPPER,\nBEARING REGISTRATION NO.KL-04-U-3261).\nBY ADV. SRI.AJEESH M UMMER\nRESPONDENT/S:\n1 STATE OF KERALA\nREPRESENTED BY PUBLIC PROSECUTOR, HIGH COURT\nOF KERALA, ERNAKULAM-682031.\n2 THE SUB INSPECTOR OF POLICE,\nPERUMBAVOOR POLICE STATION, ERNAKULAM\nDISTRICT-683542.\n3 THE DISTRICT COLLECTOR\nERNAKULAM DISTRICT-682030.\nOTHER PRESENT:\nSRI C S HRITHWIK-SR PP\nTHIS CRIMINAL MISC. CASE HAVING COME UP FOR ADMISSION ON\n\nee\n2019/KER/1028\n\nCrl.MC.No. 210 of 2019\n\n1i2..\n09.01.2019, THE COURT ON THE SAME DAY PASSED THE\nFOLLOWING:\nORDER\nPetition filed under Section 482 Cr.P.C.\n\n2. The petitioner claims to be the owner of a\nvehicle seized by the second respondent on the\nallegation of commission of the offence under\nthe provisions of the Kerala Conservation of\nPaddy Land and Wet Land Act. The seizure has\nnot been reported to the learned magistrate.\nThe prayer is to direct the second respondent\nto report the seizure to the learned\nmagistrate concerned.\n\n3. Heard the learned counsel for the petitioner\nand the learned Public Prosecutor.\n\n4, The petitioner may file an application under\nSection 457 Cr.P.C. before the competent\ncourt, which shall call for a report from the\nsecond respondent and pass appropriate orders\n\nBRE\neaten\nBiaeee\n2019/KER/1028\nCr1l.MC.No. 210 of 2019\n..3.,\non it.\nWith this direction, this Crl.M.C. is closed.\nSd/-\nK.ABRAHAM MATHEW\nJUDGE\nAPPENDIX\nPETITIONER'S/S EXHIBITS:\nANNEXURE 1 TRUE COPY OF THE SEIZURE MAHASSAR\nPREPARED BY THE SECOND RESPONDENT\nDATED 29/12/2018 IN CONNECTION WITH\nSEIZURE OF VEHICLE OF PETITIONER.\nANNEXURE 2 TRUE COPY OF THE ORDER DATED\n07/12/2018 IN CRL.M.C.8111/2018.\nBka/10.01.2019\n\n"
}