{
    "case_id": "Crl.MC.No. 17 of 2019",
    "court": "HIGH COURT OF KERALA AT ERNAKULAM",
    "date": "2019",
    "judge": "K.ABRAHAM MATHEW",
    "petitioners": [
        "4 MUHAMMED,",
        "CHITTETHUKUDY HOUSE",
        "Sd/-\nK.ABRAHAM MATHEW",
        "Ernakulam",
        "MUNDAKKAL HOUSE",
        "Piao",
        "S/O.KAREEM, CHITTETHUKUDY HOUSE,",
        "ALLAPRA P.O., PERUMBAVOOR,",
        "6 RENEESH C.A.,",
        "CHELAMATTOM KARA",
        "MC.No",
        "S/O.SUBAIR, MUNDAKKAL HOUSE,",
        "KUPPIYAN HOUSE",
        "S/O.MUSTAFA, KUPPIYAN HOUSE,",
        "AGED 30 YEARS",
        "S/O.NISSAR, MADATHUPADI HOUSE,",
        "S :",
        "5 MUBARAK ,",
        "3 MAHIN,",
        "AGED 35 YEARS",
        "THYCATTUKARA, KUNNATHERI,",
        "CHELAMATTOM KARA, OKKAL P.O.,",
        "1 K.M.ABOOBAKAR,",
        "AGED 45 YEARS",
        "2 MOHAMMED NISSAR,",
        "J.ANAKKALLUNKAL",
        "S/O.USMAN, PULIMMOOTTIL HOUSE,",
        "PERUMBAVOOR, ERNAKULAM DISTRICT.",
        "AGED 27 YEARS",
        "S/O.ALIYAR, CHIRAKKAKUDY,",
        "PONJASSERY P.O., THANDEKKAD KARA,",
        "ERNAKULAM DISTRICT."
    ],
    "respondents": [
        "S:",
        "HIGH COURT OF KERALA, ERNAKULAM-682031.",
        "THOTTUMUKHAM P.O.,",
        "2 RAFEEQ M.A.,",
        "MANAYATH HOUSE,",
        "SRI ALEX M THOMBRA- PUBLIC PROSECUTOR",
        "REPRESENTED BY THE PUBLIC PROSECUTOR,",
        "ALUVA, PIN-683105.",
        "iS} / O.FAROOK ABDULLA,",
        "1 STATE OF KERALA",
        "MANAYATH HOUSE, THOTTUMUKHAM P.O.,",
        "3 SHAHUL,",
        "AGED 24 YEARS",
        "S / O.FAROOK ABDULLA,",
        "AGED 28 YEARS"
    ],
    "sections": [
        "482",
        "506",
        "307",
        "326"
    ],
    "outcome": "In the result, this Crl.M.C is allowed",
    "full_text": "et ae\nF;\npeal\nElz 5 ie\nIN THE HIGH COURT OF KERALA AT ERNAKULAM 2019/KER/6\nPRESENT\nTHE HONOURABLE MR. JUSTICE K.ABRAHAM MATHEW\nTHURSDAY, THE O3RD DAY OF JANUARY 2019 / 13TH POUSHA, 1940\nCr1.MC.No. 17 of 2019\nCRIME NO. 3321/2018 of Aluva Police Station, Ernakulam\nPETITIONERS :\n1 K.M.ABOOBAKAR,\nAGED 45 YEARS\nS/O.MUSTAFA, KUPPIYAN HOUSE,\nCHELAMATTOM KARA, OKKAL P.O.,\nPERUMBAVOOR, ERNAKULAM DISTRICT.\n2 MOHAMMED NISSAR,\nAGED 35 YEARS\nS/O.NISSAR, MADATHUPADI HOUSE,\nPONJASSERY P.O., THANDEKKAD KARA,\nERNAKULAM DISTRICT.\n3 MAHIN,\nAGED 27 YEARS\nS/O.KAREEM, CHITTETHUKUDY HOUSE,\nPONJASSERY P.O., THANDEKKAD KARA,\nPERUMBAVOOR, ERNAKULAM DISTRICT.\n4 MUHAMMED,\nAGED 30 YEARS\nS/O.SUBAIR, MUNDAKKAL HOUSE,\nPONJASSERY P.O., THANDEKKAD KARA,\nPERUMBAVOOR, ERNAKULAM DISTRICT.\n5 MUBARAK ,\nAGED 35 YEARS\nS/O.USMAN, PULIMMOOTTIL HOUSE,\nTHYCATTUKARA, KUNNATHERI,\nERNAKULAM DISTRICT.\n6 RENEESH C.A.,\nAGED 35 YEARS\nS/O.ALIYAR, CHIRAKKAKUDY,\nALLAPRA P.O., PERUMBAVOOR,\nERNAKULAM DISTRICT.\n\nPiao\na\nEl: 4 ie\nCr1.MC.No. 17 of 2019 2 2019/KERI6\n7 SUDHEER U.U.,\nAGED 41 YEARS\n$/O.USMANKUTTY, URAKAADAN HOUSE,\nCHELAMATTOM, OKKAL P.O., PERUMBAVOOR,\nERNAKULAM DISTRICT.\nBY ADV. SRI.THOMAS J.ANAKKALLUNKAL\nRESPONDENTS:\n1 STATE OF KERALA\nREPRESENTED BY THE PUBLIC PROSECUTOR,\nHIGH COURT OF KERALA, ERNAKULAM-682031.\n2 RAFEEQ M.A.,\nAGED 28 YEARS\nS / O.FAROOK ABDULLA,\nMANAYATH HOUSE,\nTHOTTUMUKHAM P.O.,\nALUVA, PIN-683105.\n3 SHAHUL,\nAGED 24 YEARS\niS} / O.FAROOK ABDULLA,\nMANAYATH HOUSE, THOTTUMUKHAM P.O.,\nALUVA, PIN-683105.\nSRI ALEX M THOMBRA- PUBLIC PROSECUTOR\nTHIS CRIMINAL MISC. CASE HAVING BEEN FINALLY HEARD ON\n03.01.2019 , THE COURT ON THE SAME DAY PASSED THE FOLLOWING:\n\nBane\nCrl.MC.No. 17 of 2019 3 2019 /KERIG\nORDER\n\nPetition filed under Section 482 Cr.P.C.\n\n2. Petitioners are the accused in Crime\nNo.3321 of 2018 of Aluva East Police Station,\nErnakulam. They are alleged to have committed\nthe offences under Sections 307, 326 and 506\nIPC. Respondents 2 and 3 are the victims. It\nis submitted that the matter has been settled\nand the proceedings in the trial court may be\nquashed.\n\n3. Heard the learned counsel for _ the\npetitioners and respondents 2 and 3 and the\nlearned Public Prosecutor.\n\n4. I have perused the affidavits filed by\nthe respondents 2 and 3, who have entered\nappearance through counsel. TIT am satisfied\nthat the matter has been settled and no public\ninterest is involved in this case. There is no\n\nBane\nCrl.MC.No. 17 of 2019 4 201/KERIG\nimpediment for granting the prayer of the\npetitioners.\nIn the result, this Crl.M.C is allowed.\nThe proceedings in Crime No.3321 of 2018 of\nAluva East Police Station, Ernakulam are\nquashed. If any material objects have been\nproduced in this case, the trial court may pass\nappropriate orders for their disposal.\nSd/-\nK.ABRAHAM MATHEW\nJUDGE\nMC/03.01.19\n\nPiao\na\nEl: 4 ie\nCr1.MC.No. 17 of 2019 5 2019/KERI6\nAPPENDIX\nPETITIONER'S/S EXHIBITS:\nANNEXURE Al CERTIFIED COPY OF THE FIR IN CRIME\nNO.3321/2018 OF ALUVA POLICE STATION.\nANNEXURE A2 CERTIFIED COPY OF THE FIS IN CRIME\nNO.3321/2018 OF ALUVA POLICE STATION.\nANNEXURE A3 AFFIDAVIT SWORN IN BY THE 2ND\nRESPONDENT /VICTIM .\nANNEXURE A4 AFFIDAVIT SWORN IN BY THE 3RD\nRESPONDENT / DEFACTO COMPLAINANT.\nRESPONDENT'S/S EXHIBITS:\nNIL\nMC\n(TRUE COPY) PA TO JUDGE\n\n"
}