{
    "case_id": "",
    "court": "HIGH COURT OF KERALA AT ERNAKULAM\nPRESENT",
    "date": "THE 2ND DAY",
    "judge": "HARUN-UL-RASHID",
    "petitioners": [
        "S/O. THANKAPPAN PILLAI,AGED 29 YEARS,",
        "AMBIKA SADANATHIL HOUSE,",
        "MC.No",
        "PRESENT ADDRESS OF PETITIONER'S PARENTS: RAJENDRAPEL BUILDING ,",
        "ACCUSED NO.1:",
        "Thoudpuzha",
        "TRIPUNITHURA, ERNAKULAM DISTRICT.",
        "MUKHATHALA VILLAGE, KOLLAM,",
        "MURALEEKRISHNAN,",
        "IN B.A.NO.4962 OF",
        "ILLICKAPADY, MARANA ROAD, EROOR,"
    ],
    "respondents": [
        "THROUGH SUB INSPECTOR OF POLICE, CUMBUMMETTU",
        "STATE OF KERALA,",
        "COMPLAINANT:",
        "HIGH COURT OF KERALA.",
        "REPRESENTED BY PUBLIC PROSECUTOR,"
    ],
    "sections": [
        "8",
        "3"
    ],
    "outcome": "In the facts and circumstances, the Crl.M.C is disposed",
    "full_text": "Lise |\na ah\nBL\n2014/KER/242\nIN THE HIGH COURT OF KERALA AT ERNAKULAM\nPRESENT:\nTHE HONOURABLE MR.JUSTICE HARUN-UL-RASHID\nTHURSDAY, THE 2ND DAY OF JANUARY 2014/12TH POUSHA, 1935\nCril.MC.No. 81 of 2014\n[L.P. NO.6/2012 OF THE SESSIONS COURT, THODUPUZHA,\nCRIME NO. 78/2007 OF CUMBUMMETTU POLICE STATION , IDUKKI DISTRICT]\nPETITIONER/ACCUSED NO.1:\nMURALEEKRISHNAN,\nS/O. THANKAPPAN PILLAI,AGED 29 YEARS,\nAMBIKA SADANATHIL HOUSE,\nMUKHATHALA VILLAGE, KOLLAM,\nPRESENT ADDRESS OF PETITIONER'S PARENTS: RAJENDRAPEL BUILDING ,\nILLICKAPADY, MARANA ROAD, EROOR,\nTRIPUNITHURA, ERNAKULAM DISTRICT.\nBY ADV. SRI.K.JAYAKUMAR(CHERTHALA).\nRESPONDENT/COMPLAINANT:\nSTATE OF KERALA,\nTHROUGH SUB INSPECTOR OF POLICE, CUMBUMMETTU\nREPRESENTED BY PUBLIC PROSECUTOR,\nHIGH COURT OF KERALA.\nBY PUBLIC PROSECUTOR SMT. SAREENA GEORGE.\nTHIS CRIMINAL MISC. CASE HAVING COME UP FOR ADMISSION\nON 02-01-2014, THE COURT ON THE SAME DAY PASSED THE\nFOLLOWING:\nPrv.\n\nBIL\nae at\n| eae\n2014/KER/242\nCRL.M.C. NO.81/2014:\nAPPENDIX\nPETITIONER'S ANNEXURES:\nANNEXURE-A1: TRUE COPY OF ORDER DATED 7.9.2009 IN B.A.NO.4962 OF 2009\nOF THIS HON'BLE COURT.\nANNEXURE-A2: TRUE COPY OF PASSPORT OF THE PETITIONER.\nRESPONDENTS’ ANNEXURES: NIL.\nHTRUE COPY//\nP.A. TO JUDGE.\nPrv.\n\nBee\n2014/KER/242\nHARUN-UL-RASHID, J.\nCriLM.C. No.81 of 2014\nDated this the 2” day of January 2014.\nORDER\n\nHeard the learned counsel for the _ petitioner and\nrespondents.\n\n2. Petitioner is the accused No.1 in Crime No. 78/2007 of\nCumbummettu Police Station, Idukki District pending as L.P.No.\n6/2012 on the file of the Sessions Court, Thoudpuzha. The\npetitioner is charge sheeted for the offence punishable under\nSections 8 (1) and (2) of the Abkari Act and under Section 3 (1)\nof PDPP Act. Due to the non-appearance of the petitioner, non-\nbailable warrant was issued against him.\n\n3. The petitioner is willing to surrender before the court\nbelow. Non-bailable warrant is pending against him. Now, the\npetitioner seeks a direction from this Court to consider his\napplication for bail on the date of surrender itself.\n\nIn the facts and circumstances, the Crl.M.C is disposed of,\ndirecting the Sessions Court, Thodupuzha to consider and pass\norders on the bail application on the date of surrender itself in the\nevent of the petitioner surrendering before the court below and\n\nPipes\ncpiateat\nBIDRa\n2014/KER/242\nCrl.M.C. No.81/2004\n:2:\nsubmitting an application for bail with prior notice to the Assistant\nPublic Prosecutor within a period of fifteen days from today. The\nnon-bailable warrant issued shall be kept in abeyance till the bail\napplication is heard and dispose of.\nSd/-\nHARUN-UL-RASHID,\nJudge.\nAL/-\nTrue copy\nP.A to Judge\n\n"
}