{
    "case_id": "",
    "court": "HIGH COURT OF KERALA AT ERNAKULAM",
    "date": "THE 07TH DAY",
    "judge": "PADIKKAL",
    "petitioners": [
        "AGED 31 YEARS",
        "SUDHILAL,",
        "A.CHANDRA BABU",
        "CHAVARCODE",
        "s/o SAJILAL, KIZHAKKATHIL VEEDU,",
        "has_~=",
        "MULAVANA",
        "ACCUSED:",
        "PADIKKAL, NEAR PALKULANGARA DEVI TEMPLE, KILIKOLLOOR",
        "VILLAGE, KOLLAM DISTRICT.",
        "A.CHANDRA BABU\nR1"
    ],
    "respondents": [
        "1 STATE OF KERALA, REPRESENTED BY PUBLIC PROSECUTOR,",
        "VARKALA, THIRUVANANTHAPURAM DISTRICT-695001.",
        "HIGH COURT OF KERALA,",
        "S/O KADJU,NARAYANA MANDIRAM,",
        "S/STATE & DEFACTO COMPLAINANT:",
        "2 ARJUN, AGED 32 YEARS,",
        "R2 BY ADV. A.CHANDRA BABU",
        "R1 BY SRI.C.S.HRITHWIK, SR.P.P.",
        "CHAVARCODE, PARIPPALLY.P.O,",
        "ERNAKULAM-682031."
    ],
    "sections": [
        "482",
        "341",
        "143",
        "308 read with\nSection 149 IPc",
        "308",
        "147",
        "2020/KER/513",
        "294(b)",
        "447",
        "324",
        "148"
    ],
    "outcome": "/JUDGMENT IN SC 1875/2014 OF ASSISTANT SESSIONS\nCOURT , ATTINGAL\nCRIME NO.845/2011 OF Varkala Police Station , Thiruvananthapuram\nPETITIONER/ACCUSED:\nSUDHILAL,\nAGED 31 YEARS\ns/o SAJILAL, KIZHAKKATHIL",
    "full_text": "Baan\nope\nIN THE HIGH COURT OF KERALA AT ERNAKULAM 2020/KER/S13\nPRESENT\nTHE HONOURABLE MR. JUSTICE ASHOK MENON\nTUESDAY, THE 07TH DAY OF JANUARY 2020 / 17TH POUSHA, 1941\nCr1.MC.No.8401 OF 2019 (A)\nAGAINST THE ORDER/JUDGMENT IN SC 1875/2014 OF ASSISTANT SESSIONS\nCOURT , ATTINGAL\nCRIME NO.845/2011 OF Varkala Police Station , Thiruvananthapuram\nPETITIONER/ACCUSED:\nSUDHILAL,\nAGED 31 YEARS\ns/o SAJILAL, KIZHAKKATHIL VEEDU,\nPADIKKAL, NEAR PALKULANGARA DEVI TEMPLE, KILIKOLLOOR\nVILLAGE, KOLLAM DISTRICT.\nBY ADV. SRI.P.ANOOP (MULAVANA)\nRESPONDENTS/STATE & DEFACTO COMPLAINANT:\n1 STATE OF KERALA, REPRESENTED BY PUBLIC PROSECUTOR,\nHIGH COURT OF KERALA,\nERNAKULAM-682031.\n2 ARJUN, AGED 32 YEARS,\nS/O KADJU,NARAYANA MANDIRAM,\nCHAVARCODE, PARIPPALLY.P.O,\nVARKALA, THIRUVANANTHAPURAM DISTRICT-695001.\nR2 BY ADV. A.CHANDRA BABU\nR1 BY SRI.C.S.HRITHWIK, SR.P.P.\nTHIS CRIMINAL MISC. CASE HAVING COME UP FOR ADMISSION ON\n07.01.2020, ALONG WITH Crl1.MC.8407/2019(A), THE COURT ON THE SAME\nDAY PASSED THE FOLLOWING:\n\nBaan\nops\n2020/KER/513\nCrl.MC 8401 & 8407/2019\n-?-=\nIN THE HIGH COURT OF KERALA AT ERNAKULAM\nPRESENT\nTHE HONOURABLE MR. JUSTICE ASHOK MENON\nTUESDAY, THE O7TH DAY OF JANUARY 2020 / 17TH POUSHA, 1941\nCr1.MC.No.8407 OF 2019 (A)\nAGAINST THE ORDER/JUDGMENT IN SC 543/2013 OF ASSISTANT SESSIONS\nCOURT , ATTINGAL\nCRIME NO.845/2011 OF Varkala Police Station , Thiruvananthapuram\nPETITIONER/ACCUSED NO.1:\nSUJILAL\nAGED 31 YEARS\nS/O.SAJILAL, KIZHAKKATHIL VEEDU, PADIKKAL, NEAR\nPALKULANGARA DEVI TEMPLE, KILIKOLLOOR VILLAGE,\nKOLLAM DISTRICT, NOW RESIDING AT SINDHU BHAVAN,\nVRINDAVAN NAGAR, KADAPPAKADA, KOLLAM DISTRICT.\nBY ADV. SRI.P.ANOOP (MULAVANA)\nRESPONDENTS/STATE & DEFACTO COMPLAINANT :\n1 STATE OF KERALA, REPRESENTED BY PUBLIC PROSECUTOR,\nHIGH COURT OF KERALA, ERNAKULAM-682031.\n2 ARJUN\nAGED 32 YEARS\nS/O.KADJU, NARAYANA MANDIRAM, CHAVARCODE,\nPARIPPALLY.P.O., VARKALA, THIRUVANANTHAPURAM\nDISTRICT, PIN - 695 001.\nR2 BY ADV. A.CHANDRA BABU\nRl BY SRI.C.S.HRITHWIK, SR.P.P.\nTHIS CRIMINAL MISC. CASE HAVING COME UP FOR ADMISSION ON\n07.01.2020, ALONG WITH Crl1.MC.8401/2019(A), THE COURT ON THE\nSAME DAY PASSED THE FOLLOWING:\n\nBIA]\na\nrear\n2020/KER/513\nCrl.MC 8401 & 8407/2019\n3+\nCOMMON ORDER\n[ Cr1.MC.8401/2019, Cr1.MC.8407/2019 ]\nDated this the 7th day of January 2020\n\nPetitioners in these cases are accused Nos.2\nand 1 respectively, in Crime No.845/2011 of\nvarkkala Police Station for having allegedly\ncommitted offences punishable under Sections 143,\n147, 148, 447, 294(b), 341, 324 and 308 read with\nSection 149 IPc. The cases against the\npetitioners were committed and are_ presently\npending as SC No.1875/2014 and SC No.543/2013,\nrespectively, before the Assistant Sessions Court,\nAttingal. The defacto complainant/injured is the\nsecond respondent, who has_~= appeared through\ncounsel and filed separate affidavits in these\ncases to the effect that the matter has _ been\namicably settled with the petitioners and that he\nhas no grievance against’ them. Even through\noffence under Section 308 IPC has been\nincorporated, the injuries are not life\n\na\npiers\n2020/KER/513\nCrl1.MC 8401 & 8407/2019\n-4-\nthreatening. A report has been obtained from the\ninvestigating officer to the effect that the\nmatter has been settled. The petitioners do not\nhave any criminal antecedents. No public interest\nis involved.\n\nIn the result, these Criminal M.Cs are allowed\nand the entire proceedings as against’ the\npetitioners pending before the Assistant Sessions\nCourt, Attingal in SC Nos.1875/2014 and 543/2013\nshall stand quashed under Section 482 cCr.PC and\nthe petitioners/accused are discharged.\n\nSd/-\nASHOK MENON\nJUDGE\nig\n\nBaan\nEup\n2020/KER/513\nCrl.MC 8401 & 8407/2019\n-5-\nAPPENDIX OF Cr1.MC 8401/2019\nPETITIONER'S/S EXHIBITS:\nANNEXURE Al TRUE COPY OF THE CHARGE SHEET IN\n§$.C.NO.1875/2014 BEFORE THE ASSISTANT\nSESSIONS COURT ,ATTINGAL.\nANNEXURE A2 TRUE COPY OF THE AFFIDAVIT FILED BY THE\n2ND RESPONDENT.\n\nBaan\nEup\n2020/KER/513\nCrl.MC 8401 & 8407/2019\n~6-\nAPPENDIX OF Cr1.MC 8407/2019\nPETITIONER'S/S EXHIBITS:\nANNEXURE Al TRUE COPY OF THE CHARGE SHEET IN SC\nNO.543/2013 BEFORE THE ASSISTANT SESSIONS\nCOURT, ATTINGAL\nANNEXURE A2 AFFIDAVIT FILED BY THE 2ND RESPONDENT\n\n"
}