{
    "case_id": "",
    "court": "HIGH COURT OF KERALA AT BERNAKULAM\nPRESENT",
    "date": "2015",
    "judge": "Fer Lat",
    "petitioners": [
        "ALUVA.",
        "S/O.VARGHESE, KACHAPPILLY HOUSE, KEZHMADU",
        "ROY VARGHESE, AGED 48 YEARS",
        "(S)/ACCUSED :-"
    ],
    "respondents": [
        "HIGH COURT OF KERALA, ERNAKULAM-682 031.",
        "STATE OF KERALA",
        "(S) /COMPLAINANT :-",
        "REPRESENTED BY THE PUBLIC PROSECUTOR"
    ],
    "sections": [
        "420 r/w 34 of IPC"
    ],
    "outcome": "this Crl.M.C. is disposed",
    "full_text": "Fer Lat\net,\nEl i\n2015/KER/17456\nIN THE HIGH COURT OF KERALA AT BERNAKULAM\nPRESENT:\nTHE HONOURABLE MR. JUSTICE ANIL K.NARENDRAN\nTUESDAY, THE 28TH DAY OF APRIL 2015/8TH VAISAKHA, 1937\nCr1.MC.No. 2608 of 2015 ()\ncc 439/2014 of J.M.F.C., ETTUMANUR\nCRIME NO. 401/2011 OF ETTUMANOOR POLICE STATION\nPETITIONER (S)/ACCUSED :-\nROY VARGHESE, AGED 48 YEARS\nS/O.VARGHESE, KACHAPPILLY HOUSE, KEZHMADU\nALUVA.\nBY ADV. SRI.K.S.RAJEEV (ALUVA)\nRESPONDENT (S) /COMPLAINANT :-\nSTATE OF KERALA\nREPRESENTED BY THE PUBLIC PROSECUTOR\nHIGH COURT OF KERALA, ERNAKULAM-682 031.\nBY PUBLIC PROSECUTOR SRI.ABHIJITT LESSLI\nTHIS CRIMINAL MISC. CASK HAVING COME UP FOR ADMISSION ON\n28-04-2015, THE COURT ON THE SAME DAY PASSED THE FOLLOWING:\njvt\n\nope\n2015/KER/17456\nANIL K. NARENDRAN, J.\nâ€˜CrL.M.C. No.2608 of 2015\nDated this the 28\" day of April 2015\nORDER\n\nPetitioner is arrayed as the first accused in Crime\nNo.401/2011 of Ettumanoor Police Station, which is pending as\nC.C.No.439 of 2014 on the file of Judicial First Class Magistrate\nCourt, Ettumanoor, registered for the offence punishable under\nSection 420 r/w 34 of IPC. The grievance of the petitioner is that,\nthe Magistrate Court has already issued non-bailable warrant\nagainst him and if he surrenders before the Magistrate Court\nthere is likelihood of the application not being considered on the\nvery same day. Hence, he has filed this Crl.M.C. seeking an order\ndirecting the Magistrate Court to consider and pass appropriate\norders on his bail application on the day of surrender itself.\n\n2. Heard the learned counsel for the petitioner and the\nlearned Public Prosecutor for respondent.\n\n3. Considering the facts and circumstances of the case,\nthis Crl.M.C. is disposed of directing the petitioner to surrender\nbefore the Judicial First Class Magistrate Court, Ettumanoor\n\nBEST\na\neae\n2015/KER/17456\nCrl.M.C. No.2608 of 2015\n-20-\nwithin two weeks from today and the Magistrate Court is further\ndirected to consider and pass appropriate orders on the bail\napplication filed by the petitioner on the same day itself, in\naccordance with law. The non-bailable warrant issued against the\npetitioner shall be kept in abeyance for a period of two weeks\nfrom today.\nThis Crl.M.C. is disposed of.\nSd/-\nANIL K. NARENDRAN\nJUDGE\n/[TRUE COPY//\nP.A. TO JUDGE\njvt\n\n"
}