{
    "case_id": "Crl.MC.No. 55 of 2019",
    "court": "HIGH COURT OF KERALA AT ERNAKULAM\nPRESENT\nTHE HONOURABLE MR",
    "date": "2019",
    "judge": "K.ABRAHAM MATHEW",
    "petitioners": [
        "S:",
        "SHANTHIPURAM COLONY, PALARIVATTOM, ERNAKULAM-",
        "1 SHAJI.V.J",
        "2 RENY FRANCIS,",
        "682025.",
        "ERNAKULAM, PIN-683501.",
        "3 BINOY,",
        "S/O.FRANCIS, VENPILLY HOUSE, MANJUMMAL,",
        "AGED 36 YEARS",
        "MC.No",
        "Sd/-\nK. ABRAHAM MATHEW",
        "$/O.JOSEPH, VEMBILLY HOUSE, H.NO.60,",
        "BaBl",
        "AGED 27 YEARS",
        "AGED 50 YEARS",
        "THATTAM PARAMBIL",
        "S/O.K.O.THOMAS, KOTTAKKAL HOUSE, H.NO.136,"
    ],
    "respondents": [
        "S:",
        "S/O.SAKEER, KOTTATHUPARAMBIL, H.NO.141,",
        "1 SAJEER.K.S",
        "682025.",
        "SANTHIPURAM COLONY, PALARIVATTOM, ERNAKULAM-",
        "AGED 29 YEARS"
    ],
    "sections": [
        "482",
        "323",
        "324"
    ],
    "outcome": "In the result, this Crl.M.C. is allowed",
    "full_text": "Deane)\nsree\n[oR\n2019/KER/238\nIN THE HIGH COURT OF KERALA AT ERNAKULAM\nPRESENT\nTHE HONOURABLE MR. JUSTICE K.ABRAHAM MATHEW\nFRIDAY, THE O4TH DAY OF JANUARY 2019 / 14TH POUSHA, 1940\nCr1.MC.No. 55 of 2019\nCRIME NO. 1905/2012 OF PALARIVATTOM POLICE STATION,\nERNAKULAM\nPETITIONER/S:\n1 SHAJI.V.J\nAGED 50 YEARS\n$/O.JOSEPH, VEMBILLY HOUSE, H.NO.60,\nSHANTHIPURAM COLONY, PALARIVATTOM, ERNAKULAM-\n682025.\n2 RENY FRANCIS,\nAGED 27 YEARS\nS/O.FRANCIS, VENPILLY HOUSE, MANJUMMAL,\nERNAKULAM, PIN-683501.\n3 BINOY,\nAGED 36 YEARS\nS/O.K.O.THOMAS, KOTTAKKAL HOUSE, H.NO.136,\nSHANTHIPURAM COLONY, PALARIVATTOM, ERNAKULAM-\n682025.\nBY ADV. SRI.S.A.ANAND\nRESPONDENT/S:\n1 SAJEER.K.S\nAGED 29 YEARS\nS/O.SAKEER, KOTTATHUPARAMBIL, H.NO.141,\nSANTHIPURAM COLONY, PALARIVATTOM, ERNAKULAM-\n682025.\n\nDeane)\nsree\n[oR\n2019/KER/238\nCr1.MC.No. 55 of 2019\n2...\n2 SUNEER.K.S\nAGED 33 YEARS\nS/O.SAKEER, KOTTATHUPARAMBIL, H.NO.141,\nSANTHIPURAM COLONY, PALARIVATTOM, ERNAKULAM-\n682025.\n3 NISHAD .N\nAGED 26 YEARS\nS/O.NISAR, H.NO.105, SANTHIPURAM COLONY,\nTHAMMANAM P.O., PALARIVATTOM, ERNAKULAM-\n682025.\n4A ANEESH KUMAR K.H.,\nAGED 29 YEARS\nS/O.HAREEDRAN, KAVIL MADAM, THAMMANAM, KOCHI-\n682025.\n5 SHAIJU.B.,\nAGED 30 YEARS\nS/O.BABU K., THATTAM PARAMBIL, SANTHIPURAM\nCOLONY, PALARIVATTOM P.O., ERNAKULAM-682025.\n6 STATE OF KERALA,\nREPRESENTED BY S.I. OF POLICE, PALARIVATTOM\nPOLICE STATION, ERNAKULAM DISTRICT THROUGH\nPUBLIC PROSECUTOR, HIGH COURT OF KERALA ,\nERNAKULAM, PIN-682031.\nBY ADVS.\nP.V. ARUN KUMAR\nSRI.P.V.ARUN KUMAR\nOTHER PRESENT:\nSRI. ALEX M THOMBRA SR PP\nTHIS CRIMINAL MISC. CASE HAVING COME UP FOR ADMISSION ON\n04.01.2019, THE COURT ON THE SAME DAY PASSED THE\nFOLLOWING:\n\n2019/KER/238\nCrl.MC.No. 55 of 2019\n1.3..\nORDER\nPetition filed under Section 482 Cr.P.C.\n\n2. The petitioners are the accused in Crime No.\n1905 of 2012 of Palarivattom Police Station\nregistered for the offences under Sections\n323, 324 & 341 of the Indian Penal Code.\nRespondents 1 to 5 are the victims. It is\nsubmitted that the matter has been settled and\nthe proceedings in the criminal case may be\nquashed.\n\n3. Heard the learned counsel for the petitioners\nand respondents 1 to 5 and the learned Public\nProsecutor.\n\n4. I have perused the affidavits filed by\nrespondents 1 to 5, who have entered\nappearance through counsel. I am _ satisfied\nthat the allegation of settlement is true and\nno public interest is involved. There is no\nimpediment for granting the prayer of the\npetitioners.\n\nBaBl\nsree\nBaar\n2019/KER/238\nCrl.MC.No. 55 of 2019\n14.\nIn the result, this Crl.M.C. is allowed. The\nproceedings in Crime No. 1905 of 2012 of\nPalarivattom Police Station are quashed. The\nlearned magistrate may pass appropriate orders\nfor the disposal of the material objects, if\nany, produced in the case.\nSd/-\nK. ABRAHAM MATHEW\nJUDGE\nAPPENDIX\nPETITIONER'S/S EXHIBITS:\nANNEXURE A CERTIFIED COPY OF THE FIR IN CRIME\nNO.1905/2012 OF PALARIVATTOM POLICE\nSTATION.\nANNEXURE B AFFIDAVIT FILED BY THE 1ST\nRESPONDENT/DE FACTO COMPLAINANT.\nANNEXURE C AFFIDAVIT FILED BY THE 2ND RESPONDENT.\nANNEXURE D AFFIDAVIT FILED BY THE 3RD RESPONDENT.\nANNEXURE E AFFIDAVIT FILED BY THE 4TH RESPONDENT.\nANNEXURE F AFFIDAVIT FILED BY THE 5TH RESPONDENT.\nBka/07.01.2019\n\n"
}