{
    "case_id": "Crl.MC.No.5222 OF 2020(Cc)",
    "court": "HIGH COURT OF KERALA AT HERNAKULAM",
    "date": "WEDNESDAY",
    "judge": "JOSEPH",
    "petitioners": [
        "S/O. ANTONY, MERIN VILLA, MOOTHAKARA, SNEHA NAGAR 32,",
        "PETITIONER/6TH ACCUSED:",
        "KACHERT P.O, KOLLAM DISTRICT.",
        "NITHIN, AGED 35 YEARS,"
    ],
    "respondents": [
        "S/STATE AND COMPLAINANT:",
        "PUBLIC PROSECUTOR SRI.K.B.UDAYAKUMAR",
        "1 STATE OF KERALA",
        "PARAVUR POLICE STATION, PARAVUR P.O,KOLLAM DISTRICT.",
        "2 THE STATION HOUSE OFFICER,",
        "KERALA, ERNAKULAM.",
        "REPRESENTED BY THE PUBLIC PROSECUTOR, HIGH COURT OF"
    ],
    "sections": [
        "482"
    ],
    "outcome": "fori and lux loci, the Crl.M.C. is dismissed",
    "full_text": "Pie eel\nBeet\nIN THE HIGH COURT OF KERALA AT HERNAKULAM 202/KER/788\nPRESENT\nTHE HONOURABLE MR. JUSTICE P.SOMARAJAN\nWEDNESDAY, THE O6TH DAY OF JANUARY 2021 / 16TH POUSHA, 1942\nCr1.MC.No.5222 OF 2020(C)\nAGAINST THE ORDER/JUDGMENT IN CMP 2067/2020 DATED 06-11-2020 OF\nJUDICIAL FIRST CLASS MAGISTRATE COURT, PARAVUR\nCRIME NO.515/2018 OF PARAVOOR POLICE STATION, KOLLAM\nPETITIONER/PETITIONER/6TH ACCUSED:\nNITHIN, AGED 35 YEARS,\nS/O. ANTONY, MERIN VILLA, MOOTHAKARA, SNEHA NAGAR 32,\nKACHERT P.O, KOLLAM DISTRICT.\nBY ADV. SRI.N.SUNIL JOSEPH\nRESPONDENTS/STATE AND COMPLAINANT:\n1 STATE OF KERALA\nREPRESENTED BY THE PUBLIC PROSECUTOR, HIGH COURT OF\nKERALA, ERNAKULAM.\n2 THE STATION HOUSE OFFICER,\nPARAVUR POLICE STATION, PARAVUR P.O,KOLLAM DISTRICT.\nPUBLIC PROSECUTOR SRI.K.B.UDAYAKUMAR\nTHIS CRIMINAL MISC. CASE HAVING BEEN FINALLY HEARD ON\n06.01.2021, THE COURT ON THE SAME DAY PASSED THE FOLLOWING:\n\nORs te\nCr1.MC.No.5222 OF 2020(C) 2 2021/KER/788\nORDER\n\nThe accused No.6 who was enlarged on bail by\nimposing conditions including surrender of the\npassport came up before this court, aggrieved by an\norder by the learned Magistrate refusing to release\nthe passport, so as to enable him to leave the state.\nIt will not come under the purview of Section 482\nCr.P.C.. The remedy lies somewhere else. Instead of\nexhausting the remedy available to the party, the\npetitioner came up with an application under Section\n482 Cr.P.C. Without prejudice to the right of\nparties to exhaust the proper remedy as per the lux\nfori and lux loci, the Crl.M.C. is dismissed. Return\nthe certified copy of Annexure A3 to the concerned\n\ncounsel on proper application forthwith.\n\nSd/-\n\nP. SOMARAJAN\nJUDGE\nmsp\n\n[ORs\nCrl.MC.No.5222 OF 2020(Cc) 3 2021/KERI788\nAPPENDIX\nPETITIONER'S/S EXHIBITS:\nANNEXURE Al TRUE COPY OF THE ORDER DATED 15.07.2020 IN\nB.A. NO. 4053/2020 OF THIS HON'BLE COURT.\nANNEXURE A2 TRUE COPY OF THE C.M.P NO. 2067/2020 ON THE\nFILES OF THE HON'BLE JFCM (TEMPORARY),\nSOUTH PARAVUR, KOLLAM.\nANNEXURE A3 CERTIFIED COPY OF THE ORDER DATED\n06.11.2020 IN C.M.P.NO. 2067/2020 OF THE\nHON'BLE JFCM (TEMPORARY), SOUTH PARAVUR,\nKOLLAM .\n//TRUE COPY//\nP.A. TO JUDGE\n\n"
}