{
    "case_id": "Crl.MC.No. 43 of 2019",
    "court": "HIGH COURT OF KERALA AT EBRNAKULAM\nPRESENT\nTHE HONOURABLE MR",
    "date": "2019",
    "judge": "K.ABRAHAM MATHEW",
    "petitioners": [
        "S:",
        "$/O ABDHUL KAREEM, KUNNATH HOUSE, PULLUTHU",
        "1 SHAJAHAN, AGED 42 YEARS",
        "MENON",
        "PULLUTHU\nVILLAGE",
        "s/o KHADER, MANNARAPARAMBIL HOUSE, AZHIKOD",
        "MC.No",
        "5 SANEER, AGED 35 YEARS, s/o SAIDUMUHAMMED,",
        "KOTHAPARAMB, S.N.PURAM VILLAGE, THRISSUR.",
        "VILLAGE, KOZHIKADA DHESOM, THRISSUR.",
        "S.N.PURAM VILLAGE, THRISSUR.",
        "MULAKKAMPARAMBIL HOUSE",
        "4 KUNJIMUHAMMED, AGED 48 YEARS",
        "s/o KHALIDH, MULAKKAMPARAMBIL HOUSE,",
        "AZHIKOD VILLAGE, THRISSUR.",
        "K.ABRAHAM MATHEW",
        "s/o ABOOBACKER, ALLANOOR HOUSE, KAPPAL BAZAR,",
        "VAYANATTUPADI HOUSE, PATHIYACHERI DHESOM,",
        "VILLAGE, MATHILAKAM, THRISSUR.",
        "3 NAZEEMUDHEEN, AGED 38 YEARS",
        "2 SHAMEER, AGED 43 YEARS"
    ],
    "respondents": [
        "S:",
        "COURT OF KERALA, ERNAKULAM 68031.",
        "1 STATE OF KERALA",
        "REPRESENTED BY THE PUBLIC PROSECUTOR, HIGH"
    ],
    "sections": [
        "482",
        "147",
        "143",
        "149"
    ],
    "outcome": "In the result, this Crl.M.C. is allowed",
    "full_text": "Ber\n| ee\n2019/KER/199\nIN THE HIGH COURT OF KERALA AT EBRNAKULAM\nPRESENT\nTHE HONOURABLE MR. JUSTICE K.ABRAHAM MATHEW\nFRIDAY, THE O4TH DAY OF JANUARY 2019 / 14TH POUSHA, 1940\nCrl1.MC.No. 43 of 2019\nsc 784/2012 OF ADDL. SESSIONS COURT-IV, THRISSUR\nCRIME NO. 5911/2012 OF MATHILAKOM POLICE STATION, THRISSUR\nPETITIONER/S:\n1 SHAJAHAN, AGED 42 YEARS\n$/O ABDHUL KAREEM, KUNNATH HOUSE, PULLUTHU\nVILLAGE, KOZHIKADA DHESOM, THRISSUR.\n2 SHAMEER, AGED 43 YEARS\ns/o KHALIDH, MULAKKAMPARAMBIL HOUSE,\nKOTHAPARAMB, S.N.PURAM VILLAGE, THRISSUR.\n3 NAZEEMUDHEEN, AGED 38 YEARS\ns/o KHADER, MANNARAPARAMBIL HOUSE, AZHIKOD\nVILLAGE, MATHILAKAM, THRISSUR.\n4 KUNJIMUHAMMED, AGED 48 YEARS\ns/o ABOOBACKER, ALLANOOR HOUSE, KAPPAL BAZAR,\nAZHIKOD VILLAGE, THRISSUR.\n5 SANEER, AGED 35 YEARS, s/o SAIDUMUHAMMED,\nVAYANATTUPADI HOUSE, PATHIYACHERI DHESOM,\nS.N.PURAM VILLAGE, THRISSUR.\nBY ADV. SRI.E.A.HARIS\nRESPONDENT/S:\n1 STATE OF KERALA\nREPRESENTED BY THE PUBLIC PROSECUTOR, HIGH\nCOURT OF KERALA, ERNAKULAM 68031.\n\nPie\nBie\n2019/KER/199\nCri.MC.No. 43 of 2019\n..2..\n2 SHAFEER\nS/O ABU, AGED 36 YEARS, MANNOTHUMPARAMBIL\nVEETTIL, KOTHAPARAMB KARA, LOKAMALLESWARAM\nVILLAGE, MATHILAKAM, THRISSUR.-680685.\nBY ADV. T.P.ARUN MENON\nOTHER PRESENT:\nSRI ALEX M THOMBRA SR PP\nTHIS CRIMINAL MISC. CASE HAVING COME UP FOR ADMISSION ON\n04.01.2019, THE COURT ON THE SAME DAY PASSED THE\nFOLLOWING:\nORDER\nPetition filed under Section 482 Cr.P.C.\n2. The petitioners are the accused in SC No. 784\nof 2012 on the file of the Additional Sessions\nCourt-IV, Thrissur registered for the offences\nunder Sections 143, 147 & 364 r/w Section 149\nof the Indian Penal Code. The second\nrespondent is the victim. It is submitted that\nthe matter has been settled and the\nproceedings in the criminal case may be\nquashed.\n\n2019/KER/199\nCrl.MC.No. 43 of 2019\n1.3..\n\n3. Heard the learned counsel for the petitioners\nand the second respondent and the learned\nPublic Prosecutor.\n\n4. I have perused the affidavit filed by the\nsecond respondent, who has entered appearance\nthrough counsel. I am satisfied that the\nallegation of settlement is true and no public\ninterest is involved. There is no impediment\nfor granting the prayer of the petitioners.\n\nIn the result, this Crl.M.C. is allowed. The\nproceedings in SC No. 784 of 2012 on the file\nof the Additional Sessions Court-IV, Thrissur\nare quashed. The trial court may pass\nappropriate orders for the disposal of the\nmaterial objects, if any, produced in the\ncase.\n\nSd/-\n\nK.ABRAHAM MATHEW\nJUDGE\nBka/07.01.2019\n\nBel\nBL\n2019/KER/199\nCri.MC.No. 43 of 2019\non\nAPPENDIX\nPETITIONER'S/S EXHIBITS:\nANNEXURE Al CERTIFIED COPY OF THE FINAL REPORT IN\nS.C.NO.784/2012 OF ADDITIONAL DISTRICT\nAND SESSIONS COURT-IV, THRISSUR.\nANNEXURE A2 AFFIDAVIT OF THE DEFACTO\nCOMPLAINANT/2ND RESPONDENT.\n\n"
}