{
    "case_id": "",
    "court": "HIGH COURT OF KERALA AT ERNAKULAM\nPRESENT",
    "date": "MONDAY",
    "judge": "B. KEMAL PASHA",
    "petitioners": [
        "KASARAGOD.",
        "S/O.ABDULLA HAul, N.A.HOUSE,",
        "2. MUHAMMED FAIZAL M.M, AGED 33 YEARS,",
        "B.KEMAL PASHA",
        "KUMBALA POST, KASARAGOD.",
        "NAIMARMOOLA, MUTTATHODY VILLAGE,",
        "KUNNIL HOUSE",
        "S/O.ABOOBACKER, M.M MANZIL, PERVAD,",
        "M.M MANZIL",
        "KER/61\nCri",
        "affidavit",
        "PaLsgeaahl",
        "1. N.A.MOIDEEN, AGED 55 YEARS,",
        "ACCUSED:",
        "KER/61\nCRL.M.C.No",
        "KER/61\nB. KEMAL PASHA",
        "J.\nORDER\nPetitioners",
        "Annexure-A3",
        "PaLsgeiesrl",
        "Lea"
    ],
    "respondents": [
        "HIGH COURT OF KERALA, ERNAKULAM.",
        "STATE & DEFACTO COMPLAINANT:",
        "BEVINJE POST, THEKKIL FERRY, CHENGALA VILLAGE,",
        "R1 BY PUBLIC PROSECUTOR SMT.SAREENA GEORGE",
        "KASARAGOD - 671541.",
        "1. STATE OF KERALA,",
        "R2_ BY ADV. SMT.K.S.SANTHI",
        "2. AHAMMED ASLAM, S/O.B.K.ABDUL KHADER,",
        "AGED 30 YEARS, KUNNIL HOUSE, ALAMPADY,",
        "REPRESENTED BY PUBLIC PROSECUTOR,"
    ],
    "sections": [
        "423",
        "420",
        "419",
        "468 of the Indian Penal\nCode read with Section 34 IPC",
        "465"
    ],
    "outcome": "2009 of the Kasaragod Police Station, can be quashed",
    "full_text": "Lea\nine a\nBian\n2016/KER/61\nIN THE HIGH COURT OF KERALA AT ERNAKULAM\nPRESENT:\nTHE HONOURABLE MR. JUSTICE B.KEMAL PASHA\nMONDAY, THE 4TH DAY OF JANUARY 2016/14TH POUSHA, 1937\nCri.MC.No. 7842 of 2015\nCC 81/2010 OF CHIEF JUDICIAL MAGISTRATE COURT, KASARAGOD.\nCRIME NO. 192/2009 OF KASARAGOD POLICE STATION, KASARAGOD.\nPETITIONER(S)/ACCUSED:\n1. N.A.MOIDEEN, AGED 55 YEARS,\nS/O.ABDULLA HAul, N.A.HOUSE,\nNAIMARMOOLA, MUTTATHODY VILLAGE,\nKASARAGOD.\n2. MUHAMMED FAIZAL M.M, AGED 33 YEARS,\nS/O.ABOOBACKER, M.M MANZIL, PERVAD,\nKUMBALA POST, KASARAGOD.\nBY ADV. SRLS.JlJI\nRESPONDENT(S)/STATE & DEFACTO COMPLAINANT:\n1. STATE OF KERALA,\nREPRESENTED BY PUBLIC PROSECUTOR,\nHIGH COURT OF KERALA, ERNAKULAM.\n2. AHAMMED ASLAM, S/O.B.K.ABDUL KHADER,\nAGED 30 YEARS, KUNNIL HOUSE, ALAMPADY,\nBEVINJE POST, THEKKIL FERRY, CHENGALA VILLAGE,\nKASARAGOD - 671541.\nR1 BY PUBLIC PROSECUTOR SMT.SAREENA GEORGE\nR2_ BY ADV. SMT.K.S.SANTHI\nTHIS CRIMINAL MISC. CASE HAVING COME UP FOR ADMISSION\nON 04-01-2016, THE COURT ON THE SAME DAY PASSED THE\nFOLLOWING:\nmbr\n\nPaLsgeaahl\ngabon aes\n2016/KER/61\nCri.MC.No. 7842 of 2015\nAPPENDIX\nPETITIONER(S)' ANNEXURES:\nANNEXURE At: TRUE COPY OF THE FIR IN CR.NO.192/2009 OF KASARAGOD\nPOLICE STATION.\nANNEXURE A2: CERTIFIED COPY OF THE FINAL REPORT IN CR.NO.192/2009 OF\nKASARAGOD POLICE STATION.\nANNEXURE A3: AFFIDAVIT DATED 12.06.2015 SWORN BY THE\n2ND RESPONDENT.\nRESPONDENT(S)’ ANNEXURES: NIL\nITRUE COPY//\nP.S. TO JUDGE\nmbr/\n\naL pete hal\n2016/KER/61\nB. KEMAL PASHA, J.\nORDER\nPetitioners are accused in C.C. No.81 of 2010 of the\nChief Judicial Magistrate's Court, Kasaragod, which has\narisen from Crime No.192 of 2009 of the Kasaragod Police\nStation, registered for the offences punishable under\nSections 419, 420, 423, 465 and 468 of the Indian Penal\nCode read with Section 34 IPC.\n2. The matter has been amicably settled between\nthe petitioners and the defacto complainant, who is the 2™\nrespondent herein. The defacto complainant has filed\nAnnexure-A3. affidavit affirming that the matter has been\namicably settled between him and the petitioners and he\nhas no complaints against the petitioners.\n3. No criminal antecedents have been reported\nagainst the petitioners. When the matter has been amicably\n\nPaLsgeiesrl\nieee\n2016/KER/61\nCRL.M.C.No. 7842 of 2015\n“2:\nsetiled, no purpose would be served in proceeding with the\nmatter further, and therefore, all further proceedings in C.C.\nNo.81 of 2010 pending before the Chief Judicial\nMagistrate's Court, Kasaragod, as against the petitioners,\nbased on Annexure-A2 Final Report in Crime No.192 of\n2009 of the Kasaragod Police Station, can be quashed.\n\nIn the result, this Crl.M.C. is allowed and all further\nproceedings in C.C. No.81 of 2010 pending before the Chief\nJudicial Magistrate's Court, Kasaragod, as against the\npetitioners, based on Annexure-A2 Final Report in Crime\nNo.192 of 2009 of the Kasaragod Police Station, are hereby\nquashed.\n\nSd/- B. KEMAL PASHA,\nJUDGE.\nDSV/4/1/16\n[True copy] PS. to Judge\n\n"
}