{
    "case_id": "Crl.MC.No. 4767 of 2016 ()",
    "court": "HIGH COURT OF KERALA AT ERNAKULAM\nPRESENT",
    "date": "THE 4TH DAY OF",
    "judge": "MC.No",
    "petitioners": [
        "J.\nCri",
        "(S) :"
    ],
    "respondents": [
        "(S) :"
    ],
    "sections": [],
    "outcome": "recorded and Crl.M.Cs are dismissed",
    "full_text": "Bests Tal\nao\n2016/KER/34130\nIN THE HIGH COURT OF KERALA AT ERNAKULAM\nPRESENT:\nTHE HONOURABLE MR. JUSTICE SUNIL THOMAS\nTHURSDAY, THE 4TH DAY OF AUGUST 2016/13TH SRAVANA, 1938\nCr1.MC.No. 4767 of 2016 ()\nAGAINST THE ORDER/JUDGMENT IN CC 4372/2014 of JUDICIAL FIRST\nCLASS MAGISTRATE COURT, KODUNGALLUR\nCRIME NO. 2545/2014 OF KODUNGALLUR POLICE STATION , TRISSUR\n\nPETITIONER (S) :\n\nP.V.GIRI\n\nADVOCATE, AGED 48 YEARS, S/O. P.C.VELAPPAN,\n\nPATTALI HOUSE, VALAPPAD P.O., CHAVAKKAD TALUK,\n\nTHRISSUR DISTRICT.\n\nBY ADV. SRI.RAJIT\nRESPONDENT (S) :\n\n1. STATE OF KERALA\nREPRESENTED BY THE PUBLIC PROSECUTOR,\nHIGH COURT OF KERALA, ERNAKULAM-682 031.\n2. SNEHA PRABHA\n\nAGED 43 YEARS, D/O. PRAHLADHAN NAIR,\n\nVRINDHAVANAM, KODUNGALLUR P.O.,\n\nTHRISSUR DISTRICT-680 664.\n\nBY PUBLIC PROSECUTOR: SMT M T SHEEBA\n\nTHIS CRIMINAL MISC. CASE HAVING BEEN FINALLY HEARD ON\n\n04-08-2016 ALONG WITH CRL.M.C.5674/2015, THE COURT ON THE SAME\nDAY PASSED THE FOLLOWING:\n\nPiel\nao\nieee\n2016/KER/34130\nCrl.MC.No. 4767 of 2016 ()\nAPPENDIX\nPETITIONER (S)' EXHIBITS\nANNEXURE A CERTIFIED COPY OF THE PROCEEDINGS OF THE COURT\nBELOW DATED 16.1.2015 TO 7.5.2016.\nRESPONDENT (S)' EXHIBITS:NIL\nTrue Copy /\nPA to Judge\n\nieee\n2016/KER/34130\nSUNIL THOMAS, J.\nCri.M.C.Nos.5674 of 2015 and 4767 of 2016\nDated this the 4‚Äù day of August, 2016\nCOMMON ORDER\n\nWhen the matters were taken up, learned counsel for\nthe second respondent submitted that the disputes between the\nparties have been finally resolved amicably.\n\nIn the light of above, learned counsel for the petitioner\nsubmitted that he does not propose to pursue the Crl.M.Cs. This is\nrecorded and Crl.M.Cs are dismissed as not pressed.\n\nSd/-\nSUNIL THOMAS\nJudge\nSbna/4/8/16\nTrue Copy /\nP A to Judge\n\n"
}