{
    "case_id": "Crl.MC.No. 8504 of 2017",
    "court": "HIGH COURT OF KERALA AT ERNAKULAM",
    "date": "2018",
    "judge": "BiSean",
    "petitioners": [
        "MC.No",
        "PALLITHAZHATHU HOUSE",
        "THOTTARA,KARIMPUZHA,PALAKKAD DISTRICT.",
        "1 ARJUN DAS,",
        "2 HASHEER,",
        "AGED 21 YEARS,S/O MOHAMMADALI,MOTHIRAPEEDIKA HOUSE,",
        "PULLANTHODI HOUSE",
        "AGED 21 YEARS,S/O.SIVADASAN,PULLANTHODI HOUSE,",
        "ACCUSED NOS.1 & 2",
        "J.\nCrl"
    ],
    "respondents": [
        "HIGH COURT OF KERALA,ERNAKULAM-682031.",
        "3. ASMA BEEVI,",
        "R2-3 BY ADV. SRILVIVEK VENUGOPAL",
        "KARIMPUZHA.P.O,PALAKKAD DISTRICT-679513.",
        "STATE/DEFACTO COMPLAINANT & CWi, MOTHER OF THE VICTIM:",
        "AGED 37 YEARS,S/O SEETHI KOYA,PALLITHAZHATHU HOUSE,",
        "1. STATE OF KERALA,",
        "AGED 43 YEARS,S/O.CHERU KOYA THANGAL,PALLITHAZHATHU",
        "THOTTARA,KARIMPUZHA.P.O,PALAKKAD DISTRICT-679513.",
        "HOUSE,",
        "R BY PUBLIC PROSECUTOR:SRI C N PRABHAKARAN",
        "2. ABDULLA KOYA THANGAL,",
        "REPRESENTED BY PUBLIC PROSECUTOR,"
    ],
    "sections": [
        "119(1)(A)"
    ],
    "outcome": "Accordingly, Crl.M.C is allowed",
    "full_text": "Beha\nice oa ee\nBiSean re)\nIN THE HIGH COURT OF KERALA AT ERNAKULAM 2018/KERISO4\nPRESENT:\nTHE HONOURABLE MR. JUSTICE SUNIL THOMAS\nFRIDAY, THE 5TH DAY OF JANUARY 2018 / 15TH POUSHA, 1939\nCrl.MC.No. 8504 of 2017\nAGAINST THE ORDER/JUDGMENT IN CC 1668/2016 of J.M.E.C.- I, OTTAPPALAM\nCRIME NO. 722/2016 OF SREEKRISHNAPURAM POLICE STATION , PALAKKAD\nPETITIONER(S)/ACCUSED NOS.1 & 2\n1 ARJUN DAS,\nAGED 21 YEARS,S/O.SIVADASAN,PULLANTHODI HOUSE,\nTHOTTARA,KARIMPUZHA,PALAKKAD DISTRICT.\n2 HASHEER,\nAGED 21 YEARS,S/O MOHAMMADALI,MOTHIRAPEEDIKA HOUSE,\nTHOTTARA,KARIMPUZHA,PALAKKAD DISTRICT.\nBY ADV.SRLNIREESH MATHEW\nRESPONDENT(S)/STATE/DEFACTO COMPLAINANT & CWi, MOTHER OF THE VICTIM:\n1. STATE OF KERALA,\nREPRESENTED BY PUBLIC PROSECUTOR,\nHIGH COURT OF KERALA,ERNAKULAM-682031.\n2. ABDULLA KOYA THANGAL,\nAGED 43 YEARS,S/O.CHERU KOYA THANGAL,PALLITHAZHATHU\nHOUSE,\nTHOTTARA,KARIMPUZHA.P.O,PALAKKAD DISTRICT-679513.\n3. ASMA BEEVI,\nAGED 37 YEARS,S/O SEETHI KOYA,PALLITHAZHATHU HOUSE,\nKARIMPUZHA.P.O,PALAKKAD DISTRICT-679513.\nR2-3 BY ADV. SRILVIVEK VENUGOPAL\nR BY PUBLIC PROSECUTOR:SRI C N PRABHAKARAN\nTHIS CRIMINAL MISC. CASE HAVING COME UP FOR ADMISSION ON 05-01-2018, THE\nCOURT ON THE SAME DAY PASSED THE FOLLOWING:\n\npar ae\nCrl1.MC.No. 8504 of 2017 0 2018/KER/S04\nAPPENDIX\n\nPETITIONER(S)' EXHIBITS\nANNEXURE A PHOTOCOPY OF THE FINAL REPORT IN CRIME NO.722/2016 OF\nSREEKRISHNAPURAM POLICE STATION\nANNEXUREB THE ORIGINAL OF THE AFFIDAVIT SWORN TO BY THE RESPONDENT\nNO.2 BEFORE HIS ADVOCATE AT OTTAPALAM,DATED 5.12.2017\nANNEXURE C THE ORIGINAL OF THE AFFIDAVIT SWORN TO BY THE RESPONDENT\nNO.2 BEFORE HER ADVOCATE AT OTTAPALAM,DATED 5.12.2017.\nRESPONDENTS EXHIBITS:NIL\n\nTrue Copy /P A to Judge\n\nPal\nSUNIL THOMAS, J.\nCrl.M.C.No.8504 of 2017\nDated this the 5\" day of January, 2018\nORDER\n\nPetitioners stand arrayed as accused in C.C.No.1668 of\n2016 of Judicial First Class Magistrate Court-I, Ottappalam arising\nfrom Crime No.722 of 2016 of Sreekrishnapuram Police Station for\noffences punishable under sections 119(1)(A) of the Kerala Police\nAct.\n\n2.  Itis alleged by the prosecution that, on 03.11.2016 at 5\np.m., accused chased the defacto complainant and abused her.\nAccordingly, crime was registered and after investigation, final\nreport was filed. Crl.M.C is laid on a premise that the dispute\nbetween the parties have been completely settled to the satisfaction\nof the victim and the defacto complainant, who are arrayed as\nrespondents 2 and 3. Learned counsel for respondents 2 and 3\nrelied on Annexures-B and C affidavits filed by them and submitted\nthat the matter has been settled. It was acknowledged that affidavit\nhas been filed in due settlement of the dispute between the parties.\nLearned Public Prosecutor submitted that the settlement between\nthe parties have been reported to the police and the petitioners\nhave no criminal antecedents.\n\nDae\n2018/KER/504\nCri.M.C.8504/17\n2\n3. Having considered the entire nature of allegations, I feel\nthat, no purpose will be served by prosecuting the petitioners\nherein in the light of the settlement between the parties.\nAccordingly, Crl.M.C is allowed.\nIn the result, Crl.M.C is allowed. All further proceedings\nin C.C.No.1668 of 2016 of Judicial First Class Magistrate Court-I,\nOttappalam arising from Crime No.722 of 2016. of\nSreekrishnapuram Police Station will stand quashed.\nSd/-\nSUNIL THOMAS\nJudge\nSbna/5/1/18\nTrue Copy / P A to Judge\n\n"
}