{
    "case_id": "Crl.MC.No. 174 of 2019",
    "court": "HIGH COURT OF KERALA AT ERNAKULAM\nPRESENT\nTHE HONOURABLE MR",
    "date": "2019",
    "judge": "K.ABRAHAM MATHEW",
    "petitioners": [
        "S:",
        "MC.No",
        "S/O.M NOOHU KANNU, VARIKOLIL VADAKKATHIL,",
        "ABDUL RASHEED .N",
        "AGED 54 YEARS",
        "Sd/-\nK.ABRAHAM MATHEW",
        "OBJECTION",
        "VENGARA, THODIYOOR NORTH.P.O., KARUNAGAPPALLY,",
        "KOLLAM DISTRICT, KERALA."
    ],
    "respondents": [
        "S:",
        "(REPRESENTED BY STANDING COUNSEL) S.P-CBI-SCB",
        "THIRUVANANTHAPURAM-695001. (CRIME NO.RC",
        "1(S) /2012/CBI/SCB/CHENNAL.",
        "CENTRAL BUREAU OF INVESTIGATION,"
    ],
    "sections": [
        "482",
        "227"
    ],
    "outcome": "4. In the result, this Crl.M.C. is disposed",
    "full_text": "a oo\naes\n2019/KER/1010\nIN THE HIGH COURT OF KERALA AT ERNAKULAM\nPRESENT\nTHE HONOURABLE MR. JUSTICE K.ABRAHAM MATHEW\nWEDNESDAY, THE 09TH DAY OF JANUARY 2019 / 19TH POUSHA,\n1940\nCr1.MC.No. 174 of 2019\nSC 1357/2013 OF SPECIAL COURT FOR TRIAL OF CBI CASES,\nTHIRUVANANTHAPURAM\n\nPETITIONER/S:\nABDUL RASHEED .N\nAGED 54 YEARS\nS/O.M NOOHU KANNU, VARIKOLIL VADAKKATHIL,\nVENGARA, THODIYOOR NORTH.P.O., KARUNAGAPPALLY,\nKOLLAM DISTRICT, KERALA.\nBY ADVS.\nSRI.S.RAJEEV\nSRI .D.FEROZE\nSRI .K.K.DHEERENDRAKRISHNAN\nSRI .V.VINAY\n\nRESPONDENT/S:\nCENTRAL BUREAU OF INVESTIGATION,\n(REPRESENTED BY STANDING COUNSEL) S.P-CBI-SCB\nTHIRUVANANTHAPURAM-695001. (CRIME NO.RC\n1(S) /2012/CBI/SCB/CHENNAL.\n\nOTHER PRESENT:\nSRI C S HRITHWIK-SR PP\n\n2019/KER/1010\nCrl.MC.No. 174 of 2019\n1i2..\n\nTHIS CRIMINAL MISC. CASE HAVING COME UP FOR ADMISSION ON\n\n09.01.2019, THE COURT ON THE SAME DAY PASSED THE\n\nFOLLOWING:\n\nORDER\nPetition filed under Section 482 Cr.P.C.\n\n2. The petitioner is one of the accused in SC No.\n1357 of 2013 on the file of the Special Court\nfor the Trial of CBI Cases,\nThiruvananthapuram. He has filed Annexure-IV\napplication under Section 227 Cr.P.C. for his\ndischarge. The only request in this Crl.M.C.\nis to direct the trial court to dispose it of\nexpeditiously.\n\n3. After hearing both sides, I am satisfied that\nthe request is reasonable.\n\n4. In the result, this Crl.M.C. is disposed of\ndirecting the trial court to dispose of\nAnnexure-IV application as expeditiously as\npossible. The learned Sessions Judge shall\nonly look into the materials relied on by the\n\nci Roe\nBe\n2019/KER/1010\nCrl.MC.No. 174 of 2019\n1.3..\ninvestigating officer in support of the final\nreport.\nSd/-\nK.ABRAHAM MATHEW\nJUDGE\nAPPENDIX\n\nPETITIONER'S/S EXHIBITS:\nANNEXURE I TRUE COPY OF THE PETITION SUBMITTED BY\n\nCBI WHICH IS TAKEN ON THE FILE AS\n\nCRL.M.C.NO.1554/2016.\nANNEXURE II TRUE COPY OF THE ORDER DATED 27.6.2017\n\nIN CRL.M.C.1554/2016 PASSED BY THIS\n\nHON'BLE COURT.\nANNEXURE III TRUE COPY OF THE OBJECTION FILED BY\n\nCBI BEFORE THE COURT OF SESSIONS,\n\nERNAKULAM, IN CRL.MC.NO.279/2015.\nANNEXURE IV TRUE COPY OF THE PETITION SUBMITTED BY\n\nTHE PETITIONER BEFORE THE SPECIAL\n\nCOURT CBI THIRUVANANTHAPURAM.\nBKA/10.01.2019\n\n"
}