{
    "case_id": "Crl.MC.No.147 OF 2020 (G)",
    "court": "HIGH COURT OF KERALA AT ERNAKULAM\nPRESENT\nTHE HONOURABLE MR",
    "date": "2020",
    "judge": "P.B.SURESH KUMAR",
    "petitioners": [
        "ACCUSED :",
        "Annexure B.\n\n4",
        "SHIHABUDHEEN P, AGED 37 YEARS",
        "Malappuram",
        "S/O HAMZA, POOVIL HOUSE, KOLATHUR ,",
        "M.C.No.147",
        "JANET",
        "P.B.SURESH KUMAR",
        "KOLATHUR P.O.MALAPPURAM-679 338."
    ],
    "respondents": [
        "2 STATION HOUSE OFFICER",
        "3 RISWANAN K.M., AGED 23 YEARS",
        "MALAPPURAM DIST 679 338",
        "KOLATHUR POLICE STATION,",
        "R3 BY ADV. JANET JOB",
        "1 STATE OF KERALA",
        "S/STATE & DEFACTO COMPLAINANT:",
        "W/O ABDUL RAHIM, POOVIL HOUSE,",
        "REP. BY PUBLIC PROSECUTOR,",
        "KOLATHUR KOLATHUR P.O.MALAPPURAM-679 338.",
        "HIGH COURT OF KERALA, ERNAKULAM-682 031."
    ],
    "sections": [
        "482",
        "323",
        "354"
    ],
    "outcome": "In the result, the Crl.M.C. is allowed",
    "full_text": "pt eta Cl\nS as\ns : eo\nElna\n2020/KER/1197\nIN THE HIGH COURT OF KERALA AT ERNAKULAM\nPRESENT\nTHE HONOURABLE MR. JUSTICE P.B.SURESH KUMAR\nFRIDAY, THE 10TH DAY OF JANUARY 2020 / 20TH POUSHA, 1941\nCrl.MC.No.147 OF 2020 (G)\nCRIME NO.259/2019 OF Kolathur Police Station , Malappuram\nPETITIONER/ACCUSED :\nSHIHABUDHEEN P, AGED 37 YEARS\nS/O HAMZA, POOVIL HOUSE, KOLATHUR ,\nKOLATHUR P.O.MALAPPURAM-679 338.\nBY ADV. SRI.MANSOOR.B.H.\nRESPONDENTS/STATE & DEFACTO COMPLAINANT:\n1 STATE OF KERALA\nREP. BY PUBLIC PROSECUTOR,\nHIGH COURT OF KERALA, ERNAKULAM-682 031.\n2 STATION HOUSE OFFICER\nKOLATHUR POLICE STATION,\nMALAPPURAM DIST 679 338\n3 RISWANAN K.M., AGED 23 YEARS\nW/O ABDUL RAHIM, POOVIL HOUSE,\nKOLATHUR KOLATHUR P.O.MALAPPURAM-679 338.\nR3 BY ADV. JANET JOB\nBY SRI. AMJED ALI\nTHIS CRIMINAL MISC. CASE HAVING COME UP FOR ADMISSION\nON 10.01.2020, THE COURT ON THE SAME DAY PASSED THE\nFOLLOWING:\n\n2020/KER/1197\nCrl.M.C. No.147 of 2020 2\nCril.M.C.No.147 of 2020\nORDER\n\nThis is a proceedings under Section 482 of the Code\nof Criminal Procedure for quashing Annexure - A First\nInformation Report and all further proceedings pursuant thereto\nin Crime No.259 of 2019 of Kolathur Police Station.\n\n2. The petitioner is the sole accused in the said\ncase. The case was one registered under Sections 323 and 354\nof the Indian Penal Code.\n\n3. It is stated that the petitioner and the de facto\ncomplainant have amicably settled the disputes and an\naffidavit sworn to by the de facto complainant to that effect has\nbeen produced as Annexure B.\n\n4. Heard the learned counsel for the petitioner,\nthe learned Public Prosecutor as also the learned counsel for\nthe de facto complainant.\n\n5. In the light of the decision of the Apex Court in\nGian singh v. State of Punjab, (2012) 10 SCC 303, insofar as\n\n2020/KER/1197\n\nCrl.M.C. No.147 of 2020 3\nthe offences alleged against the petitioner in the case are only\noffences punishable under Sections 323 and 354 of the Indian\nPenal Code, | am of the view that this is an appropriate case\nwhere this court has to invoke the jurisdiction under Section\n482 of the Code of Criminal Procedure to quash the\nproceedings against the petitioner.\n\nIn the result, the Crl.M.C. is allowed and Annexure -\nA First Information Report and all further proceedings pursuant\nthereto in Crime No.259 of 2019 of Kolathur Police Station are\nquashed.\n\nSd/-\nP.B.SURESH KUMAR, JUDGE.\n\nds\n\nips eee Cl\nx, pes\na eo\nPlies\n2020/KER/1197\nCril.M.C. No.147 of 2020 4\nAPPENDIX\nPETITIONER'S/S EXHIBITS:\nANNEXURE A COPY OF THE F.I.R.AND F.I.S IN CRIME\nNO 259/2019 OF KOLATHUR POLICE\nSTATION.\nANNEXURE B AFFIDAVIT OF THIRD RESPONDENT\n\n"
}