{
    "case_id": "Crl.MC.No. 177 of 2019",
    "court": "HIGH COURT OF KERALA AT ERNAKULAM Beir",
    "date": "2019",
    "judge": "B. SUDHEENDRA KUMAR",
    "petitioners": [
        "S:",
        "MC.No",
        "2 MRS.CINNY REJI, AGED 30 YEARS,",
        "RANNI",
        "W/O.REGI GEORGE, CHAKKALAYIL 340,",
        "CHITTAR.P.O., RANNI (NOW WORKING AT",
        "AGED 36 YEARS, S/O.GEORGE, CHAKKALAYIL 340,",
        "CHITTAR.P.O., RANNI, PATHANAMTHITTA DISTRICT.",
        "1 REGI GEORGE,",
        "B.SUDHEENDRA KUMAR",
        "MUNSIFFS COURT RANNI, PATHANAMTHITTA DISTRICT."
    ],
    "respondents": [
        "S:",
        "CHITTAR POLICE STATION, PATHANAMTHITTA",
        "THROUGH THE SUB INSPECTOR OF POLICE,",
        "MANAGING PARTNER MR.K H MUHAMMED YUSUF,",
        "DISTRICT, REPRESENTED BY PUBLIC PROSECUTOR,",
        "PUZHAVATHUMURI, CHANGANASSERY, KOTTAYAM",
        "DISTRICT-686101.",
        "2 M/S.CAPITAL STEELS,",
        "OTHER PRESENT:",
        "S/O.HUSSAIN RAWATHER, AGED 47 YEARS,",
        "HIGH COURT OF KERALA-682 031.",
        "T B ROAD, CHANGANASSERY, REPRESENTED BY ITS",
        "1 THE STATE OF KERALA",
        "SMT V SREEJA-PUBLIC PROSECUTOR"
    ],
    "sections": [],
    "outcome": "The petitioners shall be granted",
    "full_text": "CaRereeed od\nK ae\nIN THE HIGH COURT OF KERALA AT ERNAKULAM Beir\n2019/KER/1050\nPRESENT\nTHE HONOURABLE MR. JUSTICE B.SUDHEENDRA KUMAR\nWEDNESDAY ,THE O9TH DAY OF JANUARY 2019 / 19TH POUSHA, 1940\nCrl.MC.No. 177 of 2019\nAGAINST THE ORDER/JUDGMENT IN ST 45/2018 of J.M.F.C - II,\nCHENGANACHERRY\nCRIME NO. 379/2018 OF CHITTAR POLICE STATION,\nPATHANAMTHITTA\nPETITIONER/S:\n1 REGI GEORGE,\nAGED 36 YEARS, S/O.GEORGE, CHAKKALAYIL 340,\nCHITTAR.P.O., RANNI (NOW WORKING AT\nMUNSIFFS COURT RANNI, PATHANAMTHITTA DISTRICT.\n2 MRS.CINNY REJI, AGED 30 YEARS,\nW/O.REGI GEORGE, CHAKKALAYIL 340,\nCHITTAR.P.O., RANNI, PATHANAMTHITTA DISTRICT.\nBY ADVS.\nSRI.MANU RAMACHANDRAN\nSRI .M.KIRANLAL\nSRI.R.RAJESH (VARKALA)\nSRI.T.S.SARATH\nRESPONDENT/S:\n1 THE STATE OF KERALA\nTHROUGH THE SUB INSPECTOR OF POLICE,\nCHITTAR POLICE STATION, PATHANAMTHITTA\nDISTRICT, REPRESENTED BY PUBLIC PROSECUTOR,\nHIGH COURT OF KERALA-682 031.\n2 M/S.CAPITAL STEELS,\nT B ROAD, CHANGANASSERY, REPRESENTED BY ITS\nMANAGING PARTNER MR.K H MUHAMMED YUSUF,\nS/O.HUSSAIN RAWATHER, AGED 47 YEARS,\nPUZHAVATHUMURI, CHANGANASSERY, KOTTAYAM\nDISTRICT-686101.\nOTHER PRESENT:\nSMT V SREEJA-PUBLIC PROSECUTOR\nTHIS CRIMINAL MISC. CASE HAVING COME UP FOR ADMISSION\nON 09.01.2019, THE COURT ON THE SAME DAY PASSED THE\nFOLLOWING:\n\nDreeO)\na\n[eiseeseee\n2019/KER/1050\nCri.MC.No. 177 of 2019\n-2-\nORDER\n\nDismissed as not pressed.\n\nHowever, the petitioners shall be at\nliberty to raise all their contentions\nbefore the court below at the appropriate\nstage.\n\nThe petitioners shall be granted\nexemption from personal appearance before\nthe court below on all posting dates except\nwhen their presence is necessary for the\nprogress of the case, if the petitioners\nsurrender before the court below within 30\ndays from today and file application in this\nregard.\n\nSd/-\nB. SUDHEENDRA KUMAR,\nJUDGE\nSTK\n/[TRUE COPY//\n//P.A. TO JUDGE//\n\n"
}