{
    "case_id": "Crl.MC.No. 16 of 2019",
    "court": "HIGH COURT OF KERALA AT ERNAKULAM",
    "date": "2019",
    "judge": "K.ABRAHAM MATHEW",
    "petitioners": [
        "MC.No",
        "Crl",
        "KUDLU P.O., KUDLU VILLAGE, KASARAGOD.",
        "SIDDIQUE K.K.,",
        "AGED 33 YEARS",
        "CHERANGAI KADAPPURAM",
        "S/O.MUHAMMED, CHERANGAI KADAPPURAM,"
    ],
    "respondents": [
        "Kasaragod",
        "ALAMPADY POST, KALLAKKTTA,",
        "S :",
        "2 HARIF @ ARIF",
        "AGED 39 YEARS",
        "S/O.MUHAMMED, HITACHI QUARTERS,",
        "KASARAGOD - 671 541.",
        "1 STATE OF KERALA,",
        "REPRESENTED BY PUBLIC PROSECUTOR,",
        "HIGH COURT OF KERALA, ERNAKULAM - 682 031."
    ],
    "sections": [
        "482",
        "324",
        "341"
    ],
    "outcome": "In the result, this Crl.M.C. is allowed",
    "full_text": "as\nBoe eee\nDleRaxrt\nIN THE HIGH COURT OF KERALA AT ERNAKULAM 2019/KER/S\nPRESENT\nTHE HONOURABLE MR. JUSTICE K.ABRAHAM MATHEW\nTHURSDAY, THE 03RD DAY OF JANUARY 2019 / 13TH POUSHA, 1940\nCri.MC.No. 16 of 2019\nAGAINST CC 165/2017 of J.M.F.C., KASARAGOD\nCRIME NO. 1057/2016 of Kasaragod Police Station, Kasaragod\nPETITIONER:\nSIDDIQUE K.K.,\nAGED 33 YEARS\nS/O.MUHAMMED, CHERANGAI KADAPPURAM,\nKUDLU P.O., KUDLU VILLAGE, KASARAGOD.\nBY ADV. S.JIJI,\nRESPONDENTS :\n1 STATE OF KERALA,\nREPRESENTED BY PUBLIC PROSECUTOR,\nHIGH COURT OF KERALA, ERNAKULAM - 682 031.\n2 HARIF @ ARIF\nAGED 39 YEARS\nS/O.MUHAMMED, HITACHI QUARTERS,\nALAMPADY POST, KALLAKKTTA,\nKASARAGOD - 671 541.\nBY ADV. SMT.K.S.SANTHI\nSRI C S HRITHWIK-PUBLIC PROSECUTOR\nTHIS CRIMINAL MISC. CASE HAVING BEEN FINALLY HEARD ON 03.01.2019,\nTHE COURT ON THE SAME DAY PASSED THE FOLLOWING:\n\nCrl.MC.No. 16 of 2019 2 201KERIS\nORDER\n\nPetition filed under Section 482 Cr.P.C.\n\n2. Petitioner is the accused in C.C.No.165\nof 2017 on the file of the Judicial Magistrate of\nFirst Class-I, Kasaragod. He is alleged to have\ncommitted the offences under Sections 324 and 341\nIPC. Second respondent is the victim. It is\nsubmitted that the matter has been settled and\nthe proceedings in the trial court may be\nquashed.\n\n3. Heard the learned counsel for _ the\npetitioner and second respondent and the learned\nPublic Prosecutor.\n\n4. I have perused the affidavit filed by\nthe second respondent, who has entered appearance\nthrough counsel. I am satisfied that the matter\nhas been settled and no public interest is\ninvolved in this case. There is no impediment\nfor granting the prayer of the petitioner.\n\nCrl.MC.No. 16 of 2019 3 2019/KERIS\nIn the result, this Crl.M.C. is allowed. The\n\nproceedings in C.C.No.165 of 2017 on the file of\nthe Judicial Magistrate of First Class-I,\nKasaragod are quashed. If any material objects\nhave been produced in this case, the trial court\nmay pass appropriate orders for their disposal.\n\nSd/-\n\nK. ABRAHAM MATHEW\n\nJUDGE\n\nMC/03.01.19\n\na\neae\nCrl.MC.No. 16 of 2019 4 2019/KERIS\nAPPENDIX\nPETITIONER'S/S EXHIBITS:\nANNEXURE Al CERTIFIED COPY OF FINAL REPORT IN\nCR.1057/2016 OF KASARAGOD POLICE\nSTATION.\nANNEXURE A2 AFFIDAVIT DATED 28/11/2018 SWORN BY\nTHE 2ND RESPONDENT.\nRESPONDENT'S/S EXHIBITS:\nNIL\nMC\n(TRUE COPY) PA TO JUDGE\n\n"
}