{
    "case_id": "Crl.MC.No. 9101 of 2016",
    "court": "HIGH COURT OF KERALA AT ERNAKULAM\nPRESENT",
    "date": "DECEMBER 2016/6TH",
    "judge": "K.P.JYOTHINDRANATH",
    "petitioners": [
        "MC.No",
        "SRILBLAZE K.JOSE\nSMT.RESHMA",
        "ACCUSED :",
        "USHA KUMARI, AGED 48 YEARS,",
        "Bea",
        "KEELIYODU, MARANALLOOR, THIRUVANANTHAPURAM.",
        "Magistrate",
        "JUSTICE",
        "D/O. KAMALKSHI, NELLIVILA PUTHEN VEEDU,",
        "C.M.P.No.16099",
        "J.\nCrl"
    ],
    "respondents": [
        "HIGH COURT OF KERALA, ERNAKULAM, PIN- 682 031.",
        "NEDUMANGAD POLICE STATION,",
        "1. STATE OF KERALA,",
        "2. SUB INSPECTOR OF POLICE,",
        "THIRUVANANTHAPURAM, PIN- 695 116.",
        "REPRESENTED BY PUBLIC PROSECUTOR,",
        ":"
    ],
    "sections": [
        "380"
    ],
    "outcome": "",
    "full_text": "Bea\nte ay e\nBlea\n2016/KER/S55581\nIN THE HIGH COURT OF KERALA AT ERNAKULAM\nPRESENT:\nTHE HONOURABLE MR. JUSTICE K.P.JYOTHINDRANATH\nTUESDAY, THE 27TH DAY OF DECEMBER 2016/6TH POUSHA, 1938\nCri.MC.No. 9101 of 2016\nC.M.P.NO. 16099 OF 2016 ON C.C.NO. 2734 OF 2016 OF THE JUDICIAL FIRST\nCLASS MAGISTRATE COURT-II, NEDUMANGAD\nCRIME NO. 2004/2016 OF NEDUMANGAD POLICE STATION,\nTHIRUVANANTHAPURAM DISTRICT\nPETITIONER(S)/ACCUSED :\nUSHA KUMARI, AGED 48 YEARS,\nD/O. KAMALKSHI, NELLIVILA PUTHEN VEEDU,\nKEELIYODU, MARANALLOOR, THIRUVANANTHAPURAM.\nBY ADVS. SRILBLAZE K.JOSE\nSMT.RESHMA G.MENON\nSMT.K.J.JISMA\nRESPONDENT(S) :\n1. STATE OF KERALA,\nREPRESENTED BY PUBLIC PROSECUTOR,\nHIGH COURT OF KERALA, ERNAKULAM, PIN- 682 031.\n2. SUB INSPECTOR OF POLICE,\nNEDUMANGAD POLICE STATION,\nTHIRUVANANTHAPURAM, PIN- 695 116.\nBY SR. PUBLIC PROSECUTOR SMT. REKHA C.NAIR\nTHIS CRIMINAL MISC. CASE HAVING COME UP FOR ADMISSION\nON 27-12-2016, THE COURT ON THE SAME DAY PASSED THE\nFOLLOWING:\nMsd.\n\nBea\nte soap\nBlea\n2016/KER/S55581\nCrl.MC.No. 9101 of 2016\nAPPENDIX\nPETITIONER(S)' ANNEXURES :\nANNEXURE |: CERTIFIED COPY OF THE ORDER IN\nC.M.P.NO. 16099 OF 2016 IN C.C.NO. 2734 OF 2016\nDATED 05.12.2016 OF THE JFMC-Il, NEDUMANGAD IN\nCRIME NO. 2004/2016 OF NEDUMANGAD POLICE STATION.\nRESPONDENT(S)' ANNEXURES :\nNIL\nHfTRUE COPY//\nPA.TO JUDGE\nMsd.\n\naes\n2016/KER/55581\nK.P.JYOTHINDRANATH, J.\nCrl.M.C.No.9101 of 2016\nDated this the 27\" day of December, 2016\nORDER\n\nPetitioner is the accused in C.C.No.2734 of 2016 on the file\nof the Judicial First Class Magistrate Court -II, Nedumangad.\nThe major offence alleged is under Section 380 of IPC. She was\ngranted bail as per order in C.M.P.No.16099 of 2016 of the said\ncourt. While granting bail, the petitioner was directed to\nexecute a bond for 250,000/- along with two solvent sureties. It\nis directed that at least one among the sureties shall be a close\nblood relative of the accused, for which she shall produce proof.\nThe grievance is against the said imposition of condition. After\nhearing the learned Public Prosecutor and also considering the\nsubmission, the second condition imposed by the learned\nMagistrate is modified as follows:\n\nâ€˜One among the sureties shall be a close blood relative of\nthe accused and if one of the sureties is a close blood relative,\nshe need not be a person having properties. If such a surety is\n\nBea\napa\n2016/KER/55581\nCrl.M.C.No.9101/2016 2\nnot available, the petitioner is at liberty to produce solvent\nsureties and the solvency can be verified by the court below by\nappropriate directions.\nSd/-\nK.P.JYOTHINDRANATH, JUDGE.\nTRUE COPY\nP.A TO JUDGE\nDG\n\nBEpne\nElz ae aH\n2016/KER/55581\nCrl1.M.C.No.9101/2016 3\n\n"
}