{
    "case_id": "",
    "court": "HIGH COURT OF KERALA AT ERNAKULAM\nPRESENT\nTHE HONOURABLE MR",
    "date": "2024",
    "judge": "PALAKKAD",
    "petitioners": [
        "2 KAJAHUSSAIN",
        "Singh",
        "AGED 38 YEARS",
        "AGED 48 YEARS",
        "PANANGADAN HOUSE,",
        "S/0.PYARIJAN,",
        "S/0.SHAHUL HAMEED,",
        "THEKKETHERUVU, PUDUKKODE,",
        "Gian Singh v. State of",
        "Others",
        "4 NAZEER",
        "Yogendra Yadav",
        "3 SHAMSUDHEEN",
        "1 ASHRAF",
        "S/ACCUSED NOS. i TO 5:",
        "ALATHUR, PALAKKAD, PIN - 678687",
        "AGED 40 YEARS",
        "AGED 39 YEARS"
    ],
    "respondents": [
        "HIGH COURT OF KERALA, PIN - 682031",
        "AGED 73 YEARS",
        "1 STATE OF KERALA",
        "S/STATE, SUBAIDA AND CW2:",
        "SOUTH STREET, PUDUCODE.P.O,",
        "AGED 25 YEARS",
        "S/0.NASSAR,",
        "PULIYANCHODU HOUSE,",
        "2 SUBAIDA",
        "Alathur",
        "REPRESENTED BY PUBLIC PROSECUTOR,",
        "ALATHUR, PALAKKAD, PIN - 678687",
        "THEKKETHERUVU, PUDUCODE.P.O,",
        "W/O .MUHAMMED,",
        "3 IRFAN"
    ],
    "sections": [
        "482",
        "323",
        "341",
        "1860",
        "143",
        "147",
        "447",
        "427 r/w\nSection 149 of the Indian Penal Code"
    ],
    "outcome": "to be quashed",
    "full_text": "arene\nae ae aA\nab. . ee]\nBere\n2024/KER/5275\nIN THE HIGH COURT OF KERALA AT ERNAKULAM\nPRESENT\nTHE HONOURABLE MR. JUSTICE BECHU KURIAN THOMAS\nTUESDAY, THE 23RD DAY OF JANUARY 2024 / 3RD MAGHA, 1945\nCRL.MC NO. 132 OF 2024\nCRIME NO.757/2019 OF VADAKKANCHERRY POLICE STATION, PALAKKAD\nIN S.T.NO.219/2020 OF JUDICIAL MAGISTRATE OF FIRST\nCLASS-I ,ALATHUR\nPETITIONERS/ACCUSED NOS. i TO 5:\n1 ASHRAF\nAGED 38 YEARS\nS/0.SHAHUL HAMEED,\nPANANGADAN HOUSE,\nTHEKKETHERUVU, PUDUKKODE,\nALATHUR, PALAKKAD, PIN - 678687\n2 KAJAHUSSAIN\nAGED 39 YEARS\nS/0.SHAHUL HAMEED,\nPANANGADAN HOUSE,\nTHEKKETHERUVU, PUDUKKODE,\nALATHUR, PALAKKAD, PIN - 678687\n3 SHAMSUDHEEN\nAGED 48 YEARS\nS/0.SHAHUL HAMEED,\nPANANGADAN HOUSE,\nTHEKKETHERUVU, PUDUKKODE,\nALATHUR, PALAKKAD, PIN - 678687\n4 NAZEER\nAGED 40 YEARS\nS/0.PYARIJAN,\nPANANGADAN HOUSE,\nTHEKKETHERUVU, PUDUKKODE,\nALATHUR, PALAKKAD, PIN - 678687\n\nBe bl\nae ae ah\nab. . ee]\nBar\n2024/KER/5275\nCrl.M.C.No.132 of 2024\n“12t-\n5 MUHAMMED SHAHIN\nAGED 24 YEARS\nS/0.SHAMSUDHEEN,\nPANANGADAN HOUSE,\nTHEKKETHERUVU, PUDUKKODE,\nALATHUR, PALAKKAD, PIN - 678687\nBY ADV V.A.JOHNSON (VARIKKAPPALLLIL )\nRESPONDENTS/STATE, SUBAIDA AND CW2:\n1 STATE OF KERALA\nREPRESENTED BY PUBLIC PROSECUTOR,\nHIGH COURT OF KERALA, PIN - 682031\n2 SUBAIDA\nAGED 73 YEARS\nW/O .MUHAMMED,\nTHEKKETHERUVU, PUDUCODE.P.O,\nALATHUR, PALAKKAD, PIN - 678687\n3 IRFAN\nAGED 25 YEARS\nS/0.NASSAR,\nPULIYANCHODU HOUSE,\nSOUTH STREET, PUDUCODE.P.O,\nALATHUR, PALAKKAD, PIN - 678687\nBY ADV.\nUNNI SEBASTIAN KAPPEN\nOTHER PRESENT:\nSRI. M.C. ASHI,\nPUBLIC PROSECUTOR\nTHIS CRIMINAL MISC. CASE HAVING COME UP FOR ADMISSION ON\n23.01.2024, THE COURT ON THE SAME DAY PASSED THE FOLLOWING:\n\nPa\n2024/KER/5275\nCrl.M.C.No.132 of 2024 “3s.\nBECHU KURIAN THOMAS, J.\nDated this the 23” day of January, 2024\nORDER\n\nPetitioners have invoked the jurisdiction under Section 482 Cr.P.C to\nquash all proceedings against them.\n\n2. Petitioners are accused 1 to 5 in S.T. No.219/2020 on the files of\nthe Judicial First Class Magistrate Court-l, Alathur, arising out of Crime\nNo.757/2019 Vadakkencherry Police Station, Palakkad District, registered\nfor the offences under Sections 143, 147, 447, 341, 323 and 427 r/w\nSection 149 of the Indian Penal Code, 1860. Respondents 2 and 3 are the\ndefacto complainant and the injured witness.\n\n3. According to the prosecution, on 18.11.2019, the accused formed\nthemselves into an unlawful assembly and after trespassing into the\nproperty of the defacto complainant, assaulted him and _ thereby\ncommitted the offences alleged.\n\n4. Heard the learned counsel for the petitioners and the learned\ncounsel for the respondents, apart from the learned Public Prosecutor.\n\n5. The learned counsel for the petitioners submitted that the matter\nhas been settled and hence the proceedings against the petitioners ought\nto be quashed. It was also submitted that, considering the nature of\noffences alleged, no purpose would be served by continuing the\nproceedings.\n\nPa\n2024/KER/5275\nCrl.M.C.No.132 of 2024 “As.\n\n6. In Gian Singh v. State of Punjab and Another [(2012) 10\nSCC 303], the Apex Court has held that in appropriate cases, the High\nCourt can take note of the amicable resolution of disputes between the\nvictim and the wrongdoer to put an end to the criminal proceedings. This\nview was reiterated in Narinder Singh and Others v. State of Punjab\nand Another [(2014) 6 SCC 466] and Yogendra Yadav and Others v.\nState of Jharkhand and Another [(2014) 9 SCC 653].\n\n7. | have perused Annexure-2 and Annexure-3 affidavits filed by\nrespondents 2 and 3. The learned Public Prosecutor has submitted that\nupon verification, it is understood that the affidavits are genuine, and the\ndefacto complainant and the other deponent stand by the contents\nthereof. | am satisfied that the matter has been settled and no public\ninterest is involved in this case. There is no impediment for granting the\nprayer for quashing. The continuance of the proceedings will only be an\nexercise in futility.\n\n8. Accordingly, all proceedings against the petitioners in\nS.T. No.219/2020 on the files of the Judicial First Class Magistrate Court-l,\nAlathur, are quashed.\n\nThis Crl.M.C is allowed as above.\n\nSd/-\nBECHU KURIAN THOMAS\nJUDGE\nJka/23.01.24.\n\nee\nab. etn\nBar\n2024/KER/5275\nCrl.M.C.No.132 of 2024\n-51-\nAPPENDIX OF CRL.MC 132/2024\nPETITIONERS’ ANNEXURES\nAnnexure 1 TRUE COPY OF THE FINAL REPORT IN\nS.T.NO.219/ 2020 OF THE COURT OF JUDICIAL\nFIRST CLASS MAGISTRATE-1I, ALATHUR.\nAnnexure 2 THE AFFIDAVIT DATED 18.10.2023 SWORN BY\nTHE 2ND RESPONDENT HEREIN EVIDENCING THE\nFACTUM OF SETTLEMENT.\nAnnexure 3 THE AFFIDAVIT DATED 18.10.2023 SWORN BY\nTHE 3RD RESPONDENT HEREIN EVIDENCING THE\nFACTUM OF SETTLEMENT.\n\n"
}