{
    "case_id": "Crl.MC.No.8763 OF 2019 (E)",
    "court": "HIGH COURT OF KERALA AT ERNAKULAM\nPRESENT\nTHE HONOURABLE MR",
    "date": "2020",
    "judge": "KARINJIRE @ PUTHIYAPURAYIL",
    "petitioners": [
        "S/O. KOTTAN, KARINJIRE (H),",
        "AGED 56 YEARS",
        "KANNUR DISTRICT",
        "SMT.K.REEHA KHADER",
        "1 VASU @ BHASKARAN,",
        "AGED 64 YEARS",
        "TALIPARAMBA TALUK,",
        "AGED 30 YEARS",
        "KARINJIRE @ PUTHIYAPURAYIL",
        "4 KUMARI @ SANTHAKUMARI P,",
        "S/O. VASU,",
        "2 SANOOP P,",
        "Thaliparamba",
        "S/ACCUSED 1 TO 4:",
        "KARINJIRE @ PUTHIYAPURAYIL (H),",
        "3 KIRAN,",
        "AGED 33 YEARS",
        "KOOVERI AMSOM, POONAMKODE, TALIPARAMBA TALUK,",
        "KOOVERI AMSOM, POONAMKODE,",
        "W/O. VASU, KARINJIRE @ PUTHIYAPURAYIL (H),",
        "KANNUR DISTRICT."
    ],
    "respondents": [
        "AGED 36 YEARS",
        "1 STATE OF KERALA",
        "S/STATE & DEFACTO COMPLAINANT:",
        "JUDICIAL FIRST CLASS MAGISTRATE COURT,",
        "S/O. GOVINDAN, MEETHALEPURAYIL (H), KOOVERI",
        "AMSOM, POONAMKODE, KOOVERI P.O, TALIPARAMBA",
        "R2 BY ADV. B.MUHAMMED SHAHEEL",
        "TALIPARAMBA POLICK STATION PENDING BEFORE",
        "TALIPARAMBA AS CC 1004/2015).",
        "REPRESENTED BY PUBLIC PROSECUTOR, HIGH COURT OF",
        "(INVESTIGATING OFFICER IN CRIME NO. 530/2014 OF",
        "2 SHYJU .M",
        "R1 BY C.S.HRITHWIK, SR.P.P.",
        "TALUK, KANNUR DISTRICT, PINCODE 670 581",
        "KERALA, ERNAKULAM, COCHIN 682 031"
    ],
    "sections": [
        "506(i17)\nread with Section 34 IPC",
        "341",
        "324",
        "482"
    ],
    "outcome": "/JUDGMENT IN CC 1004/2015 OF JUDICIAL\nMAGISTRATE OF FIRST CLASS , TALIPARAMBA\nPETITIONERS/ACCUSED 1 TO 4:\n1 VASU @ BHASKARAN,\nAGED 64 YEARS\nS/O. KOTTAN, KARINJIRE (H),\nKOOVERI AMSOM, POONAMKODE,\nTALIP",
    "full_text": "oars 30]\nseh a\nrc ‘ iw\n2020/KER/1367\nIN THE HIGH COURT OF KERALA AT ERNAKULAM\nPRESENT\nTHE HONOURABLE MR. JUSTICE ASHOK MENON\nFRIDAY, THE 10TH DAY OF JANUARY 2020 / 20TH POUSHA, 1941\nCrl.MC.No.8763 OF 2019 (E)\nAGAINST THE ORDER/JUDGMENT IN CC 1004/2015 OF JUDICIAL\nMAGISTRATE OF FIRST CLASS , TALIPARAMBA\nPETITIONERS/ACCUSED 1 TO 4:\n1 VASU @ BHASKARAN,\nAGED 64 YEARS\nS/O. KOTTAN, KARINJIRE (H),\nKOOVERI AMSOM, POONAMKODE,\nTALIPARAMBA TALUK,\nKANNUR DISTRICT.\n2 SANOOP P,\nAGED 30 YEARS\nS/O. VASU,\nKARINJIRE @ PUTHIYAPURAYIL (H),\nKOOVERI AMSOM, POONAMKODE,\nTALIPARAMBA TALUK,\nKANNUR DISTRICT\n3 KIRAN,\nAGED 33 YEARS\nS/O. VASU,\nKARINJIRE @ PUTHIYAPURAYIL (H),\nKOOVERI AMSOM, POONAMKODE,\nTALIPARAMBA TALUK,\nKANNUR DISTRICT.\n4 KUMARI @ SANTHAKUMARI P,\nAGED 56 YEARS\nW/O. VASU, KARINJIRE @ PUTHIYAPURAYIL (H),\nKOOVERI AMSOM, POONAMKODE, TALIPARAMBA TALUK,\nKANNUR DISTRICT.\nBY ADV. SMT.K.REEHA KHADER\n\nfl ow, 30]\nae a\nil ‘ iat\n2020/KER/1367\nCril.MC 8763/2019\n2\nRESPONDENTS/STATE & DEFACTO COMPLAINANT:\n1 STATE OF KERALA\nREPRESENTED BY PUBLIC PROSECUTOR, HIGH COURT OF\nKERALA, ERNAKULAM, COCHIN 682 031\n(INVESTIGATING OFFICER IN CRIME NO. 530/2014 OF\nTALIPARAMBA POLICK STATION PENDING BEFORE\nJUDICIAL FIRST CLASS MAGISTRATE COURT,\nTALIPARAMBA AS CC 1004/2015).\n2 SHYJU .M\nAGED 36 YEARS\nS/O. GOVINDAN, MEETHALEPURAYIL (H), KOOVERI\nAMSOM, POONAMKODE, KOOVERI P.O, TALIPARAMBA\nTALUK, KANNUR DISTRICT, PINCODE 670 581\nR2 BY ADV. B.MUHAMMED SHAHEEL\nR1 BY C.S.HRITHWIK, SR.P.P.\nTHIS CRIMINAL MISC. CASE HAVING COME UP FOR ADMISSION\nON 10.01.2020, THE COURT ON THE SAME DAY PASSED THE\nFOLLOWING :\n\n2020/KER/1367\nCrl.MC 8763/2019\n3\nASHOK MENON, J.\n—¢rT.MC No.8763 of 2019\npated this the 10% day of January, 2020\nORDER\n\nPetitioners are accused 1 to 4 in CC No.1004/2015\non the files of the Judicial First Class Magistrate’s\nCourt, Thaliparamba for having allegedly committed\noffences punishable under Sections 341, 324 and 506(i17)\nread with Section 34 IPC.\n\n2. The only defacto complainant/injured is the\nsecond respondent herein. He has appeared through\ncounsel and filed an affidavit to the effect that the\nmatter has been amicably settled with the petitioners\nand that he has no grievance against them. A report to\nthat effect has also been obtained from the\ninvestigating officer through the learned Senior Public\nProsecutor. The petitioners do not have any criminal\nantecedents. No public interest is involved.\n\nIn the result, the Criminal M.Cc. is allowed and\n\nhearse\ncape\n2020/KER/1367\nCrl.MC 8763/2019\n4\nthe entire proceedings as against the petitioners\nherein in CC No.1004/2015 on the files of the Judicial\nFirst Class Magistrate’s Court, Thaliparamba_ shall\nstand quashed under Section 482 cr.PC and_ the\npetitioners/accused are discharged.\nSd/-\nASHOK MENON\nJUDGE\n59\n\nfl ow, 30]\nae a\nil ‘ iat\n2020/KER/1367\nCril.MC 8763/2019\n5\nAPPENDIX\nPETITIONER'S/S EXHIBITS:\nANNEXURE Al THE TRUE COPY OF THE FINAL REPORT IN\nCRIME NO. 530/2014 OF TALIPARAMBA\nPOLICE STATION PENDING BEFORE JUDICIAL\nFIRST CLASS MAGISTRATE COURT,\nTALIPARAMBA AS CC 1004/2015\nANNEXURE A2 THE TRUE COPY OF THE FIR AND FIS IN\nCRIME NO. 530/2014 OF TALIPARAMBA\nPOLICE STATION PENDING BEFORE JUDICIAL\nFIRST CLASS MAGISTRATE COURT,\nTALIPARAMBA AS CC 1004/2015\nANNEXURE A3 THE TRUE COPY OF THE MEMO OF EVIDENCE\nIN CRIME NO. 5530/2014 OF TALIPARAMBA\nPOLICE STATION PENDING BEFORE JUDICIAL\nFIRST CLASS MAGISTRATE COURT,\nTALIPARAMBA AS CC 1004/2015\nANNEXURE A4 AFFIDAVIT SWORN BY THE 2ND RESPONDENT\n\n"
}