{
    "case_id": "",
    "court": "HIGH COURT OF KERALA AT ERNAKULAM\nPRESENT",
    "date": "2017",
    "judge": "B.KEMAL PASHA",
    "petitioners": [
        "POOKOM, P.O.PANOOR, KANNUR DISTRICT.",
        "ASNIJA K.K",
        "ASNIJA K.K,",
        "J.\nDated",
        "(S)/2ND ACCUSED:",
        "THOMAS",
        "D/O.ABDULLAH, AGED 28 YEARS,",
        "KADAMKUNNUMMAL HOUSE",
        "KADAMKUNNUMMAL HOUSE,"
    ],
    "respondents": [
        "HIGH COURT OF KERALA, ERNAKULAM-682031.",
        "(S) /DEFACTO COMPLAINANT/STATE:",
        "1. SAMEER K.K,",
        "POOKOM, P.O.PANOOR, KANNUR DISTRICT-670673.",
        "R2-R3 BY PUBLIC PROSECUTOR SRI.C.S.HRITWICK",
        "2. SUB INSPECTOR OF POLICE,",
        "REP.BY PUBLIC PROSECUTOR,",
        "R1 BY ADV. SRI.K.PRAVEEN KUMAR",
        "3. STATE OF KERALA,",
        "CHOKLI POLICE STATION-670672.",
        "S/O.MUHAMMED,AGED 41 YEARS ,KADAMKUNNUMMAL HOUSE,"
    ],
    "sections": [
        "448",
        "427 r/w Section 34 of the Indian Penal Code"
    ],
    "outcome": "In the result, this Crl.M.C. is allowed",
    "full_text": "Euan\njae\n4 ere\n2017/KER/49568\nIN THE HIGH COURT OF KERALA AT ERNAKULAM\nPRESENT:\nTHE HONOURABLE MR. JUSTICE B.KEMAL PASHA\nTHURSDAY, THE 7TH DAY OF DECEMBER 2017/16TH AGRAHAYANA, 1939\nCr1.MC.No. 8166 of 2017 ()\nCC 666/2016 of J.M.F.C., THALASSERY\nCRIME NO. 419/2015 OF CHOKLI POLICE STATION, KANNUR\nPETITIONER (S)/2ND ACCUSED:\nASNIJA K.K,\nD/O.ABDULLAH, AGED 28 YEARS,\nKADAMKUNNUMMAL HOUSE,\nPOOKOM, P.O.PANOOR, KANNUR DISTRICT.\nBY ADV. SRI.CIBI THOMAS\nRESPONDENT (S) /DEFACTO COMPLAINANT/STATE:\n1. SAMEER K.K,\nS/O.MUHAMMED,AGED 41 YEARS ,KADAMKUNNUMMAL HOUSE,\nPOOKOM, P.O.PANOOR, KANNUR DISTRICT-670673.\n2. SUB INSPECTOR OF POLICE,\nCHOKLI POLICE STATION-670672.\n3. STATE OF KERALA,\nREP.BY PUBLIC PROSECUTOR,\nHIGH COURT OF KERALA, ERNAKULAM-682031.\nR1 BY ADV. SRI.K.PRAVEEN KUMAR\nR2-R3 BY PUBLIC PROSECUTOR SRI.C.S.HRITWICK\nTHIS CRIMINAL MISC. CASH HAVING COME UP FOR ADMISSION ON\n07-12-2017, THE COURT ON THE SAME DAY PASSED THE FOLLOWING:\n\nEl\njee\noy ar\n2017/KER/49568\nCr1.MC.No. 8166 of 2017 ()\nAPPENDIX\nPETITIONER (S)' EXHIBITS\nANNEXURE I TRUE COPY OF THE CHARGE IN CRIME NO.419/2015 OF CHOKLI\nPOLICE STATION\nANNEXURE IT TRUE COPY OF THE DEATH CERTIFICATE OF THE 1ST ACCUSED\nANNEXURE IIT TRUE COPY OF THE AFFIDAVTI SWORN IN BY THE 1ST\nRESPONDENT\nANNEXURE IV TRUE COPY OF THE AGREEMENT ENTERED INTO BETWEEN THE\nPETITIONER AND THE 1ST RESPONDENT.\nRESPONDENT'S EXHIBITS: NIL\nTRUE COPY\nPA TO JUDGE\nScl.\n\nBipasha]\n2017/KER/49568\nB. KEMAL PASHA, J.\nDated this the 7\" day of December, 2017\nORDER\n\nPetitioner is the second accused in Crime No.419/2015\nof Chokli Police Station, which is now pending as C.C.No.666 of\n2016 of the Judicial First Class Magistrate's Court, Thalassery,\nregistered for the offences punishable under Sections 448 and\n427 r/w Section 34 of the Indian Penal Code.\n\n2. It seems that the matter has been amicably settled\nbetween the parties.\n\n3. On going through the facts and circumstances of the\ncase, it seems that the matter can be permitted to be settled.\n\n4. It has been reported that no criminal antecedents\nhave been reported against the petitioner. The first respondent\nhas filed Annexure-III affidavit affirming that the matter has\nbeen amicably settled between him and the petitioner and he\nhas no complaints against the petitioner. Considering the fact\nthat the matter has already been settled amicably between the\n\nEl\napa\n2017/KER/49568\nCril.M.C. No.8166 of 2017\n-2-\nparties, this court is satisfied that no purpose would be served\nin proceeding with the trial of the case. Matters being so, all\nfurther proceedings in C.C.No.666 of 2016 of the Judicial First\nClass Magistrate's Court, Thalassery, in Crime No.419/2015 of\nChokli Police Station, against the petitioner, are liable to be\nquashed.\n\nIn the result, this Crl.M.C. is allowed and all further\nproceedings in C.C.No.666 of 2016 of the Judicial First Class\nMagistrate's Court, Thalassery, in Crime No.419/2015 of Chokli\nPolice Station, against the petitioner, against the petitioner,\nare hereby quashed.\n\nSd/-\nB.KEMAL PASHA\nJUDGE\nScl/07.12.2017\n\n"
}