{
    "case_id": "",
    "court": "HIGH COURT OF KERALA AT ERNAKULAM",
    "date": "6 day of January, 2021",
    "judge": "ANNA STEPHEN\nRESPONDENTS",
    "petitioners": [
        "T.C.4/1008(1), KURAVANKONAM, KOWDIAR P.O.,",
        "Ambalapuzha",
        "Sd/-\nV.G.ARUN",
        "J.\n- GrLM.C.No.213",
        "THIRUVANANTHAPURAM .",
        "Frais",
        "MISCELLANEOUS",
        "SR.PP.C.S.HRITHWIK",
        "THOMAS JOHN MUTHOOT"
    ],
    "respondents": [
        "KERALA, ERNAKULAM-682031.",
        "1 STATE OF KERALA",
        "S :",
        "2 ASSISTANT LABOUR OFFICER",
        "SR.PP.C.S.HRITHWIK",
        "AMBALAPPUZHA-688561.",
        "REPRESENTED BY THE PUBLIC PROSECUTOR, HIGH COURT OF"
    ],
    "sections": [
        "258",
        "251"
    ],
    "outcome": "has stated that the S.T itself was disposed",
    "full_text": "Bre imy eee\nBae\nIN THE HIGH COURT OF KERALA AT ERNAKULAM 2021/KER/703\nPRESENT\nTHE HONOURABLE MR.JUSTICE V.G.ARUN\nWEDNESDAY, THE O6TH DAY OF JANUARY 2021 / 16TH POUSHA, 1942\nCr1.MC.No.213 OF 2015\nAGAINST THE JUDGMENT IN ST 5506/2012 DATED 30-08-2014 OF JUDICIAL\nMAGISTRATE OF FIRST CLASS ,AMBALAPUZHA\nPETITIONER:\nTHOMAS JOHN MUTHOOT\nT.C.4/1008(1), KURAVANKONAM, KOWDIAR P.O.,\nTHIRUVANANTHAPURAM .\nBY ADVS.\nSRI.C.M.STEPHEN\nSMT.JEAN ANNA STEPHEN\nRESPONDENTS :\n1 STATE OF KERALA\nREPRESENTED BY THE PUBLIC PROSECUTOR, HIGH COURT OF\nKERALA, ERNAKULAM-682031.\n2 ASSISTANT LABOUR OFFICER\nAMBALAPPUZHA-688561.\nSR.PP.C.S.HRITHWIK\nTHIS CRIMINAL MISC. CASE HAVING COME UP FOR ADMISSION ON\n06.01.2021, THE COURT ON THE SAME DAY PASSED THE FOLLOWING:\n\nBeer\n2021/KER/703\nV.G.ARUN, J.\n- GrLM.C.No.213 of 2015.\nDated this the 6 day of January, 2021\nORDER\nThe Crl.M.C is filed challenging the order passed in S.T.No.506 of\n2012 of JFCM, Ambalapuzha. Being a Crl.M.C of the year 2015,\npertaining to a crime of 2014, a report was called for, from the\njurisdictional Magistrate Court. In the report, the learned Magistrate\nhas stated that the S.T itself was disposed of on 17.04.2019 by\nimposing a fine of Rs.2100/- on the accused. In the circumstances,\nnothing survives for consideration in the Crl.M.C and it is accordingly\ndismissed.\nSd/-\nV.G.ARUN\nJUDGE\nlgk\n\nFrais\nBae\n2021/KER/703\nAPPENDIX OF Cr1.MC 213/2015\n\nPETITIONER'S/S EXHIBITS:\n\nANNEXURE P1 ANNEXURE 1: TRUE COPY OF THE COMPLAINT\nFILED BEFORE THE JFMC AMBALAPPUZHA BY THE\nR2, UNDERB SEC.29(1)B OF THE KERALA SHOPS\nAND COMMERCTAL ESTABLISHMENTS ACT.\n\nANNEXURE P2 ANNEXURE 2 : TRUE COPY OF THE ORDER PASSED\nBY JFMC AMBALAPPUZHA IN CMP 2218/13 IN ST\n506/12.\n\nANNEXURE P3 ANNEXURE 3 : TRUE COPY OF THE INSPECTION\nNOTE FILED BY THE R2 BEFORE JFMC DT.21-2-\n2012.\n\nANNEXURE P4 ANNEXURE 4: TRUE COPY OF THE SHOW CAUSE\nNOTICE FILED BY THE R2 BEFORE JFMC DT.13-6-\n2012.\n\nANNEXURE P5 ANNEXURE 5: TRUE COPY OF THE ADDRESS PROOF\nOF THE PETITIONER.\n\nANNEXURE P6 ANNEXURE 6 : TRUE COPY OF THE CERTIFICATE\nOF INCORPORATION OF M/S.MUTHOOT FINCROP\nLTD. ISSUED BY THE REGISTRAR OF COMPANY OF\nKERALA .\n\nANNEXURE P7 ANNEXURE 7: TRUE COPY OF THE CERTIFICATE\nISSUED BY THE RESERVE BANK OF INDIA\nREGISTERING M/S.MUTHOOT FINCROP LTD. AS AN\nNON BANKING FINANCE COMPANY.\n\nANNEXURE P8 ANNEXURE 8 : TRUE COPY OF THE MISCELLANEOUS\nPETITION FILED BY THE PETITIONER BEFORE\nJEMC UNDER SECTION 251 AND 258 OF CRPC.\n\n"
}