{
    "case_id": "Crl.MC.No. 24 of 2014",
    "court": "HIGH COURT OF KERALA AT ERNAKULAM\nPRESENT",
    "date": "2014",
    "judge": "HARUN-UL-RASHID",
    "petitioners": [
        "KANNAMPALLY BHAGHOM,",
        "MC.No",
        "VINEETHA BHAVANAM,",
        "VISHWAN,AGED 44 YEARS,",
        "KEERIKADU.",
        "S/O.CHAKRAPANI,",
        "ACCUSED:"
    ],
    "respondents": [
        "1. STATE OF KERALA, REPRESENTED BY",
        "ERUMBANILEKSHAM VEEDU,",
        "S/O.KOCHUMANI,",
        "PUBLIC PROSECUTOR, HIGH COURT OF KERALA,",
        "CHOOLATHERUVU, MUTHUKULAM - 690 506.",
        "RAMAPURAM - 686 576.",
        "R1 BY PUBLIC PROSECUTOR SMT.S. HYMA",
        "COMPLAINANT/CW-2 AND 3:",
        "4. UTHAMAN, AGED 42 YEARS,",
        "MUTHUKULAM THEKKU, MUTHUKULAM - 690 506.",
        "3. AJIKUMAR, AGED 31 YEARS,",
        "ERNAKULAM, THROUGH POLICE INSPECTOR,",
        "R2, R3 &R4 BY ADV. SMT.T.M.BINITHA",
        "S/O.KRISHNAN, THIRUVATHIRA,",
        "S/O.KRISHNAN, ANAKHA BHAVAN,",
        "2. SUJIKUMAR, AGED 36 YEARS,",
        "KAYAMKULAM POLICE STATION - 690 502."
    ],
    "sections": [
        "307"
    ],
    "outcome": "Crl.M.C is disposed",
    "full_text": "Oar ee\nsean\nBEA\n2014/KER/211\nIN THE HIGH COURT OF KERALA AT ERNAKULAM\nPRESENT:\nTHE HONOURABLE MR.JUSTICE HARUN-UL-RASHID\nTHURSDAY, THE 2ND DAY OF JANUARY 2014/12TH POUSHA, 1935\nCrl.MC.No. 24 of 2014\nSC NO.276/2013 OF ADDL.SESSIONS COURT (FAST TRACK )-II, ALAPPUZHA\nCRIME NO. 497/2012 OF KANAKAKUNNU POLICE STATION , ALAPPUZHA\nPETITIONER(S):ACCUSED:\nVISHWAN,AGED 44 YEARS,\nS/O.CHAKRAPANI,\nVINEETHA BHAVANAM,\nKANNAMPALLY BHAGHOM,\nKEERIKADU.\nBY ADVS.SRILR.SUNIL KUMAR\nSMT.A.SALINI LAL\nRESPONDENT/COMPLAINANT/CW-2 AND 3:\n1. STATE OF KERALA, REPRESENTED BY\nPUBLIC PROSECUTOR, HIGH COURT OF KERALA,\nERNAKULAM, THROUGH POLICE INSPECTOR,\nKAYAMKULAM POLICE STATION - 690 502.\n2. SUJIKUMAR, AGED 36 YEARS,\nS/O.KRISHNAN, THIRUVATHIRA,\nMUTHUKULAM THEKKU, MUTHUKULAM - 690 506.\n3. AJIKUMAR, AGED 31 YEARS,\nS/O.KRISHNAN, ANAKHA BHAVAN,\nCHOOLATHERUVU, MUTHUKULAM - 690 506.\n4. UTHAMAN, AGED 42 YEARS,\nS/O.KOCHUMANI,\nERUMBANILEKSHAM VEEDU,\nRAMAPURAM - 686 576.\nR1 BY PUBLIC PROSECUTOR SMT.S. HYMA\nR2, R3 &R4 BY ADV. SMT.T.M.BINITHA\nTHIS CRIMINAL MISC. CASE HAVING COME UP FOR ADMISSION\nON 02-01-2014, THE COURT ON THE SAME DAY PASSED THE\nFOLLOWING:\nKss\n\nae cae\nFretted\nlee\n2014/KER/211\nCrl.M.C.No.24/2014\nAPPENDIX\nPETITIONER'S ANNEXURES:\nANNEX.A1: COPY OF THE FINAL REPORT.\nANNEX.A2: COPY OF THE AFFIDAVIT BY THE 2ND,3RD & 4TH RESPONDENT.\nRESPONDENT'S ANNEXURES: NIL\nITRUE COPY/\nP.A.TO JUDGE\nKss\n\nBil\nHARUN-UL-RASHID, J. NEED\nCr.M.C. No.24 of 2014\nDated this the 2‚Äù day of January 2014.\nORDER\n\nHeard the learned counsel for the petitioner and respondents.\n\n2. Accused in Crime No.497/2012 of Kanakakkunnu Police\nStation pending as S.C.No.276/2013 on the file of the Additional\nSessions Court (Fast Track)-II, Alappuzha is the petitioner. The\npetition is filed seeking to quash Annexure -A and further proceedings\nagainst the petitioner in Crime No. 497/2012 of Kanakakkunnu Police\nStation.\n\n3. The offence alleged is punishable under Section 307 of IPC.\n\n4. The learned counsel on both sides submit that the disputes\nbetween the parties have been amicably settled and having regard to\nthe resolution of the disputes between the parties, continuance of the\ncriminal prosecution against the petitioner is an avoidable irritant.\n\nIn view of the settlement arrived at between the parties, the\nCrl.M.C is disposed of quashing Annexure-A and further proceedings\nagainst the petitioner in Crime No. 497/2012 of Kanakakkunnu Police\nStation.\n\nSd/-\nHARUN-UL-RASHID,\nJudge.\nAL/-\nTrue copy\nP.A to Judge\n\n"
}