{
    "case_id": "",
    "court": "HIGH COURT OF KERALA AT ERNAKULAM",
    "date": "WEDNESDAY",
    "judge": "PIN-691 301",
    "petitioners": [
        "S/O. SUJU, ASAN MADAM VEEDU, KOONAYIL CHERRY,",
        "VISHNU",
        "Tipper Lorry",
        "PIN-691 013\n3",
        "PARAVUR VILLAGE, KOLLAM TALUK, PIN-691 301"
    ],
    "respondents": [
        "PIN-691 013",
        "PARIPPALLY POLICE STATION,",
        "PP T.R.RENJITH",
        "PIN-682 031",
        "REPRESENTED BY THE PUBLIC PROSECUTOR,",
        "HIGH COURT OF KERALA,",
        "2 DISTRICT COLLECTOR,",
        "1 STATE OF KERALA",
        "RESPONDENTS:",
        "CIVIL STATION, KOLLAM,",
        "KOLLAM, PIN-691 574",
        "OTHER PRESENT:",
        "3 SUB-INSPECTOR OF POLICE,"
    ],
    "sections": [
        "457"
    ],
    "outcome": "The Crl.M.C is allowed",
    "full_text": "sere\nrae\noa\nElz me\nIN THE HIGH COURT OF KERALA AT ERNAKULAM 202 UKERI66?\nPRESENT\nTHE HONOURABLE MR.JUSTICE V.G.ARUN\nWEDNESDAY, THE O6TH DAY OF JANUARY 2021 / 16TH POUSHA, 1942\nCr1.MC.No.66 OF 2021 (G)\nAGAINST THE ORDER/JUDGMENT IN CMP 4714/2019 OF JUDICIAL FIRST\nCLASS MAGISTRATE COURT, PARAVUR\nPETITIONER:\nVISHNU\nS/O. SUJU, ASAN MADAM VEEDU, KOONAYIL CHERRY,\nPARAVUR VILLAGE, KOLLAM TALUK, PIN-691 301\nBY ADV. SRI.M.R.SASITH\nRESPONDENT/RESPONDENTS:\n1 STATE OF KERALA\nREPRESENTED BY THE PUBLIC PROSECUTOR,\nHIGH COURT OF KERALA,\nPIN-682 031\n2 DISTRICT COLLECTOR,\nCIVIL STATION, KOLLAM,\nPIN-691 013\n3 SUB-INSPECTOR OF POLICE,\nPARIPPALLY POLICE STATION,\nKOLLAM, PIN-691 574\nOTHER PRESENT:\nPP T.R.RENJITH\nTHIS CRIMINAL MISC. CASE HAVING COME UP FOR ADMISSION ON\n06.01.2021, THE COURT ON THE SAME DAY PASSED THE FOLLOWING:\n\nee ae\nCRL.M.C.NO.66 OF 2021 > 2021/KER/669\nORDER\nDated this the 6th day of January 2021\n\nPetitioner claims to be the owner of a\nTipper Lorry bearing Registration No.KL-02-BE-\n1247. The vehicle was seized by the 3‚Äù\nrespondent alleging violation of the provisions\nof the Kerala Minor Mineral Concession Rules,\n2015 and the Mines and Minerals (Development\nand Regulation) Act, 1957. After seizure, the\npetitioner's vehicle was produced before the\nJudicial First Class Magistrate Court\n(Temporary), South Paravur. On the basis of an\napplication submitted by the petitioner under\nSection 457 of the Code of Criminal Procedure,\nthe learned Magistrate issued Annexure Al order\ndirecting release of the vehicle, subject to\nconditions. The petitioner complied with the\nconditions and the vehicle was released.\n\nee ae\nCRL.M.C.NO.66 OF 2021 3 2021/KER/669\n\n2. This Crl.M.C is filed aggrieved by\ncondition No.8 in Annexure Al order, directing\nthe original documents produced before the\ncourt to be retained in court custody and to\nissue true certified copies of those documents\nto the petitioner. Annexures A2 is the order\npassed by this Court whereby, the conditions\nakin to condition No.8 in Annexure Al were\nmodified.\n\n3. On the facts of this case and in\nview of the earlier order passed by this Court\nunder similar circumstances, I am inclined to\ngrant the relief sought.\n\nIn the result, condition No.8 in\nAnnexure Al is modified as follows:-\n\nThe petitioner shall submit an\naffidavit undertaking to produce the original\ndocuments of the vehicle bearing registration\nNo.KL-0O2-BE-1247 as and when required by the\ncourt. On submission of such affidavit, the\noriginal documents of the vehicle kept in the\nsafe custody of the court shall be released to\n\nBee eBl\nee a\nElz fh rely\nCRL.M.C.NO.66 OF 2021 2021/KER/669\n4\nthe petitioner, after substituting those\ndocuments with certified copies.\nThe Crl.M.C is allowed as above.\nSd/-\nV.G.ARUN\nJUDGE\nNB\n\nsere\nrae\noa\nElz me\nCRL.M.C.NO.66 OF 2021 2021/KER/669\n5\nAPPENDIX\nPETITIONER'S EXHIBITS:\nANNEXURE A1 CERTIFIED COPY OF THE ORDER IN CMP NO.\n4714/2019 OF MAGISTRATE COURT I,\n(TEMPORARY) , SOUTH PARAVUR, KOLLAM.\nANNEXURE A2 TRUE COPY OF THE ORDER IN CRL.M.C. NO.\n3429/2020 OF HIGH COURT OF KERALA.\n\n"
}