{
    "case_id": "CRL.MC.NO. 8265 OF 2019",
    "court": "HIGH COURT OF KERALA AT ERNAKULAM\nPRESENT\nTHE HONOURABLE MR",
    "date": "2019 1 2020/KER/59",
    "judge": "",
    "petitioners": [
        "KUNNAMKULAM TALUK, THRISSUR DISTRICT — 680 102.",
        "s/o. ABU, KARUPPAMVEETTIL HOUSE,",
        "RAPHY,",
        "KANDANISSERY VILLAGE, ARIKANNIYUR DESOM,",
        "ACCUSED:",
        "AGED 36 YEARS,"
    ],
    "respondents": [
        "2 JOBI,",
        "S/O. KARAPPUNNY, KARUTHUVAKA HOUSE,",
        "NEMINI DESOM, CHAVAKKAD TALUK, THRISSUR DISTRICT —-",
        "680 101.",
        "AGED 29 YEARS,",
        "NEMMINI DESOM, CHAVAKKAD TALUK, THRISSUR DISTRICT —-",
        "s/o. SANKARAN, KIPPADA HOUSE, THIKKAD VILLAGE,",
        "4 HARIKRISHNAN,",
        "3 NEDHESH,",
        "S/O. JOSEPH, PUTHUR HOUSE, GURUVAYUR VILLAGE,",
        "S /STATE & DEFACTO COMPLAINANT:",
        "CHAVAKKAD TALUK, THRISSUR DISTRICT —- 680 101.",
        "1 STATE OF KERALA,",
        "AGED 56 YEAR,S",
        "REPRESENTED BY PUBLIC PROSECUTOR,",
        "THIKKAD VILLAGE, MAMABAZAR DESOM,",
        "HIGH COURT OF KERALA, ERNAKULAM - 682 031."
    ],
    "sections": [
        "482",
        "420"
    ],
    "outcome": "/JUDGMENT IN CC.NO. 696/2017 OF JUDICIAL\nMAGISTRATE OF FIRST CLASS ,CHAVAKKAD\nCRIME NO.12/2017 OF Guruvayoor Police Station, Thrissur\nPETITIONER/ACCUSED:\nRAPHY,\nAGED 36 YEARS,\ns/o. ABU, KARUPPAMVEETTI",
    "full_text": "Die\npoe\nes\nCRL.MC.NO. 8265 OF 2019 1 2020/KER/59\nIN THE HIGH COURT OF KERALA AT ERNAKULAM\nPRESENT\nTHE HONOURABLE MR. JUSTICE ASHOK MENON\nMONDAY, THE O6TH DAY OF JANUARY 2020 / 16TH POUSHA, 1941\nCr1.MC.No.8265 OF 2019(C)\nAGAINST THE ORDER/JUDGMENT IN CC.NO. 696/2017 OF JUDICIAL\nMAGISTRATE OF FIRST CLASS ,CHAVAKKAD\nCRIME NO.12/2017 OF Guruvayoor Police Station, Thrissur\nPETITIONER/ACCUSED:\nRAPHY,\nAGED 36 YEARS,\ns/o. ABU, KARUPPAMVEETTIL HOUSE,\nKANDANISSERY VILLAGE, ARIKANNIYUR DESOM,\nKUNNAMKULAM TALUK, THRISSUR DISTRICT — 680 102.\nBY ADV. SRI.RAJIT\nRESPONDENTS /STATE & DEFACTO COMPLAINANT:\n1 STATE OF KERALA,\nREPRESENTED BY PUBLIC PROSECUTOR,\nHIGH COURT OF KERALA, ERNAKULAM - 682 031.\n2 JOBI,\nAGED 56 YEAR,S\nS/O. JOSEPH, PUTHUR HOUSE, GURUVAYUR VILLAGE,\nNEMINI DESOM, CHAVAKKAD TALUK, THRISSUR DISTRICT —-\n680 101.\n3 NEDHESH,\nAGED 29 YEARS,\nS/O. KARAPPUNNY, KARUTHUVAKA HOUSE,\nTHIKKAD VILLAGE, MAMABAZAR DESOM,\nCHAVAKKAD TALUK, THRISSUR DISTRICT —- 680 101.\n4 HARIKRISHNAN,\nAGED 29 YEARS,\ns/o. SANKARAN, KIPPADA HOUSE, THIKKAD VILLAGE,\nNEMMINI DESOM, CHAVAKKAD TALUK, THRISSUR DISTRICT —-\n680 101.\n\nBlsieea B\nes\nCRL.MC.NO. 8265 OF 2019 2 2020/KER/159\n5 SHIJURAJAN,\nAGED 31 YEARS,\nS/O. RAJAN, SHEEJA BHAVAN HOUSE,\nKOCHUTHOPPU VILLAGE, VALLAKADAVU DESOM,\nTHIRUVANANTHAPURAM DISTRICT — 690 001.\n6 PRATHEESH KRISHNAN CHETTIYAR,\nAGED 36 YEARS,\nS/O. KRISHNAN CHETTYAR, SARASWATHY BHAVAN,\nBHARATHNOOR, PANGODE VILLAGE, THIRUVANANTHAPURAM\nDISTRICT - 695609., NOW RESIDING AT AL SAFA-2, AL\nHABTOOR HOSPITALITY, TRANSPORTATION DEPARTMENT,\nVILLA 727, POST BOX NO.26666, DUBAI, UAE (PASSPORT\nNO.L 7411220)\n7 AJAYAKUMAR,\nAGED 34 YEARS,\nS/O. LAKSMANA CHETTYAR, SARASWATHY BHAVAN,\nBHARATHNOOR, NELLIKUNNU VILLAGE, THIRUVANANTHAPURAM\nDISTRICT — 695 609.\nC.S.HRITHWIK-SR.P.P\nR2-5, R7 BY ADV. SRI.V.V.JOY\nTHIS CRIMINAL MISC. CASE HAVING COME UP FOR ADMISSION ON\n06.01.2020, THE COURT ON THE SAME DAY PASSED THE FOLLOWING:\n\nBeam\nCRL.MC.NO. 8265 OF 2019 3 2020/KER/159\nORDER\nDated this the 06\" day of January, 2020\n\nThe petitioner is the sole accused in CC.No.696/2017 on\nthe files of the Judicial first Class Magistrate Court, Chavakkad for\nhaving allegedly committed offence punishable under Section 420\nof the IPC. The defacto complainant and aggrieved are\nrespondents 2 to 7. They have appeared through counsel and filed\naffidavits to the effect that the matter has been amicably settled\nwith the petitioner and that they do not have any grievance\nagainst him. A report has been obtained from the Investing Officer\nthrough the learned Senior Public Prosecutor. The petitioner does\nnot has any criminal antecedents.\n\nIn the result, the Crl.M.C is allowed and the entire\nproceedings as against the petitioners in C.C.No.696/2017 on the\nfile of the Judicial First Class Magistrate Court, Chavakkad stands\nquashed under Section 482 of the Cr.PC and the accused is\ndischarged.\n\nSd/-\nASHOK MENON\nJUDGE\nasm\n\nBiel\npoe\nBok:\nCRL.MC.NO. 8265 OF 2019 4 2020/KER/IS9\nAPPENDIX\nEXHIBITS:\nANNEXURE A COPY OF THE COMPLAINT FILED BY THE 2ND\nRESPONDENT.\nANNEXURE B COPY OF THE CHARGE SHEET FILED BY THE\nGURUVAYUR POLICE IN C.C.696/2017 BEFORE\nTHE JFCM COURT, CHAVAKKAD.\nANNEXURE C AFFIDAVIT FILED BY THE 2ND RESPONDENT.\nANNEXURE D AFFIDAVIT FILED BY THE 3RD RESPONDENT.\nANNEXURE E AFFIDAVIT FILED BY THE 4TH RESPONDENT.\nANNEXURE F AFFIDAVIT FILED BY THE 5TH RESPONDENT.\nANNEXURE G AFFIDAVIT FILED BY THE 6TH RESPONDENT.\nANNEXURE H AFFIDAVIT FILED BY THE 7TH RESPONDENT.\n//True Copy// PA to Judge\n\n"
}