{
    "case_id": "Crl.MC.No. 6532 of 2016 ()",
    "court": "HIGH COURT OF KERALA AT ERNAKULAM\nPRESENT",
    "date": "3 day of October, 2016",
    "judge": "MC.No",
    "petitioners": [
        "(S) :",
        "KOCHI 682031\n2",
        "NOUFAL",
        "THEVALAKKARA PO, KOLLAM DISTRICT",
        "PANCHA VILAYIL HOUSE, PALACKAI, SOUTH,"
    ],
    "respondents": [
        "Prayer",
        "1. THE STATE OF KERALA",
        "REPRESENTED BY THE PUBLIC PROSECUTOR,",
        "R1 TO R3 BY PUBLIC PROSECUTOR AMJAD ALI.",
        "3. THE GEOLOGIST",
        "(S)/STATE & COMPLAINANT :",
        "2. THE SUB INSPECTOR OF POLICE",
        "HIGH COURT OF KERALA, ERNAKULAM, KOCHI 682031",
        "KOLLAM, KOLLAM DISTRICT, PIN 691001",
        "CHAVARA THEKKUMBHAGAM POLICE STATION,",
        "KOLLAM DISTRICT, PIN 691001",
        "DEPARTMENT OF MINING AND GEOLOGY,"
    ],
    "sections": [
        "482"
    ],
    "outcome": "DATED 23.06.2016 IN\nCRL.M.C.NO. 3849/2016 OF THIS HON'BLE COURT\nRESPONDENT (S)' EXHIBITS : NIL.\n//TRUE COPY//\nP.A. TO JUDGE\nbp\n\n2016/KER/42232\nRAJA VIJAYARAGHAVAN.Y, J\nDated this the 3 day of October,",
    "full_text": "Dee\neae\nsaa\nreeens\n2016/KER/42232\nIN THE HIGH COURT OF KERALA AT ERNAKULAM\nPRESENT:\nTHE HONOURABLE MR. JUSTICE RAJA VIJAYARAGHAVAN V\nMONDAY, THE 3RD DAY OF OCTOBER 2016/11TH ASWINA, 1938\nCrl.MC.No. 6532 of 2016 ()\nCril.MC 3849/2016 of THIS HON'BLE COURT\nCRIME NO. 1323/2016 OF THEKKUMBHAGOM POLICE STATION,\nKOLLAM DISTRICT\nPETITIONER (S) :\nNOUFAL\nPANCHA VILAYIL HOUSE, PALACKAI, SOUTH,\nTHEVALAKKARA PO, KOLLAM DISTRICT\nBY ADV. SRI.K.RAKESH\nRESPONDENT (S)/STATE & COMPLAINANT :\n1. THE STATE OF KERALA\nREPRESENTED BY THE PUBLIC PROSECUTOR,\nHIGH COURT OF KERALA, ERNAKULAM, KOCHI 682031\n2. THE SUB INSPECTOR OF POLICE\nCHAVARA THEKKUMBHAGAM POLICE STATION,\nKOLLAM DISTRICT, PIN 691001\n3. THE GEOLOGIST\nDEPARTMENT OF MINING AND GEOLOGY,\nKOLLAM, KOLLAM DISTRICT, PIN 691001\nR1 TO R3 BY PUBLIC PROSECUTOR AMJAD ALI.\nTHIS CRIMINAL MISC. CASE HAVING COME UP FOR ADMISSION\nON 03-10-2016, THE COURT ON THE SAME DAY PASSED THE\nFOLLOWING:\nbp\n\nBSE\nFrat te ‘\nise\n2016/KER/42232\nCr1.MC.No. 6532 of 2016 ()\nAPPENDIX\nPETITIONER(S)' EXHIBITS\nANNEXURE A: TRUE COPY OF THE REGISTRATION CERTIFICATE OF\nTHE VEHICLE OF THE PETITIONER\nANNEXURE B: TRUE COPY OF THE REPORT SENT BY THE 2ND\nRESPONDENT TO THE DISTRICT COLLECTOR, KOLLAM\nDATED 03.09.2016\nANNEXURE C: TRUE COPY OF THE ORDER DATED 23.06.2016 IN\nCRL.M.C.NO. 3849/2016 OF THIS HON'BLE COURT\nRESPONDENT (S)' EXHIBITS : NIL.\n//TRUE COPY//\nP.A. TO JUDGE\nbp\n\n2016/KER/42232\nRAJA VIJAYARAGHAVAN.Y, J\nDated this the 3 day of October, 2016\nORDER\n\n1.This petition is filed under section 482 of the Code of\nCriminal Procedure (hereinafter referred to as ‘the Code'\nfor brevity).\n\n2.The petitioner is the registered owner of a mini lorry\nbearing registration No.KL-23L/6815. The said vehicle\nwas seized on 23.8.2016 by the 2™ respondent on the\nallegation that the same was used for the transportation\nof red earth. The grievance of the petitioner is that the\nseizure of the vehicle has not been reported before the\nlearned Magistrate.\n\n3.1 have heard the learned counsel for the petitioner as well\nas the learned Public Prosecutor.\n\n4.It is submitted by the learned counsel that though the\nvehicle was seized under the provisions of the Kerala\n\n2016/KER/42232\n\nCrl.M.C.6532/2016 2\nMinor Mineral Concession Rules, 2015 read with the Mines\nand Minerals (Development and Regulation) Act, 1957,\nthe seizure of the vehicle has not been reported till date\nbefore the jurisdictional Magistrate.\n\n5.The petitioner seeks for a direction to the 2™ respondent\nto report the seizure of the aforesaid vehicle and to issue\nappropriate directions to the learned Magistrate to release\nthe vehicle. The learned counsel refers to orders dated\n1.9.2015 in W.A.1889/2015 and 1890/2015 and order\ndated 14.6.2016 in W.A.1126 of 2016 and 1129 of 2016 to\ncontend that a Division Bench of this Court, in an appeal\nchallenging the provisions, has passed interim orders\ndirecting release of the vehicle subject to conditions.\nPrayer is to direct release of the vehicle on the same\nconditions.\n\n6.Having regard to the facts and circumstances, the 2™\nrespondent is directed to report the seizure of the vehicle\nbearing registration No.KL-23L/6815 before the\njurisdictional Magistrate and the learned Magistrate is\n\n2016/KER/42232\nCrl.M.C.6532/2016 3\ndirected to release the vehicle on deposit of an amount of\nRs.25,000/- and on executing a bond for Rs.25,000/-\nwithout sureties. The learned Magistrate is directed to\nimpose appropriate conditions to prevent\nalienation/transfer of the vehicle) and subsequent\nproduction of the vehicle.\n7.However, the conditions imposed as aforesaid will be\nsubject to modification later, in terms of the final orders in\nthe Writ Appeals, referred to in para 5 above. The\nrespondents 2 will be at liberty to seek for modification\nwithout referring the matter to this Court and in that\nevent, the learned Magistrate is directed to pass\nappropriate orders in accordance with law.\nThe petition is disposed off as above.\nSd/-\nRAJA VIJAYARAGHAVAN.Y.\nJUDGE\nvps\n\n"
}