{
    "case_id": "Crl.MC.No. 218 of 2019",
    "court": "HIGH COURT OF KERALA AT ERNAKULAM",
    "date": "THE 10TH DAY",
    "judge": "Pleas al\nrks saree\nGn ache",
    "petitioners": [
        "Kasaragod",
        "AGED 45 YEARS, S/O LATE ANTONY,",
        "MC.No",
        "MOOVARIKKUND , PADANNAKKAD ,",
        "PAUL K.A.ANTONY",
        "SRI.VIPIN T JOSE\nSENIOR PUBLIC PROSECUTOR SRI C S",
        "PAUL K.A.ANTONY\n",
        "KANHANGAD VILLAGE,HOSDURG TALUK.",
        "K.ABRAHAM MATHEW"
    ],
    "respondents": [
        "S:",
        "HIGH COURT OF KERALA, ERNAKULAM-682031.",
        "MOOVARIKKUND, PADANAKKAD.P.0O,",
        "MOOVARIKKUND , PADANNAKKAD .P.O,",
        "2 REJI C.M,",
        "1 STATE OF KERALA",
        "AGED 53 YEARS, S/O MARKOSE,",
        "NILESHWAR (VIA), HOSDURG TALUK-671314.",
        "AGED 28 YEARS, S/O.REJI.C.M.,",
        "REPRESENTED BY PUBLIC PROSECUTOR,",
        "3 RENI C.R."
    ],
    "sections": [
        "482",
        "465",
        "420"
    ],
    "outcome": "In the result, this Crl.M.C. is allowed",
    "full_text": "Pleas al\nrks saree\nGn ache heen\nBeer\nIN THE HIGH COURT OF KERALA AT ERNAKULAM 201/KER/1323\nPRESENT\nTHE HONOURABLE MR. JUSTICE K.ABRAHAM MATHEW\nTHURSDAY, THE 10TH DAY OF JANUARY 2019 / 20TH POUSHA, 1940\nCr1.MC.No. 218 of 2019\nCRIME NO. 1067/2017 of Hosdurg Police Station, Kasaragod\nPETITIONER:\nPAUL K.A.ANTONY\nAGED 45 YEARS, S/O LATE ANTONY,\nMOOVARIKKUND , PADANNAKKAD ,\nKANHANGAD VILLAGE,HOSDURG TALUK.\nBY ADV. SRI.A.ARUNKUMAR\nRESPONDENTS:\n1 STATE OF KERALA\nREPRESENTED BY PUBLIC PROSECUTOR,\nHIGH COURT OF KERALA, ERNAKULAM-682031.\n2 REJI C.M,\nAGED 53 YEARS, S/O MARKOSE,\nMOOVARIKKUND, PADANAKKAD.P.0O,\nNILESHWAR (VIA), HOSDURG TALUK-671314.\n3 RENI C.R.\nAGED 28 YEARS, S/O.REJI.C.M.,\nMOOVARIKKUND , PADANNAKKAD .P.O,\nNILESHWAR (VIA), HOSDURG TALUK-671314.\nBY ADV. SRI.VIPIN T JOSE\nSENIOR PUBLIC PROSECUTOR SRI C S HRITHWIK\nTHIS CRIMINAL MISC. CASE HAVING COME UP FOR ADMISSION ON\n10.01.2019, THE COURT ON THE SAME DAY PASSED THE FOLLOWING:\n\nee\nCrl.MC.No. 218 of 2019 2 2O1MKER/T323\nORDER\n\nPetition filed under Section 482 Cr.P.C.\n\n2. Petitioner is the accused in Crime\nNo.1067 of 2017 of Hosdurg Police Station,\nKasaragod. He is alleged to have committed the\noffences under Sections 420 and 465 Â£42=IPC.\nRespondents 2 and 3 are the victims. It is\nsubmitted that the matter has been settled and\nthe proceedings in the trial court may be\nquashed.\n\n3. Heard the learned counsel for the\npetitioner and respondents 2 and 3 and the\nlearned Public Prosecutor.\n\n4. TI have perused the affidavits filed by\nrespondents 2 and 3, who have entered\nappearance through counsel. T am satisfied\nthat the matter has been settled and no public\ninterest is involved in this case. There is no\nimpediment for granting the prayer of the\npetitioner.\n\nmeee\nCrl.MC.No. 218 of 2019 3 2019/KERI1323\nIn the result, this Crl.M.C. is allowed.\n\nThe proceedings in Crime No.1067 of 2017 of\nHosdurg Police Station, Kasaragod are quashed.\nIf any material objects have been produced in\nthis case, the trial court may pass appropriate\norders for their disposal.\n\nSd/-\n\nK. ABRAHAM MATHEW\n\nJUDGE\n\nMC/14.1.19\n\nPleas al\nSes\nGn ache heen\nieee\nCr1.MC.No. 218 of 2019 4 2019/KER/1323\nAPPENDIX\nPETITIONER'S/S EXHIBITS:\nANNEXURE AT A TRUE COPY OF THE F.I.R.IN CRIME\nNO.1067 OF 2017 OF HOSDURG POLICE\nSTATION.\nANNEXURE AIT A TRUE COPY OF THE AFFIDAVIT SWORN\nTO BY THE 2ND RESPONDENT.\nANNEXURE ATIT A TRUE COPY OF THE AFFIDAVIT SWORN\nTO BY THE 3RD RESPONDENT.\nRESPONDENT 'S/S EXHIBITS:\nNIL\nMC\n(TRUE COPY) PA TO JUDGE\n\n"
}