{
    "case_id": "",
    "court": "HIGH COURT OF KERALA AT ERNAKULAM\nPRESENT\nTHE HONOURABLE MR",
    "date": "2020",
    "judge": "Ci 4 te\n",
    "petitioners": [
        "AGED 28 YEARS, S/O.YUSUF,",
        "AGED 24 YEARS, S/O.SHADULI.M.M,",
        "KANDAKADAVU(H), AVIYIL, HOSDURG,",
        "Kasargod",
        "ARIFA MANZIL",
        "KASARAGOD DISTRICT-671315",
        "1 MUHAMMED ASARUDHEEN M.M.,",
        "C.S.HRITHWIK",
        "KANDAKADAVU(H",
        "KASARAGOD DISTRICT.",
        "ARIFA MANZIL, AVIYIL, HOSDURG,",
        "C.K.HOUSE, AVIYIL, HOSDURG,",
        "3 JAFFER.A.V,",
        "ERNAKULAM-31",
        "AGED 36 YEARS,",
        "Ci 4",
        "S/ACCUSED 1 TO 3:",
        "2 ANSAR.T.P,"
    ],
    "respondents": [
        "HIGH COURT OF KERALA, ERNAKULAM-31.",
        "2 THE SUB INSPECTOR OF POLICE,",
        "REPRESENTED BY THE PUBLIC PROSECUTOR,",
        "1 STATE OF KERALA",
        "S/STATE, COMPLAINANT & VICTIMS:",
        "HOSDURG POLICE STATION,",
        "KASARAGOD DISTRICT-671315."
    ],
    "sections": [
        "482",
        "143",
        "149",
        "147",
        "448",
        "506(ii)",
        "148",
        "427"
    ],
    "outcome": "In the result, the Crl.M.C. is allowed",
    "full_text": "nee\nae\n| Ci 4 te\n2020/KER/553\nIN THE HIGH COURT OF KERALA AT ERNAKULAM\nPRESENT\nTHE HONOURABLE MR. JUSTICE ASHOK MENON\nTUESDAY, THE 07TH DAY OF JANUARY 2020 / 17TH POUSHA, 1941\nCr1.MC.No.8815 OF 2019 (B)\nAGAINST THE ORDER/JUDGMENT IN CC 1739/2018 OF JUDICIAL MAGISTRATE\nOF FIRST CLASS -I, HOSDURG\nCRIME NO.419/2018 OF Hosdurg Police Station, Kasargod\nPETITIONERS/ACCUSED 1 TO 3:\n1 MUHAMMED ASARUDHEEN M.M.,\nAGED 24 YEARS, S/O.SHADULI.M.M,\nARIFA MANZIL, AVIYIL, HOSDURG,\nKASARAGOD DISTRICT.\n2 ANSAR.T.P,\nAGED 28 YEARS, S/O.YUSUF,\nKANDAKADAVU(H), AVIYIL, HOSDURG,\nKASARAGOD DISTRICT.\n3 JAFFER.A.V,\nAGED 36 YEARS,\nC.K.HOUSE, AVIYIL, HOSDURG,\nKASARAGOD DISTRICT.\nBY ADV. SMT.LAKSHMI SREEDHAR\nRESPONDENTS/STATE, COMPLAINANT & VICTIMS:\n1 STATE OF KERALA\nREPRESENTED BY THE PUBLIC PROSECUTOR,\nHIGH COURT OF KERALA, ERNAKULAM-31.\n2 THE SUB INSPECTOR OF POLICE,\nHOSDURG POLICE STATION,\nKASARAGOD DISTRICT-671315.\n\na\nBR\nEls 4 ie\nCrl1.M.C.No.8815 of 2019 2020/KER/553\n2\n3 SUNU .K\nAGED 37 YEARS, S/O. KUNHIKANNAN,\nKALLOORAVI HOUSE, KALLOORAVI,\nKANHANGAD VILLAGE, HOSDURG TALUK,\nKASARAGOD DISTRICT-671315.\n4 K.T.MADHAVI,\nAGED 75 YEARS, W/O.KUNHIKANNAN,\nK.T.HOUSE, KALLOORAVI, KANHANGAD VILLAGE,\nHOSDURG TALUK, KASARAGOD DISTRICT-671315.\n5 NAYANA.K.T,\nAGED 21 YEARS, W/O.ANIL KUMAR,\nK.T.HOUSE, KALLOORAVI, KANHANGAD VILLAGE,\nHOSDURG TALUK, KASARAGOD DISTRICT-671315.\nR1-R2 BY SRI. C.S.HRITHWIK, SR.PP\nR3-R5 BY SMT. UMMUL FIDA\nOTHER PRESENT:\nTHIS CRIMINAL MISC. CASE HAVING COME UP FOR ADMISSION ON\n07.01.2020, THE COURT ON THE SAME DAY PASSED THE FOLLOWING:\n\neaeKetece4C|\n=\nBeare\nCr1.M.C.No.8815 of 2019 3 2020/KER/S53\nORDER\nDated this the 7th day of January 2020\nThe petitioners are accused 1 to 3 in\nC.C.No.1739/2018 on the file of the Judicial First\nClass Magistrate Court-I, Hosdurg, for having\nallegedly committed the offences punishable under\nSections 143, 147, 148, 448, 427 and 506(ii) read\nwith Section 149 of I.P.C. The defacto complainant-\ninjured are respondents 3 to 5 herein, who have\nappeared through a Counsel and have filed affidavits\nat Annexures A2 to A4 stating that the matter has\nbeen amicably settled and they have no existing\ngrievance against the petitioners. A report has been\nfiled by the investigating officer through the Senior\nPublic Prosecutor to that effect. The petitioners do\nnot have any criminal antecedents and no _ public\ninterest is involved.\nIn the result, the Crl.M.C. is allowed and the\nentire proceedings in Crime No.419/2018 of Hosdurg\n\neaeKetece4C|\naf can\n|\n| Ci 4 te\nCr1.M.C.No.8815 of 2019 2020/KER/S53\n4\nPolice Station, now pending as C.C.No.1739/2018 on\nthe file of the Judicial First Class Magistrate\nCourt-I, Hosdurg, stands quashed under Section 482 of\nCr.P.C. and the petitioners are discharged.\nSd/-\ndkr ASHOK MENON\nJUDGE\n\na\nBR\nEls 4 ie\nCrl1.M.C.No.8815 of 2019 2020/KER/553\n5\nAPPENDIX\nPETITIONER'S/S EXHIBITS:\nANNEXURE Al COPY OF THE FINAL REPORT IN CRIME\nNO.419/2018 OF HOSDURG POLICE\nSTATION, KASARAGOD DISTRICT.\nANNEXURE A2 AFFIDAVIT SWORN BY THE THIRD RESPONDENT\nSTATING THE SETTLEMENT OF ALL THE DISPUTES.\nANNEXURE A3 AFFIDAVIT SWORN BY THE FOURTH RESPONDENT\nSTATING THE SETTLEMENT OF ALL THE DISPUTES.\nANNEXURE A4 AFFIDAVIT SWORN BY THE FIFTH RESPONDENT\nSTATING THE SETTLEMENT OF ALL THE DISPUTES.\n\n"
}