{
    "case_id": "",
    "court": "HIGH COURT OF KERALA AT ERNAKULAM\nPRESENT\nTHE HONOURABLE MRS",
    "date": "2024",
    "judge": "THOMAS",
    "petitioners": [
        "Gian Singh v. State of Punjab",
        "PATHANAMTHITTA, PIN - 689503.",
        "V.G.SURESH",
        "S/O NANU PILLA, KUNNATHU HOUSE, MANTHUKA PO, KULANADA,",
        "ANANDHU",
        "ACCUSED:",
        "MADHUSOODANAN PILLA, AGED 53 YEARS,"
    ],
    "respondents": [
        "2 STATION HOUSE OFFICER",
        "PATHANAMTHITTA, PIN - 689503.",
        "3 SOBHA SANKAR, AGED 38 YEARS,",
        "1 STATE OF KERALA",
        "ADOOR POLICE STATION, KAYAMKULAM-PATHANAPURAM ROAD, ADOOR,",
        "D/O SIVASANKARA PILLAI, RESIDING AT KUNNATHU HOUSE,",
        "PUBLIC PROSECUTOR SRI.PRASANTH M.P.",
        "PATHANAMTHITTA, PIN - 691523.",
        "ERNAKULAM, PIN - 682031.",
        "REPRESENTED BY PUBLIC PROSECUTOR, HIGH COURT OF KERALA,",
        "MANTHUKA PO, KULANADA VILLAGE,",
        "S /STATE:"
    ],
    "sections": [
        "482",
        "323",
        "31(1)",
        "498A",
        "2005"
    ],
    "outcome": "petitioner can be quashed",
    "full_text": "rc a Pe\n2024/KER/4013\nIN THE HIGH COURT OF KERALA AT ERNAKULAM\nPRESENT\nTHE HONOURABLE MRS. JUSTICE SOPHY THOMAS\nWEDNESDAY, THE 177\" pay OF JANUARY 2024 / 27TH POUSHA, 1945\nCRL.MC NO. 53 OF 2024\nCRIME NO.450/2023 OF PANDALAM POLICE STATION,\nPATHANAMTHITTA\nCC 933/2023 OF JUDICIAL MAGISTRATE OF FIRST CLASS, ADOOR\nPETITIONER/ACCUSED:\nMADHUSOODANAN PILLA, AGED 53 YEARS,\nS/O NANU PILLA, KUNNATHU HOUSE, MANTHUKA PO, KULANADA,\nPATHANAMTHITTA, PIN - 689503.\nBY ADVS.\nANANDHU SATHEESH\nV.G.SURESH\nSREEDEVI 8S.\nRESPONDENTS /STATE:\n1 STATE OF KERALA\nREPRESENTED BY PUBLIC PROSECUTOR, HIGH COURT OF KERALA,\nERNAKULAM, PIN - 682031.\n2 STATION HOUSE OFFICER\nADOOR POLICE STATION, KAYAMKULAM-PATHANAPURAM ROAD, ADOOR,\nPATHANAMTHITTA, PIN - 691523.\n3 SOBHA SANKAR, AGED 38 YEARS,\nD/O SIVASANKARA PILLAI, RESIDING AT KUNNATHU HOUSE,\nMANTHUKA PO, KULANADA VILLAGE,\nPATHANAMTHITTA, PIN - 689503.\nPUBLIC PROSECUTOR SRI.PRASANTH M.P.\nTHIS CRIMINAL MISC. CASE HAVING COME UP FOR ADMISSION\nON 17.01.2024, THE COURT ON THE SAME DAY PASSED THE\nFOLLOWING :\n\nPeal\nCrl.M.C.No.53/2024 2 2024/KERMOI3\nORDER\n\nThis Crl.M.C. under Section 482 of CrP.C. is filed by the\nsole accused in Crime No.450 of 2023 of Pandalam Police\nStation, Pathanamthitta District, registered under Sections\n323 and 498A of IPC and Section 31(1) of the Protection of\nWomen from Domestic Violence Act, 2005, for quashing\nAnnexure-Al final report in C.C.No.933 of 2023, on the file\nof Judicial First Class Magistrate Court, Adoor.\n\n2. The prosecution allegation is that the petitioner,\nwho is the husband of the defacto complainant, subjected\nher to matrimonial cruelties demanding money and gold.\n\n3. When the matter is taken up for consideration,\nlearned counsel for the petitioner would submit that the\ndispute stands settled, and he produced Annexure-A2\naffidavit of the 3rd respondent, endorsing the settlement,\nand further stating that, she has no intention to continue\nwith the prosecution. She has no objection in quashing the\n\nRial\nCrl.M.C.No.53/2024 3 2024/KERMOI3\nproceedings in C.C.No.933 of 2023 pending against the\npetitioner before Judicial First Class Magistrate Court, Adoor.\n\n4. Learned Public Prosecutor’ on __ instructions\nsubmitted that the matter has been settled, and he\nproduced the signed statement of the 3rd respondent, to the\neffect that as the matter is settled, she has no objection in\nquashing the proceedings in C.C.No.933 of 2023.\n\n5. Since the matter stands settled, no purpose would\nbe served by continuing the prosecution against the\npetitioner.\n\n6. In the light of the principles laid down by the Apex\nCourt in Gian Singh v. State of Punjab and Another;\n[(2012) 10 SCC 303)], and State of Madhya Pradesh v.\nLaxmi Narayan and Others; [(2019) 5 SCC 688], this\nCourt is of the view that the proceedings against the\npetitioner can be quashed on the basis of settlement.\nMoreover, the dispute is purely personal in nature, and no\npublic interest is involved in it.\n\n|\nCrL.M.C.No.53/2024 4 2024/KER/M013\nIn the result, this Crl.M.C. is allowed and Annexure-Al\nfinal report in C.C.No.933 of 2023 on the file of Judicial First\nClass Magistrate Court, Adoor, stands quashed.\nSd/-\nSOPHY THOMAS\nJUDGE\nDSV/-\n\nrc he fwt\nCr.M.C.No.53/2024 5 2024/KER/MO13\nAPPENDIX OF CRL.MC 53/2024\n\nPETITIONER’ S ANNEXURES:\n\nAnnexure Al TRUE COPY OF THE FINAL REPORT IN CRIME NO.\n933/2023 OF PANDALAM POLICE STATION,\nPATHANAMTHITTA DISTRICT.\n\nAnnexure A2 THE AFFIDAVIT SWORN IN BY RESPONDENT\nNO .3/DEFACTO COMPLAINANT DATED 20/12/2023.\n\nRESPONDENTS’ ANNEXURES: NIL\n\n"
}