{
    "case_id": "Crl.MC.No. 212 of 2019",
    "court": "HIGH COURT OF KERALA AT ERNAKULAM\nPRESENT\nTHE HONOURABLE MR",
    "date": "2019",
    "judge": "K.ABRAHAM MATHEW",
    "petitioners": [
        "S:",
        "J.M.F.C.-I",
        "J. ANAKKALLUNKAL\nOTHER PRESENT:\n",
        "MC.No",
        "J.ANAKKALLUNKAL",
        "PAZHUKKAKALAM BHAGOM",
        "Sd/-\nK. ABRAHAM MATHEW",
        "BHAGOM",
        "MADAKKATHANAM KARA",
        "KELAKATH",
        "SAMIKAVALA BHAGOM",
        "ARIKUZHA KARA",
        "PAZHUKKAKKALAM BHAGOM",
        "MUNDEKALLU BHAGOM",
        "KUZHIKKAKAVU\nBHAGOM",
        "MUTHALAKODAM KARA"
    ],
    "respondents": [
        "S:",
        "VELLYAMATTOM VILLAGE, THODUPUZHA,",
        "3 SUNEESH, AGED 21 YEARS, S/O RAJAN, NJARAVELIL",
        "1 STATE OF KERALA REPRESENTED BY THE PUBLIC",
        "2 JISTO, AGED 20, S/O PYARISON, PARAYANIKKAL",
        "HOUSE, SAMIKAVALA BHAGOM, POOMALAK KARA,",
        "PROSECUTOR, HIGH COURT OF KERALA,",
        "ERNAKULAM - 682031",
        "IDUKKI DISTRICT — 685 508",
        "Thodupuzha",
        "HOUSE,",
        "THODUPUZHA, IDUKKI DISTRICT - 685505xX",
        "THEKKUMBHAGOM KARA, KARIKODE VILLAGE,"
    ],
    "sections": [
        "482",
        "323",
        "294(b)"
    ],
    "outcome": "In the result, this Crl.M.C. is allowed",
    "full_text": "Deere\napap\n2019/KER/1049\nIN THE HIGH COURT OF KERALA AT ERNAKULAM\nPRESENT\nTHE HONOURABLE MR. JUSTICE K.ABRAHAM MATHEW\nWEDNESDAY , THE 09TH DAY OF JANUARY 2019 / 19TH POUSHA,\n1940\nCrl.MC.No. 212 of 2019\ncc 171/2018 OF J.M.F.C.-I, THODUPUZHA\nCRIME NO. 2195/2017 OF THODUPUZHA POLICE STATION , IDUKKI\nPETITIONER/S:\n\n1 MATHEWS KOLLAPPILLI, AGED 21 YEARS, S/O SABU,\nKOLLAPPILLIL HOUSE, PAZHUKKAKKALAM BHAGOM,\nMUTHALAKODAM KARA, KARIKKODE VILLAGE,\nTHODUPUZHA\n\n2 GOKUL T.R., AGED 21 YEARS, S/O REJILAL,\nTHACHUKUZHIYIL HOUSE, MUNDEKALLU BHAGOM,\nTHODUPUZHA\n\n3 SARATH KRISHNAMOHAN, AGED 23 YEARS, S/O\nMOHANAN, MOOZHIKKAL HOUSE, KUZHIKKAKAVU\nBHAGOM, ARIKUZHA KARA, MANAKKAD VILLAGE,\nTHODUPUZHA\n\n4 BHARATH KRISHNA, AGED 23 YEARS, S/O AJITH\nKUMAR, VANIYAPALLIL HOUSE, EDAKKAD KAYATTAM\nBHAGOM, MADAKKATHANAM KARA, MAJALLOOR VILLAGE,\nTHODUPUZHA\n\n5 NAVIN JOSE, AGED 19 YEARS, S/O JOSE, KELAKATH\nHOUSE, PAZHUKKAKALAM BHAGOM, MUTHALAKODAM\nKARA, KARIKKODE VILLAGE, THODUPUZHA\nBY ADV. SRI.THOMAS J.ANAKKALLUNKAL\n\nseen noid\nElz\n2019/KER/1049\nCrl.MC.No. 212 of 2019\nLi2e.\nRESPONDENT/S:\n1 STATE OF KERALA REPRESENTED BY THE PUBLIC\nPROSECUTOR, HIGH COURT OF KERALA,\nERNAKULAM - 682031\n2 JISTO, AGED 20, S/O PYARISON, PARAYANIKKAL\nHOUSE,\nTHEKKUMBHAGOM KARA, KARIKODE VILLAGE,\nTHODUPUZHA, IDUKKI DISTRICT - 685505xX\n3 SUNEESH, AGED 21 YEARS, S/O RAJAN, NJARAVELIL\nHOUSE, SAMIKAVALA BHAGOM, POOMALAK KARA,\nVELLYAMATTOM VILLAGE, THODUPUZHA,\nIDUKKI DISTRICT — 685 508\nBY ADV. SRI.JACOB J. ANAKKALLUNKAL\nOTHER PRESENT:\nSRI C S HRITHWIK-SR PP\nTHIS CRIMINAL MISC. CASE HAVING COME UP FOR ADMISSION ON\n09.01.2019, THE COURT ON THE SAME DAY PASSED THE\nFOLLOWING:\nORDER\nPetition filed under Section 482 Cr.P.C.\n2. The petitioners are the accused in CC No. 171\nof 2018 on the file of the Judicial First\nClass Magistrate Court-I, Thodupuzha\n\neee\n2019/KER/1049\n\nCrl.MC.No. 212 of 2019\n\n1.3..\nregistered for the offences under Sections\n294(b), 323 & 324 of the Indian Penal Code.\nRespondents 2 & 3 are the victims. It is\nsubmitted that the matter has been settled and\nthe proceedings in the criminal case may be\nquashed.\n\n3. Heard the learned counsel for the petitioners\nand respondents 2 & 3 and the learned Public\nProsecutor.\n\n4. I have perused the affidavits filed by\nrespondents 2 & 3, who have entered appearance\nthrough counsel. I am satisfied that the\nallegation of settlement is true and no public\ninterest is involved. There is no impediment\nfor granting the prayer of the petitioners.\n\nIn the result, this Crl.M.C. is allowed. The\nproceedings in CC No. 171 of 2018 on the file\nof the Judicial First Class Magistrate\nCourt-I, Thodupuzha are quashed. The learned\nmagistrate may pass appropriate orders for the\n\nEe\n2019/KER/1049\nCrl.MC.No. 212 of 2019\n14e.\ndisposal of the material objects, if any,\nproduced in the case.\nSd/-\nK. ABRAHAM MATHEW\nJUDGE\nAPPENDIX\n\nPETITIONER'S/S EXHIBITS:\nANNEXURE Al COPY OF THE FINAL REPORT IN\n\nC.C.NO.717/2018 PENDING BEFORE THE\n\nJUDICIAL FIRST CLASS MAGISTRATE COURT-\n\nI, THODUPUZHA.\nANNEXURE A2 AFFIDAVIT SWORN IN BY THE 2ND\n\nRESPONDENT.\nANNEXURE A3 AFFIDAVIT SWORN IN BY THE 3RD\n\nRESPONDENT.\nBka/14.01.2019\n\n"
}