{
    "case_id": "",
    "court": "HIGH COURT OF KERALA AT ERNAKULAM\nPRESENT",
    "date": "4 day of October, 2016",
    "judge": "CHERTHALA",
    "petitioners": [
        "NISHAD,",
        "CHERTHALA, ALAPUZHA.",
        "ACCUSED :",
        "MADAVANACHIRA, VADUTHALA JETTY. P.O.,",
        "W.P.(C",
        "Cherthala",
        "VADUTHALA JETTY",
        "AGED 32 YEARS, S/O. ABUBACKER,",
        "CHERTHALA",
        "Annexure-A3"
    ],
    "respondents": [
        "ALAPPUZHA DISTRICT.",
        "STATE OF KERALA,",
        "OF POLICE, PATTANAKKAD PS, CHERTHALA,",
        "COMPLAINANT:",
        "REPRESENTED BY THE PUBLIC PROSECUTOR,",
        "HIGH COURT, REPRESENTED BY SUB INSPECTOR"
    ],
    "sections": [
        "1957",
        "34",
        "21",
        "118(e)",
        "118(e) of the Kerala Police Act read with Section\n\nCER Pe)\n2\ntai\n2016/KER/42461\nCri"
    ],
    "outcome": "Petition is disposed",
    "full_text": "BE] 4 :\n2016/KER/42461\nIN THE HIGH COURT OF KERALA AT ERNAKULAM\nPRESENT:\nTHE HONOURABLE MR. JUSTICE RAJA VIJAYARAGHAVAN V\nTUESDAY, THE 4TH DAY OF OCTOBER 2016/12TH ASWINA, 1938\nCri.MC.No. 5407 of 2016 ()\nCC.NO. 1170/2013 OF JUDICIAL FIRST CLASS MAGISTRATE COURT-I, CHERTHALA\nCRIME NO. 524/2013 OF PATTANAKKAD POLICE STATION, ALAPPUZHA DISTRICT\nPETITIONER/ACCUSED :\nNISHAD,\nAGED 32 YEARS, S/O. ABUBACKER,\nMADAVANACHIRA, VADUTHALA JETTY. P.O.,\nCHERTHALA, ALAPUZHA.\nBY ADVS.SRILABDUL JALEEL.A\nSMT.M.A.SULFIA\nRESPONDENT/COMPLAINANT:\nSTATE OF KERALA,\nREPRESENTED BY THE PUBLIC PROSECUTOR,\nHIGH COURT, REPRESENTED BY SUB INSPECTOR\nOF POLICE, PATTANAKKAD PS, CHERTHALA,\nALAPPUZHA DISTRICT.\nBY PUBLIC PROSECUTOR SRI.M.R.DHANIL\nTHIS CRIMINAL MISC. CASE HAVING BEEN FINALLY HEARD\nON 04-10-2016, THE COURT ON THE SAME DAY PASSED THE\nFOLLOWING:\nsts\n\nBE] 4 :\n2016/KER/42461\nCri.MC.No. 5407 of 2016 ()\nAPPENDIX\nPETITIONER(S)' ANNEXURES:\nANNEXURE A1: CERTIFIED COPY OF THE FIR AND FINAL REPORT FILED BY THE\nSUB INSPECTOR OF POLICE, PATTANAKKADU POLICE STATION\nANNEXURE A2: ATRUE COPYOF THE JUDGMENT IN WPC NO.26779/2013\nDATED 28.08.2013.\nANNEXURE A3: ATRUE COPY OF THE PAYMENT RECEIPT DATED 26.09.2013\nRESPONDENT(S)â€™ ANNEXURES: NIL\n/TRUE COPY/\nP.A.TO JUDGE\nsts\n\neae\n2016/KER/42461\nRAJA VIJTAYARAGHAVAN, V., J.\nDated this the 4 day of October, 2016\nORDER\n1.The petitioner is the first accused in C.C.No.1170 of 2013\non the file of the Judicial Magistrate of First Class-I,\nCherthala. He is being proceeded against for having\ncommitted offence punishable under Section 21 of the\nMines and Mineral (Development and Regulation) Act,\n1957 and Section 118(e) of the Kerala Police Act read\nwith Section 34 of the IPC.\n2.The learned counsel appearing for the petitioner submits\nthat by Annexure-A2 judgment in W.P.(C) No.26779 of\n2013, the petitioner herein was permitted to file an\napplication before the respondent and seek for\n\neae\n2016/KER/42461\n\nCri.M.C. No. 5407 of 2016 ~2-\ncompounding the offence and the respondent was also\ndirected to pass orders in compliance with the directions\nin Digil v. Sub Inspector of Police [2013(1) KLT 600].\nIn pursuance to Annexure-A2 judgment, a sum of\nRs.25,000/- was remitted towards compounding fee which\nis evidenced by Annexure-A3 and the offence was\ncompounded. According to the learned counsel, in view\nof the decision of this Court in Digil v. Sub Inspector of\nPolice (supra), when compounding fee has been collected\nand the vehicle has been released, no further proceedings\ncan be taken in respect of the offence under the MMDR\nAct.\n\n3.In view of the above, insofar as the offence under Section\n21 of the Mines and Mineral (Development Regulation)\nAct, 1957 is concerned, the prosecution cannot be\nsustained. However, the criminal proceedings under\nSection 118(e) of the Kerala Police Act read with Section\n\nCER Pe)\n2\ntai\n2016/KER/42461\nCri.M.C. No. 5407 of 2016 ~3-\n34 of the IPC shall continue unabated against the\npetitioner and others.\nPetition is disposed of.\nSd/-\nRAJA VIJAYARAGHAVAN, V.\nJUDGE\nPs/4/10/16\n\n"
}