{
    "case_id": "Crl.MC.No. 4960 of 2018",
    "court": "HIGH COURT OF KERALA AT ERNAKULAM",
    "date": "2019",
    "judge": "K.ABRAHAM MATHEW",
    "petitioners": [
        "S:",
        "MC.No",
        "Sd/-\nK.ABRAHAM MATHEW",
        "AGED 42 YEARS, S/O.DAMODARAN,",
        "PULINGOME, P.O.CHUNDA,",
        "AGED 40 YEARS, S/O.CHANDRAN,",
        "1 A.T.V.DAMODARAN",
        "AGED 61 YEARS, S/O.DEVASSYA,",
        "EDAVARAMB P.O., CHERUPUZHA -670511,",
        "CHERUPUZHA, KANNUR DISTRICT.",
        "2 RAJESH K.",
        "KOOTHOOR HOSUE, EDAVARAMBA P.O.,",
        "3 K.D.AUGUSTINE",
        "CHERUPUZHA - 670511, KANNUR DISTRICT.",
        "KANNUR DISTRICT."
    ],
    "respondents": [
        "S:",
        "NARAMBU, KAKKAYINCHAL,",
        "(CRIME NO.1218/2016 PERINGOME POLICE STATION, KANNUR",
        "1 STATE OF KERALA",
        "KANNUR DISTRICT 670001.",
        "HIGH COURT OF KERALA, ERNAKULAM -682031.",
        "s/o. JOSEPH, KURICHITHANAM HOUSE,",
        "2 THE STATION HOUSE OFFICER",
        "3 JORDIN JOSEPH",
        "REPRESENTED BY PUBLIC PROSECUTOR,",
        "DISTRICT, PIN-670001) .",
        "VAYAKKARA AMSOM, PERINGOME,",
        "AGED 39 YEARS"
    ],
    "sections": [
        "201",
        "306",
        "174",
        "420",
        "406"
    ],
    "outcome": "In the result, this Crl.M.C. is allowed",
    "full_text": "B ae TC\nEred wie\nEls an\nIN THE HIGH COURT OF KERALA AT ERNAKULAM 2019/KERI35\nPRESENT\nTHE HONOURABLE MR. JUSTICE K.ABRAHAM MATHEW\nTHURSDAY, THE O3RD DAY OF JANUARY 2019 / 13TH POUSHA, 1940\nCr1.MC.No. 4960 of 2018\nCRIME NO. 1218/2016 OF Peringome Police Station, Kannur\nPETITIONERS:\n1 A.T.V.DAMODARAN\nAGED 40 YEARS, S/O.CHANDRAN,\nEDAVARAMB P.O., CHERUPUZHA -670511,\nKANNUR DISTRICT.\n2 RAJESH K.\nAGED 42 YEARS, S/O.DAMODARAN,\nKOOTHOOR HOSUE, EDAVARAMBA P.O.,\nCHERUPUZHA - 670511, KANNUR DISTRICT.\n3 K.D.AUGUSTINE\nAGED 61 YEARS, S/O.DEVASSYA,\nPULINGOME, P.O.CHUNDA,\nCHERUPUZHA, KANNUR DISTRICT.\nBY ADVS.\nSRI .M. SASTNDRAN\nSRI.P.K.SUBHASH\nRESPONDENTS:\n1 STATE OF KERALA\nREPRESENTED BY PUBLIC PROSECUTOR,\nHIGH COURT OF KERALA, ERNAKULAM -682031.\n2 THE STATION HOUSE OFFICER\n(CRIME NO.1218/2016 PERINGOME POLICE STATION, KANNUR\nDISTRICT, PIN-670001) .\n3 JORDIN JOSEPH\nAGED 39 YEARS\ns/o. JOSEPH, KURICHITHANAM HOUSE,\nNARAMBU, KAKKAYINCHAL,\nVAYAKKARA AMSOM, PERINGOME,\nKANNUR DISTRICT 670001.\nBY ADV. SRI.S.R.SREEJITH\n\nB ae TC\nEred wie\nEls anne\nCrl.MC.No. 4960 of 2018 2 2019/KERI35\nSENOPR PUBLIC PROSECUTOR SRI M S BREEZ\nTHIS CRIMINAL MISC. CASE HAVING BEEN FINALLY HEARD ON\n03.01.2019, THE COURT ON THE SAME DAY PASSED THE FOLLOWING:\n\nieee\nCrl.MC.No. 4960 of 2018 3 201KERISS\nORDER\n\nPetitioners are the accused in Crime No.1218\nof 2016 of Peringome Police Station registered\nunder Section 174 Cr.P.C. Third respondent is\nthe informant. In the course of the\ninvestigation, the investigation officer reported\nthat the investigation revealed commission of the\noffences under Sections 201, 306, 406 and 420\nTPC. The accused allegedly abetted suicide of\nthe father-in-law of the third respondent. It is\nsubmitted that the matter has been settled. The\nprayer is to quash the proceedings.\n\n2. Heard the learned counsel for the\npetitioners and the third respondent and the\nlearned Public Prosecutor.\n\n3. I have perused the affidavit filed by the\nthird respondent who has entered appearance\nthrough counsel. I am satisfied that the matter\n\nieee\nCrl.MC.No. 4960 of 2018 4 201KERISS\nhas been settled. In Annexure AV Order this\ncourt took the view that the facts of the case do\nnot attract the offences under Section 306 IPC.\nNo public interest is involved in this case.\nThere is no impediment for quashing the\nproceedings\nIn the result, this Crl.M.C. is allowed. The\nproceedings in Crime No.1218 of 2016 of Peringome\nPolice Station are quashed. The learned\nMagistrate is directed to dispose of material\nobjects if any produced in this case.\nSd/-\nK.ABRAHAM MATHEW\nJUDGE\nMC/03.01.19\n\nB ae TC\nEred wie\nEls anne\nCrl.MC.No. 4960 of 2018 5 2019/KERI35\nAPPENDIX\nPETITIONER'S/S EXHIBITS:\nANNEXURE A1- A CERTIFIED COPY OF THE FIR IN CRIME\nNO. 1218/2016 OF PERINGOME POLICE\nSTATION.\nANNEXURE AII- A TRUE COPY OF THE AGREEMENT ENTERED\nBETWEEN THE 2ND PETITIONER AND THE\nDECEASED.\nANNEXURE AIII- A TRUE COPY OF THE PLAINT IN OS NO.33\nOF 2016 ON THE FILE OF SUB COURT,\nPAYYANNUR.\nANNEXURE AIV- A TRUE COPY OF THE WRITTEN STATEMENT\nFIELD BY THE 2ND PETITIONER IN OS.\nNO.33 OF 2016 ON THE FILE OF SUB\nCOURT, PAYYANNUR.\nANNEXURE AV- A TRUE COOPY OF THE ORDER IN B.A.\nNO.8937/2017 DATED 6/2/2018\nANNEXURE AVI- A TRUE COPY OF THE ORDER IN B.A.\nNO.1745/2018 DATED 26/3/2018\nRESPONDENT'S/S EXHIBITS:\nNIL\nMC\n(TRUE COPY) PA TO JUDGE\n\n"
}