{
    "case_id": "Crl.MC.No.55 OF 2020(F)",
    "court": "HIGH COURT OF KERALA AT ERNAKULAM\nPRESENT\nTHE HONOURABLE MR",
    "date": "THE 07TH DAY",
    "judge": "P.B.SURESH KUMAR",
    "petitioners": [
        "AGED 31 YEARS",
        "S/ACCUSED 1 TO 5:",
        "2 FOUZU MON,",
        "5 SHAHUL HAMEED,",
        "MALAPPURAM",
        "AGED 32 YEARS",
        "P.O., AREEKODE, MALAPPURAM DISTRICT.",
        "3 MUNEER,",
        "4 NISAR BABU,",
        "AGED 39 YEARS,",
        "1 NABEEL,",
        "AGED 27 YEARS",
        "AGED 35 YEARS",
        "Manjeri",
        "S/O.SULAIMAN, CHOYAKKAD HOUSE, KEEZHUPARAMBA",
        "P.B.SURESH KUMAR",
        "ABDUL SHUKOOR MUNDAMBRA\n"
    ],
    "respondents": [
        "Annexure A3",
        "MALAPPURAM DISTRICT- 693639.",
        "R2 BY ADV. ABDUL SHUKOOR MUNDAMBRA",
        "OF KERALA, ERNAKULAM- 682031.",
        "R1 BY SRI.AMJED ALI, PUBLIC PROSECUTOR",
        "S /COMPLAINANTS :",
        "REPRESENTED BY PUBLIC PROSECUTOR, HIGH COURT",
        "2 KHADEEJA MUSALIYARAKATH",
        "1 STATE OF KERALA,",
        "D/O.SAINUDHEEN MUSALIYARAKATH, CHOYAKKAD",
        "HOUSE, KEEZHUPARAMBA VILLAGE, ERANADU TALUK,",
        "AGED 40 YEARS"
    ],
    "sections": [
        "482",
        "341",
        "506",
        "354",
        "324 read with\nSection 34 of the Indian Penal Code"
    ],
    "outcome": "In the result, the Crl.M.C. is allowed",
    "full_text": "ERAT\neet\nee\nDe\n2020/KER/326\nIN THE HIGH COURT OF KERALA AT ERNAKULAM\nPRESENT\nTHE HONOURABLE MR. JUSTICE P.B.SURESH KUMAR\nTUESDAY, THE 07TH DAY OF JANUARY 2020 / 17TH POUSHA, 1941\nCrl.MC.No.55 OF 2020(F)\nAGAINST CC 354/2019 OF JUDICIAL FIRST CLASS MAGISTRATE\nCOURT - I,MANJERI\nCRIME NO.35/2019 OF AREEKODE POLICE STATION\nPETITIONERS/ACCUSED 1 TO 5:\n1 NABEEL,\nAGED 32 YEARS\nS/O.SULAIMAN, CHOYAKKAD HOUSE, KEEZHUPARAMBA\nP.O., AREEKODE, MALAPPURAM DISTRICT.\n2 FOUZU MON,\nAGED 27 YEARS\nS/O.SULAIMAN, CHOYAKKAD HOUSE, KEEZHUPARAMBA\nP.O., AREEKODE, MALAPPURAM DISTRICT.\n3 MUNEER,\nAGED 31 YEARS\nS/O.SULAIMAN, CHOYAKKAD HOUSE, KEEZHUPARAMBA\nP.O., AREEKODE, MALAPPURAM DISTRICT.\n4 NISAR BABU,\nAGED 35 YEARS\nS/O.SULAIMAN, CHOYAKKAD HOUSE, KEEZHUPARAMBA\nP.O., AREEKODE, MALAPPURAM DISTRICT.\n5 SHAHUL HAMEED,\nAGED 39 YEARS,\nS/O.SULAIMAN, CHOYAKKAD HOUSE, KEEZHUPARAMBA\nP.O., AREEKODE, MALAPPURAM DISTRICT.\nBY ADV. SRI.P.K.MOHAMED JAMEEL\n\nBeas\nae\nEt AT\nRees,\ncee\n2020/KER/326\nCri.M.C. No.55 of 2020 2\nRESPONDENTS /COMPLAINANTS :\n1 STATE OF KERALA,\nREPRESENTED BY PUBLIC PROSECUTOR, HIGH COURT\nOF KERALA, ERNAKULAM- 682031.\n2 KHADEEJA MUSALIYARAKATH\nAGED 40 YEARS\nD/O.SAINUDHEEN MUSALIYARAKATH, CHOYAKKAD\nHOUSE, KEEZHUPARAMBA VILLAGE, ERANADU TALUK,\nMALAPPURAM DISTRICT- 693639.\nR2 BY ADV. ABDUL SHUKOOR MUNDAMBRA\nR1 BY SRI.AMJED ALI, PUBLIC PROSECUTOR\nTHIS CRIMINAL MISC. CASE HAVING COME UP FOR ADMISSION\nON 07.01.2020, THE COURT ON THE SAME DAY PASSED THE\nFOLLOWING :\n\npee\n2020/KER/326\nCrl.M.C. No.55 of 2020 3\nORDER\n\nThis is a proceedings instituted under Section 482 of\nthe Code of Criminal Procedure for quashing Annexure A2 final\nreport and all further proceedings pursuant thereto now\npending as C.C.No.354 of 2019 on the files of the Court of the\nJudicial Magistrate of First Class - I, Manjeri.\n\n2. The petitioners are the accused in the said case.\nThe case was one instituted at the instance of the second\nrespondent under Sections 341, 354, 506, 324 read with\nSection 34 of the Indian Penal Code.\n\n3. It is seen that the second respondent has settled\nher disputes with the petitioners and an affidavit to that effect\nhas been filed as Annexure A3.\n\n4. The learned counsel for the second respondent\naffirmed that Annexure A3 is an affidavit sworn to by the\nsecond respondent and submitted that the second respondent\nhas no objection in granting the relief sought for by the\n\nâ€”\n2020/KER/326\nCrl.M.C. No.55 of 2020 4\npetitioners.\n\n5. In the light of the decision of the Apex Court in\nGian singh v. State of Punjab, (2012) 10 SCC 303, | am of\nthe view that this is an appropriate case where this court has to\ninvoke the jurisdiction under Section 482 of the Code of\nCriminal Procedure to quash the proceedings against the\npetitioners.\n\nIn the result, the Crl.M.C. is allowed and Annexure-A2\nfinal report and all further proceedings pursuant thereto against\nthe petitioners pending as_ C.C.No.354 of 2019 on the files of\nthe Court of the Judicial Magistrate of First Class - |, Manjeri are\nquashed.\n\nSd/-\nP.B.SURESH KUMAR, JUDGE.\nDK\n\nBeas\nae\nEt AT\ncee\n2020/KER/326\nCri.M.C. No.55 of 2020 5\nAPPENDIX\nPETITIONERS ' EXHIBITS:\nANNEXURE Al CERTIFIED COPY OF THE F.I.R IN CRIME\nNO.35/2019 OF AREEKODE POLICE STATION.\nANNEXURE A2 CERTIFIED COPY OF THE FINAL REPORT IN\nCRIME NO.35/2019 OF AREEKODE POLICE\nSTATION.\nANNEXURE A3 ORIGINAL AFFIDAVIT SWORN IN BY THE 2ND\nRESPONDENT.\nRESPONDENTS\" EXHIBITS: NIL\n//TRUE COPY//\nPA TO JUDGE\nDK\n\n"
}