{
    "case_id": "",
    "court": "HIGH COURT OF KERALA AT ERNAKULAM\nPRESENT",
    "date": "2015",
    "judge": "B.KEMAL PASHA",
    "petitioners": [
        "1. ARUN GOPI @ SABU(A1), AGED 38 YEARS,",
        "CHERTHALA, ALAPPUZHA DISTRICT(A4).",
        "ACCUSED :",
        "Scns",
        "2. SARASWATHY GOPINATH, AGED 63 YEARS,",
        "4, GOPINATHAN.M,(A4) AGED 66 YEARS,",
        "D/O.GOPINATHAN, CHITHIRA, MARUTHORVATTON.P.O.,",
        "MC.No",
        "3. ARUNIMA, AGED 31 YEARS,",
        "CHERTHALA, ALAPPUZHA DISTRICT(A2).",
        "W/O.GOPINATHAN, CHITHIRA, MARUTHORVATTON.P.O.,",
        "ARUN GOPI @ SABU(A1",
        "CHERTHALA, ALAPPUZHA DISTRICT.",
        "S/O.GOPINATHAN, CHITHIRA, MARUTHORVATTOM.P.O.,",
        "Beene",
        "ALAPPUZHA DISTRICT(A3",
        "CHERTHALA",
        "CHERTHALA, ALAPPUZHA DISTRICT(A3).",
        "S/O.MADHAVAN, CHITHIRA, MARUTHORVATTOM.P.O.,",
        "BRE"
    ],
    "respondents": [
        "HIGH COURT OF KERALA- 682 031.",
        "REPRESENTED BY THE PUBLIC PROSECUTOR,",
        "R1 BY PUBLIC PROSECUTOR SRI.JIBU.P. THOMAS",
        "STATE & COMPLAINANT (CW'):",
        "2. SANDHYA, AGED 33 YEARS,",
        "MARUTHORVATTOMN.P.O., CHERTHALA,",
        "1. STATE OF KERALA,",
        "ALAPPUZHA DISTRICT- 688 547.",
        "R2 BY ADV. SMT.V.PSATHI",
        "W/O.ARUN GOPI @ SABU, GOVINDALAYAM (GOVINDAVILASAM),"
    ],
    "sections": [
        "482",
        "34",
        "2015/KER/36",
        "406",
        "498A"
    ],
    "outcome": "Alappuzha, quashed",
    "full_text": "Beene\n= ve â€˜\nBl ees\n2015/KER/36\nIN THE HIGH COURT OF KERALA AT ERNAKULAM\nPRESENT:\nTHE HONOURABLE MR. JUSTICE B.KEMAL PASHA\nMONDAY, THE 5TH DAY OF JANUARY 2015/15TH POUSHA, 1936\nCri.MC.No. 7067 of 2014\nC.C.NO.2030/2014 OF JUDICIAL FIRST CLASS MAGISTRATE COURT- I, ALAPPUZHA\nPETITIONER(S)/ACCUSED :\n1. ARUN GOPI @ SABU(A1), AGED 38 YEARS,\nS/O.GOPINATHAN, CHITHIRA, MARUTHORVATTOM.P.O.,\nCHERTHALA, ALAPPUZHA DISTRICT.\n2. SARASWATHY GOPINATH, AGED 63 YEARS,\nW/O.GOPINATHAN, CHITHIRA, MARUTHORVATTON.P.O.,\nCHERTHALA, ALAPPUZHA DISTRICT(A2).\n3. ARUNIMA, AGED 31 YEARS,\nD/O.GOPINATHAN, CHITHIRA, MARUTHORVATTON.P.O.,\nCHERTHALA, ALAPPUZHA DISTRICT(A3).\n4, GOPINATHAN.M,(A4) AGED 66 YEARS,\nS/O.MADHAVAN, CHITHIRA, MARUTHORVATTOM.P.O.,\nCHERTHALA, ALAPPUZHA DISTRICT(A4).\nBY ADV. SRI.K.RAMANATHAN\nRESPONDENT(S)/STATE & COMPLAINANT (CW'):\n1. STATE OF KERALA,\nREPRESENTED BY THE PUBLIC PROSECUTOR,\nHIGH COURT OF KERALA- 682 031.\n2. SANDHYA, AGED 33 YEARS,\nW/O.ARUN GOPI @ SABU, GOVINDALAYAM (GOVINDAVILASAM),\nMARUTHORVATTOMN.P.O., CHERTHALA,\nALAPPUZHA DISTRICT- 688 547.\nR1 BY PUBLIC PROSECUTOR SRI.JIBU.P. THOMAS\nR2 BY ADV. SMT.V.PSATHI\nTHIS CRIMINAL MISC. CASE HAVING COME UP FOR ADMISSION\nON 05-01-2015, THE COURT ON THE SAME DAY PASSED THE FOLLOWING:\nMsd.\n\nScns toy\nBeka\n2015/KER/36\nCril.MC.No. 7067 of 2014\nAPPENDIX\nPETITIONER(S)' ANNEXURES :\nANNEXURE A1: THE TRUE COPY OF F.I.RIN CRIME NO.382/2014 OF\nMARARIKKULAM POLICE STATION.\nANNEXURE A2: THE TRUE COPY OF THE FINAL REPORT IN CRIME NO.382/2014\nOF MARARIKKULAM POLICE STATION IN C.C.NO.2030/14\nPENDING BEFORE THE JUDICIAL FIRST CLASS MAGISTRATE'S\nCOURT-I, ALAPPUZHA.\nANNEXURE A3: THE ORIGINAL AFFIDAVIT SWORN BY THE 2ND RESPONDENT\n(DEFACTO COMPLAINANT).\nRESPONDENT(S)\" ANNEXURES :\nNIL\nHTRUE COPY//\nP.A.TO JUDGE.\nMsd.\n\nBeal\nB. KEMAL PASHA, J. 201SIRERISG\nveneeene CE MC. NO-7067 OF 2014\nDated this the 5\" day of January, 2015\nORDER\nThis is a petition filed under Section 482 of the\nCode of Criminal Procedure.\n\n2. Petitioners are accused Nos.1 to 4 in Crime\nNo.382/2014 of Mararikkulam Police Station registered for\nthe offences punishable under Sections 498A and 406 read\nwith Section 34 of the Indian Penal Code.\n\n3. Petitioners have come up with this petition for\ngetting Annexure-A2 final report in Crime No.382/2014 of\nMararikkulam Police Station as against the petitioners and\nall further proceedings based on it in C.C.2030/2014\npending before the Judicial First Class Magistrate's Court-l,\nAlappuzha, quashed.\n\n4. The allegation against the petitioners is that they\nhave tortured and harassed the de facto complainant, who\nis the wife of the 1* petitioner, and treated her with cruelty\nwithin the meaning of Section 498A IPC, by demanding\nmore dowry after misappropriating her entire gold\n\nBRE\n2015/KER/36\nCrl.M.C.7067/2014 oe\nornaments and money,\n\n5. Heard learned counsel for the petitioners, the\nlearned counsel for the defacto complainant, who is the 2\"\nrespondent herein, and learned Public Prosecutor.\n\n6. According to the petitioners, all the matters in\ndispute between the petitioners and the defacto complainant\nhave been amicably settled and presently, the defacto\ncomplainant has no complaints against the petitioners and,\ntherefore, the proceedings against the petitioners may be\nquashed.\n\n7. The defacto complainant, who is the 2\"\nrespondent herein, has filed an affidavit affirming that all the\nmatiers in dispute between her and the petitioners have\nbeen amicably settled and, therefore, she has no complaints\nagainst the petitioners and, therefore, all further\nproceedings in the matter referred to above can be\nquashed. She has entered appearance through her\ncounsel. The learned counsel for the defacto complainant\n\nBeal\n2015/KER/36\nCrl.M.C.7067/2014 uae\nalso endorses the fact that the affidavit has been sworn in\nby the defacto complainant on her own volition.\n8. When all the matrimonial disputes have been\nsetiled between the parties and as the defacto complainant\nhas no complaints against the petitioners, it is only just and\nexpedient in the interest of justice to quash the proceedings\nreferred to above.\nIn the result, this Crl.M.C. is allowed and Annexure-A2\nfinal report in Crime No.382/2014 of Mararikkulam Police\nStation as against the petitioners and all further proceedings\nbased on it in C.C.2030/2014 pending before the Judicial\nFirst Class Magistrate's Court-l, Alappuzha are hereby\nquashed.\nSd/-\n(B.KEMAL PASHA, JUDGE)\naks/05/01\n\n"
}