{
    "case_id": "Crl.MC.No.839 OF 2013",
    "court": "HIGH COURT OF KERALA AT ERNAKULAM",
    "date": "FRIDAY",
    "judge": "Alappuzha",
    "petitioners": [
        "Kayamkulam",
        "Sd/-\nV.G.ARUN\nSB/08/01/2020",
        "KER/1221\nAPPENDIX",
        "SHYNI MANDIRAM",
        "AGED 40 YEARS",
        "JAYACHANDRAN",
        "VALLIKUNNAM , ALAPPUZHA",
        "ACCUSE NO.1:",
        "$/0.P.K.KOCHUKUNJU"
    ],
    "respondents": [
        "REP BY ITS GENERAL MANAGER IN CHARGE S.SREEKUMAR PIN",
        "1 STATE OF KERALA",
        "688 001",
        "2 ALAPPUZHA DISTRICT CO-OPERATIVE BANK",
        "REP BY THE PUBLIC PROSECUTOR HIGH COURT OF KERALA",
        "DE FACTO COMPLAINANT:",
        "OTHER PRESENT:",
        "SR.PP.C.S.HRITHWIK",
        "ERNAKULAM PIN 682031"
    ],
    "sections": [],
    "outcome": "Dated this the 8th day of January 2021\n\nThe Criminal M.C.is filed seeking to quash\nfurther proceedings in C.C.No.173/2012 on the files\nof the Judicial First Class Magistrate Court,\nKayamkulam, or in t",
    "full_text": "Dera)\nir |\nrcp aS vs\nIN THE HIGH COURT OF KERALA AT ERNAKULAM 2021U/KER/1221\nPRESENT\nTHE HONOURABLE MR.JUSTICE V.G.ARUN\nFRIDAY, THE O8TH DAY OF JANUARY 2021 / 18TH POUSHA, 1942\nCr1.MC.No.839 OF 2013\nAGAINST THE JUDGMENT IN CC 173/2012 OF JUDICIAL MAGISTRATE OF\nFIRST CLASS , KAYAMKULAM\nCRIME NO.54/2009 OF Vallikunnam Police Station , Alappuzha\nPETITIONER/ACCUSE NO.1:\nJAYACHANDRAN\nAGED 40 YEARS\n$/0.P.K.KOCHUKUNJU\nSHYNI MANDIRAM\nVALLIKUNNAM , ALAPPUZHA\nBY ADVS.\nSRI.R.SUNIL KUMAR\nSMT.A.SALINI LAL\nRESPONDENT/DE FACTO COMPLAINANT:\n1 STATE OF KERALA\nREP BY THE PUBLIC PROSECUTOR HIGH COURT OF KERALA\nERNAKULAM PIN 682031\n2 ALAPPUZHA DISTRICT CO-OPERATIVE BANK\nREP BY ITS GENERAL MANAGER IN CHARGE S.SREEKUMAR PIN\n688 001\nOTHER PRESENT:\nSR.PP.C.S.HRITHWIK\nTHIS CRIMINAL MISC. CASE HAVING COME UP FOR ADMISSION ON\n08.01.2021, THE COURT ON THE SAME DAY PASSED THE FOLLOWING:\n\nCrl.MC.No.839 OF 2013 2. 202UKER/1221\nORDER\n\nDated this the 8th day of January 2021\n\nThe Criminal M.C.is filed seeking to quash\nfurther proceedings in C.C.No.173/2012 on the files\nof the Judicial First Class Magistrate Court,\nKayamkulam, or in the alternative to issue a\ndirection to dispose the case at the earliest. Being a\nCriminal M.C. of the year 2013, pertaining to a crime\nof the year 2009, a report was called for from the\njurisdictional court.\n\n2. The learned Judicial First Class Magistrate\nKayamkulam has reported that certain documents\nwere sent to the Forensic Science Lab,\nThiruvananthapuram for verification of signature and\nreceived back only on 19.10.2020. In order to\nminimise the delay, the court commenced trial in the\n\nCrl.MC.No.839 OF 2013 3... 202UKER/1221\nyear 2017 itself and has examined 12 witnesses. It is\nreported that, as the report from the Forensic\nScience Lab has been received, the case can be\ndisposed of without further delay.\n\nThis is recorded and the Criminal M.C.is closed.\nSd/-\nV.G.ARUN\nSB/08/01/2020 JUDGE\n\neel\ncies ee\nCr1.MC.No.839 OF 2013 4... 2021/KER/1221\nAPPENDIX\n\nPETITIONERS EXTS:\n\nANNEXURE 1 COPY OF THE FIR IN CRIME NO.54/09 OF\nTHE VALLIKKUNNAM POLICH STATION.\n\nANNEXURE 2 COPY OF THE REPRESENTATION DATED\n13.1.09 FILED BY THE PETITIONER\nBEFORE THE REGISTRAR OF CO-OPERATIVE\nSOCIETIES.\n\nANNEXURE 3 COPY OF THE SUSPENSION ORDER DATED\n18.02.09.\n\nANNEXURE 4 COPY OF THE REPORT FILED BY THE\nDY.S.P.CRIME DETACHMENT BEFORE THE\nPETITIONS COMMITTEE.\n\nANNEXURE 5 COPY OF THE FINAL REPORT IN CRIME\nNO.54/09.\n\nANNEXURE 6 COPY OF THE ORDER DISMISSING THE\nDISCHARGE PETITION FILED BY THE\nPETITIONER.\n\nANNEXURE 7 COPY OF THE ORDER ALLOWING FURTHER\nINVESTIGATION BY THE JFMC,\nKAYAMRULAM .\n\nANNEXURE 8 COPY OF THE COUNTER FILED BY THE\nBANK IN WP(C) NO.13216/2010.\n\nANNEXURE 9 COPY OF THE REPLY GIVEN BY THE BANK\nAS PER RIGHT TO INFORMATION ACT.\n\n//true copy// P.A to Judge\n\n"
}