{
    "case_id": "",
    "court": "HIGH COURT OF KERALA AT ERNAKULAM\nPRESENT",
    "date": "MONDAY",
    "judge": "B. KEMAL PASHA",
    "petitioners": [
        "cau a\n",
        "B.KEMATL PASHA",
        "AGED 51YEARS, KUNNUMBRATH HOUSE,",
        "ANCHAMPEEDIKA PO,",
        "KUNNUMBRATH HOUSE, KALLIASSERY CENTRAL,",
        "KHADEEJA K.\n",
        "KUNNUMBRATH HOUSE",
        "JUDUCUAL",
        "FAIZAL P.\nAGED 51YEARS",
        "ANCHAMPEEDIKA PO, KANNUR DIST.",
        "1. SHAJAR K.",
        "(S) /ACCUSED:",
        "AGED 45 YEARS, W/O FAIZAL P,",
        "3. KHADEEJA K.",
        "CHOOTTUKADAN HOUSE",
        "J.\nar Peer",
        "KANNUR DIST.",
        "2. FAIZAL P.",
        "AGED 27 YEARS, S/O FAIZAL P,",
        "KALLIASSERY CENTRAL, ANCHAMPEEKIKA PO,",
        "jee",
        "KANNUR DISTRICT."
    ],
    "respondents": [
        "1. STATE OF KERALA",
        "R1 BY PUBLIC PROSECUTOR SMT SHEEBA.",
        "(S) /STATE & DE-FACTO COMPLAINANT. :",
        "REPRESENTED BY THE PUBLIC PROSECUTOR,",
        "HIGH COURT OF KERALA,",
        "2. MASNA C.K",
        "ERNAKULAM- 682031.",
        "CHOOTTUKADAN HOUSE, KAPPAKKADAVU,",
        "R2 BY ADV. SRI.M.SURESH KUMAR",
        "AZHEEKKAL PO, KANNUR TALUK,",
        "KANNUR DISTRICT, PIN-670009.",
        "AGED 24 YEARS, D/O SAKKARIYA E."
    ],
    "sections": [
        "482",
        "498A\nread with Section 34 of the Indian Penal Code",
        "2016/KER/33661",
        "498A"
    ],
    "outcome": "based on it, quashed",
    "full_text": "jee, cau a\n2016/KER/33661\nIN THE HIGH COURT OF KERALA AT ERNAKULAM\nPRESENT:\nTHE HONOURABLE MR. JUSTICE B.KEMATL PASHA\nMONDAY, THE 1ST DAY OF AUGUST 2016/10TH SRAVANA, 1938\nCr1.MC.No. 4239 of 2016\nCc 1230/2015 of JUDUCUAL FIRST CLASS MAGISTRATE COURT-1,KANNUR\nPETITIONER (S) /ACCUSED:\n1. SHAJAR K.\nAGED 27 YEARS, S/O FAIZAL P,\nKUNNUMBRATH HOUSE, KALLIASSERY CENTRAL,\nANCHAMPEEDIKA PO, KANNUR DIST.\n2. FAIZAL P.\nAGED 51YEARS, KUNNUMBRATH HOUSE,\nKALLIASSERY CENTRAL, ANCHAMPEEKIKA PO,\nKANNUR DIST.\n3. KHADEEJA K.\nAGED 45 YEARS, W/O FAIZAL P,\nKUNNUMBRATH HOUSE, KALLIASSERY CENTRAL,\nANCHAMPEEDIKA PO,\nKANNUR DISTRICT.\nBY ADVS.SRI.P.U.SHAILAJAN\nSMT .D.N.NISHANI\nRESPONDENT (S) /STATE & DE-FACTO COMPLAINANT. :\n1. STATE OF KERALA\nREPRESENTED BY THE PUBLIC PROSECUTOR,\nHIGH COURT OF KERALA,\nERNAKULAM- 682031.\n2. MASNA C.K\nAGED 24 YEARS, D/O SAKKARIYA E.\nCHOOTTUKADAN HOUSE, KAPPAKKADAVU,\nAZHEEKKAL PO, KANNUR TALUK,\nKANNUR DISTRICT, PIN-670009.\nR1 BY PUBLIC PROSECUTOR SMT SHEEBA.\nR2 BY ADV. SRI.M.SURESH KUMAR\nTHIS CRIMINAL MISC. CASE HAVING COME UP FOR ADMISSION\nON 01-08-2016, THE COURT ON THE SAME DAY PASSED THE\nFOLLOWING:\nK.V.\n\nple ae oH\n2016/KER/33661\nCRM(C) .NO4239/2016.\nAPPENDIX\nPETITIONER (S) 'ANNEXURE\nANNEXURE1: PHOTOCOPY OF THE COMPLAINT C.C.NO.1230/2015 FILED\nBEFORE THE JUDICIAL FIRST CLASS MAGISTRATE COURT, 1KANNUR\nBY THE 2ND RESPONDENT.\nANNEXURE11: AFFIDAVIT SWEARED BY THE 2ND RESPONDENT/DE-FACTO\nCOMPLAINANT .\nRESPONDENT (S)' ANNEXURE NIL\n/TRUE COPY/\nP.S.TO. JUDGE\nK.V.\n\nBasal\n2016/KER/33661\nB. KEMAL PASHA, J.\nar Peer aa\nORDER\n\nPetitioners are the accused in C.C.No.1230/2015\nbefore the Judicial First Class Magistrate's Court-l, Kannur,\nregistered for the offence punishable under Section 498A\nread with Section 34 of the Indian Penal Code.\n\n2. Petitioners have come up with this Crl.M.C. under\nSection 482 CrPC. for getting Annexure-| complaint in\nC.C.No.1230/2015 before the Judicial First Class\nMagistrate's Court-l, Kannur and all further proceedings\nbased on it, quashed.\n\n3. The allegation against the petitioners is that they\nhave tortured and harassed the defacto complainant, who is\nthe wife of the 1* accused, and treated her with cruelty\nwithin the meaning of Section 498A IPC, by demanding\nmore dowry, after misappropriating her entire gold\n\nBasal\n2016/KER/33661\nCRL.M.C.No. 4239 of 2016 uoe\nornaments and money,\n\n4. Heard learned counsel for the petitioners, the\nlearned counsel for the defacto complainant, who is the 2\"\nrespondent herein, and the learned Public Prosecutor.\n\n5. According to the petitioners, all the matters in\ndispute between the petitioners and the defacto complainant\nhave been amicably settled and presently the defacto\ncomplainant has no complaint against the petitioners and,\ntherefore, the proceedings against the petitioners may be\nquashed.\n\n6. The defacto complainant, who is the 2\"\nrespondent herein, has filed an affidavit affirming that all the\nmatiers in dispute between her and the petitioners have\nbeen amicably settled and, therefore, she has no complaint\nagainst the petitioners, and, hence, all further proceedings\nin the matter referred to above can be quashed. She has\nentered appearance through her counsel. The learned\ncounsel for the defacto complainant also endorses the fact\n\nLEER\n2016/KER/33661\nCRL.M.C.No. 4239 of 2016 uae\nthat the affidavit has been sworn in by the defacto\ncomplainant on her own volition. Therefore, it is only just\nand expedient in the interest of justice to quash the\nproceedings referred to above.\n\nIn the result, this Crl.M.C. is allowed and Annexure-l\ncomplaint in C.C.No.1230/2015 before the Judicial First\nClass Magistrate's Court-l, Kannur, and all further\nproceedings in C.C.No.1230/2015, as against the petitioners\nherein, are hereby quashed.\n\nSd/- B. KEMAL PASHA, JUDGE.\nul/-\n/{ true copy //\nPS. to Judge.\n\n"
}