{
    "case_id": "",
    "court": "HIGH COURT OF KERALA AT ERNAKULAM\nPRESENT\nTHE HONOURABLE MRS",
    "date": "2024",
    "judge": "Bee\nBeane\n",
    "petitioners": [
        "1ST ACCUSED:",
        "Aadhar Card",
        "SANTHANAMARTAMMAN KOVIL STREET",
        "THOMAS",
        "10/18, SANTHANAMARTAMMAN KOVIL STREET, VELLANGULI,",
        "Anna Nagar",
        "THIRUNELVELI, AMBASAMUDRAM, TAMIL NADU, PIN - 627426",
        "A. NAGESWARI@ ABINA AGED 36 YEARS W/O. ARUMUGAM,",
        "Tamil Nadu"
    ],
    "respondents": [
        "2 STATION HOUSE OFFICER VALIYATHURA POLICE",
        "1 STATE OF KERALA REPRESENTED BY PUBLIC PROSECUTOR, HIGH",
        "PP- SRI.PRASANTH M.P",
        "STATION, VALIYATHURA , THIRUVANANTHAPURAM, PIN - 695008",
        "COURT OF KERALA, PIN - 682031",
        "S /STATE/COMPLAINANT:"
    ],
    "sections": [
        "482"
    ],
    "outcome": "Dated this the 8\" day of January , 2024\n\nThis Crl.M.C., under Section 482 of Cr.P.C., is\nfiled by the first accused in crime No.978 of 2023 of\nValiyathura Police Station, Thiruvananthapuram, for a\ndir",
    "full_text": "Bee\nBeane\n2024/KERN254\nIN THE HIGH COURT OF KERALA AT ERNAKULAM\nPRESENT\nTHE HONOURABLE MRS. JUSTICE SOPHY THOMAS\nMONDAY, THE 8™ DAY OF JANUARY 2024 / 18TH POUSHA, 1945\nCRL.MC NO. 122 OF 2024\nCRIME NO.978/2023 OF Valiyathura Police Station,\nThiruvananthapuram\nPETITIONER/1ST ACCUSED:\nA. NAGESWARI@ ABINA AGED 36 YEARS W/O. ARUMUGAM,\n10/18, SANTHANAMARTAMMAN KOVIL STREET, VELLANGULI,\nTHIRUNELVELI, AMBASAMUDRAM, TAMIL NADU, PIN - 627426\nBY ADVS. AJAYA KUMAR. G FATHIMA MAJEED\nRESPONDENTS /STATE/COMPLAINANT:\n1 STATE OF KERALA REPRESENTED BY PUBLIC PROSECUTOR, HIGH\nCOURT OF KERALA, PIN - 682031\n2 STATION HOUSE OFFICER VALIYATHURA POLICE\nSTATION, VALIYATHURA , THIRUVANANTHAPURAM, PIN - 695008\nPP- SRI.PRASANTH M.P\nTHIS CRIMINAL MISC. CASE HAVING COME UP FOR ADMISSION ON\n08.01.2024, THE COURT ON THE SAME DAY PASSED THE FOLLOWING:\n\nTein\n2024/KERN254\nCri.M.C. NO.122 OF 2024\n2\nORDER\n\nDated this the 8\" day of January , 2024\n\nThis Crl.M.C., under Section 482 of Cr.P.C., is\nfiled by the first accused in crime No.978 of 2023 of\nValiyathura Police Station, Thiruvananthapuram, for a\ndirection to the Judicial First Class Magistrate Court-XI,\nThiruvananthapuram, to permit the petitioner to execute\nbail bond as per Annexure Al order dated 09.11.2023,\nafter accepting her Aadhar Card as identity proof.\n\n2. According to the petitioner, she has got an alias\nname as Abina, and in the FIR, her name and address were\nshown as “Abina, D/O Kalapathi, Door No.13, Anna Nagar,\nThuthukudi, Tamil Nadu”. When she produced her Aadhar\nCard for executing the bond as per Annexure Ai order, her\naddress was shown as “A.Nageswari, W/O Arumugam,\n10/18, Santhanamariamman  Kovil Street, Vellanguli,\nTirunelveli. Since there was change in the name and\naddress, learned Magistrate not permitted her to execute\n\nap\n2024/KER/1254\nCrl.M.C. NO.122 OF 2024\n3\n\nthe bond as per Annexure Al order. Learned counsel for\nthe petitioner would submit that the petitioner filed\nAnnexure A3 application before Judicial First Class\nMagistrate Court-XI, Thiruvananthapuram, for permitting\nher to execute the bail bond on accepting her Aadhar Card.\n\n3. Since her address in the FIR and Aadhar Card are\nentirely different, learned Magistrate is justified in not\npermitting her to execute the bond as per Annexure Al\norder. Learned Magistrate has to obtain a report from the\nInvestigating Officer in crime No.978 of 2023, as to the\ncorrect name and address of the 1* accused in crime\nNo.978 of 2023, whether she has got an alias name as\n‘Abina’ etc. The petitioner is also at liberty to produce ‘one\nand the same certificate’ obtained from Village Office\nconcerned to show that the accused in the FIR and the\nperson in Annexure A2 Aadhar Card are one and the same\nperson. Learned Magistrate has to obtain the report from\nthe Investigating Officer within 10 days from today, and\nthe petitioner also can produce ‘one and the same\n\nTein\n2024/KERN254\nCri.M.C. NO.122 OF 2024\n4\n\ncertificate’ before the learned Magistrate within that time.\nOn getting either of these documents, learned Magistrate\nhas to dispose Annexure A3 petition filed by the petitioner,\nwithin 10 days thereafter.\n\nRegistry to forward a copy of this order to the\ntrial court forthwith. With these directions this Crl.M.C. is\ndisposed of.\n\nSd/-\nSOPHY THOMAS\nJUDGE\n\nSSK/08/01\n\nie eel\nBeans\n2024/KER/1254\nCrl.M.C. NO.122 OF 2024\n5\nAPPENDIX OF CRL.MC 122/2024\nPETITIONER ANNEXURES\nAnnexure Al TRUE COPY OF THE ORDER DATED 09-11-2023 IN CRL MP\nNO. 4749/2023 OF THE JUDICIAL FIRST CLASS\nMAGISTRATE COURT XI, THIRUVANANTHAPURAM\nAnnexure A2 TRUE COPY OF THE AADHAAR CARD OF THE PETITIONER\nAnnexure A3 TRUE COPY OF THE PETITION FILED BY THE PETITIONER\nDATED 24-11-2023 BEFORE THE JUDICIAL FIRST CLASS\nMAGISTRATE COURT XI, THIRUVANANTHAPURAM\n\n"
}