{
    "case_id": "Crl.MC.No.4434 OF 2020(D)",
    "court": "HIGH COURT OF KERALA AT ERNAKULAM\nPRESENT\nTHE HONOURABLE MR",
    "date": "2021",
    "judge": "SRI.RENJITH B.MARAR\nSMT",
    "petitioners": [
        "S:",
        "MOTHER) .",
        "AHMED NAGARA",
        "1 BINDU PRAMOD PANICKER",
        "AGED 58 YEARS",
        "NEELIKULAM MURI, KULASEKHARAPURAM,",
        "KARUNAGAPPALLY, (REPRESENTED BY HER NEXT FRIEND AND",
        "2 ASSINI KUMARI,",
        "AGED 27 YEARS",
        "PETER",
        "Sd/-\nP.V.KUNHIKRISHNAN",
        "KARUNAGAPPALY-690544.",
        "CHEMBAKASSERY THARAYIL HOUSE, NEELIKULAM MURI,",
        "W/O. PURUSHOTHAMAN, CHEMBAKASSERY THARAYIL HOUSE,"
    ],
    "respondents": [
        "S:",
        "HIGH COURT OF KERALA, ERNAKULAM-682031.",
        "KOPARGAON, AHMED NAGARA, MAHARASHTRA-423601.",
        "S.G. VIDHYALAYA HOUSE, GANDHI NAGAR,",
        "1 STATE OF KERALA,",
        "2 PRAMOD V. PANICKER,",
        "REPRESENTED BY PUBLIC PROSECUTOR,",
        "AGED 43 YEARS, S/O. VIDYADHARAN PACNICKAR,"
    ],
    "sections": [],
    "outcome": "Dated this the 8th day of January 2021\n\nThis petition is filed to issue appropriate direction to the\nlower court to take steps to execute Annexure A8 order.\n\nWhen this matter came up for consideration",
    "full_text": "aa\n, ety |\nBe het Sek\nBehe\n2021/KER/1280\nIN THE HIGH COURT OF KERALA AT ERNAKULAM\nPRESENT\nTHE HONOURABLE MR. JUSTICE P.V.KUNHIKRISHNAN\nFRIDAY, THE 08TH DAY OF JANUARY 2021 / 18TH POUSHA, 1942\nCrl1.MC.No.4434 OF 2020(D)\nAGAINST THE JUDGMENT IN MC 45/2016 OF JUDICIAL MAGISTRATE OF\nFIRST CLASS - I, KARUNAGAPPALLY\nPETITIONER/S:\n1 BINDU PRAMOD PANICKER\nAGED 27 YEARS\nCHEMBAKASSERY THARAYIL HOUSE, NEELIKULAM MURI,\nKARUNAGAPPALLY, (REPRESENTED BY HER NEXT FRIEND AND\nMOTHER) .\n2 ASSINI KUMARI,\nAGED 58 YEARS\nW/O. PURUSHOTHAMAN, CHEMBAKASSERY THARAYIL HOUSE,\nNEELIKULAM MURI, KULASEKHARAPURAM,\nKARUNAGAPPALY-690544.\nBY ADVS.\nSRI.RENJITH B.MARAR\nSMT .LAKSHMI .N.KAIMAL\nRESPONDENT/S:\n1 STATE OF KERALA,\nREPRESENTED BY PUBLIC PROSECUTOR,\nHIGH COURT OF KERALA, ERNAKULAM-682031.\n2 PRAMOD V. PANICKER,\nAGED 43 YEARS, S/O. VIDYADHARAN PACNICKAR,\nS.G. VIDHYALAYA HOUSE, GANDHI NAGAR,\nKOPARGAON, AHMED NAGARA, MAHARASHTRA-423601.\nSRI.SANTOSH PETER, SR.PP\nTHIS CRIMINAL MISC. CASE HAVING BEEN FINALLY HEARD ON\n08.01.2021, THE COURT ON THE SAME DAY PASSED THE FOLLOWING:\n\nBel\noR\nCrl.MC.No.4434 OF 2020(D) 2 2021/KER/1280\nORDER\nDated this the 8th day of January 2021\n\nThis petition is filed to issue appropriate direction to the\nlower court to take steps to execute Annexure A8 order.\n\nWhen this matter came up for consideration today, it is seen\nreported by the lower court that, Annexure A8 order is already\nset aside in Crl.A No.163/2019 by the II Additional Sessions\nJudge, Kollam. In the light of the above judgment, I think this\nCriminal Miscellaneous Case need not be kept pending.\n\nTherefore, this Crl.M.C is closed.\n\nSd/-\nP.V.KUNHIKRISHNAN\nJUDGE\nab\n\ney ited\nBases\nCr1.MC.No.4434 OF 2020(D) 3 2021/KER/1280\nAPPENDIX\nPETITIONER'S/S EXHIBITS:\nANNEXURE Al TRUE COPY OF THE ORDER DATED 25/02/2013\nIN SLP CIVIL NO. 8254/2013.\nANNEXURE A2 TRUE COPY OF THE ORDER DATED 20/09/2013\nIN SLP CIVIL NO.8254/2013.\nANNEXURE A3 TRUE COPY OF THE ORDER DATED 30/07/2014\nIN SLP CIVIL NO.8254/2013.\nANNEXURE A4 TRUE COPY OF THE ORDER DATED 25/08/2014\nIN SLP CIVIL NO.8254/2013.\nANNEXURE A5 TRUE COPY OF THE ORDER DATED 26/02/2014\nIN CRL. MP NO.57/2014 IN MC NO.357/2013.\nANNEXURE A6 TRUE COPY OF THE ORDER DATED 19/01/2015\nIN SLP NO.8254/2013.\nANNEXURE A7 TRUE COPY OF THE ORDER DATED 16/02/2015\nIN CIVIL APPEAL NO.2000/2015 PASSED BY\nTHE HON'BLE SUPREME COURT.\nANNEXURE A8 TRUE COPY OF THE ORDER IN MC 45/2016\nDATED 31/03/2016 PASSED BY THE JUDICIAL\nFIRST CLASS MAGISTRATE COURT,\nKARUNAGAPPALLY .\nRESPONDENTS ANNEXURES: NIL\n//TRUE COPY//\nP.A TO JUDGE\nab\n\n"
}