{
    "case_id": "Crl.MC.No.8218 OF 2019(F)",
    "court": "HIGH COURT OF KERALA AT ERNAKULAM",
    "date": "MONDAY",
    "judge": "Kozhikode",
    "petitioners": [
        "S:",
        "KUTTIADY P. O., KOZHIKODE DISTRICT.",
        "Kozhikode",
        "AGED 25 YEARS",
        "KUTTIYADY P. O.",
        "KUTTIADY P. O.",
        "FAIZAL",
        "S/O. KUNJAMMAD, RESIDING AT AMBALAKANDY HOUSE,"
    ],
    "respondents": [
        "S:",
        "S/O. POKKAN, RESIDING AT PAIKKATTUMMAL (VATTAKKUNI) ,",
        "RAMESH CHAND-P.P",
        "AGED 51 YEARS",
        "1 STATE OF KERALA",
        "KUTTIADY POLICE STATION, KUTTIADY P. 0O., KOZHIKODE",
        "KUTTIYADY P. O., ADUKKATH, KOZHIKODE DISTRICT - 673",
        "REPRESENTED BY THE PUBLIC PROSECUTOR, HIGH COURT OF",
        "2 THE SUB INSPECTOR OF POLICE",
        "OTHER PRESENT:",
        "R3 BY ADV. R.SREEHARI",
        "DISTRICT - 673 508.",
        "3 V.K.CHANDRAN",
        "KERALA, ERNAKULAM - 682 031.",
        "508."
    ],
    "sections": [
        "323",
        "482",
        "341",
        "143",
        "308",
        "147",
        "308 r/w Section 149 of IPC",
        "324",
        "148"
    ],
    "outcome": "/JUDGMENT IN LP 22/2017 OF FIRST ADDITIONAL\nDISTRICT AND SESSIONS COURT, KOZHIKODE\nCRIME NO.517/2014 OF Kuttiyadi Police Station , Kozhikode\nPETITIONER/S:\nFAIZAL\nAGED 25 YEARS\nS/O. KUNJAMMAD, RESIDING",
    "full_text": "Rava\nBe eee a\nBs\nIN THE HIGH COURT OF KERALA AT ERNAKULAM 2020/KER/IS6\nPRESENT\nTHE HONOURABLE MR. JUSTICE ASHOK MENON\nMONDAY, THE O6TH DAY OF JANUARY 2020 / 16TH POUSHA, 1941\nCri .MC.No.8218 OF 2019(F)\nAGAINST THE ORDER/JUDGMENT IN LP 22/2017 OF FIRST ADDITIONAL\nDISTRICT AND SESSIONS COURT, KOZHIKODE\nCRIME NO.517/2014 OF Kuttiyadi Police Station , Kozhikode\nPETITIONER/S:\nFAIZAL\nAGED 25 YEARS\nS/O. KUNJAMMAD, RESIDING AT AMBALAKANDY HOUSE,\nKUTTIADY P. O., KOZHIKODE DISTRICT.\nBY ADVS.\nSRI .ANOOP .V.NATIR\nSHRI .NIKITHA ANTONY\nRESPONDENT/S:\n1 STATE OF KERALA\nREPRESENTED BY THE PUBLIC PROSECUTOR, HIGH COURT OF\nKERALA, ERNAKULAM - 682 031.\n2 THE SUB INSPECTOR OF POLICE\nKUTTIADY POLICE STATION, KUTTIADY P. 0O., KOZHIKODE\nDISTRICT - 673 508.\n3 V.K.CHANDRAN\nAGED 51 YEARS\nS/O. POKKAN, RESIDING AT PAIKKATTUMMAL (VATTAKKUNI) ,\nKUTTIYADY P. O., ADUKKATH, KOZHIKODE DISTRICT - 673\n508.\nR3 BY ADV. R.SREEHARI\nOTHER PRESENT:\nRAMESH CHAND-P.P\nTHIS CRIMINAL MISC. CASE HAVING COME UP FOR ADMISSION ON\n06.01.2020, THE COURT ON THE SAME DAY PASSED THE FOLLOWING:\n\nHees\nCrl.MC.No.8218 OF 2019(F) 2 2020/KER/156\nORDER\nDated this the 6th day of January 2020\n\nPetitioner is the 1% accused in Crime No.517/2014 of\nKuttiady Police Station presently pending before the i*\nAdditional District and Sessions Court, Kozhikode as LP\nNo.22/2017 for having allegedly committed offences\npunishable under Sections 143, 147, 148, 341, 323, 324 and\n308 r/w Section 149 of IPC.\n\n2. The only de facto complainant is the 3\" respondent,\nwho has appeared through counsel and filed affidavit to the\neffect that the matter has been amicably settled with the\npetitioner and he does not have any grievance whatsoever\nagainst the petitioner A report has been filed by the\ninvestigating officer to the effect that the petitioner has eight\nother crimes registered against him, which also includes\noffences punishable under Sections 308 and 324 of IPC. Going\nby the description of the offence in the final report, it is seen\nthat the injury allegedly sustained by the de facto complainant\nis not life threatening and it does not attract the offence under\nSection 308 in the strict sense.\n\nDeen\nCrl.MC.No.8218 OF 2019(F) 3 2020/KER/156\n\n3. In view of the fact that the 3 respondent has settled\nthe matter as against the 1* accused, no purpose will be\nserved by proceeding with the trial as against him. The fact\nthat the petitioner has criminal antecedents alone will not\nstand in the way to quash the proceedings against the\npetitioner. There is no public interest involved.\n\nIn the result, the Crl.M.C is allowed and the entire\nproceedings as against the petitioner in Crime No.517/2014 of\nKuttiady Police Station presently pending against the petitioner\nas L.P. No.22/2017 on the files of the 1* Additional District and\nSessions Court, Kozhikode stands quashed under Section 482\nof Cr.P.C. and the accused is discharged.\n\nSd/-\nASHOK MENON\nJUDGE\n\nPa a\nEt eee\nme tae\nel\n|\nCrl.MC.No.8218 OF 2019(F) 4 2020/KER/156\nAPPENDIX\nPETITIONER'S/S EXHIBITS:\nANNEXURE I TRUE COPY OF THE FINAL REPORT IN THE\nABOVE CRIME FILED BY THE 2ND\nRESPONDENT BEFORE THE COURT BELOW.\nANNEXURE IT TRUE COPY OF THE AFFIDAVIT ENTERED BY\nTHE 3RD RESPONDENT IN THE MATTER\nSHOWING THAT THE MATTER IS SETTLED,\nDATED 12.11.2019.\n\n"
}