{
    "case_id": "Crl.MC.No. 25 of 2014 ()",
    "court": "HIGH COURT OF KERALA AT ERNAKULAM\nPRESENT",
    "date": "2014",
    "judge": "MC.No",
    "petitioners": [
        "MC.No",
        "Biehl",
        "CHEMMARASERIPARA,AZHIKODU,",
        "AZHIKODU",
        "MARSHANA MANZIL",
        "MOIDU V.P.U AGED 50 YEARS,",
        "S/O.M.T.P.ABDULLA, MARSHANA MANZIL,",
        "KANNUR DISTRICT.",
        "/ ACCUSED:-"
    ],
    "respondents": [
        "PUBLIC PROSECUTOR,",
        "REPRESENTED BY THE,",
        "4,STAR APARTMENT, PANNENPARA,",
        "HIGH COURT OF KERALA,",
        "R2 BY ADV. SRI.S.KANNAN",
        "D/O. VENUGOPAL, RESIDING AT",
        "VALLIKUNNU, KANNUR DISTRICT.670 306",
        "1. STATE OF KERALA,",
        "2. SEENA M.K, AGED 46 YEARS,",
        "/ STATE /COMPLAINANT:-",
        "Ri BY PUBLIC PROSECUTOR SRI .DHANESH MATHEW",
        "ERNAKULAM."
    ],
    "sections": [
        "482",
        "354(A)"
    ],
    "outcome": "Kannur quashed",
    "full_text": "Pagel\nne\nBl et\n2014/KER/212\nIN THE HIGH COURT OF KERALA AT ERNAKULAM\nPRESENT:\nTHE HONOURABLE MR.JUSTICE P.BHAVADASAN\nTHURSDAY, THE 2ND DAY OF JANUARY 2014/12TH POUSHA, 1935\nCrl.MC.No. 25 of 2014 ()\n(AGAINST CC 1117/2013 OF JUDICIAL FIRST CLASS MAGISTRATE'S COURT.-I\nKANNUR)\nPETITIONER / ACCUSED:-\nMOIDU V.P.U AGED 50 YEARS,\nS/O.M.T.P.ABDULLA, MARSHANA MANZIL,\nCHEMMARASERIPARA,AZHIKODU,\nKANNUR DISTRICT.\nBY ADVS.SRI.P.N.SUKUMARAN\nSRI.K.A.ANAS\nRESPONDENT / STATE /COMPLAINANT:-\n1. STATE OF KERALA,\nREPRESENTED BY THE,\nPUBLIC PROSECUTOR,\nHIGH COURT OF KERALA,\nERNAKULAM.\n2. SEENA M.K, AGED 46 YEARS,\nD/O. VENUGOPAL, RESIDING AT\n4,STAR APARTMENT, PANNENPARA,\nVALLIKUNNU, KANNUR DISTRICT.670 306\nRi BY PUBLIC PROSECUTOR SRI .DHANESH MATHEW\nR2 BY ADV. SRI.S.KANNAN\nTHIS CRIMINAL MISC. CASE HAVING COME UP FOR ADMISSION\nON 02-01-2014, THE COURT ON THE SAME DAY PASSED THE FOLLOWING:-\nKKS\n\nPagel\nne\nBl et\n2014/KER/212\nCrl.MC.No. 25 of 2014 ()\nAPPENDIX\nPETITIONER(S)’ EXHIBITS:-\nANNEXURE-A1: CHARGE SHEET IN C.C.NO.1117/2013 OF JFCM -I, KANNUR.\nANNEXURE-A2: AFFIDAVIT SWORN BY THE 2ND RESPONDENT.\nANNEXURE-A3: COMPROMISE PETITION SIGNED BY THE PETITIONER AND\nTHE SECOND RESPONDENT.\nRESPONDENT(S)' EXHIBITS:- NIL\nHTRUE COPY//\nP.S.TO JUDGE\nKKS\n\n2014/KER/212\nP.BHAVADASAN, J.\n~—CrLM.C.No. 25 of 2014\nDated this the 02” day of January, 2014\nORDER\n\nThis is a petition filed under Section 482 of Cr.P.C.\nseeking to have all further proceedings in C.C.No. 1117 of\n2013 pending before Judicial First Class Magistrate's Court-l,\nKannur quashed.\n\n2. The petitioner stands accused of having\ncommitted the offence punishable under Section 354(A) of\nIPC in Crime No. 850/2013 of Kannur Town Police Station.\nAfter investigation, final report was laid and cognizance of\nthe offence was taken as C.C.No. 1117 of 2013.\n\n3.  Itis unnecessary to go into the facts and details of\nthe case for the simple reason that the petitioner has chosen\nto implead the defacto complaint/victim as the second\nrespondent who has entered appearance through a counsel\nand who accepts that the Annexure-A2 affidavit filed along\nwith this petition is one sworn to by the second respondent\n\nBiehl\nee\nElz ere\n2014/KER/212\nCrl.M.C. No.25/2014\n-2-\nherself and she stands by the statements contained therein.\n\n4. On going through affidavit, it is seen that the\nparties have settled all their differences and issues between\nthem and the victim has no further grievance in the matter.\nlt is pointed out that she is disinterested in continuing the\nproceedings.\n\n6. In the light of the above stand taken by the de\nfacto complainant, it is felt that continuance of the\nproceedings will only be an exercise in futility.\n\nHence, this petition is allowed. All further proceedings\nin C.C.No. 1117 of 2013 pending before Judicial First Class\nMagistrate's Court-l, Kannur including the final report based\non which cognizance was taken shall stand quashed and the\npetitioner shall stand discharged.\n\nSd/-\nP.BHAVADASAN\nJUDGE\nds\n\n"
}