{
    "case_id": "",
    "court": "HIGH COURT OF KERALA AT ERNAKULAM\nPRESENT",
    "date": "1 day of August, 2016",
    "judge": "FORT KOCHI",
    "petitioners": [
        "ATHIRAMPUZHA, KOTTAYAM.",
        "62/KANDANAMKUZHIYIL,",
        "PIN-682001",
        "$/O.MUHAMMED JAMAL,",
        "(S) /CLAIM PETITIONERS:",
        "KANJIRAMATTOM P.O, ERNAKULAM.",
        "Burk",
        "M.C.No.2472/2016",
        "$/O.ALI KUNJU, PALLIKUNNEL HOUSE,",
        "1. SHANMON, AGED 25 YEARS,",
        "2. JABBAR P A, AGED 50 YEARS,"
    ],
    "respondents": [
        "MULANTHURUTHY, PIN-682314.",
        "FORT KOCHI, PIN-682001,",
        "2.THE REVENUE DIVISIONAL OFFICER,",
        "1.STATE OF KERALA, REPRESENTED BY",
        "3.SUB INSPECTOR OF POLICE",
        "PALURUTHI, KOCHI, PIN-682006.",
        "(S) /STATE/RESPONDENTS :",
        "THE SUB INSPECTOR OF POLICE,"
    ],
    "sections": [
        "451"
    ],
    "outcome": "application has not been considered and disposed",
    "full_text": "Beare ha\nLe\nBleck\n2016/KER/33669\nIN THE HIGH COURT OF KERALA AT ERNAKULAM\nPRESENT:\nTHE HONOURABLE MR. JUSTICE RAJA VIJAYARAGHAVAN V\nMONDAY, THE 1ST DAY OF AUGUST 2016/10TH SRAVANA, 1938\nCr1.MC.No. 4844 of 2016 ()\nC.M.P.NO.1164/2016 IN CRIME NO.84/2016 OF MULANTHURUTHY POLICE\nSTATION & FIR NO.211/2016 OF PALLURUTHY POLICE STATION,\nERNAKULAM.\nPETITIONER (S) /CLAIM PETITIONERS:\n1. SHANMON, AGED 25 YEARS,\n$/O.MUHAMMED JAMAL,\n62/KANDANAMKUZHIYIL,\nATHIRAMPUZHA, KOTTAYAM.\n2. JABBAR P A, AGED 50 YEARS,\n$/O.ALI KUNJU, PALLIKUNNEL HOUSE,\nKANJIRAMATTOM P.O, ERNAKULAM.\nBY ADVS.SMT.AYSHA YOUSEFF\nSMT .MOLLY JACOB\nSRI.JOBI .A.THAMPT\nSMT.M.KABANI DINESH\nSRI.SHOUKATH HUSAIN\nSMT.PRIYANKA SEBASTIAN\nSMT.ASHIFA TAHTB\nSRI.C.M.EBRAHIM\nRESPONDENT (S) /STATE/RESPONDENTS :\n1.STATE OF KERALA, REPRESENTED BY\nTHE SUB INSPECTOR OF POLICE,\nMULANTHURUTHY, PIN-682314.\n2.THE REVENUE DIVISIONAL OFFICER,\nFORT KOCHI, PIN-682001,\n3.SUB INSPECTOR OF POLICE\nPALURUTHI, KOCHI, PIN-682006.\nBY PUBLIC PROSECUTOR SMT. PUSHPALATH\nTHIS CRIMINAL MISC. CASE HAVING COME UP FOR ADMISSION\nON 01-08-2016, THE COURT ON THE SAME DAY PASSED THE\nFOLLOWING:\nmbr/\n\n| aE ye\nLS\nBurk:\n2016/KER/33669\nCr1.MC.No. 4844 of 2016 ()\nAPPENDIX\nPETITIONER (S) ' ANNEXURES:\nANNEXURE 1 : PHOTO COPY OF THE FIR NO 84/2016 OF THE JUDICIAL\nFIRST CLASS MAGISTRATE COURT, PIRAVOM\nON 24/1/2016.\nANNEXURE 2 : PHOTO COPY OF THE FIR NO 211 OF 2016.\nANNEXURE 3 : COPY OF THE ORDER DTD 27TH JUNE 2016 IN\nCRMC 2472/2016.\nANNEXURE 4 : TRUE COPY OF THE LETTER DID 7/7/2016 TO THE SHO\nPALLURUTHY, KASABA POLICE STATION.\nANNEXURE 5 : COPY OF PETITION FILED UNDER SECTION 451 OF CRPC\nFOR INTERIM CUSTODY OF VEHICLE.\nRESPONDENT (S)' ANNEXURES: NIL\n//TRUE COPY//\nP.S. TO JUDGE\nmbr/\n\n.\nbales\n2016/KER/33669\nRAJA VIJAYARAGHAVAN.Y, J\nDated this the 1 day of August, 2016\nORDER\n1.By order dated 27.6.2016 in Crl.M.C.No.2472/2016, the\norder dismissing the application filed by the petitioners\nseeking interim custody of a vehicle was set aside and the\nlearned Magistrate was directed to pass appropriate\norders for releasing the vehicle to the ist petitioner subject\nto appropriate conditions. The grievance of the petitioners\nis that in spite of specific orders being passed, the said\napplication has not been considered and disposed of till\ndate.\n2.The learned counsel also submits that the said application\nnow stands posted to 9.8.2016. As per the earlier order\nwhich is produced as Annexure-3, the Sub Inspector of\nPolice, Kasaba Police Station was also directed to report\n\ngare]\nBES,\n2016/KER/33669\nCrl.M.C.4844/2016 2\nseizure of the vehicle before the learned Magistrate.\nHaving regard to the facts and circumstances, I direct the\nlearned Magistrate to pass orders as directed in Annexure-\n3 on 9.8.2016 itself and grant interim custody of the\nvehicle to the _ petitioners subject to appropriate\nconditions.\nPetition is disposed of as above.\nSd/-\nRAJA VIJAYARAGHAVAN.Y.\nJUDGE\nvps\n\n"
}