{
    "case_id": "Crl.MC.No.6910 OF 2019(C)",
    "court": "HIGH COURT OF KERALA AT ERNAKULAM",
    "date": "2020",
    "judge": "Malappuram",
    "petitioners": [
        "2 HARRIS, AGED 25 YEARS",
        "S/O.MOHAMMED, CHULLIYAN HOUSE, CHIRAYIL.P.O.",
        "Baal",
        "S/O.MOITHEEN KUTTY, ALUMKUZHIYATTIL HOUSE,",
        "V.K.",
        "KARIPPUR.P.O.",
        "S/O.MOHAMMED, CHALIKANICHIRI HOUSE, CHERALAPPALAM,",
        "S /ACCUSED :",
        "THARAYITTAL, KARIPPUR.P.O.",
        "3 MOHAMMED SUHAIL, AGED 22 YEARS",
        "CHULLIYAN HOUSE",
        "MALAPPURAM DISTRICT-673638",
        "1 VEERAN KUTTY, AGED 24 YEARS"
    ],
    "respondents": [
        "POLICE STATION, MALAPPURAM DISTRICT)",
        "2 MOHAMMED ASIF ALI V.K.,",
        "R2 BY ADV. VINOD KUMAR.C",
        "ERNAKULAM- 682031. (CRIME NO.107/2017 OF KARIPPUR",
        "S/STATE & DEFACTO COMPLAINANT:",
        "AGED 28 YEARS, S/O.BEERAN KUTTY, VELLAKKADAN HOUSE,",
        "OTHER PRESENT:",
        "1 STATE OF KERALA,",
        "PERUVALLUR.P.O., MALAPPURAM DISTRICT-673638.",
        "Manjeri",
        "REP. BY PUBLIC PROSECUTOR, HIGH COURT OF KERALA,"
    ],
    "sections": [
        "323",
        "482",
        "341",
        "34",
        "294(b)",
        "427"
    ],
    "outcome": "/JUDGMENT IN CC 1147/2017 OF JUDICIAL MAGISTRATE\nOF FIRST CLASS-I,MANJERI\nCRIME NO.107/2017 OF KARIPUR POLICE STATION, Malappuram\nPETITIONERS /ACCUSED :\n1 VEERAN KUTTY, AGED 24 YEARS\nS/O.MOITHEEN KUTT",
    "full_text": "Baal\nines\nIN THE HIGH COURT OF KERALA AT ERNAKULAM 2020/KERI774\nPRESENT\nTHE HONOURABLE MR. JUSTICE ASHOK MENON\nWEDNESDAY, THE 08TH DAY OF JANUARY 2020 / 18TH POUSHA, 1941\nCrl.MC.No.6910 OF 2019(C)\nAGAINST THE ORDER/JUDGMENT IN CC 1147/2017 OF JUDICIAL MAGISTRATE\nOF FIRST CLASS-I,MANJERI\nCRIME NO.107/2017 OF KARIPUR POLICE STATION, Malappuram\nPETITIONERS /ACCUSED :\n1 VEERAN KUTTY, AGED 24 YEARS\nS/O.MOITHEEN KUTTY, ALUMKUZHIYATTIL HOUSE,\nTHARAYITTAL, KARIPPUR.P.O.\n2 HARRIS, AGED 25 YEARS\nS/O.MOHAMMED, CHULLIYAN HOUSE, CHIRAYIL.P.O.\n3 MOHAMMED SUHAIL, AGED 22 YEARS\nS/O.MOHAMMED, CHALIKANICHIRI HOUSE, CHERALAPPALAM,\nKARIPPUR.P.O.\nBY ADVS.\nSRI.S.RAJEEV\nSRI.K.K.DHEERENDRAKRISHNAN\nSRI.V.VINAY\nSRI.D.FEROZE\nSRI.K.ANAND (A-1921)\nRESPONDENTS/STATE & DEFACTO COMPLAINANT:\n1 STATE OF KERALA,\nREP. BY PUBLIC PROSECUTOR, HIGH COURT OF KERALA,\nERNAKULAM- 682031. (CRIME NO.107/2017 OF KARIPPUR\nPOLICE STATION, MALAPPURAM DISTRICT)\n2 MOHAMMED ASIF ALI V.K.,\nAGED 28 YEARS, S/O.BEERAN KUTTY, VELLAKKADAN HOUSE,\nPERUVALLUR.P.O., MALAPPURAM DISTRICT-673638.\nR2 BY ADV. VINOD KUMAR.C\nOTHER PRESENT:\nSRI.B.JAYASURYA SR PP\nTHIS CRIMINAL MISC. CASE HAVING COME UP FOR ADMISSION ON\n08.01.2020, THE COURT ON THE SAME DAY PASSED THE FOLLOWING:\n\n2\n2020/KER/774\nCrl.MC 6910/2019\n-2-\nORDER\nDated this the 8th day of January 2020\n\nPetitioners are accused in CC No.1147/2017 on the\nfiles of the Judicial First Class Magistrate's Court-\nI, Manjeri for having allegedly committed offences\npunishable under Sections 341, 323, 427, 294(b) read\nwith Section 34 IPC.\n\n2. The defacto complainant is the second\nrespondent. He has appeared through counsel and filed\naffidavit to the effect that the matter has been\namicably settled with the petitioners and that he has\nno grievance against them. A report to that effect\nhas also been obtained from the investigating officer\nthrough the learned Senior Public Prosecutor. The\npetitioners do not have any criminal antecedents. No\npublic interest is involved.\n\nIn the result, the Criminal M.c. is allowed and\nthe entire proceedings as against the petitioners\nherein in CC No.1147/2017 on the files of the Judicial\nFirst Class Magistrate's Court-I, Manjeri shall stand\n\nBier\n\n. c\n\nEl a B\n\n2020/KER/774\nCrl.MC 6910/2019\n-3-\nquashed under Section 482 Ccr.PC and the\npetitioners/accused are discharged.\nSd/-\nASHOK MENON\nJUDGE\n\nIg\n\nBaal\nines\n2020/KER/774\nCr1l.MC 6910/2019\n-4-\nAPPENDIX\nPETITIONER'S/S EXHIBITS:\nANNEXURE I CERTIFIED COPY OF THE FINAL REPORT IN\nCRIME NO.107/2017 OF KARIPPUR POLICE\nSTATION PRESENTLY CC.NO.1147/17 ON THE\nFILE OF THE JUDICIAL MAGISTRATE OF\nFIRST CLASS-I, MANJERI.\nANNEXURE II AFFIDAVIT DATED 2.10.2019 SWORN BY THE\nSECOND RESPONDENT.\n\n"
}