{
    "case_id": "Crl.MC.No. 8884 of 2017",
    "court": "HIGH COURT OF KERALA AT ERNAKULAM\nPRESENT",
    "date": "2018",
    "judge": "B.KEMAL PASHA",
    "petitioners": [
        "PADMAKUMAR",
        "1 SHINE J.PALLAN,",
        "S/O.PETER,AGED 35 YEARS,ANJIPARAMBIL HOUSE,",
        "MC.No",
        "2 RAJAN,",
        "J.\nDated",
        "NEAR KATHRUKADAVU BRIDGE",
        "Higbee",
        "(S) /ACCUSED 1 & 2",
        "S/O.JACOB PALLAN,AGED 31 YEARS,PALLATH VEEDU,FELIX ROAD,",
        "NEAR KATHRUKADAVU BRIDGE, KALOOR,ERNAKULAM DISTRICT.",
        "ANJIPARAMBIL HOUSE",
        "THAMMANAM KARA, POONITHURA VILLAGE."
    ],
    "respondents": [
        "ERNAKULAM DISTRICT-682304.",
        "Ril BY PUBLIC PROSECUTOR SRI.C.S.HRITHWIK",
        "S/O.RAVEENDRAN NAIR,AGED 39 YEARS,APPLE ASSOCIATES,",
        "BHAVANA ROAD , KANNADIKKADU ,MARADU, POONITHURA VILLAGE,",
        "R2 BY ADV. SMT.M.K.RAJITHA",
        "ERNAKULAM- 682031.",
        "(S) /STATE & DEFACTO COMPLAINANT:",
        "1.STATE OF KERALA,",
        "REPRESENTED BY PUBLIC PROSECUTOR,HIGH COURT OF KERALA,",
        "2. PADMAKUMAR,"
    ],
    "sections": [
        "323",
        "341",
        "294(b) read with Section 34 IPC"
    ],
    "outcome": "Palarivattom Police Station, can be quashed",
    "full_text": "Plies\n25 rena\nHigbee\na Pea\n2018/KER/283\nIN THE HIGH COURT OF KERALA AT ERNAKULAM\nPRESENT:\nTHE HONOURABLE MR. JUSTICE B.KEMAL PASHA\nTHURSDAY, THE 4TH DAY OF JANUARY 2018 / 14TH POUSHA, 1939\nCrl.MC.No. 8884 of 2017\nCC.NO.17/2016 of JUDICIAL FIRST CLASS MAGISTRATE COURT-IX, ERNAKULAM (TEMPORARY)\nCRIME NO. 835/2008 OF PALARIVATTOM POLICE STATION , ERNAKULAM\nPETITIONER (S) /ACCUSED 1 & 2\n1 SHINE J.PALLAN,\nS/O.JACOB PALLAN,AGED 31 YEARS,PALLATH VEEDU,FELIX ROAD,\nTHAMMANAM KARA, POONITHURA VILLAGE.\n2 RAJAN,\nS/O.PETER,AGED 35 YEARS,ANJIPARAMBIL HOUSE,\nNEAR KATHRUKADAVU BRIDGE, KALOOR,ERNAKULAM DISTRICT.\nBY ADVS.SRI.P.V.ANILKUMAR\nSMT .D.SARITHA\nSMT .J.RAJI\nRESPONDENT (S) /STATE & DEFACTO COMPLAINANT:\n1.STATE OF KERALA,\nREPRESENTED BY PUBLIC PROSECUTOR,HIGH COURT OF KERALA,\nERNAKULAM- 682031.\n2. PADMAKUMAR,\nS/O.RAVEENDRAN NAIR,AGED 39 YEARS,APPLE ASSOCIATES,\nBHAVANA ROAD , KANNADIKKADU ,MARADU, POONITHURA VILLAGE,\nERNAKULAM DISTRICT-682304.\nRil BY PUBLIC PROSECUTOR SRI.C.S.HRITHWIK\nR2 BY ADV. SMT.M.K.RAJITHA\nTHIS CRIMINAL MISC. CASE HAVING COME UP FOR ADMISSION ON 04-01-2018,\nTHE COURT ON THE SAME DAY PASSED THE FOLLOWING:\nTS\n\nEel\nfue\nhis ca\nB Tae P\n2018/KER/283\nCr1.MC.No. 8884 of 2017 ()\nAPPENDIX\nPETITIONER(S)' ANNEXURES\nANNEXURE AL COPY OF FINAL REPORT IN CRIME NO. 835/08 OF\nPALARIVATTM POLICE STATION SUBMITTED BEFORE\nJUDICIAL FIRST CLASS MAGISTRATE\nCOURT-IX , ERNAKULAM.\nANNEXURE A2 ORIGINAL OF THE AFFIDAVIT FILED BY THE DEFACTO\nCOMPLAINANT.\nRESPONDENT (S)' ANNEXURES - NIL\n/TRUE COPY/\nPS TO JUDGE\nTS\n\neee\n2018/KER/283\nB. KEMAL PASHA, J.\nDated this the 4\" day of January, 2018\nORDER\nPetitioners are the accused in CC No.17/2016 of\nthe Judicial First Class Magistrate's Court-IX, Ernakulam,\nwhich has arisen from Crime No.835/2008 of Palarivattom\nPolice Station for the offences punishable under Sections\n341, 323 and 294(b) read with Section 34 IPC.\n\n2. It seems that the matter has been amicably\nsettled between the petitioners and the de_ facto\ncomplainant, who is the 2\"? respondent herein.\n\n3. The 2â„¢ respondent has filed Annexure-A2\naffidavit affirming that the matter has been amicably settled\nbetween him and the petitioners and presently, he has no\ncomplaints against the petitioners. No purpose would be\nserved in proceeding with the matter further. Matters being\nso, all further proceedings against the petitioners in CC\n\nPe\napesoeiae es\n2018/KER/283\nCrl.M.C.8884/2017\n:2:\nNo.17/2016 of the Judicial First Class Magistrate's Court-IX,\nErnakulam, which has arisen from Crime No.835/2008 of\nPalarivattom Police Station, can be quashed.\n\nIn the result, this Crl.M.C. is allowed and all further\nproceedings against the petitioners in CC No.17/2016 of the\nJudicial First Class Magistrate's Court-IX, Ernakulam, which\nhas arisen from Crime No.835/2008 of Palarivattom Police\nStation, are quashed.\n\nSd/-\n(B.KEMAL PASHA, JUDGE)\naks/04/01\n// True Copy //\nPS to Judge\n\n"
}