{
    "case_id": "",
    "court": "HIGH COURT OF KERALA AT ERNAKULAM",
    "date": "2021",
    "judge": "Pseeaer",
    "petitioners": [
        "ATTOORKONAM, VELINELLOOR VILLAGE,",
        "KOLLAM, PIN-691 516",
        "ABDUL JALEEL,",
        "PIN-691 013\n3",
        "CR.M.C.NO.92",
        "CHARUVILA PUTHENVEEDU",
        "AGED 43 YEARS",
        "Bee\nCR.M.C.NO.92",
        "s/o ABUSHAMAM, KUTTIMOOTIL, CHARUVILA PUTHENVEEDU,"
    ],
    "respondents": [
        "S:",
        "PIN-691 013",
        "PP T.R.RENJITH",
        "REPRESENTED BY THE PUBLIC PROSECUTOR,",
        "2 DISTRICT COLLECTOR,",
        "1 STATE OF KERALA",
        "CIVIL STATION, KOLLAM,",
        "PARIPPALLY POLICE STATION, KOLLAM,",
        "OTHER PRESENT:",
        "HIGH COURT OF KERALA, PIN-682 031",
        "PIN-691 574",
        "3 SUB-INSPECTOR OF POLICE,"
    ],
    "sections": [
        "457"
    ],
    "outcome": "The Crl.M.C is allowed",
    "full_text": "P eer\nhy aren\nPseeaer\nIN THE HIGH COURT OF KERALA AT ERNAKULAM 2021/KER/998\nPRESENT\nTHE HONOURABLE MR.JUSTICE V.G.ARUN\nTHURSDAY, THE O7TH DAY OF JANUARY 2021 / 17TH POUSHA, 1942\nCr1.MC.No.92 OF 2021 (B)\nPETITIONER:\nABDUL JALEEL,\nAGED 43 YEARS\ns/o ABUSHAMAM, KUTTIMOOTIL, CHARUVILA PUTHENVEEDU,\nATTOORKONAM, VELINELLOOR VILLAGE,\nKOLLAM, PIN-691 516\nBY ADV. SRI.M.R.SASITH\nRESPONDENT/S:\n1 STATE OF KERALA\nREPRESENTED BY THE PUBLIC PROSECUTOR,\nHIGH COURT OF KERALA, PIN-682 031\n2 DISTRICT COLLECTOR,\nCIVIL STATION, KOLLAM,\nPIN-691 013\n3 SUB-INSPECTOR OF POLICE,\nPARIPPALLY POLICE STATION, KOLLAM,\nPIN-691 574\nOTHER PRESENT:\nPP T.R.RENJITH\nTHIS CRIMINAL MISC. CASE HAVING COME UP FOR ADMISSION ON\n07.01.2021, THE COURT ON THE SAME DAY PASSED THE FOLLOWING:\n\nBIPREe\nCR.M.C.NO.92 OF 2021 > 202 U/KERIISE\nORDER\n\nDated this the 7th day of January 2021\n\nPetitioner claims to be the owner of an\nExcavator bearing Registration No.KL-08-AA-\n7446. The vehicle was seized by the 3‚Äù?\nrespondent alleging violation of the\nprovisions of the Kerala Minor Mineral\nConcession Rules, 2015 and the Mines and\nMinerals (Development and Regulation) Act,\n1957. After seizure, the petitioner's\nvehicle was produced before the Judicial\nFirst Class Magistrate Court (Temporary),\nsouth Paravur. On the basis of an\napplication submitted by the petitioner\nunder Section 457 of the Code of Criminal\nProcedure, the learned Magistrate issued\nAnnexure Al order directing release of the\nvehicle, subject to conditions. The\n\nBIPREe\nCR.M.C.NO.92 OF 2021 ; 202 U/KERIISE\npetitioner complied with the conditions and\nthe vehicle was released.\n\n2. This Crl.M.C is filed aggrieved by\ncondition No.4(7)in Annexure Al order,\ndirecting the original documents produced\nbefore the court to be retained in court\ncustody and to issue true certified copies\nof those documents to the petitioner.\nAnnexure A2 is a similar order passed by\nthis Court whereby, conditions akin to\ncondition No.4(7) in Annexure Al were\nmodified.\n\n3. On the facts of this case and in\nview of the earlier order passed by this\nCourt under similar circumstances, I am\ninclined to grant the relief sought.\n\nIn the result, condition No.4(7) in\nAnnexure Al is modified as follows:-\n\nThe petitioner shall submit an affidavit\nundertaking to produce the original\n\na\nFea teed\nBIPREe\nCR.M.C.NO.92 OF 2021 202 U/KERIISE\n4\ndocuments of the vehicle bearing\nregistration No.KL-08-AA-7446 as and when\nrequired by the court. On submission of such\naffidavit, the original documents of the\nvehicle kept in the safe custody of the\ncourt shall be released to the petitioner,\nafter substituting those documents with\ncertified copies.\nThe Crl.M.C is allowed as above.\nSd/-\nV.G.ARUN\nJUDGE\nNB\n\np meoya\nhy aren\nBee\nCR.M.C.NO.92 OF 2021 202 U/KERIISE\n5\nAPPENDIX\nPETITIONER'S EXHIBITS:\nANNEXURE Al TRUE COPY OF THE ORDER IN CMP NO 3835/2018,\nOF MAGISTRATE COURT 1 STEMPORARY), SOUTH\nPARAVUR, KOLLAM\nANNEXURE A2 TRUE COPY OF THE ORDER IN CRL MC NO\n3429/2020 OF HIGH COURT OF KERALA\n\n"
}