{
    "case_id": "Crl.MC.No. 17 of 2014",
    "court": "HIGH COURT OF KERALA ATERNAKULAM\nPRESENT",
    "date": "2014",
    "judge": "HARUN-UL-RASHID",
    "petitioners": [
        "44TH ACCUSED:",
        "Baer",
        "MC.No",
        "S.C.NO",
        "Sessions Court"
    ],
    "respondents": [
        "COMPLAINANT AND STATE:"
    ],
    "sections": [
        "333",
        "143",
        "147",
        "332",
        "120(b) read with Section 149 of IPC",
        "324",
        "3(2)(a)",
        "148",
        "307"
    ],
    "outcome": "Proceedings against other six accused were quashed",
    "full_text": "Blea hl\nBaer\n2014/KER/205\nIN THE HIGH COURT OF KERALA ATERNAKULAM\nPRESENT:\nTHE HONOURABLE MR.JUSTICE HARUN-UL-RASHID\nTHURSDAY, THE 2ND DAY OF JANUARY 2014/12TH POUSHA, 1935\nCrl.MCNo. 17 of 20140\nLP 144/2012 of JUDICIAL FIRST CLASS MAGISTRATE COURT, KARUNAGAPPALLY\nSC 216/1995 of ADDL.SUB COURT,KOLLAM\nCrl.MC 3919/2013 of HIGH COURT OF KERALA\n\nPETITIONER/44TH ACCUSED:\n\nNAVAS\n\nS/O. ABDUL REHUMAN KUNIJU, KADA YASSERIL VEEDU\n\nCHANGANKULANGARA, OACHIRA, KOLLAM DISTRICT.\n\nBY ADVS.SRLK.SIJU\n\nSMT.CHITHRA.S.BABU\n\nRESPONDENT/COMPLAINANT AND STATE:\n\nSTATE OF KERALA\n\nTHROUGH THE DEPUTY SUPERINTENDENT OF POLICE\n\nKARUNAGAPPALLY,REPRESENTED BY PUBLIC PROSECUTOR\n\nHIGH COURT OF KERALA, ERNAKULAM.\n\nR BY PUBLIC PROSECUTOR SMT.SAREENA GEORGE\n\nTHIS CRIMINAL MISC. CASE HAVING COME UP FOR ADMISSION ON\n02-01-2014, THE COURT ON THE SAME DAY PASSED THE FOLLOWING:\n\nBlea hl\nBaer\n2014/KER/205\nCrl.MC.No. 17 of 2014 0\nAPPENDIX\nPETITIONER(S)' EXHIBITS\nANNEXURE 1- TRUE COPY OF FIR. IN CRIME NO. 42/1992 OF OACHIRA POLICE\nSTATION.\nANNEXURE 2- TRUE COPY OF FINAL REPORT FILED BY THE 2ND RESPONDENT\nIN CRIME NO.42/1992 OF OACHIRA POLICE STATION.\nANNEXURE 3- THE COPY OF COMMON JUDGMENT PASSED BY THE ASST.\nSESSIONS COURT, KOLLAM IN S.C.NO. 216/1995, S.C.NO. 8/1996 AND S.C.NO.\n25/1997 DATED 8-10-2002.\nANNEXURE 4- THE COPY OF JUDGMENT IN CRL.M.C.NO. 2367/2005.\nANNEXURE 5- THE COPY OF COMMON ORDER PASSED IN CRL.M.C.NO. 1690/2011\nAND 1713/2011 DATED 13-6-2011.\nANNEXURE 6- THE COPY OF ORDER IN CRL.M.C.NO. 3919/2013 DATED 10-9-2013.\nRESPONDENT(S)' EXHIBITS : NIL\n/TRUE COPY/\nPATO JUDGE\nAV\n\nBiers)\nHARUN-UL-RASHID, J. 2014RERI20S\nDated this the 2\" day of January, 2014\nORDER\n\nPetitioner is the 44 accused in Crime No.42/1992 of\nOachira Police Station pending as L.P.No.144/2012 on the file of\nJudicial First Class Magistrate Court, Karunagappally. The\noffences alleged are punishable under Sections 143, 147, 148,\n324, 332, 333, 307, 120(b) read with Section 149 of IPC and\nSection 3(2)(a) of Prevention of Destruction of Public Properties\nAct.\n\n2. Originally mob violence was registered on 01.04.1992\nagainst 400 persons and final report was filed against 101\npersons. 70 of the accused faced trial in S.C.Nos.216/1995,\n8/1996 and 25/1997 before the Asst.Sessions Court, Kollam.\nThe trial court acquitted all the accused persons finding that\nthe injured police men failed to identify any of the accused.\nThe trial court found that there is no evidence against the\naccused regarding criminal conspiracy and their involvement in\nthe violence and all of them were acquitted. A copy of the\njudgment dt.08.10.2002 is produced as Annexure _ 3.\nProceedings against other six accused were quashed by this\nCourt through three separate judgments. Annexures 4, 5 and\n6 are the copies of the said judgments.\n\nBiers)\n2014/KER/205\nCrl.M.C.No.17 of 2014 ;\n\n3. It is submitted that even if trial is conducted no\npurpose will be served for the reasons stated by the learned\nJudge in Annexure 3 judgment. There is no possibility of the\nprosecution to end in conviction in the facts and circumstances\nof the case.\n\nIn the result, this Crl.M.C. is allowed. All further\nproceedings in Crime No.42/1992 of Oachira Police Station\nagainst the petitioner pending as L.P.No.144/2012 on the file of\nJudicial First Class Magistrate Court, Karunagappally is\nquashed.\n\nSd/-\nHARUN-UL-RASHID, JUDGE.\nAV\n\n"
}