{
    "case_id": "Crl.MC.No. 2334 of 2015",
    "court": "HIGH COURT OF KERALA AT ERNAKULAM\nPRESENT",
    "date": "21ST DAY OF APRIL 2015",
    "judge": "K.HARILAL\nTUESDAY",
    "petitioners": [
        "UNAIS, AGED 23 YEARS,",
        "S/O. ALI, KALATHINGAL HOUSE, MOOLAPPURAM,",
        "VAZHAYOOR, MALAPPURAM DISTRICT."
    ],
    "respondents": [
        "S/STATE:",
        "1. THE STATE OF KERALA",
        "REPRESENTED BY THE PUBLIC PROSECUTOR",
        "HIGH COURT OF KERALA, ERNAKULAM, KOCHI 68Z 031",
        "2. THE TAHSILDAR,",
        "KONDOTTY TALUK, MALAPPURAM DISTRICT, PIN 673 638"
    ],
    "sections": [
        "23A of the\nKerala Protection of River Banks",
        "Regulation of\nRemoval of S",
        "Act",
        "2001"
    ],
    "outcome": "",
    "full_text": "Bee)\nee\nhor\n2015/KER/17259\nIN THE HIGH COURT OF KERALA AT ERNAKULAM\nPRESENT:\nTHE HONOURABLE MR.JUSTICE K.HARILAL\nTUESDAY, THE 21ST DAY OF APRIL 2015/1ST VAISAKHA, 1937\nCrl.MC.No. 2334 of 2015 ()\nPETITIONER:\nUNAIS, AGED 23 YEARS,\nS/O. ALI, KALATHINGAL HOUSE, MOOLAPPURAM,\nVAZHAYOOR, MALAPPURAM DISTRICT.\nBY ADV. SRI.BABU S. NAIR\nRESPONDENTS/STATE:\n1. THE STATE OF KERALA\nREPRESENTED BY THE PUBLIC PROSECUTOR\nHIGH COURT OF KERALA, ERNAKULAM, KOCHI 68Z 031\n2. THE TAHSILDAR,\nKONDOTTY TALUK, MALAPPURAM DISTRICT, PIN 673 638\nBY PUBLIC PROSECUTOR SRLEGY N. ELIAS\nTHIS CRIMINAL MISC. CASE HAVING COME UP FOR ADMISSION ON 21-04-2015,\nTHE COURT ON THE SAME DAY PASSED THE FOLLOWING:\n\nPLR ell\nee\noe\n2015/KERI17259\nCrl.MC.No. 2334 of 2015 ()\nAPPENDIX\nPETITIONER(S)' EXHIBITS\nANNEXURE A: TRUE COPY OF THE SEIZURE MAHAZAR PREPARED BY THE 2ND\nRESPONDENT DATED,24-05-2014\nRESPONDENT(S)' EXHIBITS : NIL\nOKB\nTrue copy\nPA. to Judge\n\nBle aa!\n2015/KER/[17259\nK.HARILAL, J.\nCr1.M.C. No.2334 of 2015\nDated this the 21\" day of April, 2015.\nORDER\nThe petitioner herein is the owner of a mini lorry\nbearing Regn. No.KL-10T/8781. The above vehicle was\nseized on 24-5-2014 by the second respondent\nTahsildar on the allegation of illegal transportation\nof river sand. After seizure, the said fact was\nreported to the Revenue Divisional Officer by the\nsecond respondent. But the second respondent has not\nproduced the vehicle before the concerned\nMagistrate's court, enabling the petitioner to file an\napplication for interim custody of the vehicle,\ninvoking the jurisdiction under Section 23A of the\nKerala Protection of River Banks and Regulation of\nRemoval of Sand Act, 2001. Hence, the petitioner has\nsought for a direction to the second respondent to\nreport the seizure of the vehicle to the concerned\nMagistrate's court and also to direct the learned\n\nBle aa!\n2015/KER/[17259\nCrl.M.C.2334/15-C :2:\nMagistrate to dispose the application for interim\ncustody of the vehicle.\n\n2. The learned Public Prosecutor, on instruction,\nsubmitted that the direction to produce the vehicle\nbefore the concerned Magistrate had already been\nissued to the second respondent and the second\nrespondent will produce the vehicle without any\ndelay.\n\n3. In view of the above submission, the second\nrespondent is directed to report the seizure of the\nvehicle to the Judicial First Class Magistrate's Court,\nParappanangadi forthwith, and the petitioner is at\nliberty to file an application for interim custody of\nthe vehicle. In that event, the learned Magistrate\nshall dispose the application at the earliest, after\naffording an opportunity of being heard to the\npetitioner.\n\nThis petition is allowed.\n\nSd/-\n(K.HARILAL, JUDGE)\nokb.\n\n"
}