{
    "case_id": "",
    "court": "HIGH COURT OF KERALA AT ERNAKULAM",
    "date": "07TH DAY OF JANUARY 2019",
    "judge": "RAJA VIJAYARAGHAVAN V\nMONDAY",
    "petitioners": [
        "S/ACCUSED NOS.1 & 2:",
        "1 VARGHESE NITHISH,",
        "AGED 37 YEARS, S/O.JACOB, H.NO.23/1753 C,",
        "CHAKKALAKKAL HOUSE, DON BOSCO ROAD,",
        "PALLURUTHY, KOCHI-6.",
        "2 LISSY JACOB,",
        "W/O.JACOB, H.NO.23/1753 C,CHAKKALAKKAL HOUSE,",
        "DON BOSCO ROAD, PALLURUTHY, KOCHI-6."
    ],
    "respondents": [
        "S/DE FACTO COMPLAINANT & STATE:",
        "1 STELLA DITTA,",
        "D/O.JOSEPH T.A., AGED 33 YEARS, THEKKINAPPILLY HOUSE,",
        "INFANT JESUS CROSS ROAD, VADUTHALA P.O., ERNAKULAM,",
        "KOCHI-682023.",
        "2 STATE OF KERALA,",
        "REPRESENTED BY SUB INSPECTOR OF POLICE,",
        "KOCHI CUSBA POLICE STATION, ERNAKULAM DISTRICT,",
        "REPRESENTED BY PUBLIC PROSECUTOR,HIGH COURT OF",
        "KERALA, ERNAKULAM, PIN-682031."
    ],
    "sections": [
        "482 of the Code of Criminal\nProcedure"
    ],
    "outcome": "ORDER\n\nThis petition is filed under Section 482 of the Code of Criminal\nProcedure.\n\n2. The petitioners herein are the accused Nos.1 and 2 in C.C\nNo.1758 of 2015 on the file of the Judicial Magistrate of First\nClass-II, Kochi involving offences punishable under Sections 498A\nand 423 r/w. Section 34 of the IPC. The de facto complainant, who\nis arrayed as the 1* respondent, is the wife of the 1* petitioner\nherein. The 2\" petitioner is the mother of the 1* petitioner.\n\n3. The instant petition is filed with a prayer to quash the\nproceedings on the ground of settlement of all disputes. The 1*\nrespondent has filed an affidavit stating that she does not wish to\ncontinue with the prosecution proceedings against the petitioners.\n\n4. The learned Public Prosecutor has obtained instructions.\nHe submitted that the statement of the 1 respondent has been\nrecorded and the State has no objection in terminating the\nproceedings as it involves no public interest.\n\n5. I have considered the submissions advanced.\n\nBuel\nBisse\nCRL.MC:7923/18 4 201 /KERMOS\n6. In Gian Singh v. State of Punjab [(2012) 10 SCC 303]\nand in Narinder Singh v. State of Punjab [(2014) 6 SCC 466],\nthe Apex Court has laid down that in appropriate cases, the High\nCourt can take note of the amicable resolution of disputes between\nthe victim and the wrongdoer to put an end to the criminal\nproceedings. Further in Jitendra Raghuvanshi & Others v. Babita\nRaghuvanshi & Another [(2013) 4 SCC 58], it was observed that\nit is the duty of the courts to encourage genuine settlements of\nmatrimonial disputes. If the parties ponder over their faults and\nterminate their disputes amicably by mutual agreement instead of\nfighting it out in a court of law, the courts should not hesitate to\nexercise its powers under Section 482 of the Code. Permitting such\nproceedings to continue would be nothing, but an abuse of process\nof court. The interest of justice also require that the proceedings be\nquashed",
    "full_text": "Le\nSere Bead\non\nBs ne\nIN THE HIGH COURT OF KERALA AT ERNAKULAM 201/KERMOS\nPRESENT\nTHE HONOURABLE MR. JUSTICE RAJA VIJAYARAGHAVAN V\nMONDAY, THE 07TH DAY OF JANUARY 2019 / 17TH POUSHA, 1940\nCr1.MC.No. 7923 of 2017\nAGAINST THE PROCEEDINGS IN C.C. NO.1758/2015 ON THE FILE OF THE\nJUDICIAL FIRST CLASS MAGISTRATE COURT-II, KOCHI ARISING OUT OF\nCRIME NO. 1067/2015 OF PALLURUTHY POLICE STATION, ERNAKULAM\nPETITIONERS/ACCUSED NOS.1 & 2:\n1 VARGHESE NITHISH,\nAGED 37 YEARS, S/O.JACOB, H.NO.23/1753 C,\nCHAKKALAKKAL HOUSE, DON BOSCO ROAD,\nPALLURUTHY, KOCHI-6.\n2 LISSY JACOB,\nW/O.JACOB, H.NO.23/1753 C,CHAKKALAKKAL HOUSE,\nDON BOSCO ROAD, PALLURUTHY, KOCHI-6.\nBY ADV. SRI.M.H.HANIS\nRESPONDENTS/DE FACTO COMPLAINANT & STATE:\n1 STELLA DITTA,\nD/O.JOSEPH T.A., AGED 33 YEARS, THEKKINAPPILLY HOUSE,\nINFANT JESUS CROSS ROAD, VADUTHALA P.O., ERNAKULAM,\nKOCHI-682023.\n2 STATE OF KERALA,\nREPRESENTED BY SUB INSPECTOR OF POLICE,\nKOCHI CUSBA POLICE STATION, ERNAKULAM DISTRICT,\nREPRESENTED BY PUBLIC PROSECUTOR,HIGH COURT OF\nKERALA, ERNAKULAM, PIN-682031.\nBY ADVS.\nSMT.R.S.ASWINI SANKAR\nSRI.G.RENJITH\nSRI.S.M.PRASANTH\nSRI.T.H.ARAVIND\nSRI.T.RAMPRASAD UNNI\n\nBRAS Ta]\nSere Bead\noe\nBERS\nCRL.MC:7923/18 2 201 1KER/E95\nOTHER PRESENT:\nSRI C K PRASAD-PP\nTHIS CRIMINAL MISC. CASE HAVING BEEN FINALLY HEARD ON\n07.01.2019, THE COURT ON THE SAME DAY PASSED THE FOLLOWING:\n\nBuel\n2 a\nBisset:\nCRL.MC:7923/18 3 2019/KERIA9S\nORDER\n\nThis petition is filed under Section 482 of the Code of Criminal\nProcedure.\n\n2. The petitioners herein are the accused Nos.1 and 2 in C.C\nNo.1758 of 2015 on the file of the Judicial Magistrate of First\nClass-II, Kochi involving offences punishable under Sections 498A\nand 423 r/w. Section 34 of the IPC. The de facto complainant, who\nis arrayed as the 1* respondent, is the wife of the 1* petitioner\nherein. The 2\" petitioner is the mother of the 1* petitioner.\n\n3. The instant petition is filed with a prayer to quash the\nproceedings on the ground of settlement of all disputes. The 1*\nrespondent has filed an affidavit stating that she does not wish to\ncontinue with the prosecution proceedings against the petitioners.\n\n4. The learned Public Prosecutor has obtained instructions.\nHe submitted that the statement of the 1 respondent has been\nrecorded and the State has no objection in terminating the\nproceedings as it involves no public interest.\n\n5. I have considered the submissions advanced.\n\nBuel\nBisse\nCRL.MC:7923/18 4 201 /KERMOS\n6. In Gian Singh v. State of Punjab [(2012) 10 SCC 303]\nand in Narinder Singh v. State of Punjab [(2014) 6 SCC 466],\nthe Apex Court has laid down that in appropriate cases, the High\nCourt can take note of the amicable resolution of disputes between\nthe victim and the wrongdoer to put an end to the criminal\nproceedings. Further in Jitendra Raghuvanshi & Others v. Babita\nRaghuvanshi & Another [(2013) 4 SCC 58], it was observed that\nit is the duty of the courts to encourage genuine settlements of\nmatrimonial disputes. If the parties ponder over their faults and\nterminate their disputes amicably by mutual agreement instead of\nfighting it out in a court of law, the courts should not hesitate to\nexercise its powers under Section 482 of the Code. Permitting such\nproceedings to continue would be nothing, but an abuse of process\nof court. The interest of justice also require that the proceedings be\nquashed. Having considered all the relevant circumstances, I am of\nthe considered view that this Court will be well justified in invoking\nits extraordinary powers under Section 482 of the Code to quash the\nproceedings.\nIn the result, this petition will stand allowed. Annexure-A final\nreport and all proceedings pursuant thereto against the petitioners\n\nBuel\n\nCRL.MC:7923/18 5 2019/KERIA9S\nnow pending as C.C No.1758 of 2015 on the file of the Judicial\nMagistrate of First Class-II, Kochi are quashed.\n\nSD/-\n\nRAJA VIJAYARAGHAVAN V.,\n\nJUDGE\n\nKRJ\nTRUE COPY// PATO JUDGE\n\nBRAS Ta]\nSere Bead\noe\nBERS\nCRL.MC:7923/18 6 201 1KER/E95\nAPPENDIX\nPETITIONER'S/S EXHIBITS:\nANNEXURE A CERTIFIED COPY OF THE FINAL CHARGE IN\nC.C.NO.1758/2015 OF THE JUDICIAL FIRST\nCLASS MAGISTRATE'S COURT-II, KOCHI\nARISING OUT OF CRIME NO.1067/2015 OF\nKOCHI CUSBA POLICE STATION, ERNAKULAM\nDISTRICT.\nANNEXURE B AFFIDAVIT OF THE DE FACTO COMPLAINANT.\n\n"
}