{
    "case_id": "",
    "court": "HIGH COURT OF KERALA AT ERNAKULAM\nPRESENT\nTHE HONOURABLE MR",
    "date": "8TH DAY OF JANUARY 2020",
    "judge": "P.B.SURESH KUMAR\nWEDNESDAY",
    "petitioners": [
        "S /ACCUSED :",
        "1 JOY P.D.,",
        "AGED 44 YEARS, S/O. LATE. DEVASSY,",
        "PALATTY KOONATHAN HOUSE, PULLANY, THURAVUOOR,",
        "ANKAMALY, ERNAKULAM DISTRICT.",
        "2 ALIUAKUTTY,",
        "AGED 82 YEARS, W/O. LATE. DEVASSY, PALATTY",
        "KOONATHAN HOUSE, PULLANY, THURAVUOOR,",
        "ANKAMALY, ERNAKULAM DISTRICT."
    ],
    "respondents": [
        "COMPLAINANT AND STATE:",
        "1 SMITHA,",
        "AGED 41 YEARS, W/O. JOY, PALATTY KOONATHAN",
        "HOUSE, PULLANY, THURAVUOOR, ANGAMALY,",
        "ERNAKULAM DISTRICT 683 572.",
        "2 STATE OF KERALA,",
        "REPRESENTED BY THE PUBLIC PROSECUTOR,",
        "HIGH COURT OF KERALA, ERNAKULAM.",
        "R1 BY SRI.ADV. SANIL KUNJACHAN"
    ],
    "sections": [
        "482 of\nthe Code of Criminal Procedure for quashing Annexure"
    ],
    "outcome": "ORDER IN CC NO.657/2019 OF JUDICIAL FIRST\nCLASS MAGIST. COURT, ANGAMALY (TEMPORARY)\nCRIME NO.508/2019 OF ANGAMALI POLICE STATION, ERNAKULAM\nPETITIONERS /ACCUSED :\n1 JOY P.D.,\nAGED 44 YEARS, S/O. LATE. DEVASSY,\nPALATTY KOONATHAN HOUSE, PULLANY, THURAVUOOR,\nANKAMALY, ERNAKULAM DISTRICT.\n2 ALIUAKUTTY,\nAGED 82 YEARS, W/O. LATE. DEVASSY, PALATTY\nKOONATHAN HOUSE, PULLANY, THURAVUOOR,\nANKAMALY, ERNAKULAM DISTRICT.\nBY ADV. SMT .K.RAJESWARY\nRESPONDENT/COMPLAINANT AND STATE:\n1 SMITHA,\nAGED 41 YEARS, W/O. JOY, PALATTY KOONATHAN\nHOUSE, PULLANY, THURAVUOOR, ANGAMALY,\nERNAKULAM DISTRICT 683 572.\n2 STATE OF KERALA,\nREPRESENTED BY THE PUBLIC PROSECUTOR,\nHIGH COURT OF KERALA, ERNAKULAM.\nR1 BY SRI.ADV. SANIL KUNJACHAN\nSRI.SANTHOSH PETER PP\nTHIS CRIMINAL MISC. CASE HAVING COME UP FOR ADMISSION\nON 08.01.2020, THE COURT ON THE SAME DAY PASSED THE\nFOLLOWING:\n\nesha\nCees\nLd\n2020/KER/670\nCrl.M.C. No.96 of 2020 2\nCri.M.C.No.96 of 2020\nORDER\n\nThis is a proceedings instituted under Section 482 of\nthe Code of Criminal Procedure for quashing Annexure - 1 final\nreport and all further proceedings pursuant thereto now\npending as C.C.No.657 of 2019 on the files of the Court of the\nJudicial Magistrate of First Class, Angamaly.\n\n2. The petitioners are the accused in the said case.\nThe case was one instituted at the instance of the first\nrespondent under Sections 498A, 341 and 323 read with\nSection 34 of the Indian Penal Code.\n\n3. It is seen that the first respondent has settled her\ndisputes with the petitioners and an affidavit to that effect has\nbeen produced as Annexure A2.\n\n4. Heard the learned counsel for the petitioners,\nthe learned Public Prosecutor as also the learned counsel for\nthe first respondent.\n\n5. In the light of the decision of the Apex Court in\n\n2020/KER/670\n\nCrl.M.C. No.96 of 2020 3\n\nGian singh v. State of Punjab, (2012) 10 SCC 303, insofar as\n\nthe offences alleged against the accused in the case are only\noffences punishable under Sections 498A, 341 and 323 read\nwith Section 34 of the Indian Penal Code, | am of the view that\nthis is an appropriate case where this court has to invoke the\njurisdiction under Section 482 of the Code of Criminal Procedure\n\nto quash the proceedings against the petitioners.\n\nIn the result, the Crl.M.C. is allowed and Annexure-1\nfinal report and all further proceedings pursuant thereto against\nthe petitioners, pending as C.C.No.657 of 2019 on the files of\nthe Court of the Judicial Magistrate of First Class, Angamaly are\nquashed",
    "full_text": "Cpe aereecl\nrf eo\ncil : Ca\n2020/KER/670\nIN THE HIGH COURT OF KERALA AT ERNAKULAM\nPRESENT\nTHE HONOURABLE MR. JUSTICE P.B.SURESH KUMAR\nWEDNESDAY, THE O8TH DAY OF JANUARY 2020 / 18TH POUSHA,\n1941\nCr1.MC.No.96 OF 2020 (B)\nAGAINST THE ORDER IN CC NO.657/2019 OF JUDICIAL FIRST\nCLASS MAGIST. COURT, ANGAMALY (TEMPORARY)\nCRIME NO.508/2019 OF ANGAMALI POLICE STATION, ERNAKULAM\nPETITIONERS /ACCUSED :\n1 JOY P.D.,\nAGED 44 YEARS, S/O. LATE. DEVASSY,\nPALATTY KOONATHAN HOUSE, PULLANY, THURAVUOOR,\nANKAMALY, ERNAKULAM DISTRICT.\n2 ALIUAKUTTY,\nAGED 82 YEARS, W/O. LATE. DEVASSY, PALATTY\nKOONATHAN HOUSE, PULLANY, THURAVUOOR,\nANKAMALY, ERNAKULAM DISTRICT.\nBY ADV. SMT .K.RAJESWARY\nRESPONDENT/COMPLAINANT AND STATE:\n1 SMITHA,\nAGED 41 YEARS, W/O. JOY, PALATTY KOONATHAN\nHOUSE, PULLANY, THURAVUOOR, ANGAMALY,\nERNAKULAM DISTRICT 683 572.\n2 STATE OF KERALA,\nREPRESENTED BY THE PUBLIC PROSECUTOR,\nHIGH COURT OF KERALA, ERNAKULAM.\nR1 BY SRI.ADV. SANIL KUNJACHAN\nSRI.SANTHOSH PETER PP\nTHIS CRIMINAL MISC. CASE HAVING COME UP FOR ADMISSION\nON 08.01.2020, THE COURT ON THE SAME DAY PASSED THE\nFOLLOWING:\n\nesha\nCees\nLd\n2020/KER/670\nCrl.M.C. No.96 of 2020 2\nCri.M.C.No.96 of 2020\nORDER\n\nThis is a proceedings instituted under Section 482 of\nthe Code of Criminal Procedure for quashing Annexure - 1 final\nreport and all further proceedings pursuant thereto now\npending as C.C.No.657 of 2019 on the files of the Court of the\nJudicial Magistrate of First Class, Angamaly.\n\n2. The petitioners are the accused in the said case.\nThe case was one instituted at the instance of the first\nrespondent under Sections 498A, 341 and 323 read with\nSection 34 of the Indian Penal Code.\n\n3. It is seen that the first respondent has settled her\ndisputes with the petitioners and an affidavit to that effect has\nbeen produced as Annexure A2.\n\n4. Heard the learned counsel for the petitioners,\nthe learned Public Prosecutor as also the learned counsel for\nthe first respondent.\n\n5. In the light of the decision of the Apex Court in\n\n2020/KER/670\n\nCrl.M.C. No.96 of 2020 3\n\nGian singh v. State of Punjab, (2012) 10 SCC 303, insofar as\n\nthe offences alleged against the accused in the case are only\noffences punishable under Sections 498A, 341 and 323 read\nwith Section 34 of the Indian Penal Code, | am of the view that\nthis is an appropriate case where this court has to invoke the\njurisdiction under Section 482 of the Code of Criminal Procedure\n\nto quash the proceedings against the petitioners.\n\nIn the result, the Crl.M.C. is allowed and Annexure-1\nfinal report and all further proceedings pursuant thereto against\nthe petitioners, pending as C.C.No.657 of 2019 on the files of\nthe Court of the Judicial Magistrate of First Class, Angamaly are\nquashed.\n\nSd/-\nP.B.SURESH KUMAR, JUDGE.\nYKB\n\nCiera\ni\n| : a\n2020/KER/670\nCrl.M.C. No.96 of 2020 4\nAPPENDIX\nPETITIONER'S/S EXHIBITS:\nANNEXURE 1 A TRUE COPY OF THE FIR AND CHANGE\nSHEET IN C.C. NO. 652/2019 PENDING\nBEFORE THE JUDICIAL FIRST CLASS\nMAGISTRATE COURT ANGAMALY.\nANNEXURE 2 AFFIDAVIT OF THE 1ST RESPONDENT DATED\n21/12/2019.\nRESPONDENT'S/S EXHIBITS:\nNIL\n//TRUE COPY//\nPA TO JUDGE\n\n"
}