{
    "case_id": "",
    "court": "HIGH COURT OF KERALA AT ERNAKULAM\nPRESENT",
    "date": "7TH DAY OF DECEMBER 2017",
    "judge": "SUNIL THOMAS\nTHURSDAY",
    "petitioners": [
        "(S) /ACCUSED 1,2 & 3:",
        "1. BINTISH CHERIA",
        "S/O. CHERIA, AGED 36, MANAVALAN HOUSE, KARAYAMPARAMBU,",
        "KARUKUTTY VILLAGE, ERNAKULAM DISTRICT.",
        "2. CHERIA",
        "S/O. OUSEPH, AGED 68, MANAVALAN HOUSE, KARAYAMPARAMBU,",
        "KARUKUTTY VILLAGE, ERNAKULAM DISTRICT.",
        "3. TREESA CHERIA,",
        "W/O. CHERIA, AGED 62 YEARS, MANAVALAN HOUSE,",
        "KARAYAMPARAMBU, KARUKUTTY VILLAGE, ERNAKULAM DISTRICT."
    ],
    "respondents": [
        "(S) /DE-FACTO COMPLAINANT:",
        "1. STATE OF KERALA",
        "REPRESENTED BY ITS PUBLIC PROSECUTOR, HIGH COURT OF",
        "KERALA, ERNAKULAM - 682 031.",
        "2. SALMA GEORGE,",
        "D/O. GEORGE, AGED 30, PHILIPS HOUSE, KUTHURACHIRA,",
        "PUNALUR P.O., KOLLAM DISTRICT.",
        "R2 BY ADV. SRI.R.KRISHNAKUMAR (CHERTHALA)",
        "R BY PUBLIC PROSECUTOR C.N.PRABHAKARAN"
    ],
    "sections": [
        "406",
        "498A",
        "34 IPC"
    ],
    "outcome": "ORDER/JUDGMENT IN CC 1277/2016 of JUDICIAL FIRST CLASS\nMAGIST. COURT, ANGAMALY (TEMPORARY) CRIME NO. 1018/2016 OF ANGAMALT\nPOLICE STATION , ERNAKULAM)\nPETITIONER (S) /ACCUSED 1,2 & 3:\n1. BINTISH CHERIA\nS/O. CHERIA, AGED 36, MANAVALAN HOUSE, KARAYAMPARAMBU,\nKARUKUTTY VILLAGE, ERNAKULAM DISTRICT.\n2. CHERIA\nS/O. OUSEPH, AGED 68, MANAVALAN HOUSE, KARAYAMPARAMBU,\nKARUKUTTY VILLAGE, ERNAKULAM DISTRICT.\n3. TREESA CHERIA,\nW/O. CHERIA, AGED 62 YEARS, MANAVALAN HOUSE,\nKARAYAMPARAMBU, KARUKUTTY VILLAGE, ERNAKULAM DISTRICT.\nBY ADV. SRI.V.M.ALI\nRESPONDENT (S) /DE-FACTO COMPLAINANT:\n1. STATE OF KERALA\nREPRESENTED BY ITS PUBLIC PROSECUTOR, HIGH COURT OF\nKERALA, ERNAKULAM - 682 031.\n2. SALMA GEORGE,\nD/O. GEORGE, AGED 30, PHILIPS HOUSE, KUTHURACHIRA,\nPUNALUR P.O., KOLLAM DISTRICT.\nR2 BY ADV. SRI.R.KRISHNAKUMAR (CHERTHALA)\nR BY PUBLIC PROSECUTOR C.N.PRABHAKARAN\nTHIS CRIMINAL MISC. CASE HAVING COME UP FOR ADMISSION ON\n07-12-2017, THE COURT ON THE SAME DAY PASSED THE FOLLOWING:\n\na\nrae\nSe Si dena\n2017/KER/49562\nCr1.MC.No. 7796 of 2017 ()\nAPPENDIX\nPETITIONER (S)' EXHIBITS\nANNEXURE 1 THE CERTIFIED COPY OF THE FINAL REPORT IN C.C.NO.\n1277/2016.\nANNEXURE 2 A TRUE COPY OF THE COMPROMISE SUBMITTED BEFORE FAMILY\nCOURT, ERNAKULAM.\nANNEXURE 3 AFFIDAVIT SUBMITTED BY THE DE-FACTO COMPLAINANT.\nRESPONDENT (S)' EXHIBITS\neee Tare aT OEE TOTTI NIL\n/TRUE COPY/ PS TO JUDGE.\n\n2017/KER/49562\nSUNIL THOMAS, J.\nCrl.M.C.No. 7796 of 2017\nDated this the 7\" day of December, 2017\nORDER\n\nThe petitioners herein are the accused Nos. 1,2 and 3 in CC\nNo.1277/2016 of the JFCMC, Angamaly for offences punishable\nunder sections 406,498A and 34 IPC.\n\n2. It was alleged by the second respondent herein that, she\nwas subjected to matrimonial cruelty by the first petitioner-her\nhusband and in-laws. On the basis of the complaint lodged, the\ncrime was registered and investigation was completed. According\nto the petitioners and the learned counsel for the contesting\nrespondent, the disputes between the parties have been completely\nsettled to the satisfaction of both the sides. To support that,\nAnnexure 3 affidavit of the defacto complainant is produced. It is\nstated therein that, all the matrimonial disputes have been settled\nand Annexure A2 compromise was arrived at.\n\n3. Learned Public Prosecutor, on instructions, submitted that\nthe disputes have been settled and it is informed to the\ninvestigating agency. In the light of the above, I am inclined to\n\nPEmaNel\nape ee\n2017/KER/49562\nCr.M.C.No.7796/2017 2\ninvoke the jurisdiction of this court under section 482 Cr.P.C.to\nquash the proceedings.\n\nAccordingly, Cril.M.C.is allowed. All further proceedings\npursuant to C.C.No.12787/2016 of the JFCMC, Ankamaly stand\nquashed",
    "full_text": "eae\nSe Si dena\n2017/KER/49562\nIN THE HIGH COURT OF KERALA AT ERNAKULAM\nPRESENT:\nTHE HONOURABLE MR. JUSTICE SUNIL THOMAS\nTHURSDAY, THE 7TH DAY OF DECEMBER 2017/16TH AGRAHAYANA, 1939\nCr1.MC.No. 7796 of 2017 ()\n(AGAINST THE ORDER/JUDGMENT IN CC 1277/2016 of JUDICIAL FIRST CLASS\nMAGIST. COURT, ANGAMALY (TEMPORARY) CRIME NO. 1018/2016 OF ANGAMALT\nPOLICE STATION , ERNAKULAM)\nPETITIONER (S) /ACCUSED 1,2 & 3:\n1. BINTISH CHERIA\nS/O. CHERIA, AGED 36, MANAVALAN HOUSE, KARAYAMPARAMBU,\nKARUKUTTY VILLAGE, ERNAKULAM DISTRICT.\n2. CHERIA\nS/O. OUSEPH, AGED 68, MANAVALAN HOUSE, KARAYAMPARAMBU,\nKARUKUTTY VILLAGE, ERNAKULAM DISTRICT.\n3. TREESA CHERIA,\nW/O. CHERIA, AGED 62 YEARS, MANAVALAN HOUSE,\nKARAYAMPARAMBU, KARUKUTTY VILLAGE, ERNAKULAM DISTRICT.\nBY ADV. SRI.V.M.ALI\nRESPONDENT (S) /DE-FACTO COMPLAINANT:\n1. STATE OF KERALA\nREPRESENTED BY ITS PUBLIC PROSECUTOR, HIGH COURT OF\nKERALA, ERNAKULAM - 682 031.\n2. SALMA GEORGE,\nD/O. GEORGE, AGED 30, PHILIPS HOUSE, KUTHURACHIRA,\nPUNALUR P.O., KOLLAM DISTRICT.\nR2 BY ADV. SRI.R.KRISHNAKUMAR (CHERTHALA)\nR BY PUBLIC PROSECUTOR C.N.PRABHAKARAN\nTHIS CRIMINAL MISC. CASE HAVING COME UP FOR ADMISSION ON\n07-12-2017, THE COURT ON THE SAME DAY PASSED THE FOLLOWING:\n\na\nrae\nSe Si dena\n2017/KER/49562\nCr1.MC.No. 7796 of 2017 ()\nAPPENDIX\nPETITIONER (S)' EXHIBITS\nANNEXURE 1 THE CERTIFIED COPY OF THE FINAL REPORT IN C.C.NO.\n1277/2016.\nANNEXURE 2 A TRUE COPY OF THE COMPROMISE SUBMITTED BEFORE FAMILY\nCOURT, ERNAKULAM.\nANNEXURE 3 AFFIDAVIT SUBMITTED BY THE DE-FACTO COMPLAINANT.\nRESPONDENT (S)' EXHIBITS\neee Tare aT OEE TOTTI NIL\n/TRUE COPY/ PS TO JUDGE.\n\n2017/KER/49562\nSUNIL THOMAS, J.\nCrl.M.C.No. 7796 of 2017\nDated this the 7\" day of December, 2017\nORDER\n\nThe petitioners herein are the accused Nos. 1,2 and 3 in CC\nNo.1277/2016 of the JFCMC, Angamaly for offences punishable\nunder sections 406,498A and 34 IPC.\n\n2. It was alleged by the second respondent herein that, she\nwas subjected to matrimonial cruelty by the first petitioner-her\nhusband and in-laws. On the basis of the complaint lodged, the\ncrime was registered and investigation was completed. According\nto the petitioners and the learned counsel for the contesting\nrespondent, the disputes between the parties have been completely\nsettled to the satisfaction of both the sides. To support that,\nAnnexure 3 affidavit of the defacto complainant is produced. It is\nstated therein that, all the matrimonial disputes have been settled\nand Annexure A2 compromise was arrived at.\n\n3. Learned Public Prosecutor, on instructions, submitted that\nthe disputes have been settled and it is informed to the\ninvestigating agency. In the light of the above, I am inclined to\n\nPEmaNel\nape ee\n2017/KER/49562\nCr.M.C.No.7796/2017 2\ninvoke the jurisdiction of this court under section 482 Cr.P.C.to\nquash the proceedings.\n\nAccordingly, Cril.M.C.is allowed. All further proceedings\npursuant to C.C.No.12787/2016 of the JFCMC, Ankamaly stand\nquashed.\n\nSd/-\nSUNIL THOMAS\nJudge\ndpk\n/true copy/ PS to Judge.\n\n"
}