{
    "case_id": "",
    "court": "HIGH COURT OF KERALA AT ERNAKULAM\nPRESENT",
    "date": "2ND DAY OF JANUARY 2014",
    "judge": "HARUN-UL-RASHID\nTHURSDAY",
    "petitioners": [
        "(S) /PETITIONERS/ACCUSED NOS.1 & 3:",
        "1. KOCHUKHADEEJA, AGED 75 YEARS",
        "W/O.SYNUDHEEN, KADAMBOT HOUSE, CHANDAPURABHAGAM,",
        "LOKESWARAM VILLAGE.",
        "2. OMANA, AGED 46 YEARS",
        "W/O.SABU, BELOW KOYIPURAM SCHOOL, VAZHAPPILLY",
        "CHANGANASSERY, KOTTAYAM."
    ],
    "respondents": [
        "/COMPLAINANT :",
        "STATE OF KERALA,",
        "REPRESENTED BY THE CIRLCE INSPECTOR OF POLICE",
        "MALA POLICE STATION THROUGH THE PUBLIC PROSECUTOR",
        "HIGH COURT OF KERALA, ERNAKULAM - 682 031."
    ],
    "sections": [
        "3"
    ],
    "outcome": "",
    "full_text": "cae\nea!\n2014/KER/247\nIN THE HIGH COURT OF KERALA AT ERNAKULAM\nPRESENT :\nTHE HONOURABLE MR.JUSTICE HARUN-UL-RASHID\nTHURSDAY, THE 2ND DAY OF JANUARY 2014/12TH POUSHA, 1935\nCr1.MC.No. 6121 of 2013 ()\nAGAINST THE ORDER/JUDGMENT IN CC 1333/2012 of J.M.F.C., KODUNGALLUR\nPETITIONER (S) /PETITIONERS/ACCUSED NOS.1 & 3:\n1. KOCHUKHADEEJA, AGED 75 YEARS\nW/O.SYNUDHEEN, KADAMBOT HOUSE, CHANDAPURABHAGAM,\nLOKESWARAM VILLAGE.\n2. OMANA, AGED 46 YEARS\nW/O.SABU, BELOW KOYIPURAM SCHOOL, VAZHAPPILLY\nCHANGANASSERY, KOTTAYAM.\nBY ADV. SMI.ANITHA MATHAI MUTHIRENTHY\nRESPONDENT /COMPLAINANT :\nSTATE OF KERALA,\nREPRESENTED BY THE CIRLCE INSPECTOR OF POLICE\nMALA POLICE STATION THROUGH THE PUBLIC PROSECUTOR\nHIGH COURT OF KERALA, ERNAKULAM - 682 031.\nBY PUBLIC PROSECUTOR SMT.SAREENA GEORGE\nTHIS CRIMINAL MISC. CASE HAVING COME UP FOR ADMISSION ON\n02-01-2014, THE COURT ON THE SAME DAY PASSED THE FOLLOWING:\nPn\n\na\neee!\n2014/KER/247\nHARUN-UL-RASHID, J.\nDated this the 2 day of January, 2014\nORDER\n\nPetitioners are the accused Nos.1 and 3 in Crime\nNo.542/2003 of Kodungallur Police Station now pending as\nC.C.No.1333/2012 on the file of the Judicial First Class\nMagistrate Court, Kodungallur. The offences alleged are\npunishable under Sections 3(1), 4(1) & 5 (1) of Immoral Traffic\n(Prevention) Act, 1956.\n\n2. It is submitted that, the 1* petitioner is aged 75 years\nand the 2\" petitioner 46 years that, the case is stands posted\nto 16.06.2014 that, no summons is issued to witnesses and\nthat it will take several years for a final verdict in this case.\n\nThe prayer in this case is for an early disposal of\nC.C.No.1333/2012 on the file of the Judicial First Class\nMagistrate Court, Kodungallur.\n\n3. In the facts and circumstances, this Court directed the\nRegistry to call for a report from the Chief Judicial Magistrate,\nThrissur to ascertain whether the case is ripe for trial and by\nwhat time the matter can be disposed of. Pursuant to the\ndirection, the Chief Judicial Magistrate, Thrissur through the\ncommunication dated 21.12.2013 informed the Registrar that\n\nBees al\nae\nees!\n2014/KER/247\nCrl.M.C.No.6121 of 2013\n2\n\nthe case can be advanced and can be disposed of within a\n\nperiod of three months.\n\nIn the result, this Crl.M.C. is allowed. There will be a\ndirection to the Judicial First Class Magistrate Court,\nKodungallur to dispose of C.C.No.1333/2012 within a period of\nthree months from the date of receipt of a copy of this order.\n\nHARUN-UL-RASHID, JUDGE.\nAV\n\n"
}