{
    "case_id": "",
    "court": "HIGH COURT OF KERALA AT ERNAKULAM\nPRESENT",
    "date": "2ND DAY OF JANUARY 2014",
    "judge": "HARUN-UL-RASHID\nTHURSDAY",
    "petitioners": [
        "PETITIONER:"
    ],
    "respondents": [
        "RESPONDENT:"
    ],
    "sections": [],
    "outcome": "",
    "full_text": "BIL al\nEe] Sea\n2014/KER/228\nIN THE HIGH COURT OF KERALA AT ERNAKULAM\nPRESENT:\nTHE HONOURABLE MR.JUSTICE HARUN-UL-RASHID\nTHURSDAY, THE 2ND DAY OF JANUARY 2014/12TH POUSHA, 1935\nCri.MC.No. 52 of 2014 ()\n\nCMP.NO. 868/2013 OF JUDICIAL FIRST CLASS MAGISTRATE COURT, MALAPPURAM\nPETITIONER/PETITIONER:\n\nJALEEL, S/O. IBRAHIM,\n\nIRINGALLOOR P.O., TIRURANGADI,\n\nMALAPPURAM DISTRICT.\n\nBY ADVS.SRI.P.SAMSUDIN\n\nSMT.NIMA JACOB\n\nRESPONDENT/RESPONDENT:\n\nSTATE OF KERALA,\n\nREPRESENTED BY THE PUBLIC PROSECUTOR,\n\nHIGH COURT OF KERALA, ERNAKULAM-682 031.\n\nBY PUBLIC PROSECUTOR SMT. S.HYMA\n\nTHIS CRIMINAL MISC. CASE HAVING COME UP FOR ADMISSION\n\nON 02-01-2014, THE COURT ON THE SAME DAY PASSED THE FOLLOWING:\nsts\n\nEe] Sea\n2014/KER/228\nCri.MC.No. 52 of 2014 ()\nAPPENDIX\nPETITIONER(S)’ ANNEXURES:\nANNEXURE A1- TRUE COPY OF THE ORDER IN CRL.M.P.NO. 868/2013 ON THE\nFILES OF JFCM COURT MALAPPURAM DATED 06-06-2013.\n\nRESPONDENT(S)’ ANNEXURES: NIL\n\nITRUE COPY/\n\nP.A.TO.JUDGE\nsts\n\n2014/KER/228\nHARUN-UL-RASHID, J.\nCri.M.C. No. 52 of 2014\nDated this the 2” day of January 2014.\nORDER\n\nAnnexure Ai is the copy of the order dated 6.6.2013 in\nCrl.M.P.No.868/2013 on the file of the Judicial First Class\nMagistrate Court, Malappuram. Petitioner seeks modification of\nthe said order. The vehicle owned by the petitioner was seized by\nthe Station House Officer, Vengara on the allegation of illegal\ntransportation of river sand. Learned Magistrate ordered release\nof the vehicle subject to seven conditions. Condition Nos.1,2 &3\nreads as follows:\n\n(i) Petitioner shall execute a bond for Rs.30,000/- with two\nsolvent sureties each for the like sum.\n\n(ii) Petitioner shall deposit Rs.10,000/- in the court.\n\n(iii) Petitioner shall produce security or bank guarantee for\nRs.20,000/-.\n\n2. It is submitted that the petitioner is not in a position to\narrange sureties as nobody will stand as surety for the release of\nthe vehicle. It is also submitted that the petitioner is not having\nany landed property in his name and is unable to arrange bank\nguarantee for the amount. Petitioner is ready to deposit entire\n\nDLs ha]\npee\nBaa\n2014/KER/228\nCrl.M.C. No.52/2014\n:2:\nvalue of the vehicle.\n\n3. In the facts and circumstances, condition Nos.1 to 3 are\ndeleted. In lieu of condition Nos. 1 to 3, the petitioner shall\ndeposit Rs.30,000/- being the value of the vehicle on or before\n13.1.2014.\n\nThe Cri.M.C is disposed of as above.\n\nSd/-\nHARUN-UL-RASHID,\nJudge.\nAL/-\nTrue copy\nP.A to Judge\n\n"
}