{
    "case_id": "",
    "court": "HIGH COURT OF KERALA AT ERNAKULAM",
    "date": "6TH DAY OF JANUARY 2021",
    "judge": "V.G.ARUN\nWEDNESDAY",
    "petitioners": [
        "ACCUSED:",
        "SAJEEV V.K.",
        "AGED 41 YEARS",
        "S/O.KOCHAKKEN, VIYYATH HOUSE, THONNURKKARA POST,",
        "CHELAKKARA, THRISSUR DISTRICT, PIN - 680 586."
    ],
    "respondents": [
        "STATE:",
        "STATE OF KERALA",
        "REPRESENTED BY THE PUBLIC PROSECUTOR,",
        "HIGH COURT OF KERALA, ERNAKULAM,",
        "KOCHI - 682 031."
    ],
    "sections": [],
    "outcome": "",
    "full_text": "eet\nBz Te\nIN THE HIGH COURT OF KERALA AT ERNAKULAM 2021/KERBS3\nPRESENT\nTHE HONOURABLE MR.JUSTICE V.G.ARUN\nWEDNESDAY, THE O6TH DAY OF JANUARY 2021 / 16TH POUSHA, 1942\nCri .MC.No.5834 OF 2020 (H)\nAGAINST THE JUDGMENT IN CC 182/2017 OF JUDICIAL MAGISTRATE OF\nFIRST CLASS -I,THRISSUR\nCRIME NO.2256/2016 OF Viyyur Police Station , Thrissur\n\nPETITIONER/ACCUSED:\nSAJEEV V.K.\nAGED 41 YEARS\nS/O.KOCHAKKEN, VIYYATH HOUSE, THONNURKKARA POST,\nCHELAKKARA, THRISSUR DISTRICT, PIN - 680 586.\nBY ADV. SRI.J.VIMAL\n\nRESPONDENT/STATE:\nSTATE OF KERALA\nREPRESENTED BY THE PUBLIC PROSECUTOR,\nHIGH COURT OF KERALA, ERNAKULAM,\nKOCHI - 682 031.\n\nOTHER PRESENT:\nPP T.R.RENJITH\n\nTHIS CRIMINAL MISC. CASE HAVING COME UP FOR ADMISSION ON\n06.01.2021, THE COURT ON THE SAME DAY PASSED THE FOLLOWING:\n\nBpirsh\npe conn\nBee\nCr1.MC.No.5834 OF 2020 (H) ide, 202 UKERBSS\nORDER\nDated this the 6th day of January 2021\nThe learned Counsel for the petitioner seeks\npermission to withdraw the Criminal M.C.\nAccordingly, the Criminal M.C. is dismissed as\nwithdrawn.\nSd/-\nV.G.ARUN\nSB/06/01/2020 JUDGE\n//true copy// P.A to Judge\n\n"
}