{
    "case_id": "Crl.MC.No. 7294 of 2017",
    "court": "HIGH COURT OF KERALA AT ERNAKULAM",
    "date": "9TH DAY OF JANUARY 2018",
    "judge": "SUNIL THOMAS\nTUESDAY",
    "petitioners": [
        "ACCUSED 1 TO 3:",
        "4 AROMAL @ AROMAL GOVIND,",
        "AGED 24 YEARS, S/O.G.DHANANJAYAN NAIR,",
        "RAVI MANDIRAM, NEDUMUDI P.O., ALAPPUZHA DISTRICT.",
        "2 RATHEESH,",
        "AGED 42 YEARS, S/O. THANKAPPAN PILLAI,",
        "MULLASSERI HOUSE, MURIKKUMPUZHA P.O.,",
        "VETILOOR VILLAGE, THIRUVANANTHAPURAM DISTRICT.",
        "3 MADHU MULLASSERI,",
        "AGED 54 YEARS, S/O. THANKAPPAN NAIR,",
        "MULLASSERI HOUSE, MURIKKUMPUZHA P.O.,",
        "VETILOOR VILLAGE, THIRUVANANTHAPURAM DISTRICT."
    ],
    "respondents": [
        "STATE AND DEFACTO COMPLAINANT:",
        "1. STATE OF KERALA,",
        "REPRESENTED BY THE PUBLIC PROSECUTOR,",
        "HIGH COURT OF KERALA, ERNAKULAM.",
        "2. SAJITHA,",
        "AGED 40 YEARS, D/O.SUSEELA,",
        "PALLIVILAKATHU VEEDU, KOLIYAKKODE,",
        "NEDUMANGAD TALUK, THIRUVANANTHAPURAM DISTRICT.",
        "R2 BY ADV. SRI.N.M.JAMES",
        "R BY PUBLIC PROSECUTOR:SMT M K PUSHPALATHA"
    ],
    "sections": [
        "500",
        "506",
        "34",
        "54C of Indian Penal\nCode"
    ],
    "outcome": "ORDER\nPetitioners stand arrayed as accused Nos.1 to 3 in Crime\nNo.918 of 2015 of Pothencode Police Station for offences\npunishable under sections 500, 506, 34 and 54C of Indian Penal\nCode.\n\n2. The second respondent had married the second\npetitioner and their matrimonial relationship got strained. Alleging\nvarious offences against the accused, crime was registered at the\ninstance of the complainant, who is the second respondent herein\nand crime was registered. Pending the proceedings, accused have\napproached this Court to quash the proceedings. It is stated that\nthe parties have resolved their dispute. To substantiate it, second\nrespondent has affirmed an affidavit produced as Annexure-A3. The\nsecond respondent has reiterated that, she has no objection in\nquashing the proceedings.\n\n3. On instructions, learned Public Prosecutor submitted\nthat the matter was settled and the second respondent has given a\nstatement to the investigating officer to the effect that the disputes\nhave been settled and have decided to withdraw the criminal cases\nfiled against each other. She has also stated that, she has no\n\nBea\nene\nBe\n2018/KER/988\nCri.M.C.7294/17\n2\nobjection in quashing Crime No.918 of 2015, if accused Nos.1 to 3\nwill not misuse the documents allegedly kept by them or used it\nagainst her and her family members. This submission was recorded\nand brought to the notice of the petitioners herein.\n\nAccordingly, Crl.M.C is allowed. In the light of the\nsettlement between the parties, all further proceedings arising from\nCrime No.918 of 2015 of Pothencode Police Station will stand\nquashed",
    "full_text": "meee\noes\nIN THE HIGH COURT OF KERALA AT ERNAKULAM 22/8/KER/988\nPRESENT:\nTHE HONOURABLE MR. JUSTICE SUNIL THOMAS\nTUESDAY, THE 9TH DAY OF JANUARY 2018 / 19TH POUSHA, 1939\nCri.MC.No. 7294 of 2017\nCRIME NO. 918/2015 OF POTHENCODE POLICE STATION , THIRUVANANDAPURAM\nPETITIONER(S)/ACCUSED 1 TO 3:\n4 AROMAL @ AROMAL GOVIND,\nAGED 24 YEARS, S/O.G.DHANANJAYAN NAIR,\nRAVI MANDIRAM, NEDUMUDI P.O., ALAPPUZHA DISTRICT.\n2 RATHEESH,\nAGED 42 YEARS, S/O. THANKAPPAN PILLAI,\nMULLASSERI HOUSE, MURIKKUMPUZHA P.O.,\nVETILOOR VILLAGE, THIRUVANANTHAPURAM DISTRICT.\n3 MADHU MULLASSERI,\nAGED 54 YEARS, S/O. THANKAPPAN NAIR,\nMULLASSERI HOUSE, MURIKKUMPUZHA P.O.,\nVETILOOR VILLAGE, THIRUVANANTHAPURAM DISTRICT.\nBY ADV.SRI.J.JAYAKUMAR\nRESPONDENT(S)/STATE AND DEFACTO COMPLAINANT:\n1. STATE OF KERALA,\nREPRESENTED BY THE PUBLIC PROSECUTOR,\nHIGH COURT OF KERALA, ERNAKULAM.\n2. SAJITHA,\nAGED 40 YEARS, D/O.SUSEELA,\nPALLIVILAKATHU VEEDU, KOLIYAKKODE,\nNEDUMANGAD TALUK, THIRUVANANTHAPURAM DISTRICT.\nR2 BY ADV. SRI.N.M.JAMES\nR BY PUBLIC PROSECUTOR:SMT M K PUSHPALATHA\nTHIS CRIMINAL MISC. CASE HAVING BEEN FINALLY HEARD ON 09-01-2018, THE COURT\nON THE SAME DAY PASSED THE FOLLOWING:\n\nmee\n\neee\nCrl.MC.No. 7294 of 2017 () 2018/KER/988\n\nAPPENDIX\nPETITIONER(S)' EXHIBITS:\nANNEXURE A1 : TRUE COPY OF THE FIR IN CRIME NO.918/2015 OF POTHENCODE\nPOLICE STATION, THIRUVANANTHAPURAM.\nANNEXURE A2 : TRUE COPY OF THE COMPROMISE PETITION FILED BY THE 2ND\nPETITIONER AND 2ND RESPONDENT IN 0.P.NO.265/2016 BEFORE FAMILY COURT,\nNEDUMANGAD.\nANNEXURE A3_ : AFFIDAVIT DATED 7.9.2017 SWORN IN BY THE 2ND RESPONDENT.\nRESPONDENTS:NIL\nTrue Copy /P Ato Judge\n\nPiel\n2018/KER/988\nSUNIL THOMAS, J.\nCrl.M.C.No.7294 of 2017\nDated this the 9\" day of January, 2018\nORDER\nPetitioners stand arrayed as accused Nos.1 to 3 in Crime\nNo.918 of 2015 of Pothencode Police Station for offences\npunishable under sections 500, 506, 34 and 54C of Indian Penal\nCode.\n\n2. The second respondent had married the second\npetitioner and their matrimonial relationship got strained. Alleging\nvarious offences against the accused, crime was registered at the\ninstance of the complainant, who is the second respondent herein\nand crime was registered. Pending the proceedings, accused have\napproached this Court to quash the proceedings. It is stated that\nthe parties have resolved their dispute. To substantiate it, second\nrespondent has affirmed an affidavit produced as Annexure-A3. The\nsecond respondent has reiterated that, she has no objection in\nquashing the proceedings.\n\n3. On instructions, learned Public Prosecutor submitted\nthat the matter was settled and the second respondent has given a\nstatement to the investigating officer to the effect that the disputes\nhave been settled and have decided to withdraw the criminal cases\nfiled against each other. She has also stated that, she has no\n\nBea\nene\nBe\n2018/KER/988\nCri.M.C.7294/17\n2\nobjection in quashing Crime No.918 of 2015, if accused Nos.1 to 3\nwill not misuse the documents allegedly kept by them or used it\nagainst her and her family members. This submission was recorded\nand brought to the notice of the petitioners herein.\n\nAccordingly, Crl.M.C is allowed. In the light of the\nsettlement between the parties, all further proceedings arising from\nCrime No.918 of 2015 of Pothencode Police Station will stand\nquashed, being a purely person dispute.\n\nSd/-\nSUNIL THOMAS\nJudge\nSbna/9/1/18\nTrue Copy / P A to Judge\n\n"
}