{
    "case_id": "",
    "court": "HIGH COURT OF KERALA AT ERNAKULAM\nPRESENT\nTHE HONOURABLE MRS",
    "date": "4 DAY OF JANUARY 2024",
    "judge": "SOPHY THOMAS\nWEDNESDAY",
    "petitioners": [
        "MUHAMMED",
        "AGED 47 YEARS",
        "S/O KUNCHAMMU, AMBALATHINGAL HOUSE, CHENNAMANGALOOR,",
        "MUKKAM, KOZHIKODE DISTRICT, PIN - 673602"
    ],
    "respondents": [
        "S/COMPLAINANT AND STATE:",
        "1 THE STATE OF KERALA",
        "REPRESENTED BY THE PUBLIC PROSECUTOR, HIGH COURT OF",
        "KERALA, ERNAKULAM, KOCHI, PIN - 682031",
        "2 THE SUPERINTENDENT",
        "CENTRAL PRISON, TAVANOOR MALAPPURAM, PIN - 679571",
        "OTHER PRESENT:",
        "PP-SRI.PRASANTH M.P."
    ],
    "sections": [],
    "outcome": "",
    "full_text": "Bisel\nEocene\nBE ms he 4\n2024/KER/3214\nIN THE HIGH COURT OF KERALA AT ERNAKULAM\nPRESENT\nTHE HONOURABLE MRS. JUSTICE SOPHY THOMAS\nWEDNESDAY, THE 17Â°4 DAY OF JANUARY 2024 / 27TH POUSHA, 1945\nCRL.MC NO. 303 OF 2024\nCRIME NO.452/2008 OF Mukkom Police Station, Kozhikode\nAGAINST THE ORDER/JUDGMENT SC 530/2009 OF FAST TRACK SPECIAL\nCOURT, KOZHIKODE\nPETITIONER:\nMUHAMMED\nAGED 47 YEARS\nS/O KUNCHAMMU, AMBALATHINGAL HOUSE, CHENNAMANGALOOR,\nMUKKAM, KOZHIKODE DISTRICT, PIN - 673602\nBY ADV K.M.SATHYANATHA MENON\nRESPONDENTS/COMPLAINANT AND STATE:\n1 THE STATE OF KERALA\nREPRESENTED BY THE PUBLIC PROSECUTOR, HIGH COURT OF\nKERALA, ERNAKULAM, KOCHI, PIN - 682031\n2 THE SUPERINTENDENT\nCENTRAL PRISON, TAVANOOR MALAPPURAM, PIN - 679571\nOTHER PRESENT:\nPP-SRI.PRASANTH M.P.\nTHIS CRIMINAL MISC. CASE HAVING COME UP FOR ADMISSION ON\n17.01.2024, THE COURT ON THE SAME DAY PASSED THE FOLLOWING:\n\nEarner\nBizRate\n2024/KER/3214\nCRL.MC NO. 303 OF 2024 2\nORDER\nLearned Public Prosecutor submitted that the petitioner herein has\nfiled an application before the jail authorities under Rule 4 of the\nPrison Rules on 8/1/2024 and that petition will be taken for\nconsideration along with the report of the Station House Officer\nconcerned. The 2\"? respondent Superintendent of Central Prison\nThavanoor, Malappuram is directed to consider the petition dated\n8/1/2024 submitted by the petitioner herein, and to pass appropriate\norders on or before 20/1/2024.\nWith the above direction, this Crl.M.C is disposed of.\nSd/-\nSOPHY THOMAS\nJUDGE\nSka\n\nEocene\npee\nElz she\n2024/KER/3214\nCRL.MC NO, 303 OF 2024 3\nAPPENDIX OF CRL.MC 303/2024\nPETITIONER ANNEXURES\nAnnexure A TRUE COPY OF JUDGMENT DATED 23/2/2021 IN SC\nNO.530/2009 ON THE FILEOF THE COURT OF THE\nFAST TRACK SPECIAL JUDGE KOZHIKODE\nAnnexure B A TRUE COPY OF THE MARRIAGE INVITATION LETTER\nOF DAUGHTER OF THE APPLICANT NAMED KUMARI\nHANA MUHAMMED\n\n"
}