{
    "case_id": "",
    "court": "HIGH COURT OF KERALA AT ERNAKULAM",
    "date": "6TH DAY OF JANUARY 2021",
    "judge": "V.G.ARUN\nWEDNESDAY",
    "petitioners": [
        "NIJEESH.C.B",
        "AGED 30 YEARS",
        "S/O. BHASKARAN, CHEMBAN HOUSE, MUKKOLA, NETTIRACHIRA,",
        "KUNDALTYOOR P.O., THRISSUR."
    ],
    "respondents": [
        "S:",
        "1 STATE OF KERALA",
        "REPRESENTED BY ITS PUBLIC PROSECUTOR, HIGH COURT OF",
        "KERALA, ERNAKULAM.",
        "2 SUB INSPECTOR OF POLICE",
        "NEDUMKANDOM POLICE STATION, NEDUMKANDOM, IDUKKI.",
        "3 BABU K. GEORGE",
        "S/O.GEORGE, KAVALAKKATTU HOUSE, THANKAMONY, IDUKKI.",
        "4 MANOHARAN",
        "S/O.VELAYUDHAN, PARACKAL HOUSE, MOONNAM MILE, CHINNAR",
        "KARA, ELAPPARA VILLAGE, IDUKKI.",
        "5 SALIM",
        "S/O.ILLYAS, KALAPPURA HOUSE, AMAYATHRA BHAGOM,",
        "UDUMMBANOOR KARA, UDUMBANNOOR VILLAGE, IDUKKT.",
        "6 SASI KUMAR",
        "S/O. KUNJOONJU, VALLUZHUTHI HOUSE, PONNANGANI BHAGOM,",
        "KOMBAYAR PARA, PARATHODU VILLAGE, IDUKKI.",
        "SR.PP.C.S.HRITHWIK"
    ],
    "sections": [
        "248"
    ],
    "outcome": "",
    "full_text": "Pie Bl\na ee)\nBrae\nIN THE HIGH COURT OF KERALA AT ERNAKULAM 2021/KER/705\nPRESENT\nTHE HONOURABLE MR.JUSTICE V.G.ARUN\nWEDNESDAY, THE O6TH DAY OF JANUARY 2021 / 16TH POUSHA, 1942\nCr1.MC.No.231 OF 2015\nAGAINST THE JUDGMENT IN CC 265/2014 OF JUDICIAL MAGISTRATE OF\nFIRST CLASS ,NEDUMKANDOM\nCRIME NO.265/2014 OF Nedumkandam Police Station , Idukki\nPETITIONER:\nNIJEESH.C.B\nAGED 30 YEARS\nS/O. BHASKARAN, CHEMBAN HOUSE, MUKKOLA, NETTIRACHIRA,\nKUNDALTYOOR P.O., THRISSUR.\nBY ADVS.\nSRI .G.P.SHINOD\nSRI.GOVIND PADMANAABHAN\nSRI .MANU V.\nRESPONDENTS:\n1 STATE OF KERALA\nREPRESENTED BY ITS PUBLIC PROSECUTOR, HIGH COURT OF\nKERALA, ERNAKULAM.\n2 SUB INSPECTOR OF POLICE\nNEDUMKANDOM POLICE STATION, NEDUMKANDOM, IDUKKI.\n3 BABU K. GEORGE\nS/O.GEORGE, KAVALAKKATTU HOUSE, THANKAMONY, IDUKKI.\n4 MANOHARAN\nS/O.VELAYUDHAN, PARACKAL HOUSE, MOONNAM MILE, CHINNAR\nKARA, ELAPPARA VILLAGE, IDUKKI.\n5 SALIM\nS/O.ILLYAS, KALAPPURA HOUSE, AMAYATHRA BHAGOM,\nUDUMMBANOOR KARA, UDUMBANNOOR VILLAGE, IDUKKT.\n6 SASI KUMAR\nS/O. KUNJOONJU, VALLUZHUTHI HOUSE, PONNANGANI BHAGOM,\nKOMBAYAR PARA, PARATHODU VILLAGE, IDUKKI.\nSR.PP.C.S.HRITHWIK\nTHIS CRIMINAL MISC. CASE HAVING COME UP FOR ADMISSION ON\n06.01.2021, THE COURT ON THE SAME DAY PASSED THE FOLLOWING:\n\nCrme 231/2015 > 2021/KER/705\nV.G.ARUN, J.\nGLC. No.231 of 2015\nDated this the 6\" day of January, 2021\nORDER\nThe prayer in this Crl.M.C is to quash the proceedings in\nC.C.No.265 of 2014 on the file of JFCM, Nedumkandam. Being a\nCri.M.C of the year 2015, pertaining to a crime of 2014, a report was\ncalled for, from the jurisdictional Magistrate Court. In the report, the\nlearned Magistrate has reported that as per judgment dated\n18.08.2017 in C.C.No.265 of 2014, the accused was acquitted under\nSection 248(1) Cr.P.C. In the light of the said report, the Crl.M.C is\nclosed.\nSd/-\nV.G.ARUN\nJUDGE\nlgk\n\nBRE\na ee)\noe\nCrmce 231/2015 3 2021/KER/705\nAPPENDIX\nPETITIONER'S ANNEXURES:\nANNEXURE I A CERTIFIED COPY OF THE FIR IN CRIME NO.\n787 OF 2013 OF NEDUMKANDOM POLICE STATION.\nANNEXURE II A CERTIFIED COPY OF THE FINAL REPORT IN\nCRIME NO.787 OF 2013 OF NEDUMKANDOM\nPOLICE STATION.\n\n"
}