{
    "case_id": "",
    "court": "HIGH COURT OF KERALA AT ERNAKULAM\nPRESENT\nTHE HONOURABLE MRS",
    "date": "5TH DAY OF JANUARY 2021",
    "judge": "SHIRCY V.\nTUESDAY",
    "petitioners": [
        "ACCUSED :",
        "VITTO",
        "AGED 50 YEARS",
        "S/O. KUMARAN, BRAHMAKULAM HOUSE, NEAR JUBILEE",
        "MISSION HOSPITAL, KIZHAKKEKKOTTA BHAGAM, CHIYYARAM",
        "VILLAGE, THRISSUR DISTRICT, PIN-680 026"
    ],
    "respondents": [
        "S/STATE AND DEFACTO COMPLAINANT-CW1-VICTIM:",
        "1 STATE OF KERALA",
        "REPRESENTED BY THE PUBLIC PROSECUTOR,",
        "HIGH COURT OF KERALA, ERNAKULAM, PIN-682 031",
        "2 RUBY VARGHESE",
        "W/O. VARGHESE, THANNIKKAPPILLIL HOUSE, OLANADU",
        "KARA, ALANAD VILLAGE, VARAPUZHA P.O, PARAVUR TALUK,",
        "ERNAKULAM DISTRICT, PIN-683 517",
        "R2 BY ADV. M.REVIKRISHNAN",
        "OTHER PRESENT:",
        "AJITH MURALI -P.P"
    ],
    "sections": [
        "482 of the Code of Criminal\nProcedure"
    ],
    "outcome": "ORDER IN CC 330/2018 OF JUDL. FIRST CLASS MAGISTRATE\nCOURT,NORTH PARAVUR (TEMPORARY)\nCRIME NO.434/2018 OF Varappuzha Police Station, Ernakulam\nPETITIONER/ACCUSED :\nVITTO\nAGED 50 YEARS\nS/O. KUMARAN, BRAHMAKULAM HOUSE, NEAR JUBILEE\nMISSION HOSPITAL, KIZHAKKEKKOTTA BHAGAM, CHIYYARAM\nVILLAGE, THRISSUR DISTRICT, PIN-680 026\nBY ADVS.\nSRI.PRASUN.S\nSRI .N.A.RETHEESH\nRESPONDENTS/STATE AND DEFACTO COMPLAINANT-CW1-VICTIM:\n1 STATE OF KERALA\nREPRESENTED BY THE PUBLIC PROSECUTOR,\nHIGH COURT OF KERALA, ERNAKULAM, PIN-682 031\n2 RUBY VARGHESE\nW/O. VARGHESE, THANNIKKAPPILLIL HOUSE, OLANADU\nKARA, ALANAD VILLAGE, VARAPUZHA P.O, PARAVUR TALUK,\nERNAKULAM DISTRICT, PIN-683 517\nR2 BY ADV. M.REVIKRISHNAN\nOTHER PRESENT:\nAJITH MURALI -P.P\nTHIS CRIMINAL MISC. CASE HAVING COME UP FOR ADMISSION ON\n05.01.2021, THE COURT ON THE SAME DAY PASSED THE FOLLOWING:\n\nLAA\nee\nCrl.M.C.5592/2020 ; 2021/KER/336\nORDER\n\nDated this the 5th day of January 2021\n\nPetition under Section 482 of the Code of Criminal\nProcedure.\n\n2. The petitioner is the accused in Crime No. 434\nof 2018 of Varapuzha Police Station registered for the\noffences punishable under Sections 448, 354 and 294(b) of\nIndian Penal Code.\n\n3. It is submitted by the learned counsel for\nthe petitioner that the parties have resolved their entire\ndisputes among themselves and as such there is no\nsubsisting dispute between them. Therefore, this petition\nto quash the Annexure Al final report in Crime No.434 of\n2018 of Varapuzha Police Station and all further\nproceedings in C.C. No. 330 of 2018 of Judicial First Class\nMagistrate Court-III, North Paravur.\n\n4. Learned counsel appearing for the 2™\nrespondent/defacto complainant has submitted that she has\nabsolutely no grievance or complaints against the\npetitioner. Annexure A2 is the affidavit sworn to by her\nin support of the submission of the petitioner. The\naffidavit further indicates that she has no intention to\npursue the matter further.\n\n5. The learned Public Prosecutor has reported that\n\nLAA\n-\nee\nCrl.M.C.5592/2020 ; 202 1/KER336\nthe prosecution has no serious objection in allowing the\npetition. It is also submitted that as the dispute has\nbeen amicably settled, the possibility of conviction is\nremote and bleak and therefore, no useful purpose would\nbe served in proceeding with the case.\n\n6. On hearing the submissions of all concerned,\non perusal of the records as well on consideration of the\nspecial facts and circumstances involved in this case, I\nfind that no fruitful purpose is likely to be served by\nproceeding with the matter against this petitioner.\nMoreover, no public interest is involved in the case and\nthere is no legal impediment in granting the prayer as\nsought for by the petitioner. Therefore, for the purpose of\nsecuring the ends of justice, this Crl.M.C. is only to be\nallowed.\n\nFor the foregoing reasons, Annexure Al final\nreport in Crime No.434 of 2018 of Varapuzha Police Station\nand all further proceedings in C.C. No. 330 of 2018 of\nJudicial First Class Magistrate Court-III, North Paravur\nwill stand quashed",
    "full_text": "pee\nbala\nCr1.M.C.5592/2020 202UKERIS36\n1\nIN THE HIGH COURT OF KERALA AT ERNAKULAM\nPRESENT\nTHE HONOURABLE MRS. JUSTICE SHIRCY V.\nTUESDAY, THE O5TH DAY OF JANUARY 2021 / 15TH POUSHA, 1942\nCrl1.MC.No.5592 OF 2020 (H)\nAGAINST THE ORDER IN CC 330/2018 OF JUDL. FIRST CLASS MAGISTRATE\nCOURT,NORTH PARAVUR (TEMPORARY)\nCRIME NO.434/2018 OF Varappuzha Police Station, Ernakulam\nPETITIONER/ACCUSED :\nVITTO\nAGED 50 YEARS\nS/O. KUMARAN, BRAHMAKULAM HOUSE, NEAR JUBILEE\nMISSION HOSPITAL, KIZHAKKEKKOTTA BHAGAM, CHIYYARAM\nVILLAGE, THRISSUR DISTRICT, PIN-680 026\nBY ADVS.\nSRI.PRASUN.S\nSRI .N.A.RETHEESH\nRESPONDENTS/STATE AND DEFACTO COMPLAINANT-CW1-VICTIM:\n1 STATE OF KERALA\nREPRESENTED BY THE PUBLIC PROSECUTOR,\nHIGH COURT OF KERALA, ERNAKULAM, PIN-682 031\n2 RUBY VARGHESE\nW/O. VARGHESE, THANNIKKAPPILLIL HOUSE, OLANADU\nKARA, ALANAD VILLAGE, VARAPUZHA P.O, PARAVUR TALUK,\nERNAKULAM DISTRICT, PIN-683 517\nR2 BY ADV. M.REVIKRISHNAN\nOTHER PRESENT:\nAJITH MURALI -P.P\nTHIS CRIMINAL MISC. CASE HAVING COME UP FOR ADMISSION ON\n05.01.2021, THE COURT ON THE SAME DAY PASSED THE FOLLOWING:\n\nLAA\nee\nCrl.M.C.5592/2020 ; 2021/KER/336\nORDER\n\nDated this the 5th day of January 2021\n\nPetition under Section 482 of the Code of Criminal\nProcedure.\n\n2. The petitioner is the accused in Crime No. 434\nof 2018 of Varapuzha Police Station registered for the\noffences punishable under Sections 448, 354 and 294(b) of\nIndian Penal Code.\n\n3. It is submitted by the learned counsel for\nthe petitioner that the parties have resolved their entire\ndisputes among themselves and as such there is no\nsubsisting dispute between them. Therefore, this petition\nto quash the Annexure Al final report in Crime No.434 of\n2018 of Varapuzha Police Station and all further\nproceedings in C.C. No. 330 of 2018 of Judicial First Class\nMagistrate Court-III, North Paravur.\n\n4. Learned counsel appearing for the 2™\nrespondent/defacto complainant has submitted that she has\nabsolutely no grievance or complaints against the\npetitioner. Annexure A2 is the affidavit sworn to by her\nin support of the submission of the petitioner. The\naffidavit further indicates that she has no intention to\npursue the matter further.\n\n5. The learned Public Prosecutor has reported that\n\nLAA\n-\nee\nCrl.M.C.5592/2020 ; 202 1/KER336\nthe prosecution has no serious objection in allowing the\npetition. It is also submitted that as the dispute has\nbeen amicably settled, the possibility of conviction is\nremote and bleak and therefore, no useful purpose would\nbe served in proceeding with the case.\n\n6. On hearing the submissions of all concerned,\non perusal of the records as well on consideration of the\nspecial facts and circumstances involved in this case, I\nfind that no fruitful purpose is likely to be served by\nproceeding with the matter against this petitioner.\nMoreover, no public interest is involved in the case and\nthere is no legal impediment in granting the prayer as\nsought for by the petitioner. Therefore, for the purpose of\nsecuring the ends of justice, this Crl.M.C. is only to be\nallowed.\n\nFor the foregoing reasons, Annexure Al final\nreport in Crime No.434 of 2018 of Varapuzha Police Station\nand all further proceedings in C.C. No. 330 of 2018 of\nJudicial First Class Magistrate Court-III, North Paravur\nwill stand quashed as prayed for.\n\nSd/-\nSHIRCY V.\nJUDGE\nsb\n\nape oases\nFe ae\nines\nCr1.M.C.5592/2020 202 1/KER/336\n4\nAPPENDIX\nPETITIONER'S/S EXHIBITS:\nANNEXURE Al THE TRUE COPY OF THE FINAL REPORT IN C.C.\nNO. 330 OF 2018 OF THE JUDICIAL FIRST CLASS\nMAGISTRATE COURT III, NORTH PARAVUR.\nANNEXURE A2 THE AFFIDAVIT DATED 05.12.2020 SWORN BY THE\n2ND RESPONDENT HEREIN.\n\n"
}