{
    "case_id": "Crl.MC.No.4480 OF 2014",
    "court": "HIGH COURT OF KERALA AT ERNAKULAM",
    "date": "8TH DAY OF JANUARY 2021",
    "judge": "P.V.KUNHIKRISHNAN\nFRIDAY",
    "petitioners": [
        "SURAYYA",
        "W/O.AMOO, R/AT. CHELLANAD HOUSE, ALAMPADY,",
        "VIDAYNAGER, CITIZEN NAGER, KASARAGOD."
    ],
    "respondents": [
        "S :",
        "1 M/S. MAHINDRA AND MAHINDRA",
        "FINANCIAL SERVICES LTD, 2ND FLOOR, CITY CENTRE, BANK",
        "ROAD, KASARAGOD, REPRESENTED BY ITS MANAGER.",
        "PIN-671121",
        "2 PRASAD",
        "MANAGER, M/S.MAHINDRA & MAHINDRA, FINANCIAL SERVICES",
        "LTD, 2ND FLOOR, CITY CENTRE, BANK ROAD, KASARAGOD.",
        "671121",
        "3 STATE OF KERALA",
        "THROUGH THE STATION HOUSE OFFICER VIDYANAGER, REP. BY",
        "ITS PUBLIC PROSECUTOR, HIGH COURT OF KERALA,",
        "ERNAKULAM. 682031",
        "R1 BY ADV. SRI.DEVAPRASANTH.P.J.",
        "OTHER PRESENT:",
        "R3 BY SRI.SANTHOSH PETER, SR.PP"
    ],
    "sections": [],
    "outcome": "",
    "full_text": "Baal\npiskhts: *\napa\nIN THE HIGH COURT OF KERALA AT ERNAKULAM 2021/KER/1233\nPRESENT\nTHE HONOURABLE MR. JUSTICE P.V.KUNHIKRISHNAN\nFRIDAY, THE O8TH DAY OF JANUARY 2021 / 18TH POUSHA, 1942\nCrl.MC.No.4480 OF 2014\n[CMP NO.4615/2013 ON THE FILE OF THE CHIEF JUDICIAL MAGISTRATE\nCOURT, KASARAGOD]\nPETITIONER:\nSURAYYA\nW/O.AMOO, R/AT. CHELLANAD HOUSE, ALAMPADY,\nVIDAYNAGER, CITIZEN NAGER, KASARAGOD.\nBY ADV. SRI.KODOTH SREEDHARAN\nRESPONDENTS :\n1 M/S. MAHINDRA AND MAHINDRA\nFINANCIAL SERVICES LTD, 2ND FLOOR, CITY CENTRE, BANK\nROAD, KASARAGOD, REPRESENTED BY ITS MANAGER.\nPIN-671121\n2 PRASAD\nMANAGER, M/S.MAHINDRA & MAHINDRA, FINANCIAL SERVICES\nLTD, 2ND FLOOR, CITY CENTRE, BANK ROAD, KASARAGOD.\n671121\n3 STATE OF KERALA\nTHROUGH THE STATION HOUSE OFFICER VIDYANAGER, REP. BY\nITS PUBLIC PROSECUTOR, HIGH COURT OF KERALA,\nERNAKULAM. 682031\nR1 BY ADV. SRI.DEVAPRASANTH.P.J.\nOTHER PRESENT:\nR3 BY SRI.SANTHOSH PETER, SR.PP\nTHIS CRIMINAL MISC. CASE HAVING BEEN FINALLY HEARD ON\n08.01.2021, THE COURT ON THE SAME DAY PASSED THE FOLLOWING:\n\nBier\n=\npage 7\nCRL.M.C.NO.4480 OF 2014 2 2021/KER/1233\nORDER\nDated this the 8th day of January 2021\nThis Crl.M.C. is dismissed with a liberty to\nthe petitioner to challenge Annexure-V order by\nfiling a revision, if she is advised so.\nSd/-\nP.V.KUNHIKRISHNAN\npkk JUDGE\n\nBaal\npiskhts: *\nbes\nCRL.M.C.NO.4480 OF 2014 3 2021/KER/1233\nAPPENDIX\n\nPETITIONER'S/S EXHIBITS:\n\nEXHIBIT Al Al - TRUE COPY OF THE COMPLAINT IN CMP\n4615/2013 BEFORE THE CHIEF JUDICIAL\nMAGISTRATE COURT, KASARAGOD.\n\nEXHIBIT A2 A2 - TRUE COPY OF THE COUNTER IN CMP\n4615/2013 BEFORE THE CHIEF JUDICIAL\nMAGISTRATE COURT, KASARAGOD.\n\nEXHIBIT A3 A3 - TRUE COPY OF THE SEARCH APPLICATION\nFILED U/S.94 OF CR.PC\n\nEXHIBIT A4 A4 - TRUE COPY OF THE COUNTER IN CMP\n4616/13 BEFORE THE CHIEF JUDICIAL\nMAGISTRATE COURT, KASARAGOD.\n\nEXHIBIT A5 A5 - TRUE COPY OF THE ORDER IN CMP NO.\n4615/2013 DT. 31.5.14 OF THE CHIEF JUDICIAL\nMAGISTRATE COURT, KASARAGOD.\n\n//TRUE COPY//\nSD/-\nP.S. TO JUDGE\n\n"
}