{
    "case_id": "",
    "court": "HIGH COURT OF KERALA AT ERNAKULAM",
    "date": "5TH DAY OF JANUARY 2021",
    "judge": "V.G.ARUN\nTUESDAY",
    "petitioners": [
        "S :",
        "1 POOVANCHERY ABDUL MAJEED",
        "AGED 30 YEARS",
        "S/O.ABDUL AZEEZ, POOVANCHERY HOUSE, KANNATTIPADI",
        "P.O., MALAPPURAM DISTRICT-676304.",
        "2 USMAN,",
        "AGED 27 YEARS",
        "S/O.ABDUL AZEEZ, POOVANCHERY HOUSE, KANNATTIPADI",
        "P.O., MALAPPURAM DISTRICT-676304."
    ],
    "respondents": [
        "S:",
        "1 ABDUL LATHEEF",
        "AGED 51 YEARS",
        "S/O.ALAVI, PANAKKAL HOUSE, KANNATTIPADI P.O.,",
        "MALAPPURAM DISTRICT-676304.",
        "2 STATE OF KERALA,",
        "REPRESENTED BY PUBLIC PROSECUTOR, HIGH COURT OF",
        "KERALA, ERNAKULAM-682031.",
        "R1 BY ADV. P.K.MOHAMED JAMEEL"
    ],
    "sections": [
        "341",
        "323",
        "326 read with 34 of IPC",
        "now\npending as C"
    ],
    "outcome": "ORDER\nPetitioners are the accused in Crime No.178 of 2016\nregistered at the Vengara Police Station for the offence\npunishable under Sections 341, 323, 326 r/w 34 of IPC, now\npending as C.P.No.55 of 2019 on the files of Judicial First Class\nMagistrate, Malappuram. The de facto complainant at whose\ninstance the crime was registered is the 1* respondent.\nAnnexure A2 affidavit has been filed by the 1* respondent,\nstating that the dispute has been settled and that he has no\nsubsisting grievance against the petitioners.\n\n2. Heard the learned Public Prosecutor also, who, on\ninstructions, submits that the petitioners have no criminal\nantecedents.\n\n3. Having considered the gravity of the offences alleged,\nnature of the injury caused and having perused the affidavit filed\nby the 1* respondent, the contents of which are submitted to be\ntrue and voluntary, I am satisfied that the dispute is settled and\nthat no public interest is involved in this matter. Moreover, in\n\nEleaael\nCrmc 5214/2020 3 202 1U/KER/296\nview of the settlement, possibility of the criminal proceedings\nending in conviction is remote. As such, continuance of the\nproceedings will amount to an abuse of process of court and\nhence, in view of the legal position set out by the Honourable\nSupreme Court in Madan Mohan Abbot v. State of Punjab\n[(2008) 4 SCC 582] and Gian Singh v. State of Punjab and\nanother [(2012) 10 SCC 303], there is no impediment in\ngranting the relief sought.\n\n4. In the result, this Crl.M.C is allowed. The proceedings in\nC.P.No.55 of 2019 on the files of Judicial First Class Magistrate,\nMalappuram is quashed",
    "full_text": "iis che be)\nBSR\nIN THE HIGH COURT OF KERALA AT ERNAKULAM 2021/KER/296\nPRESENT\nTHE HONOURABLE MR.JUSTICE V.G.ARUN\nTUESDAY, THE O5TH DAY OF JANUARY 2021 / 15TH POUSHA, 1942\nCri.MC.No.5214 OF 2020 (B)\nAGAINST THE JUDGMENT IN CP 55/2019 OF JUDICIAL MAGISTRATE OF FIRST\nCLASS ,MALAPPURAM\nCRIME NO.178/2016 OF Vengara Police Station , Malappuram\nPETITIONERS :\n1 POOVANCHERY ABDUL MAJEED\nAGED 30 YEARS\nS/O.ABDUL AZEEZ, POOVANCHERY HOUSE, KANNATTIPADI\nP.O., MALAPPURAM DISTRICT-676304.\n2 USMAN,\nAGED 27 YEARS\nS/O.ABDUL AZEEZ, POOVANCHERY HOUSE, KANNATTIPADI\nP.O., MALAPPURAM DISTRICT-676304.\nBY ADV. SHRI.JINU JOSEPH\nRESPONDENTS:\n1 ABDUL LATHEEF\nAGED 51 YEARS\nS/O.ALAVI, PANAKKAL HOUSE, KANNATTIPADI P.O.,\nMALAPPURAM DISTRICT-676304.\n2 STATE OF KERALA,\nREPRESENTED BY PUBLIC PROSECUTOR, HIGH COURT OF\nKERALA, ERNAKULAM-682031.\nR1 BY ADV. P.K.MOHAMED JAMEEL\nTHIS CRIMINAL MISC. CASE HAVING COME UP FOR ADMISSION ON\n05.01.2021, THE COURT ON THE SAME DAY PASSED THE FOLLOWING:\n\nEleaael\nCrmc 5214/2020 2 2021/KER/296\nV.G.ARUN, J.\n~GYLM.C.NO.5214 of 2020.\nDated this the 5* day of January, 2021\nORDER\nPetitioners are the accused in Crime No.178 of 2016\nregistered at the Vengara Police Station for the offence\npunishable under Sections 341, 323, 326 r/w 34 of IPC, now\npending as C.P.No.55 of 2019 on the files of Judicial First Class\nMagistrate, Malappuram. The de facto complainant at whose\ninstance the crime was registered is the 1* respondent.\nAnnexure A2 affidavit has been filed by the 1* respondent,\nstating that the dispute has been settled and that he has no\nsubsisting grievance against the petitioners.\n\n2. Heard the learned Public Prosecutor also, who, on\ninstructions, submits that the petitioners have no criminal\nantecedents.\n\n3. Having considered the gravity of the offences alleged,\nnature of the injury caused and having perused the affidavit filed\nby the 1* respondent, the contents of which are submitted to be\ntrue and voluntary, I am satisfied that the dispute is settled and\nthat no public interest is involved in this matter. Moreover, in\n\nEleaael\nCrmc 5214/2020 3 202 1U/KER/296\nview of the settlement, possibility of the criminal proceedings\nending in conviction is remote. As such, continuance of the\nproceedings will amount to an abuse of process of court and\nhence, in view of the legal position set out by the Honourable\nSupreme Court in Madan Mohan Abbot v. State of Punjab\n[(2008) 4 SCC 582] and Gian Singh v. State of Punjab and\nanother [(2012) 10 SCC 303], there is no impediment in\ngranting the relief sought.\n\n4. In the result, this Crl.M.C is allowed. The proceedings in\nC.P.No.55 of 2019 on the files of Judicial First Class Magistrate,\nMalappuram is quashed.\n\nSd/-\nV.G.ARUN\nJUDGE\n1gk\n\ncars as\niis che be)\nBeet\nCrmc 5214/2020 4 202U/KERI296\nAPPENDIX OF Crl.MC 5214/2020\nPETITIONER'S/S EXHIBITS:\nANNEXURE Al CERTIFIED COPY OF FINAL REPORT IN CRIME\nNO.178/2016 OF VENGARA POLICE STATION.\nANNEXURE A2 ORIGINAL AFFIDAVIT OF 1ST RESPONDENT.\n\n"
}