{
    "case_id": "Crl.MC.No. 2598 of 2015",
    "court": "HIGH COURT OF KERALA AT ERNAKULAM\nPRESENT",
    "date": "28TH DAY OF APRIL 2015",
    "judge": "ANIL K.NARENDRAN\nTUESDAY",
    "petitioners": [
        "ACCUSED:"
    ],
    "respondents": [
        "S/COMPLAINANT & INVESTIGATING OFFICER:",
        "1. STATE OF KERALA,",
        "REP.BY THE PUBLIC PROSECUTOR, HIGH COURT OF KERALA,",
        "ERNAKULAM- 682 031.",
        "2. SUB INSPECTOR OF POLICE,"
    ],
    "sections": [
        "22 OF THE MINES"
    ],
    "outcome": "",
    "full_text": "Foseiena\naes\n2015/KER/17450\nIN THE HIGH COURT OF KERALA AT ERNAKULAM\nPRESENT:\nTHE HONOURABLE MR. JUSTICE ANIL K.NARENDRAN\nTUESDAY, THE 28TH DAY OF APRIL 2015/8TH VAISAKHA, 1937\nCrl.MC.No. 2598 of 2015\n\nPETITIONER/ACCUSED:\n\nRAJKUMAR, AGED 28 YEARS,\n\nS/O.RAMACHANDRAN, CHANKOOR VEEDU, PALLARIMANGALAM MURI,\n\nTHEKKEKARA VILLAGE (P.O), MAVELIKARA.\n\nBY ADVS.SMT.ASHA ELIZABETH MATHEW\n\nSRILNIRMAL.V.NAIR\nRESPONDENTS/COMPLAINANT & INVESTIGATING OFFICER:\n1. STATE OF KERALA,\nREP.BY THE PUBLIC PROSECUTOR, HIGH COURT OF KERALA,\nERNAKULAM- 682 031.\n2. SUB INSPECTOR OF POLICE,\n\nPOLICE STATION, KANAKAKUNNU (P.O)\n\nBY PUBLIC PROSECUTOR SRI.ABIJITT LESSLI\n\nTHIS CRIMINAL MISC. CASE HAVING COME UP FOR ADMISSION ON\n28-04-2015, THE COURT ON THE SAME DAY PASSED THE FOLLOWING:\n\nrae\naes\n2015/KER/17450\nCrl.MC.No. 2598 of 2015\nAPPENDIX\nPETITIONER'S EXHIBITS :-\nANNEXURE Al A TRUE COPY OF THE CERTIFICATE OF REGISTRATION OF MMV\nEXCAVATOR BEARING REGISTRATION NO.KL-23-E-4083.\nANNNEXURE A2 A TRUE COPY OF THE COMPLAINT PREFERRED BY THE 2ND\nRESPONDENT UNDER SECTION 22 OF THE MINES & MINERALS (DEVELOPMENT &\nREGULATION) ACT.\nANNEXURE A3 A TRUE COPY OF THE JUDGMENT DATED 13/05/2014 OF THIS COURT\nIN CRL MC 2529/2014.\nRESPONDENTSâ€™ EXHIBITS :- NIL.\nTrue copy\nP.A to Judge\n\n2015/KER/17450\nANIL K.NARENDRAN, J.\nDated this the 28\" day of April, 2015\nORDER\n\nThe petitioner is the registered owner of a JCB MMV Excavator\nbearing registration No.KL-23-E-4083, which was seized alleging\ntransportation of gravel, which is an offence punishable under Rule\n48K read with Rule 58(1) of the Kerala Minor Mineral Concession\nRules. The vehicle was seized by the second respondent on\n22.4.2015. According to the petitioner, though the alleged offence is\na compoundable offence under Section 23A of the Mines & Minerals\n(Development & Regulation) Act and Rule 32 Kerala Minerals\n(Prevention of Illegal Mining, Storage and Transportation) Rules,\n2015, the second respondent did not consider such request made\nfor compounding the offence. Therefore the petitioner seeks\ninterference of this Court.\n\n2. Heard the learned counsel for the petitioner and also the\nlearned Public Prosecutor.\n\n3. Considering the facts and circumstances of the case, this\nCri.M.C. is disposed of directing the petitioner to make an\n\nes\nte\n2015/KER/17450\nCrl.M.C.No.2598 of 2015\n2\napplication to compound the offence within a period of one week\nfrom today. If such an application is received by the second\nrespondent, the said respondent shall consider and pass appropriate\norders thereon as expeditiously as possible, at any rate, within a\nperiod of two weeks from the date of receipt of such application.\nThe Criminal M.C. is disposed of as above.\nANIL K.NARENDRAN, JUDGE\n\nskj\n\n"
}