{
    "case_id": "",
    "court": "HIGH COURT OF KERALA AT ERNAKULAM\nPRESENT",
    "date": "4TH DAY OF JANUARY 2018",
    "judge": "B.KEMAL PASHA\nTHURSDAY",
    "petitioners": [
        "(S) /1ST ACCUSED",
        "AMJITH,",
        "AGED 32 YEARS, S/O.MOIDU, KAYAKOOL HOUSE,",
        "KUNDUTHODE P.O., MARUTHUAKARA VILLAGE,",
        "VADAKARA TALUK, CALICUT DISTRICT, PIN-673513."
    ],
    "respondents": [
        "(S) /COMPLAINANT AND DE FACTO COMPLAINANT:",
        "1. STATE OF KERALA,",
        "REPRESENTED BY THE PUBLIC PROSECUTOR,",
        "HIGH COURT OF KERALA, ERNAKULAM, KOCHI-682031.",
        "2. ANAS,",
        "AGED 28 YEARS, S/O.KUNHABDULLA @ ABDULLA,",
        "KANDOTH THAZHA KUNI HOUSE, KUTTIPPURAM AMSOM,",
        "CHELAKKAD DESOM, CHELAKKAD P.O., NADAPURAM VILLAGE,",
        "VADAKARA TALUK, KOZHIKODE DISTRICT, PIN-673506.",
        "R1 BY PUBLIC PROSECUTOR SRI. ALEX M. THOMBRA",
        "R2 BY ADV. SRI.VINUCHAND"
    ],
    "sections": [
        "341",
        "323",
        "324",
        "308 read with 34 of the Indian Penal Code"
    ],
    "outcome": "ORDER\n\nPetitioner is the 1 accused in S.C.No.295/2017 of the\nAdditional District and Sessions Court-IV, Kozhikode,\nregistered for the offences punishable under Sections 341,\n323, 324 and 308 read with 34 of the Indian Penal Code.\n\n2. It seems that the matter has been amicably settled\nbetween the parties.\n\n3. On going through the matter, this Court is satisfied\nthat there are no ingredients to invite an offence under Section\n308 IPC in the matter All the cases relating to the matter\nwere settled. The 2™ respondent has filed affidavit as\nAnnexure-A3, affirming that the matter has been amicably\nsettled between him and the petitioner and he has no\ncomplaints against the petitioner.\n\n4. When the matter has been amicably settled between\nthe parties, no purpose would be served in proceeding with the\nmatter any further. Matters being so, all further proceedings\nagainst the petitioner in S.C.No.295/2017 of the Additional\n\nBE\nye ale\n2018/KER/264\nCrl.M.C.No.8803 of 2017 2\nDistrict and Sessions Court-IV, Kozhikode, can be quashed",
    "full_text": "gaan\nBiph sew ie\n2018/KER/264\nIN THE HIGH COURT OF KERALA AT ERNAKULAM\nPRESENT:\nTHE HONOURABLE MR. JUSTICE B.KEMAL PASHA\nTHURSDAY, THE 4TH DAY OF JANUARY 2018 / 14TH POUSHA, 1939\nCr1.MC.No. 8803 of 2017\nSC 295/2017 of ADDL. D.C. & SESSIONS COURT - IV, KOZHIKODE\nCRIME NO. 611/2014 OF KUTTIYADI POLICE STATION , KOZHIKODE DISTRICT\nPETITIONER (S) /1ST ACCUSED\nAMJITH,\nAGED 32 YEARS, S/O.MOIDU, KAYAKOOL HOUSE,\nKUNDUTHODE P.O., MARUTHUAKARA VILLAGE,\nVADAKARA TALUK, CALICUT DISTRICT, PIN-673513.\nBY ADVS.SRI.ABU MATHEW\nSRI.AJU MATHEW\nSRI.BYJU PUTHIYADATH MEETHAL\nRESPONDENT (S) /COMPLAINANT AND DE FACTO COMPLAINANT:\n1. STATE OF KERALA,\nREPRESENTED BY THE PUBLIC PROSECUTOR,\nHIGH COURT OF KERALA, ERNAKULAM, KOCHI-682031.\n2. ANAS,\nAGED 28 YEARS, S/O.KUNHABDULLA @ ABDULLA,\nKANDOTH THAZHA KUNI HOUSE, KUTTIPPURAM AMSOM,\nCHELAKKAD DESOM, CHELAKKAD P.O., NADAPURAM VILLAGE,\nVADAKARA TALUK, KOZHIKODE DISTRICT, PIN-673506.\nR1 BY PUBLIC PROSECUTOR SRI. ALEX M. THOMBRA\nR2 BY ADV. SRI.VINUCHAND\nTHIS CRIMINAL MISC. CASE HAVING COME UP FOR ADMISSION ON 04-01-2018,\nTHE COURT ON THE SAME DAY PASSED THE FOLLOWING:\nPBS\n\nBel\n2018/KER/264\nCr1.MC.No. 8803 of 2017 ()\nAPPENDIX\nPETITIONER (S)' ANNEXURE'S\nANNEXURE Al CERTIFIED COPY OF THE FIR IN CRIME NO.611 OF 2014\nOF KUTTIYADY POLICE STATION.\nANNEXURE A2 CERTIFIED COPY OF THE FINAL REPORT IN CRIME\nNO.611 OF 2014 OF KUTTIYADY POLICE STATION.\nANNEXURE A3 NOTORIZED AFFIDAVIT DATED 09.12.2017 EXECUTED BY\nTHE 2ND RESPONDENT/DE FACTO COMPLAINANT.\nRESPONDENT'S ANNEXURE NIL\n/TRUE coPy/\nPA TO JUDGE\nPBS\n\nBE\n2018/KER/264\nB. KEMAL PASHA, J.\nDated this the 4\" day of January, 2018\nORDER\n\nPetitioner is the 1 accused in S.C.No.295/2017 of the\nAdditional District and Sessions Court-IV, Kozhikode,\nregistered for the offences punishable under Sections 341,\n323, 324 and 308 read with 34 of the Indian Penal Code.\n\n2. It seems that the matter has been amicably settled\nbetween the parties.\n\n3. On going through the matter, this Court is satisfied\nthat there are no ingredients to invite an offence under Section\n308 IPC in the matter All the cases relating to the matter\nwere settled. The 2™ respondent has filed affidavit as\nAnnexure-A3, affirming that the matter has been amicably\nsettled between him and the petitioner and he has no\ncomplaints against the petitioner.\n\n4. When the matter has been amicably settled between\nthe parties, no purpose would be served in proceeding with the\nmatter any further. Matters being so, all further proceedings\nagainst the petitioner in S.C.No.295/2017 of the Additional\n\nBE\nye ale\n2018/KER/264\nCrl.M.C.No.8803 of 2017 2\nDistrict and Sessions Court-IV, Kozhikode, can be quashed.\n\nIn the result, this Crl.M.C. is allowed and all further\nproceedings against the petitioner in S.C.No.295/2017 of the\nAdditional District and Sessions Court-IV, Kozhikode, are\nquashed.\n\nSd/-\nB. KEMAL PASHA, JUDGE.\nsd\n// True Copy // P.A. to Judge\n\n"
}