{
    "case_id": "",
    "court": "HIGH COURT OF KERALA AT ERNAKULAM\nPRESENT\nTHE HONOURABLE MR",
    "date": "9TH DAY OF JANUARY 2019",
    "judge": "K.ABRAHAM MATHEW\nWEDNESDAY",
    "petitioners": [
        "ABDUL SALEEM,",
        "AGED 31 YEARS",
        "S/O ABDURAHIMAN , KARALAKATH",
        "HOUSE , AREEKULAM , VENGARA , MALAPPURAM DISTRICT"
    ],
    "respondents": [
        "S :",
        "1 MOIDEEN,",
        "S/O MOOSA,KANKARAKADAN HOUSE ,MATTATHUR",
        "AMSOM , MOOLAPARAMB , OTHUKKUNGAL , KOTTAKKAL , MALAPPURAM",
        "DISTRICT",
        "2 STATE OF KERALA,",
        "REPRESENTED BY PUBLIC PROSECUTOR,HIGH COURT OF",
        "KERALA , ERNAKULAM"
    ],
    "sections": [
        "482 Cr"
    ],
    "outcome": "ORDER\n\nPetition filed under Section 482 Cr.P.C.\n\n2. Petitioner was the first accused in\nS.C.No.597 of 2016 on the file of the Asst. Sessions\nJudge, Manjeri. He and the co-accused allegedly\ncommitted the offences under Sections 364 and 392\nIPC. As the petitioner was absconding, only the\nothers were tried. They were acquitted by Annexure-B\njudgment. Later the petitioner surrendered and his\ncase is now pending as S.C.No.5 of 2019. The\nproceedings are sought to be quashed",
    "full_text": "Bee\nune\nEat:\n2019/KER/1225\nIN THE HIGH COURT OF KERALA AT ERNAKULAM\nPRESENT\nTHE HONOURABLE MR. JUSTICE K.ABRAHAM MATHEW\nWEDNESDAY ,THE O9TH DAY OF JANUARY 2019 / 19TH POUSHA, 1940\nCr1.MC.No. 8655 of 2018\nAGAINST THE JUDGMENT IN SC 349/2013 of ASST. SESSIONS COURT,\nMANJERI DATED 09-08-2016\nCRIME NO. 161/2013 OF Vengara Police Station , Malappuram\nPETITIONER:\nABDUL SALEEM,\nAGED 31 YEARS\nS/O ABDURAHIMAN , KARALAKATH\nHOUSE , AREEKULAM , VENGARA , MALAPPURAM DISTRICT\nBY ADV. SRI.P.M.RAFIO\nRESPONDENTS :\n1 MOIDEEN,\nS/O MOOSA,KANKARAKADAN HOUSE ,MATTATHUR\nAMSOM , MOOLAPARAMB , OTHUKKUNGAL , KOTTAKKAL , MALAPPURAM\nDISTRICT\n2 STATE OF KERALA,\nREPRESENTED BY PUBLIC PROSECUTOR,HIGH COURT OF\nKERALA , ERNAKULAM\nBY ADV. SRI.V.C.SARATH\nSRI.ALEX M THOMBRA SR PP\nTHIS CRIMINAL MISC. CASE HAVING COME UP FOR ADMISSION ON\n09.01.2019, THE COURT ON THE SAME DAY PASSED THE FOLLOWING:\n\nmeee\nBere\n2019/KER/1225\nCr1.MC.No. 8655 of 2018 2\nORDER\n\nPetition filed under Section 482 Cr.P.C.\n\n2. Petitioner was the first accused in\nS.C.No.597 of 2016 on the file of the Asst. Sessions\nJudge, Manjeri. He and the co-accused allegedly\ncommitted the offences under Sections 364 and 392\nIPC. As the petitioner was absconding, only the\nothers were tried. They were acquitted by Annexure-B\njudgment. Later the petitioner surrendered and his\ncase is now pending as S.C.No.5 of 2019. The\nproceedings are sought to be quashed in the light of\nthe acquittal of the co-accused. Moreover, the\nmatter has been settled. The first respondent is the\nvictim.\n\n3. Heard the learned counsel for the petitioner\nand the learned Public Prosecutor.\n\n4. IT am satisfied that the trial of the\npetitioner will not serve any purpose since the co-\naccused has been acquitted and the matter has been\n\nay\nPumped\n[OR\n2019/KER/1225\nCr1.MC.No. 8655 of 2018 3\nsettled.\n\nIn the result, this Crl.M.C is allowed. The\nproceedings in S.C.No.5 of 2019 on the file of the\nAsst. Sessions Judge, Manjeri are quashed. If any\nmaterial objects have been produced in this case, the\ntrial court may pass appropriate orders for their\ndisposal.\n\nSd/-\nK.ABRAHAM MATHEW\nJUDGE\npm\n\nay\nunion\nese\n2019/KER/1225\nCr1.MC.No. 8655 of 2018 4\nAPPENDIX\nPETITIONER'S EXHIBITS:\nANNEXURE A TRUE COPY OF THE FINAL REPORT IN CRIME NO\n1161/2013 OF VENGARA POLICE\nSTATION ,MALAPPURAM DISTRICT\nANNEXURE B THE TRUE COPY OF THE JUDGMENT IN SC NO\n439/2013 OF THE COURT OF ASSISTANT\nSESSIONS JUDGE ,MANJERI ,DATED 9.8.2016\nANNEXURE C THE AFFIDAVIT SWORN BY 1ST RESPONDENT\nINFORMING THE FACTUM OF SETTLEMENT\nRESPONDENTS ' EXHIBITS: NIL\n// TRUE COPY // PA TO JUDGE\n\n"
}