{
    "case_id": "Crl.MC.No. 347 of 2014",
    "court": "HIGH COURT OF KERALA AT ERNAKULAM\nPRESENT",
    "date": "5TH DAY OF JANUARY 2015",
    "judge": "P.UBAID\nMONDAY",
    "petitioners": [
        "APPELLANT :",
        "V.K.SAJI, AGED 42 YEARS,",
        "ADVOCATE, $/O.LATE KRISHNAN, VELLARAMKUNNEL,",
        "KARIMKUNNAM P.O, VIA THODUPUZHA,",
        "IDUKKI DISTRICT."
    ],
    "respondents": [
        "S:",
        "1. STATE OF KERALA",
        "REPRESENTED BY THE PUBLIC PROSECUTOR,",
        "HIGH COURT OF KERALA,",
        "ERNAKULAM-682 031.",
        "2. THE STATION HOUSE OFFICER,",
        "KARIMKUNNAM POLICE STATION, KARIMKUNNAM P.O.",
        "VIA THODUPUZHA, IDUKKI DISTRICT-685 581.",
        "3. THE SECRETARY",
        "KARIMKUNNAM GRAMA PANCHAYATH,",
        "KARIMKUNNAM P.O.",
        "VIA THODUPUZHA,",
        "TDUKKI DISTRICT-685 581.",
        "R3 BY ADV. SRI.THOMAS J.ANAKKALLUNKAL",
        "R1 & R2 BY SR. PUBLIC PROSECUTOR SMT.SAREENA GEORGE.P"
    ],
    "sections": [],
    "outcome": "",
    "full_text": "Peleg zl\nel acted\nBae\n2015/KER/26\nIN THE HIGH COURT OF KERALA AT ERNAKULAM\nPRESENT:\nTHE HONOURABLE MR. JUSTICE P.UBAID\nMONDAY, THE 5TH DAY OF JANUARY 2015/15TH POUSHA, 1936\nCr1.MC.No. 347 of 2014\nCRIME NO. 691/2013 OF KARINKUNNAM POLICE STATION, IDUKKI\nPETITIONER/APPELLANT :\nV.K.SAJI, AGED 42 YEARS,\nADVOCATE, $/O.LATE KRISHNAN, VELLARAMKUNNEL,\nKARIMKUNNAM P.O, VIA THODUPUZHA,\nIDUKKI DISTRICT.\nBY ADV. DR.GEORGE ABRAHAM\nRESPONDENTS:\n1. STATE OF KERALA\nREPRESENTED BY THE PUBLIC PROSECUTOR,\nHIGH COURT OF KERALA,\nERNAKULAM-682 031.\n2. THE STATION HOUSE OFFICER,\nKARIMKUNNAM POLICE STATION, KARIMKUNNAM P.O.\nVIA THODUPUZHA, IDUKKI DISTRICT-685 581.\n3. THE SECRETARY\nKARIMKUNNAM GRAMA PANCHAYATH,\nKARIMKUNNAM P.O.\nVIA THODUPUZHA,\nTDUKKI DISTRICT-685 581.\nR3 BY ADV. SRI.THOMAS J.ANAKKALLUNKAL\nR1 & R2 BY SR. PUBLIC PROSECUTOR SMT.SAREENA GEORGE.P\nTHIS CRIMINAL MISC. CASE HAVING BEEN FINALLY HEARD ON\n05-01-2015, THE COURT ON THE SAME DAY PASSED THE FOLLOWING:\n\nBee\npa ra\nae\n2015/KER/26\nCrl.MC.No. 347 of 2014\nAPPENDIX\nPETITIONER'S ANNEXURES :\nANNEXURE-A. COPY OF THE LOCATION SKTECH OF THE PETITIONER'S\nPROPERTY\nANNEXURE-B. COPY OF THE COMPLAINT FILED BY K.R.RAGHAVAN.\nANNEXURE-C. COPY OF THE COMPLAINT MADE BY SEBASTIAN JOHN DATED\n13/009/2012.\nANNEXURE-D. COPY OF THE REPORT OF THE VILLAGE OFFICER\nANNEXURE-E.COPY OF THE ORDER OF TAHSILDAR, THODUPUZHA DATED\n3/8/2012.\nANNEXURE-F.COPY OF THE JUDGMENT IN WPC NO.24094/2012.\nANNEXURE-G. PHOTOGRAPH SHOWING THE PROPERTY OF THE PETITIONER\nANNEXURE-H.COPY OF THE REPROT OF THE TALUK SURVEYOR.\nANNEXURE-I.COPY OF THE F.I.S FILED BY THE 3RD RESPONDENT\nANNEXURE-J.COPY OF THE F.I.R. NO.691/13 FILED BY THE 2ND\nRESPONDENT\nRESPONDENTS! ANNEXURES:\nNIL\n//TRUE COPY//\nP.A TO JUDGE\nab\n\nBRE\nate\n2015/KER/26\nP.UBAID, J.\nCrl.M.C No.347 of 2014\nDated this the 5\" day of January, 2015\nORDER\nThe prayer in this proceeding is to quash FIR.\nThe learned Public Prosecutor submits that the crime itself\nstands now referred. It appears that the petitioner accepts\nthe same. Hence the submission made by the learned Public\nProsecutor is recorded, and the Criminal Miscellaneous Case\nis closed.\nP.UBAID\nJUDGE\nab\n\n"
}