{
    "case_id": "",
    "court": "HIGH COURT OF KERALA AT ERNAKULAM\nPRESENT",
    "date": "8TH DAY OF JANUARY 2015",
    "judge": "P.UBAID\nTHURSDAY",
    "petitioners": [
        "ACCUSED:",
        "SHAFEEKH RAHMAN, AGED 26 YEARS",
        "S/O.ALI KUNDUKULI, KUNDUKULI AKKARA HOUSE,",
        "IRUVETTY P.O., AREKODE POLICE STATION LIMIT,",
        "MALAPPURAM DISTRICT."
    ],
    "respondents": [
        "S/COMPLAINANT & STATE:",
        "1. STATE OF KERALA",
        "REPRESENTED BY PUBLIC PROSECUTUR",
        "HIGH COURT OF KERALA,",
        "ERNAKULAM, KOCHI 682 031.",
        "2. SUB INSPECTOR OF POLICE,",
        "KARIPPUR POLICE STATION, MALAPPURAM - 676 552."
    ],
    "sections": [],
    "outcome": "",
    "full_text": "PIR\nme comet\nBle ae\n2015/KER/791\nIN THE HIGH COURT OF KERALA AT ERNAKULAM\nPRESENT:\nTHE HONOURABLE MR. JUSTICE P.UBAID\nTHURSDAY, THE 8TH DAY OF JANUARY 2015/18TH POUSHA, 1936\nCr1.MC.No. 83 of 2014\nAGAINST THE ORDER IN CRMP 5726/2013 OF THE CHIEF JUDICIAL\nMAGISTRATE COURT, MANJERI DATED 19-12-2013\nCRIME NO. 800/2013 OF KARIPUR POLICE STATION, MALAPPURAM\nPETITIONER/ACCUSED:\nSHAFEEKH RAHMAN, AGED 26 YEARS\nS/O.ALI KUNDUKULI, KUNDUKULI AKKARA HOUSE,\nIRUVETTY P.O., AREKODE POLICE STATION LIMIT,\nMALAPPURAM DISTRICT.\nBY ADV. SRI.P.V.KUNHIKRISHNAN\nRESPONDENTS/COMPLAINANT & STATE:\n1. STATE OF KERALA\nREPRESENTED BY PUBLIC PROSECUTUR\nHIGH COURT OF KERALA,\nERNAKULAM, KOCHI 682 031.\n2. SUB INSPECTOR OF POLICE,\nKARIPPUR POLICE STATION, MALAPPURAM - 676 552.\nBY PUBLIC PROSECUTOR SMT.SAREENA GEORGE .P\nTHIS CRIMINAL MISC. CASE HAVING BEEN FINALLY HEARD ON\n08-01-2015, THE COURT ON THE SAME DAY PASSED THE FOLLOWING:\n\nPalette]\n\nPa cee\n\nBE ees\n\n2015/KER/791\nCrl1.MC.No. 83 of 2014\nAPPENDIX\nPETITIONER'S ANNEXURES :\nANNEXURE A: COPY OF THE MEMORANDUM DATED 13/12/2013 OF\nMR.K.T.SASIDHARAN, A.IT.O A.F.R.R.O., BOI, CALICUT, INTERNATIONAL\nAIRPORT.\nANNEXURE B: CERTIFIED COPY OF THE FIR IN CRIME NO.800/2013 OF\nKARIPUR POLICE STATION.\nANNEXURE C: A COPY OF THE PASSPORT OF THE PETITIONER BEARING NO.G\n0752436, WHICH IS SEIZED BY THE 2ND RESPONDENT.\nANNEXURE D: COPY OF THE S.S.L.C. CERTIFICATE OF THE PETITIONER.\nANNEXURE E: COPY OF THE PETITION FILED BY THE PETITIONER TO\nRELEASE THE PASSPORT WHICH HIS NUMBERED AS CRL.M.P.5726 OF 2013\nDATED 17/12/2013.\nANNEXURE F: COPY OF THE PETITION FILED BY THE PETITIONER SEEKING\nPERMISSION TO GO ABROAD WHICH HIS NUMBERED AS CRL.M.P NO.5727 OF\n2013 DATED 17/12/2013.\nANNEXURE G: CERTIFIED COPY OF THE ORDER DATED 19/12/2013 IN\nCRL.M.P.NO.5726 OF 2013.\nANNEXURE H: COPY OF THE ORDER DATED 19/12/2013 IN\nCRL.M.P.NO.5727/2013.\nRESPONDENTS' ANNEXURES :\nNIL\n//TRUE COPY//\nP.A TO JUDGE\n\nab\n\nee ct\n2015/KER/791\nP.UBAID, J.\nDated this the 8 day of January, 2015\nORDER\nThe order of the court below declining release of the\npetitioner's passport is under challenge. On 3.1.2014 this Court\ndirected the court below to release the passport on appropriate\nconditions. In such a situation, I do not find the necessity of any\nfurther hearing or probe. This order is made absolute and the\npetitioner is allowed to possess his passport subject to the\nconditions imposed by the court below. This Criminal\nMiscellaneous Case is accordingly closed.\nP.UBAID\nJUDGE\nab\n\n"
}