{
    "case_id": "",
    "court": "HIGH COURT OF KERALA AT ERNAKULAM",
    "date": "5TH DAY OF JANUARY 2018",
    "judge": "B.KEMATL PASHA\nFRIDAY",
    "petitioners": [
        "/ACCUSED 2 TO 4",
        "1 SOBHA S,",
        "D/O LATE SOMAN, AGED 35 YEARS, KARIKUZHIYIL HOUSE, VAYALA",
        "(P.O), PARAKKODU, PATHANAMTHITTA DISTRICT,",
        "PIN 691 554.",
        "2 GEETHA .S,",
        "D/O LATE SOMAN, AGED 38 YEARS, KARIKUZHIYIL HOUSE, VAYALA",
        "(P.O), PARAKKODU, PATHANAMTHITTA DISTRICT,",
        "PIN 691 554.",
        "3 SAVITHRI AMMA,",
        "W/O LATE SOMAN, KARIKUZHIYIL HOUSE, VAYALA P.O,",
        "PARAKKODU, PATHANAMTHITTA DISTRICT, PIN 691 554."
    ],
    "respondents": [
        "(S) /DEFACTO COMPLATNANT :",
        "1. STATE OF KERALA,",
        "REPRESENTED BY S.I OF POLICE, ADOOR POLICE STATION,",
        "PATHANAMTHITTA THROUGH PUBLIC PROSECUTOR,",
        "HIGH COURT OF KERALA, ERNAKULAM.",
        "2. ANIL KUMAR,",
        "s/o NARAYANAN, KALLUMPURATHU VEEDU,",
        "VADAKKADATHUKAVU, ERATHU VILLAGE, ADOOR, PIN 691 554.",
        "R1 BY PUBLIC PROSECUTOR SRI. AMJAD ALI",
        "R2 BY ADV. SRI.C.B.SREEKUMAR"
    ],
    "sections": [
        "294"
    ],
    "outcome": "ORDER\n\nPetitioners are A2 to A4 in CC No.137/2012 of the\nJudicial First Class Magistrate's Court, Adoor, based on\nAnnexure-A2 final report in Crime No.743/2011 of Adoor\nPolice Station, for the offences punishable under Sections\n\n294(b) and 324 read with Section 34 IPC.\n2. On going through the contents of the final report,\nit is evident that the offence under Section 294(b) IPC\ncannot be attracted. The abusive words allegedly made use\nof by the petitioners have not been mentioned anywhere in\nthe final report. Therefore, the offence under Section 294(b)\n\nIPC is liable to be quashed",
    "full_text": "ee\nBlasi aa\nIN THE HIGH COURT OF KERALA AT ERNAKULAM 201S/KER/493\nPRESENT:\nTHE HONOURABLE MR. JUSTICE B.KEMATL PASHA\nFRIDAY, THE 5TH DAY OF JANUARY 2018 / 15TH POUSHA, 1939\nCr1.MC.No. 5783 of 2016\nCC 137/2012 OF JUDICIAL FIRST CLASS MAGISTRATE COURT, ADOOR\nCRIME NO. 743/2011 OF ADOOR POLICE STATION r\nPATHANAMTHITTA DISTRICT\nPETITIONER(S) /ACCUSED 2 TO 4\n1 SOBHA S,\nD/O LATE SOMAN, AGED 35 YEARS, KARIKUZHIYIL HOUSE, VAYALA\n(P.O), PARAKKODU, PATHANAMTHITTA DISTRICT,\nPIN 691 554.\n2 GEETHA .S,\nD/O LATE SOMAN, AGED 38 YEARS, KARIKUZHIYIL HOUSE, VAYALA\n(P.O), PARAKKODU, PATHANAMTHITTA DISTRICT,\nPIN 691 554.\n3 SAVITHRI AMMA,\nW/O LATE SOMAN, KARIKUZHIYIL HOUSE, VAYALA P.O,\nPARAKKODU, PATHANAMTHITTA DISTRICT, PIN 691 554.\nBY ADVS.SRI.S.SAJU\nSRI.P.M. SHAMEER\nRESPONDENT (S) /DEFACTO COMPLATNANT :\n1. STATE OF KERALA,\nREPRESENTED BY S.I OF POLICE, ADOOR POLICE STATION,\nPATHANAMTHITTA THROUGH PUBLIC PROSECUTOR,\nHIGH COURT OF KERALA, ERNAKULAM.\n2. ANIL KUMAR,\ns/o NARAYANAN, KALLUMPURATHU VEEDU,\nVADAKKADATHUKAVU, ERATHU VILLAGE, ADOOR, PIN 691 554.\nR1 BY PUBLIC PROSECUTOR SRI. AMJAD ALI\nR2 BY ADV. SRI.C.B.SREEKUMAR\nTHIS CRIMINAL MISC. CASE HAVING BEEN FINALLY HEARD ON 05-01-2018,\nTHE COURT ON THE SAME DAY PASSED THE FOLLOWING:\nsdr/-\n\nee\nBlas a\n2018/KER/493\nCr1.MC.No. 5783 of 2016 ()\nAPPENDIX\n\nPETITIONER(S)' ANNEXURES\nANNEXURE Al CERTIFIED COPY OF THE F.I.R. NO 743/2011 OF ADOOR\n\nPOLICE STATION, DATED 12-09-2011\nANNEXURE A2 TRUE CERTIFIED COPY OF THE FINAL REPORT IN CRIME\n\nNO 743/2011 OF ADOOR POLICE STATION DATED\n\n02-10-2011 SUBMITTED THE 1ST RESPONDENT BEFORE\n\nTHE JUDICIAL FIRST CLASS MAGISTRATE, ADOOR.\nANNEXURE A3 TRUE COPY OF THE FIR IN CRIME NO 742/2011 OF ADOOR\n\nPOLICE STATION DATED 12-09-2011\nANNEXURE A4 TRUE COPY OF THE CHARGE SHEET IN CRIME NO\n\n742/2011 OF ADOOR POLICE STATION DATED 02-10-2011\n\nIN C.C 8835/2012 OF JFCM COURT, ADOOR.\nRESPONDENTS ANNEXURES NIL\n\n/TRUE COPY/\nPA TO JUDGE\n\nsdr/-\n\napes\n2018/KER/493\nB. KEMAL PASHA, J.\nDated this the 5â€œ day of January, 2018\nORDER\n\nPetitioners are A2 to A4 in CC No.137/2012 of the\nJudicial First Class Magistrate's Court, Adoor, based on\nAnnexure-A2 final report in Crime No.743/2011 of Adoor\nPolice Station, for the offences punishable under Sections\n\n294(b) and 324 read with Section 34 IPC.\n2. On going through the contents of the final report,\nit is evident that the offence under Section 294(b) IPC\ncannot be attracted. The abusive words allegedly made use\nof by the petitioners have not been mentioned anywhere in\nthe final report. Therefore, the offence under Section 294(b)\n\nIPC is liable to be quashed.\n\n3. Regarding the offence under Section 324 IPC,\nthere is an allegation that injuries were inflicted by beating\nwith a firewood and also by pelting stone. According to the\n\nbale Pe\n2018/KER/493\nCrl.M.C.5783/2016 5.\nlearned counsel for the petitioners, Annexures-A1 and A2\nare mere counter cases to the cases registered against the\nde facto complainant and his associates. Those matters\ncannot be considered at present.\n\nWith liberty to the petitioners to take up all these\ncontentions before the trial court at appropriate stage, this\nCri.M.C. is disposed of, by making it clear that the offence\nunder Section 294(b) IPC has been quashed. As far as\npracticable, the court below shall grant exemption to the\npetitioners from personal appearance.\n\nSd/-\n(B.KEMAL PASHA, JUDGE)\naks/05/01\n// True Copy //\nPS to Judge\n\n"
}