{
    "case_id": "",
    "court": "HIGH COURT OF KERALA AT ERNAKULAM\nPRESENT",
    "date": "8TH DAY OF DECEMBER 2017",
    "judge": "B.KEMAL PASHA\nFRIDAY",
    "petitioners": [
        "(S)/ACCUSED 2 - 5:",
        "1. SHEELA,",
        "D/O.LATE VASU, AGED 44 YEARS, KUNNATH HOUSE,",
        "ALAPPAD DESOM, P.O.ALAPPAD, THRISSUR-680641.",
        "2. CHANDRIKA,",
        "W/O.LATE VASU, AGED 74 YEARS, KUNNATH HOUSE,",
        "ALAPPAD DESOM, P.O.ALAPPAD, THRISSUR-680641.",
        "3. PRASANNA,",
        "D/O.LATE VASU, AGED 40 YEARS, KUNNATH HOUSE,",
        "ALAPPAD DESOM, P.O.ALAPPAD, THRISSUR-680641.",
        "4. BABY,",
        "D/O.LATE VASU, AGED 38 YEARS, KUNNATH HOUSE,",
        "ALAPPAD DESOM, P.O.ALAPPAD, THRISSUR-680641."
    ],
    "respondents": [
        "(S) /COMPLAINANT & DE FACTO COMPLAINANT:",
        "1. STATE OF KERALA,",
        "REPRESENTED BY PUBLIC PROSECUTOR,",
        "HIGH COURT OF KERALA, ERNAKULAM.",
        "2. RASHID,",
        "S/O.ASHRAF, MATHILAKATH HOUSE, THALIKKULAM P.O.,",
        "THALTKKULAM VILLAGE, CHAVAKKAD TALUK, THRISSUR-680659.",
        "R1 BY PUBLIC PROSECUTOR SRI SLEX M THOMBRA"
    ],
    "sections": [],
    "outcome": "",
    "full_text": "meee\n2017/KER/49782\nIN THE HIGH COURT OF KERALA AT ERNAKULAM\nPRESENT:\nTHE HONOURABLE MR. JUSTICE B.KEMAL PASHA\nFRIDAY, THE 8TH DAY OF DECEMBER 2017/17TH AGRAHAYANA, 1939\nCr1.MC.No. 8495 of 2017 ()\ncc 4738/2013 OF JUDICIAL FIRST CLASS MAGISTRATE COURT-II,THRISSUR\nCRIME NO. 108/2013 OF ANTHIKADPOLICE STATION , THRISSUR\nPETITIONER (S)/ACCUSED 2 - 5:\n1. SHEELA,\nD/O.LATE VASU, AGED 44 YEARS, KUNNATH HOUSE,\nALAPPAD DESOM, P.O.ALAPPAD, THRISSUR-680641.\n2. CHANDRIKA,\nW/O.LATE VASU, AGED 74 YEARS, KUNNATH HOUSE,\nALAPPAD DESOM, P.O.ALAPPAD, THRISSUR-680641.\n3. PRASANNA,\nD/O.LATE VASU, AGED 40 YEARS, KUNNATH HOUSE,\nALAPPAD DESOM, P.O.ALAPPAD, THRISSUR-680641.\n4. BABY,\nD/O.LATE VASU, AGED 38 YEARS, KUNNATH HOUSE,\nALAPPAD DESOM, P.O.ALAPPAD, THRISSUR-680641.\nBY ADVS.SRI.C.A.CHACKO\nSMT .C.M.CHARTSMA\nSMT .MEGHA K.XAVIER\nRESPONDENT (S) /COMPLAINANT & DE FACTO COMPLAINANT:\n1. STATE OF KERALA,\nREPRESENTED BY PUBLIC PROSECUTOR,\nHIGH COURT OF KERALA, ERNAKULAM.\n2. RASHID,\nS/O.ASHRAF, MATHILAKATH HOUSE, THALIKKULAM P.O.,\nTHALTKKULAM VILLAGE, CHAVAKKAD TALUK, THRISSUR-680659.\nR1 BY PUBLIC PROSECUTOR SRI SLEX M THOMBRA\nTHIS CRIMINAL MISC. CASE HAVING COME UP FOR ADMISSION\nON 08-12-2017, THE COURT ON THE SAME DAY PASSED THE\nFOLLOWING:\nK.V.\n\n2017/KER/49782\nCr1.MC.No. 8495 of 2017 ()\nAPPENDIX\nPETITIONER(S)' EXHIBITS\nANNEXURE Al1- CERTIFIED COPY OF THE FIR IN CRIME NO.108/2013 OF\nANTHIKKAD POLICE STATION ALONG WITH PRIVATE COMPLAINT\nFILED BY 2ND RESPONDENT.\nANNEXURE A2- CERTIFIED COPY OF FINAL REPORT IN CRIME NO.108/2013 OF\nANTHIKKAD POLICE STATION.\nANNEXURE A3- TRUE COPY OF SALE AGREEMENT DATED 03/08/2010.\nRESPONDENT (S)' EXHIBITS NIL\n/TRUE COPY/\nK.V. P.S.TO JUDGE\n\nees\n2017/KER/49782\nB. KEMAL PASHA, J.\n~â€”Crl.M.C.No.8495 of 2017\nDated this the 8 day of December, 2017\nORDER\nIt has come out that charges have been framed. With\nliberty to the petitioner to challenge the court charges if so\nadvised, through a Crl.R.P., this Crl.M.C. is closed.\nSd/-\nB. KEMAL PASHA, JUDGE.\nsd\n// True Copy // P.A. to Judge\n\n"
}