{
    "case_id": "",
    "court": "HIGH COURT OF KERALA AT ERNAKULAM\nPRESENT",
    "date": "8TH DAY OF DECEMBER 2017",
    "judge": "B.KEMAL PASHA\nFRIDAY",
    "petitioners": [
        "1ST ACCUSED:",
        "NOUSHAD M.c,",
        "S/O.MOIDU K.M.,",
        "AGED 30 YEARS, K.M.HOUSE, MEETHAL MANGAD,",
        "KULIKKUNNU, BARE VILLAGE, KASARAGOD."
    ],
    "respondents": [
        "COMPLAINANTS:",
        "STATE OF KERALA,",
        "REP. BY PUBLIC PROSECUTOR,",
        "HIGH COURT OF KERALA, ERNAKULAM- 682 031."
    ],
    "sections": [],
    "outcome": "",
    "full_text": "Peleig asl\nrapa\n2017/KER/49764\nIN THE HIGH COURT OF KERALA AT ERNAKULAM\nPRESENT:\nTHE HONOURABLE MR. JUSTICE B.KEMAL PASHA\nFRIDAY, THE 8TH DAY OF DECEMBER 2017/17TH AGRAHAYANA, 1939\nCri.MC.No. 6677 of 2017 ()\nCMP.NO.4822/2017 IN C.P.NO.17/2017 OF JUDICIAL FIRST CLASS-\nMAGISTRATE COURT-II, HOSDURG.\nPETITIONER(S)/1ST ACCUSED:\nNOUSHAD M.c,\nS/O.MOIDU K.M.,\nAGED 30 YEARS, K.M.HOUSE, MEETHAL MANGAD,\nKULIKKUNNU, BARE VILLAGE, KASARAGOD.\nBY ADVS.SRI.RAHUL SASI\nSMT.NEETHU PREM\nRESPONDENT(S)/COMPLAINANTS:\nSTATE OF KERALA,\nREP. BY PUBLIC PROSECUTOR,\nHIGH COURT OF KERALA, ERNAKULAM- 682 031.\nBY GOVERNMENT PLEADER SRI.ALEX M.THOMBRA\nTHIS CRIMINAL MISC. CASE HAVING COME UP FOR ADMISSION\nON 08-12-2017, THE COURT ON THE SAME DAY PASSED THE\nFOLLOWING:\nTS\n\nBl Tal\nEL\nBee\n2017/KER/49764\nCri.MC.No. 6677 of 2017 ()\nAPPENDIX\nPETITIONER(S)' ANNEXURES\nANNEXURE A1 A TRUE COPY ORDER IN C.M.P NO.4822/2017 OF HOSDURG\nPOLICE STATION\nRESPONDENT(S)\"'ANNEXURES- NIL\n(TRUE COPY/\nPS TO JUDGE\nTS\n\nBrats ial\nsie\n2017/KER/49764\nB. KEMAL PASHA, J.\n~Crl.M.C.No.6677 of 2017\nDated this the 8 day of December, 2017\nORDER\nThe court below shall expeditiously commit the case to\nthe Court of Session for enabling the petitioner to apply for\ngetting back his passport from the Sessions Court concerned.\nWith the said direction to the court below, this Crl.M.C.\nis disposed of.\nSd/-\nB. KEMAL PASHA, JUDGE.\nSd\n// True Copy // P.A. to Judge\n\n"
}