{
    "case_id": "Crl.MC.No.122 OF 2020",
    "court": "HIGH COURT OF KERALA AT ERNAKULAM",
    "date": "9TH DAY OF JANUARY 2020",
    "judge": "P.B.SURESH KUMAR\nTHURSDAY",
    "petitioners": [
        "ACCUSED:",
        "1 SHABEER",
        "AGED 30 YEARS",
        "S/O. AMMED HAJI, THAYYULLATHIL HOUSE, VANIMEL P. O.,",
        "VATAKARA TALUK, KOZHIKODE DISTRICT, PIN - 673 506.",
        "2 AYISHU",
        "AGED 57 YEARS",
        "S/O. AMMED HAJI, THAYYULLATHIL HOUSE, VANIMEL P. O.,",
        "VATAKARA TALUK, KOZHIKODE DISTRICT, PIN - 673 506."
    ],
    "respondents": [
        "STATE & DEFACTO COMPLAINANT:",
        "1 THE STATE OF KERALA",
        "REPRESENTED BY THE STATION HOUSE OFFICER,",
        "VATAKARA POLICE STATION, KOZHIKODE DISTRICT,",
        "THROUGH PUBLIC PROSECUTOR, HIGH COURT OF KERALA,",
        "ERNAKULAM - 682 031.",
        "2 SHIFANA N. P.",
        "AGED 28 YEARS",
        "D/O.KUNJAMMED HAJI, RESIDING AT NIBRAS HOUSE,",
        "RANDAM MILE, VAIKKILISSERI ROAD, MAYYANNOOR P. O.,",
        "KOZHIKODE DISTRICT.",
        "R2 BY ADV. C.H.ABDUL RASAC"
    ],
    "sections": [
        "482 of the Code\nof Criminal Procedure for quashing Annexure"
    ],
    "outcome": "ORDER/JUDGMENT IN CC 1014/2016 OF JUDICIAL MAGISTRATE\nOF FIRST CLASS ,VATAKARA\nCRIME NO.318/2016 OF Vatakara Police Station , Kozhikode\nPETITIONER/ACCUSED:\n1 SHABEER\nAGED 30 YEARS\nS/O. AMMED HAJI, THAYYULLATHIL HOUSE, VANIMEL P. O.,\nVATAKARA TALUK, KOZHIKODE DISTRICT, PIN - 673 506.\n2 AYISHU\nAGED 57 YEARS\nS/O. AMMED HAJI, THAYYULLATHIL HOUSE, VANIMEL P. O.,\nVATAKARA TALUK, KOZHIKODE DISTRICT, PIN - 673 506.\nBY ADVS.\nSRI.U.P. BALAKRISHNAN\nSRI.K.R.AVINASH (KUNNATH)\nRESPONDENT/STATE & DEFACTO COMPLAINANT:\n1 THE STATE OF KERALA\nREPRESENTED BY THE STATION HOUSE OFFICER,\nVATAKARA POLICE STATION, KOZHIKODE DISTRICT,\nTHROUGH PUBLIC PROSECUTOR, HIGH COURT OF KERALA,\nERNAKULAM - 682 031.\n2 SHIFANA N. P.\nAGED 28 YEARS\nD/O.KUNJAMMED HAJI, RESIDING AT NIBRAS HOUSE,\nRANDAM MILE, VAIKKILISSERI ROAD, MAYYANNOOR P. O.,\nKOZHIKODE DISTRICT.\nR2 BY ADV. C.H.ABDUL RASAC\nSRI.SANTHOSH PETER - PP\nTHIS CRIMINAL MISC. CASE HAVING COME UP FOR ADMISSION ON\n09.01.2020, THE COURT ON THE SAME DAY PASSED THE FOLLOWING:\n\nLeganl\n2020/KER/919\nCr1.MC.No.122 OF 2020 (EK)\n2\nCri.M.C.No.122 of 2020\nORDER\n\nThis is a proceedings under Section 482 of the Code\nof Criminal Procedure for quashing Annexure - 2 Final Report\npending trial before the Judicial First Class Magistrate Court,\nVatakara in C.C.No.1014 of 2016.\n\n2. The petitioners are accused Nos.1 and 2 in the\nsaid case. The case was one registered under Sections 406\nand 498A read with Section 34 of the Indian Penal Code.\n\n3. It is stated that the petitioners and the de facto\ncomplainant have amicably settled the disputes and an\naffidavit sworn to by the de facto complainant is part of the\nrecords.\n\n4. Heard the learned counsel for the petitioners,\nthe learned Public Prosecutor as also the learned counsel for\nthe de facto complainant.\n\n5. In the light of the decision of the Apex Court in\nGian singh v. State of Punjab, (2012) 10 SCC 303, insofar\n\nPata\n2020/KER/919\nCr1.MC.No.122 OF 2020 (E)\n3\nas the offences alleged against the petitioners are only\noffences punishable under Sections 406 and 498A read with\nSection 34 of the Indian Penal Code, | am of the view that this\nis an appropriate case where this court has to invoke the\njurisdiction under Section 482 of the Code of Criminal\nProcedure to quash the proceedings.\nIn the result, the Crl.M.C. is allowed and Annexure -\n2 Final Report pending trial before the Judicial First Class\nMagistrate Court, Vatakara in C.C.No.1014 of 2016 is quashed",
    "full_text": "tate\nZe soya\nei te\nBlak anert\nIN THE HIGH COURT OF KERALA AT ERNAKULAM 2020/KER/919\nPRESENT\nTHE HONOURABLE MR. JUSTICE P.B.SURESH KUMAR\nTHURSDAY, THE O9TH DAY OF JANUARY 2020 / 19TH POUSHA, 1941\nCr1.MC.No.122 OF 2020 (E)\nAGAINST THE ORDER/JUDGMENT IN CC 1014/2016 OF JUDICIAL MAGISTRATE\nOF FIRST CLASS ,VATAKARA\nCRIME NO.318/2016 OF Vatakara Police Station , Kozhikode\nPETITIONER/ACCUSED:\n1 SHABEER\nAGED 30 YEARS\nS/O. AMMED HAJI, THAYYULLATHIL HOUSE, VANIMEL P. O.,\nVATAKARA TALUK, KOZHIKODE DISTRICT, PIN - 673 506.\n2 AYISHU\nAGED 57 YEARS\nS/O. AMMED HAJI, THAYYULLATHIL HOUSE, VANIMEL P. O.,\nVATAKARA TALUK, KOZHIKODE DISTRICT, PIN - 673 506.\nBY ADVS.\nSRI.U.P. BALAKRISHNAN\nSRI.K.R.AVINASH (KUNNATH)\nRESPONDENT/STATE & DEFACTO COMPLAINANT:\n1 THE STATE OF KERALA\nREPRESENTED BY THE STATION HOUSE OFFICER,\nVATAKARA POLICE STATION, KOZHIKODE DISTRICT,\nTHROUGH PUBLIC PROSECUTOR, HIGH COURT OF KERALA,\nERNAKULAM - 682 031.\n2 SHIFANA N. P.\nAGED 28 YEARS\nD/O.KUNJAMMED HAJI, RESIDING AT NIBRAS HOUSE,\nRANDAM MILE, VAIKKILISSERI ROAD, MAYYANNOOR P. O.,\nKOZHIKODE DISTRICT.\nR2 BY ADV. C.H.ABDUL RASAC\nSRI.SANTHOSH PETER - PP\nTHIS CRIMINAL MISC. CASE HAVING COME UP FOR ADMISSION ON\n09.01.2020, THE COURT ON THE SAME DAY PASSED THE FOLLOWING:\n\nLeganl\n2020/KER/919\nCr1.MC.No.122 OF 2020 (EK)\n2\nCri.M.C.No.122 of 2020\nORDER\n\nThis is a proceedings under Section 482 of the Code\nof Criminal Procedure for quashing Annexure - 2 Final Report\npending trial before the Judicial First Class Magistrate Court,\nVatakara in C.C.No.1014 of 2016.\n\n2. The petitioners are accused Nos.1 and 2 in the\nsaid case. The case was one registered under Sections 406\nand 498A read with Section 34 of the Indian Penal Code.\n\n3. It is stated that the petitioners and the de facto\ncomplainant have amicably settled the disputes and an\naffidavit sworn to by the de facto complainant is part of the\nrecords.\n\n4. Heard the learned counsel for the petitioners,\nthe learned Public Prosecutor as also the learned counsel for\nthe de facto complainant.\n\n5. In the light of the decision of the Apex Court in\nGian singh v. State of Punjab, (2012) 10 SCC 303, insofar\n\nPata\n2020/KER/919\nCr1.MC.No.122 OF 2020 (E)\n3\nas the offences alleged against the petitioners are only\noffences punishable under Sections 406 and 498A read with\nSection 34 of the Indian Penal Code, | am of the view that this\nis an appropriate case where this court has to invoke the\njurisdiction under Section 482 of the Code of Criminal\nProcedure to quash the proceedings.\nIn the result, the Crl.M.C. is allowed and Annexure -\n2 Final Report pending trial before the Judicial First Class\nMagistrate Court, Vatakara in C.C.No.1014 of 2016 is quashed.\nSd/-\nP.B.SURESH KUMAR, JUDGE.\nPV\n\nBeet El\ntree\nFe soya\nete tee\nBian\n2020/KER/919\nCrl.MC.No.122 OF 2020 (E)\n4\nAPPENDIX\nPETITIONERS' EXHIBITS:\nANNEXURE 1 TRUE COPY OF THE FIR IN CRIME\nNO.318/2016.\nANNEXURE 2 TRUE COPY OF THE FINAL REPORT IN CRIME\nNO.318/2016.\nANNEXURE 3 TRUE COPY OF THE AFFIDAVIT SWORN BY\nTHE 2ND RESPONDENT.\nRESPONDENTS' EXHIBITS: NIL\n\n"
}