{
    "case_id": "",
    "court": "HIGH COURT OF KERALA AT ERNAKULAM",
    "date": "8TH DAY OF JANUARY 2018",
    "judge": "P.UBAID\nMONDAY",
    "petitioners": [
        "ACCUSED 1&2 :-",
        "1. SIVAPRASAD,",
        "AGED 20 YEARS, S/O SURENDRAN,",
        "MEKKURATH HOUSE, PARALAM, MUKUNDAPURAM TALUK,",
        "THRISSUR DISTRICT.",
        "2. RANJITH, AGED 22 YEARS,",
        "S/O BABU, POOZHITHARA HOUSE, PARALAM,",
        "MUKUNDAPURAM TALUK, THRISSUR DISTRICT."
    ],
    "respondents": [
        ":-",
        "STATE OF KERALA,",
        "REPRESENTED BY THE PUBLIC PROSECUTOR,",
        "HIGH COURT OF KERALA, ERNAKULAM.",
        "R BY SRI.C.M.KAMMAPPU, PUBLIC PROSECUTOR"
    ],
    "sections": [],
    "outcome": "ORDER IN CRL.MC 3397/2017 of SESSIONS COURT,\nPALAKKAD DATED 03-01-2018\nCRIME NO. 49/2017 OF PALAKKAD EXCISE ENFORCEMENT & ANTI\nNARCOTIC SPECIAL SQUAD, PALAKKAD\nPETITIONER(S)/ACCUSED 1&2 :-\n1. SIVAPRASAD,\nAGED 20 YEARS, S/O SURENDRAN,\nMEKKURATH HOUSE, PARALAM, MUKUNDAPURAM TALUK,\nTHRISSUR DISTRICT.\n2. RANJITH, AGED 22 YEARS,\nS/O BABU, POOZHITHARA HOUSE, PARALAM,\nMUKUNDAPURAM TALUK, THRISSUR DISTRICT.\nBY ADVS.SRI.SAIJO HASSAN\nSRI.BENOJ C AUGUSTIN\nSRI.VISHNU BHUVANENDRAN\nSMT .P.PARVATHY\nRESPONDENT :-\nSTATE OF KERALA,\nREPRESENTED BY THE PUBLIC PROSECUTOR,\nHIGH COURT OF KERALA, ERNAKULAM.\nR BY SRI.C.M.KAMMAPPU, PUBLIC PROSECUTOR\nTHIS CRIMINAL MISC. CASE HAVING COME UP FOR ADMISSION ON 08-01-2018,\nTHE COURT ON THE SAME DAY PASSED THE FOLLOWING:\n\nae\n2018/KER/692\nCr1.MC.No. 118 of 2018 ()\nAPPENDIX\nPETITIONER(S)' ANNEXURES) :-\nANNEXURE I 27 TRUE COPY OF THE ORDER PASSED BY THE SESSIONS\nCOURT, PALAKKAD DATED 3.1.2018.\nRESPONDENT'S ANNEXURES © :- NIL\n//TRUE COPY//\nP.A. TO JUDGE\nrkj\n\n2018/KER/692\nP.UBAID, J.\n~SEriLM.C.No.118 of 2018\n\"Dated this the 8\" day of January, 2018\nORDER\nThe petitioners are the two accused in Crime No.49 of\n2017 of the Excise Enforcement and Anti Narcotic Special Squad,\nPalakkad. By order dated 03.01.2018 in Crl.M.C.No.3397 of 2017,\nthey were granted bail by the Court of Session, Palakkad on\nconditions. One of the conditions is that they shall deposit a sum\nof Rs.50,000/- (Rupees Fifty Thousand only) each as security. The\npetitioners are aggrieved by the said condition, and it is sought to\nbe quashed",
    "full_text": "ape ieas\nIN THE HIGH COURT OF KERALA AT ERNAKULAM 2018/KER/692\nPRESENT :\nTHE HONOURABLE MR. JUSTICE P.UBAID\nMONDAY, THE 8TH DAY OF JANUARY 2018 / 18TH POUSHA, 1939\nCr1.MC.No. 118 of 2018\nAGAINST THE ORDER IN CRL.MC 3397/2017 of SESSIONS COURT,\nPALAKKAD DATED 03-01-2018\nCRIME NO. 49/2017 OF PALAKKAD EXCISE ENFORCEMENT & ANTI\nNARCOTIC SPECIAL SQUAD, PALAKKAD\nPETITIONER(S)/ACCUSED 1&2 :-\n1. SIVAPRASAD,\nAGED 20 YEARS, S/O SURENDRAN,\nMEKKURATH HOUSE, PARALAM, MUKUNDAPURAM TALUK,\nTHRISSUR DISTRICT.\n2. RANJITH, AGED 22 YEARS,\nS/O BABU, POOZHITHARA HOUSE, PARALAM,\nMUKUNDAPURAM TALUK, THRISSUR DISTRICT.\nBY ADVS.SRI.SAIJO HASSAN\nSRI.BENOJ C AUGUSTIN\nSRI.VISHNU BHUVANENDRAN\nSMT .P.PARVATHY\nRESPONDENT :-\nSTATE OF KERALA,\nREPRESENTED BY THE PUBLIC PROSECUTOR,\nHIGH COURT OF KERALA, ERNAKULAM.\nR BY SRI.C.M.KAMMAPPU, PUBLIC PROSECUTOR\nTHIS CRIMINAL MISC. CASE HAVING COME UP FOR ADMISSION ON 08-01-2018,\nTHE COURT ON THE SAME DAY PASSED THE FOLLOWING:\n\nae\n2018/KER/692\nCr1.MC.No. 118 of 2018 ()\nAPPENDIX\nPETITIONER(S)' ANNEXURES) :-\nANNEXURE I 27 TRUE COPY OF THE ORDER PASSED BY THE SESSIONS\nCOURT, PALAKKAD DATED 3.1.2018.\nRESPONDENT'S ANNEXURES © :- NIL\n//TRUE COPY//\nP.A. TO JUDGE\nrkj\n\n2018/KER/692\nP.UBAID, J.\n~SEriLM.C.No.118 of 2018\n\"Dated this the 8\" day of January, 2018\nORDER\nThe petitioners are the two accused in Crime No.49 of\n2017 of the Excise Enforcement and Anti Narcotic Special Squad,\nPalakkad. By order dated 03.01.2018 in Crl.M.C.No.3397 of 2017,\nthey were granted bail by the Court of Session, Palakkad on\nconditions. One of the conditions is that they shall deposit a sum\nof Rs.50,000/- (Rupees Fifty Thousand only) each as security. The\npetitioners are aggrieved by the said condition, and it is sought to\nbe quashed. The allegation as against them is that they were\nfound possessing 6 Kgs of ganja at about 5.30 p.m. on\n30.10.2017. The antecedents of the petitioners are being probed\ninto. | am not inclined to lift the condition as such as requested by\nthe petitioners in the particular facts and circumstances.\nAccordingly, the first condition imposed by the court below as per\nthe order dated 03.01.2018 in Crl.M.C.No.3397 of 2017 will stand\nmodified to the effect that the petitioners shall make a security\ndeposit of Rs.20,000/- (Rupees Twenty Thousand only) each.\nSd/-\nP.UBAID, JUDGE\n\nrkj\n\n//TRUE COPY//\n\nP.A. TO JUDGE\n\n"
}