{
    "case_id": "Crl.MC.No.2846 OF 2014",
    "court": "HIGH COURT OF KERALA AT ERNAKULAM",
    "date": "4TH DAY OF JANUARY 2021",
    "judge": "P.SOMARAJAN\nMONDAY",
    "petitioners": [
        "ACCUSED",
        "DR.SURESH BABU",
        "AGED 56 YEARS",
        "S/O.RAMAN PILLAI, NARAYANEEYAM HOUSE,",
        "WARD NO.VIII,PATHANAMTHITTA PANCHAYATH,",
        "PATHANAMTHITTA VILLAGE, PATHANAMTHITTA DISTRICT."
    ],
    "respondents": [
        "S: STATE & DEFACTO COMPLAINANT",
        "1 STATE OF KERALA",
        "REPRESENTED BY THE PUBLIC PROSECUTOR,",
        "HIGH COURT OF KERALA,",
        "ERNAKULAM- 682 031.",
        "2 SADANANDAN",
        "S/O.NARAYANAN, KONNATH EDAPPURAYIL,",
        "MANJADITHARA MURI, PALLIKKAL P.O.,",
        "BARANIKAVU VILLAGE.",
        "R1 BY ADV.SRI. RAMESH CHAND, PUBLIC PROSECUTOR",
        "R2 BY ADV. SRI.VINCENT JOSEPH"
    ],
    "sections": [
        "420",
        "423",
        "465",
        "468 of IPC"
    ],
    "outcome": "ORDER/JUDGMENT IN CC 790/2013 OF JUDICIAL MAGISTRATE\nOF FIRST CLASS , KAYAMKULAM\nCRIME NO.348/2012 OF Vallikunnam Police Station , Alappuzha\nPETITIONER: ACCUSED\nDR.SURESH BABU\nAGED 56 YEARS\nS/O.RAMAN PILLAI, NARAYANEEYAM HOUSE,\nWARD NO.VIII,PATHANAMTHITTA PANCHAYATH,\nPATHANAMTHITTA VILLAGE, PATHANAMTHITTA DISTRICT.\nBY ADVS.\nSRI.B.RAMAN PILLAI (SR.)\nSRI.R.ANIL\nSRI.T.ANIL KUMAR\nSRI.MANU TOM\nSRI .M. SUNILKUMAR\nSRI.SUJESH MENON V.B.\nSRI.THOMAS ABRAHAM (NILACKAPPILLIL)\nSRI .M. VIVEK\nRESPONDENTS: STATE & DEFACTO COMPLAINANT\n1 STATE OF KERALA\nREPRESENTED BY THE PUBLIC PROSECUTOR,\nHIGH COURT OF KERALA,\nERNAKULAM- 682 031.\n2 SADANANDAN\nS/O.NARAYANAN, KONNATH EDAPPURAYIL,\nMANJADITHARA MURI, PALLIKKAL P.O.,\nBARANIKAVU VILLAGE.\nR1 BY ADV.SRI. RAMESH CHAND, PUBLIC PROSECUTOR\nR2 BY ADV. SRI.VINCENT JOSEPH\nTHIS CRIMINAL MISC. CASE HAVING BEEN FINALLY HEARD ON\n04.01.2021, THE COURT ON THE SAME DAY PASSED THE FOLLOWING:\n\nas\nees\nCrl.MC.No.2846 OF 2014 202UKER/7\n2\nORDER\nThe offences alleged are under Section 420,\n423, 465, 468 of IPC. The matter settled out of\ncourt. An affidavit sworn by the defacto\ncomplainant produced to show the settlement arrived\nat out of the Court. Hence, if it is proceeded\nfurther, it will not serve any purpose. Hence, the\nFIR and its further proceedings are quashed",
    "full_text": "Bae\nBe es\nIN THE HIGH COURT OF KERALA AT ERNAKULAM 2021/KER/7\nPRESENT\nTHE HONOURABLE MR. JUSTICE P.SOMARAJAN\nMONDAY, THE O4TH DAY OF JANUARY 2021 / 14TH POUSHA, 1942\nCrl1.MC.No.2846 OF 2014\nAGAINST THE ORDER/JUDGMENT IN CC 790/2013 OF JUDICIAL MAGISTRATE\nOF FIRST CLASS , KAYAMKULAM\nCRIME NO.348/2012 OF Vallikunnam Police Station , Alappuzha\nPETITIONER: ACCUSED\nDR.SURESH BABU\nAGED 56 YEARS\nS/O.RAMAN PILLAI, NARAYANEEYAM HOUSE,\nWARD NO.VIII,PATHANAMTHITTA PANCHAYATH,\nPATHANAMTHITTA VILLAGE, PATHANAMTHITTA DISTRICT.\nBY ADVS.\nSRI.B.RAMAN PILLAI (SR.)\nSRI.R.ANIL\nSRI.T.ANIL KUMAR\nSRI.MANU TOM\nSRI .M. SUNILKUMAR\nSRI.SUJESH MENON V.B.\nSRI.THOMAS ABRAHAM (NILACKAPPILLIL)\nSRI .M. VIVEK\nRESPONDENTS: STATE & DEFACTO COMPLAINANT\n1 STATE OF KERALA\nREPRESENTED BY THE PUBLIC PROSECUTOR,\nHIGH COURT OF KERALA,\nERNAKULAM- 682 031.\n2 SADANANDAN\nS/O.NARAYANAN, KONNATH EDAPPURAYIL,\nMANJADITHARA MURI, PALLIKKAL P.O.,\nBARANIKAVU VILLAGE.\nR1 BY ADV.SRI. RAMESH CHAND, PUBLIC PROSECUTOR\nR2 BY ADV. SRI.VINCENT JOSEPH\nTHIS CRIMINAL MISC. CASE HAVING BEEN FINALLY HEARD ON\n04.01.2021, THE COURT ON THE SAME DAY PASSED THE FOLLOWING:\n\nas\nees\nCrl.MC.No.2846 OF 2014 202UKER/7\n2\nORDER\nThe offences alleged are under Section 420,\n423, 465, 468 of IPC. The matter settled out of\ncourt. An affidavit sworn by the defacto\ncomplainant produced to show the settlement arrived\nat out of the Court. Hence, if it is proceeded\nfurther, it will not serve any purpose. Hence, the\nFIR and its further proceedings are quashed.\nThe Crl.M.C. is allowed accordingly.\nSd/-\nP.SOMARAJAN\nJUDGE\nSPV\n\nCoprere eC\nbales\nCr1.MC.No.2846 OF 2014 202U/KERIT\n3\nAPPENDIX\n\nPETITIONER'S EXHIBITS:\n\nANNEXURE A THE CERTIFIED COPY OF CMP NO.2289 OF\n2012 OF THE COURT OF JUDICIAL FIRST\nCLASS MAGISTRATE, KAYAMKULAM.\n\nANNEXURE A THE NOTARIZED COPY OF THE AFFIDAVIT\nSWORN TO BY THE RESPONDENT INDICATING\nTHE FACTUM OF SETTLEMENT\n\nANNEXURE B THE TRUE COPY OF THE FIR IN CRIME NO.348\nOF 2012 OF VALLIKUNNAM POLICE STATION.\n\nANNEXURE-C THE CERTIFIED COPY OF THE FINAL REPORT\nIN C.c. 790 OF 2013 ALONG WITH THE\nSTATEMENT OF WITNESSES AND RECORDS\n\nANNEXURE-C1 THE TRUE COPY OF THE FURTHER STATEMENT\nOF DEFACTO COMPLAINANT DATED 1.8.2012,\nWHICH FORMS PART OF THE FINAL REPORT\n\nANNEXURE-C2 THE TRUE COPY OF THE STATEMENT OF CW2,\nDATED 6.6.2012 WHICH FROM PART OF THE\nFINAL REPORT.\n\nANNEXURE-C3 THE TRUE COPY OF THE STATEMENT OF CW3,\nDATED 6.6.2012 WHICH FORM PART OF THE\nFINAL REPORT\n\nANNEXURE-C4 THE TRUE COPY OF THE STATEMENT OF CW4,\nDATED 6.6.2012 WHICH FORM PART OF THE\nFINAL REPORT\n\nANNEXURE-C5 THE TRUE COPY OF THE STATEMENT OF CW5,\nDATED 6.6.2012 WHICH FORM PART OF THE\nFINAL REPORT\n\nANNEXURE-C6 THE TRUE COPY OF THE STATEMENT OF CW2,\nWHICH FORM PART OF ANNEXURE-C DATED\n1.8.2012\n\nANNEXURE-C7 THE TRUE COPY OF THE STATEMENT OF CW3,\nWHICH FORM PART OF ANNEXURE-C DATED\n1.8.2012\n\nANNEXURE-C8 THE TRUE COPY OF THE STATEMENT OF CW4,\nWHICH FORM PART OF ANNEXURE-C DATED\n1.8.2012\n\nBae\nees\nCr1.MC.No.2846 OF 2014 2021/KER/7\n4\nANNEXURE -C9 THE TRUE COPY OF THE STATEMENT OF CW5,\nWHICH FROM PART OF ANNEXURE-C DATED\n1.8.2012\nRESPONDENTS' EXHIBITS: NIL\n//TRUE COPY//\nPA TO JUDGE\n\n"
}