{
    "case_id": "Crl.MC.No.5469 OF 2020",
    "court": "HIGH COURT OF KERALA AT ERNAKULAM",
    "date": "8TH DAY OF JANUARY 2021",
    "judge": "V.G.ARUN\nFRIDAY",
    "petitioners": [
        "ACCUSED 2 AND 3:",
        "1 ASHRAF. P",
        "AGED 46 YEARS",
        "$/O MUHAMMED P, PALLIYEDATHUKANDI HOUSE,",
        "CHERUVATTAPARAMBIL, KURUVATTUR, KOZHIKODE, PIN-",
        "673012.",
        "(2ND ACCUSED)",
        "2 RIYAZ PM",
        "S/O MUHAMMED P, PALAYANKAL HOUSE, APARTMENT NO.16,",
        "KARAPARAMBA, KOZHIKODE, PIN-673010."
    ],
    "respondents": [
        "STATE AND DE FACTO COMPLAINANT:",
        "1 STATE OF KERALA",
        "REPRESENTED BY PUBLIC PROSECUTOR,",
        "HIGH COURT OF KERALA,",
        "ERNAKULAM-682031.",
        "2 ATHILA SHAJAHAN",
        "W/O ALI MUHASIN, PATHUVANA HOUSE, MUPPATHADAM P O,",
        "ALUVA,",
        "ERNAKULAM DISTRICT, PIN-683110.",
        "(DEFACTO-COMPALINANT)",
        "R2 BY ADV. SRI.VIVEK VENUGOPAL",
        "OTHER PRESENT:",
        "SR.PP.C.S.HRITHWIK"
    ],
    "sections": [
        "406",
        "420",
        "468 read with 34 of IPC"
    ],
    "outcome": "ORDER\n\nDated this the 8th day of January 2021\n\nPetitioners are the accused Nos. 2 and 3 in Crime\nNo.717/2019 registered at the Binanipuram Police\nStation for offences punishable under Sections 406,\n420 and 468 r/w 34 of IPC. The de facto complainant,\nat whose instance the crime was registered, is arrayed\nas the 2™ respondent. Annexure-R2(a) affidavit has\nbeen filed by 2\" respondent. The allegation is that the\npetitioners along with the 1* accused had transferred\nthe Hyundai Creta Car belonging to the de facto\ncomplainant/2™ respondent by forging her signature.\nThe de facto complainant has now filed an affidavit\nstating that the dispute has been resolved amicably\nand she has no subsisting grievance against any of the\npetitioners. The 1* accused is stated to be abroad and\ntherefore, has not been arrayed as party to this\n\nBerl\nCrl.MC.No.5469 OF 2020(C) LiB., 202 1/KERITS38\nCriminal M.C.\n\n2. Heard the learned Public Prosecutor also, who,\non instructions, submits that the petitioners have no\ncriminal antecedents.\n\n3. Having considered the gravity of the offences\nalleged, nature of the injury caused and having\nperused the affidavit filed by the 2™* respondent, the\ncontents of which are submitted to be true and\nvoluntary, I am satisfied that the dispute is settled and\nno public interest is involved in this matter.\nMoreover, in view of the settlement, possibility of the\ncriminal proceedings ending in conviction is remote.\n\nAs such, continuance of the proceedings will amount\nto an abuse of process of court and hence, in view of\nthe legal position set out by the Honourable Supreme\nCourt in Madan Mohan Abbot v. State of Punjab\n[(2008) 4 SCC 582] and Gian Singh v. State of\nPunjab and another [(2012) 10 SCC 303], there is\n\nBash\nCrl1.MC.No.5469 OF 2020(C) AL, 202 UKER/1338\n\nno impediment in granting the relief sought.\n\nIn the result, this Crl.M.C is allowed. Annexure-l\nFIR and the proceedings in Crime No.717/2019\nregistered at the Binanipuram Police Station, as\nagainst the petitioners is quashed",
    "full_text": "sr eheei|\ncies 4 ie\nIN THE HIGH COURT OF KERALA AT ERNAKULAM 202 1/KER/1338\nPRESENT\nTHE HONOURABLE MR.JUSTICE V.G.ARUN\nFRIDAY, THE O8TH DAY OF JANUARY 2021 / 18TH POUSHA, 1942\nCr1.MC.No.5469 OF 2020(C)\nCRIME NO.717/2019 OF Binanipuram Police Station , Ernakulam\nPETITIONER/ACCUSED 2 AND 3:\n1 ASHRAF. P\nAGED 46 YEARS\n$/O MUHAMMED P, PALLIYEDATHUKANDI HOUSE,\nCHERUVATTAPARAMBIL, KURUVATTUR, KOZHIKODE, PIN-\n673012.\n(2ND ACCUSED)\n2 RIYAZ PM\nS/O MUHAMMED P, PALAYANKAL HOUSE, APARTMENT NO.16,\nKARAPARAMBA, KOZHIKODE, PIN-673010.\nBY ADVS.\nSRI.VINEETH KURIAKOSE\nSRI .DOMINIC JOHNSON\nRESPONDENT/STATE AND DE FACTO COMPLAINANT:\n1 STATE OF KERALA\nREPRESENTED BY PUBLIC PROSECUTOR,\nHIGH COURT OF KERALA,\nERNAKULAM-682031.\n2 ATHILA SHAJAHAN\nW/O ALI MUHASIN, PATHUVANA HOUSE, MUPPATHADAM P O,\nALUVA,\nERNAKULAM DISTRICT, PIN-683110.\n(DEFACTO-COMPALINANT)\nR2 BY ADV. SRI.VIVEK VENUGOPAL\nOTHER PRESENT:\nSR.PP.C.S.HRITHWIK\nTHIS CRIMINAL MISC. CASE HAVING COME UP FOR ADMISSION ON\n08.01.2021, THE COURT ON THE SAME DAY PASSED THE FOLLOWING:\n\nBerl\n|\nCrl1.MC.No.5469 OF 2020(c) 2. 202 1KER/T338\nORDER\n\nDated this the 8th day of January 2021\n\nPetitioners are the accused Nos. 2 and 3 in Crime\nNo.717/2019 registered at the Binanipuram Police\nStation for offences punishable under Sections 406,\n420 and 468 r/w 34 of IPC. The de facto complainant,\nat whose instance the crime was registered, is arrayed\nas the 2™ respondent. Annexure-R2(a) affidavit has\nbeen filed by 2\" respondent. The allegation is that the\npetitioners along with the 1* accused had transferred\nthe Hyundai Creta Car belonging to the de facto\ncomplainant/2™ respondent by forging her signature.\nThe de facto complainant has now filed an affidavit\nstating that the dispute has been resolved amicably\nand she has no subsisting grievance against any of the\npetitioners. The 1* accused is stated to be abroad and\ntherefore, has not been arrayed as party to this\n\nBerl\nCrl.MC.No.5469 OF 2020(C) LiB., 202 1/KERITS38\nCriminal M.C.\n\n2. Heard the learned Public Prosecutor also, who,\non instructions, submits that the petitioners have no\ncriminal antecedents.\n\n3. Having considered the gravity of the offences\nalleged, nature of the injury caused and having\nperused the affidavit filed by the 2™* respondent, the\ncontents of which are submitted to be true and\nvoluntary, I am satisfied that the dispute is settled and\nno public interest is involved in this matter.\nMoreover, in view of the settlement, possibility of the\ncriminal proceedings ending in conviction is remote.\n\nAs such, continuance of the proceedings will amount\nto an abuse of process of court and hence, in view of\nthe legal position set out by the Honourable Supreme\nCourt in Madan Mohan Abbot v. State of Punjab\n[(2008) 4 SCC 582] and Gian Singh v. State of\nPunjab and another [(2012) 10 SCC 303], there is\n\nBash\nCrl1.MC.No.5469 OF 2020(C) AL, 202 UKER/1338\n\nno impediment in granting the relief sought.\n\nIn the result, this Crl.M.C is allowed. Annexure-l\nFIR and the proceedings in Crime No.717/2019\nregistered at the Binanipuram Police Station, as\nagainst the petitioners is quashed.\n\nSd/-\nV.G.ARUN\n\nSB/08/01/2020 JUDGE\n\nPaes ad\n.\nree 4 ie\nCril.MC.No.5469 OF 2020(C Be. 202 1/KER/1338\nAPPENDIX\nPETITIONER'S/S EXHIBITS:\nANNEXURE-1 CERTIFIED COPY OF FIRST INFORMATION\nREPORT DATED 26.11.2019 IN CRIME\nNO.717/2019 OF BINANIPURAM POLICE\nSTATION.\nANNEXURE-II CERTIFIED COPY OF FIRST INFORMATION\nSTATEMENT 26.11.2019 IN CRIME\nNO.717/2019 OF BINANIPURAM AND POLICE\nSTATION.\nRESPONDENTS EXTS:\nANNEXURE-R2 (a) ORIGINAL OF THE AFFIDAVIT SWORN TO BY\nTHE PETITIONER/2ND RESPONDENT DATED\n15.12.2020.\n//true copy// P.A to Judge\n\n"
}