{
    "case_id": "Crl.MC.No.6457 OF 2019",
    "court": "HIGH COURT OF KERALA AT ERNAKULAM\nPRESENT\nTHE HONOURABLE MR",
    "date": "09TH DAY OF JANUARY 2020",
    "judge": "ASHOK MENON\nTHURSDAY",
    "petitioners": [
        "S/ACCUSED NO. 1 TO 5:",
        "1 SYAM MOHAN,",
        "AGED 24 YEARS,",
        "S/O.MOHAN,",
        "KORPULLITHARA HOUSE, PUTHUVYPU VILLAGE,",
        "VYPEEN, KOCHI TALUK,",
        "ERNAKULAM - 682 508.",
        "2 ARUN,",
        "AGED 26 YEARS,",
        "S/O.ABBAS,",
        "PANDARAPARAMBIL HOUSE,",
        "NEAR ATHIRA BUS STOP, HOUSE,",
        "PUTHUVYPU VILLAGE, VYPEEN,",
        "KOCHI TALUK, ERNAKULAM - 682 508.",
        "3 ABIJITH,",
        "AGED 25 YEARS,",
        "S/O.ABBAS,",
        "PANDARAPARAMBIL HOUSE,",
        "NEAR ATHIRA BUS STOP, HOUSE,",
        "PUTHUVYPU VILLAGE, VYPEEN,",
        "KOCHI TALUK,",
        "ERNAKULAM - 682 508.",
        "4 TONY,",
        "AGED 25 YEARS,",
        "S/O.JOHNY,",
        "MUKKATH HOUSE, PUTHUVYPEKARA,",
        "PUTHUVYPU VILLAGE, VYPEEN,",
        "KOCHI TALUK, ERNAKULAM - 682 508.",
        "5 SUJI @ SUJITH,",
        "AGED 29 YEARS,",
        "S/O.VASU,",
        "KANJIRAKAD HOUSE, AARAT ROAD,",
        "NEAR SEASHORE, NJARAKKAL VILLAGE,"
    ],
    "respondents": [
        "S /STATE:",
        "STATE OF KERALA,",
        "REPRESENTED BY THE SHO(STATION HOUSE OFFICER),",
        "NJARAKKAL POLICE STATION,",
        "ERNAKULAM DISTRICT,",
        "THROUGH THE PUBLIC PROSECUTOR,",
        "HIGH COURT OF KERALA, ERNAKULAM - 682 031.",
        "OTHER PRESENT:"
    ],
    "sections": [],
    "outcome": "ORDER\nDated this the 9th day of January, 2020\n\nThe petitioners are accused in S.C. No. 849/2018\npending on the files of the 2™ Additional Assistant Sessions\nCourt, Ernakulam. It is submitted that there is a counter\ncase which was pending before the Judicial First Class\nMagistrate Court, Njarakkal as C.C. No.947/2018. Being a\ncase and counter case, steps were taken for both the cases\nbeing tried by the same court, and it is submitted by the\nlearned counsel for the petitioners that the case pending\nbefore the Judicial First Class Magistrate Court, Njarakkal\nhas now been committed to the Sessions Court and the\nallotment of the said case to the 2™ Additional Assistant\nSessions Court is awaited.\n\n2. The prayer in this petition is only to defer the trial\nof S.C. No.849/2018 for such period as may be directed by\nthis court. There is an interim stay already granted by this\ncourt. In view of the fact that the counter case has also been\n\nEe, Stet]\nCrl.MC.No.6457 OF 2019(F) 2020/KER/LO37\n4\n\ntransferred to the Sessions division, both the cases can be\ntried together by the same court.\n\nWith these observations, the petition is disposed",
    "full_text": "oe\nPr rab: Sits\npe a\n2020/KER/1037\nIN THE HIGH COURT OF KERALA AT ERNAKULAM\nPRESENT\nTHE HONOURABLE MR. JUSTICE ASHOK MENON\nTHURSDAY, THE 09TH DAY OF JANUARY 2020 / 19TH POUSHA, 1941\nCr1.MC.No.6457 OF 2019(F)\nTO DIRECT THE 2ND ADDITIONAL ASSISTANT SESSIONS JUDGE, ERNAKULAM\nTO DEFER THE TRIAL OF S.C.NO.849/2018 FOR SUCH PERIOD OF TIME AS\nMAY BE DIRECTED BY THIS HONOURABLE COURT\nPETITIONERS/ACCUSED NO. 1 TO 5:\n1 SYAM MOHAN,\nAGED 24 YEARS,\nS/O.MOHAN,\nKORPULLITHARA HOUSE, PUTHUVYPU VILLAGE,\nVYPEEN, KOCHI TALUK,\nERNAKULAM - 682 508.\n2 ARUN,\nAGED 26 YEARS,\nS/O.ABBAS,\nPANDARAPARAMBIL HOUSE,\nNEAR ATHIRA BUS STOP, HOUSE,\nPUTHUVYPU VILLAGE, VYPEEN,\nKOCHI TALUK, ERNAKULAM - 682 508.\n3 ABIJITH,\nAGED 25 YEARS,\nS/O.ABBAS,\nPANDARAPARAMBIL HOUSE,\nNEAR ATHIRA BUS STOP, HOUSE,\nPUTHUVYPU VILLAGE, VYPEEN,\nKOCHI TALUK,\nERNAKULAM - 682 508.\n4 TONY,\nAGED 25 YEARS,\nS/O.JOHNY,\nMUKKATH HOUSE, PUTHUVYPEKARA,\nPUTHUVYPU VILLAGE, VYPEEN,\nKOCHI TALUK, ERNAKULAM - 682 508.\n5 SUJI @ SUJITH,\nAGED 29 YEARS,\nS/O.VASU,\nKANJIRAKAD HOUSE, AARAT ROAD,\nNEAR SEASHORE, NJARAKKAL VILLAGE,\n\na\nPr rab: Sits\npe a\nCrl.MC.No.6457 OF 2019(F) 2020/KER/LO37\n2\nVYPEEN, KOCHI TALUK,\nERNAKULAM - 682 508.\nBY ADV. SRI.P.B.AJOY\nRESPONDENTS /STATE:\nSTATE OF KERALA,\nREPRESENTED BY THE SHO(STATION HOUSE OFFICER),\nNJARAKKAL POLICE STATION,\nERNAKULAM DISTRICT,\nTHROUGH THE PUBLIC PROSECUTOR,\nHIGH COURT OF KERALA, ERNAKULAM - 682 031.\nOTHER PRESENT:\nSRI.C.S.HRITHWIK SR. PUBLIC PROSECUTOR\nTHIS CRIMINAL MISC. CASE HAVING COME UP FOR ADMISSION ON\n09.01.2020, THE COURT ON THE SAME DAY PASSED THE FOLLOWING:\n\nCrl.MC.No.6457 OF 2019 (F) 2020/KER/TO37\n3\nORDER\nDated this the 9th day of January, 2020\n\nThe petitioners are accused in S.C. No. 849/2018\npending on the files of the 2™ Additional Assistant Sessions\nCourt, Ernakulam. It is submitted that there is a counter\ncase which was pending before the Judicial First Class\nMagistrate Court, Njarakkal as C.C. No.947/2018. Being a\ncase and counter case, steps were taken for both the cases\nbeing tried by the same court, and it is submitted by the\nlearned counsel for the petitioners that the case pending\nbefore the Judicial First Class Magistrate Court, Njarakkal\nhas now been committed to the Sessions Court and the\nallotment of the said case to the 2™ Additional Assistant\nSessions Court is awaited.\n\n2. The prayer in this petition is only to defer the trial\nof S.C. No.849/2018 for such period as may be directed by\nthis court. There is an interim stay already granted by this\ncourt. In view of the fact that the counter case has also been\n\nEe, Stet]\nCrl.MC.No.6457 OF 2019(F) 2020/KER/LO37\n4\n\ntransferred to the Sessions division, both the cases can be\ntried together by the same court.\n\nWith these observations, the petition is disposed.\n\nSd/-\nASHOK MENON\nJUDGE\n\nNR/16/01/20\n\n, ciate\nSan\npe a\nCrl.MC.No.6457 OF 2019(F) 2020/KER/1037\n5\nAPPENDIX\nPETITIONERS' EXHIBITS:\nANNEXURE Al THE TRUE COPY OF THE FIRST INFORMATION\nREPORT IN CRIME NO.745/2016 OF\nNJARAKKAL POLICE STATION, ERNAKULAM\nDISTRICT.\nANNEXURE A2 THE CERTIFIED COPY OF THE FINAL REPORT\nIN SC NO.849/2018 ON THE FILES OF THE\nCOURT OF 2ND ADDITIONAL ASSISTANT\nSESSIONS JUDGE, ERNAKULAM.\nANNEXURE A3 THE TRUE COPY OF THE FIRST INFORMATION\nREPORT IN CRIME NO.688/2017 OF\nNJARAKKAL POLICE STATION, ERNAKULAM\nDISTRICT.\nANNEXURE A4 THE CERTIFIED COPY OF THE FINAL REPORT\nIN C.C.NO.947/2018 ON THE FILES OF THE\nJUDICIAL FIRST CLASS MAGISTRATE COURT,\nNJARAKKAL .\nRESPONDENT'S EXHIBITS: NIL\n// TRUE COPY// PA TO JUDGE\n\n"
}