{
    "case_id": "",
    "court": "HIGH COURT OF KERALA AT HRNAKULAM\nPRESENT\nTHE HONOURABLE MR",
    "date": "4TH DAY OF JANUARY 2021",
    "judge": "V.G.ARUN\nMONDAY",
    "petitioners": [
        "S:",
        "SUNIL LAL G.",
        "S/O GURUDASAN, UDAYA BHAVANAN, THAZHUTHALA",
        "CHERRY, THAZHUTHARA VILLAGE,",
        "KOLLAM ,REPRESENTED BY ITS POWER OF ATTORNEY",
        "HOLDER, SUBASH, AGED 47 YEARS, S/O SUDARSANAN,",
        "SUBHASH BHAVAN, THEKKUMKARA, PULLICHIRA",
        "P.O.MAYYANADU, KOLLAM."
    ],
    "respondents": [
        "S:",
        "1 STATE OF KERALA,",
        "REPRESENTED BY THE PUBLIC PROSECUTOR, HIGH",
        "COURT OF KERALA, PIN-682 O31.",
        "2 DISTRICT COLLECTOR,",
        "COLLECTORATE, KOLLAM, KERALA, PIN-691 013.",
        "OTHER PRESENT:",
        "PP RENJITH T.R."
    ],
    "sections": [
        "457 of the Code\nof Criminal Procedure",
        "the learned Magistrate\nissued Annexure Al order directing release of the\nvehicle",
        "subject to conditions"
    ],
    "outcome": "",
    "full_text": "oti\nPER\n2021/KER/146\nIN THE HIGH COURT OF KERALA AT HRNAKULAM\nPRESENT\nTHE HONOURABLE MR.JUSTICE V.G.ARUN\nMONDAY, THE O4TH DAY OF JANUARY 2021 / 14TH POUSHA, 1942\nCr1.MC.No.5918 OF 2020 (H)\nCMP 2052/2020 OF JUDICIAL FIRST CLASS MAGISTRATE COURT,\nPARAVUR\nPETITIONER/S:\nSUNIL LAL G.\nS/O GURUDASAN, UDAYA BHAVANAN, THAZHUTHALA\nCHERRY, THAZHUTHARA VILLAGE,\nKOLLAM ,REPRESENTED BY ITS POWER OF ATTORNEY\nHOLDER, SUBASH, AGED 47 YEARS, S/O SUDARSANAN,\nSUBHASH BHAVAN, THEKKUMKARA, PULLICHIRA\nP.O.MAYYANADU, KOLLAM.\nBY ADV. SRI.M.R.SASITH\nRESPONDENT/S:\n1 STATE OF KERALA,\nREPRESENTED BY THE PUBLIC PROSECUTOR, HIGH\nCOURT OF KERALA, PIN-682 O31.\n2 DISTRICT COLLECTOR,\nCOLLECTORATE, KOLLAM, KERALA, PIN-691 013.\nOTHER PRESENT:\nPP RENJITH T.R.\nTHIS CRIMINAL MISC. CASE HAVING COME UP FOR\nADMISSION ON 04.01.2021, THE COURT ON THE SAME DAY PASSED\nTHE FOLLOWING:\n\nEen\n2021/KER/146\nCrl.M.C No. 5918 of 2020\n-2-\nORDER\n\nDated this the 4 day of January, 2021\n\nPetitioner claims to be the owner of a\nTipper Lorry bearing Registration No.KL-23-6434.\nThe vehicle was seized by the 2â„¢ respondent\nalleging violation of the provisions of the\nMines and Minerals (Development and Regulation)\nAct, 1957. After seizure, the petitioner's\nvehicle was produced before the Judicial First\nClass Magistrate Court (Temporary), South\nParavur. On the basis of an application submitted\nby the petitioner under Section 457 of the Code\nof Criminal Procedure, the learned Magistrate\nissued Annexure Al order directing release of the\nvehicle, subject to conditions. The petitioner\ncomplied with the conditions and the vehicle was\n\nEen\n2021/KER/146\nCrl.M.C No. 5918 of 2020\n-3-\nreleased.\n\n2. This Crl.M.C is filed aggrieved by\ncondition No.4(7) in Annexure Al order, directing\nthe original documents produced before the court\nto be retained in court custody and to issue true\ncertified copies of those documents to the\npetitioner. Annexure A2 is the order passed by\nthis Court whereby, the condition akin to\ncondition No.4(7) in Annexure Al was modified.\n\n3. On the facts of this case and in view of\nthe earlier orders passed by this Court under\nSimilar circumstances, I am inclined to grant the\nrelief sought.\n\nIn the result, condition No.4(7) in Annexure\nAl is modified as follows: -\n\nThe petitioner shall submit an affidavit\nundertaking to produce the original documents of\nthe vehicle bearing registration No.KL-23-6434 as\n\noe\nal\n2021/KER/146\nCrl.M.C No. 5918 of 2020\n-4-\nand when required by the court. On submission of\nsuch affidavit, the original documents of the\nvehicle kept in the safe custody of the court\nshall be released to the petitioner, after\nsubstituting those documents with certified\ncopies.\nThe Cr1.M.C is allowed as above.\nSd/-\nV.G.ARUN\nJUDGE\n\nSc1/04.01.2021\n\nBonne\nPER\n2021/KER/146\nCril.M.C No. 5918 of 2020\n-5-\nAPPENDIX\nPETITIONER'S/S EXHIBITS:\nANNEXURE Al TRUE COPY OF THE ORDER IN CMP NO\n2052/2020 OF MAGISTRATE COURT, SOUTH\nPARAVUR\nANNEXURE A2 TRUE COPY OF THE ORDER IN CRL MC NO\n3429/2020 OF HIGH COURT OF KERALA\n\n"
}