{
    "case_id": "Crl.MC.No.3345 OF 2017",
    "court": "HIGH COURT OF KERALA AT ERNAKULAM\nPRESENT\nTHE HONOURABLE MR",
    "date": "8TH DAY OF JANUARY 2021",
    "judge": "P.V.KUNHIKRISHNAN\nFRIDAY",
    "petitioners": [
        "ACCUSED :",
        "SHADHAB",
        "AGED 35 YEARS,S/O SHOWKATH, THEKKTIL",
        "HOUSE , CHAKKALAKUTH, NEAR N.S.SCHOOL,NILAMBUR P.O.,",
        "MALAPPURAM DISTRICT."
    ],
    "respondents": [
        "S/COMPLAINANTS & STATE:",
        "1 BRIJESH P G",
        "AGED 33 YEARS,S/O GOVINDANKUTTY, PUTHENPURAYIL",
        "HOUSE , CHAKKALAKUTHU, NILAMBUR P.O. ,MALAPPURAM",
        "DISTRICT - 679329",
        "2 THE SUB INSPECTOR OF POLICE",
        "NILAMBUR POLICE STATION,MALAPPURAM DISTRICT - 679329",
        "3 STATE OF KERALA",
        "(RESPONDENTS 2 AND 3 REPRESENTED BY THE PUBLIC",
        "PROSECUTOR,HIGH COURT OF KERALA, ERNAKULAM - 682031)",
        "R1 BY ADV. SRI.C.C.ANOOP"
    ],
    "sections": [
        "482 Cr"
    ],
    "outcome": "ORDER\nDated this the 8th day of January 2021\n\nThis Crl.M.C. under Section 482 Cr.P.C. is\nfiled to quash all further proceedings in Crime\nNo.209/2017 of Nilamboor Police Station. The\nabove case is registered against the petitioner\nalleging offences punishable under Sections 324\nand 308 read with Section 34 of the IPC.\n\n2. The prosecution case in brief is that on\n02.05.2017 at 8 p.m., the accused assaulted the\ndefacto complainant in this case and he sustained\ninjury.\n\n3. When this case came up for consideration\nthe learned counsel for the petitioner submitted\nthat the entire dispute between the petitioner and\nthe 1** respondent are settled out of court. A\nlawyer is also appeared for the 15* respondent.\nThe learned counsel for the 1** respondent also\nsubmitted that the entire dispute are settled out\nof court. Annexure A2 is an affidavit filed by\n\nEee\nCrl.MC.No.3345 OF 2017 202 1/KER/T226\n3\nthe 1** respondent.\n\n4. The learned Public Prosecutor also\nsubmitted that he has no objection in quashing\nthe proceedings.\n\n5. Having considered the gravity of the\noffences alleged, nature of the injury caused and\nhaving perused the affidavit filed by the i1*\nrespondent, the contents of which are submitted to\nbe true and voluntary, I am satisfied that the\nmatter has been amicably settled and that no\npublic interest is involved in this’ matter.\nMoreover, in view of the settlement arrived at\nbetween the parties, there is no possibility of\nthe criminal proceedings ending in conviction. As\nsuch, continuance of the proceedings will amount\nto an abuse of process of court and hence, in view\nof the legal position set out by the Honourable\nSupreme Court in Madan Mohan Abbot v. State of\nPunjab [(2008) 4 SCC 582] and Gian Singh v. State\nof Punjab and another [(2012) 10 SCC 303], there\nis no impediment in granting the relief.\n\nPelige\n| CHE amen\nCrl.MC.No.3345 OF 2017 202UKER/1226\n4\nTherefore, this Crl.M.C. is allowed and all\nfurther proceedings consequent to Crime\nNo.209/2017 of Nilamboor Police Station are\nquashed",
    "full_text": "PMS\ntee cere\n4s wae icy\neee\nBee\n2021/KER/1226\nIN THE HIGH COURT OF KERALA AT ERNAKULAM\nPRESENT\nTHE HONOURABLE MR. JUSTICE P.V.KUNHIKRISHNAN\nFRIDAY, THE O8TH DAY OF JANUARY 2021 / 18TH POUSHA, 1942\nCrl1.MC.No.3345 OF 2017\nCRIME NO.209/2017 OF Nilambur Police Station , Malappuram\nPETITIONER/ACCUSED :\nSHADHAB\nAGED 35 YEARS,S/O SHOWKATH, THEKKTIL\nHOUSE , CHAKKALAKUTH, NEAR N.S.SCHOOL,NILAMBUR P.O.,\nMALAPPURAM DISTRICT.\nBY ADV. SRI.SUNNY MATHEW\nRESPONDENTS/COMPLAINANTS & STATE:\n1 BRIJESH P G\nAGED 33 YEARS,S/O GOVINDANKUTTY, PUTHENPURAYIL\nHOUSE , CHAKKALAKUTHU, NILAMBUR P.O. ,MALAPPURAM\nDISTRICT - 679329\n2 THE SUB INSPECTOR OF POLICE\nNILAMBUR POLICE STATION,MALAPPURAM DISTRICT - 679329\n3 STATE OF KERALA\n(RESPONDENTS 2 AND 3 REPRESENTED BY THE PUBLIC\nPROSECUTOR,HIGH COURT OF KERALA, ERNAKULAM - 682031)\nR1 BY ADV. SRI.C.C.ANOOP\nSRI.SANTOSH PETER, SR.PP\nTHIS CRIMINAL MISC. CASE HAVING BEEN FINALLY HEARD ON\n08.01.2021, THE COURT ON THE SAME DAY PASSED THE FOLLOWING:\n\nPeli\nOa\nCrl.MC.No.3345 OF 2017 202 1/KER/T226\n2\nORDER\nDated this the 8th day of January 2021\n\nThis Crl.M.C. under Section 482 Cr.P.C. is\nfiled to quash all further proceedings in Crime\nNo.209/2017 of Nilamboor Police Station. The\nabove case is registered against the petitioner\nalleging offences punishable under Sections 324\nand 308 read with Section 34 of the IPC.\n\n2. The prosecution case in brief is that on\n02.05.2017 at 8 p.m., the accused assaulted the\ndefacto complainant in this case and he sustained\ninjury.\n\n3. When this case came up for consideration\nthe learned counsel for the petitioner submitted\nthat the entire dispute between the petitioner and\nthe 1** respondent are settled out of court. A\nlawyer is also appeared for the 15* respondent.\nThe learned counsel for the 1** respondent also\nsubmitted that the entire dispute are settled out\nof court. Annexure A2 is an affidavit filed by\n\nEee\nCrl.MC.No.3345 OF 2017 202 1/KER/T226\n3\nthe 1** respondent.\n\n4. The learned Public Prosecutor also\nsubmitted that he has no objection in quashing\nthe proceedings.\n\n5. Having considered the gravity of the\noffences alleged, nature of the injury caused and\nhaving perused the affidavit filed by the i1*\nrespondent, the contents of which are submitted to\nbe true and voluntary, I am satisfied that the\nmatter has been amicably settled and that no\npublic interest is involved in this’ matter.\nMoreover, in view of the settlement arrived at\nbetween the parties, there is no possibility of\nthe criminal proceedings ending in conviction. As\nsuch, continuance of the proceedings will amount\nto an abuse of process of court and hence, in view\nof the legal position set out by the Honourable\nSupreme Court in Madan Mohan Abbot v. State of\nPunjab [(2008) 4 SCC 582] and Gian Singh v. State\nof Punjab and another [(2012) 10 SCC 303], there\nis no impediment in granting the relief.\n\nPelige\n| CHE amen\nCrl.MC.No.3345 OF 2017 202UKER/1226\n4\nTherefore, this Crl.M.C. is allowed and all\nfurther proceedings consequent to Crime\nNo.209/2017 of Nilamboor Police Station are\nquashed.\nSd/-\nP.V.KUNHIKRISHNAN\nJUDGE\nDM\n\nLEA\nre cea\nape\nCrl.MC.No.3345 OF 2017 2021/KER/1226\n5\nAPPENDIX\nPETITIONER'S EXHIBITS:\nANNEXURE Al TRUE COPY OF FIRST INFORMATION REPORT\nIN CRIME NO.209/2017 OF NILAMBUR POLICE\nSTATION.\nANNEXURE A2 TRUE COPY OF THE AFFIDAVIT SWORN TO BY\nTHE RESPONDENT NO.1\nRESPONDENTS' EXHIBITS : NIL\n//TRUE COPY//\nPA TO JUDGE\n\n"
}