{
    "case_id": "Crl.MC.No. 8946 of 2018",
    "court": "HIGH COURT OF KERALA AT ERNAKULAM\nPRESENT\nTHE HONOURABLE MR",
    "date": "9TH DAY OF JANUARY 2019",
    "judge": "K.ABRAHAM MATHEW\nWEDNESDAY",
    "petitioners": [
        "S:",
        "1 SANJITH B,",
        "AGED 26 YEARS",
        "S/O RAJAN K,RESIDING NEAR AJANUR",
        "BEACH , KOLAVAYAL,AJANUR VILLAGE , KASARAGOD",
        "DISTRICT",
        "2 RIDHIN RAJ,",
        "AGED 22 YEARS",
        "S/O RAJAN,RESIDING NEAR AJANUR",
        "BEACH , KOLAVAYAL ,AJANUR VILLAGE , KASARAGOD",
        "DISTRICT."
    ],
    "respondents": [
        "S:",
        "1 THE STATE OF KERALA,",
        "KERALA THROUGH THE STATION",
        "HOUSE ,OFFICER,HOSDURG POLICE STATION , KASARAGOD",
        "DISTRICT ,REPRESENTED BY THE PUBLIC",
        "PROSECUTOR,HIGH COURT OF KERALA,",
        "ERNAKULAM 682 031."
    ],
    "sections": [
        "482 Cr"
    ],
    "outcome": "ORDER\nPetition filed under Section 482 Cr.P.C.\n2. The petitioners are the accused in CC No. 1021\nof 2016 on the file of the Judicial First\nClass Magistrate Court-I, Hosdurg registered\nfor the offences under Sections 323, 324 & 447\nof the Tndian Penal Code. The second\nrespondent is the victim. It is submitted that\nthe matter has been settled and the\nproceedings in the criminal case may be\nquashed",
    "full_text": "Bees hal\nFee\nEd\n| CB\n2019/KER/1264\nIN THE HIGH COURT OF KERALA AT ERNAKULAM\nPRESENT\nTHE HONOURABLE MR. JUSTICE K.ABRAHAM MATHEW\nWEDNESDAY ,THE O9TH DAY OF JANUARY 2019 / 19TH POUSHA,\n1940\nCr1.MC.No. 8946 of 2018\ncc 1021/2016 OF J.M.F.C.-I, HOSDRUG\nCRIME NO. 73/2016 OF HOSDURG POLICE STATION , KASARGOD\nPETITIONER/S:\n1 SANJITH B,\nAGED 26 YEARS\nS/O RAJAN K,RESIDING NEAR AJANUR\nBEACH , KOLAVAYAL,AJANUR VILLAGE , KASARAGOD\nDISTRICT\n2 RIDHIN RAJ,\nAGED 22 YEARS\nS/O RAJAN,RESIDING NEAR AJANUR\nBEACH , KOLAVAYAL ,AJANUR VILLAGE , KASARAGOD\nDISTRICT.\nBY ADVS.\nSRI .T.MADHU\nSMT.C.R.SARADAMANT\nRESPONDENT/S:\n1 THE STATE OF KERALA,\nKERALA THROUGH THE STATION\nHOUSE ,OFFICER,HOSDURG POLICE STATION , KASARAGOD\nDISTRICT ,REPRESENTED BY THE PUBLIC\nPROSECUTOR,HIGH COURT OF KERALA,\nERNAKULAM 682 031.\n\nDeLee a]\nER:\n2019/KER/1264\nCr1.MC.No. 8946 of 2018\n1.2...\n2 VARUN VASANTHAN, AGED 22 YEARS\nS/O VASANTHAN,RESIDING AT KRISHNA NIVAS ,AJANUR\nKADAPPURAM ,AJANUR VILLAGE , HOSDURG\nTALUK ,KASARAGOD DISTRICT\nBY ADV. T.P.UNNIKRISHNAN\nOTHER PRESENT:\nSRI C S HRITHWIK-SR PP\nTHIS CRIMINAL MISC. CASE HAVING COME UP FOR ADMISSION ON\n09.01.2019, THE COURT ON THE SAME DAY PASSED THE\nFOLLOWING:\nORDER\nPetition filed under Section 482 Cr.P.C.\n2. The petitioners are the accused in CC No. 1021\nof 2016 on the file of the Judicial First\nClass Magistrate Court-I, Hosdurg registered\nfor the offences under Sections 323, 324 & 447\nof the Tndian Penal Code. The second\nrespondent is the victim. It is submitted that\nthe matter has been settled and the\nproceedings in the criminal case may be\nquashed.\n\nsane\n2019/KER/1264\n\nCrl.MC.No. 8946 of 2018\n\n1.3..\n\n3. Heard the learned counsel for the petitioners\nand the second respondent and the learned\nPublic Prosecutor.\n\n4. I have perused the affidavit filed by the\nsecond respondent, who has entered appearance\nthrough counsel. I am satisfied that the\nallegation of settlement is true and no public\ninterest is involved. There is no impediment\nfor granting the prayer of the petitioners.\n\nIn the result, this Crl.M.C. is allowed. The\nproceedings in CC No. 1021 of 2016 on the file\nof the Judicial First Class Magistrate\nCourt-I, Hosdurg are quashed. The learned\nmagistrate may pass appropriate orders for the\ndisposal of the material objects, if any,\nproduced in the case.\n\nSd/-\n\nK.ABRAHAM MATHEW\nJUDGE\nBka/11.01.2019\n\nBees hal\nFee\nER:\n2019/KER/1264\nCr1.MC.No. 8946 of 2018\n~.4..\nAPPENDIX\nPETITIONER'S/S EXHIBITS:\nANNEXURE Al THE TRUE CERTIFIED COPY OF THE FIR IN\nCRIME NO 73/2016 OF HOSDURG POLICE\nSTATION\nANNEXURE A2 THE TRUE CERTIFIED COPY OF THE FINAL\nREPORT IN CRIME NO 73/2016 OF HOSDURG\nPOLICE STATION\nANNEXURE A3 THE AFFIDAVIT DATED 25.10.2018 SWORN\nIN BY THE 2ND RESPONDENT\n\n"
}