{
    "case_id": "",
    "court": "HIGH COURT OF KERALA AT ERNAKULAM\nPRESENT",
    "date": "1ST DAY OF JANUARY 2014",
    "judge": "A-HARIPRASAD\nWEDNESDAY",
    "petitioners": [
        "ACCUSED:",
        "JOGIMON MATHEW, AGED 32 YEARS,",
        "S/O.MATHAI, VADAKKEDATHU HOUSE, PULICKAL KAVALA",
        "VAZHOOR, KOTTAYAM."
    ],
    "respondents": [
        "STATE & COMPLAINANT:",
        "1. STATE OF KREALA, REPRESENTED BY THE",
        "PUBLIC PROSECUTOR, HIGH COURT OF KERALA, ERNAKULAM.",
        "2. THE SUB INSPECTOR OF POLICE,",
        "PALLICKATHODU POLICE STATION, KOTTAYAM.",
        "3. PK.PURUSHOTHAMAN, S/O. KUMARAN,",
        "PANDIMAKAL HOUSE, VAZHOOR P.O., KOTTAYAM.",
        "R3 BY ADV. SRLPKURUVILLA JACOB",
        "RI & R2 BY PUBLIC PROSECUTOR SMT. BINDU GOPINATH"
    ],
    "sections": [
        "406 of the Indian\nPenal Code"
    ],
    "outcome": "ORDER\nHeard the learned counsel for the petitioner. Perused the\naffidavit dated 17.10.2013 filed by the 3 respondent.\n\n2. Learned counsel for the petitioner submitted that the offence\nalleged against the petitioner is punishable under Section 406 of the Indian\nPenal Code. Since the matter has been settled, | find that the petition can\nbe allowed. Annexure-B FIR is hereby quashed",
    "full_text": "-\nBeas\n2014/KER/S3\nIN THE HIGH COURT OF KERALA AT ERNAKULAM\nPRESENT:\nTHE HONOURABLE MR. JUSTICE A-HARIPRASAD\nWEDNESDAY, THE 1ST DAY OF JANUARY 2014/11TH POUSHA, 1935\nCrLMCNo. 1723 of 2010 ()\nCRIME NO.217/2010 OF THE PALLICKATHODU POLICE STATION\nPETITIONER(S)/ACCUSED:\nJOGIMON MATHEW, AGED 32 YEARS,\nS/O.MATHAI, VADAKKEDATHU HOUSE, PULICKAL KAVALA\nVAZHOOR, KOTTAYAM.\nBY ADV. SRI.M.J.THOMAS\nRESPONDENT(S)/STATE & COMPLAINANT:\n1. STATE OF KREALA, REPRESENTED BY THE\nPUBLIC PROSECUTOR, HIGH COURT OF KERALA, ERNAKULAM.\n2. THE SUB INSPECTOR OF POLICE,\nPALLICKATHODU POLICE STATION, KOTTAYAM.\n3. PK.PURUSHOTHAMAN, S/O. KUMARAN,\nPANDIMAKAL HOUSE, VAZHOOR P.O., KOTTAYAM.\nR3 BY ADV. SRLPKURUVILLA JACOB\nRI & R2 BY PUBLIC PROSECUTOR SMT. BINDU GOPINATH\nTHIS CRIMINAL MISC. CASE HAVING BEEN FINALLY HEARD ON 01-01-2014,\nTHE COURT ON THE SAME DAY PASSED THE FOLLOWING:\n\nBeas\n2014/KER/53\nCRL.MC, NO.1723/2010\nAPPENDIX\nPETITIONER'S EXHIBITS:\nANNEXURE A TRUE COPY OF THE CMP NO.1701/2010 FILED BY THE 3RD RESPONDENT\nBEFORE THE JUDICIAL FIRST CLASS MAGISTRATE COURT NO.1, KANJIRAPPALLY\nANNEXURE B CERTIFIED COPY OF THE CRIME NO.217/2010 OF PALLICKATHODU POLICE\nSTATION\nANNEXURE C TRUE COPY OF THE SALE DEED NO.1103/2002 OF SRO VAZHOOR\nRESPONDENTS' EXHIBITS: NIL\nTRUE COPY//\n\noe\n\nBeet\n2014/KER/53\n\nA.HARIPRASAD, J.\nCri.M.C. No.1723 of 2010\nDated this the 1* day of January, 2014.\nORDER\nHeard the learned counsel for the petitioner. Perused the\naffidavit dated 17.10.2013 filed by the 3 respondent.\n\n2. Learned counsel for the petitioner submitted that the offence\nalleged against the petitioner is punishable under Section 406 of the Indian\nPenal Code. Since the matter has been settled, | find that the petition can\nbe allowed. Annexure-B FIR is hereby quashed.\n\nAll pending interlocutory applications will stand dismissed.\nA. HARIPRASAD, JUDGE.\ncks\n\n"
}