{
    "case_id": "Crl.MC.No. 6297 of 2017",
    "court": "HIGH COURT OF KERALA AT ERNAKULAM",
    "date": "8TH DAY OF JANUARY 2018",
    "judge": "B.KEMAIL PASHA\nMONDAY",
    "petitioners": [
        "(S) /ACCUSED:",
        "DR.P.S.THAHA,",
        "AGED 65 YEARS, S/O.THE LATE SHAHUL HAMEED,",
        "DIRECTOR, PMS COLLEGE OF DENTAL SCIENCE AND RESEARCH,",
        "VATTAPPARA, GOLDEN HILLS, VENKOD P.O.,",
        "THIRUVANANTHAPURAM DISTRICT, PIN - 695 028."
    ],
    "respondents": [
        "(S)} /COMPLAINANT AND THE STATE :",
        "1. THE ASSISTANT LABOUR OFFICER,",
        "NEGUMANGAD, NEDUMANGAD P.O.,",
        "THIRUVANANTHAPURAM DISTRICT, PIN - 695 541.",
        "2. STATE OF KERALA,",
        "REPRESENTED BY THE PUBLIC PROSECUTOR,",
        "HIGH COURT OF KERALA, ERNAKULAM, PIN - 682 031."
    ],
    "sections": [],
    "outcome": "",
    "full_text": "stra re eeeat\na\nIN THE HIGH COURT OF KERALA AT ERNAKULAM 2018/KER/711\nPRESENT:\nTHE HONOURABLE MR. JUSTICE B.KEMAIL PASHA\nMONDAY, THE 8TH DAY OF JANUARY 2018 / 18TH POUSHA, 1939\nCr1.MC.No. 6297 of 2017\nS.T.NO. 2941/2015 OF JUDICIAL FIRST CLASS MAGISTRATE COURT-I, NEDUMANGAD,\nTHIRUVANANTHAPURAM DISTRICT\nPETITIONER (S) /ACCUSED:\nDR.P.S.THAHA,\nAGED 65 YEARS, S/O.THE LATE SHAHUL HAMEED,\nDIRECTOR, PMS COLLEGE OF DENTAL SCIENCE AND RESEARCH,\nVATTAPPARA, GOLDEN HILLS, VENKOD P.O.,\nTHIRUVANANTHAPURAM DISTRICT, PIN - 695 028.\nBY ADVS.SRI.C.S.MANU\nSRI.S.K.PREMRAJ\nRESPONDENT (S)} /COMPLAINANT AND THE STATE :\n1. THE ASSISTANT LABOUR OFFICER,\nNEGUMANGAD, NEDUMANGAD P.O.,\nTHIRUVANANTHAPURAM DISTRICT, PIN - 695 541.\n2. STATE OF KERALA,\nREPRESENTED BY THE PUBLIC PROSECUTOR,\nHIGH COURT OF KERALA, ERNAKULAM, PIN - 682 031.\nBY PUBLIC PROSECUTOR SRI.ALEX M.THOMBRA\nTHIS CRIMINAL MISC. CASE HAVING COME UP FOR ADMISSION\nON 08-01-2018, THE COURT ON THE SAME DAY PASSED\nTHE FOLLOWING:\nMsd.\n\nattra oesge\n= F sae\neee\nCrl.MC.No. 6297 of 2017 2018/KER/711\nAPPENDIX\nPETITIONER(S)' ANNEXURES :\nANNEXURE AL. TRUE COPY OF THE COMPLAINT DATED 05.11.2015 FILED\nBY THE 1ST RESPONDENT BEFORE THE JFCM-1,\nNEDUMANGAD AND REGISTERED AS ST NO.2941 OF 2015.\nANNEXURE A2. TRUE COPY OF THE REPLY DATED 25.05.2015 FILED BY\nTHE 1ST RESPONDENT.\nANNEXURE A3. TRUE COPY OF AGREEMENT DATED 01.06.2005 ENTERED\nINTO BY AND BETWEEN PMS COLLEGE AND DENTAL\nSCIENCE AND RESEARCH AND SREE UTHRADAM\nTHIRUNAL RURAL GENERAL HOSPITAL.\nANNEXURE A4. TRUE COPY OF THE CERTIFICATE BEARING\nNO .D5-187/2006 DATED 10.04.2016 ISSUED BY THE\nEXECUTIVE ENGINEER, PWD BUILDINGS DIVISION,\nTHIRUVANANTHAPURAM .\nRESPONDENT (S) ' ANNEXURES :\nNIL\n//TRUE COPY//\nP.S.TO JUDGE\nMsd.\n\n2018/KER/711\nB. KEMAL PASHA, J.\n~ Crl.M.C.No.6297 of 2017\n\"Dated this the 8\" day of January, 2018\nORDER\n\nAccording to the learned counsel for the\npetitioner, the present establishment is not covered by\nthe Kerala Industrial Establishments (National and Festival\nHolidays) Act, 1958 (the 1958 Act), since it has not been\nnotified by the Government as such an establishment.\nFurther, it has been pointed out that the same is covered\nby the Kerala University of Health Sciences Act, 2010\nwherein provisions are there, which cover the similar\ninstances contained in this case.\n\n2. The question as to whether the institution\nis one coming within the category of _ industrial\nestablishment as defined in the 1958 Act, is a matter to\nbe decided by the court below. The petitioner can\napproach the court below with the said request, so that\nthe court below can decide the said request.\n\nWith the said liberty to the petitioner, this Crl.\n\nape\n2018/KER/711\nCrl.M.C.No. 6297 of 2017\n-2-\nM.C is disposed of. As far as practicable, the court below\nshall grant exemption to the petitioner from personal\nappearance.\nSd/-\nB. KEMAL PASHA\nJUDGE\nbng\n\n"
}