{
    "case_id": "Crl.MC.No.3004 OF 2015",
    "court": "HIGH COURT OF KERALA AT ERNAKULAM",
    "date": "11TH DAY OF JANUARY 2021",
    "judge": "P.SOMARAJAN\nMONDAY",
    "petitioners": [
        "S /ACCUSED 1 TO 3:",
        "1 SHAHUL HAMEED",
        "AGED 40 YEARS",
        "S/O.NOORUDHIN, MATTUMMAL PARAMBU, MUTHIRAPARAMBATH,",
        "VAIDYARANGADI, RAMANATTUKARA, KOZHIKODE-673633.",
        "2 SHAHITHA",
        "AGED 37 YEARS, D/O. VEERAN KOYA, THOPPAYIL HOUSE,",
        "NADAKKAVU P.O., KOZHIKODE-673011.",
        "3 MOHANAN.T",
        "AGED 57 YEARS, S/O.KESAVAN NAIR, AREEKKAL MEETHAL",
        "HOUSE, P.O.MADAVOOR, NARIKUNI, KOZHIKODE-673583."
    ],
    "respondents": [
        "S/STATE, COMPLAINANT & NO PARTY:",
        "1 THE STATE OF KERALA",
        "REPRESENTED BY THE PUBLIC PROSECUTOR, HIGH COURT OF",
        "KERALA, ERNAKULAM-682031.",
        "2 THE SUB INSPECTOR OF POLICE",
        "NALLALAM POLICE STATION, KOZHIKODE-673019.",
        "3 THE ASSISTANT CITY POLICE COMMISSIONER SOUTH",
        "KOZHIKODE-673001.",
        "4 BHASKARAN",
        "S/O KANARAN,AGED ABOUT 46,KODAKAT HOUSE, ELATTIL",
        "VATTOLI P.O.,KOZHIKODE AMSOM,KODUVALLY , KOZHIKODE",
        "673572",
        "(IS IMPLEADED AS 4TH RESPONDENT AS PER ORDER DATED",
        "02.06.2015, IN CRL.MA. 5148/15 IN CRL.M.C.3004/15)",
        "R1 BY ADV. SRI.K.I.ABDUL RASHEED, ADDL. PUBLIC",
        "PROSECUTOR",
        "R1 BY ADV. SRI.K.I.ABDUL RASHEEDADDL. PUBLIC",
        "PROSECUTOR",
        "R1 BY ADV. SMT.REKHA ARAVIND",
        "R1 BY ADV. SRI.SANTHARAM.P",
        "P.P.SMT.M.N.MAYA"
    ],
    "sections": [],
    "outcome": "",
    "full_text": "a Eee\nBae\nIN THE HIGH COURT OF KERALA AT ERNAKULAM 202 1/KER/518\nPRESENT\nTHE HONOURABLE MR. JUSTICE P.SOMARAJAN\nMONDAY, THE 11TH DAY OF JANUARY 2021 / 21TH POUSHA, 1942\nCrl1.MC.No.3004 OF 2015\nCRIME NO.1030/2014 OF Nallalam Police Station , Kozhikode\nPETITIONERS /ACCUSED 1 TO 3:\n1 SHAHUL HAMEED\nAGED 40 YEARS\nS/O.NOORUDHIN, MATTUMMAL PARAMBU, MUTHIRAPARAMBATH,\nVAIDYARANGADI, RAMANATTUKARA, KOZHIKODE-673633.\n2 SHAHITHA\nAGED 37 YEARS, D/O. VEERAN KOYA, THOPPAYIL HOUSE,\nNADAKKAVU P.O., KOZHIKODE-673011.\n3 MOHANAN.T\nAGED 57 YEARS, S/O.KESAVAN NAIR, AREEKKAL MEETHAL\nHOUSE, P.O.MADAVOOR, NARIKUNI, KOZHIKODE-673583.\nBY ADV. SRI.C.K.SREEJITH\nRESPONDENTS/STATE, COMPLAINANT & NO PARTY:\n1 THE STATE OF KERALA\nREPRESENTED BY THE PUBLIC PROSECUTOR, HIGH COURT OF\nKERALA, ERNAKULAM-682031.\n2 THE SUB INSPECTOR OF POLICE\nNALLALAM POLICE STATION, KOZHIKODE-673019.\n3 THE ASSISTANT CITY POLICE COMMISSIONER SOUTH\nKOZHIKODE-673001.\n4 BHASKARAN\nS/O KANARAN,AGED ABOUT 46,KODAKAT HOUSE, ELATTIL\nVATTOLI P.O.,KOZHIKODE AMSOM,KODUVALLY , KOZHIKODE\n673572\n(IS IMPLEADED AS 4TH RESPONDENT AS PER ORDER DATED\n02.06.2015, IN CRL.MA. 5148/15 IN CRL.M.C.3004/15)\nR1 BY ADV. SRI.K.I.ABDUL RASHEED, ADDL. PUBLIC\nPROSECUTOR\nR1 BY ADV. SRI.K.I.ABDUL RASHEEDADDL. PUBLIC\nPROSECUTOR\nR1 BY ADV. SMT.REKHA ARAVIND\nR1 BY ADV. SRI.SANTHARAM.P\nP.P.SMT.M.N.MAYA\nTHIS CRIMINAL MISC. CASE HAVING BEEN FINALLY HEARD ON\n11.01.2021, THE COURT ON THE SAME DAY PASSED THE FOLLOWING:\n\nBaers Tal\nBae\nCr1.MC.No.3004 OF 2015 2021/KER/1518\n2\nORDER\nIt is the case of the year 2015. Adv. Smt.\nSheeja appeared on behalf of the counsel for the\npetitioners. The counsel for the petitioners\nremained absent. Farlier it was dismissed for\ndefault. It was restored and again came up for\nhearing. This would show what is behind it. Hence\nthe Crl.M.C. is dismissed for non-prosecution.\nSd/-\nP. SOMARAJAN\nJUDGE\nSPV\n\nBl Lee\nake\nBer\nCrl.MC.No.3004 OF 2015 2021/KERIISI8\n3\nAPPENDIX\nPETITIONER'S/S EXHIBITS:\nANNEXURE P1 ANNEXURE-I: TRUE COPIES OF THE\nAPPLICATION FORM DATED 7.1.2014 WITH\nCONSENT LETTER AND RECEIPT OF PAYMENT OF\nREGISTRATION FEE.\nANNEXURE P2 ANNEXURE-II: TRUE COPY OF THE ACCOUNTS\nSTATEMENT OF LOAN TRANSACTION OF THE DE\nFACTO COMPLAINANT.\nANNEXURE P3 ANNEXURE-IIIT: TRUE COPY OF THE COMPLAINT\nDATED 2.10.2013 LODGED BY THE 2ND\nPETITIONER BEFORE THE 2ND RESPONDENT.\nANNEXURE P4 ANNEXURE-IV: TRUE COPY OF THE FINAL\nREPORT DATED 4.3.2015 IN CRIME NO.1031\nOF THE 2ND RESPONDENT.\nANNEXURE P5 ANNEXURE-V: TRUE COPY OF THE F.I.R.\nDATED 10.12.2014 (CRIME NO.1030/14) OF\nTHE 2ND RESPONDENT WITH COMPLAINT DATED\n2.10.2014 OF THE DE FACTO COMPLAINANT.\nANNEXURE P6 ANNEXURE-VI: TRUE COPY OF THE FINAL\nREPORT DATED 9.3.2015 WITH STATEMENT OF\nWITNESSES .\nANNEXURE P7 ANNEXURE-VII: TRUE COPY OF THE\nREPRESENTATION DATED 21.2.2014 SUBMITTED\nBY THE PETITIONERS TO THE CO-OPERATIVE\nSOCIETY.\nANNEXURE P8 ANNEXURE-VIII: TRUE COPY OF THE\nREPRESENTATION DATED 3.5.2015 SUBMITTED\nBY THE PETITIONERS TO THE CO-OPERATIVE\nSOCIETY.\nANNEXURE P9 ANNEXURE-IX: TRUE COPY OF THE\nCOMMUNICATION DATED 28.2.2014 ISSUED BY\nTHE CO-OPERATIVE SOCIETY TO THE DE FACTO\nCOMPLAINANT .\nANNEXURE P10 ANNEXURE-X: TRUE COPY OF NEWS ITEM\nAPPEARED IN MALABAR EXPRESS DAILY DATED\n3.5.2014.\nANNEXURE Pil ANNEXURE-XI: TRUE COPY OF THE COMPLAINT\n\nBl ee\n[siete\nCrl.MC.No.3004 OF 2015 2021/KER/ISI8\n4\nDATED 17.1.2015 SUBMITTED BY THE\nPETITIONERS TO THE 3RD RESPONDENT WITH\nITS RECEIPT DATED 19.1.2015.\nRESPONDENTS! EXHIBITS: NIL\n//TRUE COPY//\nPA TO JUDGE\n\n"
}