{
    "case_id": "Crl.MC.No.132 OF 2020",
    "court": "HIGH COURT OF KERALA AT ERNAKULAM",
    "date": "9TH DAY OF JANUARY 2020",
    "judge": "ASHOK MENON\nTHURSDAY",
    "petitioners": [
        "S:",
        "MUNEER,",
        "AGED 31 YEARS",
        "$/O.ABDUL RAHIM, KILITHATTIL VEEDU, UMYANALLOOR P.O.,",
        "THAZHATHUTHALA VILLAGE, KOLLAM DISTRICT, (OWNER OF A",
        "LORRY BEARING REGISTRATION NO.",
        "KL-19-A-6669) ."
    ],
    "respondents": [
        "S:",
        "1 STATE OF KERALA,",
        "REPRESENTED BY PUBLIC PROSECUTOR, HONOURABLE HIGH",
        "COURT OF KERALA AT ERNAKULAM, KOCHI-31.",
        "2 THE SUB INSPECTOR OF POLICE,",
        "PARIPPALLY POLICE STATION, KOLLAM DISTRICT- 691572.",
        "3 THE DISTRICT COLLECTOR,",
        "CIVIL STATION, KOLLAM- 691572.",
        "4 THE SUB COLLECTOR/REVENUE DIVISIONAL OFFICER,",
        "KOLLAM- 691013.",
        "OTHER PRESENT:"
    ],
    "sections": [
        "457 of Cr"
    ],
    "outcome": "",
    "full_text": "sete rs\nBas on\nIN THE HIGH COURT OF KERALA AT ERNAKULAM 2020/KER/928\nPRESENT\nTHE HONOURABLE MR. JUSTICE ASHOK MENON\nTHURSDAY, THE O9TH DAY OF JANUARY 2020 / 19TH POUSHA, 1941\nCrl1.MC.No.132 OF 2020 (F)\n\nAGAINST THE ORDER/JUDGMENT IN CRMP 1094/2019 DATED 28-02-2019 OF\nJUDICIAL FIRST CLASS MAGISTRATE COURT (TEMPORARY) ,SOUTH PARAVUR,\nKOLLAM\n\nPETITIONER/S:\nMUNEER,\nAGED 31 YEARS\n$/O.ABDUL RAHIM, KILITHATTIL VEEDU, UMYANALLOOR P.O.,\nTHAZHATHUTHALA VILLAGE, KOLLAM DISTRICT, (OWNER OF A\nLORRY BEARING REGISTRATION NO.\nKL-19-A-6669) .\nBY ADV. SRI.P.M.ZIRAJ\nRESPONDENT/S:\n1 STATE OF KERALA,\nREPRESENTED BY PUBLIC PROSECUTOR, HONOURABLE HIGH\nCOURT OF KERALA AT ERNAKULAM, KOCHI-31.\n2 THE SUB INSPECTOR OF POLICE,\nPARIPPALLY POLICE STATION, KOLLAM DISTRICT- 691572.\n3 THE DISTRICT COLLECTOR,\nCIVIL STATION, KOLLAM- 691572.\n4 THE SUB COLLECTOR/REVENUE DIVISIONAL OFFICER,\nKOLLAM- 691013.\nOTHER PRESENT:\nSRI.B.JAYASURYA SR PP\nTHIS CRIMINAL MISC. CASE HAVING COME UP FOR ADMISSION ON\n09.01.2020, THE COURT ON THE SAME DAY PASSED THE FOLLOWING:\n\nau\nCrl.MC.No.132 OF 2020(F) 2 2020/KER/928\nORDER\nDated this the 9th day of January 2020\n\nThe petitioner is the registered owner of a Tipper lorry\nbearing registration No. KL-19-A 6669. The vehicle was\nseized allegedly for the involvement of offences under the\nprovisions of Kerala Minor Mineral Concession Rule, 2015. No\nFIR has been registered. The Sub Inspector of Police,\nParippally has filed a report to the Revenue Divisional Officer,\nKollam and thereafter the petitioner filed a petition before the\nJudicial First Class Magistrate Court (Temporary), South\nParavur, Kollam under Section 457 of Cr.PB.C. for interim\ncustody of the Tipper lorry belonging to him. Vide order at\nAnnexure I, the lorry was directed to be released to the\npetitioner. The petitioner is aggrieved by condition No.7\nwhich states that the original documents of the vehicle shall\nbe kept in safe custody of the Court and the petitioner shall\nbe issued with a true copy certified from the Court for all\nlegal and practical purposes. The petitioner states that in\nview of this order, he could not ply the vehicle because it is\nessential that the original documents be kept with the\nvehicle.\n\nau\nCrl.MC.No.132 OF 2020(F) 3 2020/KER/928\nIn view of the fact that no crime has been registered\nagainst the petitioner, imposing of such condition cannot be\njustified. The condition No.7 is therefore modified to the\nextent that the petitioner shall produce the _ original\ndocuments and certified copy of the same shall be retained in\nthe court, while the original shall be returned to the\npetitioner.\nThe Crl.M.C is allowed.\nSD/-\nASHOK MENON\nJUDGE\nrmm\n\nsete rs\nBas on\nCrl.MC.No.132 OF 2020(F) 4 2020/KER/928\nAPPENDIX\n\nPETITIONER'S/S EXHIBITS:\n\nANNEXURE 1 TRUE COPY OF THE ORDER DATED\n28.02.2019 IN CMP NO.1094 OF 2019 oN\nTHE FILE OF JUDICIAL FIRST CLASS\nMAGISTRATE COURT (TEMPORARY) SOUTH\nPARAVOOR, KOLLAM.\n\nANNEXURE 2 TRUE COPY OF THE ORDER OF THIS\nHONOURABLE COURT DATED 16.12.2019 IN\nCRL.M.C.NO.8474 OF 2019.\n\nANNEXURE 3 TRUE COPY OF THE ORDER DATED\n07.05.2019 IN CRL.M.C.NO. 3248/2019 oF\nTHIS HONOURABLE COURT.\n\nANNEXURE 4 TRUE COPY OF THE ORDER OF THIS\nHONOURABLE COURT DATED 03.5.2019 IN\nCRL.M.C.NO.3152 OF 2019.\n\nANNEXURE 5 TRUE COPY OF THE ORDER DATED\n11.01.2019 IN CRL.M.C.NO.252/2019 OF\nTHIS HONOURABLE COURT.\n\nANNEXURE 6 TRUE COPY OF THE ORDER DATED\n25.09.2017 IN CRL.M.C.NO.6419/2017 OF\nTHIS HONOURABLE COURT.\n\n"
}