{
    "case_id": "",
    "court": "HIGH COURT OF KERALA AT ERNAKULAM\nPRESENT",
    "date": "5TH DAY OF JANUARY 2015",
    "judge": "B.KEMAL PASHA\nMONDAY",
    "petitioners": [
        "ACCUSED :",
        "BABU, AGED 40 YEARS, S/O MATHAI,",
        "NEELANAL HOUSE, EZHAKKARANADU KARA,",
        "MANEEDU VILLAGE, MUVATTUPUZHA TALUK."
    ],
    "respondents": [
        "COMPLAINANT :",
        "STATE OF KERALA",
        "REPRESENTED BY THE PUBLIC PROSECUTOR,",
        "HIGH COURT OF KERALA, ERNAKULAM."
    ],
    "sections": [],
    "outcome": "",
    "full_text": "grasa\nEl ere\n2015/KER/37\nIN THE HIGH COURT OF KERALA AT ERNAKULAM\nPRESENT:\nTHE HONOURABLE MR. JUSTICE B.KEMAL PASHA\nMONDAY, THE 5TH DAY OF JANUARY 2015/15TH POUSHA, 1936\nCri.MC.No. 7137 of 2014 ()\nCC 1000/2010 of ADDL.CHIEF JUDICIAL MAGISTRATE COURT, ERNAKULAM\nPETITIONER/ACCUSED :\nBABU, AGED 40 YEARS, S/O MATHAI,\nNEELANAL HOUSE, EZHAKKARANADU KARA,\nMANEEDU VILLAGE, MUVATTUPUZHA TALUK.\nBY ADV. SRI.P.T.JOSE\nRESPONDENT/COMPLAINANT :\nSTATE OF KERALA\nREPRESENTED BY THE PUBLIC PROSECUTOR,\nHIGH COURT OF KERALA, ERNAKULAM.\nBY PUBLIC PROSECUTOR SRI. JIBU P. THOMAS\nTHIS CRIMINAL MISC. CASE HAVING COME UP FOR ADMISSION\nON 05-01-2015, THE COURT ON THE SAME DAY PASSED THE\nFOLLOWING:\nbp\n\nBE ees\n2015/KER/37\nCri.MC.No. 7137 of 2014 ()\nAPPENDIX\nPETITIONER(S)' EXHIBITS\nANNEXURE A1: COPY OF JUDGMENT IN CC 2476/2001 OF ACJUM COURT\nERNAKULAM DATED 23.7.2008.\nRESPONDENT(S)' EXHIBITS : NIL.\nITRUE COPY//\nP.A. TO JUDGE\nbp\n\nea\n\nBiante\n2015/KER/37\n\nB. KEMAL PASHA, J.\nvee CTE MAC, NO-7137 OF 2014\nDated this the 5‚Äù day of January, 2015\nORDER\nAdmitted. Heard.\n\n2. The request is for an expeditious disposal of\n\nC.C.1000/2010 by the Additional Chief Judicial Magistrate's\nCourt, Ernakulam. Perused the report filed by the learned\nAdditional Chief Judicial Magistrate's Court, Ernakulam.\nThe learned Additional Chief Judicial Magistrate, Ernakulam\nis directed to dispose of the matter, as expeditiously as\npossible, at any rate, within a period of three months from\ntoday.\n\nThis Crl.M.C. is disposed of as above.\n\nSd/-\n(B.KEMAL PASHA, JUDGE)\naks/05/01\n\n"
}