{
    "case_id": "Crl.MC.No. 6888 of 2017",
    "court": "HIGH COURT OF KERALA AT ERNAKULAM",
    "date": "8TH DAY OF JANUARY 2018",
    "judge": "B.KEMAL PASHA\nMONDAY",
    "petitioners": [
        "(S) /ACCUSED_ :",
        "1  SHARATHLAL P.K.,",
        "S/O.SATHYANARAYANAN, AGED 22 YEARS, KOORANGARA HOUSE,",
        "KALLIOT, KASARAGOD DISTRICT.",
        "2  SREEKUMAR K. @ BAVA,",
        "AGED 28 YEARS, S/O.KRISHNAN P., KANIMKUNDU HOUSE,",
        "PALLIKKARA (VIA), PERIYA P.O., KASARAGOD DISTRICT.",
        "3 SIVARAU P.,",
        "AGED 18 YEARS, S/O.RAJAN K.V., KOORANGARA HOUSE,",
        "KALLIOT, KASARAGOD DISTRICT.",
        "4 MAHESH V.,",
        "AGED 27 YEARS, S/O.BHASKARAN, PARAPPAKKETTU HOUSE,",
        "KALLIOT, KASARAGOD DISTRICT.",
        "5 NIBIN A.,",
        "AGED 19 YEARS, S/O.LATE BALAKRISHNAN, KOORANGARA HOUSE,",
        "KALLIOT, KASARAGOD DISTRICT.",
        "6  SANOOP P.,",
        "AGED 20 YEARS, S/O.JANARDHANAN, KOORANGARA HOUSE,",
        "KALLIOT, KANHIRADUKAM P.O., PERIYA VILLAGE,",
        "KASARAGOD DISTRICT.",
        "7  KRIPESH,",
        "AGED 17 YEARS, S/O.KRISHNAN, KALLIOT HOUSE, KALLIOT,",
        "KASARGOD DISTRICT.",
        "8  JANARDHANAN A.,",
        "AGED 29 YEARS, S/O.THAMBI, PULLUMALA HOUSE, KALLIOT,",
        "KASARAGOD DISTRICT."
    ],
    "respondents": [
        "(S) /COMPLAINANT & STATE:",
        "1. STATE OF KERALA,",
        "REPRESENTED BY PUBLIC PROSECUTOR,",
        "HIGH COURT OF KERALA, ERNAKULAM-682 031.",
        "2/-"
    ],
    "sections": [
        "143",
        "147",
        "148",
        "452",
        "427 IPC read with\nSection 149 IPC"
    ],
    "outcome": "ORDER\n\nPetitioners are accused in Crime No.571 of 2017 of the\nBekal Police Station, registered for the offences punishable\nunder Sections 143, 147, 148, 452 and 427 IPC read with\nSection 149 IPC.\n\n2. It seems that the matter has been amicably seitled\nbetween the parties.\n\n3. On going through the facts and circumstances of\nthe case, it seems that the matter can be permitted to be\nsettled. lt has been reported that no criminal antecedents\nhave been reported against the petitioners. The defacto\ncomplainant has filed Annexure-All affidavit affirming that the\nmatter has been amicably settled between him and the\npetitioners and he has no complaints against the petitioners.\nConsidering the fact that the matter has already been settled\namicably between the parties, this court is satisfied that no\npurpose would be served in proceeding with the trial of the\n\n2018/KER/716\nCrl.M.C.No.6888 of 2017 2\ncase. Matters being so, Annexure-Al First Information Report\nin Crime No.571 of 2017 of the Bekal Police Station, and all\nfurther proceedings in it, as against the petitioners, are liable\nto be quashed",
    "full_text": "eats\nee\neeaeies\nIN THE HIGH COURT OF KERALA AT ERNAKULAM 2018/KER/716\nPRESENT:\nTHE HONOURABLE MR. JUSTICE B.KEMAL PASHA\nMONDAY, THE 8TH DAY OF JANUARY 2018 / 18TH POUSHA, 1939\nCrl.MC.No. 6888 of 2017\nCRIME NO. 571/2017 OF BEKAL POLICE STATION, KASARAGOD DISTRICT\nPETITIONER (S) /ACCUSED_ :\n1  SHARATHLAL P.K.,\nS/O.SATHYANARAYANAN, AGED 22 YEARS, KOORANGARA HOUSE,\nKALLIOT, KASARAGOD DISTRICT.\n2  SREEKUMAR K. @ BAVA,\nAGED 28 YEARS, S/O.KRISHNAN P., KANIMKUNDU HOUSE,\nPALLIKKARA (VIA), PERIYA P.O., KASARAGOD DISTRICT.\n3 SIVARAU P.,\nAGED 18 YEARS, S/O.RAJAN K.V., KOORANGARA HOUSE,\nKALLIOT, KASARAGOD DISTRICT.\n4 MAHESH V.,\nAGED 27 YEARS, S/O.BHASKARAN, PARAPPAKKETTU HOUSE,\nKALLIOT, KASARAGOD DISTRICT.\n5 NIBIN A.,\nAGED 19 YEARS, S/O.LATE BALAKRISHNAN, KOORANGARA HOUSE,\nKALLIOT, KASARAGOD DISTRICT.\n6  SANOOP P.,\nAGED 20 YEARS, S/O.JANARDHANAN, KOORANGARA HOUSE,\nKALLIOT, KANHIRADUKAM P.O., PERIYA VILLAGE,\nKASARAGOD DISTRICT.\n7  KRIPESH,\nAGED 17 YEARS, S/O.KRISHNAN, KALLIOT HOUSE, KALLIOT,\nKASARGOD DISTRICT.\n8  JANARDHANAN A.,\nAGED 29 YEARS, S/O.THAMBI, PULLUMALA HOUSE, KALLIOT,\nKASARAGOD DISTRICT.\nBY ADVS.SRI.M.SASINDRAN\nSRI.P.K.SUBHASH\nRESPONDENT (S) /COMPLAINANT & STATE:\n1. STATE OF KERALA,\nREPRESENTED BY PUBLIC PROSECUTOR,\nHIGH COURT OF KERALA, ERNAKULAM-682 031.\n2/-\n\nse\nee\neee\na 2018/KER/716\nCr1.MC.No. 6888 of 2017\n2. OMANAKUTTAN,\nAGED 52 YEARS, S/O.NARAYANAN, KANNADIPPARA HOUSE,\nKALLIOT, KANJIRADUKKAM P.O., PERIYA VILLAGE,\nKASARAGOD-671 121.\nRi BY SR PUBLIC PROSECUTOR SRI.B.JAYASURYA\nR2 BY ADV. SRI.S.R.SREEJITH\nTHIS CRIMINAL MISC. CASE HAVING COME UP FOR ADMISSION\nON 08-01-2018,THE COURT ON THE SAME DAY PASSED THE FOLLOWING:\nsts\n\neats\nees\n2018/KER/716\nCrl.MC.No. 6888 of 2017 ()\nAPPENDIX\nPETITIONER (S) ' ANNEXURES:\nANNEXURE AT A TRUE COPY OF THE FIR IN CRIME NO.571 OF 2017 OF\nBAKEL POLICE STATION, KASARAGOD DISTRICT.\nANNEXURE AIT A TRUE COPY OF THE AFFIDAVIT SWORN TO BY THE\n2ND RESPONDENT ENDORSING THE FACTUM OF\nCOMPOUNDING OF THE ABOVE SAID OFFENCES AND\nTHE SETTLEMENT OF DISPUTES BETWEEN THE PARTIES.\nRESPONDENT'S ANNEXURES: NIL\n/TRUE COPY/\nP.A.TO JUDGE\nsts\n\n2018/KER/716\nB.KEMAL PASHA, J.\nDated this the 8\" day of January, 2018\nORDER\n\nPetitioners are accused in Crime No.571 of 2017 of the\nBekal Police Station, registered for the offences punishable\nunder Sections 143, 147, 148, 452 and 427 IPC read with\nSection 149 IPC.\n\n2. It seems that the matter has been amicably seitled\nbetween the parties.\n\n3. On going through the facts and circumstances of\nthe case, it seems that the matter can be permitted to be\nsettled. lt has been reported that no criminal antecedents\nhave been reported against the petitioners. The defacto\ncomplainant has filed Annexure-All affidavit affirming that the\nmatter has been amicably settled between him and the\npetitioners and he has no complaints against the petitioners.\nConsidering the fact that the matter has already been settled\namicably between the parties, this court is satisfied that no\npurpose would be served in proceeding with the trial of the\n\n2018/KER/716\nCrl.M.C.No.6888 of 2017 2\ncase. Matters being so, Annexure-Al First Information Report\nin Crime No.571 of 2017 of the Bekal Police Station, and all\nfurther proceedings in it, as against the petitioners, are liable\nto be quashed.\nIn the result, this Crl.M.C. is allowed and Annexure-Al\nFirst Information Report in Crime No.571 of 2017 of the Bekal\nPolice Station, and all further proceedings in it, as against the\npetitioners, are hereby quashed.\nSd/-\nB.KEMAL PASHA\nJUDGE\n\nDSV/8/1/18\n\n// True Copy /\n\nP.A.To Judge\n\n"
}