{
    "case_id": "",
    "court": "HIGH COURT OF KERALA AT ERNAKULAM\nPRESENT",
    "date": "2ND DAY OF JANUARY 2014",
    "judge": "HARUN-UL-RASHID\nTHURSDAY",
    "petitioners": [
        "5TH ACCUSED:",
        "SEBIN, AGED 34 YEARS",
        "S/O.JOSEPH, PANNIPPALLIL HOUSE, VECHOOCHIRA BHAGAM",
        "KUNNUMKARA, KOLLAMULA VILLAGE, RANNI."
    ],
    "respondents": [
        ":",
        "STATE OF KERALA",
        "REP. BY PUBLIC PROSECUTOR, HIGH COURT OF KERALA",
        "ERNAKULAM - 31(SUB INSPECTOR OF POLICE",
        "KOTHAMANGALAM) .",
        "R BY PUBLIC PROSECUTOR SMT. SAREENA GEORGE"
    ],
    "sections": [
        "143",
        "147",
        "148",
        "323",
        "324",
        "326 read with Section 149 of\nthe Indian Penal Code"
    ],
    "outcome": "ORDER OF JUDICIAL FIRST CLASS\nMAGISTRATE COURT KOTHAMANGALAM DATED 30.9.2011 ACQUITTING THE ACCUSED\nRESPONDENT (S)' EXHIBITS: NIL\nTRUE COPY\nPA TO JUDGE\nSCL.\n\n2014/KER/214\nHARUN-UL-RASHID, J.\nDated this the 2” day of January, 2014\nORDER\n\nPetitioner is the fifth accused in Crime No.186 of 2001 of\nKothamangalam Police Station, now pending as C.C.No.517 of\n2011 on the file of the Judicial First Class Magistrate Court,\nKothamangalam. The offences alleged are punishable under\nSections 143, 147, 148, 323, 324 and 326 r/w Section 149 of\nthe Indian Penal Code. The Crl. M.C. is filed seeking to quash\nall further proceedings against the petitioner in C.C.No.517 of\n2011 of the Judicial First Class Magistrate Court,\nKothamangalam.\n\n2. There are altogether 5 accused. The accused Nos. 1\nto 4 faced trial and as per the order in C.C.No.246 of 2008 on\nthe same court, they were acquitted under Section 248(1) of\nthe Code of Criminal Procedure. The learned Magistrate on\nevidence held that, identity of the accused persons was not\nestablished that, the available materials will not suggest anything\n\naah\nape\n2014/KER/214\nCrl.M.C.No. 29 of 2014\n2\nto show that the accused Nos. 1 to 4 attacked CWs 1 to 5 and\ncaused hurt and grievous hurt to them. The dispute between the\naccused and the injured had been settled and presently the\ninjured got no complaint against these accused.\nIn the facts and circumstances, no purpose will be served\nby prosecuting the petitioner. Hence, the Crl.M.C is allowed. All\nfurther proceedings in C.C.No.517 of 2011 of the Judicial First\nClass Magistrate Court, Kothamangalam is quashed",
    "full_text": "Beg aahl\nDe i\npee\neiner\n2014/KER/214\nIN THE HIGH COURT OF KERALA AT ERNAKULAM\nPRESENT :\nTHE HONOURABLE MR.JUSTICE HARUN-UL-RASHID\nTHURSDAY, THE 2ND DAY OF JANUARY 2014/12TH POUSHA, 1935\nCr1.MC.No. 29 of 2014 ()\n(CRIME NO. 186/2001 OF KOTHAMANGALAM POLICE STATION, ERNAKULAM\nDISTRICT)\nPETITIONER/5TH ACCUSED:\nSEBIN, AGED 34 YEARS\nS/O.JOSEPH, PANNIPPALLIL HOUSE, VECHOOCHIRA BHAGAM\nKUNNUMKARA, KOLLAMULA VILLAGE, RANNI.\nBY ADVS.SRI.P.M.HABEEB\nSMT.FRINDA PAILY\nRESPONDENT :\nSTATE OF KERALA\nREP. BY PUBLIC PROSECUTOR, HIGH COURT OF KERALA\nERNAKULAM - 31(SUB INSPECTOR OF POLICE\nKOTHAMANGALAM) .\nR BY PUBLIC PROSECUTOR SMT. SAREENA GEORGE\nTHIS CRIMINAL MISC. CASE HAVING COME UP FOR ADMISSION ON\n02-01-2014, THE COURT ON THE SAME DAY PASSED THE FOLLOWING:\n\nDire\nte 1\npee\nreer\n2014/KER/214\nCr1.MC.No. 29 of 2014 ()\nAPPENDIX\nPETITIONE'S EXHIBITS\nANNEXURE-A: CERTIFIED COPY OF THE CHARGE SHEET IN CRIME NO.186 OF\n2001 OF KOTHAMANGALAM POLICE STATION.\nANNEXURE-B: CERTIFIED COPY OF THE ORDER OF JUDICIAL FIRST CLASS\nMAGISTRATE COURT KOTHAMANGALAM DATED 30.9.2011 ACQUITTING THE ACCUSED\nRESPONDENT (S)' EXHIBITS: NIL\nTRUE COPY\nPA TO JUDGE\nSCL.\n\n2014/KER/214\nHARUN-UL-RASHID, J.\nDated this the 2” day of January, 2014\nORDER\n\nPetitioner is the fifth accused in Crime No.186 of 2001 of\nKothamangalam Police Station, now pending as C.C.No.517 of\n2011 on the file of the Judicial First Class Magistrate Court,\nKothamangalam. The offences alleged are punishable under\nSections 143, 147, 148, 323, 324 and 326 r/w Section 149 of\nthe Indian Penal Code. The Crl. M.C. is filed seeking to quash\nall further proceedings against the petitioner in C.C.No.517 of\n2011 of the Judicial First Class Magistrate Court,\nKothamangalam.\n\n2. There are altogether 5 accused. The accused Nos. 1\nto 4 faced trial and as per the order in C.C.No.246 of 2008 on\nthe same court, they were acquitted under Section 248(1) of\nthe Code of Criminal Procedure. The learned Magistrate on\nevidence held that, identity of the accused persons was not\nestablished that, the available materials will not suggest anything\n\naah\nape\n2014/KER/214\nCrl.M.C.No. 29 of 2014\n2\nto show that the accused Nos. 1 to 4 attacked CWs 1 to 5 and\ncaused hurt and grievous hurt to them. The dispute between the\naccused and the injured had been settled and presently the\ninjured got no complaint against these accused.\nIn the facts and circumstances, no purpose will be served\nby prosecuting the petitioner. Hence, the Crl.M.C is allowed. All\nfurther proceedings in C.C.No.517 of 2011 of the Judicial First\nClass Magistrate Court, Kothamangalam is quashed.\nSd/-\nHARUN-UL-RASHID\nJUDGE\nScl.\n\n"
}