{
    "case_id": "",
    "court": "HIGH COURT OF KERALA AT ERNAKULAM",
    "date": "5TH DAY OF JANUARY 2021",
    "judge": "SHIRCY V.\nTUESDAY",
    "petitioners": [
        "S /ACCUSED NOS.1,3 AND 4:",
        "1 BIPIN THOMAS",
        "AGED 22 YEARS",
        "S/O TOMY THOMAS,",
        "VELIKKAKATHU VEEDU, ERESANKULAM, THENIDUKKU,",
        "VADAKKANCHERRY, ALATHUR, PALAKKAD.",
        "2 TOMY THOMAS",
        "AGED 53 YEARS",
        "S/O THOMAS,",
        "VELIKKAKATHU VEEDU, ERESANKULAM, THENIDUKKU,",
        "VADAKKANCHERRY, ALATHUR, PALAKKAD.",
        "3 BINCY",
        "AGED 44 YEARS",
        "W/O TOMY THOMAS,",
        "VELIKKAKATHU VEEDU, ERESANKULAM, THENIDUKKU,",
        "VADAKKANCHERRY, ALATHUR, PALAKKAD."
    ],
    "respondents": [
        "COMPLAINANT AND STATE:",
        "STATE OF KERALA",
        "REPRESENTED BY PUBLIC PROSECUTOR, HIGH COURT OF",
        "KERALA, ERNAKULAM-682031.",
        "AJITH MURALI -P.P"
    ],
    "sections": [],
    "outcome": "ORDER/JUDGMENT IN CC 741/2016 OF JUDICIAL MAGISTRATE-I\nOF FIRST CLASS, ALATHUR\nCRIME NO.528/2016 OF Vadakkancherry Police Station, Palakkad\nPETITIONERS /ACCUSED NOS.1,3 AND 4:\n1 BIPIN THOMAS\nAGED 22 YEARS\nS/O TOMY THOMAS,\nVELIKKAKATHU VEEDU, ERESANKULAM, THENIDUKKU,\nVADAKKANCHERRY, ALATHUR, PALAKKAD.\n2 TOMY THOMAS\nAGED 53 YEARS\nS/O THOMAS,\nVELIKKAKATHU VEEDU, ERESANKULAM, THENIDUKKU,\nVADAKKANCHERRY, ALATHUR, PALAKKAD.\n3 BINCY\nAGED 44 YEARS\nW/O TOMY THOMAS,\nVELIKKAKATHU VEEDU, ERESANKULAM, THENIDUKKU,\nVADAKKANCHERRY, ALATHUR, PALAKKAD.\nBY ADV. SRI.V.A.JOHNSON (VARIKKAPPALLIL)\nRESPONDENT/COMPLAINANT AND STATE:\nSTATE OF KERALA\nREPRESENTED BY PUBLIC PROSECUTOR, HIGH COURT OF\nKERALA, ERNAKULAM-682031.\nAJITH MURALI -P.P\nTHIS CRIMINAL MISC. CASE HAVING COME UP FOR ADMISSION ON\n05.01.2021, THE COURT ON THE SAME DAY PASSED THE FOLLOWING:\n\n2021/KER/333\nCr1.M.C.No.5618 of 2020\n2\nORDER\nDated this the 5th day of January 2021\n\nThis petition filed by the petitioners, who are the accused\nNos.1, 3 and 4. in C.C.No.741/2016 pending before the\nJudicial First Class Magistrate -I, Alathur for a direction to the\ncourt below to dispose of the case at an early date.\n\n2. A report has been called for from the court\nconcerned regarding the present status of the case and the\ntime required for disposal",
    "full_text": "oe\nFe te eo\nieee\nIN THE HIGH COURT OF KERALA AT ERNAKULAM 2021/KER/333\nPRESENT\nTHE HONOURABLE MRS. JUSTICE SHIRCY V.\nTUESDAY, THE O5TH DAY OF JANUARY 2021 / 15TH POUSHA, 1942\nCri .MC.No.5618 OF 2020 (B)\nAGAINST THE ORDER/JUDGMENT IN CC 741/2016 OF JUDICIAL MAGISTRATE-I\nOF FIRST CLASS, ALATHUR\nCRIME NO.528/2016 OF Vadakkancherry Police Station, Palakkad\nPETITIONERS /ACCUSED NOS.1,3 AND 4:\n1 BIPIN THOMAS\nAGED 22 YEARS\nS/O TOMY THOMAS,\nVELIKKAKATHU VEEDU, ERESANKULAM, THENIDUKKU,\nVADAKKANCHERRY, ALATHUR, PALAKKAD.\n2 TOMY THOMAS\nAGED 53 YEARS\nS/O THOMAS,\nVELIKKAKATHU VEEDU, ERESANKULAM, THENIDUKKU,\nVADAKKANCHERRY, ALATHUR, PALAKKAD.\n3 BINCY\nAGED 44 YEARS\nW/O TOMY THOMAS,\nVELIKKAKATHU VEEDU, ERESANKULAM, THENIDUKKU,\nVADAKKANCHERRY, ALATHUR, PALAKKAD.\nBY ADV. SRI.V.A.JOHNSON (VARIKKAPPALLIL)\nRESPONDENT/COMPLAINANT AND STATE:\nSTATE OF KERALA\nREPRESENTED BY PUBLIC PROSECUTOR, HIGH COURT OF\nKERALA, ERNAKULAM-682031.\nAJITH MURALI -P.P\nTHIS CRIMINAL MISC. CASE HAVING COME UP FOR ADMISSION ON\n05.01.2021, THE COURT ON THE SAME DAY PASSED THE FOLLOWING:\n\n2021/KER/333\nCr1.M.C.No.5618 of 2020\n2\nORDER\nDated this the 5th day of January 2021\n\nThis petition filed by the petitioners, who are the accused\nNos.1, 3 and 4. in C.C.No.741/2016 pending before the\nJudicial First Class Magistrate -I, Alathur for a direction to the\ncourt below to dispose of the case at an early date.\n\n2. A report has been called for from the court\nconcerned regarding the present status of the case and the\ntime required for disposal of the same. The learned Judicial\nFirst Class Magistrate-I, Alathur has reported that actually the\ncase stands posted to 08.02.2021 but it was suo motu\nadvanced to 04.01.2021 for examination of CW 1 to 3 and\ntherefore only six months time is required to dispose of the\nsame.\n\n3. As the case is of the year 2016, I think that the time\nsought for by the learned Judicial First Class Magistrate-I for\ndisposal of the same appears to be quite reasonable.\n\nBie ae)\nPy: ea\ncal\n2021/KER/333\nCrl.M.C.No.5618 of 2020\n3\nHence, this Crl.M.C. is disposed of directing the learned\nJudicial First Class Magistrate-I, Alathur to dispose of\nC.C.No.741/2016 within a period of six months from today.\nSd/-\nSHIRCY V.\nJUDGE\nmpm\n\nTees ha\na\n2021/KER/333\nCr1l.M.C.No.5618 of 2020\nA\nAPPENDIX\nPETITIONERS' EXHIBITS:\nANNEXURE-A TRUE COPY OF THE FINAL REPORT IN CC\nNO.741/2016 ON THE FILE OF THE COURT OF\nTHE JUDICIAL FIRST-CLASS MAGISTRATE-1,\nALATHUR.\n// TRUE COPY //\nP.A. TO JUDGE\n\n"
}