{
    "case_id": "",
    "court": "HIGH COURT OF KERALA AT ERNAKULAM\nPRESENT\nTHE HONOURABLE MR",
    "date": "17 DAY OF JANUARY 2024",
    "judge": "BECHU KURIAN THOMAS\nTHURSDAY",
    "petitioners": [
        "S/ACCUSEDS NOS.1 TO 3:",
        "1 DELBIN TOM",
        "AGED 18 YEARS",
        "$/0. THOMAS PJ, PAYYAPPALLIL HOUSE, M",
        "ANATHANA POST, KANICHAR",
        "KANNUR DISTRICT, PIN - 670 674",
        "2 AJITH SABU",
        "AGED 18 YEARS",
        "S/O. SABU M A, MANJANATTU HOUSE,",
        "VELLARVALLY POST, VELLARVALLY",
        "KANNUR DISTRICT, PIN - 670 673",
        "3 TOBIN VIJU,",
        "AGED 18 YEARS",
        "S/O. VIJUMON P Z, PANNIYAMMAKKAL HOUSE,",
        "MANATHANA POST, PERAVUR",
        "KANNUR DISTRICT, PIN - 670 674"
    ],
    "respondents": [
        "COMPLAINANT :",
        "1 STATE OF KERALA",
        "REPRESENTED BY PUBLIC PROSECUTOR,",
        "HIGH COURT OF KERALA, PIN - 682 031",
        "2 MISHAL K C,AGED 19 YEARS",
        "$/0. SABIR KC, RESIDING AT MISHAL VILLA.",
        "MELMURINGODI POST,",
        "MANATHANA",
        "KANNUR DISTRICT, PIN - 670 673.",
        "ADV.ANNA SONIE"
    ],
    "sections": [
        "482 Cr"
    ],
    "outcome": "ORDER/JUDGMENT CC 56/2023 OF JUVANILE JUSTICE\nBOARD, THALASSERY\nPETITIONERS/ACCUSEDS NOS.1 TO 3:\n1 DELBIN TOM\nAGED 18 YEARS\n$/0. THOMAS PJ, PAYYAPPALLIL HOUSE, M\nANATHANA POST, KANICHAR\nKANNUR DISTRICT, PIN - 670 674\n2 AJITH SABU\nAGED 18 YEARS\nS/O. SABU M A, MANJANATTU HOUSE,\nVELLARVALLY POST, VELLARVALLY\nKANNUR DISTRICT, PIN - 670 673\n3 TOBIN VIJU,\nAGED 18 YEARS\nS/O. VIJUMON P Z, PANNIYAMMAKKAL HOUSE,\nMANATHANA POST, PERAVUR\nKANNUR DISTRICT, PIN - 670 674\nBY ADVS.\nRESHMA E.\nATHIRA V.M.\nRESPONDENT/COMPLAINANT :\n1 STATE OF KERALA\nREPRESENTED BY PUBLIC PROSECUTOR,\nHIGH COURT OF KERALA, PIN - 682 031\n2 MISHAL K C,AGED 19 YEARS\n$/0. SABIR KC, RESIDING AT MISHAL VILLA.\nMELMURINGODI POST,\nMANATHANA\nKANNUR DISTRICT, PIN - 670 673.\nSMT.SREEJA V., PP\nADV.ANNA SONIE\nTHIS CRIMINAL MISC. CASE HAVING COME UP FOR ADMISSION ON\n11.01.2024, THE COURT ON THE SAME DAY PASSED THE FOLLOWING:\n\n2024/KER/1603\nBECHU KURIAN THOMAS, J\nee ee\nORDER\nPetitioners have invoked the jurisdiction under Section 482 Cr.P.C\nto quash all proceedings against them.\n\n2. Petitioners are accused in C.C.No.56/2023 on the files of the\nJuvenile Justice Board, Thalassery arising out of Crime\nNo.62/2023 of Peravur Police Station, Kannur District, registered\nfor the offences punishable under Sections 143, 147, 341, 323\nr/w Section 149 of the Indian Penal Code, 1860. The second\nrespondent is the defacto complainant.\n\n3. According to the prosecution, on 02.02.2023 the accused, in\nfurtherance of their common intention, formed themselves into an\nunlawful assembly, and assaulted the de facto complainant, and\nthereby committed the offences alleged.\n\n4. Heard the learned counsel for the petitioners and the learned\ncounsel for the respondent, apart from the learned Public\nProsecutor.\n\n2024/KER/1603\nCRL.MC_221/2024\n3\n\n5. It is submitted that petitioners were apprehended as juveniles,\nand the matter is pending before the Juvenile Justice Board,\nThalassery. In the meantime, the dispute has been settled\nbetween the parties, and an affidavit to that effect has been\nfiled as Annexure-A3.\n\n6. In Gian Singh v. State of Punjab and Another [(2012) 10 SCC\n303], the Apex Court has held that in appropriate cases, the\nHigh Court can take note of the amicable resolution of disputes\nbetween the victim and the wrongdoer to put an end to the\ncriminal proceedings. This view was reiterated in Narinder\nSingh and Others v. State of Punjab and Another [(2014) 6 SCC\n466] and Yogendra Yadav and Others v. State of Jharkhand\nand Another [(2014) 9 SCC 653].\n\n7. Considering the circumstances stated in the Crl.M.C and the\nsubmission of the learned Public Prosecutor that the affidavit\nproduced have been verified with the de facto complainant and\nthe same has been found to be correct, I am of the view that\nthe proceedings against the petitioners can be quashed",
    "full_text": "ptecteckttc\nae i 4\n2024/KER/1603\nIN THE HIGH COURT OF KERALA AT ERNAKULAM\nPRESENT\nTHE HONOURABLE MR. JUSTICE BECHU KURIAN THOMAS\nTHURSDAY, THE 117 DAY OF JANUARY 2024 / 21ST POUSHA, 1945\nCRL.MC NO. 221 OF 2024\nCRIME NO.0062/2023 OF PERAVOOR POLICE STATION, KANNUR\nAGAINST THE ORDER/JUDGMENT CC 56/2023 OF JUVANILE JUSTICE\nBOARD, THALASSERY\nPETITIONERS/ACCUSEDS NOS.1 TO 3:\n1 DELBIN TOM\nAGED 18 YEARS\n$/0. THOMAS PJ, PAYYAPPALLIL HOUSE, M\nANATHANA POST, KANICHAR\nKANNUR DISTRICT, PIN - 670 674\n2 AJITH SABU\nAGED 18 YEARS\nS/O. SABU M A, MANJANATTU HOUSE,\nVELLARVALLY POST, VELLARVALLY\nKANNUR DISTRICT, PIN - 670 673\n3 TOBIN VIJU,\nAGED 18 YEARS\nS/O. VIJUMON P Z, PANNIYAMMAKKAL HOUSE,\nMANATHANA POST, PERAVUR\nKANNUR DISTRICT, PIN - 670 674\nBY ADVS.\nRESHMA E.\nATHIRA V.M.\nRESPONDENT/COMPLAINANT :\n1 STATE OF KERALA\nREPRESENTED BY PUBLIC PROSECUTOR,\nHIGH COURT OF KERALA, PIN - 682 031\n2 MISHAL K C,AGED 19 YEARS\n$/0. SABIR KC, RESIDING AT MISHAL VILLA.\nMELMURINGODI POST,\nMANATHANA\nKANNUR DISTRICT, PIN - 670 673.\nSMT.SREEJA V., PP\nADV.ANNA SONIE\nTHIS CRIMINAL MISC. CASE HAVING COME UP FOR ADMISSION ON\n11.01.2024, THE COURT ON THE SAME DAY PASSED THE FOLLOWING:\n\n2024/KER/1603\nBECHU KURIAN THOMAS, J\nee ee\nORDER\nPetitioners have invoked the jurisdiction under Section 482 Cr.P.C\nto quash all proceedings against them.\n\n2. Petitioners are accused in C.C.No.56/2023 on the files of the\nJuvenile Justice Board, Thalassery arising out of Crime\nNo.62/2023 of Peravur Police Station, Kannur District, registered\nfor the offences punishable under Sections 143, 147, 341, 323\nr/w Section 149 of the Indian Penal Code, 1860. The second\nrespondent is the defacto complainant.\n\n3. According to the prosecution, on 02.02.2023 the accused, in\nfurtherance of their common intention, formed themselves into an\nunlawful assembly, and assaulted the de facto complainant, and\nthereby committed the offences alleged.\n\n4. Heard the learned counsel for the petitioners and the learned\ncounsel for the respondent, apart from the learned Public\nProsecutor.\n\n2024/KER/1603\nCRL.MC_221/2024\n3\n\n5. It is submitted that petitioners were apprehended as juveniles,\nand the matter is pending before the Juvenile Justice Board,\nThalassery. In the meantime, the dispute has been settled\nbetween the parties, and an affidavit to that effect has been\nfiled as Annexure-A3.\n\n6. In Gian Singh v. State of Punjab and Another [(2012) 10 SCC\n303], the Apex Court has held that in appropriate cases, the\nHigh Court can take note of the amicable resolution of disputes\nbetween the victim and the wrongdoer to put an end to the\ncriminal proceedings. This view was reiterated in Narinder\nSingh and Others v. State of Punjab and Another [(2014) 6 SCC\n466] and Yogendra Yadav and Others v. State of Jharkhand\nand Another [(2014) 9 SCC 653].\n\n7. Considering the circumstances stated in the Crl.M.C and the\nsubmission of the learned Public Prosecutor that the affidavit\nproduced have been verified with the de facto complainant and\nthe same has been found to be correct, I am of the view that\nthe proceedings against the petitioners can be quashed on the\nbasis of the aforesaid settlement. The continuance of the crime\n\naL\n2024/KER/1603\nCRL.MC_ 221/2024\n4\nhas no public interest and the offence alleged are not heinous\nas well. Thus the settlement can be given effect to.\nAccordingly, all proceedings against the petitioners in\nC.C.No.56/2023 on the files of the Juvenile Justice Board,\nThalassery, arising out of Crime No.62/2023 of Peravur Police\nStation, Kannur District, shall stand quashed.\nThis Crl.M.C is allowed as above.\nsd/-\nBECHU KURIAN THOMAS\nJUDGE\nAMV/11/01/2024\n\nie fee\n2024/KER/1603\nCRL.MC_ 221/2024\n5\nAPPENDIX OF CRL.MC 221/2024\n\nPETITIONER ANNEXURES\n\nANNEXURE At TRUE COPY OF THE FIR DATED 03.02.2023\nIN CRIME NO 62 OF 2023 AT PERAVUR\nPOLICE STATION, KANNUR DISTRICT\n\nANNEXURE A2 TRUE COPY OF THE FINAL REPORT DATED\n27.02.2023 IN CRIME NO 62/2023 OF\nPERAVUR POLICE STATION\n\nANNEXURE A3 THE TRUE COPY OF THE AFFIDAVIT DATED\n31.12.2023 SIGNED BY THE RESPONDENT\nNO.2/DEFACTO COMPLAINANT\n\nANNEXURE A4 THE TRUE COPY OF THE CALL LETTER FOR\nDESPATCH: CEE DATED 20.09.2023 RECEIVED\nBY THE PETITIONER NO.1 FROM ARMY\nRECRUITING OFFICE (ARO), CALICUT\n\n"
}