{
    "case_id": "",
    "court": "HIGH COURT OF KERALA AT ERNAKULAM",
    "date": "8TH DAY OF JANUARY 2018",
    "judge": "B.KEMAL PASHA\nMONDAY",
    "petitioners": [
        "(S) /ACCUSED NOS.1 TO 3:",
        "1 RAMYA, AGED 22 YEARS,",
        "D/O. LATE MURALEEDHARAN,",
        "ATHIRA NIVAS, THANNEGATHU,",
        "VIYYUR, THRISSUR.",
        "2 SOUMYA, AGED 26 YEARS,",
        "D/O.LATE MURALEEDHARAN, ATHIRA NIVAS,",
        "THANNEGATHU, VIYYUR, THRISSUR.",
        "3 SARASWATHI AMMA, AGED 56 YEARS,",
        "W/O.LATE MURALEEDHARAN, ATHIRA NIVAS,",
        "THANNEGATHU, VIYYUR, THRISSUR.",
        "BY SRI.P.VIJAYA BHANU (SENIOR ADVOCATE)",
        "ADVS.SRI.ALAN PAPALI",
        "SRI .M. REVIKRISHNAN",
        "SRI .V.C.SARATH"
    ],
    "respondents": [
        "(S) /COMPLAINANT & STATE:",
        "1. SANIL KUMAR,",
        "S/O.LATE SUKUMARAN, KUNDURKUNNU,",
        "SREEKRISHNAPURAM, PALAKKAD-679 103.",
        "2. STATE OF KERALA,",
        "REPRESENTED BY PUBLIC PROSECUTOR,",
        "HIGH COURT OF KERALA, ERNAKULAM - 682 031.",
        "R1 BY ADV. SRI.P.N.MOHANAN",
        "R2 BY ADV. PUBLIC PROSECUTOR SRI.AMJAD ALI"
    ],
    "sections": [],
    "outcome": "",
    "full_text": "Else\nIN THE HIGH COURT OF KERALA AT ERNAKULAM 2018/KER/708\nPRESENT:\nTHE HONOURABLE MR. JUSTICE B.KEMAL PASHA\nMONDAY, THE 8TH DAY OF JANUARY 2018 / 18TH POUSHA, 1939\nCr1.MC.No. 4679 of 2014\nCRIME NO. 421/2014 OF SREEKRISHNAPURAM POLICE STATION, PALAKKAD DISTRICT.\nPETITIONER (S) /ACCUSED NOS.1 TO 3:\n1 RAMYA, AGED 22 YEARS,\nD/O. LATE MURALEEDHARAN,\nATHIRA NIVAS, THANNEGATHU,\nVIYYUR, THRISSUR.\n2 SOUMYA, AGED 26 YEARS,\nD/O.LATE MURALEEDHARAN, ATHIRA NIVAS,\nTHANNEGATHU, VIYYUR, THRISSUR.\n3 SARASWATHI AMMA, AGED 56 YEARS,\nW/O.LATE MURALEEDHARAN, ATHIRA NIVAS,\nTHANNEGATHU, VIYYUR, THRISSUR.\nBY SRI.P.VIJAYA BHANU (SENIOR ADVOCATE)\nADVS.SRI.ALAN PAPALI\nSRI .M. REVIKRISHNAN\nSRI .V.C.SARATH\nRESPONDENT (S) /COMPLAINANT & STATE:\n1. SANIL KUMAR,\nS/O.LATE SUKUMARAN, KUNDURKUNNU,\nSREEKRISHNAPURAM, PALAKKAD-679 103.\n2. STATE OF KERALA,\nREPRESENTED BY PUBLIC PROSECUTOR,\nHIGH COURT OF KERALA, ERNAKULAM - 682 031.\nR1 BY ADV. SRI.P.N.MOHANAN\nR2 BY ADV. PUBLIC PROSECUTOR SRI.AMJAD ALI\nTHIS CRIMINAL MISC. CASE HAVING BEEN FINALLY HEARD\nON 08-01-2018, THE COURT ON THE SAME DAY PASSED THE\nFOLLOWING:\nmbr/\n\nBRE\nCr1.MC.No. 4679 of 2014 () 2018/KER/708\nAPPENDIX\n\nPETITIONERS ' ANNEXURES :\n\nANNEXURE-A. TRUE COPY OF THE PRIVATE COMPLAINT PREFERRED BY THE\n1ST RESPONDENT BEFORE THE COURT OF THE JUDICIAL FIRST CLASS\nMAGISTRATE, OTTAPALAM.\n\nANNEXURE-B. TRUE COPY OF THE FIR IN CRIME NO.421/2014 AGAINST THE\nPETITIONERS.\n\nANNEXURE-C. TRUE COPY OF THE PARTITION DEED IN FARM OF THE MURALEEDHARAN\nRELATING TO THE PROPERTY IN SY.NO.210/1 DATED 20/09/2004.\n\nANNEXURE-D. TRUE COPY OF THE COMPLAINT LODGED BY THE 1ST PETITIONER BEFORE\nTHE CIRCLE INSPECTOR OF POLICE, CHERPULASSERY\nDATED 26/12/2012.\n\nANNEXURE-E. TRUE COPY OF THE SETTLEMENT BETWEEN THE 1ST PETITIONER AND THE\n1ST RESPONDENT/COMPLAINT MADE IN FRONT OF THE CIRCLE INSPECTOR\nOF POLICE, CHERPULASSERY DATED 10/1/2013.\n\nANNEXURE-F . TRUE COPY OF THE OWNERSHIP CERTIFICATE OF THE BUILDING\nNUMBERED 10/498 BELONGS TO THE LATE MURALEEDHARAN IN\nSY.NO.210/1 IN THE 7 CENTS OF PROPERTY OBTAINED FROM THE\nKARIPUZHA GRAMA PANCHAYATH DATED 30/7/2014.\n\nANNEXURE-G. TRUE COPY OF THE COMPLAINT FILED BEFORE THE JUDICIAL FIRST\nCLASS MAGISTRATE COURT NO-I, THRISSUR DATED 1/4/2013.\n\nANNEXURE-H. TRUE COPY OF THE COUNTER AFFIDAVIT FILED BY THE 1ST RESPONDENT\nIN MC NO.4/2014 BEFORE THE JUDICIAL FIRST CLASS MAGISTRATE\nCOURT NO-I, THRISSUR DATED 12/8/2014.\n\nANNEXURE-TI. TRUE COPY OF THE NATIONAL SAVING CERTIFICATE NO.60DD 065788\nDATED 4/7/2011 OF RS.5,000/- AS SECURITY FOR REGISTRATION\nUNDER KVAT ACT 1963 IS RELEASED TO THE 1ST PETITIONER FROM\nCOMMERCIAL TAX OFFICER.\n\nANNEXURE-J. TRUE COPY OF THE NOTICE ISSUED BY THE COMMERCIAL TAX\nDEPARTMENT U/S.67(1) (C) OF THE KVAT ACT, 2002, TO UNIVERSAL\nPAPER PRODUCTS DATED 18/7/2013.\n\nANNEXURE-K. TRUE COPY OF THE DETAILS FROM THE COMMERCIAL TAX DEPARTMENT\nREGARDING THE iST PETITIONER HAS STOPPED THE BUSINESS.\n\nANNEXURE-L. TRUE COPY OF THE REQUEST GIVEN TO THE COMMERCIAL TAX OFFICER,\nOTTAPALAM FOR CLOSURE OF HIS BUSINESS BY THE\n1ST RESPONDENT/COMPLAINT DATED 30/6/2011.\n\nANNEXURE-M. TRUE COPY OF THE TAX RECEIPT ISSUED BY THE KARIMPUZHA GRAMA\nPANCHAYATH DATED 30/3/2005.\n\nRESPONDENTS ' ANNEXURSS : NIL\n\n/TRUE COPY/\nP.S.TO JUDGE\nmbr/\n\n2018/KER/708\nB. KEMAL PASHA, J.\neen\n\"Dated this the 8\" day of January, 2018\nORDER\nLearned Public Prosecutor has reported that the final\nreport has been filed in the maiter, and after investigation,\nthe case has been referred. Recording the said submission,\nthis Crl.M.C. is disposed of.\nSd/- B. KEMAL PASHA, JUDGE.\na [True copy]\nP.S. to Judge.\n\n"
}