{
    "case_id": "",
    "court": "HIGH COURT OF KERALA AT ERNAKULAM\nPRESENT",
    "date": "6TH DAY OF JANUARY 2015",
    "judge": "P.UBAID\nTUESDAY",
    "petitioners": [
        "ACCUSED:",
        "NELLIYALI SHAHUL HAMEED,",
        "S/O.SAIDALIKUTTY NELLIYALI, NELLIYALI HOUSE,",
        "CHERIYAMUNDAM.P.O., MACHINGAPARA, PONMUNDAM,",
        "MALAPPURAM DISTRICT."
    ],
    "respondents": [
        "S/STATE :",
        "1. THE STATE OF KERALA",
        "REPRESENTED BY THE PUBLIC PROSECUTOR",
        "HIGH COURT OF KERALA, ERNAKULAM, KOCHI-31",
        "THROUGH THE SUB INSPECTOR OF POLICE",
        "KARIPOOR POLICE STATION, MALAPPURAM DISTRICT.",
        "2. THE PASSPORT OFFICER",
        "PASSPORT OFFICE, KOZHIKKODE, PIN-673 001.",
        "R2 BY SRI.P.PARAMESWARAN NAIR,ASG OF INDIA",
        "R1 BY PUBLIC PROSECUTOR SMT.SAREENA GEORGE P"
    ],
    "sections": [],
    "outcome": "",
    "full_text": "a\nBISA\n2015/KER/221\nIN THE HIGH COURT OF KERALA AT ERNAKULAM\nPRESENT:\nTHE HONOURABLE MR. JUSTICE P.UBAID\nTUESDAY, THE 6TH DAY OF JANUARY 2015/16TH POUSHA, 19361\nCr1.MC.No. 224 of 2014\nAGAINST THE ORDER IN CRMP 5771/2013 OF THE CHIEF JUDICIAL\nMAGISTRATE COURT, MANJERI DATED 20-02-2013\nCRIME NO. 804/2013 OF KARIPUR POLICE STATION , MALAPPURAM\nPETITIONER/ACCUSED:\nNELLIYALI SHAHUL HAMEED,\nS/O.SAIDALIKUTTY NELLIYALI, NELLIYALI HOUSE,\nCHERIYAMUNDAM.P.O., MACHINGAPARA, PONMUNDAM,\nMALAPPURAM DISTRICT.\nBY ADVS.SRI.BABU S. NAIR\nSRI.K.RAKESH\nRESPONDENTS/STATE :\n1. THE STATE OF KERALA\nREPRESENTED BY THE PUBLIC PROSECUTOR\nHIGH COURT OF KERALA, ERNAKULAM, KOCHI-31\nTHROUGH THE SUB INSPECTOR OF POLICE\nKARIPOOR POLICE STATION, MALAPPURAM DISTRICT.\n2. THE PASSPORT OFFICER\nPASSPORT OFFICE, KOZHIKKODE, PIN-673 001.\nR2 BY SRI.P.PARAMESWARAN NAIR,ASG OF INDIA\nR1 BY PUBLIC PROSECUTOR SMT.SAREENA GEORGE P\nTHIS CRIMINAL MISC. CASE HAVING BEEN FINALLY HEARD ON\n06-01-2015, THE COURT ON THE SAME DAY PASSED THE FOLLOWING:\nab\n\nPisgerl\npea\n2015/KER/221\nP.UBAID, J.\nCrl.M.C No.224 of 2014\nDated this the 6\" day of January, 2015\nORDER\nThe learned counsel for the petitioner submits\nthat the matter is not pressed. This submission is recorded, and\nthe Criminal Miscellaneous Case is dismissed as not pressed.\nP.UBAID\nJUDGE\nab\n\n"
}