{
    "case_id": "",
    "court": "HIGH COURT OF KERALA AT ERNAKULAM\nPRESENT",
    "date": "4TH DAY OF AUGUST 2016",
    "judge": "B.KEMAL PASHA\nTHURSDAY",
    "petitioners": [
        "ACCUSED :",
        "M.RAJAVELU, AGED 58 YEARS,",
        "S/O.MUTHIAH, RR/O. 393,",
        "ARUNACHALAM NADAR COMPOUND ,",
        "VAITHYANATHAPURAM ,",
        "NAGARCOIL, TAMIL NADU-629 002."
    ],
    "respondents": [
        "/ COMPLAINANT :",
        "STATE OF KERALA,",
        "REPRESENTED BY CENTRAL BUREAU",
        "OF INVESTIGATION (C.B.I.),",
        "KOCHI-682 011."
    ],
    "sections": [
        "309 CR"
    ],
    "outcome": "",
    "full_text": "Be ae\nys ee\npoet Fe\niRee\n2016/KER/34131\nIN THE HIGH COURT OF KERALA AT ERNAKULAM\nPRESENT:\nTHE HONOURABLE MR. JUSTICE B.KEMAL PASHA\nTHURSDAY, THE 4TH DAY OF AUGUST 2016/13TH SRAVANA, 1938\nCr1.MC.No. 4893 of 2016 ()\nCRL.MP.NO.700/2016 IN CC.NO.4/14 OF SPECIAL COURT (SPE/CBI)-I,\nERNAKULAM.\nPETITIONER/ACCUSED :\nM.RAJAVELU, AGED 58 YEARS,\nS/O.MUTHIAH, RR/O. 393,\nARUNACHALAM NADAR COMPOUND ,\nVAITHYANATHAPURAM ,\nNAGARCOIL, TAMIL NADU-629 002.\nBY ADVS.SRI.M.K.CHANDRA MOHANDAS\nSRI.SHAKTHI PRAKASH\nRESPONDENT / COMPLAINANT :\nSTATE OF KERALA,\nREPRESENTED BY CENTRAL BUREAU\nOF INVESTIGATION (C.B.I.),\nKOCHI-682 011.\nBY SRI.P.CHANDRASEKHARA PILLAT, SC\nTHIS CRIMINAL MISC. CASE HAVING COME UP FOR ADMISSION\nON 04-08-2016, THE COURT ON THE SAME DAY PASSED THE\nFOLLOWING:\nmbr/\n\nBore asia]\nys ee\ni Â¥,\nre ; ia\nBURA\n2016/KER/34131\nCr1.MC.No. 4893 of 2016 ()\nAPPENDIX\nPETITIONER (S) ' ANNEXURES:\nANNEXURE A: COPY OF THE PETITION FILED BY THE COUNSEL FOR\nTHE PETITIONER UNDER SECTION 309 CR.P.C. PRAYING\nFOR POSTPONING/ADJOURNING THE CASE ALONG WITH\nTHE COPY OF THE MEDICAL RECORDS.\nANNEXURE Bs: COPY OF THE ORDER DATED 29.7.2016 IN\nCRL.MP NO.700/16 IN cc 2/14 PASSED BY THE COURT\nBELOW DISMISSING ANNEXURE-A PETITION FILED ON\nBEHALF OF THE PETITIONER.\nRESPONDENT (S)' ANNEXURES: NIL\n//TRUE COPY//\nP.S. TO JUDGE\nmbr/\n\n2016/KER/34131\nB. KEMAL PASHA, J.\nee\nORDER\n\nHeard the learned counsel for the petitioner and the\nlearned Standing Counsel for the CBI.\n\n2. The learned counsel for the petitioner has pointed\nout that the petitioner has undergone a surgery by way of\nAngioplasty on 13.07.2016 and he is on rest at Madurai. It\nhas been pointed out that it will be tedious for him to travel\nall the way from Madurai to Kochi to attend the case, as he\nhas to take rest for two more weeks.\n\n3. At the same time, the learned Standing Counsel\nfor the CBI has pointed out that three cases were scheduled\nfor trial before the court below and the other two cases had\nto be adjourned since the accused absconded. In case the\n\nPEE\n2016/KER/34131\nCRL.M.C.No. 4893 of 2016 uoe\npresent trial is adjourned, there would not be any work in the\ncourt below during that period.\n\n4. Considering the circumstances pointed out by the\nlearned counsel for the petitioner and the anguish\nexpressed by him, this Court is of the view that the court\nbelow can be directed to grant exemption to the petitioner\nfrom personal appearance as far as practicable. As far as\npracticable, the court below shall grant exemption to the\npetitioner, liberally. His presence shall be insisted only on\nthe dates on which his presence is actually required for\nidentification in the case before the court below. The court\nbelow shall grant such accommodation to the petitioner as\nfar as practicable.\n\nIn the result, this Crl.M.C. is disposed of with the above\ndirection.\n\nSd/- B. KEMAL PASHA, JUDGE.\nw // true copy //\nPS. to Judge.\n\n"
}