{
    "case_id": "",
    "court": "HIGH COURT OF KERALA AT ERNAKULAM",
    "date": "8TH DAY OF JANUARY 2019",
    "judge": "RAJA VIJAYARAGHAVAN V\nTUESDAY",
    "petitioners": [
        "S:",
        "PRADEEP KUMAR, AGED 44 YEARS,",
        "S/O SIVADASAN, KALAVAPPADAM, VADAKKANCHERY, PALAKKAD",
        "DISTRICT."
    ],
    "respondents": [
        "S:",
        "1 STATE OF KERALA",
        "REPRESENTEDBY THE PUBLIC PROSECUTOR,",
        "HIGH COURT OF KERALA, PIN-682031",
        "2 VICTIM",
        "x"
    ],
    "sections": [],
    "outcome": "",
    "full_text": "Bl cya t\nwei ae i\nOa\nIN THE HIGH COURT OF KERALA AT ERNAKULAM 201/KER/IO4\nPRESENT\nTHE HONOURABLE MR. JUSTICE RAJA VIJAYARAGHAVAN V\nTUESDAY, THE O8TH DAY OF JANUARY 2019 / 18TH POUSHA, 1940\nCr1.MC.No. 7536 of 2018\nCRIME NO. 79/2018 OF Meppadi Police Station, Wayanad District\nPETITIONER/S:\nPRADEEP KUMAR, AGED 44 YEARS,\nS/O SIVADASAN, KALAVAPPADAM, VADAKKANCHERY, PALAKKAD\nDISTRICT.\nBY ADVS.\nSRI .P.K.VARGHESE\nSMT .M.B.SHYNI\nRESPONDENT/S:\n1 STATE OF KERALA\nREPRESENTEDBY THE PUBLIC PROSECUTOR,\nHIGH COURT OF KERALA, PIN-682031\n2 VICTIM\nx\nBY ADV. PRASANNA N V\nOTHER PRESENT:\nSRI. AMJAD ALI SR. PP.\nTHIS CRIMINAL MISC. CASE HAVING COME UP FOR ADMISSION ON\n08.01.2019, THE COURT ON THE SAME DAY PASSED THE FOLLOWING:\n\nDeere\n= areey\nBz ere\nCrl.MC:7536/18 2 2019/KER/904\nORDER\nWhen the matter was taken up, Sri. PK.Varghese, the learned\ncounsel appearing for the petitioner, requests that the matter be\ndismissed as withdrawn without prejudice to his right to challenge\nthe final report. He also prays that Annexure-III affidavit sworn to by\nthe de facto complainant be returned. Reserving such right, this\napplication is dismissed as withdrawn.\nSd/-\nRAJA VIJAYARAGHAVAN V.,\nJUDGE\nps\n/ftrue copy// PA. TO JUDGE\n\nBl cya t\n% > ee i\nBl: ane\nCrl.MC:7536/18 3 201/KER/D04\nAPPENDIX\nPETITIONER'S/S EXHIBITS:\nANNEXURE I CERTIFIED COPYOF THE FIRST INFORMATION\nREPORT IN CRIME NO.79/2018 OF MEPPADT\nPOLICE STATION.\nANNEXURE IT A TRUE COPY OF THE COMPLAINT GIVEN BY THE\nDEFACTO COMPLAINANT TO THE POLICE OFFICIAL\nDATED 14.3.2018.\nANNEXURE III A TRUE COPY OF THE AFFIDAVIT SWORN BY THE\n2ND RESPONDENT/DEFACTO COMPLAINANT DATED\n10.7.2018.\n\n"
}