{
    "case_id": "",
    "court": "HIGH COURT OF KERALA AT ERNAKULAM\nPRESENT",
    "date": "8TH DAY OF DECEMBER 2017",
    "judge": "B.KEMAL PASHA\nFRIDAY",
    "petitioners": [
        "ACCUSED:",
        "SURESH MATHEW, NEDUMCHIRAYIL HOUSE, AGED 56 YEARS,",
        "$/O.MATHEW, S.H.MOUNT BHAGOM,",
        "NATTASSERY KARA, PERUMBAIKADU VILLAGE,",
        "KOTTAYAM DISTRICT."
    ],
    "respondents": [
        "DE FACTO COMPLAINANT AND STATE:",
        "1. BABY MATHEW, AGED 57 YEARS,",
        "S/O.MATHEW, VETTOOR VEEDU, ETTUMANOOR - P.O.",
        "KOTTAYAM DISTRICT-686631.",
        "2. THE STATE OF KERALA (S.I.OF POLICE ETTUMANOOR POLICE",
        "STATION) REPRESENTED BY THE PUBLIC PROSECUTOR,",
        "HIGH COURT OF KERALA, ERNAKULAM-682031.",
        "R2 BY PUBLIC PROSECUTOR SRI.ALEX M.THOMBRA"
    ],
    "sections": [],
    "outcome": "",
    "full_text": "Blige as\nfe ora\nElz a ielt 4\n2017/KER/49783\nIN THE HIGH COURT OF KERALA AT ERNAKULAM\nPRESENT:\nTHE HONOURABLE MR. JUSTICE B.KEMAL PASHA\nFRIDAY, THE 8TH DAY OF DECEMBER 2017/17TH AGRAHAYANA, 1939\nCr1.MC.No. 8537 of 2017 ()\n(C.M.P.No.4449/2017 IN C.C.NO.245/2011 OF JFCM COURT, ETTUMANOOR)\nPETITIONER/ACCUSED:\nSURESH MATHEW, NEDUMCHIRAYIL HOUSE, AGED 56 YEARS,\n$/O.MATHEW, S.H.MOUNT BHAGOM,\nNATTASSERY KARA, PERUMBAIKADU VILLAGE,\nKOTTAYAM DISTRICT.\nBY ADV. SRI.P.KURUVILLA JACOB\nRESPONDENT/DE FACTO COMPLAINANT AND STATE:\n1. BABY MATHEW, AGED 57 YEARS,\nS/O.MATHEW, VETTOOR VEEDU, ETTUMANOOR - P.O.\nKOTTAYAM DISTRICT-686631.\n2. THE STATE OF KERALA (S.I.OF POLICE ETTUMANOOR POLICE\nSTATION) REPRESENTED BY THE PUBLIC PROSECUTOR,\nHIGH COURT OF KERALA, ERNAKULAM-682031.\nR2 BY PUBLIC PROSECUTOR SRI.ALEX M.THOMBRA\nTHIS CRIMINAL MISC. CASE HAVING COME UP FOR ADMISSION ON\n08-12-2017, THE COURT ON THE SAME DAY PASSED THE FOLLOWING:\n\nPlaines el\nfe ete\nElz sae\n2017/KER/49783\nCr1l.MC.No. 8537 of 2017 ()\nAPPENDIX\nPETITIONER'S EXHIBITS\nANNEXURE AT: TRUE CERTIFIED COPY OF THE ORDER DATED 23.10.2017\nIN C.M.P.NO.4449/2017 IN C.C.NO.245/2011 OF THE JUDICIAL FIRST CLASS\nMAGISTRATE COURT, ETTUMANOOR.\nANNEXURE A2: TRUE COPY OF THE ORDER DATED 8.8.17 IN\nCRL.M.C.1005/2017 OF THIS HON'BLE COURT.\nANNEXURE A3: TRUE COPY OF FIRST RESPONDENT'S COMPLAINT DATED\n22.10.10 FILED AGAINST PETITIONER, BEFORE THE JUDICIAL FIRST CLASS\nMAGISTRATE COURT, ETTUMANOOR.\nANNEXURE AA: TRUE COPY OF ORDER DATED 1.11.16 IN\nCRL.M.C.NO.6247/2016 OF THE HON'BLE HIGH COURT.\nANNEXURE A5: TRUE COMPUTER PRINT OF JUDGMENT DATED 11.2.15 IN\nW.P.(c) NO.25/2015 OF THE HON'BLE HIGH COURT WHICH IS REPORTED AS\n2015 KHC-166.\nANNEXURE AG: TRUE COPY OF THE ORDR SHEET FROM 2.6.2016 TO\n17.7.2017 RELATING TO C.C.NO.245/2011 OF THE JUDICIAL FIRST CLASS\nMAGISTRATE COURT, ETTUMANOOR.\nRESPONDENT'S EXHIBITS: NIL\nTRUE COPY\nPA TO JUDGE\nScl.\n\nBisa\nBlea\n2017/KER/49783\nB. KEMAL PASHA, J.\nDated this the 8\" day of December, 2017\nORDER\n\nOn hearing the learned counsel for the petitioner and the\nlearned Public Prosecutor and also on perusing Annexure Al\norder passed by the court below as well as Annexure A2 order\npassed by this Court, it is hereby ordered that the petitioner\nneed not surrender his passport before the court below. In\ncase, CW2 is not available on the next posting date for\nexamination, the court below shall dispense with his\nexamination and shall proceed with the matter further. The\ncourt below shall expedite the trial and dispose it of at the\nearliest.\n\nWith this direction, this Crl.M.C. is disposed of.\n\nSd/-\nB.KEMAL PASHA\nJUDGE\n\nScl/08.12.2017\n\n"
}