{
    "case_id": "",
    "court": "HIGH COURT OF KERALA AT ERNAKULAM",
    "date": "07TH DAY OF JANUARY 2020",
    "judge": "ASHOK MENON\nTUESDAY",
    "petitioners": [
        "2ND ACCUSED:",
        "FRANKLIN,",
        "AGED 42 YEARS, S/O. CHARLS,",
        "T.C. 69/1960, JOSE HOUSE, POONTHURA,",
        "MUTTATHARA VILLAGE, THIRUVANANTHAPURAM."
    ],
    "respondents": [
        "S/STATE, COMPLAINANT & VICTIMS:",
        "1 STATE OF KERALA",
        "REPRESENTED BY THE PUBLIC PROSECUTOR,",
        "HIGH COURT OF KERALA, ERNAKULAM - 682 031.",
        "2 STATION HOUSE OFFICER,",
        "POONTHURA POLICE STATION,",
        "THIRUVANANTHAPURAM DISTRICT - 695 026.",
        "3 MYTHEEN ,",
        "AGED 42 YEARS, S/O. AHAMMED KANNU,",
        "PUTHUVALPURAYIDAM, T.C. 46/477,",
        "NEAR NEW ARABIC COLLEGE, BEEMA PALLI WARD, MUTTATHARA",
        "VILLAGE, THIRUVANANTHAPURAM-695 026.",
        "4 SAKEER,",
        "AGED 41 YEARS, S/O. AHAMMED KANNU,",
        "PUTHUVALPURAYIDAM, T.C. 46/477,",
        "NEAR NEW ARABIC COLLEGE, BEEMA PALLI WARD, MUTTATHARA",
        "VILLAGE, THIRUVANANTHAPURAM-695 026.",
        "R1-R2 BY SRI. C.S.HRITHWIK, SR.PP",
        "R3-R4 BY ADV. R.ARUN",
        "OTHER PRESENT:"
    ],
    "sections": [
        "323",
        "324 read with Section 34 of I"
    ],
    "outcome": "ORDER/JUDGMENT IN CC 436/2005 OF JUDICIAL MAGISTRATE\nOF FIRST CLASS -II, TRIVANDRUM\nCRIME NO.145/2005 OF Poonthura Police Station, Thiruvananthapuram\nPETITIONER/2ND ACCUSED:\nFRANKLIN,\nAGED 42 YEARS, S/O. CHARLS,\nT.C. 69/1960, JOSE HOUSE, POONTHURA,\nMUTTATHARA VILLAGE, THIRUVANANTHAPURAM.\nBY ADV. SRI.LATHEESH SEBASTIAN\nRESPONDENTS/STATE, COMPLAINANT & VICTIMS:\n1 STATE OF KERALA\nREPRESENTED BY THE PUBLIC PROSECUTOR,\nHIGH COURT OF KERALA, ERNAKULAM - 682 031.\n2 STATION HOUSE OFFICER,\nPOONTHURA POLICE STATION,\nTHIRUVANANTHAPURAM DISTRICT - 695 026.\n3 MYTHEEN ,\nAGED 42 YEARS, S/O. AHAMMED KANNU,\nPUTHUVALPURAYIDAM, T.C. 46/477,\nNEAR NEW ARABIC COLLEGE, BEEMA PALLI WARD, MUTTATHARA\nVILLAGE, THIRUVANANTHAPURAM-695 026.\n4 SAKEER,\nAGED 41 YEARS, S/O. AHAMMED KANNU,\nPUTHUVALPURAYIDAM, T.C. 46/477,\nNEAR NEW ARABIC COLLEGE, BEEMA PALLI WARD, MUTTATHARA\nVILLAGE, THIRUVANANTHAPURAM-695 026.\nR1-R2 BY SRI. C.S.HRITHWIK, SR.PP\nR3-R4 BY ADV. R.ARUN\nOTHER PRESENT:\nTHIS CRIMINAL MISC. CASE HAVING COME UP FOR ADMISSION ON\n07.01.2020, THE COURT ON THE SAME DAY PASSED THE FOLLOWING:\n\nBie el\nCrl1.M.C.No.5827 of 2019 > 2020/KER/428\nORDER\nDated this the 7th day of January 2020\n\nThe petitioner is the 2 accused in Crime\nNo.145/2005 of Poonthura Police Station, for having\nallegedly committed the offences punishable under\nSections 323 and 324 read with Section 34 of I.P.C.\nThe defacto complainant-injured are respondents 3 and\n4 herein, who have appeared through a Counsel and\nhave filed affidavits at Annexures A2 and A3 stating\nthat the matter has been amicably settled and they\nhave no existing grievance, whatsoever, against the\npetitioner. It is submitted by the petitioner that\nthe co-accused were already acquitted in the parent\ncase, ie., C.C.No.436/2005, but the judgment has not\nbeen produced. The case against the petitioner is\nnow pending as L.P.No.31/2010 on the file of the\nJudicial First Class Magistrate Court-II,\nThiruvananthapuram. In view of the fact that the\ndispute has been compounded and settled between the\npetitioner and the injured, nothing survives. A\n\nBie el\nCrl1.M.C.No.5827 of 2019 3 2020/KER/428\nreport has been filed by the investigating officer\nthrough the Senior Public Prosecutor to that effect.\nThe petitioner does not have any criminal antecedents\nand no public interest is involved.\n\nIn the result, the Crl.M.C. is allowed and the\nentire proceedings in Crime No.145/2005 of Poonthura\nPolice Station, now pending against the petitioner as\nL.P.No.31/2010 on the file of the Judicial First\nClass Magistrate Court-II, Thiruvananthapuram, stands\nquashed",
    "full_text": "Bas\nIN THE HIGH COURT OF KERALA AT ERNAKULAM 2020/KER/428\nPRESENT\nTHE HONOURABLE MR. JUSTICE ASHOK MENON\nTUESDAY, THE 07TH DAY OF JANUARY 2020 / 17TH POUSHA, 1941\nCri .MC.No.5827 OF 2019 (G)\nAGAINST THE ORDER/JUDGMENT IN CC 436/2005 OF JUDICIAL MAGISTRATE\nOF FIRST CLASS -II, TRIVANDRUM\nCRIME NO.145/2005 OF Poonthura Police Station, Thiruvananthapuram\nPETITIONER/2ND ACCUSED:\nFRANKLIN,\nAGED 42 YEARS, S/O. CHARLS,\nT.C. 69/1960, JOSE HOUSE, POONTHURA,\nMUTTATHARA VILLAGE, THIRUVANANTHAPURAM.\nBY ADV. SRI.LATHEESH SEBASTIAN\nRESPONDENTS/STATE, COMPLAINANT & VICTIMS:\n1 STATE OF KERALA\nREPRESENTED BY THE PUBLIC PROSECUTOR,\nHIGH COURT OF KERALA, ERNAKULAM - 682 031.\n2 STATION HOUSE OFFICER,\nPOONTHURA POLICE STATION,\nTHIRUVANANTHAPURAM DISTRICT - 695 026.\n3 MYTHEEN ,\nAGED 42 YEARS, S/O. AHAMMED KANNU,\nPUTHUVALPURAYIDAM, T.C. 46/477,\nNEAR NEW ARABIC COLLEGE, BEEMA PALLI WARD, MUTTATHARA\nVILLAGE, THIRUVANANTHAPURAM-695 026.\n4 SAKEER,\nAGED 41 YEARS, S/O. AHAMMED KANNU,\nPUTHUVALPURAYIDAM, T.C. 46/477,\nNEAR NEW ARABIC COLLEGE, BEEMA PALLI WARD, MUTTATHARA\nVILLAGE, THIRUVANANTHAPURAM-695 026.\nR1-R2 BY SRI. C.S.HRITHWIK, SR.PP\nR3-R4 BY ADV. R.ARUN\nOTHER PRESENT:\nTHIS CRIMINAL MISC. CASE HAVING COME UP FOR ADMISSION ON\n07.01.2020, THE COURT ON THE SAME DAY PASSED THE FOLLOWING:\n\nBie el\nCrl1.M.C.No.5827 of 2019 > 2020/KER/428\nORDER\nDated this the 7th day of January 2020\n\nThe petitioner is the 2 accused in Crime\nNo.145/2005 of Poonthura Police Station, for having\nallegedly committed the offences punishable under\nSections 323 and 324 read with Section 34 of I.P.C.\nThe defacto complainant-injured are respondents 3 and\n4 herein, who have appeared through a Counsel and\nhave filed affidavits at Annexures A2 and A3 stating\nthat the matter has been amicably settled and they\nhave no existing grievance, whatsoever, against the\npetitioner. It is submitted by the petitioner that\nthe co-accused were already acquitted in the parent\ncase, ie., C.C.No.436/2005, but the judgment has not\nbeen produced. The case against the petitioner is\nnow pending as L.P.No.31/2010 on the file of the\nJudicial First Class Magistrate Court-II,\nThiruvananthapuram. In view of the fact that the\ndispute has been compounded and settled between the\npetitioner and the injured, nothing survives. A\n\nBie el\nCrl1.M.C.No.5827 of 2019 3 2020/KER/428\nreport has been filed by the investigating officer\nthrough the Senior Public Prosecutor to that effect.\nThe petitioner does not have any criminal antecedents\nand no public interest is involved.\n\nIn the result, the Crl.M.C. is allowed and the\nentire proceedings in Crime No.145/2005 of Poonthura\nPolice Station, now pending against the petitioner as\nL.P.No.31/2010 on the file of the Judicial First\nClass Magistrate Court-II, Thiruvananthapuram, stands\nquashed under Section 482 of Cr.P.C. and the\npetitioner is discharged.\n\nSd/-\ndkr ASHOK MENON\nJUDGE\n\nio\nCri.M.C.No.5827 of 2019 2020/KER/428\n4\nAPPENDIX\nPETITIONER'S / S EXHIBITS:\nANNEXURE Al COPY OF THE FINAL REPORT IN CRIME NO.\n145/2005 OF POONTHURA POLICHK STATION.\nANNEXURE A2 COPY OF THE AFFIDAVIT OF THE 3RD\nRESPONDENT.\nANNEXURE A3 COPY OF THE AFFIDAVIT OF THE ATH\nRESPONDENT.\n\n"
}