{
    "case_id": "Crl.MC.No. 7703 of 2018",
    "court": "HIGH COURT OF KERALA AT ERNAKULAM",
    "date": "7TH DAY OF JANUARY 2019",
    "judge": "SUNIL THOMAS\nMONDAY",
    "petitioners": [
        "ACCUSED 1 TO 7:",
        "1 FR. BINU THOMAS THADATHIL,",
        "AGED 37 YEARS",
        "s/o THOMAS, CHOORAPPADAVU, KANNUR DISTRICT",
        "2 JIMMI",
        "AGED 38 YEARS",
        "S/O. THOMAS, VELLIKKUZHIYIL, PULIMGOM, KOTTATHALACHI,",
        "KANNUR DISTRICT.",
        "3 JAMES ,",
        "AGED 41 YEARS",
        "S/O. SCARIA, MYLATOOR, PULIMGOM, KOTTATHALACHI,",
        "KANNUR DISTRICT.",
        "4 PRAKASAN,",
        "AGED 52 YEARS",
        "S/O. JOSEPH, PANUNANICKAL HOUSE, PULIMGOM,",
        "VAZHAKKUNDOM, KANNUR DISTRICT.",
        "5 THOMAS ,",
        "AGED 38 YEARS",
        "S/O. AUGUSTIN, VENGACHUVATTIL HOUSE, PULIMGOM,",
        "KOTTATHALACHIT, KANNUR DISTRICT.",
        "6 RAJESH,",
        "AGED 45 YEARS",
        "s/o. KURIAKOSE, KUTTIYANICKAL HOUSE, PULIMGOM,",
        "KOTTATHALACHI, KANNUR DISTRICT.",
        "7 JAMES,",
        "AGED 56 YEARS",
        "S/O. JACOB, KARIPAL HOUSE, PULIMGOM, KOTTATHALACHI,",
        "KANNUR DISTRICT."
    ],
    "respondents": [
        "DEFACTO COMPLAINANT & STATE:",
        "1 BAIJUMON V.S.,",
        "AGED 38 YEARS",
        "S/O SASIDHARAN NAIR, VADAKKEDATHU HOUSE,",
        "KOTTATHALACHI, EDAVARAMBA P O, PULIGOM VILLAGE,",
        "KANNUR DISTRICT, PIN-670511",
        "2 RAVEENDRAN K.",
        "AGED 42 YEARS",
        "S/O. KUNJIKKANNAN, PALLIKKUNNEL, PULIMGOM AMSOM ,",
        "KOTTATHALACHI, KANNUR DISTRICT, PIN - 670511.",
        "3 SHEEBA,",
        "AGED 34 YEARS",
        "W/O. RAVEENDRAN, PALLIKKUNNEL, PULIMGOM AMSOM,",
        "KOTTATHALACHI, KANNUR DISTRICT, PIN - 670511.",
        "4 STATE OF KERALA",
        "REPRESENTED BY THE PUBLIC PROSECUTOR, HIGH COURT OF",
        "KERALA, ERNAKULAM, PIN 682 031."
    ],
    "sections": [
        "143",
        "147",
        "148",
        "341",
        "323",
        "324",
        "506"
    ],
    "outcome": "ORDER/JUDGMENT IN CC 475/2013 of J.M.F.C.,PAYYANNUR\nCRIME NO. 58/2012 OF Peringome Police Station , Kannur\nPETITIONER/ACCUSED 1 TO 7:\n1 FR. BINU THOMAS THADATHIL,\nAGED 37 YEARS\ns/o THOMAS, CHOORAPPADAVU, KANNUR DISTRICT\n2 JIMMI\nAGED 38 YEARS\nS/O. THOMAS, VELLIKKUZHIYIL, PULIMGOM, KOTTATHALACHI,\nKANNUR DISTRICT.\n3 JAMES ,\nAGED 41 YEARS\nS/O. SCARIA, MYLATOOR, PULIMGOM, KOTTATHALACHI,\nKANNUR DISTRICT.\n4 PRAKASAN,\nAGED 52 YEARS\nS/O. JOSEPH, PANUNANICKAL HOUSE, PULIMGOM,\nVAZHAKKUNDOM, KANNUR DISTRICT.\n5 THOMAS ,\nAGED 38 YEARS\nS/O. AUGUSTIN, VENGACHUVATTIL HOUSE, PULIMGOM,\nKOTTATHALACHIT, KANNUR DISTRICT.\n6 RAJESH,\nAGED 45 YEARS\ns/o. KURIAKOSE, KUTTIYANICKAL HOUSE, PULIMGOM,\nKOTTATHALACHI, KANNUR DISTRICT.\n7 JAMES,\nAGED 56 YEARS\nS/O. JACOB, KARIPAL HOUSE, PULIMGOM, KOTTATHALACHI,\nKANNUR DISTRICT.\nBY ADV. SRI.M.T.SURESHKUMAR\n\nEI ee\nOE: an fet\nCri.M.C. No.7608 & 7703/2018. 2 201 /KERIGIS\nRESPONDENT/DEFACTO COMPLAINANT & STATE:\n1 BAIJUMON V.S.,\nAGED 38 YEARS\nS/O SASIDHARAN NAIR, VADAKKEDATHU HOUSE,\nKOTTATHALACHI, EDAVARAMBA P O, PULIGOM VILLAGE,\nKANNUR DISTRICT, PIN-670511\n2 RAVEENDRAN K.\nAGED 42 YEARS\nS/O. KUNJIKKANNAN, PALLIKKUNNEL, PULIMGOM AMSOM ,\nKOTTATHALACHI, KANNUR DISTRICT, PIN - 670511.\n3 SHEEBA,\nAGED 34 YEARS\nW/O. RAVEENDRAN, PALLIKKUNNEL, PULIMGOM AMSOM,\nKOTTATHALACHI, KANNUR DISTRICT, PIN - 670511.\n4 STATE OF KERALA\nREPRESENTED BY THE PUBLIC PROSECUTOR, HIGH COURT OF\nKERALA, ERNAKULAM, PIN 682 031.\nBY ADV. SRI.GEORGE MECHERIL\nOTHER PRESENT:\nPP AJITH MURALI\nTHIS CRIMINAL MISC. CASE HAVING BEEN FINALLY HEARD ON\n07.01.2019, ALONG WITH Cr1.MC.7703/2018, THE COURT ON THE SAME\nDAY PASSED THE FOLLOWING:\n\nEI ee\nOE: see\nCri.M.C. No.7608 & 7703/2018. 3 201 /KERIGIS\nIN THE HIGH COURT OF KERALA AT ERNAKULAM\nPRESENT\nTHE HONOURABLE MR. JUSTICE SUNIL THOMAS\nMONDAY ,THE O7TH DAY OF JANUARY 2019 / 17TH POUSHA, 1940\nCrl.MC.No. 7703 of 2018\nAGAINST THE ORDER/JUDGMENT IN CC 229/2013 of J.M.F.C.,PAYYANNUR\nCRIME NO. 57/2012 OF Peringome Police Station , Kannur\nPETITIONERS/ACCUSED NOS. 1 AND 2:\n1 BALJUMON,\nAGED 38 YEARS\n$/O.SASIDHARAN NAIR, VADAKKEDATHU HOUSE, PULINGOM\nAMSOM, KANNUR DISTRICT.\n2 RAVEENDRAN\nAGED 42 YEARS\nS/O KUNJIKANNAN, PULIKKUNNEL, PULINGOM,\nKOTTATHALACHI MALA, KANNUR DISTRICT.\nBY ADV. SRI.GEORGE MECHERIL\nRESPONDENTS/ DEFACTO COMPLAINANT AND STATE:\n1 FR.BINU THOMAS,\nAGED 37 YEARS\nS/O. THOMAS, THADATHILPUTHENVEEDU, VILAKKENNUR,\nNDUVIL AMSOM, CHOORAPPADAVU, (VIKAR OF HOLY CROSS\nCHURCH), KANNUR DISTRICT, PIN - 670 511.\n2 RARICHAN @ JOMYSYRIAK,\nAGED 38 YEARS\nS/O.KURIAN, MYLADOOR HOUSE, PULINGOM,\nCHOORAPPADAVU, KANNUR DISTRICT, PIN-670511.\n3 THOMAS V.A.\nAGED 43 YEARS\nS/O.AUGUSTIN, VENGACHUVATTIL HOUSE, PULINGOM,\n\nEI ee\nOE: an fet\nCri.M.C. No.7608 & 7703/2018. 4 201 /KERIGIS\nKOTTATHALACHI, EDAVARAMBU P.O., KANNUR DISTRICT,\nPIN-670 511.\n4 THOMAS P.O.,\nAGED 48 YEARS\nS/O.MATHEW, PARATHOTTATHIL HOSUE, THIRUMENI AMSOM,\nTHEKKENMAVU, KOTTACHALACHI, KANNUR DISTRICT, PIN-\n670 511.\n5 M.S.JAMES,\nAGED 41 YEARS\nS/O.SCARIA, MYLADOOR HOUSE, PULINGOM,\nKOTTATHALACHI, KANNUR DISTRICT, PIN-670 511.\n6 SINS AUGUSTIN\nAGED 27 YEARS\n$/O.AUGUSTIN, PULINGOM, CHOORAPPADAVU, KANNUR\nDISTRICT, PIN-670 511.\n7 JIMMI JOSEPH,\nAGED 38 YEARS\n$/O.JOSEPH, VELLIMOODIYIL HOUSE, PULINGOM AMSOM,\nKOTTATHALACHI, KANNUR DISTRICT, PIN-670 511.\n8 STATE OF KERALA\nREPRESENTED BY THE PUBLIC PROSECUTOR, HIGH COURT OF\nKERALA, ERNAKULAM, PIN-682 031.\nBY ADVS.\nSRI .M.T. SURESHKUMAR\nSRI .M.T. SURESHKUMAR\nSRI.R.RANJITH\nTHIS CRIMINAL MISC. CASE HAVING BEEN FINALLY HEARD ON\n07.01.2019, ALONG WITH Cr1.MC.7608/2018, THE COURT ON THE SAME\nDAY PASSED THE FOLLOWING:\n\nCrl.M.C. No.7608 & 7703/2018. 5 2019/KER/OIS\nORDER\n[ Crl1.MC 7608/2018 ,Cr1.MC.7703/2018 ]\n\nCrl.M.C.No.7608/2018 arises from Crime No. 58 of 2012 of\nPeringome Police station, for offences punishable under sections\n143,147,148,341,323,324,506(ii), 354 read with section 149 IPC.\nAllegation of the prosecution is that, petitioners herein attacked the\ndefacto complainants on 20/1/2012 at 11.45 a.m. It was alleged that,\nit was pursuant to a protest against running of a quarry. Respondents\n1 to 3 are the defacto complainants. Now the matter is pending as CC\nNo. 475/2013 of the Judicial Magistrate of First Class, Payyannur.\n\n2. Cri.M.C. No.7703/2018 arises from Crime No.57/2012 of\nPeringom police station for offences punishable under sections\n341,323,324,294(b), 506(ii), read with section 34IPC. Allegation of the\nprosecution is that petitioners herein attacked the defacto\ncomplainant on 20/1/2012 at 11.45 a.m. Matter is now pending as\nC.C.No.229/2013 of the Judicial Magistrate of First Class, Payyannur.\n\n3. Accused in both the cases have approached this court to\nquash the proceedings on the basis of the settlement arrived at\nbetween the parties. To substantiate their statement, parties relied\non the affidavit submitted by the defacto complainants.\n\nCrl.M.C. No.7608 & 7703/2018. 6 2019/KER/OIS\n\n4. It is seen that accused 1 and 2 in Crime No. 57/2012 are the\ndefacto complainants in Crime No. 58/2012. Learned counsel on\ninstructions submitted that parties have settled their disputes in both\nthe cases and their statements have been recorded.\n\n5.Considering the fact that, the petitioners have no criminal\nantecedents and the settlement arrived at between the parties is on\nrecord, I am inclined to quash the proceedings.\n\nAccordingly, Crl.M.Cs are allowed. All further proceedings\npending as CC No. 475/2013 and 229/2013 of the Judicial Magistrate\nof First Class, Payyanur stand quashed",
    "full_text": "El ete\nBE are\nIN THE HIGH COURT OF KERALA AT ERNAKULAM 2019/KER/615\nPRESENT\nTHE HONOURABLE MR. JUSTICE SUNIL THOMAS\nMONDAY ,THE O7TH DAY OF JANUARY 2019 / 17TH POUSHA, 1940\nCr1.MC.No. 7608 of 2018\nAGAINST THE ORDER/JUDGMENT IN CC 475/2013 of J.M.F.C.,PAYYANNUR\nCRIME NO. 58/2012 OF Peringome Police Station , Kannur\nPETITIONER/ACCUSED 1 TO 7:\n1 FR. BINU THOMAS THADATHIL,\nAGED 37 YEARS\ns/o THOMAS, CHOORAPPADAVU, KANNUR DISTRICT\n2 JIMMI\nAGED 38 YEARS\nS/O. THOMAS, VELLIKKUZHIYIL, PULIMGOM, KOTTATHALACHI,\nKANNUR DISTRICT.\n3 JAMES ,\nAGED 41 YEARS\nS/O. SCARIA, MYLATOOR, PULIMGOM, KOTTATHALACHI,\nKANNUR DISTRICT.\n4 PRAKASAN,\nAGED 52 YEARS\nS/O. JOSEPH, PANUNANICKAL HOUSE, PULIMGOM,\nVAZHAKKUNDOM, KANNUR DISTRICT.\n5 THOMAS ,\nAGED 38 YEARS\nS/O. AUGUSTIN, VENGACHUVATTIL HOUSE, PULIMGOM,\nKOTTATHALACHIT, KANNUR DISTRICT.\n6 RAJESH,\nAGED 45 YEARS\ns/o. KURIAKOSE, KUTTIYANICKAL HOUSE, PULIMGOM,\nKOTTATHALACHI, KANNUR DISTRICT.\n7 JAMES,\nAGED 56 YEARS\nS/O. JACOB, KARIPAL HOUSE, PULIMGOM, KOTTATHALACHI,\nKANNUR DISTRICT.\nBY ADV. SRI.M.T.SURESHKUMAR\n\nEI ee\nOE: an fet\nCri.M.C. No.7608 & 7703/2018. 2 201 /KERIGIS\nRESPONDENT/DEFACTO COMPLAINANT & STATE:\n1 BAIJUMON V.S.,\nAGED 38 YEARS\nS/O SASIDHARAN NAIR, VADAKKEDATHU HOUSE,\nKOTTATHALACHI, EDAVARAMBA P O, PULIGOM VILLAGE,\nKANNUR DISTRICT, PIN-670511\n2 RAVEENDRAN K.\nAGED 42 YEARS\nS/O. KUNJIKKANNAN, PALLIKKUNNEL, PULIMGOM AMSOM ,\nKOTTATHALACHI, KANNUR DISTRICT, PIN - 670511.\n3 SHEEBA,\nAGED 34 YEARS\nW/O. RAVEENDRAN, PALLIKKUNNEL, PULIMGOM AMSOM,\nKOTTATHALACHI, KANNUR DISTRICT, PIN - 670511.\n4 STATE OF KERALA\nREPRESENTED BY THE PUBLIC PROSECUTOR, HIGH COURT OF\nKERALA, ERNAKULAM, PIN 682 031.\nBY ADV. SRI.GEORGE MECHERIL\nOTHER PRESENT:\nPP AJITH MURALI\nTHIS CRIMINAL MISC. CASE HAVING BEEN FINALLY HEARD ON\n07.01.2019, ALONG WITH Cr1.MC.7703/2018, THE COURT ON THE SAME\nDAY PASSED THE FOLLOWING:\n\nEI ee\nOE: see\nCri.M.C. No.7608 & 7703/2018. 3 201 /KERIGIS\nIN THE HIGH COURT OF KERALA AT ERNAKULAM\nPRESENT\nTHE HONOURABLE MR. JUSTICE SUNIL THOMAS\nMONDAY ,THE O7TH DAY OF JANUARY 2019 / 17TH POUSHA, 1940\nCrl.MC.No. 7703 of 2018\nAGAINST THE ORDER/JUDGMENT IN CC 229/2013 of J.M.F.C.,PAYYANNUR\nCRIME NO. 57/2012 OF Peringome Police Station , Kannur\nPETITIONERS/ACCUSED NOS. 1 AND 2:\n1 BALJUMON,\nAGED 38 YEARS\n$/O.SASIDHARAN NAIR, VADAKKEDATHU HOUSE, PULINGOM\nAMSOM, KANNUR DISTRICT.\n2 RAVEENDRAN\nAGED 42 YEARS\nS/O KUNJIKANNAN, PULIKKUNNEL, PULINGOM,\nKOTTATHALACHI MALA, KANNUR DISTRICT.\nBY ADV. SRI.GEORGE MECHERIL\nRESPONDENTS/ DEFACTO COMPLAINANT AND STATE:\n1 FR.BINU THOMAS,\nAGED 37 YEARS\nS/O. THOMAS, THADATHILPUTHENVEEDU, VILAKKENNUR,\nNDUVIL AMSOM, CHOORAPPADAVU, (VIKAR OF HOLY CROSS\nCHURCH), KANNUR DISTRICT, PIN - 670 511.\n2 RARICHAN @ JOMYSYRIAK,\nAGED 38 YEARS\nS/O.KURIAN, MYLADOOR HOUSE, PULINGOM,\nCHOORAPPADAVU, KANNUR DISTRICT, PIN-670511.\n3 THOMAS V.A.\nAGED 43 YEARS\nS/O.AUGUSTIN, VENGACHUVATTIL HOUSE, PULINGOM,\n\nEI ee\nOE: an fet\nCri.M.C. No.7608 & 7703/2018. 4 201 /KERIGIS\nKOTTATHALACHI, EDAVARAMBU P.O., KANNUR DISTRICT,\nPIN-670 511.\n4 THOMAS P.O.,\nAGED 48 YEARS\nS/O.MATHEW, PARATHOTTATHIL HOSUE, THIRUMENI AMSOM,\nTHEKKENMAVU, KOTTACHALACHI, KANNUR DISTRICT, PIN-\n670 511.\n5 M.S.JAMES,\nAGED 41 YEARS\nS/O.SCARIA, MYLADOOR HOUSE, PULINGOM,\nKOTTATHALACHI, KANNUR DISTRICT, PIN-670 511.\n6 SINS AUGUSTIN\nAGED 27 YEARS\n$/O.AUGUSTIN, PULINGOM, CHOORAPPADAVU, KANNUR\nDISTRICT, PIN-670 511.\n7 JIMMI JOSEPH,\nAGED 38 YEARS\n$/O.JOSEPH, VELLIMOODIYIL HOUSE, PULINGOM AMSOM,\nKOTTATHALACHI, KANNUR DISTRICT, PIN-670 511.\n8 STATE OF KERALA\nREPRESENTED BY THE PUBLIC PROSECUTOR, HIGH COURT OF\nKERALA, ERNAKULAM, PIN-682 031.\nBY ADVS.\nSRI .M.T. SURESHKUMAR\nSRI .M.T. SURESHKUMAR\nSRI.R.RANJITH\nTHIS CRIMINAL MISC. CASE HAVING BEEN FINALLY HEARD ON\n07.01.2019, ALONG WITH Cr1.MC.7608/2018, THE COURT ON THE SAME\nDAY PASSED THE FOLLOWING:\n\nCrl.M.C. No.7608 & 7703/2018. 5 2019/KER/OIS\nORDER\n[ Crl1.MC 7608/2018 ,Cr1.MC.7703/2018 ]\n\nCrl.M.C.No.7608/2018 arises from Crime No. 58 of 2012 of\nPeringome Police station, for offences punishable under sections\n143,147,148,341,323,324,506(ii), 354 read with section 149 IPC.\nAllegation of the prosecution is that, petitioners herein attacked the\ndefacto complainants on 20/1/2012 at 11.45 a.m. It was alleged that,\nit was pursuant to a protest against running of a quarry. Respondents\n1 to 3 are the defacto complainants. Now the matter is pending as CC\nNo. 475/2013 of the Judicial Magistrate of First Class, Payyannur.\n\n2. Cri.M.C. No.7703/2018 arises from Crime No.57/2012 of\nPeringom police station for offences punishable under sections\n341,323,324,294(b), 506(ii), read with section 34IPC. Allegation of the\nprosecution is that petitioners herein attacked the defacto\ncomplainant on 20/1/2012 at 11.45 a.m. Matter is now pending as\nC.C.No.229/2013 of the Judicial Magistrate of First Class, Payyannur.\n\n3. Accused in both the cases have approached this court to\nquash the proceedings on the basis of the settlement arrived at\nbetween the parties. To substantiate their statement, parties relied\non the affidavit submitted by the defacto complainants.\n\nCrl.M.C. No.7608 & 7703/2018. 6 2019/KER/OIS\n\n4. It is seen that accused 1 and 2 in Crime No. 57/2012 are the\ndefacto complainants in Crime No. 58/2012. Learned counsel on\ninstructions submitted that parties have settled their disputes in both\nthe cases and their statements have been recorded.\n\n5.Considering the fact that, the petitioners have no criminal\nantecedents and the settlement arrived at between the parties is on\nrecord, I am inclined to quash the proceedings.\n\nAccordingly, Crl.M.Cs are allowed. All further proceedings\npending as CC No. 475/2013 and 229/2013 of the Judicial Magistrate\nof First Class, Payyanur stand quashed.\n\nSd/-\ndpk SUNIL THOMAS\nJUDGE\n\nmer as\nOE: see\nCri.M.C. No.7608 & 7703/2018. 7 201 /KERIGIS\nAPPENDIX OF Cri.MC 7608/2018\nPETITIONER'S/S EXHIBITS:\nANNEXURE P1 TRUE COPY OF THE FIR IN CRIME NO. 58 OF\n2012 OF PERINGOME POLICE STATION, KANNUR\nDISTRICT.\nANNEXURE P2 TRUE COPY OF THE FINAL REPORT IN CRIME NO.\n58 OF 2012 OF PERINGOME POLICE STATION,\nKANNUR DISTRICT DATED 05.04.2013.\n\nBl ee\nok ay\nCri.M.C. No.7608 & 7703/2018. 8 2019/KER/61S\nAPPENDIX OF Crl1.MC 7703/2018\nPETITIONER'S/S EXHIBITS:\nANNEXURE Al TRUE COPY OF THE FIR IN CRIME NO.57 OF 2012\nOF PERINGOME POLICE STATION, KANNUR\nDISTRICT.\nANNEXURE A2 TRUE COPY OF THE FINAL REPORT IN CRIME\nNO.57 OF 2012 OF PERINGOME POLICE STATION,\nKANNUR DISTRICT DATED 5.4.2013.\n\n"
}