{
    "case_id": "",
    "court": "HIGH COURT OF KERALA AT ERNAKULAM\nPRESENT",
    "date": "7TH DAY OF DECEMBER 2017",
    "judge": "B.KEMAL PASHA\nTHURSDAY",
    "petitioners": [
        "ACCUSED:"
    ],
    "respondents": [
        "STATE:"
    ],
    "sections": [],
    "outcome": "",
    "full_text": "a pe\nape\n2017/KER/49559\nIN THE HIGH COURT OF KERALA AT ERNAKULAM\nPRESENT:\nTHE HONOURABLE MR. JUSTICE B.KEMAL PASHA\nTHURSDAY, THE 7TH DAY OF DECEMBER 2017/16TH AGRAHAYANA, 1939\nCr1l.MC.No. 7508 of 2017 ()\nC.P.NO.156/2017 OF JUDICIAL FIRST CLASS MAGISTRATE COURT-I, KASARGOD\n\nPETITIONER/ACCUSED:\n\nHARSHAD RAHMAN,\n\nS/O.ABOOBAKKAR,AGED 23 YEARS,\n\nRESIDING AT RAHMATH MANZIL,\n\nKOLAVAYAL,AJANUR P.O.,\n\nHOSDURG TALUK,\n\nKASARAGOD DISTRICT.\n\nBY ADVS.SRI.T.MADHU\n\nSMT .C.R.SARADAMANT\n\nRESPONDENT/STATE:\n\nSTATE OF KERALA,\n\nTHROUGH THE STATION HOUSE OFFICER,\n\nHOSDURG POLICE STATION ,KASARAGOD DISTRICT,\n\nREPRESENTED BY THE PUBLIC PROSECUTOR,\n\nHIGH COURT OF KERALA,\n\nERNAKULAM-682031.\n\nBY PUBLIC PROSECUTOR SRI.C.S. HRITWIK\n\nTHIS CRIMINAL MISC. CASE HAVING COME UP FOR ADMISSION ON 07-12-2017,\nTHE COURT ON THE SAME DAY PASSED THE FOLLOWING:\n\nEL\n\nBape hal\n2017/KER/49559\nB. KEMAL PASHA, J.\n~Crl.M.C.No.7508 of 2017\nDated this the 7\" day of December, 2017\nORDER\nLearned counsel for the petitioner seeks permission to\nwithdraw this Crl.M.C., with liberty to approach the Court of\nSession concerned, where the Sessions Case is pending.\nPermission is granted, and accordingly, this Crl.M.C. is\ndismissed as withdrawn, with liberty to approach the Court of\nSession concerned, where the Sessions Case is pending.\nSd/-\nB. KEMAL PASHA, JUDGE.\nSd\n// True Copy // P.A. to Judge\n\n"
}