{
    "case_id": "Crl.MC.No. 8225 of 2018",
    "court": "HIGH COURT OF KERALA AT ERNAKULAM\nPRESENT\nTHE HONOURABLE MR",
    "date": "4TH DAY OF JANUARY 2019",
    "judge": "RAJA VIJAYARAGHAVAN V\nFRIDAY",
    "petitioners": [
        "PETITIONER/ACCUSED:",
        "NASSAR, AGED 36 YEARS,",
        "S/O.SHAHUL HAMEED, CHERUMKAD (HOUSE) ,",
        "PATHANAPURAM, KAVASSERRY, ALATHUR, PALAKKAD."
    ],
    "respondents": [
        "RESPONDENT & COMPLAINANT:",
        "STATE OF KERALA,",
        "REPRESENTED BY PUBLIC PROSECUTOR,",
        "HIGH COURT OF KERALA, ERNAKULAM, PIN-682031."
    ],
    "sections": [
        "482 of the Cr"
    ],
    "outcome": "",
    "full_text": "Pleieis el\nfl? ae\n2019/KER/343\nIN THE HIGH COURT OF KERALA AT ERNAKULAM\nPRESENT\nTHE HONOURABLE MR. JUSTICE RAJA VIJAYARAGHAVAN V\nFRIDAY, THE O4TH DAY OF JANUARY 2019 / 14TH POUSHA, 1940\nCr1.MC.No. 8225 of 2018\nCRL.M.P.NO.6805/2018 ON THE FILES OF THE JUDICIAL FIRST CLASS\nMAGISTRATE COURT, ALATHUR DATED 17-11-2018\nCRIME NO. 803/2018 OF Alathur Police Station, Palakkad\nPETITIONER/PETITIONER/ACCUSED:\nNASSAR, AGED 36 YEARS,\nS/O.SHAHUL HAMEED, CHERUMKAD (HOUSE) ,\nPATHANAPURAM, KAVASSERRY, ALATHUR, PALAKKAD.\nBY ADV. SRI.V.A.JOHNSON (VARIKKAPPALLIL)\nRESPONDENT/RESPONDENT & COMPLAINANT:\nSTATE OF KERALA,\nREPRESENTED BY PUBLIC PROSECUTOR,\nHIGH COURT OF KERALA, ERNAKULAM, PIN-682031.\nSRI. B. JAYASURYA-PUBLIC PROSECUTOR\nTHIS CRIMINAL MISC. CASE HAVING COME UP FOR ADMISSION ON\n04.01.2019, THE COURT ON THE SAME DAY PASSED THE FOLLOWING:\n\nBIRR hal\nBisa\nCrl.MC.No. 8225 of 2018 2 201MKERISA3\nORDER\n\nThis petition is filed under Section 482 of the Cr.P.C.\n\n2. The petitioner herein is the accused in Crime No.803 of\n2018 registered at the Alathur Police Station under Sections 447,\n354, 354A(2) and 506(i) of the IPC.\n\n3. By order dated 05.10.2018, the petitioner was granted\nbail by this Court subject to various conditions. One of the\nconditions required him to surrender his passport before the\nlearned Magistrate. It appears that the petitioner filed an\napplication seeking release of the passport. The learned\nMagistrate by Annexure-C order rejected the prayer by holding\nthat the petitioner would evade the proceedings.\n\n4. Heard the learned counsel appearing for the petitioner,\nwho submitted that the petitioner was employed abroad and he\nwould get his job Visa extended for a further period only if he gets\nback his passport and goes abroad for a short visit. The learned\nPublic Prosecutor does not raise any serious objection. It is,\nhowever, submitted that stringent conditions be imposed to\n\nralesarced\nia aa\nCrl.MC.No. 8225 of 2018 3 201/KERIS4S\nensure that the petitioner herein is available as and when his\npresence is required.\n\n5. I have considered the submissions advanced. Having\nregard to the facts and circumstances, this petition is disposed of\ndirecting the court below to release the passport to the petitioner\nand to permit him to go abroad for a period of six months on his\nexecuting a bond for Rs.25,000/- (Rupees Twenty five thousand\nonly) with two solvent sureties each for the like sum to the\nsatisfaction of the court below. The release of passport shall be\nsubject to the following conditions: -\n\n1. The passport of the petitioner shall be released to him for\na period of six months. The petitioner shall give an\nundertaking before the learned Magistrate that he will return\nthe passport before the Court within the said period from the\ndate of obtaining release of the passport from Court.\n\n2. The petitioner shall submit his VISA and passport details\nbefore the court below and also furnish his address abroad.\nHe shall also give the name and other particulars, including\nmobile phone number etc. of his local Advocate, who could be\ncontacted by the Court or the Investigating officer for issuing\nany direction to the petitioner.\n\nIMR esTal\nisi ae\nCrl.MC.No. 8225 of 2018 4 2019/KER343\n3. The petitioner shall not leave the country without obtaining\nprior permission from the learned Magistrate.\n\nIf the petitioner requires the passport to be released for a further\nperiod, he shall seek appropriate orders from the Court where the case\nagainst him is pending.\n\nSD/-\nRAJA VIJAYARAGHAVAN V.,\nJUDGE\nDSVi-\nTRUE COPY// P.A.TO JUDGE\n\nerate)\n|\nOE: ene\nCrl.MC.No, 8225 of 2018 5 2019/KERI343\nAPPENDIX\nPETITIONER'S/S EXHIBITS:\nANNEXURE A TRUE COPY OF THE F.I.R NO.803/2018 OF\nALATHUR POLICHK STATION ALONG WITH F.I.\nSTATEMENT.\nANNEXURE B TRUE COPY OF THE ORDER IN B.A.NO. 6673/2018\nOF THIS HON'BLE COURT DATED 5.10.2018.\nANNEXURE C CERTIFIED COPY OF TTHE ORDER IN\nCRL.M.P.NO.6805/2018 OF THE COURT OF THE\nJUDICIAL FIRST CLASS MAGISTRATE-I, ALATHUR\nDATED 17.11.2018.\nRESPONDENT'S/S EXHIBITS:\nNIL\n//TRUE Ccopy//\nP.A.TO JUDGE\n\n"
}