{
    "case_id": "",
    "court": "HIGH COURT OF KERALA AT ERNAKULAM\nPRESENT\nTHE HONOURABLE MR",
    "date": "9TH DAY OF JANUARY 2020",
    "judge": "ASHOK MENON\nTHURSDAY",
    "petitioners": [
        "1ST ACCUSED:",
        "PRAMOD KUMAR S.GORAY @ PRAMOD S.GORAY,",
        "AGED 75 YEARS, S/O S.V.GORAY,",
        "C.C.NO.5/896, VAMAN NIVAS, G.K.AVENUE ROAD,",
        "MATTANCHERRY, KOCHI-682 002."
    ],
    "respondents": [
        "S/COMPLAINANT & STATE:",
        "1 CHANDRAPRAKASH D.DEO,",
        "AGED 68 YEARS, S/O. LATE D.V.DEO,",
        "C.C.NO.5/1085, PANDIT ROAD, KOCHI-682 002.",
        "2 STATE OF KERALA,",
        "REPRESENTED BY THE PUBLIC PROSECUTOR,",
        "HIGH COURT OF KERALA, ERNAKULAM-682 031.",
        "R1 BY ADV. SRI.N.RATHEESH",
        "R1 BY ADV. SMT.SUMA RATHEESH",
        "R2 BY SRI.B.JAYASURYA , SR.PP",
        "OTHER PRESENT:"
    ],
    "sections": [
        "415"
    ],
    "outcome": "ORDER/JUDGMENT IN CC 467/2012 OF JUDICIAL MAGISTRATE\nOF FIRST CLASS-I,KOCHI\nPETITIONER/1ST ACCUSED:\nPRAMOD KUMAR S.GORAY @ PRAMOD S.GORAY,\nAGED 75 YEARS, S/O S.V.GORAY,\nC.C.NO.5/896, VAMAN NIVAS, G.K.AVENUE ROAD,\nMATTANCHERRY, KOCHI-682 002.\nBY ADVS.\nSRI.G.KRISHNAKUMAR\nSMT .M.L.REMYA\nRESPONDENTS/COMPLAINANT & STATE:\n1 CHANDRAPRAKASH D.DEO,\nAGED 68 YEARS, S/O. LATE D.V.DEO,\nC.C.NO.5/1085, PANDIT ROAD, KOCHI-682 002.\n2 STATE OF KERALA,\nREPRESENTED BY THE PUBLIC PROSECUTOR,\nHIGH COURT OF KERALA, ERNAKULAM-682 031.\nR1 BY ADV. SRI.N.RATHEESH\nR1 BY ADV. SMT.SUMA RATHEESH\nR2 BY SRI.B.JAYASURYA , SR.PP\nOTHER PRESENT:\nTHIS CRIMINAL MISC. CASE HAVING BEEN FINALLY HEARD ON\n09.01.2020, THE COURT ON THE SAME DAY PASSED THE FOLLOWING:\n\nCrl.M.C.No. 4208 of 2019 > 2020/KER/1012\nORDER\nDated this the 9th day of January 2020\n\nThe petitioner is the 1** accused in C.C.No.467/2012\non the file of the Judicial First Class Magistrate\nCourt-I, Kochi. There were two accused. The 272\naccused had approached this Court in\nCrl.M.C.No.5542/2014 to quash the proceedings against\nhim in the very same case. The complaint filed by the\n1s* respondent was referred by the Police, against which\nhe filed a protest complaint and that has been taken on\nfile by the Judicial First Class Magistrate Court-I,\nKochi and is presently pending as C.C.No.467/2012. The\nallegation in the complaint is that the 2\" accused had\nunder the instigation of the 1% accused; forged and\nproduced a document before the Cochin Devaswom Board to\nlay a claim over the Temple. After considering the\nentire materials available, this Court by a detailed\nOrder dated 07.06.2019 at Annexure X quashed",
    "full_text": "Deere\n4 aneey\npisos\n2020/KER/1012\nIN THE HIGH COURT OF KERALA AT ERNAKULAM\nPRESENT\nTHE HONOURABLE MR. JUSTICE ASHOK MENON\nTHURSDAY, THE O9TH DAY OF JANUARY 2020 / 19TH POUSHA, 1941\nCr1.MC.No.4208 OF 2019(E)\nAGAINST THE ORDER/JUDGMENT IN CC 467/2012 OF JUDICIAL MAGISTRATE\nOF FIRST CLASS-I,KOCHI\nPETITIONER/1ST ACCUSED:\nPRAMOD KUMAR S.GORAY @ PRAMOD S.GORAY,\nAGED 75 YEARS, S/O S.V.GORAY,\nC.C.NO.5/896, VAMAN NIVAS, G.K.AVENUE ROAD,\nMATTANCHERRY, KOCHI-682 002.\nBY ADVS.\nSRI.G.KRISHNAKUMAR\nSMT .M.L.REMYA\nRESPONDENTS/COMPLAINANT & STATE:\n1 CHANDRAPRAKASH D.DEO,\nAGED 68 YEARS, S/O. LATE D.V.DEO,\nC.C.NO.5/1085, PANDIT ROAD, KOCHI-682 002.\n2 STATE OF KERALA,\nREPRESENTED BY THE PUBLIC PROSECUTOR,\nHIGH COURT OF KERALA, ERNAKULAM-682 031.\nR1 BY ADV. SRI.N.RATHEESH\nR1 BY ADV. SMT.SUMA RATHEESH\nR2 BY SRI.B.JAYASURYA , SR.PP\nOTHER PRESENT:\nTHIS CRIMINAL MISC. CASE HAVING BEEN FINALLY HEARD ON\n09.01.2020, THE COURT ON THE SAME DAY PASSED THE FOLLOWING:\n\nCrl.M.C.No. 4208 of 2019 > 2020/KER/1012\nORDER\nDated this the 9th day of January 2020\n\nThe petitioner is the 1** accused in C.C.No.467/2012\non the file of the Judicial First Class Magistrate\nCourt-I, Kochi. There were two accused. The 272\naccused had approached this Court in\nCrl.M.C.No.5542/2014 to quash the proceedings against\nhim in the very same case. The complaint filed by the\n1s* respondent was referred by the Police, against which\nhe filed a protest complaint and that has been taken on\nfile by the Judicial First Class Magistrate Court-I,\nKochi and is presently pending as C.C.No.467/2012. The\nallegation in the complaint is that the 2\" accused had\nunder the instigation of the 1% accused; forged and\nproduced a document before the Cochin Devaswom Board to\nlay a claim over the Temple. After considering the\nentire materials available, this Court by a detailed\nOrder dated 07.06.2019 at Annexure X quashed the\nproceedings as against the 2\"? accused. The offences\nalleged against the petitioner are under Sections 415,\n\n:\nCrl.M.C.No. 4208 of 2019 3 2020/KER/1012\n465, 468 and 474 of I.P.C. There is also a civil suit\npending against the 2â„¢ accused. The dispute revolves\naround the title over the Temple and its properties.\nThe discussions in Annexure X order would equally apply\nto the petitioner also, because the specific allegation\ntherein is that in furtherance of common intention the\naccused 1 and 2 had forged documents to usurp the title\nover the Temple. In view of the specific finding in\nfavour of the 27 accused, the allegations as against\nthe 1** accused also would not lie as the role of the 1**\naccused is only to instigate the 2\" accused to produce\nthe forged document. Therefore, the entire proceedings\naS against the 1% accused in C.C.No.467/2012 on the\nfile of the Judicial First Class Magistrate Court-I,\nKochi, also stands quashed under Section 482 of Cr.P.C.\nand the petitioner is discharged.\n\nSd/-\nASHOK MENON\n\ndkr JUDGE\n\nDeere\n5 alee]\npisos\nCri.M.C.No. 4208 of 2019 2020/KER/1012\n4\nAPPENDIX\nPETITIONER'S/S EXHIBITS:\nANNEXURE I COPY OF THE FINAL REPORT FILED IN CRIME\nNO.229/2009 BEFORE THE JFCM I, KOCHI.\nANNEXURE IT COPY OF THE COMPLAINT FILED U/S.200 CIVIL\nPROCEDURE CODE IN C.C.467/2012 ON THE FILE\nOF THE JFCM COURT, KOCHI.\nANNEXURE III COPY OF CHATTAPATHRAM 1075 ME EXECUTED BY\nBABU PANDITHAN GOVINDA PANDITHAN PRODUCED\nIN ANNEXURE II COMPLAINT.\nANNEXURE IV COPY OF THE ORDER NO.E 3909/76 DATED\n10.4.1978 OF COCHIN DEVASWOM BOARD.\nANNEXURE V COPY OF THE ENQUIRY REPORT DATED 14.10.2008\nOF THE ENQUIRY OFFICER OF COCHIN DEVASWOM\nBOARD.\nANNEXURE VI COY OF THE REPORT OF THE OMBUDSMAN IN WPC\nNO.4205/2009.\nANNEXURE VII COPY OF REPORT DATED 3.12.1977 OF ASSISTANT\nCOMMISSIONER OF THE COCHIN DEVASWOM BOARD\nOBTAINED UNDER THE RTI.\nANNEXURE VIII COPY OF THE FILE NOTE APPROVED ON 31.3.1978\nOF THE COCHIN DEVASWOM BOARD, OBTAINED\nUNDER THE RTI ACT.\nANNEXURE IX ORDER DATED 18.2.1986 OF THE COCHIN\nDEVASWOM BOARD ON E 3909/76 OBTAINED UNDER\nTHE RTI ACT.\nANNEXURE X COPY OF THE JUDGMENT DATED 7.6.2019 IN\nCRL.M.C.NO.5542/2014 OF THE HIGH COURT.\n\n"
}