{
    "case_id": "Crl.MC.No. 8516 of 2017",
    "court": "HIGH COURT OF KERALA AT ERNAKULAM",
    "date": "3RD DAY OF JANUARY 2018",
    "judge": "SUNIL THOMAS\nWEDNESDAY",
    "petitioners": [
        "ACCUSED:",
        "1 SANDEEP SASIDHARAN,",
        "AGED-32 YEARS,S/O.V.SASIDHARAN,SAS VALUPACHAYIL,",
        "KADAKKAL,PULIPPARA.P.O,KOLLAM-691536.",
        "2 V.SASIDHARAN,",
        "AGED-66 YEARS,RESIDING @ SAS VALUPACHAYIL,",
        "KADAKKAL,PULIPPARA.P.O,KOLLAM-691536.",
        "3 ASHA SASIDHARAN,",
        "AGED 59 YEARS,RESIDING @ SAS VALUPACHAYIL,",
        "KADAKKAL,PULIPPARA.P.O,KOLLAM-691536."
    ],
    "respondents": [
        "COMPLAINANTS:",
        "1. STATE OF KERALA,",
        "REPRESENTED BY PUBLIC PROSECUTOR,HIGH COURT OF KERALA,",
        "ERNAKULAM.",
        "2. SUB INSPECTOR OF POLICE,",
        "ANCHALUMOODU,KOLLAM.",
        "3. SWAN LETHA,",
        "AGED-28 YEARS,D/O B.PRASANNAKUMAR,KUMRASWAMY BHAVAN,",
        "MATHILIL.P.O,KOLLAM.",
        "R3 BY ADV. SMT.P.SREESHA",
        "R BY PUBLIC PROSECUTOR:SRI C N PRABHAKARAN"
    ],
    "sections": [
        "420",
        "498A read with 34 of the Indian Penal Code"
    ],
    "outcome": "ORDER OF FAMILY COURT KOLLAM IN O.P.NO.127/2016\nDATED JULY 2017 1S PRODUCED\nANNEXURE A4 THE TRUE COPY OF THE JOINT DIVORCE PETITION FILED BEFORE FAMILY\nCOURT KOLLAM NUMBERED AS OP.779/2017 IS PRODUCED.\nRESPONDENTS EXHIBITS:NIL\nTRUE COPY\nP A TO JUDGE\n\n2018/KER/44\nSUNIL THOMAS, J.\nCrl.M.C.No.8516 of 2017\nDated this the 3\" day of January, 2018\nORDER\n\nPetitioners are arrayed as accused in Crime No.622 of\n2015 of Anchalumoodu Police Station for offences punishable under\nsections 420, 498A r/w 34 of the Indian Penal Code.\n\n2. The allegation of the prosecution is that after the\nmarriage of the first petitioner with the third respondent herein, she\nwas subjected to matrimonial cruelty by the petitioners in\nconnection with demand for dowry. Crime was registered and\ninvestigation is progressing. In the meanwhile, petitioners have\napproached this Court contending that the disputes have now been\nresolved and the parties have approached the Family Court seeking\ndivorce by filing a joint petition evidenced by Annexure-A4.\n\n3. It seems that the parties have settled the dispute.\nLearned counsel for the third respondent submitted that she has no\nobjection in quashing the proceedings in the light of the settlement\narrived at between the parties. Learned Public Prosecutor, on\ninstructions, submitted that the parties have resolved their dispute\nand the petitioners are not involved in any other crime. Having\nconsidered these facts and the fact that the issue arises from a\nmatrimonial discord, I am inclined to invoke the jurisdiction under\n\n2018/KER/44\nCrl.M.C.8516/17\n2\nsection 482 Cr.P.C to quash the criminal proceedings.\n\nIn the result, Crl.M.C is allowed. All further proceedings\narising from Crime No.622 of 2015 of Anchalumoodu Police Station\nwill stand quashed",
    "full_text": "rapes\nIN THE HIGH COURT OF KERALA AT ERNAKULAM 2018/KER/44\nPRESENT:\nTHE HONOURABLE MR. JUSTICE SUNIL THOMAS\nWEDNESDAY, THE 3RD DAY OF JANUARY 2018 / 13TH POUSHA, 1939\nCrl.MC.No. 8516 of 2017\nCRIME NO. 622/2015 OF ANCHALUMMOODU POLICE STATION , KOLLAM\nPETITIONER/ACCUSED:\n1 SANDEEP SASIDHARAN,\nAGED-32 YEARS,S/O.V.SASIDHARAN,SAS VALUPACHAYIL,\nKADAKKAL,PULIPPARA.P.O,KOLLAM-691536.\n2 V.SASIDHARAN,\nAGED-66 YEARS,RESIDING @ SAS VALUPACHAYIL,\nKADAKKAL,PULIPPARA.P.O,KOLLAM-691536.\n3 ASHA SASIDHARAN,\nAGED 59 YEARS,RESIDING @ SAS VALUPACHAYIL,\nKADAKKAL,PULIPPARA.P.O,KOLLAM-691536.\nBY ADV.SRILR.KISHORE (KALLUMTHAZHAM)\nRESPONDENT(S)/COMPLAINANTS:\n1. STATE OF KERALA,\nREPRESENTED BY PUBLIC PROSECUTOR,HIGH COURT OF KERALA,\nERNAKULAM.\n2. SUB INSPECTOR OF POLICE,\nANCHALUMOODU,KOLLAM.\n3. SWAN LETHA,\nAGED-28 YEARS,D/O B.PRASANNAKUMAR,KUMRASWAMY BHAVAN,\nMATHILIL.P.O,KOLLAM.\nR3 BY ADV. SMT.P.SREESHA\nR BY PUBLIC PROSECUTOR:SRI C N PRABHAKARAN\nTHIS CRIMINAL MISC, CASE HAVING COME UP FOR ADMISSION ON 03-01-2018,\nTHE COURT ON THE SAME DAY PASSED THE FOLLOWING:\n\nrapes\n\nCrI.MC.No. 8516 of 2017 2018/KER/44\nAPPENDIX\n\nPETITIONER(S)' EXHIBITS\nANNEXURE Al CERTIFIED COPY OF THE FIR IN CRIME NO.622/2015 DATED 23.08.2012 IS\nPRODUCED.\nANNEXURE A2 THE TRUE COPY OF THE AFFIDAVIT BY THE 3RD RESPONDENT IS PRODUCED\nANNEXURE A3 THE TRUE COPY OF THE ORDER OF FAMILY COURT KOLLAM IN O.P.NO.127/2016\nDATED JULY 2017 1S PRODUCED\nANNEXURE A4 THE TRUE COPY OF THE JOINT DIVORCE PETITION FILED BEFORE FAMILY\nCOURT KOLLAM NUMBERED AS OP.779/2017 IS PRODUCED.\nRESPONDENTS EXHIBITS:NIL\nTRUE COPY\nP A TO JUDGE\n\n2018/KER/44\nSUNIL THOMAS, J.\nCrl.M.C.No.8516 of 2017\nDated this the 3\" day of January, 2018\nORDER\n\nPetitioners are arrayed as accused in Crime No.622 of\n2015 of Anchalumoodu Police Station for offences punishable under\nsections 420, 498A r/w 34 of the Indian Penal Code.\n\n2. The allegation of the prosecution is that after the\nmarriage of the first petitioner with the third respondent herein, she\nwas subjected to matrimonial cruelty by the petitioners in\nconnection with demand for dowry. Crime was registered and\ninvestigation is progressing. In the meanwhile, petitioners have\napproached this Court contending that the disputes have now been\nresolved and the parties have approached the Family Court seeking\ndivorce by filing a joint petition evidenced by Annexure-A4.\n\n3. It seems that the parties have settled the dispute.\nLearned counsel for the third respondent submitted that she has no\nobjection in quashing the proceedings in the light of the settlement\narrived at between the parties. Learned Public Prosecutor, on\ninstructions, submitted that the parties have resolved their dispute\nand the petitioners are not involved in any other crime. Having\nconsidered these facts and the fact that the issue arises from a\nmatrimonial discord, I am inclined to invoke the jurisdiction under\n\n2018/KER/44\nCrl.M.C.8516/17\n2\nsection 482 Cr.P.C to quash the criminal proceedings.\n\nIn the result, Crl.M.C is allowed. All further proceedings\narising from Crime No.622 of 2015 of Anchalumoodu Police Station\nwill stand quashed.\n\nSd/-\nSUNIL THOMAS\nJudge\nSbna/3/1/18\nTrue Copy / P A to Judge\n\n"
}