{
    "case_id": "Crl.MC.No.8639 OF 2019",
    "court": "HIGH COURT OF KERALA AT ERNAKULAM",
    "date": "8TH DAY OF JANUARY 2020",
    "judge": "ASHOK MENON\nWEDNESDAY",
    "petitioners": [
        "ACCUSED:",
        "VISHNU PRASAD",
        "AGED 28 YEARS",
        "S/O. RAVIKUMAR, DARSHANA HOUSE, KRWA 183, KAVALLUR",
        "KANJIRAMPATTA WARD, PEROORKADA 695 013."
    ],
    "respondents": [
        "S/DEFACTO COMPLAINANT & STATE:",
        "1 MIKHIL MOHAN,",
        "S/O. MOHANAN PILLAI, PRATHEEKSHA BHAVAN, TC 5/154,",
        "HOUSE NO. 229, NEETHI NAGAR, PEROORKADA 695 005.",
        "2 STATE OF KERALA,",
        "REPRESENTED BY PUBLIC PROSECUTOR, HIGH COURT OF",
        "KERALA, ERNAKULAM 682 031.",
        "R1 BY ADV. JINNU SARA GEORGE",
        "OTHER PRESENT:"
    ],
    "sections": [
        "380 of the IPC"
    ],
    "outcome": "ORDER/JUDGMENT IN CC 40/2014 OF JUDICIAL MAGISTRATE OF\nFIRST CLASS -II,TRIVANDRUM\nCRIME NO.1711/2013 OF Peroorkada Police Station ,\nThiruvananthapuram\nPETITIONER/ACCUSED:\nVISHNU PRASAD\nAGED 28 YEARS\nS/O. RAVIKUMAR, DARSHANA HOUSE, KRWA 183, KAVALLUR\nKANJIRAMPATTA WARD, PEROORKADA 695 013.\nBY ADVS.\nSRI.RIJI RAJENDRAN\nSMT .MITHA SUDHINDRAN\nRESPONDENTS/DEFACTO COMPLAINANT & STATE:\n1 MIKHIL MOHAN,\nS/O. MOHANAN PILLAI, PRATHEEKSHA BHAVAN, TC 5/154,\nHOUSE NO. 229, NEETHI NAGAR, PEROORKADA 695 005.\n2 STATE OF KERALA,\nREPRESENTED BY PUBLIC PROSECUTOR, HIGH COURT OF\nKERALA, ERNAKULAM 682 031.\nR1 BY ADV. JINNU SARA GEORGE\nOTHER PRESENT:\nSRI.C.S.HRITHWIK SR PP\nTHIS CRIMINAL MISC. CASE HAVING COME UP FOR ADMISSION ON\n08.01.2020, THE COURT ON THE SAME DAY PASSED THE FOLLOWING:\n\nope\nCrl.MC.No.8639 OF 2019(H) 2020/KER/823\n2\nORDER\nDated this the 8th day of January, 2020\n\nThe petitioner is the sole accused in C.C No.40/2014 on\nthe files of the Judicial First Class Magistrate Court-II,\nThiruvananthapuram for having allegedly committed offences\npunishable under Section 380 of the IPC. The defacto complainant\nand the aggrieved is the 1** respondent who has appeared through\ncounsel and filed an affidavit to the effect that he has no grievance\nagainst the petitioner and the matter has been amicably settled. A\nreport also has been obtained from the Investigating Officer through\nthe Senior Public Prosecutor. The petitioner has no criminal\nantecedents. There is no public interest involved.\n\nIn the result, the Crl.M.C is allowed and the entire\nproceedings in C.C No.40/2014 on the files of the Judicial First Class\nMagistrate Court-II, Thiruvananthapuram stands quashed",
    "full_text": "Baar\nIN THE HIGH COURT OF KERALA AT ERNAKULAM 2020/KER/823\nPRESENT\nTHE HONOURABLE MR. JUSTICE ASHOK MENON\nWEDNESDAY, THE O8TH DAY OF JANUARY 2020 / 18TH POUSHA, 1941\nCri .MC.No.8639 OF 2019 (H)\nAGAINST THE ORDER/JUDGMENT IN CC 40/2014 OF JUDICIAL MAGISTRATE OF\nFIRST CLASS -II,TRIVANDRUM\nCRIME NO.1711/2013 OF Peroorkada Police Station ,\nThiruvananthapuram\nPETITIONER/ACCUSED:\nVISHNU PRASAD\nAGED 28 YEARS\nS/O. RAVIKUMAR, DARSHANA HOUSE, KRWA 183, KAVALLUR\nKANJIRAMPATTA WARD, PEROORKADA 695 013.\nBY ADVS.\nSRI.RIJI RAJENDRAN\nSMT .MITHA SUDHINDRAN\nRESPONDENTS/DEFACTO COMPLAINANT & STATE:\n1 MIKHIL MOHAN,\nS/O. MOHANAN PILLAI, PRATHEEKSHA BHAVAN, TC 5/154,\nHOUSE NO. 229, NEETHI NAGAR, PEROORKADA 695 005.\n2 STATE OF KERALA,\nREPRESENTED BY PUBLIC PROSECUTOR, HIGH COURT OF\nKERALA, ERNAKULAM 682 031.\nR1 BY ADV. JINNU SARA GEORGE\nOTHER PRESENT:\nSRI.C.S.HRITHWIK SR PP\nTHIS CRIMINAL MISC. CASE HAVING COME UP FOR ADMISSION ON\n08.01.2020, THE COURT ON THE SAME DAY PASSED THE FOLLOWING:\n\nope\nCrl.MC.No.8639 OF 2019(H) 2020/KER/823\n2\nORDER\nDated this the 8th day of January, 2020\n\nThe petitioner is the sole accused in C.C No.40/2014 on\nthe files of the Judicial First Class Magistrate Court-II,\nThiruvananthapuram for having allegedly committed offences\npunishable under Section 380 of the IPC. The defacto complainant\nand the aggrieved is the 1** respondent who has appeared through\ncounsel and filed an affidavit to the effect that he has no grievance\nagainst the petitioner and the matter has been amicably settled. A\nreport also has been obtained from the Investigating Officer through\nthe Senior Public Prosecutor. The petitioner has no criminal\nantecedents. There is no public interest involved.\n\nIn the result, the Crl.M.C is allowed and the entire\nproceedings in C.C No.40/2014 on the files of the Judicial First Class\nMagistrate Court-II, Thiruvananthapuram stands quashed under\nSection 482 Cr.P.C and the accused is discharged.\n\nSd/-\nASHOK MENON\nJUDGE\nNR/08/01/20\n\nCe\nBeat\nCr1.MC.No.8639 OF 2019(H) 2020/KER/S23\n3\nAPPENDIX\nPETITIONER'S EXHIBITS:\nANNEXURE A TRUE COPY OF THE FIR AND FIS IN CRIME NO.\n1711/2013 OF PEROROORKADA POLICE STATION,\nTHIRUVANANTHAPURAM DISTRICT.\nANNEXURE B TRUE COPY OF THE FINAL REPORT IN CC NO.\n40/2014 PENDING ON THE FILES OF THE COURT\nOF THE JUDICIAL FIRST CLASS MAGISTRATE II,\nTHIRUVANANTHAPURAM DISTRICT.\nANNEXURE C THE AFFIDAVIT FIELD BY THE DE-FACTO\nCOMPLAINANT CONTAINING THE FACTUM OF\nSETTLEMENT OF THE ISSUE.\nRESPONDENTS' EXHIBITS: NIL\n//TRUE COPY// PA TO JUDGE\n\n"
}