{
    "case_id": "",
    "court": "HIGH COURT OF KERALA AT ERNAKULAM",
    "date": "4TH DAY OF JANUARY 2018",
    "judge": "B.SUDHEENDRA KUMAR\nTHURSDAY",
    "petitioners": [
        "(S) /ACCUSED",
        "ROHITH,",
        "S/O. PREMAKUMARAN, PILAMKADU HOUSE,",
        "MARUTHA ROAD.P.O., PALAKKAD DISTRICT."
    ],
    "respondents": [
        "(S) /RESPONDENTS:",
        "1. STATE OF KERALA",
        "REPRESENTED BY PUBLIC PROSECUTOR,",
        "HON'BLE HIGH COURT OF KERALA, ERNAKULAM, KOCHI-682031.",
        "2. C.L. VENKTACHALAM,",
        "S/O. LAKSHMI NARAYANA GOUNDER,",
        "KESAVA FARM, KANJIKODE.P.O., PUDUSSERI,",
        "PALAKKAD DISTRICT-678621.",
        "R1 BY PUBLIC PROSECUTOR SRI.E.C.BINEESH"
    ],
    "sections": [],
    "outcome": "",
    "full_text": "â€” ae uJ\neS\noioaeas\nIN THE HIGH COURT OF KERALA AT ERNAKULAM 2018/KER/287\nPRESENT:\nTHE HONOURABLE MR. JUSTICE B.SUDHEENDRA KUMAR\nTHURSDAY, THE 4TH DAY OF JANUARY 2018 / 14TH POUSHA, 1939\nCr1.MC.No. 9010 of 2016\nST 373/2007 of J.M.F.C.-1, PALAKKAD\nPETITIONER (S) /ACCUSED\nROHITH,\nS/O. PREMAKUMARAN, PILAMKADU HOUSE,\nMARUTHA ROAD.P.O., PALAKKAD DISTRICT.\nBY ADV.SRI.K.MOHANAKANNAN\nRESPONDENT (S) /RESPONDENTS:\n1. STATE OF KERALA\nREPRESENTED BY PUBLIC PROSECUTOR,\nHON'BLE HIGH COURT OF KERALA, ERNAKULAM, KOCHI-682031.\n2. C.L. VENKTACHALAM,\nS/O. LAKSHMI NARAYANA GOUNDER,\nKESAVA FARM, KANJIKODE.P.O., PUDUSSERI,\nPALAKKAD DISTRICT-678621.\nR1 BY PUBLIC PROSECUTOR SRI.E.C.BINEESH\nTHIS CRIMINAL MISC. CASE HAVING BEEN FINALLY HEARD ON 04-01-2018,\nTHE COURT ON THE SAME DAY PASSED THE FOLLOWING:\n\nea ml\nBi? rae\n2018/KER/287\nCr1.MC.No. 9010 of 2016 ()\nAPPENDIX\nPETITIONER(S)' EXHIBITS\nANX.A1L TRUE COPY OF THE JUDGMENT IN ST 373/2007 OF THE\nJUDICIAL FIRST CLASS MAGISTRATE DATED 19-1-2010.\nANX.A2. TRUE COPY OF THE JUDGMENT IN CRIMINAL RP\n3465/2010 DATED 27-5-2013.\nRESPONDENT'S EXHIBITS: NIL\n//TRUE copy//\nP.A. TO JUDGE\nSTK\n\n= ai uJ\nrapes as\n2018/KER/287\nB. SUDHEENDRA KUMAR, J.\nCri.M.C. No.9010 of 2016\nDated this the 4\" day of January, 2018\nORDER\nWhen this matter has been taken up for hearing, the\nlearned counsel for the petitioner has requested to close\nthis Crl.M.C. In view of the above submission of the\nlearned counsel for the petitioner, this Crl.M.C. stands\nclosed.\nSd/-\nB. SUDHEENDRA KUMAR,\nJUDGE\nSTK\n/{TRUE COPY//\n//P.A. TO JUDGE//\n\n"
}