{
    "case_id": "CRL.MC.NO. 9318 OF 2019",
    "court": "HIGH COURT OF KERALA AT ERNAKULAM\nPRESENT\nTHE HONOURABLE MR",
    "date": "6TH DAY OF JANUARY 2020",
    "judge": "ASHOK MENON\nMONDAY",
    "petitioners": [
        "PETITIONER/ACCUSED:",
        "ABOOBACKER KUTTIKKOL,",
        "AGED 45 YEARS,",
        "S/O NJERU IBRAHIM, RAHMATH MANZIL,",
        "PADANNAKKAD, KASARGOD DISTRICT."
    ],
    "respondents": [
        "S /COMPLAINANT AND DE-FACTO COMPLAINANT :",
        "1 STATE OF KERALA",
        "REP. BY PUBLIC PROSECUTOR,",
        "HIGH COURT OF KERALA, ERNAKULAM-682 031.",
        "2 DEVAKI,",
        "AGED 70 YEARS,",
        "W/O KUNHIRAMAN, CHERUVATHUR AMSOM DESOM,",
        "KASARGOD DISTRICT-671 313.",
        "OTHER PRESENT:",
        "RAMESH CHAND-P.P"
    ],
    "sections": [],
    "outcome": "",
    "full_text": "Berl\nOn|\nBi. ro a\n2020/KER/283\nIN THE HIGH COURT OF KERALA AT ERNAKULAM\nPRESENT\nTHE HONOURABLE MR. JUSTICE ASHOK MENON\nMONDAY, THE O6TH DAY OF JANUARY 2020 / 16TH POUSHA, 1941\nCri .MC.No.9318 OF 2019 (D)\nAGAINST THE ORDER/JUDGMENT IN CMP.NO. 8144/2019 OF JUDICIAL\nMAGISTRATE OF FIRST CLASS -I,HOSDRUG\nCRIME NO.438/2019 OF Chandera Police Station , Kasargod\nPETITIONER/PETITIONER/ACCUSED:\nABOOBACKER KUTTIKKOL,\nAGED 45 YEARS,\nS/O NJERU IBRAHIM, RAHMATH MANZIL,\nPADANNAKKAD, KASARGOD DISTRICT.\nBY ADV. SRI.VIJU ABRAHAM\nRESPONDENTS /COMPLAINANT AND DE-FACTO COMPLAINANT :\n1 STATE OF KERALA\nREP. BY PUBLIC PROSECUTOR,\nHIGH COURT OF KERALA, ERNAKULAM-682 031.\n2 DEVAKI,\nAGED 70 YEARS,\nW/O KUNHIRAMAN, CHERUVATHUR AMSOM DESOM,\nKASARGOD DISTRICT-671 313.\nOTHER PRESENT:\nRAMESH CHAND-P.P\nTHIS CRIMINAL MISC. CASE HAVING BEEN FINALLY HEARD ON\n06.01.2020, THE COURT ON THE SAME DAY PASSED THE FOLLOWING:\n\nBi\nCRL.MC.NO. 9318 OF 2019 2 2020/KER/283\nORDER\nDated this the 06\" day of January, 2020\n\nThe learned counsel for the petitioner submits that the\nCrl.MC has become infructuous. Accordingly, the Crl.MC is dismissed\nas infructuous.\n\nSd/-\nASHOK MENON\nJUDGE\n\nasm\n\nOn|\nBi. ro a\nCRL.MC.NO. 9318 OF 2019 3 2020/KER/283\nAPPENDIX\nEXHIBITS:\nANNEXURE 1 A COPY OF THE SAID ORDER DATED 10.12.2019\nIN BA.NO. 8709 OF 2019\nANNEXURE 2 PETITION FILED AS CRIME NO 438/2019 BEFORE\nJUDICIAL FIRST CLASS MAGISTRATE COURT-1,\nHOSDURG.\nANNEXURE 3 CERTIFIED COPY OF THE ORDER DATED\n24.12.2019 IN C.M.P NO 8144 OF 2019 OF THE\nJUDICIAL FIRST CLASS MAGISTRATE COURT-1,\nHOSDURG\n// True Copy// PA to Judge\n\n"
}