{
    "case_id": "",
    "court": "HIGH COURT OF KERALA AT ERNAKULAM",
    "date": "8TH DAY OF JANUARY 2019",
    "judge": "RAJA VIJAYARAGHAVAN V\nTUESDAY",
    "petitioners": [
        "S.SHIBU",
        "S/O.G.SOMAN, PERUMPALLY VEEDU, KEEZHKOLLA,",
        "AMARAVILA.P.O., CHANKAL VILLAGE,",
        "NEYYATINKARA TALUK."
    ],
    "respondents": [
        "S:",
        "1 STATE OF KERALA",
        "REP. BY PUBLIC PROSECUTOR, HIGH COURT OF KERALA,",
        "ERNAKULAM-682 031.",
        "2 SHINCY J.PALAYYAN",
        "KRIPA BHAVAN, CHOORAKUZHY, AYIRAYIL DESOM,",
        "KARODE VILLAGE, NEYYATINKARA TALUK,",
        "THIRUVANANTHAPURAM.695 121.",
        "3 ALEENA",
        "AGED 1 1/2 YEARS, (REP. BY THE 2ND RESPONDENT MOTHER",
        "SHINCY J.PALAYYAN, KRIPA BHAVAN, CHOORAKUZHY,",
        "AYIRAYIL DESOM, KARODE VILLAGE, NEYYATINKARA TALUK,",
        "THIRUVANANTHAPURAM.)695 121."
    ],
    "sections": [],
    "outcome": "",
    "full_text": "Deere\neae\noe\nIN THE HIGH COURT OF KERALA AT ERNAKULAM 2019/KER/817\nPRESENT\nTHE HONOURABLE MR. JUSTICE RAJA VIJAYARAGHAVAN V\nTUESDAY ,THE O8TH DAY OF JANUARY 2019 / 18TH POUSHA, 1940\nCr1.MC.No. 6108 of 2015\nMC 16/2013 ON THE FILES OF THE FAMILY COURT, TRIVANDRUM\nPETITIONER:\nS.SHIBU\nS/O.G.SOMAN, PERUMPALLY VEEDU, KEEZHKOLLA,\nAMARAVILA.P.O., CHANKAL VILLAGE,\nNEYYATINKARA TALUK.\nBY ADVS.\nSRI .S .RAJEEV\nSRI .K.K.DHEERENDRAKRISHNAN\nSRI .V.VINAY\nRESPONDENTS:\n1 STATE OF KERALA\nREP. BY PUBLIC PROSECUTOR, HIGH COURT OF KERALA,\nERNAKULAM-682 031.\n2 SHINCY J.PALAYYAN\nKRIPA BHAVAN, CHOORAKUZHY, AYIRAYIL DESOM,\nKARODE VILLAGE, NEYYATINKARA TALUK,\nTHIRUVANANTHAPURAM.695 121.\n3 ALEENA\nAGED 1 1/2 YEARS, (REP. BY THE 2ND RESPONDENT MOTHER\nSHINCY J.PALAYYAN, KRIPA BHAVAN, CHOORAKUZHY,\nAYIRAYIL DESOM, KARODE VILLAGE, NEYYATINKARA TALUK,\nTHIRUVANANTHAPURAM.)695 121.\nBY ADVS.\nSRI.M.H.HANIL KUMAR\nSRI.S.RAMACHANDRAN NAIR\nSRI AMJAD ALI PP\nTHIS CRIMINAL MISC. CASE HAVING COME UP FOR ADMISSION ON\n08.01.2019, THE COURT ON THE SAME DAY PASSED THE FOLLOWING:\n\n: are]\nBees\nCr1.MC.No. 6108 of 2015 2 2019/KER/817\nORDER\nIt is submitted by Sri.S.Rajeev, the learned counsel appearing for\nthe petitioner, that this petition has become infructuous.\nAccordingly, this petition is dismissed.\nSd/-\nRAJA VIJAYARAGHAVAN V\nJUDGE\nIAP\n\n"
}