{
    "case_id": "Crl.MC.No. 6201 of 2016",
    "court": "HIGH COURT OF KERALA AT ERNAKULAM\nPRESENT",
    "date": "3RD DAY OF OCTOBER 2016",
    "judge": "SUNIL THOMAS\nMONDAY",
    "petitioners": [
        "ACCUSED.:",
        "PARAMESWARY AMMA,",
        "D/O AMMASAM VEETTIL LAKSHMI AMMA,",
        "AGED 68, PUNNAYURKULAM VILLAGE,",
        "CHERAYI DESOM, ANDATHODU P.O.,",
        "THRISSUR DISTRICT, PIN-679 564."
    ],
    "respondents": [
        "S/COMPLAINANT:",
        "1. STATE OF KERALA,",
        "REPRESENTED BY THE PUBLIC PROSECUTOR,",
        "HIGH COURT OF KERALA, ERNAKULAM, KOCHI-31.",
        "2. SABU,",
        "S/O AKKARA VEETTIL DEVASSY,",
        "LOORDUPURAM ROAD, KIZHAKKEKOTA,",
        "THRISSUR VILLAGE, DESOM,",
        "THRISSUR TALUK, PIN-680 609.",
        "3. KANNAN,",
        "$/O PARAMESWARAN NAIR, THOTTEKKATTU LINE,",
        "THRISSUR VILLAGE, POONKUNNAM DESOM,",
        "PROPRIETOR, M/S VIJAYA CONSTRUCTIONS,",
        "VIJAYA BHAVAN, XXXVIU/III,",
        "POONKUNNAM P.O, THRISSUR -680 609.",
        "4. UNION BANK OF INDIA,",
        "ALAPPUZHA BRANCH, REPRESENTED BY THE MANAGER",
        "DURING THE PERIOD 2006-2007, UNION BANK OF INDIA,",
        "KABEER PLAZA, CCSB ROAD, MULLAKKAL,",
        "ALAPPUZHA-688 001."
    ],
    "sections": [],
    "outcome": "",
    "full_text": "2\naot\n2016/KER/42226\nIN THE HIGH COURT OF KERALA AT ERNAKULAM\nPRESENT:\nTHE HONOURABLE MR. JUSTICE SUNIL THOMAS\nMONDAY, THE 3RD DAY OF OCTOBER 2016/11TH ASWINA, 1938\nCrl.MC.No. 6201 of 2016 ()\nCC. NO.590/2010 & CC. NO.480/2011 OF JUDICIAL FIRST CLASS MAGISTRATE\nCOURT, KUNNAMKULAM.\nPETITIONER/ACCUSED.:\nPARAMESWARY AMMA,\nD/O AMMASAM VEETTIL LAKSHMI AMMA,\nAGED 68, PUNNAYURKULAM VILLAGE,\nCHERAYI DESOM, ANDATHODU P.O.,\nTHRISSUR DISTRICT, PIN-679 564.\nBY ADVS.SMT.K.NANDINI,\nSRI.BINU BOSE.\nRESPONDENTS/COMPLAINANT:\n1. STATE OF KERALA,\nREPRESENTED BY THE PUBLIC PROSECUTOR,\nHIGH COURT OF KERALA, ERNAKULAM, KOCHI-31.\n2. SABU,\nS/O AKKARA VEETTIL DEVASSY,\nLOORDUPURAM ROAD, KIZHAKKEKOTA,\nTHRISSUR VILLAGE, DESOM,\nTHRISSUR TALUK, PIN-680 609.\n3. KANNAN,\n$/O PARAMESWARAN NAIR, THOTTEKKATTU LINE,\nTHRISSUR VILLAGE, POONKUNNAM DESOM,\nPROPRIETOR, M/S VIJAYA CONSTRUCTIONS,\nVIJAYA BHAVAN, XXXVIU/III,\nPOONKUNNAM P.O, THRISSUR -680 609.\n4. UNION BANK OF INDIA,\nALAPPUZHA BRANCH, REPRESENTED BY THE MANAGER\nDURING THE PERIOD 2006-2007, UNION BANK OF INDIA,\nKABEER PLAZA, CCSB ROAD, MULLAKKAL,\nALAPPUZHA-688 001.\n\n2\na tae\n2016/KER/42226\nCrl.MC.No. 6201 of 2016\n5. P.SYAM @ SYAMRAJ, PROPRIETOR,\nM/S ARJUNA CONSTRUCTIONS, MURUKALAYAM,\nPUNNAPRA P.O, ALAPPUZHA, (NOW RESIDING AT ARJUNA,\nTHIRUVAMBADI P.O., ALAPPUZHA-688 002.\nR1 BY PUBLIC PROSECUTOR SRI.E.C. BINEESH.\nTHIS CRIMINAL MISC. CASE HAVING COME UP FOR ADMISSION\nON 03-10-2016, ALONG WITH CRL.MC. NO.1192 OF 2014, THE\nCOURT ON THE SAME DAY PASSED THE FOLLOWING:\nrs*\n\nel\naot\n2016/KER/42226\nCrl.MC.No. 6201 of 2016\nAPPENDIX\nPETITIONER'S ANNEXURES:-\nANNEXURE | TRUE COPY OF THE COMPLAINT M.P.NO.7701/2009 (CC 590/10)\nFILED BY THE PETITIONER BEFORE THE JUDICIAL\nFIRST CLASS MAGISTRATE COURT, KUNNAMKULAM.\nANNEXURE II TRUE COPY OF THE JUDGMENT IN OP(CRL) NO.3230/2011\nDT. 10.10.2011 OF THIS HON'BLE COURT.\nANNEXURE III TRUE COPY OF THE COMMON ORDER OF\nJ.F.M.C. KUNNAMKULAM DATED 04.06.2010 IN MP. NO.4637/09\nAND M.P.NO.7701/09.\nANNEXURE IV TRUE COPY OF THE NEWS ITEMS APPEARED IN\nMATHRUBHUMI DAILY DATED 01.10.2013.\nANNEXURE V TRUE COPY OF THE NEWS ITEM APPEARED IN MATHRUBHUMI\nDAILY DATED 2.102.2013.\nANNEXURE VI TRUE COPY OF THE PETITION FILED BY THE PETITIONER IN\nC.C.NO.590/2010 BEFORE THE JUDICIAL FIRST CLASS\nMAGISTRATE COURT, KUNNAMKULAM DATED 08.10.2013.\nANNEXURE VII TRUE COPY OF THE ORDER DATED 06/11/2013 IN\nOP(CRL) NO.3711/2013.\nANNEXURE VIII TRUE COPY OF THE PETITION FILED BY THE\n5TH RESPONDENT DATED 20/01/2014.\nANNEXURE IX TRUE COPY OF THE ORDER IN CRL.MC. NO.1305/2014\nDATED 26/03/2014 OF THIS HONâ€™BLE COURT.\nANNEXURE X TRUE COPY OF THE PROCEEDINGS IN C.C.590/2010.\nANNEXURE XI TRUE COPY OF THE PROCEEDINGS IN C.C.480/2011.\nRESPONDENT'S ANNEXURES:-__iNIL.\nHTRUE COPY//\nP.S. TO JUDGE\nrs*\n\n0)\n2016/KER/42226\nSUNIL THOMAS, J.\n\nCr. M. C. Nos. 6201 of 2016 & 1192 of 2014\nDated this the 3\" day of October, 2016\nORDER\n\nThese applications are filed by the complainant in CC\nNo.590/2010 and 480/2011 of the Judicial 1%* Class Magistrate\nCourt, Kunnamkulam. CC No.480/2011 arises from Crime\nNo.119/1990 of Vadakkekad Police Station and Crl.M.C. No.\n1192/2014 relates to that crime. The grievance of the petitioner\nin Crl.M.C. No.6201/2016 is that, the disposal of the cases is\ngetting delayed. According to the petitioner, while the trial in CC\nNo. 590/2010 had reached its fag end, the 5 respondent herein\nfiled an application for simultaneous trial along with CC\nNo.480/2011. It was allowed by Annexure-IX order. The\npetitioner apprehends thai, it will further delay the proceedings.\n\n2. The learned Magistrate on a direction from this Court\nhas informed, by communication dated 27.09.2016 that, C.C.\nNos.590/2010 and 480/2011 are being proceeded with and both\nthe cases can be disposed of within a period of 6 months time.\n\nHaving regard to this, | feel that, the request made by the\nlearned Magistrate is reasonable. Hence, | am inclined to dispose\nof both the Crl.M.Cs. with a direction that, the court below shall\n\nmo)\n2016/KER/42226\nCri. M. C. Nos. 6201 of 2016 & 1192 of 2014\n2\ndispose of the matters, at the earliest, as expeditiously as\npossible, at any rate, within a period of 6 months from the date of\nreceipt of a copy of this order.\nCrl.M.Cs. are disposed of.\nSd/-\nSUNIL THOMAS, JUDGE.\nPn\n\n"
}