{
    "case_id": "",
    "court": "HIGH COURT OF KERALA AT ERNAKULAM\nPRESENT",
    "date": "1ST DAY OF AUGUST 2016",
    "judge": "RAJA VIJAYARAGHAVAN V\nMONDAY",
    "petitioners": [
        "[ACCUSED 1 & 2:",
        "1. M.K.MUHAMMED ALI,",
        "AGED 52 YEARS, S/O.V.K.MOOSA,",
        "MADAKKAL KURUPPILAKATH,",
        "UDUMBUMTHALA P.O, SOUTH THRIKARIPUR,",
        "HOSDURG, KASARAGOD DT.",
        "2. AJEER, S/O. MUHAMMED ALI,",
        "MADAKKAL KURUPPILAKATH,",
        "UDUMBUMTHALA P.O, SOUTH THRIKARIPUR,",
        "HOSDURG, KASARAGOD DT."
    ],
    "respondents": [
        "DEFACTO COMPLAINANTS & STATE:",
        "1. M.K.SAYED, AGED 39 YEARS, S/O.USMAN HAJI,",
        "MADAKKAL KURUPPILAKATH,",
        "UDUMBUMTHALA P.O, SOUTH THRIKARIPUR,",
        "HOSDURG, KASARAGOD -671 315.",
        "2. STATE OF KERALA,",
        "REPRESENTED BY THE STATION HOUSE OFFICER,",
        "CHANDERA POLICE STATION,",
        "THOUGH PUBLIC PORSECUTOR, HIGH COURT OF KERALA,",
        "ERNAKULAM -682 031.",
        "R1 BY ADV. SRI.C.H.ABDUL RASAC",
        "R2 BY PUBLIC PROSECUTOR SMT. PUSHPALATHA.WN.K."
    ],
    "sections": [
        "506"
    ],
    "outcome": "ORDER\n\n1.The petitioners herein are the accused Nos. 1 and 2 in\nC.C.No.3003 of 2013 of the Judicial Magistrate of First\nClass-I, Hosdurg. They are charged with for having\ncommitted offence punishable under Section 506(i) read\nwith section 34 of the IPC. The 1* respondent is the\nvictim.\n\n2.The instant petition is filed under Section 482 of the Code\nof Criminal Procedure banking on the ratio of the\nJudgment rendered by the Apex Court in Gian Singh v.\nState of Punjab ( 2012 (4) KLT 108) and a series of\nother cases which include Narinder Singh and others v.\nState of Punjab and Another [2014) 6 SCC 466] and\n\nBn\napa\n2016/KER/33660\nCri.M.C. No.4140 of 2016\n-2-\n\nYogendra Yadav _ and others V_ State of Jharkhand\n(2014 (9) SCC 653 ) with a prayer to quash the above\nproceeding.\n\n3.The sole ground is that the Apex Court in the above\njudgments have delineated the circumstances and the\ncases in which inherent powers under Section 482 can be\ninvoked de hors section 320 of the Code of Criminal\nProcedure for recognizing out of court settlement for the\npurpose of quashing criminal proceedings. It is prayed\nthat powers under Section 482 of the Code of Criminal\nProcedure be invoked to quash the criminal proceedings .\n\n4.It is submitted that the parties have reached an out of\ncourt settlement and there is no acrimony between them\nat present. All the disputes have been amicably resolved\nand they desire to live in peace and harmony. The 1*\nrespondent has sworn to an affidavit wherein he asserts\n\nBn\napa\n2016/KER/33660\n\nCri.M.C. No.4140 of 2016\n\n-3-\nthat he has no objection in terminating the proceedings.\n5.The prosecution allegation is that on 10.8.2013 at about\n4.00 p.m., the petitioners had criminally intimidated the\n1** respondent and thus committed the offence.\n\n6.The learned Public Prosecutor, on instructions, submits\nthat no other cases are reported against the petitioners.\n\n7.1 have given my anxious consideration to the submissions\nmade across the bar and I have also gone through the\nmaterials on record.\n\n8.The victim has sworn to an affidavit wherein it is asserted\nthat he has no objection in allowing the petition and in\nquashing the proceedings as all the disputed between the\nparties have been resolved and the parties are living in\npeace and harmony. The pendency of the Criminal\nproceeding will act as a hindrance to the peace and\nharmony which prevail between the parties.\n\nBn\napa\n2016/KER/33660\n\nCri.M.C. No.4140 of 2016\n\n-4-\n\n9.It appears to me that the offence is entirely personal in\nnature and do not affect public peace or tranquility. It is\nalso felt that quashing of proceedings on account of\ncompromise would bring about peace. In a case such as\nthe instant one, even if the prosecution is allowed to\ncontinue, it would not serve any purpose as the possibility\nof conviction is remote and bleak. It can only result in\nputting the de facto complainant and the accused to\nunwanted oppression and prejudice. Settlement will\naugur well for the interest of the community and will\nenable the parties to live in peace and harmony.\n\n10.1 am of the view that this Court is well justified in\nquashing the impugned proceedings as the instant case\nfalls within the matrix of guidelines issued by the Apex\nCourt in Gian Singh (Supra) and the other cases referred\nto above.\n\nne ‘a\npoe\nape\n2016/KER/33660\nCri.M.C. No.4140 of 2016\n-5-\nIn the result, this petition is allowed. All further\nproceedings against the petitioners, who are the accused\nNos.1 and 2 in C.C.No.3003 of 2013 of the Judicial\nMagistrate of First Class-I, Hosdurg, shall stand quashed",
    "full_text": "ae i]\n= ae\n+; Lat .\nrrapuseeea es\n2016/KER/33660\nIN THE HIGH COURT OF KERALA AT ERNAKULAM\nPRESENT:\nTHE HONOURABLE MR. JUSTICE RAJA VIJAYARAGHAVAN V\nMONDAY, THE 1ST DAY OF AUGUST 2016/10TH SRAVANA, 1938\nCri.MC.No. 4140 of 2016 ()\nCC.NO. 3003/2013 OF JUDICIAL FIRST CLASS MAGISTRATE COURT-I, HOSDURG\nCRIME NO. 76/2013 OF CHANDERA POLICE STATION,KASARGOD DISTRICT\nPETITIONER(S)/[ACCUSED 1 & 2:\n1. M.K.MUHAMMED ALI,\nAGED 52 YEARS, S/O.V.K.MOOSA,\nMADAKKAL KURUPPILAKATH,\nUDUMBUMTHALA P.O, SOUTH THRIKARIPUR,\nHOSDURG, KASARAGOD DT.\n2. AJEER, S/O. MUHAMMED ALI,\nMADAKKAL KURUPPILAKATH,\nUDUMBUMTHALA P.O, SOUTH THRIKARIPUR,\nHOSDURG, KASARAGOD DT.\nBY ADVS.SRI.K.R.AVINASH (KUNNATH)\nSRILABDUL RAOOF PALLIPATH\nRESPONDENT(S)/DEFACTO COMPLAINANTS & STATE:\n1. M.K.SAYED, AGED 39 YEARS, S/O.USMAN HAJI,\nMADAKKAL KURUPPILAKATH,\nUDUMBUMTHALA P.O, SOUTH THRIKARIPUR,\nHOSDURG, KASARAGOD -671 315.\n2. STATE OF KERALA,\nREPRESENTED BY THE STATION HOUSE OFFICER,\nCHANDERA POLICE STATION,\nTHOUGH PUBLIC PORSECUTOR, HIGH COURT OF KERALA,\nERNAKULAM -682 031.\nR1 BY ADV. SRI.C.H.ABDUL RASAC\nR2 BY PUBLIC PROSECUTOR SMT. PUSHPALATHA.WN.K.\nTHIS CRIMINAL MISC. CASE HAVING COME UP FOR ADMISSION\nON 01-08-2016, THE COURT ON THE SAME DAY PASSED THE FOLLOWING:\nsts\n\neee\n= ae\n+; Lat .\n2016/KER/33660\nCri.MC.No. 4140 of 2016 ()\nAPPENDIX\nPETITIONER(S)’ ANNEXURES:\nANNEXURE Ai TRUE COPY OF THE FINAL REPORT IN CRIME NO.76/13 OF\nCHANDERA POLICE STATION, KASARGOD.\nANNEXURE A2 TRUE COPY OF THE AFFIDAVIT SWORN IN BY RESPONDENT NO.1\nRESPONDENT(S)’ ANNEXURES: NIL\nITRUE COPY/\nP.A.TO JUDGE\nsts\n\n2016/KER/33660\nRAJA VIJAYARAGHAVAN, V., J.\nDated this the 1% day of August, 2016\nORDER\n\n1.The petitioners herein are the accused Nos. 1 and 2 in\nC.C.No.3003 of 2013 of the Judicial Magistrate of First\nClass-I, Hosdurg. They are charged with for having\ncommitted offence punishable under Section 506(i) read\nwith section 34 of the IPC. The 1* respondent is the\nvictim.\n\n2.The instant petition is filed under Section 482 of the Code\nof Criminal Procedure banking on the ratio of the\nJudgment rendered by the Apex Court in Gian Singh v.\nState of Punjab ( 2012 (4) KLT 108) and a series of\nother cases which include Narinder Singh and others v.\nState of Punjab and Another [2014) 6 SCC 466] and\n\nBn\napa\n2016/KER/33660\nCri.M.C. No.4140 of 2016\n-2-\n\nYogendra Yadav _ and others V_ State of Jharkhand\n(2014 (9) SCC 653 ) with a prayer to quash the above\nproceeding.\n\n3.The sole ground is that the Apex Court in the above\njudgments have delineated the circumstances and the\ncases in which inherent powers under Section 482 can be\ninvoked de hors section 320 of the Code of Criminal\nProcedure for recognizing out of court settlement for the\npurpose of quashing criminal proceedings. It is prayed\nthat powers under Section 482 of the Code of Criminal\nProcedure be invoked to quash the criminal proceedings .\n\n4.It is submitted that the parties have reached an out of\ncourt settlement and there is no acrimony between them\nat present. All the disputes have been amicably resolved\nand they desire to live in peace and harmony. The 1*\nrespondent has sworn to an affidavit wherein he asserts\n\nBn\napa\n2016/KER/33660\n\nCri.M.C. No.4140 of 2016\n\n-3-\nthat he has no objection in terminating the proceedings.\n5.The prosecution allegation is that on 10.8.2013 at about\n4.00 p.m., the petitioners had criminally intimidated the\n1** respondent and thus committed the offence.\n\n6.The learned Public Prosecutor, on instructions, submits\nthat no other cases are reported against the petitioners.\n\n7.1 have given my anxious consideration to the submissions\nmade across the bar and I have also gone through the\nmaterials on record.\n\n8.The victim has sworn to an affidavit wherein it is asserted\nthat he has no objection in allowing the petition and in\nquashing the proceedings as all the disputed between the\nparties have been resolved and the parties are living in\npeace and harmony. The pendency of the Criminal\nproceeding will act as a hindrance to the peace and\nharmony which prevail between the parties.\n\nBn\napa\n2016/KER/33660\n\nCri.M.C. No.4140 of 2016\n\n-4-\n\n9.It appears to me that the offence is entirely personal in\nnature and do not affect public peace or tranquility. It is\nalso felt that quashing of proceedings on account of\ncompromise would bring about peace. In a case such as\nthe instant one, even if the prosecution is allowed to\ncontinue, it would not serve any purpose as the possibility\nof conviction is remote and bleak. It can only result in\nputting the de facto complainant and the accused to\nunwanted oppression and prejudice. Settlement will\naugur well for the interest of the community and will\nenable the parties to live in peace and harmony.\n\n10.1 am of the view that this Court is well justified in\nquashing the impugned proceedings as the instant case\nfalls within the matrix of guidelines issued by the Apex\nCourt in Gian Singh (Supra) and the other cases referred\nto above.\n\nne ‘a\npoe\nape\n2016/KER/33660\nCri.M.C. No.4140 of 2016\n-5-\nIn the result, this petition is allowed. All further\nproceedings against the petitioners, who are the accused\nNos.1 and 2 in C.C.No.3003 of 2013 of the Judicial\nMagistrate of First Class-I, Hosdurg, shall stand quashed.\nSd/-\nRAJA VIJAYARAGHAVAN, V.\nJUDGE\nPs/3/8/16\n\n"
}