{
    "case_id": "",
    "court": "HIGH COURT OF KERALA AT ERNAKULAM",
    "date": "6TH DAY OF JANUARY 2021",
    "judge": "V.G.ARUN\nWEDNESDAY",
    "petitioners": [
        "AJITH KUMAR",
        "AGED 37 YEARS",
        "S/O. PARAMESWARAN PILLAI, REGHUSMRITHI HOUSE,NEAR NSS",
        "KARAYOGAM, PERINAD VILLAGE, KOLLAM DISTRICT."
    ],
    "respondents": [
        "S:",
        "1 STATE OF KERALA",
        "REPRESENTED BY THE PUBLIC PROSECUTOR, HIGH COURT OF",
        "KERALA, ERNAKULAM.",
        "2 BALAN",
        "S/O. KUMARAN, ADDITIONAL SUB INSPECTOR OF POLICE,",
        "TRAFFIC POLICE STATION, KOLLAM DISTRICT, RESIDING AT",
        "KAVUMVATHUKKAL VEEDU, KAHADEVA NAGAR -54, NEAR JOLLY",
        "JUNCTION, VALATHUNGAL CHERY, ERAVIPURAM VILLAGE,",
        "KOLLAM DISTRICT.",
        "SR.PP.C.S.HRITHWIK"
    ],
    "sections": [],
    "outcome": "",
    "full_text": "Bisel\nets Stet]\nok 4 te\nIN THE HIGH COURT OF KERALA AT ERNAKULAM 2021/KER/704\nPRESENT\nTHE HONOURABLE MR.JUSTICE V.G.ARUN\nWEDNESDAY, THE O6TH DAY OF JANUARY 2021 / 16TH POUSHA, 1942\nCr1.MC.No.221 OF 2015\nCRIME NO.767/2014 OF Kollam East Police Station , Kollam\nPETITIONER:\nAJITH KUMAR\nAGED 37 YEARS\nS/O. PARAMESWARAN PILLAI, REGHUSMRITHI HOUSE,NEAR NSS\nKARAYOGAM, PERINAD VILLAGE, KOLLAM DISTRICT.\nBY ADV. SMT.G.VIDYA\nRESPONDENTS:\n1 STATE OF KERALA\nREPRESENTED BY THE PUBLIC PROSECUTOR, HIGH COURT OF\nKERALA, ERNAKULAM.\n2 BALAN\nS/O. KUMARAN, ADDITIONAL SUB INSPECTOR OF POLICE,\nTRAFFIC POLICE STATION, KOLLAM DISTRICT, RESIDING AT\nKAVUMVATHUKKAL VEEDU, KAHADEVA NAGAR -54, NEAR JOLLY\nJUNCTION, VALATHUNGAL CHERY, ERAVIPURAM VILLAGE,\nKOLLAM DISTRICT.\nSR.PP.C.S.HRITHWIK\nTHIS CRIMINAL MISC. CASE HAVING COME UP FOR ADMISSION ON\n06.01.2021, THE COURT ON THE SAME DAY PASSED THE FOLLOWING:\n\nCrme 221/2015 > 2021/KER/704\nV.G.ARUN, J.\n- GrLM.C.No.221 of 2015.\nDated this the 6\" day of January, 2021\nORDER\n\nBeing a Crl.M.C of the year 2015, pertaining to a crime of 2014,\na report was called for, from the jurisdictional Magistrate Court. It is\nreported that pending the Crl.MC, the investigation of the crime was\ncompleted, final report filed and cognizance taken as C.C.No.2414 of\n2015 by JFCM-II, Kollam. It is reported that the case was notified on\n30.12.2019 and summons ordered to the accused on 20.10.2020. The\ncase now stands posted to 22.12.2020 awaiting return of summons.\nThe Crl.M.C having been filed challenging registration of FIR and\nfurther proceedings in Crime No.767 0 2019 of Kollam East Police\nStation, nothing survives for consideration in the Crl.M.C, due to the\nsubsequent events mentioned above. Hence the Crl.M.C is dismissed,\nwithout prejudice to the petitioner's right to agitate and raise all\ncontentions before the jurisdictional court.\n\nSd/-\nV.G.ARUN\nJUDGE\n\nlgk\n\nS :\nSie Stet]\nBz 5 ie\nCrmc 221/2015 3 2021/KER/704\nAPPENDIX\nPETITIONER'S ANNEXURES:\nANNEXURE -1 CERTIFIED COPY OF FIR IN CRIME NO.767/2014 OF KOLLAM\nEAST POLICE STATION IN KOLLAM DISTRICT, DATED 21.04.2014.\nANNEXURE -2 THE TRUE COPY OF THE FIR IN CRIME NO.768/2014 OF KOLLAM\nEAST POLICE STATION IN KOLLAM, DATED 21.04.2014.\nANNEXURE -3 TRUE COPY OF THE NEWS REPORTED IN DESHABHIMANT DAILY\nDATED 22.04.2014.\nANNEXURE-4 TRUE COPY OF DISCHARGE CARD ISSUED BY THE DISTRICT HOSPITAL\nKOLLAM DATED 26.04.2014.\nANNEXURE-5 TRUE COPY OF TREATMENT CERTIFICATE ISSUED BY THE\nDISTRICT HOSPITAL, KOLLAM DATED 22.04.2014.\nANNEXURE-6 TRUE COPY OF ACCIDENT REGISTER-CUM-WOULD CERTIFICATE\nDATED 22.05.2014.\nANNEXURE-7 TRUE COPY OF TREATMENT SUMMARY ISSUED BY THE DISTRICT\nHOSPITAL, KOLLAM DATED 28.04.2014.\n\n"
}