{
    "case_id": "",
    "court": "HIGH COURT OF KERALA AT ERNAKULAM",
    "date": "4TH DAY OF JANUARY 2021",
    "judge": "V.G.ARUN\nMONDAY",
    "petitioners": [
        "S :",
        "1 LIKHIL T.G.",
        "AGED 35 YEARS",
        "$/O.GOVINDAN, THAIPARAMBIL HOUSE, MUTTITHADI P.O.,",
        "KALOOR ALANGAD, THRISSUR.",
        "2 GOVINDAN",
        "AGED 70 YEARS",
        "S/O.SANKUNNI, THAIPARAMBIL HOUSE, MUTTITHADI P.O.,",
        "KALOOR ALANGAD, THRISSUR.",
        "3 RATNABHAT",
        "AGED 57 YEARS",
        "W/O.GOVINDAN, THAIPARAMBIL HOUSE, MUTTITHADI P.O.,",
        "KALOOR ALANGAD, THRISSUR.",
        "4 LEKHA",
        "D/O.GOVINDAN, THAIPARAMBIL HOUSE, MUTTITHADI P.O.,",
        "KALOOR ALANGAD, THRISSUR."
    ],
    "respondents": [
        "S:",
        "1 STATE OF KERALA",
        "REP.BY THE PUBLIC PROSECUTOR, HIGH COURT OF KERALA.",
        "2 RAKHI V.R.",
        "AGED 24 YEARS",
        "D/O.RAMAKRISHNAN, VAKAYIL HOUSE, ASHTAMICHIRA P.O.,",
        "THRISSUR DISTRICT.",
        "PP RENJITH T.R."
    ],
    "sections": [
        "406",
        "498A",
        "50"
    ],
    "outcome": "",
    "full_text": "Ep cael\nPeet eee\npci\nIN THE HIGH COURT OF KERALA AT ERNAKULAM 2021/KER/O\nPRESENT\nTHE HONOURABLE MR.JUSTICE V.G.ARUN\nMONDAY, THE O4TH DAY OF JANUARY 2021 / 14TH POUSHA, 1942\nCri .MC.No.756 OF 2015\nCRIME NO.836/2014 OF Varandarappally Police Station , Thrissur\nPETITIONERS :\n1 LIKHIL T.G.\nAGED 35 YEARS\n$/O.GOVINDAN, THAIPARAMBIL HOUSE, MUTTITHADI P.O.,\nKALOOR ALANGAD, THRISSUR.\n2 GOVINDAN\nAGED 70 YEARS\nS/O.SANKUNNI, THAIPARAMBIL HOUSE, MUTTITHADI P.O.,\nKALOOR ALANGAD, THRISSUR.\n3 RATNABHAT\nAGED 57 YEARS\nW/O.GOVINDAN, THAIPARAMBIL HOUSE, MUTTITHADI P.O.,\nKALOOR ALANGAD, THRISSUR.\n4 LEKHA\nD/O.GOVINDAN, THAIPARAMBIL HOUSE, MUTTITHADI P.O.,\nKALOOR ALANGAD, THRISSUR.\nBY ADV. SHRI.K.B.GANGESH\nRESPONDENTS:\n1 STATE OF KERALA\nREP.BY THE PUBLIC PROSECUTOR, HIGH COURT OF KERALA.\n2 RAKHI V.R.\nAGED 24 YEARS\nD/O.RAMAKRISHNAN, VAKAYIL HOUSE, ASHTAMICHIRA P.O.,\nTHRISSUR DISTRICT.\nPP RENJITH T.R.\nTHIS CRIMINAL MISC. CASE HAVING COME UP FOR ADMISSION ON\n04.01.2021, THE COURT ON THE SAME DAY PASSED THE FOLLOWING:\n\nCrmc 756/2015 2 2021/KERI6\nV.G.ARUN, J.\n- GrLM.C.No.756 of 2015.\nDated this the 4\" day of January, 2021\nORDER\nBeing a Crl.M.C of the year 2015, pertaining to a crime of 2014,\na report was called for, from the jurisdictional Magistrate Court. It is\nreported that cognizance was taken for offences punishable under\nSection 406, 498A, 50(i), 294(b) and 420 r/w 34 IPC and the case\nnumbered as C.C.No.9093 of 2014 on the files of the JFCM,\nIrinjalakkuda. After trial, the petitioners(accused 1 to 4) were\nacquitted under Section 248(1) Cr.P.C, as per judgment dated\n04.04.2017.\nIn view of this subsequent development, the Crl.M.C is closed.\nSd/-\nV.G.ARUN\nJUDGE\nlgk\n\nFF4.\nH ALE\noe ae\npecans\nCrmc 756/2015 3 2021/KER/6\nAPPENDIX\nPETITIONER'S/S EXHIBITS:\nANNEXURE Al CERTIFIED COPY OF THE FIR IN CRIME\nNO.836/2014 OF VARATHARAPPILLY POLICE\nSTATION.\nANNEXURE A2 TRUE COPY OF THE PETITION FOR DIVORCE-\nOP NO.1107/2012 FILED BY THE 1ST\nACCUSED BEFORE FAMILY COURT,\nIRINJALAKKUDA.\nANNEXURE A3 TRUE COPY OF FIR IN CRIME NO.1991/2012\nOF PUTHUKKAD POLICE STATION.\nANNEXURE A4 TRUE COPY OF FINAL REPORT IN CRIME\nNO.1991/2012 OF PUTHUKKAD POLICE\nSTATION.\n\n"
}