{
    "case_id": "CRL.MC.NO. 1846 OF 2019",
    "court": "HIGH COURT OF KERALA AT ERNAKULAM\nPRESENT\nTHE HONOURABLE MR",
    "date": "6TH DAY OF JANUARY 2020",
    "judge": "ASHOK MENON\nMONDAY",
    "petitioners": [
        "S/ACCUSED NOS.:",
        "1 AKSHAY,",
        "AGED 19 YEARS,",
        "S/O.RAVINDRANATH, PALLATHU HOUSE,",
        "DOWNHILL VALIYAPARAMBU, MALAPPURAM.",
        "2 MUJEEB RAHMAN,",
        "AGED 21 YEARS,",
        "S/O.HAMSA, MUKKATTIL HOUSE, K.PURAM, THANOOR,",
        "THANALOOR, MALAPPURAM.",
        "3 ARAVINDU SAI,",
        "AGED 18 YEARS,",
        "S/O.SUBHASAN, PUTHANVEETIL HOUSE, CHERUVAYOOR.P.O.,",
        "VAZHAKKAD, MALAPPURAM."
    ],
    "respondents": [
        "S/COMPLAINANT :",
        "1 STATE OF KERALA,",
        "REPRESENTED BY PUBLIC PROSECUTOR,",
        "HIGH COURT OF KERALA, ERAKULAM-682 031.",
        "2 IBRAHIM,",
        "AGED 41 YEARS,S/O.MUHAMMED,, KANJHIRAMKUTH HOUSE,",
        "KONDOTTY POST, MALAPPURAM DISTRICT- 673 638",
        "RAMESH CHAND-P.P",
        "R2 BY ADV. A.ARUNKUMAR"
    ],
    "sections": [
        "341",
        "323",
        "326 read with\nSection 34 of the IPC"
    ],
    "outcome": "ORDER/JUDGMENT IN CC.NO. 1323/2018 OF JUDICIAL\nMAGISTRATE OF FIRST CLASS ,MALAPPURAM\nCRIME NO.333/2018 OF Malappuram Police Station , Malappuram\nPETITIONERS/ACCUSED NOS.:\n1 AKSHAY,\nAGED 19 YEARS,\nS/O.RAVINDRANATH, PALLATHU HOUSE,\nDOWNHILL VALIYAPARAMBU, MALAPPURAM.\n2 MUJEEB RAHMAN,\nAGED 21 YEARS,\nS/O.HAMSA, MUKKATTIL HOUSE, K.PURAM, THANOOR,\nTHANALOOR, MALAPPURAM.\n3 ARAVINDU SAI,\nAGED 18 YEARS,\nS/O.SUBHASAN, PUTHANVEETIL HOUSE, CHERUVAYOOR.P.O.,\nVAZHAKKAD, MALAPPURAM.\nBY ADV. SRI.S.SHYAM KUMAR\nSTATE /RESPONDENTS/COMPLAINANT :\n1 STATE OF KERALA,\nREPRESENTED BY PUBLIC PROSECUTOR,\nHIGH COURT OF KERALA, ERAKULAM-682 031.\n2 IBRAHIM,\nAGED 41 YEARS,S/O.MUHAMMED,, KANJHIRAMKUTH HOUSE,\nKONDOTTY POST, MALAPPURAM DISTRICT- 673 638\nRAMESH CHAND-P.P\nR2 BY ADV. A.ARUNKUMAR\nTHIS CRIMINAL MISC. CASE HAVING COME UP FOR ADMISSION ON\n06.01.2020, THE COURT ON THE SAME DAY PASSED THE FOLLOWING:\n\nope\nCRL.MC.NO. 1846 OF 2019 2 2020/KER/14\nORDER\nDated this the 06\" day of January, 2020\n\nThe petitioners are accused in Crime.No.333/2018 of\nMalappuram Police Station presently pending as\nC.C.No.1323/2018 on the files of the Judicial First Class\nMagistrate Court, Malappuram for having allegedly committed\noffences punishable under Sections 341, 323 and 326 read with\nSection 34 of the IPC. The only injured is the 2\" respondent who\nhas appeared through counsel and filed an affidavit to the effect\nthat the matter has been amicably settled with the petitioners.\nHe has no grievance against the petitioners. The injury sustained\nis not life threatening. The petitioners do not have any criminal\nantecedents. A report has been filed by the Investigating Officer\nthrough the learned Public Prosecutor.\n\nIn the result, the Crl.MC is allowed and the entire\nproceedings in C.C.No.1323/2018 on the files of the Judicial First\nClass Magistrate Court, Malappuram stands quashed",
    "full_text": "24 1\nBeene\nHaat\nBP) * =\n2020/KER/14\nIN THE HIGH COURT OF KERALA AT ERNAKULAM\nPRESENT\nTHE HONOURABLE MR. JUSTICE ASHOK MENON\nMONDAY, THE O6TH DAY OF JANUARY 2020 / 16TH POUSHA, 1941\nCr1.MC.No.1846 OF 2019 (A)\nAGAINST THE ORDER/JUDGMENT IN CC.NO. 1323/2018 OF JUDICIAL\nMAGISTRATE OF FIRST CLASS ,MALAPPURAM\nCRIME NO.333/2018 OF Malappuram Police Station , Malappuram\nPETITIONERS/ACCUSED NOS.:\n1 AKSHAY,\nAGED 19 YEARS,\nS/O.RAVINDRANATH, PALLATHU HOUSE,\nDOWNHILL VALIYAPARAMBU, MALAPPURAM.\n2 MUJEEB RAHMAN,\nAGED 21 YEARS,\nS/O.HAMSA, MUKKATTIL HOUSE, K.PURAM, THANOOR,\nTHANALOOR, MALAPPURAM.\n3 ARAVINDU SAI,\nAGED 18 YEARS,\nS/O.SUBHASAN, PUTHANVEETIL HOUSE, CHERUVAYOOR.P.O.,\nVAZHAKKAD, MALAPPURAM.\nBY ADV. SRI.S.SHYAM KUMAR\nSTATE /RESPONDENTS/COMPLAINANT :\n1 STATE OF KERALA,\nREPRESENTED BY PUBLIC PROSECUTOR,\nHIGH COURT OF KERALA, ERAKULAM-682 031.\n2 IBRAHIM,\nAGED 41 YEARS,S/O.MUHAMMED,, KANJHIRAMKUTH HOUSE,\nKONDOTTY POST, MALAPPURAM DISTRICT- 673 638\nRAMESH CHAND-P.P\nR2 BY ADV. A.ARUNKUMAR\nTHIS CRIMINAL MISC. CASE HAVING COME UP FOR ADMISSION ON\n06.01.2020, THE COURT ON THE SAME DAY PASSED THE FOLLOWING:\n\nope\nCRL.MC.NO. 1846 OF 2019 2 2020/KER/14\nORDER\nDated this the 06\" day of January, 2020\n\nThe petitioners are accused in Crime.No.333/2018 of\nMalappuram Police Station presently pending as\nC.C.No.1323/2018 on the files of the Judicial First Class\nMagistrate Court, Malappuram for having allegedly committed\noffences punishable under Sections 341, 323 and 326 read with\nSection 34 of the IPC. The only injured is the 2\" respondent who\nhas appeared through counsel and filed an affidavit to the effect\nthat the matter has been amicably settled with the petitioners.\nHe has no grievance against the petitioners. The injury sustained\nis not life threatening. The petitioners do not have any criminal\nantecedents. A report has been filed by the Investigating Officer\nthrough the learned Public Prosecutor.\n\nIn the result, the Crl.MC is allowed and the entire\nproceedings in C.C.No.1323/2018 on the files of the Judicial First\nClass Magistrate Court, Malappuram stands quashed under\nSection 482 of the Cr.P.C and the accused are discharged.\n\nSd/-\nASHOK MENON\nJUDGE\nasm\n\n| Eps orl]\neae\nBP) * E.\nCRL.MC.NO. 1846 OF 2019 3 2020/KER/14\nAPPENDIX\nEXHIBITS:\nANNEXURE Al CERTIFIED COPY OF THE COMPLAINT.\nANNEXURE AITI CERTIFIED COPY OF THE FIR IN CRIME\nNO.333 OF 2018 OF MALAPPURAM POLICE\nSTATION.\nANNEXURE AIII CERTIFIED COPY OF THE FINAL REPORT.\nANNEXURE AIV AFFIDAVIT OF THE 2ND RESPONDENT\nENDORSING THE FACTUM OF COMPOUNDING OF\nTHE SAID OFFENCES AND THE SETTLEMENT OF\nTHE DISPUTES.\n// True Copy// PA to Judge\n\n"
}