{
    "case_id": "Crl.MC.No. 1627 of 2016",
    "court": "HIGH COURT OF KERALA AT ERNAKULAM\nPRESENT",
    "date": "4TH DAY OF AUGUST 2016",
    "judge": "SUNIL THOMAS\nTHURSDAY",
    "petitioners": [
        "(S) /ACCUSED:",
        "SASI KUMAR",
        "S/O.THAZHATHU NARAYANAN, AGED 47,",
        "CHELOOR 680 121, THRISSUR DISTRICT."
    ],
    "respondents": [
        "(S) /DEFACTO COMPLAINANT & COMPLAINANT:",
        "1. PREETHI",
        "D/O.KUMARAN KUNNATH BALASUBRAMANIAN,",
        "AGED ABOUT 39,",
        "KOLAZHI P.O., 680 010,",
        "THRISSUR DISTRICT.",
        "2. S I OF POLICE",
        "VIYYOOR, KOLAZHI P.O. 680 010,",
        "THRISSUR DISTRICT.",
        "*ADDL.R3 TO R8 IMPLEADED",
        "ADDITIONAL RESPONDENTS 3 TO 8",
        "3. AMMINI AMMA, W/O.NARAYANAN, CHELUR, MANAVALASSERY",
        "VILLAGE, MUKUNDAPURAM TALUK",
        "4. SARADHA, D/O.NARAYANAN, CHELUR, MANAVALASSERY",
        "VILLAGE, MUKUNDAPURAM TALUK",
        "5. JAYANTHI, D/O.NARAYANAN, CHELUR, MANAVALASSERY",
        "VILLAGE, MUKUNDAPURAM TALUK",
        "6. GEETHA, D/O.NARAYANAN, CHELUR, MANAVALASSERY",
        "VILLAGE, MUKUNDAPURAM TALUK",
        "7. JAYAKUMAR, S/O.NARAYANAN, CHELUR, MANAVALASSERY",
        "VILLAGE, MUKUNDAPURAM TALUK"
    ],
    "sections": [],
    "outcome": "ORDER/JUDGMENT IN CC 320/2013 of J.M.F.C.-I, THRISSUR\nPETITIONER (S) /ACCUSED:\nSASI KUMAR\nS/O.THAZHATHU NARAYANAN, AGED 47,\nCHELOOR 680 121, THRISSUR DISTRICT.\nBY ADV. SMT.P.K.PRIYA\nRESPONDENT (S) /DEFACTO COMPLAINANT & COMPLAINANT:\n1. PREETHI\nD/O.KUMARAN KUNNATH BALASUBRAMANIAN,\nAGED ABOUT 39,\nKOLAZHI P.O., 680 010,\nTHRISSUR DISTRICT.\n2. S I OF POLICE\nVIYYOOR, KOLAZHI P.O. 680 010,\nTHRISSUR DISTRICT.\n*ADDL.R3 TO R8 IMPLEADED\nADDITIONAL RESPONDENTS 3 TO 8\n3. AMMINI AMMA, W/O.NARAYANAN, CHELUR, MANAVALASSERY\nVILLAGE, MUKUNDAPURAM TALUK\n4. SARADHA, D/O.NARAYANAN, CHELUR, MANAVALASSERY\nVILLAGE, MUKUNDAPURAM TALUK\n5. JAYANTHI, D/O.NARAYANAN, CHELUR, MANAVALASSERY\nVILLAGE, MUKUNDAPURAM TALUK\n6. GEETHA, D/O.NARAYANAN, CHELUR, MANAVALASSERY\nVILLAGE, MUKUNDAPURAM TALUK\n7. JAYAKUMAR, S/O.NARAYANAN, CHELUR, MANAVALASSERY\nVILLAGE, MUKUNDAPURAM TALUK\n\na\nBS Bape iae\nSeri\n2016/KER/34106\nCrl.MC.No. 1627 of 2016 ()}\n8. SINDHU, W/O.JAYAKUMAR, CHELUR, MANAVALASSERY\nVILLAGE, MUKUNDAPURAM TALUK\nARE IMPLEADED AS ADDL. R3 TO R8 AS PER ORDER DATED\n21.06.2016 IN CRL.M.A. NO.6116/2016 IN\nCRL.M.C.NO.1627/2016\nADDL. R3-R8 BY ADV. SMT.T.M.BINITHA\nR1 BY ADVS. SRI.SANTHOSH P.PODUVAL\nSMT .R.RAJITHA\nSMT .VINAYA V.NAIR\nR2 BY PUBLIC PROSECUTOR SMT.M.T.SHEEBA\nTHIS CRIMINAL MISC. CASE HAVING COME UP FOR ADMISSION ON\n04-08-2016, THE COURT ON THE SAME DAY PASSED THE FOLLOWING:\n\n§ :\n> are\ngaara rea\n2016/KER/34106\nCrl.MC.No. 1627 of 2016 ()\nAPPENDIX\nPETITIONER(S)' EXHIBITS\nANNEXURE Al COPY OF COMPLAINT DATED 13.9.2012 FILED BY 187\nRESPONDENT BEFORE THE COMMISSIONER OF POLICE,\nTHRISSUR\nANNEXURE A2 TRUE COPY OF COMMON JUDGMENT DATED 18.11.2014 IN OP\n2159/2010, 2197/2010, 9/2011, 14/2011, 2008/2012\nAND 4/2013 IN FAMILY COURT, THRISSUR.\nANNEXURE A3 TRUE COPY OF JUDGMENT DATED 9.6.2015 IN MAT APPEAL\n1152/2014\nRESPONDENT (S)' EXHIBITS > NIL\n/TRUE COPY/\nP. A. TO JUDGE\nPn\n\nBel\n2016/KER/34106\nSUNIL THOMAS, J.\nDated this the 4\" day of August, 2016\nORDER\n\nThe petitioner seeks to quash all further proceedings arising\nfrom Annexure 1, now pending before the Judicial First Class\nMagistrate Court - 1, Thrissur as C.C.No.320/2013. It seems that,\nthere were several disputes between the petitioner herein and the\n1* respondent. One of the case was disposed of by this Court by\nAnnexure A3 judgment, pursuant to the settlement arrived at in a\nmediation.\n\n2. | When the matter was taken up, learned counsel for the\npetitioner submitted that, all amounts payable by the petitioner\nherein has been directly paid through the trial court. Since the 1*\nrespondent was appearing through Mr.Santhosh Poduval in the\nother connected cases, notice on R1 was served on Mr.Santhosh\nPoduval, who appeared and submitted that, the entire amounts\ndue have been received. Respondents 3 to 8 are represented by\nanother counsel.\n\n3. Having heard all the counsel, | am satisfied that the\ndisputes have been settled to the satisfaction to the parties. In\n\nBerl\npea\n2016/KER/34106\nCri. M. C. No. 1627 of 2016 2\nthe light of the above, all further proceedings in C.C.No.320/2013\npending before the Judicial First Class Magistrate Court - 1,\nThrissur stand quashed",
    "full_text": "a\nBS Bape iae\nSeri\n2016/KER/34106\nIN THE HIGH COURT OF KERALA AT ERNAKULAM\nPRESENT:\nTHE HONOURABLE MR. JUSTICE SUNIL THOMAS\nTHURSDAY, THE 4TH DAY OF AUGUST 2016/13TH SRAVANA, 1938\nCr1l.MC.No. 1627 of 2016 ()\nAGAINST THE ORDER/JUDGMENT IN CC 320/2013 of J.M.F.C.-I, THRISSUR\nPETITIONER (S) /ACCUSED:\nSASI KUMAR\nS/O.THAZHATHU NARAYANAN, AGED 47,\nCHELOOR 680 121, THRISSUR DISTRICT.\nBY ADV. SMT.P.K.PRIYA\nRESPONDENT (S) /DEFACTO COMPLAINANT & COMPLAINANT:\n1. PREETHI\nD/O.KUMARAN KUNNATH BALASUBRAMANIAN,\nAGED ABOUT 39,\nKOLAZHI P.O., 680 010,\nTHRISSUR DISTRICT.\n2. S I OF POLICE\nVIYYOOR, KOLAZHI P.O. 680 010,\nTHRISSUR DISTRICT.\n*ADDL.R3 TO R8 IMPLEADED\nADDITIONAL RESPONDENTS 3 TO 8\n3. AMMINI AMMA, W/O.NARAYANAN, CHELUR, MANAVALASSERY\nVILLAGE, MUKUNDAPURAM TALUK\n4. SARADHA, D/O.NARAYANAN, CHELUR, MANAVALASSERY\nVILLAGE, MUKUNDAPURAM TALUK\n5. JAYANTHI, D/O.NARAYANAN, CHELUR, MANAVALASSERY\nVILLAGE, MUKUNDAPURAM TALUK\n6. GEETHA, D/O.NARAYANAN, CHELUR, MANAVALASSERY\nVILLAGE, MUKUNDAPURAM TALUK\n7. JAYAKUMAR, S/O.NARAYANAN, CHELUR, MANAVALASSERY\nVILLAGE, MUKUNDAPURAM TALUK\n\na\nBS Bape iae\nSeri\n2016/KER/34106\nCrl.MC.No. 1627 of 2016 ()}\n8. SINDHU, W/O.JAYAKUMAR, CHELUR, MANAVALASSERY\nVILLAGE, MUKUNDAPURAM TALUK\nARE IMPLEADED AS ADDL. R3 TO R8 AS PER ORDER DATED\n21.06.2016 IN CRL.M.A. NO.6116/2016 IN\nCRL.M.C.NO.1627/2016\nADDL. R3-R8 BY ADV. SMT.T.M.BINITHA\nR1 BY ADVS. SRI.SANTHOSH P.PODUVAL\nSMT .R.RAJITHA\nSMT .VINAYA V.NAIR\nR2 BY PUBLIC PROSECUTOR SMT.M.T.SHEEBA\nTHIS CRIMINAL MISC. CASE HAVING COME UP FOR ADMISSION ON\n04-08-2016, THE COURT ON THE SAME DAY PASSED THE FOLLOWING:\n\n§ :\n> are\ngaara rea\n2016/KER/34106\nCrl.MC.No. 1627 of 2016 ()\nAPPENDIX\nPETITIONER(S)' EXHIBITS\nANNEXURE Al COPY OF COMPLAINT DATED 13.9.2012 FILED BY 187\nRESPONDENT BEFORE THE COMMISSIONER OF POLICE,\nTHRISSUR\nANNEXURE A2 TRUE COPY OF COMMON JUDGMENT DATED 18.11.2014 IN OP\n2159/2010, 2197/2010, 9/2011, 14/2011, 2008/2012\nAND 4/2013 IN FAMILY COURT, THRISSUR.\nANNEXURE A3 TRUE COPY OF JUDGMENT DATED 9.6.2015 IN MAT APPEAL\n1152/2014\nRESPONDENT (S)' EXHIBITS > NIL\n/TRUE COPY/\nP. A. TO JUDGE\nPn\n\nBel\n2016/KER/34106\nSUNIL THOMAS, J.\nDated this the 4\" day of August, 2016\nORDER\n\nThe petitioner seeks to quash all further proceedings arising\nfrom Annexure 1, now pending before the Judicial First Class\nMagistrate Court - 1, Thrissur as C.C.No.320/2013. It seems that,\nthere were several disputes between the petitioner herein and the\n1* respondent. One of the case was disposed of by this Court by\nAnnexure A3 judgment, pursuant to the settlement arrived at in a\nmediation.\n\n2. | When the matter was taken up, learned counsel for the\npetitioner submitted that, all amounts payable by the petitioner\nherein has been directly paid through the trial court. Since the 1*\nrespondent was appearing through Mr.Santhosh Poduval in the\nother connected cases, notice on R1 was served on Mr.Santhosh\nPoduval, who appeared and submitted that, the entire amounts\ndue have been received. Respondents 3 to 8 are represented by\nanother counsel.\n\n3. Having heard all the counsel, | am satisfied that the\ndisputes have been settled to the satisfaction to the parties. In\n\nBerl\npea\n2016/KER/34106\nCri. M. C. No. 1627 of 2016 2\nthe light of the above, all further proceedings in C.C.No.320/2013\npending before the Judicial First Class Magistrate Court - 1,\nThrissur stand quashed.\nCrl.M.C. stands disposed of accordingly.\nSd/-\nSUNIL THOMAS, JUDGE.\n\nPn\n\n"
}