{
    "case_id": "Crl.MC.No. 8939 of 2018",
    "court": "HIGH COURT OF KERALA AT ERNAKULAM",
    "date": "3RD DAY OF JANUARY 2019",
    "judge": "K.ABRAHAM MATHEW\nTHURSDAY",
    "petitioners": [
        "ACCUSED :-",
        "1 JAMES JOHN",
        "AGED 70 YEARS",
        "S/O. PAILY YOHANNAN ,",
        "MANJUMMELRKUDIYIL HOUSE, SOUTH KOTTAPADI,",
        "KOTHAMANGALAM TALUK, ERNAKULAM DISTRICT.",
        "2 BASIL JAMES,",
        "AGED 41 YEARS",
        "S/O. JAMES JOHN,",
        "MANJUMMELKUDIYIL HOUSE, SOUTH KOTTAPADI,",
        "KOTHAMANGALAM TALUK, ERNAKULAM DISTRICT."
    ],
    "respondents": [
        "S/STATE & COMPLAINANT :-",
        "1 STATE OF KERALA",
        "REPRESENTED BY THE PUBLIC PROSECUTOR, HIGH COURT OF",
        "KERALA, ERNAKULAM THROUGH THE SUB INSPECTOR OF",
        "POLICE, ERNAKULAM TOWN NORTH POLICE STATION, COCHIN-",
        "682018",
        "2 SHIRASTADAR,",
        "FAMILY COURT ERNAKULAM, COURT COMPLEX,",
        "ERNAKULAM , COCHIN-682011.",
        "SRI ALEX M THOMBRA- PUBLIC PROSECUTOR"
    ],
    "sections": [],
    "outcome": "",
    "full_text": "Elie |\n| Ct ae\nIN THE HIGH COURT OF KERALA AT ERNAKULAM 2019/KER/S2\nPRESENT\nTHE HONOURABLE MR. JUSTICE K.ABRAHAM MATHEW\nTHURSDAY ,THE O3RD DAY OF JANUARY 2019 / 13TH POUSHA, 1940\nCr1.MC.No. 8939 of 2018\nIN cc 1042/2017 of ADDL.CHIEF JUDICIAL MAGISTRATE, ERNAKULAM\nCRIME NO. 804/2016 OF Ernakulam North Police Station , Ernakulam\nPETITIONER/ACCUSED :-\n1 JAMES JOHN\nAGED 70 YEARS\nS/O. PAILY YOHANNAN ,\nMANJUMMELRKUDIYIL HOUSE, SOUTH KOTTAPADI,\nKOTHAMANGALAM TALUK, ERNAKULAM DISTRICT.\n2 BASIL JAMES,\nAGED 41 YEARS\nS/O. JAMES JOHN,\nMANJUMMELKUDIYIL HOUSE, SOUTH KOTTAPADI,\nKOTHAMANGALAM TALUK, ERNAKULAM DISTRICT.\nBY ADVS.\nSRI .R.SREEHART\nSRI.SACHIN VYAS\nRESPONDENTS/STATE & COMPLAINANT :-\n1 STATE OF KERALA\nREPRESENTED BY THE PUBLIC PROSECUTOR, HIGH COURT OF\nKERALA, ERNAKULAM THROUGH THE SUB INSPECTOR OF\nPOLICE, ERNAKULAM TOWN NORTH POLICE STATION, COCHIN-\n682018\n2 SHIRASTADAR,\nFAMILY COURT ERNAKULAM, COURT COMPLEX,\nERNAKULAM , COCHIN-682011.\nSRI ALEX M THOMBRA- PUBLIC PROSECUTOR\nTHIS CRIMINAL MISC. CASE HAVING COME UP FOR ADMISSION ON\n03.01.2019, THE COURT ON THE SAME DAY PASSED THE FOLLOWING:\n\nBe\nCrl.MC.No. 8939 of 2018 201KER/TS2\n2\nORDER\n\nLearned counsel appearing for the\npetitioners seeks permission to withdraw this\npetition with liberty to file another petition if it\nbecome necessary.\n\nPermission granted.\n\nAccordingly, this Crl.M.C is dismissed as\nwithdrawn reserving liberty with the petitioners to\nfile another petition if it becomes necessary.\n\nSd/-\nK.ABRAHAM MATHEW\nJUDGE\nSMA\n\n"
}