{
    "case_id": "Crl.MC.No. 9087 of 2016",
    "court": "HIGH COURT OF KERALA AT BRNAKULAM\nPRESENT",
    "date": "27TH DAY OF DECEMBER 2016",
    "judge": "K.P.JYOTHINDRANATH\nTUESDAY",
    "petitioners": [
        "(S) /PETITIONER/ACCUSED NO.2:",
        "RAJESH, AGED 36 YEARS, S/O.MANICKAN, NO. 3/140,",
        "AVILCHINNAPALAYAM, JAMIN KOTTAMPADI,",
        "SAMATHOOR, POLLACHI, TAMIL NADU STATE."
    ],
    "respondents": [
        "(S) /RESPONDENT/COMPLAINANT :",
        "STATE OF KERALA",
        "REP. BY PUBLIC PROSECUTOR, HIGH COURT OF KERALA,",
        "ERNAKULAM."
    ],
    "sections": [
        "20"
    ],
    "outcome": "",
    "full_text": "Pee\none\nEee\n2016/KER/55578\nIN THE HIGH COURT OF KERALA AT BRNAKULAM\nPRESENT:\nTHE HONOURABLE MR. JUSTICE K.P.JYOTHINDRANATH\nTUESDAY, THE 27TH DAY OF DECEMBER 2016/6TH POUSHA, 1938\nCrl.MC.No. 9087 of 2016 ()\nAGAINST THE ORDER IN CRMP 3642/2016 OF THE COURT OF SESSION, PALAKKAD\nDIVISION DATED 17-12-2016\nCRIME NO. 1092/2016 OF PALAKKAD TOWN SOUTH POLICE STATION\nPETITIONER (S) /PETITIONER/ACCUSED NO.2:\nRAJESH, AGED 36 YEARS, S/O.MANICKAN, NO. 3/140,\nAVILCHINNAPALAYAM, JAMIN KOTTAMPADI,\nSAMATHOOR, POLLACHI, TAMIL NADU STATE.\nBY ADV. SRI.NIREESH MATHEW\nRESPONDENT (S) /RESPONDENT/COMPLAINANT :\nSTATE OF KERALA\nREP. BY PUBLIC PROSECUTOR, HIGH COURT OF KERALA,\nERNAKULAM.\nBY PUBLIC PROSECUTOR SMT.REKHA C. NAIR\nTHIS CRIMINAL MISC. CASE HAVING COME UP FOR ADMISSION ON\n27-12-2016, THE COURT ON THE SAME DAY PASSED THE FOLLOWING:\nBKA/-\n\nPal\none\nEee\n2016/KER/55578\nCr1.MC.No. 9087 of 2016 ()\nAPPENDIX\nPETITIONER (S)' EXHIBITS\nANNEXURE A COPY OF THE ORDER DATED 17.12.2016 IN CRL.M.P. NO.\n3642/2016 PASSED BY THE SESSIONS COURT, PALAKKAD\nANNEXURE B COPY OF THE CITATION, 1985 KHC 795 KESHAB NARAYANAN\nBANERJEE & ANOTHER VS. STATE OF BIHAR\nANNEXURE C COPY OF THE CITATION, 2010 KHC 6262 SYAMKUMAR VS.\nSTATE OF KERALA & ANOTHER\nANNEXURE D COPY OF THE CITATION, 2012(3) KHC 411 RAMAKRISHNA\nPILLAI & ANOTHER VS. STATE OF KERALA & ANOTHER\nRESPONDENT (S)' EXHIBITS NIL\n//TRUE COPY//\nPA TO JUDGE\nbka/-\n\nPal\n2016/KER/55578\nK.P. JYYOTHINDRANATH, J.\nDated this the 27\" day of December, 2016\nORDER\n1.This is a petition filed by the 2\"? accused in Crime\nNo.1092/2016 of Palakkad Town South Police Station.\nThe offence alleged is under Section 20(b)(ii)(B) of\nNarcotic Drugs and Psychotropic Substances Act, 1985.\nThe quantum of ganja involved is 10 kg.\n2.When default bail was granted by the lower court, a\ncondition was imposed that one of the sureties must be\none of his parents with landed properties. The\npetitioner is aggrieved by the said condition.\n3.It is submitted by the learned counsel for the petitioner\nthat the court below cannot suppose that the parents of\nthe petitioner are having landed properties. I see force\nin the said submission.\n4.Similarly, the petitioner is also aggrieved by the\ncondition that the original title deed of the properties\n\nPal\n2016/KER/55578\n\nCrl.M.C. No. 9087 of 2016\nalso should be produced by the sureties, not for\nperusal, but, has to be deposited. The petitioner is also\naggrieved by the condition to deposit %1,00,000/-\n(Rupees one lakh only) before the court below as cash\nsecurity while executing bond.\n\n5.Heard the learned Public Prosecutor as well.\n\n6.After hearing the learned Public Prosecutor, I feel that\nthe condition that one among the sureties shall be one\nof his parents with landed properties has to be\ninterfered with.\n\n7.The petitioner is aged 36 years and it is submitted that\nhis father is no more. After considering all these\naspects, the second condition imposed by the court\nbelow while granting bail in Crl.M.P. No.3642/2016 in\nCrime No.1092/2016 of Palakkad Town South Police\nStation is hereby deleted. The third condition imposed\nis modified to the extent that after perusal of the title\ndeeds by the court below, the said title deeds can be\nreturned on an undertaking to produce the same as and\n\nPeal\naaah\na\n2016/KER/55578\nCrl.M.C. No. 9087 of 2016\nwhen required. The petitioner shall also produce a\nphotocopy of the title deed at the time of execution of\nthe bond. I am not inclined to interfere with the 4‚Äù\ncondition imposed by the court below while granting\nbail.\n8.The Crl.M.C. is disposed of, as above.\nSd/-\nK.P. JYYOTHINDRANATH\nJUDGE\nbka/27.12.2016\n\n"
}