{
    "case_id": "",
    "court": "HIGH COURT OF KERALA AT ERNAKULAM\nPRESENT",
    "date": "5TH DAY OF MAY 2015",
    "judge": "P.UBAID\nTUESDAY",
    "petitioners": [
        "ACCUSED NO.3 AND 4:",
        "1. SAHITHA JAMAL, AGED 62 YEARS,",
        "W/O.JAMAL, MANADATH (VALIYAKUNNATH),",
        "EDAKKAD P.O., KOZHIKODE.",
        "2. SAFIYA BEEVI, AGED 70 YEARS,"
    ],
    "respondents": [
        "COMPLAINANT:"
    ],
    "sections": [],
    "outcome": "",
    "full_text": "eevee:\n2015/KER/17605\nIN THE HIGH COURT OF KERALA AT ERNAKULAM\nPRESENT:\nTHE HONOURABLE MR. JUSTICE P.UBAID\nTUESDAY, THE 5TH DAY OF MAY 2015/15TH VAISAKHA, 1937\nCri. MC.No. 2680 of 2015\nCC 908/2013 OF JUDICIAL FIRST CLASS MAGISTRATE COURT, VAIKOM\nCRIME NO. 1090/2011 OF VAIKOM POLICE STATION , KOTTAYAM\nPETITIONER(S)/ACCUSED NO.3 AND 4:\n1. SAHITHA JAMAL, AGED 62 YEARS,\nW/O.JAMAL, MANADATH (VALIYAKUNNATH),\nEDAKKAD P.O., KOZHIKODE.\n2. SAFIYA BEEVI, AGED 70 YEARS,\n\nW/O.ADV.KAIKARA SHAMSUDHEEN, KAIKARA HOUSE,\n\nULIYAKOVIL ROAD, CHINNAKKADA, KOLLAM.\n\nBY ADV. SRI.P.M.HABEEB\nRESPONDENT(S)/COMPLAINANT:\n\nSTATE OF KERALA,\n\nTHROUGH PUBLIC PROSECUTOR, HIGH COURT OF KERALA,\n\nERNAKULAM - 682 031, (STATION HOUSE OFFICER,\n\nVAIKOM POLICE STATION).\n\nBY SENIOR PUBLIC PROSECUTOR SRI.K.K.SAIDALAVI\n\nTHIS CRIMINAL MISC. CASE HAVING COME UP FOR ADMISSION ON\n\n05-05-2015, THE COURT ON THE SAME DAY PASSED THE FOLLOWING:\nmsv/\n\n2015/KER/17605\nP. UBAID, J.\nDated this the 5\" day of May, 2015\nORDER\nIn view of some mistakes in the proceeding, the learned\ncounsel seeks permission to withdraw the proceeding with\nliberty to file proper Crl.M.C. today itself.\nPermission is granted on submission. Accordingly, the\nCrl.M.C. is dismissed as withdrawn.\nSd/-\nP, UBAID, JUDGE\nsd\n\n"
}