{
    "case_id": "",
    "court": "HIGH COURT OF KERALA AT ERNAKULAM\nPRESENT",
    "date": "8TH DAY OF DECEMBER 2017",
    "judge": "MARY JOSEPH\nFRIDAY",
    "petitioners": [
        "ACCUSED IN CRIME NO. 176/13 OF CJM ERNAKULAM",
        "THOMAS JOHN KITHU, AGED 57,",
        "S/O.JOHN KITHU, KITHU HOUSE, KODANADU P. O VIA THIRURANBALAMN-682305"
    ],
    "respondents": [
        "STATE AND COMPLAINANT IN CRIME NO.176/13 OF CUM, ERNAKULAM",
        "4. STATE OF KERALA"
    ],
    "sections": [],
    "outcome": "",
    "full_text": "el\ncarte\nA core} ree\nBE] et\n2017/KER/49753\nIN THE HIGH COURT OF KERALA AT ERNAKULAM\nPRESENT:\nTHE HONOURABLE MRS. JUSTICE MARY JOSEPH\nFRIDAY, THE 8TH DAY OF DECEMBER 2017/17TH AGRAHAYANA, 1939\nCri.MC.No. 2351 of 2014 ()\nAGAINST THE ANNEXURE X IN CRIME NO. 176/2013 ON THE FILES OF CHIEF JUDICIAL\nMAGISTRATE COURT AT ERNAKULAM\nPETITIONER(S)/ACCUSED IN CRIME NO. 176/13 OF CJM ERNAKULAM\nTHOMAS JOHN KITHU, AGED 57,\nS/O.JOHN KITHU, KITHU HOUSE, KODANADU P. O VIA THIRURANBALAMN-682305\nBY ADVS.SRI.PRAVEEN K. JOY\nSRI.T.A.JOY\nRESPONDENT/STATE AND COMPLAINANT IN CRIME NO.176/13 OF CUM, ERNAKULAM\n4. STATE OF KERALA\nBY PUBLIC PROSECUTOR, HIGH COURT OF KERALA,ERNAKULAM,\nREP BY SI OF POLICE, KADAVANTHRA POLICE STATION- 686019\n2. M.P.SHYAM, AGED 53 YEARS,\nS/O.C.M.KRISHNAN, BHARGAVI NILAYAM, SATHRAM ROAD, DHARMADAM P. O.,\nTHALASSERY TALUK, KANNUR DIST- 671 106\nR BY PUBLIC PROSECUTOR. SMT. REHNA N.S\nR2 BY ADV. SRI.M.S.UNNIKRISHNAN\nTHIS CRIMINAL MISC. CASE HAVING BEEN FINALLY HEARD ON 08-12-2017, THE COURT\nON THE SAME DAY PASSED THE FOLLOWING:\nhmh\n\nel\n2017/KER/49753\nMARY JOSEPH,J.\nCrl.M.C. 2351 of 2014\nDated this the 8â€œ day of December, 2017.\nORDER\n\nBased on the submission made by the learned counsel for the\npetitioner that, the matter has become infructuous, this Crl.M.C. is\nclosed as infructuous.\n\nSd/-\nMARY JOSEPH,\nJUDGE\n\nbmh\n\n"
}