{
    "case_id": "",
    "court": "HIGH COURT OF KERALA AT ERNAKULAM\nPRESENT\nTHE HONOURABLE MR",
    "date": "8TH DAY OF JANUARY 2020",
    "judge": "P.B.SURESH KUMAR\nWEDNESDAY",
    "petitioners": [
        "ACCUSED :",
        "PANKAJAKSHT KUNJAMMA",
        "AGED 78 YEARS",
        "AYANIKKATTUTHARAYIL, PADINJATTOM MURI , SOORANADU",
        "NORTH, KOLLAM RURAL, KERALA, PIN-690561."
    ],
    "respondents": [
        "S/STATE & COMPLAINANT:",
        "1 STATE OF KERALA",
        "HIGH COURT OF KERALA, ERNAKULAM",
        "2 RADHAMMA K.LR.A 103 KUKKULIYA LANE",
        "SOORANADU, THYCADU P.O., JAGATHI, KOLLAM",
        "RURAL,KERALA - 690 561."
    ],
    "sections": [],
    "outcome": "",
    "full_text": "Ela Ca\nce\npete\n2020/KER/688\nIN THE HIGH COURT OF KERALA AT ERNAKULAM\nPRESENT\nTHE HONOURABLE MR. JUSTICE P.B.SURESH KUMAR\nWEDNESDAY, THE O8TH DAY OF JANUARY 2020 / 18TH POUSHA, 1941\nCrl1.MC.No.1691 OF 2018\nCRIME NO.211/2018 OF Sooranadu Police Station , Kollam\nPETITIONER/ACCUSED :\nPANKAJAKSHT KUNJAMMA\nAGED 78 YEARS\nAYANIKKATTUTHARAYIL, PADINJATTOM MURI , SOORANADU\nNORTH, KOLLAM RURAL, KERALA, PIN-690561.\nBY ADVS.\nSMT .SREEDEVI KYLASANATH\nSRI.ACHUTH KYLAS\nSRI.DEAGO JOHN K\nSRI.R.MAHESH MENON\nRESPONDENTS/STATE & COMPLAINANT:\n1 STATE OF KERALA\nHIGH COURT OF KERALA, ERNAKULAM\n2 RADHAMMA K.LR.A 103 KUKKULIYA LANE\nSOORANADU, THYCADU P.O., JAGATHI, KOLLAM\nRURAL,KERALA - 690 561.\nBY PUBLIC PROSECUTOR P.N. SUMODU\nTHIS CRIMINAL MISC. CASE HAVING BEEN FINALLY HEARD ON\n08.01.2020, THE COURT ON THE SAME DAY PASSED THE FOLLOWING:\n\nCops mseatc|\nEee\na\nBleay\n\n2020/KER/688\n\nCri.MC.No.1691 oF 2018\n-2-\nCri.M.C. No. 1691 of 2018\nORDER\n\nThe learned counsel for the _ petitioner seeks\npermission to withdraw the Crl.M.C. without prejudice to the right\nof the petitioner to file a fresh Crl.M.C., if so advised, challenging\nthe final report in the case.\n\nHaving regard to the facts and circumstances of the\ncase, I deem it appropriate to grant the permission sought for by\nthe petitioner. Ordered accordingly.\n\nSd/-\nP.B.SURESH KUMAR\nJUDGE\nds 09.01.2020\n\n"
}