{
    "case_id": "",
    "court": "HIGH COURT OF KERALA AT ERNAKULAM lease",
    "date": "9TH DAY OF JANUARY 2019",
    "judge": "B.SUDHEENDRA KUMAR\nWEDNESDAY",
    "petitioners": [
        "S:",
        "K.S.ANANDAMANI ,",
        "AGED 62 YEARS",
        "S/O.SUBRAMANY IYER, MANGALAM HOUSE,",
        "KURUVATOOR, THIRUVAZHIYODE, 679514."
    ],
    "respondents": [
        "S:",
        "1 STATE OF KERALA,",
        "REPRESENTED BY DEPARTMENT OF FORESTS AND",
        "WLDLIFE, REPRESENTED BY ITS SECRETARY.",
        "2 SIVARAMAN,",
        "AGED 36 YEARS,",
        "AYYAPAN KUDAM, VENGASSERY AMBALAPARA.",
        "OTHER PRESENT:"
    ],
    "sections": [],
    "outcome": "",
    "full_text": "IN THE HIGH COURT OF KERALA AT ERNAKULAM lease\n2019/KER/1162\nPRESENT\nTHE HONOURABLE MR. JUSTICE B.SUDHEENDRA KUMAR\nWEDNESDAY ,THE O9TH DAY OF JANUARY 2019 / 19TH POUSHA, 1940\nCr1.MC.No. 7081 of 2018\nAGAINST THE ORDER/JUDGMENT IN CC 1330/2016 of J.M.F.C.- I,\nOTTAPPALAM\nCRIME NO. 9/2012 OF OTTAPALAM FOREST RANGE OFFICE, PALAKKAD\nPETITIONER/S:\nK.S.ANANDAMANI ,\nAGED 62 YEARS\nS/O.SUBRAMANY IYER, MANGALAM HOUSE,\nKURUVATOOR, THIRUVAZHIYODE, 679514.\nBY ADVS.\nSRI.VIPIN P.VARGHESE\nSRI.ADARSH MATHEW\nSMT. DHANYA T MALLAR\nSRI.DILJITH K.MANOHAR\nRESPONDENT/S:\n1 STATE OF KERALA,\nREPRESENTED BY DEPARTMENT OF FORESTS AND\nWLDLIFE, REPRESENTED BY ITS SECRETARY.\n2 SIVARAMAN,\nAGED 36 YEARS,\nAYYAPAN KUDAM, VENGASSERY AMBALAPARA.\nOTHER PRESENT:\nSRI. RAVIKRISHNAN FOR SPL. GP FOREST\nTHIS CRIMINAL MISC. CASE HAVING COME UP FOR ADMISSION\nON 09.01.2019, THE COURT ON THE SAME DAY PASSED THE\nFOLLOWING:\n\nIBLSats fal\na\n2019/KER/1162\nCri.MC.No. 7081 of 2018\n-2-\nORDER\n\nDismissed as withdrawn.\n\nHowever, the petitioner shall be at\nliberty to raise all his contentions before the\ncourt below and plead for discharge. If the\npetitioner files any petition for discharge,\nthe court below shall consider al1ll_Ã© the\ncontentions of the petitioner in accordance\nwith law. The petitioner shall be also granted\nexemption from personal appearance before the\ncourt below on all posting dates except when\nhis presence is necessary for the progress of\nthe case, if the petitioner surrenders before\nthe court below within one month from today and\nfiles application in this regard.\n\nSd/-\nB. SUDHEENDRA KUMAR,\nJUDGE\nSTK\n/{TRUE COPY//\n/1P.A. TO JUDGE//\n\n"
}