{
    "case_id": "Crl.MC.No.83 OF 2020",
    "court": "HIGH COURT OF KERALA AT HERNAKULAM\nPRESENT\nTHE HONOURABLE MR",
    "date": "8TH DAY OF JANUARY 2020",
    "judge": "ASHOK MENON\nWEDNESDAY",
    "petitioners": [
        "SURAJ KALESH,",
        "AGED 34 YEARS,",
        "S/O. KALESH KUMAR,",
        "ANIL NIVAS, UMAYANELLOOR P O,",
        "MAYANADU VILLAGE, KOLLAM."
    ],
    "respondents": [
        "S /STATE:",
        "1 STATE OF KERALA,",
        "REPRESENTED BY THE PUBLIC PROSECUTOR,",
        "HIGH COURT OF KERALA, ERNAKULAM, PIN-682031.",
        "2 SUB-INSPECTOR OF POLICE,",
        "CHATHANNUR POLICE STATION,",
        "KOLLAM, PIN-691572.",
        "OTHER PRESENT:"
    ],
    "sections": [
        "457 Cr"
    ],
    "outcome": "",
    "full_text": "ee\nBeer\n2020/KER/667\nIN THE HIGH COURT OF KERALA AT HERNAKULAM\nPRESENT\nTHE HONOURABLE MR. JUSTICE ASHOK MENON\nWEDNESDAY, THE O8TH DAY OF JANUARY 2020 / 18TH POUSHA, 1941\nCr1.MC.No.83 OF 2020 (A)\n\nAGAINST THE CONDITION NO.7 IN ORDER DATED 24/05/2019 IN\nC.M.P NO: 2864/2019 OF JUDICIAL FIRST CLASS MAGISTRATE COURT\n(TEMPORARY) SOUTH PARAVUR, KOLLAM\n\nPETITIONER:\nSURAJ KALESH,\nAGED 34 YEARS,\nS/O. KALESH KUMAR,\nANIL NIVAS, UMAYANELLOOR P O,\nMAYANADU VILLAGE, KOLLAM.\nBY ADV. SRI.M.R.SASITH PANICKER\nRESPONDENTS /STATE:\n1 STATE OF KERALA,\nREPRESENTED BY THE PUBLIC PROSECUTOR,\nHIGH COURT OF KERALA, ERNAKULAM, PIN-682031.\n2 SUB-INSPECTOR OF POLICE,\nCHATHANNUR POLICE STATION,\nKOLLAM, PIN-691572.\nOTHER PRESENT:\nSRI.C.S.HRITHWIK SR.PUBLIC PROSECUTOR\nTHIS CRIMINAL MISC. CASE HAVING COME UP FOR ADMISSION ON\n08.01.2020, THE COURT ON THE SAME DAY PASSED THE FOLLOWING:\n\nBeal\nCrl.MC.No.83 OF 2020 (A) 2020/KER/O67\n2\nORDER\nDated this the 8th day of January, 2020\nPetitioner is the registered owner of a vehicle bearing\nRegistration No. KL -03 P- 9018, which was allegedly involved in\nan offence under the Mines and Minerals (Development and\nRegulation) Act, 1957. An application was filed under\nSection 457 Cr.P.C for custody of the vehicle, which was allegedly\nseized on 21.05.2019. No crime has been registered. The vehicle\nwas ordered to be returned by the learned Magistrate on nine\nconditions. The petitioner is aggrieved by condition No. 7, which\nrequires that the original documents of the vehicle shall be kept\nin safe custody of the court and the petitioner shall be issued with\na true copy certified from the court for all legal and practical\npurposes. Hence, this criminal MC has been filed.\n\n2.  Itis seen that no crime has been registered so far and\nthere is no necessity for retaining the original documents with the\ncourt. Hence, it will be sufficient to retain copies of the\ndocuments of the vehicle in the court after being certified and\ncompared with the originals and to return the original documents\n\neee\nope\nCrl.MC.No.83 OF 2020 (A) 2020/KERI667\n3\nto the petitioner. Hence, it is directed that condition No. 7 is\nmodified to the effect that the original documents of the vehicle\nshall be returned to the petitioner after taking copies of the\noriginal documents of the vehicle and after being certified and\ncompared it with the originals for the custody of the court.\nThe Criminal MC is allowed with the above direction.\nSd/-\nASHOK MENON\nJUDGE\nNR/08/01/20\n\na at\nHeaters\nets\nbeer\nCr1.MC.No.83 OF 2020 (A) 2020/KERI667\n4\nAPPENDIX\nPETITIONER'S EXHIBITS:\nANNEXURE Al TRUE COPY OF THE ORDER IN CMP\nNO.2864/2019 OF MAGISTRATE\nCOURT (TEMPORARY) , SOUTH PARAVUR.\nANNEXURE A2 TRUE COPY OF THE ORDER IN CRL.M.C\nNO.4237/2019 OF HIGH COURT OF KERALA.\nRESPONDENTS' EXHIBITS: NIL\n//TRUE COPY// PA TO JUDGE\n\n"
}