{
    "case_id": "",
    "court": "HIGH COURT OF KERALA AT ERNAKULAM\nPRESENT",
    "date": "4TH DAY OF AUGUST 2016",
    "judge": "RAJA VIJAYARAGHAVAN V\nTHURSDAY",
    "petitioners": [
        "2ND ACCUSED :",
        "SHIBU,",
        "AGED 49 YEARS,",
        "S/O.STEPHEN,",
        "MADATHTIL HOUSE,",
        "VADAKKEPERINGOTTUKAVU KARA,",
        "KIDANGOOR VILLAGE,",
        "KOTTAYAM."
    ],
    "respondents": [
        "(S) /RESPONDENT :",
        "STATE OF KERALA,",
        "REPRESENTED BY THE PUBLIC PROSECUTOR,",
        "HIGH COURT OF KERALA,",
        "ERNAKULAM."
    ],
    "sections": [
        "482 of the Code of Criminal Procedure had granted the\nrelief"
    ],
    "outcome": "",
    "full_text": "pac CI\nTinie pas\nLe\nBir\n2016/KER/34134\nIN THE HIGH COURT OF KERALA AT ERNAKULAM\nPRESENT:\nTHE HONOURABLE MR. JUSTICE RAJA VIJAYARAGHAVAN V\nTHURSDAY, THE 4TH DAY OF AUGUST 2016/13TH SRAVANA, 1938\nCr1.MC.No. 4954 of 2016\nCC 212/1994 OF JUDICIAL FIRST CLASS MAGISTRATE COURT - I,\nETTUMANUR\nPETITIONER/2ND ACCUSED :\nSHIBU,\nAGED 49 YEARS,\nS/O.STEPHEN,\nMADATHTIL HOUSE,\nVADAKKEPERINGOTTUKAVU KARA,\nKIDANGOOR VILLAGE,\nKOTTAYAM.\nBY ADV. SRI.V.K.SUNIL\nRESPONDENT (S) /RESPONDENT :\nSTATE OF KERALA,\nREPRESENTED BY THE PUBLIC PROSECUTOR,\nHIGH COURT OF KERALA,\nERNAKULAM.\nBY PUBLIC PROSECUTOR SMT.PUSHPALATHA M.K.\nTHIS CRIMINAL MISC. CASE HAVING COME UP FOR ADMISSION\nON 04-08-2016, THE COURT ON THE SAME DAY PASSED THE\nFOLLOWING:\nmsv/\n\npeared CI\nPiast aes\n- .\nles\n2016/KER/34134\nCr1.MC.No. 4954 of 2016\nAPPENDIX\nPETITIONER (S) ' ANNEXURES:\nANNEXURE Ai TRUE COPY OF THE PETITIONERS VISA AFFIXED ON HIS\nPASSPORT\nANNEXURE A2 TRUE COPY OF THE ORDER DTD 6/8/2015 OF THIS\nHONORABLE COURT IN CRL.RP. NO 711/2003.\nRESPONDENT (S)' ANNEXURE:\nNIL\n//TRUE COPY//\nP.S.TO JUDGE\nMsv/\n\nbs ; :\n2016/KER/34134\nRAJA VIJAYARAGHAVAN.Y, J\nDated this the 4\" day of August, 2016\nORDER\n\n1.As per order dated 6.8.2015 in Crl.R.P.No.711 of 2003,\nthis Court after maintaining the conviction imposed\nagainst the petitioner had modified the sentence and the\npetitioner was sentenced to undergo imprisonment till the\nrising of the Court and to pay a compensation of\nRs.5,000/-. Two months time was granted to deposit the\ncompensation amount before the trial court with a default\nclause.\n\n2.It is submitted by the learned counsel appearing for the\npetitioner that the petitioner is abroad and he will be\npermitted to relieve himself from his employment only in\nthe month of August. The learned counsel prays that he\nbe permitted to appear before court below on a day\nbetween 10.8.2016 and 20.8.2016 to suffer the sentence\n\nbs : :\n2016/KER/34134\n\nCri.M.C.4954/2016 2\nand to pay the compensation amount. The learned\ncounsel also relies on the judgment of this Court in\nK.G.Girish Kumar v. Muthoot Capital Services Pvt.\nLitd.(2007 (4) KLT 16) and Subash Sait v. Sree\nGokulam Chits and Finances, Palakkad & Another\n(2015(4) KLT 497) to contend that this Court in\nappropriate cases have exercised powers under section\n482 of the Code of Criminal Procedure had granted the\nrelief. I am convinced of the reasons stated and I am of\nthe view that the time granted as per order dated\n6.8.2015 can be extended by a period of two weeks to\nsecure the ends of justice.\n\n3.Accordingly, the time granted as per order dated 6.8.2015\nin Crl.R.P.No.711 of 2003 is extended by a period of two\nweeks from today.\n\nPetition is disposed of.\nSd/-\nRAJA VIJAYARAGHAVAN.YV.\nJUDGE\nvps\n\n"
}