{
    "case_id": "Crl.MC.No.8395 OF 2019",
    "court": "HIGH COURT OF KERALA AT ERNAKULAM",
    "date": "8TH DAY OF JANUARY 2020",
    "judge": "ASHOK MENON\nWEDNESDAY",
    "petitioners": [
        "S /ACCUSED:",
        "1 PRADEEP P,",
        "AGED 25 YEARS,",
        "S/O.PRABHAKARAN,",
        "PRABHA NIVAS,",
        "MEPPALLAM, NALLEPPILLY.P.O.",
        "2 JISHNU PRABOSH,",
        "AGED 19 YEARS,",
        "S/O.PRABOSH,",
        "THONNIPPALLAM HOUSE,",
        "THEKKEDESAM, NALLEPPILLY.P.O.",
        "3 SANTHOSH.K,",
        "AGED 26 YEARS,",
        "S/O.KRISHNANKUTTY,",
        "MEPPALLAM HOUSE, NALLEPPILLY.P.O.",
        "4 SATHEESH.K,",
        "AGED 30 YEARS,",
        "S/O.KRISHNANKUTTY,",
        "MEPPALLAM HOUSE, NALLEPPILLY.P.O."
    ],
    "respondents": [
        "S/STATE & DEFACTO COMPLAINANTS:",
        "1 STATE OF KERALA,",
        "REP. BY PUBLIC PROSECUTOR,",
        "HIGH COURT OF KERALA, ERNAKULAM - 682031.",
        "2 SHARATH R,",
        "AGED 23 YEARS,",
        "D/O.RAVEENDRAN,",
        "KURUVANNAMPALLAM, THEKKEDESAM.P.O.,",
        "NALLEPPILLY - 678006.",
        "3 AJITH A.,",
        "AGED 25 YEARS,",
        "S/O.APPU,"
    ],
    "sections": [
        "143",
        "147",
        "148",
        "341",
        "323",
        "324",
        "308 read with Section 34 of the IPC"
    ],
    "outcome": "ORDER\nDated this the 8th day of January, 2020\n\nThe petitioners are accused in Crime No.403/2019 of\nChittoor Police Station, Palakkad for having allegedly committed\noffences punishable under Sections 143, 147, 148, 341, 323, 324 and\n308 read with Section 34 of the IPC. The defacto complainant and\ninjured are respondents 2 to 5. They have appeared through counsel\nand filed affidavits to the effect that the matter has been amicably\nsettled and that they do not have any grievance against the petitioners.\nThere is also a counter case registered against the respondents herein\nas Crime No.402/2019 of the same Police Station which also has been\nsettled. A report has been obtained from the Investigating Officer\nregarding the settlement. The petitioners do not have any criminal\nantecedents. There is no public interest involved.\n\nIn the result, the Crl.M.C is allowed and the entire\nproceedings in Crime No.403/2019 of Chittoor Police Station stands\nquashed",
    "full_text": "B inks MCI\nPeat\nBIER\nIN THE HIGH COURT OF KERALA AT ERNAKULAM 2020/KER/812\nPRESENT\nTHE HONOURABLE MR. JUSTICE ASHOK MENON\nWEDNESDAY, THE O8TH DAY OF JANUARY 2020 / 18TH POUSHA, 1941\nCr1.MC.No.8395 OF 2019 (H)\nCRIME NO.403/2019 OF Chitoor Police Station , Palakkad District\nPETITIONERS /ACCUSED:\n1 PRADEEP P,\nAGED 25 YEARS,\nS/O.PRABHAKARAN,\nPRABHA NIVAS,\nMEPPALLAM, NALLEPPILLY.P.O.\n2 JISHNU PRABOSH,\nAGED 19 YEARS,\nS/O.PRABOSH,\nTHONNIPPALLAM HOUSE,\nTHEKKEDESAM, NALLEPPILLY.P.O.\n3 SANTHOSH.K,\nAGED 26 YEARS,\nS/O.KRISHNANKUTTY,\nMEPPALLAM HOUSE, NALLEPPILLY.P.O.\n4 SATHEESH.K,\nAGED 30 YEARS,\nS/O.KRISHNANKUTTY,\nMEPPALLAM HOUSE, NALLEPPILLY.P.O.\nBY ADV. SRI.N.RAJESH (PALAKKAD)\nRESPONDENTS/STATE & DEFACTO COMPLAINANTS:\n1 STATE OF KERALA,\nREP. BY PUBLIC PROSECUTOR,\nHIGH COURT OF KERALA, ERNAKULAM - 682031.\n2 SHARATH R,\nAGED 23 YEARS,\nD/O.RAVEENDRAN,\nKURUVANNAMPALLAM, THEKKEDESAM.P.O.,\nNALLEPPILLY - 678006.\n3 AJITH A.,\nAGED 25 YEARS,\nS/O.APPU,\n\nB inks MCI\nae\neae:\nCrl.MC.No.8395 OF 2019 (H) 2020/KERBI2\n2\nKURUVANNAMPALLAM ,\nTHEKKEDESAM.P.O., NALLEPPILLY - 678006.\n4 MANOS M.,\nAGED 21 YEARS,\nS/O.MADHAVAN,\nKURUVANNAMPALLAM ,\nTHEKKEDESAM.P.O., NALLEPPILLY - 678006.\n5 PRADEEP S.,\nAGED 21 YEARS,\nS/O.SREEDHARAN,\nARANDAPPALLAM HOUSE,\nTHEKKEDESAM.P.O., NALLEPPILLY - 678006.\nR2-5 BY ADV. SRI.K.ANAND\nR2-5 BY ADV. SRI.BENNY ANTONY PAREL\nR2-5 BY ADV. SRI.T.M.MUHAMED HAFEES\nOTHERS PRESENT: SRI. C.S. HRITHWIK, SENIOR PUBLIC PROSECUTOR\nTHIS CRIMINAL MISC. CASE HAVING COME UP FOR ADMISSION ON\n08.01.2020, THE COURT ON THE SAME DAY PASSED THE FOLLOWING:\n\nee\nCrl.MC.No.8395 OF 2019 (H) 2020/KERBI2\n3\nORDER\nDated this the 8th day of January, 2020\n\nThe petitioners are accused in Crime No.403/2019 of\nChittoor Police Station, Palakkad for having allegedly committed\noffences punishable under Sections 143, 147, 148, 341, 323, 324 and\n308 read with Section 34 of the IPC. The defacto complainant and\ninjured are respondents 2 to 5. They have appeared through counsel\nand filed affidavits to the effect that the matter has been amicably\nsettled and that they do not have any grievance against the petitioners.\nThere is also a counter case registered against the respondents herein\nas Crime No.402/2019 of the same Police Station which also has been\nsettled. A report has been obtained from the Investigating Officer\nregarding the settlement. The petitioners do not have any criminal\nantecedents. There is no public interest involved.\n\nIn the result, the Crl.M.C is allowed and the entire\nproceedings in Crime No.403/2019 of Chittoor Police Station stands\nquashed under Section 482 Cr.P.C and the accused are discharged.\n\nSd/-\nASHOK MENON\nJUDGE\nNR/08/01/20\n\niB wee\nEerie ita\neee\nCrl.MC.No.8395 OF 2019 (H) 2020/KERBI2\n4\nAPPENDIX\nPETITIONERS' EXHIBITS:\nANNEXURE Al TRUE COPY OF THE FIR NO.403/2019 OF\nCHITTOOR POLICE STATION, PALAKKAD.\nANNEXURE A2 TRUE COPY OF THE AFFIDAVIT OF THE\nDEFACTO COMPLAINT /2ND RESPONDENT.\nANNEXURE A3 TRUE COPY OF THE AFFIDAVIT OF THE\nINJURED/3RD RESPONDENT.\nANNEXURE A4 TRUE COPY OF THE AFFIDAVIT OF THE\nINJURED/3RD RESPONDENT.\nANNEXURE A5 TRUE COPY OF THE AFFIDAVIT OF THE\nINJURED/A4TH RESPONDENT.\nRESPONDENTS' EXHIBITS: NIL\n//TRUE COPY// PA TO JUDGE\n\nBia EI\nas\nplea\nCr1.MC.No.8395 OF 2019 (H) 2020/KER/812\n5\n\n"
}