{
    "case_id": "",
    "court": "HIGH COURT OF KERALA AT ERNAKULAM\nPRESENT",
    "date": "3RD DAY OF JANUARY 2017",
    "judge": "SUNIL THOMAS\nTUESDAY",
    "petitioners": [
        "(S)/5TH ACCUSED:",
        "VADAYIL SATHAR",
        "VADAYIL HOUSE, MUTHUKURUSSI,",
        "PERINTHALMANNA TALUK, MALAPPURAM DISTRICT."
    ],
    "respondents": [
        "(S) /COMPLAINANT/DEFACTO COMPLAINANT:",
        "1. STATE OF KERALA",
        "REPRESENTED BY THE S.I. OF POLICE,",
        "PERINTHALMANNA THROUGH THE PUBLIC PROSECUTOR,",
        "HIGH COURT OF KERALA, ERNAKULAM.",
        "2. IBRAHIM",
        "S/O.HAMSA HAJI, CHEELATH HOUSE,",
        "MUTHUKURUSSI, ELAD, MALAPPURAM DISTRICT, 678593.",
        "R2 BY ADV. SMT.LIJI KUTTAPPAN"
    ],
    "sections": [],
    "outcome": "",
    "full_text": "SPT FFA.\nJae\n2017/KER/SO\nIN THE HIGH COURT OF KERALA AT ERNAKULAM\nPRESENT:\nTHE HONOURABLE MR. JUSTICE SUNIL THOMAS\nTUESDAY, THE 3RD DAY OF JANUARY 2017/13TH POUSHA, 1938\nCril.MC.No. 2482 of 2014 ()\nAGAINST THE ORDER/JUDGMENT IN CC 523/2013 of J.M.F.C.-I,\nPERINTHALMANNA\nCRIME NO. 629/2013 OF PERINTHALMANNA POLICE STATION , MALAPPURAM\nPETITIONER (S)/5TH ACCUSED:\nVADAYIL SATHAR\nVADAYIL HOUSE, MUTHUKURUSSI,\nPERINTHALMANNA TALUK, MALAPPURAM DISTRICT.\nBY ADV. SRI.U.K.DEVIDAS\nRESPONDENT (S) /COMPLAINANT/DEFACTO COMPLAINANT:\n1. STATE OF KERALA\nREPRESENTED BY THE S.I. OF POLICE,\nPERINTHALMANNA THROUGH THE PUBLIC PROSECUTOR,\nHIGH COURT OF KERALA, ERNAKULAM.\n2. IBRAHIM\nS/O.HAMSA HAJI, CHEELATH HOUSE,\nMUTHUKURUSSI, ELAD, MALAPPURAM DISTRICT, 678593.\nR2 BY ADV. SMT.LIJI KUTTAPPAN\nBY PUBLIC PROSECUTOR:SRI T R RANJITH\nTHIS CRIMINAL MISC. CASE HAVING BEEN FINALLY HEARD ON\n03-01-2017, THE COURT ON THE SAME DAY PASSED THE FOLLOWING:\n\n2017/KER/50\nSUNIL THOMAS, J.\nCrl.M.C.No.2482 of 2014\nDated this the 3\" day of January, 2017\nORDER\nIt is submitted by the learned counsel for the petitioner\nthat this Crl.M.C is not pressed. Hence, Crl.M.C is dismissed as\nnot pressed.\nSd/-\nSUNIL THOMAS\nJudge\nSbna\nTrue Copy /\nP A to Judge\n\n"
}