{
    "case_id": "",
    "court": "HIGH COURT OF KERALA AT ERNAKULAM\nPRESENT",
    "date": "8TH DAY OF DECEMBER 2017",
    "judge": "SUNIL THOMAS\nFRIDAY",
    "petitioners": [
        "(S) /ACCUSED :",
        "SANTHI,",
        "WIFE OF SUBRAMANIAN,",
        "MADHURA MEENAKSHI AMMAN KOVIL THERU,",
        "MADURAI-TAMIL NADU."
    ],
    "respondents": [
        "(S) /STATE AND COMPLAINANT :",
        "1. STATE OF KERALA,",
        "REPRESENTED BY PUBLIC PROSECUTOR, HIGH COURT OF KERALA,",
        "ERNAKULAM-682011.",
        "2. SUBAIDA P.,",
        "DAUGHTER OF BEERAN, PONAKATHODI HOUSE POST PALAMAD,",
        "EDAKKARA AMSOM, MALAPPURAM DISTRICT 676505.",
        "R2 BY ADV. SMT.VARSHA BHASKAR",
        "R BY PUBLIC PROSECUTOR C.N.PRABHAKARA"
    ],
    "sections": [
        "380 IPC"
    ],
    "outcome": "ORDER/JUDGMENT IN CC 762/2017 of J.M.F.C.,KUNNAMANGALAM\nCRIME NO. 504/2017 OF MEDICAL COLLEGE POLICE STATION , KOZHIKODE)\nPETITIONER (S) /ACCUSED :\nSANTHI,\nWIFE OF SUBRAMANIAN,\nMADHURA MEENAKSHI AMMAN KOVIL THERU,\nMADURAI-TAMIL NADU.\nBY ADV. SRI.K.A.SALIL NARAYANAN\nRESPONDENT (S) /STATE AND COMPLAINANT :\n1. STATE OF KERALA,\nREPRESENTED BY PUBLIC PROSECUTOR, HIGH COURT OF KERALA,\nERNAKULAM-682011.\n2. SUBAIDA P.,\nDAUGHTER OF BEERAN, PONAKATHODI HOUSE POST PALAMAD,\nEDAKKARA AMSOM, MALAPPURAM DISTRICT 676505.\nR2 BY ADV. SMT.VARSHA BHASKAR\nR BY PUBLIC PROSECUTOR C.N.PRABHAKARA\nTHIS CRIMINAL MISC. CASE HAVING COME UP FOR ADMISSION ON\n08-12-2017, THE COURT ON THE SAME DAY PASSED THE FOLLOWING:\n\nPlier\nRie ed\nPere ape ine\no bin Wb oT\nra ra\n2017/KER/49774\nCr1.MC.No. 7864 of 2017 ()\nAPPENDIX\n\nPETITIONER(S)' EXHIBITS\n\nANNEXURE 1 TRUE COPY OF THE F I R IN CRIME 504/2017 OF THE\n\nMEDICAL COLLEGE POLICE STATION ALONG WITH THE MEMO OF EVIDENCE AND\n\nCHARGE.\n\nANNEXURE 2 AFFIDAVIT SWORN TO BY THE 2ND RESPONDENT.\n\nRESPONDENT (S)' EXHIBITS\n\nlee intestate onneninie einen tenienienienneal NIL\n\n/TRUE COPY/ PS TO JUDGE.\n\nmall\n2017/KER/49774\nSUNIL THOMAS, J.\nCrl.M.C.No. 7864 of 2017\nDated this the 8 day of December, 2017\nORDER\n\nThe petitioner herein stands arrayed as accused in CC\nNo.762/2017 of JFCM , Kunnamangalam Police station for offences\npunishable under section 380 IPC.\n\n2. The allegation of the prosecution was that, 7/9/2017, while\nthe second respondent, who is the defacto complainant, was in the\nhospital, the petitioner herein removed the bracelet of the child of\nthe defacto complainant. Alleging the commission of crime, the\ncomplaint was laid and the petitioner was arrested. She is in\ncustody since then. The petitioner has approached this Court on a\npremise that, the dispute with the second respondent has been\namicably settled. To substantiate it, the petitioner relied on\nAnnexure 2 affidavit affirmed by the defacto complainant.\n\n3. The learned counsel for the second respondent affirmed\nthe execution of the above affidavit and stated that the second\nrespondent was duly compensated by the petitioner and she has\nno objection in quashing the proceedings.\n\nmall\n2017/KER/49774\nCrl.M.C.No.7864/2017 2\n\n4. Learned Public Prosecutor submitted that, oral instructions\nhave been received from the defacto complainant to the effect that\nshe has no grievance against the petitioner herein and that the\nmatter has been settled.\n\n5. It was submitted by the learned counsel for the petitioner\nthat, after the alleged incident, the petitioner herein was taken to\nthe police station and two crimes were simultaneously registered\nagainst her. Regarding the second crime, Crl.M.C.No.7760/2017\nwas filed which was allowed by this Court. There is nothing on\nrecord to show that the petitioner herein has got any other\ncriminal antecedents.\n\n6. Having considered the above, I am inclined to quash the\ncriminal proceedings against the petitioner herein to meet the\nends of justice.\n\nAccordingly, Crl.M.C.is allowed. All further proceedings\npursuant to Annexure-Al1(CCNo.762/2017 of JFCM,\nKunnamangalam) stands quashed",
    "full_text": "Peleigissl\nRie ed\nPere ape ine\no bin Wb oT\nra ra\n2017/KER/49774\nIN THE HIGH COURT OF KERALA AT ERNAKULAM\nPRESENT:\nTHE HONOURABLE MR. JUSTICE SUNIL THOMAS\nFRIDAY, THE 8TH DAY OF DECEMBER 2017/17TH AGRAHAYANA, 1939\nCr1.MC.No. 7864 of 2017 ()\n(AGAINST THE ORDER/JUDGMENT IN CC 762/2017 of J.M.F.C.,KUNNAMANGALAM\nCRIME NO. 504/2017 OF MEDICAL COLLEGE POLICE STATION , KOZHIKODE)\nPETITIONER (S) /ACCUSED :\nSANTHI,\nWIFE OF SUBRAMANIAN,\nMADHURA MEENAKSHI AMMAN KOVIL THERU,\nMADURAI-TAMIL NADU.\nBY ADV. SRI.K.A.SALIL NARAYANAN\nRESPONDENT (S) /STATE AND COMPLAINANT :\n1. STATE OF KERALA,\nREPRESENTED BY PUBLIC PROSECUTOR, HIGH COURT OF KERALA,\nERNAKULAM-682011.\n2. SUBAIDA P.,\nDAUGHTER OF BEERAN, PONAKATHODI HOUSE POST PALAMAD,\nEDAKKARA AMSOM, MALAPPURAM DISTRICT 676505.\nR2 BY ADV. SMT.VARSHA BHASKAR\nR BY PUBLIC PROSECUTOR C.N.PRABHAKARA\nTHIS CRIMINAL MISC. CASE HAVING COME UP FOR ADMISSION ON\n08-12-2017, THE COURT ON THE SAME DAY PASSED THE FOLLOWING:\n\nPlier\nRie ed\nPere ape ine\no bin Wb oT\nra ra\n2017/KER/49774\nCr1.MC.No. 7864 of 2017 ()\nAPPENDIX\n\nPETITIONER(S)' EXHIBITS\n\nANNEXURE 1 TRUE COPY OF THE F I R IN CRIME 504/2017 OF THE\n\nMEDICAL COLLEGE POLICE STATION ALONG WITH THE MEMO OF EVIDENCE AND\n\nCHARGE.\n\nANNEXURE 2 AFFIDAVIT SWORN TO BY THE 2ND RESPONDENT.\n\nRESPONDENT (S)' EXHIBITS\n\nlee intestate onneninie einen tenienienienneal NIL\n\n/TRUE COPY/ PS TO JUDGE.\n\nmall\n2017/KER/49774\nSUNIL THOMAS, J.\nCrl.M.C.No. 7864 of 2017\nDated this the 8 day of December, 2017\nORDER\n\nThe petitioner herein stands arrayed as accused in CC\nNo.762/2017 of JFCM , Kunnamangalam Police station for offences\npunishable under section 380 IPC.\n\n2. The allegation of the prosecution was that, 7/9/2017, while\nthe second respondent, who is the defacto complainant, was in the\nhospital, the petitioner herein removed the bracelet of the child of\nthe defacto complainant. Alleging the commission of crime, the\ncomplaint was laid and the petitioner was arrested. She is in\ncustody since then. The petitioner has approached this Court on a\npremise that, the dispute with the second respondent has been\namicably settled. To substantiate it, the petitioner relied on\nAnnexure 2 affidavit affirmed by the defacto complainant.\n\n3. The learned counsel for the second respondent affirmed\nthe execution of the above affidavit and stated that the second\nrespondent was duly compensated by the petitioner and she has\nno objection in quashing the proceedings.\n\nmall\n2017/KER/49774\nCrl.M.C.No.7864/2017 2\n\n4. Learned Public Prosecutor submitted that, oral instructions\nhave been received from the defacto complainant to the effect that\nshe has no grievance against the petitioner herein and that the\nmatter has been settled.\n\n5. It was submitted by the learned counsel for the petitioner\nthat, after the alleged incident, the petitioner herein was taken to\nthe police station and two crimes were simultaneously registered\nagainst her. Regarding the second crime, Crl.M.C.No.7760/2017\nwas filed which was allowed by this Court. There is nothing on\nrecord to show that the petitioner herein has got any other\ncriminal antecedents.\n\n6. Having considered the above, I am inclined to quash the\ncriminal proceedings against the petitioner herein to meet the\nends of justice.\n\nAccordingly, Crl.M.C.is allowed. All further proceedings\npursuant to Annexure-Al1(CCNo.762/2017 of JFCM,\nKunnamangalam) stands quashed. The petitioner shall be released\nfrom jail if her presence is not required in connection with any\nother crime.\n\nSd/-\nSUNIL THOMAS\nJudge\ndpk\n/true copy/ PS to Judge.\n\nPagel\nFy a oe â€˜\nra\n2017/KER/49774\nCrl.M.C.No.7864/2017 3\n\n"
}