{
    "case_id": "Crl.MC.No. 8513 of 2018",
    "court": "HIGH COURT OF KERALA AT ERNAKULAM",
    "date": "07TH DAY OF JANUARY 2019",
    "judge": "RAJA VIJAYARAGHAVAN V\nMONDAY",
    "petitioners": [
        "ACCUSED:"
    ],
    "respondents": [
        "S/COMPLAINANT & STATE :"
    ],
    "sections": [
        "482 of the Code of Criminal\nProcedure"
    ],
    "outcome": "ORDER\n\nThis petition is filed under Section 482 of the Code of Criminal\nProcedure (“the Code” for brevity).\n\n2. The petitioner herein is the accused in C.C.No.574 of 2018\non the file of the Judicial First Class Magistrate Court-II, Hosdurg. In\nthe said case, he stands indicted for having committed offence\npunishable under Section 420 of the IPC. The 1* respondent is the de\nfacto complainant.\n\n3. The instant petition is filed with a prayer to quash the\nproceedings on the ground of settlement of all disputes. The 1*\nrespondent has filed an affidavit stating that she does not wish to\ncontinue with the prosecution proceedings against the petitioner.\n\n4. The learned Public Prosecutor, on instructions, submitted\nthat the statement of the 1* respondent has been recorded and the\nState has no objection in terminating the proceedings as it involves no\npublic interest.\n\nCrl.MC.No. 8513 of 2018 3 2019/KERI655\n\n5. I have considered the submissions advanced.\n\n6. In Gian Singh v. State of Punjab [(2012) 10 SCC 303]\nand in Narinder Singh v. State of Punjab [(2014) 6 SCC 466], the\nApex Court has laid down that in appropriate cases, the High Court\ncan take note of the amicable resolution of disputes between the\nvictim and the wrongdoer to put an end to the criminal proceedings.\n\n7. The offence committed by the petitioner cannot be said to\nbe grave and serious having ingredients of extreme mental depravity.\nIt also does not appear that the offence in this case will have a serious\nimpact on the society. It is felt that quashing of proceedings on\naccount of compromise would bring about peace and secure the ends\nof justice. Even otherwise, persisting with the prosecution would be\nnothing, but a waste of time as the prospects of conviction is bleak.\nHaving considered all the relevant circumstances, I am of the\nconsidered view that this Court will be well justified in invoking its\nextraordinary powers under Section 482 of the Code to quash the\nproceedings.\n\nIn the result, this petition will stand allowed. Annexure-Ai Final\n\nBRE\n\nCr1.MC.No. 8513 of 2018 4 2019/KERI655\nReport and all proceedings pursuant thereto against the petitioner in\nC.C.No.574 of 2018 on the file of the Judicial First Class Magistrate\nCourt-II, Hosdurg are quashed",
    "full_text": "meee\nBS ay vs\nIN THE HIGH COURT OF KERALA AT ERNAKULAM 201/KERIOSS\nPRESENT\nTHE HONOURABLE MR. JUSTICE RAJA VIJAYARAGHAVAN V\nMONDAY ,THE 07TH DAY OF JANUARY 2019 / 17TH POUSHA, 1940\nCr1.MC.No. 8513 of 2018\ncc 574/2018 of J.M.F.C.-II,HOSDRUG\nCRIME NO. 79/2016 OF CBCID, OCW IV, KASARAGOD\n\nPETITIONER/ACCUSED:\n\nSAJISH CHANDRAN,\n\nAGED 33 YEARS\n\nS/O C.CHANDRAN NAIR,\n\nCHOORIKKAT HOUSE, PUTHUKKUNNU,\n\nVATTAKALLU P.O.KATTIPOYIL,\n\nKINANNOOR VILLAGE ,KASARGOD DISTRICT.\n\nBY ADVS.\n\nSRI.PHILIP T.VARGHESE\n\nSMT.ACHU SUBHA ABRAHAM\n\nSRI.THOMAS T.VARGHESE\nRESPONDENTS/COMPLAINANT & STATE :\n\n1 SHYLAJA .M,\n\nAGED 50 YEARS\n\nW/O RAVINDRAN,RESIDING AT\n\nPODOTHURUTHI P.O., CHATHAMATH,\n\nPEROLE VILLAGE,HOSDURG TALUK,\n\nKASARGOD - 671314.\n\n2 STATE OF KERALA,\n\nREPRESENTED BY THE PUBLIC PROSECUTOR,\n\nHIGH COURT OF KERALA,ERNAKULAM 682 031,\n\nREPRESENTING THE DETECTIVE INSPECTOR,\n\nCBCID,OCW IV,SUB UNIT,KASARGOD - 671 314.\n\nBY ADV. SMT.V.T.LITHA\n\nSRI B JAYASURYA-PUBLIC PROSECUTOR\nTHIS CRIMINAL MISC. CASE HAVING COME UP FOR ADMISSION ON\n07.01.2019, THE COURT ON THE SAME DAY PASSED THE FOLLOWING:\n\nBese\nbie\nCr1.MC.No. 8513 of 2018 2 201/KERIO55\nORDER\n\nThis petition is filed under Section 482 of the Code of Criminal\nProcedure (“the Code” for brevity).\n\n2. The petitioner herein is the accused in C.C.No.574 of 2018\non the file of the Judicial First Class Magistrate Court-II, Hosdurg. In\nthe said case, he stands indicted for having committed offence\npunishable under Section 420 of the IPC. The 1* respondent is the de\nfacto complainant.\n\n3. The instant petition is filed with a prayer to quash the\nproceedings on the ground of settlement of all disputes. The 1*\nrespondent has filed an affidavit stating that she does not wish to\ncontinue with the prosecution proceedings against the petitioner.\n\n4. The learned Public Prosecutor, on instructions, submitted\nthat the statement of the 1* respondent has been recorded and the\nState has no objection in terminating the proceedings as it involves no\npublic interest.\n\nCrl.MC.No. 8513 of 2018 3 2019/KERI655\n\n5. I have considered the submissions advanced.\n\n6. In Gian Singh v. State of Punjab [(2012) 10 SCC 303]\nand in Narinder Singh v. State of Punjab [(2014) 6 SCC 466], the\nApex Court has laid down that in appropriate cases, the High Court\ncan take note of the amicable resolution of disputes between the\nvictim and the wrongdoer to put an end to the criminal proceedings.\n\n7. The offence committed by the petitioner cannot be said to\nbe grave and serious having ingredients of extreme mental depravity.\nIt also does not appear that the offence in this case will have a serious\nimpact on the society. It is felt that quashing of proceedings on\naccount of compromise would bring about peace and secure the ends\nof justice. Even otherwise, persisting with the prosecution would be\nnothing, but a waste of time as the prospects of conviction is bleak.\nHaving considered all the relevant circumstances, I am of the\nconsidered view that this Court will be well justified in invoking its\nextraordinary powers under Section 482 of the Code to quash the\nproceedings.\n\nIn the result, this petition will stand allowed. Annexure-Ai Final\n\nBRE\n\nCr1.MC.No. 8513 of 2018 4 2019/KERI655\nReport and all proceedings pursuant thereto against the petitioner in\nC.C.No.574 of 2018 on the file of the Judicial First Class Magistrate\nCourt-II, Hosdurg are quashed.\n\nSd/-\n\nRAJA VIJAYARAGHAVAN V\n\nJUDGE\n\nIAP\n\nmeee\nBS ay\nCr1.MC.No. 8513 of 2018 5 201 1KERIGSS\nAPPENDIX\nPETITIONER'S/S EXHIBITS:\nANNEXURE Al CERTIFIED COPY OF FINAL REPORT IN CC NO\n574/2018 DATED 31.3.2018 IN JUDICIAL FIRST\nCLASS MAGISTRATES COURT II, HOSDURG\nANNEXURE A2 AFFIDAVIT OF 1ST RESPONDENT DATED\n28.11.2018\nRESPONDENTS' EXHIBITS:\nNIL\n\n"
}