{
    "case_id": "",
    "court": "HIGH COURT OF KERALA AT ERNAKULAM\nPRESENT\nTHE HONOURABLE MR",
    "date": "4 DAY OF JANUARY 2024",
    "judge": "BECHU KURIAN THOMAS\nTUESDAY",
    "petitioners": [
        "S:",
        "1 ASHOK KUMAR.P,",
        "AGED 63 YEARS",
        "S/0. PATHMANABHA MENON NAIR, NEDUMPILLIL KRISHNAKRUPA",
        "HOUSE, THODUPUZHA PO, IDUKKI DISTRICT, PIN - 685584",
        "2 UMA ASHOK @ UMADEVI",
        "AGED 55 YEARS",
        "W/O. ASHOK KUMAR, NEDUMPILLIL KRISHNAKRUPA HOUSE,",
        "THODUPUZHA PO, IDUKKI DISTRICT, PIN - 685584"
    ],
    "respondents": [
        "S:",
        "1 STATE OF KERALA",
        "REPRESENTED BY PUBLIC PROSECUTOR, HIGH COURT OF KERALA,",
        "KOCHI, PIN - 682031",
        "2 JAYAN PRABHAKARAN @ JAYAKUMAR",
        "AGED 49 YEARS",
        "S/0. PRABHAKARAN NAIR, KARUMBAYIL HOUSE,",
        "MANNARTHARAKARA, KARIMANNOOR VILLAGE, THODUPUZHA TALUK,",
        "IDUKKI DISTRICT, PIN - 685584",
        "OTHER PRESENT:"
    ],
    "sections": [],
    "outcome": "",
    "full_text": "Ceska)\nBisa\n2024/KER/4639\nIN THE HIGH COURT OF KERALA AT ERNAKULAM\nPRESENT\nTHE HONOURABLE MR. JUSTICE BECHU KURIAN THOMAS\nTUESDAY, THE 16'4 DAY OF JANUARY 2024 / 26TH POUSHA, 1945\nCRL.MC NO. 350 OF 2024\nCRIME NO.1775/2021 OF Thodupuzha Police Station, Idukki\nAGAINST THE ORDER/JUDGMENT CC 268/2023 OF CHIEF JUDICIAL\nMAGISTRATE , THODUPUZHA\nPETITIONER/S:\n1 ASHOK KUMAR.P,\nAGED 63 YEARS\nS/0. PATHMANABHA MENON NAIR, NEDUMPILLIL KRISHNAKRUPA\nHOUSE, THODUPUZHA PO, IDUKKI DISTRICT, PIN - 685584\n2 UMA ASHOK @ UMADEVI\nAGED 55 YEARS\nW/O. ASHOK KUMAR, NEDUMPILLIL KRISHNAKRUPA HOUSE,\nTHODUPUZHA PO, IDUKKI DISTRICT, PIN - 685584\nBY ADV K.MOHANAKANNAN\nRESPONDENT/S:\n1 STATE OF KERALA\nREPRESENTED BY PUBLIC PROSECUTOR, HIGH COURT OF KERALA,\nKOCHI, PIN - 682031\n2 JAYAN PRABHAKARAN @ JAYAKUMAR\nAGED 49 YEARS\nS/0. PRABHAKARAN NAIR, KARUMBAYIL HOUSE,\nMANNARTHARAKARA, KARIMANNOOR VILLAGE, THODUPUZHA TALUK,\nIDUKKI DISTRICT, PIN - 685584\nOTHER PRESENT:\nSRI. M.C. ASHI (PP)\nTHIS CRIMINAL MISC. CASE HAVING COME UP FOR ADMISSION ON\n16.01.2024, THE COURT ON THE SAME DAY PASSED THE FOLLOWING:\n\nBl\n2024/KER/4639\nBECHU KURIAN THOMAS, J.\nCril.M.C No.350 of 2024\nDated this the 16\" day of January 2024\nORDER\nLearned Counsel for the petitioner seeks permission to withdraw\nthis Crl.M.C.\nPermission granted. Accordingly, this Crl.M.C. is dismissed as\nwithdrawn.\nsd/\nBECHU KURIAN THOMAS\nJUDGE\njm/\n\nDepa\nPeeled\nrape es\n2024/KER/4639\nAPPENDIX OF CRL.MC 350/2024\nPETITIONER ANNEXURES\nAnnexure At TRUE COPY OF THE FINAL REPORT IN CRIME NO.\n1775/2021 OF THODUPUZHA POLICE STATION, WHICH\nIS PENDING IN CC NO. 268/2023 OF CHIEF\nJUDICIAL MAGISTRATE COURT, THODUPUZHA DATED\n02/06/2023\nAnnexure A2 TRUE COPY OF THE CMP NO. 2638/2021 DATED\n26/11/2021 OF THE CHIEF JUDICIAL MAGISTRATE\nCOURT, THODUPUZHA\nAnnexure A3 TRUE COPY OF THE LICENSE AGREEMENT DATED\n27/08/2020\nAnnexure A4 TRUE COPY OF THE FIR IN CRIME NO. CRIME NO.\n1131/2021 OF THODUPUZHA POLICE STATION DATED\n17/07/2021\nAnnexure A5 TRUE COPY OF THE JUDGMENT IN WP(C) NO.\n11032/2021 DATED 03/09/2021\nAnnexure A6 TRUE COPY OF THE JUDGMENT IN WRIT APPEAL NO.\n1524/2021 DATED 18/01/2022\nAnnexure A7 TRUE COPY OF THE ORDER PASSED BY THE SESSIONS\nCOURT, THODUPUZHA IN CRL.M.C. NO. 772/2021\nDATED 25/08/2021\nAnnexure A8 TRUE COPY OF THE JUDGMENT IN CRL.MC NO.\n8810/2023 DATED 25/10/2023\nAnnexure AQ TRUE COPY OF THE APPLICATION FILED BY THE\nPETITIONERS, U/S. 239 OF CR.P.C AS CMP NO.\n5658/2023\nAnnexure A10 TRUE COPY OF THE ORDER IN CMP NO. 5658/2023\nIN CC 268/2023 DATED 23/12/2023\nAnnexure A11 TRUE COPY OF THE REPORT OF THE FORENSIC\nLABORATORY DATED 27/05/2023\n\n"
}