{
    "case_id": "Crl.MC.No.5679 OF 2020",
    "court": "HIGH COURT OF KERALA AT ERNAKULAM",
    "date": "07TH DAY OF JANUARY 2021",
    "judge": "V.G.ARUN\nTHURSDAY",
    "petitioners": [
        "ACCUSED NOS 1 AND 2:",
        "1 SARFRAS @ CHEPPU",
        "AGED 23 YEARS",
        "S/O. SAJUDHEEN, RESIDING AT KOMBANADUKKAM HOUSE,",
        "CHEMMANAD VILLAGE, KASARAGOD DISTRICT.",
        "2 NIDHAL,",
        "AGED 22 YEARS",
        "S/O. KAREEM, RESIDING AT DARUL HASSANATH, NORTH",
        "BATHIRA, VIDYANAGAR P.O, KASARAGOD DISTRICT."
    ],
    "respondents": [
        "STATE AND THE DE FACTO COMPLAINANT:",
        "1 THE STATE OF KERALA",
        "REPRESENTED BY PUBLIC PROSECUTOR, HIGH COURT OF",
        "KERALA, ERNAKULAM, PIN - 682031.",
        "2 MUHAMMED SAJUDDEEN",
        "AGED 23 YEARS",
        "S/O. AHAMMED SHAREEF C, RESIDING AT CHEKKARAMKODE",
        "HOUSE, CHEMMANAD P.O, KASARAGOD DISTRICT, PIN -",
        "671317.",
        "R2 BY ADV. JAISON ANTONY",
        "OTHER PRESENT:",
        "SR.PP.C.S.HRITHWIK"
    ],
    "sections": [
        "341",
        "324 read with 34 of IPC",
        "now pending as C"
    ],
    "outcome": "ORDER\nDated this the 7th day of January 2021\nPetitioners are the accused in Crime No.2/2020\nregistered at the Kasargod Police Station for offences\npunishable under Sections 341 and 324 r/w 34 of IPC,\nnow pending as C.C.No.448/2020 on the files of the\nJudicial First Class Magistrate Court-I, Kasargod. The\nde facto complainant, at whose instance the crime\nwas registered, is arrayed as the 2™ respondent.\nAnnexure-E affidavit has been filed by 2\"? respondent\nstating that the dispute, which was the reason for the\nincident and registration of the crime, has been\nresolved amicably and he has no subsisting grievance\nagainst the petitioners.\n2. Heard the learned Public Prosecutor also,\n\nLael\nBee\nCrl.MC.No.5679 OF 2020 (H) Be. 2021/KER/TIIS\nwho, on instructions, submits that the petitioners\nhave no criminal antecedents.\n\n3. Having considered the gravity of the offences\n\nalleged, nature of the injury caused and having\nperused the affidavit filed by the 2™* respondent, the\ncontents of which are submitted to be true and\nvoluntary, I am satisfied that the dispute is settled and\nno public interest is involved in this matter.\nMoreover, in view of the settlement, possibility of the\ncriminal proceedings ending in conviction is remote.\nAs such, continuance of the proceedings will amount\nto an abuse of process of court and hence, in view of\nthe legal position set out by the Honourable Supreme\nCourt in Madan Mohan Abbot v. State of Punjab\n(2008) 4 SCC 582] and Gian Singh v. State of\nPunjab and another [(2012) 10 SCC 303], there is\nno impediment in granting the relief sought.\n\nBasha\nRee\nCrl.MC.No.5679 OF 2020 (H) A. 202UKER/LIIS\nIn the result, this Crl.M.C is allowed. The\nproceedings in C.C.No.448/2020 on the files of the\nJudicial First Class Magistrate Court-I, Kasargod is\nquashed",
    "full_text": "Pearl\npeas\nead\nCopa\nIN THE HIGH COURT OF KERALA AT ERNAKULAM 202UKER/IIS\nPRESENT\nTHE HONOURABLE MR.JUSTICE V.G.ARUN\nTHURSDAY, THE 07TH DAY OF JANUARY 2021 / 17TH POUSHA, 1942\nCrl.MC.No.5679 OF 2020 (H)\nAGAINST THE JUDGMENT IN CC 448/2020 OF JUDICIAL MAGISTRATE OF\nFIRST CLASS COURT-I ,KASARAGOD\nCRIME NO.2/2020 OF THE KASARAGODE POLICE STATION\nPETITIONER/ACCUSED NOS 1 AND 2:\n1 SARFRAS @ CHEPPU\nAGED 23 YEARS\nS/O. SAJUDHEEN, RESIDING AT KOMBANADUKKAM HOUSE,\nCHEMMANAD VILLAGE, KASARAGOD DISTRICT.\n2 NIDHAL,\nAGED 22 YEARS\nS/O. KAREEM, RESIDING AT DARUL HASSANATH, NORTH\nBATHIRA, VIDYANAGAR P.O, KASARAGOD DISTRICT.\nBY ADV. SHRI.JAWAHAR JOSE\nRESPONDENT/STATE AND THE DE FACTO COMPLAINANT:\n1 THE STATE OF KERALA\nREPRESENTED BY PUBLIC PROSECUTOR, HIGH COURT OF\nKERALA, ERNAKULAM, PIN - 682031.\n2 MUHAMMED SAJUDDEEN\nAGED 23 YEARS\nS/O. AHAMMED SHAREEF C, RESIDING AT CHEKKARAMKODE\nHOUSE, CHEMMANAD P.O, KASARAGOD DISTRICT, PIN -\n671317.\nR2 BY ADV. JAISON ANTONY\nOTHER PRESENT:\nSR.PP.C.S.HRITHWIK\nTHIS CRIMINAL MISC. CASE HAVING COME UP FOR ADMISSION ON\n07.01.2021, THE COURT ON THE SAME DAY PASSED THE FOLLOWING:\n\nLael\nBae\nCrl1.MC.No.5679 OF 2020 (H) iQ. 202UKER/LIIS\nORDER\nDated this the 7th day of January 2021\nPetitioners are the accused in Crime No.2/2020\nregistered at the Kasargod Police Station for offences\npunishable under Sections 341 and 324 r/w 34 of IPC,\nnow pending as C.C.No.448/2020 on the files of the\nJudicial First Class Magistrate Court-I, Kasargod. The\nde facto complainant, at whose instance the crime\nwas registered, is arrayed as the 2™ respondent.\nAnnexure-E affidavit has been filed by 2\"? respondent\nstating that the dispute, which was the reason for the\nincident and registration of the crime, has been\nresolved amicably and he has no subsisting grievance\nagainst the petitioners.\n2. Heard the learned Public Prosecutor also,\n\nLael\nBee\nCrl.MC.No.5679 OF 2020 (H) Be. 2021/KER/TIIS\nwho, on instructions, submits that the petitioners\nhave no criminal antecedents.\n\n3. Having considered the gravity of the offences\n\nalleged, nature of the injury caused and having\nperused the affidavit filed by the 2™* respondent, the\ncontents of which are submitted to be true and\nvoluntary, I am satisfied that the dispute is settled and\nno public interest is involved in this matter.\nMoreover, in view of the settlement, possibility of the\ncriminal proceedings ending in conviction is remote.\nAs such, continuance of the proceedings will amount\nto an abuse of process of court and hence, in view of\nthe legal position set out by the Honourable Supreme\nCourt in Madan Mohan Abbot v. State of Punjab\n(2008) 4 SCC 582] and Gian Singh v. State of\nPunjab and another [(2012) 10 SCC 303], there is\nno impediment in granting the relief sought.\n\nBasha\nRee\nCrl.MC.No.5679 OF 2020 (H) A. 202UKER/LIIS\nIn the result, this Crl.M.C is allowed. The\nproceedings in C.C.No.448/2020 on the files of the\nJudicial First Class Magistrate Court-I, Kasargod is\nquashed.\nSd/-\nV.G.ARUN\n\nSB/07/01/2021 JUDGE\n\nLaan\nHelin eet\npee\nBaer\nCr1.MC.No.5679 OF 2020(H Bo. 2021/KER/1118\nAPPENDIX\nPETITIONER'S/S EXHIBITS:\nANNEXURE A CERTIFIED COPY OF THE FIR IN CRIME\nNO. 2/2020 OF KASARAGOD POLICE\nSTATION,\nANNEXURE B CERTIFIED COPY OF THE CHARGE SHEET AS\nAGAINST THE PETITIONERS WHICH WAS\nFILED IN CRIME NO. 2/2020 OF\nKASARAGOD POLICE STATION.\nANNEXURE C CERTIFIED COPY OF THE MEMO OF\nEVIDENCE FILED ALONG WITH ANNEXURE B\nCHARGE SHEET.\nANNEXURE D CERTIFIED COPY OF WOUND CERTIFICATE\nFILED ALONG WITH ANNEXURE B CHARGE\nSHEET.\nANNEXURE E COPY OF THE AFFIDAVIT DATED 4.12.2020\nSWORN BY THE 2ND RESPONDENT\nEVIDENCING SETTLEMENT.\n//true copy// P.A to Judge\n\n"
}