{
    "case_id": "",
    "court": "HIGH COURT OF KERALA AT ERNAKULAM\nPRESENT",
    "date": "5TH DAY OF JANUARY 2015",
    "judge": "P.UBAID\nMONDAY",
    "petitioners": [
        "3RD ACCUSED:",
        "VINESH AGED 23 YEARS",
        "S/O.RADHAKRISHNAN, PALLAYIL HOUSE, TARUR P.O.",
        "ALATHUR TALUK, PALAKKAD DISTRICT."
    ],
    "respondents": [
        "1. STATE OF KERALA",
        "REPRESENTED BY PUBLIC PROSECUTOR",
        "HIGH COURT OF KERALA, ERNAKULAM.",
        "2. SUB INSPECTOR OF POLICE,",
        "ALATHUR POLICE STATION, PALAKKAD DISTRICT.",
        "3. RENJITH S/O.RAJAN,, AGED 23 YEARS",
        "VALAKKARA HOUSE, TARUR P.O., ALATHUR TALUK",
        "PALAKKAD DISTRICT.",
        "R3 BY ADV. SRI.S.KRISHNAKUMAR",
        "R1-2 BY PUBLIC PROSECUTOR SMT. P. MAYA"
    ],
    "sections": [],
    "outcome": "",
    "full_text": "Prey\neae\n2015/KER/28\nIN THE HIGH COURT OF KERALA AT ERNAKULAM\nPRESENT:\nTHE HONOURABLE MR. JUSTICE P.UBAID\nMONDAY, THE 5TH DAY OF JANUARY 2015/15TH POUSHA, 1936\nCril.MC.No. 3299 of 2014 ()\nIN CC 3027/2012 of JUDICIAL FIRST CLASS MAGISTRATE COURT, ALATHUR\nCRIME NO. 331/2010 OF ALATHUR POLICE STATION, PALAKKAD\nPETITIONER(S)/3RD ACCUSED:\nVINESH AGED 23 YEARS\nS/O.RADHAKRISHNAN, PALLAYIL HOUSE, TARUR P.O.\nALATHUR TALUK, PALAKKAD DISTRICT.\nBY ADV. SRILBABY MATHEW\nRESPONDENT(S):\n1. STATE OF KERALA\nREPRESENTED BY PUBLIC PROSECUTOR\nHIGH COURT OF KERALA, ERNAKULAM.\n2. SUB INSPECTOR OF POLICE,\nALATHUR POLICE STATION, PALAKKAD DISTRICT.\n3. RENJITH S/O.RAJAN,, AGED 23 YEARS\nVALAKKARA HOUSE, TARUR P.O., ALATHUR TALUK\nPALAKKAD DISTRICT.\nR3 BY ADV. SRI.S.KRISHNAKUMAR\nR1-2 BY PUBLIC PROSECUTOR SMT. P. MAYA\nTHIS CRIMINAL MISC. CASE HAVING COME UP FOR ADMISSION ON 05-01-2015,\nTHE COURT ON THE SAME DAY PASSED THE FOLLOWING:\nsab\n\neae\neae\n2015/KER/28\nP.UBAID, J.\nCri. M.C No.3299 of 2014\nDated this the 5\" day of January, 2015.\nORDER\nThe learned counsel for the petitioner submits that this Crl.M.C\nis not pressed.\nThis submission is recorded, and the Crl. M.C is dismissed as\nnot pressed.\nP.UBAID,\nJUDGE\nsab\n\n"
}