{
    "case_id": "",
    "court": "HIGH COURT OF KERALA AT ERNAKULAM\nPRESENT",
    "date": "7TH DAY OF DECEMBER 2017",
    "judge": "B.SUDHEENDRA KUMAR\nTHURSDAY",
    "petitioners": [
        "(S) /3RD ACCUSED:",
        "NASIA IBRAHIM,",
        "D/O.A.T.OBRAHIM KUTYY, THOOMAT HOUSE,",
        "ORUMANAYOOR PO.,CHAVAKKAD, THRISSUR-680 512."
    ],
    "respondents": [
        "(S) :",
        "1. STATE OF KERALA",
        "REPRESENTED BY THE PUBLIC PROSECUTOR,",
        "HIGH COURT OF KERALA, ERNAKULAM-682 031.",
        "2. MARY MOLY VARGHESE,",
        "W/O.JOHNSON V GEORGE, PROPRIETOR,",
        "CREATIVE ONE, DOOR NO.28/910, MUNDARKETTACKAL BUILDINGS,",
        "KADAVANTHRA, KOCHI-682 020,",
        "REPRESENTED BY P/A. HOLDER JOHNSON V GEROGE.",
        "R-R2 BY ADV. SRI.SHAHUL HAMEED MOOPPAN",
        "R-R2 BY ADV. SRI.K.M.VARGHESE",
        "Rl BY PUBLIC PROSECUTOR SRI.T.R.RENJITH",
        "THTS CRIMINAL MISC. CASE HAVING BEEN FINALLY HEARD ON 07-12-2017,",
        "THE COURT ON THE SAME DAY PASSED THE FOLLOWING:",
        "STK"
    ],
    "sections": [],
    "outcome": "",
    "full_text": "=o me 5\nmares\nEz haa a\n2017/KER/49551\nIN THE HIGH COURT OF KERALA AT ERNAKULAM\nPRESENT:\nTHE HONOURABLE MR. JUSTICE B.SUDHEENDRA KUMAR\nTHURSDAY, THE 7TH DAY OF DECEMBER 2017/16TH AGRAHAYANA, 1939\nCr1.MC.No. 5216 of 2013 ()\nST 273/2012 of J.M.F.C.-IV, KOCHI\nPETITIONER (S) /3RD ACCUSED:\nNASIA IBRAHIM,\nD/O.A.T.OBRAHIM KUTYY, THOOMAT HOUSE,\nORUMANAYOOR PO.,CHAVAKKAD, THRISSUR-680 512.\nBY ADVS.SRI.C.V.MANUVILSAN\nSRI.G.SUDHEER (THURAVOOR)\nSMT .K.VIDYA\nSRI.RAJAN VISHNURAT\nSRI .V.HARISH\nRESPONDENT (S) :\n1. STATE OF KERALA\nREPRESENTED BY THE PUBLIC PROSECUTOR,\nHIGH COURT OF KERALA, ERNAKULAM-682 031.\n2. MARY MOLY VARGHESE,\nW/O.JOHNSON V GEORGE, PROPRIETOR,\nCREATIVE ONE, DOOR NO.28/910, MUNDARKETTACKAL BUILDINGS,\nKADAVANTHRA, KOCHI-682 020,\nREPRESENTED BY P/A. HOLDER JOHNSON V GEROGE.\nR-R2 BY ADV. SRI.SHAHUL HAMEED MOOPPAN\nR-R2 BY ADV. SRI.K.M.VARGHESE\nRl BY PUBLIC PROSECUTOR SRI.T.R.RENJITH\nTHTS CRIMINAL MISC. CASE HAVING BEEN FINALLY HEARD ON 07-12-2017,\nTHE COURT ON THE SAME DAY PASSED THE FOLLOWING:\nSTK\n\n2017/KER/49551\nB. SUDHEENDRA KUMAR, J.\nCri.M.C. No.5216 of 2013\nDated this the 7 day of December, 2017\nORDER\nWhen this matter has been taken up for hearing, the\nlearned counsel for the petitioner has sought for\npermission to withdraw this Crl.M.C. Permission stands\ngranted and this Crl.M.C. stands dismissed as withdrawn.\n2. The learned counsel for the petitioner has\nsubmitted that the second accused in this case, namely,\nNaeem Ibrahim, who is the brother of the petitioner herein\nhad deposited an amount equivalent to the cheque\namount before the court below at the time of executing\nthe bond and the second accused is prepared to file an\naffidavit before the court below stating that he has no\nobjection in releasing the above said amount to the\nsecond respondent herein, who is the complainant before\nthe court below. The learned counsel for the second\nrespondent herein has submitted that if the above said\namount is released to the second respondent, he is\n\nEuan\n7 make\nBee\n2017/KER/49551\nCrl.M.C. No.5216 of 2013\n-32%-\nprepared to withdraw the complaint.\n\n3. This being the situation, it is directed that if the\nsecond accused in this case files an affidavit before the\ncourt below, within 15 days of receipt of this order stating\nthat he has no objection in releasing the amount\ndeposited by him in favour of the complainant, the court\nbelow shall release the said amount to the complainant, if\nthe complainant is prepared to withdraw the complaint on\nreceipt of the said amount.\n\n| make it clear that the personal attendance of the\npetitioner or the second accused shall not be insisted by\nthe court below for the above purpose.\n\nSd/-\nB. SUDHEENDRA KUMAR,\nJUDGE\nSTK\n/[TRUE COPY//\n//P.A. TO JUDGE//\n\n"
}