{
    "case_id": "",
    "court": "HIGH COURT OF KERALA AT ERNAKULAM\nPRESENT",
    "date": "4TH DAY OF JANUARY 2016",
    "judge": "B.KEMAL PASHA\nMONDAY",
    "petitioners": [
        "ACCUSED 1 - 4:",
        "1. MANEESH, AGED 27 YEARS,",
        "S/O. MAHEEN, RESIDING AT CHERAVALLITHARAYIL,",
        "ERUVA MURI, PATHIYOOR VILLAGE, ALAPPUZHA DISTRICT.",
        "2. SHAN, AGED 26 YEARS,",
        "S/O. SHAMSUDDIN, RESIDING AT CHARUMMOOTTIL THARAYIL,",
        "ERUVA MURI, PATHIYOOR VILLAGE, ALAPPUZHA DISTRICT.",
        "3. MUHAMMED @ MADAMPI, AGED 28 YEARS,",
        "S/O. MUHAMMED KUNJU, KURANGASHERIL, ERUVA MURI,",
        "PATHIYOOR VILLAGE, ALAPPUZHA DISTRICT.",
        "4. ASHARAF, AGED 25 YEARS,",
        "S/O. ABDUL SALAM, RESIDING AT THAYYIL VADAKKATHIL,",
        "KANNAMPALLY BHAGOM MURI, KEERIKKAD VILLAGE,",
        "ALAPPUZHA DISTRICT."
    ],
    "respondents": [
        "STATE AND CW1:",
        "1. STATE OF KERALA, REPRESENTED"
    ],
    "sections": [],
    "outcome": "",
    "full_text": "s im ail\nEee\n2016/KER/58\nIN THE HIGH COURT OF KERALA AT ERNAKULAM\nPRESENT:\nTHE HONOURABLE MR. JUSTICE B.KEMAL PASHA\nMONDAY, THE 4TH DAY OF JANUARY 2016/14TH POUSHA, 1937\nCri.MC.No. 7638 of 2015\nSC 1024/2011 OF ASSISTANT SESSIONS COURT, MAVELIKKARA\nCRIME NO. 630/2010 OF KAYAMKULAM POLICE STATION, ALAPPUZHA\nPETITIONER(S)/ACCUSED 1 - 4:\n1. MANEESH, AGED 27 YEARS,\nS/O. MAHEEN, RESIDING AT CHERAVALLITHARAYIL,\nERUVA MURI, PATHIYOOR VILLAGE, ALAPPUZHA DISTRICT.\n2. SHAN, AGED 26 YEARS,\nS/O. SHAMSUDDIN, RESIDING AT CHARUMMOOTTIL THARAYIL,\nERUVA MURI, PATHIYOOR VILLAGE, ALAPPUZHA DISTRICT.\n3. MUHAMMED @ MADAMPI, AGED 28 YEARS,\nS/O. MUHAMMED KUNJU, KURANGASHERIL, ERUVA MURI,\nPATHIYOOR VILLAGE, ALAPPUZHA DISTRICT.\n4. ASHARAF, AGED 25 YEARS,\nS/O. ABDUL SALAM, RESIDING AT THAYYIL VADAKKATHIL,\nKANNAMPALLY BHAGOM MURI, KEERIKKAD VILLAGE,\nALAPPUZHA DISTRICT.\nBY ADVS.SRI.K.SHAJ\nSRILSAJJU.S\nSRILRENJIT GEORGE\nSMTANJU MOHAN\nSRI.S.VISHNU (ARIKKATTIL)\nSRI.C.IJLAL\nRESPONDENT(S)/STATE AND CW1:\n1. STATE OF KERALA, REPRESENTED\nBY THE PUBLIC PROSECUTOR, HIGH COURT OF KERALA,\nERNAKULAM - 682 0371.\n2. RAJESH,\nS/O. THANKAPPAN, MANNANSHERIVEETIL, VALIYAPARAMBIL,\nERUVA MURI, PATHIYOOR VILLAGE, KAYAMKULAM.\nR1 BY PUBLIC PROSECUTOR SMT.SAREENA\nR2 BY ADV. SRI.SERG!] JOSEPH THOMAS\nTHIS CRIMINAL MISC. CASE HAVING COME UP FOR ADMISSION\nON 04-01-2016, THE COURT ON THE SAME DAY PASSED THE FOLLOWING:\nPJ\n\nPee ao)\napa\n2016/KER/58\nB. KEMAL PASHA, J.\nCRL.M.C. No. 7638 of 2015\nDated this the 4\" day of January, 2016\nORDER\nLearned counsel for the petitioners seeks permission\nto withdraw from this Crl.M.C. Permission is granted.\nAccordingly, this Crl.M.C is dismissed as withdrawn.\nSd/- B.KEMAL PASHA, JUDGE\nul/-\n[True copy] PS. to Judge\n\n"
}