{
    "case_id": "",
    "court": "HIGH COURT OF KERALA AT ERNAKULAM\nPRESENT",
    "date": "3RD DAY OF AUGUST 2016",
    "judge": "RAJA VIJAYARAGHAVAN V\nWEDNESDAY",
    "petitioners": [
        "(S) :",
        "1. SHIJU,",
        "AGED 22 YEARS, s/o. KUNJIREVI,",
        "RESIDING AT THAMARATH HOUSE, THELEKKAD P.O.,",
        "VETTATHUR, PERINTHALMANNA TALUK,",
        "MALAPPURAM - 679 325.",
        "2. SREEJITH,",
        "AGED 25 YEARS, S/O. UNNIKUNJU,",
        "PULIKKAL HOUSE, THELAKKAD P.O., VETTATHUR,",
        "PERINTHALMANNA TALUK, MALAPPURAM-679 325.",
        "3. MUHAMMED ILLIYAS,",
        "AGED 24 YEARS, S/O. ABDUL HAMEED,",
        "THAMRATH HOUSE, THELAKKAD P.O.,",
        "VETTATHUR, PERINTHALMANNA TALUK,",
        "MALAPPURAM-679 325.",
        "4. SREERAG,",
        "AGED 22 YEARS, S/O.UNNIKUNJU,",
        "PULIKKAL HOUSE, THELAKKAD P.0O.,",
        "VETTATHUR, PERINTHALMANNA TALUK,",
        "MALAPPURAM- 679 325.",
        "5. SHAMSUDEEN,",
        "AGED 19 YEARS, S/o. ABOOBACKER,",
        "THAMARATH HOUSE, THELAKKAD P.O.,",
        "VETTATHUR, PERINTHALMANNA TALUK,",
        "MALAPPURAM- 679 325.",
        "6. SAIFUDHEEN,",
        "AGED 27 YEARS, s/o. ABOOBACKER,",
        "THAMARATH, THELAKKAD P.O.,",
        "VETTATHUR, PERINTHALMANNA TALUK,",
        "MALAPPURAM- 679 325."
    ],
    "respondents": [
        "(S) :",
        "1. THE STATE OF KERALA,",
        "REPRESENTED BY THE PUBLIC PROSECUTOR,",
        "HIGH COURT OF KERALA, ERNAKULAM, COCHIN-682 011.",
        "2. MANIKANDAN,",
        "AGED 30 YEARS, s/o. RAMAN ,",
        "RESIDING AT THIRUTHIYIL HOUSE,",
        "THIRUTHIYIL COLONY, THELAKKAD P.O.,",
        "MALAPPURAM DISTRICT - 676 101.",
        "Rl BY PUBLIC PROSECUTOR SMT.PUSHPALATHA M.K.",
        "R2 BY ADV. SRI.NIRMAL V NAIR"
    ],
    "sections": [
        "143",
        "147",
        "323",
        "506",
        "149\nIPC",
        "Section 3"
    ],
    "outcome": "ORDER\n\n1.The petitioners herein are the accused Nos. 1 to 6 in\nCrime No.234 of 2016 of the Melattur Police Station. They\nare proceeded against for having committed offences\npunishable under Sections 143, 147, 323, 506 and 149\nIPC and Section 3(1)(v) of the SC/ST (Prevention of\nAtrocities) Act, 1989. The 2™ respondent is the victim.\n\n2.The instant petition is filed under Section 482 of the Code\nof Criminal Procedure banking on the ratio of the\nJudgment rendered by the Apex Court in Gian Singh v.\nState of Punjab ( 2012 (4) KLT 108) and a series of\nother cases which include Narinder Singh and others v.\nState of Punjab and another (2014) 6 SCC 466) and\n\nBEE\n2016/KER/33879\n\nCril.M.C. No.4312 of 2016 -2-\nYogendra Yadav and others V State of Jharkhand\n[2014 (9) SCC 653] with a prayer to quash the above\nproceeding.\n\n3.The sole ground is that the Apex Court in the above\njudgments have delineated the circumstances and the\ncases in which inherent powers under Section 482 can be\ninvoked de hors section 320 of the Code of Criminal\nProcedure for recognizing out of court settlement for the\npurpose of quashing criminal proceedings. It is prayed\nthat powers under Section 482 of the Code of Criminal\nProcedure be invoked to quash the criminal proceedings .\n\n4.It is submitted that the parties have reached an out of\ncourt settlement and there is no acrimony between them\nat present. All the disputes have been amicably resolved\nand they desire to live in peace and harmony. The 2\"\nrespondent has sworn to an affidavit wherein he asserts\nthat he has no objection in terminating the proceedings.\n\nbree)\n2016/KER/33879\n\nCril.M.C. No.4312 of 2016 -3-\n\n5.The crux of the prosecution allegation is that on\n26.05.2016 at about 8.30 p.m., the petitioners along with\nother accused formed themselves into an_ unlawful\nassembly and _ voluntarily caused hurt to the 2\"\nrespondent.\n\n6.The learned Public Prosecutor, on instructions, submits\nthat no other cases of heinous nature are reported\nagainst the petitioners.\n\n7.1 have bestowed my anxious consideration to the\nsubmissions made across the bar and I have also gone\nthrough the materials on record.\n\n8.The victim has sworn to an affidavit wherein it is asserted\nthat he has no objection in allowing the petition and in\nquashing the proceedings as all the disputes between the\nparties have been resolved and the parties are living in\npeace and harmony .\n\n9.It appears to me that the offence is entirely personal in\n\napa\n2016/KER/33879\n\nCril.M.C. No.4312 of 2016 -4-\nnature and do not affect public peace or tranquility. It is\nalso felt that quashing of proceedings on account of\ncompromise would bring about peace. In a case such as\nthe instant one, even if the prosecution is allowed to\ncontinue, it would not serve any purpose as the possibility\nof conviction is remote and bleak. It can only result in\nputting the de facto complainant and the accused to\nunwanted oppression and prejudice. Settlement will augur\nwell for the interest of the community and will enable the\nparties to live in peace and harmony.\n\n10.. am of the view that this Court is well justified in\nquashing the impugned proceedings as the instant case\nfalls within the matrix of guidelines issued by the Apex\nCourt in Gian Singh ( Supra ) and the other cases\nreferred to above.\n\nIn the result, this petition is allowed. All further\nproceedings against the petitioners, who are the accused\n\npee\n2016/KER/33879\n\nCri.M.C. No.4312 of 2016 -~5-\n\nNos. 1 to 6 in Crime No.234 of 2016 of the Melattur Police\n\nStation, are quashed",
    "full_text": "leet\naoe\nBarta\nBees\n2016/KER/33879\nIN THE HIGH COURT OF KERALA AT ERNAKULAM\nPRESENT:\nTHE HONOURABLE MR. JUSTICE RAJA VIJAYARAGHAVAN V\nWEDNESDAY, THE 3RD DAY OF AUGUST 2016/12TH SRAVANA, 1938\nCr1.MC.No. 4312 of 2016\nCRIME NO. 234/2016 OF MELATTUR POLICE STATION, MALAPPURAM\nPETITIONER (S) :\n1. SHIJU,\nAGED 22 YEARS, s/o. KUNJIREVI,\nRESIDING AT THAMARATH HOUSE, THELEKKAD P.O.,\nVETTATHUR, PERINTHALMANNA TALUK,\nMALAPPURAM - 679 325.\n2. SREEJITH,\nAGED 25 YEARS, S/O. UNNIKUNJU,\nPULIKKAL HOUSE, THELAKKAD P.O., VETTATHUR,\nPERINTHALMANNA TALUK, MALAPPURAM-679 325.\n3. MUHAMMED ILLIYAS,\nAGED 24 YEARS, S/O. ABDUL HAMEED,\nTHAMRATH HOUSE, THELAKKAD P.O.,\nVETTATHUR, PERINTHALMANNA TALUK,\nMALAPPURAM-679 325.\n4. SREERAG,\nAGED 22 YEARS, S/O.UNNIKUNJU,\nPULIKKAL HOUSE, THELAKKAD P.0O.,\nVETTATHUR, PERINTHALMANNA TALUK,\nMALAPPURAM- 679 325.\n5. SHAMSUDEEN,\nAGED 19 YEARS, S/o. ABOOBACKER,\nTHAMARATH HOUSE, THELAKKAD P.O.,\nVETTATHUR, PERINTHALMANNA TALUK,\nMALAPPURAM- 679 325.\n6. SAIFUDHEEN,\nAGED 27 YEARS, s/o. ABOOBACKER,\nTHAMARATH, THELAKKAD P.O.,\nVETTATHUR, PERINTHALMANNA TALUK,\nMALAPPURAM- 679 325.\nBY ADV. SRI.SURAJ S.\nmsv/\n-2-\n\nBarta\n2016/KER/33879\n-2-\nCr1.MC.No. 4312 of 2016\nRESPONDENT (S) :\n1. THE STATE OF KERALA,\nREPRESENTED BY THE PUBLIC PROSECUTOR,\nHIGH COURT OF KERALA, ERNAKULAM, COCHIN-682 011.\n2. MANIKANDAN,\nAGED 30 YEARS, s/o. RAMAN ,\nRESIDING AT THIRUTHIYIL HOUSE,\nTHIRUTHIYIL COLONY, THELAKKAD P.O.,\nMALAPPURAM DISTRICT - 676 101.\nRl BY PUBLIC PROSECUTOR SMT.PUSHPALATHA M.K.\nR2 BY ADV. SRI.NIRMAL V NAIR\nTHIS CRIMINAL MISC. CASE HAVING COME UP FOR ADMISSION\nON 03-08-2016, THE COURT ON THE SAME DAY PASSED THE\nFOLLOWING:\nmsv/\n\nwy et\nane\n2016/KER/33879\nCr1.MC.No. 4312 of 2016\nAPPENDIX\nPETITIONER (S) ' ANNEXURES:\nANNEXURE A: COPY OF THE FIR IN CRIME NO.234/2016 OF THE MELATTOOR\nPOLICE STAITON.\nANNEXURE B: AFFIDAVIT FILED BY 2ND RESPONDENT.\nRESPONDENT (S)' ANNEXURE:\nNIL\n//TRUE COPY//\nP.S.TO JUDGE\nMsv/\n\neats\n2016/KER/33879\nRAJA VIJAYARAGHAVAN, V., J.\nDated this the 3 day of August, 2016\nORDER\n\n1.The petitioners herein are the accused Nos. 1 to 6 in\nCrime No.234 of 2016 of the Melattur Police Station. They\nare proceeded against for having committed offences\npunishable under Sections 143, 147, 323, 506 and 149\nIPC and Section 3(1)(v) of the SC/ST (Prevention of\nAtrocities) Act, 1989. The 2™ respondent is the victim.\n\n2.The instant petition is filed under Section 482 of the Code\nof Criminal Procedure banking on the ratio of the\nJudgment rendered by the Apex Court in Gian Singh v.\nState of Punjab ( 2012 (4) KLT 108) and a series of\nother cases which include Narinder Singh and others v.\nState of Punjab and another (2014) 6 SCC 466) and\n\nBEE\n2016/KER/33879\n\nCril.M.C. No.4312 of 2016 -2-\nYogendra Yadav and others V State of Jharkhand\n[2014 (9) SCC 653] with a prayer to quash the above\nproceeding.\n\n3.The sole ground is that the Apex Court in the above\njudgments have delineated the circumstances and the\ncases in which inherent powers under Section 482 can be\ninvoked de hors section 320 of the Code of Criminal\nProcedure for recognizing out of court settlement for the\npurpose of quashing criminal proceedings. It is prayed\nthat powers under Section 482 of the Code of Criminal\nProcedure be invoked to quash the criminal proceedings .\n\n4.It is submitted that the parties have reached an out of\ncourt settlement and there is no acrimony between them\nat present. All the disputes have been amicably resolved\nand they desire to live in peace and harmony. The 2\"\nrespondent has sworn to an affidavit wherein he asserts\nthat he has no objection in terminating the proceedings.\n\nbree)\n2016/KER/33879\n\nCril.M.C. No.4312 of 2016 -3-\n\n5.The crux of the prosecution allegation is that on\n26.05.2016 at about 8.30 p.m., the petitioners along with\nother accused formed themselves into an_ unlawful\nassembly and _ voluntarily caused hurt to the 2\"\nrespondent.\n\n6.The learned Public Prosecutor, on instructions, submits\nthat no other cases of heinous nature are reported\nagainst the petitioners.\n\n7.1 have bestowed my anxious consideration to the\nsubmissions made across the bar and I have also gone\nthrough the materials on record.\n\n8.The victim has sworn to an affidavit wherein it is asserted\nthat he has no objection in allowing the petition and in\nquashing the proceedings as all the disputes between the\nparties have been resolved and the parties are living in\npeace and harmony .\n\n9.It appears to me that the offence is entirely personal in\n\napa\n2016/KER/33879\n\nCril.M.C. No.4312 of 2016 -4-\nnature and do not affect public peace or tranquility. It is\nalso felt that quashing of proceedings on account of\ncompromise would bring about peace. In a case such as\nthe instant one, even if the prosecution is allowed to\ncontinue, it would not serve any purpose as the possibility\nof conviction is remote and bleak. It can only result in\nputting the de facto complainant and the accused to\nunwanted oppression and prejudice. Settlement will augur\nwell for the interest of the community and will enable the\nparties to live in peace and harmony.\n\n10.. am of the view that this Court is well justified in\nquashing the impugned proceedings as the instant case\nfalls within the matrix of guidelines issued by the Apex\nCourt in Gian Singh ( Supra ) and the other cases\nreferred to above.\n\nIn the result, this petition is allowed. All further\nproceedings against the petitioners, who are the accused\n\npee\n2016/KER/33879\n\nCri.M.C. No.4312 of 2016 -~5-\n\nNos. 1 to 6 in Crime No.234 of 2016 of the Melattur Police\n\nStation, are quashed.\n\nSd/-\nRAJA VIJAYARAGHAVAN, V.\nJUDGE\n\nPs/5/8/16\n\n"
}