{
    "case_id": "Crl.MC.No. 8511 of 2018",
    "court": "HIGH COURT OF KERALA AT ERNAKULAM",
    "date": "7TH DAY OF JANUARY 2019",
    "judge": "RAJA VIJAYARAGHAVAN V\nMONDAY",
    "petitioners": [
        "S/ACCUSED NOS.1 TO 4:",
        "1 SUKESH.K,",
        "AGED 38 YEARS,",
        "S/O KUNHIRAMAN, KARIYIL HOUSE, KILIYALAM,",
        "P.O.KAYARALAM, KANNUR-60602.",
        "2 KARTHIYANI .K,",
        "AGED 75 YEARS,",
        "W/O KUNHIRAMAN, KARIYIL HOUSE, KILIYALAM,",
        "P.O.KAYARALAM, KANNUR-60602.",
        "3 SUSHEEALA K,",
        "AGED 55 YEARS,",
        "W/O KUNHIRAMAN, MACHERY HOUSE, KUTTIYATOOR, KANUUR.",
        "4 SARADA.K,",
        "AGED 49 YEARS,",
        "W/O BHASKARAN, SREENILYAM, CHELERI, KANNUR."
    ],
    "respondents": [
        "S/DE FACTO COMPLAINANT /STATE:",
        "1 SHABINA P.P,",
        "AGED 29 YEARS,",
        "D/O M.ACHUTHAN, SHABINA NIVAS, P.O.KOLACHERI, KANNUR-",
        "670 601.",
        "2 STATE OF KERALA,",
        "REP.BY PUBLIC PROSECUTOR, HIGH COURT OF KERALA,",
        "ERNAKULAM 682 031.",
        "Rl BY ADV. SRI.R.SREEHARI",
        "R2 BY SRI B JAYASURYA, PUBLIC PROSECUTOR"
    ],
    "sections": [
        "482 of the Code of\nCriminal Procedure"
    ],
    "outcome": "ORDER\n\nThis petition is filed under Section 482 of the Code of\nCriminal Procedure (“the Code” for brevity).\n\n2. The 1* respondent is the de facto complainant in Crime\nNo.430 of 2018 of the Mayyil Police Station. The 1* petitioner is\nthe husband of the de facto complainant. The petitioners 2 to 4\nare his near relatives. They are being proceeded against for\nhaving committed offence punishable under Section 498A r/w.\nSection 34 of the IPC.\n\n3. The instant proceeding is initiated with a prayer to\nquash the proceedings on the ground of settlement of all disputes.\nThe 1* respondent has filed an affidavit stating that she does not\nwish to continue with the prosecution proceedings against the\npetitioners.\n\n4. The learned Public Prosecutor has obtained instructions.\nHe submits that the statement of the 1 respondent has been\nrecorded and the State has no objection in terminating the\nproceedings as it involves no public interest.\n\naa\nCrl.MC.No. 8511 of 2018 3 201KERIOS6\n\n5. I have considered the submissions advanced.\n\n6. In Gian Singh v. State of Punjab [(2012) 10 SCC\n303] and in Narinder Singh v. State of Punjab [(2014) 6 SCC\n466], the Apex Court has laid down that in appropriate cases, the\nHigh Court can take note of the amicable resolution of disputes\nbetween the victim and the wrongdoer to put an end to the\ncriminal proceedings. Further in Jitendra Raghuvanshi &\nOthers v. Babita Raghuvanshi & Another [(2013) 4 SCC 58], it\nwas observed that it is the duty of the courts to encourage\ngenuine settlements of matrimonial disputes. If the parties ponder\nover their faults and terminate their disputes amicably by mutual\nagreement instead of fighting it out in a court of law, the courts\nshould not hesitate to exercise its powers under Section 482 of the\nCode. Permitting such proceedings to continue would be nothing,\nbut an abuse of process of court. The interest of justice also\nrequire that the proceedings be quashed",
    "full_text": "ay ae\nnee ae ”\nBle sas\nIN THE HIGH COURT OF KERALA AT ERNAKULAM 2019/KERIO56\nPRESENT\nTHE HONOURABLE MR. JUSTICE RAJA VIJAYARAGHAVAN V\nMONDAY, THE O7TH DAY OF JANUARY 2019 / 17TH POUSHA, 1940\nCr1.MC.No. 8511 of 2018\nCMP 2291/2018 of JUDICIAL FIRST CLASS MAGISTRATE COURT-II, KANNUR\nCRIME NO. 430/2018 OF MAYYIL POLICE STATION, Kannur\nPETITIONERS/ACCUSED NOS.1 TO 4:\n1 SUKESH.K,\nAGED 38 YEARS,\nS/O KUNHIRAMAN, KARIYIL HOUSE, KILIYALAM,\nP.O.KAYARALAM, KANNUR-60602.\n2 KARTHIYANI .K,\nAGED 75 YEARS,\nW/O KUNHIRAMAN, KARIYIL HOUSE, KILIYALAM,\nP.O.KAYARALAM, KANNUR-60602.\n3 SUSHEEALA K,\nAGED 55 YEARS,\nW/O KUNHIRAMAN, MACHERY HOUSE, KUTTIYATOOR, KANUUR.\n4 SARADA.K,\nAGED 49 YEARS,\nW/O BHASKARAN, SREENILYAM, CHELERI, KANNUR.\nBY ADV. SRI.K.RAJESH SUKUMARAN\nRESPONDENTS/DE FACTO COMPLAINANT /STATE:\n1 SHABINA P.P,\nAGED 29 YEARS,\nD/O M.ACHUTHAN, SHABINA NIVAS, P.O.KOLACHERI, KANNUR-\n670 601.\n2 STATE OF KERALA,\nREP.BY PUBLIC PROSECUTOR, HIGH COURT OF KERALA,\nERNAKULAM 682 031.\nRl BY ADV. SRI.R.SREEHARI\nR2 BY SRI B JAYASURYA, PUBLIC PROSECUTOR\nTHIS CRIMINAL MISC. CASE HAVING COME UP FOR ADMISSION ON\n07.01.2019, THE COURT ON THE SAME DAY PASSED THE FOLLOWING:\n\nEERE\n\nee\n\nCrl.MC.No. 8511 of 2018 2 2019/KERI656\nORDER\n\nThis petition is filed under Section 482 of the Code of\nCriminal Procedure (“the Code” for brevity).\n\n2. The 1* respondent is the de facto complainant in Crime\nNo.430 of 2018 of the Mayyil Police Station. The 1* petitioner is\nthe husband of the de facto complainant. The petitioners 2 to 4\nare his near relatives. They are being proceeded against for\nhaving committed offence punishable under Section 498A r/w.\nSection 34 of the IPC.\n\n3. The instant proceeding is initiated with a prayer to\nquash the proceedings on the ground of settlement of all disputes.\nThe 1* respondent has filed an affidavit stating that she does not\nwish to continue with the prosecution proceedings against the\npetitioners.\n\n4. The learned Public Prosecutor has obtained instructions.\nHe submits that the statement of the 1 respondent has been\nrecorded and the State has no objection in terminating the\nproceedings as it involves no public interest.\n\naa\nCrl.MC.No. 8511 of 2018 3 201KERIOS6\n\n5. I have considered the submissions advanced.\n\n6. In Gian Singh v. State of Punjab [(2012) 10 SCC\n303] and in Narinder Singh v. State of Punjab [(2014) 6 SCC\n466], the Apex Court has laid down that in appropriate cases, the\nHigh Court can take note of the amicable resolution of disputes\nbetween the victim and the wrongdoer to put an end to the\ncriminal proceedings. Further in Jitendra Raghuvanshi &\nOthers v. Babita Raghuvanshi & Another [(2013) 4 SCC 58], it\nwas observed that it is the duty of the courts to encourage\ngenuine settlements of matrimonial disputes. If the parties ponder\nover their faults and terminate their disputes amicably by mutual\nagreement instead of fighting it out in a court of law, the courts\nshould not hesitate to exercise its powers under Section 482 of the\nCode. Permitting such proceedings to continue would be nothing,\nbut an abuse of process of court. The interest of justice also\nrequire that the proceedings be quashed. Having considered all\nthe relevant circumstances, I am of the considered view that this\nCourt will be well justified in invoking its extra ordinary powers\nunder Section 482 of the Code to quash the proceedings.\n\nIn the result, this petition will stand allowed.\n\nBRA R\nCrl.MC.No. 8511 of 2018 4 2019/KERIS6\nAnnexure-A3 final report and all proceedings pursuant thereto\nagainst the petitioners now pending as C.C.No.1161 of 2018 on\nthe file of the Judicial Magistrate Magistrate of First Class-II,\nKannur are quashed.\nSd/-\nRAJA VIJAYARAGHAVAN V\nJUDGE\npsvi-\n\noy an\nroe ae ”\nBle sas\nCr1.MC.No, 8511 of 2018 5 2019/KERI656\nAPPENDIX\nPETITIONER'S/S EXHIBITS:\nANNEXURE Al CERTIFIED COPY OF THE PRIVATE COMPLAINT CMP\n2291/2018 FILED BY THE 1ST RESPONDENT\nBEFORE THE 741 JUDICIAL FIRST CLASS\nMAGISTRATE COURT, NO 11,KANNUR\nANNEXURE A2 CERTIFIED COPY OF THE FIR IN CRIME NO\n4300/2018 OF MAYYIL POLICE STATION\nANNEXURE A3 CERTIFIED COPY OF THE FINAL REPORT IN CRIME\nNO 430/2018 OF MAYYIL POLICE STATION\nANNEXURE 4 SWORN AFFIDAVIT DATED 6.12.2018 OF THE 1ST\nRESPONDENT.\nRESPONDENT'S/S EXHIBITS:\nNIL\n//TRUE CoPYy//\nP.A.TO JUDGE\n\n"
}