{
    "case_id": "",
    "court": "HIGH COURT OF KERALA AT ERNAKULAM\nPRESENT\nTHE HONOURABLE MR",
    "date": "8TH DAY OF JANUARY 2020",
    "judge": "P.B.SURESH KUMAR\nWEDNESDAY",
    "petitioners": [
        "SOLE ACCUSED:",
        "SHAJAHAN @ SHAJI,",
        "AGED 60 YEARS, S/O. BADHARUDFEN, RESIDING AT",
        "S.R.MANZIL , NEAR M.E.S. SCHOOL, PATTARUMUKKU,",
        "THAZHUTHALA VILLAGE, KOLLAM"
    ],
    "respondents": [
        "S/STATE AND DE-FACTO COMPLAINANT:",
        "1 THE STATE OF KERALA",
        "REPRESENTED BY THE PUBLIC PROSECUTOR,",
        "HIGH COURT OF KERALA AT ERNAKULAM-682 031",
        "2 THE STATION HOUSE OFFICER,",
        "KOTTIYAM POLICE STATION, KOLLAM DISTRICT,",
        "REPRESENTED THE PUBLIC PROSECUTOR,",
        "HIGH COURT OF KERALA AT ERNAKULAM-682 031",
        "3 RASHEEDA BEEVI,",
        "AGED 55 YEARS, D/O. SULEKHA BEEVI, RESIDING AT",
        "S.R.MANZIL (VADAKKEVILA VEEDU) , VADAKKUMKARA",
        "CHERRY, UMAYANALOOR, THAZHUTHALA VILLAGE, KOLLAM-",
        "691 589",
        "R3 BY ADV. S.JAYAKUMAR (PANAMBIL)"
    ],
    "sections": [
        "482 of\nthe Code of Criminal Procedure for quashing Annexure"
    ],
    "outcome": "ORDER IN CC 2374/2016 OF JUDICIAL MAGISTRATE OF\nFIRST CLASS -II, KOLLAM\nCRIME NO.1449/2016 OF KOTTIYAM POLICE STATION, KOLLAM\nPETITIONER/SOLE ACCUSED:\nSHAJAHAN @ SHAJI,\nAGED 60 YEARS, S/O. BADHARUDFEN, RESIDING AT\nS.R.MANZIL , NEAR M.E.S. SCHOOL, PATTARUMUKKU,\nTHAZHUTHALA VILLAGE, KOLLAM\nBY ADV. SRI.S.SREEKUMAR (KOLLAM)\nRESPONDENTS/STATE AND DE-FACTO COMPLAINANT:\n1 THE STATE OF KERALA\nREPRESENTED BY THE PUBLIC PROSECUTOR,\nHIGH COURT OF KERALA AT ERNAKULAM-682 031\n2 THE STATION HOUSE OFFICER,\nKOTTIYAM POLICE STATION, KOLLAM DISTRICT,\nREPRESENTED THE PUBLIC PROSECUTOR,\nHIGH COURT OF KERALA AT ERNAKULAM-682 031\n3 RASHEEDA BEEVI,\nAGED 55 YEARS, D/O. SULEKHA BEEVI, RESIDING AT\nS.R.MANZIL (VADAKKEVILA VEEDU) , VADAKKUMKARA\nCHERRY, UMAYANALOOR, THAZHUTHALA VILLAGE, KOLLAM-\n691 589\nR3 BY ADV. S.JAYAKUMAR (PANAMBIL)\nSRI.SANTHOSH PETER PP\nTHIS CRIMINAL MISC. CASE HAVING COME UP FOR ADMISSION ON\n08.01.2020, THE COURT ON THE SAME DAY PASSED THE FOLLOWING:\n\nBeyeg\noo\na\n2020/KER/674\nCrl.M.C. No.106 of 2020 2\nCri.M.C.No.106 of 2020\nORDER\n\nThis is a proceedings instituted under Section 482 of\nthe Code of Criminal Procedure for quashing Annexure - A2 final\nreport and all further proceedings pursuant thereto now\npending as CC No.2374 of 2016 on the files of the Court of the\nJudicial Magistrate of First Class - Il, Kollam.\n\n2. The petitioner is the sole accused in the said\ncase. The case was one instituted at the instance of the third\nrespondent under Sections 506(i) and 294(b) of the Indian\nPenal Code and Section 31(1) of the Protection of women from\nDomestic Violence Act, 2005\n\n3. It is seen that the third respondent had settled\nher disputes with the petitioner and an affidavit to that effect\nhas been produced as Annexure A3.\n\n4. Heard the learned counsel for the petitioner,\nthe learned Public Prosecutor as also the learned counsel for\nthe third respondent.\n\nBEA\n2020/KER/674\nCrl.M.C. No.106 of 2020 3\n\n5. In the light of the decision of the Apex Court in\nGian singh v. State of Punjab, (2012) 10 SCC 303, insofar\nas the offences alleged against the petitioner are only offences\npunishable under Sections 506(i) and 294(b) of the Indian Penal\nCode and Section 31(1) of the Protection of women from\nDomestic Violence Act, 2005, | am of the view that this is an\nappropriate case where this court has to invoke the jurisdiction\nunder Section 482 of the Code of Criminal Procedure to quash\nthe proceedings against the petitioner.\n\nIn the result, the Crl.M.C. is allowed and Annexure-A2\nfinal report and all further proceedings pursuant thereto against\nthe petitioner pending as CC No.2374 of 2016 on the files of the\nCourt of the Judicial Magistrate of First Class - Il, Kollam are\nquashed",
    "full_text": "Ta]\n2 afte\nBs eet\n2020/KER/674\nIN THE HIGH COURT OF KERALA AT ERNAKULAM\nPRESENT\nTHE HONOURABLE MR. JUSTICE P.B.SURESH KUMAR\nWEDNESDAY, THE O8TH DAY OF JANUARY 2020 / 18TH POUSHA, 1941\nCr1.MC.No.106 OF 2020(C)\nAGAINST THE ORDER IN CC 2374/2016 OF JUDICIAL MAGISTRATE OF\nFIRST CLASS -II, KOLLAM\nCRIME NO.1449/2016 OF KOTTIYAM POLICE STATION, KOLLAM\nPETITIONER/SOLE ACCUSED:\nSHAJAHAN @ SHAJI,\nAGED 60 YEARS, S/O. BADHARUDFEN, RESIDING AT\nS.R.MANZIL , NEAR M.E.S. SCHOOL, PATTARUMUKKU,\nTHAZHUTHALA VILLAGE, KOLLAM\nBY ADV. SRI.S.SREEKUMAR (KOLLAM)\nRESPONDENTS/STATE AND DE-FACTO COMPLAINANT:\n1 THE STATE OF KERALA\nREPRESENTED BY THE PUBLIC PROSECUTOR,\nHIGH COURT OF KERALA AT ERNAKULAM-682 031\n2 THE STATION HOUSE OFFICER,\nKOTTIYAM POLICE STATION, KOLLAM DISTRICT,\nREPRESENTED THE PUBLIC PROSECUTOR,\nHIGH COURT OF KERALA AT ERNAKULAM-682 031\n3 RASHEEDA BEEVI,\nAGED 55 YEARS, D/O. SULEKHA BEEVI, RESIDING AT\nS.R.MANZIL (VADAKKEVILA VEEDU) , VADAKKUMKARA\nCHERRY, UMAYANALOOR, THAZHUTHALA VILLAGE, KOLLAM-\n691 589\nR3 BY ADV. S.JAYAKUMAR (PANAMBIL)\nSRI.SANTHOSH PETER PP\nTHIS CRIMINAL MISC. CASE HAVING COME UP FOR ADMISSION ON\n08.01.2020, THE COURT ON THE SAME DAY PASSED THE FOLLOWING:\n\nBeyeg\noo\na\n2020/KER/674\nCrl.M.C. No.106 of 2020 2\nCri.M.C.No.106 of 2020\nORDER\n\nThis is a proceedings instituted under Section 482 of\nthe Code of Criminal Procedure for quashing Annexure - A2 final\nreport and all further proceedings pursuant thereto now\npending as CC No.2374 of 2016 on the files of the Court of the\nJudicial Magistrate of First Class - Il, Kollam.\n\n2. The petitioner is the sole accused in the said\ncase. The case was one instituted at the instance of the third\nrespondent under Sections 506(i) and 294(b) of the Indian\nPenal Code and Section 31(1) of the Protection of women from\nDomestic Violence Act, 2005\n\n3. It is seen that the third respondent had settled\nher disputes with the petitioner and an affidavit to that effect\nhas been produced as Annexure A3.\n\n4. Heard the learned counsel for the petitioner,\nthe learned Public Prosecutor as also the learned counsel for\nthe third respondent.\n\nBEA\n2020/KER/674\nCrl.M.C. No.106 of 2020 3\n\n5. In the light of the decision of the Apex Court in\nGian singh v. State of Punjab, (2012) 10 SCC 303, insofar\nas the offences alleged against the petitioner are only offences\npunishable under Sections 506(i) and 294(b) of the Indian Penal\nCode and Section 31(1) of the Protection of women from\nDomestic Violence Act, 2005, | am of the view that this is an\nappropriate case where this court has to invoke the jurisdiction\nunder Section 482 of the Code of Criminal Procedure to quash\nthe proceedings against the petitioner.\n\nIn the result, the Crl.M.C. is allowed and Annexure-A2\nfinal report and all further proceedings pursuant thereto against\nthe petitioner pending as CC No.2374 of 2016 on the files of the\nCourt of the Judicial Magistrate of First Class - Il, Kollam are\nquashed.\n\nSd/-\nP.B.SURESH KUMAR, JUDGE.\nYKB\n\nkerr\nLa\nBs eet\n2020/KER/674\nCrl.M.C. No.106 of 2020 4\nAPPENDIX\nPETITIONER'S/S EXHIBITS:\nANNEXURE-A1 A TRUE COPY OF THE FIR IN CRIME\nNO.1449/2016 DATED 05.06.2016 OF THE\nKOTTIYAM POLICE STATION\nANNEXURE-A2 A TRUE COPY OF THE CHARGE/FINAL REPORT\nON THE FILE OF THE JUDICIAL FIRST\nCLASS MAGISTRATE COURT-II, KOLLAM IN\nC.C.NO.2374 OF 2016\nANNEXURE-A3 A TRUE COPY OF THE AFFIDAVIT DATED\n24.12.2019 HAS BEEN SWORN BY THE THIRD\nRESPONDENT BEFORE THIS HON'BLE COURT\nRESPONDENT'S/S EXHIBITS:\nNIL\n//TRUE COPY//\nPA TO JUDGE\n\n"
}