{
    "case_id": "",
    "court": "HIGH COURT OF KERALA AT ERNAKULAM",
    "date": "5TH DAY OF JANUARY 2018",
    "judge": "B.KEMAL PASHA\nFRIDAY",
    "petitioners": [
        "/2ND ACCUSED :",
        "DEVINA PAULINE VANDHANA",
        "AGED 38 YEARS, FLAT NO. B 003, AJMERA ARISTTA, BANSWADI",
        "QUARTER, SERVILERING ROAD, KALYAN NAGAR, POST",
        "BENGULURU, KARNATAKA, PIN - 560 043."
    ],
    "respondents": [
        "(S) /STATE :",
        "STATE OF KERALA",
        "REPRESENTED BY SUB INSPECTOR OF POLICH, ALUVA EAST POLICE",
        "STATION, REPRESENTED BY PUBLIC PROSECUTOR, HIGH COURT OF",
        "KERALA, ERNAKULAM - 682 031."
    ],
    "sections": [],
    "outcome": "",
    "full_text": "Baas\nIN THE HIGH COURT OF KERALA AT ERNAKULAM 201S/KERIAS2\nPRESENT:\nTHE HONOURABLE MR. JUSTICE B.KEMAL PASHA\nFRIDAY, THE 5TH DAY OF JANUARY 2018 / 15TH POUSHA, 1939\nCr1.MC.No. 74 of 2018\nCRIME NO. 2616/2017 OF ALUVA EAST POLICE STATION, ERNAKULAM DISTRICT\nPETITIONER(S) /2ND ACCUSED :\nDEVINA PAULINE VANDHANA\nAGED 38 YEARS, FLAT NO. B 003, AJMERA ARISTTA, BANSWADI\nQUARTER, SERVILERING ROAD, KALYAN NAGAR, POST\nBENGULURU, KARNATAKA, PIN - 560 043.\nBY ADV.SRI.V.N.SUNIL KUMAR\nRESPONDENT (S) /STATE :\nSTATE OF KERALA\nREPRESENTED BY SUB INSPECTOR OF POLICH, ALUVA EAST POLICE\nSTATION, REPRESENTED BY PUBLIC PROSECUTOR, HIGH COURT OF\nKERALA, ERNAKULAM - 682 031.\nBY PUBLIC PROSECUTOR SRI.C.S.HRITHWIK\nTHIS CRIMINAL MISC. CASE HAVING COME UP FOR ADMISSION\nON 05-01-2018, THE COURT ON THE SAME DAY PASSED THE FOLLOWING:\nMsd.\n\nparce are\nae\n2018/KER/452\nB.KEMAL PASHA, J.\nCri.M.C.No.74 of 2018\nDated this the 5\" day of January, 2018\nORDER\nLearned counsel for the petitioner seeks permission to\nwithdraw from this Crl.M.C. Permission is granted.\nAccordingly, this Crl.M.C. is dismissed as withdrawn.\nSd/-\nB.KEMAL PASHA\nJUDGE\nDSV/5/1/18\n// True Copy /\nPA.To Judge\n\n"
}