{
    "case_id": "Crl.MC.No. 3521 of 2013",
    "court": "HIGH COURT OF KERALA AT ERNAKULAM\nPRESENT",
    "date": "12TH DAY OF JANUARY 2017",
    "judge": "K.P.JYOTHINDRANATH\nTHURSDAY",
    "petitioners": [
        "DEFACTO COMPLAINANT:",
        "K.P.KURIAKOSE",
        "S/O. PAULOSE, KUDILINKAL HOUSE, VARADOOR P.O., MEENANGADI,",
        "WAYANAD DISTRICT."
    ],
    "respondents": [
        "S/STATE, COMPLAINANT AND ACCUSED:",
        "1. STATE OF KERALA",
        "REPRESENTED BY THE PUBLIC PROSECUTOR, HON'BLE HIGH COURT",
        "OF KERALA, ERNAKULAM-682031.",
        "2. SHAJU JOEPSH",
        "SUB INSPECTOR OF POLICE, MEENANGADI POLICE STATION,",
        "MEENANGADI-673591, WAYANAD DISTRICT.",
        "3. JOSE",
        "SON OF ITTIYAVIRA, ADKKATHOTTATHIL HOUSE, VARADOOR P.O.,",
        "KANIYAMBATTA VILLAGE, VYTHIRI TALUK, WAYANAD DISTRICT, PIN-673 591.",
        "4. REJI",
        "SON OF ITTIYAVIRA, ADAKKATHOTTATHIL HOUSE, VARADOOR P.O.,",
        "KANIYAMBATTA VILLAGE, VYTHIRI TALUK, WAYANAD DISTRICT, PIN-673591.",
        "R3 &4 BY ADV. SRILMATHEW KURIAKOSE",
        "R1 BY PUBLIC PROSECUTOR SMT. MAYA M.N."
    ],
    "sections": [],
    "outcome": "ORDER\nWhen the petition came up for hearing, the learned\ncounsel for the petitioner submitted before me that the\nmatter has become infructuous. Accordingly, the petition is\ndismissed",
    "full_text": "El: foe relt aH\n2017/KER/1796\nIN THE HIGH COURT OF KERALA AT ERNAKULAM\nPRESENT:\nTHE HONOURABLE MR. JUSTICE K.P.JYOTHINDRANATH\nTHURSDAY, THE 12TH DAY OF JANUARY 2017/22ND POUSHA, 1938\nCrl.MC.No. 3521 of 2013 ()\nCRIME NO. 382/2013 OF MEENANGADI POLICE STATION , WAYANAD\nPETITIONER/DEFACTO COMPLAINANT:\nK.P.KURIAKOSE\nS/O. PAULOSE, KUDILINKAL HOUSE, VARADOOR P.O., MEENANGADI,\nWAYANAD DISTRICT.\nBY ADVS.SRI.K.RAMAKUMAR (SR.)\nSRI.S.M.PRASANTH\nRESPONDENTS/STATE, COMPLAINANT AND ACCUSED:\n1. STATE OF KERALA\nREPRESENTED BY THE PUBLIC PROSECUTOR, HON'BLE HIGH COURT\nOF KERALA, ERNAKULAM-682031.\n2. SHAJU JOEPSH\nSUB INSPECTOR OF POLICE, MEENANGADI POLICE STATION,\nMEENANGADI-673591, WAYANAD DISTRICT.\n3. JOSE\nSON OF ITTIYAVIRA, ADKKATHOTTATHIL HOUSE, VARADOOR P.O.,\nKANIYAMBATTA VILLAGE, VYTHIRI TALUK, WAYANAD DISTRICT, PIN-673 591.\n4. REJI\nSON OF ITTIYAVIRA, ADAKKATHOTTATHIL HOUSE, VARADOOR P.O.,\nKANIYAMBATTA VILLAGE, VYTHIRI TALUK, WAYANAD DISTRICT, PIN-673591.\nR3 &4 BY ADV. SRILMATHEW KURIAKOSE\nR1 BY PUBLIC PROSECUTOR SMT. MAYA M.N.\nTHIS CRIMINAL MISC. CASE HAVING BEEN FINALLY HEARD ON 12-01-2017,\nTHE COURT ON THE SAME DAY PASSED THE FOLLOWING:\n\not ae\nEl: foe relt aH\n2017/KER/796\nCri.MC.No. 3521 of 2013 ()\nAPPENDIX\nPETITIONER'S) EXHIBITS\nANNEXURE A- A TRUE COPY OF CERTIFICATE DT. 9-8-2013 ISSUED BY THE\nBABY MEMORIAL HOSPITAL, KOZHIKODE.\nANNEXURE B- TRUE COPY OF STATEMENT DT. 8-8-2013 GIVEN BY THE\nPETITIONER TO THE POLICE.\nANNEXURE C- TRUE COPY OF WOUND CERTIFICATE DT. 9-8-2013 ISSUED BY\nTHE MEDICAL OFFICER, KOZHIKODE.\nRESPONDENT(S)â€™ EXHIBITS\nNIL\nTRUE COPY\nPA.TO JUDGE\nSHG/\n\nfoe\nret\nBAAS\n2017/KER/796\nK.P. JYYOTHINDRANATH, J.\nCrl.M.C.No.3521 of 2013\nDated this the 12\" day of January, 2017\nORDER\nWhen the petition came up for hearing, the learned\ncounsel for the petitioner submitted before me that the\nmatter has become infructuous. Accordingly, the petition is\ndismissed as infructuous.\nK.P. JYOTHINDRANATH\nJUDGE\nshg/\n\n"
}