{
    "case_id": "",
    "court": "HIGH COURT OF KERALA AT ERNAKULAM\nPRESENT\nTHE HONOURABLE MR",
    "date": "07TH DAY OF JANUARY 2020",
    "judge": "P.B.SURESH KUMAR\nTUESDAY",
    "petitioners": [
        "S/ACCUSED NO.1 AND 2:",
        "1 JIJIMON",
        "AGED 32 YEARS",
        "s/O.JUSTIN, 125, ANDARAPARAMBIL VEEDU,",
        "VELANKANNI NAGAR, THEKKUBHAGOM CHERIYIL,",
        "MUNDAKKAL VILLAGE, KOLLAM.",
        "2 JASMIN",
        "AGED 53 YEARS",
        "W/O.JUSTIN, 125, ANDARAPARAMBIL VEEDU,",
        "VELANKANNI NAGAR, THEKKUBHAGOM CHERIYIL,",
        "MUNDAKKAL VILLAGE, KOLLAM."
    ],
    "respondents": [
        "S/STATE & COMPLAINANT:",
        "1 STATE OF KERALA,",
        "REPRESENTED BY THE PUBLIC PROSECUTOR, HIGH",
        "COURT OF KERALA, ERNAKULAM.",
        "2 ASHLY,",
        "D/O.JOSEPH MORIS, AGED 29 YEARS, ST.JOSEPH",
        "HOUSE, SAKTIKULANGARA.P.O.,",
        "KOLLAM DISTRICT-691581.",
        "R2 BY ADV. ANIL K.MOHAMMED",
        "R1 BY SRI.SANTHOSH PETER, PUBLIC PROSECUTOR"
    ],
    "sections": [
        "482 of\nthe Code of Criminal Procedure for quashing Annexure"
    ],
    "outcome": "ORDER\n\nThis is a proceedings instituted under Section 482 of\nthe Code of Criminal Procedure for quashing Annexure - A final\nreport in CC No.476 of 2018 on the files of the Court of the\nJudicial Magistrate of First Class - II, Kollam.\n\n2. The petitioners are accused Nos.1 and 2 in the\nsaid case instituted at the instance of the second respondent\nfor offences punishable under Sections 498A read with Section\n34 of the Indian Penal Code.\n\n3. It is seen that the second respondent has settled\nher disputes with the petitioners, and an affidavit to that effect\nhas been filed as Annexure - B.\n\n4. Heard the learned counsel for the petitioners,\nthe learned Public Prosecutor as also the learned counsel for the\nsecond respondent.\n\n5. The learned counsel for the second respondent\n\npane |\n2020/KER/325\nCrl.M.C. No.14 of 2020 3\naffirmed that Annexure - B affidavit is one sworn to by the\nsecond respondent and submitted that the second respondent\nhas no objection in allowing the prayer of the petitioners.\n\n6. In the light of the decisions of the Apex Court in\nGian singh v. State of Punjab, (2012) 10 SCC 303, | am of\nthe view that this is an appropriate case where this court has to\ninvoke the jurisdiction under Section 482 of the Code of\nCriminal Procedure to quash the proceedings against the\npetitioners.\n\nIn the result, the Crl.M.C. is allowed and Annexure - A\nfinal report in CC No.476 of 2018 on the files of the Court of the\nJudicial Magistrate of the First Class - Il, Kollam are quashed",
    "full_text": "Euens\ns aed\na\niz a : at a\n2020/KER/325\nIN THE HIGH COURT OF KERALA AT ERNAKULAM\nPRESENT\nTHE HONOURABLE MR. JUSTICE P.B.SURESH KUMAR\nTUESDAY, THE 07TH DAY OF JANUARY 2020 / 17TH POUSHA, 1941\nCr1.MC.No.14 OF 2020(B)\nAGAINST C.C.NO.476/2018 ON THE FILE OF COURT OF JUDICIAL\nMAGISTRATE OF FIRST CLASS -II, KOLLAM\nCRIME NO.2130/2017 OF ERAVIPURAM POLICE STATION, KOLLAM\nPETITIONERS/ACCUSED NO.1 AND 2:\n1 JIJIMON\nAGED 32 YEARS\ns/O.JUSTIN, 125, ANDARAPARAMBIL VEEDU,\nVELANKANNI NAGAR, THEKKUBHAGOM CHERIYIL,\nMUNDAKKAL VILLAGE, KOLLAM.\n2 JASMIN\nAGED 53 YEARS\nW/O.JUSTIN, 125, ANDARAPARAMBIL VEEDU,\nVELANKANNI NAGAR, THEKKUBHAGOM CHERIYIL,\nMUNDAKKAL VILLAGE, KOLLAM.\nBY ADV. SRI.S.MOHAMMED AL RAFI\nRESPONDENTS/STATE & COMPLAINANT:\n1 STATE OF KERALA,\nREPRESENTED BY THE PUBLIC PROSECUTOR, HIGH\nCOURT OF KERALA, ERNAKULAM.\n2 ASHLY,\nD/O.JOSEPH MORIS, AGED 29 YEARS, ST.JOSEPH\nHOUSE, SAKTIKULANGARA.P.O.,\nKOLLAM DISTRICT-691581.\nR2 BY ADV. ANIL K.MOHAMMED\nR1 BY SRI.SANTHOSH PETER, PUBLIC PROSECUTOR\nTHIS CRIMINAL MISC. CASE HAVING COME UP FOR ADMISSION\nON 07.01.2020, THE COURT ON THE SAME DAY PASSED THE\nFOLLOWING :\n\n2020/KER/325\nCrl.M.C. No.14 of 2020 2\nORDER\n\nThis is a proceedings instituted under Section 482 of\nthe Code of Criminal Procedure for quashing Annexure - A final\nreport in CC No.476 of 2018 on the files of the Court of the\nJudicial Magistrate of First Class - II, Kollam.\n\n2. The petitioners are accused Nos.1 and 2 in the\nsaid case instituted at the instance of the second respondent\nfor offences punishable under Sections 498A read with Section\n34 of the Indian Penal Code.\n\n3. It is seen that the second respondent has settled\nher disputes with the petitioners, and an affidavit to that effect\nhas been filed as Annexure - B.\n\n4. Heard the learned counsel for the petitioners,\nthe learned Public Prosecutor as also the learned counsel for the\nsecond respondent.\n\n5. The learned counsel for the second respondent\n\npane |\n2020/KER/325\nCrl.M.C. No.14 of 2020 3\naffirmed that Annexure - B affidavit is one sworn to by the\nsecond respondent and submitted that the second respondent\nhas no objection in allowing the prayer of the petitioners.\n\n6. In the light of the decisions of the Apex Court in\nGian singh v. State of Punjab, (2012) 10 SCC 303, | am of\nthe view that this is an appropriate case where this court has to\ninvoke the jurisdiction under Section 482 of the Code of\nCriminal Procedure to quash the proceedings against the\npetitioners.\n\nIn the result, the Crl.M.C. is allowed and Annexure - A\nfinal report in CC No.476 of 2018 on the files of the Court of the\nJudicial Magistrate of the First Class - Il, Kollam are quashed.\n\nSd/-\nP.B.SURESH KUMAR, JUDGE.\nDK\n\naol\ncaps : Sie\n2020/KER/325\nCri.M.C. No.14 of 2020 4\nAPPENDIX\nPETITIONERS ' EXHIBITS:\nANNEXURE A TRUE COPY OF THE FINAL REPORT IN CRIME\nNO.2130/17 OF ERAVIPURAM POLICE\nSTATION.\nANNEXURE B NOTARISED AFFIDAVIT SWORN BY 2ND\nRESPONDENT.\nRESPONDENTS' EXHIBITS: NIL\n//TRUE COPY//\nPA TO JUDGE\nDK\n\n"
}