{
    "case_id": "",
    "court": "HIGH COURT OF KERALA AT ERNAKULAM\nPRESENT",
    "date": "5TH DAY OF JANUARY 2017",
    "judge": "SUNIL THOMAS\nTHURSDAY",
    "petitioners": [
        "PETITIONER:",
        "SML FINANCE LTD.",
        "KUNNAMKULAM, KUNNAMKULAM P.O., THRISSUR DISTRICT,",
        "PIN - 680 503, REPRESENTED BY ITS LEGAL COORDINATOR",
        "MR.DHANESH K.S, AGED 36 YEARS, S/O. SUKUMARANA K.P,",
        "RESIDING AT DHANESH BAHVAN, VALAMANGALAM SOUTH,",
        "THURAVOOR VILLAGE, CHERTHALA TALUK,",
        "ALAPPUZHA DISTRICT."
    ],
    "respondents": [
        "STATE:",
        "STATE OF KERALA",
        "REPRESENED BY PUBLIC PROSECUTOR,",
        "HIGH COURT OF KERALA, ERNAKULAM - 682 031."
    ],
    "sections": [],
    "outcome": "",
    "full_text": "oes oe 1\nElz is Bere\n2017/KER/464\nIN THE HIGH COURT OF KERALA AT ERNAKULAM\nPRESENT:\nTHE HONOURABLE MR. JUSTICE SUNIL THOMAS\nTHURSDAY, THE 5TH DAY OF JANUARY 2017/15TH POUSHA, 1938\nCri.MC.No. 94 of 2017 ()\nAGAINST THE ORDER/JUDGMENT IN CMP 7526/2016 OF JUDICIAL FIRST CLASS\nMAGISTRATE COURT, KUNNAMKULAM\nCRIME NO. 2592/2016 OF KUNNAMKULAM POLICE STATION , TRISSUR\nPETITIONER(S)/PETITIONER:\nSML FINANCE LTD.\nKUNNAMKULAM, KUNNAMKULAM P.O., THRISSUR DISTRICT,\nPIN - 680 503, REPRESENTED BY ITS LEGAL COORDINATOR\nMR.DHANESH K.S, AGED 36 YEARS, S/O. SUKUMARANA K.P,\nRESIDING AT DHANESH BAHVAN, VALAMANGALAM SOUTH,\nTHURAVOOR VILLAGE, CHERTHALA TALUK,\nALAPPUZHA DISTRICT.\nBY ADVS.SRILSUNIL NAIR PALAKKAT\nSRILV.SATHISH KUMAR\nSRILM.A.AHAMMAD SAHEER\nSMT.K.AASHA\nRESPONDENT(S)/STATE:\nSTATE OF KERALA\nREPRESENED BY PUBLIC PROSECUTOR,\nHIGH COURT OF KERALA, ERNAKULAM - 682 031.\nBY SRI.T.R.RANJITH, PUBLIC PROSECUTOR\nTHIS CRIMINAL MISC. CASE HAVING COME UP FOR ADMISSION ON\n05-01-2017, THE COURT ON THE SAME DAY PASSED THE FOLLOWING:\n\noes oe 1\nElz is Bere\n2017/KER/464\nCri.MC.No. 94 of 2017 ()\nAPPENDIX\nPETITIONER(S)' EXHIBITS\nANNEXURE A1 THE TRUE COPY OF THE CRL.M.P NO. 7526/2016 DATED\n25.11.2016 BEFOR ETHE HON'BLE JUDICIAL FIRST CLASS MAGISTRATE COURT,\nKUNNAMKULAM U/S. 451 OF THE CRIMINAL PROCEDURE CODE.\nANNEXURE A2 THE TRUE COPY OF THE INTERIM ORDER DATED 29.11.2016 IN\nCRL.M.A NO. 12674/2016 IN CRL.M.C NO. 8269/2016 OF THIS HON'BLE COURT.\nANNEXURE A3 THE TRUE COPY OF THE ORDER IN CRL.M.C NO. 8943/2016\nDATED 20.12.2016 ON THE FILES OF THIS HON'BLE COURT.\nRESPONDENT(S)' EXHIBITS NIL\nR.AV TRUE COPY?!\nPATO JUDGE\n\nESE\n2017/KER/464\nSUNIL THOMAS, J.\nDated this the 5‚Äù day of January, 2017\nORDER\n\nThe dispute arises in relation to the Motor Cycle\nbearing registration No.KL-49D/9902, which was subject\nmatter of a hire purchase agreement. It was seized by\nthe Kunnamkulam Police in Crime No.2592/2016 in a\ncomplaint preferred by the petitioner herein against the\nborrower. Pending the proceedings, the registered owner\nof the vehicle preferred Crl.M.C.8269/2016 along with his\nmother seeking a stay of the entire proceedings. Stay for\na period of two months was granted by Annexure-2 order.\nSubsequently by Annexure-3 order in\nCri.M.C.No.8943/2016 it was clarified that the interim\nstay granted by the court will not stand in the way of the\ncourt below taking up Crl.M.P.7435/2016 in Crime\nNo.2592/2016 of Kunnamkulam Police Station, which was\nan application filed by the RC owner seeking interim\ncustody of the vehicle.\n\n2. The grievance of the petitioner herein who is\n\nESE\n2017/KER/464\nCrl.M.C.No.94 of 2017 2\nthe financier is that, his application for interim custody is\nnot being taken for hearing on a premise that neither\nAnnexure-2 nor Annexure-3 authorised the court below to\ntake up his Crl.M.P.No.7526/2016. In the light of above,\nit is clarified that the court below shall take up\nCrl.MP.No.7526/2016 also along with\nCrl.M.P.No.7436/2016 filed by the RC owner and dispose\nof together.\nCrl.M.C. is disposed of accordingly.\nSUNIL THOMAS, JUDGE\nRAV ITTRUE COPY/I\nPATO JUDGE\n\n"
}