{
    "case_id": "",
    "court": "HIGH COURT OF KERALA AT ERNAKULAM",
    "date": "5TH DAY OF JANUARY 2021",
    "judge": "V.G.ARUN\nTUESDAY",
    "petitioners": [
        "HARIS",
        "AGED 40 YEARS",
        "S/O. MOIDEENKUTTY, KALLATHAL HOUSE, KANNATTIPPADI,",
        "MALAPPURAM DISTRICT."
    ],
    "respondents": [
        "S:",
        "1 MANIKATHODI SHIBILI",
        "AGED 28 YEARS",
        "S/O. ABDUL KAREEM, MANIKATHODI HOUSE, KANNATTIPPADI",
        "P.O, MALAPPURAM DISTRICT-676304.",
        "2 STATE OF KERALA",
        "REPRESENTED BY PUBLIC PROSECUTOR, HIGH COURT OF",
        "KERALA, ERNAKULAM-682031.",
        "Rl BY ADV. JINU JOSEPH"
    ],
    "sections": [
        "341",
        "323",
        "506"
    ],
    "outcome": "ORDER\nPetitioner is the accused in Crime No.194 of 2016\nregistered at the Vengara Police Station for the offence\npunishable under Sections 341, 323, 506(i), 308 r/w 34 of IPC,\nnow pending as S.C.No.127 of 2019 on the files of Additional\nDistrict and Sessions Court-III, Manjeri. The de facto complainant\nat whose instance the crime was registered is the 1* respondent.\nAnnexure A2 affidavit has been filed by the 1* respondent,\nstating that the dispute has been settled and that he has no\nsubsisting grievance against the petitioner.\n\n2. Heard the learned Public Prosecutor also, who, on\ninstructions, submits that the petitioner has no_ criminal\nantecedents.\n\n3. Having considered the gravity of the offences alleged,\nnature of the injury caused and having perused the affidavit filed\nby the 1* respondent, the contents of which are submitted to be\ntrue and voluntary, I am satisfied that the dispute is settled and\nthat no public interest is involved in this matter. Moreover, in\nview of the settlement, possibility of the criminal proceedings\n\nCrmc 5203/2020 3 202 U/KER/301\nending in conviction is remote. As such, continuance of the\nproceedings will amount to an abuse of process of court and\nhence, in view of the legal position set out by the Honourable\nSupreme Court in Madan Mohan Abbot v. State of Punjab\n[(2008) 4 SCC 582] and Gian Singh v. State of Punjab and\nanother [(2012) 10 SCC 303], there is no impediment in\ngranting the relief sought.\n\n4. In the result, this Crl.M.C is allowed. The proceedings in\nS.C.No.127 of 2019 on the files of Additional District and\nSessions Court-III, Manjeri is quashed",
    "full_text": "Ee aa\nee ots\naaa\nOR aay\nIN THE HIGH COURT OF KERALA AT ERNAKULAM 2021/KER/301\nPRESENT\nTHE HONOURABLE MR.JUSTICE V.G.ARUN\nTUESDAY, THE O5TH DAY OF JANUARY 2021 / 15TH POUSHA, 1942\nCr1.MC.No.5203 OF 2020 (A)\nAGAINST THE JUDGMENT IN SC 127/2019 OF ADDITIONAL DISTRICT COURT &\nSESSIONS COURT - III, MANJERI\nCRIME NO.194/2016 OF Vengara Police Station , Malappuram\nPETITIONER:\nHARIS\nAGED 40 YEARS\nS/O. MOIDEENKUTTY, KALLATHAL HOUSE, KANNATTIPPADI,\nMALAPPURAM DISTRICT.\nBY ADV. SRI.P.K.MOHAMED JAMEEL\nRESPONDENTS:\n1 MANIKATHODI SHIBILI\nAGED 28 YEARS\nS/O. ABDUL KAREEM, MANIKATHODI HOUSE, KANNATTIPPADI\nP.O, MALAPPURAM DISTRICT-676304.\n2 STATE OF KERALA\nREPRESENTED BY PUBLIC PROSECUTOR, HIGH COURT OF\nKERALA, ERNAKULAM-682031.\nRl BY ADV. JINU JOSEPH\nTHIS CRIMINAL MISC. CASE HAVING COME UP FOR ADMISSION ON\n05.01.2021,THE COURT ON THE SAME DAY PASSED THE FOLLOWING:\n\nBrats hal\nBee\nCrmc 5203/2020 2 2021/KER/301\nV.G.ARUN, J.\n-GrLM.C.N0.5203 of 2020\nDated this the 5* day of January, 2021\nORDER\nPetitioner is the accused in Crime No.194 of 2016\nregistered at the Vengara Police Station for the offence\npunishable under Sections 341, 323, 506(i), 308 r/w 34 of IPC,\nnow pending as S.C.No.127 of 2019 on the files of Additional\nDistrict and Sessions Court-III, Manjeri. The de facto complainant\nat whose instance the crime was registered is the 1* respondent.\nAnnexure A2 affidavit has been filed by the 1* respondent,\nstating that the dispute has been settled and that he has no\nsubsisting grievance against the petitioner.\n\n2. Heard the learned Public Prosecutor also, who, on\ninstructions, submits that the petitioner has no_ criminal\nantecedents.\n\n3. Having considered the gravity of the offences alleged,\nnature of the injury caused and having perused the affidavit filed\nby the 1* respondent, the contents of which are submitted to be\ntrue and voluntary, I am satisfied that the dispute is settled and\nthat no public interest is involved in this matter. Moreover, in\nview of the settlement, possibility of the criminal proceedings\n\nCrmc 5203/2020 3 202 U/KER/301\nending in conviction is remote. As such, continuance of the\nproceedings will amount to an abuse of process of court and\nhence, in view of the legal position set out by the Honourable\nSupreme Court in Madan Mohan Abbot v. State of Punjab\n[(2008) 4 SCC 582] and Gian Singh v. State of Punjab and\nanother [(2012) 10 SCC 303], there is no impediment in\ngranting the relief sought.\n\n4. In the result, this Crl.M.C is allowed. The proceedings in\nS.C.No.127 of 2019 on the files of Additional District and\nSessions Court-III, Manjeri is quashed.\n\nSd/-\nV.G.ARUN\nJUDGE\n1gk\n\nEl ee\nee aa\naaa\nBUSeaer\nCrme 5203/2020 4 202 /KER/3O1\nAPPENDIX OF Cr1.MC 5203/2020\nPETITIONER'S/S EXHIBITS:\nANNEXURE Al CERTIFIED COPY OF FINAL REPORT IN CRIME\nNO.194/2016 OF VENGARA POLICE STATION.\nANNEXURE A2 ORIGINAL AFFIDAVIT OF IST RESPONDENT.\n\n"
}