{
    "case_id": "Crl.MC.No.89 OF 2020",
    "court": "HIGH COURT OF KERALA AT ERNAKULAM\nPRESENT\nTHE HONOURABLE MR",
    "date": "8TH DAY OF JANUARY 2020",
    "judge": "P.B.SURESH KUMAR\nWEDNESDAY",
    "petitioners": [
        "S/ACCUSED NO. 1 TO 4:",
        "1 DINU S KUMAR,",
        "AGED 32 YEARS, S/O.SUKUMARAN, EANTHUNKAL,",
        "ANIKKAD, AVOLI.P.O., MUVATTUPUZHA,",
        "ERNAKULAM DISTRICT.",
        "2 SHANU K MUHAMMED,",
        "AGED 36 YEARS, S/O.K.P.MUHAMMED,",
        "KALLELI PUTHENPURAYIL, CHIRAPPADI BHAGAM,",
        "ANIKKAD, AVOLI.P.O., MUVATTUPUZHA,",
        "ERNAKULAM DISTRICT.",
        "3 BINU S KUMAR,",
        "AGED 31 YEARS, S/O.SUKUMARAN, EANTHUNKAL,",
        "ANIKKAD, AVOLI.P.O., MUVATTUPUZHA,",
        "ERNAKULAM DISTRICT.",
        "4 VINOD .U.,",
        "AGED 36 YEARS, S/O.UNNIKRISHNAMN NAIR, LAKSHMI",
        "BABY SADANAM, CHIRAPADI BHAGAM, ANIKKAD,",
        "AVOLI.P.O., MUVATTUPUZHA, ERNAKULAM DISTRICT."
    ],
    "respondents": [
        "S/STATE/ DE FACTO COMPLAINANT:",
        "1 STATE OF KERALA,",
        "REP. BY PUBLIC PROSECUTOR, HIGH COURT OF",
        "KERALA, ERNAKULAM-682031. (CRIME NO.1903/2015",
        "OF MUVATTUPUZHA POLICE STATION, ERNAKULAM",
        "DISTRICT) .",
        "2 SHEEJA,",
        "AGED 38 YEARS, W/O.NISHAD.M.S.,",
        "MULLANKUZHIYIL, PUTHENPURA, AVOLI.P.O.,",
        "MUVATTUPUZHA, ERNAKULAM DISTRICT-686667.",
        "R2 BY ADV. S.RAJEEV",
        "SRI T.R.RENJITH PP"
    ],
    "sections": [
        "482 of\nthe Code of Criminal Procedure for quashing Annexure"
    ],
    "outcome": "ORDER IN CC 195/2016 OF JUDICIAL MAGISTRATE\nOF FIRST CLASS -I MUVATUPUZHA\nCRIME NO.1903/2015 OF MUVATTUPUZHA POLICE STATION,\nERNAKULAM\nPETITIONERS/ACCUSED NO. 1 TO 4:\n1 DINU S KUMAR,\nAGED 32 YEARS, S/O.SUKUMARAN, EANTHUNKAL,\nANIKKAD, AVOLI.P.O., MUVATTUPUZHA,\nERNAKULAM DISTRICT.\n2 SHANU K MUHAMMED,\nAGED 36 YEARS, S/O.K.P.MUHAMMED,\nKALLELI PUTHENPURAYIL, CHIRAPPADI BHAGAM,\nANIKKAD, AVOLI.P.O., MUVATTUPUZHA,\nERNAKULAM DISTRICT.\n3 BINU S KUMAR,\nAGED 31 YEARS, S/O.SUKUMARAN, EANTHUNKAL,\nANIKKAD, AVOLI.P.O., MUVATTUPUZHA,\nERNAKULAM DISTRICT.\n4 VINOD .U.,\nAGED 36 YEARS, S/O.UNNIKRISHNAMN NAIR, LAKSHMI\nBABY SADANAM, CHIRAPADI BHAGAM, ANIKKAD,\nAVOLI.P.O., MUVATTUPUZHA, ERNAKULAM DISTRICT.\nBY ADV. SRI.VINOD KUMAR.C\n\nPipe ash\nSeances\nCA eet\n2020/KER/665\nCrl.M.C. No.89 of 2020 2\nRESPONDENTS/STATE/ DE FACTO COMPLAINANT:\n1 STATE OF KERALA,\nREP. BY PUBLIC PROSECUTOR, HIGH COURT OF\nKERALA, ERNAKULAM-682031. (CRIME NO.1903/2015\nOF MUVATTUPUZHA POLICE STATION, ERNAKULAM\nDISTRICT) .\n2 SHEEJA,\nAGED 38 YEARS, W/O.NISHAD.M.S.,\nMULLANKUZHIYIL, PUTHENPURA, AVOLI.P.O.,\nMUVATTUPUZHA, ERNAKULAM DISTRICT-686667.\nR2 BY ADV. S.RAJEEV\nSRI T.R.RENJITH PP\nTHIS CRIMINAL MISC. CASE HAVING COME UP FOR ADMISSION\nON 08.01.2020, THE COURT ON THE SAME DAY PASSED THE\nFOLLOWING:\n\nee |\n2020/KER/665\nCrl.M.C. No.89 of 2020 3\nCri.M.C.No.89 of 2020\nORDER\n\nThis is a proceedings instituted under Section 482 of\nthe Code of Criminal Procedure for quashing Annexure - | final\nreport and all further proceedings pursuant thereto now\npending as CC No.195 of 2016 on the files of the Court of the\nJudicial Magistrate of First Class, Muvattupuzha.\n\n2. The petitioners are accused 1 to 4 in the said\ncase. The case was one instituted at the instance of the second\nrespondent under Sections 294(b), 323, 447 and 506(i) read\nwith Section 34 of the Indian Penal Code.\n\n3. It is seen that the second respondent has settled\nher disputes with the petitioners and an affidavit sworn to by\nher to that effect has been produced as Annexure Il.\n\n4. Heard the learned counsel for the petitioners,\nthe learned Public Prosecutor as also the learned counsel for\nthe second respondent.\n\nail\n2020/KER/665\nCrl.M.C. No.89 of 2020 4\n\n5. In the light of the decision of the Apex Court in\nGian singh v. State of Punjab, (2012) 10 SCC 303, insofar as\nthe offences alleged against the petitioners are only offences\npunishable under Sections 294(b), 323, 447 and 506(i) read\nwith Section 34 of the Indian Penal Code, | am of the view that\nthis is an appropriate case where this court has to invoke the\njurisdiction under Section 482 of the Code of Criminal Procedure\nto quash the proceedings against the petitioners.\n\nIn the result, the Crl.M.C. is allowed and Annexure-|\nfinal report and all further proceedings pursuant thereto against\nthe petitioners pending as CC No.195 of 2016 on the files of the\nCourt of the Judicial Magistrate of First Class, Muvattupuzha are\nquashed",
    "full_text": "Be anl\nSeances\nEe\nCA eet\n2020/KER/665\nIN THE HIGH COURT OF KERALA AT ERNAKULAM\nPRESENT\nTHE HONOURABLE MR. JUSTICE P.B.SURESH KUMAR\nWEDNESDAY, THE O8TH DAY OF JANUARY 2020 / 18TH POUSHA,\n1941\nCrl.MC.No.89 OF 2020(A)\nAGAINST THE ORDER IN CC 195/2016 OF JUDICIAL MAGISTRATE\nOF FIRST CLASS -I MUVATUPUZHA\nCRIME NO.1903/2015 OF MUVATTUPUZHA POLICE STATION,\nERNAKULAM\nPETITIONERS/ACCUSED NO. 1 TO 4:\n1 DINU S KUMAR,\nAGED 32 YEARS, S/O.SUKUMARAN, EANTHUNKAL,\nANIKKAD, AVOLI.P.O., MUVATTUPUZHA,\nERNAKULAM DISTRICT.\n2 SHANU K MUHAMMED,\nAGED 36 YEARS, S/O.K.P.MUHAMMED,\nKALLELI PUTHENPURAYIL, CHIRAPPADI BHAGAM,\nANIKKAD, AVOLI.P.O., MUVATTUPUZHA,\nERNAKULAM DISTRICT.\n3 BINU S KUMAR,\nAGED 31 YEARS, S/O.SUKUMARAN, EANTHUNKAL,\nANIKKAD, AVOLI.P.O., MUVATTUPUZHA,\nERNAKULAM DISTRICT.\n4 VINOD .U.,\nAGED 36 YEARS, S/O.UNNIKRISHNAMN NAIR, LAKSHMI\nBABY SADANAM, CHIRAPADI BHAGAM, ANIKKAD,\nAVOLI.P.O., MUVATTUPUZHA, ERNAKULAM DISTRICT.\nBY ADV. SRI.VINOD KUMAR.C\n\nPipe ash\nSeances\nCA eet\n2020/KER/665\nCrl.M.C. No.89 of 2020 2\nRESPONDENTS/STATE/ DE FACTO COMPLAINANT:\n1 STATE OF KERALA,\nREP. BY PUBLIC PROSECUTOR, HIGH COURT OF\nKERALA, ERNAKULAM-682031. (CRIME NO.1903/2015\nOF MUVATTUPUZHA POLICE STATION, ERNAKULAM\nDISTRICT) .\n2 SHEEJA,\nAGED 38 YEARS, W/O.NISHAD.M.S.,\nMULLANKUZHIYIL, PUTHENPURA, AVOLI.P.O.,\nMUVATTUPUZHA, ERNAKULAM DISTRICT-686667.\nR2 BY ADV. S.RAJEEV\nSRI T.R.RENJITH PP\nTHIS CRIMINAL MISC. CASE HAVING COME UP FOR ADMISSION\nON 08.01.2020, THE COURT ON THE SAME DAY PASSED THE\nFOLLOWING:\n\nee |\n2020/KER/665\nCrl.M.C. No.89 of 2020 3\nCri.M.C.No.89 of 2020\nORDER\n\nThis is a proceedings instituted under Section 482 of\nthe Code of Criminal Procedure for quashing Annexure - | final\nreport and all further proceedings pursuant thereto now\npending as CC No.195 of 2016 on the files of the Court of the\nJudicial Magistrate of First Class, Muvattupuzha.\n\n2. The petitioners are accused 1 to 4 in the said\ncase. The case was one instituted at the instance of the second\nrespondent under Sections 294(b), 323, 447 and 506(i) read\nwith Section 34 of the Indian Penal Code.\n\n3. It is seen that the second respondent has settled\nher disputes with the petitioners and an affidavit sworn to by\nher to that effect has been produced as Annexure Il.\n\n4. Heard the learned counsel for the petitioners,\nthe learned Public Prosecutor as also the learned counsel for\nthe second respondent.\n\nail\n2020/KER/665\nCrl.M.C. No.89 of 2020 4\n\n5. In the light of the decision of the Apex Court in\nGian singh v. State of Punjab, (2012) 10 SCC 303, insofar as\nthe offences alleged against the petitioners are only offences\npunishable under Sections 294(b), 323, 447 and 506(i) read\nwith Section 34 of the Indian Penal Code, | am of the view that\nthis is an appropriate case where this court has to invoke the\njurisdiction under Section 482 of the Code of Criminal Procedure\nto quash the proceedings against the petitioners.\n\nIn the result, the Crl.M.C. is allowed and Annexure-|\nfinal report and all further proceedings pursuant thereto against\nthe petitioners pending as CC No.195 of 2016 on the files of the\nCourt of the Judicial Magistrate of First Class, Muvattupuzha are\nquashed.\n\nSd/-\nP.B.SURESH KUMAR, JUDGE.\nYKB\n\naac\neo\nEis Sie\n2020/KER/665\nCrl.M.C. No.89 of 2020 5\nAPPENDIX\nPETITIONER'S/S EXHIBITS:\nANNEXURE I CERTIFIED COPY OF THE FINAL REPORT IN\nCC.NO.195/2016 ON THE FILE OF THE\nJUDICIAL MAGISTRATE OF FIRST CLASS,\nMUVATTUPUZHA.\nANNEXURE ITI NOTARISED AFFIDAVIT DATED 6.1.2020\nSWORN BY THE 2ND RESPONDENT.\nRESPONDENT'S/S EXHIBITS:\nNIL\n//TRUE COPY//\nPA TO JUDGE\n\n"
}