{
    "case_id": "",
    "court": "HIGH COURT OF KERALA AT ERNAKULAM\nPRESENT",
    "date": "8TH DAY OF DECEMBER 2017",
    "judge": "B.KEMAL PASHA\nFRIDAY",
    "petitioners": [
        "SANJEEV KUMAR K.P,",
        "AGED 41 YEARS, S/O. LATE ASHOK KUMAR, RADHALAYAM,",
        "METHOTTU THAZAM P.O., KOMMERI, CALICUT."
    ],
    "respondents": [
        "1. STATE OF KERALA",
        "REPRESENTED BY THE PUBLIC PROSECUTOR, HIGH COURT OF",
        "KERALA - 682 031.",
        "2. THE SUB INSPECTOR OF POLICE,",
        "KOZHIKODE TOWN POLICE STATION -677 602.",
        "3. K.P. PAVITHRAN,",
        "S/O. RAGHAVAN NAMBIAR, KANI RAWTHER, CHALIYIL HOUSE,",
        "TRILLANKERRY, MATTANOOR, KANNUR - 677 101.",
        "R1&R2 BY PUBLIC PROSECUTOR SMT. SHEEBA"
    ],
    "sections": [
        "239 Cr"
    ],
    "outcome": "",
    "full_text": "Bees el\nPook ape caen\nie\nope\n2017/KER/49772\nIN THE HIGH COURT OF KERALA AT ERNAKULAM\nPRESENT:\nTHE HONOURABLE MR. JUSTICE B.KEMAL PASHA\nFRIDAY, THE 8TH DAY OF DECEMBER 2017/17TH AGRAHAYANA, 1939\nCri.MC.No. 7768 of 2017 ()\nCC 808/2015 OF JUDICIAL FIRST CLASS MAGISTRATE COURT-I,\nKOZHIKODE DISTRICT\nPETITIONER(S):\nSANJEEV KUMAR K.P,\nAGED 41 YEARS, S/O. LATE ASHOK KUMAR, RADHALAYAM,\nMETHOTTU THAZAM P.O., KOMMERI, CALICUT.\nBY ADVS.SRI.LAL K.JOSEPH\nSRI.A.A.ZIYAD RAHMAN\nRESPONDENT(S):\n1. STATE OF KERALA\nREPRESENTED BY THE PUBLIC PROSECUTOR, HIGH COURT OF\nKERALA - 682 031.\n2. THE SUB INSPECTOR OF POLICE,\nKOZHIKODE TOWN POLICE STATION -677 602.\n3. K.P. PAVITHRAN,\nS/O. RAGHAVAN NAMBIAR, KANI RAWTHER, CHALIYIL HOUSE,\nTRILLANKERRY, MATTANOOR, KANNUR - 677 101.\nR1&R2 BY PUBLIC PROSECUTOR SMT. SHEEBA\nTHIS CRIMINAL MISC. CASE HAVING BEEN FINALLY HEARD\nON 08-12-2017, THE COURT ON THE SAME DAY PASSED THE\nFOLLOWING:\nsdr/-\n\nBees el\nPook ape caen\nie\nope\n2017/KER/49772\nCri.MC.No. 7768 of 2017 ()\nAPPENDIX\nPETITIONER(S)' ANNEXURES\nANNEXURE A1 CERTIFIED COPY OF THE FIR NO. 659/11 OF KOZHIKODE TOWN\nPOLICE STATION AND THE FINAL REPORT NUMBERED AS\nC.C.808/15.\nANNEXURE A2 TRUE COPY OF THE FINAL REPORT NUMBERED AS C.C 808/15.\nANNEXURE A3 TRUE COPY OF THE PRIVATE COMPLAINT FILED BEFORE THE\nJUDICIAL FIRST CLASS MAGISTRATE, COURT - 1, KOZHIKODE.\nANNEXURE A4 TRUE COPY OF THE CONTINUATION OF THE NEWS WHICH CAME IN\nSAYANNA NEWS PAPER DAILY IN THE YEAR 20713.\nRESPONDENT(S)â€™ ANNEXURES NIL\n/TRUE COPY/\nPA TO JUDGE\nsdr/-\n\n2017/KER/49772\nB. KEMAL PASHA, J.\nDated this the 8\" day of December, 2017\nORDER\nPresently, when allegations are there, there is\nabsolutely nothing to quash the proceedings in\nCC.808/2015 of the Judicial First Class Magistrate's Court-l,\nKozhikode. At the same time, it is open to the petitioner to\nmove the court below under Section 239 Cr.PC., in case\nthat stage is not over. This Crl.M.C. is disposed of\naccordingly.\nlt has been pointed out that the petitioner has been\nimplicated in a series of crimes by the police at the instance\nof the 3 respondent complainant and his associates. After\nthe filing of the Crl.m.C., he has been placed under arrest\nand presently, he is in custody. The District Police Chief,\n\nPe\norcs\n2017/KER/49772\nCrl.M.C.7768/2017\n:2:\nKannur shall see that the petitioner is produced before the\ncourt below in CC.808/2015 on the next posting date for\nenabling him to file an application under Section 239 Cr.P.C.\nSd/-\n(B.KEMAL PASHA, JUDGE)\naks/08/12\n// True Copy //\nPS to Judge\n\n"
}