{
    "case_id": "",
    "court": "HIGH COURT OF KERALA AT ERNAKULAM\nPRESENT",
    "date": "5TH DAY OF JANUARY 2017",
    "judge": "SUNIL THOMAS\nTHURSDAY",
    "petitioners": [
        "SML FINANCE LTD.",
        "KUNNAMKULAM, KUNNAMKULAM PO.",
        "THRISSUR DIST. PIN- 680 503",
        "REP. BY ITS LEGAL COORDINATOR MR.DHANESH K.S., AGED 36 YEARS,",
        "S/O SUKUMARAN K.P.",
        "RESIDING AT DHANESH BHAVAN, VALAMANGALAM SOUTH,",
        "THURAVOOR VILLAGE, CHERTHALA TALUK, ALAPPUZHA DIST."
    ],
    "respondents": [
        "STATE OF KERALA",
        "REPRESENTED BY PUBLIC PROSECUTOR",
        "HIHG COURT OF KERALA, ERNAKULAM- 682 031"
    ],
    "sections": [],
    "outcome": "",
    "full_text": "peepiare\n[Ele\n2017/KER/463\nIN THE HIGH COURT OF KERALA AT ERNAKULAM\nPRESENT:\nTHE HONOURABLE MR. JUSTICE SUNIL THOMAS\nTHURSDAY, THE 5TH DAY OF JANUARY 2017/15TH POUSHA, 1938\nCri.MC.No. 93 of 2017 ()\nAGAINST THE ORDER/JUDGMENT IN CMP 7525/2016 OF JUDICIAL FIRST CLASS\nMAGISTRATE COURT, KUNNAMKULAM\nCRIME NO. 2593/2016 OF KUNNAMKULAM POLICE STATION, TRISSUR\nPETITIONER(S):\nSML FINANCE LTD.\nKUNNAMKULAM, KUNNAMKULAM PO.\nTHRISSUR DIST. PIN- 680 503\nREP. BY ITS LEGAL COORDINATOR MR.DHANESH K.S., AGED 36 YEARS,\nS/O SUKUMARAN K.P.\nRESIDING AT DHANESH BHAVAN, VALAMANGALAM SOUTH,\nTHURAVOOR VILLAGE, CHERTHALA TALUK, ALAPPUZHA DIST.\nBY ADVS.SRI.SUNIL NAIR PALAKKAT\nSRI.K.N.ABHILASH\nSRILM.A.AHAMMAD SAHEER\nSMT.K.AASHA\nRESPONDENT(S):\nSTATE OF KERALA\nREPRESENTED BY PUBLIC PROSECUTOR\nHIHG COURT OF KERALA, ERNAKULAM- 682 031\nBY SRIAMJAD ALI, PUBLIC PROSECUTOR\nTHIS CRIMINAL MISC. CASE HAVING COME UP FOR ADMISSION ON\n05-01-2017, THE COURT ON THE SAME DAY PASSED THE FOLLOWING:\n\nEee il\nPepe\ney Seng\nx Pare\nBeet\n2017/KER/463\nCri.MC.No. 93 of 2017 ()\nAPPENDIX\nPETITIONER(S)' EXHIBITS\nANNEXRE A1 THE TRUE COPY OF THE CRL.M.P NO.7525/2016 DATED 18-11-2016\nBEFORE THE HON'BLE JUDICIAL FIRST CLASS MAGISTRATE COURT,\nKANNAMKULAM U/S 451 OF THE CRIMINAL PROCEDURE CODE\nANNEXURE A2 THE TRUE COPY OF THE INTERIM ORDER DATED 18-11-2016 IN\nCRL.M.A. NO.12241/2016 IN CRL.M.C. NO.7923 OF 2016 OF THIS HON'BLE COURT\nANNEXURE A3 THE TRUE COPY OF THE ORDER IN CRL.M.C. NO.8919/2016 DATED\n20-12-2016 ON THE FILES OF THIS HON'BLE COURT\nRESPONDENT(S)' EXHIBITS NIL\nR.AV TRUE COPY?!\nPATO JUDGE\n\n2017/KER/463\nSUNIL THOMAS, J.\nDated this the 5‚Äù day of January, 2017\nORDER\n\nThe dispute arises in relation to the Maruti WagonR\nvehicle bearing registration No.KL-49G/2383, which was\nsubject matter of hire purchase agreement. It was seized\nby the Kunnamkulam Police in Crime No.2593/2016 in a\ncomplaint preferred by the petitioner herein against the\nborrower. Pending the proceedings the registered owner\nof the vehicle preferred Crl.M.C.7923/2016 along with his\nmother seeking a stay of the entire proceedings. Stay for\na period of two months was granted by Annexure-2 order.\nSubsequently by Annexure-3 order in\nCri.M.C.No.8919/2016 it was clarified that the interim\nstay granted by the court will not stand in the way of the\ncourt below taking up Crl.M.P.7435/2016 in Crime\nNo.2593/2016 of Kunnamkulam Police Station, which was\nan application filed by the RC owner seeking interim\ncustody of the vehicle.\n\n2. The grievance of the petitioner herein who is\n\n2017/KER/463\nCrl.M.C.No.93 of 2017 2\nthe financier is that, his application for interim custody is\nnot being taken for hearing on a premise that neither\nAnnexure-2 nor Annexure-3 authorised the court below to\ntake up his Crl.M.P.No.7525/2016. In the light of above,\nit is clarified that the court below shall take up\nCrl.MP.No.7525/2016 also along with\nCrl.M.P.No.7435/2016 filed by the RC owner and dispose\nof together.\nCrl.M.C. is disposed of accordingly.\nSd/-\nSUNIL THOMAS, JUDGE\n\nRAV ITRUE COPY/I\n\nPATO JUDGE\n\n"
}