{
    "case_id": "",
    "court": "HIGH COURT OF KERALA AT ERNAKULAM\nPRESENT",
    "date": "2ND DAY OF JANUARY 2014",
    "judge": "HARUN-UL-RASHID\nTHURSDAY",
    "petitioners": [
        "ACCUSED:"
    ],
    "respondents": [
        "STATE:"
    ],
    "sections": [],
    "outcome": "",
    "full_text": "Bee\n2014/KER/223\nIN THE HIGH COURT OF KERALA AT ERNAKULAM\nPRESENT:\nTHE HONOURABLE MR.JUSTICE HARUN-UL-RASHID\nTHURSDAY, THE 2ND DAY OF JANUARY 2014/12TH POUSHA, 1935\nCri.MC.No. 42 of 2014 ()\n(SC.NO. 922/2013 OF ADDL.DISTRICT & SESSIONS COURT - V, KOLLAM\nDATED 16-12-2013)\n\nPETITIONER/ACCUSED:\n\nJOSE @ SUNIL, AGED 23 YEARS,\n\nS/O. YESUDASAN, JOY VILASOM, PERAYAM CHERRY,\n\nKOLLAM DISTRICT.\n\nBY ADV. SRIL.M.L.SURESH KUMAR\n\nRESPONDENT/STATE:\n\nSTATE OF KERALA,\n\nREPRESENTED BY PUBLIC PROSECUTOR,\n\nHIGH COURT OF KERALA AT ERNAKULAM.\n\nBY PUBLIC PROSECUTOR SMT. S.HYMA\n\nTHIS CRIMINAL MISC. CASE HAVING COME UP FOR ADMISSION\n\nON 02-01-2014, THE COURT ON THE SAME DAY PASSED THE FOLLOWING:\nsts\n\nBh\ney ee\npera\nBee\n2014/KER/223\nCri.MC.No. 42 of 2014 ()\nAPPENDIX\nPETITIONER(S)’ ANNEXURES:\nANNEXURE-A: THE TRUE COPY OF THE BAIL ORDER DATED 13.11.2013 IN\nCRL.M.P. 3336/2013 OF SESSIONS COURT, KOLLAM.\nANNEXURE-B: THE TRUE COPY OF THE SHOW CAUSE NOTICE DATED\n25.11.2013 ISSUED BY THE SESSIONS COURT.\nANNEXURE-C: THE TRUE COPY OF THE AFFIDAVIT DATED 29.11.2013 BY THE\nPETITIONER BEFORE THE SESSIONS COURT, KOLLAM.\nANNEXURE-D: THE TRUE COPY OF THE ORDER DATED 16.12.2013 IN\n§.C. 922/2013 OF SESSIONS COURT, KOLLAM.\nRESPONDENT(S)’ ANNEXURES: NIL\n/TRUE COPY/\nP.A.TO.JUDGE\nsts\n\nBlas al\n2014/KER/223\nHARUN-UL-RASHID, J.\nCriLM.C. No. 42 of 2014\nDated this the 2” day of January 2014.\nORDER\n\nPetitioner is the accused in S.C.No. 922/2013 of Additional\nSessions Court No.V of Kollam. Annexure A is the copy of the\norder dated 13.11.2013 in Crl.M.P.No. 3336/2013 of Sessions\nCourt, Kollam. As per Annexure A, learned Judge granted bail\nsubject to conditions. Subsequently, the court issued show cause\nnotice dated 25.11.2013 directing the petitioner to show cause\nwithin seven days from receipt of the notice as to why bail shall\nnot be cancelled. Annexure B is the copy of the show cause\nnotice. The reason stated for issuing show cause notice is that\nwhile filing Cri.M.P.No. 3336/2013 on 11.11.13 the fact that bail\napplication filed by the petitioner was dismissed by this Court on\n8.11.13 was not mentioned that it was concealed from the court\nbelow and that it is seen that bail was obtained from the court\nbelow by playing fraud. Annexure C is the affidavit filed by the\npetitioner dated 29.11.2013 explaining the circumstance under\nwhich the Cri.M.P.No. 3336/2013 was filed.\n\n2. In the facts and circumstance, there will be a direction to\nthe Additional District and Sessions Judge-V, Kollam to consider\n\nPa\nBISaa\n2014/KER/223\nCrl.M.C. No.42/2014\n:2:\nAnnexure C explanation and pass appropriate orders. The\nproceedings initiated as per Annexure D order shall be kept in\nabeyance till a decision is taken pursuant to show cause notice\nissued by the court.\nThe Crl.M.C is disposed of as above.\nSd/-\nHARUN-UL-RASHID,\nJudge.\nAL/-\nTrue copy\nP.A to Judge\n\n"
}