{
    "case_id": "Crl.MC.No. 7815 of 2016",
    "court": "HIGH COURT OF KERALA AT ERNAKULAM\nPRESENT",
    "date": "4TH DAY OF JANUARY 2017",
    "judge": "SUNIL THOMAS\nWEDNESDAY",
    "petitioners": [
        "(S) /ACCUSED NO.3:",
        "SHAFI KALLITTA VALAPPIL, AGED 45 YEARS,",
        "S/O.MAHMOOD, KHADEEJAS',",
        "MATTOOL, KANNUR DISTRICT."
    ],
    "respondents": [
        "(S) /DEFACTO COMPLAINTANTS/STATE:",
        "1. STATE OF KERALA,",
        "REPRESENTED BY PUBLIC PROSECUTOR,",
        "HIGH COURT OF KERALA,",
        "ERNAKULAM 682 031.",
        "2. KALLUVALAPPIL RAMACHANDRAN, AGED 45 YEARS,",
        "S/O.KUNHAPPA, MATTOOL AMSOM DESOM",
        "BIRIYANI ROAD, KANNUR DISTRICT, 670 001.",
        "3. P.V.RAJAN, AGED 58 YEARS,",
        "$/O.KUNHIRAMAN,",
        "PAYYAN VALAPPIL HOUSE,",
        "MATTOL AMSOM, MATTOL SOUTH,",
        "NEAR MATTOOL VILLAGE OFFICE",
        "KANNUR DISTRICT 670 001.",
        "R1 BY PUBLIC PROSECUTOR SR.AMJAD ALI",
        "R2&3 BY ADV. SRI.S.R.SREEJITH"
    ],
    "sections": [
        "143",
        "147",
        "457",
        "380 read with Section\n149 of IPC"
    ],
    "outcome": "ORDER/JUDGMENT IN LP 16/2001 of J.M.F.C., PAYYANNUR\nCRIME NO.62/1993 OF PAZHAYANGADI POLICE STATION, KANNUR\nPETITIONER (S) /ACCUSED NO.3:\nSHAFI KALLITTA VALAPPIL, AGED 45 YEARS,\nS/O.MAHMOOD, KHADEEJAS',\nMATTOOL, KANNUR DISTRICT.\nBY ADVS.SRI.M.SASINDRAN\nSRI.P.K.SUBHASH\nRESPONDENT (S) /DEFACTO COMPLAINTANTS/STATE:\n1. STATE OF KERALA,\nREPRESENTED BY PUBLIC PROSECUTOR,\nHIGH COURT OF KERALA,\nERNAKULAM 682 031.\n2. KALLUVALAPPIL RAMACHANDRAN, AGED 45 YEARS,\nS/O.KUNHAPPA, MATTOOL AMSOM DESOM\nBIRIYANI ROAD, KANNUR DISTRICT, 670 001.\n3. P.V.RAJAN, AGED 58 YEARS,\n$/O.KUNHIRAMAN,\nPAYYAN VALAPPIL HOUSE,\nMATTOL AMSOM, MATTOL SOUTH,\nNEAR MATTOOL VILLAGE OFFICE\nKANNUR DISTRICT 670 001.\nR1 BY PUBLIC PROSECUTOR SR.AMJAD ALI\nR2&3 BY ADV. SRI.S.R.SREEJITH\nTHIS CRIMINAL MISC. CASE HAVING COME UP FOR ADMISSION ON\n04-01-2017, THE COURT ON THE SAME DAY PASSED THE FOLLOWING:\n\nPisin)\nPe ae C\noe\nae\n2017/KER/238\nCrl.MC.No. 7815 of 2016 ()\nAPPENDIX\nPETITIONER(S)' EXHIBITS\nANNEXURE Al A TRUE COPY OF THE FIR IN CRIME NO.62/1993\nANNEXURE AIT A TRUE COPY OF THE FINAL REPORT\nANNEXURE AIII A TRUE COPY OF THE JUDGMENT DATED 9/2/1998 IN C.c\nNO.360/1994\nANNEXURE AIV TRUE COPY OF THE AFFIDAVIT SWORN TO BY THE 2ND\nRESPONDENT ENDORSING THE FACTUM OF COMPOUNDING OF THE SAID OFFENCES\nAND THE SETTLEMENT OF THE DISPUTES\nANNEXURE AV TRUE COPY OF THE AFFIDAVIT SWORN TO BY THE 3RD\nRESPONDENT ENDORSING THE FACTUM OF COMPOUNDING OF THE SAID OFFENCES\nAND THE SETTLEMENT OF THE DISPUTES\nRESPONDENT (S)' EXHIBITS : NIL\n/TRUE COPY/\nP. A. TO JUDGE\nPn\n\n2017/KER/238\nSUNIL THOMAS, J.\nDated this the 4\" day of January, 2017\nORDER\n\nThe petitioner herein is the accused No.3 in Crime\nNo.62/1993 of Pazhayangadi Police Station, Kannur for offences\npunishable under Sections 143, 147, 457, 380 read with Section\n149 of IPC.\n\n2. After investigation, final report was laid and the\nremaining accused faced the trial in C.C. No.360/1994. They were\nacquitted, evidenced by Annexure Alll judgment. The case\nagainst the petitioner herein was split up and refiled as C.C.\nNo.76/1998. Since the accused remained absent, matter is now\npending as L.P. No.16/2001. The petitioner contends that the\nmatter has been settled between the parties and in the light of\nthe settlement as well as Annexure Alll judgment, he is entitled\nfor a relief and also to get the proceedings quashed",
    "full_text": "Bel\nu od Baie a\noe\nete\n2017/KER/238\nIN THE HIGH COURT OF KERALA AT ERNAKULAM\nPRESENT:\nTHE HONOURABLE MR. JUSTICE SUNIL THOMAS\nWEDNESDAY, THE 4TH DAY OF JANUARY 2017/14TH POUSHA, 1938\nCrl.MC.No. 7815 of 2016 ()\nAGAINST THE ORDER/JUDGMENT IN LP 16/2001 of J.M.F.C., PAYYANNUR\nCRIME NO.62/1993 OF PAZHAYANGADI POLICE STATION, KANNUR\nPETITIONER (S) /ACCUSED NO.3:\nSHAFI KALLITTA VALAPPIL, AGED 45 YEARS,\nS/O.MAHMOOD, KHADEEJAS',\nMATTOOL, KANNUR DISTRICT.\nBY ADVS.SRI.M.SASINDRAN\nSRI.P.K.SUBHASH\nRESPONDENT (S) /DEFACTO COMPLAINTANTS/STATE:\n1. STATE OF KERALA,\nREPRESENTED BY PUBLIC PROSECUTOR,\nHIGH COURT OF KERALA,\nERNAKULAM 682 031.\n2. KALLUVALAPPIL RAMACHANDRAN, AGED 45 YEARS,\nS/O.KUNHAPPA, MATTOOL AMSOM DESOM\nBIRIYANI ROAD, KANNUR DISTRICT, 670 001.\n3. P.V.RAJAN, AGED 58 YEARS,\n$/O.KUNHIRAMAN,\nPAYYAN VALAPPIL HOUSE,\nMATTOL AMSOM, MATTOL SOUTH,\nNEAR MATTOOL VILLAGE OFFICE\nKANNUR DISTRICT 670 001.\nR1 BY PUBLIC PROSECUTOR SR.AMJAD ALI\nR2&3 BY ADV. SRI.S.R.SREEJITH\nTHIS CRIMINAL MISC. CASE HAVING COME UP FOR ADMISSION ON\n04-01-2017, THE COURT ON THE SAME DAY PASSED THE FOLLOWING:\n\nPisin)\nPe ae C\noe\nae\n2017/KER/238\nCrl.MC.No. 7815 of 2016 ()\nAPPENDIX\nPETITIONER(S)' EXHIBITS\nANNEXURE Al A TRUE COPY OF THE FIR IN CRIME NO.62/1993\nANNEXURE AIT A TRUE COPY OF THE FINAL REPORT\nANNEXURE AIII A TRUE COPY OF THE JUDGMENT DATED 9/2/1998 IN C.c\nNO.360/1994\nANNEXURE AIV TRUE COPY OF THE AFFIDAVIT SWORN TO BY THE 2ND\nRESPONDENT ENDORSING THE FACTUM OF COMPOUNDING OF THE SAID OFFENCES\nAND THE SETTLEMENT OF THE DISPUTES\nANNEXURE AV TRUE COPY OF THE AFFIDAVIT SWORN TO BY THE 3RD\nRESPONDENT ENDORSING THE FACTUM OF COMPOUNDING OF THE SAID OFFENCES\nAND THE SETTLEMENT OF THE DISPUTES\nRESPONDENT (S)' EXHIBITS : NIL\n/TRUE COPY/\nP. A. TO JUDGE\nPn\n\n2017/KER/238\nSUNIL THOMAS, J.\nDated this the 4\" day of January, 2017\nORDER\n\nThe petitioner herein is the accused No.3 in Crime\nNo.62/1993 of Pazhayangadi Police Station, Kannur for offences\npunishable under Sections 143, 147, 457, 380 read with Section\n149 of IPC.\n\n2. After investigation, final report was laid and the\nremaining accused faced the trial in C.C. No.360/1994. They were\nacquitted, evidenced by Annexure Alll judgment. The case\nagainst the petitioner herein was split up and refiled as C.C.\nNo.76/1998. Since the accused remained absent, matter is now\npending as L.P. No.16/2001. The petitioner contends that the\nmatter has been settled between the parties and in the light of\nthe settlement as well as Annexure Alll judgment, he is entitled\nfor a relief and also to get the proceedings quashed.\n\n3. Heard the learned Public Prosecutor who submitted\nthat the matter has been settled between the parties and\nAnnexure Alll is not under challenge in any other proceeding.\nLearned counsel for the contesting respondents relied on\n\n2017/KER/238\nCri. M. C. No. 7815 of 2016 2\nAnnexures A IV & A V and submitted that the matter has been\nsettled and they have no grievance against the petitioner herein.\n\n4. In the light of the above, | am satisfied that, no\npurpose will be served by prosecuting the petitioner herein.\n\nIn the result, Crl.M.C. is allowed. All further proceedings in\nCrime No.62/1993 of Pazhayangadi Police Station, Kannur stand\nquashed.\n\nSd/-\nSUNIL THOMAS, JUDGE.\nPn\n\n"
}