{
    "case_id": "Crl.MC.No. 7001 of 2017",
    "court": "HIGH COURT OF KERALA AT ERNAKULAM\nPRESENT",
    "date": "7TH DAY OF DECEMBER 2017",
    "judge": "B.SUDHEENDRA KUMAR\nTHURSDAY",
    "petitioners": [
        "(S) /ACCUSED:",
        "BIRTHELOMEO BIRTY,",
        "AGED 66,S/0.MARYAN.F.MORRIS,FABI,",
        "PATTATHANAM EAST ,KOLLAM-691021."
    ],
    "respondents": [
        "(S) /DE-FACTO COMPLAINANT & STATE:",
        "STATE OF KERALA,",
        "REPRESENTED BY PUBLIC PROSECUTOR,",
        "HIGH COURT OF KERALA,",
        "ERNAKULAM , KOCHI-682031."
    ],
    "sections": [],
    "outcome": "",
    "full_text": "Bisa torn 1\n4 are\n2017/KER/49556\nIN THE HIGH COURT OF KERALA AT ERNAKULAM\nPRESENT:\nTHE HONOURABLE MR. JUSTICE B.SUDHEENDRA KUMAR\nTHURSDAY, THE 7TH DAY OF DECEMBER 2017/16TH AGRAHAYANA, 1939\nCrl.MC.No. 7001 of 2017 ()\nC.M.P.NO.1254/2016 (A) IN C.C.NO.23 OF 2008 OF ENQUIRY COMMISSIONER\nAND SPECIAL JUDGE, THIRUVANANTHAPURAM.\nCRIME NO. 11/1996 OF V.A.C.B., KOLLAM\nPETITIONER (S) /ACCUSED:\nBIRTHELOMEO BIRTY,\nAGED 66,S/0.MARYAN.F.MORRIS,FABI,\nPATTATHANAM EAST ,KOLLAM-691021.\nBY ADV. SRI.SIVAN MADATHIL\nRESPONDENT (S) /DE-FACTO COMPLAINANT & STATE:\nSTATE OF KERALA,\nREPRESENTED BY PUBLIC PROSECUTOR,\nHIGH COURT OF KERALA,\nERNAKULAM , KOCHI-682031.\nBY SPECIAL GOVERNMENT PLEADER (VACB) SRI.RAJESH A.\nTHIS CRIMINAL MISC. CASE HAVING COME UP FOR ADMISSION ON 07-12-2017,\nTHE COURT ON THE SAME DAY PASSED THE FOLLOWING:\nSTK\n\nES\n2017/KER/49556\nB. SUDHEENDRA KUMAR, J.\nCrl.M.C. No.7001 of 2017\nDated this the 7 day of December, 2017\nORDER\n\nWhen the matter has been taken up for hearing, the\nlearned counsel for the petitioner has requested for\ngranting permission to withdraw this Crl.M.C. Accordingly,\nthis Crl.M.C. stands dismissed as withdrawn.\n\n2. However, the learned counsel for the petitioner\nhas submitted that there was a direction in Annexure-A6\norder that the personal presence of the petitioner is to be\ndispensed with by the court concerned and the petitioner\nneed not be compelled to appear now.\n\n3. The petitioner is aged 66 years. The learned\nSpecial Public Prosecutor has submitted that further\ninvestigation will be complete and the supplementary\nreport will be filed before the court within 30 days from\ntoday. Since the supplementary final report is not yet\nfiled after completing the further investigation, it is\n\na S ware\nra\n2017/KER/49556\nCri.M.C. No.7001 of 2017\n-32%-\ndirected that the petitioner need not appear before the\ncourt below in C.C.No.9/2009 till the filing of\nsupplementary final report by the respondent. I! also\ndirect the court below to give notice to the learned\ncounsel appearing for the petitioner before that court,\nintimating the date on which the petitioner has to appear\nbefore that court, after the filing of the supplementary\nfinal report by the respondent, as the appearance of the\npetitioner shall be subject to the result of the further\ninvestigation.\nSd/-\nB. SUDHEENDRA KUMAR,\nJUDGE\nSTK\n/[TRUE COPY//\n//P.A. TO JUDGE//\n\n"
}