{
    "case_id": "",
    "court": "HIGH COURT OF KERALA AT ERNAKULAM\nPRESENT",
    "date": "7TH DAY OF DECEMBER 2017",
    "judge": "B.SUDHEENDRA KUMAR\nTHURSDAY",
    "petitioners": [
        "(S) /PETITIONER/3RD ACCUSED:",
        "NASIA IBRAHIM,",
        "D/O. A.T.IBRAHIM KUTTY, THOOMAT HOUSE,",
        "ORUMANAYOOR P.O., CHAVAKAD,",
        "THRISSUR, PIN-680512."
    ],
    "respondents": [
        "(S) /RESPONDENTS / COMPLAINANT :",
        "1. STATE OF KERALA",
        "REPRESENTED THROUGH THE PUBLIC PROSECUTOR,",
        "HIGH COURT OF KERALA, ERNAKULAM-682031.",
        "2. ZODIAC ADVERTISERS",
        "P.B.NO. 2064, S.A.ROAD, KADAVANTHRA,",
        "REP. BY ITS MANAGING PARTNER,",
        "JOHNSON V.GEORGE, S/O. VARKEY.",
        "R2 BY ADV. SRI.SHAHUL HAMEED MOOPPAN",
        "SRI .K.M. VARGHESE",
        "R1 BY PUBLIC PROSECUTOR SRI.T.R.RENJITH"
    ],
    "sections": [],
    "outcome": "",
    "full_text": "hl\neae 1\net =8 Fr\nfaery\n2017/KER/49552\nIN THE HIGH COURT OF KERALA AT ERNAKULAM\nPRESENT:\nTHE HONOURABLE MR. JUSTICE B.SUDHEENDRA KUMAR\nTHURSDAY, THE 7TH DAY OF DECEMBER 2017/16TH AGRAHAYANA, 1939\nCr1l.MC.No. 5228 of 2013 ()\nST 274/2012 of J.M.F.C.-IV, KOCHI\nPETITIONER (S) /PETITIONER/3RD ACCUSED:\nNASIA IBRAHIM,\nD/O. A.T.IBRAHIM KUTTY, THOOMAT HOUSE,\nORUMANAYOOR P.O., CHAVAKAD,\nTHRISSUR, PIN-680512.\nBY ADVS.SRI.C.V.MANUVILSAN\nSRI.G.SUDHEER (THURAVOOR)\nSMT .K.VIDYA\nSRI.RAJAN VISHNURAT\nSRI .V.HARISH\nRESPONDENT (S) /RESPONDENTS / COMPLAINANT :\n1. STATE OF KERALA\nREPRESENTED THROUGH THE PUBLIC PROSECUTOR,\nHIGH COURT OF KERALA, ERNAKULAM-682031.\n2. ZODIAC ADVERTISERS\nP.B.NO. 2064, S.A.ROAD, KADAVANTHRA,\nREP. BY ITS MANAGING PARTNER,\nJOHNSON V.GEORGE, S/O. VARKEY.\nR2 BY ADV. SRI.SHAHUL HAMEED MOOPPAN\nSRI .K.M. VARGHESE\nR1 BY PUBLIC PROSECUTOR SRI.T.R.RENJITH\nTHIS CRIMINAL MISC. CASE HAVING BEEN FINALLY HEARD ON 07-12-2017, THE\nCOURT ON THE SAME DAY PASSED THE FOLLOWING:\nSTK\n\na\n2017/KER/49552\nB. SUDHEENDRA KUMAR, J.\nCri.M.C. No.5228 of 2013\nDated this the 7 day of December, 2017\nORDER\n\nWhen this matter has been taken up for hearing, the\nlearned counsel for the petitioner has sought for\npermission to withdraw this Crl.M.C. Permission stands\ngranted. Accordingly, this Crl.M.C. stands dismissed as\nwithdrawn.\n\n2. The learned counsel for the petitioner has\nsubmitted that the second accused in this case, namely,\nNaeem Ibrahim, who is the brother of the petitioner\nherein, had deposited an amount equivalent to the cheque\namount before the court below at the time of executing\nthe bond. The learned counsel has further submitted that\nthe second accused is prepared to file an affidavit before\nthe court below stating that he has no objection in\nreleasing the above said amount to theâ€™ second\nrespondent herein, who is the complainant before the\ncourt below. The learned counsel for the second\n\nna\n2017/KER/49552\nCri.M.C. No.5228 of 2013\n-:2%-\nrespondent herein has submitted that if the above said\namount is released to the second respondent, he is\nprepared to withdraw the complaint.\n\n3. This being the situation, it is directed that if the\nsecond accused in this case files affidavit before the court\nbelow, within 15 days of receipt of this order stating that\nhe has no objection in releasing the amount deposited by\nhim in favour of the complainant, the court below shall\nrelease the said amount to the complainant, if the\ncomplainant is prepared to withdraw the complaint on\nreceipt of the said amount.\n\n| make it clear that the personal attendance of the\npetitioner or the second accused shall not be insisted\nupon by the court below for the above purpose.\n\nSd/-\nB. SUDHEENDRA KUMAR,\nJUDGE\nSTK\n/[TRUE COPY//\n/IP.A. TO JUDGE//\n\n"
}