{
    "case_id": "Crl.MC.No. 7382 of 2016",
    "court": "HIGH COURT OF KERALA AT ERNAKULAM\nPRESENT",
    "date": "6TH DAY OF JANUARY 2016",
    "judge": "SUNIL THOMAS\nFRIDAY",
    "petitioners": [
        "(S) /ACCISED NO. 1:"
    ],
    "respondents": [
        "(S) /STATE/RESPONDENTS :",
        "1. STATE OF KERALA,",
        "REPRESENTED BY THE PUBLIC PROSECUTOR,",
        "HIGH COURT OF KERALA, ERNAKULAM-31.",
        "2. RAHUL,"
    ],
    "sections": [
        "143",
        "147",
        "148",
        "323",
        "308 of IPC read with Section 4 of the Kerala"
    ],
    "outcome": "ORDER/JUDGMENT IN SC 1334/2010 of ADDITIONAL SESSIONS\nCOURT (ADHOC) III, KOLLAM ORDER/JUDGMENT IN LP 13/2014 of ADDL. D.C. &\nSESSIONS COURT - VI, KOLLAM\nCRIME NO. 664/2004 OF KOLLAM EAST POLICE STATION , KOLLAM)\nPETITIONER (S) /ACCISED NO. 1:\n\nHASHIM,\n\nAGED 35 YEARS, S/O.SAINUDEEN, HAJITHA BHAVAN,\n\nMOTTAKKAVU NEDUMPANA NOW RESIDING AT HASEENA BHAVAN,\n\nMOTTAKKAVU NEDUMPANA , KOLLAM.\n\nBY ADVS.SRI.K.SHAJ\n\nSRI.RENJIT GEORGE\nRESPONDENT (S) /STATE/RESPONDENTS :\n1. STATE OF KERALA,\nREPRESENTED BY THE PUBLIC PROSECUTOR,\nHIGH COURT OF KERALA, ERNAKULAM-31.\n2. RAHUL,\n\nAGED 31 YEARS, S/O.RAJAGOPAL,\n\nSIVASAKTHI BHAVANAM, MUTTACKAVU, NEDUMPANA VILLAGE,\n\nKOLLAM-691009.\n\nR2 BY ADV. SRI.SANTHOSH MATHEW\n\nR2 BY ADV. SRI.SERGI JOSEPH THOMAS\n\nR BY PUBLIC PROSECUTOR T.R.RANJITH\n\nTHIS CRIMINAL MISC. CASE HAVING COME UP FOR ADMISSION ON\n\n06-01-2017, THE COURT ON THE SAME DAY PASSED THE FOLLOWING:\n\n5 5\ns are\naa\n2017/KER/708\nCrl.MC.No. 7382 of 2016 ()}\nAPPENDIX\nPETITIONER(S)' EXHIBITS\nANNEXURE Al THE CERTIFIED COPY OF THE FINAL REPORT IN SC NO\n1334/2010 PENDING AS LP NO 13/2014 ON THE FILE OF VI ADDITIONAL\nSESSIONS COURT,KOLLAM ARISING OUT OF CRIME NO 664/2004 OF KOLLAM EAST\nPOLICE STATION,\nANNEXURE A2 THE CERTIFIED COPY OF THE JUDGMENT DTD 9/4/2010 IN Sc\nNO 541/2007 (CLUBBED WITH SC NO 1351/2007) IN THE COURT OF THE\nADDITIONAL DISTRICT AND SESSIONS JUDGE, KOLLAM.\nANNEXURE A3 AN AFFIDAVIT SWORN BY THE 2ND RESPONDENT STATING THE\nSETTLEMENT OF ALL THE DISPUTES.\nRESPONDENT (S)' EXHIBITS\neo NIL\n/TRUE COPY/ PS TO JUDGE\n\nBalers Tal\n2017/KER/708\nSUNIL THOMAS, J.\nCr.M.C.No.7382 of 2016\nDated this the 6\" day of January, 2017\nORDER\n\nThe petitioner herein is the first accused in SC No.1334/2010,\nnow pending as L.P.No.13/2014 of the VI Additional Sessions Court,\nKollam for offences punishable under sections 143,147,148,323 and\n308 of IPC read with Section 4 of the Kerala(Prevention) of Ragging\nAct .\n\n2. The petitioner herein along with nine other persons stood\ncharge sheeted for offences punishable under the above provisions\nof law. All the accused except the petitioner herein faced the trial.\nBy Annexure A2 Judgment, all the accused who faced the trial were\nacquitted on the ground that the prosecution failed to prove the\nallegation against the accused. The case against the petitioner\nherein was split up and re-filed. Since the accused again remained\nabsent, it was relegated to the LP Register.\n\n3. The petitioner has now approached this court contending\nthat the matter has been settled between the parties, that in the\nlight of Annexure A2 judgment, the substratum of the case is\nbroken and that benefit should enure to him also. It was further\nsubmitted that the dispute has also been settled between the\nparties as is evident from Annexure A3 affidavit filed by the second\n\nBie al\n2017/KER/708\nCri.M.C.No.7382/2016 2\nrespondent.\n\n4, Learned counsel for the second respondent relying on\nAnnexure A3 affidavit, submitted that the matter has been settled.\n\n5. Learned Public Prosecutor on instructions, submitted that\nthe petitioner is not involved in any other crime and that the\ndispute has been resolved.\n\n6. In the light of the above, I am satisfied that no purpose will\nbe served at this length of time by proceeding against the\npetitioner herein. Having considered these facts in detail, I find\nthat interest of justice demands,all the further proceedings against\nthe petitioner should stand quashed",
    "full_text": "ements\nfrance\n2017/KER/708\nIN THE HIGH COURT OF KERALA AT ERNAKULAM\nPRESENT:\nTHE HONOURABLE MR. JUSTICE SUNIL THOMAS\nFRIDAY, THE 6TH DAY OF JANUARY 2016/16TH POUSHA, 1938\nCr1.MC.No. 7382 of 2016 ()\n\n(AGAINST THE ORDER/JUDGMENT IN SC 1334/2010 of ADDITIONAL SESSIONS\nCOURT (ADHOC) III, KOLLAM ORDER/JUDGMENT IN LP 13/2014 of ADDL. D.C. &\nSESSIONS COURT - VI, KOLLAM\nCRIME NO. 664/2004 OF KOLLAM EAST POLICE STATION , KOLLAM)\nPETITIONER (S) /ACCISED NO. 1:\n\nHASHIM,\n\nAGED 35 YEARS, S/O.SAINUDEEN, HAJITHA BHAVAN,\n\nMOTTAKKAVU NEDUMPANA NOW RESIDING AT HASEENA BHAVAN,\n\nMOTTAKKAVU NEDUMPANA , KOLLAM.\n\nBY ADVS.SRI.K.SHAJ\n\nSRI.RENJIT GEORGE\nRESPONDENT (S) /STATE/RESPONDENTS :\n1. STATE OF KERALA,\nREPRESENTED BY THE PUBLIC PROSECUTOR,\nHIGH COURT OF KERALA, ERNAKULAM-31.\n2. RAHUL,\n\nAGED 31 YEARS, S/O.RAJAGOPAL,\n\nSIVASAKTHI BHAVANAM, MUTTACKAVU, NEDUMPANA VILLAGE,\n\nKOLLAM-691009.\n\nR2 BY ADV. SRI.SANTHOSH MATHEW\n\nR2 BY ADV. SRI.SERGI JOSEPH THOMAS\n\nR BY PUBLIC PROSECUTOR T.R.RANJITH\n\nTHIS CRIMINAL MISC. CASE HAVING COME UP FOR ADMISSION ON\n\n06-01-2017, THE COURT ON THE SAME DAY PASSED THE FOLLOWING:\n\n5 5\ns are\naa\n2017/KER/708\nCrl.MC.No. 7382 of 2016 ()}\nAPPENDIX\nPETITIONER(S)' EXHIBITS\nANNEXURE Al THE CERTIFIED COPY OF THE FINAL REPORT IN SC NO\n1334/2010 PENDING AS LP NO 13/2014 ON THE FILE OF VI ADDITIONAL\nSESSIONS COURT,KOLLAM ARISING OUT OF CRIME NO 664/2004 OF KOLLAM EAST\nPOLICE STATION,\nANNEXURE A2 THE CERTIFIED COPY OF THE JUDGMENT DTD 9/4/2010 IN Sc\nNO 541/2007 (CLUBBED WITH SC NO 1351/2007) IN THE COURT OF THE\nADDITIONAL DISTRICT AND SESSIONS JUDGE, KOLLAM.\nANNEXURE A3 AN AFFIDAVIT SWORN BY THE 2ND RESPONDENT STATING THE\nSETTLEMENT OF ALL THE DISPUTES.\nRESPONDENT (S)' EXHIBITS\neo NIL\n/TRUE COPY/ PS TO JUDGE\n\nBalers Tal\n2017/KER/708\nSUNIL THOMAS, J.\nCr.M.C.No.7382 of 2016\nDated this the 6\" day of January, 2017\nORDER\n\nThe petitioner herein is the first accused in SC No.1334/2010,\nnow pending as L.P.No.13/2014 of the VI Additional Sessions Court,\nKollam for offences punishable under sections 143,147,148,323 and\n308 of IPC read with Section 4 of the Kerala(Prevention) of Ragging\nAct .\n\n2. The petitioner herein along with nine other persons stood\ncharge sheeted for offences punishable under the above provisions\nof law. All the accused except the petitioner herein faced the trial.\nBy Annexure A2 Judgment, all the accused who faced the trial were\nacquitted on the ground that the prosecution failed to prove the\nallegation against the accused. The case against the petitioner\nherein was split up and re-filed. Since the accused again remained\nabsent, it was relegated to the LP Register.\n\n3. The petitioner has now approached this court contending\nthat the matter has been settled between the parties, that in the\nlight of Annexure A2 judgment, the substratum of the case is\nbroken and that benefit should enure to him also. It was further\nsubmitted that the dispute has also been settled between the\nparties as is evident from Annexure A3 affidavit filed by the second\n\nBie al\n2017/KER/708\nCri.M.C.No.7382/2016 2\nrespondent.\n\n4, Learned counsel for the second respondent relying on\nAnnexure A3 affidavit, submitted that the matter has been settled.\n\n5. Learned Public Prosecutor on instructions, submitted that\nthe petitioner is not involved in any other crime and that the\ndispute has been resolved.\n\n6. In the light of the above, I am satisfied that no purpose will\nbe served at this length of time by proceeding against the\npetitioner herein. Having considered these facts in detail, I find\nthat interest of justice demands,all the further proceedings against\nthe petitioner should stand quashed.\n\nIn the result, the Crl.M.C.is allowed. All further proceedings\npursuant to SC No.1334/2010 now pending as LP No.13/2014 of\nthe VI Additional Sessions Court, Kollam arising from crime\nNO.664/2004 of Kollam East Police Station stand quashed.\n\nSd/-\nSUNIL THOMAS\nJudge\ndpk\n/true copy/ PS to Judge.\n\n|\n2017/KER/708\nCri.M.C.No.7382/2016 3\n\n"
}