{
    "case_id": "",
    "court": "HIGH COURT OF KERALA AT ERNAKULAM\nPRESENT\nTHE HONOURABLE MR",
    "date": "19TH DAY OF JANUARY 2024",
    "judge": "BECHU KURIAN THOMAS\nFRIDAY",
    "petitioners": [
        "CW2:",
        "SAJITHA,",
        "AGED 38 YEARS",
        "W/O SHAHUL HAMMED,",
        "MATTUMMAL HOUSE,",
        "RAMANATTUKARA, VYDYARANGADI.P.O,",
        "KOZHIKODE DISTRICT -, PIN - 673633"
    ],
    "respondents": [
        "S/COMPLAINANT/DEFACTO COMPLAINANT:",
        "1 STATE OF KERALA",
        "REPRESENTED BY THE PUBLIC PROSECUTOR,",
        "HIGH COURT OF KERALA,",
        "ERNAKULUM, KOCHI., PIN - 682031",
        "2 THE STATION HOUSE OFFICER",
        "FEROKE POLICE STATION,",
        "KOZHIKODE, KERALA ., PIN - 673631"
    ],
    "sections": [],
    "outcome": "",
    "full_text": "sR]\ni et mth q\nBl? ce: a\n2024/KER/4264\nIN THE HIGH COURT OF KERALA AT ERNAKULAM\nPRESENT\nTHE HONOURABLE MR. JUSTICE BECHU KURIAN THOMAS\nFRIDAY, THE 19TH DAY OF JANUARY 2024 / 29TH POUSHA, 1945\nCRL.MC NO. 35 OF 2024\nCRIME NO.119/2009 OF FEROKE POLICE STATION, KOZHIKODE\nIN C.C.NO.1280/2016 OF JUDICIAL MAGISTRATE OF FIRST\nCLASS -V,KOZHIKODE\nPETITIONER/CW2:\nSAJITHA,\nAGED 38 YEARS\nW/O SHAHUL HAMMED,\nMATTUMMAL HOUSE,\nRAMANATTUKARA, VYDYARANGADI.P.O,\nKOZHIKODE DISTRICT -, PIN - 673633\nBY ADVS.\nPRATHAP. S.R.K.\nANN OLIVIA VALLAVANADAN\nARCHANA VINOD\nMAHENDRAKUMAR K.,\nRESPONDENTS/COMPLAINANT/DEFACTO COMPLAINANT:\n1 STATE OF KERALA\nREPRESENTED BY THE PUBLIC PROSECUTOR,\nHIGH COURT OF KERALA,\nERNAKULUM, KOCHI., PIN - 682031\n2 THE STATION HOUSE OFFICER\nFEROKE POLICE STATION,\nKOZHIKODE, KERALA ., PIN - 673631\nBY ADV. SRI. NOUSHAD K.A.\nPUBLIC PROSECUTOR\nTHIS CRIMINAL MISC. CASE HAVING COME UP FOR ADMISSION ON\n19.01.2024, THE COURT ON THE SAME DAY PASSED THE FOLLOWING:\n\nage\nrapes aes\n2024/KER/4264\nâ€œ12!\nBECHU KURIAN THOMAS, J.\nCrl.M.C. No.35 of 2024\nDated this the 19\" day of January, 2024\nORDER\nThe learned counsel for the petitioner seeks permission to withdraw\nthis criminal miscellaneous case.\nPermission granted. Accordingly, this Crl.M.C. is dismissed as\nwithdrawn.\nSd/-\nBECHU KURIAN THOMAS\nJUDGE\nJka/19.01.24.\n\n"
}