{
    "case_id": "Crl.MC.No. 214 of 2019",
    "court": "HIGH COURT OF KERALA AT ERNAKULAM",
    "date": "9TH DAY OF JANUARY 2019",
    "judge": "K.ABRAHAM MATHEW\nWEDNESDAY",
    "petitioners": [
        "MAYA DIVAKARAN",
        "AGED 32 YEARS, W/O.RAVEENDRAN,",
        "CHEMANCHERY PUTHIYA VEEDU,",
        "VADAVANTHOOR, MATHIL (P.0O.),",
        "KANNUR (DIST.)."
    ],
    "respondents": [
        "1 STATE OF KERALA",
        "REP. BY THE PUBLIC PROSECUTOR,",
        "HIGH COURT OF KERALA, ERNAKULAM.",
        "2 N.U. SARAMMA",
        "AGED 70 YEARS, W/O.N.S.POULOSE,",
        "PAULSONS HOUSE, PRESIDENT,",
        "PERINGOME VANITHA SAHAKARANA SANGHAM,",
        "ARAVANCHAL, PERINGOME, KANNUR."
    ],
    "sections": [
        "482 Cr"
    ],
    "outcome": "ORDER\n\nPetition filed under Section 482 Cr.P.C.\n\n2. Petitioner is the accused in\nC.C.No.419 of 2018 on the file of the Judicial\nMagistrate of First Class, Payyannur. She is\nalleged to have committed the offences under\nSections 201, 406 and 420 £42=IPC. Second\nrespondent is the President of the\nCo-operative Society. She is the victim in\nthe case. It is submitted that the matter has\nbeen settled and the proceedings in the trial\ncourt may be quashed",
    "full_text": "ee\neae\nIN THE HIGH COURT OF KERALA AT ERNAKULAM 2019/KER/1068\nPRESENT\nTHE HONOURABLE MR. JUSTICE K.ABRAHAM MATHEW\nWEDNESDAY, THE O9TH DAY OF JANUARY 2019 / 19TH POUSHA, 1940\nCrl1.MC.No. 214 of 2019\nAGAINST CC 419/2018 of J.M.F.C., PAYYANNUR\nCRIME NO. 227/2017 of Peringome Police Station, Kannur\nPETITIONER:\nMAYA DIVAKARAN\nAGED 32 YEARS, W/O.RAVEENDRAN,\nCHEMANCHERY PUTHIYA VEEDU,\nVADAVANTHOOR, MATHIL (P.0O.),\nKANNUR (DIST.).\nBY ADV. SMT.K.DEEPA (PAYYANUR)\nRESPONDENT:\n1 STATE OF KERALA\nREP. BY THE PUBLIC PROSECUTOR,\nHIGH COURT OF KERALA, ERNAKULAM.\n2 N.U. SARAMMA\nAGED 70 YEARS, W/O.N.S.POULOSE,\nPAULSONS HOUSE, PRESIDENT,\nPERINGOME VANITHA SAHAKARANA SANGHAM,\nARAVANCHAL, PERINGOME, KANNUR.\nBY ADV. SURYA.K.P\nPUBLIC PROSECUTOR SRI M S BREEZ\nTHIS CRIMINAL MISC. CASE HAVING COME UP FOR ADMISSION ON\n09.01.2019, THE COURT ON THE SAME DAY PASSED THE FOLLOWING:\n\nPa\nie ped\nElz ro mm\nCr1.MC.No. 214 of 2019 2 2019/KER/1068\nORDER\n\nPetition filed under Section 482 Cr.P.C.\n\n2. Petitioner is the accused in\nC.C.No.419 of 2018 on the file of the Judicial\nMagistrate of First Class, Payyannur. She is\nalleged to have committed the offences under\nSections 201, 406 and 420 £42=IPC. Second\nrespondent is the President of the\nCo-operative Society. She is the victim in\nthe case. It is submitted that the matter has\nbeen settled and the proceedings in the trial\ncourt may be quashed.\n\n3. Heard the learned counsel for the\npetitioner and the second respondent and the\nlearned Public Prosecutor.\n\n4. The petitioner was temporary Secretary\nof the Peringome Vanitha Sahakarana Sangham of\nwhich the second respondent is the present\n\nBiel\nCrl.MC.No. 214 of 2019 3 2019 /KERITO68\nPresident. The petitioner allegedly\nmisappropriated certain amount belonging to\nthe Society and cheated it. T have perused\nthe affidavit filed by the second respondent.\nI am satisfied that the matter has been\nsettled and no public interest is involved in\nit. There is no legal impediment for quashing\nthe proceedings.\nIn the result, this Crl.M.C. is allowed.\n\nThe proceedings in C.C.No.419 of 2018 on the\nfile of the Judicial Magistrate of First\nClass, Payyannur are quashed.\n\nSd/-\n\nK.ABRAHAM MATHEW\n\nJUDGE\n\nMC/10.01.19\n\nee\neres\nCrl.MC.No. 214 of 2019 4 2019/KER/1068\nAPPENDIX\n\nPETITIONER'S/S EXHIBITS:\n\nANNEXURE I TRUE COPY OF THE RESOLUTION DATED\n21/11/2018 PASSED BY THE PERINGOME\nSAHAKARANA SANGHAM TO THE EFFECT OF\nTAKING DECISION TO WITHDRAW THE\nPROSECUTION PROCEEDINGS AGAINST THE\nPETITIONER.\n\nANNEXURE II CERTIFIED COPY OF THE FINAL REPORT\nOF CRIME NO. 227/17 OF PERINGOME\nPOLICE STATION, KANNUR.\n\nANNEXURE III AFFIDAVIT FILED BY THE 2ND\nRESPONDENT.\n\nRESPONDENT'S/S EXHIBITS:\n\nNIL\n\nMC\n\n(TRUE COPY) PA TO JUDGE\n\n"
}