{
    "case_id": "Crl.MC.No.8885 of 2018",
    "court": "HIGH COURT OF KERALA AT ERNAKULAM",
    "date": "8TH DAY OF JANUARY 2019",
    "judge": "MARY JOSEPH\nTUESDAY",
    "petitioners": [
        "ACCUSED 1 TO 3:",
        "1 SANDEEP",
        "AGED 27 YEARS",
        "S/O.MANIKANTAN, NOCHIKKALPATTA HOUSE, CHITLACHERRY,",
        "ALATHUR, PALAKKAD.",
        "2 AJESH",
        "AGED 34 YEARS",
        "S/O.KRISHNAN, NOCHIKKALPATTA HOUSE, CHITLACHERRY,",
        "ALATHUR, PALAKKAD.",
        "3 RAMESH",
        "AGED 27 YEARS",
        "S/O.RAMAN, NOCHIKKALPATTA HOUSE, CHITLACHERRY,",
        "ALATHUR, PALAKKAD."
    ],
    "respondents": [
        "S/COMPLAINANT & STATE:",
        "1 STATE OF KERALA",
        "REPRESENTED BY THE PUBLIC PROSECUTOR, HIGH COURT OF",
        "KERALA, ERNAKULAM-31.",
        "2 RATHEESH",
        "AGED 34 YEARS",
        "S/O.RAMAKRISHNAN, CHERUVANJIPARAMBU, KATHAMPOTTA,",
        "CHITLANCHERRY, ALATHUR, PALAKKAD-678510.",
        "R2 BY ADV. SRI.GOKUL DAS V.V.H.",
        "RI BY SRI. ALEX M. THOMBRA, SR.PUBLIC PROSECUTOR"
    ],
    "sections": [],
    "outcome": "ORDER\n\nAnnexure II final report filed on concluding the\ninvestigation in Crime No.1445 of 2015 of Alathur Police\nStation, Palakkad District and the proceedings in\nS.C.No.641/2016 registered on its basis are sought to be\nquashed",
    "full_text": "BLA hl\noud\nBlu ae\nIN THE HIGH COURT OF KERALA AT ERNAKULAM 2019/KER/976\nPRESENT\nTHE HONOURABLE MRS. JUSTICE MARY JOSEPH\nTUESDAY ,THE O8TH DAY OF JANUARY 2019 / 18TH POUSHA, 1940\nCr1.MC.No. 8885 of 2018\nCRIME NO. 1445/2015 OF Alathur Police Station , Palakkad District\nPETITIONER/ACCUSED 1 TO 3:\n1 SANDEEP\nAGED 27 YEARS\nS/O.MANIKANTAN, NOCHIKKALPATTA HOUSE, CHITLACHERRY,\nALATHUR, PALAKKAD.\n2 AJESH\nAGED 34 YEARS\nS/O.KRISHNAN, NOCHIKKALPATTA HOUSE, CHITLACHERRY,\nALATHUR, PALAKKAD.\n3 RAMESH\nAGED 27 YEARS\nS/O.RAMAN, NOCHIKKALPATTA HOUSE, CHITLACHERRY,\nALATHUR, PALAKKAD.\nBY ADV. SRI.T.K.SANDEEP\nRESPONDENTS/COMPLAINANT & STATE:\n1 STATE OF KERALA\nREPRESENTED BY THE PUBLIC PROSECUTOR, HIGH COURT OF\nKERALA, ERNAKULAM-31.\n2 RATHEESH\nAGED 34 YEARS\nS/O.RAMAKRISHNAN, CHERUVANJIPARAMBU, KATHAMPOTTA,\nCHITLANCHERRY, ALATHUR, PALAKKAD-678510.\nR2 BY ADV. SRI.GOKUL DAS V.V.H.\nRI BY SRI. ALEX M. THOMBRA, SR.PUBLIC PROSECUTOR\nTHIS CRIMINAL MISC. CASE HAVING COME UP FOR ADMISSION ON\n08.01.2019, THE COURT ON THE SAME DAY PASSED THE FOLLOWING:\n\nLiha\nbh\nCrl.MC.No.8885 of 2018 2 201KER/IT6\nORDER\n\nAnnexure II final report filed on concluding the\ninvestigation in Crime No.1445 of 2015 of Alathur Police\nStation, Palakkad District and the proceedings in\nS.C.No.641/2016 registered on its basis are sought to be\nquashed in the present petition. The petition is filed by the\nthree accused involved in the above crime jointly.\n\n2. It is contended by Sri.Sandeep T.K., the learned\ncounsel for petitioners that, the issues involved in the case have\nbeen settled amicably among the petitioners and the defacto\ncomplainant and an affidavit of the defacto complainant\nswearing to those aspects is produced along with the petition as\nAnnexure III. He invited the attention of this Court to Annexure\nIII. On a glance at the same, it is revealed that the issues\ninvolved in the case on hand were settled. The deponent of\nthe affidavit is none other than the defacto complainant and he\nhas sworn to the factum of settlement arrived at among himself\nand the petitioners and stated that, he maintains no grievance\nagainst the petitioners in view of the settlement arrived at and\nhas no objection in quashing the proceedings initiated against\nthem pursuant to Annexure II final report in Crime No.1445 of\n2015 of Alathur Police Station, Palakkad District and S.C\n\nLiha\nbh\nCrl.MC.No.8885 of 2018 3 201KER/IT6\nNo.S.C.No.641/2016.\n\n3. The learned Public Prosecutor was directed by this\nCourt on 21.12.2018 to obtain instructions in the matter and\nholding an enquiry into it's veracity. The learned Public\nProsecutor has submitted on the basis of the instructions\nobtained by him that, the submission of the learned counsel for\nthe petitioner is true to facts. In the aforesaid circumstances,\nthis Court is inclined to allow this petition.\n\nIn the result, Crl.M.C stands allowed. Annexure-II final\nreport laid by Alathur Police in Crime No.1445 of 2015 and all\nfurther proceedings initiated in S.C.No.641 of 2016 registered\non the basis of Annexure-II by the Assistant Sessions Court,\nPalakkad stands quashed forthwith as against all the\npetitioners.\n\nsd/-\nMARY JOSEPH\nJUDGE\nNAB\n\nPR\npoeve|\nBl ene\nCr1.MC.No.8885 of 2018 4 2019/KERIS76\nAPPENDIX\nPETITIONER'S/S ANNEXURE:\nANNEXURE I A TRUE COPY OF FIR IN CRIME NO.1445/2015\nDATED 27/12/2015 OF ALATHUR POLICE\nSTATION, PALAKKAD DISTRICT.\nANNEXURE II A TRUE COPY OF FINAL REPORT IN CRIME\nNO.1445/2015 DATED 14/02/2016 OF ALATHUR\nPOLICE STATION, PALAKKAD DIST.\nANNEXURE III A TRUE COPY OF THE AFFIDAVIT SWORN IN BY\nTHE 2ND RESPONDENT DATED 07/12/2018.\nRESPONDENT'S ANNEXURE: NIL\n//TRUE CoPpy//\nP A TO JUDGE\n\n"
}