{
    "case_id": "",
    "court": "HIGH COURT OF KERALA AT ERNAKULAM\nPRESENT",
    "date": "3RD DAY OF OCTOBER 2016",
    "judge": "SUNIL THOMAS\nMONDAY",
    "petitioners": [
        "(S) /ACCUSED NO.1 TO 4:",
        "1. JOMON, S/O.MATHEW,",
        "AGED 28 YEARS, KANNAMPLAKKAL HOUSE,",
        "MUNNOORKOCHI, KUDIYANMALA P.O.,",
        "NADUVIL AMSOM, KANNUR DISTRICT-670 582.",
        "2. JOBIN, S/O.MATHEW,",
        "AGED 26 YEARS, KANNAMPLAKKAL HOUSE,",
        "MUNNOORKOCHI, KUDIYANMALA P.O.,",
        "NADUVIL AMSOM, KANNUR DISTRICT-670 582.",
        "3. KURIAN @ KUNHU, S/O.MICHAEL,",
        "AGED 51 YEARS, KANNAMPLAKKAL HOUSE,",
        "MUNNOORKOCHI, KUDIYANMALA P.O.,",
        "NADUVIL AMSOM, KANNUR DISTRICT-670 582.",
        "4. NITHIN, S/O.KURIAN,",
        "AGED 22 YEARS, KANNAMPLAKKAL HOUSE,",
        "MUNNOORKOCHI, KUDIYANMALA P.O.,",
        "NADUVIL AMSOM, KANNUR DISTRICT-670 582."
    ],
    "respondents": [
        "(S)/STATE & AGGRIEVED PERSONS:",
        "1. STATE OF KERALA,",
        "REP. BY THE PUBLIC PROSECUTOR,",
        "HIGH COURT OF KERALA AT ERNAKULAM,",
        "THROUGH S.H.O. KUDIYANMALA POLICE STATION,",
        "KANNUR DISTRICT - 670 121.",
        "2. SUNNY, s/o. VARGHESE ,",
        "AGED 45 YEARS, MANGALATH HOUSE,",
        "MUNNOORKOCHI, KUDIYANMALA P.O.,",
        "NADUVIL AMSOM, KANNUR DISTRICT-670 582.",
        "msv/",
        "-2-"
    ],
    "sections": [
        "452",
        "341",
        "323",
        "294"
    ],
    "outcome": "ORDER\n\nThe petitioners are the accused in Crime No.296/2014 of\nKudiyanmala Police Station, Kannur District for offences punisable\nunder Sections 452, 341, 323, 294(b), 354 read with 34 IPC.\n\n2. The allegation of the prosecution is that, on\n10.07.2014 at 8.30 p.m., the petitioners trespassed into the\nhouse of the defacto complainant and pulled her towards the\nvaranda. When CW2 tried to obstruct the petitioners, the accused\nhit them and the 1* petitioner caught hold of her hand thereby\naffecting her modesty. Other accused have also committed\nvarious specific overt acts. On the basis of the complaint lodged,\ncrime was registered. After investigation final report was laid.\nCognizance was taken and the matter is now pending as\nC.C.No.1344/2014 of the Judicial First Class Magistrate Court,\nTaliparamba.\n\n3. The petitioners have now approached this Court stating\nthat, the disputes between the parties have been voluntarily and\namicably settled. The defacto complainant is stated to have no\nfurther grievance as against the petitioners. A joint petition has\n\n2016/KER/42229\n\nCri. M. C. No. 6368 of 2016 2\n\nbeen filed by the petitioners and the respondents 2 to 4 jointly\nstating that, the parties have settled their disputes. Separate\naffidavits have also been filed by the respondents 3 and 4,\nwherein they have reiterated the settlement arrived at and also\nexpressed their mind that they do not propose to pursue the\nmatter.\n\n4. Learned Public Prosecutor on instructions submitted\nthat the petitioners herein are not involved in any other crime and\nthe information is that, the parties have resolved their disputes.\n\n5. Having regard to these, | am satisfied that the dispute\nis essentially a private one and does not involve any larger public\ninterest. In the light of the settlement, interest of justice\ndemands that further continuation of the proceedings should be\ngiven a premature end to. Hence, | am inclined to allow the\nprayer sought for.\n\nHence, Crl.M.C. is allowed. All further proceedings in\nC.C.No.1344/2014 of the Judicial First Class Magistrate Court,\nTaliparamba stand quashed",
    "full_text": "Dass)\nFieak ors\nBiase\n2016/KER/42229\nIN THE HIGH COURT OF KERALA AT ERNAKULAM\nPRESENT:\nTHE HONOURABLE MR. JUSTICE SUNIL THOMAS\nMONDAY, THE 3RD DAY OF OCTOBER 2016/11TH ASWINA, 1938\nCr1.MC.No. 6368 of 2016\nCC 1344/2014 OF JUDICIAL FIRST CLASS MAGISTRATE COURT , TALTPARAMBA\nCRIME NO. 296/2014 OF KUDIYANMALA POLICE STATION, KANNUR\nPETITIONER (S) /ACCUSED NO.1 TO 4:\n1. JOMON, S/O.MATHEW,\nAGED 28 YEARS, KANNAMPLAKKAL HOUSE,\nMUNNOORKOCHI, KUDIYANMALA P.O.,\nNADUVIL AMSOM, KANNUR DISTRICT-670 582.\n2. JOBIN, S/O.MATHEW,\nAGED 26 YEARS, KANNAMPLAKKAL HOUSE,\nMUNNOORKOCHI, KUDIYANMALA P.O.,\nNADUVIL AMSOM, KANNUR DISTRICT-670 582.\n3. KURIAN @ KUNHU, S/O.MICHAEL,\nAGED 51 YEARS, KANNAMPLAKKAL HOUSE,\nMUNNOORKOCHI, KUDIYANMALA P.O.,\nNADUVIL AMSOM, KANNUR DISTRICT-670 582.\n4. NITHIN, S/O.KURIAN,\nAGED 22 YEARS, KANNAMPLAKKAL HOUSE,\nMUNNOORKOCHI, KUDIYANMALA P.O.,\nNADUVIL AMSOM, KANNUR DISTRICT-670 582.\nBY ADV. SRI.V.T.MADHAVANUNNI\nRESPONDENT (S)/STATE & AGGRIEVED PERSONS:\n1. STATE OF KERALA,\nREP. BY THE PUBLIC PROSECUTOR,\nHIGH COURT OF KERALA AT ERNAKULAM,\nTHROUGH S.H.O. KUDIYANMALA POLICE STATION,\nKANNUR DISTRICT - 670 121.\n2. SUNNY, s/o. VARGHESE ,\nAGED 45 YEARS, MANGALATH HOUSE,\nMUNNOORKOCHI, KUDIYANMALA P.O.,\nNADUVIL AMSOM, KANNUR DISTRICT-670 582.\nmsv/\n-2-\n\nDass)\nBee erie\nrrapesebea es\n2016/KER/42229\n-2-\nCr1.MC.No. 6368 of 2016\n3. VINCY SUNNY, W/O. SUNNY,\nAGED 36 YEARS, MANGALATH HOUSE,\nMUNNOORKOCHI, KUDIYANMALA P.O.,\nNADUVIL AMSOM, KANNUR DISTRICT-670 582.\n4. ROSAMMA, W/O.VARGHESE,\nAGED 77 YEARS, MANGALATH HOUSE,\nMUNNOORKOCHI, KUDIYANMALA P.O.,\nNADUVIL AMSOM, KANNUR DISTRICT-670 582.\nRI BY PUBLIC PROSECUTOR SMT.M.K.PUSHPALATHA\nR2-R4 BY ADV. SRI.V.A.SATHEESH\nTHIS CRIMINAL MISC. CASE HAVING COME UP FOR ADMISSION\nON 03-10-2016, THE COURT ON THE SAME DAY PASSED THE\nFOLLOWING:\nmsv/\n\nEl el\nPes ee\niat oar\n2016/KER/42229\nCr1.MC.No. 6368 of 2016\nAPPENDIX\nPETITIONER(S)' EXHIBITS\nAl TRUE COPY OF THE FIR IN CRIME NO.296/2014 OF KUDIYANMALA\nPOLICE STATION.\nA2 TRUE COPY OF THE CHARGE IN CC NO.1344/2014 ON THE FILE OF\nJFCM COURT, TALIPARAMBA\nA3 TRUE COPY OF THE MEMO OF EVIDENCE IN CC NO.1344/2014 ON THE\nFILE OF JFCM COURT, TALIPARAMBA.\nRESPONDENT (S)' EXHIBITS\nNIL\n//TRUE COPY//\nP.S.TO JUDGE\nMsv/\n\n2016/KER/42229\nSUNIL THOMAS, J.\nDated this the 3\" day of October, 2016\nORDER\n\nThe petitioners are the accused in Crime No.296/2014 of\nKudiyanmala Police Station, Kannur District for offences punisable\nunder Sections 452, 341, 323, 294(b), 354 read with 34 IPC.\n\n2. The allegation of the prosecution is that, on\n10.07.2014 at 8.30 p.m., the petitioners trespassed into the\nhouse of the defacto complainant and pulled her towards the\nvaranda. When CW2 tried to obstruct the petitioners, the accused\nhit them and the 1* petitioner caught hold of her hand thereby\naffecting her modesty. Other accused have also committed\nvarious specific overt acts. On the basis of the complaint lodged,\ncrime was registered. After investigation final report was laid.\nCognizance was taken and the matter is now pending as\nC.C.No.1344/2014 of the Judicial First Class Magistrate Court,\nTaliparamba.\n\n3. The petitioners have now approached this Court stating\nthat, the disputes between the parties have been voluntarily and\namicably settled. The defacto complainant is stated to have no\nfurther grievance as against the petitioners. A joint petition has\n\n2016/KER/42229\n\nCri. M. C. No. 6368 of 2016 2\n\nbeen filed by the petitioners and the respondents 2 to 4 jointly\nstating that, the parties have settled their disputes. Separate\naffidavits have also been filed by the respondents 3 and 4,\nwherein they have reiterated the settlement arrived at and also\nexpressed their mind that they do not propose to pursue the\nmatter.\n\n4. Learned Public Prosecutor on instructions submitted\nthat the petitioners herein are not involved in any other crime and\nthe information is that, the parties have resolved their disputes.\n\n5. Having regard to these, | am satisfied that the dispute\nis essentially a private one and does not involve any larger public\ninterest. In the light of the settlement, interest of justice\ndemands that further continuation of the proceedings should be\ngiven a premature end to. Hence, | am inclined to allow the\nprayer sought for.\n\nHence, Crl.M.C. is allowed. All further proceedings in\nC.C.No.1344/2014 of the Judicial First Class Magistrate Court,\nTaliparamba stand quashed.\n\nSd/-\n: SUNIL THOMAS, JUDGE.\nn\n\n"
}