{
    "case_id": "",
    "court": "HIGH COURT OF KERALA AT ERNAKULAM\nPRESENT",
    "date": "4TH DAY OF AUGUST 2016",
    "judge": "RAJA VIJAYARAGHAVAN V\nTHURSDAY",
    "petitioners": [
        "(S) /ACCUSED NO.1:",
        "RAFEEK,AGED 35 YEARS,",
        "$/O.ABOOBACKER, PIRIYALI HOUSE,",
        "NEAR KALLERY HEALTH CENTRE,",
        "VILYAPALLI, POLMERY PARAMBU VILLAGE,",
        "VADAKARA TALUK, KOZHIKODE DISTRICT."
    ],
    "respondents": [
        "(S) /STATE/COMPLAINANT :",
        "STATE OF KERALA,",
        "REPRESENTED BY THE PUBLIC",
        "PROSECUTOR, HIGH COURT OF KERALA,",
        "ERNAKULAM - 682 031, (CRIME NO. 176/2000",
        "OF VALIYATHURA POLICE STATION,",
        "THIRUVANANTHAPURAM, REFILED AS",
        "149/CR/SI/02 CBCID SIG-I,",
        "THIRUVANANTHAPURAM."
    ],
    "sections": [
        "482 of the Code of Criminal Procedure will not be\njustified in interfering with the discretion of the learned\nMagistrate in granting bail"
    ],
    "outcome": "",
    "full_text": "ae\nPe oo eS cea\nSS :\n2016/KER/34126\nIN THE HIGH COURT OF KERALA AT ERNAKULAM\nPRESENT:\nTHE HONOURABLE MR. JUSTICE RAJA VIJAYARAGHAVAN V\nTHURSDAY, THE 4TH DAY OF AUGUST 2016/13TH SRAVANA, 1938\nCr1.MC.No. 4492 of 2016\nLP NO.40/2008 (ORIGINALLY CC 278/2007) OF JUDICIAL MAGISTRATE\nCOURT, THIRUVANANTHAPURAM\nPETITIONER (S) /ACCUSED NO.1:\nRAFEEK,AGED 35 YEARS,\n$/O.ABOOBACKER, PIRIYALI HOUSE,\nNEAR KALLERY HEALTH CENTRE,\nVILYAPALLI, POLMERY PARAMBU VILLAGE,\nVADAKARA TALUK, KOZHIKODE DISTRICT.\nBY ADVS.SRI.S.RAJEEV\nSRI.K.K.DHEERENDRAKRISHNAN\nSRI.V.VINAY\nSRI.D.FEROZE\nRESPONDENT (S) /STATE/COMPLAINANT :\nSTATE OF KERALA,\nREPRESENTED BY THE PUBLIC\nPROSECUTOR, HIGH COURT OF KERALA,\nERNAKULAM - 682 031, (CRIME NO. 176/2000\nOF VALIYATHURA POLICE STATION,\nTHIRUVANANTHAPURAM, REFILED AS\n149/CR/SI/02 CBCID SIG-I,\nTHIRUVANANTHAPURAM.\nBY GOVERNMENT PLEADER SMT.PUSHPALATHA M.K.\nTHIS CRIMINAL MISC. CASE HAVING COME UP FOR ADMISSION\nON 04-08-2016, THE COURT ON THE SAME DAY PASSED THE\nFOLLOWING:\nmsv/\n\nsohimenean6\nRAJA VIJAYARAGHAVAN.YV, J\nDated this the 4\" day of August, 2016\nORDER\n\n1.The petitioner is the accused in L.P.No.40 of 2008 on\nthe file of the Chief Judicial Magistrate Court,\nThiruvananthapuram.\n\n2.On his failure to appear before the learned Magistrate\nin pursuance to summons issued, coercive steps have\nbeen issued against him. The petitioner seeks for\nissuance of appropriate directions to the learned\nMagistrate to consider his application for recall of\nwarrant and grant of bail on the date of surrender\nitself and to grant him bail.\n\n3.It was owing to the contumacious conduct of the\npetitioner, that Non Bailable Warrant was _ issued\nagainst him to secure his presence before the court\n\n2016/KER/34126\n\nCrl.M.C.4492/2016 2\nbelow. This court in exercise of powers under Section\n482 of the Code of Criminal Procedure will not be\njustified in interfering with the discretion of the learned\nMagistrate in granting bail.\n\n4.It is for the petitioner to approach the learned\nMagistrate and appraise the reasons for his absence\nand to seek for recalling the warrant and grant of bail.\nThere is no reason for this Court to assume that the\nlearned Magistrate will not exercise his discretion\njudicially and in accordance with law.\n\n5.In the result, the petitioner is directed to surrender\nbefore the trial court within 2 weeks from the date of\nthis order and prefer application for recall of warrant\nand also for grant of bail with advance notice to the\nprosecutor concerned. In that event the learned\nMagistrate is directed to consider and dispose of the\nsaid application, uninfluenced by the pendency of the\n\nfeat as\n2016/KER/34126\nCrl.M.C.4492/2016 3\nwarrant, preferably on the same day itself, on its\nmerits and in accordance with law.\nPetition is disposed off as above.\nSd/-\nRAJA VITAYARAGHAVAN.V.\nJUDGE\nvps\n\n"
}