{
    "case_id": "",
    "court": "HIGH COURT OF KERALA AT ERNAKULAM",
    "date": "4TH DAY OF JANUARY 2018",
    "judge": "B.KEMAL PASHA\nTHURSDAY",
    "petitioners": [
        "S/ACCUSED NO.1 TO 3:",
        "1 HARIKRISHNAN,",
        "AGED 18 YEARS, S/O JAYAKUMAR,",
        "RESIDING AT THEKKEDATHU HOUSE,",
        "ARUVAPPULAM P.O. & VILLAGE, KONNI TALUK,",
        "PATHANAMTHITTA DISTRICT.",
        "2 ABHIDEV,",
        "AGED 18 YEARS, S/O MOHANKUMAR,",
        "RESIDING AT CHARIVILL PADINJATTETHIL HOUSE,",
        "ARUVAPPULAM P.O. & VILLAGE,",
        "KONNI TALUK & PATHANAMTHITTA DISTRICT.",
        "3 VISHNU S. NAIR,",
        "AGED 23 YEARS, S/O SURESH KUMAR,",
        "RESIDING AT THEKKEDATHU HOUSE,",
        "ARUVAPPULAM P.O. & VILLAGE,",
        "KONNI TALUK, PATHANAMTHITTA DISTRICT."
    ],
    "respondents": [
        "S/STATE & DEFACTO COMPLAINANT & INJURED:",
        "1. THE STATE OF KERALA,",
        "THROUGH THE SUB INSPECTOR OF POLICE,",
        "KONNI POLICE STATION, PATHANAMTHITTA DISTRICT,",
        "REPRESENTED BY PUBLIC PROSECUTOR,",
        "HIGH COURT OF KERATA-682031.",
        "2. <ABHIJITH,",
        "AGED 23 YEARS, S/O AJAYAKUMAR,",
        "RESIDING AT VILAYIL THAZHETHIL VEEDU,",
        "ARUVAPPULAM P.O. & VILLAGE,",
        "KONNI TALUK, PATHANAMTHITTA DISTRICT-689640.",
        "3. ANSAL,",
        "AGED 22 YEARS, S/O RAHIM,",
        "RESIDING AT ANZIL MANZIL,",
        "ARUVAPPULAM P.O. & VILLAGE, KONNI TALUK,",
        "PATHANAMTHITTA DISTRICT-689640.",
        "Ril BY PUBLIC PROSECUTOR",
        "R2 & R3 BY ADV. SRI.T.S.SARATH"
    ],
    "sections": [
        "294"
    ],
    "outcome": "ORDER\n\nPetitioners are the accused in CC No.1186/2017\nof the Judicial First Class Magistrate's Court-ll,\nPathanamthitta, which has arisen from Crime No.1301/2017\nof Konni Police Station for the offences punishable under\nSections 294(b), 323 and 324 read with Section 34 IPC.\n\n2. It seems that the matter has been amicably\nsettled between the petitioners and the de_ facto\ncomplainant, who is the 2\" respondent herein. The 3”\nrespondent is the other injured.\n\n3. Respondents 2 and 3 have filed Annexures-A3\nand A4 affidavits, affirming that the matter has been\namicably settled between them and the petitioners and\npresently, they have no complaints against the petitioners.\nNo purpose would be served in proceeding with the matter\n\nBE\nore,\n2018/KER/277\nCrl.M.C.8860/2017\n:2:\n\nfurther. Matters being so, all further proceedings against the\npetitioners in CC No.1186/2017 of the Judicial First Class\nMagistrate's Court-ll, Pathanamthitta, which has arisen from\nCrime No.1301/2017 of Konni Police Station, can be\nquashed",
    "full_text": "ee\noS \" Nas\nE] ett wee\nIN THE HIGH COURT OF KERALA AT ERNAKULAM 2018/KER/277\nPRESENT:\nTHE HONOURABLE MR. JUSTICE B.KEMAL PASHA\nTHURSDAY, THE 4TH DAY OF JANUARY 2018 / 14TH POUSHA, 1939\nCr1.MC.No. 8860 of 2017\nCC.1186/2017 of JUDICIAL FIRST CLASS MAGISTRATE COURT-II, PATHANAMTHITTA\nCRIME NO.1301/2017 OF KONNI POLICE STATION, PATHANAMTITTA\nPETITIONERS/ACCUSED NO.1 TO 3:\n1 HARIKRISHNAN,\nAGED 18 YEARS, S/O JAYAKUMAR,\nRESIDING AT THEKKEDATHU HOUSE,\nARUVAPPULAM P.O. & VILLAGE, KONNI TALUK,\nPATHANAMTHITTA DISTRICT.\n2 ABHIDEV,\nAGED 18 YEARS, S/O MOHANKUMAR,\nRESIDING AT CHARIVILL PADINJATTETHIL HOUSE,\nARUVAPPULAM P.O. & VILLAGE,\nKONNI TALUK & PATHANAMTHITTA DISTRICT.\n3 VISHNU S. NAIR,\nAGED 23 YEARS, S/O SURESH KUMAR,\nRESIDING AT THEKKEDATHU HOUSE,\nARUVAPPULAM P.O. & VILLAGE,\nKONNI TALUK, PATHANAMTHITTA DISTRICT.\nBY ADV.SRI.MANU RAMACHANDRAN\nRESPONDENTS/STATE & DEFACTO COMPLAINANT & INJURED:\n1. THE STATE OF KERALA,\nTHROUGH THE SUB INSPECTOR OF POLICE,\nKONNI POLICE STATION, PATHANAMTHITTA DISTRICT,\nREPRESENTED BY PUBLIC PROSECUTOR,\nHIGH COURT OF KERATA-682031.\n2. <ABHIJITH,\nAGED 23 YEARS, S/O AJAYAKUMAR,\nRESIDING AT VILAYIL THAZHETHIL VEEDU,\nARUVAPPULAM P.O. & VILLAGE,\nKONNI TALUK, PATHANAMTHITTA DISTRICT-689640.\n3. ANSAL,\nAGED 22 YEARS, S/O RAHIM,\nRESIDING AT ANZIL MANZIL,\nARUVAPPULAM P.O. & VILLAGE, KONNI TALUK,\nPATHANAMTHITTA DISTRICT-689640.\nRil BY PUBLIC PROSECUTOR\nR2 & R3 BY ADV. SRI.T.S.SARATH\nTHIS CRIMINAL MISC. CASE HAVING COME UP FOR ADMISSION ON 04-01-2018,\nTHE COURT ON THE SAME DAY PASSED THE FOLLOWING:\nEL\n\nee\nape\n2018/KER/277\nCr1.MC.No. 8860 of 2017\nAPPENDIX\n\nPETITIONER(S)' ANNEXURES:\nANNEXURE Al THE TRUE COPY OF THE FINAL REPORT IN CRIME\n\nNO.1301/2017 OF KONNI POLICE STATION,\n\nPATHANAMTHITTA DISTRICT NOW PENDING AS C.C.\n\nNO.1186/2017 ON THE FILE OF THE JFMC-II\n\nPATHANAMTHITTA.\nANNEXURE A2 THE ORIGINAL OF THE SINGED JOINT STATEMENT BY\n\nTHE PETITIONERS/ACCUSED NO.1 TO 3 AND\n\nRESPONDENTS 2 & 3 ATTESTED BY THEIR COUNSELS\n\nWHO APPEAR IN THE TRIAL COURT.\nANNEXURE A3 THE ORIGINAL OF THE AFFIDAVIT DATED 30.11.2017\n\nSWORN BY THE 2ND RESPONDENT\nANNEXURE A4 THE ORIGINAL OF THE AFFIDAVIT DATED 30.11.2017\n\nSWORN BY THE 3RD RESPONDENT\nRESPONDENT (S)' ANNEXURE\n\nNIL\nTRUE COPY\nP.S. TO JUDGE\n\nEL\n\n2018/KER/277\nB. KEMAL PASHA, J.\nDated this the 4\" day of January, 2018\nORDER\n\nPetitioners are the accused in CC No.1186/2017\nof the Judicial First Class Magistrate's Court-ll,\nPathanamthitta, which has arisen from Crime No.1301/2017\nof Konni Police Station for the offences punishable under\nSections 294(b), 323 and 324 read with Section 34 IPC.\n\n2. It seems that the matter has been amicably\nsettled between the petitioners and the de_ facto\ncomplainant, who is the 2\" respondent herein. The 3”\nrespondent is the other injured.\n\n3. Respondents 2 and 3 have filed Annexures-A3\nand A4 affidavits, affirming that the matter has been\namicably settled between them and the petitioners and\npresently, they have no complaints against the petitioners.\nNo purpose would be served in proceeding with the matter\n\nBE\nore,\n2018/KER/277\nCrl.M.C.8860/2017\n:2:\n\nfurther. Matters being so, all further proceedings against the\npetitioners in CC No.1186/2017 of the Judicial First Class\nMagistrate's Court-ll, Pathanamthitta, which has arisen from\nCrime No.1301/2017 of Konni Police Station, can be\nquashed.\n\nIn the result, this Crl.M.C. is allowed and all further\nproceedings against the petitioners in CC No.1186/2017 of\nthe Judicial First Class Magistrate's Court-ll,\nPathanamthitta, which has arisen from Crime No.1301/2017\nof Konni Police Station, are quashed.\n\nSd/-\n(B.KEMAL PASHA, JUDGE)\naks/04/01\n// True Copy /\nPS to Judge\n\n"
}