{
    "case_id": "",
    "court": "HIGH COURT OF KERALA AT ERNAKULAM\nPRESENT",
    "date": "5TH DAY OF JANUARY 2018",
    "judge": "B.KEMAL PASHA\nFRIDAY",
    "petitioners": [
        "ACCUSED",
        "SHAJAN SCARTA",
        "AGED 44 YEARS, S/O. SCARIA, KARIYILAKULAM HOUSE,",
        "EDAKADATHY P.0,ERUMELY SOUTH VILLAGE,",
        "KOTTAYAM DIST.NOW RESIDING AT 14, HIGHLAND PARK, MLA",
        "ROAD , KUDAPPANAKKUNNU P.O, THIRUVANANTHAPURAM."
    ],
    "respondents": [
        "(S) /STATE:",
        "1. STATE OF KERALA",
        "REPRESENTED BY PUBLIC PROSECUTOR,",
        "HIGH COURT OF KERALA ,ERNAKULAM",
        "* ADDL R2 IMPLEADED",
        "2. BENNY BEHANAN, EX.M.L.A, AGED 58,",
        "S/O THOMAS,K.P.C.C GENERAL SECRETARY,",
        "KUNJUVEETTIKKUDIYIL HOUSE, THRIKKAKKARA FO,",
        "ERNAKULAM COCHIN-682021.",
        "* ADDL R2 IMPLEADED AS PER ORDER DATED 8/6/2016 IN CRL.MA 5253/2016 IN",
        "CRL.MC NO 2599/2016.",
        "R1 BY PUBLIC PROSECUTOR SRI AMJAD ALI",
        "R2 BY ADVS. SRI.RAJU JOSEPH (SR.)"
    ],
    "sections": [
        "500 IPC",
        "Section 66"
    ],
    "outcome": "ORDER DATED 8/6/2016 IN CRL.MA 5253/2016 IN\nCRL.MC NO 2599/2016.\nR1 BY PUBLIC PROSECUTOR SRI AMJAD ALI\nR2 BY ADVS. SRI.RAJU JOSEPH (SR.)\nSRI.C.JOSEPH ANTONY\nTHIS CRIMINAL MISC. CASE HAVING BEEN FINALLY HEARD ON 05-01-2018,\nTHE COURT ON THE SAME DAY PASSED THE FOLLOWING:\nK.V.\n\nrece\noi ae\n= Bava Oy\nBee\n2018/KER/480\nCr1.MC.No. 2599 of 2016 ()\nAPPENDIX\nPETITIONER (S)' ANNEXURES\nAl TRUE COPY OF THE F.I.R IN CRIME NO 199/2015 OF THRIKKAKKARA\nPOLICE STATION\nA2 TRUE COPY OF THE NEWS ITEM PUBLISHED IN MARUNADAN MALAYALI .COM\nA3 CERTIFIED COPY OF THE FINAL REPORT IN CR. NO.199/2015 OF THRIKKAKKARA\nPOLICE STATION.\nCRL.MC.2599/2016 IN I.A NO 10515/2016\nAl: TRUE COPY OF THE LETTER DATED 25.7.2016 ISSUED BY PCB SOLICITORS.\nA2: TRUE COPY OF HIS RESIDENTIAL PERMIT.\nCRL.MC 2599/2016 IN I.A 2121/2017\nAl: TRUE COPY OF THE E-MAIL DATED 27.10.16 ISSUED BY PCB SOLICITORS.\nA2: TRUE COPY OF PETITIONER'S RESIDENTIAL PERMIT.\nCRL.MC 2599/2016 IN I.A NO 5981/2017\nAl: TRUE COPY OF THE IMMIGRATION SEAL PAGE OF THE PASSPORT.\nA2: AFFIDAVIT FILED BY THE PETITIONER.\nRESPONDENTS ANNEXURES: NIL\n/TRUE COPY/\nK.V. P.S.TO JUDGE\n\nDrea\n2018/KER/480\nB. KEMAL PASHA, J.\nee ee\n“Dated this the 5\" day of January, 2018\nORDER\n\nPetitioner is the accused in C.C.372/2015 of the\nJudicial First Class Magistrate's Court, Kakkanad, which is\nbased on Annexure A-3 final report in Crime No.199/2015 of\nthe Thrikkakkara Police Station, for the offences punishable\nunder Section 500 IPC and Section 66(A) of the Information\nTechnology Act, 2000.\n\n2. The court below has taken cognizance of the\noffences. The court below ought not to have taken\ncognizance of the offence under Section 500 IPC on a\npolice report. When the said offence is one coming under\nChapter XXI of the Indian Penal Code, the prosecution\ncould be initiated only on a complaint by the person\naggrieved.\n\nDrea)\n2018/KER/480\nCRL.M.C.No. 2599 of 2016 aoe\n\n3. Regarding the offence under Section 66(A) of the\n|.T. Act, the same has been declared as ultravires of the\nConstitution by the Apex Court. Matters being so, Annexure\nA-2 Final Report as against the petitioner herein and all\nfurther proceedings in C.C.372/2015 of the Judicial First\nClass Magistrate's Court, Kakkanad, which is based on\nAnnexure A-3 final report in Crime No.199/2015 of the\nThrikkakkara Police Station, can be quashed",
    "full_text": "rece\na mnt\n= Bava Oy\nBEAT\n2018/KER/480\nIN THE HIGH COURT OF KERALA AT ERNAKULAM\nPRESENT:\nTHE HONOURABLE MR. JUSTICE B.KEMAL PASHA\nFRIDAY, THE 5TH DAY OF JANUARY 2018 / 15TH POUSHA, 1939\nCr1.MC.No. 2599 of 2016\ncc 372/2015 OF JUDICIAL FIRST CLASS MAGISTRATE COURT, KAKKANAD\nCRIME NO. 199/2015 OF THRIKKAKKARA POLICE STATION , ERNAKULAM\nPETITIONER/ACCUSED\nSHAJAN SCARTA\nAGED 44 YEARS, S/O. SCARIA, KARIYILAKULAM HOUSE,\nEDAKADATHY P.0,ERUMELY SOUTH VILLAGE,\nKOTTAYAM DIST.NOW RESIDING AT 14, HIGHLAND PARK, MLA\nROAD , KUDAPPANAKKUNNU P.O, THIRUVANANTHAPURAM.\nBY ADV.SRI.S.JIIJI\nRESPONDENT (S) /STATE:\n1. STATE OF KERALA\nREPRESENTED BY PUBLIC PROSECUTOR,\nHIGH COURT OF KERALA ,ERNAKULAM\n* ADDL R2 IMPLEADED\n2. BENNY BEHANAN, EX.M.L.A, AGED 58,\nS/O THOMAS,K.P.C.C GENERAL SECRETARY,\nKUNJUVEETTIKKUDIYIL HOUSE, THRIKKAKKARA FO,\nERNAKULAM COCHIN-682021.\n* ADDL R2 IMPLEADED AS PER ORDER DATED 8/6/2016 IN CRL.MA 5253/2016 IN\nCRL.MC NO 2599/2016.\nR1 BY PUBLIC PROSECUTOR SRI AMJAD ALI\nR2 BY ADVS. SRI.RAJU JOSEPH (SR.)\nSRI.C.JOSEPH ANTONY\nTHIS CRIMINAL MISC. CASE HAVING BEEN FINALLY HEARD ON 05-01-2018,\nTHE COURT ON THE SAME DAY PASSED THE FOLLOWING:\nK.V.\n\nrece\noi ae\n= Bava Oy\nBee\n2018/KER/480\nCr1.MC.No. 2599 of 2016 ()\nAPPENDIX\nPETITIONER (S)' ANNEXURES\nAl TRUE COPY OF THE F.I.R IN CRIME NO 199/2015 OF THRIKKAKKARA\nPOLICE STATION\nA2 TRUE COPY OF THE NEWS ITEM PUBLISHED IN MARUNADAN MALAYALI .COM\nA3 CERTIFIED COPY OF THE FINAL REPORT IN CR. NO.199/2015 OF THRIKKAKKARA\nPOLICE STATION.\nCRL.MC.2599/2016 IN I.A NO 10515/2016\nAl: TRUE COPY OF THE LETTER DATED 25.7.2016 ISSUED BY PCB SOLICITORS.\nA2: TRUE COPY OF HIS RESIDENTIAL PERMIT.\nCRL.MC 2599/2016 IN I.A 2121/2017\nAl: TRUE COPY OF THE E-MAIL DATED 27.10.16 ISSUED BY PCB SOLICITORS.\nA2: TRUE COPY OF PETITIONER'S RESIDENTIAL PERMIT.\nCRL.MC 2599/2016 IN I.A NO 5981/2017\nAl: TRUE COPY OF THE IMMIGRATION SEAL PAGE OF THE PASSPORT.\nA2: AFFIDAVIT FILED BY THE PETITIONER.\nRESPONDENTS ANNEXURES: NIL\n/TRUE COPY/\nK.V. P.S.TO JUDGE\n\nDrea\n2018/KER/480\nB. KEMAL PASHA, J.\nee ee\n“Dated this the 5\" day of January, 2018\nORDER\n\nPetitioner is the accused in C.C.372/2015 of the\nJudicial First Class Magistrate's Court, Kakkanad, which is\nbased on Annexure A-3 final report in Crime No.199/2015 of\nthe Thrikkakkara Police Station, for the offences punishable\nunder Section 500 IPC and Section 66(A) of the Information\nTechnology Act, 2000.\n\n2. The court below has taken cognizance of the\noffences. The court below ought not to have taken\ncognizance of the offence under Section 500 IPC on a\npolice report. When the said offence is one coming under\nChapter XXI of the Indian Penal Code, the prosecution\ncould be initiated only on a complaint by the person\naggrieved.\n\nDrea)\n2018/KER/480\nCRL.M.C.No. 2599 of 2016 aoe\n\n3. Regarding the offence under Section 66(A) of the\n|.T. Act, the same has been declared as ultravires of the\nConstitution by the Apex Court. Matters being so, Annexure\nA-2 Final Report as against the petitioner herein and all\nfurther proceedings in C.C.372/2015 of the Judicial First\nClass Magistrate's Court, Kakkanad, which is based on\nAnnexure A-3 final report in Crime No.199/2015 of the\nThrikkakkara Police Station, can be quashed.\n\nIn the result, this Crl.M.C. is allowed and all further\nproceedings in C.C.372/2015 of the Judicial First Class\nMagistrate's Court, Kakkanad, which is based on Annexure\nA-3 final report in Crime No.199/2015 of the Thrikkakkara\nPolice Station, are hereby quashed.\n\nSd/- B. KEMAL PASHA, JUDGE.\na [True copy]\nP.S. to Judge.\n\n"
}