{
    "case_id": "",
    "court": "HIGH COURT OF KERALA AT ERNAKULAM\nPRESENT",
    "date": "7TH DAY OF DECEMBER 2017",
    "judge": "B.KEMAL PASHA\nTHURSDAY",
    "petitioners": [
        "(S) /ACCUSED 27, 42 & 48:",
        "1. P.M. FAIZAL",
        "AGED 32 YEARS, S/O. MUHAMMED KUNHI,",
        "RESIDING AT KEEZHUR, KALANAD VILLAGE,",
        "CHANDRAGIRI POST, KASARAGOD DISTRICT - 671 317.",
        "2. MOIDEEN KUNHI V.D,",
        "S/O. MUHAMMED KUNHI, AGED 36 YEARS, RESIDING AT",
        "VALLIYODE, MELPARAMBA, KALANAD VILLAGE,",
        "CHANDRAGIRI POST, KASARAGOD DISTRICT - 671 317.",
        "3. ANIL S,",
        "S/O. SUMANDRAN, AGED 37 YEARS, RESIDING AT KEEZHUR",
        "KADAPPURAM, KALANAD VILLAGE, CHANDRAGIRI POST,",
        "KASARAGOD DISTRICT - 671 317."
    ],
    "respondents": [
        "(S) :",
        "THE STATE OF KERALA",
        "THROUGH THE STATION HOUSE OFFICER, BEKAL POLICE STATION,",
        "KASARAGOD DISTRICT, REPRESENTED BY PUBLIC PROSECUTOR,",
        "HIGH COURT OF KERALA AT ERNAKULAM - 682 031.",
        "R BY PUBLIC PROSECUTOR SRI. ALEX M. THOMBRA"
    ],
    "sections": [
        "143",
        "147",
        "148",
        "452",
        "427",
        "506"
    ],
    "outcome": "ORDER DATED 15/12/2016 IN CRL.M.C\nNO.5854/2016 ON THE FILES OF THIS HONOURABLE COURT.\nANNEXURE A5 THE TRUE COPY OF THE JUDGMENT DATED 28/2/2017 IN C.Cc\nNO.267/2013 ION THE FILES OF THE LEARNED JUDICIAL FIRST CLASS\nMAGISTRATE'S COURT -II, HOSDURG.\nRESPONDENT'S EXHIBITS: NIL\nTRUE COPY\nPA TO JUDGE\nScl.\n\n2017/KER/49563\nB. KEMAL PASHA, J.\nDated this the 7\" day of December, 2017\nORDER\n\nPetitioners were originally A27, A42, A48 in C.C.No.986\nof 2008 of the Judicial First Class Magistrate's Court-II,\nHosdurg for the offences punishable under Sections 143, 147,\n148, 452, 427, 506 (ii) and 153 (A) IPC r/w Section 149 IPC.\n\n2. The incident was the result of a commotion occurred\nbetween two groups. The case was the result of Annexure A2\nfinal report in Crime No.404 of 2005 of the Bekal Police\nStation.\n\n3. 38 accused faced trial in C.C.No.986 of 2008. All\nthe said accused were acquitted for want of any evidence.\nNone of the accused were identified. There was no evidence in\nthe case. The case against the petitioners was split up and re-\nfiled. Subsequently, through Annexure-4 order, this Court had\nquashed",
    "full_text": "2017/KER/49563\nIN THE HIGH COURT OF KERALA AT ERNAKULAM\nPRESENT:\nTHE HONOURABLE MR. JUSTICE B.KEMAL PASHA\nTHURSDAY, THE 7TH DAY OF DECEMBER 2017/16TH AGRAHAYANA, 1939\nCr1.MC.No. 7835 of 2017 ()\nCC 924/2016 of JUDCIAL FIRST CLASS MAGISTRATE COURT-II, HOSDURG\nCRIME NO. 404/2005 OF BEKAL POLICE STATION, KASARGOD\nPETITIONER (S) /ACCUSED 27, 42 & 48:\n1. P.M. FAIZAL\nAGED 32 YEARS, S/O. MUHAMMED KUNHI,\nRESIDING AT KEEZHUR, KALANAD VILLAGE,\nCHANDRAGIRI POST, KASARAGOD DISTRICT - 671 317.\n2. MOIDEEN KUNHI V.D,\nS/O. MUHAMMED KUNHI, AGED 36 YEARS, RESIDING AT\nVALLIYODE, MELPARAMBA, KALANAD VILLAGE,\nCHANDRAGIRI POST, KASARAGOD DISTRICT - 671 317.\n3. ANIL S,\nS/O. SUMANDRAN, AGED 37 YEARS, RESIDING AT KEEZHUR\nKADAPPURAM, KALANAD VILLAGE, CHANDRAGIRI POST,\nKASARAGOD DISTRICT - 671 317.\nBY ADVS.SRI.T.MADHU\nSMT .C.R.SARADAMANT\nRESPONDENT (S) :\nTHE STATE OF KERALA\nTHROUGH THE STATION HOUSE OFFICER, BEKAL POLICE STATION,\nKASARAGOD DISTRICT, REPRESENTED BY PUBLIC PROSECUTOR,\nHIGH COURT OF KERALA AT ERNAKULAM - 682 031.\nR BY PUBLIC PROSECUTOR SRI. ALEX M. THOMBRA\nTHIS CRIMINAL MISC. CASE HAVING COME UP FOR ADMISSION ON\n07-12-2017, THE COURT ON THE SAME DAY PASSED THE FOLLOWING:\n\nDigi\nmea ete\n2017/KER/49563\nCr1.MC.No. 7835 of 2017 ()\nAPPENDIX\nPETITIONER(S)' EXHIBITS\nANNEXURE Al THE TRUE COPY OF THE FIR IN CRIME NO.404/2005 OF BEKAL\nPOLICE STATION, KASARAGOD DISTRICT.\nANNEXURE A2 THE TRUE COPY OF THE FINAL REPORT IN CRIME NO. 404/2005\nOF BEKAL POLICE STATION.\nANNEXURE A3 THE TRUE COPY OF THE JUDGMENT DATED 25/2/2013 IN C.c\nNO. 986/2008 ON THE FILES OF THE LEARNED JUDICIAL FIRST CLASS\nMAGISTRATE'S COURT -II, HOSDURG.\nANNEXURE A4 THR TRUE COPY OF THE ORDER DATED 15/12/2016 IN CRL.M.C\nNO.5854/2016 ON THE FILES OF THIS HONOURABLE COURT.\nANNEXURE A5 THE TRUE COPY OF THE JUDGMENT DATED 28/2/2017 IN C.Cc\nNO.267/2013 ION THE FILES OF THE LEARNED JUDICIAL FIRST CLASS\nMAGISTRATE'S COURT -II, HOSDURG.\nRESPONDENT'S EXHIBITS: NIL\nTRUE COPY\nPA TO JUDGE\nScl.\n\n2017/KER/49563\nB. KEMAL PASHA, J.\nDated this the 7\" day of December, 2017\nORDER\n\nPetitioners were originally A27, A42, A48 in C.C.No.986\nof 2008 of the Judicial First Class Magistrate's Court-II,\nHosdurg for the offences punishable under Sections 143, 147,\n148, 452, 427, 506 (ii) and 153 (A) IPC r/w Section 149 IPC.\n\n2. The incident was the result of a commotion occurred\nbetween two groups. The case was the result of Annexure A2\nfinal report in Crime No.404 of 2005 of the Bekal Police\nStation.\n\n3. 38 accused faced trial in C.C.No.986 of 2008. All\nthe said accused were acquitted for want of any evidence.\nNone of the accused were identified. There was no evidence in\nthe case. The case against the petitioners was split up and re-\nfiled. Subsequently, through Annexure-4 order, this Court had\nquashed the case against A40 and A41. Over and above it,\nthrough Ext.A5 judgment, another accused who faced the trial\n\nBR\nGets\n2017/KER/49563\nCril.M.C. No.7835 of 2017\n-~2-\nwas also acquitted.\n\n4. The case against the petitioners is pending as\nC.C.No.924 of 2016 before the Judicial First Class Magistrate's\nCourt-II, Hosdurg. Even if, the case is proceeded with, no\nfruitful purpose would be served and therefore, all further\nproceedings in C.C.No.924 of 2016 before the Judicial First\nClass Magistrate's Court-II, Hosdurg based on Annexure A2\nfinal report in Crime No.404 of 2005 of Bekal Police is liable to\nbe quashed.\n\nIn the result, this Crl.M.C. is allowed, and all further\nproceedings in C.C.No.924 of 2016 before the Judicial First\nClass Magistrate's Court-II, Hosdurg based on Annexure A2\nfinal report in Crime No.404 of 2005 of Bekal Police are\nquashed\n\nSd/-\nB.KEMAL PASHA\nJUDGE\nScl/07.12.2017\n\n"
}