{
    "case_id": "",
    "court": "HIGH COURT OF KERALA AT ERNAKULAM\nPRESENT\nTHE HONOURABLE MR",
    "date": "4TH DAY OF JANUARY 2021",
    "judge": "P.SOMARAJAN\nMONDAY",
    "petitioners": [
        "K.M. PRINCE,",
        "AGED 62 YEARS, S/O.MATHEW, KILITHATTIL HOUSE,",
        "VADACODE P.O., THENGODU KARA."
    ],
    "respondents": [
        "S:",
        "1 STATE OF KERALA",
        "REP. BY PUBLIC PROSECUTOR,",
        "HIGH COURT OF KERALA, ERNAKULAM.",
        "2 SUB INSPECTOR OF POLICE",
        "THRIKKAKARA POLICE STATION, ERNAKULAM DISTRICT.",
        "3 SOBHA VASUDEV SOBHA MENON",
        "D/O.VASUDEVAN NAIR, AGED 47 YEARS, ASHA BHAVAN,",
        "VADACODE DESOM, THRIKKAKARA NORTH VILLAGE,",
        "KANAYANNOOR TALUK.",
        "R1, R3 BY ADV. SRI.M.REVIKRISHNAN",
        "PUBLIC PROSECUTOR SRI.RAMESH CHAND"
    ],
    "sections": [
        "447",
        "427 IPC based on a\ncivil dispute cannot be sustained"
    ],
    "outcome": "ORDER/ JUDGMENT IN cc 1188/2016 OF JMFC, KAKKANAD\n(TEMPORARY)\nCRIME NO.1514/2015 OF THRIKKAKARA POLICE STATION, ERNAKULAM\nPETITIONER:\nK.M. PRINCE,\nAGED 62 YEARS, S/O.MATHEW, KILITHATTIL HOUSE,\nVADACODE P.O., THENGODU KARA.\nBY ADVS.\nSRI.A.T.ANILKUMAR\nSMT .V.SHYLAJA\nRESPONDENTS:\n1 STATE OF KERALA\nREP. BY PUBLIC PROSECUTOR,\nHIGH COURT OF KERALA, ERNAKULAM.\n2 SUB INSPECTOR OF POLICE\nTHRIKKAKARA POLICE STATION, ERNAKULAM DISTRICT.\n3 SOBHA VASUDEV SOBHA MENON\nD/O.VASUDEVAN NAIR, AGED 47 YEARS, ASHA BHAVAN,\nVADACODE DESOM, THRIKKAKARA NORTH VILLAGE,\nKANAYANNOOR TALUK.\nR1, R3 BY ADV. SRI.M.REVIKRISHNAN\nPUBLIC PROSECUTOR SRI.RAMESH CHAND\nTHIS CRIMINAL MISC. CASE HAVING BEEN FINALLY HEARD ON\n04.01.2021, THE COURT ON THE SAME DAY PASSED THE FOLLOWING:\n\nCrl1.MC.No.7200 OF 2017 2 202 1/KER\nORDER\n\nA temporary gate installed obstructing the way\nclaimed by the accused was removed by him without\ncausing any destruction to the property. It is\nalleged that it was removed violating the interim\norder of injunction granted by a civil court. A\nremoval of obstructing structure over a way claimed\nby the accused may not always constitute a criminal\noffence, unless the same is coupled with any kind of\ndestruction. Violation of the interim order of\ninjunction, if any should be addressed under Order 39\nRule 2 A C.P.C. Hence the crime registered on the\nallegation of Section 447 and 427 IPC based on a\ncivil dispute cannot be sustained. Hence the same\n\nis quashed",
    "full_text": "Oke an ies\nCr1.MC.No.7200 OF 2017 1 202 1/KER\nIN THE HIGH COURT OF KERALA AT ERNAKULAM\nPRESENT\nTHE HONOURABLE MR. JUSTICE P.SOMARAJAN\nMONDAY, THE O4TH DAY OF JANUARY 2021 / 14TH POUSHA, 1942\nCr1.MC.No.7200 OF 2017\nAGAINST THE ORDER/ JUDGMENT IN cc 1188/2016 OF JMFC, KAKKANAD\n(TEMPORARY)\nCRIME NO.1514/2015 OF THRIKKAKARA POLICE STATION, ERNAKULAM\nPETITIONER:\nK.M. PRINCE,\nAGED 62 YEARS, S/O.MATHEW, KILITHATTIL HOUSE,\nVADACODE P.O., THENGODU KARA.\nBY ADVS.\nSRI.A.T.ANILKUMAR\nSMT .V.SHYLAJA\nRESPONDENTS:\n1 STATE OF KERALA\nREP. BY PUBLIC PROSECUTOR,\nHIGH COURT OF KERALA, ERNAKULAM.\n2 SUB INSPECTOR OF POLICE\nTHRIKKAKARA POLICE STATION, ERNAKULAM DISTRICT.\n3 SOBHA VASUDEV SOBHA MENON\nD/O.VASUDEVAN NAIR, AGED 47 YEARS, ASHA BHAVAN,\nVADACODE DESOM, THRIKKAKARA NORTH VILLAGE,\nKANAYANNOOR TALUK.\nR1, R3 BY ADV. SRI.M.REVIKRISHNAN\nPUBLIC PROSECUTOR SRI.RAMESH CHAND\nTHIS CRIMINAL MISC. CASE HAVING BEEN FINALLY HEARD ON\n04.01.2021, THE COURT ON THE SAME DAY PASSED THE FOLLOWING:\n\nCrl1.MC.No.7200 OF 2017 2 202 1/KER\nORDER\n\nA temporary gate installed obstructing the way\nclaimed by the accused was removed by him without\ncausing any destruction to the property. It is\nalleged that it was removed violating the interim\norder of injunction granted by a civil court. A\nremoval of obstructing structure over a way claimed\nby the accused may not always constitute a criminal\noffence, unless the same is coupled with any kind of\ndestruction. Violation of the interim order of\ninjunction, if any should be addressed under Order 39\nRule 2 A C.P.C. Hence the crime registered on the\nallegation of Section 447 and 427 IPC based on a\ncivil dispute cannot be sustained. Hence the same\n\nis quashed. Crl1l.M.C. is allowed accordingly.\n\nSd/-\nP. SOMARAJAN\nJUDGE\nmsp\n\nEl: sear\nCr1.MC.No.7200 OF 2017 3 2021/KER/9\nAPPENDIX\nPETITIONER'S/S EXHIBITS:\nANNEXURE A THE TRUE COPY OF THE CHARGE IN CC\nNO.188/2016 OF JUDICIAL FIRST CLASS\nMAGISTRATE COURT, KAKKANAD.\nANNEXURE B THE TRUE COPY OF THE REGISTERED SALE DEED\nBEARING NO.7140/2004 OF EDAPPALLY SRO.\nANNEXURE C THE TRUE COPY OF THE REGISTERED SALE DEED\nBEARING NO. 4898/2004 OF EDAPPALLY SRO.\nANNEXURE D THE TRUE COPY OF THE PARTITION DEED BEARING\nNO.4184/2008.\nANNEXURE E THE TRUE COPY OF THE PLAINT IN\nOS .NO.156/2013 OF MUNSIFF COURT, ERNAKULAM.\nANNEXURE F THE TRUE COPY OF THE WRITTEN STATEMENT.\n/ / TRUE COPY/ /\nP.A. TO JUDGE\n\n"
}