{
    "case_id": "Crl.MC.No.3738 OF 2018",
    "court": "HIGH COURT OF KERALA AT ERNAKULAM\nPRESENT\nTHE HONOURABLE MR",
    "date": "8TH DAY OF JANUARY 2020",
    "judge": "ASHOK MENON\nWEDNESDAY",
    "petitioners": [
        "SHON VARGHESE,",
        "s/O. BAIJU THOMAS,",
        "AGED 20 YEARS,",
        "NOW RESIDING AT PATTATHANAM HOUSE,",
        "LFC ROAD, KALOOR, KOCHI — 682 017"
    ],
    "respondents": [
        "S:"
    ],
    "sections": [],
    "outcome": "",
    "full_text": "Eiri meat\noes\n2020/KER/691\nIN THE HIGH COURT OF KERALA AT ERNAKULAM\nPRESENT\nTHE HONOURABLE MR. JUSTICE ASHOK MENON\nWEDNESDAY, THE O8TH DAY OF JANUARY 2020 / 18TH POUSHA, 1941\nCrl.MC.No.3738 OF 2018\nSEEKING TO QUASH THE FIR IN CRIME NO. 425 OF 2018 OF THE\nCHANGANASSERY POLICE STATION, KOTTAYAM DISTRICT\n\nPETITIONER:\nSHON VARGHESE,\ns/O. BAIJU THOMAS,\nAGED 20 YEARS,\nNOW RESIDING AT PATTATHANAM HOUSE,\nLFC ROAD, KALOOR, KOCHI — 682 017\nBY ADVS.\nSRI.C.S.MANU\nSRI.S.K.PREMRAT\nSMT.V.SARITHA PREMRAJ\nMRS .S. SREELAKSHMY\n\nRESPONDENTS:\n\n1 STATE OF KERALA\nREPRESENTED BY THE SUB INSPECTOR OF\nPOLICE ,CHANGANASSERY POLICE STATION, KOTTAYAM -\n686 101(NOTICE ON WHOM IS SERVED UPON THE PUBLIC\nPROSECUTOR, HIGH COURT OF KERALA, ERNAKULAM - 682\n018)\n2 REDUL OMANAKUTTAN ,\n\nS/O. OMANAKUTTAN,\nAGED 19 YEARS,\nRESIDING AT THYPARAMBIL HOUSE,\nVATTAPPALLY, VAZHAPPALLY EAST,\nCHANGANASSERY ,\nKOTTAYAM - 686 101.\n\nOTHER PRESENT:\nSRI.B.JAYASURYA - SR. PUBLIC PROSECUTOR\n\nTHIS CRIMINAL MISC. CASE HAVING COME UP FOR ADMISSION ON\n08.01.2020, THE COURT ON THE SAME DAY PASSED THE FOLLOWING:\n\nBae\nCrl1.MC.No.3738 OF 2018 2020/KER/691\n2\nORDER\nDated this the 8th day of January, 2020\nLearned Counsel for the petitioner seeks permission to\nwithdraw the Crl.M.C permission is granted and the Crl.M.C is\ndismissed as withdrawn.\nSd/-\nASHOK MENON\nJUDGE\nNR/08/01/20\n\nEiri meat\nmee\nCrl.MC.No.3738 OF 2018 2020/KER/691\n3\nAPPENDIX\nPETITIONER'S EXHIBITS:\nANNEXURE Al CERTIFIED COPY OF THE FIR IN CRIME NO.425\nOF 2018 OF THE CHANGANASSERY POLICE\nSTATION.\nANNEXURE A2 AFFIDAVIT DT. 05.06.2018 OF THE 2ND\nRESPONDENT SWEARING THE TRUE FACTS OF THE\nCASE.\nRESPONDENTS' EXHIBITS: NIL\n// TRUE COPY// PA TO JUDGE\n\n"
}