{
    "case_id": "Crl.MC.No.3341 OF 2017",
    "court": "HIGH COURT OF KERALA AT ERNAKULAM\nPRESENT\nTHE HONOURABLE MR",
    "date": "8TH DAY OF JANUARY 2021",
    "judge": "P.V.KUNHIKRISHNAN\nFRIDAY",
    "petitioners": [
        "RAJENDRAN",
        "AGED 41 YEARS,S/O. CHAMI,2/537-A, PALLIYALIL",
        "HOUSE ,ERANTHODE, VALAMBOOR",
        "(P.O) , PERINTHALMANNA ,MALAPPURAM DISTRICT . PIN-679325."
    ],
    "respondents": [
        "S/STATE & COMPLAINANT:",
        "1 STATE OF KERALA",
        "REPRESENTED BY THE PUBLIC PROSECUTOR,HIGH COURT OF",
        "KERALA, ERNAKULAM, KOCHI-682031.",
        "2 THE SUB INSPECTOR OF POLICE",
        "MANKADA POLICE STATION,MANKADA, MALAPPURAM",
        "DISTRICT , PIN-679324."
    ],
    "sections": [
        "23A of\nthe Mines",
        "Minerals"
    ],
    "outcome": "",
    "full_text": "renee\npear\n2021/KER/1225\nIN THE HIGH COURT OF KERALA AT ERNAKULAM\nPRESENT\nTHE HONOURABLE MR. JUSTICE P.V.KUNHIKRISHNAN\nFRIDAY, THE O8TH DAY OF JANUARY 2021 / 18TH POUSHA, 1942\nCrl.MC.No.3341 OF 2017\nPETITIONER:\nRAJENDRAN\nAGED 41 YEARS,S/O. CHAMI,2/537-A, PALLIYALIL\nHOUSE ,ERANTHODE, VALAMBOOR\n(P.O) , PERINTHALMANNA ,MALAPPURAM DISTRICT . PIN-679325.\nBY ADV. SRI.NIREESH MATHEW\nRESPONDENTS/STATE & COMPLAINANT:\n1 STATE OF KERALA\nREPRESENTED BY THE PUBLIC PROSECUTOR,HIGH COURT OF\nKERALA, ERNAKULAM, KOCHI-682031.\n2 THE SUB INSPECTOR OF POLICE\nMANKADA POLICE STATION,MANKADA, MALAPPURAM\nDISTRICT , PIN-679324.\nSRI.SANTOSH PETER, SR. PP\nTHIS CRIMINAL MISC. CASE HAVING BEEN FINALLY HEARD ON\n08.01.2021, ALONG WITH Crl.MC.3343/2017, THE COURT ON THE SAME DAY\nPASSED THE FOLLOWING:\n\nrenee\nreese\nCrl.MC.NoS.3341/2017 & 3343 OF 2017 2021/KER/1225\n2\nIN THE HIGH COURT OF KERALA AT ERNAKULAM\nPRESENT\nTHE HONOURABLE MR. JUSTICE P.V.KUNHIKRISHNAN\nFRIDAY, THE O8TH DAY OF JANUARY 2021 / 18TH POUSHA, 1942\nCri .MC.No.3343 OF 2017\nPETITIONER:\nKUNHALAVI P.\nAGED 42 YEARS ,S/O. KUNHAHAMMED , PULLITHODI\nHOUSE ,KOLATHUR (P.O) ,MALAPPURAM DISTRICT, PIN-\n679338.\nBY ADV. SRI.NIREESH MATHEW\nRESPONDENTS /STATE & COMPLAINANT:\n1 STATE OF KERALA\nREPRESENTED BY THE PUBLIC PROSECUTOR,HIGH COURT OF\nKERALA, ERNAKULAM ,KOCHI-682031.\n2 THE SUB INSPECTOR OF POLICE\nPERINTHALMANNA POLICE STATION, PERINTHALMANNA ,\nMALAPPURAM DISTRICT, PIN-679322.\nTHIS CRIMINAL MISC. CASE HAVING BEEN FINALLY HEARD ON\n08.01.2021, ALONG WITH Cr1.MC.3341/2017, THE COURT ON THE SAME\nDAY PASSED THE FOLLOWING:\n\na\nCrl.MC.NoS.3341/2017 & 3343 OF 2017 202 1IKERIT225\n3\nORDER\n[ Crl.M.C.No.3341/2017 and Crl1.M.C.No.3343/2017 ]\nDated this the 8th day of January 2021\n\nThese Crl.M.Cs are filed with a prayer to\nissue appropriate direction to the 2Â° respondent\nto report the seizure of the vehicles of the\npetitioners to the Jurisdictional Magistrate and\nto direct the learned Magistrate to release the\nvehicles to the petitioners unconditionaly.\n\n2. These Crl.M.Cs are pending from 2017\nonwards. When these cases came up for\nconsideration, the learned counsel for the\npetitioners submitted that the petitioners may be\ngiven liberty to approach the geologist concerned\nfor compounding the offence under Section 23A of\nthe Mines and Minerals (Development and\nRegulation)Act and Rule 60A of the Mines and\nMinerals (Development and Regulation) Rules.\n\nEo el\narte\nBl amen\nCrl.MC.NoS.3341/2017 & 3343 OF 2017 2021/RER/1225\n4\nTherefore, these Crl.M.Cs are closed with\nliberty to the petitioners to approach the\ncompetent authority in accordance to law if they\nare adviced so, if such an application is\npermissible legally.\nSd/-\nP.V.KUNHIKRISHNAN\nJUDGE\nDM\n\nDeere\nSS\nreese\nCrl.MC.NoS.3341/2017 & 3343 OF 2017 2021/KER/1225\n5\nAPPENDIX OF Crl.MC 3341/2017\nPETITIONERS 'EXHIBITS:\nANNEXURE A TRUE PHOTOCOPY OF THE CERTIFICATE OF\nREGISTRATION IN RESPECT OF VEHICLE\nNO. KL53/E-7009.\nANNEXURE B TRUE PHOTOCOPY OF THE SEIZURE MAHAZAR\nDATED 01.05.2017.\nANNEXURE C TRUE PHOTOCOPY OF THE ORDER PASSED BY\nTHIS HON'BLE COURT IN CRL.M.C\nNO.2164/2017 DATED 24.03.2017.\nRESPONDENTS' EXHIBITS :NIL\n\nDeere\nSS\nreese\nCrl.MC.NoS.3341/2017 & 3343 OF 2017 2021/KER/1225\n6\nAPPENDIX OF Crl.MC 3343/2017\nPETITIONERS' EXHIBITS:\nANNEXURE A TRUE PHOTOCOPY OF THE CERTIFICATE OF\nREGISTRATION IN RESPECT OF VEHICLE\nNO.KL.53/D.1719.\nANNEXURE B TRUE PHOTOCOPY OF THE SEIZURE MAHAZAR DATED\n07.05.2017.\nANNEXURE C TRUE PHOTOCOPY OF THE ORDER PASSED BY THIS\nHON 'BLE COURT IN CRL.M.C NO.2164/2017 DATED\n24.03.2017.\nRESPONDENTS' EXHIBITS :NIL\n//TRUE COPY//\nPA TO JUDGE\n\n"
}