{
    "case_id": "",
    "court": "HIGH COURT OF KERALA AT ERNAKULAM\nPRESENT\nTHE HONOURABLE MR",
    "date": "5TH DAY OF JANUARY 2024",
    "judge": "BECHU KURIAN THOMAS\nFRIDAY",
    "petitioners": [
        "ACCUSED :",
        "CHRISTOPHER @ SHAJI, AGED 56 YEARS",
        "S/O ISSAC, KUNNATH HOUSE, KUMBALAM,",
        "MULAVANA VILLAGE, KOLLAM:691 500.",
        "NOW RESIDING AT RENTAL HOUSE OF SHEELA VIJAYAN,",
        "PAVAMBUKAD NORTH MULAVUKAD VILLAGE, ERNAKULAM-",
        "682 504."
    ],
    "respondents": [
        "COMPLAINANT :",
        "STATE OF KERALA",
        "REPRESENTED BY PUBLIC PROSECUTOR,",
        "HIGH COURT OF KERALA, PIN - 682 031"
    ],
    "sections": [
        "341",
        "294b",
        "506 of\nIndian Penal Code",
        "1860"
    ],
    "outcome": "",
    "full_text": "Ps)\nSoe\nElse\n2024/KER/627\nIN THE HIGH COURT OF KERALA AT ERNAKULAM\nPRESENT\nTHE HONOURABLE MR. JUSTICE BECHU KURIAN THOMAS\nFRIDAY, THE 5TH DAY OF JANUARY 2024 / 15TH POUSHA, 1945\nCRL.MC NO. 65 OF 2024\nAGAINST THE ORDER/JUDGMENT CC 207/2019 OF JUDICIAL\nMAGISTRATE OF FIRST CLASS-I, ERNAKULAM\nPETITIONER/ACCUSED :\nCHRISTOPHER @ SHAJI, AGED 56 YEARS\nS/O ISSAC, KUNNATH HOUSE, KUMBALAM,\nMULAVANA VILLAGE, KOLLAM:691 500.\nNOW RESIDING AT RENTAL HOUSE OF SHEELA VIJAYAN,\nPAVAMBUKAD NORTH MULAVUKAD VILLAGE, ERNAKULAM-\n682 504.\nBY ADVS.\nB.S.SURESH (CHIRAKKARA)\nLAKSHMI SURESH\nVIPIN VIJAYAN\nRESPONDENT/COMPLAINANT :\nSTATE OF KERALA\nREPRESENTED BY PUBLIC PROSECUTOR,\nHIGH COURT OF KERALA, PIN - 682 031\nSRI. C.S. HRITHWIK (PP)\nTHIS CRIMINAL MISC. CASE HAVING COME UP FOR ADMISSION ON\n05.01.2024, THE COURT ON THE SAME DAY PASSED THE\nFOLLOWING:\n\nBier\nBsa\n2024/KER/627\nCRL.MC NO. 65 OF 2024\n2\nBECHU KURIAN THOMAS, J\nvere ee eee\nORDER\nPetitioner is the accused in C.C.No.207/2019 on the files of the\nJudicial First Class Magistrate Court-I, Ernakulam, registered for\nthe offences punishable under Sections 341, 294b and 506 of\nIndian Penal Code, 1860.\n2. Petitioner had initially been released on _ bail. However,\nthereafter he absconded and due to his failure to appear before\nthe Court, bail already granted, was cancelled and a non bailable\nwarrant has been issued apart from steps initiated under Section\n82 and 83 of Cr.P.C.\n3. Sri.Suresh B.S., the learned counsel for the petitioner submitted\nthat the petitioner is willing to appear before the Trial court and\nseek bail. However, he apprehend that he may be remanded to\ncustody before considering his bail application.\n4. Sri.C.S.Hrithwik, the learned Public Prosecutor, opposed the\n\nBier\neach\nSe\n| aes oH\n2024/KER/627\nCRL.MC NO. 65 OF 2024\n3\ncontentions and submitted that the non bailable warrant issued to\nthe petitioner is to secure his presence before the trial court.\n5. Since the petitioner has undertaken that he will appear before\nthe trial court without fail, I am of the view that an opportunity\nought to be granted to the petitioner.\n6. Therefore, if the petitioner appears before the trial court on or\nbefore 16.01.2024 and applies for recall of warrant and for grant\nof bail, those applications shall be considered by the learned\nMagistrate on the same day itself. To enable the petitioner to\nappear before the learned Magistrate, coercive proceedings\npursuant to the non bailable warrant issued in C.C.No.207/2019\non the files of the Judicial First Class Magistrate Court-I,\nErnakulam shall be kept in abeyance till 16.01.2024.\nThis Crl.M.C. is disposed of.\nsd/-\nBECHU KURIAN THOMAS\nJUDGE\nAMV/06/01/2024\n\nPs)\nSoe\nElse\n2024/KER/627\nCRL.MC NO. 65 OF 2024\n4\nAPPENDIX OF CRL.MC 65/2024\nPETITIONER ANNEXURES\nANNEXURE Ai THE COPY OF THE EMERGENCY DEPARTMENT\nCARD ISSUED THE GENERAL HOSPITAL\nERNAKULAM ON 05.07.2021\nANNEXURE A2 THE COPY OF THE MEDICAL CERTIFICATE\nISSUED BY THE RENAI MEDICITY HOSPITAL\nERNAKULAM DATED 07.04.2022\nANNEXURE A3 THE COPY OF THE ADVISED ON DISCHARGED\nSIGNED BY THE LEAD CONSULTANT\nNEUROSURGEON AT RENAL MEDICITY DATED\n13.7.2021\nANNEXURE A4. THE COPY OF THE NOTICE OF ATTACHMENT\nISSUED DATED 3.11.2023\nANNEXURE A5 THE COPY OF THE E-COURT DAILY STATUS ON\n18.3.2022 IN CC NO.0600207/2019 OF JFCM-\n1 ,ERNAKULAM\nTRUE COPY\n\n"
}