{
    "case_id": "",
    "court": "HIGH COURT OF KERALA AT ERNAKULAM",
    "date": "8TH DAY OF JANUARY 2021",
    "judge": "V.G.ARUN\nFRIDAY",
    "petitioners": [
        "S /ACCUSED :",
        "1 RANJITH.A.R",
        "AGED 31 YEARS",
        "S/O RAVI AS, RS NIVAS,",
        "AJANUR KADAPPURAM,",
        "AJANUR VILLAGE,",
        "HOSDURG TALUK",
        "2 ROOPESH K",
        "AGED 27 YEARS",
        "S/O RAMESHAN K,",
        "KARTHIKA NILAYAM,",
        "NEAR CRESCENT SCHOOL,",
        "AJANUR KADAPPURAM,",
        "AJANUR VILLAGE,",
        "HOSDURG TALUK",
        "3 ABHILASH A K",
        "AGED 24 YEARS",
        "S/O CHANDRAN A K, CHITTIKKOTTAN NILAYAM,",
        "AJANUR KADAPPURAM,",
        "AJANUR VILLAGE,",
        "HOSDURG TALUK",
        "4 AJAY PRASEED K V",
        "AGED 40 YEARS",
        "S/O K V KUNHAMBU,",
        "KAVAUNGAL HOUSE,",
        "KATTUKULANGARA ,",
        "AJANUR VILLAGE,",
        "HOSDURG TALUK",
        "5 RAJAN C V",
        "AGED 44 YEARS",
        "S/O SHAMBU, KATTADI HOUSE, KATTADI, KOLAVAYAL,",
        "AJANUR VILLAGE, NOW R/AT ALARANDA,",
        "PERIYA VILLAGE,",
        "HOSDURG TALUK"
    ],
    "respondents": [
        "S /STATE & DEFACTO COMPLAINANT:",
        "1 STATE OF KERALA",
        "REPRESENTED BY PUBLIC PROSECUTOR,",
        "HIGH COURT OF KERALA, ERNAKULAM-682031",
        "2 KUNHIRAMAN .K",
        "AGED 59 YEARS",
        "S/O KRISHNAN,",
        "KAPPANANKKAL HOUSE, KATTUKULANGARA,",
        "ANANDASRAMAM P O,",
        "AJANUR VILLAGE,",
        "HOSDURG TALUK,",
        "KASARGOD DISTRICT-671314",
        "R2 BY ADV. VIPIN T JOSE",
        "OTHER PRESENT:",
        "PP T.R.RENJITH"
    ],
    "sections": [
        "341",
        "323",
        "109",
        "120B read with Section 34 of IPC",
        "now\npending as C"
    ],
    "outcome": "ORDER/JUDGMENT IN CC 159/2018 OF JUDICIAL MAGISTRATE\nOF FIRST CLASS -1I,HOSDRUG\nCRIME NO.135/2017 OF HOSDURG POLICE STATION, KASARGOD\nPETITIONERS /ACCUSED :\n1 RANJITH.A.R\nAGED 31 YEARS\nS/O RAVI AS, RS NIVAS,\nAJANUR KADAPPURAM,\nAJANUR VILLAGE,\nHOSDURG TALUK\n2 ROOPESH K\nAGED 27 YEARS\nS/O RAMESHAN K,\nKARTHIKA NILAYAM,\nNEAR CRESCENT SCHOOL,\nAJANUR KADAPPURAM,\nAJANUR VILLAGE,\nHOSDURG TALUK\n3 ABHILASH A K\nAGED 24 YEARS\nS/O CHANDRAN A K, CHITTIKKOTTAN NILAYAM,\nAJANUR KADAPPURAM,\nAJANUR VILLAGE,\nHOSDURG TALUK\n4 AJAY PRASEED K V\nAGED 40 YEARS\nS/O K V KUNHAMBU,\nKAVAUNGAL HOUSE,\nKATTUKULANGARA ,\nAJANUR VILLAGE,\nHOSDURG TALUK\n5 RAJAN C V\nAGED 44 YEARS\nS/O SHAMBU, KATTADI HOUSE, KATTADI, KOLAVAYAL,\nAJANUR VILLAGE, NOW R/AT ALARANDA,\nPERIYA VILLAGE,\nHOSDURG TALUK\n\nBl a |\nSo\nle 4 te\nCRL.M.C.NO.5574 OF 2020 202 U/KER/1355\n2\n6 PRAMOD H\nAGED 39 YEARS\nS/O GANESH,\nNELLITHARA HOUSE, ANANDASRAMAM P O,\nPULLUR VILLAGE,\nHOSDURG TALUK\nBY ADV. SRI.A.ARUNKUMAR\nRESPONDENTS /STATE & DEFACTO COMPLAINANT:\n1 STATE OF KERALA\nREPRESENTED BY PUBLIC PROSECUTOR,\nHIGH COURT OF KERALA, ERNAKULAM-682031\n2 KUNHIRAMAN .K\nAGED 59 YEARS\nS/O KRISHNAN,\nKAPPANANKKAL HOUSE, KATTUKULANGARA,\nANANDASRAMAM P O,\nAJANUR VILLAGE,\nHOSDURG TALUK,\nKASARGOD DISTRICT-671314\nR2 BY ADV. VIPIN T JOSE\nOTHER PRESENT:\nPP T.R.RENJITH\nTHIS CRIMINAL MISC. CASE HAVING COME UP FOR ADMISSION ON\n08.01.2021, THE COURT ON THE SAME DAY PASSED THE FOLLOWING:\n\neel\nBie\nCRL.M.C.NO.5574 OF 2020 3 202 U/KER/1355\nORDER\n\nDated this the 8th day of January 2021\n\nPetitioners are accused Nos.1 to 6 in\nCrime No.135/2017 registered at the Hosdurg\nPolice Station, Kasargode for offences\npunishable under Sections 341, 323, 109,\n120B read with Section 34 of IPC, now\npending as C.C.No.159/2018 on the files of\nthe Judicial First Class Magistrate-I,\nHosdurg. The de facto complainant, at whose\ninstance the crime was registered, is\narrayed as the 2™ respondent. Annexure-AIIT\naffidavit has been filed by 2™ respondent\nstating that the dispute, which was the\nreason for the incident and registration of\nthe crime, has been resolved amicably and he\nhas no subsisting grievance against the\npetitioners.\n\neel\nBae\nCRL.M.C.NO.5574 OF 2020 4 202 U/KER/1355\n\n2. Heard the learned Public Prosecutor\nalso, who, on instructions, submits that the\npetitioners have no criminal antecedents.\n\n3. Having considered the gravity of the\noffences alleged, nature of the injury\ncaused and having perused the affidavit\nfiled by the 2° respondent, the contents of\nwhich are submitted to be true and\nvoluntary, I am satisfied that the dispute\nis settled and no public interest is\ninvolved in this matter. Moreover, in view\nof the settlement, possibility of the\ncriminal proceedings ending in conviction is\nremote. As such, continuance of the\nproceedings will amount to an abuse of\nprocess of court and hence, in view of the\nlegal position set out by the Honourable\nSupreme Court in Madan Mohan Abbot v. State\nof Punjab [(2008) 4 SCC 582] and Gian Singh\nv. State of Punjab and another [(2012) 10\n\nBIE\nee\naoe\nBias\nCRL.M.C.NO.5574 OF 2020 202 U/KER/1355\n5\nSCC 303], there is no impediment in granting\nthe relief sought.\nIn the result, this Crl.M.C is allowed.\nThe proceedings in C.C.No.159/2018 on the\nfiles of the Judicial First Class\nMagistrate- I, Hosdurg is quashed",
    "full_text": "Bl a |\na\nOE: 4 ie\nIN THE HIGH COURT OF KERALA AT ERNAKULAM 2021/KER/1395\nPRESENT\nTHE HONOURABLE MR.JUSTICE V.G.ARUN\nFRIDAY, THE O8TH DAY OF JANUARY 2021 / 18TH POUSHA, 1942\nCr1.MC.No.5574 OF 2020(F)\nAGAINST THE ORDER/JUDGMENT IN CC 159/2018 OF JUDICIAL MAGISTRATE\nOF FIRST CLASS -1I,HOSDRUG\nCRIME NO.135/2017 OF HOSDURG POLICE STATION, KASARGOD\nPETITIONERS /ACCUSED :\n1 RANJITH.A.R\nAGED 31 YEARS\nS/O RAVI AS, RS NIVAS,\nAJANUR KADAPPURAM,\nAJANUR VILLAGE,\nHOSDURG TALUK\n2 ROOPESH K\nAGED 27 YEARS\nS/O RAMESHAN K,\nKARTHIKA NILAYAM,\nNEAR CRESCENT SCHOOL,\nAJANUR KADAPPURAM,\nAJANUR VILLAGE,\nHOSDURG TALUK\n3 ABHILASH A K\nAGED 24 YEARS\nS/O CHANDRAN A K, CHITTIKKOTTAN NILAYAM,\nAJANUR KADAPPURAM,\nAJANUR VILLAGE,\nHOSDURG TALUK\n4 AJAY PRASEED K V\nAGED 40 YEARS\nS/O K V KUNHAMBU,\nKAVAUNGAL HOUSE,\nKATTUKULANGARA ,\nAJANUR VILLAGE,\nHOSDURG TALUK\n5 RAJAN C V\nAGED 44 YEARS\nS/O SHAMBU, KATTADI HOUSE, KATTADI, KOLAVAYAL,\nAJANUR VILLAGE, NOW R/AT ALARANDA,\nPERIYA VILLAGE,\nHOSDURG TALUK\n\nBl a |\nSo\nle 4 te\nCRL.M.C.NO.5574 OF 2020 202 U/KER/1355\n2\n6 PRAMOD H\nAGED 39 YEARS\nS/O GANESH,\nNELLITHARA HOUSE, ANANDASRAMAM P O,\nPULLUR VILLAGE,\nHOSDURG TALUK\nBY ADV. SRI.A.ARUNKUMAR\nRESPONDENTS /STATE & DEFACTO COMPLAINANT:\n1 STATE OF KERALA\nREPRESENTED BY PUBLIC PROSECUTOR,\nHIGH COURT OF KERALA, ERNAKULAM-682031\n2 KUNHIRAMAN .K\nAGED 59 YEARS\nS/O KRISHNAN,\nKAPPANANKKAL HOUSE, KATTUKULANGARA,\nANANDASRAMAM P O,\nAJANUR VILLAGE,\nHOSDURG TALUK,\nKASARGOD DISTRICT-671314\nR2 BY ADV. VIPIN T JOSE\nOTHER PRESENT:\nPP T.R.RENJITH\nTHIS CRIMINAL MISC. CASE HAVING COME UP FOR ADMISSION ON\n08.01.2021, THE COURT ON THE SAME DAY PASSED THE FOLLOWING:\n\neel\nBie\nCRL.M.C.NO.5574 OF 2020 3 202 U/KER/1355\nORDER\n\nDated this the 8th day of January 2021\n\nPetitioners are accused Nos.1 to 6 in\nCrime No.135/2017 registered at the Hosdurg\nPolice Station, Kasargode for offences\npunishable under Sections 341, 323, 109,\n120B read with Section 34 of IPC, now\npending as C.C.No.159/2018 on the files of\nthe Judicial First Class Magistrate-I,\nHosdurg. The de facto complainant, at whose\ninstance the crime was registered, is\narrayed as the 2™ respondent. Annexure-AIIT\naffidavit has been filed by 2™ respondent\nstating that the dispute, which was the\nreason for the incident and registration of\nthe crime, has been resolved amicably and he\nhas no subsisting grievance against the\npetitioners.\n\neel\nBae\nCRL.M.C.NO.5574 OF 2020 4 202 U/KER/1355\n\n2. Heard the learned Public Prosecutor\nalso, who, on instructions, submits that the\npetitioners have no criminal antecedents.\n\n3. Having considered the gravity of the\noffences alleged, nature of the injury\ncaused and having perused the affidavit\nfiled by the 2° respondent, the contents of\nwhich are submitted to be true and\nvoluntary, I am satisfied that the dispute\nis settled and no public interest is\ninvolved in this matter. Moreover, in view\nof the settlement, possibility of the\ncriminal proceedings ending in conviction is\nremote. As such, continuance of the\nproceedings will amount to an abuse of\nprocess of court and hence, in view of the\nlegal position set out by the Honourable\nSupreme Court in Madan Mohan Abbot v. State\nof Punjab [(2008) 4 SCC 582] and Gian Singh\nv. State of Punjab and another [(2012) 10\n\nBIE\nee\naoe\nBias\nCRL.M.C.NO.5574 OF 2020 202 U/KER/1355\n5\nSCC 303], there is no impediment in granting\nthe relief sought.\nIn the result, this Crl.M.C is allowed.\nThe proceedings in C.C.No.159/2018 on the\nfiles of the Judicial First Class\nMagistrate- I, Hosdurg is quashed.\nSd/-\nV.G.ARUN\nJUDGE\nNB\n\nBl a |\nSo\nle 4 te\nCRL.M.C.NO.5574 OF 2020 2021/KER/1355\n6\nAPPENDIX\nPETITIONERS 'S EXHIBITS:\nANNEXURE-AI A CERTIFIED COPY OF THE FIR IN CRIME\nNO.135/2017 OF HOSDURG POLICE STATION\nANNEXURE-AITI A CERTIFIED COPY OF THE FINAL REPORT IN\nCRIME NO.135 OF 2017 OF HOSDURG POLICE\nSTATION\nANNEXURE-ATITI ORIGINAL AFFIDAVIT SWORN TO BY THE 2ND\nRESPONDENT\n\n"
}