{
    "case_id": "Crl.MC.No. 1036 of 2017",
    "court": "HIGH COURT OF KERALA AT ERNAKULAM\nPRESENT",
    "date": "6TH DAY OF DECEMBER 2017",
    "judge": "B.KEMAIL PASHA\nWEDNESDAY",
    "petitioners": [
        "(S) /ACCUSED:",
        "DILEEP",
        "S/O. LEKSHMANAN, AGED 46 YEARS,",
        "'KOUSTHUBAM', ERAMALLOOR P.O.,",
        "EZHUPUNNA, CHERTHALA,",
        "ALAPPUZHA DISTRICT."
    ],
    "respondents": [
        "(S) /COMPLAINANT AND DEFACTO COMPLAINANT:",
        "1. STATE OF KERALA",
        "THROUGH THE SUB INSPECTOR OF POLICE,",
        "CHOTTANIKKARA,",
        "REPRESENTED BY THE PUBLIC PROSECUTOR,",
        "HIGH COURT OF KERALA,",
        "ERNAKULAM.",
        "2. BIJUKUMAR",
        "s/o. KRISHNAN NAIR,",
        "POTHALT HOUSE, MUPPAYIKKATTU KARA,",
        "NATTAKAM P.O., KOTTAYAM, PIN-686 013.",
        "R1 BY PUBLIC PROSECUTOR SRI.DILEEP §S."
    ],
    "sections": [
        "294"
    ],
    "outcome": "ORDER\n\nPetitioner is the accused in C.C.No.640 of 2016 of the\nJudicial First Class Magistrate's Court, Chottanikkara for the\noffences punishable under Sections 294 (b), 341 and 506 (1)\nof Indian Penal Code, based on Annexure - II final report in\nCrime No.620 of 2016 of Chottanikkara Police Station.\n\n2. Even though the offence under Section 294 (b) IPC\nhas been alleged, there are no ingredients to invite the said\noffence. The abusive words allegedly used by the petitioner\nhave not been recorded anywhere in the FIR or in the final\nreport. Matters being so, the said offence incorporated in\nAnnexure -II final report and C.C.No.640 of 2016 of the\nJudicial First Class Magistrate's Court, Chottanikkara is liable to\nbe quashed",
    "full_text": "BURA\n¢ . ant\nseeaae\nBe\n2017/KER/49277\nIN THE HIGH COURT OF KERALA AT ERNAKULAM\nPRESENT:\nTHE HONOURABLE MR. JUSTICE B.KEMAIL PASHA\nWEDNESDAY, THE 6TH DAY OF DECEMBER 2017/15TH AGRAHAYANA , 1939\nCr1.MC.No. 1036 of 2017 ()\ncc 640/2016 of JUDICIAL FIRST CLASS MAGIST. COURT, CHOTTANIKKARA\nCRIME NO. 620/2016 OF CHOTTANIKKARA POLICE STATION, ERNAKULAM\nPETITIONER (S) /ACCUSED:\nDILEEP\nS/O. LEKSHMANAN, AGED 46 YEARS,\n'KOUSTHUBAM', ERAMALLOOR P.O.,\nEZHUPUNNA, CHERTHALA,\nALAPPUZHA DISTRICT.\nBY ADVS.SRI.C.R.SYAMKUMAR\nSRI.SOORAJ T.BELENJICKAL\nSRI.P.A.MOHAMMED SHAH\nSRI.K.ARJUN VENUGOPAL\nSMT .MARY RESHMA GEORGE\nSMT .V.A.HARITHA\nSMT .SANDHYA R.NAIR\nSMT .P.M.MAZNA MANSOOR\nRESPONDENT (S) /COMPLAINANT AND DEFACTO COMPLAINANT:\n1. STATE OF KERALA\nTHROUGH THE SUB INSPECTOR OF POLICE,\nCHOTTANIKKARA,\nREPRESENTED BY THE PUBLIC PROSECUTOR,\nHIGH COURT OF KERALA,\nERNAKULAM.\n2. BIJUKUMAR\ns/o. KRISHNAN NAIR,\nPOTHALT HOUSE, MUPPAYIKKATTU KARA,\nNATTAKAM P.O., KOTTAYAM, PIN-686 013.\nR1 BY PUBLIC PROSECUTOR SRI.DILEEP §S.\nTHIS CRIMINAL MISC. CASE HAVING BEEN FINALLY HEARD ON\n06-12-2017, THE COURT ON THE SAME DAY PASSED THE FOLLOWING:\n\nDPS ae)\nSheath ered\nseat\nBe\n2017/KER/49277\nCrl.MC.No. 1036 of 2017 ()\nAPPENDIX\nPETITIONER(S)' EXHIBITS\nANNEXURE 1 THE CERTIFIED COPY OF THE FIRST INFORMATION REPORT\nDATED 29.07.2016 LODGED IN CRIME NO.620/2016 OF CHOTTANITKKARA POLICE\nSTATION.\nANNEXURE 2 THE CERTIFICATE COPY OF THE FINAL REPORT DATED\n06.08.2016 SUBMITTED IN CRIME NO.620/2016 OF CHOTTANIKKARA POLICE\nSTATION BEFORE THE JURISDICTIONAL JUDICIAL FIRST CLASS MAGISTRATE\nCOURT, CHOTTANIKKARA,\nRESPONDENT'S EXHIBITS: NIL\nTRUE COPY\nPA TO JUDGE\nScl.\n\nal\nor7ieeR/49277\nB. KEMAL PASHA, J.\nDated this the 6 day of December, 2017\nORDER\n\nPetitioner is the accused in C.C.No.640 of 2016 of the\nJudicial First Class Magistrate's Court, Chottanikkara for the\noffences punishable under Sections 294 (b), 341 and 506 (1)\nof Indian Penal Code, based on Annexure - II final report in\nCrime No.620 of 2016 of Chottanikkara Police Station.\n\n2. Even though the offence under Section 294 (b) IPC\nhas been alleged, there are no ingredients to invite the said\noffence. The abusive words allegedly used by the petitioner\nhave not been recorded anywhere in the FIR or in the final\nreport. Matters being so, the said offence incorporated in\nAnnexure -II final report and C.C.No.640 of 2016 of the\nJudicial First Class Magistrate's Court, Chottanikkara is liable to\nbe quashed.\n\n3. In respect of the other offences, the present stage\nis to premature to conclude that the other offences will not\n\ns\n2017/KER/49277\nCri.M.C. No.1036 of 2017\n-2-\n\nlie.\n\nIn the result, Crl.M.C is allowed in part by quashing the\noffence under Section 294 (b) IPC incorporated in Annexure-II\nfinal report and C.C.No.640 of 2016 of the Judicial First Class\nMagistrate's Court, Chottanikkara.\n\nSd/-\nB.KEMAL PASHA\nJUDGE\n\nScl/06.12.2017\n\n"
}