{
    "case_id": "",
    "court": "HIGH COURT OF KERALA AT ERNAKULAM\nPRESENT",
    "date": "6TH DAY OF JANUARY 2017",
    "judge": "RAJA VIJAYARAGHAVAN V\nFRIDAY",
    "petitioners": [
        "S/DE-FACTO COMPLAINANT AND VICTIM:",
        "1. BALAKRISHNAN, AGED 65 YEARS",
        "S/O. SUBRAMONIAN, RESIDING AT T.C.63/2182,",
        "AISWARYA, AMBALATHARA,",
        "MUTTATHARA VILLAGE, THIRUVANANTHAPURAM.",
        "2. MISHA @ MANJU",
        "D/O. PREMAKUMARY, T.C. 63/2182, AISWARYA,",
        "AMBALATHARA, MUTTATHARA VILLAGE, THIRUVANANTHAPURAM."
    ],
    "respondents": [
        "S/STATE & ACCUSED 1 AND 2:",
        "1. THE STATE OF KERALA",
        "REPRESENTED BY PUBLIC PROSECUTOR,",
        "HIGH COURT OF KERALA, ERNAKULAM, PIN 682031.",
        "2. ASSISTANT COMMISSIONER OF POLICE",
        "SHANGHUMUGHAM SUB DIVISION,",
        "THIRUVANANTHAPURAM, REPRESENTED BY PUBLIC PROSECUTOR,",
        "HIGH COURT OF KERALA, ERNAKULAM-682031.",
        "3. MANOJ, AGED 34 YEARS,",
        "S/O. BALAKRISHNAN, RESIDING AT T.C. 63/2182,",
        "AISWARYA, AMBALATHARA, MUTTATHARA VILLAGE,",
        "THIRUVANANTHAPURAM- 695206.",
        "4. RAJEEV",
        "S/O. SUDHAKARAN, T.C.47/1472(1), ALUCADU,",
        "POONTHURA, MUTTATHARA VILLAGE,",
        "THT RUVANANTHAPURAM- 695026.",
        "R3 BY ADV. SRI.V.A.VINOD"
    ],
    "sections": [],
    "outcome": "",
    "full_text": "ee seen\neS\nieee\n2017/KER/698\nIN THE HIGH COURT OF KERALA AT ERNAKULAM\nPRESENT:\nTHE HONOURABLE MR. JUSTICE RAJA VIJAYARAGHAVAN V\nFRIDAY, THE 6TH DAY OF JANUARY 2017/16TH POUSHA, 1938\nCr1.MC.No. 2988 of 2014 ()\nCP 127/2013 of J.M.F.C.-II, TRIVANDRUM\nCRIME NO. 141/2000 OF POONTHURA POLICE STATION , THIRUVANANDAPURAM\nPETITIONERS/DE-FACTO COMPLAINANT AND VICTIM:\n1. BALAKRISHNAN, AGED 65 YEARS\nS/O. SUBRAMONIAN, RESIDING AT T.C.63/2182,\nAISWARYA, AMBALATHARA,\nMUTTATHARA VILLAGE, THIRUVANANTHAPURAM.\n2. MISHA @ MANJU\nD/O. PREMAKUMARY, T.C. 63/2182, AISWARYA,\nAMBALATHARA, MUTTATHARA VILLAGE, THIRUVANANTHAPURAM.\nBY ADVS.SRI.M.RAJAGOPALAN NAIR\nSRI.G.BIJU\nRESPONDENTS/STATE & ACCUSED 1 AND 2:\n1. THE STATE OF KERALA\nREPRESENTED BY PUBLIC PROSECUTOR,\nHIGH COURT OF KERALA, ERNAKULAM, PIN 682031.\n2. ASSISTANT COMMISSIONER OF POLICE\nSHANGHUMUGHAM SUB DIVISION,\nTHIRUVANANTHAPURAM, REPRESENTED BY PUBLIC PROSECUTOR,\nHIGH COURT OF KERALA, ERNAKULAM-682031.\n3. MANOJ, AGED 34 YEARS,\nS/O. BALAKRISHNAN, RESIDING AT T.C. 63/2182,\nAISWARYA, AMBALATHARA, MUTTATHARA VILLAGE,\nTHIRUVANANTHAPURAM- 695206.\n4. RAJEEV\nS/O. SUDHAKARAN, T.C.47/1472(1), ALUCADU,\nPOONTHURA, MUTTATHARA VILLAGE,\nTHT RUVANANTHAPURAM- 695026.\nR3 BY ADV. SRI.V.A.VINOD\nBY ADV. SRI.J.S.AJITHKUMAR\nBY PUBLIC PROSECUTOR SMT. M.K. PUSHPALATHA.\nTHIS CRIMINAL MISC. CASE HAVING BEEN FINALLY HEARD ON 06-\n01-2017, THE COURT ON THE SAME DAY PASSED THE FOLLOWING:\nkp\n\nBlair\na Spor\n2017/KER/698\nRAJA VITAYARAGHAVAN.Y, J\nCri.M.C. No. 2988 of 2014\nDated this the 6\" day of January, 2017\nORDER\nThe learned counsel appearing for the petitioners\nseeks permission to withdraw this petition. Resultantly,\nthis petition is dismissed as withdrawn.\nsd/-\nRAJA VIJAYARAGHAVAN.Y.\nJUDGE\nkp/6.1.17\n\n"
}