{
    "case_id": "",
    "court": "HIGH COURT OF KERALA AT ERNAKULAM\nPRESENT\nTHE HONOURABLE MR",
    "date": "97 DAY OF JANUARY 2024",
    "judge": "BECHU KURIAN THOMAS\nFRIDAY",
    "petitioners": [
        "/ PETITIONER & APPELLANT/ ACCUSED :",
        "SACHITHRA SELVARAJ ,",
        "AGED 45 YEARS, SACHITHRA SELVARAJ,",
        "W/O. SELVARAJ, KALATHIL HOUSE,",
        "PUTHENTHODE, ANDIKKADAVU P.O.,",
        "KOCHI, ERNAKULAM DISTRICT, PIN - 682 008"
    ],
    "respondents": [
        "S/ RESPONDENTS/ COMPLAINANT & STATE:",
        "1 V.P. NELSON,",
        "AGED 54 YEARS, S/O. PETER,",
        "VELIYIL PARAMBIL HOUSE, KANNAMALY P.0O.,",
        "KOCHI, ERNAKULAM DISTRICT, PIN — 682 008",
        "2 STATE OF KERALA,",
        "REPRESENTED BY PUBLIC PROSECUTOR,",
        "HIGH COURT OF KERALA, ERNAKULAM,",
        "PIN - 682031"
    ],
    "sections": [],
    "outcome": "",
    "full_text": "BEATS\nElz anes\n2024/KER/5277\nIN THE HIGH COURT OF KERALA AT ERNAKULAM\nPRESENT\nTHE HONOURABLE MR. JUSTICE BECHU KURIAN THOMAS\nFRIDAY, THE 197 DAY OF JANUARY 2024 / 29TH POUSHA, 1945\nCRL.MC NO. 524 OF 2024\nCRA 317/2023 OF ADDITIONAL DISTRICT COURT & SESSIONS COURT - VIII,\nERNAKULAM/ IV ADDITIONAL MACT, ERNAKULAM\nPETITIONER// PETITIONER & APPELLANT/ ACCUSED :\nSACHITHRA SELVARAJ ,\nAGED 45 YEARS, SACHITHRA SELVARAJ,\nW/O. SELVARAJ, KALATHIL HOUSE,\nPUTHENTHODE, ANDIKKADAVU P.O.,\nKOCHI, ERNAKULAM DISTRICT, PIN - 682 008\nBY ADV A.S.SASIDHARAN\nRESPONDENTS/ RESPONDENTS/ COMPLAINANT & STATE:\n1 V.P. NELSON,\nAGED 54 YEARS, S/O. PETER,\nVELIYIL PARAMBIL HOUSE, KANNAMALY P.0O.,\nKOCHI, ERNAKULAM DISTRICT, PIN — 682 008\n2 STATE OF KERALA,\nREPRESENTED BY PUBLIC PROSECUTOR,\nHIGH COURT OF KERALA, ERNAKULAM,\nPIN - 682031\nBY SRI. M.C. ASHI, PUBLIC PROSECUTOR\nTHIS CRIMINAL MISC. CASE HAVING COME UP FOR ADMISSION ON\n19.01.2024, THE COURT ON THE SAME DAY PASSED THE FOLLOWING:\n\nig\nElz ete\n2024/KER/5277\nCRL.MC NO. 524 OF 2024\n2\nBECHU KURIAN THOMAS, J.\nCri.M.C.No.524 of 2024\nDated this the 19\" day of January, 2024\nORDER\n\nThe limited relief now sought for by the petitioner is for a direction\nto extend the time to deposit an amount of Rs.34,500/- stipulated as a\ncondition for suspending the sentence. Though petitioner has already\nbeen granted three months, which is the statutorily fixed period, I am of\nthe view that as a last chance, a further 30 days from today can be\ngranted.\n\nAccordingly, the time to deposit the amount stipulated in\nAnnexure-A2 order shall stand extended by a further period of 30 days\nfrom today.\n\nThe Crl.M.C.is disposed of as above.\n\nSd/-\nBECHU KURIAN THOMAS, JUDGE\nRKM\n\nBE h\nBaise ceeoaA\nElz anes\n2024/KER/5277\nCRL.MC NO. 524 OF 2024\n3\nAPPENDIX OF CRL.MC 524/2024\nPETITIONER'S ANNEXURES :\nAnnexure Al TRUE COPY OF THE ORDER DATED 21/8/2023 IN\nCRL. M.P. NO. 3536/2023 IN CRL. APPEAL\nNO. 317/2023 OF SESSIONS COURT, ERNAKLAM\nDIVISION\nAnnexure A2 CERTIFIED COPY OF ORDER DATED 14/12/2023\nIN CRL. M.P. NO. 5387/2023 IN CRL. APPEAL\nNO. 317/2023 OF ADDL. SESSIONS COURT\nVIII, ERNAKULAM\n\n"
}