{
    "case_id": "",
    "court": "HIGH COURT OF KERALA AT ERNAKULAM\nPRESENT",
    "date": "2ND DAY OF JANUARY 2014",
    "judge": "HARUN-UL-RASHID\nTHURSDAY",
    "petitioners": [
        "PETITIONER:",
        "PRABHAKARAN,",
        "$/O0.KORU, OTTUPARA HOUSE,",
        "EDAVANNA PO,",
        "MALAPPURAM DISTRICT, PIN - 676 541."
    ],
    "respondents": [
        "RESPONDENT:",
        "STATE OF KERALA,",
        "REPRESENTED BY S.|. OF POLICE,",
        "EDAVANNA, MALAPPURAM DT. PIN - 676 541,"
    ],
    "sections": [],
    "outcome": "",
    "full_text": "aaa\n2014/KER/240\nIN THE HIGH COURT OF KERALA AT ERNAKULAM\nPRESENT:\nTHE HONOURABLE MR.JUSTICE HARUN-UL-RASHID\nTHURSDAY, THE 2ND DAY OF JANUARY 2014/12TH POUSHA, 1935\nCri.MC.No. 79 of 2014\nCMP NO.6155/2013 OF JUDICIAL FIRST CLASS MAGISTRATE COURT I,\nMANJERI DATED 11-12-2013\nPETITIONER(S):PETITIONER:\nPRABHAKARAN,\n$/O0.KORU, OTTUPARA HOUSE,\nEDAVANNA PO,\nMALAPPURAM DISTRICT, PIN - 676 541.\nBY ADV. SRI.T.K.AJITH KUMAR\nRESPONDENT(S):RESPONDENT:\nSTATE OF KERALA,\nREPRESENTED BY S.|. OF POLICE,\nEDAVANNA, MALAPPURAM DT. PIN - 676 541,\nBY THE PUBLIC PROSECUTOR,\nHIGH COURT OF KERALA, ERNAKULAM.\nBY PUBLIC PROSECUTOR SMT. SAREENA GEORGE\nTHIS CRIMINAL MISC. CASE HAVING COME UP FOR ADMISSION\nON 02-01-2014, THE COURT ON THE SAME DAY PASSED THE\nFOLLOWING:\nKss\n\nBRA\n2014/KER/240\nCrl.M.C.No.79/2014\nAPPENDIX\nPETITIONER'S ANNEXURE:\nANNEX.A: TRUE COPY OF THE ORDER DATED 11/12/2013 PASSED BY\nTHE JUDICIAL FIRST CLASS MAGISTRATE COURT |, MANJERI\nIN CMP.NO.6155/2013.\nRESPONDENT'S ANNEXURES: NIL\nITRUE COPY/\nPA.TO JUDGE\nKss\n\n2014/KER/240\nHARUN-UL-RASHID, J.\nCri.M.C. No.79 of 2014\nDated this the 2‚Äù day of January 2014.\nORDER\nPetitioner claims to be the registered owner of the vehicle\nbearing registration No. KL-10-W-8603. The said vehicle was\nseized by the respondent in connection with a crime of Edavanna\nPolice Station on the allegation of illegal transportation of river\nsand.\n\n2. The petitioner filed CMP No. 6155/2013 before the Judicial\nFirst Class Magistrate Court-I, Manjeri seeking interim custody of\nthe vehicle. The court ordered interim custody subject to eight\nconditions. The court ordered that the petitioner shall deposit\nRs.39,900/- and shall also furnish bank guarantee for Rs.\n93,100/-. He is also directed to execute a bond for Rs. 1,33,000/-\nwith two solvent sureties each for the like sum.\n\n3. The petitioner is aggrieved by the condition to deposit\nRs.39,900/- and to furnish bank guarantee for Rs.93,100/- as\nsecurity. It is submitted that he is unable to comply with the\nabove conditions and that he is willing to execute a bond for\nRs.1,33,000/- with two solvent sureties each for the like sum.\n\nBlea\nrapa\n2014/KER/240\nCrl.M.C. No.79/2014\n:2:\nHaving regard to the facts and circumstance of the case,\nthis Court is of the view that the conditions imposed by the court\nbelow for the release of the vehicle shall be modified. The 3%\ncondition and the direction in the 4\" condition to furnish bank\nguarantee for Rs. 93,100/- stand deleted.\nThe Cri.M.C is disposed of as above.\nSd/-\nHARUN-UL-RASHID,\nJudge.\nAL/-\nTrue copy\nP.A to Judge\n\n"
}