{
    "case_id": "Crl.MC.No. 8717 of 2018",
    "court": "HIGH COURT OF KERALA AT ERNAKULAM\nPRESENT\nTHE HONOURABLE MR",
    "date": "",
    "judge": "B.SUDHEENDRA KUMAR\nFRIDAY",
    "petitioners": [
        "S:",
        "1 E.HASSAINAR",
        "AGED 56 YEARS,",
        "S/O. YOUSEF, MANJAMPARA, ADHUR VILLAGE, ADHUR",
        "POST, KASARAGOD DISTRICT, 671543.",
        "2 IRFAD,",
        "AGED 23 YEARS",
        "S/O. HASSAINAR, MANJAMPARA, ADHUR VILLAGE,",
        "ADHUR POST, KASARAGOD DISTRICT, 671543.",
        "3 THAIU,",
        "AGED 23 YEARS",
        "S/O. MUHAMMED, MANJAMPARA, ADHUR VILLAGE, ADHUR",
        "POST, KASARAGOD DISTRICT, 671543.",
        "4 ASIF,",
        "AGED 23 YEARS",
        "s/o. ABOOBACKER, MANJAMPARA, ADHUR VILLAGE,",
        "ADHUR POST, KASARAGOD DISTRICT, 671543."
    ],
    "respondents": [
        "S:",
        "1 KUNHAPU,",
        "AGED 47 YEARS",
        "S/O. KEPU, MANHAMPARA HOUSE, ADHUR POST,",
        "KASARGOD - 671543.",
        "2 STATE OF KERALA,",
        "REP. BY THE PUBLIC PROSECUTOR, HIGH COURT OF",
        "KERALA, ERNAKULAM - 682031."
    ],
    "sections": [
        "143",
        "147",
        "148",
        "323",
        "324",
        "506\nread with Section 149 IPC",
        "Section 3"
    ],
    "outcome": "",
    "full_text": "ie a Te\n2019/KER/378\nIN THE HIGH COURT OF KERALA AT ERNAKULAM\nPRESENT\nTHE HONOURABLE MR. JUSTICE B.SUDHEENDRA KUMAR\nFRIDAY,THE OATH DAY OF JANUARY 2019 / 14TH POUSHA, 1940\nCr1.MC.No. 8717 of 2018\nCRIME NO. 401/2018 OF Adhur Police Station , Kasargod\nPETITIONER/S:\n1 E.HASSAINAR\nAGED 56 YEARS,\nS/O. YOUSEF, MANJAMPARA, ADHUR VILLAGE, ADHUR\nPOST, KASARAGOD DISTRICT, 671543.\n2 IRFAD,\nAGED 23 YEARS\nS/O. HASSAINAR, MANJAMPARA, ADHUR VILLAGE,\nADHUR POST, KASARAGOD DISTRICT, 671543.\n3 THAIU,\nAGED 23 YEARS\nS/O. MUHAMMED, MANJAMPARA, ADHUR VILLAGE, ADHUR\nPOST, KASARAGOD DISTRICT, 671543.\n4 ASIF,\nAGED 23 YEARS\ns/o. ABOOBACKER, MANJAMPARA, ADHUR VILLAGE,\nADHUR POST, KASARAGOD DISTRICT, 671543.\nBY ADV. SMT.K.PUSHPAVATHT\nRESPONDENT/S:\n1 KUNHAPU,\nAGED 47 YEARS\nS/O. KEPU, MANHAMPARA HOUSE, ADHUR POST,\nKASARGOD - 671543.\n2 STATE OF KERALA,\nREP. BY THE PUBLIC PROSECUTOR, HIGH COURT OF\nKERALA, ERNAKULAM - 682031.\nBY ADV. SRI.SEBASTIAN JOSEPH (KURISUMMOOTTIL)\nOTHER PRESENT:\nSMT .V.SREEJA,PUBLIC PROSECUTOR\nTHIS CRIMINAL MISC. CASE HAVING COME UP FOR ADMISSION\nON 04.01.2019, THE COURT ON THE SAME DAY PASSED THE\nFOLLOWING:\n\nCrl.MC.No. 8717 of 2018\n-2-\nORDER\n\nThe petitioners are accused in Crime No. 401 of 2018\nof Adhur Police Station registered for the offences\npunishable under Sections 143, 147, 148, 323, 324 and 506\nread with Section 149 IPC and Section 3 (1)(s) of\nScheduled Castes and Scheduled Tribes (Prevention of\nAtrocities) Amendment Act, 2015.\n\n2. The first respondent is the de facto complainant,\nwho filed affidavit stating that the matter has been settled\nand hence he has no further grievance against the\npetitioners. The learned Public Prosecutor, on instructions,\nhas also submitted that the matter has been settled by the\nparties. The offences alleged are personal in nature.\nTherefore, settlement of the above dispute will lead to\npeace and harmony in the locality. In the said\ncircumstances, J am inclined to quash Annexure-Al FIR\nand further proceedings against the petitioners in Crime\n\nDee)\nos\nca] oh Pe\n2019/KER/378\nCr1l.MC.No. 8717 of 2018\n-3-\nNo. 401 of 2018 of Adhur Police Station in exercise of the\ninherent power under Section 482 Cr.P.C., to meet the ends\nof justice. It is ordered accordingly.\nIn the result, this Crl.M.C. stands allowed.\nDated this the 4\" day of January, 2019.\nSd/-B. SUDHEENDRA KUMAR, JUDGE.\n/true copy/\nP.S. to Judge\nani/\n\nie a Te\n2019/KER/378\nCr1.MC.No. 8717 of 2018\n-4-\n\nie a Te\n2019/KER/378\nCr1.MC.No. 8717 of 2018\n-5-\nAPPENDIX\n\nPETITIONER'S/S EXHIBITS:\nEXHIBIT Pl A TRUE COPY OF THE FIR DATED 07.10.2018\n\nSUBMITTED BY THE ADHUR POLICE BEFORE\n\nTHE DISTRICT AND SESSIONS JUDGE,\n\nKASARAGOD.\nEXHIBIT P2 THE AFFIDAVIT SOLEMNLY AFFIRMED BY THE\n\n1ST RESPONDENT DATED 17.12.2018.\n\n"
}