{
    "case_id": "",
    "court": "HIGH COURT OF KERALA AT ERNAKULAM\nPRESENT",
    "date": "1ST DAY OF JANUARY 2014",
    "judge": "HARUN-UL-RASHID\nWEDNESDAY",
    "petitioners": [
        "ACCUSED:",
        "MANSOOR V.M",
        "S/O.MARIKAR.V.A, VARIKADAN HOUSE, PONJASSERY (PO),",
        "THANDEKKADKARA, PERUMBAVOOR."
    ],
    "respondents": [
        "RESPONDENTS:",
        "1. STATE OF KERALA,",
        "REPRESENTED BY THE PUBLIC PROSECUTOR,",
        "HIGH COURT OF KERALA, ERNAKULAM-6820371.",
        "2. M/S.SREERAM TRANSPORT FINANCE CO.LTD., AGED 31 YEARS",
        "4TH FLOOR, MATHEW SONS SQUARE, HIGH SCHOOL JUNCTION",
        "EDAPPALLY, REP.BY ITS POWER OF ATTORNEY HOLDER VINOD BABU",
        "$/O.LATE BABU, SENIOR FILED OFFICER",
        "RESIDING AT PATTASSERIKARA, KURIAKKADU PO-682317.",
        "3. MR.SANTHOSH KESAV, S/O.KESAVAN, PURAIKATTUVEETTIL,",
        "THODUPUZHAKARAYIL, THODUPUZHA TALUK-678114.",
        "4. THE CIRCLE INSPECTOR OF POLICE,",
        "PERUMABAVOOR POLICE STATION,",
        "(CRIME NO.1328 DATED 10/7/2008), PIN-683542.",
        "R1 & 4 BY PUBLIC PROSECUTOR SMT.SAREENA GEORGE",
        "R2 BY ADVS. SRI.C.HARIKUMAR"
    ],
    "sections": [],
    "outcome": "",
    "full_text": "meee\nBeene\n2014/KER/S6\nIN THE HIGH COURT OF KERALA AT ERNAKULAM\nPRESENT:\nTHE HONOURABLE MR.JUSTICE HARUN-UL-RASHID\nWEDNESDAY, THE 1ST DAY OF JANUARY 2014/11TH POUSHA, 1935\nCri.MC.No. 4123 of 2013 ()\nAGAINST THE ORDER IN CC 202/2010 of JUDICIAL FIRST CLASS MAGISTRATE\nCOURT-II, ALUVA\nCRIME NO. 1328/2008 OF PERUMBAVOOR POLICE STATION , ERNAKULAM\nPETITIONER(S)/ACCUSED:\nMANSOOR V.M\nS/O.MARIKAR.V.A, VARIKADAN HOUSE, PONJASSERY (PO),\nTHANDEKKADKARA, PERUMBAVOOR.\nBY ADVS.SRI.B.ASHOK SHENOY\nSMT.C.G.PREETHA\nSRI.LK.V.GEORGE\nSRILP.N.RAJAGOPALAN NAIR\nRESPONDENT(S)/RESPONDENTS:\n1. STATE OF KERALA,\nREPRESENTED BY THE PUBLIC PROSECUTOR,\nHIGH COURT OF KERALA, ERNAKULAM-6820371.\n2. M/S.SREERAM TRANSPORT FINANCE CO.LTD., AGED 31 YEARS\n4TH FLOOR, MATHEW SONS SQUARE, HIGH SCHOOL JUNCTION\nEDAPPALLY, REP.BY ITS POWER OF ATTORNEY HOLDER VINOD BABU\n$/O.LATE BABU, SENIOR FILED OFFICER\nRESIDING AT PATTASSERIKARA, KURIAKKADU PO-682317.\n3. MR.SANTHOSH KESAV, S/O.KESAVAN, PURAIKATTUVEETTIL,\nTHODUPUZHAKARAYIL, THODUPUZHA TALUK-678114.\n4. THE CIRCLE INSPECTOR OF POLICE,\nPERUMABAVOOR POLICE STATION,\n(CRIME NO.1328 DATED 10/7/2008), PIN-683542.\nR1 & 4 BY PUBLIC PROSECUTOR SMT.SAREENA GEORGE\nR2 BY ADVS. SRI.C.HARIKUMAR\nSMT.C.B.ANUROOPA\nTHIS CRIMINAL MISC. CASE HAVING BEEN FINALLY HEARD ON 01-01-2014,\nTHE COURT ON THE SAME DAY PASSED THE FOLLOWING:\nPJ\n\nBae\n2014/KER/56\n\n2014/KER/56\nHARUN-UL-RASHID, J.\nCrl. M.C No.4123 of 2013\nDated this the 01\" day of January, 2014.\nORDER\nThe counsel for the petitioner submitted not pressed\nmemo stating that the petitioner is not interested in\nprosecuting the Crl.M.C further. Therefore the case is\ndismissed as not pressed.\nHARUN-UL-RASHID, JUDGE.\nIsn\n\n"
}