{
    "case_id": "",
    "court": "HIGH COURT OF KERALA AT ERNAKULAM\nPRESENT",
    "date": "8TH DAY OF DECEMBER 2017",
    "judge": "B.KEMAL PASHA\nFRIDAY",
    "petitioners": [
        "ACCUSED:",
        "SUGADHAKUMAR M.,",
        "S/O.LATE RADHAKRISHNAN, AGED 42, REETHA HOUSE,",
        "RAMANADHAPURAM, PALAKKAD."
    ],
    "respondents": [
        "/COMPLAINANT :",
        "STATE OF KERALA,",
        "REPRESENTED BY SUB INSPECTOR OF POLICE,",
        "TOWN NORTH POLICE STATION, PALAKKAD.",
        "REPRESENTED BY PUBLIC PROSECUTOR,",
        "HIGH COURT OF KERALA, ERNAKULAM."
    ],
    "sections": [],
    "outcome": "",
    "full_text": "nial\n2017/KER/49778\nIN THE HIGH COURT OF KERALA AT ERNAKULAM\nPRESENT:\nTHE HONOURABLE MR. JUSTICE B.KEMAL PASHA\nFRIDAY, THE 8TH DAY OF DECEMBER 2017/17TH AGRAHAYANA, 1939\nCr1.MC.No. 8285 of 2017 ()\nCMP 3900/2017 IN CC 74/2017 OF JUDICIAL FIRST CLASS MAGISTRATE COURT-\n11, PALAKKAD\nCRIME NO. 1164/2016 OF TOWN NORTH POLICE STATION , PALAKKAD\nPETITIONER/ACCUSED:\nSUGADHAKUMAR M.,\nS/O.LATE RADHAKRISHNAN, AGED 42, REETHA HOUSE,\nRAMANADHAPURAM, PALAKKAD.\nBY ADV. SRI.LIJU. M.P\nRESPONDENT /COMPLAINANT :\nSTATE OF KERALA,\nREPRESENTED BY SUB INSPECTOR OF POLICE,\nTOWN NORTH POLICE STATION, PALAKKAD.\nREPRESENTED BY PUBLIC PROSECUTOR,\nHIGH COURT OF KERALA, ERNAKULAM.\nBY PUBLIC PROSECUTOR SRI ALEX M THOMBRA\nTHIS CRIMINAL MISC. CASE HAVING COME UP FOR ADMISSION\nON 08-12-2017, THE COURT ON THE SAME DAY PASSED THE\nFOLLOWING :\nK.V.\n\nnial\n2017/KER/49778\nCr1.MC.No. 8285 of 2017 ()\nAPPENDIX\n\nPETITIONER (S)' EXHIBITS\nANNEXURE A- TRUE COPY OF THE CHARGE SHEET IN CRIME NO.1164/2016 OF\n\nTOWN NORTH POLICE STATION, PALAKKAD.\nANNEXURE B- TRUE COPY OF THE PETITION IN C.M.P.NO.3900/2017 IN\n\nCc NO.74/17 ON THE FILE OF JUDICIAL FIRST CLASS\n\nMAGISTRATE COURT-II, PALAKKAD.\nANNEXURE C- CERTIFIED COPY OF THE ORDER DATED 20/09/2017 PASSED IN\n\nC.M.P.NO.3900/2017 IN CC.NO.74/17 ON THE FILE OF\n\nJUDICIAL FIRST CLASS MAGISTRATE COURT-II, PALAKKAD.\nRESPONDENT (S)' EXHIBITS NIL\n\n/TRUE COPY/\n\nK.V. P.S.TO JUDGE\n\nPe al\nearn\nap\n2017/KER/49778\nB. KEMAL PASHA, J.\nCrl.M.C. No.8285 of 2017\nDated this the 8\" day of December, 2017\nORDER\nCri.M.C. is disposed of by directing the court\nbelow to grant exemption from personal appearance to the\npetitioner, as far as practicable. Considering the peculiar\ncircumstances in the case and the fact that the petitioner is\nin probation in the post of Municipal Secretary, the court\nbelow shall dispose of the matter, expeditiously.\nSd/-\n(B.KEMAL PASHA, JUDGE)\naks/08/12\nHW True Copy //\nPS to Judge\n\n"
}