{
    "case_id": "Crl.MC.No. 144 of 2017",
    "court": "HIGH COURT OF KERALA AT ERNAKULAM\nPRESENT",
    "date": "9TH DAY OF JANUARY 2017",
    "judge": "RAJA VIJAYARAGHAVAN V\nMONDAY",
    "petitioners": [
        "ACCUSED NO.1:",
        "HRISHIKESH @ RISHI, AGED 26 YEARS,",
        "S/O. M.R. PREMCHANDRA BHAT,",
        "MEMANA HOUSE, KANNAMNALY P.O.,",
        "KOCHI."
    ],
    "respondents": [
        "STATE/COMPLAINANT:",
        "STATE OF KERALA,",
        "REP. BY PUBLIC PROSECUTOR,",
        "HIGH COURT OF KERALA, ERNAKULAM-682 031,",
        "(CRIME NO.1433/2011 OF E.T. SOUTH POLICE STATION,",
        "ERNAKULAM DISTRICT)."
    ],
    "sections": [
        "482 of the Code of\nCriminal Procedure",
        "the prayer is to issue necessary\ndirections to the learned Magistrate to consider his\napplication for recall of warrant",
        "grant of bail on the\ndate of surrender itself"
    ],
    "outcome": "",
    "full_text": "Bear\n2017/KER/946\nIN THE HIGH COURT OF KERALA AT ERNAKULAM\nPRESENT:\nTHE HONOURABLE MR. JUSTICE RAJA VIJAYARAGHAVAN V\nMONDAY, THE 9TH DAY OF JANUARY 2017/19TH POUSHA, 1938\nCrl.MC.No. 144 of 2017 ()\nCC. NO.143/2013 ADDL. CHIEF JUDICIAL MAGISTRATE COURT (E&0O), ERNAKULAM.\nPETITIONER/ACCUSED NO.1:\nHRISHIKESH @ RISHI, AGED 26 YEARS,\nS/O. M.R. PREMCHANDRA BHAT,\nMEMANA HOUSE, KANNAMNALY P.O.,\nKOCHI.\nBY ADVS.SRIS.RAJEEV,\nSRI.K.K.DHEERENDRAKRISHNAN,\nSRI.V.VINAY,\nSRI.D.FEROZE.\nRESPONDENT/STATE/COMPLAINANT:\nSTATE OF KERALA,\nREP. BY PUBLIC PROSECUTOR,\nHIGH COURT OF KERALA, ERNAKULAM-682 031,\n(CRIME NO.1433/2011 OF E.T. SOUTH POLICE STATION,\nERNAKULAM DISTRICT).\nBY PUBLIC PROSECUTOR SMT.M.K. PUSHPALATHA.\nTHIS CRIMINAL MISC. CASE HAVING COME UP FOR ADMISSION\nON 09-01-2017, THE COURT ON THE SAME DAY PASSED THE\nFOLLOWING:\nrs\n\nae\n2017/KER/946\nRAJA VIJAYARAGHAVAN.YV., J\n~â€” CrLM.C. No. 144 of 2017\nDated this the 9\" day of January, 2017\nORDER\n\n1.The petitioner is the sole accused in C.C.No.143 of 2013\non the file of the Additional Chief Judicial Magistrate Court\n(EO), Ernakulam. On his failure to appear before the\nlearned Magistrate, non bailable warrant has been issued\nagainst him.\n\n2.In this petition filed under Section 482 of the Code of\nCriminal Procedure, the prayer is to issue necessary\ndirections to the learned Magistrate to consider his\napplication for recall of warrant and grant of bail on the\ndate of surrender itself. According to the petitioner, the\npetitioner was studying outside the state of Kerala and\nthere are no wilful latches.\n\n3.Having heard the learned counsel and the learned Public\nProsecutor, this petition is disposed of by ordering that if\n\na\nBisa\n2017/KER/946\nCrl.M.C. No. 144 of 2017 -2-\nthe petitioner surrenders before the court below and\nmoves appropriate application for recall of warrant and\ngrant of bail within a period of two weeks from today, with\nadvance notice to the concerned prosecutor, the court\nbelow shall consider and dispose of the same, on its\nmerits, preferably on the date of surrender itself. Till such\ntime the coercive proceedings shall be kept in abeyance.\nSd/-\nRAJA VIJAYARAGHAVAN.YV.,\nJUDGE\nps/9.1.17\n\n"
}