{
    "case_id": "",
    "court": "HIGH COURT OF KERALA AT ERNAKULAM\nPRESENT",
    "date": "28TH DAY OF APRIL 2015",
    "judge": "ANIL K.NARENDRAN\nTUESDAY",
    "petitioners": [
        "PETITIONER:",
        "SARJAS,S/O.MOHAMMED,",
        "KARUVAKKUNNAN HOUSE, VADAKKUMURI,",
        "OORGATTIRI P.O., MALAPPURAM DISTRICT."
    ],
    "respondents": [
        "RESPONDENT:",
        "STATE OF KERALA,",
        "REPRESENTED BY THE PUBLIC PROSECUTOR,",
        "HIGH COURT OF KERALA, ERNAKULAM-682 031.",
        "(CRIME NO.86/2015 OF KONDOTTY POLICE STATION)"
    ],
    "sections": [
        "457 of the Code of Criminal Procedure which\nresulted in Annexure Al order passed by the court below"
    ],
    "outcome": "",
    "full_text": "| pear\nHy} tf 7\nI\nBurk\n2015/KERIN7455\nIN THE HIGH COURT OF KERALA AT ERNAKULAM\nPRESENT:\nTHE HONOURABLE MR. JUSTICE ANIL K.NARENDRAN\nTUESDAY, THE 28TH DAY OF APRIL 2015/8TH VAISAKHA, 1937\nCri.MC.No. 2606 of 2015 ()\nCMP.NO. 717/2015 OF JUDICIAL FIRST CLASS MAGISTRATE COURT, MALAPPURAM\nCRIME NO. 86/2015 OF KONDOTTY POLICE STATION , MALAPPURAM DISTRICT\nPETITIONER/PETITIONER:\nSARJAS,S/O.MOHAMMED,\nKARUVAKKUNNAN HOUSE, VADAKKUMURI,\nOORGATTIRI P.O., MALAPPURAM DISTRICT.\nBY ADVS.SRI.P.SAMSUDIN\nSRI.JITHIN LUKOSE\nRESPONDENT/RESPONDENT:\nSTATE OF KERALA,\nREPRESENTED BY THE PUBLIC PROSECUTOR,\nHIGH COURT OF KERALA, ERNAKULAM-682 031.\n(CRIME NO.86/2015 OF KONDOTTY POLICE STATION)\nBY PUBLIC PROSECUTOR SRILABHIJETT LESSLI\nTHIS CRIMINAL MISC. CASE HAVING COME UP FOR ADMISSION\nON 28-04-2015, THE COURT ON THE SAME DAY PASSED THE FOLLOWING:\nsts\n\nBix olf]\nHy} tf 7\ni\nBurk\n2015/KER/17455\nCRMC.NO.2606/2015\nAPPENDIX\nPETITIONER'S ANNEXURES:\nANNEX A1 CERTIFIED COPY OF THE ORDER DATED 31/3/2015 IN\nCMP.NO.717/2015 ON THE FILES OF JFCM COURT, MALAPPURAM.\nRESPONDENT'S ANNEXURES: NIL\n/TRUE COPY/\nP.A.TO JUDGE\nsts\n\nin\n2015/KER/17455\nANIL K.NARENDRAN, J.\nDated this the 28th day of April, 2015\nORDER\n\nThe petitioner has filed this Criminal Miscellaneous Case\nseeking to quash order dated 31.03.2015 of the Judicial First\nClass Magistrate Court, Malappuram in C.M.P. No. 717/2015 in\nCrime No. 86/2015 of Kondotty Police Station. Goods carriage\nbearing registration No.KL-10-T-9988 owned by the petitioner is\ntaken into custody by the police during December 2014,\nalleging contravention of the provisions of the Kerala Protection\nof River Banks and Regulation of Removal of Sand Act, 2002\nand the Rules made thereunder.\n\n2. Acrime has been registered against the driver of the\nvehicle. The petitioner applied before the Magistrate Court\nseeking interim custody of the vehicle by filing an application\nunder Section 457 of the Code of Criminal Procedure which\nresulted in Annexure Al order passed by the court below. The\n\nin\nCri.M.C.No. 2606 of 2015 2NEEETES\npetitioner is aggrieved by condition No. 3 of Annexure Al order\nby which he has been directed to produce bank guarantee for\nRs. 53,000/- in order to release the vehicle in question. Going\nby the averments in the Crl. M.C., the vehicle in question was\nvalued at Rs. 75,000/- by the Assistant Motor Vehicles\nInspector. The conditions imposed by the court below in\nAnnexure Al order reads as follows:-\n1) Petitioner shall execute a bond of Rs. 75,000/-\nwith two solvent sureties each for the like sum.\n2) Petitioner shall deposit Rs. 22,000/- in the court.\n3) Petitioner shall produceâ€™ security of bank\nguarantee for Rs. 53,000/-\n4) Petitioner shall produce photograph and CD of\nthe vehicle.\n5) Station house officer is directed to prepare a\npanchanama of the vehicle\n6) Petitioner shall produce attested true copy of RC\n7) Petitioner shall produce the vehicle before the\ncourt as and when directed.\n\nin\nCri.M.C.No. 2606 of 2015 NEEL\n\n3. Heard the learned counsel for the petitioner and the\nlearned Public Prosecutor appearing for the respondent.\n\n4. A reading of Annexure Ai order passed by the court\nbelow would show that after considering the rival contentions,\nthe court below has ordered interim custody of the vehicle in\nquestion to the petitioner after imposing certain conditions. The\nconditions imposed by the court below cannot be turned either\narbitrary or otherwise, warranting interference of this Court\nunder Section 482 of the Code of Criminal Procedure.\nConsidering the facts and circumstances of the case and also\ntaking note of condition No. 1 imposed by the court below in\nAnnexure Al order, I deem it appropriate to modify the\ncondition Nos. 2 and 3 in Annexure Ail order as follows:-\n\ni) The petitioner shall deposit a sum of Rs. 30,000/-\n(Rupees Thirty Thousand Only) in the court.\n\nii)The petitioner shall furnish adequate security for the\nbalance sum of Rs. 45,000/- (Rupees Forty Five\nThousand Only), to the satisfaction of the court\nbelow.\n\nBisa\nLe\nBIER\nCrl.M.C.No. 2606 of 2015 AN IEERLTES\nOn satisfying the above conditions as well as condition\nNos. 1 and 4 to 7 in Annexure Al order, the petitioner shall be\nentitled for interim custody of the vehicle.\nThe Crl.M.C. is disposed of as above.\nANIL K.NARENDRAN,\nJUDGE\nDCS\n\n"
}