{
    "case_id": "",
    "court": "HIGH COURT OF KERALA AT ERNAKULAM\nPRESENT",
    "date": "3RD DAY OF AUGUST 2016",
    "judge": "SUNIL THOMAS\nWEDNESDAY",
    "petitioners": [
        "(S)/ACCUSED NOS. 1 TO 7 :",
        "1. BABY POULOSE,",
        "AGED 62 YEARS, S/O. POULOSE,",
        "KULAPPARAYIL HOUSE, MANNATHOOR",
        "KARA, THIRUMARADY VILLAGE,",
        "ERNAKULAM DISTRICT 686667",
        "2. BINOT",
        "AGED 39 YEARS, S/O. GOPI,",
        "PARASSERI HOUSE, MANNATHOOR",
        "KARA, THIRUMARADY VILLAGE,",
        "ERNAKULAM DISTRICT 686667",
        "3. K.d. THOMAS",
        "AGED 51 YEARS, S/O. JOHN,",
        "KOLKUNNEL HOUSE, MANNATHOOR",
        "KARA, THIRUMARADY VILLAGE,",
        "ERNAKULAM DISTRICT 686667",
        "4. RAMAKRISHNAN",
        "AGED 58 YEARS, S/O. VELAYUDHAN,",
        "KADUVAKUZHIYIL HOUSE, MANNATHOOR",
        "KARA, THIRUMARADY VILLAGE,",
        "ERNAKULAM DISTRICT 686667",
        "5. BENNY THOMAS",
        "AGED 49 YEARS, S/O. THOMAS,",
        "KUNNUMMEL HOUSE, MANNATHOOR KARA, THIRUMARADY VILLAGE,",
        "ERNAKULAM DISTRICT 686 667",
        "6. AMMINI",
        "AGED 57 YEARS, W/O. THEVAN,",
        "ALPPARA HOUSE, MANNATHOOR",
        "KARA, THIRUMARADY VILLAGE,",
        "ERNAKULAM DISTRICT 686667",
        "7. ALICE",
        "AGED 57 YEARS, W/O. BABY,",
        "KULAPPARAYIL HOUSE, MANNATHOOR",
        "KARA, THIRUMARADY VILLAGE,",
        "ERNAKULAM DISTRICT 686667"
    ],
    "respondents": [
        "(S) /DEFACTO COMPLAINANT, INJURED & COMPLAINANT: :",
        "1. AJEESH RAJAN,",
        "AGED 30 YEARS, S/O. RAJAN,",
        "NELLIKUNNEL HOUSE,",
        "PALLITHAZHAM BHAGOM,",
        "VAZHATHOPPU KARA,",
        "IDUKKI DISTRICT",
        "685602",
        "2. JAIMOL",
        "AGED 37 YEARS, W/O. SANTHOSH,",
        "MAMBALAYIL HOUSE, SOUTH MEMMURI BHAGOM,",
        "MEMMURI KARA, MEMMURI",
        "VILLAGE, MUVATTUPUZHA,",
        "686667",
        "3. JESSY",
        "AGED 36 YEARS, W/O. JIBU,",
        "PAMBAKKOLIL HOUSE, YMCA JUNCTION BHAGOM,",
        "KADACKANAD KARA,",
        "MAZHUVANNOOR VILLAGE",
        "686669",
        "4. STATE OF KERALA",
        "REP. BY THE PUBLIC PROSECUTOR,",
        "HIGH COURT OF KERALA,",
        "ERNAKULAM",
        "R1-3 BY ADV. SRI.N.R.SANGEETHARAJ",
        "R4 BY PUBLIC PROSECUTOR SMT.M.T.SHEEBA"
    ],
    "sections": [
        "143",
        "144",
        "147",
        "148",
        "341",
        "323",
        "324",
        "326",
        "354",
        "506"
    ],
    "outcome": "ORDER/JUDGMENT IN CC 105/2016 of JUDICIAL FIRST CLASS\nMAGISTRATE COURT, KOOTHATUKULAM\nCRIME NO. 267/2016 OF KOOTHATTUKULAM POLICE STATION, ERNAKULAM\nPETITIONER (S)/ACCUSED NOS. 1 TO 7 :\n1. BABY POULOSE,\nAGED 62 YEARS, S/O. POULOSE,\nKULAPPARAYIL HOUSE, MANNATHOOR\nKARA, THIRUMARADY VILLAGE,\nERNAKULAM DISTRICT 686667\n2. BINOT\nAGED 39 YEARS, S/O. GOPI,\nPARASSERI HOUSE, MANNATHOOR\nKARA, THIRUMARADY VILLAGE,\nERNAKULAM DISTRICT 686667\n3. K.d. THOMAS\nAGED 51 YEARS, S/O. JOHN,\nKOLKUNNEL HOUSE, MANNATHOOR\nKARA, THIRUMARADY VILLAGE,\nERNAKULAM DISTRICT 686667\n4. RAMAKRISHNAN\nAGED 58 YEARS, S/O. VELAYUDHAN,\nKADUVAKUZHIYIL HOUSE, MANNATHOOR\nKARA, THIRUMARADY VILLAGE,\nERNAKULAM DISTRICT 686667\n5. BENNY THOMAS\nAGED 49 YEARS, S/O. THOMAS,\nKUNNUMMEL HOUSE, MANNATHOOR KARA, THIRUMARADY VILLAGE,\nERNAKULAM DISTRICT 686 667\n6. AMMINI\nAGED 57 YEARS, W/O. THEVAN,\nALPPARA HOUSE, MANNATHOOR\nKARA, THIRUMARADY VILLAGE,\nERNAKULAM DISTRICT 686667\n7. ALICE\nAGED 57 YEARS, W/O. BABY,\nKULAPPARAYIL HOUSE, MANNATHOOR\nKARA, THIRUMARADY VILLAGE,\nERNAKULAM DISTRICT 686667\nBY ADV. SRI.DINESH MATHEW J.MURICKEN\n\npe see\noye\n2016/KER/33884\nCr1l.MC.No. 4595 of 2016 ()\nRESPONDENT (S) /DEFACTO COMPLAINANT, INJURED & COMPLAINANT: :\n1. AJEESH RAJAN,\nAGED 30 YEARS, S/O. RAJAN,\nNELLIKUNNEL HOUSE,\nPALLITHAZHAM BHAGOM,\nVAZHATHOPPU KARA,\nIDUKKI DISTRICT\n685602\n2. JAIMOL\nAGED 37 YEARS, W/O. SANTHOSH,\nMAMBALAYIL HOUSE, SOUTH MEMMURI BHAGOM,\nMEMMURI KARA, MEMMURI\nVILLAGE, MUVATTUPUZHA,\n686667\n3. JESSY\nAGED 36 YEARS, W/O. JIBU,\nPAMBAKKOLIL HOUSE, YMCA JUNCTION BHAGOM,\nKADACKANAD KARA,\nMAZHUVANNOOR VILLAGE\n686669\n4. STATE OF KERALA\nREP. BY THE PUBLIC PROSECUTOR,\nHIGH COURT OF KERALA,\nERNAKULAM\nR1-3 BY ADV. SRI.N.R.SANGEETHARAJ\nR4 BY PUBLIC PROSECUTOR SMT.M.T.SHEEBA\nTHIS CRIMINAL MISC. CASE HAVING COME UP FOR ADMISSION ON\n03-08-2016, ALONG WITH CRL.M.C.NO.4596/2016, THE COURT ON THE SAME\nDAY PASSED THE FOLLOWING:\n\npe see\nae\noye\n2016/KER/33884\nCr1l.MC.No. 4595 of 2016 ()\nAPPENDIX\nPETITIONER(S)' EXHIBITS\nANNEXURE Al: TRUE COPY OF THE FIRST INFORMATION REPORT IN CRIME\nNO.267/2016 OF KOOTHATTUKULAM POLICE STATION DATED 24.02.2016\nANNEXURE A2: TRUE COPY OF THE FINAL REPORT IN C.C.NO.105/2016 ON\nTHE FILE OF JUDICIAL FIRST CLASS MAGISTRATE COURT, KOOTHATTUKULAM\nANNEXURE A3: TRUE COPY OF THE AFFIDAVIT SWORN BY THE iST\nRESPONDENT/DEFACTO COMPLAINANT DATED 19.07.2015\nANNEXURE A4: TRUE COPY OF THE AFFIDAVIT SWORN BY THE 2ND\nRESPONDENT/INJURED (CW2) DATED 19.07.2016\nANNEXURE A5: TRUE COPY OF THE AFFIDAVIT SWORN BY THE 3RD\nRESPONDENT/INJURIED (CW3) DATED 19.07.2016\nRESPONDENT (S)' EXHIBITS : NIL\n/TRUE COPY/\nP. A. TO JUDGE\nPn\n\n.\nbine\n2016/KER/33884\nSUNIL THOMAS, J.\nDated this the 3\" day of August, 2016\nORDER\n\nThese Crl.M.C.s arise from C.C.No.105/2016 of the Judicial\nFirst Class Magistrate Court, Koothattukulam in Crime\nNo.267/2016 of Koothattukulam Police Station for offences\npunishable under Sections 143, 144, 147, 148, 341, 323, 324,\n326, 354, 506(ii), 427, 294(b) read with Section 149 of IPC.\nC.C.No.164/2016 of the Judicial First Class Magistrate Court,\nKoothattukulam arises from Crime No.278/2016 _ for\nKoothattukulam Police Station for offences punishable under\nSections 341, 323, 324 read with Section 34 of IPC.\n\n2. In C.C.No.105/2016, the allegation is that, the\npetitioners herein had attacked the defacto complainant and\nothers and caused bodily injuries. One person sustained\ndislocation of his shoulder bone. On the basis of the complaint\nlodged, crime was registered. After investigation, final report was\nlaid.\n\n3. In C.C.No.164/2016, the allegation of the prosecution is\nthat, the petitioners herein who are the defacto complainant in\nC.C.No.105/2016 had attacked the respondents herein who are\n\n.\nbine\n2016/KER/33884\nCri. M. C. Nos. 4595 & 4596 of 2016 ;\nthe accused in C.C.No.105/2016 and caused bodily injuries. On\nthe basis of a complaint lodged, crime was registered and after\ninvestigation final report was filed.\n\n4. Pending the’ proceedings, both parties have\napproached this Court stating that the respective cases have\nbeen resolved between the accused and the defacto complainant\nin each case. In Crl.M.C. 4595/2016 affidavits have been filed by\nthe defacto complainant and the injured as Annexures A3, A4 and\nA5. In Cri.M.C. No.4596/2016 affidavits have been filed by the\ndefacto complainant and the 2™ respondent injured as Annexures\nA3 and A4.\n\n5. The learned Public Prosecutor on_ instructions\nsubmitted that the petitioners herein are not involved in any other\ncrime. It appears that, regarding the running of quarry, there was\ncertain disputes between the management and locals, which\nseems to have led to this case and counter case. Since both sides\nhave resolved to settle the issue and to give a quietus to the\nentire litigation, | feel that, it is liable to be permitted. Even\nthough, in Crime No.267/2016 there is an offence alleged is one\nincluding Section 326, having regard to the fact that the injury is\n\nDipset\noe\n2016/KER/33884\nCri. M. C. Nos. 4595 & 4596 of 2016\n3\n\nonly a dislocation of the shoulder bone and not on a very vital\npart of the body, | am inclined to grant permission to settle the\ndispute.\n\nIn the result, Crl.M.C.s are allowed and all further\nproceedings C.C.Nos.105/2016 & 164/2016 of Judicial First Class\nMagistrate Court, Koothattukulam stand quashed",
    "full_text": "pe see\nae\noye\n2016/KER/33884\nIN THE HIGH COURT OF KERALA AT ERNAKULAM\nPRESENT:\nTHE HONOURABLE MR. JUSTICE SUNIL THOMAS\nWEDNESDAY, THE 3RD DAY OF AUGUST 2016/12TH SRAVANA, 1938\nCr1l.MC.No. 4595 of 2016 ()\nAGAINST THE ORDER/JUDGMENT IN CC 105/2016 of JUDICIAL FIRST CLASS\nMAGISTRATE COURT, KOOTHATUKULAM\nCRIME NO. 267/2016 OF KOOTHATTUKULAM POLICE STATION, ERNAKULAM\nPETITIONER (S)/ACCUSED NOS. 1 TO 7 :\n1. BABY POULOSE,\nAGED 62 YEARS, S/O. POULOSE,\nKULAPPARAYIL HOUSE, MANNATHOOR\nKARA, THIRUMARADY VILLAGE,\nERNAKULAM DISTRICT 686667\n2. BINOT\nAGED 39 YEARS, S/O. GOPI,\nPARASSERI HOUSE, MANNATHOOR\nKARA, THIRUMARADY VILLAGE,\nERNAKULAM DISTRICT 686667\n3. K.d. THOMAS\nAGED 51 YEARS, S/O. JOHN,\nKOLKUNNEL HOUSE, MANNATHOOR\nKARA, THIRUMARADY VILLAGE,\nERNAKULAM DISTRICT 686667\n4. RAMAKRISHNAN\nAGED 58 YEARS, S/O. VELAYUDHAN,\nKADUVAKUZHIYIL HOUSE, MANNATHOOR\nKARA, THIRUMARADY VILLAGE,\nERNAKULAM DISTRICT 686667\n5. BENNY THOMAS\nAGED 49 YEARS, S/O. THOMAS,\nKUNNUMMEL HOUSE, MANNATHOOR KARA, THIRUMARADY VILLAGE,\nERNAKULAM DISTRICT 686 667\n6. AMMINI\nAGED 57 YEARS, W/O. THEVAN,\nALPPARA HOUSE, MANNATHOOR\nKARA, THIRUMARADY VILLAGE,\nERNAKULAM DISTRICT 686667\n7. ALICE\nAGED 57 YEARS, W/O. BABY,\nKULAPPARAYIL HOUSE, MANNATHOOR\nKARA, THIRUMARADY VILLAGE,\nERNAKULAM DISTRICT 686667\nBY ADV. SRI.DINESH MATHEW J.MURICKEN\n\npe see\noye\n2016/KER/33884\nCr1l.MC.No. 4595 of 2016 ()\nRESPONDENT (S) /DEFACTO COMPLAINANT, INJURED & COMPLAINANT: :\n1. AJEESH RAJAN,\nAGED 30 YEARS, S/O. RAJAN,\nNELLIKUNNEL HOUSE,\nPALLITHAZHAM BHAGOM,\nVAZHATHOPPU KARA,\nIDUKKI DISTRICT\n685602\n2. JAIMOL\nAGED 37 YEARS, W/O. SANTHOSH,\nMAMBALAYIL HOUSE, SOUTH MEMMURI BHAGOM,\nMEMMURI KARA, MEMMURI\nVILLAGE, MUVATTUPUZHA,\n686667\n3. JESSY\nAGED 36 YEARS, W/O. JIBU,\nPAMBAKKOLIL HOUSE, YMCA JUNCTION BHAGOM,\nKADACKANAD KARA,\nMAZHUVANNOOR VILLAGE\n686669\n4. STATE OF KERALA\nREP. BY THE PUBLIC PROSECUTOR,\nHIGH COURT OF KERALA,\nERNAKULAM\nR1-3 BY ADV. SRI.N.R.SANGEETHARAJ\nR4 BY PUBLIC PROSECUTOR SMT.M.T.SHEEBA\nTHIS CRIMINAL MISC. CASE HAVING COME UP FOR ADMISSION ON\n03-08-2016, ALONG WITH CRL.M.C.NO.4596/2016, THE COURT ON THE SAME\nDAY PASSED THE FOLLOWING:\n\npe see\nae\noye\n2016/KER/33884\nCr1l.MC.No. 4595 of 2016 ()\nAPPENDIX\nPETITIONER(S)' EXHIBITS\nANNEXURE Al: TRUE COPY OF THE FIRST INFORMATION REPORT IN CRIME\nNO.267/2016 OF KOOTHATTUKULAM POLICE STATION DATED 24.02.2016\nANNEXURE A2: TRUE COPY OF THE FINAL REPORT IN C.C.NO.105/2016 ON\nTHE FILE OF JUDICIAL FIRST CLASS MAGISTRATE COURT, KOOTHATTUKULAM\nANNEXURE A3: TRUE COPY OF THE AFFIDAVIT SWORN BY THE iST\nRESPONDENT/DEFACTO COMPLAINANT DATED 19.07.2015\nANNEXURE A4: TRUE COPY OF THE AFFIDAVIT SWORN BY THE 2ND\nRESPONDENT/INJURED (CW2) DATED 19.07.2016\nANNEXURE A5: TRUE COPY OF THE AFFIDAVIT SWORN BY THE 3RD\nRESPONDENT/INJURIED (CW3) DATED 19.07.2016\nRESPONDENT (S)' EXHIBITS : NIL\n/TRUE COPY/\nP. A. TO JUDGE\nPn\n\n.\nbine\n2016/KER/33884\nSUNIL THOMAS, J.\nDated this the 3\" day of August, 2016\nORDER\n\nThese Crl.M.C.s arise from C.C.No.105/2016 of the Judicial\nFirst Class Magistrate Court, Koothattukulam in Crime\nNo.267/2016 of Koothattukulam Police Station for offences\npunishable under Sections 143, 144, 147, 148, 341, 323, 324,\n326, 354, 506(ii), 427, 294(b) read with Section 149 of IPC.\nC.C.No.164/2016 of the Judicial First Class Magistrate Court,\nKoothattukulam arises from Crime No.278/2016 _ for\nKoothattukulam Police Station for offences punishable under\nSections 341, 323, 324 read with Section 34 of IPC.\n\n2. In C.C.No.105/2016, the allegation is that, the\npetitioners herein had attacked the defacto complainant and\nothers and caused bodily injuries. One person sustained\ndislocation of his shoulder bone. On the basis of the complaint\nlodged, crime was registered. After investigation, final report was\nlaid.\n\n3. In C.C.No.164/2016, the allegation of the prosecution is\nthat, the petitioners herein who are the defacto complainant in\nC.C.No.105/2016 had attacked the respondents herein who are\n\n.\nbine\n2016/KER/33884\nCri. M. C. Nos. 4595 & 4596 of 2016 ;\nthe accused in C.C.No.105/2016 and caused bodily injuries. On\nthe basis of a complaint lodged, crime was registered and after\ninvestigation final report was filed.\n\n4. Pending the’ proceedings, both parties have\napproached this Court stating that the respective cases have\nbeen resolved between the accused and the defacto complainant\nin each case. In Crl.M.C. 4595/2016 affidavits have been filed by\nthe defacto complainant and the injured as Annexures A3, A4 and\nA5. In Cri.M.C. No.4596/2016 affidavits have been filed by the\ndefacto complainant and the 2™ respondent injured as Annexures\nA3 and A4.\n\n5. The learned Public Prosecutor on_ instructions\nsubmitted that the petitioners herein are not involved in any other\ncrime. It appears that, regarding the running of quarry, there was\ncertain disputes between the management and locals, which\nseems to have led to this case and counter case. Since both sides\nhave resolved to settle the issue and to give a quietus to the\nentire litigation, | feel that, it is liable to be permitted. Even\nthough, in Crime No.267/2016 there is an offence alleged is one\nincluding Section 326, having regard to the fact that the injury is\n\nDipset\noe\n2016/KER/33884\nCri. M. C. Nos. 4595 & 4596 of 2016\n3\n\nonly a dislocation of the shoulder bone and not on a very vital\npart of the body, | am inclined to grant permission to settle the\ndispute.\n\nIn the result, Crl.M.C.s are allowed and all further\nproceedings C.C.Nos.105/2016 & 164/2016 of Judicial First Class\nMagistrate Court, Koothattukulam stand quashed.\n\nSd/-\nSUNIL THOMAS, JUDGE.\nPn\n\n"
}