{
    "case_id": "Crl.MC.No. 6236 of 2016",
    "court": "HIGH COURT OF KERALA AT ERNAKULAM\nPRESENT",
    "date": "",
    "judge": "SUNIL THOMAS\nMONDAY",
    "petitioners": [
        "(S) :",
        "DINAKAR",
        "s/o. SUKUMARAN, AGED 39 YEARS,",
        "RESIDING AT KOTTAKUZHI VEEDU,",
        "VILANTHARA PO., SASTHAMCOTTA,",
        "KOLLAM DISTRICT."
    ],
    "respondents": [
        "(S) /STATE:",
        "1. THE SUB INSPECTOR OF POLICE",
        "SASTHAMCOTTA POLICE STATION",
        "KOLLAM DISTRICT.REP. BY THE",
        "PUBLIC PROSECUTOR, HIGH COURT",
        "OF KERALA, ERNAKULAM0682031",
        "2. THE SUB DIVISIONAL MAGISTRATE",
        "KOLLAM, OFFICE OF THE SUB DIVISIONAL",
        "MAGISTRATE, KOLLAM PO., KOLLAM",
        "DISTRICT-691001",
        "R BY PUBLIC PROSECUTOR: SRI T R RANJITH"
    ],
    "sections": [
        "107 Cr"
    ],
    "outcome": "ORDER/JUDGMENT IN CRMP 2039/2016 of SESSIONS COURT,\nKOLLAM DATED 27-07-2016\nCRIME NO. 691/2016 OF SASTHAMCOTTA POLICE STATION , KOLLAM\nPETITIONER (S) :\nDINAKAR\ns/o. SUKUMARAN, AGED 39 YEARS,\nRESIDING AT KOTTAKUZHI VEEDU,\nVILANTHARA PO., SASTHAMCOTTA,\nKOLLAM DISTRICT.\nBY ADVS.SRI.T.MADHU\nSRI.B.K.RAJAGOPAL\nRESPONDENT (S) /STATE:\n1. THE SUB INSPECTOR OF POLICE\nSASTHAMCOTTA POLICE STATION\nKOLLAM DISTRICT.REP. BY THE\nPUBLIC PROSECUTOR, HIGH COURT\nOF KERALA, ERNAKULAM0682031\n2. THE SUB DIVISIONAL MAGISTRATE\nKOLLAM, OFFICE OF THE SUB DIVISIONAL\nMAGISTRATE, KOLLAM PO., KOLLAM\nDISTRICT-691001\nR BY PUBLIC PROSECUTOR: SRI T R RANJITH\nTHIS CRIMINAL MISC. CASE HAVING BEEN FINALLY HEARD ON\n09-01-2017, THE COURT ON THE SAME DAY PASSED THE FOLLOWING:\n\nEar: nel\nha\nee ates\nea tee\nBares\n2017/KER/952\nCr1.MC.No. 6236 of 2016 ()\nAPPENDIX\nPETITIONER (S)' EXHIBITS\nANNEXURE Al: THE TRUE COPY OF THE ORDER DATED 27/7/2016 IN\nCRL.M.P.NO.2039/2016 ON THE FILES OF THE LEARNED SESSIONS COURT\nKOLLAM\nANNEXURE A2: THE TRUE COPY OF THE FIR IN CRIME NO.691/2016 OF\nSASTHAMCOTTA POLICE STATION.\nRESPONDENT (S)' EXHIBITS:NIL\nTrue Copy /\nP A to Judge\n\neee\n2017/KER/952\nSUNIL THOMAS, J.\nCrl.M.C.No.6236 of 2016\nDated this the 9\" day of January, 2017\nORDER\n\nPetitioner herein is the accused in Annexure-A2 FIR for\nproceeding under section 107 Cr.P.C. The reason stated in\nAnnexure-A2 FIR is that the petitioner herein indulges in criminal\nactivities affecting the public order and hence for preventing him\nfrom committing such acts, bail may be taken from him. This is\nchallenged in this Crl.M.C.\n\n2. Evidently, Section 107Cr.P.C is contemplated as an\nindependent proceeding by itself. It cannot prima facie be the\nsubject matter of registering the FIR . Having regard to this, I am\ninclined to quash Crime No.691 of 2016 of Sasthamcotta Police\nStation. It is made clear that this will not bar the respondents from\ninitiating independent proceedings under section 107Cr.P.C.\n\nIn the result, Crl.M.C is allowed. All further proceedings\narising from Crime No.691 of 2016 of Sasthamcotta Police Station\nstand quashed",
    "full_text": "Plies)\nEr aoe aa\nSeer cg\nea tee\nBeate\n2017/KER/952\nIN THE HIGH COURT OF KERALA AT ERNAKULAM\nPRESENT:\nTHE HONOURABLE MR. JUSTICE SUNIL THOMAS\nMONDAY, THE OTH DAY OF JANUARY 2017/19TH POUSHA, 1938\nCrl.MC.No. 6236 of 2016 ()\nAGAINST THE ORDER/JUDGMENT IN CRMP 2039/2016 of SESSIONS COURT,\nKOLLAM DATED 27-07-2016\nCRIME NO. 691/2016 OF SASTHAMCOTTA POLICE STATION , KOLLAM\nPETITIONER (S) :\nDINAKAR\ns/o. SUKUMARAN, AGED 39 YEARS,\nRESIDING AT KOTTAKUZHI VEEDU,\nVILANTHARA PO., SASTHAMCOTTA,\nKOLLAM DISTRICT.\nBY ADVS.SRI.T.MADHU\nSRI.B.K.RAJAGOPAL\nRESPONDENT (S) /STATE:\n1. THE SUB INSPECTOR OF POLICE\nSASTHAMCOTTA POLICE STATION\nKOLLAM DISTRICT.REP. BY THE\nPUBLIC PROSECUTOR, HIGH COURT\nOF KERALA, ERNAKULAM0682031\n2. THE SUB DIVISIONAL MAGISTRATE\nKOLLAM, OFFICE OF THE SUB DIVISIONAL\nMAGISTRATE, KOLLAM PO., KOLLAM\nDISTRICT-691001\nR BY PUBLIC PROSECUTOR: SRI T R RANJITH\nTHIS CRIMINAL MISC. CASE HAVING BEEN FINALLY HEARD ON\n09-01-2017, THE COURT ON THE SAME DAY PASSED THE FOLLOWING:\n\nEar: nel\nha\nee ates\nea tee\nBares\n2017/KER/952\nCr1.MC.No. 6236 of 2016 ()\nAPPENDIX\nPETITIONER (S)' EXHIBITS\nANNEXURE Al: THE TRUE COPY OF THE ORDER DATED 27/7/2016 IN\nCRL.M.P.NO.2039/2016 ON THE FILES OF THE LEARNED SESSIONS COURT\nKOLLAM\nANNEXURE A2: THE TRUE COPY OF THE FIR IN CRIME NO.691/2016 OF\nSASTHAMCOTTA POLICE STATION.\nRESPONDENT (S)' EXHIBITS:NIL\nTrue Copy /\nP A to Judge\n\neee\n2017/KER/952\nSUNIL THOMAS, J.\nCrl.M.C.No.6236 of 2016\nDated this the 9\" day of January, 2017\nORDER\n\nPetitioner herein is the accused in Annexure-A2 FIR for\nproceeding under section 107 Cr.P.C. The reason stated in\nAnnexure-A2 FIR is that the petitioner herein indulges in criminal\nactivities affecting the public order and hence for preventing him\nfrom committing such acts, bail may be taken from him. This is\nchallenged in this Crl.M.C.\n\n2. Evidently, Section 107Cr.P.C is contemplated as an\nindependent proceeding by itself. It cannot prima facie be the\nsubject matter of registering the FIR . Having regard to this, I am\ninclined to quash Crime No.691 of 2016 of Sasthamcotta Police\nStation. It is made clear that this will not bar the respondents from\ninitiating independent proceedings under section 107Cr.P.C.\n\nIn the result, Crl.M.C is allowed. All further proceedings\narising from Crime No.691 of 2016 of Sasthamcotta Police Station\nstand quashed.\n\nSd/-\nSUNIL THOMAS\nJudge\nSbna/9/1/17\nTrue Copy f P A to Judge\n\n"
}