{
    "case_id": "",
    "court": "HIGH COURT OF KERALA AT ERNAKULAM",
    "date": "8TH DAY OF JANUARY 2018",
    "judge": "B.KEMAL PASHA\nMONDAY",
    "petitioners": [
        "(S) /ACCUSED:",
        "1 SAJESH B., S/O.BALAKRISHNAN,",
        "AGED 23 YEARS, RESIDING AT NANDANAM,",
        "MANIPPADI, RD NAGAR POST, KASARAGOD-676519.",
        "2 ASHWIN KRISHNAN, $/O.BALAKRISHNAN,",
        "AGED 20 YEARS, RESIDING AT PATHIPPURAM HOUSE,",
        "PERIYA, PERIYA POST, KASARAGOD-673636.",
        "3 SHAN SEBASTIAN, S/O.SEBASTIAN,",
        "AGED 20 YEARS, RESIDING AT MATTAPALLY HOUSE,",
        "MANNAM, KANNOR POST KANNOOR-676306.",
        "4 ABDUL SAHAD, S$/O.HUSSAIN, AGED 22 YEARS,",
        "RESIDING AT SEYHUNA MANZIL, CHALAKKADAVU,",
        "VIDYA NAGAR POST, KASARAGOD-676506.",
        "5 SHYAM RAJ, S/O.GANGADHARAN, AGED 23 YEARS,",
        "RESIDING AT MULLACHERI HOUSE, THURIYANNI,",
        "MULLIYARKAVU POST, KASARAGOD-676306.",
        "6 ANEESH, S/O.APPAKUNJI, AGED 19 YEARS,",
        "MULLADUKKAM HOUSE POVVAL,",
        "POVVAL POST, KASARAGOD-676306."
    ],
    "respondents": [
        "(S) /COMPLATNANTS AND DE FACTO COMPLAINANT:",
        "1. STATE OF KERALA,",
        "REPRESENTED BY PUBLIC PROSECUTOR,",
        "HIGH COURT OF KERALA,",
        "ERNAKULAM- 682031.",
        "2. BILAL IBNU ASHRAF,",
        "AGED 20 YEARS, S/O.ASHARAF,",
        "DARUSSALAM HOUSE, PARAVANADUKKAM P.0O.,",
        "CHEMANAD, KASARAGOD DISTRICT-671317.",
        "3. ABDUL SIDEEQUE C.M., AGED 21 YEARS,",
        "S/O.MOIDU, CNZ HOUSE, INDIRA NAGAR P.O.,",
        "CHENGALA, KASARAGOD DISTRICT-671541.",
        "-2-"
    ],
    "sections": [
        "143",
        "147",
        "148",
        "341",
        "323",
        "324 read with Section 149 IPC"
    ],
    "outcome": "ORDER\nPetitioners are the accused in CC No.145/2017 of\nthe Judicial First Class Magistrate's Court-l, Kasaragod,\nwhich has arisen from Crime No.11/2016 of Kasaragod\nPolice Station for the offences punishable under Sections\n143, 147, 148, 341, 323 and 324 read with Section 149 IPC.\n\n2. It seems that the matter has been amicably\nsettled between the petitioners and the de_ facto\ncomplainant, who is the 2™ respondent herein.\nRespondents 3 to 6 are the other injured.\n\n3. Respondents 2 to 6 have filed separate affidavits\nas Annexures-A3 to A7 respectively, affirming that the matter\nhas been amicably settled between them and the petitioners\nand presently, they have no complaints against the\n\n2018/KER/736\n\nCrl.M.C.8673/2017 5.\n\npetitioners. When the maiter is settled between the parties,\n\nno purpose would be served in proceeding with the matter\nfurther. Matters being so, all further proceedings against the\npetitioners in CC No.145/2017 of the Judicial First Class\nMagistrate's Court-l, Kasaragod, which has arisen from\nCrime No.11/2016 of Kasaragod Police Station, can be\nquashed",
    "full_text": "Sree\noe ah\nIN THE HIGH COURT OF KERALA AT ERNAKULAM 2018/KER/736\nPRESENT:\nTHE HONOURABLE MR. JUSTICE B.KEMAL PASHA\nMONDAY, THE 8TH DAY OF JANUARY 2018 / 18TH POUSHA, 1939\nCr1.MC.No. 8673 of 2017\nCC 145/2017 OF JUDICIAL FIRST CLASS MAGISTRATE COURT-I, KASARAGOD.\nCRIME NO.11/2016 OF KASARAGOD POLICE STATION , KASARGOD\nPETITIONER (S) /ACCUSED:\n1 SAJESH B., S/O.BALAKRISHNAN,\nAGED 23 YEARS, RESIDING AT NANDANAM,\nMANIPPADI, RD NAGAR POST, KASARAGOD-676519.\n2 ASHWIN KRISHNAN, $/O.BALAKRISHNAN,\nAGED 20 YEARS, RESIDING AT PATHIPPURAM HOUSE,\nPERIYA, PERIYA POST, KASARAGOD-673636.\n3 SHAN SEBASTIAN, S/O.SEBASTIAN,\nAGED 20 YEARS, RESIDING AT MATTAPALLY HOUSE,\nMANNAM, KANNOR POST KANNOOR-676306.\n4 ABDUL SAHAD, S$/O.HUSSAIN, AGED 22 YEARS,\nRESIDING AT SEYHUNA MANZIL, CHALAKKADAVU,\nVIDYA NAGAR POST, KASARAGOD-676506.\n5 SHYAM RAJ, S/O.GANGADHARAN, AGED 23 YEARS,\nRESIDING AT MULLACHERI HOUSE, THURIYANNI,\nMULLIYARKAVU POST, KASARAGOD-676306.\n6 ANEESH, S/O.APPAKUNJI, AGED 19 YEARS,\nMULLADUKKAM HOUSE POVVAL,\nPOVVAL POST, KASARAGOD-676306.\nBY ADV.SRI.P.E.SAJAL\nRESPONDENT (S) /COMPLATNANTS AND DE FACTO COMPLAINANT:\n1. STATE OF KERALA,\nREPRESENTED BY PUBLIC PROSECUTOR,\nHIGH COURT OF KERALA,\nERNAKULAM- 682031.\n2. BILAL IBNU ASHRAF,\nAGED 20 YEARS, S/O.ASHARAF,\nDARUSSALAM HOUSE, PARAVANADUKKAM P.0O.,\nCHEMANAD, KASARAGOD DISTRICT-671317.\n3. ABDUL SIDEEQUE C.M., AGED 21 YEARS,\nS/O.MOIDU, CNZ HOUSE, INDIRA NAGAR P.O.,\nCHENGALA, KASARAGOD DISTRICT-671541.\n-2-\n\neigen\ni? es\n-2- 2018/KER/736\nCr1.MC.No. 8673 of 2017 ()\n4. ABOOBACKER SIDEEQUE, AGED 22 YEARS,\nS/O.ABDULLA, KAPPANA HOUSE, ETHIRTHOD,\nEDANEER P.O., KASARAGOD DISTRICT-671541.\n5. SAHAD, AGED 23 YEARS,\nS/O.ABDUL SAMAD, SAHARULLA HOUSE,\nKALLAKKATTA, KASARAGOD DISTRICT-671123.\n6. ANSAR SALMAN, AGED 23 YEARS,\nS/O.ABDUL RAHIMAN, PUTHIYILLATH HOUSE,\nKOPPA, HIDAYATH NAGAR P.O.,\nKASARAGOD DISTRICT-671123.\nR1 BY PUBLIC PROSECUTOR SRI.ALEX M THOMBRA\nR2 TO R6 BY ADV. SRI.E.ADITHYAN\nTHIS CRIMINAL MISC. CASE HAVING COME UP FOR ADMISSION\nON 08-01-2018, THE COURT ON THE SAME DAY PASSED THE\nFOLLOWING:\nmbr/\n\neigen\nfl aes\n2018/KER/736\nCr1.MC.No. 8673 of 2017 ()\nAPPENDIX\nPETITIONERS' ANNEXURES:\nANNEXURE Ai- CERTIFIED COPY OF THE FIR IN CRIME NO.11/2016 OF\nTHE KASARAGOD POLICE STATION.\nANNEXURE A2- CERTIFIED COPY OF THE FINAL REPORT IN CRIME NO.11/2016.\nANNEXURE A3- A TRUE COPY OF THE AFFIDAVITS SWORN BY THE 2ND RESPONDENT.\nANNEXURE A4- A TRUE COPY OF THE AFFIDAVIT SWORN BY THE 3RD RESPONDENT.\nANNEXURE A5- A TRUE COPY OF THE AFFIDAVIT SWORN BY THE 4TH RESPONDENT.\nANNEXURE A6- A TRUE COPY OF THE AFFIDAVIT SWORN BY THE 5TH RESPONDENT.\nANNEXURE A7- A TRUE COPY OF THE AFFIDAVIT SWORN BY THE 6TH RESPONDENT.\nRESPONDENTS ' ANNEXURES: NIL\n/TRUE COPY/\nP.S.TO JUDGE\nmbx/\n\n2018/KER/736\nB. KEMAL PASHA, J.\nDated this the 8\" day of January, 2018\nORDER\nPetitioners are the accused in CC No.145/2017 of\nthe Judicial First Class Magistrate's Court-l, Kasaragod,\nwhich has arisen from Crime No.11/2016 of Kasaragod\nPolice Station for the offences punishable under Sections\n143, 147, 148, 341, 323 and 324 read with Section 149 IPC.\n\n2. It seems that the matter has been amicably\nsettled between the petitioners and the de_ facto\ncomplainant, who is the 2™ respondent herein.\nRespondents 3 to 6 are the other injured.\n\n3. Respondents 2 to 6 have filed separate affidavits\nas Annexures-A3 to A7 respectively, affirming that the matter\nhas been amicably settled between them and the petitioners\nand presently, they have no complaints against the\n\n2018/KER/736\n\nCrl.M.C.8673/2017 5.\n\npetitioners. When the maiter is settled between the parties,\n\nno purpose would be served in proceeding with the matter\nfurther. Matters being so, all further proceedings against the\npetitioners in CC No.145/2017 of the Judicial First Class\nMagistrate's Court-l, Kasaragod, which has arisen from\nCrime No.11/2016 of Kasaragod Police Station, can be\nquashed.\n\nIn the result, this Crl.M.C. is allowed and all further\nproceedings against the petitioners in CC No.145/2017 of\nthe Judicial First Class Magistrate's Court-l, Kasaragod,\nwhich has arisen from Crime No.11/2016 of Kasaragod\nPolice Station, are quashed.\n\nSd/-\n(B.KEMAL PASHA, JUDGE)\naks/08/01\n// True Copy //\nPS to Judge\n\n"
}