{
    "case_id": "Crl.MC.No. 173 of 2019",
    "court": "HIGH COURT OF KERALA AT EBRNAKULAM\nPRESENT\nTHE HONOURABLE MR",
    "date": "9TH DAY OF JANUARY 2019",
    "judge": "K.ABRAHAM MATHEW\nWEDNESDAY",
    "petitioners": [
        "S:",
        "1 ANAS .M.",
        "AGED 26 YEARS",
        "S/O.AYISHA, MARUNNOLI VEEDU, NADAPURAM,",
        "VATAKARA TALUK, KOZHIKODE DISTRICT, PIN-",
        "673513.",
        "2 MUHAMMED SABITH",
        "AGED 28 YEARS",
        "S/O.ABOOBAKKAR, POMNARA HOUSE, NADAPURAM,",
        "VATAKARA TALUK, KOZHIKODE DISTRICT, PIN-",
        "673513.",
        "3 MUHAMMED SALIH O P.",
        "AGED 27 YEARS",
        "S/O.KUNJABDULLA, OTTAPILAKKOOL, NADAPURAM,",
        "VATAKARA TALUK, KOZHIKODE DISTRICT, PIN-",
        "673513.",
        "4 ARSHAD K., AGED 25 YEARS",
        "S/O.HAMEED, KODAKKAT HOUSE, NADAPURAM,",
        "VATAKARA TALUK, KOZHIKODE DISTRICT, PIN-",
        "673513.",
        "5 ARSHAD K.,",
        "AGED 25 YEARS",
        "S/O.HAMEED, KODAKKATT HOUSE, NADAPURAM,",
        "VATAKARA TALUK, KOZHIKODE DISTRICT, PIN-",
        "673513."
    ],
    "respondents": [
        "S:",
        "1 C.M.VALSAN,",
        "AGED 46 YEARS",
        "S/O.CHATHU, EYYANKOD AMSOM AND DESOM, VATAKARA",
        "TALUK, KOZHIKODE DISTRICT, PIN-673513.",
        "2 STATE OF KERALA,",
        "REPRESENTED BY THE PUBLIC PROSECUTOR, HIGH",
        "COURT OF KERALA, ERNAKULAM, PIN-682031."
    ],
    "sections": [
        "482 Cr"
    ],
    "outcome": "ORDER\nPetition filed under Section 482 Cr.P.C.\n\n2. The petitioners are the accused in Crime No.\n64 of 2017 of Thottilpalam Police Station\nregistered for the offences under Sections\n143, 147, 153A & 342 r/w Section 149 of the\nIndian Penal Code. The first respondent is\nthe victim. It is submitted that the matter\nhas been settled and the proceedings in the\ncriminal case may be quashed",
    "full_text": "BEELEl\nSee eee\ncee\nORES\n2019/KER/1023\nIN THE HIGH COURT OF KERALA AT EBRNAKULAM\nPRESENT\nTHE HONOURABLE MR. JUSTICE K.ABRAHAM MATHEW\nWEDNESDAY ,THE O9TH DAY OF JANUARY 2019 / 19TH POUSHA,\n1940\nCr1.MC.No. 173 of 2019\nCRIME NO. 64/2017 OF THOTTILPALAM POLICE STATION ,\nKOZHIKODE\nPETITIONER/S:\n1 ANAS .M.\nAGED 26 YEARS\nS/O.AYISHA, MARUNNOLI VEEDU, NADAPURAM,\nVATAKARA TALUK, KOZHIKODE DISTRICT, PIN-\n673513.\n2 MUHAMMED SABITH\nAGED 28 YEARS\nS/O.ABOOBAKKAR, POMNARA HOUSE, NADAPURAM,\nVATAKARA TALUK, KOZHIKODE DISTRICT, PIN-\n673513.\n3 MUHAMMED SALIH O P.\nAGED 27 YEARS\nS/O.KUNJABDULLA, OTTAPILAKKOOL, NADAPURAM,\nVATAKARA TALUK, KOZHIKODE DISTRICT, PIN-\n673513.\n4 ARSHAD K., AGED 25 YEARS\nS/O.HAMEED, KODAKKAT HOUSE, NADAPURAM,\nVATAKARA TALUK, KOZHIKODE DISTRICT, PIN-\n673513.\n5 ARSHAD K.,\nAGED 25 YEARS\nS/O.HAMEED, KODAKKATT HOUSE, NADAPURAM,\nVATAKARA TALUK, KOZHIKODE DISTRICT, PIN-\n673513.\n\nRepeal\nete r\nBle icogt fc\nBer\n2019/KER/1023\nCr1.MC.No. 173 of 2019\n22a.\n6 JASEER V K.,\nAGED 26 YEARS\nS/O.EBRAHIM, CHERIAKOYAPPALLI HOUSE,\nNADAPURAM, VATAKARA TALUK, KOZHIKODE DISTRICT,\nPIN-673513.\n7 MUHAMMED RAFT\nAGED 26 YEARS\nS/O.EBRAHIM, CHERIAKOYAPPALLI HOUSE,\nNADAPURAM, VATAKARA TALUK, KOZHIKODE DISTRICT,\nPIN-673513.\nBY ADV. SRI.P.S.BINU\nRESPONDENT/S:\n1 C.M.VALSAN,\nAGED 46 YEARS\nS/O.CHATHU, EYYANKOD AMSOM AND DESOM, VATAKARA\nTALUK, KOZHIKODE DISTRICT, PIN-673513.\n2 STATE OF KERALA,\nREPRESENTED BY THE PUBLIC PROSECUTOR, HIGH\nCOURT OF KERALA, ERNAKULAM, PIN-682031.\nBY ADV. SRI.ZUBAIR PULIKKOOL\nOTHER PRESENT:\nSRI ALEX M THOMBRA- SR PUBLIC PROSECUTOR\nTHIS CRIMINAL MISC. CASE HAVING COME UP FOR ADMISSION ON\n09.01.2019, THE COURT ON THE SAME DAY PASSED THE\nFOLLOWING:\n\n[OF\n2019/KER/1023\n\nCrl.MC.No. 173 of 2019\n\n1.3..\nORDER\nPetition filed under Section 482 Cr.P.C.\n\n2. The petitioners are the accused in Crime No.\n64 of 2017 of Thottilpalam Police Station\nregistered for the offences under Sections\n143, 147, 153A & 342 r/w Section 149 of the\nIndian Penal Code. The first respondent is\nthe victim. It is submitted that the matter\nhas been settled and the proceedings in the\ncriminal case may be quashed.\n\n3. Heard the learned counsel for the petitioners\nand the first respondent and the learned\nPublic Prosecutor.\n\n4. I have perused the affidavit filed by the\nfirst respondent, who has entered appearance\nthrough counsel. I am satisfied that the\nallegation of settlement is true and no public\ninterest is involved. There is no impediment\nfor granting the prayer of the petitioners.\n\nIn the result, this Crl.M.C. is allowed. The\n\nBeil\nLape\nob\n2019/KER/1023\nCrl.MC.No. 173 of 2019\n14...\nproceedings in Crime No. 64 of 2017 of\nThottilpalam Police Station are quashed. The\nlearned magistrate may pass appropriate orders\nfor the disposal of the material objects, if\nany, produced in the case.\nSd/-\nK.ABRAHAM MATHEW\nJUDGE\nAPPENDIX\nPETITIONER'S/S EXHIBITS:\nANNEXURE 1 COPY OF THE F.I.R WITH F.I.S. IN CRIME\nNO.64/2017 OF THOTTIPALAM POLICE\nSTATION.\nANNEXURE 2 SWORN AFFIDAVIT OF FIRST RESPONDENT.\nBka/10.01.2018\n\n"
}