{
    "case_id": "Crl.MC.No. 38 of 2019",
    "court": "HIGH COURT OF KERALA AT EBRNAKULAM\nPRESENT\nTHE HONOURABLE MR",
    "date": "4TH DAY OF JANUARY 2019",
    "judge": "K.ABRAHAM MATHEW\nFRIDAY",
    "petitioners": [
        "S:",
        "1 SANDHOSH K.V.,",
        "AGED 40 YEARS",
        "s/o. BASKARA KURUP, KALARTIKYAL HOUSE,",
        "BRAHMMAKULAM, GURUVAYOOR, THRISSUR-680104.",
        "2 YOUSAF ALI,",
        "AGED 45 YEARS",
        "s/o. UMMER, NALAKATH HOUSE, BRAHMMAKULAM,",
        "GURUVAYOOR, THRISSUR-680104."
    ],
    "respondents": [
        "S:",
        "1 STATE OF KERALA,",
        "REPRESENTED BY PUBLIC PROSECUTOR, HIGH COURT",
        "OF KERALA THROUGH SUB INSPECTOR, PAVARATTY",
        "POLICE STATION, ERNAKULAM.",
        "2 ABDHUL HYSHAM,",
        "s/o. ABDHUL HAMEED, AGED 20 YEARS, PULICHARAM",
        "HOUSE, PAVARATTY KARA, CHAVAKAD, THRISSUR.",
        "3 AJAMAL",
        "s/o. ASHARAF, AGED 23 YEARS, MUDAVATHAYIL",
        "HOUSE, CHAKKAMKANDAM P.O., CHAVAKAD, THRISSUR."
    ],
    "sections": [
        "482 Cr"
    ],
    "outcome": "ORDER\nPetition filed under Section 482 Cr.P.C.\n\n2. The petitioners are the accused in Crime No.\n843 of 2018 of Pavaratty Police Station\nregistered for the offences under Sections\n323, 324 & 341 of the Indian Penal Code.\nRespondents 2 & 3 are the victims. It is\nsubmitted that the matter has been settled and\nthe proceedings in the criminal case may be\nquashed",
    "full_text": "pret\nFo i a\niis\n2019/KER/198\nIN THE HIGH COURT OF KERALA AT EBRNAKULAM\nPRESENT\nTHE HONOURABLE MR. JUSTICE K.ABRAHAM MATHEW\nFRIDAY, THE O4TH DAY OF JANUARY 2019 / 14TH POUSHA, 1940\nCrl.MC.No. 38 of 2019\nCRIME NO. 843/2018 OF PAVARATTY POLICE STATION, THRISSUR\nPETITIONER/S:\n1 SANDHOSH K.V.,\nAGED 40 YEARS\ns/o. BASKARA KURUP, KALARTIKYAL HOUSE,\nBRAHMMAKULAM, GURUVAYOOR, THRISSUR-680104.\n2 YOUSAF ALI,\nAGED 45 YEARS\ns/o. UMMER, NALAKATH HOUSE, BRAHMMAKULAM,\nGURUVAYOOR, THRISSUR-680104.\nBY ADV. SRI.E.A.HARIS\nRESPONDENT/S:\n1 STATE OF KERALA,\nREPRESENTED BY PUBLIC PROSECUTOR, HIGH COURT\nOF KERALA THROUGH SUB INSPECTOR, PAVARATTY\nPOLICE STATION, ERNAKULAM.\n2 ABDHUL HYSHAM,\ns/o. ABDHUL HAMEED, AGED 20 YEARS, PULICHARAM\nHOUSE, PAVARATTY KARA, CHAVAKAD, THRISSUR.\n3 AJAMAL\ns/o. ASHARAF, AGED 23 YEARS, MUDAVATHAYIL\nHOUSE, CHAKKAMKANDAM P.O., CHAVAKAD, THRISSUR.\n\n2019/KER/198\nCrl.MC.No. 38 of 2019\n1i2..\nBY ADV. SHRI.AFSAL KHAN H.\nOTHER PRESENT:\nSRI.C.S.HRITHWIK SR PP\n\nTHIS CRIMINAL MISC. CASE HAVING COME UP FOR ADMISSION ON\n\n04.01.2019, THE COURT ON THE SAME DAY PASSED THE\n\nFOLLOWING:\n\nORDER\nPetition filed under Section 482 Cr.P.C.\n\n2. The petitioners are the accused in Crime No.\n843 of 2018 of Pavaratty Police Station\nregistered for the offences under Sections\n323, 324 & 341 of the Indian Penal Code.\nRespondents 2 & 3 are the victims. It is\nsubmitted that the matter has been settled and\nthe proceedings in the criminal case may be\nquashed.\n\n3. Heard the learned counsel for the petitioners\nand respondents 2 & 3 and the learned Public\nProsecutor.\n\n4. I have perused the affidavits filed by\n\n2019/KER/198\nCrl.MC.No. 38 of 2019\n1.3..\nrespondents 2 & 3, who have entered appearance\nthrough counsel. I am satisfied that the\nallegation of settlement is true and no public\ninterest is involved. There is no impediment\nfor granting the prayer of the petitioners.\nIn the result, this Crl.M.C. is allowed. The\nproceedings in Crime No. 843 of 2018 of\nPavaratty Police Station are quashed. The\nlearned magistrate may pass appropriate orders\nfor the disposal of the material objects, if\nany, produced in the case.\nSd/-\nK.ABRAHAM MATHEW\nJUDGE\nBka/07.01.2019\n\nBupa\n2 ae a\nFe =\npa\nBE\n2019/KER/198\nCrl.MC.No. 38 of 2019\nAPPENDIX\nPETITIONER'S/S EXHIBITS:\nANNEXURE-A1 CERTIFIED COPY OF THE FIR IN CRIME\nNO.843/2018 OF PAVARATHY POLICE\nSTATION.\nANNEXURE-A2 CERTIFIED COPY OF THE FIS IN CRIME\nNO.843/2018 OF PAVARATHY POLICE\nSTATION.\nANNEXURE-A3 AFFIDAVIT OF THE DEFACTO\nCOMPLAINANT/2ND RESPONDENT.\nANNEXURE-A4 AFFIDAVIT OF THE DEFACTO COMPLAINANT /\n2ND RESPONDENT.\n\n"
}