{
    "case_id": "",
    "court": "HIGH COURT OF KERALA AT BRNAKULAM",
    "date": "4TH DAY OF JANUARY 2018",
    "judge": "B.SUDHEENDRA KUMAR\nTHURSDAY",
    "petitioners": [
        "(S) /PETITIONER",
        "SHIBU K.V., AGED 45 YEARS,",
        "S/O.VASUDEVAN, RESIDING AT KUNNEPARAMBIL HOUSE,",
        "THEKKENADA P.O., VAIKOM TALUK, KOTTAYAM DISTRICT."
    ],
    "respondents": [
        "(S) /STATE:",
        "1. THE STATE OF KERALA",
        "THROUGH THE STATION HOUSE OFFICER, VAIKOM POLICE STATION,",
        "KOTTAYAM DISTRICT, REPRESENTED BY THE PUBLIC PROSECUTOR,",
        "HIGH COURT OF KERALA, ERNAKULAM - 682 031.",
        "2. PADMAKUMAR, AGED 45 YEARS,",
        "S$/O.SIVARAJA PANICKER, RESIDING AT SARASWATHY BHAVAN",
        "HOUSE, NADUVILE VILLAGE, VAIKOM TALUK,",
        "KOTTAYAM DISTRICT - 686 141.",
        "Rl BY PUBLIC PROSECUTOR SRI.E.C.BINEESH"
    ],
    "sections": [],
    "outcome": "",
    "full_text": "beeen\nsetae\nx ats\nBore\nIN THE HIGH COURT OF KERALA AT BRNAKULAM 2018/KER/246\nPRESENT:\nTHE HONOURABLE MR. JUSTICE B.SUDHEENDRA KUMAR\nTHURSDAY, THE 4TH DAY OF JANUARY 2018 / 14TH POUSHA, 1939\nCr1.MC.No. 4675 of 2014\nCC 716/2014 of J.M.F.C., VAIKOM\nCRIME NO. 435/2014 OF VAIKOM POLICE STATION, KOTTAYAM\nPETITIONER (S) /PETITIONER\nSHIBU K.V., AGED 45 YEARS,\nS/O.VASUDEVAN, RESIDING AT KUNNEPARAMBIL HOUSE,\nTHEKKENADA P.O., VAIKOM TALUK, KOTTAYAM DISTRICT.\nBY ADVS.SRI.T.MADHU\nSMT.C.R.SARADAMANT\nRESPONDENT (S) /STATE:\n1. THE STATE OF KERALA\nTHROUGH THE STATION HOUSE OFFICER, VAIKOM POLICE STATION,\nKOTTAYAM DISTRICT, REPRESENTED BY THE PUBLIC PROSECUTOR,\nHIGH COURT OF KERALA, ERNAKULAM - 682 031.\n2. PADMAKUMAR, AGED 45 YEARS,\nS$/O.SIVARAJA PANICKER, RESIDING AT SARASWATHY BHAVAN\nHOUSE, NADUVILE VILLAGE, VAIKOM TALUK,\nKOTTAYAM DISTRICT - 686 141.\nRl BY PUBLIC PROSECUTOR SRI.E.C.BINEESH\nTHIS CRIMINAL MISC. CASE HAVING BEEN FINALLY HEARD ON 04-01-2018,\nTHE COURT ON THE SAME DAY PASSED THE FOLLOWING:\nSTK\n\nFue\n2018/KER/246\nB. SUDHEENDRA KUMAR, J.\nCri.M.C. No.4675 of 2014\nDated this the 4\" day of January, 2018\nORDER\nWhen this matter has been taken up for hearing, the\nlearned counsel for the petitioner has submitted that the\nmatter has become _ infructuous. In view of the above\nsubmission of the learned counsel for the petitioner, this\nCri.M.C. stands dismissed as infructuous.\nSd/-\nB. SUDHEENDRA KUMAR,\nJUDGE\nSTK\n/{TRUE COPY//\n//P.A. TO JUDGE//\n\n"
}