{
    "case_id": "Crl.MC.No. 2502 of 2015",
    "court": "HIGH COURT OF KERALA AT ERNAKULAM\nPRESENT",
    "date": "21ST DAY OF APRIL 2015",
    "judge": "K.HARILAL\nTUESDAY",
    "petitioners": [
        "S/ACCUSED NO.1 TO 3:",
        "1. SUJITH M.S. AGED 24 YEARS",
        "$/O SHAJI, MAPPLIAKUNNEL HOUSE, CHANDANAKKAMPARA.P.O",
        "PAYYAVOOR AMSOM, TALIPARAMBA TALUK",
        "KANNUR DISTRICT-670633",
        "2. SHIJITH.M.S",
        "S/O SHAJI, MAPPLIAKUNNEL HOUSE, CHANDANAKKAMPARA.P.O",
        "PAYYAVOOR AMSOM, TALIPARAMBA TALUK",
        "KANNUR DISTRICT-670633",
        "3. VIPIN @BIBIN BABY@JOSEPH,",
        "S/O JOSEPH, ELANJIKUZHIYIL HOPUSE",
        "CHANDANAKKAMPARA.P.O, PAYYAVOOR AMSOM",
        "TALIPARAMBA TALUK, KANNUR DISTRICT-670633"
    ],
    "respondents": [
        "COMPLAINANT:",
        "STATE OF KERALA",
        "REPRESENTED BY THE PUBLIC PROSECUTOR",
        "HIOGH COURT OF KERALA THROUGH S.H.O. PAYYAVOOR POLICE STATION",
        "KANNUR. DT",
        "R BY PUBLIC PROSECUTOR SRI.EGY N. ELIAS."
    ],
    "sections": [
        "341",
        "323 read with 34 of the Indian Penal Code"
    ],
    "outcome": "",
    "full_text": "meee\nRoget â€œ4\na\nBurk:\n2015/KER/17263\nIN THE HIGH COURT OF KERALA AT ERNAKULAM\nPRESENT:\nTHE HONOURABLE MR.JUSTICE K.HARILAL\nTUESDAY, THE 21ST DAY OF APRIL 2015/18T VAISAKHA, 1937\nCrl.MC.No. 2502 of 2015 ()\ncc 1404/2012 OF JUDICIAL FIRST CLASS MAGISTRATE COURT, TALIPARAMBA\nCRIME NO. 364/2012 OF PAYYAVOOR POLICE STATION, KANNUR\nPETITIONERS/ACCUSED NO.1 TO 3:\n1. SUJITH M.S. AGED 24 YEARS\n$/O SHAJI, MAPPLIAKUNNEL HOUSE, CHANDANAKKAMPARA.P.O\nPAYYAVOOR AMSOM, TALIPARAMBA TALUK\nKANNUR DISTRICT-670633\n2. SHIJITH.M.S\nS/O SHAJI, MAPPLIAKUNNEL HOUSE, CHANDANAKKAMPARA.P.O\nPAYYAVOOR AMSOM, TALIPARAMBA TALUK\nKANNUR DISTRICT-670633\n3. VIPIN @BIBIN BABY@JOSEPH,\nS/O JOSEPH, ELANJIKUZHIYIL HOPUSE\nCHANDANAKKAMPARA.P.O, PAYYAVOOR AMSOM\nTALIPARAMBA TALUK, KANNUR DISTRICT-670633\nBY ADVS.SRI.V.A.SATHEESH\nSRI.V.T.MADHAVANUNNI\nRESPONDENT/COMPLAINANT:\nSTATE OF KERALA\nREPRESENTED BY THE PUBLIC PROSECUTOR\nHIOGH COURT OF KERALA THROUGH S.H.O. PAYYAVOOR POLICE STATION\nKANNUR. DT\nR BY PUBLIC PROSECUTOR SRI.EGY N. ELIAS.\nTHIS CRIMINAL MISC. CASE HAVING COME UP FOR ADMISSION ON\n21-04-2015, THE COURT ON THE SAME DAY PASSED THE FOLLOWING:\nSCL.\n\nee\n.\n2015/KER/17263\nK. HARILAL, J.\nCrl.M.C.No.2502 of 2015\nDated this the 21* day of April, 2015.\nORDER\n\nThe petitioners are accused Nos. 1 to 3 respectively in\nCrime No.364 of 2012 of Payyavoor Police Station, Kannur\nDistrict, registered for the offences punishable under Sections\n341 and 323 r/w 34 of the Indian Penal Code.\n\n2. The petitioners entered appearance on receipt of\nsummons before the court below through a counsel. Since the\npetitioners were not in station thereafter, they could not\nappear before the court below on hearing dates. Now the non-\nbailable warrant has been issued against the petitioners by the\ncourt below. Now the petitioners are ready to surrender before\nthe court below to seek regular bail. | Apprehension of the\npetitioners is that if he surrenders before the court below, he\nwill be remanded to the judicial custody, pending consideration\nof the application.\n\nI do not think that the Learned Magistrate will remand\n\nBeare\nae\n2015/KER/17263\nCrl.M.C.No.2502 of 2015\n-2-\nthe petitioners mechanically, without application of mind.\nNonetheless, the learned magistrate is directed to consider and\ndispose of the bail application to be filed by the petitioners on\nthe date of surrender itself.\nSd/-\nK. HARILAL\nJUDGE\nScl.\nTrue Copy\nPA to Judge\n\n"
}