{
    "case_id": "",
    "court": "HIGH COURT OF KERALA AT ERNAKULAM\nPRESENT",
    "date": "11TH DAY OF JANUARY 2017",
    "judge": "SUNIL THOMAS\nWEDNESDAY",
    "petitioners": [
        "(S) /ACCUSED NO.4:"
    ],
    "respondents": [
        "(S) /COMPLAINANT:"
    ],
    "sections": [],
    "outcome": "",
    "full_text": "% =8 Fr\nBaa\n2017/KER/1504\nIN THE HIGH COURT OF KERALA AT ERNAKULAM\nPRESENT:\nTHE HONOURABLE MR. JUSTICE SUNIL THOMAS\nWEDNESDAY, THE 11TH DAY OF JANUARY 2017/21ST POUSHA, 1938\nCr1.MC.No. 221 of 2017 ()\n\nAGAINST THE ORDER/JUDGMENT IN CP 75/2016 of J.M.F.C., KODUNGALLUR\nCRIME NO. 3/2015 OF KODUNGALLUR EXCISE RANGE OFFICE, TRISSUR\nPETITIONER (S) /ACCUSED NO.4:\n\nMOHANAN, AGED 56 YEARS,\n\nS/O.MANIKUTTAN,\n\nTHEKKOOTTUVALOOPARAMBIL HOUSE,\n\nCHELOOR, IRINJALAKKUDA,\n\nTHRISSUR DISTRICT.\n\nBY ADV. SRI.NIREESH MATHEW\nRESPONDENT (S) /COMPLAINANT:\n\nSTATE OF KERALA,\n\nREPRESENTED BY THE PUBLIC PROSECUTOR,\n\nHIGH COURT OF KERALA,\n\nERNAKULAM.\n\nBY PUBLIC PROSECUTOR SRI.AMJAD ALI\n\nTHIS CRIMINAL MISC. CASE HAVING COME UP FOR ADMISSION ON\n\n11-01-2017, THE COURT ON THE SAME DAY PASSED THE FOLLOWING:\nPn\n\nBeal\nBeet\n2017/KER/1504\nSUNIL THOMAS, J.\nCri. M. C. No. 221 of 2017\nDated this the 11\" day of January, 2017\nORDER\nWhen the matter was taken up, learned counsel for the\npetitioner seeks permission to withdraw the Crl.M.C. with liberty\nto file appropriate comprehensive application.\nPermitted. Hence, the Crl.M.C. is dismissed as withdrawn.\nSd/-\nSUNIL THOMAS, JUDGE.\n/true copy/\nP, A. to Judge\nPn\n\n"
}