{
    "case_id": "Crl.MC.No. 8522 of 2018",
    "court": "HIGH COURT OF KERALA AT ERNAKULAM\nPRESENT\nTHE HONOURABLE MR",
    "date": "7TH DAY OF JANUARY 2019",
    "judge": "RAJA VIJAYARAGHAVAN V\nMONDAY",
    "petitioners": [
        "ACCUSED:",
        "SANDEEP K., AGED 32 YEARS,",
        "S/O NARAYANAN, KOTTEKKATTIL HOUSE, PACHATTITI,",
        "TIRUR, MALAPPURAM-676 105."
    ],
    "respondents": [
        "S /STATE/DE FACTO COMPLAINANT :",
        "1 STATE OF KERALA,",
        "REPRESENTED BY THE PUBLIC PROSECUTOR,",
        "HIGH COURT KERALA, ERNAKULAM-682 031.",
        "2 PREETHI,",
        "AGED 23 YEARS,",
        "D/O KESAVAN, ILLAPARAMBIL HOUSE, KODAKKAL P.O.",
        "AJITHPADI, MALAPPURAM-676 108.",
        "R2 BY ADV. SRI.MANU.M. THOMAS",
        "R1 SRI.AMJAD ALI, SENIOR PUBLIC PROSECUTOR"
    ],
    "sections": [
        "482 of the Code of\nCriminal Procedure"
    ],
    "outcome": "ORDER\n\nThis petition is filed under Section 482 of the Code of\nCriminal Procedure (“the Code” for brevity) with a prayer to quash\nthe proceedings pending against the petitioner.\n\n2. The 2\" respondent is the wife of the petitioner. Their\nmarriage was solemnized on 09.11.2014 and they were living\ntogether. In the course of their connubial relationship, serious\ndisputes cropped up. The 2™ respondent specifically alleges that\nthe petitioner is guilty of culpable matrimonial cruelty. This finally\nled to the institution of criminal proceedings at the instance of the\n2\"? respondent. FIR was registered and after investigation, final\nreport was laid before the learned Magistrate and the case is now\npending as C.C.No.1830 of 2017 on the files of the Judicial\nMagistrate of First Class-I, Tirur. In the aforesaid case, the\npetitioner is accused of having committed offences punishable\nunder Sections 498A and 406 read with Section 34 of the IPC.\n\n3. The learned Counsel appearing for the petitioner\n\nBRE\noa\nCrl.MC.No. 8522 of 2018 3 2011KEROS7\nsubmitted that at the instance of well wishers and family\nmembers, the parties have decided to put an end to their discord\nand have decided to part ways. It is urged that the dispute is\npurely private in nature. The learned counsel appearing for the 2\"\nrespondent invited the attention of this Court to the affidavit filed\nby her and asserts that the disputes inter se have been settled\nand the continuance of criminal proceedings will only result in\ngross inconvenience and hardship. It is submitted that the 2\"\nrespondent has no objection in allowing the prayer sought for.\n\n4. The learned Public Prosecutor after getting instructions\nhas submitted that the statement of the 2\" respondent has been\nrecorded and she has stated in unequivocal terms that the\nsettlement arrived at is genuine.\n\n5. Ihave considered the submissions advanced.\n\n6. In Gian singh v. State of Punjab [(2012) 10 SCC\n303] and in Narinder singh v. State of Punjab [(2014) 6 SCC\n466], the Apex Court has laid down that in appropriate cases, the\n\nBeer\nCrl.MC.No. 8522 of 2018 4 2019/KERIOS7\nHigh Court can take note of the amicable resolution of disputes\nbetween the victim and the wrongdoer to put an end to the\ncriminal proceedings. Further in Jitendra Raghuvanshi &\nOthers v. Babita Raghuvanshi & Another (2013) 4 SCC 58, it\nwas observed that it is the duty of the courts to encourage\ngenuine settlements of matrimonial disputes. If the parties ponder\nover their faults and terminate their disputes amicably by mutual\nagreement instead of fighting it out in a court of law, the courts\nshould not hesitate to exercise its powers under Section 482 of\nthe Code. Permitting such proceedings to continue would be\nnothing, but an abuse of process of court. The interest of justice\nalso require that the proceedings be quashed",
    "full_text": "Peet ial\ncet oeeth\nBis aaerts\n2019/KER/657\nIN THE HIGH COURT OF KERALA AT ERNAKULAM\nPRESENT\nTHE HONOURABLE MR. JUSTICE RAJA VIJAYARAGHAVAN V\nMONDAY, THE O7TH DAY OF JANUARY 2019 / 17TH POUSHA, 1940\nCr1.MC.No. 8522 of 2018\nCc 1830/2017 of JUDICIAL FIRST CLASS MAGISTRATE COURT-I,TIRUR\nCRIME NO. 1725/2015 OF Tirur Police Station, Malappuram\nPETITIONER/ACCUSED:\nSANDEEP K., AGED 32 YEARS,\nS/O NARAYANAN, KOTTEKKATTIL HOUSE, PACHATTITI,\nTIRUR, MALAPPURAM-676 105.\nBY ADVS.\nSRI.P.C.ANIL KUMAR\nSMT.P.SREESHA\nSRI.FOUD. C.O0.T.\nRESPONDENTS /STATE/DE FACTO COMPLAINANT :\n1 STATE OF KERALA,\nREPRESENTED BY THE PUBLIC PROSECUTOR,\nHIGH COURT KERALA, ERNAKULAM-682 031.\n2 PREETHI,\nAGED 23 YEARS,\nD/O KESAVAN, ILLAPARAMBIL HOUSE, KODAKKAL P.O.\nAJITHPADI, MALAPPURAM-676 108.\nR2 BY ADV. SRI.MANU.M. THOMAS\nR1 SRI.AMJAD ALI, SENIOR PUBLIC PROSECUTOR\nTHIS CRIMINAL MISC. CASE HAVING COME UP FOR ADMISSION ON\n07.01.2019, THE COURT ON THE SAME DAY PASSED THE FOLLOWING:\n\ngree\nCrl.MC.No. 8522 of 2018 2 20191KERI6S?\nORDER\n\nThis petition is filed under Section 482 of the Code of\nCriminal Procedure (“the Code” for brevity) with a prayer to quash\nthe proceedings pending against the petitioner.\n\n2. The 2\" respondent is the wife of the petitioner. Their\nmarriage was solemnized on 09.11.2014 and they were living\ntogether. In the course of their connubial relationship, serious\ndisputes cropped up. The 2™ respondent specifically alleges that\nthe petitioner is guilty of culpable matrimonial cruelty. This finally\nled to the institution of criminal proceedings at the instance of the\n2\"? respondent. FIR was registered and after investigation, final\nreport was laid before the learned Magistrate and the case is now\npending as C.C.No.1830 of 2017 on the files of the Judicial\nMagistrate of First Class-I, Tirur. In the aforesaid case, the\npetitioner is accused of having committed offences punishable\nunder Sections 498A and 406 read with Section 34 of the IPC.\n\n3. The learned Counsel appearing for the petitioner\n\nBRE\noa\nCrl.MC.No. 8522 of 2018 3 2011KEROS7\nsubmitted that at the instance of well wishers and family\nmembers, the parties have decided to put an end to their discord\nand have decided to part ways. It is urged that the dispute is\npurely private in nature. The learned counsel appearing for the 2\"\nrespondent invited the attention of this Court to the affidavit filed\nby her and asserts that the disputes inter se have been settled\nand the continuance of criminal proceedings will only result in\ngross inconvenience and hardship. It is submitted that the 2\"\nrespondent has no objection in allowing the prayer sought for.\n\n4. The learned Public Prosecutor after getting instructions\nhas submitted that the statement of the 2\" respondent has been\nrecorded and she has stated in unequivocal terms that the\nsettlement arrived at is genuine.\n\n5. Ihave considered the submissions advanced.\n\n6. In Gian singh v. State of Punjab [(2012) 10 SCC\n303] and in Narinder singh v. State of Punjab [(2014) 6 SCC\n466], the Apex Court has laid down that in appropriate cases, the\n\nBeer\nCrl.MC.No. 8522 of 2018 4 2019/KERIOS7\nHigh Court can take note of the amicable resolution of disputes\nbetween the victim and the wrongdoer to put an end to the\ncriminal proceedings. Further in Jitendra Raghuvanshi &\nOthers v. Babita Raghuvanshi & Another (2013) 4 SCC 58, it\nwas observed that it is the duty of the courts to encourage\ngenuine settlements of matrimonial disputes. If the parties ponder\nover their faults and terminate their disputes amicably by mutual\nagreement instead of fighting it out in a court of law, the courts\nshould not hesitate to exercise its powers under Section 482 of\nthe Code. Permitting such proceedings to continue would be\nnothing, but an abuse of process of court. The interest of justice\nalso require that the proceedings be quashed.\n\n7. Having considered all the relevant circumstances, I am\nof the considered view that this Court will be well justified in\ninvoking its extraordinary powers under Section 482 of the Code\nto quash the proceedings.\n\nIn the result, this petition will stand allowed.\nAnnexure-A2 final report and all proceedings pursuant thereto\n\nBRE\nES eee\nBis aaerts\nCrl.MC.No. 8522 of 2018 5 2019/KERIOS7\nagainst the petitioner now pending as C.C.No.1830 of 2017 on the\nfile of the Judicial First Class Magistrate Court-I, Tirur are\nquashed.\nSD/-\nRAJA VIJAYARAGHAVAN V.,\nJUDGE\nDSVi-\n\nabserateied c|\nete a\nEls ae\nCr1.MC.No, 8522 of 2018 6 2019/KERI657\nAPPENDIX\nPETITIONER'S/S EXHIBITS:\nANNEXURE Al CERTIFIED COPY OF FIR NO 1725/2015 OF TIRUR\nPOLICE STATION, MALAPPURAM.\nANNEXURE A2 CERTIFIED COPY OF THE FINAL REPORT IN CRIME\nNO 1725/2015 OF TIRUR POLICE STATION,\nMALAPPURAM.\nANNEXURE A3 A TRUE PHOTOCOPY OF THE AGREEMENT DATED\n6.4.2018 SIGNED BY THE PETITIONER AND 2ND\nRESPONDENT /DE-FACTO COMPLAINANT.\nANNEXURE A4 AFFIDAVIT DATED 6.4.2018 SOLEMNLY AFFIRMED\nBY THE 2ND RESPONDENT /DE-FACTO COMPLAINANT.\nRESPONDENT'S/S EXHIBITS:\nNIL\n//TRUE CoPY//\nP.A.TO JUDGE\n\n"
}