{
    "case_id": "",
    "court": "HIGH COURT OF KERALA AT ERNAKULAM\nPRESENT\nTHE HONOURABLE MR",
    "date": "07TH DAY OF JANUARY 2020",
    "judge": "P.B.SURESH KUMAR\nTUESDAY",
    "petitioners": [
        "ACCUSED:",
        "SABU C.S., AGED 35 YEARS",
        "S/O.SANTHOSH, CHATTHANATT HOUSE,",
        "NARAKKAL.P.O., ERNAKULAM-682505."
    ],
    "respondents": [
        "STATE AND COMPLAINANT:",
        "1 STATE OF KERALA,",
        "REPRESENTED BY THE PUBLIC PROSECUTOR,",
        "HIGH COURT OF KERALA, ERNAKULAM-682031.",
        "2 SUB INSPECTOR OF POLICE,",
        "NARAKKAL POLICE STATION, ERNAKULAM-682505."
    ],
    "sections": [
        "366A",
        "370 of the Indian Penal Code"
    ],
    "outcome": "",
    "full_text": "Fen a\noe\nBAe\n2020/KER/586\nIN THE HIGH COURT OF KERALA AT ERNAKULAM\nPRESENT\nTHE HONOURABLE MR. JUSTICE P.B.SURESH KUMAR\nTUESDAY, THE 07TH DAY OF JANUARY 2020 / 17TH POUSHA, 1941\nCr1.MC.No.9084 OF 2019(E)\nAGAINST THE ORDER/JUDGMENT IN CRMC 2522/2019 OF DISTRICT\nCOURT & SESSIONS COURT, ERNAKULAM\nAGAINST THE ORDER/JUDGMENT IN CMP 1406/2019 OF TEMPORARY\nJUDL. FIRST CLASS MAGISTRATE COURT, NJARAKKAL\nCRIME NO.1468/2019 OF Narakkal Police Station , Ernakulam\nPETITIONER/ACCUSED:\nSABU C.S., AGED 35 YEARS\nS/O.SANTHOSH, CHATTHANATT HOUSE,\nNARAKKAL.P.O., ERNAKULAM-682505.\nBY ADVS.\nSRI .PRAVEEN .H.\nSRI.G.HARTHARAN\nSMT .K.S.SMITHA\nSMT .T.T.SHANIBA\nSRI.M.V.VIPINDAS\nD.AMALDEV\nRESPONDENT/STATE AND COMPLAINANT:\n1 STATE OF KERALA,\nREPRESENTED BY THE PUBLIC PROSECUTOR,\nHIGH COURT OF KERALA, ERNAKULAM-682031.\n2 SUB INSPECTOR OF POLICE,\nNARAKKAL POLICE STATION, ERNAKULAM-682505.\nBY SPECIAL PUBLIC PROSECUTOR\nSRI. SANTHOSH PETER\nTHIS CRIMINAL MISC. CASE HAVING COME UP FOR\nADMISSION ON 07.01.2020, THE COURT ON THE SAME DAY PASSED\nTHE FOLLOWING:\n\na\n2020/KER/586\nCrl.M.C. No. 9084 of 2019\nCri.M.C. No. 9084 of 2019\nORDER\nThe petitioner is the sole accused in Crime No. 1468\nof 2019 of Njarakkal Police Station registered under Sections\n366A and 370 of the Indian Penal Code. He was arrested and\nenlarged on regular bail by the Sessions Court in terms of\nAnnexure A3 order dated 30.11.2019. In the course of\ninvestigation, the following articles were recovered from the\npetitioner:\n1. VW POLO 1.2 CR Car having Engine No.CFW151011,\nChasis No. WVWF11609BT072529 and registration\nNo. KL-O7-BT-5843 along with original certificate of\nregistration, insurance and tax tokens.\n2. Space Black colour Redmi Note 7 Pro mobile Phone\nIME] bearing no.861934048975294 and\n861934048975302.\n3. Kerala State Driving License having\n\na\n2020/KER/586\nCrl.M.C. No. 9084 of 2019\nno.42/4969/2002\n4. Two number of 500 currencies\n5. Four number of 200 currencies\n6. Twenty two number of 100 currencies\n7. Thirty two number of 50 currencies\nAfter being released on bail, the petitioner moved an\napplication under Section 451 of the Code of Criminal\nProcedure for release of the aforesaid articles. The said\napplication was rejected by the jurisdictional Magistrate in\nterms of Annexure Al order. Annexure Al order is under\nchallenge in this Crl.M.C.\n\n2. Heard the learned counsel for the petitioner as\nalso the learned Public Prosecutor.\n\n3. At the time of hearing, the learned counsel for\nthe petitioner only pressed for release of the vehicle, mobile\nphone and his driving licence, recovered from the petitioner.\nThe learned Public Prosecutor submitted that the said articles\ncan be ordered to be released subject to appropriate\nconditions.\n\nes, sl\nsoul\nops\n2020/KER/586\nCrl.M.C. No. 9084 of 2019\n4.\n\nIn the circumstances, the Crl.M.C. is disposed of\ndirecting the jurisdictional Magistrate to issue orders for\nrelease of the vehicle, mobile phone and driving licence\nrecovered from the petitioner, imposing appropriate conditions.\n\nSd/-\nP.B.SURESH KUMAR\nJUDGE\nds 07.01.2020\n\nFen a\noe\nBer\n2020/KER/586\nCrl.M.C. No. 9084 of 2019\nOe.\nAPPENDIX\nPETITIONER'S/S EXHIBITS:\nANNEXURE Al CERTIFIED COPY OF THE ORDER DATED\n13.12.2019 PASSED IN CMP.NO.1406/2019\nIN CRIME NO.1468/2019 (NARAKKAL POLICE\nSTATION) BY THE JUDICIAL FIRST CLASS\nMAGISTRATE COURT, NARAKKAL.\nANNEXURE A2 A TRUE COPY OF THE FIR IN CRIME\nNO.1468/2019 OF NARAKKAL POLICE\nSTATION.\nANNEXURE A3 A TRUE COPY OF THE ORDER IN\nCRL.M.C.NO.2522/2019 PASSED BY THE\nHON'BLE DISTRICT AND SESSIONS COURT,\nERNARKULAM .\nANNEXURE A4 A TRUE COPY OF THE PETITION FILED BY\nTHE PETITIONER.\nANNEXURE A5 A TRUE COPY OF THE OBJECTION FILED BY\nTHE 2ND RESPONDENT TO ANNEXURE A3.\nANNEXURE A6 A TRUE COPY OF THE REGISTRATION\nDETAILS OF VEHICLE NO.KLO7-BT-5843\nMAINTAINED IN THE WEBSITE OF THE MOTOR\nVEHICLES DEPARTMENT.\n\n"
}