{
    "case_id": "",
    "court": "HIGH COURT OF KERALA AT ERNAKULAM",
    "date": "8TH DAY OF JANUARY 2018",
    "judge": "B.KEMAL PASHA\nMONDAY",
    "petitioners": [
        "ACCUSED:",
        "DR. P.S. THAHA,",
        "AGED 65 YEARS, S/O LATE SHAHUL HAMEED,",
        "DIRECTOR,",
        "PMS COLLEGE OF DENTAL SCIENCE AND RESEARCH,",
        "VATTAPPARA, GOLDEN HILLS, VENKOD P.O.,",
        "THIRUVANANTHAPURAM DISTRICT, PIN-695028."
    ],
    "respondents": [
        "S/COMPLAINANT AND THE STATE:",
        "1. THE ASSISTANT LABOUR OFFICER,",
        "NEDUMANGAD , NEDUMANGAD P.O,",
        "THIRUVANANTHPARAM DISTRICT,",
        "PIN-695541.",
        "2. STATE OF KERALA,",
        "REPRESENTED BY THE PUBLIC PROSECUTOR,",
        "HIGH COURT OF KERALA,",
        "ERNAKULAM, PIN-682031."
    ],
    "sections": [],
    "outcome": "",
    "full_text": "Eek: Ze40]|\nna ttre\nere\noe eaten\nDslseatiete\nIN THE HIGH COURT OF KERALA AT ERNAKULAM 2018/KER/703\nPRESENT:\nTHE HONOURABLE MR. JUSTICE B.KEMAL PASHA\nMONDAY, THE 8TH DAY OF JANUARY 2018 / 18TH POUSHA, 1939\nCr1.MC.No. 3347 of 2016\nST 2943/2015 of JUDICIAL FIRST CLASS MAGISTRATE COURT-I,NEDUMANGAD\nPETITIONER/ACCUSED:\nDR. P.S. THAHA,\nAGED 65 YEARS, S/O LATE SHAHUL HAMEED,\nDIRECTOR,\nPMS COLLEGE OF DENTAL SCIENCE AND RESEARCH,\nVATTAPPARA, GOLDEN HILLS, VENKOD P.O.,\nTHIRUVANANTHAPURAM DISTRICT, PIN-695028.\nBY ADVS.SRI.C.S.MANU\nSRI.S.K.PREMRAJ\nRESPONDENTS/COMPLAINANT AND THE STATE:\n1. THE ASSISTANT LABOUR OFFICER,\nNEDUMANGAD , NEDUMANGAD P.O,\nTHIRUVANANTHPARAM DISTRICT,\nPIN-695541.\n2. STATE OF KERALA,\nREPRESENTED BY THE PUBLIC PROSECUTOR,\nHIGH COURT OF KERALA,\nERNAKULAM, PIN-682031.\nBY PUBLIC PROSECUTOR SRI.ALEX M. THOMBRA\nTHIS CRIMINAL MISC. CASE HAVING COME UP FOR ADMISSION ON 08-01-2018,\nTHE COURT ON THE SAME DAY PASSED THE FOLLOWING:\nEL\n\nPRS al\nSe aT\nanes\noe nari\n2018/KER/703\nCr1.MC.No. 3347 of 2016\nAPPENDIX\nPETITIONER (S)' ANNEXURES\nANNEXURE A-1 TRUE COPY OF THE COMPLAINT DATED 5-11-2015 FILED\nBY THE 1ST RESPONDENT\nANNEXURE A-2 TRUE COPY OF THE REPLY DATED 25-5-2015 FILED BY\nTHE 1ST RESPONDENT\nANNEXURE A-3 TRUE COPY OF THE SHOW CAUSE NOTICE DATED\n14-10-2015 ISSUED BY THE 1ST RESPONDENT TO THE\nPETITIONER\nANNEXURE A-4 TRUE COPY OF THE NOTICE DATED 21-10-2015 ISSUED\nBY THE 1ST RESPONDENT TO THE PETITIONER\nANNEXURE A-5 TRUE COPY OF THE STATEMENT OF OBJECTIONS DATED\n10-12-2015 EXCLUDING THE ANNEXURES THEREIN\nSUBMITTED BY THE PETITIONER TO THE 18ST\nRESPONDENT\nANNEXURE A~-6 TRUE COPY OF ORDER BEARING G.O. (MS) .135/2013/LABOUR DATED\n5.11.2013 ISSUED BY THE GOVERNMENT OF KERALA\nANNEXURE A-7 TRUE COPY OF AGREEMENT DATED 1.1.2005 ENTERED INTO BY AND\nBETWEEN PMS COLLAGE AND DENTAL SCIENCE AND RESEARCH AND SREE\nUTHRADAM THIRUNAL RURAL GENERAL HOSPITAL\nANNEXURE A-8 TRUE COPY OF THE CERTIFICATE BEARING NO.D5-187/2006 DATED\n10.4.2006 ISSUED BY THE EXECUTIVE ENGINEER, PWD BUILDINGS\nDIVISION, THIRUVANANTHAPURAM\nRESPONDENT (S)' ANNEXURE\nNIL\nTRUE COPY\nP.S. TO JUDGE\nEL\n\nPE\napo\n2018/KER/703\nB. KEMAL PASHA. , J\n~ Crl.M.C.No.3347 of 2016 -\n\"Dated this the 8\" day of January, 2018\nORDER\n\nThe petitioner is proceeded against for violation\nof the provisions of the Minimum Wages Act, 1948.\nAccording to the petitioner, the private educational\ninstitution is not covered by the provisions of the said Act.\n\n2. The learned Public Prosecutor has invited\nthe attention of this court to the notification SRO\n612/2011 dated 12.09.2011 whereby the Government has\nnotified all the non-teaching staff of private educational\ninstitutions as persons covered by the said Act. Matters\nbeing so, this Crl.M.C is not maintainable and is only to be\ndismissed, and | do so.\n\nIn the result, this Crl.M.C is dismissed.\nRegarding the other contentions taken up by the\npetitioner, those contentions can be taken up by the\npetitioner before the court below. As far as practicable,\n\nape\n\n2018/KER/703\n\nCrI.M.C.No.3347 of 2016\n-2-\nthe court below shall grant exemption to the petitioner from\npersonal appearance.\nSd/-\nB. KEMAL PASHA\nJUDGE\n\nbng\n\n"
}