{
    "case_id": "",
    "court": "HIGH COURT OF KERALA AT ERNAKULAM\nPRESENT",
    "date": "12TH DAY OF JANUARY 2017",
    "judge": "SUNIL THOMAS\nTHURSDAY",
    "petitioners": [
        "(S) /ACCUSED NO.5:",
        "SUMESH, AGED 33 YEARS,",
        "S/O.SUKUMARAN,",
        "ARAYI, VATTATHODU,",
        "HOSDURG VILLAGE,",
        "KANHANGAD SOUTH P.O.,",
        "HOSDURG TALUK."
    ],
    "respondents": [
        "(S) /STATE:",
        "STATE OF KERALA,",
        "REPRESENTED BY PUBLIC PROSECUTOR,",
        "HIGH COURT OF KERALA,",
        "ERNAKULAM 682 031."
    ],
    "sections": [
        "143",
        "147",
        "148",
        "324",
        "427",
        "436",
        "448 read with 149\nof IPC"
    ],
    "outcome": "",
    "full_text": "2s ae\nEi te Pe\nBeasts\n2017/KER/1792\nIN THE HIGH COURT OF KERALA AT ERNAKULAM\nPRESENT:\nTHE HONOURABLE MR. JUSTICE SUNIL THOMAS\nTHURSDAY, THE 12TH DAY OF JANUARY 2017/22ND POUSHA, 1938\nCr1.MC.No. 257 of 2017 ()\nAGAINST THE ORDER/JUDGMENT IN CP 94/2016 of J.M.F.C.-1I, HOSDURG\nCRIME NO. 1206/2014 OF HOSDURG POLICE STATION, KASARGOD\nPETITIONER (S) /ACCUSED NO.5:\nSUMESH, AGED 33 YEARS,\nS/O.SUKUMARAN,\nARAYI, VATTATHODU,\nHOSDURG VILLAGE,\nKANHANGAD SOUTH P.O.,\nHOSDURG TALUK.\nBY ADV. SRI.A.ARUNKUMAR\nRESPONDENT (S) /STATE:\nSTATE OF KERALA,\nREPRESENTED BY PUBLIC PROSECUTOR,\nHIGH COURT OF KERALA,\nERNAKULAM 682 031.\nBY PUBLIC PROSECUTOR SRI.AMJAD ALI\nTHIS CRIMINAL MISC. CASE HAVING COME UP FOR ADMISSION ON\n12-01-2017, THE COURT ON THE SAME DAY PASSED THE FOLLOWING:\nPn\n\nBee\n2017/KER/1792\nSUNIL THOMAS, J.\nDated this the 12\" day of January, 2017\nORDER\n\nThe petitioner herein is the 5‚Äù accused in Crime\nNo.1206/2014 of Hosdurg Police Station for offences punishable\nunder Sections 143, 147, 148, 324, 427, 436, 448 read with 149\nof IPC. After investigation final report was laid and the matter is\nnow pending as C.P.No.94/2016 of Judicial First Class Magistrate\nCourt - 1, Hosdurg.\n\n2. Learned counsel for the petitioner submitted that, the\npetitioner was abroad and hence he could not participate in the\nproceedings. Now having came to know about the proceedings,\nhe offers to surrender before the court below and to submit\nhimself to the jurisdiction. His only apprehension is that, he may\nbe detained and his bail application is not likely to be taken up on\nthe same day.\n\n3. Having considered the above prayer and hearing both\nsides, | am satisfied that the grievance of the petitioner herein is\nsustainable. Hence, the Crl.M.C. is disposed of with a direction\nthat, in the event of the petitioner herein surrendering before the\ncourt below within 2 weeks from today and filing an application\n\nBue zal\npease\n2017/KER/1792\nCri. M. C. No. 257 of 2017 2\nfor bail, the court below shall take up the bail application on the\nSame day and pass appropriate orders in accordance with law.\nThe warrant, if any, issued by the court below, will be kept in\nabeyance till the actual date of his appearance within the above\nstipulated time.\nSd/-\nSUNIL THOMAS, JUDGE.\n/true copy/\nP. A. to Judge\nPn\n\n"
}