{
    "case_id": "",
    "court": "HIGH COURT OF KERALA AT ERNAKULAM\nPRESENT",
    "date": "2ND DAY OF JANUARY 2014",
    "judge": "HARUN-UL-RASHID\nTHURSDAY",
    "petitioners": [
        "/ACCUSED 1 TO 7:",
        "1. M. BAKIR,",
        "$/O.ABOOBACKER, PANAYAM PURATH HOUSE,",
        "PERMUGHAM P.O., FEROKE - KOZHIKODE - 673 631",
        "2. ABDUL SALEEM T.P.,",
        "$/O.MOYIN, THIYATHU HOUSE",
        "PERMUGHAM P.O., FEROKE - KOZHIKODE - 673 631",
        "3. ABDUL GAFOOR M,",
        "$/O.MUHAMMED KUTTY, VALIYA PARAMB HOUSE",
        "PERMUGHAM P.O., FEROKE - KOZHIKODE - 673 631",
        "4. ABDUL KAREEM A,",
        "$/O.MOIDEEN KOYA, KODIYATHU PARA HOUSE, PERMUGHAM P.O.",
        "FEROKE - KOZHIKODE - 673 631",
        "5. SHIHABUDHEEN K,",
        "S/O. ABOOBACKER, KUNIYANCHERI HOUSE",
        "PERMUGHAM P.O., FEROKE - KOZHIKODE - 673 631",
        "6. MUHAMMED RAFEEQO K,",
        "$/O.MUHAMMED, VALIYAPARAMBIL HOUSE, PERMUGHAM P.O.",
        "FEROKE - KOZHIKODE - 673 631",
        "7. j\\ABDUL AZEEZ K.T",
        "S/O.MUHAMMED KUTTY, KARAMARUTHIYIL HOUSE",
        "PERMUGHAM P.O., FEROKE - KOZHIKODE - 673 631"
    ],
    "respondents": [
        "S/STATE:",
        "1. STATE OF KERALA",
        "REPRESENTED BY THE PUBLIC PROSECUTOR",
        "HIGH COURT OF KERALA",
        "ERNAKULAM - 682 031. (IN CRIME NO.168/12 OF",
        "FEROKE POLICE STATION IN KOZHIKODE DISTRICT)",
        "2. MUJEEB T.K, AGED 36 YEARS",
        "S/O.MOIDEEN KUTTY, KOTTUVAYAL, KALLAPARA P.O -673 631",
        "FEROKE, KOZHIKODE DISTRICT.",
        "R1 BY PUBLIC PROSECUTOR SMT.SAREENA GEORGE",
        "R2 BY ADV. SRI.A.V.ANVAR"
    ],
    "sections": [
        "341",
        "323",
        "324 read with Section 34 of IPC"
    ],
    "outcome": "",
    "full_text": "Plea earl\nhoe ane\nBeans\n2014/KER/207\nIN THE HIGH COURT OF KERALA AT ERNAKULAM\nPRESENT:\nTHE HONOURABLE MR.JUSTICE HARUN-UL-RASHID\nTHURSDAY, THE 2ND DAY OF JANUARY 2014/12TH POUSHA, 1935\nCr1.MC.No. 19 of 2014 ()\nAGAINST THE ORDER/JUDGMENT IN CC 575/2013 of J.M.F.C. - VI, KOZHIKODE\nCRIME NO. 168/2012 OF FEROKE POLICE STATION, KOZHIKODE\nPETITIONER(S) /ACCUSED 1 TO 7:\n1. M. BAKIR,\n$/O.ABOOBACKER, PANAYAM PURATH HOUSE,\nPERMUGHAM P.O., FEROKE - KOZHIKODE - 673 631\n2. ABDUL SALEEM T.P.,\n$/O.MOYIN, THIYATHU HOUSE\nPERMUGHAM P.O., FEROKE - KOZHIKODE - 673 631\n3. ABDUL GAFOOR M,\n$/O.MUHAMMED KUTTY, VALIYA PARAMB HOUSE\nPERMUGHAM P.O., FEROKE - KOZHIKODE - 673 631\n4. ABDUL KAREEM A,\n$/O.MOIDEEN KOYA, KODIYATHU PARA HOUSE, PERMUGHAM P.O.\nFEROKE - KOZHIKODE - 673 631\n5. SHIHABUDHEEN K,\nS/O. ABOOBACKER, KUNIYANCHERI HOUSE\nPERMUGHAM P.O., FEROKE - KOZHIKODE - 673 631\n6. MUHAMMED RAFEEQO K,\n$/O.MUHAMMED, VALIYAPARAMBIL HOUSE, PERMUGHAM P.O.\nFEROKE - KOZHIKODE - 673 631\n7. j\\ABDUL AZEEZ K.T\nS/O.MUHAMMED KUTTY, KARAMARUTHIYIL HOUSE\nPERMUGHAM P.O., FEROKE - KOZHIKODE - 673 631\nBY ADV. SRI.P.SAMSUDIN\n\nPLease\nie cre\nleer\n2014/KER/207\nCr1.MC.No. 19 of 2014 ()\nCOMPLAINANT (S) /RESPONDENTS/STATE:\n1. STATE OF KERALA\nREPRESENTED BY THE PUBLIC PROSECUTOR\nHIGH COURT OF KERALA\nERNAKULAM - 682 031. (IN CRIME NO.168/12 OF\nFEROKE POLICE STATION IN KOZHIKODE DISTRICT)\n2. MUJEEB T.K, AGED 36 YEARS\nS/O.MOIDEEN KUTTY, KOTTUVAYAL, KALLAPARA P.O -673 631\nFEROKE, KOZHIKODE DISTRICT.\nR1 BY PUBLIC PROSECUTOR SMT.SAREENA GEORGE\nR2 BY ADV. SRI.A.V.ANVAR\nTHIS CRIMINAL MISC. CASE HAVING COME UP FOR ADMISSION ON\n02-01-2014, THE COURT ON THE SAME DAY PASSED THE FOLLOWING:\n\nPlier ss El\nie cre\nBae\n2014/KER/207\nCr1.MC.No. 19 of 2014 ()\nAPPENDIX\nPETITIONER(S)' EXHIBITS\nANNEXURE-A1: TRUE COPY OF THE FIR, FIS, FINAL REPORT AND CHARGE\nSHEET IN CRIME NO.168/2012 OF FEROKE POLICE\nSTATION.\nANNEXURE-A2: TRUE COPY OF THE AFFIDAVIT SWORN IN BY THE 2ND\nRESPONDENT\nRESPONDENT (S)' EXHIBITS : NIL\n/TRUE COPY/\nP. A. TO JUDGE\nPn\n\nHARUN-UL-RASHID, J. NLD\nDated this the 2 day of January, 2014\nORDER\n\nHeard the learned counsel for the petitioners and respondents.\n\n2. Accused Nos.1 to 7 in Crime No.168/2012 of the Feroke\nPolice Station now pending as C.C.No.575/2013 before the Judicial\nFirst Class Magistrate Court-VI, Kozhikode are the petitioners. The\npetition is filed seeking to quash further proceedings against the\npetitioners in C.C.No.575/2013 on the file of the Judicial First Class\nMagistrate Court-Vl, Kozhikode.\n\n3. The offences alleged are punishable under Sections 341,\n323, 324 read with Section 34 of IPC.\n\n4. The learned counsel on both sides submit that the dispute\nbetween the parties have been amicably settled and having regard\nto the resolution of the disputes between the parties, continuance of\nthe criminal prosecution against the petitioners is an avoidable\nirritant.\n\nIn view of the settlement arrived at between the parties, the\nCril.M.C is disposed of quashing further proceedings against the\npetitioners in C.C.No.575/2013 on the file of the Judicial First Class\nMagistrate Court-VI, Kozhikode.\n\nSd/-\nHARUN-UL-RASHID, JUDGE.\nAV\n\n"
}