{
    "case_id": "",
    "court": "HIGH COURT OF KERALA AT ERNAKULAM",
    "date": "8TH DAY OF JANUARY 2018",
    "judge": "B.KEMAL PASHA\nMONDAY",
    "petitioners": [
        "ACCUSED NO.5",
        "JITH JOY,AGED 33 YEARS,",
        "S/O.JOY EANTHUNKAL HOUSE ,MULAPPURAM KARA,",
        "KARIMANNOOR VILLAGE , KARIMANNOOR.P.O,PIN: 685581,",
        "IDUKKI DISTRICT."
    ],
    "respondents": [
        "S /COMPLAINANT :",
        "1. STATE OF KERALA,",
        "REPRESENTED BY PUBLIC PROSECUTOR,",
        "HIGH COURT OF KERALA,ERNAKULAM.",
        "2. THE CIRCLE INSPECTOR OF POLICE,",
        "MUVATTUPUZHA.",
        "Ril & R2 BY PUBLIC PROSECUTOR SRI.B.JAYASURYA"
    ],
    "sections": [],
    "outcome": "",
    "full_text": "pees\nA at\nrae\nElSaee\nIN THE HIGH COURT OF KERALA AT ERNAKULAM 2018/KER/719\nPRESENT:\nTHE HONOURABLE MR. JUSTICE B.KEMAL PASHA\nMONDAY, THE 8TH DAY OF JANUARY 2018 / 18TH POUSHA, 1939\nCr1.MC.No. 7454 of 2016\nCMP 1064/2016 AND CMP 1065/2016 of JUDICIAL FIRST CLASS MAGISTRATE\nCOURT-I, MUVATUPUZHA\nCRIME NO. 941/2016 OF VAZHAKULAM POLICE STATION,\nERNAKULAM RURAL\nPETITIONER/ACCUSED NO.5\nJITH JOY,AGED 33 YEARS,\nS/O.JOY EANTHUNKAL HOUSE ,MULAPPURAM KARA,\nKARIMANNOOR VILLAGE , KARIMANNOOR.P.O,PIN: 685581,\nIDUKKI DISTRICT.\nBY ADVS.SRI.P.FAZIL\nSRI.A.C.THOMAS ADHIKARAM\nSMT .JAYASREE MANOJ\nSRI.SAJU THALIATH\nSRI.SONNYMON K. MATHEW\nRESPONDENTS /COMPLAINANT :\n1. STATE OF KERALA,\nREPRESENTED BY PUBLIC PROSECUTOR,\nHIGH COURT OF KERALA,ERNAKULAM.\n2. THE CIRCLE INSPECTOR OF POLICE,\nMUVATTUPUZHA.\nRil & R2 BY PUBLIC PROSECUTOR SRI.B.JAYASURYA\nTHIS CRIMINAL MISC. CASE HAVING COME UP FOR ADMISSION\nON 08-01-2018,THE COURT ON THE SAME DAY PASSED THE\nFOLLOWING:\nbp\n\napeaia\n2018/KER/719\nB. KEMAL PASHA, J.\nCrl.M.C.No.7454 of 2016\nDated this the 8\" day of January, 2018\nORDER\nLearned counsel for the petitioner seeks\npermission to withdraw the Crl.M.C. Permission is granted.\nAccordingly, this Crl.M.C. is dismissed as withdrawn, with\nliberty to move other Crl.M.C., if so advised, at\nappropriate stage.\nSd/-\nB. KEMAL PASHA\nJUDGE\nbng\n\n"
}