{
    "case_id": "",
    "court": "HIGH COURT OF KERALA AT ERNAKULAM\nPRESENT",
    "date": "8TH DAY OF JANUARY 2015",
    "judge": "B.KEMAL PASHA\nTHURSDAY",
    "petitioners": [
        ":",
        "ARATHI GANDHI",
        "D/O.PRASAD GANDHI, PRASADAM TC 41/448(3), CHAKKAI",
        "ANAYARA P.O, THIRUVANANTHAPURAM 695 003"
    ],
    "respondents": [
        "S :",
        "1. THE STATE OF KERALA",
        "REPRESENTED BY THE PUBLIC PROSECUTOR,",
        "HIGHC OURT OF KERALA AT ERNAKULAM, PIN 682 031",
        "2. ADDITIONAL SUB INSPECTOR OF POLICE",
        "VARKALA POLICE STATION, VARKALA 695 011",
        "3. CHIEF MANAGER",
        "STATE BANK OF TRAVANCORE, VARKALA BRANCH 695 011",
        "4, LARA RAVEENDRAN, AGED 33 YEARS,",
        "$/O.RAVEENDRAN, K.P.PMANDIRAM, KURAKKANNI,",
        "VARKALA, THIRUVANANTHAPURAM 695 141",
        "5, C.LALITHA RAVEENDRAN,",
        "K.P.P MANDIRAM, KURAKKANNI, VARKALA,",
        "THIRUVANANTHAPURAM 695 141",
        "6. LOVELY RAVEENDRAN,",
        "K.P.P MANDIRAM, KURAKKANNI, VARKALA,",
        "THIRUVANANTHAPURAM 695 141",
        "7. RAVEENDRAN",
        "K.P.P MANDIRAM, KURAKKANNI, VARKALA",
        "THIRUVANANTHAPURAM 695 141.",
        "R1 & R2 BY PUBLIC PROSECUTORSRI. JIBU P. THOMAS",
        "R3 BY ADV. SRI.R.S.KALKURA, SC, SBT",
        "R4 BY ADV. SRI.T.K.ANANDA KRISHNAN"
    ],
    "sections": [
        "482 Cr"
    ],
    "outcome": "",
    "full_text": "Blea\na ay aan\nBeene\n2015/KER/794\nIN THE HIGH COURT OF KERALA AT ERNAKULAM\nPRESENT:\n\nTHE HONOURABLE MR. JUSTICE B.KEMAL PASHA\nTHURSDAY, THE 8TH DAY OF JANUARY 2015/18TH POUSHA, 1936\nCri.MC.No. 3838 of 2014 ()\n\nMC 234/2013 of JUDICIAL FIRST CLASS MAGISTRATE COURT I, VARKALA\n\nPETITIONER :\nARATHI GANDHI\nD/O.PRASAD GANDHI, PRASADAM TC 41/448(3), CHAKKAI\nANAYARA P.O, THIRUVANANTHAPURAM 695 003\nBY ADV. SRILVAKKOM N.VIJAYAN\nRESPONDENTS :\n1. THE STATE OF KERALA\nREPRESENTED BY THE PUBLIC PROSECUTOR,\nHIGHC OURT OF KERALA AT ERNAKULAM, PIN 682 031\n2. ADDITIONAL SUB INSPECTOR OF POLICE\nVARKALA POLICE STATION, VARKALA 695 011\n3. CHIEF MANAGER\nSTATE BANK OF TRAVANCORE, VARKALA BRANCH 695 011\n4, LARA RAVEENDRAN, AGED 33 YEARS,\n$/O.RAVEENDRAN, K.P.PMANDIRAM, KURAKKANNI,\nVARKALA, THIRUVANANTHAPURAM 695 141\n5, C.LALITHA RAVEENDRAN,\nK.P.P MANDIRAM, KURAKKANNI, VARKALA,\nTHIRUVANANTHAPURAM 695 141\n6. LOVELY RAVEENDRAN,\nK.P.P MANDIRAM, KURAKKANNI, VARKALA,\nTHIRUVANANTHAPURAM 695 141\n7. RAVEENDRAN\nK.P.P MANDIRAM, KURAKKANNI, VARKALA\nTHIRUVANANTHAPURAM 695 141.\nR1 & R2 BY PUBLIC PROSECUTORSRI. JIBU P. THOMAS\nR3 BY ADV. SRI.R.S.KALKURA, SC, SBT\nR4 BY ADV. SRI.T.K.ANANDA KRISHNAN\nTHIS CRIMINAL MISC. CASE HAVING BEEN FINALLY HEARD\nON 08-01-2015, THE COURT ON THE SAME DAY PASSED THE\nFOLLOWING:\nbp\n\nBlea\na ay aan\nBeene\n2015/KER/794\nCri.MC.No. 3838 of 2014 ()\nAPPENDIX\nPETITIONER'S ANNEXURES :\nANNEXURE A: COPY OF THE REQUISITION ISSUED BYTHE R2 TO THE R3.\nANNEXURE B: COPY OF THE INTIMATION DT 20/12/2012 ISSUED BY THE R3\nTO THE R4.\nANNEXURE C: COPY OF THE INTIMATION DT 20/12/2012 ISSUED BY THE R3\nTO THE R5.\nANNEXURE D: COPY OF THE INTIMATION DT 20/12/2012 ISSUED BY THE R3\nTO THE R7.\nANNEXURE E: COPY OF THE BAIL APPLICATION NO. 725/2013 FILED BEFORE THIS\nHON'BLE COURT.\nANNEXURE F: COPY OF THE MC NO. 234/2012 FILED BY THE PETITIONER BEFORE\nJUDICIAL FIRST CLASS MAGISTRATE COURT - I.\nANNEXURE G: COPY OF THE ORDER DT 20/3/2014 PASSED IN CRL.MC 1602/2014 BY\nTHIS HON'BLE COURT.\nRESPONDENT'S ANNEXURES : NIL.\nHTRUE COPY!!\nP.S. TO JUDGE\nbp\n\n2015/KER/794\nB.KEMAL PASHA, J.\nee ee\nORDER\n\nThe petitioner in M.C.234/2013 on the file of the\nJudicial First Class Magistrate's Court-l, Varkala has come\nup with the present Crl.M.C. under Section 482 Cr.PC.\nseeking a direction to the Judicial First Class Magistrate's\nCourt-l, Varkala to issue necessary directions to ensure that\nhow much gold ornaments of the petitioner are kept in the\nJoint Locker No.514 at the State Bank of Travancore,\nVarkala and also to ensure that an amount of %50,000/- has\nbeen deposited in the Account No.67152095505 of the State\nBank of Travancore, Varkala.\n\n2. Heard all the parties. Much discussion is not\nrequired to conclude that the present prayer is liable to be\n\nBeene\n2015/KER/794\nCRL.M.C.No.3838 of 2014\n= 2%\ngranted. Hence, this Crl.M.C. is only to be allowed.\nIn the result, this Crl.M.C. is allowed and the Judicial\nFirst Class Magistrate Court-l, Varkala is directed to issue\nnecessary directions to ensure that how much _ gold\nornaments of the petitioner are kept in the Joint Locker\nNo.514 and also to ensure that %50,000/- has been\ndeposited in the Account No.67152095505 of SBT, Varkala.\nSd/- B.KEMAL PASHA, JUDGE\nul/-\n[True copy] PS. to Judge\n\n"
}