{
    "case_id": "",
    "court": "HIGH COURT OF KERALA AT ERNAKULAM\nPRESENT",
    "date": "1ST DAY OF JUNE 2016",
    "judge": "RAJA VIJAYARAGHAVAN V\nWEDNESDAY",
    "petitioners": [
        "SOLE ACCUSED:",
        "REV. SANTHOSH P.CCHACKO, AGED 49 YEARS,",
        "$/O.P.M.CHACKO, RESIDING AT PALLITHAZHE HOUSE,",
        "ANIKKAD WEST.P.0O.,KOTTAYAM."
    ],
    "respondents": [
        "COMPLAINANT/STATE:",
        "STATE OF KERALA,",
        "REPRESENTED BY THE SUB-INSPECTOR OF POLICE,",
        "RANNI POLICE STATION, PATHANAMTHITTA DISTRICT-689 672,",
        "THROUGH PUBLIC PROSECUTOR,",
        "HIGH COURT OF KERALA AT ERNAKULAM.",
        "*ADDL.R2 IMPLEADED",
        "*ADDL.R2: LISSY PHILIP, W/O.LATE THOMAS PHILIP,",
        "MARAMKOLLIL(H), KAPIKULAM(P.O.), MOTHIRAVAYAL,",
        "PAZHAVANGADI VILLAGE, PIN-670 644",
        "*IS IMPLEADED AS ADDL.RS AS PER ORDER DATED 18/12/2015 IN",
        "CRL.M.A.NO.11799/15 IN CRL.MC.NO.5922/2015.",
        "R1 BY PUBLIC PROSECUTOR SMT. SAREENA GEORGE"
    ],
    "sections": [],
    "outcome": "",
    "full_text": "Bee hl\nae tA\n2016/KER/23870\nIN THE HIGH COURT OF KERALA AT ERNAKULAM\nPRESENT:\nTHE HONOURABLE MR. JUSTICE RAJA VIJAYARAGHAVAN V\nWEDNESDAY, THE 1ST DAY OF JUNE 2016/11TH JYAISHTA, 1938\nCri.MC.No. 5922 of 2015 ()\nCRIME NO. 880/2013 OF RANNI POLICE STATION , PATHANAMTHITTA DISTRICT\nC.C.NO.1441/2013 OF JUDICIAL FIRST CLASS MAGISTRATE COURT, RANNI\nPETITIONER/SOLE ACCUSED:\nREV. SANTHOSH P.CCHACKO, AGED 49 YEARS,\n$/O.P.M.CHACKO, RESIDING AT PALLITHAZHE HOUSE,\nANIKKAD WEST.P.0O.,KOTTAYAM.\nBY ADVS.SRI.M.V.THAMBAN\nSRI.R.REJI\nRESPONDENT(S)/COMPLAINANT/STATE:\nSTATE OF KERALA,\nREPRESENTED BY THE SUB-INSPECTOR OF POLICE,\nRANNI POLICE STATION, PATHANAMTHITTA DISTRICT-689 672,\nTHROUGH PUBLIC PROSECUTOR,\nHIGH COURT OF KERALA AT ERNAKULAM.\n*ADDL.R2 IMPLEADED\n*ADDL.R2: LISSY PHILIP, W/O.LATE THOMAS PHILIP,\nMARAMKOLLIL(H), KAPIKULAM(P.O.), MOTHIRAVAYAL,\nPAZHAVANGADI VILLAGE, PIN-670 644\n*IS IMPLEADED AS ADDL.RS AS PER ORDER DATED 18/12/2015 IN\nCRL.M.A.NO.11799/15 IN CRL.MC.NO.5922/2015.\nR1 BY PUBLIC PROSECUTOR SMT. SAREENA GEORGE\nTHIS CRIMINAL MISC. CASE HAVING COME UP FOR ADMISSION\nON 01-06-2016, THE COURT ON THE SAME DAY PASSED THE FOLLOWING:\nsts\n\nBee hl\nae tA\nsas\n2016/KER/23870\nCri.MC.No. 5922 of 2015 ()\nAPPENDIX\nPETITIONER(S)' ANNEXURES:\nANNEX At- THE TRUE COPY OF THE ORDER DATED 04.10.2013 IN\nB.A.NO.6253/2013 OF HIGH COURT OF KERALA.\nANNEX A2- THE COPY OF THE EMERGENCY ISSUED BY INDIAN CONSULATE, USA\nDATED 05.08.14.\nANNEX A3- THE CERTIFIED COPY OF THE ORDER DATED 13.08.2015 IN\nCRL.M.P.NO.7093/2015 IN C.C.NO.1441/2013 OF JUDICIAL FIRST CLASS\nMAGISTRATE COURT, RANNI.\nANNEUX A4- THE TRUE PHOTOCOPY OF THE PROMISSORY NOTE DATED\n15.02.2013.\nRESPONDENT(S)â€™ ANNEXURES: NIL\nITRUE COPY/\nP.A.TO JUDGE\nsts\n\nBeer\nBisset\n2016/KER/23870\nB.KEMAL PASHA, J.\nene eee\nORDER\nNo representation for the petitioner. This Crl.M.C. is\ndismissed for default.\nSd/- B.KEMAL PASHA, JUDGE\nul/-\n[True copy] PS. to Judge\n\n"
}