{
    "case_id": "Crl.MC.No.5882 OF 2020",
    "court": "HIGH COURT OF KERALA AT ERNAKULAM",
    "date": "6TH DAY OF JANUARY 2021",
    "judge": "V.G.ARUN\nWEDNESDAY",
    "petitioners": [
        "ACCUSED NOS. 1,10,13,19 AND 26:"
    ],
    "respondents": [
        "STATE AND COMPLAINANT:"
    ],
    "sections": [],
    "outcome": "",
    "full_text": "BAU PF.\npees\nIN THE HIGH COURT OF KERALA AT ERNAKULAM 2021/KER/870\nPRESENT\nTHE HONOURABLE MR.JUSTICE V.G.ARUN\nWEDNESDAY, THE O6TH DAY OF JANUARY 2021 / 16TH POUSHA, 1942\nCrl1.MC.No.5882 OF 2020(E\nAGAINST THE ORDER IN SC 1143/2017 OF ASSISTANT SESSIONS COURT,\nKANNUR\nCRIME NO.1457/2011 OF Kannur Town , Kannur\nPETITIONER/ACCUSED NOS. 1,10,13,19 AND 26:\n\n1 AJESH P.,\nAGED 38 YEARS\nS/O.SHAILAJA, PUTHUSSERY HOUSE, KOOTHUPARAMB, KANNUR\nDISTRICT.\n\n2 RAHUL\nAGED 30 YEARS\nS/O.RAJAN, MUNICIPAL COLONY, THEKKE BAZAR, CIVIL\nSTATION, KANNUR.\n\n3 SHABIN K.C.\nAGED 32 YEARS\nS/O.BALAN, VANNANTE VALAPPIL, MAKERY AMSOM,\nMUNDALLOOR DESOM, KANNUR.\n\n4 RIYAS K.\nAGED 29 YEARS\nS/O.ABOOBACKER HAJI, KALLIAT, BLATHOOR, IRIKKOOR,\nKANNUR.\n\n5 KRIMNESH\nAGED 29 YEARS\nS/O.CHANDNI, NEAR ELAYAVOOR CO-OPERATIVE BANK,\nP.O.CHOVVA, KANNUR.\nBY ADV. SRI.K.I.SAGEER\n\nRESPONDENT/STATE AND COMPLAINANT:\n\n1 STATE OF KERALA,\nREPRESENTED BY ITS PUBLIC PROSECUTOR, HIGH COURT OF\nKERALA, ERNAKULAM - 682 031.\n\n2 STATION HOUSE OFFICER\nKANNUR TOWN POLICE STATION, (CRIME NO.1457/11) KANNUR\n- 670 001.\n\nPor ES\nBete\nCrl.MC.No.5882 OF 2020(R) 2... 2021/KER/870\nOTHER PRESENT:\nPP RENJITH T.R.\nTHIS CRIMINAL MISC. CASE HAVING COME UP FOR ADMISSION ON\n06.01.2021, THE COURT ON THE SAME DAY PASSED THE FOLLOWING:\n\nCr1.MC.No.5882 OF 2020(E) 3... 202 UKERIB70\nORDER\nDated this the 6th day of January 2021\nThe learned Counsel for the petitioners seeks\npermission to withdraw the Criminal M.C with liberty\nto move afresh. Accordingly, the Criminal M.C. is\ndismissed as withdrawn with the liberty sought.\nSd/-\nV.G.ARUN\nSB/06/01/2020 JUDGE\n//true copy// P.A to Judge\n\n"
}