{
    "case_id": "Crl.MC.No. 4917 of 2016",
    "court": "HIGH COURT OF KERALA AT ERNAKULAM\nPRESENT",
    "date": "4TH DAY OF AUGUST 2016",
    "judge": "RAJA VIJAYARAGHAVAN V\nTHURSDAY",
    "petitioners": [
        "(S) /ACCUSED :",
        "1. TONY BABU,",
        "AGED 21 YEARS, S/O.IGNATIOUS BABU,",
        "BHOMIKA HOUSE, POOLAKADAVU ROAD,",
        "VELLIMADKUNNU, MERIKUNNU P.O.,",
        "KOZHIKODE-673012.",
        "2. VISHAK.K,",
        "AGED 21 YEARS, S/O.VISHVANATHAN,",
        "KOTTADATH HOUSE, MEDICAL COLLEGE VIA,",
        "CHERUKULATHOOR P.O., KOZHIKODE-673008.",
        "3. AJITH KUMAR,",
        "AGED 19 YEARS, S/O.NARAYANI,",
        "NELLIKUNNU HOUSE, RAJAPURAM P.O.,",
        "PANATHUR, KASSARGODE - 671532.",
        "PRESENTLY RESIDING AT P & T QUARTERS, 59,",
        "NEAR NELLALAM POLICE STATION,",
        "KOZHIKODE - 673027.",
        "4. ANOOP.P, AGED 21 YEARS,",
        "S/O.VASUDEVAN, POOLAPARAMBIL HOUSE,",
        "CHOOLUR P.O., CHATHAMANGALAM,",
        "KOZHIKODE - 673601.",
        "5. JITHIN S8.Y¥., AGED 21 YEARS, S/O.SHIJU,",
        "JITHIN NIVAS, THATKOTTUMCHALIL,",
        "PAINGOTUPURAM, KUNNAMANGALAM,",
        "KOZHIKODE-673571.",
        "6. SHRAVAN K SATHEESH,",
        "AGED 20 YEARS, S/O.SATHEESH KUMAR,",
        "ARUKANDATHIL HOUSE, CHENAKKALANGADI,",
        "TIRURANGADI TALUK, MALAPPURAM - 676636.",
        "--2--"
    ],
    "respondents": [
        "(S)/STATE AND VICTIMS:",
        "1.THE STATE OF KERALA,",
        "REPRESENTED BY THE PUBLIC PROSECUTOR,",
        "HIGH COURT OF KERALA, ERNAKULAM.",
        "2.THE SUB INSPECTOR OF POLICE,",
        "PANNIYANKARA POLICE STATION,",
        "KOZHIKODE- 673003.",
        "3.MUBASHIR, S/O.HAMZA KOYA, AGED 22 YEARS,",
        "PANACHARANTAPURAKKAL HOUSE,",
        "PARAPANANGADI P.O.,",
        "MALAPPURAM DISTRICT - 676303.",
        "4.PRANAV, S/O.SOMASUNDARAN,",
        "AGED 21 YEARS, THAROL HOUSE,",
        "K.PURAM, THANALUR, MALAPPURAM.",
        "5.ALI AKBAR, S/O.ABDULLA, AGED 22 YEARS,",
        "PZHAYAKANDATHIL HOUSE,",
        "PARAPPANANGADI P.O., MALAPPURAM.",
        "6.NIBRAS AHAMMAD,S/O.ABDUL RAZAK,",
        "AGED 20 YEARS, KONARI HOUSE,",
        "ARTYALLUR, VALLIKUNNU P.O., MALAPPURAM.",
        "7.MUHAMMED AJINAS ,S/O.MAYANKUTTY,",
        "AGED 23 YEARS, CHERKOTTU HOUSE,",
        "PUTHANPEEDIKA, PARAPANANGADI, MALAPPURAM DT.",
        "8.ABDUL RAHIM,S/O.ABDUL KAREEM,",
        "AGED 20 YEARS, MACHINJERI HOUSE,",
        "K.PURAM, MALAPPURAM DISTRICT.",
        "RL & R2 BY PUBLIC PROSECUTOR SRI.AMJAD ALI",
        "R3 BY ADVS.SRI.K.M.FIROZ",
        "SMT .M.SHAJNA"
    ],
    "sections": [],
    "outcome": "",
    "full_text": "Ber eel\npeace\nSears\nDeas oat Ti\nneath\n2016/KER/34132\nIN THE HIGH COURT OF KERALA AT ERNAKULAM\nPRESENT :\nTHE HONOURABLE MR. JUSTICE RAJA VIJAYARAGHAVAN V\nTHURSDAY, THE 4TH DAY OF AUGUST 2016/13TH SRAVANA, 1938\nCr1.MC.No. 4917 of 2016 ()\nSC 665/2016 OF SPECIAL ADDITIONAL SESSIONS COURT (MARAD CASES)\nKOZHIKODE.\nCRIME NO.446/2014 OF PANNIYANKARA POLICE STATION, KOZHIKODE.\nPETITIONER (S) /ACCUSED :\n1. TONY BABU,\nAGED 21 YEARS, S/O.IGNATIOUS BABU,\nBHOMIKA HOUSE, POOLAKADAVU ROAD,\nVELLIMADKUNNU, MERIKUNNU P.O.,\nKOZHIKODE-673012.\n2. VISHAK.K,\nAGED 21 YEARS, S/O.VISHVANATHAN,\nKOTTADATH HOUSE, MEDICAL COLLEGE VIA,\nCHERUKULATHOOR P.O., KOZHIKODE-673008.\n3. AJITH KUMAR,\nAGED 19 YEARS, S/O.NARAYANI,\nNELLIKUNNU HOUSE, RAJAPURAM P.O.,\nPANATHUR, KASSARGODE - 671532.\nPRESENTLY RESIDING AT P & T QUARTERS, 59,\nNEAR NELLALAM POLICE STATION,\nKOZHIKODE - 673027.\n4. ANOOP.P, AGED 21 YEARS,\nS/O.VASUDEVAN, POOLAPARAMBIL HOUSE,\nCHOOLUR P.O., CHATHAMANGALAM,\nKOZHIKODE - 673601.\n5. JITHIN S8.Y¥., AGED 21 YEARS, S/O.SHIJU,\nJITHIN NIVAS, THATKOTTUMCHALIL,\nPAINGOTUPURAM, KUNNAMANGALAM,\nKOZHIKODE-673571.\n6. SHRAVAN K SATHEESH,\nAGED 20 YEARS, S/O.SATHEESH KUMAR,\nARUKANDATHIL HOUSE, CHENAKKALANGADI,\nTIRURANGADI TALUK, MALAPPURAM - 676636.\n--2--\n\nBer eel\npeace\nSears\nDeas oat Ti\neee\n2016/KER/34132\n--2--\nCrl.MC.No. 4917 of 2016 ()\n7. ANAS, AGED 35 YEARS, S/O.AHMEDKUTTY,\nNAMBRAKOTT HOUSE, CHENAKKALANGADT ,\nTIRURANGADI TALUK, MALAPPURAM - 676636.\n8. SAITHU MATHILANJERI, AGED 48 YEARS,\nS/O.ALI KUTTY, THRIKKANUR HOUSE,\nCHENAKKALANGADI, TIRURANGADI TALUK,\nMALAPPURAM - 673636.\nBY ADV. SRI.S.KANNAN\nRESPONDENT (S)/STATE AND VICTIMS:\n1.THE STATE OF KERALA,\nREPRESENTED BY THE PUBLIC PROSECUTOR,\nHIGH COURT OF KERALA, ERNAKULAM.\n2.THE SUB INSPECTOR OF POLICE,\nPANNIYANKARA POLICE STATION,\nKOZHIKODE- 673003.\n3.MUBASHIR, S/O.HAMZA KOYA, AGED 22 YEARS,\nPANACHARANTAPURAKKAL HOUSE,\nPARAPANANGADI P.O.,\nMALAPPURAM DISTRICT - 676303.\n4.PRANAV, S/O.SOMASUNDARAN,\nAGED 21 YEARS, THAROL HOUSE,\nK.PURAM, THANALUR, MALAPPURAM.\n5.ALI AKBAR, S/O.ABDULLA, AGED 22 YEARS,\nPZHAYAKANDATHIL HOUSE,\nPARAPPANANGADI P.O., MALAPPURAM.\n6.NIBRAS AHAMMAD,S/O.ABDUL RAZAK,\nAGED 20 YEARS, KONARI HOUSE,\nARTYALLUR, VALLIKUNNU P.O., MALAPPURAM.\n7.MUHAMMED AJINAS ,S/O.MAYANKUTTY,\nAGED 23 YEARS, CHERKOTTU HOUSE,\nPUTHANPEEDIKA, PARAPANANGADI, MALAPPURAM DT.\n8.ABDUL RAHIM,S/O.ABDUL KAREEM,\nAGED 20 YEARS, MACHINJERI HOUSE,\nK.PURAM, MALAPPURAM DISTRICT.\nRL & R2 BY PUBLIC PROSECUTOR SRI.AMJAD ALI\nR3 BY ADVS.SRI.K.M.FIROZ\nSMT .M.SHAJNA\nTHIS CRIMINAL MISC. CASE HAVING COME UP FOR ADMISSION\nON 04-08-2016, THE COURT ON THE SAME DAY PASSED THE\nFOLLOWING:\nmbr/\n\n2016/KER/34132\nRAJA VIJAYARAGHAVAN.V., J\nCri.M.C. No. 4917 of 2016\nDated 4% August, 2016\nORDER\nThe learned counsel for the petitioners prays that the\npetition be dismissed as withdrawn without prejudice to\ntheir right to move afresh. It is also prayed that the original\ndocuments produced along with this petition be returned\nback to him.\nPermission is granted. This petition is dismissed as\nwithdrawn.\nSd/-\nRAJA VIJAYARAGHAVAN.V.,\nJUDGE\nkp/-5.8.16\n\n"
}