{
    "case_id": "Crl.MC.No.1081 OF 2013",
    "court": "HIGH COURT OF KERALA AT ERNAKULAM",
    "date": "6TH DAY OF JANUARY 2021",
    "judge": "V.G.ARUN\nWEDNESDAY",
    "petitioners": [
        "ACCUSED :",
        "NOWFAL",
        "$/O.THANKALU KUNJU, KOIPPALLY THODIYIL, ORUMA NAGAR",
        "139, KARIKKODE P.O, KOLLAM 691 005."
    ],
    "respondents": [
        "/ COMPLAINANT :",
        "STATE OF KERALA",
        "THROUGH SUB INSPECTOR OF POLICE, KILIKKOLLOOR POLICE",
        "STATION, REPRESENTED BY THE PUBLIC PROSECUTOR, HIGH",
        "COURT OF KERALA, 682 031.",
        "OTHER PRESENT:",
        "SR.PP.C.S.HRITHWIK"
    ],
    "sections": [],
    "outcome": "",
    "full_text": "Bo a\nit\nioe\nBz tt\nIN THE HIGH COURT OF KERALA AT ERNAKULAM 2021/KER/707\nPRESENT\nTHE HONOURABLE MR.JUSTICE V.G.ARUN\nWEDNESDAY, THE O6TH DAY OF JANUARY 2021 / 16TH POUSHA, 1942\nCrl.MC.No.1081 OF 2013\nAGAINST THE JUDGMENT IN LP 191/2012 OF JUDICIAL MAGISTRATE OF\nFIRST CLASS -I, KOLLAM\nPETITIONER/ACCUSED :\nNOWFAL\n$/O.THANKALU KUNJU, KOIPPALLY THODIYIL, ORUMA NAGAR\n139, KARIKKODE P.O, KOLLAM 691 005.\nBY ADV. SRI.D.SHAJI\nRESPONDENT / COMPLAINANT :\nSTATE OF KERALA\nTHROUGH SUB INSPECTOR OF POLICE, KILIKKOLLOOR POLICE\nSTATION, REPRESENTED BY THE PUBLIC PROSECUTOR, HIGH\nCOURT OF KERALA, 682 031.\nOTHER PRESENT:\nSR.PP.C.S.HRITHWIK\nTHIS CRIMINAL MISC. CASE HAVING COME UP FOR ADMISSION ON\n06.01.2021, THE COURT ON THE SAME DAY PASSED THE FOLLOWING:\n\nEL |\n|\nioe\nBee\nCrl.MC.No.1081 OF 2013 2. 202UKERI707\nORDER\n\nDated this the 6th day of January 2021\n\nThis Criminal M.C. was filed, way back in the\nyear 2013, for a direction to consider the petitioner's\nbail application on the date of surrender.\n\n2. In the report called for by this Court, the\nJudicial First Class Magistrate Court-I, Kollam has\ninformed that, pursuant to the petitioner's\nappearance before the court, the case was removed\nfrom the Long Pending Register and refiled as\nC.C.No.459/2014 and posted for hearing on\n01.01.2021.\n\nIn such circumstances, nothing survives for\nconsideration and accordingly, the Criminal M.C.is\ndismissed.\n\nSd/-\nV.G.ARUN\nSB/06/01/2020 JUDGE\n//true copy// P.A to Judge\n\n"
}