{
    "case_id": "Crl.MC.No. 4901 of 2016",
    "court": "HIGH COURT OF KERALA AT ERNAKULAM\nPRESENT",
    "date": "3RD DAY OF AUGUST 2016",
    "judge": "SUNIL THOMAS\nWEDNESDAY",
    "petitioners": [
        "(S) /ACCUSED:",
        "ANIL KUMAR K.R,",
        "AGED 36 YEARS, S/O RAJAN, MINI BHAVANAM,",
        "CHITTATTINMUKKU, ERATHU VILLAGE, ADOOR,",
        "PATHANAMTHITTA DISTRICT."
    ],
    "respondents": [
        "(S)/STATE AND COMPLAINANT:",
        "1. STATE OF KERALA,",
        "REPRESENTED BY THE PUBLIC PROSECUTOR,",
        "HIGH COURT OF KERALA, ERNAKULAM 682 031.",
        "2. THE SUB INSPECTOR OF POLICE,",
        "ADOOR POLICE STATION,",
        "PATHANAMTHITTA DISTRICT 689 645."
    ],
    "sections": [
        "452",
        "294"
    ],
    "outcome": "",
    "full_text": "a eaeeN\n5. Orel\n-\nenclay\n2016/KER/33890\nIN THE HIGH COURT OF KERALA AT ERNAKULAM\nPRESENT :\nTHE HONOURABLE MR. JUSTICE SUNIL THOMAS\nWEDNESDAY, THE 3RD DAY OF AUGUST 2016/12TH SRAVANA, 1938\nCrl.MC.No. 4901 of 2016 ()\nCRIME NO. 1863/2016 OF ADOOR POLICE STATION, PATHANAMTHITTA\nPETITIONER (S) /ACCUSED:\nANIL KUMAR K.R,\nAGED 36 YEARS, S/O RAJAN, MINI BHAVANAM,\nCHITTATTINMUKKU, ERATHU VILLAGE, ADOOR,\nPATHANAMTHITTA DISTRICT.\nBY ADVS.SRI.D.KISHORE\nSMT.MINI GOPINATH\nSMT.MEERA GOPINATH\nSRI.R.MURALEEKRISHNAN (MALAKKARA)\nRESPONDENT (S)/STATE AND COMPLAINANT:\n1. STATE OF KERALA,\nREPRESENTED BY THE PUBLIC PROSECUTOR,\nHIGH COURT OF KERALA, ERNAKULAM 682 031.\n2. THE SUB INSPECTOR OF POLICE,\nADOOR POLICE STATION,\nPATHANAMTHITTA DISTRICT 689 645.\nBY PUBLIC PROSECUTOR SMT.M.1T.SHEEBA\nTHIS CRIMINAL MISC. CASE HAVING COME UP FOR ADMISSION ON\n03-08-2016, THE COURT ON THE SAME DAY PASSED THE FOLLOWING:\n\na\n5 a5\nSeep\nBa\n2016/KER/33890\nCr1l.MC.No. 4901 of 2016 ()\nAPPENDIX\nPETITIONER(S)' EXHIBITS\nANNEXURE 1 TRUE COPY OF THE FIR IN CRIME 1863/2016 OF ADOOR\nPOLICE STATION.\nRESPONDENT (S)' EXHIBITS : NIL\n/TRUE COPY/\nP. A. TO JUDGE\nPn\n\nBee\n2016/KER/33890\nSUNIL THOMAS, J.\nDated this the 3\" day of August, 2016\nORDER\n\nThe petitioner herein is the sole accused in Crime\nNo.1863/2016 of Adoor Police Station for offences punishable\nunder Sections 452, 294(b), 323, 354 and 506(i) of IPC read with\nSections 3(1)(s), 3(1),(w)(i), 3(2) (VA) of the Scheduled Castes and\nScheduled Tribes (Prevention of Atrocities), Amendment Act,\n2015.\n\n2. The allegation of the defacto complainant is that, the\npetitioner herein had assaulted her. According to the learned\ncounsel for the petitioner, actually there was a monetary dispute\nbetween the wife of the petitioner and the defacto complainant\nwhich promoted the defacto complainant to set up a false case.\nEven in the Fl statement, there is a reference about a monetary\ntransaction. The learned counsel submits that, he is ready and\nwilling to surrender before the court below. However, his\napprehension is that, the bail application submitted by him is not\nlikely to be taken up on the same day.\n\nHaving regard to the limited prayer sought for by him, this\nCrl.M.C. is disposed of with a direction that in the event of the\n\nBee\n2016/KER/33890\nCri. M. C. No. 4901 of 2016 2\npetitioner surrendering before the court below and files an\napplication for bail, the same shall be considered by the court\nbelow on the same day, having regard to the spirit of the\ndecisions reported in Shanu V. State of Kerala (2000 (3) KLT\n452) and Ali V. State of Kerala (2000 (2) KLT 280) and also\nthe contention of the learned counsel for the petitioner that the\npresent case only an offshoot of a monetary dispute.\nSd/-\n\nSUNIL THOMAS, JUDGE.\n\nPn\n\n"
}