{
    "case_id": "Crl.MC.No. 8975 of 2017",
    "court": "HIGH COURT OF KERALA AT ERNAKULAM",
    "date": "8TH DAY OF JANUARY 2018",
    "judge": "B.KEMAL PASHA\nMONDAY",
    "petitioners": [
        "(S) /ACCUSED :",
        "1 RIYAS.M.A.,",
        "AGED 22 YEARS, S/O. ASEEZ,",
        "AVIYIL HOUSE, KANHANGAD VILLAGE, HOSDURG TALUK.",
        "2 RASHID M.A",
        "AGED 20 YEARS, S/O. ASEEZ,",
        "AVIYIL HOUSE, KANHANGAD VILLAGE, HOSDURG TALUK."
    ],
    "respondents": [
        "(S) /STATE/COMPLAINANT :",
        "1. STATE OF KERALA,",
        "REPRESENTED BY PUBLIC PROSECUTOR,",
        "HIGH COURT OF KERALA, ERNAKULAM - 682 031.",
        "2. KRIPESH.K,",
        "AGED 24 YEARS, S/O. KUNHIKRISHNAN,",
        "R/AT VANIYAM VEEDU, ERIYA, HOSDURG TALUK - 671 315.",
        "3. ASKER ALI, AGED 24 YEARS,",
        "$/O.MUHAMMED, R/AT PAZHAYA KADAPPURAM, KANHANGAD VILLAGE,",
        "HOSDURG TALUK- 671 315.",
        "R1 BY PUBLIC PROSECUTOR SRI.ALEX M.THOMBRA",
        "R2 & R3 BY ADV. SRI.P.K.SUBHASH"
    ],
    "sections": [
        "341",
        "324 read with Section 34 IPC"
    ],
    "outcome": "ORDER\n\nPetitioners are the accused in CC No.1988/2017\nof the Judicial First Class Magistrate's Court-l, Hosdurg,\nwhich has arisen from Crime No.409/2017 of Ambalathara\nPolice Station for the offences punishable under Sections\n341 and 324 read with Section 34 IPC.\n\n2. It seems that the matter has been amicably\nsettled between the petitioners and the de_ facto\ncomplainant, who is the 2\"? respondent herein. The 3”\nrespondent is the other injured.\n\n3. Respondents 2 and 3 have filed Annexures-All\nand Alll affidavits respectively, affirming that the matter has\nbeen amicably settled between them and the petitioners and\npresently, they have no complaints against the petitioners.\nWhen the matter is settled between the parties, no purpose\n\nBel\noe saree\napa\n2018/KER/742\nCrl.M.C.8975/2017\n:2:\nwould be served in proceeding with the matter further.\nMatters being so, all further proceedings against the\npetitioners in CC No.1988/2017 of the Judicial First Class\nMagistrate's Court-], Hosdurg, which has arisen from Crime\nNo.409/2017 of Ambalathara Police Station, can be\nquashed",
    "full_text": "Bee\narp cat ios\npees\nieee\nIN THE HIGH COURT OF KERALA AT ERNAKULAM 2018/KER/742\nPRESENT:\nTHE HONOURABLE MR. JUSTICE B.KEMAL PASHA\nMONDAY, THE 8TH DAY OF JANUARY 2018 / 18TH POUSHA, 1939\nCrl.MC.No. 8975 of 2017\nC.C.NO. 1988/2017 OF JUDICIAL FIRST CLASS MAGISTRATE COURT-I, HOSDURG\nCRIME NO. 409/2017 OF AMBALATHARA POLICE STATION\nPETITIONER (S) /ACCUSED :\n1 RIYAS.M.A.,\nAGED 22 YEARS, S/O. ASEEZ,\nAVIYIL HOUSE, KANHANGAD VILLAGE, HOSDURG TALUK.\n2 RASHID M.A\nAGED 20 YEARS, S/O. ASEEZ,\nAVIYIL HOUSE, KANHANGAD VILLAGE, HOSDURG TALUK.\nBY ADV.SRI.A.ARUNKUMAR\nRESPONDENT (S) /STATE/COMPLAINANT :\n1. STATE OF KERALA,\nREPRESENTED BY PUBLIC PROSECUTOR,\nHIGH COURT OF KERALA, ERNAKULAM - 682 031.\n2. KRIPESH.K,\nAGED 24 YEARS, S/O. KUNHIKRISHNAN,\nR/AT VANIYAM VEEDU, ERIYA, HOSDURG TALUK - 671 315.\n3. ASKER ALI, AGED 24 YEARS,\n$/O.MUHAMMED, R/AT PAZHAYA KADAPPURAM, KANHANGAD VILLAGE,\nHOSDURG TALUK- 671 315.\nR1 BY PUBLIC PROSECUTOR SRI.ALEX M.THOMBRA\nR2 & R3 BY ADV. SRI.P.K.SUBHASH\nTHIS CRIMINAL MISC. CASE HAVING COME UP FOR ADMISSION\nON 08-01-2018, THE COURT ON THE SAME DAY PASSED\nTHE FOLLOWING:\nMsd.\n\nBee\narp cat ios\nrears\nieee\nCrl.MC.No. 8975 of 2017 2018/KER/742\nAPPENDIX\nPETITIONER(S)' ANNEXURES :\nANNEXURE AT A TRUE COPY OF THE F.I.R IN CRIME NO. 409 OF 2017 OF\nAMBALATHARA POLICE STATION.\nANNEXURE AIT A TRUE COPY OF THE FINAL REPORT IN CRIME NO. 409 OF 2017\nOF AMBALATHARA POLICE STATION.\nANNEXURE AIII A TRUE COPY OF THE AFFIDAVIT SWORN TO BY THE 2ND RESPONDENT.\nANNEXURE AIV A TRUE COPY OF THE AFFIDAVIT SWORN TO BY THE 3RD RESPONDENT.\nRESPONDENT (S) ' ANNEXURES :\nNIL\n//'TRUE COPY//\nP.S.TO JUDGE\nMsd.\n\n2018/KER/742\nB. KEMAL PASHA, J.\nDated this the 8\" day of January, 2018\nORDER\n\nPetitioners are the accused in CC No.1988/2017\nof the Judicial First Class Magistrate's Court-l, Hosdurg,\nwhich has arisen from Crime No.409/2017 of Ambalathara\nPolice Station for the offences punishable under Sections\n341 and 324 read with Section 34 IPC.\n\n2. It seems that the matter has been amicably\nsettled between the petitioners and the de_ facto\ncomplainant, who is the 2\"? respondent herein. The 3”\nrespondent is the other injured.\n\n3. Respondents 2 and 3 have filed Annexures-All\nand Alll affidavits respectively, affirming that the matter has\nbeen amicably settled between them and the petitioners and\npresently, they have no complaints against the petitioners.\nWhen the matter is settled between the parties, no purpose\n\nBel\noe saree\napa\n2018/KER/742\nCrl.M.C.8975/2017\n:2:\nwould be served in proceeding with the matter further.\nMatters being so, all further proceedings against the\npetitioners in CC No.1988/2017 of the Judicial First Class\nMagistrate's Court-], Hosdurg, which has arisen from Crime\nNo.409/2017 of Ambalathara Police Station, can be\nquashed.\nIn the result, this Crl.M.C. is allowed and all further\nproceedings against the petitioners in CC No.1988/2017 of\nthe Judicial First Class Magistrate's Court-l, Hosdurg, which\nhas arisen from Crime No.409/2017 of Ambalathara Police\nStation, are quashed.\nSd/-\n(B.KEMAL PASHA, JUDGE)\naks/08/01\n1! True Copy //\nPS to Judge\n\n"
}