{
    "case_id": "Crl.MC.No.2660 OF 2014",
    "court": "HIGH COURT OF KERALA AT ERNAKULAM",
    "date": "11TH DAY OF JANUARY 2021",
    "judge": "P.SOMARAJAN\nMONDAY",
    "petitioners": [
        "ACCUSED NO.1:",
        "VIJAYAKUMAR",
        "SECRETARY, HINDU MADHA DHARMA PARTPALAMA SABHA,",
        "VADAKKEKKARA, ERNAKULAM"
    ],
    "respondents": [
        "S /STATE:"
    ],
    "sections": [],
    "outcome": "",
    "full_text": "Beer\nIN THE HIGH COURT OF KERALA AT ERNAKULAM 202UKERMS2I\nPRESENT\nTHE HONOURABLE MR. JUSTICE P.SOMARAJAN\nMONDAY, THE 11TH DAY OF JANUARY 2021 / 21TH POUSHA, 1942\nCrl1.MC.No.2660 OF 2014\nCRIME NO.254/2014 OF VADAKKEKARA POLICE STATION , ERNAKULAM\n\nPETITIONER/ACCUSED NO.1:\nVIJAYAKUMAR\nSECRETARY, HINDU MADHA DHARMA PARTPALAMA SABHA,\nVADAKKEKKARA, ERNAKULAM\nBY ADVS.\nSRI.S.RAJEEV\nSRI .K.K.DHEERENDRAKRISHNAN\n\nRESPONDENTS /STATE:\n\n1 STATE OF KERALA\nREPRESENTED BY PUBLIC PROSECUTOR, HIGH COURT OF\nKERALA, ERNAKULAM (CRIME NO.254/2014 OF VADAKKEKKARA\nPOLICE STATION)\n2 VALSAN\nS/O.KUNJAN PILLAI, NEELIMATHARA HOUSE, MALYANKARA\nKARA, MOOTHAKUNNAM VILLAGE, PARAVUR\nR1-2 BY ADV. SRI.A.V.JOJO\nR1 BY ADV. SRI.A.X.VARGHESE\nPUBLIC PROSECUTOR SRI.SMT.M.N.MAYA\nTHIS CRIMINAL MISC. CASE HAVING BEEN FINALLY HEARD ON\n11.01.2021, THE COURT ON THE SAME DAY PASSED THE FOLLOWING:\n\nCrl.MC.No.2660 OF 2014 2 202 KER/TS21\nORDER\nIt is fairly submitted by the learned counsel\nfor the petitioner that the matter has become\ninfructuous. The accused was acquitted. The same\nis recorded. The Crl.M.C. is dismissed as\ninfructuous.\nSd/-\nP. SOMARAJAN\nJUDGE\nmsp\n\nimine\nneers\nCr1.MC.No.2660 OF 2014 3 2021/KER/1521\nAPPENDIX\nPETITIONER'S/S EXHIBITS:\nANNEXURE 1 CERTIFIED COPY OF THE FIR IN CRIME\nNO.254/2014 OF VADAKKEKKARA POLICE STATION\nRESPONDENTS EXHIBITS:\nANNEXURE R2 (A) TRUE COPY OF THE PAINT IN 0.$.47/2011\nANNEXURE R2 (B) TRUE COPY OF THE ORDER IN I.A.229/2011 IN\n0.8.47/2011\nANNEXURE R2 (C) TRUE COPY OF THE COMPLAINT DATED 28/2/2014\nANNEXURE R2 (D) TRUE COPY OF THE RECEIPT\n//TRUE CcoPpy//\nP.A. TO JUDGE\n\n"
}