{
    "case_id": "Crl.MC.No. 2503 of 2017",
    "court": "HIGH COURT OF KERALA AT ERNAKULAM",
    "date": "5TH DAY OF JANUARY 2018",
    "judge": "B.KEMAL PASHA\nFRIDAY",
    "petitioners": [
        "(S) /ACCUSED NO.2 :",
        "MEETHALAKATH MAHAMOOD ,",
        "CHAIRMAN, M/S.BLOSSOM INTERNATIONAL RESIDENTIAL SCHOOL,",
        "PANIPRA P.O. ,KOTHAMANGALAM."
    ],
    "respondents": [
        "(S) /STATE/COMPLAINANT :",
        "1. STATE OF KERALA,",
        "REPRESENTED BY PUBLIC PROSECUTOR,",
        "HIGH COURT OF KERALA, ERNAKULAM-682 031.",
        "2. THE MANAGER,",
        "BRANCH OFFICE, ESI CORPORATION, PERUMBAVOOR,",
        "REPRESENTED BY THE STANDING COUNSEL,",
        "HIGH COURT OF KERALA, ERNAKULAM-682 031.",
        "R1 BY PUBLIC PROSECUTOR SRI.ALEX M.THOMBRA",
        "R2 BY ADV. SRI.K.SANDESH RAJA"
    ],
    "sections": [],
    "outcome": "",
    "full_text": "ial\n32 Et Sah\n.. pak 4\nIN THE HIGH COURT OF KERALA AT ERNAKULAM 2018/KER/478\nPRESENT:\nTHE HONOURABLE MR. JUSTICE B.KEMAL PASHA\nFRIDAY, THE 5TH DAY OF JANUARY 2018 / 15TH POUSHA, 1939\nCr1.MC.No. 2503 of 2017\nC.C.NO. 620/2014 OF JUDICIAL FIRST CLASS MAGISTRATE COURT, PERUMBAVOOR\nPETITIONER (S) /ACCUSED NO.2 :\nMEETHALAKATH MAHAMOOD ,\nCHAIRMAN, M/S.BLOSSOM INTERNATIONAL RESIDENTIAL SCHOOL,\nPANIPRA P.O. ,KOTHAMANGALAM.\nBY ADVS.SRI.S.RAJEEV\nSRI.K.K. DHEERENDRAKRISHNAN\nSRI.V.VINAY\nSRI.D.FEROZE\nRESPONDENT (S) /STATE/COMPLAINANT :\n1. STATE OF KERALA,\nREPRESENTED BY PUBLIC PROSECUTOR,\nHIGH COURT OF KERALA, ERNAKULAM-682 031.\n2. THE MANAGER,\nBRANCH OFFICE, ESI CORPORATION, PERUMBAVOOR,\nREPRESENTED BY THE STANDING COUNSEL,\nHIGH COURT OF KERALA, ERNAKULAM-682 031.\nR1 BY PUBLIC PROSECUTOR SRI.ALEX M.THOMBRA\nR2 BY ADV. SRI.K.SANDESH RAJA\nTHIS CRIMINAL MISC. CASE HAVING COME UP FOR ADMISSION\nON 05-01-2018, THE COURT ON THE SAME DAY PASSED THE FOLLOWING:\nMsd.\n\nEg eae\nae eso 4\nCrl.MC.No. 2503 of 2017 2018/KER/478\nAPPENDIX\nPETITIONER(S)' ANNEXURES :\nANNEXURE TI CERTIFIED COPY OF THE COMPLAINT IN CC NO.620/2014\nON THE FILE OF THE JUDICIAL MAGISTRATE OF FIRST\nCLASS, PERUMBAVOOR.\nANNEXURE IT TRUE COPY OF THE TRUST DEED DATED 12.7.2004.\nANNEXURE IIT TRUE COPY OF THE LETTER DATED 10.2.2017 ISSUED BY\nTHE ASST. DIRECTOR, ESI CORPORATION, ERNAKULAM.\nRESPONDENT (S) ' ANNEXURES :\nNIL\n/ [TRUE COPY//\nP.S.TO JUDGE\nMsd.\n\nus\n2018/KER/478\nB. KEMAL PASHA, J.\neee\n\"Dated this the 5” day of January, 2018\nORDER\n\nA Trust is proceeded against for non-payment of ESI\ncontribution. Subsequently, it seems that the contribution\nhas been paid. At the same time, even if the contribution is\npaid, it cannot be said that there is no offence.\n\n2. According to the petitioner, who is the 2\"?\naccused, he is the Chairman of the Trust and he is not\nperforming the day-to-day affairs of the trust. It is for the\npetitioner to apprise the court below with regard to the true\nstate of affairs regarding the Trust.\n\nWithout prejudice to the right of the petitioner to take\nup all these contentions before the court below, this Crl.M.C.\n\ney\n\n2018/KER/478\n\nCRL.M.C.No. 2503 of 2017\n“20\nis disposed of. As far as practicable, the court below shall\ngrant exemption to the petitioner from personal appearance.\nSd/- B. KEMAL PASHA, JUDGE.\nul/-\n[True copy]\nP.S. to Judge.\n\n"
}