{
    "case_id": "",
    "court": "HIGH COURT OF KERALA AT ERNAKULAM\nPRESENT\nTHE HONOURABLE MR",
    "date": "",
    "judge": "BECHU KURIAN THOMAS\nMONDAY",
    "petitioners": [
        "S:",
        "DIPUMON C.T.",
        "AGED 36 YEARS",
        "S/0. THOMAS, H.NO. 236, CHEETHAPARAMBIL HOUSE,",
        "CHERANELLOOR VILLAGE, KUNNUMMEL ROAD, VADUTHALA P.O.,",
        "ERNAKULAM DISTRICT,, PIN - 682021"
    ],
    "respondents": [
        "S:",
        "1 STATE OF KERALA",
        "REPRESENTED BY PUBLIC PROSECUTOR, HIGH COURT OF KERALA,",
        "PIN - 682031",
        "2 SUB INSPECTOR OF POLICE,",
        "KALAMASSERY POLICE STATION, ERNAKULAM,, PIN - 683104",
        "3 JITHIN,",
        "AGED 23 YEARS, S/O. UNNI, VADAKKEDATHU HOUSE,",
        "KARUKUTTY, ERNAKULAM,, PIN - 683576",
        "OTHER PRESENT:",
        "RESPONDENT )"
    ],
    "sections": [
        "482 Cr"
    ],
    "outcome": "ORDER/JUDGMENT CC 632/2023 OF JMFC, KALAMASSERY\n(TEMPORARY)\nPETITIONER/S:\nDIPUMON C.T.\nAGED 36 YEARS\nS/0. THOMAS, H.NO. 236, CHEETHAPARAMBIL HOUSE,\nCHERANELLOOR VILLAGE, KUNNUMMEL ROAD, VADUTHALA P.O.,\nERNAKULAM DISTRICT,, PIN - 682021\nBY ADV N.S.HASNA MOL\nRESPONDENT/S:\n1 STATE OF KERALA\nREPRESENTED BY PUBLIC PROSECUTOR, HIGH COURT OF KERALA,\nPIN - 682031\n2 SUB INSPECTOR OF POLICE,\nKALAMASSERY POLICE STATION, ERNAKULAM,, PIN - 683104\n3 JITHIN,\nAGED 23 YEARS, S/O. UNNI, VADAKKEDATHU HOUSE,\nKARUKUTTY, ERNAKULAM,, PIN - 683576\nOTHER PRESENT:\nSMT. SREEJA V. (PP) / SRI. SUDHEER K.K. (FOR\nRESPONDENT )\nTHIS CRIMINAL MISC. CASE HAVING COME UP FOR ADMISSTON ON\n22.01.2024, THE COURT ON THE SAME DAY PASSED THE FOLLOWING:\n\npone\n2024/KER/7204\nCRL.MC NO. 69 OF 2024\n2\nBECHU KURIAN THOMAS, J.\n CriLM.C.No.69 of 2024\nDated this the 22\" day of January, 2024\nORDER\n\nPetitioner has invoked the jurisdiction under Section 482 Cr.P.C\nto quash all proceedings against him.\n\n2. Petitioner is the sole accused in C.C.No.632/2023 on the files\nof the Judicial First Class Magistrate Court, Kalamassery arising out of\nCrime No.967/2023 of Kalamassery Police Station, Ernakulam District,\nregistered for the offences under Sections 294(b), 427 and 392 of the\nIndian Penal Code, 1860. The 3% respondent is the defacto\ncomplainant.\n\n3. According to the prosecution, the accused by inflicting\nbodily harm abused the defacto complainant and destroyed mobile\nphones kept in the shop and thereby committed the offences alleged.\n\n4. Heard the learned Counsel for the petitioner and the learned\nCounsel for the respondent apart from the learned Public Prosecutor.\n\n5. The learned Counsel for the petitioner submitted that the\nmatter has been settled and hence the proceedings against the\npetitioner ought to be quashed",
    "full_text": "Besa\n=e eee\naan,\nbh} A fect\nleaner)\n2024/KER/7204\nCRL.MC NO. 69 OF 2024\n1\nIN THE HIGH COURT OF KERALA AT ERNAKULAM\nPRESENT\nTHE HONOURABLE MR. JUSTICE BECHU KURIAN THOMAS\nMONDAY, THE 22\"D DAY OF JANUARY 2024 / 2ND MAGHA, 1945\nCRL.MC NO. 69 OF 2024\nCRIME NO.967/2023 OF Kalamassery Police Station, Ernakulam\nAGAINST THE ORDER/JUDGMENT CC 632/2023 OF JMFC, KALAMASSERY\n(TEMPORARY)\nPETITIONER/S:\nDIPUMON C.T.\nAGED 36 YEARS\nS/0. THOMAS, H.NO. 236, CHEETHAPARAMBIL HOUSE,\nCHERANELLOOR VILLAGE, KUNNUMMEL ROAD, VADUTHALA P.O.,\nERNAKULAM DISTRICT,, PIN - 682021\nBY ADV N.S.HASNA MOL\nRESPONDENT/S:\n1 STATE OF KERALA\nREPRESENTED BY PUBLIC PROSECUTOR, HIGH COURT OF KERALA,\nPIN - 682031\n2 SUB INSPECTOR OF POLICE,\nKALAMASSERY POLICE STATION, ERNAKULAM,, PIN - 683104\n3 JITHIN,\nAGED 23 YEARS, S/O. UNNI, VADAKKEDATHU HOUSE,\nKARUKUTTY, ERNAKULAM,, PIN - 683576\nOTHER PRESENT:\nSMT. SREEJA V. (PP) / SRI. SUDHEER K.K. (FOR\nRESPONDENT )\nTHIS CRIMINAL MISC. CASE HAVING COME UP FOR ADMISSTON ON\n22.01.2024, THE COURT ON THE SAME DAY PASSED THE FOLLOWING:\n\npone\n2024/KER/7204\nCRL.MC NO. 69 OF 2024\n2\nBECHU KURIAN THOMAS, J.\n CriLM.C.No.69 of 2024\nDated this the 22\" day of January, 2024\nORDER\n\nPetitioner has invoked the jurisdiction under Section 482 Cr.P.C\nto quash all proceedings against him.\n\n2. Petitioner is the sole accused in C.C.No.632/2023 on the files\nof the Judicial First Class Magistrate Court, Kalamassery arising out of\nCrime No.967/2023 of Kalamassery Police Station, Ernakulam District,\nregistered for the offences under Sections 294(b), 427 and 392 of the\nIndian Penal Code, 1860. The 3% respondent is the defacto\ncomplainant.\n\n3. According to the prosecution, the accused by inflicting\nbodily harm abused the defacto complainant and destroyed mobile\nphones kept in the shop and thereby committed the offences alleged.\n\n4. Heard the learned Counsel for the petitioner and the learned\nCounsel for the respondent apart from the learned Public Prosecutor.\n\n5. The learned Counsel for the petitioner submitted that the\nmatter has been settled and hence the proceedings against the\npetitioner ought to be quashed. It was also submitted that,\nconsidering the nature of offences alleged, no purpose would be\nserved by continuing the proceedings.\n\n6. In Gian Singh v. State of Punjab [(2012) 10 SCC 303],\n\npone\n2024/KER/7204\nCRL.MC NO. 69 OF 2024\n3\n\nthe Apex Court has held that in appropriate cases, the High Court can\ntake note of the amicable resolution of disputes between the victim\nand the wrongdoer to put an end to the criminal proceedings. This\nview was reiterated in Narinder Singh v. State of Punjab [(2014) 6\nSCC 466] and Yogendra Yadav and Others v. State of Jharkhand\nand Another [(2014) 9 SCC 653].\n\n7. | have perused Annexure A4 affidavit filed by the 3‚Äù\nrespondent. The learned Public Prosecutor has submitted that upon\nverification, it is understood that the affidavit is genuine, and the\ndefacto complainant stands by the contents thereof. | am satisfied\nthat the matter has been settled and no public interest is involved in\nthis case. There is no impediment for granting the prayer for\nquashing. The continuance of the proceedings will only be an\nexercise in futility.\n\n8. Accordingly, all proceedings against the petitioner in\nC.C.No0.632/2023 on the files of the Judicial First Class Magistrate\nCourt, Kalamassery, are quashed.\n\nThis Crl.M.C is allowed.\nsd/\nBECHU KURIAN THOMAS\nJUDGE\njrm/\n\nOo\nES A eee\npetra:\nbh} A fect\nBaa\n2024/KER/7204\nCRL.MC NO. 69 OF 2024\n4\nAPPENDIX OF CRL.MC 69/2024\nPETITIONER ANNEXURES\nAnnexure At CERTIFIED COPY OF THE FIR IN CRIME NO.\n967/2023 OF KALAMASSERY POLICE STATION DATED\n18.05,20232\nAnnexure A2 CERTIFIED COPY OF THE FINAL REPORT IN CRIME\nNO. 967/2023 OF KALAMASSERY POLICE STATION\nDATED 1.6.2023\nAnnexure A3 TRUE COPY OF WOUND CERTIFICATE DATED\n18.5,.2023\nAnnexure A4 AFFIDAVIT DATED 27.12.2023 SWORN TO BY THE\n3RD RESPONDENT\n\n"
}