{
    "case_id": "Crl.MC.No. 6 of 2014",
    "court": "HIGH COURT OF KERALA ATERNAKULAM\nPRESENT",
    "date": "2ND DAY OF JANUARY 2014",
    "judge": "HARUN-UL-RASHID\nTHURSDAY",
    "petitioners": [
        "ACCUSED :",
        "BINDU RAJAN, AGED 38 YEARS",
        "W/O.RAJAN, KUTTAKKALLIL HOUSE",
        "CHATTUPARA MACHIPLAVUP O ADIMALY, DUKKI-685561"
    ],
    "respondents": [
        "S/STATE & COMPLAINANT :",
        "1. STATE OF KERALA",
        "REP BY THE PUBLIC PROSECUTOR, HIGH COURT OF KERALA",
        "ERNAKULAM",
        "2. JAYANR,",
        "S/O.LATE RAMAN PILLAI GAYEE NIVAS, HOUSE NO.36",
        "HOUSING BOARD MUVATTUPUZHA",
        "BRANCH MANAGER AND POWER OF ATTORNEY HOLDER",
        "MUTHOOT LEASING AND FINANCE LIMITED",
        "SALAL TOWERS(MAKKAR PLAZA), BYE PASS ROAD",
        "PNB JUNCTION, MOUVATTUPUZHA, ERNAKUALM-686673",
        "R BY PUBLIC PROSECUTOR SMT.S.HYMA"
    ],
    "sections": [
        "138 of the\nNegotiable Instruments Act"
    ],
    "outcome": "Disposed",
    "full_text": "Pipe)\nBene\nBie awe 4\n2014/KER/202\nIN THE HIGH COURT OF KERALA ATERNAKULAM\nPRESENT:\nTHE HONOURABLE MR.JUSTICE HARUN-UL-RASHID\nTHURSDAY, THE 2ND DAY OF JANUARY 2014/12TH POUSHA, 1935\nCrl.MC.No. 6 of 2014 0\nST 1136/2008 of JUDICIAL FIRST CLASS MAGISTRATE COURT-I MUVATUPUZHA\nPETITIONER/ACCUSED :\nBINDU RAJAN, AGED 38 YEARS\nW/O.RAJAN, KUTTAKKALLIL HOUSE\nCHATTUPARA MACHIPLAVUP O ADIMALY, DUKKI-685561\nBY ADV.SRIP.B.AJOY\nRESPONDENTS/STATE & COMPLAINANT :\n1. STATE OF KERALA\nREP BY THE PUBLIC PROSECUTOR, HIGH COURT OF KERALA\nERNAKULAM\n2. JAYANR,\nS/O.LATE RAMAN PILLAI GAYEE NIVAS, HOUSE NO.36\nHOUSING BOARD MUVATTUPUZHA\nBRANCH MANAGER AND POWER OF ATTORNEY HOLDER\nMUTHOOT LEASING AND FINANCE LIMITED\nSALAL TOWERS(MAKKAR PLAZA), BYE PASS ROAD\nPNB JUNCTION, MOUVATTUPUZHA, ERNAKUALM-686673\nR BY PUBLIC PROSECUTOR SMT.S.HYMA\nTHIS CRIMINAL MISC. CASE HAVING COME UP FOR ADMISSION ON\n02-01-2014, THE COURT ON THE SAME DAY PASSED THE FOLLOWING:\n\nbree\nBene\nBie awe 4\n2014/KER/202\nCrLMC.No. 6 of 2014 ()\nAPPENDIX\nPETITIONER(S)' EXHIBITS\nANNEX.1:-TRUE COPY OF THE ORDER SHEET IN ST NO 1136/2008 PENDING\nBEFORE THE JUDICIAL FIRST CLASS MAGISTRATE COURT I, MUVATTUPUZHA\nRESPONDENT(S)' EXHIBITS : NIL\n/TRUE COPY/\nPATO JUDGE\nAV\n\n2014/KER/202\nHARUN-UL-RASHID, J.\nDated this the 2‚Äù day of January, 2014\nORDER\n\nPetitioner is the accused in S.T.No.1136/2008 on the file\nof Judicial First Class Magistrate Court-l, Muvattupuzha. The\noffence alleged is punishable under Section 138 of the\nNegotiable Instruments Act. The petitioner failed to appear\nbefore court on 31/01/2013, the court issued non-bailable\nwarrant and steps are initiated under Section 82-83 on the\nsame day. The offence alleged under Section 138 of the\nNegotiable Instruments Act is a bailable offence.\n\n3. The petitioner is willing to surrender before the Judicial\nFirst Class Magistrate Court-l, Muvattupuzha. Non-bailable\nwarrant is pending against her. Now, the petitioner seeks a\ndirection from this Court to consider her application for bail on\nthe date of surrender itself.\n\nIn the facts and circumstances, the Crl.M.C is disposed of,\ndirecting the Judicial First Class Magistrate Court-l,\nMuvattupuzha to consider and pass orders on the bail\napplication on the date of surrender itself in the event of the\npetitioner surrendering before the court below and submitting\nan application for bail with prior notice to the Assistant Public\n\nbere\nBae\n2014/KER/202\nCrl.M.C.No. 6 of 2014\n2\nProsecutor within a period of three weeks from today. Non-\nbailable warrant issued shall be kept in abeyance till the\ndisposal of the bail application.\nSd/-\nHARUN-UL-RASHID, JUDGE.\nAV\n\n"
}