{
    "case_id": "Crl.MC.No.333 OF 2015",
    "court": "HIGH COURT OF KERALA AT ERNAKULAM\nPRESENT\nTHE HONOURABLE MR",
    "date": "08TH DAY OF JANUARY 2021",
    "judge": "P.V.KUNHIKRISHNAN\nFRIDAY",
    "petitioners": [
        "S /ACCUSED:",
        "1 SAIJU JOHN, AGED 45 YEARS",
        "S/O.T.C.JOHN, RESIDING AT THALACKAVIL VEETIL,",
        "SOUTH VAZHAKKULAM P.O., ALUVA-683 105.",
        "2 LAIJU JOHN, AGED 46 YEARS",
        "S/O.T.C.JOHN, RESIDING AT THALACKAVIL VEETIL,",
        "SOUTH VAZHAKKULAM P.O., ALUVA-683 105.",
        "3 T.C.JOHN, AGED 82 YEARS",
        "S/O.LATE CHERIYAN, RESIDING AT THALACKAVIL VEETIL,",
        "SOUTH VAZHAKKULAM P.O., ALUVA-683 105."
    ],
    "respondents": [
        "STATE & DEFACTO COMPLAINANT:",
        "1 STATE OF KERALA",
        "REPRESENTED BY THE PUBLIC PROSECUTOR,",
        "HIGH COURT OF KERALA, ERNAKULAM-682 031.",
        "2 SEN THOMAS, AGED 50 YEARS",
        "S/O.THOMAS, ALACKAL HOUSE, KOVALLOR,",
        "AMBOORY VILLAGE, KATTAKADA TALUK,",
        "THIRUVANANTHAPURAM DISTRICT.",
        "Rl BY PUBLIC PROSECUTOR SRI.SANTHOSH PETER"
    ],
    "sections": [],
    "outcome": "",
    "full_text": "Pats Bl\npo roe og\nieee\nBla\n2021/KER/1215\nIN THE HIGH COURT OF KERALA AT ERNAKULAM\nPRESENT\nTHE HONOURABLE MR. JUSTICE P.V.KUNHIKRISHNAN\nFRIDAY, THE 08TH DAY OF JANUARY 2021 / 18TH POUSHA, 1942\nCrl.MC.No.333 OF 2015\nCRIME NO.2440/2014 OF Perumbavoor Police Station.\nPETITIONERS /ACCUSED:\n1 SAIJU JOHN, AGED 45 YEARS\nS/O.T.C.JOHN, RESIDING AT THALACKAVIL VEETIL,\nSOUTH VAZHAKKULAM P.O., ALUVA-683 105.\n2 LAIJU JOHN, AGED 46 YEARS\nS/O.T.C.JOHN, RESIDING AT THALACKAVIL VEETIL,\nSOUTH VAZHAKKULAM P.O., ALUVA-683 105.\n3 T.C.JOHN, AGED 82 YEARS\nS/O.LATE CHERIYAN, RESIDING AT THALACKAVIL VEETIL,\nSOUTH VAZHAKKULAM P.O., ALUVA-683 105.\nBY ADVS.\nSRI.P.THOMAS GEEVERGHESE\nSRI.TONY THOMAS (INCHIPARAMBIL)\nRESPONDENT/STATE & DEFACTO COMPLAINANT:\n1 STATE OF KERALA\nREPRESENTED BY THE PUBLIC PROSECUTOR,\nHIGH COURT OF KERALA, ERNAKULAM-682 031.\n2 SEN THOMAS, AGED 50 YEARS\nS/O.THOMAS, ALACKAL HOUSE, KOVALLOR,\nAMBOORY VILLAGE, KATTAKADA TALUK,\nTHIRUVANANTHAPURAM DISTRICT.\nRl BY PUBLIC PROSECUTOR SRI.SANTHOSH PETER\nTHIS CRIMINAL MISC. CASE HAVING BEEN FINALLY HEARD ON\n08.01.2021, THE COURT ON THE SAME DAY PASSED THE FOLLOWING:\n\nCr1.MC.No.333 OF 2015 2 2021/KER/I215\nORDER\nDated this the 8th day of January 2021\n\nThis petition is filed to quash the proceedings in Crime\nNo.2440/2014 of Perumbavoor Police Station.\n\n2. When this matter came up for consideration, the\nlearned Public Prosecutor submitted that after investigation the\ncase is referred.\n\nRecording the above submission, this Criminal\nMiscellaneous Case is dismissed.\nSd/-\nP.V.KUNHIKRISHNAN\nJUDGE\nab\n\nPats Bl\npo roe og\nBe\nCrl.MC.No.333 OF 2015 3 2021/KER/I215\nAPPENDIX\nPETITIONERS EXHIBITS:\nANNEXURE-A. COPY OF THE FIR NO.224/2014 OF PERUMBAVOOR\nPOLICE STATION, FORWARDED TO JFCMC-PERUMBAVOOR.\nANNEXURE-B. COPY OF THE SALE DEED NO.567/2010 OF\nPERUMBAVOOR SUB REGISTRY OFFICE.\nANNEXURE-C. COPY OF THE SALE DEED NO.568/2010 OF\nPERUMBAVOOR SUB REGISTRY OFFICE.\nANNEXURE-D. COPY OF THE OS NO.21/2014 ON THE FILES OF\nHONOURABLE SUBORDINATE JUDGE, PERUMBAVOOR.\nANNEXURE-E. COPY OF THE WRITTEN STATEMENT OF PETITIONERS\nIN OS 21/2014 ON THE FILES OF THE HONOURABLE SUBORINDATE\nJUDGE, PERUMBAVOOR.\nRESPONDENTS ANNEXURES : NIL\n//TRUE COPY//\nP.A TO JUDGE\nab\n\n"
}