{
    "case_id": "Crl.MC.No. 6729 of 2016",
    "court": "HIGH COURT OF KERALA AT ERNAKULAM\nPRESENT",
    "date": "10TH DAY OF JANUARY 2017",
    "judge": "SUNIL THOMAS\nTUESDAY",
    "petitioners": [
        "ACCUSED:",
        "SANTHOSH KUMAR,",
        "S/O.SANKARAN NAIR, CHEMBAKASSERY THAZHATHU VEEDU,",
        "VATTAPARAMBU P.O., KODUSSERI, ERNAKULAM DISTRICT."
    ],
    "respondents": [
        "(S)/STATE & DEFACTO COMPLAINANT:",
        "1. THE STATE OF KERALA,",
        "REPRESENTED BY THE PUBLIC PROSECUTOR,",
        "HIGH COURT OF KERALA, ERNAKULAM,",
        "KOCHI - 682 031, FOR ANGAMALY POLICE STATION,",
        "ERNAKULAM DISTRICT.",
        "2. HEMACHANDRAN,",
        "S/O.CHELLAPPAN, NADAYILPARAMBIL HOUSE,",
        "KARUVATTA, ALAPPUZHA DISTRICT, PIN - 690 517.",
        "R2 BY ADV. SMT.M.LISHA"
    ],
    "sections": [],
    "outcome": "",
    "full_text": "Dsl\n55 4\nMeta tees\n2017/KER/1235\nIN THE HIGH COURT OF KERALA AT ERNAKULAM\nPRESENT :\nTHE HONOURABLE MR. JUSTICE SUNIL THOMAS\nTUESDAY, THE 10TH DAY OF JANUARY 2017/20TH POUSHA, 1938\nCrl.MC.No. 6729 of 2016 ()\nCRIME NO. 1564/2013 OF ANGAMALI POLICE STATION , ERNAKULAM\nPETITIONER/ACCUSED:\nSANTHOSH KUMAR,\nS/O.SANKARAN NAIR, CHEMBAKASSERY THAZHATHU VEEDU,\nVATTAPARAMBU P.O., KODUSSERI, ERNAKULAM DISTRICT.\nBY ADV. SRI.BABU S. NAIR\nRESPONDENT (S)/STATE & DEFACTO COMPLAINANT:\n1. THE STATE OF KERALA,\nREPRESENTED BY THE PUBLIC PROSECUTOR,\nHIGH COURT OF KERALA, ERNAKULAM,\nKOCHI - 682 031, FOR ANGAMALY POLICE STATION,\nERNAKULAM DISTRICT.\n2. HEMACHANDRAN,\nS/O.CHELLAPPAN, NADAYILPARAMBIL HOUSE,\nKARUVATTA, ALAPPUZHA DISTRICT, PIN - 690 517.\nR2 BY ADV. SMT.M.LISHA\nBY PUBLIC PROSECUTOR:SRI AMJAD ALI\nTHIS CRIMINAL MISC. CASE HAVING BEEN FINALLY HEARD ON\n10-01-2017, THE COURT ON THE SAME DAY PASSED THE FOLLOWING:\n\nDsl\nBr 1\nMeta tees\nape\n2017/KER/1235\nCr1.MC.No. 6729 of 2016 ()\nAPPENDIX\nPETITIONER (S)' EXHIBITS\nANNEXURE A. TRUE COPY OF THE F.I.R AND F.I.S. IN CRIME\nNO.1564/2013 OF ANGAMALY POLICE STATION DATED 30.06.2013.\nANNEXURE B. TRUE COPY OF THE AFFIDAVIT SWORN TO BY THE 2ND\nRESPONDENT DATED, 03.10.2016.\nRESPONDENT (S)' EXHIBITS:NIL\nTrue Copy /\nP A to Judge\n\n2017/KER/1235\nSUNIL THOMAS, J.\nCr1.M.C.No.6729 of 2016\nDated this the 10 day of January, 2017\nORDER\nLearned Public Prosecutor on instructions submitted that\nthe petitioner herein has not been arrayed as an accused in this\ncase till now. In the light of above, Crl.M.C is closed reserving the\nright of the petitioner herein to move at the appropriate stage in\ncase such an eventuality arises.\nSd/-\nSUNIL THOMAS\nJudge\nSbna/10/1/17\nTrue Copy /\nP A to Judge\n\n"
}