{
    "case_id": "Crl.MC.No.5176 OF 2014",
    "court": "HIGH COURT OF KERALA AT ERNAKULAM",
    "date": "7TH DAY OF JANUARY 2021",
    "judge": "V.G.ARUN\nTHURSDAY",
    "petitioners": [
        "ACCUSED:",
        "SREERANGARAYAN",
        "AGED 55 YEARS",
        "S/O.RANGASWAMI , MATTATHUKADU, KULIKKOOR, ANAKATTY,",
        "AGALT ,MANNARKKAD, PALAKKAD"
    ],
    "respondents": [
        "STATE:",
        "1 STATE OF KERALA",
        "REP BY PUBLIC PROSECUTOR, HIGH COURT OF",
        "KERALA , ERNAKULAM-682031, (CRIME NO 137/2014 OF",
        "SHOLAYAR POLICE STATION, PALAKKAD DIST)",
        "2 SAROJAM",
        "W/O.RAMAKRISHNAN, KULUKKOR, ANAKKATTY, SHOLAYAR,",
        "PALAKKAD DIST-678581",
        "OTHER PRESENT:",
        "PP T.R.RENJITH"
    ],
    "sections": [],
    "outcome": "",
    "full_text": "FS ae: A\nleo\nIN THE HIGH COURT OF KERALA AT ERNAKULAM 202 1/KER/993\nPRESENT\nTHE HONOURABLE MR.JUSTICE V.G.ARUN\nTHURSDAY, THE O7TH DAY OF JANUARY 2021 / 17TH POUSHA, 1942\nCrl1.MC.No.5176 OF 2014\nCRIME NO.137/2014 OF Sholayar Police Station , Palakkad\nPETITIONER/ACCUSED:\nSREERANGARAYAN\nAGED 55 YEARS\nS/O.RANGASWAMI , MATTATHUKADU, KULIKKOOR, ANAKATTY,\nAGALT ,MANNARKKAD, PALAKKAD\nBY ADVS.\nSRI .S .RAJEEV\nSRI .K.K. DHEERENDRAKRISHNAN\nRESPONDENT/ STATE:\n1 STATE OF KERALA\nREP BY PUBLIC PROSECUTOR, HIGH COURT OF\nKERALA , ERNAKULAM-682031, (CRIME NO 137/2014 OF\nSHOLAYAR POLICE STATION, PALAKKAD DIST)\n2 SAROJAM\nW/O.RAMAKRISHNAN, KULUKKOR, ANAKKATTY, SHOLAYAR,\nPALAKKAD DIST-678581\nOTHER PRESENT:\nPP T.R.RENJITH\nTHIS CRIMINAL MISC. CASE HAVING COME UP FOR ADMISSION ON\n07.01.2021, THE COURT ON THE SAME DAY PASSED THE FOLLOWING:\n\neee\nCrl1.MC.No.5176 OF 2014 Qe, 202UKERIO93\nORDER\nDated this the 7th day of January 2021\nThe prayer in this Criminal M.C. is to quash the\nproceedings in Crime No.137/2014 of Sholayar Police\nStation. Being a Criminal M.C. of the year 2014,\npertaining to a crime of 2014, a report was called for\nfrom the jurisdictional Court. It is reported by the\nSpecial Judge for SC/ST (POA) Act case, Mannarkkad\nthat, the police, on completion of investigation, has\nfiled a refer report finding the allegations to be false.\nTherefore, nothing survives for consideration\nand accordingly, the Criminal M.C. is closed.\nSd/-\nV.G.ARUN\nSB/07/01/2021 JUDGE\n\nFe athe x\nBlea\nCrl.MC.No.5176 OF 2014 3... 2021/KER/993\nAPPENDIX\nPETITIONER'S/S EXHIBITS:\nANNEXURE P1 ANNEXURE 1:-COPY OF THE ADVOCATE\nNOTICE DTD 15/5/2014\nANNEXURE P2 ANNEXURE II:COPY OF THE FIRST\nINFORMATION REPORT ALONG WITH FIRST\nINFORMATION STATEMENT IN CRIME NO\n137/2014 OF SHOLAYAR POLICE STATION\n//true copy// P.A to Judge\n\n"
}