{
    "case_id": "",
    "court": "HIGH COURT OF KERALA AT ERNAKULAM\nPRESENT\nTHE HONOURABLE MRS",
    "date": "41 DAY OF JANUARY 2024",
    "judge": "SOPHY THOMAS\nWEDNESDAY",
    "petitioners": [
        "REMA MOHAN",
        "AGED 62 YEARS",
        "W/O. MOHANAN NIKARTHIL HOUSE ,POYAPALLI , VADAKKEKKARA",
        "NORTH PARAVOOR TALUK ERNAKULAM DISTRICT, PIN - 683513"
    ],
    "respondents": [
        "S:",
        "1 STATE OF KERALA",
        "REPRESENTED BY PUBLIC PROSECUTOR, HIGH COURT OF KERALA,",
        "PIN - 682031",
        "2 M/S .MUTHOOT FIN CORP LTD",
        "EMMY SQUARE ,NEAR DREAM HOTEL ELAMKULAM VYTTILA KOCHI,",
        "PIN - 682019",
        "OTHER PRESENT:",
        "PP-SRI.PRASANTH M.P."
    ],
    "sections": [],
    "outcome": "",
    "full_text": "Lean\nEl anes 4\n2024/KER/4240\nIN THE HIGH COURT OF KERALA AT ERNAKULAM\nPRESENT\nTHE HONOURABLE MRS. JUSTICE SOPHY THOMAS\nWEDNESDAY, THE 17Â°41 DAY OF JANUARY 2024 / 27TH POUSHA, 1945\nCRL.MC NO. 334 OF 2024\nAGAINST THE ORDER/JUDGMENT CRMP 1961/2013 OF JUDICIAL MAGISTRATE\nOF FIRST CLASS -II, ERNAKULAM\nCRRP 85/2013 OF ADDITIONAL SESSIONS COURT (ADHOC)-II, ERNAKULAM\nPETITIONER:\nREMA MOHAN\nAGED 62 YEARS\nW/O. MOHANAN NIKARTHIL HOUSE ,POYAPALLI , VADAKKEKKARA\nNORTH PARAVOOR TALUK ERNAKULAM DISTRICT, PIN - 683513\nBY ADVS.\nG.HARTHARAN\nPRAVEEN.H.\nK.S.SMITHA\nB.R.SINDU\nV.R.SANJEEV KUMAR\nRESPONDENTS:\n1 STATE OF KERALA\nREPRESENTED BY PUBLIC PROSECUTOR, HIGH COURT OF KERALA,\nPIN - 682031\n2 M/S .MUTHOOT FIN CORP LTD\nEMMY SQUARE ,NEAR DREAM HOTEL ELAMKULAM VYTTILA KOCHI,\nPIN - 682019\nOTHER PRESENT:\nPP-SRI.PRASANTH M.P.\nTHIS CRIMINAL MISC. CASE HAVING COME UP FOR ADMISSION ON\n17.01.2024, THE COURT ON THE SAME DAY PASSED THE FOLLOWING:\n\nree\nEl ane\n2024/KER/4240\nCRL.MC NO.334 OF 2024 2\nORDER\nThe learned counsel for the petitioner seek permission\nto withdraw this Crl.M.C. The permission sought for is granted\nand the Crl.M.C is dismissed as withdrawn.\nAccordingly, this Crl.M.C is dismissed as withdrawn.\nSd/-\nSOPHY THOMAS\nJUDGE\nska\n\n"
}