{
    "case_id": "",
    "court": "HIGH COURT OF KERALA AT ERNAKULAM\nPRESENT\nTHE HONOURABLE MR",
    "date": "",
    "judge": "BECHU KURIAN THOMAS\nTUESDAY",
    "petitioners": [
        ":",
        "SHIJI S.,",
        "AGED 36 YEARS, W/O KENSI JOHNSON,",
        "RESIDING AT M.J. BHAVAN, CHATHINAMKULAM,",
        "CHANDANATHOPE P.O., PERINAD,",
        "KOLLAM, PIN — 691 014"
    ],
    "respondents": [
        ":",
        "STATE OF KERALA,",
        "REPRESENTED BY PUBLIC PROSECUTOR,",
        "HIGH COURT OF KERALA, PIN — 682 031"
    ],
    "sections": [
        "403",
        "406",
        "409",
        "420",
        "465",
        "468",
        "471 read with\nSection 34 of the Indian Penal code",
        "1860"
    ],
    "outcome": "",
    "full_text": "ana\nae\nBae\n2024/KER/1165\nIN THE HIGH COURT OF KERALA AT ERNAKULAM\nPRESENT\nTHE HONOURABLE MR. JUSTICE BECHU KURIAN THOMAS\nTUESDAY, THE 97 pay OF JANUARY 2024 / 19TH POUSHA, 1945\nCRL.MC NO. 157 OF 2024\nCRIME NO.3665/2017 OF Kollam East Police Station, Kollam\ncc 34/2018 OF CHIEF JUDICIAL MAGISTRATE, KOLLAM\nPETITIONER :\nSHIJI S.,\nAGED 36 YEARS, W/O KENSI JOHNSON,\nRESIDING AT M.J. BHAVAN, CHATHINAMKULAM,\nCHANDANATHOPE P.O., PERINAD,\nKOLLAM, PIN — 691 014\nBY ADVS.\nR.N.SANDEEP\nB.MUHAMMED SHAHEEL\nKEERTHI VIJAYAN\nATHIRA UTHAMAN\nRESPONDENT :\nSTATE OF KERALA,\nREPRESENTED BY PUBLIC PROSECUTOR,\nHIGH COURT OF KERALA, PIN — 682 031\nSMT. V. SREEJA, PUBLIC PROSECUTOR\nTHIS CRIMINAL MISC. CASE HAVING COME UP FOR ADMISSION ON\n09.01.2024, THE COURT ON THE SAME DAY PASSED THE FOLLOWING:\n\nBaer\n2024/KER/1165\nCRL.MC NO. 157 OF 2024\n2\nBECHU KURIAN THOMAS, J.\nCri.M.C.No.157 of 2024\nDated this the 9\" day of January, 2024\nORDER\n\nPetitioner seeks for a direction to stay all further proceedings in\nC.C.No.34 of 2018 on the files of the Chief Judicial Magistrate's Court,\nKollam, for a period of nine months.\n\n2. Petitioner is the first accused in C.C.No.34 of 2018 on the files\nof the Chief Judicial Magistrate's Court, Kollam. On 01.12.2023, charge\nwas framed under Sections 403, 406, 409, 420, 465, 468 and 471 r/w\nSection 34 of the Indian Penal code, 1860. On the said date, summons\nwas issued to CWi to give evidence on 10.01.2024 (tomorrow).\nSummons have also been issued to CW2 to CW4 to give evidence on\n15.01.2024 and CW5 to CW9 on 16.01.2024 and CW10 on 22.01.2024.\nIt is evident that trial has already been scheduled and summons have\nbeen issued to the witnesses. In such circumstances, interference with\nthe scheduled trial is not legally permissible.\n\nHence, I find no merit in this Cril.M.C.and the same is dismissed.\n\nSd/-\nBECHU KURIAN THOMAS, JUDGE\nRKM\n\niE ceva\nee\n2024/KER/1165\nCRL.MC NO. 157 OF 2024\n3\nAPPENDIX OF CRL.MC 157/2024\nPETITIONER'S ANNEXURES :\nAnnexure Al TRUE COPY OF THE FIR IN C.C. NO. 34/2018\nIN CRIME NO. 3665 OF 2017 IN KOLLAM EAST\nPOLICE STATION ON THE FILES THE HON'BLE\nCHIEF JUDICIAL MAGISTRATE COURT, KOLLAM\nAnnexure A2 TRUE COPY OF THE MEDICAL CERTIFICATE\nISSUED BY THE DOCTOR TO PETITIONER\nAnnexure A3 TRUE COPY OF THE ONLINE COURT DAIRY OF\nC.C. NO. 34/2018 ON THE FILES OF THE\nHON'BLE CHIEF JUDICIAL MAGISTRATE COURT,\nKOLLAM\n\n"
}