{
    "case_id": "Crl.MC.No. 8936 of 2018",
    "court": "HIGH COURT OF KERALA AT ERNAKULAM",
    "date": "3RD DAY OF JANUARY 2019",
    "judge": "K.ABRAHAM MATHEW\nTHURSDAY",
    "petitioners": [
        "S /ACCUSED :-",
        "1 SASTDHARAN PILLAT",
        "AGED 65 YEARS",
        "VALIYARKUZHUVILA, PALLICKAL, MYLOM, KOTTRAKARA, KOLLAM",
        "2 KRISHNAN KUTTY NAIR",
        "AGED 68 YEARS",
        "BINDHU BHAVAN, PALLICKAL, MYLOM , KOTTARAKARA, KOLLAM"
    ],
    "respondents": [
        "S/STATE :-",
        "1 STATE OF KERALA",
        "REPRESENTED BY PUBLIC PROSECUTOR,",
        "HIGH COURT OF KERALA",
        "2 GOPAKUMAR",
        "AGED 62 YEARS",
        "S/O. GOPALA PILLAI,",
        "ARYA BHAVAN, PALLICKAL, MYLOM, KOTTRAKARA,",
        "KOLLAM - 691 001."
    ],
    "sections": [
        "482 Cr"
    ],
    "outcome": "ORDER\n\nPetition filed under section 482 Cr.P.C.\n\n2. Petitioners are accused in Crime\nNo.2549 of 2018 of Kottarakara Police Station\nregistered for the offences under sections 294(b),\n308, 324, 326 and 447 IPC. The second respondent\nis the victim. It is submitted that the matter has\nbeen settled and the proceedings in the trial court\nmay be quashed",
    "full_text": "Laas Gets a\nral\nPa\nIN THE HIGH COURT OF KERALA AT ERNAKULAM 201/KER/169\nPRESENT\nTHE HONOURABLE MR. JUSTICE K.ABRAHAM MATHEW\nTHURSDAY ,THE O3RD DAY OF JANUARY 2019 / 13TH POUSHA, 1940\nCr1.MC.No. 8936 of 2018\nCRIME NO. 2549/2018 OF Kottarakkara Police Station , Kollam\nPETITIONERS /ACCUSED :-\n1 SASTDHARAN PILLAT\nAGED 65 YEARS\nVALIYARKUZHUVILA, PALLICKAL, MYLOM, KOTTRAKARA, KOLLAM\n2 KRISHNAN KUTTY NAIR\nAGED 68 YEARS\nBINDHU BHAVAN, PALLICKAL, MYLOM , KOTTARAKARA, KOLLAM\nBY ADV. SRI.SYAM J SAM\nRESPONDENTS/STATE :-\n1 STATE OF KERALA\nREPRESENTED BY PUBLIC PROSECUTOR,\nHIGH COURT OF KERALA\n2 GOPAKUMAR\nAGED 62 YEARS\nS/O. GOPALA PILLAI,\nARYA BHAVAN, PALLICKAL, MYLOM, KOTTRAKARA,\nKOLLAM - 691 001.\nBY ADV. SMT.JISHA P.C.\nR1 BY SRI C S HRITHWIK-PUBLIC PROSECUTOR\nTHIS CRIMINAL MISC. CASE HAVING COME UP FOR ADMISSION ON\n03.01.2019, THE COURT ON THE SAME DAY PASSED THE FOLLOWING:\n\nPisgah\nbaat\nCrl.MC.No. 8936 of 2018 2019 IKERITO?\n2\nORDER\n\nPetition filed under section 482 Cr.P.C.\n\n2. Petitioners are accused in Crime\nNo.2549 of 2018 of Kottarakara Police Station\nregistered for the offences under sections 294(b),\n308, 324, 326 and 447 IPC. The second respondent\nis the victim. It is submitted that the matter has\nbeen settled and the proceedings in the trial court\nmay be quashed.\n\n3. Heard the learned counsel for the\npetitioners and second respondent and the learned\nPublic Prosecutor.\n\n4. I have perused the affidavit filed by\nthe second respondent, who has entered appearance\nthrough counsel. I am satisfied that the matter\nhas been settled and no public interest is involved\nin this case. There is no impediment for granting\nthe prayer of the petitioners.\n\nIn the result, this Crl.M.C is allowed.\nThe proceedings in Crime No.2549 of 2018 of\n\npee el\nTerres a\nSoe\nBiase\nCrl.MC.No. 8936 of 2018 2019 IKERITO?\n3\nKottarakara Police Station are quashed. If any\nmaterial objects have been produced in this case,\nthe trial court may pass appropriate orders for\ntheir disposal.\nK.ABRAHAM MATHEW,\nJUDGE\nSMA\n\nBuse\nLaas Gets a\nral\nBases\nCr1.MC.No, 8936 of 2018 2019/KER/169\n4\nAPPENDIX\nPETITIONER'S/S ANNEXURES :-\nANNEXURE Al THE TRUE COPY OF THE FIR IN CRIME NUMBER\n2549/2018 OF KOTTARAKARA POLICE STATION\nANNEXURE A2 THE TRUE COPY OF THE AFFIDAVIT FILED BY\nTHE SECOND RESPONDENT\nRESPONDENT (S)' ANNEXURES :- NIL\n/ / TRUE CoPy/ /\nPA TO JUDGE\nSMA\n\n"
}