{
    "case_id": "",
    "court": "HIGH COURT OF KERALA AT ERNAKULAM",
    "date": "8TH DAY OF JANUARY 2019",
    "judge": "B.SUDHEENDRA KUMAR\nTUESDAY",
    "petitioners": [
        "S/ACCUSED:",
        "BABY MATHEW,",
        "AGED 51 YEARS",
        "S/O. MATHEW, KAROTTU KIZHAKKETHIL HOUSE, MULLAKKANAM",
        "KARA, RAJAKKAD VILLAGE, UDUMBANCHOLA TALUK, IDUKKI",
        "DISTRICT."
    ],
    "respondents": [
        "S/COMPLAINANT & STATE:",
        "1 THE EXCISE INSPECTOR",
        "EXCISE RANGE OFFICE, UDUMBANCHOLA, IDUKKI DISTRICT",
        "2 STATE OF KERALA",
        "REPRESENTED BY THE PUBLIC PROSECUTOR, HIGH COURT OF",
        "KERALA, ERNAKULAM, KOCHI-682 031"
    ],
    "sections": [],
    "outcome": "",
    "full_text": "Baal\npe Shiney\nope\nIN THE HIGH COURT OF KERALA AT ERNAKULAM 2019/KERI783\nPRESENT\nTHE HONOURABLE MR. JUSTICE B.SUDHEENDRA KUMAR\nTUESDAY ,THE O8TH DAY OF JANUARY 2019 / 18TH POUSHA, 1940\nCr1.MC.No. 154 of 2019\nCRIME NO. 15/2018 OF UDUMBANCHOLA EXCISE RANGE, IDUKKI DISTRICT\nPETITIONER/S/ACCUSED:\nBABY MATHEW,\nAGED 51 YEARS\nS/O. MATHEW, KAROTTU KIZHAKKETHIL HOUSE, MULLAKKANAM\nKARA, RAJAKKAD VILLAGE, UDUMBANCHOLA TALUK, IDUKKI\nDISTRICT.\nBY ADVS.\nSRI.NIREESH MATHEW\nSRI.ARUN JOSE THOMAS\nSRI.BABU JOSE\nSRI.N.P. PRAJEESH\nSRI.SEBIN SEBASTIAN\nSRI.VIVEK VENUGOPAL\nRESPONDENT/S/COMPLAINANT & STATE:\n1 THE EXCISE INSPECTOR\nEXCISE RANGE OFFICE, UDUMBANCHOLA, IDUKKI DISTRICT\n2 STATE OF KERALA\nREPRESENTED BY THE PUBLIC PROSECUTOR, HIGH COURT OF\nKERALA, ERNAKULAM, KOCHI-682 031\nBY PUBLIC PROSECUTOR, SRI E C BINEESH\nTHIS CRIMINAL MISC. CASE HAVING COME UP FOR ADMISSION ON\n08.01.2019, THE COURT ON THE SAME DAY PASSED THE FOLLOWING:\n\nBee\n2019/KER/783\nCr1.MC.No. 154 of 2019\n2\nORDER\n\nThe prayer in this Crl.M.C. is to issue a direction to\nthe investigating officer to complete the investigation\nand file the final report in C.R.No.15 of 2018 of\nUdumbanchola Excise Range, within a time frame.\n\n2. Heard.\n\n3. The learned Public Prosecutor has submitted\nthat the above crime was registered only on\n19.04.2018 and hence, atleast a period of three months\nis required for completing the investigation. In view of\nthe above submission, no direction is required at\npresent in this Crl.M.C.\n\nDene)\nene\nBoe\n2019/KER/783\nCr1.MC.No. 154 of 2019\n3\nIn the result, this Crl.M.C. stands closed.\nHowever, this order will not stand in the way of\nthe petitioner in approaching this Court again after a\nperiod of three months, if the situation so warrants.\nSd/-\nB.SUDHEENDRA KUMAR\nRK/09.01.2018 JUDGE\n{TRUE COPY//\nPA TO JUDGE\n\nBaal\nâ€œERE\nop!\n2019/KER/783\nCrl1.MC.No. 154 of 2019\n4\nAPPENDIX\nPETITIONER'S/S EXHIBITS:\nANNEXURE A CERTIFIED COPY OF THE CRIME AND\nOCCURRENCE REPORT IN C.R. NO. 15/2018\nOF UDUMBANCHOLA EXCISE RANGE DATED\n19.4.2018\nANNEXURE B TRUE PHOTOCOPY OF THE NOTICE ISSUED BY\nTHE DEPUTY COMMISSIONER OF EXCISE,\nIDUKKI.\nANNEXURE C TRUE PHOTOCOPY OF THE REPLY SUBMITTED\nBY THE PETITIONER TO THE DEPUTY\nCOMMISSIONER OF EXCISE, IDUKKI DATED\n02.06.2018\nRESPONDENT'S/S EXHIBITS: NIL\nITRUE COPY//\nPA TO JUDGE\n\n"
}