{
    "case_id": "",
    "court": "HIGH COURT OF KERALA AT ERNAKULAM\nPRESENT",
    "date": "5TH DAY OF MAY 2015",
    "judge": "P.UBAID\nTUESDAY",
    "petitioners": [
        "S/ACCUSED 3, 5, 8,10 & 13 :",
        "1. SHEREEF, AGED 35 YEARS,",
        "S/O.ABOOBACKER, RESIDING AT AP.ROAD, THAIKADAPPURAM,",
        "NILESHWAR VILLAGE, HOSDURG TALUK, KASARAGOD DISTRICT",
        "2. NABEEL, AGED 32 YEARS,",
        "S/O.ABDULLA, RESIDING AT SEA ROAD, THAIKADAPPURAM",
        "NILESHWAR VILLAGE, HOSDURG TALUK, KASARAGOD DISTRICT",
        "3. ASHRAF.C.K., AGED 31 YEARS,",
        "S/O.RABIYA, RESIDING AT CHENAMMADAM HOUSE,",
        "THAIKADAPPURAM, NILESHWAR VILLAGE, HOSDURG TALUK,",
        "KASARAGOD DISTRICT",
        "4, RAFFI, AGED 32 YEARS,",
        "S/O. IBRAHIM, RESIDING AT NALUPURAPATTIL HOUSE,",
        "THAIKADAPPURAM, NILESHWAR VILLAGE, HOSDURG TALUK,",
        "KASARAGOD DISTRICT",
        "5. RIYAS, AGED 28 YEARS,",
        "$/O.KUNHI MOIDEEN, RESIDING AT PALICHON ROAD,",
        "THAIKADAPPURAM, NILESHWAR VILLAGE, HOSDURG TALUK,",
        "KASARAGOD DISTRICT"
    ],
    "respondents": [
        "ISTATE :",
        "THE STATE OF KERALA",
        "THROUGH THE STATION HOUSE OFFICER,",
        "NILESWAR POLICE STATION, KASARAGOD DISTRICT",
        "REPRESENTED BY THE PUBLIC PROSECUTOR,",
        "HIGH COURT OF KERALA, ERNAKULAM 682031"
    ],
    "sections": [
        "143",
        "147",
        "148",
        "452",
        "323",
        "427\nread with149 IPC"
    ],
    "outcome": "ORDER\n\nThe petitioners herein are the original accused\nNos.3,5,8,10 and 13 in C.C. No.951/2011 of the Judicial First\nClass Magistrate Court-ll, Hosdurg. The offences involved in\nthis case are under Sections 143,147,148,452,323 and 427\nread with149 IPC. The original accused Nos.1,2,4,6,7,9,11,12\nand 14 faced trial before the learned Magistrate, and obtained\na judgment of acquittal on 02.03.2015 under Section 248(1)\nCr.P.C., when all the material witnesses turned hostile to the\nprosecution in view of an amicable settlement made by the\nparties out of court. The prosecution examined twelve\nwitnesses in the said case and marked Ext.P1. None of the\nmaterial witnesses examined in the case supported the\nprosecution. In the absence of any evidence or incriminating\ncircumstance, the learned Magistrate acquitted the accused\nNos.1,2,4,6,7,9,11,12 and 14. The case against the petitioners\nherein was split up and refiled as C.C.280/2015. The petitioners\nnow seek orders quashing the prosecution as against them on\nthe ground that the very substratum of the prosecution case is\n\nnee)\n2015/KER/17602\n\nCri.M.C. No.2670 of 2015 2\n\ntotally lost by the acquittal of the others, and continuance of\nprosecution against them will not serve any purpose. Annexure\n\n- A3 judgment in C.C.951/2011 shows that all the material\nwitnesses examined by the prosecution in the said case turned\nhostile in view of an amicable settlement made by the parties\n\nout of court. In such a situation, it is quite definite that the\nprosecution cannot in any manner improve the case and the\nwitnesses also cannot in any manner help the prosecution, if\n\nthe case against the petitioners goes to trial. In short, such\nproceeding will be a sheer waste of time.\n\nIn the result, this petition is allowed. The prosecution\nagainst the petitioners in C.C.280/2015 of the Judicial First\nClass Magistrate Court-ll, Hosdurg will stand quashed",
    "full_text": "Beane\nBeet\n2015/KER/17602\nIN THE HIGH COURT OF KERALA AT ERNAKULAM\nPRESENT:\nTHE HONOURABLE MR. JUSTICE P.UBAID\nTUESDAY, THE 5TH DAY OF MAY 2015/15TH VAISAKHA, 1937\nCri.MC.No. 2670 of 2015 ()\nCC 280/2015 of JUDICIAL FIRST CLASS MAGISTRATE COURT-IILHOSDRUG\nCRIME NO. 613/2010 OF NILESWAR POLICE STATION, KASARGOD\nPETITIONERS/ACCUSED 3, 5, 8,10 & 13 :\n1. SHEREEF, AGED 35 YEARS,\nS/O.ABOOBACKER, RESIDING AT AP.ROAD, THAIKADAPPURAM,\nNILESHWAR VILLAGE, HOSDURG TALUK, KASARAGOD DISTRICT\n2. NABEEL, AGED 32 YEARS,\nS/O.ABDULLA, RESIDING AT SEA ROAD, THAIKADAPPURAM\nNILESHWAR VILLAGE, HOSDURG TALUK, KASARAGOD DISTRICT\n3. ASHRAF.C.K., AGED 31 YEARS,\nS/O.RABIYA, RESIDING AT CHENAMMADAM HOUSE,\nTHAIKADAPPURAM, NILESHWAR VILLAGE, HOSDURG TALUK,\nKASARAGOD DISTRICT\n4, RAFFI, AGED 32 YEARS,\nS/O. IBRAHIM, RESIDING AT NALUPURAPATTIL HOUSE,\nTHAIKADAPPURAM, NILESHWAR VILLAGE, HOSDURG TALUK,\nKASARAGOD DISTRICT\n5. RIYAS, AGED 28 YEARS,\n$/O.KUNHI MOIDEEN, RESIDING AT PALICHON ROAD,\nTHAIKADAPPURAM, NILESHWAR VILLAGE, HOSDURG TALUK,\nKASARAGOD DISTRICT\nBY ADV. SRI.T.MADHU\nRESPONDENTISTATE :\nTHE STATE OF KERALA\nTHROUGH THE STATION HOUSE OFFICER,\nNILESWAR POLICE STATION, KASARAGOD DISTRICT\nREPRESENTED BY THE PUBLIC PROSECUTOR,\nHIGH COURT OF KERALA, ERNAKULAM 682031\nBY PUBLIC PROSECUTOR SRI. K.K. SAIDALAVI\nTHIS CRIMINAL MISC. CASE HAVING COME UP FOR ADMISSION\nON 05-05-2015, THE COURT ON THE SAME DAY PASSED THE\nFOLLOWING:\nbp\n\nBiehl\n2015/KER/17602\nCri.MC.No. 2670 of 2015 ()\nAPPENDIX\nPETITIONER(S)' EXHIBITS\nANNEXURE AI: THE TRUE CERTIFIED COPY OF THE FIR IN CRIME NO.613/2010\nOF NILESHWAR POLICE STATION.\nANNEXURE A2:THE TRUE CERTIFIED COPY OF THE FINAL REPORT IN CRIME\nNO.613/2010 OF NILESWAR POLICE STATION.\nANNEXURE A3:THE TRUE CERTIFIED COPY OF THE JUDGMENT DATED 02.03.2015\nIN CC.NO.951/2011 ON THE FILES OF THE LEARNED JUDICIAL FIRST\nCLASS MAGISTRATE COURT II, HOSDURG\nRESPONDENT(S)â€™ EXHIBITS : NIL.\nHTRUE COPY//\nPA. TO JUDGE\nbp\n\nBier)\n2015/KER/17602\nP. UBAID, J.\nDated this the 5\" day of May, 2015\nORDER\n\nThe petitioners herein are the original accused\nNos.3,5,8,10 and 13 in C.C. No.951/2011 of the Judicial First\nClass Magistrate Court-ll, Hosdurg. The offences involved in\nthis case are under Sections 143,147,148,452,323 and 427\nread with149 IPC. The original accused Nos.1,2,4,6,7,9,11,12\nand 14 faced trial before the learned Magistrate, and obtained\na judgment of acquittal on 02.03.2015 under Section 248(1)\nCr.P.C., when all the material witnesses turned hostile to the\nprosecution in view of an amicable settlement made by the\nparties out of court. The prosecution examined twelve\nwitnesses in the said case and marked Ext.P1. None of the\nmaterial witnesses examined in the case supported the\nprosecution. In the absence of any evidence or incriminating\ncircumstance, the learned Magistrate acquitted the accused\nNos.1,2,4,6,7,9,11,12 and 14. The case against the petitioners\nherein was split up and refiled as C.C.280/2015. The petitioners\nnow seek orders quashing the prosecution as against them on\nthe ground that the very substratum of the prosecution case is\n\nnee)\n2015/KER/17602\n\nCri.M.C. No.2670 of 2015 2\n\ntotally lost by the acquittal of the others, and continuance of\nprosecution against them will not serve any purpose. Annexure\n\n- A3 judgment in C.C.951/2011 shows that all the material\nwitnesses examined by the prosecution in the said case turned\nhostile in view of an amicable settlement made by the parties\n\nout of court. In such a situation, it is quite definite that the\nprosecution cannot in any manner improve the case and the\nwitnesses also cannot in any manner help the prosecution, if\n\nthe case against the petitioners goes to trial. In short, such\nproceeding will be a sheer waste of time.\n\nIn the result, this petition is allowed. The prosecution\nagainst the petitioners in C.C.280/2015 of the Judicial First\nClass Magistrate Court-ll, Hosdurg will stand quashed under\nSection 482 of the Code of Criminal Procedure. Accordingly,\nthe petitioners will stand released from prosecution.\n\nSd/-\nP. UBAID, JUDGE\nsd\n\n"
}