{
    "case_id": "",
    "court": "HIGH COURT OF KERALA AT HRNAKULAM",
    "date": "4TH DAY OF JANUARY 2018",
    "judge": "B.KEMAL PASHA\nTHURSDAY",
    "petitioners": [
        "ACCUSED NO.2",
        "SURESH,",
        "AGED 40 YEARS, S/O. SETHUMADHAVAN NAIR,",
        "SINDU NIVAS, PARAKKULAM, KUNISSERY, ALATHUR, PALAKKAD."
    ],
    "respondents": [
        "(S) /DEFACTO COMPLAINANT & STATE",
        "1. RAMACHANDRAN UNNITHAN,",
        "AGED 73 YEARS, S/O. RAGHAVAN UNNITHAN,",
        "SREEVALSAM, MKK NAIR NAGAR,",
        "TRIPUNITHURA, COCHIN-682 301.",
        "2. STATE OF KERALA,",
        "REPRESENTED BY PUBLIC PROSECUTOR,",
        "HIGH COURT OF KERALA, ERNAKULAM-682 031.",
        "R1 BY ADV. SRI.BINDU SREEKUMAR",
        "R2 BY PUBLIC PROSECUTOR SRI. T.R. RENJITH."
    ],
    "sections": [
        "420 IPC\nas against the petitioner"
    ],
    "outcome": "ORDER IN CRL. M.C NO 1634/2017 OF THE COURT OF\nSESSION, ERNAKULAM DIVISION DATED 23-08-2017.\nRESPONDENT (S)' EXHIBITS\nNIL\n// TRUE COPY//\nP.S TO JUDGE.\n\nBape hal\nBISA\n2018/KER/250\nB. KEMAL PASHA, J.\nDated this the 4\" day of January, 2018\nORDER\n\nHeard. On a perusal of the complaint and the allegations\nagainst the 2™ accused, who is the petitioner herein, it seems\nthat at the most the complaint is one of breach of contract and\nnothing more. It cannot invite an offence under Section 420 IPC\nas against the petitioner.\n\n2. Even though, the learned counsel for the 2\"\nrespondent has argued that some documents were forged by the\n2™ accused, there is no such allegation in the complaint.\nMatters being so, all further proceedings in Crime No.1337/2017\nof the Hill Palace Police Station as against the petitioner herein\ncan be quashed",
    "full_text": "Bee Tal\neG\nFade\nesas\nIN THE HIGH COURT OF KERALA AT HRNAKULAM 2018/KER/250\nPRESENT:\nTHE HONOURABLE MR. JUSTICE B.KEMAL PASHA\nTHURSDAY, THE 4TH DAY OF JANUARY 2018 / 14TH POUSHA, 1939\nCr1.MC.No. 7392 of 2017\nCRMC 1634/2017 of I ADDL.DISTRICT COURT, ERNAKULAM\nCRIME NO. 1337/2017 OF HILL PALACE POLICE STATION , ERNAKULAM.\nPETITIONER/ACCUSED NO.2\nSURESH,\nAGED 40 YEARS, S/O. SETHUMADHAVAN NAIR,\nSINDU NIVAS, PARAKKULAM, KUNISSERY, ALATHUR, PALAKKAD.\nBY ADV.SRI.V.A.JOHNSON (VARIKKAPPALLIL)\nRESPONDENT (S) /DEFACTO COMPLAINANT & STATE\n1. RAMACHANDRAN UNNITHAN,\nAGED 73 YEARS, S/O. RAGHAVAN UNNITHAN,\nSREEVALSAM, MKK NAIR NAGAR,\nTRIPUNITHURA, COCHIN-682 301.\n2. STATE OF KERALA,\nREPRESENTED BY PUBLIC PROSECUTOR,\nHIGH COURT OF KERALA, ERNAKULAM-682 031.\nR1 BY ADV. SRI.BINDU SREEKUMAR\nR2 BY PUBLIC PROSECUTOR SRI. T.R. RENJITH.\nTHIS CRIMINAL MISC.CASE HAVING BEEN FINALLY HEARD ON 04-01-2018,\nTHE COURT ON THE SAME DAY PASSED THE FOLLOWING:\nHr....\n\nOe dC\n= a\nBianca reg\n2018/KER/250\nCr1.MC.No. 7392 of 2017\nAPPENDIX\nPETITIONER(S) ' EXHIBITS\nANNEXURE A CERTIFIED COPY OF THE F.I.R NO 1337/2017 OF HILL PALACE POLICE\nSTATION, ERNAKULAM ALONG WITH THE COMPLAINT.\nANNEXURE B TRUE COPY OF THE IDENTITY CARD OF THE PETITIONER.\nANNEXURE C TRUE COPY OF THE SALE AGREEMENT EXECUTED BETWEEN THE PETITIONER'S\nFATHER AND THE 1ST RESPONDENT DATED 04-02-2017.\nANNEXURE D TRUE COPY OF THE CERTIFICATE OF REGISTRATION OF THE VEHICLE\nBEARING REGISTRATION NO KL 05 W 999.\nANNEXURE E TRUE COPY OF THE ORDER IN CRL. M.C NO 1634/2017 OF THE COURT OF\nSESSION, ERNAKULAM DIVISION DATED 23-08-2017.\nRESPONDENT (S)' EXHIBITS\nNIL\n// TRUE COPY//\nP.S TO JUDGE.\n\nBape hal\nBISA\n2018/KER/250\nB. KEMAL PASHA, J.\nDated this the 4\" day of January, 2018\nORDER\n\nHeard. On a perusal of the complaint and the allegations\nagainst the 2™ accused, who is the petitioner herein, it seems\nthat at the most the complaint is one of breach of contract and\nnothing more. It cannot invite an offence under Section 420 IPC\nas against the petitioner.\n\n2. Even though, the learned counsel for the 2\"\nrespondent has argued that some documents were forged by the\n2™ accused, there is no such allegation in the complaint.\nMatters being so, all further proceedings in Crime No.1337/2017\nof the Hill Palace Police Station as against the petitioner herein\ncan be quashed.\n\nIn the result, this Crl.M.C. is allowed and all further\nproceedings as against the petitioner in Crime No.1337/2017 of\nthe Hill Palace Police Station are hereby quashed.\n\nSd/-\nB. KEMAL PASHA, JUDGE.\nse // True Copy // P.A. to Judge\n\n"
}