{
    "case_id": "",
    "court": "HIGH COURT OF KERALA AT BERNAKULAM\nPRESENT\nTHE HONOURABLE MR",
    "date": "6TH DAY OF JANUARY 2020",
    "judge": "P.B.SURESH KUMAR\nMONDAY",
    "petitioners": [
        "ACCUSED:",
        "SHIHAB T.V.,",
        "AGED 31 YEARS, S/O.ABDUL KHADER, RESIDING AT",
        "ORCHA, ORCHA ROAD, KOTTAPPURAM, NEELESHWAR",
        "VILLAGE, KOTTAPPURAM.P.O., HOSDURG TALUK,",
        "KASARAGOD DISTRICT."
    ],
    "respondents": [
        "STATE & DE FACTO COMPLAINANT:",
        "1 THE STATE OF KERALA,",
        "REPRESENTED BY THE PUBLIC PROSECUTOR,",
        "HIGH COURT OF KERALA, ERNAKULAM-682031.",
        "2 THE STATION HOUSE OFFICER,",
        "NEELESWARAM POLICE STATION,",
        "KASARAGOD DISTRICT-671314.",
        "3 SHANIDHA M.,",
        "D/O.SHAFI.P., AGED 25 YEARS, RESIDING AT SHANIDHA",
        "QUARTERS, COLONY ROAD, THAIKKADAPPURAM,",
        "P.O. THATKKADAPPURAM, KASARAGOD DISTRICT-671315.",
        "R3 BY ADV. SRI.M.ABDUL KAREEM"
    ],
    "sections": [
        "482 of\nthe Code of Criminal Procedure for quashing Annexure A2 final\nreport",
        "all further proceedings pursuant thereto now\npending as C"
    ],
    "outcome": "ORDER IN CC NO.1019/2019 OF JUDICIAL MAGISTRATE OF\nFIRST CLASS -II, HOSDRUG\nCRIME NO.303/2019 OF NILESWARAM POLICE STATION, KASARGOD\nPETITIONER/ACCUSED:\nSHIHAB T.V.,\nAGED 31 YEARS, S/O.ABDUL KHADER, RESIDING AT\nORCHA, ORCHA ROAD, KOTTAPPURAM, NEELESHWAR\nVILLAGE, KOTTAPPURAM.P.O., HOSDURG TALUK,\nKASARAGOD DISTRICT.\nBY ADVS.\nSRI .T.MADHU\nSMT .C.R.SARADAMANT\nRESPONDENT/STATE & DE FACTO COMPLAINANT:\n1 THE STATE OF KERALA,\nREPRESENTED BY THE PUBLIC PROSECUTOR,\nHIGH COURT OF KERALA, ERNAKULAM-682031.\n2 THE STATION HOUSE OFFICER,\nNEELESWARAM POLICE STATION,\nKASARAGOD DISTRICT-671314.\n3 SHANIDHA M.,\nD/O.SHAFI.P., AGED 25 YEARS, RESIDING AT SHANIDHA\nQUARTERS, COLONY ROAD, THAIKKADAPPURAM,\nP.O. THATKKADAPPURAM, KASARAGOD DISTRICT-671315.\nR3 BY ADV. SRI.M.ABDUL KAREEM\nSRI. AMJED ALI PP\nTHIS CRIMINAL MISC. CASE HAVING COME UP FOR ADMISSION ON\n06.01.2020, THE COURT ON THE SAME DAY PASSED THE FOLLOWING:\n\nCarrara\na\nrap\n2020/KER/261\nCrl.M.C. No.9269 of 2019 2\nCril.M.C.No.9269 of 2019\nORDER\n\nThis is a proceedings instituted under Section 482 of\nthe Code of Criminal Procedure for quashing Annexure A2 final\nreport and all further proceedings pursuant thereto now\npending as C.C.No.1019 of 2019 on the files of the Court of the\nJudicial Magistrate of First Class - Il, Hosdurg against the\npetitioner.\n\n2. The petitioner is the sole accused in the said case\nand the case is one instituted at the instance of the third\nrespondent, the wife of the petitioner, under Section 498A of\nthe Indian Penal Code.\n\n3. It is seen that the petitioner and the de facto\ncomplainant have settled their disputes, and an affidavit to that\neffect has been filed by the third respondent as Annexure A3.\n\n4. The learned counsel for the third respondent\naffirms that Annexure A3 is an affidavit sworn to by the defacto\ncomplainant, and submits that the third respondent has no\n\nCarrara\nape\n2020/KER/261\nCrl.M.C. No.9269 of 2019 3\nobjection in granting the relief sought for by the petitioner.\n\n5. In the light of the decisions of the Apex Court in\nGian singh v. State of Punjab, (2012) 10 SCC 303,\nNarinder singh v. State of Punjab, (2014) 6 SCC 466 and\nJitendra Raghuvanshi & Others v. Babita Raghuvanshi &\nAnother, (2013) 4 SCC 58, | am of the view that this is an\nappropriate case where this court has to invoke the jurisdiction\nunder Section 482 of the Code of Criminal Procedure to quash\nthe proceedings against the petitioner.\n\nIn the result, the Crl.M.C. is allowed and Annexure-A2\nfinal report and all further proceedings pursuant thereto against\nthe petitioner pending as C.C.No.1019 of 2019 on the files of\nthe Judicial Magistrate of First Class - Il, Hosdurg are quashed",
    "full_text": "Crate ca\nie\na\nrc ‘ ia\n2020/KER/261\nIN THE HIGH COURT OF KERALA AT BERNAKULAM\nPRESENT\nTHE HONOURABLE MR. JUSTICE P.B.SURESH KUMAR\nMONDAY, THE O6TH DAY OF JANUARY 2020 / 16TH POUSHA, 1941\nCr1.MC.No.9269 OF 2019 (G)\nAGAINST THE ORDER IN CC NO.1019/2019 OF JUDICIAL MAGISTRATE OF\nFIRST CLASS -II, HOSDRUG\nCRIME NO.303/2019 OF NILESWARAM POLICE STATION, KASARGOD\nPETITIONER/ACCUSED:\nSHIHAB T.V.,\nAGED 31 YEARS, S/O.ABDUL KHADER, RESIDING AT\nORCHA, ORCHA ROAD, KOTTAPPURAM, NEELESHWAR\nVILLAGE, KOTTAPPURAM.P.O., HOSDURG TALUK,\nKASARAGOD DISTRICT.\nBY ADVS.\nSRI .T.MADHU\nSMT .C.R.SARADAMANT\nRESPONDENT/STATE & DE FACTO COMPLAINANT:\n1 THE STATE OF KERALA,\nREPRESENTED BY THE PUBLIC PROSECUTOR,\nHIGH COURT OF KERALA, ERNAKULAM-682031.\n2 THE STATION HOUSE OFFICER,\nNEELESWARAM POLICE STATION,\nKASARAGOD DISTRICT-671314.\n3 SHANIDHA M.,\nD/O.SHAFI.P., AGED 25 YEARS, RESIDING AT SHANIDHA\nQUARTERS, COLONY ROAD, THAIKKADAPPURAM,\nP.O. THATKKADAPPURAM, KASARAGOD DISTRICT-671315.\nR3 BY ADV. SRI.M.ABDUL KAREEM\nSRI. AMJED ALI PP\nTHIS CRIMINAL MISC. CASE HAVING COME UP FOR ADMISSION ON\n06.01.2020, THE COURT ON THE SAME DAY PASSED THE FOLLOWING:\n\nCarrara\na\nrap\n2020/KER/261\nCrl.M.C. No.9269 of 2019 2\nCril.M.C.No.9269 of 2019\nORDER\n\nThis is a proceedings instituted under Section 482 of\nthe Code of Criminal Procedure for quashing Annexure A2 final\nreport and all further proceedings pursuant thereto now\npending as C.C.No.1019 of 2019 on the files of the Court of the\nJudicial Magistrate of First Class - Il, Hosdurg against the\npetitioner.\n\n2. The petitioner is the sole accused in the said case\nand the case is one instituted at the instance of the third\nrespondent, the wife of the petitioner, under Section 498A of\nthe Indian Penal Code.\n\n3. It is seen that the petitioner and the de facto\ncomplainant have settled their disputes, and an affidavit to that\neffect has been filed by the third respondent as Annexure A3.\n\n4. The learned counsel for the third respondent\naffirms that Annexure A3 is an affidavit sworn to by the defacto\ncomplainant, and submits that the third respondent has no\n\nCarrara\nape\n2020/KER/261\nCrl.M.C. No.9269 of 2019 3\nobjection in granting the relief sought for by the petitioner.\n\n5. In the light of the decisions of the Apex Court in\nGian singh v. State of Punjab, (2012) 10 SCC 303,\nNarinder singh v. State of Punjab, (2014) 6 SCC 466 and\nJitendra Raghuvanshi & Others v. Babita Raghuvanshi &\nAnother, (2013) 4 SCC 58, | am of the view that this is an\nappropriate case where this court has to invoke the jurisdiction\nunder Section 482 of the Code of Criminal Procedure to quash\nthe proceedings against the petitioner.\n\nIn the result, the Crl.M.C. is allowed and Annexure-A2\nfinal report and all further proceedings pursuant thereto against\nthe petitioner pending as C.C.No.1019 of 2019 on the files of\nthe Judicial Magistrate of First Class - Il, Hosdurg are quashed.\n\nSd/-\nP.B.SURESH KUMAR, JUDGE.\nYKB\n\nLe: a\na\nrc ‘ ia\n2020/KER/261\nCrl.M.C. No.9269 of 2019 4\nAPPENDIX\nPETITIONER'S/S EXHIBITS:\nANNEXURE Al THE TRUE CERTIFIED COPY OF THE FIR\nDATED 22.8.2019 IN CRIME NO.303/2019\nOF NEELESWARAM POLICE STATION,\nKASARAGOD DISTRICT.\nANNEXURE A2 THE TRUE CERTIFIED COPY OF THE FINAL\nREPORT DATED 31.10.2019 IN CRIME\nNO.303/2019 OF NELESWARAM POLICE\nSTATION, KASARAGOD DISTRICT.\nANNEXURE A3 THE AFFIDAVIT DATED 29.11.2019 SWORN\nIN BY THE 3RD RESPONDENT.\nRESPONDENT'S/S EXHIBITS:\nNIL\n//TRUE COPY//\nPA TO JUDGE\n\n"
}