{
    "case_id": "",
    "court": "HIGH COURT OF KERALA AT ERNAKULAM\nPRESENT",
    "date": "2ND DAY OF JANUARY 2014",
    "judge": "HARUN-UL",
    "petitioners": [
        "S /ACCUSED:",
        "1. MUHAMMED FAISAL, AGED 37 YEARS",
        "S/O. ABDUL GAFOOR, KUWAIT HOUSE, P.O.OLAVANNA",
        "OLAVANNA AMSOM DESOM, KOHIKODE DISTRICT.",
        "2. K.P.RAZAK, AGED 32 YEARS",
        "$/O.ABDUL GAFOOR, KUWAIT HOUSE, P.O.OLAVANNA",
        "OLAVANNA AMSOM DESOM, KOHIKODE DISTRICT",
        "3. RASHEED P.",
        "$/O.ABOOBACKER, POOLAKKAL HOUSE, P.O.OLAVANNA",
        "OLAVANNA AMSOM DESOM, KOHIKODE DISTRICT"
    ],
    "respondents": [
        "/STATE:",
        "STATE OF KERALA",
        "REPRESENTED BY THE PUBLIC PROSECUTOR",
        "HIGH COURT OF KERALA, ERNAKULAM-682 031.",
        "R BY PUBLIC PROSECUTOR SMT. S. HYMA"
    ],
    "sections": [
        "341",
        "323",
        "326",
        "294"
    ],
    "outcome": "",
    "full_text": "ae\niar\n2014/KER/220\nIN THE HIGH COURT OF KERALA AT ERNAKULAM\nPRESENT:\nTHE HONOURABLE MR.JUSTICE HARUN-ULâ€”-RASHID\nTHURSDAY, THE 2ND DAY OF JANUARY 2014/12TH POUSHA, 1935\nCr1.MC.No. 38 of 2014 ()\n(CRIME NO.507/2013 OF NALLALAM POLICE STATION, KOZHIKODE)\nPETITIONERS /ACCUSED:\n1. MUHAMMED FAISAL, AGED 37 YEARS\nS/O. ABDUL GAFOOR, KUWAIT HOUSE, P.O.OLAVANNA\nOLAVANNA AMSOM DESOM, KOHIKODE DISTRICT.\n2. K.P.RAZAK, AGED 32 YEARS\n$/O.ABDUL GAFOOR, KUWAIT HOUSE, P.O.OLAVANNA\nOLAVANNA AMSOM DESOM, KOHIKODE DISTRICT\n3. RASHEED P.\n$/O.ABOOBACKER, POOLAKKAL HOUSE, P.O.OLAVANNA\nOLAVANNA AMSOM DESOM, KOHIKODE DISTRICT\nBY ADV. SRI.C.M.MOHAMMED IQUABAL\nRESPONDENT /STATE:\nSTATE OF KERALA\nREPRESENTED BY THE PUBLIC PROSECUTOR\nHIGH COURT OF KERALA, ERNAKULAM-682 031.\nR BY PUBLIC PROSECUTOR SMT. S. HYMA\nTHIS CRIMINAL MISC. CASE HAVING COME UP FOR ADMISSION ON\n02-01-2014, THE COURT ON THE SAME DAY PASSED THE FOLLOWING:\nSCL.\n\n2014/KER/220\nHARUN-UL-RASHID, J.\nCri.M.C No.38 of 2014\nDated this the 2 day of January, 2014\nORDER\n\nPetitioners are arrayed as the accused in Crime No.507 of\n2013 of Nallalam Police Station, Kozhikode District. The offences\nalleged are punishable under Sections 341, 323, 326 and 294(b)\nr/w Section 34 of I.P.C.\n\n2. Petitioners are willing to surrender before the Judicial\nFirst Class Magistrate Court-V, Kozhikode. Non-bailable warrant is\npending against them. Now, the petitioners seek a direction from\nthis Court to consider their application for bail on the date of\nsurrender itself.\n\nIn the facts and circumstances, the Crl.M.C. is disposed of,\ndirecting the Judicial First Class Magistrate Court-V, Kozhikode to\nconsider and pass orders on the bail application on the date of\nsurrender itself in the event of the petitioners surrendering before\nthe court below and submitting an application for bail with prior\nnotice to the Assistant Public Prosecutor within a period of 15 days\nfrom today. The non-bailable warrant issued against the petitioner\nshall be kept in abeyance till the disposal of the bail application.\n\nSd/-\nHARUN-UL-RASHID,\nJudge.\nScl.\n\n"
}