{
    "case_id": "",
    "court": "HIGH COURT OF KERALA AT ERNAKULAM\nPRESENT",
    "date": "7TH DAY OF DECEMBER 2017",
    "judge": "B.KEMAL PASHA\nTHURSDAY",
    "petitioners": [
        "(S) /ACCUSED:",
        "FRANCIS JOSEPH",
        "AGED 36 YEARS, S/O.JOSEPH, EDATHIL HOUSE,",
        "PIZHALA DESOM, KADAMAKKUDY VILLAGE,",
        "ERNAKULAM DISTRICT."
    ],
    "respondents": [
        "(S) /STATE/ DEFACTO COMPLAINANT:",
        "1. STATE OF KERALA",
        "REPRESENTED BY PUBLIC PROSECUTOR,",
        "HIGH COURT OF KERALA, ERNAKULAM - 682 031,",
        "(CRIME NO.2020/2011 OF E.T.SOUTH POLICE STATION,",
        "ERNAKULAM DISTRICT) .",
        "2. SUNIL KUMAR",
        "AGED 45 YEARS, S/O.RAMAKRISHNAN, EDANATTU VEEDU,",
        "NEAR MATTAL BHAGAWATHY TEMPLE,",
        "KADAVANTHRA, ELAMKULAM VILLAGE, ERNAKULAM DISTRICT,",
        "682016.",
        "R2 BY ADV. SRI.VINOD KUMAR.C",
        "R1 BY PUBLIC PROSECUTOR SRI.C.S.HRITWICK"
    ],
    "sections": [
        "283",
        "323",
        "294"
    ],
    "outcome": "ORDER\n\nPetitioner is the accused in L.P.No.40 of 2016 of the\nAdditional Chief Judicial Magistrate's Court (Economic\nOffences), Ernakulam, which is arising out of Crime No.2020 of\n2011 of E.T.South Police Station, registered for the offences\npunishable under Sections 283, 323, 294 (b) of the Indian\nPenal Code.\n\n2. It seems that the matter has been amicably settled\nbetween the parties.\n\n3. On going through the facts and circumstances of the\ncase, it seems that the matter can be permitted to be settled.\n\n4. It has been reported that no criminal antecedents\nhave been reported against the petitioner. The second\nrespondent has filed Annexure-II affidavit affirming that the\nmatter has been amicably settled between him and the\npetitioner and he has no complaints against the petitioner.\n\napa\n2017/KER/49566\nCril.M.C. No.8150 of 2017\n-~2-\n\nConsidering the fact that the matter has already been settled\namicably between the parties, this court is satisfied that no\npurpose would be served in proceeding with the trial of the\ncase. Matters being so, all further proceedings in L.P.No.40 of\n2016 of the Additional Chief Judicial Magistrate's Court\n(Economic Offences), Ernakulam, which is arising out of Crime\nNo.2020 of 2011 of E.T.South Police Station, against the\npetitioner, are liable to be quashed",
    "full_text": "sgl\nita\n2017/KER/49566\nIN THE HIGH COURT OF KERALA AT ERNAKULAM\nPRESENT:\nTHE HONOURABLE MR. JUSTICE B.KEMAL PASHA\nTHURSDAY, THE 7TH DAY OF DECEMBER 2017/16TH AGRAHAYANA, 1939\nCr1.MC.No. 8150 of 2017 ()\nLP 40/2016 of ADDL.C.J.M. (E&O), ERNAKULAM\nPETITIONER (S) /ACCUSED:\nFRANCIS JOSEPH\nAGED 36 YEARS, S/O.JOSEPH, EDATHIL HOUSE,\nPIZHALA DESOM, KADAMAKKUDY VILLAGE,\nERNAKULAM DISTRICT.\nBY ADVS.SRI.S.RAJEEV\nSRI .K.K.DHEERENDRAKRISHNAN\nSRI.V.VINAY\nSRI .D.FEROZE\nRESPONDENT (S) /STATE/ DEFACTO COMPLAINANT:\n1. STATE OF KERALA\nREPRESENTED BY PUBLIC PROSECUTOR,\nHIGH COURT OF KERALA, ERNAKULAM - 682 031,\n(CRIME NO.2020/2011 OF E.T.SOUTH POLICE STATION,\nERNAKULAM DISTRICT) .\n2. SUNIL KUMAR\nAGED 45 YEARS, S/O.RAMAKRISHNAN, EDANATTU VEEDU,\nNEAR MATTAL BHAGAWATHY TEMPLE,\nKADAVANTHRA, ELAMKULAM VILLAGE, ERNAKULAM DISTRICT,\n682016.\nR2 BY ADV. SRI.VINOD KUMAR.C\nR1 BY PUBLIC PROSECUTOR SRI.C.S.HRITWICK\nTHIS CRIMINAL MISC. CASE HAVING COME UP FOR ADMISSION ON\n07-12-2017, THE COURT ON THE SAME DAY PASSED THE FOLLOWING:\n\nsgl\nns nae\nites\n2017/KER/49566\nCr1.MC.No. 8150 of 2017 ()\nAPPENDIX\nPETITIONER(S)' EXHIBITS\nANNEXURE-TI: CERTIFIED COPY OF THE FINAL REPORT IN CRIME NO.2020/11\nREGISTERED BY E.T.SOUTH POLICE STATION, NOW PENDING AS LP NO.40/2016.\nANNEXURE-ITI: AFFIDAVIT DATED 21.11.2017 SWORN BY THE 2ND\nRESPONDENT/DEFACTO COMPALINANT.\nRESPONDENT'S EXHIBITS: NIL\nTRUE COPY\nPA TO JUDGE\nScl.\n\n2017/KER/49566\nB. KEMAL PASHA, J.\nDated this the 7‚Äù day of December, 2017\nORDER\n\nPetitioner is the accused in L.P.No.40 of 2016 of the\nAdditional Chief Judicial Magistrate's Court (Economic\nOffences), Ernakulam, which is arising out of Crime No.2020 of\n2011 of E.T.South Police Station, registered for the offences\npunishable under Sections 283, 323, 294 (b) of the Indian\nPenal Code.\n\n2. It seems that the matter has been amicably settled\nbetween the parties.\n\n3. On going through the facts and circumstances of the\ncase, it seems that the matter can be permitted to be settled.\n\n4. It has been reported that no criminal antecedents\nhave been reported against the petitioner. The second\nrespondent has filed Annexure-II affidavit affirming that the\nmatter has been amicably settled between him and the\npetitioner and he has no complaints against the petitioner.\n\napa\n2017/KER/49566\nCril.M.C. No.8150 of 2017\n-~2-\n\nConsidering the fact that the matter has already been settled\namicably between the parties, this court is satisfied that no\npurpose would be served in proceeding with the trial of the\ncase. Matters being so, all further proceedings in L.P.No.40 of\n2016 of the Additional Chief Judicial Magistrate's Court\n(Economic Offences), Ernakulam, which is arising out of Crime\nNo.2020 of 2011 of E.T.South Police Station, against the\npetitioner, are liable to be quashed.\n\nIn the result, this Crl.M.C. is allowed and all further\nproceedings in L.P.No.40 of 2016 of the Additional Chief\nJudicial Magistrate's Court (Economic Offences), Ernakulam,\nwhich is arising out of Crime No.2020 of 2011 of E.T.South\nPolice Station, against the petitioner, are hereby quashed.\n\nSd/-\nB.KEMAL PASHA\nJUDGE\nScl/07.12.2017\n\n"
}