{
    "case_id": "Crl.MC.No. 898 of 2010",
    "court": "HIGH COURT OF KERALA AT ERNAKULAM\nPRESENT",
    "date": "1ST DAY OF JANUARY 2014",
    "judge": "A-HARIPRASAD\nWEDNESDAY",
    "petitioners": [
        "ACCUSED:",
        "1. MUJEEB RAHMAN, S/O. AHAMMED,",
        "PANDALAMCHERI, ENTHRATH VEEDU, KUNIYIL",
        "KEEZHPARAMBU, AREEKODE, ERNAD TALUK.",
        "MALAPPURAM DISTRICT.",
        "2. RAMEES, S/O. ABDULLAI,",
        "PALLIYALIYIL HOUSE, KUNIYIL, KEEZHPARAMBU",
        "AREECODE, ERNAD TALUK., MALAPPURAM DISTRICT.",
        "3. SHAJAHAN.PK, S/O. ABOO,",
        "AGED 26 YEARS, PAYYANATTUTHODI, VALLIAPUZHA.P.O",
        "AREEKODE, ERNAD, MALAPPURAM DISTRICT."
    ],
    "respondents": [
        "COMPLAINANT:",
        "STATE OF KERALA, REPRESENTED BY",
        "PUBLIC PROSECUTOR, HIGH COURT OF KERALA, ERNAKULAM."
    ],
    "sections": [],
    "outcome": "",
    "full_text": "eee\npees\n2014/KER/51\nIN THE HIGH COURT OF KERALA AT ERNAKULAM\nPRESENT:\nTHE HONOURABLE MR. JUSTICE A-HARIPRASAD\nWEDNESDAY, THE 1ST DAY OF JANUARY 2014/11TH POUSHA, 1935\nCrl.MC.No. 898 of 2010 ()\nCRIME NO.395/2009 OF MUKKAM POLICE STATION, KOZHIKODE\nPETITIONER(S)/ACCUSED:\n1. MUJEEB RAHMAN, S/O. AHAMMED,\nPANDALAMCHERI, ENTHRATH VEEDU, KUNIYIL\nKEEZHPARAMBU, AREEKODE, ERNAD TALUK.\nMALAPPURAM DISTRICT.\n2. RAMEES, S/O. ABDULLAI,\nPALLIYALIYIL HOUSE, KUNIYIL, KEEZHPARAMBU\nAREECODE, ERNAD TALUK., MALAPPURAM DISTRICT.\n3. SHAJAHAN.PK, S/O. ABOO,\nAGED 26 YEARS, PAYYANATTUTHODI, VALLIAPUZHA.P.O\nAREEKODE, ERNAD, MALAPPURAM DISTRICT.\nBY ADV. SRLK.A.SALIL NARAYANAN\nRESPONDENT(S)/COMPLAINANT:\nSTATE OF KERALA, REPRESENTED BY\nPUBLIC PROSECUTOR, HIGH COURT OF KERALA, ERNAKULAM.\nBY PUBLIC PROSECUTOR SHRI REJI JOSEPH\nTHIS CRIMINAL MISC. CASE HAVING BEEN FINALLY HEARD ON 01-01-2014,\nTHE COURT ON THE SAME DAY PASSED THE FOLLOWING:\n\neee\nates\n2014/KER/S51\nA.HARIPRASAD, J.\nCri.M.C. No.898 of 2010\nDated this the 1* day of January, 2014.\nORDER\nLearned counsel for the petitioners submitted that the matter\nhas become infructuous as the trial is proceeding in the lower court. Hence\nthe Crl.M.C. is dismissed as infructuous.\nAll pending interlocutory applications will stand dismissed.\nA. HARIPRASAD, JUDGE.\ncks\n\n"
}