{
    "case_id": "Crl.MC.No.8409 OF 2019",
    "court": "HIGH COURT OF KERALA AT ERNAKULAM",
    "date": "8TH DAY OF JANUARY 2020",
    "judge": "ASHOK MENON\nWEDNESDAY",
    "petitioners": [
        "S /ACCUSED:"
    ],
    "respondents": [
        "S/STATE & DEFACTO COMPLAINANT:"
    ],
    "sections": [
        "143",
        "147",
        "148",
        "341",
        "323",
        "324",
        "308 read\nwith Section 149 of the IPC"
    ],
    "outcome": "ORDER\nDated this the 8th day of January, 2020\n\nThe petitioners are accused in Crime No.402/2019 of Chittoor\nPolice Station, Palakkad for having allegedly committed offences\npunishable under Sections 143, 147, 148, 341, 323, 324 and 308 read\nwith Section 149 of the IPC. The defacto complainant and injured are\nrespondents 2 and 3. They have appeared through counsel and filed\naffidavits to the effect that the matter has been amicably settled and that\nthey do not have any grievance against the petitioners. There is also a\ncounter case registered against the respondents 2 and 3 and others as\nCrime No.403/2019 of the same Police Station which too has been settled.\nA report has been obtained from the Investigating Officer regarding the\nsettlement. The petitioners do not have any criminal antecedents. There\nis no public interest involved.\n\nIn the result, the Crl.M.C is allowed and the entire\nproceedings in Crime No.402/2019 of Chittoor Police Station stands\nquashed",
    "full_text": "REE\nEE 5 ie\nIN THE HIGH COURT OF KERALA AT ERNAKULAM 2020/KER/813\nPRESENT\nTHE HONOURABLE MR. JUSTICE ASHOK MENON\nWEDNESDAY, THE O8TH DAY OF JANUARY 2020 / 18TH POUSHA, 1941\nCr1.MC.No.8409 OF 2019 (A)\nCRIME NO.402/2019 OF Chittoor Police Station, Palakkad\nPETITIONERS /ACCUSED:\n\n1 SHARATH R\nAGED 23 YEARS\nD/O.RAVEENDRAN, KURUVANNAMPALLAM HOUSE,\nTHEKKEDASAM.P.O, NALLEPPILLY\n\n2 AJITH A\nAGED 25 YEARS\nS/O.APPU, KURUVANNAMPALLAM, THEKKEDESAM.P.O,\nNALLEPPILLY\n\n3 MANOJ M\nAGED 21 YEARS\nS/O.MADHAVAN, KURUVANNAMPALLAM, THEKKEDESAM.P.O,\nNALLEPPILLY\n\n4 PRASAD S\nAGED 22 YEARS\nS/O.SREEDHARAN, ARANDAPPALLAM HOUSE, THEKKEDESAM.P.O,\nNALLEPPILLY\n\n5 PRADEEP Â§S\nAGED 21 YEARS\nS/O.SREEDHARAN, ARANDAPPALLAM HOUSE,\nTHEKKEDESAM.P.O., NALLEPPILLY\n\n6 GOKUL K\nAGED 23 YEARS\nS/O.KRISHNAN, KURUVANNAMPALLAM HOUSE,\nTHEKKEDASAM.P.O, NALLEPPILLY\nBY ADVS.\nSRI .K.ANAND\nSRI.BENNY ANTONY PAREL\nSRI.T.M.MUHAMED HAFEES\n\nRESPONDENTS/STATE & DEFACTO COMPLAINANT:\n\n1 STATE OF KERALA\n\nREPRESENTED BY PUBLIC PROSECUTOR, HIGH COURT OF\n\ngaan\nREE\ncop 4 ie\nCrl1.MC.No.8409 OF 2019(A) 2020/KERBI3\n2\nKERALA, ERNAKULAM-682031\n2 PRADEEP P\nAGED 25 YEARS\nS/O.PRABHAKARAN, PRABHA NIVAS, MEPPALLAM,\nNALLEPPILLY, CHITTOOR, PALAKKAD\n3 SANTHOSH K\nAGED 26 YEARS\nS/O. KRISHNANKUTTY, MEPPALLAM HOUSE, NALLEPPILLY.P.O\nR2-3 BY ADV. N.RAJESH (PALAKKAD)\nOTHER PRESENT:\nSRI.C.S.HRITHWIK SR PP\nTHIS CRIMINAL MISC. CASE HAVING COME UP FOR ADMISSION ON\n08.01.2020, THE COURT ON THE SAME DAY PASSED THE FOLLOWING:\n\nBalers Tal\npea\nCrl.MC.No.8409 OF 2019(A) 2020/KERBI3\n3\nORDER\nDated this the 8th day of January, 2020\n\nThe petitioners are accused in Crime No.402/2019 of Chittoor\nPolice Station, Palakkad for having allegedly committed offences\npunishable under Sections 143, 147, 148, 341, 323, 324 and 308 read\nwith Section 149 of the IPC. The defacto complainant and injured are\nrespondents 2 and 3. They have appeared through counsel and filed\naffidavits to the effect that the matter has been amicably settled and that\nthey do not have any grievance against the petitioners. There is also a\ncounter case registered against the respondents 2 and 3 and others as\nCrime No.403/2019 of the same Police Station which too has been settled.\nA report has been obtained from the Investigating Officer regarding the\nsettlement. The petitioners do not have any criminal antecedents. There\nis no public interest involved.\n\nIn the result, the Crl.M.C is allowed and the entire\nproceedings in Crime No.402/2019 of Chittoor Police Station stands\nquashed under Section 482 Cr.P.C and the accused are discharged.\n\nSd/-\nASHOK MENON\nJUDGE\nNR/08/01/20\n\nREE\ncop 4 ie\nCrl.MC.No.8409 OF 2019(A) 2020/KERBI3\n4\nAPPENDIX\nPETITIONERS' EXHIBITS:\nANNEXURE Al TRUE COPY OF THE FIR NO 402/2019 oF\nCHITTOOR POLICE STATION, PALAKKAD.\nANNEXURE A2 TRUE COPY OF THE AFFIDAVIT OF THE DEFACTO\nCOMPLAINANT/2ND RESPONDENT.\nANNEXURE A3 TRUE COPY OF THE AFFIDAVIT OF THE\nINJURED/3RD RESPONDENT.\nPETITIONERS' EXHIBITS: NIL\n//TRUE COPY// PA TO JUDGE\n\neves\nBs i ie\nCr1.MC.No.8409 OF 2019 (A) 2020/KER/813\n5\n\n"
}