{
    "case_id": "Crl.MC.No. 37 of 2019",
    "court": "HIGH COURT OF KERALA AT ERNAKULAM\nPRESENT\nTHE HONOURABLE MR",
    "date": "4TH DAY OF JANUARY 2019",
    "judge": "K.ABRAHAM MATHEW\nFRIDAY",
    "petitioners": [
        "S:",
        "NAUSHI NAZAR, AGED 43 YEARS",
        "W/O.NAZAR ABOOBAKER, H.NO.C.C.8/1385, TD EAST",
        "ROAD, MATTANCHERY, KOCHI-2."
    ],
    "respondents": [
        "S:",
        "1 K.C.SATHEESHAN,",
        "AGED 41 YEARS",
        "S/O.CHENNAPPU, KANDAMPULLY HOUSE, KALLOOR",
        "P.O., VADAKKEKKAD, THRISSUR DISTRICT, PIN-",
        "679562.",
        "2 STATE OF KERALA,",
        "REPRESENTED BY SUB INSPECTOR OF POLICE,",
        "MATTANCHERY POLICE STATION, ERNAKULAM",
        "DISTRICT, REP. BY PUBLIC PROSECUTOR, HIGH",
        "COURT OF KERALA, ERNAKULAM, PIN- 682031."
    ],
    "sections": [
        "482 Cr"
    ],
    "outcome": "ORDER\nPetition filed under Section 482 Cr.P.C.\n\n2. The petitioner is the accused in Crime No.\n1776 of 2018 of Mattanchery Police Station\nregistered for the offences under Sections 468\n& 420 of the Indian Penal Code. The first\nrespondent is the victim. It is submitted that\nthe matter has been settled and the\nproceedings in the criminal case may be\nquashed",
    "full_text": "Besa]\noy mend\nCapea\n2019/KER/227\nIN THE HIGH COURT OF KERALA AT ERNAKULAM\nPRESENT\nTHE HONOURABLE MR. JUSTICE K.ABRAHAM MATHEW\nFRIDAY, THE O4TH DAY OF JANUARY 2019 / 14TH POUSHA, 1940\nCrl1.MC.No. 37 of 2019\nCRIME NO. 1776/2018 OF MATTANCHERRY POLICE STATION,\nERNAKULAM\nPETITIONER/S:\nNAUSHI NAZAR, AGED 43 YEARS\nW/O.NAZAR ABOOBAKER, H.NO.C.C.8/1385, TD EAST\nROAD, MATTANCHERY, KOCHI-2.\nBY ADV. SRI.M.H.HANIS\nRESPONDENT/S:\n1 K.C.SATHEESHAN,\nAGED 41 YEARS\nS/O.CHENNAPPU, KANDAMPULLY HOUSE, KALLOOR\nP.O., VADAKKEKKAD, THRISSUR DISTRICT, PIN-\n679562.\n2 STATE OF KERALA,\nREPRESENTED BY SUB INSPECTOR OF POLICE,\nMATTANCHERY POLICE STATION, ERNAKULAM\nDISTRICT, REP. BY PUBLIC PROSECUTOR, HIGH\nCOURT OF KERALA, ERNAKULAM, PIN- 682031.\nBY ADV. SRI.P.A.MUJEEB\nOTHER PRESENT:\nSRI. ALEX M THOMBRA SR PP\n\n2019/KER/227\nCrl.MC.No. 37 of 2019\n1i2..\n\nTHIS CRIMINAL MISC. CASE HAVING COME UP FOR ADMISSION ON\n\n04.01.2019, THE COURT ON THE SAME DAY PASSED THE\n\nFOLLOWING:\n\nORDER\nPetition filed under Section 482 Cr.P.C.\n\n2. The petitioner is the accused in Crime No.\n1776 of 2018 of Mattanchery Police Station\nregistered for the offences under Sections 468\n& 420 of the Indian Penal Code. The first\nrespondent is the victim. It is submitted that\nthe matter has been settled and the\nproceedings in the criminal case may be\nquashed.\n\n3. Heard the learned counsel for the petitioner\nand the first respondent and the learned\nPublic Prosecutor.\n\n4, I have perused the affidavit filed by the\nfirst respondent, who has entered appearance\nthrough counsel. I am satisfied that the\nallegation of settlement is true and no public\n\nPerl\nz eet a\nops\n2019/KER/227\nCrl.MC.No. 37 of 2019\n1.3..\ninterest is involved. There is no impediment\nfor granting the prayer of the petitioner.\nIn the result, this Crl.M.C. is allowed. The\nproceedings in Crime No. 1776 of 2018 of\nMattanchery Police Station are quashed. The\nlearned magistrate may pass appropriate orders\nfor the disposal of the material objects, if\nany, produced in the case.\nSd/-\nK. ABRAHAM MATHEW\nJUDGE\nAPPENDIX\nPETITIONER'S/S EXHIBITS:\nANNEXURE A CERTIFIED COPY OF THE FIR IN CRIME\nNO.1776/2018 OF MATTANCHERY POLICE\nSTATION, ERNAKULAM DISTRICT.\nANNEXURE B AFFIDAVIT OF THE 1ST RESPONDENT.\nBka/07.01.2019\n\n"
}