{
    "case_id": "Crl.MC.No. 8724 of 2018",
    "court": "HIGH COURT OF KERALA AT ERNAKULAM\nPRESENT\nTHE HONOURABLE MR",
    "date": "7TH DAY OF JANUARY 2019",
    "judge": "RAJA VIJAYARAGHAVAN V\nMONDAY",
    "petitioners": [
        "S:",
        "1 SAJI K.K., AGED 37 YEARS,",
        "S/O. KUTTUPPAN, KLARIPARAMBIL, ERUMATHALA P.O.,",
        "KEEZHMADU, ALUVA, ERNAKULAM DISTRICT.",
        "2 DINOOPKUMAR M.T., AGED 31 YEARS,",
        "S/O.THANKAPPAN, MUTHIRAKATTUPARAMBIL (H),",
        "ERUMATHALA P.O., KEEZHMADU, ALUVA,",
        "ERNAKULAM DISTRICT.",
        "3 USHA VIJAYAN, AGED 49 YEARS,",
        "S/O.VIJAYAN, MUTHIRAKATTUPARAMBIL HOUSE,",
        "ERUMATHALA P.O., KEEZHMADU, ALUVA,",
        "ERNAKULAM DISTRICT.",
        "4 MINI SOMAN, AGED 44 YEARS,",
        "PALAKKAPARAMBIL HOUSE, ERUMATHALA P.O.,",
        "KEEZHMADU, ALUVA, ERNAKULAM DISTRICT.",
        "5 SANTHOSH M.S., AGED 55 YEARS,",
        "S/O.SUBRAMANIAN, MARIKKAL HOUSE, ERUMATHALA P.O.,",
        "KEEZHMADU, ALUVA, ERNAKULAM DISTRICT.",
        "6 SANTHI UNNI, AGED 50 YEARS,",
        "PARAPURATH HOUSE, ERUMATHALA P.O.,",
        "KEEZHMADU, ALUVA, ERNAKULAM DISTRICT."
    ],
    "respondents": [
        "S:",
        "1 STATE OF KERALA,",
        "REPRESENTED BY THE PUBLIC PROSECUTOR,",
        "HIGH COURT OF KERALA, ERNAKULAM."
    ],
    "sections": [
        "482 of the Code of\nCriminal Procedure"
    ],
    "outcome": "ORDER\n\nThis petition is filed under Section 482 of the Code of\nCriminal Procedure (“the Code” for brevity) with a prayer to quash\nthe proceedings pending against the petitioners.\n\n2. The petitioners herein are accused Nos.1 to 6 in Crime\nNo.677 of 2018 of the Edathala Police Station. In the said case,\nthey stand indicted for having committed offences punishable\nunder Sections 142, 143, 323, 324, 451, 341, 506 and 354 r/w.\nSection 149 of the IPC.\n\n3. According to the prosecution, on 29.09.2018 at about\n6.30 a.m., the petitioners herein attacked the 2’ respondent with\nweapons.\n\n4. I have heard the learned counsel appearing for the\npetitioners, the party respondent and the learned Public\nProsecutor. It is submitted that the entire disputes between the\nparties have been amicably resolved. Reliance is placed on the\n\nBete\nisis ie\nCrl.MC.No. 8724 of 2018 4 201/KERI692\naffidavit filed by the 2\" respondent to buttress his submission. It\nis urged that the dispute is purely personal in nature and would\nnot affect public peace or tranquility.\n\n5. The learned Public Prosecutor, on _ instructions,\nsubmitted that the statement of the 2™ respondent has been\nrecorded and she has stated in clear terms that she has no\nsubsisting grievance.\n\n6. I have considered the submissions advanced.\n\n7. In Gian Singh v. State of Punjab [(2012) 10 SCC\n303] and in Narinder Singh v. State of Punjab [(2014) 6 SCC\n466], the Apex Court has laid down that in appropriate cases, the\nHigh Court can take note of the amicable resolution of disputes\nbetween the victim and the wrongdoer to put an end to the\ncriminal proceedings.\n\n8. The offence committed by the petitioners cannot be\nsaid to be grave and serious having ingredients of extreme mental\n\n=\nbs\nCrl.MC.No. 8724 of 2018 5 201HKERIO22\ndepravity. It also does not appear that the offence in this case\nwill have a serious impact on the society. It is felt that quashing\nof proceedings on account of compromise would bring about\npeace and secure the ends of justice. Even otherwise, persisting\nwith the prosecution would be nothing but a waste of time as the\nprospects of conviction is bleak. Having considered all the relevant\ncircumstances, I am of the considered view that this Court will be\nwell justified in invoking its extraordinary powers under Section\n482 of the Code to quash the proceedings.\nIn the result, this petition will stand allowed. Annexure-Al\nFIR in Crime No.677 of 2018 of the Edathala Police Station and all\nproceedings pursuant thereto against the petitioners are quashed",
    "full_text": "|\nee\nPues\n2019/KER/692\nIN THE HIGH COURT OF KERALA AT ERNAKULAM\nPRESENT\nTHE HONOURABLE MR. JUSTICE RAJA VIJAYARAGHAVAN V\nMONDAY, THE O7TH DAY OF JANUARY 2019 / 17TH POUSHA, 1940\nCr1.MC.No. 8724 of 2018\nCRIME NO.677/2018 OF Edathala Police Station, Ernakulam\nPETITIONERS:\n1 SAJI K.K., AGED 37 YEARS,\nS/O. KUTTUPPAN, KLARIPARAMBIL, ERUMATHALA P.O.,\nKEEZHMADU, ALUVA, ERNAKULAM DISTRICT.\n2 DINOOPKUMAR M.T., AGED 31 YEARS,\nS/O.THANKAPPAN, MUTHIRAKATTUPARAMBIL (H),\nERUMATHALA P.O., KEEZHMADU, ALUVA,\nERNAKULAM DISTRICT.\n3 USHA VIJAYAN, AGED 49 YEARS,\nS/O.VIJAYAN, MUTHIRAKATTUPARAMBIL HOUSE,\nERUMATHALA P.O., KEEZHMADU, ALUVA,\nERNAKULAM DISTRICT.\n4 MINI SOMAN, AGED 44 YEARS,\nPALAKKAPARAMBIL HOUSE, ERUMATHALA P.O.,\nKEEZHMADU, ALUVA, ERNAKULAM DISTRICT.\n5 SANTHOSH M.S., AGED 55 YEARS,\nS/O.SUBRAMANIAN, MARIKKAL HOUSE, ERUMATHALA P.O.,\nKEEZHMADU, ALUVA, ERNAKULAM DISTRICT.\n6 SANTHI UNNI, AGED 50 YEARS,\nPARAPURATH HOUSE, ERUMATHALA P.O.,\nKEEZHMADU, ALUVA, ERNAKULAM DISTRICT.\nBY ADV. SRI.K.K.NASSEER (ALUVA)\nRESPONDENT/S:\n1 STATE OF KERALA,\nREPRESENTED BY THE PUBLIC PROSECUTOR,\nHIGH COURT OF KERALA, ERNAKULAM.\n\nOPES 0)\nee\nPes\nCr1.MC.No. 8724 of 2018 2 2019/KERI692\n2 NAJUMA, AGED 42 YEARS,\nW/O.ABU, THANIKKADU VEEDU, KEEZHMADU KARA,\nKEEZHMADU VILLAGE, ALUVA TALUK,\nERNAKULAM DISTRICT.\nR2 BY ADV. SRI.P.MOHAMED SABAH\nR1 SRI. AMJAD ALI, SENIOR PUBLIC PROSECUTOR\nTHIS CRIMINAL MISC. CASE HAVING COME UP FOR ADMISSION ON\n07.01.2019, THE COURT ON THE SAME DAY PASSED THE FOLLOWING:\n\nBeta\nisis ie\nCrl.MC.No. 8724 of 2018 3 201/KERI692\nORDER\n\nThis petition is filed under Section 482 of the Code of\nCriminal Procedure (“the Code” for brevity) with a prayer to quash\nthe proceedings pending against the petitioners.\n\n2. The petitioners herein are accused Nos.1 to 6 in Crime\nNo.677 of 2018 of the Edathala Police Station. In the said case,\nthey stand indicted for having committed offences punishable\nunder Sections 142, 143, 323, 324, 451, 341, 506 and 354 r/w.\nSection 149 of the IPC.\n\n3. According to the prosecution, on 29.09.2018 at about\n6.30 a.m., the petitioners herein attacked the 2’ respondent with\nweapons.\n\n4. I have heard the learned counsel appearing for the\npetitioners, the party respondent and the learned Public\nProsecutor. It is submitted that the entire disputes between the\nparties have been amicably resolved. Reliance is placed on the\n\nBete\nisis ie\nCrl.MC.No. 8724 of 2018 4 201/KERI692\naffidavit filed by the 2\" respondent to buttress his submission. It\nis urged that the dispute is purely personal in nature and would\nnot affect public peace or tranquility.\n\n5. The learned Public Prosecutor, on _ instructions,\nsubmitted that the statement of the 2™ respondent has been\nrecorded and she has stated in clear terms that she has no\nsubsisting grievance.\n\n6. I have considered the submissions advanced.\n\n7. In Gian Singh v. State of Punjab [(2012) 10 SCC\n303] and in Narinder Singh v. State of Punjab [(2014) 6 SCC\n466], the Apex Court has laid down that in appropriate cases, the\nHigh Court can take note of the amicable resolution of disputes\nbetween the victim and the wrongdoer to put an end to the\ncriminal proceedings.\n\n8. The offence committed by the petitioners cannot be\nsaid to be grave and serious having ingredients of extreme mental\n\n=\nbs\nCrl.MC.No. 8724 of 2018 5 201HKERIO22\ndepravity. It also does not appear that the offence in this case\nwill have a serious impact on the society. It is felt that quashing\nof proceedings on account of compromise would bring about\npeace and secure the ends of justice. Even otherwise, persisting\nwith the prosecution would be nothing but a waste of time as the\nprospects of conviction is bleak. Having considered all the relevant\ncircumstances, I am of the considered view that this Court will be\nwell justified in invoking its extraordinary powers under Section\n482 of the Code to quash the proceedings.\nIn the result, this petition will stand allowed. Annexure-Al\nFIR in Crime No.677 of 2018 of the Edathala Police Station and all\nproceedings pursuant thereto against the petitioners are quashed.\nSD/-\nRAJA VIJAYARAGHAVAN V.,\nJUDGE\nDSV/-\n\nee\nPes\nCr1.MC.No. 8724 of 2018 6 2019/KERI692\nAPPENDIX\nPETITIONER'S/S EXHIBITS:\nANNEXURE-A1 COPY OF FIR IN CRIME NO. 677/18 OF EDATHALA\nPOLICE STATION.\nANNEXURE-A2 CERTIFIED COPY OF F.I.STATEMENT GIVEN BY\nRESPONDENT NO.2.\nANNEXUREA3 AFFIDAVIT DATED 8/12/2018 .\nRESPONDENT'S/S EXHIBITS:\nNIL\n//TRUE COPY //\nP.A.TO JUDGE\n\n"
}