{
    "case_id": "",
    "court": "HIGH COURT OF KERALA AT ERNAKULAM\nPRESENT",
    "date": "13TH DAY OF JANUARY 2017",
    "judge": "SUNIL THOMAS\nFRIDAY",
    "petitioners": [
        "5TH ACCUSED:",
        "THATTANCHERI ABDURASAK",
        "AGED:47 YEARS, S/O AHAMADKUTTY,",
        "CHEEDIKKUZHI HOUSE, KUNNATHADAYI,",
        "EDAVANNAPPARA, VAZHAKKAD, MALAPPURAM DISTRICT"
    ],
    "respondents": [
        "(S) /STATE:",
        "STATE OF KERALA",
        "REPRESENTED BY THE PUBLIC PROSECUTOR,",
        "HIGH COURT OF KERALA ERNAKULAM-682031",
        "R BY PUBLIC PROSECUTOR:SRI T R RANJITH"
    ],
    "sections": [
        "143",
        "147",
        "148",
        "450",
        "436",
        "427 r/\n149 of Indian Penal Code"
    ],
    "outcome": "ORDER NO.\n50882/L4/11/HOME DATED 2/1/2012\nANNEXURE A3 TRUE COPY OF THE PETITION U/S 321 DATED\n18/10/2012\nANNEXURE A4 TRUE COPY OF THE JUDGMENT IN SC 375/2011\nOF THE ADDL. SESSIONS COURT-(ADHOC-I) , MANJERI\nRESPONDENT (S)' EXHIBITS:NIL\nTrue Copy /\nPA to Judge\n\n2017/KER/2062\nSUNIL THOMAS, J.\nCrl.M.C.No.292 of 2017\nDated this the 13 day of January, 2017\nORDER\n\nPetitioner herein is the 5\" accused in a proceeding\narising from Crime No.237 of 2010 of Vazhakkad Police Station for\noffences punishable under sections 143, 147, 148, 450, 436, 427 r/\n149 of Indian Penal Code.\n\n2. The matter was pending as S.C.No.375 of 2011 before\nthe Additional Sessions Court, Adhoc-I, Manjeri. Pending the\nproceedings, Annexure-A2 order was issued by the Government\npermitting withdrawal of the case with the permission of the Court.\nConsequently, Annexure-A3 application was submitted by the\nAdditional Public Prosecutor and by order in Crl.M.P.No.1504 of\n2012 in the above sessions case, all the accused who faced the trial\nwere discharged. Petitioner herein and the other accused who did\nnot participate were left out. Case of the petitioner herein is now\npending as L.P.No.94 of 2012 in C.P.No.44 of 2011.\n\n3. Having considered the fact that Annexure-A4 judgment\nhas become final and conclusive and the Government order\nproduced as Annexure-A4 is in relation to the withdrawal of the case\n\nPlies P\n\nine\n\nBea\n\n2017/KER/2062\nCrl.M.C.292/17\n2\n\nas such, necessarily, it should enure to the benefit of the petitioner\nherein who also stood as accused, though had not participated in\nS.C.No.375 of 2011. Having regard to these facts, I feel that no\npurpose will be served by prosecuting the petitioner herein since all\nother main accused remain discharged. In the light of above, I am\ninclined to quash the criminal proceedings.\n\nIn the result, Crl.M.C is allowed. All further proceedings\narising from Crime No.237 of 2010 of Vazhakkad Police Station\nstand quashed",
    "full_text": "leat al\net RG\nF oo\nBl? cae: a\n2017/KER/2062\nIN THE HIGH COURT OF KERALA AT ERNAKULAM\nPRESENT:\nTHE HONOURABLE MR. JUSTICE SUNIL THOMAS\nFRIDAY, THE 13TH DAY OF JANUARY 2017/23RD POUSHA, 1938\nCr1.MC.No. 292 of 2017 ()\nL.P.94/2012 IN C.P.44/2011 ON the FILE OF JUDICIAL FIRST CLASS\nMAGISTRATE COURT, MALAPPURAM\nCRIME NO.237/2010 OF VAZHAKKAD POLICE STATION\nPETITIONER/5TH ACCUSED:\nTHATTANCHERI ABDURASAK\nAGED:47 YEARS, S/O AHAMADKUTTY,\nCHEEDIKKUZHI HOUSE, KUNNATHADAYI,\nEDAVANNAPPARA, VAZHAKKAD, MALAPPURAM DISTRICT\nBY ADVS.SRI.P.SAMSUDIN\nSRI.K.C.ANTONY MATHEW\nSRI.JITHIN LUKOSE\nKUM.ANJU CLETUS\nRESPONDENT (S) /STATE:\nSTATE OF KERALA\nREPRESENTED BY THE PUBLIC PROSECUTOR,\nHIGH COURT OF KERALA ERNAKULAM-682031\nR BY PUBLIC PROSECUTOR:SRI T R RANJITH\nTHIS CRIMINAL MISC. CASE HAVING BEEN FINALLY HEARD ON\n13-01-2017, THE COURT ON THE SAME DAY PASSED THE FOLLOWING:\n\nPletal\nee We\nF oo\nDk an\n2017/KER/2062\nCr1.MC.No. 292 of 2017 ()\nAPPENDIX\nPETITIONER (S)' EXHIBITS\nANNEXURE Al TRUE COPY OF THE FIR AND FINAL REPORT IN\nCRIME NO. 237/2010 OF VAZHAKKAD POLICE STATION\nANNEXURE A2 TRUE COPY OF THE GOVERNMENT ORDER NO.\n50882/L4/11/HOME DATED 2/1/2012\nANNEXURE A3 TRUE COPY OF THE PETITION U/S 321 DATED\n18/10/2012\nANNEXURE A4 TRUE COPY OF THE JUDGMENT IN SC 375/2011\nOF THE ADDL. SESSIONS COURT-(ADHOC-I) , MANJERI\nRESPONDENT (S)' EXHIBITS:NIL\nTrue Copy /\nPA to Judge\n\n2017/KER/2062\nSUNIL THOMAS, J.\nCrl.M.C.No.292 of 2017\nDated this the 13 day of January, 2017\nORDER\n\nPetitioner herein is the 5\" accused in a proceeding\narising from Crime No.237 of 2010 of Vazhakkad Police Station for\noffences punishable under sections 143, 147, 148, 450, 436, 427 r/\n149 of Indian Penal Code.\n\n2. The matter was pending as S.C.No.375 of 2011 before\nthe Additional Sessions Court, Adhoc-I, Manjeri. Pending the\nproceedings, Annexure-A2 order was issued by the Government\npermitting withdrawal of the case with the permission of the Court.\nConsequently, Annexure-A3 application was submitted by the\nAdditional Public Prosecutor and by order in Crl.M.P.No.1504 of\n2012 in the above sessions case, all the accused who faced the trial\nwere discharged. Petitioner herein and the other accused who did\nnot participate were left out. Case of the petitioner herein is now\npending as L.P.No.94 of 2012 in C.P.No.44 of 2011.\n\n3. Having considered the fact that Annexure-A4 judgment\nhas become final and conclusive and the Government order\nproduced as Annexure-A4 is in relation to the withdrawal of the case\n\nPlies P\n\nine\n\nBea\n\n2017/KER/2062\nCrl.M.C.292/17\n2\n\nas such, necessarily, it should enure to the benefit of the petitioner\nherein who also stood as accused, though had not participated in\nS.C.No.375 of 2011. Having regard to these facts, I feel that no\npurpose will be served by prosecuting the petitioner herein since all\nother main accused remain discharged. In the light of above, I am\ninclined to quash the criminal proceedings.\n\nIn the result, Crl.M.C is allowed. All further proceedings\narising from Crime No.237 of 2010 of Vazhakkad Police Station\nstand quashed.\n\nSd/-\nSUNIL THOMAS\nJudge\nSbna/13/1/17\nTrue Copy /\nP A to Judge\n\n"
}