{
    "case_id": "",
    "court": "HIGH COURT OF KERALA AT ERNAKULAM\nPRESENT",
    "date": "4TH DAY OF JANUARY 2016",
    "judge": "B.KEMAL PASHA\nMONDAY",
    "petitioners": [
        "ACCUSED:",
        "SANTHOSH. V.R., AGED 45 YEARS,",
        "S/O RAMANKUTTY, VAYALIL HOUSE,",
        "PERUMALLOOR KARA, MUVATTUPUZHA,",
        "ERNAKULAM DISTRICT."
    ],
    "respondents": [
        "S/COMPLAINANT AND STATE:",
        "4. SOUTHERN AUTO FINANCE, MUVATTUPUZHA,",
        "REPRESENTED BY MANAGER K.V. MATHAI.",
        "2. STATE OF KERALA, THROUGH S.I. OF POLICE,",
        "MUVATTUPUZHA POLICE STATION, MUVATTUPUZHA,",
        "REPRESENTED BY THE PUBLIC PROSECUTOR,",
        "HIGH COURT OF KERALA, ERNAKULAM-682 031.",
        "R2 BY PUBLIC PROSECUTOR SMT.SAREENA GEORGE."
    ],
    "sections": [],
    "outcome": "",
    "full_text": "Plies el\nHecate\neee\n2016/KER/70\nIN THE HIGH COURT OF KERALA AT ERNAKULAM\nPRESENT:\nTHE HONOURABLE MR. JUSTICE B.KEMAL PASHA\nMONDAY, THE 4TH DAY OF JANUARY 2016/14TH POUSHA, 1937\nCri.MC.No. 8070 of 2015 ()\nLP.NO.37/2009 OF JUDICIAL FIRST CLASS MAGISTRATE COURT-1, MUVATTUPUZHA.\nPETITIONER/ACCUSED:\nSANTHOSH. V.R., AGED 45 YEARS,\nS/O RAMANKUTTY, VAYALIL HOUSE,\nPERUMALLOOR KARA, MUVATTUPUZHA,\nERNAKULAM DISTRICT.\nBY ADVS.SRI.GEO PAUL,\nSRILSANU MATHEW,\nSRILRADHIKA RAJASEKHARAN P.,\nSRI.C.R.PRAMOD,\nSRIS.ASHOK KUMAR,\nSRILLENIN P. SUKUMARAN.\nRESPONDENTS/COMPLAINANT AND STATE:\n4. SOUTHERN AUTO FINANCE, MUVATTUPUZHA,\nREPRESENTED BY MANAGER K.V. MATHAI.\n2. STATE OF KERALA, THROUGH S.I. OF POLICE,\nMUVATTUPUZHA POLICE STATION, MUVATTUPUZHA,\nREPRESENTED BY THE PUBLIC PROSECUTOR,\nHIGH COURT OF KERALA, ERNAKULAM-682 031.\nR2 BY PUBLIC PROSECUTOR SMT.SAREENA GEORGE.\nTHIS CRIMINAL MISC. CASE HAVING COME UP FOR ADMISSION\nON 04-01-2016, THE COURT ON THE SAME DAY PASSED THE\nFOLLOWING:\nrs.\n\nPlies el\nHecate\nay\n2016/KER/70\nCri.MC.No. 8070 of 2015\nAPPENDIX\nPETITIONER'S ANNEXURES:-\nANNEXURE A1: â€˜COPY OF THE B DIARY PROCEEDINGS IN LP NO.37/2009\nON THE FILES OF JUDICIAL FIRST CLASS MAGISTRATE\nCOURT I, MUVATTUPUZHA.\nRESPONDENT'S ANNEXURES:- NIL.\nITRUE COPY//\nP.S. TO JUDGE\nrs.\n\nDa\n\nies\n2016/KER/70\n\nB. KEMAL PASHA, J.\nCrl.M.C. No.8070 of 2015\nDated this the 4\" day of January, 2016\nORDER\nHeard learned counsel for the petitioner.\n\n2. The court below is directed to dispose of the\napplication seeking bail, if any filed by the petitioner, on his\nsurrender before the court below within 10 days from today,\npreferably on the date of filing itself.\n\nCrl.M.C. is disposed of as above.\n\nSd/-\n(B.KEMAL PASHA, JUDGE)\naks/04/01\n1/1 True Copy //\nPA to Judge\n\n"
}