{
    "case_id": "",
    "court": "HIGH COURT OF KERALA AT ERNAKULAM",
    "date": "10TH DAY OF JANUARY 2020",
    "judge": "ASHOK MENON\nFRIDAY",
    "petitioners": [
        "ACCUSED NO.4:",
        "MUHAMMED SHEHEED, AGED 32 YEARS",
        "S/O. HABEEB, CHOMBAKKADAVATH HOUSE, MATTUL AMSOM,",
        "MATTUAL NORTH, KANNUR DISTRICT, 670 325."
    ],
    "respondents": [
        "COMPLAINANTS :",
        "1 M.M.V.RAHNAS, AGED 31 YEARS",
        "S/O. MUSTHAFA, MUTHARI MUZHALIYARE VALAPPIL HOUSE,",
        "MATTUL AMSOM, KAVILE PARAMBA, P.O. MATTUL NORTH,",
        "KANNUR DISTRICT 670 325.",
        "2 AJMAL.C.C, AGED 31 YEARS,",
        "S/O. IBRAHIM KUTTY, CHADICHIRE CHALIL HOUSE,",
        "MATTUAL AMSOM, NEAR MATTUL NORTH POST OFFICE,",
        "MATTUL NORTH, KANNUR DISTRICT 670 325.",
        "3 ASAHRUDEEN.M.P, AGED 29 YEARS,",
        "S/O. ABDULLA, MUTTON POOVATHINKAL HOUSE, MATTUL",
        "AMSOM, KAVILE PARAMBA, MATTUL NORTH POST OFFICE,",
        "KANNUR DISTRICT 670 325.",
        "4 STATE OF KERALA, REPRESENTED BY PUBLIC PROSECUTOR,",
        "HIGH COURT OF KERALA, ERNAKULAM 682 031.",
        "R1-3 BY ADV. SHRI.SHAMEM M.S.",
        "OTHER PRESENT:"
    ],
    "sections": [
        "143",
        "147",
        "148",
        "341",
        "323",
        "324",
        "506Cii"
    ],
    "outcome": "ORDER/JUDGMENT IN CC 465/2015 OF JUDICIAL MAGISTRATE\nOF FIRST CLASS ,PAYYANNUR\nCRIME NO.393/2010 OF Payangadi Police Station , Kannur\nPETITIONER/ACCUSED NO.4:\nMUHAMMED SHEHEED, AGED 32 YEARS\nS/O. HABEEB, CHOMBAKKADAVATH HOUSE, MATTUL AMSOM,\nMATTUAL NORTH, KANNUR DISTRICT, 670 325.\nBY ADVS.\nSRI.P.S.BINU\nSRI.ZUBAIR PULIKKOOL\nRESPONDENT/COMPLAINANTS :\n1 M.M.V.RAHNAS, AGED 31 YEARS\nS/O. MUSTHAFA, MUTHARI MUZHALIYARE VALAPPIL HOUSE,\nMATTUL AMSOM, KAVILE PARAMBA, P.O. MATTUL NORTH,\nKANNUR DISTRICT 670 325.\n2 AJMAL.C.C, AGED 31 YEARS,\nS/O. IBRAHIM KUTTY, CHADICHIRE CHALIL HOUSE,\nMATTUAL AMSOM, NEAR MATTUL NORTH POST OFFICE,\nMATTUL NORTH, KANNUR DISTRICT 670 325.\n3 ASAHRUDEEN.M.P, AGED 29 YEARS,\nS/O. ABDULLA, MUTTON POOVATHINKAL HOUSE, MATTUL\nAMSOM, KAVILE PARAMBA, MATTUL NORTH POST OFFICE,\nKANNUR DISTRICT 670 325.\n4 STATE OF KERALA, REPRESENTED BY PUBLIC PROSECUTOR,\nHIGH COURT OF KERALA, ERNAKULAM 682 031.\nR1-3 BY ADV. SHRI.SHAMEM M.S.\nOTHER PRESENT:\nSRI.C.S.HRITHWIK SR PP\nTHIS CRIMINAL MISC. CASE HAVING COME UP FOR ADMISSION ON\n10.01.2020, THE COURT ON THE SAME DAY PASSED THE FOLLOWING:\n\n2020/KER/1339\nCrl.MC 8177/2019\n2\nASHOK MENON, J.\n— ¢rl.MC No.8177 of 2019\npated this the 10% day of January, 2020\nORDER\n\nPetitioner is the fourth accused in Crime\nNo.393/2010 of Pazhayangadi Police Station for having\nallegedly committed offences punishable under Sections\n143, 147, 148, 341, 323, 324 and 506Cii) read with\nSection 149 IPC along with other accused. It is\nsubmitted that the third accused died and the case\nagainst him abated. The rest of the accused faced\ntrial in CC No.862/2010 on the files of the Judicial\nFirst Class Magistrate's Court, Payyannur for the said\noffence and they were all found not guilty = and\nacquitted vide judgment dated 6.5.2015 at Annexure-II,\nin which it 1s stated that the injured/witnesses did\nnot identify their assailants. The judgment has since\nbecome final. The case against the petitioner has been\nsplit up and is presently pending as CC No.465/2015 on\nthe files of the Judicial First Class Magistrate's\nCourt, Payyannur. No purpose whatsoever would be\n\n2020/KER/1339\nCrl.MC 8177/2019\n3\nserved by proceeding with the trial as against the\npetitioner, which would only amount to exercise in\nFutility.\n\nIn the result, the Criminal M.cC. is allowed and\nthe entire proceedings as against the petitioner herein\nin cc No.465/2015 on the files of the Judicial First\nClass Magistrate's Court, Payyannur shall stand quashed",
    "full_text": "Bee el\nEee ares\neae een\nEl: ro a\nIN THE HIGH COURT OF KERALA AT ERNAKULAM 2020/KER/1339\nPRESENT\nTHE HONOURABLE MR. JUSTICE ASHOK MENON\nFRIDAY, THE 10TH DAY OF JANUARY 2020 / 20TH POUSHA, 1941\nCr1.MC.No.8177 OF 2019(B\nAGAINST THE ORDER/JUDGMENT IN CC 465/2015 OF JUDICIAL MAGISTRATE\nOF FIRST CLASS ,PAYYANNUR\nCRIME NO.393/2010 OF Payangadi Police Station , Kannur\nPETITIONER/ACCUSED NO.4:\nMUHAMMED SHEHEED, AGED 32 YEARS\nS/O. HABEEB, CHOMBAKKADAVATH HOUSE, MATTUL AMSOM,\nMATTUAL NORTH, KANNUR DISTRICT, 670 325.\nBY ADVS.\nSRI.P.S.BINU\nSRI.ZUBAIR PULIKKOOL\nRESPONDENT/COMPLAINANTS :\n1 M.M.V.RAHNAS, AGED 31 YEARS\nS/O. MUSTHAFA, MUTHARI MUZHALIYARE VALAPPIL HOUSE,\nMATTUL AMSOM, KAVILE PARAMBA, P.O. MATTUL NORTH,\nKANNUR DISTRICT 670 325.\n2 AJMAL.C.C, AGED 31 YEARS,\nS/O. IBRAHIM KUTTY, CHADICHIRE CHALIL HOUSE,\nMATTUAL AMSOM, NEAR MATTUL NORTH POST OFFICE,\nMATTUL NORTH, KANNUR DISTRICT 670 325.\n3 ASAHRUDEEN.M.P, AGED 29 YEARS,\nS/O. ABDULLA, MUTTON POOVATHINKAL HOUSE, MATTUL\nAMSOM, KAVILE PARAMBA, MATTUL NORTH POST OFFICE,\nKANNUR DISTRICT 670 325.\n4 STATE OF KERALA, REPRESENTED BY PUBLIC PROSECUTOR,\nHIGH COURT OF KERALA, ERNAKULAM 682 031.\nR1-3 BY ADV. SHRI.SHAMEM M.S.\nOTHER PRESENT:\nSRI.C.S.HRITHWIK SR PP\nTHIS CRIMINAL MISC. CASE HAVING COME UP FOR ADMISSION ON\n10.01.2020, THE COURT ON THE SAME DAY PASSED THE FOLLOWING:\n\n2020/KER/1339\nCrl.MC 8177/2019\n2\nASHOK MENON, J.\n— ¢rl.MC No.8177 of 2019\npated this the 10% day of January, 2020\nORDER\n\nPetitioner is the fourth accused in Crime\nNo.393/2010 of Pazhayangadi Police Station for having\nallegedly committed offences punishable under Sections\n143, 147, 148, 341, 323, 324 and 506Cii) read with\nSection 149 IPC along with other accused. It is\nsubmitted that the third accused died and the case\nagainst him abated. The rest of the accused faced\ntrial in CC No.862/2010 on the files of the Judicial\nFirst Class Magistrate's Court, Payyannur for the said\noffence and they were all found not guilty = and\nacquitted vide judgment dated 6.5.2015 at Annexure-II,\nin which it 1s stated that the injured/witnesses did\nnot identify their assailants. The judgment has since\nbecome final. The case against the petitioner has been\nsplit up and is presently pending as CC No.465/2015 on\nthe files of the Judicial First Class Magistrate's\nCourt, Payyannur. No purpose whatsoever would be\n\n2020/KER/1339\nCrl.MC 8177/2019\n3\nserved by proceeding with the trial as against the\npetitioner, which would only amount to exercise in\nFutility.\n\nIn the result, the Criminal M.cC. is allowed and\nthe entire proceedings as against the petitioner herein\nin cc No.465/2015 on the files of the Judicial First\nClass Magistrate's Court, Payyannur shall stand quashed\nunder Section 482 cr.PC and the petitioner/accused is\ndischarged.\n\nSd/-\nASHOK MENON\nJUDGE\n59\n\nA\nBy ‘ iat\n2020/KER/1339\nCrl.MC 8177/2019\n4\nAPPENDIX\nPETITIONER'S/S EXHIBITS:\nANNEXURE 1 CERTIFIED COPY OF THE FINAL REPORT IN\nCRIME NO. 393/2010 OF PAZHAYANGADI\nPOLICE STATION.\nANNEXURE II THE COPY OF THE JUDGMENT IN C.C. NO.\n465/2015 BY THE JFCM COURT, PAYYANNUR.\nANNEXURE III SWORN AFFIDAVIT OF 1ST RESPONDENT.\nANNEXURE IV SWORN AFFIDAVIT OF 2ND RESPONDENT.\nANNEXURE V SWORN AFFIDAVIT OF 3RD RESPONDENT.\n\n"
}