{
    "case_id": "",
    "court": "HIGH COURT OF KERALA AT ERNAKULAM\nPRESENT",
    "date": "1ST DAY OF JANUARY 2014",
    "judge": "A.HARIPRASAD\nWEDNESDAY",
    "petitioners": [
        "ACCUSED :"
    ],
    "respondents": [
        "S/COMPLAINANT/DEFACTO COMPLAINANT :",
        "1. STATE OF KERALA,",
        "REPRESENTED BY PUBLIC PROSECUTOR,",
        "HIGH COURT OF KERALA, ERNAKULANM, PIN -682 032.",
        "2. RANJITH M.V,AGED 30 YEARS, S/O.APPU P-P,"
    ],
    "sections": [],
    "outcome": "ORDER\n\nHeard the learned counsel for the petitioner. Attention of\nthis court was drawn to Annexure V affidavit, whereby the defacto\ncomplainant solemnly affirmed and stated that the matter has been\nsettled between the defacto complainant and the petitioner/accused.\nIt is also mentioned in the affidavit that since they are neighbours\nthey decided to settle the matter and live in peace. Considering the\nsubmissions and the averments in the affidavit, I find that the\npetition is to be allowed to meet the ends of justice. Therefore, the\npetition is allowed",
    "full_text": "2014/KER/50\nIN THE HIGH COURT OF KERALA AT ERNAKULAM\nPRESENT:\nTHE HONOURABLE MR. JUSTICE A.HARIPRASAD\nWEDNESDAY, THE 1ST DAY OF JANUARY 2014/11TH POUSHA, 1935\nCri.MC.No. 1023 of 2012 ()\nCC.NO. 761/2011 OF JUDICIAL FIRST CLASS MAGISTRATE COURT -],HOSDURG\nCRIME NO. 430/2012 OF CHANDERA POLICE STATION , KASARGOD DISTRICT\n\nPETITIONER/ACCUSED :\n\nNOORUL AMEEN.T.K, AGED 25 YEARS,\n\nS/O.ABDUL JABBAR, \"NOORJAHAN MANZIL\",\n\nPADANNA VADAKKE PURAM, P.O PADANNA.\n\nBY ADV. SRI.M.V.AMARESAN\nRESPONDENTS/COMPLAINANT/DEFACTO COMPLAINANT :\n1. STATE OF KERALA,\nREPRESENTED BY PUBLIC PROSECUTOR,\nHIGH COURT OF KERALA, ERNAKULANM, PIN -682 032.\n2. RANJITH M.V,AGED 30 YEARS, S/O.APPU P-P,\n\nPADANNA VADAKKEPURAM, P.O PADANNA,\n\nPIN- 671 345. KASARGODE DISTRICT.\n\nR1 BY PUBLIC PROSECUTOR SMT. BINDU GOPINATH\n\nR2 BY ADV. SRI.G.SANTHOSH KUMAR\n\nTHIS CRIMINAL MISC. CASE HAVING BEEN FINALLY HEARD\n\nON 01-01-2014, THE COURT ON THE SAME DAY PASSED THE\n\nFOLLOWING:\nsts\n\n2014/KER/50\nCRMC.NO.1023/2012\nAPPENDIX\nPETITIONER(S) ANNEXURES:\nANNEXURE 1. TRUE COPY OF THE FIR IN CRIME NO.430/2012 OF CHANDRA\nPOLICE.\nANNEXURE 11. TRUE COPY OF CHARGE SHEET IN CRIME NO. 430/2012 OF\nCHANDRA POLICE.\nANNEXURE 111. TRUE COPY OF THE STATEMENT OF THE DOCTOR RECORDED\nBY POLICE DATED 25.05.2011.\nANNEXURE IV. ORIGINAL OF THE AFFIDAVIT DATED 09.03.2012 AND ITS\nENGLISH TRANSLATION.\nRESPONDENTS' ANNEXURES: NIL\n(TRUE COPY/\nP.A.TO.JUDGE\nsts\n\n2014/KER/S0\nA.HARIPRASAD, J.\nDated this the 1* day of January, 2014.\nORDER\n\nHeard the learned counsel for the petitioner. Attention of\nthis court was drawn to Annexure V affidavit, whereby the defacto\ncomplainant solemnly affirmed and stated that the matter has been\nsettled between the defacto complainant and the petitioner/accused.\nIt is also mentioned in the affidavit that since they are neighbours\nthey decided to settle the matter and live in peace. Considering the\nsubmissions and the averments in the affidavit, I find that the\npetition is to be allowed to meet the ends of justice. Therefore, the\npetition is allowed. The entire proceedings against the petitioner\nregistered as per Annexure I, II and IV are hereby quashed.\n\nAll pending interlocutory applications will stand dismissed.\nSd/-\nA.HARIPRASAD,\nJUDGE.\n//True Copy//\n\namk PA to Judge\n\n"
}