{
    "case_id": "",
    "court": "HIGH COURT OF KERALA AT ERNAKULAM\nPRESENT",
    "date": "3RD DAY OF OCTOBER 2016",
    "judge": "SUNIL THOMAS\nMONDAY",
    "petitioners": [
        "ACCUSED:",
        "SANTHOSH, AGED 33 YEARS,",
        "S/O.RAVEENDRAN, SANTHOSH BHAVANAM,",
        "VETTIYARMURI, VETTIYAR VILLAGE,",
        "MAVELIKKARA, ALAPPUZHA DISTRICT."
    ],
    "respondents": [
        "(S)/STATE & CW1 AND CW2:",
        "1. STATE OF KERALA",
        "REPRESENTED BY THE PUBLIC PROSECUTOR,",
        "HIGH COURT OF KERALA, ERNAKULAM,",
        "REPRESENTING THE SUB INSPECTOR OF POLICE,",
        "KURATHIKADU POLICE STATION,",
        "ALAPPUZHA DISTRICT",
        "2. INDIRA, AGED 58 YEARS,",
        "W/O.GOPALAKRISHNA PILLAI,",
        "SANTHOSH BHAVANAM, VETTIYARMURI,",
        "VETTIYAR VILLAGE, MAVELIKKARA,",
        "ALAPPUZHA DISTRICT.",
        "3.  GOPALAKRISHNA PILLAI, AGED 68 YEARS,",
        "S/O.PARAMESWARAN PILLAI,",
        "SANTHOSH BHAVANAM, VETTIYARMURI,",
        "VETTIYAR VILLAGE, MAVELIKKARA,",
        "ALAPPUZHA DISTRICT.",
        "R1 BY PUBLIC PROSECUTOR SRI.E.C.BINEESH",
        "R2 & R3 BY ADV.SRI.K.V.ANIL KUMAR"
    ],
    "sections": [
        "452",
        "427",
        "323",
        "324",
        "294"
    ],
    "outcome": "ORDER\n\nThe petitioner is the accused in C.C.No.1039/2013 of the\nJudicial First Class Magistrate Court 1, Mavelikkara for offences\npunishable under Sections 452, 427, 323, 324 and 294(b) of IPC.\n\n2. According to the prosecution, on 28.08.2013 at 5.30\np.m., the accused came to the shop of the defacto complainant,\nabused her and tried to assault the defacto complainant. When\nher husband intervened, he slapped on the cheek of the husband\nof the defacto complainant and when the wife intervened, he hit\non her cheek as well as on various other parts. He also abused\nand assaulted the mentally challenged son of the defacto\ncomplainant. On the basis of the complaint lodged, crime was\nregistered. After investigation final report was laid and the matter\nis now pending as C.C.No.1039/2013 of the Judicial First Class\nMagistrate Court I, Mavelikkara.\n\n3. The petitioner has approached this Court on a premise\nthat, the disputes between parties have now been voluntarily and\namicably settled. it was stated that, there is no further surviving\ngrievance of the defacto complainant. To substantiate it,\n\n2016/KER/42231\nCrl. M. C. No. 6395 of 2016 2\naffidavits of the defacto complainant and her husband, who is a\nvictim have been filed as Annexures A3 and A4. Relying on the\nabove affidavits, learned counsel for the respondents 2 and 3\nsubmitted that, the parties have resolved their disputes and the\nvictims have no further grievance against the petitioner herein.\n\n4. Learned Public Prosecutor on instructions submitted\nthat the petitioner is not involved in any other case and the\ninformation is that the parties have resolved their disputes.\n\n5. On the basis of these, | am satisfied that the dispute is\nessentially of private nature and no larger question of public\ninterest arises. Since the parties have voluntarily resolved, the\npowers under Section 482 Cr.P.C. can be invoked to meet the\nends of justice.\n\nIn the result, Cril.MC. is allowed. All further proceedings in\nC.C.No.1039/2013 of the Judicial First Class Magistrate Court |,\nMavelikkara stand quashed",
    "full_text": "Dik ee)\nI. me iJ\nrestore\neae\nDees\n2016/KER/42231\nIN THE HIGH COURT OF KERALA AT ERNAKULAM\nPRESENT :\nTHE HONOURABLE MR. JUSTICE SUNIL THOMAS\nMONDAY, THE 3RD DAY OF OCTOBER 2016/11TH ASWINA, 1938\nCr1.MC.No. 6395 of 2016 ()\nCC 1039/2013 OF JUDICIAL FIRST CLASS MAGISTRATE COURT-I,\nMAVELIKKARA .\nCRIME NO.586/2013 OF KURATHIKADU POLICE STATION, ALAPPUZHA.\nPETITIONER/ACCUSED:\nSANTHOSH, AGED 33 YEARS,\nS/O.RAVEENDRAN, SANTHOSH BHAVANAM,\nVETTIYARMURI, VETTIYAR VILLAGE,\nMAVELIKKARA, ALAPPUZHA DISTRICT.\nBY ADVS.SRI.M.V.THAMBAN\nSRI.R.REJI\nSMT.THARA THAMBAN\nSRI.B.BIPIN\nSRI.ARUN BOSE\nRESPONDENT (S)/STATE & CW1 AND CW2:\n1. STATE OF KERALA\nREPRESENTED BY THE PUBLIC PROSECUTOR,\nHIGH COURT OF KERALA, ERNAKULAM,\nREPRESENTING THE SUB INSPECTOR OF POLICE,\nKURATHIKADU POLICE STATION,\nALAPPUZHA DISTRICT\n2. INDIRA, AGED 58 YEARS,\nW/O.GOPALAKRISHNA PILLAI,\nSANTHOSH BHAVANAM, VETTIYARMURI,\nVETTIYAR VILLAGE, MAVELIKKARA,\nALAPPUZHA DISTRICT.\n3.  GOPALAKRISHNA PILLAI, AGED 68 YEARS,\nS/O.PARAMESWARAN PILLAI,\nSANTHOSH BHAVANAM, VETTIYARMURI,\nVETTIYAR VILLAGE, MAVELIKKARA,\nALAPPUZHA DISTRICT.\nR1 BY PUBLIC PROSECUTOR SRI.E.C.BINEESH\nR2 & R3 BY ADV.SRI.K.V.ANIL KUMAR\nTHIS CRIMINAL MISC. CASE HAVING COME UP FOR ADMISSION\nON 03-10-2016, THE COURT ON THE SAME DAY PASSED THE\nFOLLOWING:\nmbr/\n\nDire)\nI. me a\nrestore\nae\nDees\n2016/KER/42231\nCr1.MC.No. 6395 of 2016 ()\nAPPENDIX\nPETITIONER (S) ' ANNEXURES:\nANNEXURE Al : CERTIFIED COPY OF THE FIR NO 586/2013 IN\n(CC NO. 1039) OF KURATHIKADU POLICE STATION,\nALAPPUZHA DISTRICT.\nANNEXURE A2 : CERTIFIED COPY OF THE FINAL REPORT IN\nC.C NO.1039/2013 ON THE FILES OF THE HON'BLE\nJUDICIAL FIRST CLASS MAGISTRATE COURT-I,\nMAVELIKKARA.\nANNEXURE A3 : AFFIDAVIT SWORN BY THE 2ND RESPONDENT.\nANNEXURE A4 : AFFIDAVIT SWORN BY THE 3RD RESPONDENT.\nRESPONDENT (S)' ANNEXURES: NIL\n//TRUE COPY//\nP.S. TO JUDGE\nmbr\n\nBier\n2016/KER/42231\nSUNIL THOMAS, J.\nDated this the 3\" day of October, 2016\nORDER\n\nThe petitioner is the accused in C.C.No.1039/2013 of the\nJudicial First Class Magistrate Court 1, Mavelikkara for offences\npunishable under Sections 452, 427, 323, 324 and 294(b) of IPC.\n\n2. According to the prosecution, on 28.08.2013 at 5.30\np.m., the accused came to the shop of the defacto complainant,\nabused her and tried to assault the defacto complainant. When\nher husband intervened, he slapped on the cheek of the husband\nof the defacto complainant and when the wife intervened, he hit\non her cheek as well as on various other parts. He also abused\nand assaulted the mentally challenged son of the defacto\ncomplainant. On the basis of the complaint lodged, crime was\nregistered. After investigation final report was laid and the matter\nis now pending as C.C.No.1039/2013 of the Judicial First Class\nMagistrate Court I, Mavelikkara.\n\n3. The petitioner has approached this Court on a premise\nthat, the disputes between parties have now been voluntarily and\namicably settled. it was stated that, there is no further surviving\ngrievance of the defacto complainant. To substantiate it,\n\n2016/KER/42231\nCrl. M. C. No. 6395 of 2016 2\naffidavits of the defacto complainant and her husband, who is a\nvictim have been filed as Annexures A3 and A4. Relying on the\nabove affidavits, learned counsel for the respondents 2 and 3\nsubmitted that, the parties have resolved their disputes and the\nvictims have no further grievance against the petitioner herein.\n\n4. Learned Public Prosecutor on instructions submitted\nthat the petitioner is not involved in any other case and the\ninformation is that the parties have resolved their disputes.\n\n5. On the basis of these, | am satisfied that the dispute is\nessentially of private nature and no larger question of public\ninterest arises. Since the parties have voluntarily resolved, the\npowers under Section 482 Cr.P.C. can be invoked to meet the\nends of justice.\n\nIn the result, Cril.MC. is allowed. All further proceedings in\nC.C.No.1039/2013 of the Judicial First Class Magistrate Court |,\nMavelikkara stand quashed.\n\nSd/-\nSUNIL THOMAS, JUDGE.\nPn\n\n"
}