{
    "case_id": "",
    "court": "HIGH COURT OF KERALA AT ERNAKULAM\nPRESENT",
    "date": "8TH DAY OF DECEMBER 2017",
    "judge": "MARY JOSEPH\nFRIDAY",
    "petitioners": [
        "RESPONDENTS & 2:",
        "1. AJITHA REJI",
        "PROPRIETRIX, W/O.REJI MALAYIL, AGED 35 YEARS,",
        "M/S.EVER GREEN GROUPS, 34/296, HARISREE, BEERANKUTTY ROAD, EDAPALLY,",
        "KOCHI-682024.",
        "2. REJI MALAYIL",
        "$/O.M E POULOSE, AGED 40 YEARS, MALAYIL (H), POODANAM,",
        "THIRUVANKULAM, KOCHI-682305."
    ],
    "respondents": [
        "S & 2:",
        "1. AJITHA REJI",
        "PROPRIETRIX, W/O.REJI MALAYIL, AGED 35 YEARS,",
        "M/S.EVER GREEN GROUPS, 34/296, HARISREE, BEERANKUTTY ROAD, EDAPALLY,",
        "KOCHI-682024.",
        "2. REJI MALAYIL",
        "$/O.M E POULOSE, AGED 40 YEARS, MALAYIL (H), POODANAM,",
        "THIRUVANKULAM, KOCHI-682305."
    ],
    "sections": [],
    "outcome": "",
    "full_text": "Des)\nBeet\n2017/KER/49757\nIN THE HIGH COURT OF KERALA AT ERNAKULAM\nPRESENT:\nTHE HONOURABLE MRS. JUSTICE MARY JOSEPH\nFRIDAY, THE 8TH DAY OF DECEMBER 2017/17TH AGRAHAYANA, 1939\nCri.MC.No. 3923 of 2014 ()\nCMP 3016/2014 IN CMP 3522/2013 of CHIEF JUDL.MAGISTRATE, ERNAKULAM\nPETITIONER(S)/RESPONDENTS & 2:\n1. AJITHA REJI\nPROPRIETRIX, W/O.REJI MALAYIL, AGED 35 YEARS,\nM/S.EVER GREEN GROUPS, 34/296, HARISREE, BEERANKUTTY ROAD, EDAPALLY,\nKOCHI-682024.\n2. REJI MALAYIL\n$/O.M E POULOSE, AGED 40 YEARS, MALAYIL (H), POODANAM,\nTHIRUVANKULAM, KOCHI-682305.\nBY ADV. SRI.P.T.JOSE\nRESPONDENT(S)/RESPONDENTS/PETITIONER:\n1. SYNDICATE BANK,\nEDAPALLY BRANCH, ERNAKULAM, REP BY AUTHORIZED OFFICER,\nNAGARAJA ACHARYA, CHIEF MANAGER-682024,\n2. STATE OF KERALA\nREP BY PUBLIC PROSECUTOR, HIGH COURT OF KERALA,ERNAKULAM- 682031\nR2 BY PUBLIC PROSECUTOR. SMT. REHNA N.S\nR1 BY SRI.R.S. KALKURA, SC, SYNDICATE BANK\nTHIS CRIMINAL MISC. CASE HAVING BEEN FINALLY HEARD ON 08-12-2017, THE COURT\nON THE SAME DAY PASSED THE FOLLOWING:\nhmh\n\nae\n2017/KER/49757\nMARY JOSEPH, J.\nCrl.M.C. 3923 of 2014\nDated this the 8\" day of December, 2017.\nORDER\nLearned counsel for the petitioner submitted that\nhe does not intend to pursue with the case any further.\nBased on the submission, this Crl.M.C. is dismissed as\nwithdrawn.\nSd/-\nMARY JOSEPH,\nJUDGE\nbhmh\n\n"
}