{
    "case_id": "",
    "court": "HIGH COURT OF KERALA AT ERNAKULAM",
    "date": "8TH DAY OF JANUARY 2018",
    "judge": "B.KEMAL PASHA\nMONDAY",
    "petitioners": [
        "8TH ACCUSED:",
        "ANDU @ ABDUL RAHIMAN,",
        "AGED 26 YEARS, S/O.IBRAHIM,",
        "RESIDING AT KEEZHUR, KALANAD,",
        "KALANAD VILLAGE,",
        "KASARAGOD DISTRICT."
    ],
    "respondents": [
        "/STATE:",
        "THE STATE OF KERALA,",
        "THROUGH THE STATION HOUSE OFFICER,",
        "BEKAL POLICE STATION,",
        "KASATAGOD DISTRICT,",
        "REPRESENTED BY THE PUBLIC PROSECUTOR,",
        "HIGH COURT OF KERALA,",
        "ERNAKULAM-682031."
    ],
    "sections": [],
    "outcome": "",
    "full_text": "Be El\neee\npeepee\nBl mt ate aH\nIN THE HIGH COURT OF KERALA AT ERNAKULAM 2018/KER/737\nPRESENT:\nTHE HONOURABLE MR. JUSTICE B.KEMAL PASHA\nMONDAY, THE 8TH DAY OF JANUARY 2018 / 18TH POUSHA, 1939\nCr1.MC.No. 8674 of 2017\nLPC 55/2015 of JUDICIAL FIRST CLASS MAGISTRATE COURT-II, HOSDRUG\nCRIME NO.573/2011 OF BEKAL POLICE STATION, KASARGOD\nPETITIONER/8TH ACCUSED:\nANDU @ ABDUL RAHIMAN,\nAGED 26 YEARS, S/O.IBRAHIM,\nRESIDING AT KEEZHUR, KALANAD,\nKALANAD VILLAGE,\nKASARAGOD DISTRICT.\nBY ADVS.SRI.T.MADHU\nSMT .C.R.SARADAMANT\nRESPONDENT /STATE:\nTHE STATE OF KERALA,\nTHROUGH THE STATION HOUSE OFFICER,\nBEKAL POLICE STATION,\nKASATAGOD DISTRICT,\nREPRESENTED BY THE PUBLIC PROSECUTOR,\nHIGH COURT OF KERALA,\nERNAKULAM-682031.\nBY PUBLIC PROSECUTOR SRI.B.JAYASURYA\nTHIS CRIMINAL MISC. CASE HAVING COME UP FOR ADMISSION ON 08-01-2018,\nTHE COURT ON THE SAME DAY PASSED THE FOLLOWING:\nEL\n\nPee\ntare\nap\n2018/KER/737\nB. KEMAL PASHA, J.\nCril.M.C. No.8674 of 2017\nDated this the 8\" day of January, 2018\nORDER\nLearned counsel for the petitioner seeks\npermission to withdraw the Crl.M.C. Permission is granted.\nAccordingly, this Crl.M.C. is dismissed as withdrawn, with\nliberty to move other Cri.M.C., if so advised, at appropriate\nstage.\nSd/-\n(B.KEMAL PASHA, JUDGE)\naks/08/01\n4 True Copy //\nPS to Judge\n\n"
}