{
    "case_id": "",
    "court": "HIGH COURT OF KERALA AT ERNAKULAM",
    "date": "5TH DAY OF JANUARY 2018",
    "judge": "B.KEMAL PASHA\nFRIDAY",
    "petitioners": [
        "ACCUSED =:",
        "PHILIP GEORGE,S/O GEORGE,",
        "KUNNAYATH HOUSE, SOUTH JANATHA ROAD,",
        "PALARIVATTOM, ERNAKULAM DISTRICT, KOCHI 682 025"
    ],
    "respondents": [
        "S /RESPONDENTS NO 1 TO 3:",
        "1. FRANCO ALAPPATT.",
        "S/O ITTIACHEN ALAPATT, 118A WEST HILL, GOSAI KUNNU,",
        "KURIACHERA, THRISSUR 680 006, CHIEF EXECUTIVE OFFICER OF M/S",
        "EDUEXINT 1ST AND 2ND FLOOR, OF KALATHIL BUILDING,",
        "CONVENT ROAD, COCHIN 682 035",
        "2. AUGUSTINE CHANDY, S/O CHANDY, DIRECTOR,",
        "LSMS MANAGEMENT CONSULTANCIES PVT LTD, VALLAMKOT,",
        "PONGUMOOD, MEDICAL COLLEGE, THIRUVANANTHAPURAM 695 O11",
        "3. STATE OF KERALA",
        "REPRESENTED BY THE PUBLIC PROSECUTOR,",
        "HIGH COURT OF KERALA",
        "R1 BY ADVS. SRI.AGINOV MATHAPPAN",
        "R2 BY ADV. SRI.M.A.SHIHAB (B/O)",
        "R3 BY PUBLIC PROSECUTOR SRI.T.R.RENJITH"
    ],
    "sections": [
        "406",
        "418",
        "420",
        "426 IPC"
    ],
    "outcome": "ORDER\nThe petitioners are accused Nos.1 and 2 respectively in\nC.C.No.236/2014 of the Chief Judicial Magistrate's Court,\nErnakulam based on the final report in Crime No.1814/2014 of\nthe Ernakulam Central Police Station for the offences under\nSections 406, 418, 420 and 426 IPC.\n2. In brief, the allegation is that the petitioners have\nnot paid the entire commission as agreed by them based on an\nagreement to CWl1.\n3. On going through the matter, it seems that, at the\nmost the liability has arisen from a breach of contract and\nnothing more, for which civil action alone is maintainable.\nWhen it is only a breach of contract, the offences alleged\nagainst the petitioners are not legally sustainable. Therefore,\nall further proceedings in C.C.No.236/2014 of the Chief Judicial\nMagistrate's Court, Ernakulam as against the petitioners herein\nare hereby quashed",
    "full_text": "Bal\nines:\nPure\nIN THE HIGH COURT OF KERALA AT ERNAKULAM 2018/KER/477\nPRESENT:\nTHE HONOURABLE MR. JUSTICE B.KEMAL PASHA\nFRIDAY, THE 5TH DAY OF JANUARY 2018 / 15TH POUSHA, 1939\nCr1.MC.No. 1602 of 2016\ncc 236/2014 of CHIEF JUDICIAL MAGISTRATE, ERNAKULAM\nCRIME NO. 1814/2014 OF ERNAKULAM CENTRAL POLICE STATION,\nERNAKULAM DISTRICT\nPETITIONER/ACCUSED =:\nPHILIP GEORGE,S/O GEORGE,\nKUNNAYATH HOUSE, SOUTH JANATHA ROAD,\nPALARIVATTOM, ERNAKULAM DISTRICT, KOCHI 682 025\nBY ADV.SRI.IEANS .C.CHAMAKKALA\nRESPONDENTS /RESPONDENTS NO 1 TO 3:\n1. FRANCO ALAPPATT.\nS/O ITTIACHEN ALAPATT, 118A WEST HILL, GOSAI KUNNU,\nKURIACHERA, THRISSUR 680 006, CHIEF EXECUTIVE OFFICER OF M/S\nEDUEXINT 1ST AND 2ND FLOOR, OF KALATHIL BUILDING,\nCONVENT ROAD, COCHIN 682 035\n2. AUGUSTINE CHANDY, S/O CHANDY, DIRECTOR,\nLSMS MANAGEMENT CONSULTANCIES PVT LTD, VALLAMKOT,\nPONGUMOOD, MEDICAL COLLEGE, THIRUVANANTHAPURAM 695 O11\n3. STATE OF KERALA\nREPRESENTED BY THE PUBLIC PROSECUTOR,\nHIGH COURT OF KERALA\nR1 BY ADVS. SRI.AGINOV MATHAPPAN\nSMT.K.SHERIN MOHAN\nR2 BY ADV. SRI.M.A.SHIHAB (B/O)\nR3 BY PUBLIC PROSECUTOR SRI.T.R.RENJITH\nTHIS CRIMINAL MISC. CASE HAVING BEEN FINALLY HEARD\nON 05-01-2018 ALONG WITH CRL.MC NO.1866/2016,THE\nCOURT ON THE SAME DAY PASSED THE FOLLOWING:\nbp\n\nBal\nint\nBurk:\n2018/KER/477\nCr1.MC.No. 1602 of 2016 ()\nAPPENDIX\nPETITIONER(S)' EXHIBITS\nANNEXURE AL: CERTIFIED COPY OF THE COMPLAINT\nANNEXURE A2: CERTIFIED COPY OF THE F.I.R\nANNEXURE A3: CERTIFIED COPY OF THE CHARGE SHEET\nRESPONDENT'S EXHIBITS : NIL.\n//TRUE COPY//\nP.A. TO JUDGE\nbp\n\n-\nLooe\nbins\n2018/KER/477\nB. KEMAL PASHA, J.\n~ Cri.M.C.Nos.1602 and 1866 of 2016 â€”\nDated this the 5\" day of January, 2018\nORDER\nThe petitioners are accused Nos.1 and 2 respectively in\nC.C.No.236/2014 of the Chief Judicial Magistrate's Court,\nErnakulam based on the final report in Crime No.1814/2014 of\nthe Ernakulam Central Police Station for the offences under\nSections 406, 418, 420 and 426 IPC.\n2. In brief, the allegation is that the petitioners have\nnot paid the entire commission as agreed by them based on an\nagreement to CWl1.\n3. On going through the matter, it seems that, at the\nmost the liability has arisen from a breach of contract and\nnothing more, for which civil action alone is maintainable.\nWhen it is only a breach of contract, the offences alleged\nagainst the petitioners are not legally sustainable. Therefore,\nall further proceedings in C.C.No.236/2014 of the Chief Judicial\nMagistrate's Court, Ernakulam as against the petitioners herein\nare hereby quashed.\nSd/-\nB. KEMAL PASHA, JUDGE.\nne // True Copy // P.A. to Judge\n\n"
}