{
    "case_id": "Crl.MC.No. 5 of 2019",
    "court": "HIGH COURT OF KERALA AT ERNAKULAM",
    "date": "3RD DAY OF JANUARY 2019",
    "judge": "K.ABRAHAM MATHEW\nTHURSDAY",
    "petitioners": [
        "S /ACCUSED NOS.1 TO 8 :-",
        "1 MANU SAJU,",
        "AGED 33 YEARS",
        "$/O. SAJU CHACKO, MENACHERRY ,CHAITHANYA NAGAR,",
        "ANGAMALY .",
        "2 ELDHO JACOB,",
        "AGED 35 YEARS",
        "S/O. K.M JACOB, KOORAN KAROTTVEETTIL, ANGADIKADAVU,",
        "ANGAMALY .",
        "3 JOY PETER,",
        "AGED 42 YEARS",
        "S/O. PATHROSE T.V, THETTAYIL HOUSE, ANGAMALY.",
        "4 SUNIL VARGHESE PUDUSSERY,",
        "AGED 42 YEARS",
        "S/O. VARGHESE, PUDUSSERY HOUSE, KIDANGOOR, ANGAMALY.",
        "5 JOMI SEBASTIAN,",
        "AGED 39 YEARS",
        "S/O. SEBASTIAN V.M, VEZHAPARAMBIL HOUSE,",
        "THURAVANKARA, VADAKKUMBHAGAM, ANGAMALY.",
        "6 JAYADEV V,",
        "AGED 32 YEARS",
        "S/O. VIJAYAKUMAR, VADAKKEPISHARAM, VELLARAPPILLY",
        "SOUTH, CHOWARA.",
        "7 BELGI FRANCIS,",
        "AGED 40 YEARS",
        "s/o. FRANCIS, KOORAN KALLUKKARAN, KIDANGOOR,",
        "ANGAMALY .",
        "8 JOSHY P.G,",
        "AGED 44 YEARS",
        "S/O P.A.GEORGE, PUTHANANGADY HOUSE,",
        "DESOM, U.C.COLLEGE, ALUVA"
    ],
    "respondents": [
        "S/STATE & DEFACTO COMPLAINANT :-",
        "1 SHARLET",
        "AGED 43 YEARS,",
        "S/O. JOSEPH, THADATHIIL HOUSE, VAZHATHOPPU KARA,",
        "IDUKKI VILLAGE, IDUKKI DISTRICT.",
        "2 STATE OF KERALA,",
        "REPRESENTED BY PUBLIC PROSECUTOR, HIGH COURT OF",
        "KERALA, ERNAKULAM."
    ],
    "sections": [
        "482 Cr"
    ],
    "outcome": "ORDER\n\nPetition filed under section 482 Cr.P.C.\n\n2. Petitioners are the accused in Crime\nNo.75 of 2018 of Kulamavu Police Station registered\nfor the offences under sections 143, 147, 294(b),\n323, 427 and 452 r/w section 149 IPC. The first\nrespondent is the victim. It is submitted that the\nmatter has been settled and the proceedings in the\ntrial court may be quashed",
    "full_text": "ples\nIN THE HIGH COURT OF KERALA AT ERNAKULAM 2019/KER/1O\nPRESENT\nTHE HONOURABLE MR. JUSTICE K.ABRAHAM MATHEW\nTHURSDAY, THE O3RD DAY OF JANUARY 2019 / 13TH POUSHA, 1940\nCr1.MC.No. 5 of 2019\nCRIME NO. 75/2018 OF Kulamavu Police Station , Idukki\nPETITIONERS /ACCUSED NOS.1 TO 8 :-\n1 MANU SAJU,\nAGED 33 YEARS\n$/O. SAJU CHACKO, MENACHERRY ,CHAITHANYA NAGAR,\nANGAMALY .\n2 ELDHO JACOB,\nAGED 35 YEARS\nS/O. K.M JACOB, KOORAN KAROTTVEETTIL, ANGADIKADAVU,\nANGAMALY .\n3 JOY PETER,\nAGED 42 YEARS\nS/O. PATHROSE T.V, THETTAYIL HOUSE, ANGAMALY.\n4 SUNIL VARGHESE PUDUSSERY,\nAGED 42 YEARS\nS/O. VARGHESE, PUDUSSERY HOUSE, KIDANGOOR, ANGAMALY.\n5 JOMI SEBASTIAN,\nAGED 39 YEARS\nS/O. SEBASTIAN V.M, VEZHAPARAMBIL HOUSE,\nTHURAVANKARA, VADAKKUMBHAGAM, ANGAMALY.\n6 JAYADEV V,\nAGED 32 YEARS\nS/O. VIJAYAKUMAR, VADAKKEPISHARAM, VELLARAPPILLY\nSOUTH, CHOWARA.\n7 BELGI FRANCIS,\nAGED 40 YEARS\ns/o. FRANCIS, KOORAN KALLUKKARAN, KIDANGOOR,\nANGAMALY .\n8 JOSHY P.G,\nAGED 44 YEARS\nS/O P.A.GEORGE, PUTHANANGADY HOUSE,\nDESOM, U.C.COLLEGE, ALUVA\nBY ADV. SRI.GEORGE SEBASTIAN\n\nbis\nCrl.MC.No. 5 of 2019 201KER/TO\n2\nRESPONDENTS/STATE & DEFACTO COMPLAINANT :-\n1 SHARLET\nAGED 43 YEARS,\nS/O. JOSEPH, THADATHIIL HOUSE, VAZHATHOPPU KARA,\nIDUKKI VILLAGE, IDUKKI DISTRICT.\n2 STATE OF KERALA,\nREPRESENTED BY PUBLIC PROSECUTOR, HIGH COURT OF\nKERALA, ERNAKULAM.\nBY ADV. SRI.ARUN JOSE THOMAS\nSRI ALEX M THOMBRA- PUBLIC PROSECUTOR\nTHIS CRIMINAL MISC. CASE HAVING BEEN FINALLY HEARD ON\n03.01.2019, THE COURT ON THE SAME DAY PASSED THE FOLLOWING:\n\na\nCrl.MC.No. 5 of 2019 2019 /KERITO\n3\nORDER\n\nPetition filed under section 482 Cr.P.C.\n\n2. Petitioners are the accused in Crime\nNo.75 of 2018 of Kulamavu Police Station registered\nfor the offences under sections 143, 147, 294(b),\n323, 427 and 452 r/w section 149 IPC. The first\nrespondent is the victim. It is submitted that the\nmatter has been settled and the proceedings in the\ntrial court may be quashed.\n\n3. Heard the learned counsel for _ the\npetitioners and first respondent and the learned\nPublic Prosecutor.\n\n4. I have perused the affidavit filed by\nthe first respondent, who has entered appearance\nthrough counsel. I am satisfied that the matter has\nbeen settled and no public interest is involved in\nthis case. There is no impediment for granting the\nprayer of the petitioners.\n\nIn the result, this Crl.M.C is allowed. The\nproceedings in Crime No.75 of 2018 of Kulamavu Police\n\nBela\nEe\nbis\nCrl.MC.No. 5 of 2019 2019 /KERITO\n4\nStation are quashed. If any material objects have\nbeen produced in this case, the trial court may pass\nappropriate orders for their disposal.\nSd/-\nK.ABRAHAM MATHEW,\nJUDGE\nSMA\n\nee ct\nBisset:\nCrl.MC.No. 5 of 2019 2019/KER/1O\n5\nAPPENDIX\nPETITIONER'S/S ANNEXURES :-\nANNEXURE A A TRUE COPY OF THE FIR WITH Fl STATEMENT\nIN CRIME NO. 75/2018 OF KULAMAVU POLICE\nSTATION.\nANNEXURE B ORIGINAL AFFIDAVIT SWORN TO BY THE iST\nRESPONDENT DATED 21-12-2018\nRESPONDENT (S)' ANNEXURES :- NIL\n//TRUE CoPpy//\nPA TO JUDGE\nSMA\n\n"
}