{
    "case_id": "",
    "court": "HIGH COURT OF KERALA AT ERNAKULAM",
    "date": "8TH DAY OF JANUARY 2018",
    "judge": "B.KEMAL PASHA\nMONDAY",
    "petitioners": [
        "COUNTER PETITIONER:",
        "SMT .ALICE THOMAS,",
        "MEMBER OF PANCHAYATH, 2ND WARD,",
        "NEDUMKANDAM GRAMAPANCHAYATH,",
        "IDUKKI .",
        "BY SRI.GRASHIOUS KURIAKOSE (SENIOR ADVOCATE)",
        "ADV.SRI.GEORGE MATHEWS"
    ],
    "respondents": [
        "(S)/PETITIONER & STATE:",
        "1. SMT .MERCYAMMA THOMAS,",
        "HEAD MISTRESS, GOVT. L.P.S, MAVADY,",
        "NEDUMKANDUM, PIN - 685 553.",
        "2. STATE OF KERALA,",
        "SUB INSPECTOR OF POLICE, NEDUMKANDUM,",
        "REPRESENTED BY PUBLIC PROSECUTOR,",
        "HIGH COURT OF KERALA, ERNAKULAM.",
        "R1 BY ADVS. SRI.TOM JOSE",
        "SMI .GEETHA JOB (OZHUKAYIL)",
        "R2 BY PUBLIC PROSECUTOR SMT.SHEEBA"
    ],
    "sections": [
        "111\nCr"
    ],
    "outcome": "ORDER DT. 19.7.14 IN M.C NO.04/14\nOF THE SUB DIVISIONAL MAGISTRATE COURT, DEVIKULAM.\nANNEXURE 2 - TRUE COPY OF THE REPRESENTATION DT. 01.7.14 FILED BY THE\nPETITIONER BEFORE THE ASSISTANT EDUCATIONAL OFFICER,\nKATTAPPANA.\nRESPONDENTS '' ANNEXURES: NIL\n/TRUE COPY/\nP.S.TO JUDGE\nmbr/\n\nBle\n2018/KER/707\nB. KEMAL PASHA, J.\nven sonee EMC NO.4482 Of 2014 cca\nDated this the 8'\" day of January, 2018\nORDER\n\nAnnexure-1 preliminary order passed by the Sub\nDivisional Magistrate's Court, Devikulam under Section 111\nCr.P.C. is under challenge.\n\n2. As per the report of the Sub Inspector of Police,\nNedumkandom, the petitioner was involved in Crime\nNo.545/2014 of Nedumkandom Police Station and the said\ncrime was registered for the offences under Sections 448\nand 342 read with Sections 34 IPC and Section 118(d) of\nthe Kerala Police Act. The case is presently pending as\nCC.521/2014 of the Judicial First Class Magistrate's Court,\nNedumkandom.\n\n3. Over and above the aforesaid case, the petitioner\n\nBue\n2018/KER/707\n\nCrl.M.C.4482/2014 5.\n\nis not involved in any other criminal case. Annexure-1 order\n\nis quite unnecessary and there was no reason for passing\n\nsuch an order. The learned Sub Divisional Magistrate had\n\nnot applied his mind in the matter and the unnecessary\nproceedings under Section 107 Cr.P.C. has been initiated.\nMatters being so, Annexure-1 order and all further\nproceedings in it are liable to be quashed",
    "full_text": "Biz fa\nce\nBus:\nIN THE HIGH COURT OF KERALA AT ERNAKULAM 2018/KER/707\nPRESENT:\nTHE HONOURABLE MR. JUSTICE B.KEMAL PASHA\nMONDAY, THE 8TH DAY OF JANUARY 2018 / 18TH POUSHA, 1939\nCr1.MC.No. 4482 of 2014\nMc 4/2014 OF SUB DIVISIONAL MAGISTRATE COURT, DEVIKULAM.\nPETITIONER/COUNTER PETITIONER:\nSMT .ALICE THOMAS,\nMEMBER OF PANCHAYATH, 2ND WARD,\nNEDUMKANDAM GRAMAPANCHAYATH,\nIDUKKI .\nBY SRI.GRASHIOUS KURIAKOSE (SENIOR ADVOCATE)\nADV.SRI.GEORGE MATHEWS\nRESPONDENT (S)/PETITIONER & STATE:\n1. SMT .MERCYAMMA THOMAS,\nHEAD MISTRESS, GOVT. L.P.S, MAVADY,\nNEDUMKANDUM, PIN - 685 553.\n2. STATE OF KERALA,\nSUB INSPECTOR OF POLICE, NEDUMKANDUM,\nREPRESENTED BY PUBLIC PROSECUTOR,\nHIGH COURT OF KERALA, ERNAKULAM.\nR1 BY ADVS. SRI.TOM JOSE\nSMI .GEETHA JOB (OZHUKAYIL)\nR2 BY PUBLIC PROSECUTOR SMT.SHEEBA\nTHIS CRIMINAL MISC. CASE HAVING BEEN FINALLY HEARD\nON 08-01-2018, THE COURT ON THE SAME DAY PASSED THE\nFOLLOWING:\nmbr/\n\nBal\noe\nBus:\n2018/KER/707\nCr1.MC.No. 4482 of 2014 ()\nAPPENDIX\nPETITIONERS' ANNEXURES:\nANNEXURE 1 - TRUE COPY OF THE PRELIMINARY ORDER DT. 19.7.14 IN M.C NO.04/14\nOF THE SUB DIVISIONAL MAGISTRATE COURT, DEVIKULAM.\nANNEXURE 2 - TRUE COPY OF THE REPRESENTATION DT. 01.7.14 FILED BY THE\nPETITIONER BEFORE THE ASSISTANT EDUCATIONAL OFFICER,\nKATTAPPANA.\nRESPONDENTS '' ANNEXURES: NIL\n/TRUE COPY/\nP.S.TO JUDGE\nmbr/\n\nBle\n2018/KER/707\nB. KEMAL PASHA, J.\nven sonee EMC NO.4482 Of 2014 cca\nDated this the 8'\" day of January, 2018\nORDER\n\nAnnexure-1 preliminary order passed by the Sub\nDivisional Magistrate's Court, Devikulam under Section 111\nCr.P.C. is under challenge.\n\n2. As per the report of the Sub Inspector of Police,\nNedumkandom, the petitioner was involved in Crime\nNo.545/2014 of Nedumkandom Police Station and the said\ncrime was registered for the offences under Sections 448\nand 342 read with Sections 34 IPC and Section 118(d) of\nthe Kerala Police Act. The case is presently pending as\nCC.521/2014 of the Judicial First Class Magistrate's Court,\nNedumkandom.\n\n3. Over and above the aforesaid case, the petitioner\n\nBue\n2018/KER/707\n\nCrl.M.C.4482/2014 5.\n\nis not involved in any other criminal case. Annexure-1 order\n\nis quite unnecessary and there was no reason for passing\n\nsuch an order. The learned Sub Divisional Magistrate had\n\nnot applied his mind in the matter and the unnecessary\nproceedings under Section 107 Cr.P.C. has been initiated.\nMatters being so, Annexure-1 order and all further\nproceedings in it are liable to be quashed.\n\nIn the result, this Crl.M.C. is allowed and Annexure-1\norder and all further proceedings against the petitioner in it\nare quashed.\n\nSd/-\n(B.KEMAL PASHA, JUDGE)\naks/08/01\n// True Copy //\nPS to Judge\n\n"
}