{
    "case_id": "Crl.MC.No.5799 OF 2020",
    "court": "HIGH COURT OF KERALA AT ERNAKULAM",
    "date": "6TH DAY OF JANUARY 2021",
    "judge": "V.G.ARUN\nWEDNESDAY",
    "petitioners": [
        "ACCUSED 1-6:",
        "1 MONCY MICHAEL",
        "AGED 26 YEARS",
        "s/o. MICHAEL, s/o. MICHAEL, THACHILETH HOUSE,",
        "KOOTTUKAD, CHENDAMANGALAM VILLAGE, PARAVUR TALUK,",
        "ERNAKULAM , PIN-683512",
        "2 NELSON SEBASTIAN,",
        "AGED 25 YEARS",
        "S/O. SEBASTIAN, PULUCKAL HOUSE, KOOTTUKAD,",
        "CHENDAMANGALAM VILLAGE, PARAVUR TALUK, ERNAKULAM,",
        "PIN-683 512",
        "3 SMIVIN K. TOMY",
        "S/O. TOMY, AGED 26 YEARS, KURUPPASSERY HOUSE,",
        "KOOTTUKAD, CHENDAMANGALAM VILLAGE, PARAVUR TALUK,",
        "ERNAKULAM, PIN-683 512",
        "4 JACKSON JOSEPH,",
        "S/O. JOSEPH, AGED 26 YEARS, MANAKKIL HOUSE,",
        "KOOTTUKAD, CHENDAMANGALAM VILLAGE, PARAVUT TALUK,",
        "ERNAKULAM, PIN-683 512",
        "5 EBIN SEBASTIAN,",
        "AGED 25 YEARS",
        "S/O. SEBASTIAN, CHANASSERY HOUSE, MOOTHAKUNNAM",
        "VILLAGE, PARAVUR TALUK, ERNAKULAM, PIN-683 516",
        "6 JOSE ANTONY,",
        "AGED 25 YEARS",
        "s/o. JOHNSON, PULIKKATHARA HOUSE, CHALIPALAM,",
        "PULIKKATHARA HOUSE, CHALIPALAM, CHENDAMANGALAM",
        "VILLAGE, PARAVUR TALUK, ERNAKULAM, PIN-683 512"
    ],
    "respondents": [
        "STATE/DE FACTO COMPLAINANT:",
        "1 STATE OF KERALA",
        "REPRESENTED BY PUBLIC PROSECUTOR, HIGH COURT OF",
        "KERALA, ERNAKULAM.",
        "2 JAFIN",
        "AGED 22 YEARS, S/O. LANSON, CHEMMASSERY HOUSE,",
        "KOOTUKAD, CHENDAMANGALAM VILLAGE, PARAVUT TALUK,",
        "ERNAKULAM, PIN-683 512",
        "R2 BY ADV. MANEESH T.T.",
        "OTHER PRESENT:",
        "SR.PP.C.S.HRITHWIK"
    ],
    "sections": [
        "143",
        "323",
        "324",
        "341 read with 149 of IPC",
        "now pending as\nC"
    ],
    "outcome": "ORDER\nDated this the 6th day of January 2021\nPetitioners are the accused in Crime\nNo.618/2019 registered at the Vadakkekara Police\nStation for offences punishable under Sections 143,\n323, 324 and 341 r/w 149 of IPC, now pending as\nC.C.No.1432/2020 on the files of the Judicial First\nClass Magistrate Court-III, North Paravur. The de\nfacto complainant, at whose instance the crime was\nregistered, is arrayed as the 2™ respondent.\nAnnexure-II affidavit has been filed by 27? respondent\nstating that the dispute, which was the reason for the\nincident and registration of the crime, has been\nresolved amicably and he has no subsisting grievance\nagainst the petitioners.\n\nee\nCrl.MC.No.5799 OF 2020 (D) LAL, 2021/KERIS50\n\n2. Heard the learned Public Prosecutor also,\nwho, on instructions, submits that the petitioners\nhave no criminal antecedents.\n\n3. Having considered the gravity of the offences\nalleged, nature of the injury caused and having\nperused the affidavit filed by the 2™4 respondent, the\ncontents of which are submitted to be true and\nvoluntary, I am satisfied that the dispute is settled and\nno public interest is involved in this matter.\nMoreover, in view of the settlement, possibility of the\ncriminal proceedings ending in conviction is remote.\n\nAs such, continuance of the proceedings will amount\nto an abuse of process of court and hence, in view of\nthe legal position set out by the Honourable Supreme\nCourt in Madan Mohan Abbot v. State of Punjab\n[(2008) 4 SCC 582] and Gian Singh v. State of\nPunjab and another [(2012) 10 SCC 303], there is\n\nCrl.MC.No.5799 OF 2020 (D) Be. 202 1/KERIB50\nno impediment in granting the relief sought.\n\nIn the result, this Crl.M.C is allowed. The\nproceedings in C.C.No.1432/2020 on the files of the\nJudicial First Class Magistrate Court-IIJ, North\nParavur is quashed",
    "full_text": "Bieta\neer teatr|\nis Dire\nPot ge\na\nIN THE HIGH COURT OF KERALA AT ERNAKULAM 202 1/KER/850\nPRESENT\nTHE HONOURABLE MR.JUSTICE V.G.ARUN\nWEDNESDAY, THE O6TH DAY OF JANUARY 2021 / 16TH POUSHA, 1942\nCr1.MC.No.5799 OF 2020(D)\nAGAINST THE JUDGMENT IN CC 1432/2020 OF JUDL. FIRST CLASS\nMAGISTRATE COURT-III,NORTH PARAVUR\nCRIME NO.618/2019 OF Vadakkekara Police Station , Ernakulam\nPETITIONER/ACCUSED 1-6:\n1 MONCY MICHAEL\nAGED 26 YEARS\ns/o. MICHAEL, s/o. MICHAEL, THACHILETH HOUSE,\nKOOTTUKAD, CHENDAMANGALAM VILLAGE, PARAVUR TALUK,\nERNAKULAM , PIN-683512\n2 NELSON SEBASTIAN,\nAGED 25 YEARS\nS/O. SEBASTIAN, PULUCKAL HOUSE, KOOTTUKAD,\nCHENDAMANGALAM VILLAGE, PARAVUR TALUK, ERNAKULAM,\nPIN-683 512\n3 SMIVIN K. TOMY\nS/O. TOMY, AGED 26 YEARS, KURUPPASSERY HOUSE,\nKOOTTUKAD, CHENDAMANGALAM VILLAGE, PARAVUR TALUK,\nERNAKULAM, PIN-683 512\n4 JACKSON JOSEPH,\nS/O. JOSEPH, AGED 26 YEARS, MANAKKIL HOUSE,\nKOOTTUKAD, CHENDAMANGALAM VILLAGE, PARAVUT TALUK,\nERNAKULAM, PIN-683 512\n5 EBIN SEBASTIAN,\nAGED 25 YEARS\nS/O. SEBASTIAN, CHANASSERY HOUSE, MOOTHAKUNNAM\nVILLAGE, PARAVUR TALUK, ERNAKULAM, PIN-683 516\n6 JOSE ANTONY,\nAGED 25 YEARS\ns/o. JOHNSON, PULIKKATHARA HOUSE, CHALIPALAM,\nPULIKKATHARA HOUSE, CHALIPALAM, CHENDAMANGALAM\nVILLAGE, PARAVUR TALUK, ERNAKULAM, PIN-683 512\nBY ADV. SRI.JOHN MATHEW (THEREZHATH)\n\n3 a\noat\na\nCrl.MC.No.5799 OF 2020(D) L.2.. 2021/KER/850\nRESPONDENT/STATE/DE FACTO COMPLAINANT:\n1 STATE OF KERALA\nREPRESENTED BY PUBLIC PROSECUTOR, HIGH COURT OF\nKERALA, ERNAKULAM.\n2 JAFIN\nAGED 22 YEARS, S/O. LANSON, CHEMMASSERY HOUSE,\nKOOTUKAD, CHENDAMANGALAM VILLAGE, PARAVUT TALUK,\nERNAKULAM, PIN-683 512\nR2 BY ADV. MANEESH T.T.\nOTHER PRESENT:\nSR.PP.C.S.HRITHWIK\nTHIS CRIMINAL MISC. CASE HAVING COME UP FOR ADMISSION ON\n06.01.2021, THE COURT ON THE SAME DAY PASSED THE FOLLOWING:\n\na\nCrl.MC.No.5799 OF 2020 (D) Be. 202 1/KERIB50\nORDER\nDated this the 6th day of January 2021\nPetitioners are the accused in Crime\nNo.618/2019 registered at the Vadakkekara Police\nStation for offences punishable under Sections 143,\n323, 324 and 341 r/w 149 of IPC, now pending as\nC.C.No.1432/2020 on the files of the Judicial First\nClass Magistrate Court-III, North Paravur. The de\nfacto complainant, at whose instance the crime was\nregistered, is arrayed as the 2™ respondent.\nAnnexure-II affidavit has been filed by 27? respondent\nstating that the dispute, which was the reason for the\nincident and registration of the crime, has been\nresolved amicably and he has no subsisting grievance\nagainst the petitioners.\n\nee\nCrl.MC.No.5799 OF 2020 (D) LAL, 2021/KERIS50\n\n2. Heard the learned Public Prosecutor also,\nwho, on instructions, submits that the petitioners\nhave no criminal antecedents.\n\n3. Having considered the gravity of the offences\nalleged, nature of the injury caused and having\nperused the affidavit filed by the 2™4 respondent, the\ncontents of which are submitted to be true and\nvoluntary, I am satisfied that the dispute is settled and\nno public interest is involved in this matter.\nMoreover, in view of the settlement, possibility of the\ncriminal proceedings ending in conviction is remote.\n\nAs such, continuance of the proceedings will amount\nto an abuse of process of court and hence, in view of\nthe legal position set out by the Honourable Supreme\nCourt in Madan Mohan Abbot v. State of Punjab\n[(2008) 4 SCC 582] and Gian Singh v. State of\nPunjab and another [(2012) 10 SCC 303], there is\n\nCrl.MC.No.5799 OF 2020 (D) Be. 202 1/KERIB50\nno impediment in granting the relief sought.\n\nIn the result, this Crl.M.C is allowed. The\nproceedings in C.C.No.1432/2020 on the files of the\nJudicial First Class Magistrate Court-IIJ, North\nParavur is quashed.\n\nSd/-\nV.G.ARUN\nSB/06/01/2020 JUDGE\n\nDes\nis Dire\nSaas\na\nCrl.MC.No.5799 OF 2020(D) .6.. 2021/KER/850\nAPPENDIX\nPETITIONER'S/S EXHIBITS:\nANNEXURE I THE TRUE COPY OF THE FIR NO. 618 OF\n2019 DATED 07.10.2019 REGISTERED AT\nTHE VADAKKEKARA POLICE STATION IN\nERNAKULAM FOR THE OFFENCES\nPUNISHABLE UNDER SECTIONS 143, 323,\n324, 341 AND 149 OF IPC.\nANNEXURE II THE TRUE COPY OF THE CHARGE SHEET\nDATED 30.10.2020 FILED IN CRIME NO.\n618 OF 2019 FOR THE OFFENCES\nPUNISHABLE UNDER SECTIONS 143, 323,\n324, 341 AND 149 OF IPC.\nANNEXURE IIT THE NOTARIZED AFFIDAVIT DATED\n17.12.2020 SWORN IN BY THE 2ND\nRESPONDENT DEFACTO COMPLAINANT IN\nTHE PRESENT CASE.\n//true copy// P.A to Judge\n\n"
}