{
    "case_id": "",
    "court": "HIGH COURT OF KERALA AT ERNAKULAM\nPRESENT",
    "date": "6TH DAY OF DECEMBER 2017",
    "judge": "B.KEMAL PASHA\nWEDNESDAY",
    "petitioners": [
        "S/ACCUSED 1 TO 3:"
    ],
    "respondents": [
        "/COMPLAINANT-STATE:",
        "STATE OF KERALA,",
        "REPRESENTED BY THE PUBLIC PROSECUTOR,",
        "HIGH COURT OF KERALA, ERNAKULAM,",
        "KOCHI - 682 O31."
    ],
    "sections": [],
    "outcome": "",
    "full_text": "Spite\nig Z ca\n2017/KER/49298\nIN THE HIGH COURT OF KERALA AT ERNAKULAM\nPRESENT:\nTHE HONOURABLE MR. JUSTICE B.KEMAL PASHA\nWEDNESDAY, THE 6TH DAY OF DECEMBER 2017/15TH AGRAHAYANA, 1939\nCr1.MC.No. 7241 of 2017 ()\nSC 791/2017 OF *(ADDITIONAL SESSIONS COURT-I, NORTH PARAVUR)\n(CORRECTED) .\nCRIME NO.206/2016 OF ALUVA WEST POLICE STATION (ALANGAD),\nERNAKULAM.\n\n*THE NAME OF THE LWER COURT OCCURRING INCRL.M.C. IS CORRECTED AND\nSUBSTITUTED AS “ADDITIONAL SESSIONS COURT-II”, NORTH PARAVUR AS\nPER ORDER DATED 13.11.2017 IN CRL.M.A.12343/2017.\n\nPETITIONERS/ACCUSED 1 TO 3:\n\n1. R.VASUDEVAN POTTI, AGED 66 YEARS,\nS/O.RAMARAJAN POTTI, R.B.BHAVAN,\nUDAYATHUM VATHIL BHAGOM, PANANGAD (P.O),\nKUMBALAM VILLAGE, KANAYANNUR TALUK,\nERNAKULAM DISTRICT.\n\n2. PRADEEP KUMAR, AGED 54 YEARS,\nS/O.A.K.NARAYANAN NAIR, PAKKATH HOUSE,\nNEAR PUTHENCHANTHA MOSQUE, VELLOR VILLAGE,\nVAIKOM TALUK, KOTTAYAM DISTRICT.\n\n3. SHINOOB, AGED 33 YEARS, S/O.KUTTIALI,\nOLAKARA HOUSE, NEAR KARAKULAM SIVA TEMPLE,\nNELLIMATTOM KARA, KUTTAMANAGALAM VILLAGE,\nKOTHAMANGALAM TALUK, ERNAKULAM DISTRICT.\n\nBY ADV. SRI.NIREESH MATHEW\nRESPONDENT /COMPLAINANT-STATE:\nSTATE OF KERALA,\nREPRESENTED BY THE PUBLIC PROSECUTOR,\nHIGH COURT OF KERALA, ERNAKULAM,\nKOCHI - 682 O31.\nBY PUBLIC PROSECUTOR SRI.ALEX M.THOMBRA\nTHIS CRIMINAL MISC. CASE HAVING COME UP FOR ADMISSION\nON 06-12-2017, THE COURT ON THE SAME DAY PASSED THE\nFOLLOWING:\nmbr/\n\n2017/KER/49298\nB. KEMAL PASHA, J.\n~—CrLM.C.No.7241 of 2017 _\nDated this the 6\" day of December, 2017\nORDER\nLearned counsel for the petitioners seeks permission to\nwithdraw this Crl.M.C., with liberty to file another application\nat appropriate stage. Permission is granted, and accordingly,\nthis Crl.M.C. is dismissed as withdrawn, with liberty to file\nanother application at appropriate stage.\nSd/-\nB, KEMAL PASHA, JUDGE.\n-e // True Copy // P.A. to Judge\n\n"
}