{
    "case_id": "",
    "court": "HIGH COURT OF KERALA AT ERNAKULAM\nPRESENT",
    "date": "2ND DAY OF JANUARY 2014",
    "judge": "HARUN-UL-RASHID\nTHURSDAY",
    "petitioners": [
        "S/ACCUSED 1, 3 & 4:",
        "1. MOIDEENKUTTY, AGED 36 YEARS",
        "$/O.AHAMEDKUNHI HAJI",
        "NOORIKARA VELLIPURATH HOUSE, KAREETTIPARAMBU",
        "MAHATPURAM P.O., KOZHIKODEDISTRICT.",
        "2. MARIA",
        "W/O.AHAMEDKUNHI HAJI, NOORIKARA VELLIPURATH HOUSE",
        "KAREETTIPARAMBU, MAHATPURAM P.O., KOZHIKODE DISTRICT.",
        "3. ASHIF HUSSAIN",
        "$/O.AHAMEDKUNHI HAJI, NOORIKARA VELLIPURATH HOUSE",
        "KAREETTIPARAMBU, MAHATPURAM P.O., KOZHIKODE DISTRICT."
    ],
    "respondents": [
        "S:",
        "1. FASLA",
        "D/O.HAMEED, PUTHANPURAYIL HOUSE, ANDONA",
        "RAROTH VILLAGE, KOZHIKODE DISTRICT, PIN - 673 573",
        "2. STATE OF KERALA",
        "REPRESENTED BY THE PUBLIC PROSECUTOR, HIGH COURT",
        "ERNAKULAM, PIN - 682 031.",
        "Ril BY ADV. SRI.PHILJO VARUGHESE PHILIPS",
        "R BY PUBLIC PROSECUTOR SRI.PHILJO VARGHESE PHILIPS"
    ],
    "sections": [
        "406",
        "498 A IPC"
    ],
    "outcome": "",
    "full_text": "Beas\n2014/KER/215\nIN THE HIGH COURT OF KERALA AT ERNAKULAM\nPRESENT:\nTHE HONOURABLE MR.JUSTICE HARUN-UL-RASHID\nTHURSDAY, THE 2ND DAY OF JANUARY 2014/12TH POUSHA, 1935\nCr1.MC.No. 30 of 2014 ()\n(CC 537/2010 OF JUDICIAL FIRST CLASS MAGISTRATE COURT-I,\nTHAMARASSERY)\nPETITIONERS/ACCUSED 1, 3 & 4:\n1. MOIDEENKUTTY, AGED 36 YEARS\n$/O.AHAMEDKUNHI HAJI\nNOORIKARA VELLIPURATH HOUSE, KAREETTIPARAMBU\nMAHATPURAM P.O., KOZHIKODEDISTRICT.\n2. MARIA\nW/O.AHAMEDKUNHI HAJI, NOORIKARA VELLIPURATH HOUSE\nKAREETTIPARAMBU, MAHATPURAM P.O., KOZHIKODE DISTRICT.\n3. ASHIF HUSSAIN\n$/O.AHAMEDKUNHI HAJI, NOORIKARA VELLIPURATH HOUSE\nKAREETTIPARAMBU, MAHATPURAM P.O., KOZHIKODE DISTRICT.\nBY ADV. SRI.V.N.RAMESAN NAMBISAN\nRESPONDENTS:\n1. FASLA\nD/O.HAMEED, PUTHANPURAYIL HOUSE, ANDONA\nRAROTH VILLAGE, KOZHIKODE DISTRICT, PIN - 673 573\n2. STATE OF KERALA\nREPRESENTED BY THE PUBLIC PROSECUTOR, HIGH COURT\nERNAKULAM, PIN - 682 031.\nRil BY ADV. SRI.PHILJO VARUGHESE PHILIPS\nR BY PUBLIC PROSECUTOR SRI.PHILJO VARGHESE PHILIPS\nTHIS CRIMINAL MISC. CASE HAVING COME UP FOR ADMISSION ON\n02-01-2014, THE COURT ON THE SAME DAY PASSED THE FOLLOWING:\n\nSee\n2014/KER/215\nCr1.MC.No. 30 of 2014 ()\nAPPENDIX\n\nPETITIONER'S EXHIBITS:\nANNEXURE 1: TRUE COPY OF FINAL CHARGE REPORT DATED 8.7.2010 SUBMITTED\nBY THE SUB INSPECTOR OF POLICE, KODUVALLY.\nANNEXURE 2: TRUE COPY OF DETAILED AGREEMENT BETWEEN THE 1ST\nPETITIONER AND THE 1ST RESPONDENT ON 17.12.2013.\nANNEXURE 3: TRUE COPY OF AFFIDAVIT SWORN TO BY THE 1ST RESPONDENT\nON 18.12.2013.\nRESPONDENTS' EXHIBITS: NIL\n\n//TRUE COPY//\n\nPA TO JUDGE\nSel.\n\npees\n2014/KER/215\nHARUN-UL-RASHID, J.\nCrl.M.C No.30 of 2014\nDated this the 2‚Äù day of January, 2014.\nORDER\n\nHeard the learned counsel for the petitioners and\nrespondents.\n\n2. Accused Nos. 1, 3 and 4 in Crime No. 286 of 2010 of\nKoduvally Police Station, pending as C.C. No.537 of 2010 before\nthe Judicial First Class Magistrate Court-I, Thamarasserry are the\npetitioners. The petition is filed seeking to quash further\nproceedings against the petitioners in C.C. No.537 of 2010 before\nthe Judicial First Class Magistrate Court-I, Thamarasserry.\n\n3. The offences alleged are punishable under Sections 406\nand 498 A IPC.\n\n4. The learned counsel on both sides submit that the\ndisputes between the parties have been amicably settled and having\nregard to the resolution of the disputes between the parties,\ncontinuance of the criminal prosecution against the petitioners is an\navoidable irritant.\n\nIn view of the settlement arrived at between the parties, the\nCrl.M.C is disposed of quashing all further proceedings in C.C.\nNo.537 of 2010 before the Judicial First Class Magistrate Court-I,\nThamarasserry.\n\nSd/-\nHARUN-UL-RASHID,\nJudge.\nscl.\n\n"
}