{
    "case_id": "",
    "court": "HIGH COURT OF KERALA AT ERNAKULAM\nPRESENT",
    "date": "11TH DAY OF JANUARY 2017",
    "judge": "SUNIL THOMAS\nWEDNESDAY",
    "petitioners": [
        "ACCUSED:",
        "MUNEER",
        "S/O.ABDULLA, AGED 25 YEARS, VANNATHANKANDY HOUSE,",
        "KUTTIPRAM AMSOM CHELAKKAD DESOM,",
        "VATAKARA TALUK, KALLACHLP.O.,",
        "KOZHIKODE DISTRICT, PIN-673 506."
    ],
    "respondents": [
        "COMPLAINANT, DEFACTO COMPLAINANT:",
        "1. SUB INSPECTOR OF POLICE",
        "NADAPURAM POLICE STATION, NADAPURAM.P.O.,",
        "KOZHIKODE DISTRICT, PIN-673 505,",
        "2. M.K.VINODAN",
        "S/O.LATE KUNHIRAMAN NANBIAR,",
        "MARANKANDY HOUSE, P.O.KAKKATTIL,",
        "KUNNUMMAL AMSOM DESOM, PIN-673 507,",
        "VATAKARA TALUK, KOZHIKODE DISTRICT.",
        "3. THE STATE OF KERALA",
        "REP. BY PUBLIC PROSECUTOR,",
        "HIGH COURT OF KERALA, ERNAKULAM.",
        "PIN-682 031."
    ],
    "sections": [
        "143",
        "147",
        "148",
        "341",
        "323",
        "326",
        "427",
        "308 read with Section 149 of the\nIndian Penal Code"
    ],
    "outcome": "ORDER/JUDGMENT IN Crl.MC 6161/2015 of HIGH COURT OF KERALA\nDATED 15-09-2015\nAGAINST THE ORDER/JUDGMENT IN SC 738/2012 of SUB COURT, QUILANDY\nDATED 30-09-2014\nCRIME NO. 407/2011 OF NADAPURAM POLICE STATION , KOZHIKODE\nPETITIONER(S)/ACCUSED:\nMUNEER\nS/O.ABDULLA, AGED 25 YEARS, VANNATHANKANDY HOUSE,\nKUTTIPRAM AMSOM CHELAKKAD DESOM,\nVATAKARA TALUK, KALLACHLP.O.,\nKOZHIKODE DISTRICT, PIN-673 506.\nBY ADVS.SRI.U.P BALAKRISHNAN\nSRI.C.H.ABDUL RASAC\nRESPONDENT(S)/COMPLAINANT, DEFACTO COMPLAINANT:\n1. SUB INSPECTOR OF POLICE\nNADAPURAM POLICE STATION, NADAPURAM.P.O.,\nKOZHIKODE DISTRICT, PIN-673 505,\n2. M.K.VINODAN\nS/O.LATE KUNHIRAMAN NANBIAR,\nMARANKANDY HOUSE, P.O.KAKKATTIL,\nKUNNUMMAL AMSOM DESOM, PIN-673 507,\nVATAKARA TALUK, KOZHIKODE DISTRICT.\n3. THE STATE OF KERALA\nREP. BY PUBLIC PROSECUTOR,\nHIGH COURT OF KERALA, ERNAKULAM.\nPIN-682 031.\nBY ADV. SRI.K.R.AVINASH (KUNNATH)\nBY SRIAMJAD ALI,PUBLIC PROSECUTOR\nTHIS CRIMINAL MISC. CASE HAVING COME UP FOR ADMISSION ON\n11-01-2017, THE COURT ON THE SAME DAY PASSED THE FOLLOWING:\n\nDiets ol\nmae ae ta\n2017/KER/1507\nCri.MC.No. 2641 of 2016 ()\nAPPENDIX\nPETITIONER(S)’ EXHIBITS\nANNEXURE-1 THE TRUE COPY OF THE FIR DATED 22.08.2011 IN CRIME NO.407/2011\nOF NADAPURAM POLICE STATION.\nANNEXURE-2 THE TRUE COPY OF THE CHARGE SHEET DATED 30.12.2011 IN\nCRIME NO.407/2011 OF NADAPURAM POLICE STATION.\nANNEXURE-3 JUDGMENT DATED 30.09.2014 IN S.C.NO.738/12 ON THE FILES OF\nTHE ASSISTANT SESSION COURT, VATAKARA.\nANNEXURE-4 THE TRUE COPY OF THE ORDER DATED 15.09.2015 IN\nCRL.M.C.NO.6157/15.\nANNEXURE-5 AFFIDAVIT SWORN IN BY THE DEFACTO-COMPLAINANT IN CRIME\nNO.407/2011 OF NADAPURAM POLICE STATION.\nRESPONDENT'S EXHIBITS NIL\nR.AV TRUE COPY/\nPATO JUDGE\n\n2017/KER/1507\nSUNIL THOMAS, J.\n~ Cri.M.(C).No.2641 of 2016\nDated this the 11\" day of January, 2017\nORDER\n\nThe petitioner herein is the accused No.2 in Crime\nNo.407/2011 of Nadapuram Police Station in SC.No.1104\nof 2014 on the files of the Assistant Sessions Court,\nVatakara for offence punishable under Sections 143, 147,\n148, 341, 323, 326, 427, 308 r/w Section 149 of the\nIndian Penal Code.\n\n2. According to the prosecution, on 21.08.2011\nthe petitioner along with several other persons formed\ninto an unlawful assembly and in furtherance of their\ncommon object attacked the defacto complainant and\nothers. The first accused was pulled out of his car and hit\non the head with a stick. Crime was registered and after\ninvestigation, final report was laid. All other accused\nexcept the petitioner herein and accused No.2 faced the\ntrial before the court below. By Annexure-A3 judgment\nall the accused who faced the trial were acquitted.\n\n2017/KER/1507\nCri.M.(C).No.2641 of 2016 2\nContending that the petitioner herein is entitled for the\nbenefit of acquittal arrived at by the Sessions Court in\nAnnexure-A3 and that the substratum of the case is\nbroken in the light of the above finding, the petitioner\nseeks to quash the proceedings.\n\n3. Opposing the application the learned Public\nProsecutor submitted that the petitioner is involved in few\nother cases. It was further pointed out that the petitioner\nherein remained absent for a long period and he is trying\nto get a benefit of acquittal by the co-accused who faced\nthe trial. The learned counsel for the petitioner and the\nlearned counsel for the second respondent-defacto\ncomplainant submitted that, they have resolved their\ndisputes evidenced by Annexure-A5 affidavit. It was\nfurther pointed out that there were series of incident and\nall the persons in the locality were roped in several\ncases. Other cases in which the petitioner herein is\ninvolved are the cases registered on the same day as a\nsequel to the main case. I find some substance in that\ncontention. It is pertinent to note that in Annexure-A3\n\n2017/KER/1507\n\nCri.M.(C).No.2641 of 2016 3\n\njudgment, the court below had clearly arrived at a finding\nthat all the material witnesses failed to support the\nprosecution and had not identified the accused. In the\nlight of above, I find that no purpose will be served by\nprosecuting the petitioner herein, which can only result in\nmanifest injustice and mere waste of time. There is no\nlikelihood of the care ending in a successful conviction.\nThough the allegation against the accused is serious\ninsofar as Sections 308 and 326 IPC are attributed. There\nis no clear material to establish offence under Section 308\nof IPC. Hence I am inclined to allow the Crl.M.C and all\nthe further proceedings SC.No.1104/2014 on the files of\nthe Assistant Sessions Court, Vatakara as against the\npetitioner herein stands quashed",
    "full_text": "Diets ol\nmae ae ta\n2017/KER/1507\nIN THE HIGH COURT OF KERALA AT ERNAKULAM\nPRESENT:\nTHE HONOURABLE MR. JUSTICE SUNIL THOMAS\nWEDNESDAY, THE 11TH DAY OF JANUARY 2017/21ST POUSHA, 1938\nCrI.MC.No. 2641 of 2016 ()\nAGAINST THE ORDER/JUDGMENT IN Crl.MC 6161/2015 of HIGH COURT OF KERALA\nDATED 15-09-2015\nAGAINST THE ORDER/JUDGMENT IN SC 738/2012 of SUB COURT, QUILANDY\nDATED 30-09-2014\nCRIME NO. 407/2011 OF NADAPURAM POLICE STATION , KOZHIKODE\nPETITIONER(S)/ACCUSED:\nMUNEER\nS/O.ABDULLA, AGED 25 YEARS, VANNATHANKANDY HOUSE,\nKUTTIPRAM AMSOM CHELAKKAD DESOM,\nVATAKARA TALUK, KALLACHLP.O.,\nKOZHIKODE DISTRICT, PIN-673 506.\nBY ADVS.SRI.U.P BALAKRISHNAN\nSRI.C.H.ABDUL RASAC\nRESPONDENT(S)/COMPLAINANT, DEFACTO COMPLAINANT:\n1. SUB INSPECTOR OF POLICE\nNADAPURAM POLICE STATION, NADAPURAM.P.O.,\nKOZHIKODE DISTRICT, PIN-673 505,\n2. M.K.VINODAN\nS/O.LATE KUNHIRAMAN NANBIAR,\nMARANKANDY HOUSE, P.O.KAKKATTIL,\nKUNNUMMAL AMSOM DESOM, PIN-673 507,\nVATAKARA TALUK, KOZHIKODE DISTRICT.\n3. THE STATE OF KERALA\nREP. BY PUBLIC PROSECUTOR,\nHIGH COURT OF KERALA, ERNAKULAM.\nPIN-682 031.\nBY ADV. SRI.K.R.AVINASH (KUNNATH)\nBY SRIAMJAD ALI,PUBLIC PROSECUTOR\nTHIS CRIMINAL MISC. CASE HAVING COME UP FOR ADMISSION ON\n11-01-2017, THE COURT ON THE SAME DAY PASSED THE FOLLOWING:\n\nDiets ol\nmae ae ta\n2017/KER/1507\nCri.MC.No. 2641 of 2016 ()\nAPPENDIX\nPETITIONER(S)’ EXHIBITS\nANNEXURE-1 THE TRUE COPY OF THE FIR DATED 22.08.2011 IN CRIME NO.407/2011\nOF NADAPURAM POLICE STATION.\nANNEXURE-2 THE TRUE COPY OF THE CHARGE SHEET DATED 30.12.2011 IN\nCRIME NO.407/2011 OF NADAPURAM POLICE STATION.\nANNEXURE-3 JUDGMENT DATED 30.09.2014 IN S.C.NO.738/12 ON THE FILES OF\nTHE ASSISTANT SESSION COURT, VATAKARA.\nANNEXURE-4 THE TRUE COPY OF THE ORDER DATED 15.09.2015 IN\nCRL.M.C.NO.6157/15.\nANNEXURE-5 AFFIDAVIT SWORN IN BY THE DEFACTO-COMPLAINANT IN CRIME\nNO.407/2011 OF NADAPURAM POLICE STATION.\nRESPONDENT'S EXHIBITS NIL\nR.AV TRUE COPY/\nPATO JUDGE\n\n2017/KER/1507\nSUNIL THOMAS, J.\n~ Cri.M.(C).No.2641 of 2016\nDated this the 11\" day of January, 2017\nORDER\n\nThe petitioner herein is the accused No.2 in Crime\nNo.407/2011 of Nadapuram Police Station in SC.No.1104\nof 2014 on the files of the Assistant Sessions Court,\nVatakara for offence punishable under Sections 143, 147,\n148, 341, 323, 326, 427, 308 r/w Section 149 of the\nIndian Penal Code.\n\n2. According to the prosecution, on 21.08.2011\nthe petitioner along with several other persons formed\ninto an unlawful assembly and in furtherance of their\ncommon object attacked the defacto complainant and\nothers. The first accused was pulled out of his car and hit\non the head with a stick. Crime was registered and after\ninvestigation, final report was laid. All other accused\nexcept the petitioner herein and accused No.2 faced the\ntrial before the court below. By Annexure-A3 judgment\nall the accused who faced the trial were acquitted.\n\n2017/KER/1507\nCri.M.(C).No.2641 of 2016 2\nContending that the petitioner herein is entitled for the\nbenefit of acquittal arrived at by the Sessions Court in\nAnnexure-A3 and that the substratum of the case is\nbroken in the light of the above finding, the petitioner\nseeks to quash the proceedings.\n\n3. Opposing the application the learned Public\nProsecutor submitted that the petitioner is involved in few\nother cases. It was further pointed out that the petitioner\nherein remained absent for a long period and he is trying\nto get a benefit of acquittal by the co-accused who faced\nthe trial. The learned counsel for the petitioner and the\nlearned counsel for the second respondent-defacto\ncomplainant submitted that, they have resolved their\ndisputes evidenced by Annexure-A5 affidavit. It was\nfurther pointed out that there were series of incident and\nall the persons in the locality were roped in several\ncases. Other cases in which the petitioner herein is\ninvolved are the cases registered on the same day as a\nsequel to the main case. I find some substance in that\ncontention. It is pertinent to note that in Annexure-A3\n\n2017/KER/1507\n\nCri.M.(C).No.2641 of 2016 3\n\njudgment, the court below had clearly arrived at a finding\nthat all the material witnesses failed to support the\nprosecution and had not identified the accused. In the\nlight of above, I find that no purpose will be served by\nprosecuting the petitioner herein, which can only result in\nmanifest injustice and mere waste of time. There is no\nlikelihood of the care ending in a successful conviction.\nThough the allegation against the accused is serious\ninsofar as Sections 308 and 326 IPC are attributed. There\nis no clear material to establish offence under Section 308\nof IPC. Hence I am inclined to allow the Crl.M.C and all\nthe further proceedings SC.No.1104/2014 on the files of\nthe Assistant Sessions Court, Vatakara as against the\npetitioner herein stands quashed.\n\nSd/-\nSUNIL THOMAS, JUDGE\nR.AV /[TRUE COPY//\nPA TO JUDGE\n\n"
}