{
    "case_id": "Crl.MC.No. 204 of 2019",
    "court": "HIGH COURT OF KERALA AT ERNAKULAM\nPRESENT\nTHE HONOURABLE MR",
    "date": "09TH DAY OF JANUARY 2019",
    "judge": "K.ABRAHAM MATHEW\nWEDNESDAY",
    "petitioners": [
        "S:"
    ],
    "respondents": [
        "S:"
    ],
    "sections": [
        "482 Cr"
    ],
    "outcome": "ORDER\nPetition filed under Section 482 Cr.P.C.\n2. The petitioners are the accused in CC No. 959\nof 2013 on the file of the Judicial First\nClass Magistrate Court-II, Kollam registered\nfor the offences under Sections 294(b), 323 &\n341 of the Indian Penal Code. The second\nrespondent is the victim. It is submitted that\nthe matter has been settled and the\nproceedings in the criminal case may be\nquashed",
    "full_text": "oS\nElz i ie\n2019/KER/1029\nIN THE HIGH COURT OF KERALA AT ERNAKULAM\nPRESENT\nTHE HONOURABLE MR. JUSTICE K.ABRAHAM MATHEW\nWEDNESDAY, THE 09TH DAY OF JANUARY 2019 / 19TH POUSHA,\n1940\nCrl.MC.No. 204 of 2019\nCC 959/2013 OF J.M.F.C.-II, KOLLAM\nCRIME NO. 1752/2013 OF KOLLAM EAST POLICE STATION ,\nKOLLAM\nPETITIONER/S:\n\n1 AKHIL, AGED 25 YEARS,\n\nS/O.BHARGAVAN, KALPAKOM VEEDU,\nCHERIYAVELINALLOOR, ELAMADU VILLAGE, KOLLAM.\n\n2 KOUSHIK, AGED 26 YEARS, S/O.MOHANDAS, KOUSHIK\nNIVAS, DECENT JUNCTION, CHENTHAPUR CHERRY,\nTHRIKKOVILVATTOM VILLAGE, KOLLAM.\n\n3 HARIS, AGED 26 YEARS, S/O.SIRAJUDEEN,\nPUTHENAZHIKOM VEEDU, GOPALASSERY, VADAKKEVILA\nCHERRY, VADAKKEVILA VILLAGE, KOLLAM.\n\n4 MUSTHAFA, AGED 26 YEARS\nS/O.MAJEED KUNJU, MANOOFA MANZIL, NJARAKKAL,\nNJARAKKAL CHERRY, PERINADU VILLAGE KOLLAM.\n\nBY ADV. SRI.B.MOHANLAL\nRESPONDENT/S:\n\n1 STATE, REPRESENTED BY THE STATION HOUSE\nOFFICER, KOLLAM EAST POLICE STATION IN KOLLAM\nDISTRICT, THROUGH THE PUBLIC PROSECUTOR, HIGH\nCOURT OF KERALA, ERNAKULAM-682031.\n\noS\nElz 4 te\n2019/KER/1029\nCrl.MC.No. 204 of 2019\n1i2..\n2 SYAM KUMAR,\nS/O.SASIDHARAN PILLAI, EDATHUNDIL PUTHEN\nVEEDU, PORIPPANMUKKU, ANOOR CHERRY,\nNEDUVATHOOR VILLAGE, KOTTARAKKARA, KOLLAM-\n691506.\nBY ADV. SRI.A.SANIL KUMAR\nOTHER PRESENT:\nSRI C S HRITHWIK-SR PUBLIC PROSECUTOR\nTHIS CRIMINAL MISC. CASE HAVING COME UP FOR ADMISSION ON\n09.01.2019, THE COURT ON THE SAME DAY PASSED THE\nFOLLOWING:\nORDER\nPetition filed under Section 482 Cr.P.C.\n2. The petitioners are the accused in CC No. 959\nof 2013 on the file of the Judicial First\nClass Magistrate Court-II, Kollam registered\nfor the offences under Sections 294(b), 323 &\n341 of the Indian Penal Code. The second\nrespondent is the victim. It is submitted that\nthe matter has been settled and the\nproceedings in the criminal case may be\nquashed.\n\nbane\n2019/KER/1029\n\nCrl.MC.No. 204 of 2019\n\n1.3..\n\n3. Heard the learned counsel for the petitioners\nand the second respondent and the learned\nPublic Prosecutor.\n\n4. I have perused the affidavit filed by the\nsecond respondent, who has entered appearance\nthrough counsel. I am satisfied that the\nallegation of settlement is true and no public\ninterest is involved. There is no impediment\nfor granting the prayer of the petitioners.\n\nIn the result, this Crl.M.C. is allowed. The\nproceedings in CC No. 959 of 2013 on the file\nof the Judicial First Class Magistrate\nCourt-II, Kollam are quashed. The learned\nmagistrate may pass appropriate orders for the\ndisposal of the material objects, if any,\nproduced in the case.\n\nSd/-\n\nK.ABRAHAM MATHEW\nJUDGE\nBka/11.01.2019\n\noS\nElz i ie\n2019/KER/1029\nCr1.MC.No. 204 of 2019\nAPPENDIX\nPETITIONER'S/S EXHIBITS:\nANNEXURE Al THE TRUE CERTIFIED COPY OF THE FIR AND\nFIS IN CRIME NO.1752/2013 OF KOLLAM\nEAST POLICE STATION IN KOLLAM\nDISTRICT.\nANNEXURE A2 THE TRUE CERTIFIED COPY OF THE FINAL\nREPORT IN CRIME NO.1752/2013 OF KOLLAM\nEAST POLICE STATION IN KOLLAM DISTRICT\nPENDING AS C.C.NO.959/2013 ON THE FILE\nOF THE JUDICIAL FIRST CLASS MAGISTRATE\nCOURT-II, KOLLAM.\nANNEXURE A3 THE TRUE COPY OF THE AFFIDAVIT DATED\n05.01.2019 FILED BY THE 2ND RESPONDENT\nBEFORE THIS HON'BLE COURT.\n\n"
}