{
    "case_id": "Crl.MC.No.1597 OF 2020",
    "court": "HIGH COURT OF KERALA AT ERNAKULAM",
    "date": "6TH DAY OF JANUARY 2021",
    "judge": "V.G.ARUN\nWEDNESDAY",
    "petitioners": [
        "S:",
        "1 MIKDAD K.A.",
        "AGED 38 YEARS",
        "s/o. ASSAINAR, KALLUVALAPPIL HOUSE, BHOOTHANAM P.O.",
        "VELUMBIYAM PADAM, EDAKAKRA, NILAMBUR, MALAPPURAM",
        "DISTRICT.",
        "2 ABDU SAMAD.C.,",
        "AGED 47 YEARS",
        "s/o. AHAMMEDKUTTY, CHERATTIKUTH HOUSE, PATHIRIPADAM,",
        "CHUNGATHARA, MALAPPURAM DISTRICT."
    ],
    "respondents": [
        "S:",
        "1 STATE OF KERALA",
        "REPRESENTED BY PUBLIC PROSECUTOR, HIGH COURT OF",
        "KERALA, ERNAKULAM 31.",
        "2 THE STATION HOUSE OFFICER,",
        "ERNAKULAM TOWN POLICE STATION, ERNAKULAM P.O.",
        "ERNAKULAM DISTRICT 682 018.",
        "3 SUSHEEL KONGARI,",
        "S/O. MANSITH KONGARI, BORGOLAI VILLAGE, SUNITPUR",
        "DISTRICT, ASSAM, 786 181.",
        "OTHER PRESENT:",
        "SR.PP.C.S.HRITHWIK"
    ],
    "sections": [],
    "outcome": "",
    "full_text": "mies\neral\nap\nIN THE HIGH COURT OF KERALA AT ERNAKULAM 2021/KER/702\nPRESENT\nTHE HONOURABLE MR.JUSTICE V.G.ARUN\nWEDNESDAY, THE O6TH DAY OF JANUARY 2021 / 16TH POUSHA, 1942\nCr1.MC.No.1597 OF 2020 (H)\nCRIME NO.115/2019 OF Ernakulam North Police Station , Ernakulam\nPETITIONER/S:\n1 MIKDAD K.A.\nAGED 38 YEARS\ns/o. ASSAINAR, KALLUVALAPPIL HOUSE, BHOOTHANAM P.O.\nVELUMBIYAM PADAM, EDAKAKRA, NILAMBUR, MALAPPURAM\nDISTRICT.\n2 ABDU SAMAD.C.,\nAGED 47 YEARS\ns/o. AHAMMEDKUTTY, CHERATTIKUTH HOUSE, PATHIRIPADAM,\nCHUNGATHARA, MALAPPURAM DISTRICT.\nBY ADV. SRI.C.M.MOHAMMED IQUABAL\nRESPONDENT/S:\n1 STATE OF KERALA\nREPRESENTED BY PUBLIC PROSECUTOR, HIGH COURT OF\nKERALA, ERNAKULAM 31.\n2 THE STATION HOUSE OFFICER,\nERNAKULAM TOWN POLICE STATION, ERNAKULAM P.O.\nERNAKULAM DISTRICT 682 018.\n3 SUSHEEL KONGARI,\nS/O. MANSITH KONGARI, BORGOLAI VILLAGE, SUNITPUR\nDISTRICT, ASSAM, 786 181.\nOTHER PRESENT:\nSR.PP.C.S.HRITHWIK\nTHIS CRIMINAL MISC. CASE HAVING COME UP FOR ADMISSION ON\n06.01.2021, THE COURT ON THE SAME DAY PASSED THE FOLLOWING:\n\nCrl1.MC.No.1597 OF 2020 (H) ide, 202UKERI702\nORDER\n\nDated this the 6th day of January 2021\n\nThe Criminal M.C.is filed challenging the further\nproceedings in Crime No.115/2019 of Ernakulam\nTown Police Station. Pending the Criminal M.C.,\ninvestigation was completed and final report filed.\n\n2. The learned Public Prosecutor submits that\nthe matter is now pending before the jurisdictional\ncourt.\n\nIn such circumstances, nothing survives for\nconsideration in this Criminal M.C. and accordingly,\nthe Criminal MC.is closed, reserving the petitioners'\nliberty to approach the jurisdictional court for\nappropriate relief.\n\nSd/-\nV.G.ARUN\nSB/06/01/2020 JUDGE\n\nleer\nCrl.MC.No.1597 OF 2020(H) 3. 202UKERI702\nAPPENDIX\n\nPETITIONER'S/S EXHIBITS:\nANNEXURE Al TRUE COPY OF THE F.I.R. IN CRIME NO.\n\n115/2019 OF ERNAKULAM TOWN POLICE\n\nSTATION DATED 14.1.2019.\n\n//true copy// P.A to Judge\n\n"
}