{
    "case_id": "",
    "court": "HIGH COURT OF KERALA AT ERNAKULAM",
    "date": "5TH DAY OF JANUARY 2018",
    "judge": "B.KEMAL PASHA\nFRIDAY",
    "petitioners": [
        "(S) /ACCUSED 2,3,4 & 6",
        "1 P.C.VARGHESE @ KUNJUMON,",
        "S/O.CHERIYA, AGED ABOUT 67 YEARS,",
        "PUTHUSSERY HOUSE, MUKKANNUR KARA,",
        "MUKKANNUR VILLAGE",
        "2 P.C. JOSEPH @ THAMPI,",
        "S/O.CHERIYA, AGED ABOUT 77 YEARS,",
        "PUTHUSSERY HOUSE, MUKKANNUR KARA,",
        "MUKKANNUR VILLAGE",
        "3 PC. THOMAS",
        "S/O.CHERIYA, AGED ABOUT 63 YEARS,",
        "PUTHUSSERY HOUSE, MUKKANNUR KARA,",
        "MUKKANNUR VILLAGE",
        "4 MARY JACOB",
        "W/O. LATE PC. JACOB, AGED ABOUT 70 YEARS,",
        "PUTHUSSERY HOUSE, MUKKANNUR KARA,",
        "MUKKANNUR VILLAGE"
    ],
    "respondents": [
        "(S) /STATE & COMPLAINANT:",
        "1. STATE OF KERALA",
        "THROUGH THE STATION HOUSE OFFICER, ANGAMALY POLICE",
        "STATION, REPRESENTED BY PUBLIC PROSECUTOR, HIGH COURT OF",
        "KERALA, 682031",
        "2. BABU",
        "S/O.POULOSE @ PAUL, AGED 38 YEARS, PANADAN (PUTHUSSERY HOUSE),",
        "EZHATTUMUGHAM KARA, KARUKUTTY VILLAGE 683576",
        "Rl BY PUBLIC PROSECUTOR SRI. AMJAD ALI",
        "R2 BY ADVS. SRI.T.P.SAJAN"
    ],
    "sections": [
        "297",
        "201 read with Section\n34 IPC"
    ],
    "outcome": "ORDER DATED 22.01.2016 OF THE HON'BLE HIGH COURT IN\nCRL.MC.NO.4651/2015\nANNEXUURE 8:TRUE COPY OF FINAL REPORT AND THE ACCOMPANYING DOCUMENTS\nFILED IN CRIME NO.172/2015 OF ANGAMALY POLICE STATION\nRESPONDENTS ANNEXURES NIL\n/ TRUE COPY/\nPA TO JUDGE\nsdr/-\n\n2018/KER/476\nB. KEMAL PASHA, J.\nDated this the 5\" day of January, 2018\nORDER\n\nPetitioners are A2, A3, A4 and A6 in CC\nNo.1979/2015 of the Judicial First Class Magistrate's Court,\nAngamaly, based on Annexure-8 final report in Crime\nNo.172/2015 of Angamaly Police Station for the offences\npunishable under Sections 297 and 201 read with Section\n34 IPC.\n\n2. On going through the allegations in the final\nreport, it has come out that the offence under Section 297\nIPC cannot be attracted. As far as the offence under\nSection 201 IPC is concerned, when the other offence\ncannot be attracted, there cannot be an offence under\nSection 201 IPC also. Matters being so, the prosecution of\nthe petitioners in the case is quite unnecessary and\n\nRepeal\neine\n2018/KER/476\nCrl.M.C.1183/2016\n:2:\ntherefore, all further proceedings in CC No.1979/2015 of\nthe Judicial First Class Magistrate's Court, Angamaly, based\non Annexure-8 final report in Crime No.172/2015_ of\nAngamaly Police Station are liable to be quashed",
    "full_text": "BST\nlacie\nBae\nIN THE HIGH COURT OF KERALA AT ERNAKULAM 2018/KER/476\nPRESENT:\nTHE HONOURABLE MR. JUSTICE B.KEMAL PASHA\nFRIDAY, THE 5TH DAY OF JANUARY 2018 / 15TH POUSHA, 1939\nCr1.MC.No. 1183 of 2016\ncc 1979/2015 OF JUDICIAL FIRST CLASS MAGISTRATE COURT,\nANGAMALY\nCRIME NO. 172/2015 OF ANGAMALY POLICE STATION ,\nERNAKULAM\nPETITIONER (S) /ACCUSED 2,3,4 & 6\n1 P.C.VARGHESE @ KUNJUMON,\nS/O.CHERIYA, AGED ABOUT 67 YEARS,\nPUTHUSSERY HOUSE, MUKKANNUR KARA,\nMUKKANNUR VILLAGE\n2 P.C. JOSEPH @ THAMPI,\nS/O.CHERIYA, AGED ABOUT 77 YEARS,\nPUTHUSSERY HOUSE, MUKKANNUR KARA,\nMUKKANNUR VILLAGE\n3 PC. THOMAS\nS/O.CHERIYA, AGED ABOUT 63 YEARS,\nPUTHUSSERY HOUSE, MUKKANNUR KARA,\nMUKKANNUR VILLAGE\n4 MARY JACOB\nW/O. LATE PC. JACOB, AGED ABOUT 70 YEARS,\nPUTHUSSERY HOUSE, MUKKANNUR KARA,\nMUKKANNUR VILLAGE\nBY ADVS.SRI.GEORGE\nVARGHESE (PERUMPALLIKUTTIYIL)\nSRI.A.R.DILEEP\nSRI.MANU SEBASTIAN\nSRI.P.J.JOH PAUL\n\nBese\nlacie\nBeas\n2018/KER/476\nCr1.MC.No. 1183 of 2016\nRESPONDENT (S) /STATE & COMPLAINANT:\n1. STATE OF KERALA\nTHROUGH THE STATION HOUSE OFFICER, ANGAMALY POLICE\nSTATION, REPRESENTED BY PUBLIC PROSECUTOR, HIGH COURT OF\nKERALA, 682031\n2. BABU\nS/O.POULOSE @ PAUL, AGED 38 YEARS, PANADAN (PUTHUSSERY HOUSE),\nEZHATTUMUGHAM KARA, KARUKUTTY VILLAGE 683576\nRl BY PUBLIC PROSECUTOR SRI. AMJAD ALI\nR2 BY ADVS. SRI.T.P.SAJAN\nSRI.M.MOHAMED NAVAZ\nSRI.P.SANTHOSH KUMAR (TR)\nTHIS CRIMINAL MISC. CASE HAVING BEEN FINALLY HEARD ON 05-01-2018,\nTHE COURT ON THE SAME DAY PASSED THE FOLLOWING:\nsdr/-\n\nBese\nlacie\nape eos\n2018/KER/476\nCr1.MC.No. 1183 of 2016\nAPPENDIX\nPETITIONER(S)' ANNEXURES\nANNEXURE 1::TRUE COPY OF FIR IN CRIME NO.172/2015 OF ANGAMALY POLICE STATION\nANNEXURE 2:TRUE COPY OF COMPLAINT LEADING TO THE REGISTRATION OF ANNEX. I,\nFIR\nANNEXURE 3:TRUE COPY OF RELEVANT PAGES OF DIRECTIONS AND GUIDELINES OF\nERNAKULAM CHURCH ADMINISTRATION BYE LAW ON GRAVE\nANNEXURE 4:TRUE COPY OF PLAINT IN OS.NO.393/2012 OF THE MUNSIFF'S COURT,\nALUVA\nANNEXURE 5:TRUE COPY OF APPLICATION MADE BY 1ST ACCUSED TO VICAR, ST.\nMARY'S CHURCH MUKKANNOOR\nANNEXURE 6:TRUE COPY OF COMMUNICATION DATED 05.05.2015 ISSUED BY THE VICAR\nOF ST.MARY'S FORANE CHURCH, MOOKKANNOOR\nANNEXURE 7:TRUE COPY OF ORDER DATED 22.01.2016 OF THE HON'BLE HIGH COURT IN\nCRL.MC.NO.4651/2015\nANNEXUURE 8:TRUE COPY OF FINAL REPORT AND THE ACCOMPANYING DOCUMENTS\nFILED IN CRIME NO.172/2015 OF ANGAMALY POLICE STATION\nRESPONDENTS ANNEXURES NIL\n/ TRUE COPY/\nPA TO JUDGE\nsdr/-\n\n2018/KER/476\nB. KEMAL PASHA, J.\nDated this the 5\" day of January, 2018\nORDER\n\nPetitioners are A2, A3, A4 and A6 in CC\nNo.1979/2015 of the Judicial First Class Magistrate's Court,\nAngamaly, based on Annexure-8 final report in Crime\nNo.172/2015 of Angamaly Police Station for the offences\npunishable under Sections 297 and 201 read with Section\n34 IPC.\n\n2. On going through the allegations in the final\nreport, it has come out that the offence under Section 297\nIPC cannot be attracted. As far as the offence under\nSection 201 IPC is concerned, when the other offence\ncannot be attracted, there cannot be an offence under\nSection 201 IPC also. Matters being so, the prosecution of\nthe petitioners in the case is quite unnecessary and\n\nRepeal\neine\n2018/KER/476\nCrl.M.C.1183/2016\n:2:\ntherefore, all further proceedings in CC No.1979/2015 of\nthe Judicial First Class Magistrate's Court, Angamaly, based\non Annexure-8 final report in Crime No.172/2015_ of\nAngamaly Police Station are liable to be quashed.\nIn the result, this Crl.M.C. is allowed and all further\nproceedings against the petitioners in CC No.1979/2015 of\nthe Judicial First Class Magistrate's Court, Angamaly, based\non Annexure-8 final report in Crime No.172/2015 of\nAngamaly Police Station, are quashed.\nSd/-\n(B.KEMAL PASHA, JUDGE)\naks/05/01\n1! True Copy //\nPS to Judge\n\n"
}