{
    "case_id": "Crl.MC.No. 7086 of 2017",
    "court": "HIGH COURT OF KERALA AT ERNAKULAM\nPRESENT",
    "date": "8TH DAY OF DECEMBER 2017",
    "judge": "B.KEMAL PASHA\nFRIDAY",
    "petitioners": [
        "1ST AND 2ND COUNTER PETITIONERS:",
        "1. VINOD CRASTA,",
        "S/O.KALASTIN CRASTA, AGED 32 YEARS,",
        "NEAR BELA CHURCH, BELA, KASARAGOD.",
        "2. NAVEEN D'SOUZA,",
        "S/O.PAUL D'SOUZA, AGED 25 YEARS,",
        "MADATHADAKA, NEERCHAL, KASARAGOD."
    ],
    "respondents": [
        "COMPLAINANT AND STATE:",
        "1. THE SUB INSPECTOR OF POLICE,",
        "BADIADKA POLICE STATION,",
        "KASARAGOD-671121.",
        "2. THE STATE OF KERALA,",
        "REPRESENTED BY THE PUBLIC PROSECUTOR,",
        "HIGH COURT OF KERALA, ERNAKULAM-682031."
    ],
    "sections": [
        "107 Cr"
    ],
    "outcome": "ORDER DATED 22.8.2017 OF THE SUB\nDIVISIONAL MAGISTRATE, KASARAGOD.\nANNEXURE II THE TRUE COPY OF THE FIRST INFORMATION REPORT\nALLEGEDLY REGISTERED AS CRIME 405/2017.\nANNEXURE IIl COPY OF THE REPORT FILED BY THE SUB INSPECTOR OF\nPOLICE DATED 27.7.17.\nANNEXURE IV. THE TRUE COPY OF THE FIRST INFORMATION REPORT\nIN CRIME 140/2017 OF BADIADKA POLICE STATION.\nANNEXURE V THE TRUE COPY OF THE FINAL REPORT FILED BY THE POLICE\nBEFORE THE JUDICIAL FIRST CLASS MAGISTRATE COURT-II,\nKASARAGOD, IN C.C.NO.944/17 IN RESPECT OF CRIME 140/2017.\nANNEXURE VI. THE TRUE COPY OF THE FIRST INFORMATION REPORT\nIN CRIME 326/17.\nANNEXURE Vil THE TRUE COPY OF THE ORDER IN BA 4930/2017.\nRESPONDENT(S)' ANNEXURES- NIL\n[TRUE COPY/\nPS TO JUDGE\nTS\n\n2017/KER/49768\nB. KEMAL PASHA, J.\nDated this the 8\" day of December, 2017\nORDER\nOn the basis of Annexure-lll report filed by the\nSub Inspector of Police, Badiadka Police Station,\nproceedings under Section 107 Cr.P.C. have been initiated\nagainst the petitioners. The report shows that the petitioners\nare two among the accused in two crimes. One crime is\nCrime No.140/2017 of Badiadka Police Station for the\noffences under Sections 143, 147, 341, 323 and 506(i) read\nwith Section 149 IPC and the other crime is Crime\nNo.326/2017 of Badiadka Police Station for the offences\nunder Sections 341 and 323 read with Section 34 IPC.\nApart from these two crimes, no other crimes have been\nregistered against the petitioners.\n2. Based on the aforesaid aspects alone, the\n\nBeal\naa\n2017/KER/49768\nCrl.M.C.7086/2017\n:2:\npetitioners cannot be trapped in proceedings under Section\n107 Cr.P.C. Matters being so, Annexure-l order is liable to\nbe quashed",
    "full_text": "oben\neee\nEl fs\" Se\n2017/KER/49768\nIN THE HIGH COURT OF KERALA AT ERNAKULAM\nPRESENT:\nTHE HONOURABLE MR. JUSTICE B.KEMAL PASHA\nFRIDAY, THE 8TH DAY OF DECEMBER 2017/17TH AGRAHAYANA, 1939\nCrl.MC.No. 7086 of 2017 ()\nNMC.NO. 154/2017 of SUB DIVISIONAL MAGISTRATE COURT, KASARAGOD .\nCRIME NO. 140/2017 OF BADIADKA POLICE STATION , KASARAGOD.\nPETITIONER(S)/1ST AND 2ND COUNTER PETITIONERS:\n1. VINOD CRASTA,\nS/O.KALASTIN CRASTA, AGED 32 YEARS,\nNEAR BELA CHURCH, BELA, KASARAGOD.\n2. NAVEEN D'SOUZA,\nS/O.PAUL D'SOUZA, AGED 25 YEARS,\nMADATHADAKA, NEERCHAL, KASARAGOD.\nBY ADVS.SRI.T.G.RAJENDRAN\nSRI.T.R.TARIN\nSMT.ANN SUSAN GEORGE\nRESPONDENT(S)/COMPLAINANT AND STATE:\n1. THE SUB INSPECTOR OF POLICE,\nBADIADKA POLICE STATION,\nKASARAGOD-671121.\n2. THE STATE OF KERALA,\nREPRESENTED BY THE PUBLIC PROSECUTOR,\nHIGH COURT OF KERALA, ERNAKULAM-682031.\nBY PUBLIC PROSECUTOR SRI.C.S.HRITHWIK\nTHIS CRIMINAL MISC. CASE HAVING COME UP FOR ADMISSION\nON 08-12-2017, THE COURT ON THE SAME DAY PASSED THE\nFOLLOWING:\nTS\n\noben\neee\nEl fs\" Se\n2017/KER/49768\nCri.MC.No. 7086 of 2017 ()\nAPPENDIX\nPETITIONER(S)' ANNEXURES\nANNEXURE! THE TRUE COPY OF THE ORDER DATED 22.8.2017 OF THE SUB\nDIVISIONAL MAGISTRATE, KASARAGOD.\nANNEXURE II THE TRUE COPY OF THE FIRST INFORMATION REPORT\nALLEGEDLY REGISTERED AS CRIME 405/2017.\nANNEXURE IIl COPY OF THE REPORT FILED BY THE SUB INSPECTOR OF\nPOLICE DATED 27.7.17.\nANNEXURE IV. THE TRUE COPY OF THE FIRST INFORMATION REPORT\nIN CRIME 140/2017 OF BADIADKA POLICE STATION.\nANNEXURE V THE TRUE COPY OF THE FINAL REPORT FILED BY THE POLICE\nBEFORE THE JUDICIAL FIRST CLASS MAGISTRATE COURT-II,\nKASARAGOD, IN C.C.NO.944/17 IN RESPECT OF CRIME 140/2017.\nANNEXURE VI. THE TRUE COPY OF THE FIRST INFORMATION REPORT\nIN CRIME 326/17.\nANNEXURE Vil THE TRUE COPY OF THE ORDER IN BA 4930/2017.\nRESPONDENT(S)' ANNEXURES- NIL\n[TRUE COPY/\nPS TO JUDGE\nTS\n\n2017/KER/49768\nB. KEMAL PASHA, J.\nDated this the 8\" day of December, 2017\nORDER\nOn the basis of Annexure-lll report filed by the\nSub Inspector of Police, Badiadka Police Station,\nproceedings under Section 107 Cr.P.C. have been initiated\nagainst the petitioners. The report shows that the petitioners\nare two among the accused in two crimes. One crime is\nCrime No.140/2017 of Badiadka Police Station for the\noffences under Sections 143, 147, 341, 323 and 506(i) read\nwith Section 149 IPC and the other crime is Crime\nNo.326/2017 of Badiadka Police Station for the offences\nunder Sections 341 and 323 read with Section 34 IPC.\nApart from these two crimes, no other crimes have been\nregistered against the petitioners.\n2. Based on the aforesaid aspects alone, the\n\nBeal\naa\n2017/KER/49768\nCrl.M.C.7086/2017\n:2:\npetitioners cannot be trapped in proceedings under Section\n107 Cr.P.C. Matters being so, Annexure-l order is liable to\nbe quashed.\nIn the result, this Cri.M.C. is allowed and Annexure-]\norder is quashed.\nSd/-\n(B.KEMAL PASHA, JUDGE)\naks/08/12\n// True Copy //\nPS to Judge\n\n"
}