{
    "case_id": "",
    "court": "HIGH COURT OF KERALA AT ERNAKULAM\nPRESENT",
    "date": "11TH DAY OF JANUARY 2017",
    "judge": "SUNIL THOMAS\nWEDNESDAY",
    "petitioners": [
        "ACCUSED NO.4:",
        "RAJESH M.K",
        "37 YEARS, S/O.KANNAN,",
        "MOOLAKKAL KUNHI VEEDU,",
        "CHUZHALI (PO), CHUZHALI AMSOM DESOM,",
        "TALIPARAMBA TALUK, KANNUR (DIST)"
    ],
    "respondents": [
        "1. THE STATE OF KERALA",
        "REPRESENTED BY THE PUBLIC PROSECUTOR,",
        "HIGH COURT OF KERALA, ERNAKULAM 31",
        "2. THE SUB INSPECTOR OF POLICE",
        "SREEKANDAPURAM POLICE STATION,",
        "KANNUR, PIN 670301"
    ],
    "sections": [],
    "outcome": "",
    "full_text": ". Eaten a\nre aera\nStay\n2017/KER/I509\nIN THE HIGH COURT OF KERALA AT ERNAKULAM\nPRESENT:\nTHE HONOURABLE MR. JUSTICE SUNIL THOMAS\nWEDNESDAY, THE 11TH DAY OF JANUARY 2017/21ST POUSHA, 1938\nCri.MC.No. 5307 of 2016 ()\nAGAINST THE ORDER/JUDGMENT IN CRMC 560/2016 & SESSIONS COURT,\nTHALASSERY\nCRIME NO. 385/2012 OF SREEKANDAPURAM POLICE STATION, KANNUR\nPETITIONER(S)/ACCUSED NO.4:\nRAJESH M.K\n37 YEARS, S/O.KANNAN,\nMOOLAKKAL KUNHI VEEDU,\nCHUZHALI (PO), CHUZHALI AMSOM DESOM,\nTALIPARAMBA TALUK, KANNUR (DIST)\nBY ADV. SMT.K.DEEPA (PAYYANUR)\nRESPONDENT(S):\n1. THE STATE OF KERALA\nREPRESENTED BY THE PUBLIC PROSECUTOR,\nHIGH COURT OF KERALA, ERNAKULAM 31\n2. THE SUB INSPECTOR OF POLICE\nSREEKANDAPURAM POLICE STATION,\nKANNUR, PIN 670301\nBY SRIAMJAD ALI, PUBLIC PROSECUTOR\nTHIS CRIMINAL MISC. CASE HAVING COME UP FOR ADMISSION ON\n11-01-2017, THE COURT ON THE SAME DAY PASSED THE FOLLOWING:\nR.AV\n\naa\n2017/KER/1509\nSUNIL THOMAS, J.\n~ Crl.M.C.No.5307 of 2016\nDated this the 11\" day of January, 2017\nORDER\nWhen the matter was taken up, the learned counsel\nfor the petitioner submitted that after investigation final\nreport was laid. Hence the learned counsel proposes to\nfile a comprehensive Crl.M.C challenging the final report\nalso. Reserving that liberty Crl.M.C is dismissed as not\npressed.\nSd/-\nSUNIL THOMAS, JUDGE\nR.AV\nITTRUE COPYI/\nPATOJUDGE\n\n"
}