{
    "case_id": "",
    "court": "HIGH COURT OF KERALA AT ERNAKULAM",
    "date": "4TH DAY OF JANUARY 2021",
    "judge": "SHIRCY V.\nMONDAY",
    "petitioners": [
        "ACCUSED:",
        "VANAJA A.K.",
        "AGED 46 YEARS",
        "W/O. LATE VENUGOPALAN, VADAKKEMAKKOLATHU HOUSE,",
        "PAINGOTTUPURAM, KUNNAMANGALAM (PO), KOZHIKODE-673571."
    ],
    "respondents": [
        "S/STATE & DEFACTO COMPLAINANT:",
        "1 STATE OF KERALA",
        "REPRESENTED BY PUBLIC PROSECUTOR, HIGH COURT OF",
        "KERALA, ERNAKULAM, PIN-682031.",
        "2 ASOKAN NAIR V.,",
        "AGED 59 YEARS",
        "S/O.RAMAN NAIR, VADAKKANGOLATH (HOUSE) ,",
        "PAINGOTTUPURAM, KUNNAMANGALAM (PO), KOZHIKODE-673571.",
        "C.N.PRABHAKARAN -P.P"
    ],
    "sections": [],
    "outcome": "",
    "full_text": "Eee\n‘ ra\nis\nBlase\nIN THE HIGH COURT OF KERALA AT ERNAKULAM 2021UKER/4\nPRESENT\nTHE HONOURABLE MRS. JUSTICE SHIRCY V.\nMONDAY, THE O4TH DAY OF JANUARY 2021 / 14TH POUSHA, 1942\nCrl1.MC.No.795 OF 2020 (H)\nCRIME NO.981/2019 OF Medical College Police Station, Kozhikode\nPETITIONER/ACCUSED:\nVANAJA A.K.\nAGED 46 YEARS\nW/O. LATE VENUGOPALAN, VADAKKEMAKKOLATHU HOUSE,\nPAINGOTTUPURAM, KUNNAMANGALAM (PO), KOZHIKODE-673571.\nBY ADVS.\nSRI .M.VIVEK RABINDRANATH\nSRI .V.T .MADHAVANUNNIT\nRESPONDENTS/STATE & DEFACTO COMPLAINANT:\n1 STATE OF KERALA\nREPRESENTED BY PUBLIC PROSECUTOR, HIGH COURT OF\nKERALA, ERNAKULAM, PIN-682031.\n2 ASOKAN NAIR V.,\nAGED 59 YEARS\nS/O.RAMAN NAIR, VADAKKANGOLATH (HOUSE) ,\nPAINGOTTUPURAM, KUNNAMANGALAM (PO), KOZHIKODE-673571.\nC.N.PRABHAKARAN -P.P\nTHIS CRIMINAL MISC. CASE HAVING COME UP FOR ADMISSION ON\n04.01.2021, THE COURT ON THE SAME DAY PASSED THE FOLLOWING:\n\nree\nit\nlea\n\n2021/KER/4\n\nCrl.M.C.No.795 OF 2020\n2\nORDER\nDated this the 4th day of January 2021\n\nThe learned counsel for the petitioner seeks permission to\nwithdraw this petition.\n\nPermission granted. Hence, this petition is dismissed as\nwithdrawn with liberty to challenge the final report, if so\nadvised.\n\nSd/-\nSHIRCY V.\nJUDGE\nmom\n\n| pa\n‘ ra\nis\nPlaseaS\n2021/KER/4\nCr1l.M.C.No.795 OF 2020\n3\nAPPENDIX\nPETITIONER'S EXHIBITS:\nANNEXURE Al A TRUE COPY OF THE COMPLAINT OF THE\nDEFACTO COMPLATNANT DATED 25.12.2019\nFILED IN MEDICAL COLLEGE POLICHK STATION\nKOZHIKODE CITY.\nANNEXURE A2 A TRUE COPY OF THE F.I.R. IN CRIME\nNO.981/2019 OF THE MEDICAL COLLEGE POLICE\nSTATION, KOZHIKODE CITY.\nANNEXURE A3 THE PHOTOGRAPHS OF THE PROPERTY INVOLVED\nIN THE DISPUTE.\n// TRUE COPY //\nP.A. TO JUDGE\n\n"
}