{
    "case_id": "",
    "court": "HIGH COURT OF KERALA AT ERNAKULAM\nPRESENT",
    "date": "4TH DAY OF JANUARY 2018",
    "judge": "B.KEMAL PASHA\nTHURSDAY",
    "petitioners": [
        "(S) /1ST ACCUSED",
        "SWISH SUKUMARAN",
        "s/o. SUKUMARAN, SWATHI, THAMBURAN MUKKU, VANCHTYOOR",
        "VILLAGE, THIRUVANANTHAPURAM."
    ],
    "respondents": [
        "(S)/STATE & COMPLAINANT:",
        "1. STATE OF KERALA,",
        "REPRESENTED BY ITS PUBLIC PROSECUTOR,",
        "HIGH COURT OF KERALA,",
        "ERNAKULAM-682 301",
        "2. ‘THE SUB INSPECTOR OF POLICE,",
        "FORT POLICE STATION, THIRUVANANTHAPURAM DISTRICT-695 001"
    ],
    "sections": [],
    "outcome": "",
    "full_text": "Obese 2\n“ 7.\nElz ett wee\n2018/KER/275\nIN THE HIGH COURT OF KERALA AT ERNAKULAM\nPRESENT:\nTHE HONOURABLE MR. JUSTICE B.KEMAL PASHA\nTHURSDAY, THE 4TH DAY OF JANUARY 2018 / 14TH POUSHA, 1939\nCr1.MC.No. 8858 of 2017\nCRL.MC. NO. 2190/2017 OF SESSIONS COURT, THIRUVANANTHAPURAM\nCRIME NO. 2194/2017 OF FORT POLICE STATION , THIRUVANANTHAPURAM\nPETITIONER (S) /1ST ACCUSED\nSWISH SUKUMARAN\ns/o. SUKUMARAN, SWATHI, THAMBURAN MUKKU, VANCHTYOOR\nVILLAGE, THIRUVANANTHAPURAM.\nBY ADVS.SRI.D.KISHORE\nSMT .MINI GOPINATH\nSMT .MEERA GOPINATH\nSRI.R.MURALEEKRISHNAN (MALAKKARA)\nRESPONDENT (S)/STATE & COMPLAINANT:\n1. STATE OF KERALA,\nREPRESENTED BY ITS PUBLIC PROSECUTOR,\nHIGH COURT OF KERALA,\nERNAKULAM-682 301\n2. ‘THE SUB INSPECTOR OF POLICE,\nFORT POLICE STATION, THIRUVANANTHAPURAM DISTRICT-695 001\nBY PUBLIC PROSECUTOR SRI. C.S. HRITHWICK.\nTHIS CRIMINAL MISC. CASE HAVING COME UP FOR ADMISSION ON 04-01-2018,\nTHE COURT ON THE SAME DAY PASSED THE FOLLOWING:\nPBS\n\nEsa\n“ 7.\naoe\n2018/KER/275\nCr1.MC.No. 8858 of 2017 ()\nAPPENDIX\n\nPETITIONER(S) ' ANNEXURES\nANNEXURE I THE COPY OF THE ORDER DATED 25.10.2017 IN CRL.M.C\n\n2190/2017 OF SESSIONS COURT,\n\nTHIRUVANANTHAPURAM .\nANNEXURE I (A) A TYPED COPY OF ANNEXURE -I\nANNEXURE IT TRUE COPY OF THE CMP NO.2351/2017 IN CRL.M.C\n\nNO.2190/2017.\nANNEXURE III TRUE COPY OF THE ORDER DATED 12.12.2017 IN CRLM.P\n\nNO.2351/2017 IN CRL.M.C NO.2190/2017 OF SESSIONS\n\nCOURT, THIRUVANANTHAPURAM.\nRESPONDENT'S ANNEXURE NIL\n\n/TRUE COPY/\nPA TO JUDGE\n\nPBS\n\nie ree\napa\n2018/KER/275\nB. KEMAL PASHA, J.\nCril.M.C. No.8858 of 2017\nDated this the 4\" day of January, 2018\nORDER\nHeard.\nCondition No.(4) in Annexure-! order is lifted.\nCrl.M.C. is disposed of as above.\nSd/-\n(B.KEMAL PASHA, JUDGE)\naks/04/01\n4 True Copy //\nPS to Judge\n\n"
}