{
    "case_id": "",
    "court": "HIGH COURT OF KERALA AT ERNAKULAM\nPRESENT\nTHE HONOURABLE MRS",
    "date": "41 DAY OF JANUARY 2024",
    "judge": "SOPHY THOMAS\nWEDNESDAY",
    "petitioners": [
        "ACCUSED:",
        "BASITH",
        "AGED 27 YEARS",
        "S/0 ABU, UC HOUSE , KODUVALLI, KOZHIKKODE CITY, PIN -",
        "673572"
    ],
    "respondents": [
        "S/COMPLAINANT/STATE:",
        "1 MEGHA",
        "AGED 27 YEARS",
        "D/O ANILKUMAR, PAVITHRAM, KARALINK ROAD, KARAPARAMBA,",
        "KOZHIKKODE CITY, KERALA-, PIN - 673586",
        "2 THE STATION HOUSE OFFICER",
        "NADAKKAVU POLICE STATION KOZHIKKODE-, PIN - 682031",
        "3 THE STATE OF KERALA",
        "REP. BY THE PUBLIC PROSECUTOR, HIGH COURT OF KERALA,",
        "ERNAKULAM, PIN - 682023",
        "OTHER PRESENT:",
        "PP-SRI.PRASANTH M.P."
    ],
    "sections": [
        "482 of Cr"
    ],
    "outcome": "ORDER/JUDGMENT CC 372/2023 OF JUDICIAL MAGISTRATE OF\nFIRST CLASS -IV, KOZHIKODE\nPETITIONER/ACCUSED:\nBASITH\nAGED 27 YEARS\nS/0 ABU, UC HOUSE , KODUVALLI, KOZHIKKODE CITY, PIN -\n673572\nBY ADV SUNNY MATHEW\nRESPONDENTS/COMPLAINANT/STATE:\n1 MEGHA\nAGED 27 YEARS\nD/O ANILKUMAR, PAVITHRAM, KARALINK ROAD, KARAPARAMBA,\nKOZHIKKODE CITY, KERALA-, PIN - 673586\n2 THE STATION HOUSE OFFICER\nNADAKKAVU POLICE STATION KOZHIKKODE-, PIN - 682031\n3 THE STATE OF KERALA\nREP. BY THE PUBLIC PROSECUTOR, HIGH COURT OF KERALA,\nERNAKULAM, PIN - 682023\nOTHER PRESENT:\nPP-SRI.PRASANTH M.P.\nTHIS CRIMINAL MISC. CASE HAVING COME UP FOR ADMISSION ON\n17.01.2024, THE COURT ON THE SAME DAY PASSED THE FOLLOWING:\n\nBIER\n2024/KER/4378\nCRL.MC NO.152 OF 2024 2\nORDER\n\nThis Crl.M.C. under Section 482 of Cr.P.C. is filed by the\naccused in Crime No.9/2023 of Nadakkavu Police Station,\nKozhikode, registered under Sections 354D(1){i), 354D(1)(ii) and\n506 of IPC, for quashing Annexure-Al_ final report’ in\nC.C.No.372/2023, on the file of Judicial First Class Magistrate\nCourt-lV, Kozhikode.\n\n2. The prosecution allegation is that, despite the protest of\nthe defacto complainant, the accused followed her through mobile\nphone and Whatsapp from the month of November 2022, and he\nsent her photos taken together with the accused to her parents\nand on 03.01.2023, he created an Instagram account in her name\nand posted her photos with him, and also threatened her by\nsending messages.\n\n3. When the matter is taken up for consideration, learned\ncounsel for the petitioner would submit that the matter stands\nsettled, and he produced Annexure-A2 affidavit of the 1*\nrespondent, endorsing the factum of settlement, and stating that,\nshe has no intention to continue with the prosecution. She has no\nobjection in quashing the proceedings in C.C.No.372/2023\npending against the petitioner before Judicial First Class\n\nBIER\n2024/KER/4378\nCRL.MC NO.152 OF 2024 3\nMagistrate Court-IV, Kozhikode.\n\n4. Learned Public Prosecutor on instructions submitted that\nthe matter has been settled, and he produced the signed\nstatement of the 1* respondent, stating that as the matter is\nsettled, she has no objection in quashing the proceedings in\nC.C.No.372/2023.\n\n5. Since the matter stands settled, no purpose would be\nserved by continuing the prosecution against the petitioner.\n\n6. In the light of the principles laid down by the Apex Court\nin Gian Singh v. State of Punjab and Another; [(2012) 10\nSCC 303)], and State of Madhya Pradesh v. Laxmi Narayan\nand Others; [(2019) 5 SCC 688], this Court is of the view that the\nproceedings against the petitioner can be quashed",
    "full_text": "o] ms he 4\n2024/KER/4378\nIN THE HIGH COURT OF KERALA AT ERNAKULAM\nPRESENT\nTHE HONOURABLE MRS. JUSTICE SOPHY THOMAS\nWEDNESDAY, THE 17°41 DAY OF JANUARY 2024 / 27TH POUSHA, 1945\nCRL.MC NO. 152 OF 2024\nCRIME NO.9/2023 OF Nadakkavu Police Station, Kozhikode\nAGAINST THE ORDER/JUDGMENT CC 372/2023 OF JUDICIAL MAGISTRATE OF\nFIRST CLASS -IV, KOZHIKODE\nPETITIONER/ACCUSED:\nBASITH\nAGED 27 YEARS\nS/0 ABU, UC HOUSE , KODUVALLI, KOZHIKKODE CITY, PIN -\n673572\nBY ADV SUNNY MATHEW\nRESPONDENTS/COMPLAINANT/STATE:\n1 MEGHA\nAGED 27 YEARS\nD/O ANILKUMAR, PAVITHRAM, KARALINK ROAD, KARAPARAMBA,\nKOZHIKKODE CITY, KERALA-, PIN - 673586\n2 THE STATION HOUSE OFFICER\nNADAKKAVU POLICE STATION KOZHIKKODE-, PIN - 682031\n3 THE STATE OF KERALA\nREP. BY THE PUBLIC PROSECUTOR, HIGH COURT OF KERALA,\nERNAKULAM, PIN - 682023\nOTHER PRESENT:\nPP-SRI.PRASANTH M.P.\nTHIS CRIMINAL MISC. CASE HAVING COME UP FOR ADMISSION ON\n17.01.2024, THE COURT ON THE SAME DAY PASSED THE FOLLOWING:\n\nBIER\n2024/KER/4378\nCRL.MC NO.152 OF 2024 2\nORDER\n\nThis Crl.M.C. under Section 482 of Cr.P.C. is filed by the\naccused in Crime No.9/2023 of Nadakkavu Police Station,\nKozhikode, registered under Sections 354D(1){i), 354D(1)(ii) and\n506 of IPC, for quashing Annexure-Al_ final report’ in\nC.C.No.372/2023, on the file of Judicial First Class Magistrate\nCourt-lV, Kozhikode.\n\n2. The prosecution allegation is that, despite the protest of\nthe defacto complainant, the accused followed her through mobile\nphone and Whatsapp from the month of November 2022, and he\nsent her photos taken together with the accused to her parents\nand on 03.01.2023, he created an Instagram account in her name\nand posted her photos with him, and also threatened her by\nsending messages.\n\n3. When the matter is taken up for consideration, learned\ncounsel for the petitioner would submit that the matter stands\nsettled, and he produced Annexure-A2 affidavit of the 1*\nrespondent, endorsing the factum of settlement, and stating that,\nshe has no intention to continue with the prosecution. She has no\nobjection in quashing the proceedings in C.C.No.372/2023\npending against the petitioner before Judicial First Class\n\nBIER\n2024/KER/4378\nCRL.MC NO.152 OF 2024 3\nMagistrate Court-IV, Kozhikode.\n\n4. Learned Public Prosecutor on instructions submitted that\nthe matter has been settled, and he produced the signed\nstatement of the 1* respondent, stating that as the matter is\nsettled, she has no objection in quashing the proceedings in\nC.C.No.372/2023.\n\n5. Since the matter stands settled, no purpose would be\nserved by continuing the prosecution against the petitioner.\n\n6. In the light of the principles laid down by the Apex Court\nin Gian Singh v. State of Punjab and Another; [(2012) 10\nSCC 303)], and State of Madhya Pradesh v. Laxmi Narayan\nand Others; [(2019) 5 SCC 688], this Court is of the view that the\nproceedings against the petitioner can be quashed on the basis of\nsettlement. Moreover, the dispute is purely personal in nature,\nand no public interest is involved in it.\n\nIn the result, this Crl.M.C. is allowed and Annexure-A1 final\nreport in C.C.No.372/2023 on the file of Judicial First Class\nMagistrate Court-lV, Kozhikode, stands quashed.\n\nSd/-\nSOPHY THOMAS\nJUDGE\nska\n\nak eas\n2024/KER/4378\nCRL.MC NO.152 OF 2024 4\nAPPENDIX OF CRL.MC 152/2024\n\nPETITIONER ANNEXURES\nAnnexure-A 1 CERTIFIED COPY OF THE FINAL REPORT IN IN\n\nC.C.372/2023 ON THE FILE OF THE JUDICIAL\n\nFIRST CLASS MAGISTRATE COURT-IV, KOZHIKKODE\nAnnexure A2 TRUE COPY OF THE AFFIDAVIT SWORN TO BY THE\n\n1ST RESPONDENT DATED 18.12.2023\n\n"
}