{
    "case_id": "Crl.MC.No. 142 of 2019",
    "court": "HIGH COURT OF KERALA AT ERNAKULAM",
    "date": "8TH DAY OF JANUARY 2019",
    "judge": "B.SUDHEENDRA KUMAR\nTUESDAY",
    "petitioners": [
        "S/ACCUSED:",
        "VIJO P JOHNSON",
        "AGED 36 YEARS",
        "S/O. JOHNSON, PALAYOOR HOUSE, NEW DOOR NO. 5/71,",
        "KAIPPARAMBU GRAMA PANCHAYATH, MUNDOOR POST, THRISSUR",
        "680 541, THRISSUR DISTRICT."
    ],
    "respondents": [
        "S/STATE:",
        "STATE OF KERALA",
        "REP. BY PUBLIC PROSECUTOR, HIGH COURT OF KERALA,",
        "ERNARKULAM."
    ],
    "sections": [],
    "outcome": "",
    "full_text": "Bee hl\nnie nav\nBeat:\nIN THE HIGH COURT OF KERALA AT ERNAKULAM 2019/KERI770\nPRESENT\nTHE HONOURABLE MR. JUSTICE B.SUDHEENDRA KUMAR\nTUESDAY ,THE O8TH DAY OF JANUARY 2019 / 18TH POUSHA, 1940\nCrl.MC.No. 142 of 2019\nAGAINST THE ORDER/JUDGMENT IN CC 217/2016 of J.M.F.C.-I\nMUVATUPUZHA\nPETITIONER/S/ACCUSED:\nVIJO P JOHNSON\nAGED 36 YEARS\nS/O. JOHNSON, PALAYOOR HOUSE, NEW DOOR NO. 5/71,\nKAIPPARAMBU GRAMA PANCHAYATH, MUNDOOR POST, THRISSUR\n680 541, THRISSUR DISTRICT.\nBY ADV. SRI.E.A.BIJUMON\nRESPONDENT/S/STATE:\nSTATE OF KERALA\nREP. BY PUBLIC PROSECUTOR, HIGH COURT OF KERALA,\nERNARKULAM.\nBY PUBLIC PROSECUTOR, SRI E C BINEESH\nTHIS CRIMINAL MISC. CASE HAVING COME UP FOR ADMISSION ON\n08.01.2019, THE COURT ON THE SAME DAY PASSED THE FOLLOWING:\n\nPe\nsee\n2019/KER/770\nCr1.MC.No. 142 of 2019\n2\nORDER\n\nHeard.\n\nIn view of the limited nature of the prayer, it is\ndirected that if the petitioner surrenders before the\ncourt below within twenty days in C.C. No.217 of 2016\nand applies for regular bail, the court below shall\nconsider and dispose of the application for bail, in\naccordance with law, on the date of surrender itself.\nThe warrant, if any, shall be kept in abeyance for\ntwenty days.\n\nThis Crl.M.C. stands disposed of as above.\n\nsd/-\nB.SUDHEENDRA KUMAR\nJUDGE\nRK/08.01.2019\nHTRUE COPY/!\nPA TO JUDGE\n\n"
}