{
    "case_id": "",
    "court": "HIGH COURT OF KERALA AT ERNAKULAM",
    "date": "07TH DAY OF JANUARY 2021",
    "judge": "V.G.ARUN\nTHURSDAY",
    "petitioners": [
        "S:",
        "JOHNKUTTY M. V.",
        "AGED 55 YEARS",
        "S/O. VARGHESE, TC 25/4243 (1), VIKAS BHAVAN P. O.,",
        "THIRUVANANTHAPURAM, KERALA."
    ],
    "respondents": [
        "S:",
        "STATE OF KERALA",
        "REPRESENTED BY PUBLIC PROSECUTOR, HIGH COURT OF",
        "KERALA, PIN - 682 031.",
        "OTHER PRESENT:",
        "SR.PP.SRI.SUMAN CHAKRAVARTHY"
    ],
    "sections": [],
    "outcome": "",
    "full_text": "peti\nPe\nBeart\nIN THE HIGH COURT OF KERALA AT ERNAKULAM 2021/KER/922\nPRESENT\nTHE HONOURABLE MR.JUSTICE V.G.ARUN\nTHURSDAY, THE 07TH DAY OF JANUARY 2021 / 17TH POUSHA, 1942\nCr1.MC.No.103 OF 2021 (C)\n\nAGAINST THE ORDER/JUDGMENT IN CRRP 65/2019 OF ADDITIONAL\nDISTRICT COURT & SESSIONS COURT - V, THIRUVANANTHAPURAM\nAGAINST THE ORDER/JUDGMENT IN CMP 2680/2019 OF CHIEF JUDICIAL\nMAGISTRATE ,TRIVANDRUM/SPECIAL COURT FOR TRIAL OF CYBER CRIME\nCRIME NO.1133/2011 OF Museum Police Station , Thiruvananthapuram\n\nPETITIONER/S:\nJOHNKUTTY M. V.\nAGED 55 YEARS\nS/O. VARGHESE, TC 25/4243 (1), VIKAS BHAVAN P. O.,\nTHIRUVANANTHAPURAM, KERALA.\nBY ADV. SRI.C.S.SUMESH\nRESPONDENT/S:\nSTATE OF KERALA\nREPRESENTED BY PUBLIC PROSECUTOR, HIGH COURT OF\nKERALA, PIN - 682 031.\nOTHER PRESENT:\nSR.PP.SRI.SUMAN CHAKRAVARTHY\nTHIS CRIMINAL MISC. CASE HAVING COME UP FOR ADMISSION ON\n07.01.2021, THE COURT ON THE SAME DAY PASSED THE FOLLOWING:\n\nBaer\n2021/KER/922\nV.G.ARUN, J.\nDated this the 7 day of January, 2021\nORDER\nLearned counsel for the petitioner seeks permission to withdraw\nthe Crl.M.C with liberty to move a fresh case. Permission is granted\nand the Crl.M.C is dismissed as withdrawn with the liberty sought.\nSd/-\nV.G.ARUN, JUDGE\nvgs\n\nfe at\non\nBe\nBaar\n2021/KER/922\nAPPENDIX\nPETITIONER'S/S EXHIBITS:\nANNEXURE Al THE PHOTOCOPY OF THE RECEIPT DATED\n28.11.2011 ISSUED FORM THE MUSEUM POLICE\nSTATION, THIRUVANANTHAPURAM RECEIVING\nPETITION.\nANNEXURE A2 THE PHOTOCOPY OF THE FIR NO.1133/2011 OF\nMUSEUM POLICE STATION, THIRUVANANTHAPURAM\nDATED 28.11.2011.\nANNEXURE A3 THE PHOTOCOPY OF FINAL REPORT IN FIR\nNO.1133/2011 OF MUSEUM POLICE STATION,\nDATED 26.01.2012.\nANNEXURE A4 THE PHOTOCOPY OF ORDER DATED 13.12.2016 OF\nTHE JFCM COURT - III, THIRUVANANTHAPURAM.\nANNEXURE A5 PHOTOCOPY OF COMMUNICATION DATED 09.01.2017\nISSUED BY THE JFCM COURT - III,\nTHIRUVANANTHAPURAM TO THE CHIEF JUDICIAL\nMAGISTRATE COURT, THIRUVANANTHAPURAM.\nANNEXURE A6 THE PHOTOCOPY OF THE ORDER SHEET IN CC\nNO.191/2012 ON THE FILE OF JFCM - III,\nTHIRUVANANTHAPURAM .\nANNEXURE A7 THE PHOTOCOPY OF THE ORDER DATED 15.03.2019\nIN CRL. M.C.NO.838/19 OF THIS HON'BLE\nCOURT.\nANNEXURE A8 PHOTOCOPY OF THE ORDER DATED 10.05.2019 IN\nSPECIAL LEAVE PETITION (CRIMINAL)\nNO. 4344/2019.\nANNEXURE AQ THE PHOTOCOPY OF THE ORDER DATED 21.08.2019\nIN REVIEW PETITION (CRL) NO.417/2019.\nANNEXURE A10 THE PHOTOCOPY OF THE CMP NO.2680/2019,\nFILED ON 03.09.2019 IN CC 223/2017 ON THE\nFILE OF THE COURT OF CHIEF JUDICIAL\nMAGISTRATE, THIRUVANANTHAPURAM.\nANNEXURE Ail THE PHOTOCOPY OF THE ORDER IN THE COPY\nAPPLICATION ORDER DATED 27.09.2019 IN\nA.1375/2019.\nANNEXURE A12 THE PHOTOCOPY OF THE ORDER DATED 28.09.2019\nIN CMP NO.2680/2019 IN CC NO.223/2017 ON\nTHE FILE OF THE COURT OF CHIEF JUDICIAL\n\nfe at\nal\nBe\nBaar\nMAGISTRATE, THIRUVANANTHAPURAM. 2021/KER/922\nANNEXURE A13 PHOTOCOPY OF ORDER DATED 18.01.2020 IN\nCRL.R.P.NO.65 OF 2019 PASSED BY ADDL.\nSESSIONS JUDGE - V, THIRUVANANTHAPURAM.\nANNEXURE A14 THE COPY OF THE ORDER DATED 24.02.2020 BY\nLD. REGISTRAR IN CRIMINAL MAD.NO. 4534/2020.\nANNEXURE A15 THE COPY OF THE ORDER DATED 20.11.2020 BY\nHON.APEX COURT IN CRIMINAL MA.NO.2072/2020.\nANNEXURE 16 THE PHOTOCOPY OF THE FINAL ORDER IN\nCRIMINAL MA.NO.2072/2020 DATED 07.12.2020.\nANNEXURE A17 ORDER NO.C.309/2017 ISSUED BY THE HON'BLE\nCJM, THIRUVANANTHAPURAM DATED 17.01.2017.\n\n"
}