{
    "case_id": "Crl.MC.No.85 OF 2020",
    "court": "HIGH COURT OF KERALA AT ERNAKULAM\nPRESENT\nTHE HONOURABLE MR",
    "date": "8TH DAY OF JANUARY 2020",
    "judge": "P.B.SURESH KUMAR\nWEDNESDAY",
    "petitioners": [
        "S/ACCUSED NO. 1 TO 4:",
        "1 BAIJU.E,",
        "AGED 32 YEARS, S/O VISWANATHAN “EDOLI”,",
        "POYILTHAZHAM, NALLALAM, KOZHIKODE-673 027.",
        "2 VISWANATHAN,",
        "AGED 61 YEARS, S/O RAVUNNI KURUPATH, “EDOLI”,",
        "POYILTHAZHAM, NALLALAM, KOZHIKODE-673 027.",
        "3 DEVAKI,",
        "AGED 56 YEARS, W/O VISWANATHAN, “EDOLI”,",
        "POYILTHAZHAM, NALLALAM, KOZHIKODE-673 027.",
        "4 PRIYA,",
        "AGED 30 YEARS, W/O BIJEESH, “EDOLI”,",
        "POYILTHAZHAM, NALLALAM, KOZHIKODE-673 027."
    ],
    "respondents": [
        "S/DE-FACTO COMPLAINANT & STATE:",
        "1 ASWATHI.T.P,",
        "AGED 25 YEARS, D/O SIVADASAN, THAZHEPALLATH,",
        "THAYYILTHAZHAM, PERUMANNA, NALLALAM, KOZHIKODE-673",
        "027.",
        "2 STATE OF KERALA,",
        "REPRESENTED BY PUBLIC PROSECUTOR,",
        "HIGH COURT OF KERALA, ERNAKULAM-682 031.",
        "R1 BY ADV. R.SUDHISH"
    ],
    "sections": [
        "482 of\nthe Code of Criminal Procedure for quashing Annexure"
    ],
    "outcome": "ORDER IN CC NO.558/2019 OF JUDICIAL MAGISTRATE OF\nFIRST CLASS -V, KOZHIKODE\nCRIME NO.769/2018 OF NALLALAM POLICE STATION, KOZHIKODE\nPETITIONERS/ACCUSED NO. 1 TO 4:\n1 BAIJU.E,\nAGED 32 YEARS, S/O VISWANATHAN “EDOLI”,\nPOYILTHAZHAM, NALLALAM, KOZHIKODE-673 027.\n2 VISWANATHAN,\nAGED 61 YEARS, S/O RAVUNNI KURUPATH, “EDOLI”,\nPOYILTHAZHAM, NALLALAM, KOZHIKODE-673 027.\n3 DEVAKI,\nAGED 56 YEARS, W/O VISWANATHAN, “EDOLI”,\nPOYILTHAZHAM, NALLALAM, KOZHIKODE-673 027.\n4 PRIYA,\nAGED 30 YEARS, W/O BIJEESH, “EDOLI”,\nPOYILTHAZHAM, NALLALAM, KOZHIKODE-673 027.\nBY ADV. SRI.P.B.SAJITH\nRESPONDENTS/DE-FACTO COMPLAINANT & STATE:\n1 ASWATHI.T.P,\nAGED 25 YEARS, D/O SIVADASAN, THAZHEPALLATH,\nTHAYYILTHAZHAM, PERUMANNA, NALLALAM, KOZHIKODE-673\n027.\n2 STATE OF KERALA,\nREPRESENTED BY PUBLIC PROSECUTOR,\nHIGH COURT OF KERALA, ERNAKULAM-682 031.\nR1 BY ADV. R.SUDHISH\nSRI. T.R. RENJITH PP\nTHIS CRIMINAL MISC. CASE HAVING COME UP FOR ADMISSION ON\n08.01.2020, THE COURT ON THE SAME DAY PASSED THE FOLLOWING:\n\nCheers\nae eis,\n2020/KER/672\nCrl.M.C. No.85 of 2020 2\nCri.M.C.No.85 of 2020\nORDER\n\nThis is a proceedings instituted under Section 482 of\nthe Code of Criminal Procedure for quashing Annexure - A5 final\nreport and all further proceedings pursuant thereto now\npending as C.C.No.558 of 2019 on the files of the Court of the\nJudicial Magistrate of First Class - V, Kozhikode.\n\n2. The petitioners are accused in the said case. The\ncase referred to above is one instituted at the instance of the\nfirst respondent against the petitioners under Sections 406 and\n498A of the Indian Penal Code.\n\n3. It is seen that the first respondent had settled her\ndisputes with the petitioners and an affidavit to that effect has\nbeen produced as Annexure A7.\n\n4. Heard the learned counsel for the petitioners,\nthe learned Public Prosecutor as also the learned counsel for\nthe first respondent.\n\n5. In the light of the decision of the Apex Court in\n\nDeere\n\n2020/KER/672\nCrl.M.C. No.85 of 2020 3\nGian singh v. State of Punjab, (2012) 10 SCC 303, insofar as\nthe offences alleged against the accused in the case are only\noffences punishable under Sections 406 and 498A of the Indian\nPenal Code, | am of the view that this is an appropriate case\nwhere this court has to invoke the jurisdiction under Section\n482 of the Code of Criminal Procedure to quash the proceedings\nagainst the petitioners.\n\nIn the result, the Crl.M.C. is allowed and Annexure-A5\nfinal report and all further proceedings pursuant thereto against\nthe petitioners pending as C.C.No.558 of 2019 on the files of\nthe Court of the Judicial Magistrate of First Class - V, Kozhikode\nare quashed",
    "full_text": "neue\nents\nci} =F a\n2020/KER/672\nIN THE HIGH COURT OF KERALA AT ERNAKULAM\nPRESENT\nTHE HONOURABLE MR. JUSTICE P.B.SURESH KUMAR\nWEDNESDAY, THE O8TH DAY OF JANUARY 2020 / 18TH POUSHA, 1941\nCrl.MC.No.85 OF 2020(A)\nAGAINST THE ORDER IN CC NO.558/2019 OF JUDICIAL MAGISTRATE OF\nFIRST CLASS -V, KOZHIKODE\nCRIME NO.769/2018 OF NALLALAM POLICE STATION, KOZHIKODE\nPETITIONERS/ACCUSED NO. 1 TO 4:\n1 BAIJU.E,\nAGED 32 YEARS, S/O VISWANATHAN “EDOLI”,\nPOYILTHAZHAM, NALLALAM, KOZHIKODE-673 027.\n2 VISWANATHAN,\nAGED 61 YEARS, S/O RAVUNNI KURUPATH, “EDOLI”,\nPOYILTHAZHAM, NALLALAM, KOZHIKODE-673 027.\n3 DEVAKI,\nAGED 56 YEARS, W/O VISWANATHAN, “EDOLI”,\nPOYILTHAZHAM, NALLALAM, KOZHIKODE-673 027.\n4 PRIYA,\nAGED 30 YEARS, W/O BIJEESH, “EDOLI”,\nPOYILTHAZHAM, NALLALAM, KOZHIKODE-673 027.\nBY ADV. SRI.P.B.SAJITH\nRESPONDENTS/DE-FACTO COMPLAINANT & STATE:\n1 ASWATHI.T.P,\nAGED 25 YEARS, D/O SIVADASAN, THAZHEPALLATH,\nTHAYYILTHAZHAM, PERUMANNA, NALLALAM, KOZHIKODE-673\n027.\n2 STATE OF KERALA,\nREPRESENTED BY PUBLIC PROSECUTOR,\nHIGH COURT OF KERALA, ERNAKULAM-682 031.\nR1 BY ADV. R.SUDHISH\nSRI. T.R. RENJITH PP\nTHIS CRIMINAL MISC. CASE HAVING COME UP FOR ADMISSION ON\n08.01.2020, THE COURT ON THE SAME DAY PASSED THE FOLLOWING:\n\nCheers\nae eis,\n2020/KER/672\nCrl.M.C. No.85 of 2020 2\nCri.M.C.No.85 of 2020\nORDER\n\nThis is a proceedings instituted under Section 482 of\nthe Code of Criminal Procedure for quashing Annexure - A5 final\nreport and all further proceedings pursuant thereto now\npending as C.C.No.558 of 2019 on the files of the Court of the\nJudicial Magistrate of First Class - V, Kozhikode.\n\n2. The petitioners are accused in the said case. The\ncase referred to above is one instituted at the instance of the\nfirst respondent against the petitioners under Sections 406 and\n498A of the Indian Penal Code.\n\n3. It is seen that the first respondent had settled her\ndisputes with the petitioners and an affidavit to that effect has\nbeen produced as Annexure A7.\n\n4. Heard the learned counsel for the petitioners,\nthe learned Public Prosecutor as also the learned counsel for\nthe first respondent.\n\n5. In the light of the decision of the Apex Court in\n\nDeere\n\n2020/KER/672\nCrl.M.C. No.85 of 2020 3\nGian singh v. State of Punjab, (2012) 10 SCC 303, insofar as\nthe offences alleged against the accused in the case are only\noffences punishable under Sections 406 and 498A of the Indian\nPenal Code, | am of the view that this is an appropriate case\nwhere this court has to invoke the jurisdiction under Section\n482 of the Code of Criminal Procedure to quash the proceedings\nagainst the petitioners.\n\nIn the result, the Crl.M.C. is allowed and Annexure-A5\nfinal report and all further proceedings pursuant thereto against\nthe petitioners pending as C.C.No.558 of 2019 on the files of\nthe Court of the Judicial Magistrate of First Class - V, Kozhikode\nare quashed.\n\nSd/-\nP.B.SURESH KUMAR, JUDGE.\nYKB\n\nneue\nee en\nape\n2020/KER/672\nCrl.M.C. No.85 of 2020 4\nAPPENDIX\nPETITIONER'S/S EXHIBITS:\nANNEXURE Al CERTIFIED COPY OF FIRST INFORMATION\nREPORT IN CRIME NO 769/2018 OF\nNALLALAM POLICE DATED 27.12.2018\nANNEXURE A2 CERTIFIED COPY OF FIRST INFORMATION\nSTATEMENT IN CRIME NO 769/2018 OF\nNALLALAM POLICE DATED 27.12.2018\nANNEXURE A3 CERTIFIED COPY OF MEMORANDUM OF\nEVIDENCE IN CRIME NO 769/2019 OF\nNALLALAM POLICE STATION\nANNEXURE A4 CERTIFIED COPY OF STATEMENT OF\nWITNESSES UNDER SECTION 162 OF THE\nCODE OF CRIMINAL PROCEDURE IN CRIME NO\n769/2018 OF NALLALAM POLICE STATION\nANNEXURE A5 CERTIFIED COPY OF FINAL REPORT IN\nCRIME NO 769/2018 OF NALLAM POLICE\nSTATION DATED 17.4.2019\nANNEXURE A6 TRUE COPY AGREEMENT EXECUTED BETWEEN\nTHE 1ST PETITIONER AND THE 1ST\nRESPONDENT DATED 29.5.2019\nANNEXURE A7 ORIGINAL OF THE AFFIDAVIT FILED BY THE\n1ST RESPONDENT DATED 18.11.2019\nRESPONDENT'S/S EXHIBITS:\nNIL\n//TRUE COPY//\nPA TO JUDGE\n\n"
}