{
    "case_id": "",
    "court": "HIGH COURT OF KERALA AT ERNAKULAM\nPRESENT",
    "date": "6TH DAY OF JANUARY 2015",
    "judge": "P.UBAID\nTUESDAY",
    "petitioners": [
        "ACCUSED:",
        "MUHAMMED ALI, S/O. ABDULLA, AGED 24 YEARS,",
        "RESIDING AT THARAMANNIL HOUSE,",
        "NSS COLLEGE POST, MANJERI, MALAPPURAM."
    ],
    "respondents": [
        "DE-FACTO COMPLAINANT & STATE:",
        "1. NAZAR.T.K., S/O. KASIM, AGED 44 YEARS,",
        "RESIDING AT THAKIDIYIL HOUSE, MULLAMPARA,",
        "MANJERI, MALAPPURAM.",
        "2. STATE OF KERALA,",
        "REPRESENTED BY PUBLIC PROSECUTOR,",
        "HIGH COURT OF KERALA, ERNAKULAM,",
        "(INSTRUCTION THROUGH THE SUB INSPECTOR OF POLICE,",
        "MANJERI, POLICE STATION, MALAPPURAM DISTRICT.)",
        "R1 BY ADV. SMT.V.CARCHANA",
        "R2 BY PUBLIC PROSECUTOR SMT. P.MAYA"
    ],
    "sections": [
        "323",
        "324"
    ],
    "outcome": "ORDER\n\nThe petitioner herein is the sole accused in C.C.\nNo.1007/2013 of the Judicial First Class Magistrate Court-I,\nManjeri. The crime in this case was registered under Sections\n323,324 & 341 of I.P.C. on the complaint of one Nazar. The\npetitioner now seeks orders quashing the prosecution on the\nground that he and the de facto complainant Nazar have come\nto terms amicably out of Court. The de facto complainant is\nthe first respondent in this proceeding. He has filed affidavit\nto the effect that he has settled the dispute with the accused,\nand he has no grievance or complaint. I find that continuance\nof the prosecution in such a situation will not serve any\npurpose other than wasting the precious time of the Court.\nNobody will support the prosecution, if the case goes to trial.\n\nIn the result, the Crl.M.C is allowed. The prosecution\nagainst the petitioner in C.C. No. 1007/2013 of the Judicial\n\nDear\n\n2015/KER/216\nCrl.M.C. No. 29 of 2014 22:\nFirst Class Magistrate Court-I, Manjeri will stand quashed",
    "full_text": "ae aah\nBos Cte 1\nfig are\nLee aE\n2015/KER/216\nIN THE HIGH COURT OF KERALA AT ERNAKULAM\nPRESENT:\nTHE HONOURABLE MR. JUSTICE P.UBAID\nTUESDAY, THE 6TH DAY OF JANUARY 2015/16TH POUSHA, 19361\nCri.MC.No. 29 of 2015 ()\nCC.NO. 1007/2013 OF JUDICIAL FIRST CLASS MAGISTRATE COURT-I, MANJERI\nCRIME NO. 504/2013 OF MANJERI POLICE STATION , MALAPPURAM DISTRICT\nPETITIONER/ACCUSED:\nMUHAMMED ALI, S/O. ABDULLA, AGED 24 YEARS,\nRESIDING AT THARAMANNIL HOUSE,\nNSS COLLEGE POST, MANJERI, MALAPPURAM.\nBY ADVS.SRI.K.M.JAMALUDHEEN\nSMT.LATHA PRABHAKARAN\nRESPONDENT(S)/DE-FACTO COMPLAINANT & STATE:\n1. NAZAR.T.K., S/O. KASIM, AGED 44 YEARS,\nRESIDING AT THAKIDIYIL HOUSE, MULLAMPARA,\nMANJERI, MALAPPURAM.\n2. STATE OF KERALA,\nREPRESENTED BY PUBLIC PROSECUTOR,\nHIGH COURT OF KERALA, ERNAKULAM,\n(INSTRUCTION THROUGH THE SUB INSPECTOR OF POLICE,\nMANJERI, POLICE STATION, MALAPPURAM DISTRICT.)\nR1 BY ADV. SMT.V.CARCHANA\nR2 BY PUBLIC PROSECUTOR SMT. P.MAYA\nTHIS CRIMINAL MISC. CASE HAVING COME UP FOR ADMISSION\nON 06-01-2015, THE COURT ON THE SAME DAY PASSED THE FOLLOWING:\nsts\n\npee\nHae Cte 1\nfig are\nHosen,\n2015/KER/216\nCri.MC.No. 29 of 2015 ()\nAPPENDIX\nPETITIONER(S)â€™ ANNEXURES:\nANNEX A1- CERTIFIED COPY OF THE FIR AND FIS IN CRIME 5004/2013 OF MANJERI\nPOLICE STATION DT. 19.5.13.\nANNEX A2- CERTIFIED COPY OF THE CHARGE IN CRIME NO. 504/2013 OF\nMANJERI POLICE STAITON.\nANNEX A3 - TRUE COPY OF THE AGREEMENT ENTERED INTO BETWEEN THE\nPETITIONER AND 1ST RESPONDENT.\nRESPONDENT(S)' ANNEXURES: NIL\nITRUE COPY/\nP.S.TO.JUDGE\nsts\n\nBerl\n2015/KER/216\nP.UBAID, J.\n\" CrLLM.C. No. 29 OF 2015 _\nDated this the 6\" day of January, 2015\nORDER\n\nThe petitioner herein is the sole accused in C.C.\nNo.1007/2013 of the Judicial First Class Magistrate Court-I,\nManjeri. The crime in this case was registered under Sections\n323,324 & 341 of I.P.C. on the complaint of one Nazar. The\npetitioner now seeks orders quashing the prosecution on the\nground that he and the de facto complainant Nazar have come\nto terms amicably out of Court. The de facto complainant is\nthe first respondent in this proceeding. He has filed affidavit\nto the effect that he has settled the dispute with the accused,\nand he has no grievance or complaint. I find that continuance\nof the prosecution in such a situation will not serve any\npurpose other than wasting the precious time of the Court.\nNobody will support the prosecution, if the case goes to trial.\n\nIn the result, the Crl.M.C is allowed. The prosecution\nagainst the petitioner in C.C. No. 1007/2013 of the Judicial\n\nDear\n\n2015/KER/216\nCrl.M.C. No. 29 of 2014 22:\nFirst Class Magistrate Court-I, Manjeri will stand quashed under\nSection 482 of the Code of Criminal Procedure. Accordingly, the\npetitioner will stand released from the prosecution and the bail\nbond, if any, executed by him will stand discharged.\n\nSd/-\nP.UBAID, Judge.\n\ndpk /True copy/ PS to Judge.\n\n"
}