{
    "case_id": "Crl.MC.No.3183 OF 2017",
    "court": "HIGH COURT OF KERALA AT ERNAKULAM",
    "date": "8TH DAY OF JANUARY 2021",
    "judge": "P.V.KUNHIKRISHNAN\nFRIDAY",
    "petitioners": [
        "S IN CRL.M.C/ACCUSED IN CRIME NO.2387/16 OF ALUVA POLICE",
        "STATION:",
        "1 MANGESH PATANKAR",
        "S$/O.RATNAKAR MORESHWAR PATANKAR, AGED 38, MANAGING",
        "DIRECTOR, VEOL MEDICAL TECHNOLOGIES PVT. LTD., A 747,",
        "NEAR KRISHNA STEEL, PAWANE MIDC, TTC INDUSTRIAL AREA,",
        "NAVI MUMBAI-400705",
        "2 VEOL MEDICAL TECHNOLOGIES PVT. LTD.",
        "A 747, NEAR KRISHNA STEEL, PAWANE MIDC, TTC",
        "INDUSTRIAL AREA,NAVI MUMBAT-400705, REPRESENTED BY",
        "THE MANAGING DIRECTOR,MANGESH PATANKAR"
    ],
    "respondents": [
        "S IN CRL.M.C./STATE AND COMPLAINANT:",
        "1 STATE OF KERALA",
        "REPRESENTED BY THE PUBLIC PROSECUTOR,HIGH COURT OF",
        "KERALA, KOCHI-682031",
        "2 DR. LALU JOSEPH",
        "MANAGING DIRECTOR, LIMAS MEDICAL DEVICES AND",
        "DIAGNOSTICS (P) LID.,LITTLE FLOWER AUDITORIUM COMPLEX,",
        "ALUVA-683101",
        "R1-2 BY ADV. SRI.K.K.AJI KUMAR",
        "R1 BY ADV. SRI.P.SHAIJAN JOSEPH"
    ],
    "sections": [],
    "outcome": "",
    "full_text": "pe atts\neee\nBae\nIN THE HIGH COURT OF KERALA AT ERNAKULAM 2021/KER/1223\nPRESENT\nTHE HONOURABLE MR. JUSTICE P.V.KUNHIKRISHNAN\nFRIDAY, THE O8TH DAY OF JANUARY 2021 / 18TH POUSHA, 1942\nCrl1.MC.No.3183 OF 2017\nCRIME NO.2387/2016 OF Aluva Police Station , Ernakulam\nPETITIONERS IN CRL.M.C/ACCUSED IN CRIME NO.2387/16 OF ALUVA POLICE\nSTATION:\n1 MANGESH PATANKAR\nS$/O.RATNAKAR MORESHWAR PATANKAR, AGED 38, MANAGING\nDIRECTOR, VEOL MEDICAL TECHNOLOGIES PVT. LTD., A 747,\nNEAR KRISHNA STEEL, PAWANE MIDC, TTC INDUSTRIAL AREA,\nNAVI MUMBAI-400705\n2 VEOL MEDICAL TECHNOLOGIES PVT. LTD.\nA 747, NEAR KRISHNA STEEL, PAWANE MIDC, TTC\nINDUSTRIAL AREA,NAVI MUMBAT-400705, REPRESENTED BY\nTHE MANAGING DIRECTOR,MANGESH PATANKAR\nBY ADVS.\nSRI.R.LAKSHMI NARAYAN\nSRI.A.ANILKUMAR (A - 959)\nSRI.M.ASHOK KINI\nSMT .R.RANJANIE\nRESPONDENTS IN CRL.M.C./STATE AND COMPLAINANT:\n1 STATE OF KERALA\nREPRESENTED BY THE PUBLIC PROSECUTOR,HIGH COURT OF\nKERALA, KOCHI-682031\n2 DR. LALU JOSEPH\nMANAGING DIRECTOR, LIMAS MEDICAL DEVICES AND\nDIAGNOSTICS (P) LID.,LITTLE FLOWER AUDITORIUM COMPLEX,\nALUVA-683101\nR1-2 BY ADV. SRI.K.K.AJI KUMAR\nR1 BY ADV. SRI.P.SHAIJAN JOSEPH\nSRI.SANTOSH PETER, SR.PP\nTHIS CRIMINAL MISC. CASE HAVING BEEN FINALLY HEARD ON\n08.01.2021, THE COURT ON THE SAME DAY PASSED THE FOLLOWING:\n\nEee\n|\nOa\nCrl.MC.No.3183 OF 2017 2021/KER/1223\n2\nORDER\nDated this the 8th day of January 2021\nThis Crl.M.C is filed to quash the FIR in Crime\nNo.2387/2016 of Aluva Police Station. This Cr1.M.C was\nfiled in 2017 and no interim order was passed in this\ncase. The learned counsel submitted that he is not\naware what happened to the case. There is no purpose\nin keeping this Cr1.M.C pending. If any Final Report\nis filed in Crime No.2387/2016 by the Aluva Police\nagainst the petitioners, the petitioners are free to\nchallenge the Final Report. With this liberty this\nCr1.M.C is dismissed.\nSd/-\nP.V.KUNHIKRISHNAN\nJUDGE\nDM\n\nieeaore\nore\neee\nCrl.MC.No.3183 OF 2017 2021/KER/1223\n3\nAPPENDIX\nPETITIONERS ' EXHIBITS:\nANNEXURE Al THE PHOTOCOPY OF THE F I R IN CRIME\nNO.2387/16 PF ALUVA POLICE STATION\nANNEXURE A2 THE PHOTOCOPY OF THE COMPLAINT PREFERRED BY\nTHE 2ND RESPONDENT\nANNEXURE A3 THE PHOTOCOPY OF TRADE MARK CERTIFICATE\nDATED 18.4.11\nANNEXURE A4 THE PHOTOCOPY OF LETTER DATED 17.1.2014\nANNEXURE A5 THE PHOTOCOPY OF EC CERTIFICATE\nANNEXURE A6 THE PHOTOCOPY OF THE AGREEMENT DATED\n14.4.2011\nANNEXURE A7 THE PHOTOCOPY OF THE DECLARATION DATED\n8.8.2014\nANNEXURE A8 THE PHOTOCOPY OF THE CHEQUE DETAILS AND THE\nMEMO ISSUED BY THE BANK\nANNEXURE AQ THE PHOTOCOPY OF NOTICE ISSUED BY 2ND\nPETITIONER\nANNEXURE A110 THE PHOTOCOPY OF THE ORDER DATED 21.2.2017\nIN BAIL APPLICATION NO.9215/16\nANNEXURE All THE PHOTOCOPY OF CERTIFICATE PRODUCED IN\nANX. A-2\nRESPONDENTS' EXHIBITS:\nANNEXURE R2 (a) TRUE COPY OF MANUFACTURE'S CERTIFICATE\nDATED 7-5-2013 ISSUED BY PETITIONERS TO 2ND\nRESPONDENT\nANNEXURE R2 (b) TRUE COPY OF EMAIL DATED 12-6-2017 ISSUED\nBY MEDICAL DEVICES CERTIFICATION MANAGER\nANNEXURE R2(c) TRUE COPY OF COMPLAINT DATED 29-12-2016\nLODGED BY PETITIONERS BEFORE COMMISSIONER\nOF POLICE CBD BELAPUR, NAVI MUMBAT\nANNEXURE R2 (d) TRUE COPY OF EMAIL DATED 11-8-2014 SEND BY\n1ST PETITIONER TO 2ND RESPONDENT\n\nieeaore\nis ae\neee\nCrl.MC.No.3183 OF 2017 2021/KER/1223\n4\nANNEXURE R2 (e) TRUE COPY OF MESSAGE SEND BY PETITIONERS\nOFFERING ROYALTY TO 2ND RESPONDENT\nANNEXURE R2 (Â£) TRUE COPIES OF EMAILS DATED 24-2-2015 SEND\nBY 1ST PETITIONER TO 2ND RESPONDENT\nANNEXURE R2 (g) TRUE COPY OF EMAIL DATED 25-2-2015 SEND BY\n1ST PETITIONER TO 2ND RESPONDENT\n//TRUE copy//\nPA TO JUDGE\n\n"
}