{
    "case_id": "",
    "court": "HIGH COURT OF KERALA AT ERNAKULAM\nPRESENT\nTHE HONOURABLE MR",
    "date": "",
    "judge": "BECHU KURIAN THOMAS\nWEDNESDAY",
    "petitioners": [
        "S:",
        "V.M VARGHESE",
        "AGED 62 YEARS",
        "SON OF V.P.MICHEAL, VELIKKATHU HOUSE, VADUTHALA P.O.,",
        "CHERANELLOOR VILLAGE, KANAYANNUR TALUK, ERNAKULAM",
        "DISTRICT., PIN - 682023"
    ],
    "respondents": [
        "S:",
        "1 STATE OF KERALA",
        "REPRESENTED BY PUBLIC PROSECUTOR, HIGH COURT OF KERALA,",
        "PIN - 682031",
        "2 SUB INSPECTOR OF POLICE",
        "KALPATTA POLICE STATION, WAYANAD DISTRICT, PIN - 673122",
        "OTHER PRESENT:"
    ],
    "sections": [
        "403",
        "406",
        "420 read with Section 120B of the Indian Penal Code",
        "1860"
    ],
    "outcome": "",
    "full_text": "Lo\nBRE\n2024/KER/4631\nCRL.MC NO. 450 OF 2024\n2\nIN THE HIGH COURT OF KERALA AT ERNAKULAM\nPRESENT\nTHE HONOURABLE MR. JUSTICE BECHU KURIAN THOMAS\nWEDNESDAY, THE 17'4 paY OF JANUARY 2024 / 27TH POUSHA, 1945\nCRL.MC NO. 450 OF 2024\nCRIME NO.317/2019 OF Kalpetta Police Station, Wayanad\nAGAINST THE ORDER/JUDGMENT CC 126/2022 OF CHIEF JUDICIAL\nMAGISTRATE , KALEPETTA\nPETITIONER/S:\nV.M VARGHESE\nAGED 62 YEARS\nSON OF V.P.MICHEAL, VELIKKATHU HOUSE, VADUTHALA P.O.,\nCHERANELLOOR VILLAGE, KANAYANNUR TALUK, ERNAKULAM\nDISTRICT., PIN - 682023\nBY ADVS.\nP.M.ZIRAJ\nIRFAN ZIRAJ\nRESPONDENT/S:\n1 STATE OF KERALA\nREPRESENTED BY PUBLIC PROSECUTOR, HIGH COURT OF KERALA,\nPIN - 682031\n2 SUB INSPECTOR OF POLICE\nKALPATTA POLICE STATION, WAYANAD DISTRICT, PIN - 673122\nOTHER PRESENT:\nSRI. M.C. ASHI (PP)\nTHIS CRIMINAL MISC. CASE HAVING COME UP FOR ADMISSION ON\n17.01.2024, THE COURT ON THE SAME DAY PASSED THE FOLLOWING:\n\nea)\n2024/KER/4631\nCRL.MC NO. 450 OF 2024\n2\nBECHU KURIAN THOMAS, J.\nCrl.M.C.No.450 of 2024\nDated this the 17\" day of January 2024\nORDER\n\nPetitioner challenges the proceedings in C.C.No.126/2022 on the\nfiles of the Chief Judicial Magistrate, Kalpetta. According to the\npetitioner, the allegations in the final report does not make out any\noffence against the petitioner as he is the Managing Director of a\ncompany, which is a franchisee of a company empaneled by the\nGovernment of India and no criminal proceedings can be initiated\nagainst him on the basis of the final report.\n\n2. The prosecution alleges that the accused had collected\nmoney from the defacto complainant after offering to provide a software\nto the ‘Suvidha Kendra’ for filing GST returns and thereafter failed to\nprovide the software and thus committed the offences under Section\n403, 406, 420 r/w Section 120B of the Indian Penal Code, 1860.\n\n3. Though Sri.P.M.Ziraj, learned Counsel for the petitioner\nvehementaly contended that the offences alleged against the petitioner\nare not all made out, this Court notices that the case is scheduled for\ntrial on 18.01.2024, ie. tomorrow. The attempt of the accused to quash\nthe proceedings on the eve of the trial cannot be encouraged. Since all\nthese years petitioner had not chosen to challenge the proceedings and\n\nLo\nal cy\n2024/KER/4631\nCRL.MC NO. 450 OF 2024\n3\n\nthe trial has already been scheduled to take place tomorrow, this Court\n\nis not inclined to consider exercising the inherent jurisdiction under\n\nSection 482 of the Cr.P.C. to quash the proceedings. The petitioner will\n\nhave an effective remedy by participating in the trial and no prejudice\n\nwill be caused since the trial will be completed in a short time as well.\n\nTherefore, without considering any of the contentions on merits\nand leaving it open for consideration by the Trial Court, this Crl.M.C. is\ndismissed.\nsd/\nBECHU KURIAN THOMAS\nJUDGE\njm/\n\ncs\nLe\n2024/KER/4631\nCRL.MC NO. 450 OF 2024\n4\nAPPENDIX OF CRL.MC 450/2024\n\nPETITIONER ANNEXURES\n\nAnnexure 1 TRUE COPY OF THE COMPLAINT DATED 15.5.2019\nSUBMITTED BY THE DEFACTO COMPLAINT BEFORE THE\nCHIEF JUDICIAL MAGISTRATE COURT, KALPETTA\nWHICH FORWARDED BY THE LEARNED MAGISTRATE\nUNDER SECTION 156(3) OF THE CODE OF THE\nCRIMINAL PROCEDURE\n\nAnnexure 2 TRUE COPY OF THE FIRST INFORMATION REPORT IN\nCRIME NO. 317/2019 OF KALPETTA POLICE STATION\n\nAnnexure 3 TRUE COPY OF THE FINAL REPORT IN CRIME NO.\n3117/2019 OF KALPETTA POLICE STATION\n\nAnnexure 4 TRUE COPY OF THE LIST OF WITNESSES SUBMITTED\nALONG WITH THE ANNEXURE 3\n\nAnnexure 5 TRUE COPY OF THE 161 STATEMENT OF THE CW1\nDATED 6-6-2019\n\nAnnexure 6 TRUE COPY OF THE 161 STATEMENT OF THE CW2\nDATED 27.10.2019\n\nAnnexure 7 TRUE COPY OF THE 161 STATEMENT OF THE CW3\nDATED 19.7.2019\n\nAnnexure 8 TRUE COPY OF THE 161 STATEMENT OF THE CW4\nDATED 22.9.2019\n\nAnnexure 9 TRUE COPY OF THE 161 STATEMENT OF THE CW5\nDATED 16.8.2019\n\nAnnexure 10 TRUE COPY OF THE 161 STATEMENT OF THE CW6\nDATED 11.2.2022\n\nAnnexure 11 TRUE COPY OF THE 161 STATEMENT OF THE CW7\nDATED 1.10.2021\n\nAnnexure 12 TRUE COPY OF THE LIST OF COMPANIES EMPANELLED\nBY THE GOVERNMENT OF INDIA DOWNLOADED FROM\nTHE WEBSITE OF GST DEPARTMENT WITHOUT DATE\n\nAnnexure 13 TRUE COPY OF THE CERTIFICATE OF INCORPORATION\nOF THE COMPANY GROW GREEN ENVIRONMENTAL\nSOLUTIONS PRIVATE LIMITED DATED 19-11-2012\n\nAnnexure 14 TRUE COPY OF THE AGREEMENT DATED 5-10-2017\nEXECUTED BETWEEN BOTREE AND ANOTHER AND\nM/S.GROW GREEN ENVIRONMENTAL SOLUTIONS PVT.\nLTD.\n\nAnnexure 15 TRUE COPY OF THE AGREEMENT EXECUTED BETWEEN\nTHE M/S.GROW GREEN ENVIRONMENTAL SOLUTIONS\nPVT. LTD. AND ANOTHER AND CW1 DATED 20-4-2018\n\nAnnexure 16 TRUE COPY OF THE MATL SENT BY THE PETITIONER\nTO CW1 DATED 25-4-2018\n\nAnnexure 17 TRUE COPY OF THE MAIL SENT BY THE PETITIONER\n\ncs\nLe\n2024/KER/4631\nCRL.MC NO. 450 OF 2024\n5\nTO Cw2 DATED 27.3.2018\nAnnexure 18 TRUE COPY OF THE MAIL SENT BY THE PETITIONER\nTO Cw3 DATED 14.5.2018\nAnnexure 19 TRUE COPY OF THE MAIL SENT BY THE PETITIONER\nTO CW4 DATED 14.5.2018\nAnnexure 20 TRUE COPY OF THE MAIL SENT BY THE PETITIONER\nTO CW5 DATED 16.5.2018\nAnnexure 21 TRUE COPY OF THE MAIL SENT BY THE PETITIONER\nTO CW6 DATED 16.5.2018\nAnnexure 22 TRUE COPY OF THE MAIL SENT BY THE PETITIONER\nTO CW7 DATED 14.5.2018\nAnnexure 23 TRUE COPY OF THE LIST OF PERSONS WHO ATTEND\nTHE MEETING HELD ON 16-4-2018\n\n"
}