{
    "case_id": "Crl.MC.No.5893 OF 2020",
    "court": "HIGH COURT OF KERALA AT ERNAKULAM",
    "date": "6TH DAY OF JANUARY 2021",
    "judge": "SHIRCY V.\nWEDNESDAY",
    "petitioners": [
        "S /ACCUSED NO.1 TO 5 :-",
        "1 AKSHAY",
        "AGED 24 YEARS",
        "s/o BALAKRISHNAN,",
        "ERIYIMMAKANDYAYANTKKATTU HOUSE,",
        "KEEZHARIYOOR P O, QUILANDY THALUK,",
        "KOZHIKODE DISTRICT, PIN-673307.",
        "2 REENA",
        "W/O BALAKRISHNAN",
        "AGED 52 YEARS",
        "ERIYIMMAKANDYAYANTKKATTU HOUSE,",
        "KEEZHARTYOOR P O, QUILANDY THALUK,",
        "KOZHIKODE DISTRICT, PIN-673307.",
        "3 BALAKRISHNAN",
        "AGED 56 YEARS",
        "S/O KUNHIATHU,",
        "ERIYIMMAKANDYAYANTIKKATTU HOUSE,",
        "KEEZHARTYOOR P O,",
        "QUILANDY THALUK,",
        "KOZHIKODE DISTRICT, PIN-673307.",
        "4 AJI",
        "AGED 28 YEARS",
        "S/O BALAKRISHNAN,",
        "ERIYIMMAKANDYAYANIKKATTU HOUSE,",
        "KEEZHARTYOOR P O,",
        "QUILANDY THALUK,",
        "KOZHIKODE DISTRICT,",
        "PIN-673307.",
        "5 ASWAL",
        "AGED 28 YEARS",
        "s/o SIVADASAN,",
        "PUNATHUVAYAL HOUSE,",
        "KEEZHARIYOOR P O,",
        "QUILANDY THALUK,",
        "KOZHIKODE DISTRICT, PIN-673307."
    ],
    "respondents": [
        "S /DEFACTO COMPLAINANT/STATE :-",
        "1 ARYANANDHA",
        "AGED 21 YEARS",
        "D/ O CHANDRAN,",
        "VADEKANI HOUSE, KEEZHARIYOOR P O,",
        "QUILANDY THALUK,",
        "KOZHIKODE DISTRICT, PIN-673307.",
        "2 STATE OF KERALA",
        "REPRESENTED BY PUBLIC PROSECUTOR,",
        "HIGH COURT OF KERALA, ERNAKULAM-682031.",
        "R1 BY ADV. K.SEENA",
        "R2 C.N.PRABHAKARAN - SR.P.P"
    ],
    "sections": [
        "482 of the Code of\nCriminal Procedure"
    ],
    "outcome": "ORDER\nDated this the 6th day of January 2021\nPetition under Section 482 of the Code of\nCriminal Procedure.\n\n2. Petitioners are the accused Nos.1 to 5 in\nCrime No.1175 of 2020 of Quilandy Police Station\nregistered for the offences punishable under\nSections 406, 498(A)and 34 of Indian Penal Code.\n\n3. The learned counsel appearing for the\npetitioners have submitted that the first\npetitioner, who is the first accused has married\nthe defacto complainant and they resided together\nas husband and wife for sometime. But due to the\ndifference of opinion, they separated and\nsubsequently their marriage has been dissolved by a\ndecree of divorce by the Family Court, Vadakara in\nO.P.No.482 of 2020.\n\n4. It is also submitted that now the entire\ndispute between the parties have been settled out\n\npee awalC\ni\nCrl.MC.No.5893 OF 2020 202 1/KER/S68\n4\nof court and all her belongings have been returned\nto her as per the terms of the settlement.\nTherefore, it is quite unnecessary to proceed with\nthe case registered against the petitioners on some\nmisunderstanding by the defacto complainant.\n\n5. Heard the learned counsel for the\npetitioners, respondent as well the learned Public\nProsecutor.\n\n6. The learned Public Prosecutor has also\nsubmitted that the entire dispute between the\nparties have been amicably settled and as such the\ndefacto complainant has no grievance or complaints\nagainst these petitioners.\n\n7. On going through the- entire records\nproduced by the petitioners as well on hearing both\nsides, I find that no fruitful purpose is likely to\nbe served by pursuing the matter against these\npetitioners. Moreover, no public interest is\ninvolved in the case and there is no _ legal\nimpediment in granting the prayer as sought for by\nthe petitioners. As, the entire dispute has been\n\nBera\nSe\nes E\nCr1.MC.No.5893 OF 2020 2021/KER/368\n5\n\namicably settled the request to quash the FIR\n\nregistered against these petitioners can be allowed\n\nas prayed for by the petitioners.\n\nFor the foregoing reasons, this Crl.M.C is\nallowed and Crime No.1175 of 2020 of Quilandy\nPolice Station registered against these petitioners\nshall stand quashed",
    "full_text": "Pee\na : fe i\neee\nbigs\nIN THE HIGH COURT OF KERALA AT ERNAKULAM 202 U/KER/B68\nPRESENT\nTHE HONOURABLE MRS. JUSTICE SHIRCY V.\nWEDNESDAY, THE O6TH DAY OF JANUARY 2021 / 16TH POUSHA, 1942\nCr1.MC.No.5893 OF 2020(F)\nCRIME NO.1175/2020 OF Quilandy Police Station , Kozhikode\nPETITIONERS /ACCUSED NO.1 TO 5 :-\n1 AKSHAY\nAGED 24 YEARS\ns/o BALAKRISHNAN,\nERIYIMMAKANDYAYANTKKATTU HOUSE,\nKEEZHARIYOOR P O, QUILANDY THALUK,\nKOZHIKODE DISTRICT, PIN-673307.\n2 REENA\nW/O BALAKRISHNAN\nAGED 52 YEARS\nERIYIMMAKANDYAYANTKKATTU HOUSE,\nKEEZHARTYOOR P O, QUILANDY THALUK,\nKOZHIKODE DISTRICT, PIN-673307.\n3 BALAKRISHNAN\nAGED 56 YEARS\nS/O KUNHIATHU,\nERIYIMMAKANDYAYANTIKKATTU HOUSE,\nKEEZHARTYOOR P O,\nQUILANDY THALUK,\nKOZHIKODE DISTRICT, PIN-673307.\n4 AJI\nAGED 28 YEARS\nS/O BALAKRISHNAN,\nERIYIMMAKANDYAYANIKKATTU HOUSE,\nKEEZHARTYOOR P O,\nQUILANDY THALUK,\nKOZHIKODE DISTRICT,\nPIN-673307.\n5 ASWAL\nAGED 28 YEARS\ns/o SIVADASAN,\nPUNATHUVAYAL HOUSE,\nKEEZHARIYOOR P O,\nQUILANDY THALUK,\nKOZHIKODE DISTRICT, PIN-673307.\n\nDey\nBette\nCrl.MC.No.5893 OF 2020 202 U/KER/B68\n2\nBY ADV. SRI.ZUBAIR PULIKKOOL\nRESPONDENTS /DEFACTO COMPLAINANT/STATE :-\n1 ARYANANDHA\nAGED 21 YEARS\nD/ O CHANDRAN,\nVADEKANI HOUSE, KEEZHARIYOOR P O,\nQUILANDY THALUK,\nKOZHIKODE DISTRICT, PIN-673307.\n2 STATE OF KERALA\nREPRESENTED BY PUBLIC PROSECUTOR,\nHIGH COURT OF KERALA, ERNAKULAM-682031.\nR1 BY ADV. K.SEENA\nR2 C.N.PRABHAKARAN - SR.P.P\nTHIS CRIMINAL MISC. CASE HAVING COME UP FOR ADMISSION ON\n06.01.2021, THE COURT ON THE SAME DAY PASSED THE FOLLOWING:\n\npee awalC\no\nCrl.MC.No.5893 OF 2020 202 1/KERI868\n3\nORDER\nDated this the 6th day of January 2021\nPetition under Section 482 of the Code of\nCriminal Procedure.\n\n2. Petitioners are the accused Nos.1 to 5 in\nCrime No.1175 of 2020 of Quilandy Police Station\nregistered for the offences punishable under\nSections 406, 498(A)and 34 of Indian Penal Code.\n\n3. The learned counsel appearing for the\npetitioners have submitted that the first\npetitioner, who is the first accused has married\nthe defacto complainant and they resided together\nas husband and wife for sometime. But due to the\ndifference of opinion, they separated and\nsubsequently their marriage has been dissolved by a\ndecree of divorce by the Family Court, Vadakara in\nO.P.No.482 of 2020.\n\n4. It is also submitted that now the entire\ndispute between the parties have been settled out\n\npee awalC\ni\nCrl.MC.No.5893 OF 2020 202 1/KER/S68\n4\nof court and all her belongings have been returned\nto her as per the terms of the settlement.\nTherefore, it is quite unnecessary to proceed with\nthe case registered against the petitioners on some\nmisunderstanding by the defacto complainant.\n\n5. Heard the learned counsel for the\npetitioners, respondent as well the learned Public\nProsecutor.\n\n6. The learned Public Prosecutor has also\nsubmitted that the entire dispute between the\nparties have been amicably settled and as such the\ndefacto complainant has no grievance or complaints\nagainst these petitioners.\n\n7. On going through the- entire records\nproduced by the petitioners as well on hearing both\nsides, I find that no fruitful purpose is likely to\nbe served by pursuing the matter against these\npetitioners. Moreover, no public interest is\ninvolved in the case and there is no _ legal\nimpediment in granting the prayer as sought for by\nthe petitioners. As, the entire dispute has been\n\nBera\nSe\nes E\nCr1.MC.No.5893 OF 2020 2021/KER/368\n5\n\namicably settled the request to quash the FIR\n\nregistered against these petitioners can be allowed\n\nas prayed for by the petitioners.\n\nFor the foregoing reasons, this Crl.M.C is\nallowed and Crime No.1175 of 2020 of Quilandy\nPolice Station registered against these petitioners\nshall stand quashed as prayed for.\n\nSd/-\nSHIRCY V.\nJUDGE\nSMA\n\nDey\nBette\nCrl.MC.No.5893 OF 2020 202 U/KER/B68\n6\nAPPENDIX\nPETITIONER'S/S EXHIBITS:\nANNEXURE-TI TRUE COPY OF THE FIRST INFORMATION\nREPORT IN CRIME NO.1175/20 OF QUILANDY\nPOLICE STATION.\nANNEXURE-ITI SWORN AFFIDAVIT OF 1ST RESPONDENT.\nRESPONDENT (S)' EXHIBITS :- NIL\n//TRUE COPY//\nPA TO JUDGE\n\n"
}