{
    "case_id": "",
    "court": "HIGH COURT OF KERALA AT ERNAKULAM ape",
    "date": "07TH DAY OF JANUARY 2021",
    "judge": "B.SUDHEENDRA KUMAR\nTHURSDAY",
    "petitioners": [
        "S:",
        "JOBIN VARGHESE,",
        "AGED 35 YEARS,",
        "SON OF VARGHESE, THYPARAMBIL HOUSE,",
        "ABHAM COURT YARD, ELOOR,",
        "UDYOGAMANDAL-P O, ERNAKULAM, KOCHI-683501."
    ],
    "respondents": [
        "S:",
        "1 STATE OF KERALA,",
        "REPRESENTED BY THE PUBLIC PROSECUTOR,",
        "HIGH COURT OF KERALA, ERNAKULAM,",
        "KOCHI-682031.",
        "2 MRS RAKHI SUNIL,",
        "WIFE OF SUNIL A V,",
        "SUNIL VILLA,",
        "KERALASSERY P 0,",
        "PALAKKAD-678001.",
        "R2 BY ADV. SRI.NIREESH MATHEW",
        "OTHER PRESENT:"
    ],
    "sections": [],
    "outcome": "",
    "full_text": "Pearl\nae -\nIN THE HIGH COURT OF KERALA AT ERNAKULAM ape\n2021/KER/1082\nPRESENT\nTHE HONOURABLE MR. JUSTICE B.SUDHEENDRA KUMAR\nTHURSDAY, THE 07TH DAY OF JANUARY 2021 / 17TH POUSHA, 1942\nCr1.MC.No.5373 OF 2020(B)\nAGAINST THE ORDER/JUDGMENT IN CMP 2522/2020 OF CHIEF\nJUDICIAL MAGISTRATE PALAKKAD\nPETITIONER/S:\nJOBIN VARGHESE,\nAGED 35 YEARS,\nSON OF VARGHESE, THYPARAMBIL HOUSE,\nABHAM COURT YARD, ELOOR,\nUDYOGAMANDAL-P O, ERNAKULAM, KOCHI-683501.\nBY ADVS.\nSRI.S.EASWARAN\nSRI.P.MURALEEDHARAN (IRIMPANAM)\nSRI.P.SREEKUMAR (THOTTAKKATTUKARA)\nSMT .K.V.RAJESWARI\nRESPONDENT/S:\n1 STATE OF KERALA,\nREPRESENTED BY THE PUBLIC PROSECUTOR,\nHIGH COURT OF KERALA, ERNAKULAM,\nKOCHI-682031.\n2 MRS RAKHI SUNIL,\nWIFE OF SUNIL A V,\nSUNIL VILLA,\nKERALASSERY P 0,\nPALAKKAD-678001.\nR2 BY ADV. SRI.NIREESH MATHEW\nOTHER PRESENT:\nSMT. M.K.PUSHPALATHA, SR.PP\nTHIS CRIMINAL MISC. CASE HAVING BEEN FINALLY HEARD ON\n07.01.2021, THE COURT ON THE SAME DAY PASSED THE FOLLOWING:\n\nol\nap\n2021/KER/1082\nCri.M.C. No.5373 of 2020\n-2-\nORDER\n\nDismissed as withdrawn as requested by\nthe learned counsel for the petitioner in\nthis regard.\n\nHowever, the petitioner shall be at\nliberty to raise all his contentions before\nthe court below at the appropriate stage.\n\nsd/-\nB. SUDHEENDRA KUMAR,\nJUDGE\nSTK\n\n"
}