{
    "case_id": "",
    "court": "HIGH COURT OF KERALA AT ERNAKULAM\nPRESENT\nTHE HONOURABLE MR",
    "date": "",
    "judge": "BECHU KURIAN THOMAS\nTHURSDAY",
    "petitioners": [
        "2ND ACCUSED:",
        "INDIRA, AGED 44 YEARS",
        "W/O.RAMACHANDRAN, CHAMAKKALAYAIL HOUSE,",
        "CHUNAGANDU DESOM, AMBALAPPARA VILLAGE,",
        "OTTAPPALAM TALUK, THRISSUR DISTRICT - 679 512."
    ],
    "respondents": [
        "STATE :",
        "STATE OF KERALA",
        "REP. BY THE SUB INSPECTOR OF POLICE,",
        "OLLUR POLICE STATION, THRISSUR DISTRICT,",
        "THROUGH THE PUBLIC PROSECUTOR,",
        "HIGH COURT OF KERALA AT ERNAKULAM, PIN - 682031"
    ],
    "sections": [
        "406",
        "420 of the Indian\nPenal Code",
        "1860"
    ],
    "outcome": "",
    "full_text": "Bae el\nPieris er\n|\nSpratt\nBeer\n2024/KER/4447\nIN THE HIGH COURT OF KERALA AT ERNAKULAM\nPRESENT\nTHE HONOURABLE MR. JUSTICE BECHU KURIAN THOMAS\nTHURSDAY, THE 18\" pAY OF JANUARY 2024 / 28TH POUSHA, 1945\nCRL.MC NO. 519 OF 2024\nCRIME NO.48/2011 OF OLLUR POLICE STATION, THRISSUR\nAGAINST THE ORDER/JUDGMENT CC 136/2016 OF JUDICIAL MAGISTRATE\nOF FIRST CLASS -III, THRISSUR\nPETITIONER/2ND ACCUSED:\nINDIRA, AGED 44 YEARS\nW/O.RAMACHANDRAN, CHAMAKKALAYAIL HOUSE,\nCHUNAGANDU DESOM, AMBALAPPARA VILLAGE,\nOTTAPPALAM TALUK, THRISSUR DISTRICT - 679 512.\nBY ADVS.\nN.L.BITTO\nMITHUL T ANTO\nRESPONDENT/STATE :\nSTATE OF KERALA\nREP. BY THE SUB INSPECTOR OF POLICE,\nOLLUR POLICE STATION, THRISSUR DISTRICT,\nTHROUGH THE PUBLIC PROSECUTOR,\nHIGH COURT OF KERALA AT ERNAKULAM, PIN - 682031\nSMT. V. SREEJA (PP)\nTHIS CRIMINAL MISC. CASE HAVING COME UP FOR ADMISSION ON\n18.01.2024, THE COURT ON THE SAME DAY PASSED THE FOLLOWING:\n\n2024/KER/4447\nCRL.MC 519/2024\n2\nBECHU KURIAN THOMAS, J\narena\nORDER\nPetitioner is the sole accused in C.C.No.136/2016 on the files of\nthe Judicial First Class Magistrate Court-III, Thrissur; alleging\noffences punishable under Sections 406 and 420 of the Indian\nPenal Code, 1860. Since the petitioner failed to appear before\nthe trial court on the date of posting, a warrant has been\nissued, and proceedings have been initiated under Sections 82\nand 83, of Cr.P.C. Hence, this petition.\n\n2. Sri.N.L.Bitto, the learned counsel for the petitioner, submitted\nthat petitioner is willing to appear before the trial court, and\nseek bail and also participate in the proceedings without _ fail.\nHowever, petitioner apprehends that she may be remanded to\ncustody.\n\n3. I have heard Smt.Sreeja V., the learned Public Prosecutor as\nwell.\n\n2024/KER/4447\nCRL.MC 519/2024\n3\n\n4. Having regard to the circumstances arising in the case, I am\nof the view that this Crl.M.C. can be disposed of with a\ndirection.\n\n5. Accordingly, there will be a direction to the Judicial First Class\nMagistrate Court-III, Thrissur, to consider the application for\nrecall of warrant and for grant of bail, positively on the same\nday itself, provided such applications are filed by the petitioner\non or before 29.01.2024.\n\nThe Crl.M.C.is disposed of.\nsd/-\nBECHU KURIAN THOMAS\nJUDGE\nAMV/19/01/2024\n\nBae el\nPieris er\n|\nSpratt\nBeer\n2024/KER/4447\nCRL.MC 519/2024\n4\nAPPENDIX OF CRL.MC 519/2024\nPETITIONER ANNEXURES\nANNEXURE -I A TRUE COPY OF THE FIR IN CRIME NO. 48\nOF 2011 OF THE OLLUR POLICE STATION\nDATED 16/1/2011\nANNEXURE -II A TRUE COPY OF THE FINAL REPORT IN\nCC.136 OF 2016 ON THE FILES OF JUDICIAL\nFIRST CLASS MAGISTRATE COURT NO.III\nDATED 14/06/2011\nTRUE COPY\n\n"
}