{
    "case_id": "",
    "court": "HIGH COURT OF KERALA AT ERNAKULAM",
    "date": "8TH DAY OF JANUARY 2021",
    "judge": "P.SOMARAJAN\nFRIDAY",
    "petitioners": [
        "JIJI GEORGE,",
        "AGED 36 YEARS,",
        "S/o GEORGE, 35/15,",
        "THAZHATHUMALAYIL HOUSE,",
        "VARAKULAM, MANIMOOLI.P.0-679333"
    ],
    "respondents": [
        "S:",
        "1 STATE OF KERALA,",
        "REPRESENTED BY PUBLIC PROSECUTOR,",
        "HIGH COURT OF KERALA, ERNAKULAM-682031",
        "2 THE SUB INSPECTOR OF POLICE,",
        "VAZHIKADAVU POLICE STATION,",
        "MALAPPURAM DISTRICT",
        "3 NOUSHAD ALI,",
        "S/o MUHAMMED,",
        "KADAKULATH VEEDU,",
        "CHENGATHOR. P.O"
    ],
    "sections": [
        "406",
        "420\nIPC is under challenge"
    ],
    "outcome": "",
    "full_text": "or peet\nSree\nIN THE HIGH COURT OF KERALA AT ERNAKULAM 2021/KER/1309\nPRESENT\nTHE HONOURABLE MR. JUSTICE P.SOMARAJAN\nFRIDAY, THE O8TH DAY OF JANUARY 2021 / 18TH POUSHA, 1942\nCri.MC.No.6107 OF 2019(C)\nCc 457/2018 OF JUDICIAL MAGISTRATE OF FIRST CLASS, NILAMBUR\nCRIME NO.20/2017 OF VAZHIKADAVU POLICE STATION, MALAPPURAM\nPETITIONER:\nJIJI GEORGE,\nAGED 36 YEARS,\nS/o GEORGE, 35/15,\nTHAZHATHUMALAYIL HOUSE,\nVARAKULAM, MANIMOOLI.P.0-679333\nBY ADVS.SRI.A.T.ANTLKUMAR\nSMT .V.SHYLAJA\nRESPONDENTS:\n1 STATE OF KERALA,\nREPRESENTED BY PUBLIC PROSECUTOR,\nHIGH COURT OF KERALA, ERNAKULAM-682031\n2 THE SUB INSPECTOR OF POLICE,\nVAZHIKADAVU POLICE STATION,\nMALAPPURAM DISTRICT\n3 NOUSHAD ALI,\nS/o MUHAMMED,\nKADAKULATH VEEDU,\nCHENGATHOR. P.O\nBY SR. PUBLIC PROSECUTOR SRI. SUMAN CHAKRAVARTHY\nBY PUBLIC PROSECUTOR SRI. M.R. DHANIL\nR3 BY ADV. SRI.T.G.RAJENDRAN\nTHIS CRIMINAL MISC. CASE HAVING BEEN FINALLY HEARD ON\n08.01.2021, THE COURT ON THE SAME DAY PASSED THE FOLLOWING:\n\n|\nCrl.M.C.No.6107 of 2019 2 2021/KER/1309\nORDER\nThe crime registered and its further proceedings on\nthe allegation of offence under Sections 406 and 420\nIPC is under challenge. It is with respect to the\npurchase of a JCB owned by the defacto complainant for\nwhich certain amounts were paid. It was subject to a\nbank loan at that time which was subsequently closed.\nWhat is involved is only a civil dispute and the police\nhas unauthorizedly intervened in a civil dispute by\nregistering a crime. Crl.M.C. is allowed accordingly\nby quashing the FIR and its subsequent proceedings.\nSd/-\nP. SOMARAJAN\nDMR/- JUDGE\n\nea a\noi ae rr\nae\nCr1.M.C.No.6107 of 2019 3 202 1/KER/1309\nAPPENDIX\n\nPETITIONER'S ANNEXURES:\n\nANNEXURE A TRUE COPY OF RECEIPT SHOWING THE PAYMENT OF\nADVANCE AMOUNT OF RS.20,000/-\n\nANNEXURE B TRUE COPY OF THE DETAILS OF THE RECEIPT\nSHOWING THE PAYMENT OF RS.4,72,761/-\n\nANNEXURE C TRUE COPY OF THE SCHEDULE ISSUED BY THE\nFINANCE COMPANY AT THE TIME OF TAKING HIRE\nPURCHASE FACILITY\n\nANNEXURE D TRUE COPY OF THE R.C PARTICULARS OF THE\nABOVE REFERRED VEHICLE\n\nANNEXURE E TRUE COPY OF THE INSURANCE CERTIFICATE OF\nTHE VEHICLE\n\nANNEXURE F TRUE COPY OF THE TAX TOKEN SHOWING THE\nPAYMENT OF ROAD TAX\n\nANNEXURE G TRUE COPY OF THE FIR\n\nANNEXURE H TRUE COPY OF THE CHARGE IN CC NO. 457/2018\nON THE FILE OF JFCM, NILAMBUR\n\nANNEXURE TI TRUE COPY OF THE PLAINT IN 0.S.No.382/2019\nON THE FILE OF MUNSIFFS COURT, MANJERI.\n\nRESPONDENTS ' ANNEXURE:\n\nANNEXURE R2(a) : TRUE COPY OF THE ORDER DATED 26.06.2018\nIN CRL.M.C.No.3294/2017.\n\nANNEXURE R3(A) : TRUE COPY OF THE JUDGMENT REPORTED IN\n1984 KLT 268\n\n// TRUE copy //\nP.A. TO JUDGE\n\n"
}