{
    "case_id": "CRL.MC.NO. 8541 OF 2019",
    "court": "HIGH COURT OF KERALA AT ERNAKULAM\nPRESENT\nTHE HONOURABLE MR",
    "date": "6TH DAY OF JANUARY 2020",
    "judge": "ASHOK MENON\nMONDAY",
    "petitioners": [
        "S/ACCUSED NOS.1 TO 4:",
        "1 ABBAS,",
        "AGED 54 YEARS,",
        "S/O. ISMAIL, KALATHIL VEEDU,",
        "OLIPPARA, KAYARADI,",
        "NENMARA, PALAKKAD.",
        "2 SALIM,",
        "AGED 31 YEARS,",
        "S/O. MOOSAKUTTY, KUNNANKAD VEEDU,",
        "ADIPERANDATHARA, KAYARADI,",
        "NENMARA, PALAKKAD.",
        "3 SUBAIR,",
        "AGED 35 YEARS,",
        "S/O. ALIYAR, ADIPERANDATHARA,",
        "KAYARADI, NENMARA,",
        "PALAKKAD.",
        "4 JALEEL,",
        "AGED 47 YEARS,",
        "S/O. ASSANAR, ADIPERANDATHARA,",
        "KAYARADI, NENMARA,",
        "PALAKKAD ."
    ],
    "respondents": [
        "S/STATE AND DEFACTO COMPLAINANT:",
        "1 STATE OF KERALA",
        "REPRESENTED BY PUBLIC PROSECUTOR,",
        "HIGH COURT OF KERALA, ERNAKULAM 682 031",
        "2 MUHAMMED IBRAHIM,",
        "AGED 34 YEARS,",
        "S/O. SHAHUL HAMEED,"
    ],
    "sections": [
        "341",
        "324",
        "326",
        "435",
        "308 read with Section 34 of the IPC"
    ],
    "outcome": "ORDER/JUDGMENT IN SC 6/2017 OF ADDITIONAL SUB COURT,\nPALAKKAD\nCRIME NO.603/2015 OF Nenmara Police Station , Palakkad\nPETITIONERS/ACCUSED NOS.1 TO 4:\n1 ABBAS,\nAGED 54 YEARS,\nS/O. ISMAIL, KALATHIL VEEDU,\nOLIPPARA, KAYARADI,\nNENMARA, PALAKKAD.\n2 SALIM,\nAGED 31 YEARS,\nS/O. MOOSAKUTTY, KUNNANKAD VEEDU,\nADIPERANDATHARA, KAYARADI,\nNENMARA, PALAKKAD.\n3 SUBAIR,\nAGED 35 YEARS,\nS/O. ALIYAR, ADIPERANDATHARA,\nKAYARADI, NENMARA,\nPALAKKAD.\n4 JALEEL,\nAGED 47 YEARS,\nS/O. ASSANAR, ADIPERANDATHARA,\nKAYARADI, NENMARA,\nPALAKKAD .\nBY ADV. SRI.V.A.JOHNSON (VARIKKAPPALLIL)\nRESPONDENTS/STATE AND DEFACTO COMPLAINANT:\n1 STATE OF KERALA\nREPRESENTED BY PUBLIC PROSECUTOR,\nHIGH COURT OF KERALA, ERNAKULAM 682 031\n2 MUHAMMED IBRAHIM,\nAGED 34 YEARS,\nS/O. SHAHUL HAMEED,\n\nBlea\noa a\n[OF\nCRL.MC.NO. 8541 OF 2019 2 2020/KER/176\nA.P STREET, NAVAKKODE, KODUVAYUR,\nPALAKKAD 678 505\nR1 C.S.HRITHWIK-SR.G.P\nR2 BY ADV. UNNI SEBASTIAN KAPPEN\nTHIS CRIMINAL MISC. CASE HAVING COME UP FOR ADMISSION ON\n06.01.2020, THE COURT ON THE SAME DAY PASSED THE FOLLOWING:\n\nFane\nCRL.MC.NO. 8541 OF 2019 3 2020/KER/176\nORDER\nDated this the 06 day of January, 2020\n\nThe petitioners are accused in S.C.No. 6/2017 on the\nfile of the Additional Assistant Sessions Court, Palakkad for\nhaving allegedly committed offences punishable under Sections\n341, 324, 326, 435 and 308 read with Section 34 of the IPC. The\nonly injured is the 2\" respondent who has appeared through\ncounsel and filed affidavit to the effect that the matter has been\namicably settled with the petitioners and that he does not have\nany grievance. The injury sustained is not life threatening. The\npetitioners do not have any criminal antecedents. A report has\nbeen filed by the Investigating Officer through the learned Senior\nPublic Prosecutor to the effect.\n\nIn the result, the Crl.MC is allowed and the entire\nproceedings as against the petitioners herein in S.C.No. 6/2017\non the file of the Additional Assistant Sessions Court, Palakkad\nand Crime.No.603/2015 of Nenmara Police Station stand quashed",
    "full_text": "Petar\nFibres a\nBees\n2020/KER/176\nIN THE HIGH COURT OF KERALA AT ERNAKULAM\nPRESENT\nTHE HONOURABLE MR. JUSTICE ASHOK MENON\nMONDAY, THE O6TH DAY OF JANUARY 2020 / 16TH POUSHA, 1941\nCr1.MC.No.8541 OF 2019(G)\nAGAINST THE ORDER/JUDGMENT IN SC 6/2017 OF ADDITIONAL SUB COURT,\nPALAKKAD\nCRIME NO.603/2015 OF Nenmara Police Station , Palakkad\nPETITIONERS/ACCUSED NOS.1 TO 4:\n1 ABBAS,\nAGED 54 YEARS,\nS/O. ISMAIL, KALATHIL VEEDU,\nOLIPPARA, KAYARADI,\nNENMARA, PALAKKAD.\n2 SALIM,\nAGED 31 YEARS,\nS/O. MOOSAKUTTY, KUNNANKAD VEEDU,\nADIPERANDATHARA, KAYARADI,\nNENMARA, PALAKKAD.\n3 SUBAIR,\nAGED 35 YEARS,\nS/O. ALIYAR, ADIPERANDATHARA,\nKAYARADI, NENMARA,\nPALAKKAD.\n4 JALEEL,\nAGED 47 YEARS,\nS/O. ASSANAR, ADIPERANDATHARA,\nKAYARADI, NENMARA,\nPALAKKAD .\nBY ADV. SRI.V.A.JOHNSON (VARIKKAPPALLIL)\nRESPONDENTS/STATE AND DEFACTO COMPLAINANT:\n1 STATE OF KERALA\nREPRESENTED BY PUBLIC PROSECUTOR,\nHIGH COURT OF KERALA, ERNAKULAM 682 031\n2 MUHAMMED IBRAHIM,\nAGED 34 YEARS,\nS/O. SHAHUL HAMEED,\n\nBlea\noa a\n[OF\nCRL.MC.NO. 8541 OF 2019 2 2020/KER/176\nA.P STREET, NAVAKKODE, KODUVAYUR,\nPALAKKAD 678 505\nR1 C.S.HRITHWIK-SR.G.P\nR2 BY ADV. UNNI SEBASTIAN KAPPEN\nTHIS CRIMINAL MISC. CASE HAVING COME UP FOR ADMISSION ON\n06.01.2020, THE COURT ON THE SAME DAY PASSED THE FOLLOWING:\n\nFane\nCRL.MC.NO. 8541 OF 2019 3 2020/KER/176\nORDER\nDated this the 06 day of January, 2020\n\nThe petitioners are accused in S.C.No. 6/2017 on the\nfile of the Additional Assistant Sessions Court, Palakkad for\nhaving allegedly committed offences punishable under Sections\n341, 324, 326, 435 and 308 read with Section 34 of the IPC. The\nonly injured is the 2\" respondent who has appeared through\ncounsel and filed affidavit to the effect that the matter has been\namicably settled with the petitioners and that he does not have\nany grievance. The injury sustained is not life threatening. The\npetitioners do not have any criminal antecedents. A report has\nbeen filed by the Investigating Officer through the learned Senior\nPublic Prosecutor to the effect.\n\nIn the result, the Crl.MC is allowed and the entire\nproceedings as against the petitioners herein in S.C.No. 6/2017\non the file of the Additional Assistant Sessions Court, Palakkad\nand Crime.No.603/2015 of Nenmara Police Station stand quashed\nunder Section 482 of the Cr.PC and the petitioner/accused are\ndischarged.\n\nSd/-\nASHOK MENON\nJUDGE\nasm\n\nEl: ro a\nCRL.MC.NO. 8541 OF 2019 4 2020/KER/176\nAPPENDIX\n\nEXHIBITS:\n\nANNEXURE A CERTIFIED COPY OF THE FINAL REPORT IN\nCRIME NO. 603/2015 OF NENMARA POLICE\nSTATION, PALAKKAD WHICH IS NOW PENDING\nAS S.C NO. 6/2017 OF THE COURT OF\nASSISTANT SESSIONS JUDGE (ADDITIONAL) ,\nPALAKKAD .\n\nANNEXURE B AFFIDAVIT SWORN BY THE 1ST RESPONDENT\nHEREIN EVIDENCING THE AFORESAID\nSETTLEMENT.\n\n// True Copy// PA to Judge\n\n"
}