{
    "case_id": "Crl.MC.No. 8063 of 2015",
    "court": "HIGH COURT OF KERALA AT ERNAKULAM\nPRESENT",
    "date": "4TH DAY OF JANUARY 2016",
    "judge": "B.KEMAL PASHA\nMONDAY",
    "petitioners": [
        "ACCUSED:",
        "SANTHOSH. V.R., AGED 45 YEARS,",
        "S/O RAMANKUTTY, VAYALIL HOUSE,",
        "PERUMALLOOR KARA, MUVATTUPUZHA,",
        "ERNAKULAM DISTRICT."
    ],
    "respondents": [
        "S/COMPLAINANTI/STATE:",
        "1. HYPSON ABRAHAM, S/O ABRAHAM,",
        "ALUMMOOTTIL HOUSE, PERUMBALLOOR,",
        "MUVATTUPUZHA, PIN-686 661.",
        "2. STATE OF KERALA,",
        "REPRESENTED BY S.I. OF POLICE,",
        "MUVATTUPUZHA POLICE STATION, MUVATTUPUZHA,"
    ],
    "sections": [],
    "outcome": "",
    "full_text": "BGR\n‘Teeter\npea\n2016/KER/69\nIN THE HIGH COURT OF KERALA AT ERNAKULAM\nPRESENT:\nTHE HONOURABLE MR. JUSTICE B.KEMAL PASHA\nMONDAY, THE 4TH DAY OF JANUARY 2016/14TH POUSHA, 1937\nCril.MC.No. 8063 of 2015 ()\nLP.NO. 23/2012 (ST. NO.3593/2008) OF JUDICIAL FIRST CLASS MAGISTRATE\nCOURT -!, MUVATTUPUZHA.\nPETITIONER/ACCUSED:\nSANTHOSH. V.R., AGED 45 YEARS,\nS/O RAMANKUTTY, VAYALIL HOUSE,\nPERUMALLOOR KARA, MUVATTUPUZHA,\nERNAKULAM DISTRICT.\nBY ADVS.SRI.GEO PAUL,\nSRLSANU MATHEW,\nSRILRADHIKA RAJASEKHARAN P.,\nSRI.C.R.PRAMOD,\nSRILS.ASHOK KUMAR.,\nSRI.LENIN P. SUKUMARAN.\nRESPONDENTS/COMPLAINANTI/STATE:\n1. HYPSON ABRAHAM, S/O ABRAHAM,\nALUMMOOTTIL HOUSE, PERUMBALLOOR,\nMUVATTUPUZHA, PIN-686 661.\n2. STATE OF KERALA,\nREPRESENTED BY S.I. OF POLICE,\nMUVATTUPUZHA POLICE STATION, MUVATTUPUZHA,\nBY THE PUBLIC PROSECUTOR,\nHIGH COURT OF KERALA, ERNAKULAM-682 031.\nR2 BY PUBLIC PROSECUTOR SMT.P. MAYA.\nTHIS CRIMINAL MISC. CASE HAVING COME UP FOR ADMISSION\nON 04-01-2016, THE COURT ON THE SAME DAY PASSED THE\nFOLLOWING:\nrs.\n\nBGR\n‘Teeter\npea\n2016/KER/69\nCrl.MC.No. 8063 of 2015\nAPPENDIX\nPETITIONER'S ANNEXURES:-\nANNEXURE A1: COPY OF THE B DIARY PROCEEDINGS IN L.P.NO.23/2012\n(S.T.NO.3593/2008) ON THE FILES OF THE JUDICIAL FIRST\nCLASS MAGISTRATE COURT I, MUVATTUPUZHA.\nRESPONDENT'S ANNEXURES:- NIL.\n/TTRUE COPY//\nP.S. TO JUDGE\nrs.\n\nBl\n\n| CIR SPER re\n2016/KER/69\n\nB. KEMAL PASHA, J.\nCril.M.C. No.8063 of 2015\nDated this the 4\" day of January, 2016\nORDER\nHeard learned counsel for the petitioner.\n\n2. The court below is directed to dispose of the\napplication seeking bail, if any filed by the petitioner, on his\nsurrender before the court below within 10 days from today,\npreferably on the date of filing itself.\n\nCrl.M.C. is disposed of as above.\n\nSd/-\n(B.KEMAL PASHA, JUDGE)\naks/04/01\n1/1 True Copy //\nPA to Judge\n\n"
}