{
    "case_id": "Crl.MC.No. 183 of 2015",
    "court": "HIGH COURT OF KERALA AT ERNAKULAM\nPRESENT",
    "date": "13TH DAY OF JANUARY 2015",
    "judge": "PUBAID\nTUESDAY",
    "petitioners": [
        "PETITIONER/2ND ACCUSED:",
        "HAMMED AGED 36 YEARS",
        "S/O ALI, OLASSERY NARAKKAT HOUSE, NADUVATTOM",
        "NORTH BEYPORE, KOZHIKODE DISTRICT."
    ],
    "respondents": [
        "RESPONDENTS/COMPLAINANT AND STATE:",
        "1. STATE OF KERALA",
        "THROUGH THE STATION HOUYSE OFFICER",
        "BEYPORE POLICE STATION, BEYPORE, KOZHIKODE",
        "REPRESENTED BY PUBLIC PROSECUTOR",
        "HIGH COURT OF KERALA, ERNAKULAM-682031.",
        "2. K.P.SALEEM",
        "S/O K.P.MAMMU, KALLIYATTU PARAMBU HOUSE",
        "PUTHALATH PARAMBA, THAVALAKULAM, BEYPORE VILLAGE",
        "KOZHIKODE-673015.",
        "R1 BY PUBLIC PROSECUTOR SMT. P. MAYA"
    ],
    "sections": [
        "323",
        "324\nIPC"
    ],
    "outcome": "ORDER\nThe petitioner herein is the original second accused in C.C\n\nNo.576/11 of the Judicial First Class Magistrate Court-V, Kozhikode.\nThe offences involved in the case are under Sections 323 and 324\nIPC. The said crime was registered on the complaint of one Saleem.\nThe other three accused in the case faced trial before the learned\nMagistrate in C.C No.576/2011, and obtained a judgment of\nacquittal on 28.1.2014, when the de facto complainant turned\nhostile to the prosecution during trial, in view of an amicable\nsettlement made by the parties out of court. The case against the\npetitioner herein was split up and refiled as C.C 188/2014. He now\nseeks orders quashing the prosecution on the ground that\ncontinuance of proceeding against him in the above circumstance\nwill not serve any purpose. The Annexure C Judgment in C.C\nNo.576/2011 shows that, when examined as the material witness\nin the said case, the de facto complainant Saleem did not in any\nmanner support the prosecution. He fully turned hostile in view of\nan amicable settkement made out of court. Definite it is that\n\nDaltea!\n2015/KER/1514\n\nCri. M.C No. 183 of 2015 2\ncontinuance of prosecution against the petitioner herein in the\nabove circumstance will not serve any purpose, because the\nprosecution cannot in any manner improve the case as against him,\nif the case goes to trial. Practically, such continuance will be a\nsheer waste of time.\n\nIn the result, this petition is allowed. The prosecution against\nthe petitioner in C.C No.188/2014 of the Judicial First Class\nMagistrate -V, Kozhikode will stand quashed",
    "full_text": "aes te fe]\noe\noe\nEla 43\n2015/KER/1514\nIN THE HIGH COURT OF KERALA AT ERNAKULAM\nPRESENT:\nTHE HONOURABLE MR. JUSTICE PUBAID\nTUESDAY, THE 13TH DAY OF JANUARY 2015/23RD POUSHA, 1936\nCrl.MC.No. 183 of 2015 ()\nIN CC 188/2014 of J.M.F.C.V,AOZHIKODE\nCRIME NO. 194/2011 OF BEYPORE POLICE STATION , KOZHIKODE\nPETITIONER(S)/PETITIONER/2ND ACCUSED:\nHAMMED AGED 36 YEARS\nS/O ALI, OLASSERY NARAKKAT HOUSE, NADUVATTOM\nNORTH BEYPORE, KOZHIKODE DISTRICT.\nBY ADV. SRI.P.DEEPAK\nRESPONDENT(S)/RESPONDENTS/COMPLAINANT AND STATE:\n1. STATE OF KERALA\nTHROUGH THE STATION HOUYSE OFFICER\nBEYPORE POLICE STATION, BEYPORE, KOZHIKODE\nREPRESENTED BY PUBLIC PROSECUTOR\nHIGH COURT OF KERALA, ERNAKULAM-682031.\n2. K.P.SALEEM\nS/O K.P.MAMMU, KALLIYATTU PARAMBU HOUSE\nPUTHALATH PARAMBA, THAVALAKULAM, BEYPORE VILLAGE\nKOZHIKODE-673015.\nR1 BY PUBLIC PROSECUTOR SMT. P. MAYA\nTHIS CRIMINAL MISC. CASE HAVING COME UP FOR ADMISSION ON 13-01-2015,\nTHE COURT ON THE SAME DAY PASSED THE FOLLOWING:\n\neel\nie\nLe\nlage 4\n2015/KER/I514\nCri. MiC.No. 183 of 2015 ()\nAPPENDIX\n\nPETITIONER(S)â€™ EXHIBITS\n\nANNEXURE A: A TRUE COPY OF THE FIRST INFORMATION REPORT IN CRIME NO:194\n\nOF 2011 OF BEYPORE POLICE STATION.\n\nANNEXURE B: A TRUE COPY OF THE FINAL REPORT FILED IN CRIME NO:194 OF 2011\n\nOF BEYPORE POLICE STATION.\n\nANNEXURE C: CERTIFIED COPY OF THE JUDGMENT DATED 28.1.2014 IN C.C.NO.576\n\nOF 2011 ON THE FILES OF THE JFCM-V, KOZHIKODE.\n\nANNEXURE D: CERTIFIED COPY OF THE DEPOSITION OF PW1 (2ND RESPONDENT\n\nHEREIN) IN C.C.NO:576 OF 2011 ON THE FILES OF THE JFCM-V, KOZHIKODE.\n\nRESPONDENT(S)' EXHIBITS: NIL\n\n/TRUE COPY/\n\nPATO JUDGE\n\nsab\n\no\n2015/KER/1514\nP.UBAID, J.\nCri. M.C No. 183 of 2015\nDated this the 13\" day of January, 2015.\nORDER\nThe petitioner herein is the original second accused in C.C\n\nNo.576/11 of the Judicial First Class Magistrate Court-V, Kozhikode.\nThe offences involved in the case are under Sections 323 and 324\nIPC. The said crime was registered on the complaint of one Saleem.\nThe other three accused in the case faced trial before the learned\nMagistrate in C.C No.576/2011, and obtained a judgment of\nacquittal on 28.1.2014, when the de facto complainant turned\nhostile to the prosecution during trial, in view of an amicable\nsettlement made by the parties out of court. The case against the\npetitioner herein was split up and refiled as C.C 188/2014. He now\nseeks orders quashing the prosecution on the ground that\ncontinuance of proceeding against him in the above circumstance\nwill not serve any purpose. The Annexure C Judgment in C.C\nNo.576/2011 shows that, when examined as the material witness\nin the said case, the de facto complainant Saleem did not in any\nmanner support the prosecution. He fully turned hostile in view of\nan amicable settkement made out of court. Definite it is that\n\nDaltea!\n2015/KER/1514\n\nCri. M.C No. 183 of 2015 2\ncontinuance of prosecution against the petitioner herein in the\nabove circumstance will not serve any purpose, because the\nprosecution cannot in any manner improve the case as against him,\nif the case goes to trial. Practically, such continuance will be a\nsheer waste of time.\n\nIn the result, this petition is allowed. The prosecution against\nthe petitioner in C.C No.188/2014 of the Judicial First Class\nMagistrate -V, Kozhikode will stand quashed under Section 482\nCr.P.C. Accordingly, the petitioner will stand released from\nprosecution and the bail bond, if any, executed by him will stand\ndischarged.\n\nP.UBAID,\nJUDGE\nsab\n\n"
}