{
    "case_id": "",
    "court": "HIGH COURT OF KERALA AT ERNAKULAM\nPRESENT",
    "date": "2ND DAY OF JANUARY 2014",
    "judge": "HARUN-UL-RASHID\nTHURSDAY",
    "petitioners": [
        "(S) /ACCUSED:",
        "S.KUMAR AGED 82 YEARS",
        "$/O.LATE P.SUBRAMANIAN, T C 17/1760,",
        "PURA - 8 \"REMANIAM\" NETAJI ROAD, POOJAPPURA",
        "THIRUVANANTHAPURAM."
    ],
    "respondents": [
        "/COMPLAINANT :",
        "STATE OF KERALA",
        "REPRESENTED BY THE PUBLIC PROSECUTOR",
        "HIGH COURT OF KERALA AT ERNAKULAM, COCHIN - 31."
    ],
    "sections": [
        "205 Cr"
    ],
    "outcome": "",
    "full_text": "pc\ngrepeahPeas\nBas\n2014/KER/209\nIN THE HIGH COURT OF KERALA AT ERNAKULAM\nPRESENT:\nTHE HONOURABLE MR.JUSTICE HARUN-UL-RASHID\nTHURSDAY, THE 2ND DAY OF JANUARY 2014/12TH POUSHA, 1935\nCr1.MC.No. 22 of 2014 ()\nAGAINST THE ORDER/JUDGMENT IN CC 228/2008 of J.M.F.C.-II, CHERTHALA\nDATED 02-12-2013\nAGAINST THE ORDER/JUDGMENT IN Crl.Rev.Pet 1017/2013 of HIGH COURT OF\nKERALA DATED 29-05-2013\nPETITIONER (S) /ACCUSED:\nS.KUMAR AGED 82 YEARS\n$/O.LATE P.SUBRAMANIAN, T C 17/1760,\nPURA - 8 \"REMANIAM\" NETAJI ROAD, POOJAPPURA\nTHIRUVANANTHAPURAM.\nBY ADVS.SRI.V.JOHN S. RALPH\nSMT .PREETHY KARUNAKARAN\nSRI.K.J.JOSEPH (ERNAKULAM)\nSRI.V.JOHN THOMAS\nRESPONDENT /COMPLAINANT :\nSTATE OF KERALA\nREPRESENTED BY THE PUBLIC PROSECUTOR\nHIGH COURT OF KERALA AT ERNAKULAM, COCHIN - 31.\nBY PUBLIC PROSECUTOR SMT.S.HYMA\nTHIS CRIMINAL MISC. CASE HAVING COME UP FOR ADMISSION ON\n02-01-2014, THE COURT ON THE SAME DAY PASSED THE FOLLOWING:\n\npc\npena\nees\n2014/KER/209\nCr1.MC.No. 22 of 2014 ()\nAPPENDIX\nPETITIONER(S)' EXHIBITS\nANNEXURE-1: TRUE COPY OF THE ORDER DATED 29.5.2013 IN CRL.R.P\n1017/2013 OF THE HON'BLE HIGH COURT OF KERALA.\nANNEXURE-2: CERTIFIED COPY OF THE ORDER DATED 2.12.2013 ON THE FILE\nOF THE JFCM COURT II, CHERTHALA.\nANNEXURE-3: TRUE COPY OF THE MEDICAL CERTIFICATE DATED 19.6.2013\nRESPONDENT (S)' EXHIBITS : NIL\n/TRUE COPY/\nP. A. TO JUDGE\nPn\n\npou\n2014/KER/209\nHARUN-UL-RASHID, J.\nDated this the 2 day of January, 2014\nORDER\n\nThis Crl.M.C is filed seeking to set aside the order dated\n02.12.2013 in C.M.P.No.4939/2013 in C.C.No.228/08 on the file\nof the Judicial First Class Magistrate Court -IIl, Cherthala.\n\n2. The petitioner submitted an application before the\ncourt below for exempting him from personal appearance,\nconsidering his health conditions. The learned Magistrate\ndismissed the petition finding that, the above case being a\nwarrant trial, the application filed under section 205 Cr.P.C. is\napplicable only in summons cases. The court below granted\nsufficient time for appearance of the petitioner.\n\n3. The petitioner is aged 82 and it is submitted that he is\na bedridden and undergoing treatment in PRS Hospital,\nThiruvananthapuram. He is advised by his physician to avoid\nany travelling. The petitioner produced copy of the medical\ncertificate as Annexure 3. This Court in Crl.R.P.No.1017/2013\nobserved that, the petitioner is an 83 year old person suffering\nfrom serious diseases and that, it is a good ground for seeking\nexemption from appearance.\n\nel\na aie\napa\n2014/KER/209\nCrl.M.C.No.22 of 2014\n2\nIn the facts and circumstances, this Court is of the view\nthat the petitioner is entitled to the relief sought for. Hence,\nthis Crl.M.C is allowed. The order dated 02.12.2013 marked as\nAnnexure 2 is set aside. The petitioner is exempted from\npersonal appearance except on postings where his presence is\nabsolutely necessary.\nSd/-\nHARUN-UL-RASHID, JUDGE.\nAV\n\n"
}