{
    "case_id": "Crl.MC.No. 6938 of 2017",
    "court": "HIGH COURT OF KERALA AT ERNAKULAM\nPRESENT",
    "date": "7TH DAY OF DECEMBER 2017",
    "judge": "B.KEMATL PASHA\nTHURSDAY",
    "petitioners": [
        "(S) /ACCUSED NO.2:",
        "SREEKUMAR,",
        "AGED 53 YEARS, S/O. PARAMESWARAN ASARI,",
        "VAVALANKATTUVILA VEEDU,",
        "CHANKAI, KANJIKODE.P.O, KANIYAKUMARI DISTRICT, TAMILNADU."
    ],
    "respondents": [
        "(S) /STATE & DEFACTO COMPLAINANT:",
        "1. THE STATE OF KERALA,",
        "REPRESENTED BY THE PUBLIC PROSECUTOR,",
        "HIGH COURT OF KERALA, ERNAKULAM, KOCHI-682031.",
        "2. THE ASSISTANT COMMISSIONER OF POLICE,",
        "CRIME DETACHMENT, THIRUVANANTHAPURAM DISTRICT-695001.",
        "R BY PUBLIC PROSECUTOR SRI.C.S.HRITWICK"
    ],
    "sections": [
        "465",
        "468",
        "471 IPC read with Section\n34 IPC",
        "Section 12"
    ],
    "outcome": "",
    "full_text": "Beas)\nPats ache\nP Ce Cy\nDina\n2017/KER/49554\nIN THE HIGH COURT OF KERALA AT ERNAKULAM\nPRESENT:\nTHE HONOURABLE MR. JUSTICE B.KEMATL PASHA\nTHURSDAY, THE 7TH DAY OF DECEMBER 2017/16TH AGRAHAYANA, 1939\nCrl.MC.No. 6938 of 2017 ()\ncc 175/2009 of C.J.M., THIRUVANANDAPURAM\nCRIME NO. 275/1996 OF VALIYATHURA POLICE STATION, THIRUVANANDAPURAM\nPETITIONER (S) /ACCUSED NO.2:\nSREEKUMAR,\nAGED 53 YEARS, S/O. PARAMESWARAN ASARI,\nVAVALANKATTUVILA VEEDU,\nCHANKAI, KANJIKODE.P.O, KANIYAKUMARI DISTRICT, TAMILNADU.\nBY ADV. SRI.RAJESH P.NAIR\nRESPONDENT (S) /STATE & DEFACTO COMPLAINANT:\n1. THE STATE OF KERALA,\nREPRESENTED BY THE PUBLIC PROSECUTOR,\nHIGH COURT OF KERALA, ERNAKULAM, KOCHI-682031.\n2. THE ASSISTANT COMMISSIONER OF POLICE,\nCRIME DETACHMENT, THIRUVANANTHAPURAM DISTRICT-695001.\nR BY PUBLIC PROSECUTOR SRI.C.S.HRITWICK\nTHIS CRIMINAL MISC. CASE HAVING COME UP FOR ADMISSION ON\n07-12-2017, THE COURT ON THE SAME DAY PASSED THE FOLLOWING:\n\nBeas)\nat: age\nerent\n2017/KER/49554\nCr1.MC.No. 6938 of 2017 ()\nAPPENDIX\nPETITIONER (S)' EXHIBITS\nANNEXURE A CERTIFIED COPY OF THE FINAL REPORT IN C.C.NO.175/2009\nIN CRIME NO.275/1996 OF VALIYATHURA POLICE STATION.\nRESPONDENT'S EXHIBITS: NIL\nTRUE COPY\nPA TO JUDGE\nScl.\n\n2017/KER/49554\nB. KEMAL PASHA, J.\nDated this the 7‚Äù day of December, 2017\nORDER\n\nThe petitioner is the second accused in C.C.No.175 of\n2009 of the Chief Judicial Magistrate's Court,\nThiruvananthapuram. Based on Annexure-A final report in\nCrime No.275 of 1996 of Valiyathura Police Station for the\noffences punishable and Section 465, 468, 471 IPC r/w Section\n34 IPC and Section 12 (1) (b) r/w Section 3 of the Passport\nAct, 1967.\n\n2. According to the petitioner, the first accused had\ndone the entire acts, and he had pleaded guilty before the\ncourt below, and thereby he was convicted and sentenced.\nFurther, according to the learned counsel for the petitioner,\nwhen the first accused has been convicted and sentenced, the\ncontinued prosecution of the petitioner in C.C.No.175 of 2009\nis quite unnecessary.\n\n3. The arguments forwarded by the learned counsel for\n\nPLease\naa\n2017/KER/49554\nCri.M.C. No.6938 of 2017\n-2-\nthe petitioner that the offences alleged against the petitioner\nare not legally sustainable against the petitioner, does not\nseem to be correct. If the allegations are true, it may invite\nthe offences alleged. The present stage is to premature to\nconclude that the petitioner has not committed the offences\nalleged against him. Being an old matter, the court below\nshall take up the matter out of turn and shall dispose it of,\nexpeditiously, at any rate within a period of six months from\nthe date of receipt of a copy of this order.\nWith the said direction, this Crl.M.C. is dismissed.\nSd/-\nB.KEMAL PASHA\nJUDGE\n\nScl/07.12.2017\n\n"
}