{
    "case_id": "",
    "court": "HIGH COURT OF KERALA AT ERNAKULAM\nPRESENT",
    "date": "8TH DAY OF JANUARY 2015",
    "judge": "B.KEMAL PASHA\nTHURSDAY",
    "petitioners": [
        "ACCUSED:"
    ],
    "respondents": [
        "STATE & DEFACTO COMPLAINANT:"
    ],
    "sections": [],
    "outcome": "",
    "full_text": "4 eat â€˜\nEe] eae\n2015/KER/802\nIN THE HIGH COURT OF KERALA AT ERNAKULAM\nPRESENT:\nTHE HONOURABLE MR. JUSTICE B.KEMAL PASHA\nTHURSDAY, THE 8TH DAY OF JANUARY 2015/18TH POUSHA, 1936\nCri.MC.No. 7180 of 2014 ()\n\nCRIME NO. 351/2014 OF ALATHUR POLICE STATION , PALAKKAD DISTRICT\nPETITIONER/ACCUSED:\n\nSHOWKATHALI, AGED 24 YEARS,S/O.IBRAHIM,\n\nNJARAKKODU HOUSE, PATHANAPURAM,\n\nALATHUR TALUK, PALAKKAD DISTRICT.\n\nBY ADV. SRILNIREESH MATHEW\nRESPONDENT(S)/STATE & DEFACTO COMPLAINANT:\n\n1. STATE OF KERALA,\nREPRESENTED BY PUBLIC PROSECUTOR,\nHIGH COURT OF KERALA, ERNAKULAM.PIN-682 031\n2. SHAJITHA, AGED 24 YEARS,\n\nD/O.ALIYAR, NJARAKKODU, KAVASSERY,\n\nALATHUR, PALAKKAD DISTRICT. PIN-678 001\n\nR1 BY PUBLIC PROSECUTOR SRI.JIBU P. THOMAS\n\nR2 BY ADV. SRILN P PRAJEESH\n\nTHIS CRIMINAL MISC. CASE HAVING COME UP FOR ADMISSION\n\nON 08-01-2015, THE COURT ON THE SAME DAY PASSED THE FOLLOWING:\nsts\n\nBE ay mn\n2015/KER/802\nB.KEMAL PASHA, J.\nCrl.M.C.No.7180 of 2014\nDated this the 8\" day of January 2015\nORDER\nLearned counsel for the petitioner seeks permission to\nwithdraw this Crl.M.C. Permission is granted. Accordingly, this\nCrl.M.C. is dismissed as withdrawn.\nSd/-\nB.KEMAL PASHA,\nJUDGE\ndl\n1] TRUE COPY //\nPA to Judge\n\n"
}