{
    "case_id": "",
    "court": "HIGH COURT OF KERALA AT ERNAKULAM\nPRESENT\nTHE HONOURABLE MR",
    "date": "6TH DAY OF JANUARY 2020",
    "judge": "P.B.SURESH KUMAR\nMONDAY",
    "petitioners": [
        "S/ACCUSED 1 TO 12:",
        "1 JINS JOSE,",
        "AGED 32 YEARS, S/O.ANNAMMA JOSEPH, 12/77,",
        "AKKARAYIL, CHENGALAM.",
        "2 BABU MATHEW,",
        "AGED 62 YEARS, S/O.THOMAS MATHEW,",
        "KOCHUPARAMBIL, KOPRAKALAM, NARIANANI.P.O.,",
        "KANJIRAPPALLY .",
        "3 RATHEESH MOHAN,",
        "AGED 36 YEARS, S/O.C.N.MOHANAN NAIR,",
        "VEETTIYANKAL, THEKKETHUKAVALA, CHIRAKKADAVU,",
        "KOTTAYAM.",
        "4 BENNY CHACKO,",
        "AGED 50 YEARS, S/O.CHACKO, VEZHAMBASSERIL (H),",
        "VANCHIMALA.P.O., ELAMGULAM VILLAGE, ELIKKULAM,",
        "KOTTAYAM .",
        "5 V.C.BABY,",
        "AGED 57 YEARS, S/O.CHACKO, VEZHAMBASSERIL (H),",
        "VANCHIMALA.P.O., ELAMGULAM VILLAGE, ELIKKULAM,",
        "KOTTAYAM.",
        "6 EPPACHAN ANTONY,",
        "AGED 57 YEARS, S/O.ANTONY, VEZHAMBASSERIL,",
        "KOORALI, ELAMGULAM.P.O., KOTTAYAM."
    ],
    "respondents": [
        "S /COMPLAINT :",
        "1 VARKEY GEORGE,",
        "AGED 59 YEARS, S/O.VARKEY, CHERIPURATH HOUSE,",
        "KOORALI, ELANKULAM, KOTTAYAM-686522.",
        "2 GRACYKUTTY,",
        "AGED 57 YEARS, W/O.VARKEY GEORGE,",
        "CHERIPURATH HOUSE, KOORALI, ELANKULAM,",
        "KOTTAYAM- 686522."
    ],
    "sections": [
        "482 of\nthe Code of Criminal Procedure for quashing Annexure A2 final\nreport",
        "all further proceedings pursuant thereto",
        "now\npending as C"
    ],
    "outcome": "ORDER IN CC NO.583/2015 OF JUDICIAL\nMAGISTRATE OF FIRST CLASS -II, KANJIRAPPALLY\nCRIME NO.830/2015 OF PONKUNNAM POLICE STATION, KOTTAYAM\nPETITIONERS/ACCUSED 1 TO 12:\n1 JINS JOSE,\nAGED 32 YEARS, S/O.ANNAMMA JOSEPH, 12/77,\nAKKARAYIL, CHENGALAM.\n2 BABU MATHEW,\nAGED 62 YEARS, S/O.THOMAS MATHEW,\nKOCHUPARAMBIL, KOPRAKALAM, NARIANANI.P.O.,\nKANJIRAPPALLY .\n3 RATHEESH MOHAN,\nAGED 36 YEARS, S/O.C.N.MOHANAN NAIR,\nVEETTIYANKAL, THEKKETHUKAVALA, CHIRAKKADAVU,\nKOTTAYAM.\n4 BENNY CHACKO,\nAGED 50 YEARS, S/O.CHACKO, VEZHAMBASSERIL (H),\nVANCHIMALA.P.O., ELAMGULAM VILLAGE, ELIKKULAM,\nKOTTAYAM .\n5 V.C.BABY,\nAGED 57 YEARS, S/O.CHACKO, VEZHAMBASSERIL (H),\nVANCHIMALA.P.O., ELAMGULAM VILLAGE, ELIKKULAM,\nKOTTAYAM.\n6 EPPACHAN ANTONY,\nAGED 57 YEARS, S/O.ANTONY, VEZHAMBASSERIL,\nKOORALI, ELAMGULAM.P.O., KOTTAYAM.\n\nBlan\n= ~\nil ‘ ia\n2020/KER/258\nCrl.M.C.No.9258 of 2019 2\n7 SABIN EAPPEN,\nAGED 33 YEARS, S/O.EAPPACHAN ANTONY,\nVEZHAMBASSERIL, KOORALI, ELAMGULAM.P.O.,\nKOTTAYAM.\n8 BIBIN JOSE,\nAGED 32 YEARS, S/O.V.C.JOSE, VEZHAMBASSERIL\nHOUSE, THAMPALAKADU.P.O., KANJIRAPPALLY,\nKOTTAYAM.\n9 JOSE ANTONY,\nAGED 48 YEARS, S/O.ANTONY CHACKO,\nVEZHAMBASSERIL, PANAMATTAM, KURALLY.P.O.,\nELAMGULAM, KOTTAYAM.\n10 THOMAS .V.T.,\nAGED 60 YEARS, S/O.THOMAS, VEZHAMBASSERIL,\nKOORALI.P.O., ELAMGULAM, KOTTAYAM.\n11 JAISON T JOSE,\nAGED 36 YEARS, S/O.JOSEPH, THANNICKAL,\nCHENGALAM.P.O., ELAMGULAM, KOTTAYAM.\n12 K.N.MOHANAN,\nAGED 55 YEARS, S/O.NARAYANAN, KARIVATTU,\nVANCHIMALA.P.O., ELIKKULAM, KOTTAYAM.\nBY ADV. SRI.I.DINESH MENON\nRESPONDENTS /COMPLAINT :\n1 VARKEY GEORGE,\nAGED 59 YEARS, S/O.VARKEY, CHERIPURATH HOUSE,\nKOORALI, ELANKULAM, KOTTAYAM-686522.\n2 GRACYKUTTY,\nAGED 57 YEARS, W/O.VARKEY GEORGE,\nCHERIPURATH HOUSE, KOORALI, ELANKULAM,\nKOTTAYAM- 686522.\n\nBaan\n= .\nil ‘ iat\n2020/KER/258\nCrl.M.C.No.9258 of 2019 3\n3 STATE OF KERALA,\nREPRESENTED BY PUBLIC PROSECUTOR, HIGH COURT\nOF KERALA, ERNAKULAM-682031, THROUGH SUB\nINSPECTOR OF POLICE, PONKUNNAM POLICE STATION,\nKOTTAYAM DISTRICT-686506.\nR1-2 BY ADV. L.RAJESH NARAYAN\nSRI. TR.RENJITH PP\nTHIS CRIMINAL MISC. CASE HAVING BEEN FINALLY HEARD ON\n06.01.2020, THE COURT ON THE SAME DAY PASSED THE\nFOLLOWING :\n\n[BlSene\n2020/KER/258\nCrl.M.C.No.9258 of 2019 4\nCri.M.C. No.9258 of 2019\nORDER\n\nThis is a proceedings instituted under Section 482 of\nthe Code of Criminal Procedure for quashing Annexure A2 final\nreport and all further proceedings pursuant thereto, now\npending as C.C.No.583 of 2015 on the files of the Court of the\nJudicial Magistrate of First Class - Il, Kanjirappally against the\npetitioners.\n\n2. The petitioners are accused Nos.1 to 12 in the\nsaid case. The case was one instituted at the instance of\nrespondents 1 and 2 under Sections 143, 149, 427, 447 and\n506 (ii) of the Indian Penal Code.\n\n3. It is seen that the petitioners and respondents 1\nand 2 have settled their disputes, and affidavits to that effect\nhave been filed by respondents 1 and 2 as Annexure A3 series\nto the effect that they do not intend to pursue the matter\nfurther.\n\n4. The learned counsel for respondents 1 and 2\naffirms that Annexure A3 series affidavits are affidavits sworn\n\nPelee aed\n_\nSkat\n2020/KER/258\nCrl.M.C.No.9258 of 2019 5\nto by respondents 1 and 2, and submits that they have no\nobjection in granting the relief sought for by the petitioners.\n\n5. In the light of the decisions of the Apex Court in\nGian singh v. State of Punjab, (2012) 10 SCC 303 and\nNarinder singh v. State of Punjab, (2014) 6 SCC 466, | am\nof the view that this is an appropriate case where this court has\nto invoke the jurisdiction under Section 482 of the Code of\nCriminal Procedure to quash the proceedings against the\npetitioners.\n\nIn the result, the Crl.M.C. Is allowed and Annexure A2\nfinal report and all further proceedings pursuant thereto against\nthe petitioners, pending as C.C.No.583 of 2015 on the files of\nthe Court of the Judicial Magistrate of First Class - Il,\nKanjirappally are quashed",
    "full_text": "Blan\n= ~\nrc ent\n2020/KER/258\nIN THE HIGH COURT OF KERALA AT ERNAKULAM\nPRESENT\nTHE HONOURABLE MR. JUSTICE P.B.SURESH KUMAR\nMONDAY, THE O6TH DAY OF JANUARY 2020 / 16TH POUSHA, 1941\nCr1.MC.No.9258 OF 2019(F)\nAGAINST THE ORDER IN CC NO.583/2015 OF JUDICIAL\nMAGISTRATE OF FIRST CLASS -II, KANJIRAPPALLY\nCRIME NO.830/2015 OF PONKUNNAM POLICE STATION, KOTTAYAM\nPETITIONERS/ACCUSED 1 TO 12:\n1 JINS JOSE,\nAGED 32 YEARS, S/O.ANNAMMA JOSEPH, 12/77,\nAKKARAYIL, CHENGALAM.\n2 BABU MATHEW,\nAGED 62 YEARS, S/O.THOMAS MATHEW,\nKOCHUPARAMBIL, KOPRAKALAM, NARIANANI.P.O.,\nKANJIRAPPALLY .\n3 RATHEESH MOHAN,\nAGED 36 YEARS, S/O.C.N.MOHANAN NAIR,\nVEETTIYANKAL, THEKKETHUKAVALA, CHIRAKKADAVU,\nKOTTAYAM.\n4 BENNY CHACKO,\nAGED 50 YEARS, S/O.CHACKO, VEZHAMBASSERIL (H),\nVANCHIMALA.P.O., ELAMGULAM VILLAGE, ELIKKULAM,\nKOTTAYAM .\n5 V.C.BABY,\nAGED 57 YEARS, S/O.CHACKO, VEZHAMBASSERIL (H),\nVANCHIMALA.P.O., ELAMGULAM VILLAGE, ELIKKULAM,\nKOTTAYAM.\n6 EPPACHAN ANTONY,\nAGED 57 YEARS, S/O.ANTONY, VEZHAMBASSERIL,\nKOORALI, ELAMGULAM.P.O., KOTTAYAM.\n\nBlan\n= ~\nil ‘ ia\n2020/KER/258\nCrl.M.C.No.9258 of 2019 2\n7 SABIN EAPPEN,\nAGED 33 YEARS, S/O.EAPPACHAN ANTONY,\nVEZHAMBASSERIL, KOORALI, ELAMGULAM.P.O.,\nKOTTAYAM.\n8 BIBIN JOSE,\nAGED 32 YEARS, S/O.V.C.JOSE, VEZHAMBASSERIL\nHOUSE, THAMPALAKADU.P.O., KANJIRAPPALLY,\nKOTTAYAM.\n9 JOSE ANTONY,\nAGED 48 YEARS, S/O.ANTONY CHACKO,\nVEZHAMBASSERIL, PANAMATTAM, KURALLY.P.O.,\nELAMGULAM, KOTTAYAM.\n10 THOMAS .V.T.,\nAGED 60 YEARS, S/O.THOMAS, VEZHAMBASSERIL,\nKOORALI.P.O., ELAMGULAM, KOTTAYAM.\n11 JAISON T JOSE,\nAGED 36 YEARS, S/O.JOSEPH, THANNICKAL,\nCHENGALAM.P.O., ELAMGULAM, KOTTAYAM.\n12 K.N.MOHANAN,\nAGED 55 YEARS, S/O.NARAYANAN, KARIVATTU,\nVANCHIMALA.P.O., ELIKKULAM, KOTTAYAM.\nBY ADV. SRI.I.DINESH MENON\nRESPONDENTS /COMPLAINT :\n1 VARKEY GEORGE,\nAGED 59 YEARS, S/O.VARKEY, CHERIPURATH HOUSE,\nKOORALI, ELANKULAM, KOTTAYAM-686522.\n2 GRACYKUTTY,\nAGED 57 YEARS, W/O.VARKEY GEORGE,\nCHERIPURATH HOUSE, KOORALI, ELANKULAM,\nKOTTAYAM- 686522.\n\nBaan\n= .\nil ‘ iat\n2020/KER/258\nCrl.M.C.No.9258 of 2019 3\n3 STATE OF KERALA,\nREPRESENTED BY PUBLIC PROSECUTOR, HIGH COURT\nOF KERALA, ERNAKULAM-682031, THROUGH SUB\nINSPECTOR OF POLICE, PONKUNNAM POLICE STATION,\nKOTTAYAM DISTRICT-686506.\nR1-2 BY ADV. L.RAJESH NARAYAN\nSRI. TR.RENJITH PP\nTHIS CRIMINAL MISC. CASE HAVING BEEN FINALLY HEARD ON\n06.01.2020, THE COURT ON THE SAME DAY PASSED THE\nFOLLOWING :\n\n[BlSene\n2020/KER/258\nCrl.M.C.No.9258 of 2019 4\nCri.M.C. No.9258 of 2019\nORDER\n\nThis is a proceedings instituted under Section 482 of\nthe Code of Criminal Procedure for quashing Annexure A2 final\nreport and all further proceedings pursuant thereto, now\npending as C.C.No.583 of 2015 on the files of the Court of the\nJudicial Magistrate of First Class - Il, Kanjirappally against the\npetitioners.\n\n2. The petitioners are accused Nos.1 to 12 in the\nsaid case. The case was one instituted at the instance of\nrespondents 1 and 2 under Sections 143, 149, 427, 447 and\n506 (ii) of the Indian Penal Code.\n\n3. It is seen that the petitioners and respondents 1\nand 2 have settled their disputes, and affidavits to that effect\nhave been filed by respondents 1 and 2 as Annexure A3 series\nto the effect that they do not intend to pursue the matter\nfurther.\n\n4. The learned counsel for respondents 1 and 2\naffirms that Annexure A3 series affidavits are affidavits sworn\n\nPelee aed\n_\nSkat\n2020/KER/258\nCrl.M.C.No.9258 of 2019 5\nto by respondents 1 and 2, and submits that they have no\nobjection in granting the relief sought for by the petitioners.\n\n5. In the light of the decisions of the Apex Court in\nGian singh v. State of Punjab, (2012) 10 SCC 303 and\nNarinder singh v. State of Punjab, (2014) 6 SCC 466, | am\nof the view that this is an appropriate case where this court has\nto invoke the jurisdiction under Section 482 of the Code of\nCriminal Procedure to quash the proceedings against the\npetitioners.\n\nIn the result, the Crl.M.C. Is allowed and Annexure A2\nfinal report and all further proceedings pursuant thereto against\nthe petitioners, pending as C.C.No.583 of 2015 on the files of\nthe Court of the Judicial Magistrate of First Class - Il,\nKanjirappally are quashed.\n\nSd/-\nP.B.SURESH KUMAR, JUDGE.\nYKB\n\nBlan\nee ce\ni ‘ iy\n2020/KER/258\nCrl.M.C.No.9258 of 2019 6\nAPPENDIX\nPETITIONER'S/S EXHIBITS:\nANNEXURE Al TRUE COPY OF THE FIR NO.830/2015 DATED\n6.7.2015.\nANNEXURE A2 TRUE COPY OF THE FINAL REPORT DATED\n23.10.2017.\nANNEXURE A3 TRUE COPY OF THE AFFIDAVIT DATED\n12.12.2019.\nRESPONDENT'S/S EXHIBITS:\nNIL\n//TRUE coPpy//\nPA TO JUDGE\n\n"
}