{
    "case_id": "Crl.MC.No.8745 OF 2019",
    "court": "HIGH COURT OF KERALA AT ERNAKULAM\nPRESENT\nTHE HONOURABLE MR",
    "date": "07TH DAY OF JANUARY 2020",
    "judge": "ASHOK MENON\nTUESDAY",
    "petitioners": [
        "ACCUSED :",
        "AYOOB",
        "AGED 34 YEARS, S/O HUMZA, ERUMBAN HOUSE,",
        "CHIRAPILPARA, VALIYORA, VENGARA,",
        "MALAPPURAM- 676 304."
    ],
    "respondents": [
        "S/STATE/DEFACTO COMPLAINANTS:",
        "1 STATE OF KERALA",
        "REPRESENTED BY THE PUBLIC PROSECUTOR ,",
        "HIGH COURT OF KERALA, ERNAKULAM.",
        "2 ALT AKBAR",
        "AGED 32 YEARS",
        "S/O SAIDALAVI, MALIYEKAL HOUSE, PARAMBIL PARA,",
        "VALIYORA, MALAPPURAM , PIN- 676 304.",
        "3 HYDER ALI",
        "AGED 33 YEARS",
        "S/O SAIDALAVI, MALIYEKAL HOUSE, PARAMBIL PARA,",
        "VALIYORA, MALAPPURAM , PIN- 676 304.",
        "R2-3 BY ADV. C.T.BASHEER"
    ],
    "sections": [
        "143",
        "147",
        "148",
        "323",
        "324 read with Section 149 of the IPC"
    ],
    "outcome": "ORDER/JUDGMENT IN LP 82/2019 OF JUDICIAL\nMAGISTRATE OF FIRST CLASS ,MALAPPURAM\nCRIME NO.942/2015 OF Vengara Police Station , Malappuram\nPETITIONER/ACCUSED :\nAYOOB\nAGED 34 YEARS, S/O HUMZA, ERUMBAN HOUSE,\nCHIRAPILPARA, VALIYORA, VENGARA,\nMALAPPURAM- 676 304.\nBY ADV. SRI.SEBIN THOMAS\nRESPONDENTS/STATE/DEFACTO COMPLAINANTS:\n1 STATE OF KERALA\nREPRESENTED BY THE PUBLIC PROSECUTOR ,\nHIGH COURT OF KERALA, ERNAKULAM.\n2 ALT AKBAR\nAGED 32 YEARS\nS/O SAIDALAVI, MALIYEKAL HOUSE, PARAMBIL PARA,\nVALIYORA, MALAPPURAM , PIN- 676 304.\n3 HYDER ALI\nAGED 33 YEARS\nS/O SAIDALAVI, MALIYEKAL HOUSE, PARAMBIL PARA,\nVALIYORA, MALAPPURAM , PIN- 676 304.\nR2-3 BY ADV. C.T.BASHEER\nSRI. C.S.HRITHWIK, SR.PP\nTHIS CRIMINAL MISC. CASE HAVING COME UP FOR ADMISSION\nON 07.01.2020, THE COURT ON THE SAME DAY PASSED THE\nFOLLOWING:\n\nEee\nBie\n2020/KER/543\nCrl.MC.No.8745 OF 2019(C)\n2\nORDER\nDated this the 7th day of January 2020\n\nThe petitioner is the 6\" accused in\nCrime No.942/2015 of Vengara Police Station,\nfor having allegedly committed offences\npunishable under Sections 143, 147, 148, 323,\n324 r/w Section 149 of the IPC.\n\n2. The parent case was taken on the file as\nCC No.1781/2015 on the file of the Judicial\nFirst Class Magistrate Court, Malappuram. The\npetitioner was absconding and the others faced\ntrial, and vide judgment at Annexure-III, all\nthe accused who faced trial were acquitted and\nthe case against the petitioner and 4 accused\nwas split up and refiled as CC No.68/2018.\nPresently, the case against the petitioner is\npending as LP No.82/2019 on the files of the\nsame court.\n\n_\nBee\n2020/KER/543\nCrl.MC.No.8745 OF 2019(C)\n3\n\n3. Respondent Nos.2 and 3, who are the\ndefacto complainant and injured, have\nappeared through counsel and filed affidavits\nto the effect that the matter has been amicably\nsettled with the petitioner and that they do\nnot have any grievance against him. A report\nhas been called for from the Investigating\nOfficer through the senior Public Prosecutor.\nThere is no public interest involved.\n\nIn the result the Crl.M.C is allowed, and\nthe entire proceedings in Crime No.942/2015 of\nVengara Police Station, pending against the\npetitioner as LP No.82/2019 on the file of the\nJudicial First Class Magistrate Court,\nMalappuram, stands quashed",
    "full_text": "Piste\nFae Rea\neae\nBaer\n2020/KER/543\nIN THE HIGH COURT OF KERALA AT ERNAKULAM\nPRESENT\nTHE HONOURABLE MR. JUSTICE ASHOK MENON\nTUESDAY, THE 07TH DAY OF JANUARY 2020 / 17TH POUSHA, 1941\nCr1.MC.No.8745 OF 2019(C)\nAGAINST THE ORDER/JUDGMENT IN LP 82/2019 OF JUDICIAL\nMAGISTRATE OF FIRST CLASS ,MALAPPURAM\nCRIME NO.942/2015 OF Vengara Police Station , Malappuram\nPETITIONER/ACCUSED :\nAYOOB\nAGED 34 YEARS, S/O HUMZA, ERUMBAN HOUSE,\nCHIRAPILPARA, VALIYORA, VENGARA,\nMALAPPURAM- 676 304.\nBY ADV. SRI.SEBIN THOMAS\nRESPONDENTS/STATE/DEFACTO COMPLAINANTS:\n1 STATE OF KERALA\nREPRESENTED BY THE PUBLIC PROSECUTOR ,\nHIGH COURT OF KERALA, ERNAKULAM.\n2 ALT AKBAR\nAGED 32 YEARS\nS/O SAIDALAVI, MALIYEKAL HOUSE, PARAMBIL PARA,\nVALIYORA, MALAPPURAM , PIN- 676 304.\n3 HYDER ALI\nAGED 33 YEARS\nS/O SAIDALAVI, MALIYEKAL HOUSE, PARAMBIL PARA,\nVALIYORA, MALAPPURAM , PIN- 676 304.\nR2-3 BY ADV. C.T.BASHEER\nSRI. C.S.HRITHWIK, SR.PP\nTHIS CRIMINAL MISC. CASE HAVING COME UP FOR ADMISSION\nON 07.01.2020, THE COURT ON THE SAME DAY PASSED THE\nFOLLOWING:\n\nEee\nBie\n2020/KER/543\nCrl.MC.No.8745 OF 2019(C)\n2\nORDER\nDated this the 7th day of January 2020\n\nThe petitioner is the 6\" accused in\nCrime No.942/2015 of Vengara Police Station,\nfor having allegedly committed offences\npunishable under Sections 143, 147, 148, 323,\n324 r/w Section 149 of the IPC.\n\n2. The parent case was taken on the file as\nCC No.1781/2015 on the file of the Judicial\nFirst Class Magistrate Court, Malappuram. The\npetitioner was absconding and the others faced\ntrial, and vide judgment at Annexure-III, all\nthe accused who faced trial were acquitted and\nthe case against the petitioner and 4 accused\nwas split up and refiled as CC No.68/2018.\nPresently, the case against the petitioner is\npending as LP No.82/2019 on the files of the\nsame court.\n\n_\nBee\n2020/KER/543\nCrl.MC.No.8745 OF 2019(C)\n3\n\n3. Respondent Nos.2 and 3, who are the\ndefacto complainant and injured, have\nappeared through counsel and filed affidavits\nto the effect that the matter has been amicably\nsettled with the petitioner and that they do\nnot have any grievance against him. A report\nhas been called for from the Investigating\nOfficer through the senior Public Prosecutor.\nThere is no public interest involved.\n\nIn the result the Crl.M.C is allowed, and\nthe entire proceedings in Crime No.942/2015 of\nVengara Police Station, pending against the\npetitioner as LP No.82/2019 on the file of the\nJudicial First Class Magistrate Court,\nMalappuram, stands quashed under Section 482 of\nthe Cr.P.C and the accused is discharged.\n\nSd/-\nASHOK MENON\nSPK JUDGE\n\npies\noe\nBhevaert\n2020/KER/543\nCr1l.MC.No.8745 OF 2019 (C)\n4\nAPPENDIX\nPETITIONER'S/S EXHIBITS:\nANNEXURE I CERTIFIED COPY OF THE FIR DATED\n26.7.2015 IN L.P NO.82/2019 ON THE FILE\nOF THE JUDICIAL FIRST CLASS MAGISTRATE\nCOURT, MALAPPURAM IN CRIME NO .942/2015\nOF VENGARA POLICE STATION.\nANNEXURE ITI CERTIFIED COPY OF THE CHARGE SHEET\nFILED IN L.P NO 82/2019 ON THE FILE OF\nTHE JUDICIAL FIRST CLASS MAGISTRATE\nCOURT, MALAPPURAM IN CRIME NO.942/2015\nOF VENGARA POLICE STATION DATED\n26.07.2015.\nANNEXURE IIT CERTIFIED COPY OF THE C.C NO 1781/2015\nON THE FILE OF THE JUDICIAL FIRST CLASS\nMAGISTRATE COURT, MALAPPURAM.\nANNEXURE IV THE COMPROMISE AFFIDAVIT DATED\n19.11.2019 FILED BY THE DEFACTO\nCOMPLAINANT .\nRESPONDENT'S/S EXHIBITS : NIL\n//TRUE COPY//\nPA TO JUDGE\n\n"
}