{
    "case_id": "Crl.MC.No. 8930 of 2018",
    "court": "HIGH COURT OF KERALA AT ERNAKULAM Ten",
    "date": "3RD DAY OF JANUARY 2019",
    "judge": "B.SUDHEENDRA KUMAR\nTHURSDAY",
    "petitioners": [
        "S:",
        "MANIMARAN 5S.",
        "AGED 52 YEARS",
        "S/O. SREENIVASAN, IYYAR BANGLAVU,",
        "M.M.S COLONY, IIND STREET,",
        "MADURAI-14,TAMIL NADU STATE."
    ],
    "respondents": [
        "S:",
        "STATE OF KERALA,",
        "REPRESENTED BY THE PUBLIC PROSECUTOR,",
        "HIGH COURT OF KERALA, ERNAKULAM, PIN-682031.",
        "OTHER PRESENT:",
        "SRI E C BINEESH-PUBLIC PROSECUTOR"
    ],
    "sections": [],
    "outcome": "",
    "full_text": "abstr: aE\nIN THE HIGH COURT OF KERALA AT ERNAKULAM Ten\n2019/KER/156\nPRESENT\nTHE HONOURABLE MR. JUSTICE B.SUDHEENDRA KUMAR\nTHURSDAY ,THE O3RD DAY OF JANUARY 2019 / 13TH POUSHA, 1940\nCr1.MC.No. 8930 of 2018\nAGAINST THE ORDER/JUDGMENT IN C.M.P.NO.1757/2018 IN\ncc 110/2018 of J.M.F.C.-I, PEERUMEDU DATED 13-11-2018\nPETITIONER/S:\nMANIMARAN 5S.\nAGED 52 YEARS\nS/O. SREENIVASAN, IYYAR BANGLAVU,\nM.M.S COLONY, IIND STREET,\nMADURAI-14,TAMIL NADU STATE.\nBY ADVS.\nSRI .T.A.UNNIKRISHNAN\nSRI .K.K.AKHIL\nRESPONDENT/S:\nSTATE OF KERALA,\nREPRESENTED BY THE PUBLIC PROSECUTOR,\nHIGH COURT OF KERALA, ERNAKULAM, PIN-682031.\nOTHER PRESENT:\nSRI E C BINEESH-PUBLIC PROSECUTOR\nTHIS CRIMINAL MISC. CASE HAVING COME UP FOR ADMISSION\nON 03.01.2019, THE COURT ON THE SAME DAY PASSED THE\nFOLLOWING:\n\n_\nsete,\nCri.MC.No. 8930 of 2018\n-2-\nORDER\nThe petitioner is accused No.2 in\nC.C. No.110/2018 on the files of the court\nbelow. The petitioner filed CMP No.1757/2018\nbefore the court below, praying for\nreleasing the passport to the petitioner,\nwhich was produced by the petitioner before\nthe court below at the time of executing the\nbail bond. The court below as per\nAnnexure-II order dismissed the said\npetition, against which this Crl1.M.C. has\nbeen filed.\n2. Heard.\n3. It was observed in Annexure-II order\nby the learned Magistrate that the\n\n2019/KERIIS6\nCri.MC.No. 8930 of 2018\n-3-\n\npetitioner did not state about the place\nwhere he would propose to_ go. The\npetitioner only stated that he is going\nabroad for higher studies. However, there\nwas no mention in the petition about the\ncourse for which he would propose to make\nhigher studies. The name of the University\nto which he proposes to join for higher\nstudies was also not mentioned in the\npetition. In view of the above reasons,\nthe court below rightly dismissed\nCMP No.1757/2018. Having gone through the\norder impugned, I do not find anything to\ninterfere with Annexure-II order.\n\nIn the result, this Crl1.M.C. stands\ndismissed.\n\nap\n2019/KER/156\nCrl.MC.No. 8930 of 2018\n-4-\n\nHowever, the petitioner shall be at\nliberty to file fresh petition before the\ncourt below, stating all the details\nmentioned above and the document/ documents\nto support the same. If the petitioner\nfiles any such petition before the court\nbelow, the court below shall consider and\ndispose of the said petition in accordance\nwith law as expeditiously as possible.\n\nSd/-\nB. SUDHEENDRA KUMAR,\nJUDGE\nSTK\n/[TRUE COPY//\n//P.A. TO JUDGE//\n\nTelttrs aE\n| ay Pe\n2019/KER/156\nCrl.MC.No. 8930 of 2018\n-5-\nAPPENDIX\nPETITIONER'S/S EXHIBITS:\nANNEXURE I TRUE COPY OF THE OFFER LETTER DATED\n18.9.2018 ISSUED TO THE PETITIONER FROM\nTHE UNIVERSITY OF SHARJAH IN UAE\nANNEXURE ITI TRUE COPY OF THE ORDER DATED 13.11.2018\nIN CMP NO. 1757 IN C.C.NO, 110/18\nJUDICIAL FIRST CLASS MAGISTRATE COURT-\n1, PEERMADE.\nRESPONDENT'S EXHIBITS: NIL\n//TRUE COPY//\nP.A. TO JUDGE\nSTK\n\n"
}