{
    "case_id": "",
    "court": "HIGH COURT OF KERALA AT ERNAKULAM\nPRESENT\nTHE HONOURABLE MR",
    "date": "07TH DAY OF JANUARY 2019",
    "judge": "RAJA VIJAYARAGHAVAN V\nMONDAY",
    "petitioners": [
        "RESPONDENT:",
        "JAYAKUMAR C.K., AGED 55 YEARS",
        "S/O KUMARAN, MANAKKATTU HOUSE, KALVAMKODAM P.O.,",
        "CHERTHALA-688 524."
    ],
    "respondents": [
        "JAYAKUMAR C.K., AGED 55 YEARS",
        "S/O KUMARAN, MANAKKATTU HOUSE, KALVAMKODAM P.O.,",
        "CHERTHALA-688 524."
    ],
    "sections": [],
    "outcome": "",
    "full_text": ". :\nea\nz â€œ\nBz a vs\n2019/KER/498\nIN THE HIGH COURT OF KERALA AT ERNAKULAM\nPRESENT\nTHE HONOURABLE MR. JUSTICE RAJA VIJAYARAGHAVAN V\nMONDAY, THE 07TH DAY OF JANUARY 2019 / 17TH POUSHA, 1940\nCr1.MC.No. 8937 of 2016\nAGAINST THE ORDER/JUDGMENT IN MC NO.66/2016 ON THE FILES OF THE\nFAMILY COURT, ERNAKULAM DATED 18-11-2016\nPETITIONER/RESPONDENT:\nJAYAKUMAR C.K., AGED 55 YEARS\nS/O KUMARAN, MANAKKATTU HOUSE, KALVAMKODAM P.O.,\nCHERTHALA-688 524.\nBY ADVS.\nSRI.C.U.SANGEETH\nSRI . SREEVALSAN .V\nRESPONDENTS / PETITIONERS :\n1 HELJA.T.R @ HALJA JAYAKUMAR,\nW/O JAYAKUMAR C.K. RESIDING AT FLAT NO.AQ,\nMAYURA HOMES, ELAMAKKARA P.O. KOCHI-682 026.\n2 JAYADEEP JAYAKUMAR (MINOR),\nAGED 13 YEARS S/O JAYAKUMAR C.K., REP. BY MOTHER\nHELJA T.R. R HELJA JAYAKUMAR, RESIDING AT FLAT NO.AQ,\nMAYURA HOMES, ELAMAKKARA P.O. KOCHI-682 026.\nBY ADVS.\nSMT .R.PRIYA\nSMT .K.P.SREEJA\nSMT .M.S.SUBEENA\nSRI.B.SURJITH\nSRI .M.B.SANDEEP\nOTHER PRESENT:\nSRI C K PRASAD-PP\nTHIS CRIMINAL MISC. CASE HAVING BEEN FINALLY HEARD ON 07.01.2019,\nTHE COURT ON THE SAME DAY PASSED THE FOLLOWING:\n\nge\nTele\nCRL.MC:8937/16 2 2019/KERIA98\nORDER\nWhen the matter was taken up, Sri. Sangeeth C.V., the\nlearned counsel appearing for the petitioner seeks permission to\nwithdraw this petition without prejudice to the right of the petitioner to\ninitiate appropriate proceedings. Reserving the said right, this Cril.M.C\nis dismissed as withdrawn.\nSD/-\nRAJA VIJAYARAGHAVAN V.,\nJUDGE\nkrj\nTRUE COPY// P.A. TO JUDGE\n\n"
}