{
    "case_id": "Crl.MC.No. 7531 of 2017",
    "court": "HIGH COURT OF KERALA AT ERNAKULAM\nPRESENT",
    "date": "8TH DAY OF DECEMBER 2017",
    "judge": "SUNIL THOMAS\nFRIDAY",
    "petitioners": [
        "/ACCUSED 1 TO 4:",
        "1. UNNIKKANNAN V.P.",
        "S/O. BALAKRISHNAN, 'ATHIRA\" KANDOTH, VELLUR AMSOM,",
        "KANNUR DISTRICT.",
        "2. BALAKRISHNAN KARIPATH,",
        "S/O. KANNAPOTHUVAL, -DO-",
        "3. RUGMINI,",
        "W/O. BALAKRISHNAN KARIPATH, - DO-",
        "4. JISHNU V P,",
        "S/O. BALAKRISHNAN KARIPATH, - DO-"
    ],
    "respondents": [
        "(S)/DE FACTO COMPLAINANTS:",
        "1. STATE OF KERALA",
        "REPRESENTED BY THE PUBLIC PROSECUTOR,",
        "HIGH COURT OF KERALA,",
        "ERNAKULAM.- 682 031.",
        "2. SRUTHI K P,",
        "K V RAJENDRAN, RESIDING AT NIVEDYAM,",
        "VELLUR AMSOM KANDOTH DESOM,",
        "KANNUR DISTRICT - 670 001.",
        "R2 BY ADV. SRI.A.SHANAVAS",
        "R BY PUBLIC PROSECUTOR: SRI C K PRASAD"
    ],
    "sections": [
        "498A",
        "294"
    ],
    "outcome": "ORDER/JUDGMENT IN CC 729/2014 of J.M.F.C. ,PAYYANNUR\nCRIME NO. 232/2014 OF PAYYANNUR POLICE STATION , KANNUR\nPETITIONER(S) /ACCUSED 1 TO 4:\n1. UNNIKKANNAN V.P.\nS/O. BALAKRISHNAN, 'ATHIRA\" KANDOTH, VELLUR AMSOM,\nKANNUR DISTRICT.\n2. BALAKRISHNAN KARIPATH,\nS/O. KANNAPOTHUVAL, -DO-\n3. RUGMINI,\nW/O. BALAKRISHNAN KARIPATH, - DO-\n4. JISHNU V P,\nS/O. BALAKRISHNAN KARIPATH, - DO-\nBY ADV. SRI.T.V.JAYAKUMAR NAMBOODIRI\nRESPONDENT (S)/DE FACTO COMPLAINANTS:\n1. STATE OF KERALA\nREPRESENTED BY THE PUBLIC PROSECUTOR,\nHIGH COURT OF KERALA,\nERNAKULAM.- 682 031.\n2. SRUTHI K P,\nK V RAJENDRAN, RESIDING AT NIVEDYAM,\nVELLUR AMSOM KANDOTH DESOM,\nKANNUR DISTRICT - 670 001.\nR2 BY ADV. SRI.A.SHANAVAS\nR BY PUBLIC PROSECUTOR: SRI C K PRASAD\nTHIS CRIMINAL MISC. CASE HAVING COME UP FOR ADMISSION ON\n08-12-2017, THE COURT ON THE SAME DAY PASSED THE FOLLOWING:\n\nBisig ele\nPeres\nBa\n2017/KER/49771\nCrl.MC.No. 7531 of 2017 ()\nAPPENDIX\nPETITIONER(S)' EXHIBITS\nANNEXURE TI TRUE COPY OF THE FINAL REPORT IN CRIME NO: 232/14\nOF PAYYANUR POLICE STATION.\nANNEXURE IT AFFIDAVIT OF 2ND RESPONDENT DATED 12/10/2017.\nRESPONDENT (S)' EXHIBITS:NIL\nTrue Copy / P A to Judge\n\nme\n2017/KER/49771\nSUNIL THOMAS, J.\nCrl.M.C.No.7531 of 2017\nDated this the 8° day of December, 2017\nORDER\n\nPetitioners herein are arrayed as accused in Crime\nNo.232 of 2014 of Payyannur Police Station for offences punishable\nunder sections 498A, 294(b), 323 r/w 34 of the Indian Penal Code.\n\n2. It was alleged by the prosecution that the petitioners\nherein, who are the husband and in-laws of the second respondent\nherein, subjected the second respondent to matrimonial cruelty.\nAlleging it, she laid the complaint, which ultimately led to the\nregistration of the crime and filing of the final report. The matter is\npending as C.C.No.729 of 2014 of Judicial First Class Magistrate\nCourt, Payyannur.\n\n3. Petitioners have now approached this Court contending\nthat the disputes have been completely resolved and parties have no\nobjection in quashing the proceedings. Learned counsel for the\npetitioners and the learned counsel for the second respondent\nreferred to Annexure-A2 affidavit, affirmed by the second\nrespondent, reiterating the settlement. Learned counsel for the\nsecond respondent submitted that the matter has been settled and\nshe has no objection in quashing the proceedings. Learned Public\nProsecutor, on instructions, submitted that the matter has now been\n\nBel\naera\n2017/KER/49771\nCrl.M.C.753 1/17\n2\nsettled and statement of the victim recorded. Having considered\nthese facts, I am inclined to invoke the jurisdiction under section\n482 Cr.P.C.\nIn the result, Crl.M.C is allowed. All further proceedings\nin C.C.No.729 of 2014 of Judicial First Class Magistrate Court,\nPayyannur arising from Crime No.232 of 2014 of Payyannur Police\nStation will stand quashed",
    "full_text": "Bee\nPeres\nBlas\n2017/KER/49771\nIN THE HIGH COURT OF KERALA AT ERNAKULAM\nPRESENT :\nTHE HONOURABLE MR. JUSTICE SUNIL THOMAS\nFRIDAY, THE 8TH DAY OF DECEMBER 2017/17TH AGRAHAYANA, 1939\nCrl.MC.No. 7531 of 2017 ()\nAGAINST THE ORDER/JUDGMENT IN CC 729/2014 of J.M.F.C. ,PAYYANNUR\nCRIME NO. 232/2014 OF PAYYANNUR POLICE STATION , KANNUR\nPETITIONER(S) /ACCUSED 1 TO 4:\n1. UNNIKKANNAN V.P.\nS/O. BALAKRISHNAN, 'ATHIRA\" KANDOTH, VELLUR AMSOM,\nKANNUR DISTRICT.\n2. BALAKRISHNAN KARIPATH,\nS/O. KANNAPOTHUVAL, -DO-\n3. RUGMINI,\nW/O. BALAKRISHNAN KARIPATH, - DO-\n4. JISHNU V P,\nS/O. BALAKRISHNAN KARIPATH, - DO-\nBY ADV. SRI.T.V.JAYAKUMAR NAMBOODIRI\nRESPONDENT (S)/DE FACTO COMPLAINANTS:\n1. STATE OF KERALA\nREPRESENTED BY THE PUBLIC PROSECUTOR,\nHIGH COURT OF KERALA,\nERNAKULAM.- 682 031.\n2. SRUTHI K P,\nK V RAJENDRAN, RESIDING AT NIVEDYAM,\nVELLUR AMSOM KANDOTH DESOM,\nKANNUR DISTRICT - 670 001.\nR2 BY ADV. SRI.A.SHANAVAS\nR BY PUBLIC PROSECUTOR: SRI C K PRASAD\nTHIS CRIMINAL MISC. CASE HAVING COME UP FOR ADMISSION ON\n08-12-2017, THE COURT ON THE SAME DAY PASSED THE FOLLOWING:\n\nBisig ele\nPeres\nBa\n2017/KER/49771\nCrl.MC.No. 7531 of 2017 ()\nAPPENDIX\nPETITIONER(S)' EXHIBITS\nANNEXURE TI TRUE COPY OF THE FINAL REPORT IN CRIME NO: 232/14\nOF PAYYANUR POLICE STATION.\nANNEXURE IT AFFIDAVIT OF 2ND RESPONDENT DATED 12/10/2017.\nRESPONDENT (S)' EXHIBITS:NIL\nTrue Copy / P A to Judge\n\nme\n2017/KER/49771\nSUNIL THOMAS, J.\nCrl.M.C.No.7531 of 2017\nDated this the 8° day of December, 2017\nORDER\n\nPetitioners herein are arrayed as accused in Crime\nNo.232 of 2014 of Payyannur Police Station for offences punishable\nunder sections 498A, 294(b), 323 r/w 34 of the Indian Penal Code.\n\n2. It was alleged by the prosecution that the petitioners\nherein, who are the husband and in-laws of the second respondent\nherein, subjected the second respondent to matrimonial cruelty.\nAlleging it, she laid the complaint, which ultimately led to the\nregistration of the crime and filing of the final report. The matter is\npending as C.C.No.729 of 2014 of Judicial First Class Magistrate\nCourt, Payyannur.\n\n3. Petitioners have now approached this Court contending\nthat the disputes have been completely resolved and parties have no\nobjection in quashing the proceedings. Learned counsel for the\npetitioners and the learned counsel for the second respondent\nreferred to Annexure-A2 affidavit, affirmed by the second\nrespondent, reiterating the settlement. Learned counsel for the\nsecond respondent submitted that the matter has been settled and\nshe has no objection in quashing the proceedings. Learned Public\nProsecutor, on instructions, submitted that the matter has now been\n\nBel\naera\n2017/KER/49771\nCrl.M.C.753 1/17\n2\nsettled and statement of the victim recorded. Having considered\nthese facts, I am inclined to invoke the jurisdiction under section\n482 Cr.P.C.\nIn the result, Crl.M.C is allowed. All further proceedings\nin C.C.No.729 of 2014 of Judicial First Class Magistrate Court,\nPayyannur arising from Crime No.232 of 2014 of Payyannur Police\nStation will stand quashed.\nSd/-\nSUNIL THOMAS\nJudge\nSbna/8/12/17\nTrue Copy / P A to Judge\n\n"
}