{
    "case_id": "",
    "court": "HIGH COURT OF KERALA AT ERNAKULAM\nPRESENT",
    "date": "1ST DAY OF JUNE 2016",
    "judge": "V.CHITAMBARESH\nWEDNESDAY",
    "petitioners": [
        "THE EXECUTIVE OFFICER,",
        "SREE VAIRAMKODE DEVASWOM, VAIRAMKODE P.O. - 676301,",
        "THIRUNAVAYA VIA, MALAPPURAM DISTRICT."
    ],
    "respondents": [
        "1. K.V.GOPINATHAN WARRIER,",
        "AGED 49 YEARS, S/O.GOVINDA WARRIER,",
        "NOOYINGARA VARIAM, PERUMPARAMBA P.O. - 67957,",
        "EDAPPAL, MALAPPURAM DISTRICT.",
        "2. THE DEPUTY COMMISSIONER,",
        "MALABAR DEVASWOM BOARD, KOZHIKODE - 673 006.",
        "Ri BY ADV. SMT.R.RANJINI",
        "Ri BY ADV. SRI.M.ASHOK KINI",
        "R BY SRILMAHESH V RAMAKRISHNAN"
    ],
    "sections": [],
    "outcome": "",
    "full_text": "REel\n= ars SE 1\nBE] saat Oy\n2016/KER/23996\nIN THE HIGH COURT OF KERALA AT ERNAKULAM\nPRESENT:\nTHE HONOURABLE MR.JUSTICE V.CHITAMBARESH\nWEDNESDAY, THE 1ST DAY OF JUNE 2016/11TH JYAISHTA, 1938\nWP(C).No. 16435 of 2016 (D)\nPETITIONER(S):\nTHE EXECUTIVE OFFICER,\nSREE VAIRAMKODE DEVASWOM, VAIRAMKODE P.O. - 676301,\nTHIRUNAVAYA VIA, MALAPPURAM DISTRICT.\nBY ADV. SRI.M.KRISHNAKUMAR\nRESPONDENT(S):\n1. K.V.GOPINATHAN WARRIER,\nAGED 49 YEARS, S/O.GOVINDA WARRIER,\nNOOYINGARA VARIAM, PERUMPARAMBA P.O. - 67957,\nEDAPPAL, MALAPPURAM DISTRICT.\n2. THE DEPUTY COMMISSIONER,\nMALABAR DEVASWOM BOARD, KOZHIKODE - 673 006.\nRi BY ADV. SMT.R.RANJINI\nRi BY ADV. SRI.M.ASHOK KINI\nR BY SRILMAHESH V RAMAKRISHNAN\nTHIS WRIT PETITION (CIVIL) HAVING BEEN FINALLY HEARD ON\n01-06-2016, THE COURT ON THE SAME DAY DELIVERED THE FOLLOWING:\n\nREel\n= ars SE 1\nBE] saat Oy\n2016/KER/23996\nWP(C).No. 16435 of 2016 (D)\nAPPENDIX\n\nPETITIONER(S)' EXHIBITS\n\nPt TRUE COPY OF THE ORDER DATED 18.09.2015\n\nP2 TRUE COPY OF THE ORDER DATED 16.03.2016\n\nRESPONDENT(S)' EXHIBITS : NIL.\n\n//TRUE COPY//\nP.S. TO JUDGE.\n\n2016/KER/23996\nV.CHITAMBARESH, J.\nw.P (C) No.16435 of 2016\nDated this the 1* day of June, 2016\nJUDGMENT\n\nThe first respondent undertakes to withdraw\nA.P.NO.4/2015 on the file of the Deputy Commissioner,\nMalabar Devaswom Board. Consequentially the petitioner\nundertakes to withdraw R.P.No.5/2016 pending before the\nCommissioner, Malabar Devaswom Board.\n\n2. The matter can be given a quietus if the\npetitioner passes orders anew after hearing all\nparties. The first respondent as_ well as\nMr.K.P.Nandakumar Creferred to in Ext.P1) shall be put\non notice and heard.\n\n3. Fresh orders shall be passed by the\npetitioner within a period of three weeks. Status quo\nas on today shall continue in the meanwhile.\n\nThe writ Petition is disposed of.\n\nSd/-\nV.CHITAMBARESH,\nJudge.\nnj/01.06.2016\n\n"
}