{
    "case_id": "",
    "court": "HIGH COURT OF KERALA AT ERNAKULAM\nPRESENT",
    "date": "8TH DAY OF DECEMBER 2017",
    "judge": "B.KEMAL PASHA\nFRIDAY",
    "petitioners": [
        "DEFACTO COMPLATINANT.:",
        "ANEES,",
        "s/o. HAMSA HAJI, AGED 27 YEARS,",
        "KUNNUMMAL HOUSE, PARAPPANPOYIL P.O,",
        "THAMARASSERY, KOZHIKODE."
    ],
    "respondents": [
        "(S) /STATE & ACCUSED:",
        "1. STATE OF KERALA,",
        "RP. BY PUBLIC PROSECUTOR,",
        "HIGH COURT OF KERALA,",
        "ERNAKULAM-~-682031",
        "2. SHAKKIR,",
        "AGED 26 YEARS, S/O. MOIDU,",
        "PARALLAL, AVILORA P.O,",
        "KOZHIKODE-673001",
        "3. RIYAS,",
        "AGED 24 YEARS, S/O. SAITHALI,",
        "KAPPALANKUZHIYIL, VAVAD P.O,",
        "KOZHIKODE-673001",
        "4. ABDURAHIMAN,",
        "AGED 24 YEARS, S/O. MUHAMMED,",
        "KANNADTPOYIL, VAVAD P.O,",
        "KOZHTKODE-673001.",
        "5. ANAS,",
        "AGED 26 YEARS, S/O. MUHAMMED,",
        "MATLANDIKKARAMMAL, VAVAD P.O,",
        "KOZHTKODE-673001",
        "6. IBRAHIM,",
        "s/o. AHAMMEDRKUTTY MALIKATHADATHIL,",
        "VAVAD P.O, KOZHIKODE-673001",
        "R1 BY PUBLIC PROSECUTOR SRI ALEX M THOMBRA",
        "R2 TO R6 BY ADV. SRI.P.K.NIJOY"
    ],
    "sections": [
        "143",
        "147",
        "148",
        "341",
        "427",
        "307",
        "395 read with Section 149 IPC"
    ],
    "outcome": "ORDER\nPetitioner is the de facto complainant and\nrespondents 2 to 6 are the accused in Crime No.348/2015\nof Koduvally Police Station, registered for the offences\npunishable under Sections 143, 147, 148, 341, 427, 307\nand 395 read with Section 149 IPC.\n\n2. It seems that the matter has been amicably\nsettled between the petitioner, who is the de _ facto\ncomplainant and respondents 2 to 6, who are the accused.\n\n3. Petitioner, who is the de facto complainant, has\nfiled Annexure-A2 affidavit affirming that the matter has\nbeen amicably settled between him and the accused and\npresently, he has no- complaints against the\naccused/respondents 2 to 6. When the matter has been\namicably settled between the parties, no purpose would be\n\nDee Aa\nie\n2017/KER/49765\nCrl.M.C.6729/2017\n:2:\nserved in proceeding with the matter any further. Matters\nbeing so, Annexure-A1 First Information Report in Crime\nNo.348/2015 of Koduvally Police Station and all further\nproceedings as against respondents 2 to 6 in it, can be\nquashed",
    "full_text": "wat, 2 Be\nTipo\n2017/KER/49765\nIN THE HIGH COURT OF KERALA AT ERNAKULAM\nPRESENT:\nTHE HONOURABLE MR. JUSTICE B.KEMAL PASHA\nFRIDAY, THE 8TH DAY OF DECEMBER 2017/17TH AGRAHAYANA, 1939\nCr1l.MC.No. 6729 of 2017 ()\nCRIME NO. 348/2015 OF KODUVALLY POLICE STATION , KOZHIKODE\nPETITIONER/DEFACTO COMPLATINANT.:\nANEES,\ns/o. HAMSA HAJI, AGED 27 YEARS,\nKUNNUMMAL HOUSE, PARAPPANPOYIL P.O,\nTHAMARASSERY, KOZHIKODE.\nBY ADV. SRI.NIRMAL. S\nRESPONDENT (S) /STATE & ACCUSED:\n1. STATE OF KERALA,\nRP. BY PUBLIC PROSECUTOR,\nHIGH COURT OF KERALA,\nERNAKULAM-~-682031\n2. SHAKKIR,\nAGED 26 YEARS, S/O. MOIDU,\nPARALLAL, AVILORA P.O,\nKOZHIKODE-673001\n3. RIYAS,\nAGED 24 YEARS, S/O. SAITHALI,\nKAPPALANKUZHIYIL, VAVAD P.O,\nKOZHIKODE-673001\n4. ABDURAHIMAN,\nAGED 24 YEARS, S/O. MUHAMMED,\nKANNADTPOYIL, VAVAD P.O,\nKOZHTKODE-673001.\n5. ANAS,\nAGED 26 YEARS, S/O. MUHAMMED,\nMATLANDIKKARAMMAL, VAVAD P.O,\nKOZHTKODE-673001\n6. IBRAHIM,\ns/o. AHAMMEDRKUTTY MALIKATHADATHIL,\nVAVAD P.O, KOZHIKODE-673001\nR1 BY PUBLIC PROSECUTOR SRI ALEX M THOMBRA\nR2 TO R6 BY ADV. SRI.P.K.NIJOY\nTHIS CRIMINAL MISC. CASE HAVING COME UP FOR ADMISSION\nON 08-12-2017, THE COURT ON THE SAME DAY PASSED THE\nFOLLOWING:\nK.V.\n\nwat, Be\nrp aasas\n2017/KER/49765\nCr1.MC.No. 6729 of 2017 ()\nAPPENDIX\nPETITIONER(S)' EXHIBITS\nANNEXURE Al CERTIFIED COPY OF THE FIR IN CRIME NO. 348/2015\nDATED 29.07.2015.\nANNEXURE A2 TRUE COPY OF THE NOTARISED AFFIDAVIT DATED 03.04.2017\nFILED BY THE DE FACTO COMPLAINANT.\nRESPONDENT (S)' EXHIBITS NIL\n/ TRUE copy/\nK.V. P.S.TO JUDGE\n\nBED\n2017/KER/49765\nB. KEMAL PASHA, J.\nDated this the 8\" day of December, 2017\nORDER\nPetitioner is the de facto complainant and\nrespondents 2 to 6 are the accused in Crime No.348/2015\nof Koduvally Police Station, registered for the offences\npunishable under Sections 143, 147, 148, 341, 427, 307\nand 395 read with Section 149 IPC.\n\n2. It seems that the matter has been amicably\nsettled between the petitioner, who is the de _ facto\ncomplainant and respondents 2 to 6, who are the accused.\n\n3. Petitioner, who is the de facto complainant, has\nfiled Annexure-A2 affidavit affirming that the matter has\nbeen amicably settled between him and the accused and\npresently, he has no- complaints against the\naccused/respondents 2 to 6. When the matter has been\namicably settled between the parties, no purpose would be\n\nDee Aa\nie\n2017/KER/49765\nCrl.M.C.6729/2017\n:2:\nserved in proceeding with the matter any further. Matters\nbeing so, Annexure-A1 First Information Report in Crime\nNo.348/2015 of Koduvally Police Station and all further\nproceedings as against respondents 2 to 6 in it, can be\nquashed.\nIn the result, this Crl.M.C. is allowed and Annexure-A1\nFirst Information Report in Crime No.348/2015 of Koduvally\nPolice Station and all further proceedings as against\nrespondents 2 to 6 in it, are quashed.\nSd/-\n(B-KEMAL PASHA, JUDGE)\naks/08/12\n// True Copy /\nPS to Judge\n\n"
}