{
    "case_id": "Crl.MC.No. 186 of 2019",
    "court": "HIGH COURT OF KERALA AT ERNAKULAM PRESENT THE HONOURABLE MR",
    "date": "2019",
    "judge": "K.ABRAHAM MATHEW WEDNESDAY",
    "petitioners": [
        "ABDUL GAFOOR",
        "MANNARKKAD TALUK",
        "AGED",
        "ANGADIKKATTIL HOUSE",
        "MC.No",
        "K.ABRAHAM MATHEW",
        "O. HYDRU"
    ],
    "respondents": [
        "ERNAKULAM",
        "KARIMBA",
        "RAVEENDRANATHAN",
        "PONPILAVIL VEEDU",
        "Mannarkkad",
        "AGED",
        "PALAKAKD DISTRICT",
        "O. ACHUTHAN NAIR"
    ],
    "sections": [
        "482",
        "380"
    ],
    "outcome": "Petition filed under Section 482 Cr.P.C. 2. The petitioner was one of the two accused in CC No. 402 of 1998 on the file of the Judicial First Class Magistrate Court, Mannarkkad. The offence falls unde",
    "full_text": "a Seal BE petal Beer 2019/KER/1045 IN THE HIGH COURT OF KERALA AT ERNAKULAM PRESENT THE HONOURABLE MR. JUSTICE K.ABRAHAM MATHEW WEDNESDAY ,THE O9TH DAY OF JANUARY 2019 / 19TH POUSHA, 1940 Cr1.MC.No. 186 of 2019 cc 419/2018 OF J.M.F.C., MANNARKAD CRIME NO. 339/1998 OF MANNARKKAD POLICE STATION , PALAKKAD PETITIONER/S: ABDUL GAFOOR AGED 40 YEARS S/O. HYDRU, ANGADIKKATTIL HOUSE, PANAYAMPADAM, KARIMBA, MANNARKKAD TALUK, PALAKKAD DISTRICT BY ADV. SRI.P.JAYARAM RESPONDENT/S: 1 STATE OF KERALA REPRESENTED BY PUBLIC PROSECUTOR, HIGH COURT OF KERALA, ERNAKULAM 2 RAVEENDRANATHAN @ RAVEENDRAN AGED 64 YEARS S/O. ACHUTHAN NAIR, PONPILAVIL VEEDU, KARIMBA, MANNARKKAD TALUK, PALAKAKD DISTRICT BY ADV. SRI.SARATH CHANDRAN K.B. ae sant | CH ro mm 2019/KER/1045 Crl.MC.No. 186 of 2019 1.2... OTHER PRESENT: SRI.C.S HRITHWIK SR PP THIS CRIMINAL MISC. CASE HAVING COME UP FOR ADMISSION ON 09.01.2019, THE COURT ON THE SAME DAY PASSED THE FOLLOWING: ORDER Petition filed under Section 482 Cr.P.C. 2. The petitioner was one of the two accused in CC No. 402 of 1998 on the file of the Judicial First Class Magistrate Court, Mannarkkad. The offence falls under Section 380 of the Indian Penal Code. The other accused was tried and acquitted. The petitioner later surrendered and his case is now pending as CC No. 419 of 2018. The second respondent is the victim. It is submitted that the matter has been settled and the proceedings in the trial court may be quashed. 3. Heard the learned counsel for the petitioner 2019/KER/1045 Crl.MC.No. 186 of 2019 1.3.. and the second respondent and the learned Public Prosecutor. 4. I have perused the affidavit filed by the second respondent, who has entered appearance through counsel. I am satisfied that the allegation of settlement is true and no public interest is involved. There is no impediment for granting the prayer of the petitioner. In the result, this Crl.M.C. is allowed. The proceedings in CC No. 419 of 2018 on the file of the Judicial First Class Magistrate Court, Mannarkkad are quashed. The learned magistrate may pass appropriate orders for the disposal of the material objects, if any, produced in the case. Sd/- K.ABRAHAM MATHEW JUDGE Bka/10.01.2019 Eos are] BE petal Beer 2019/KER/1045 Cr1.MC.No. 186 of 2019 ~.4.,. APPENDIX PETITIONER'S/S EXHIBITS: ANNEXURE Al COPY OF THE FIRST INFORMATION REPORT IN CRIME NO. 339/1998, OF MANNARKKAD POLICE STATION ANNEXURE A2 COPY OF THE FINAL REPORT/CHARGE SHEET IN CRIME NO.339/1998 OF MANNARKKAD POLICE STATION/C.C NO. 402/1998 OF JUDICIAL FIRST CLASS MAGISTRATE, MANNARKKAD ANNEXURE A3 COPY OF THE LIST OF WITNESSES/MEMORANDUM OF EVIDENCE IN THE CASE DAIRY/FINAL REPORT IN CRIME NO. 339/1998 OF MANNARKKAD POLICE STATION ANNEXURE A4 COPY OF THE JUDGMENT DATED 24.11.2001 IN c.c. NO. 402/1998 OF JUDICIAL FIRST CLASS MAGISTRATE, MANNARKKAD ANNEXURE A5 AFFIDAVIT DATED 21/9/2018 SWORN TO AND EXECUTED BY 2ND RESPONDENT /DEFACTO COMPLAINT"
}