{
    "case_id": "CC 1039/2013",
    "court": "HIGH COURT OF KERALA AT ERNAKULAM PRESENT",
    "date": "MONDAY",
    "judge": "SUNIL THOMAS MONDAY",
    "petitioners": [
        "SANTHOSH",
        "VETTIYARMURI",
        "Annexures A",
        "MAVELIKKARA",
        "O.RAVEENDRAN"
    ],
    "respondents": [
        "KURATHIKADU POLICE STATION",
        "VETTIYAR VILLAGE",
        "O.GOPALAKRISHNA PILLAI",
        "O.PARAMESWARAN PILLAI",
        "REPRESENTING THE SUB INSPECTOR OF POLICE",
        "GOPALAKRISHNA PILLAI",
        "ALAPPUZHA DISTRICT.",
        "INDIRA",
        "ALAPPUZHA DISTRICT",
        "SANTHOSH BHAVANAM"
    ],
    "sections": [
        "324",
        "427",
        "452",
        "482",
        "323",
        "294(b)"
    ],
    "outcome": "The petitioner is the accused in C.C.No.1039/2013 of the Judicial First Class Magistrate Court 1, Mavelikkara for offences punishable under Sections 452, 427, 323, 324 and 294(b) of IPC. 2. According ",
    "full_text": "Dik ee) I. me iJ restore eae Dees 2016/KER/42231 IN THE HIGH COURT OF KERALA AT ERNAKULAM PRESENT : THE HONOURABLE MR. JUSTICE SUNIL THOMAS MONDAY, THE 3RD DAY OF OCTOBER 2016/11TH ASWINA, 1938 Cr1.MC.No. 6395 of 2016 () CC 1039/2013 OF JUDICIAL FIRST CLASS MAGISTRATE COURT-I, MAVELIKKARA . CRIME NO.586/2013 OF KURATHIKADU POLICE STATION, ALAPPUZHA. PETITIONER/ACCUSED: SANTHOSH, AGED 33 YEARS, S/O.RAVEENDRAN, SANTHOSH BHAVANAM, VETTIYARMURI, VETTIYAR VILLAGE, MAVELIKKARA, ALAPPUZHA DISTRICT. BY ADVS.SRI.M.V.THAMBAN SRI.R.REJI SMT.THARA THAMBAN SRI.B.BIPIN SRI.ARUN BOSE RESPONDENT (S)/STATE & CW1 AND CW2: 1. STATE OF KERALA REPRESENTED BY THE PUBLIC PROSECUTOR, HIGH COURT OF KERALA, ERNAKULAM, REPRESENTING THE SUB INSPECTOR OF POLICE, KURATHIKADU POLICE STATION, ALAPPUZHA DISTRICT 2. INDIRA, AGED 58 YEARS, W/O.GOPALAKRISHNA PILLAI, SANTHOSH BHAVANAM, VETTIYARMURI, VETTIYAR VILLAGE, MAVELIKKARA, ALAPPUZHA DISTRICT. 3. GOPALAKRISHNA PILLAI, AGED 68 YEARS, S/O.PARAMESWARAN PILLAI, SANTHOSH BHAVANAM, VETTIYARMURI, VETTIYAR VILLAGE, MAVELIKKARA, ALAPPUZHA DISTRICT. R1 BY PUBLIC PROSECUTOR SRI.E.C.BINEESH R2 & R3 BY ADV.SRI.K.V.ANIL KUMAR THIS CRIMINAL MISC. CASE HAVING COME UP FOR ADMISSION ON 03-10-2016, THE COURT ON THE SAME DAY PASSED THE FOLLOWING: mbr/ Dire) I. me a restore ae Dees 2016/KER/42231 Cr1.MC.No. 6395 of 2016 () APPENDIX PETITIONER (S) ' ANNEXURES: ANNEXURE Al : CERTIFIED COPY OF THE FIR NO 586/2013 IN (CC NO. 1039) OF KURATHIKADU POLICE STATION, ALAPPUZHA DISTRICT. ANNEXURE A2 : CERTIFIED COPY OF THE FINAL REPORT IN C.C NO.1039/2013 ON THE FILES OF THE HON'BLE JUDICIAL FIRST CLASS MAGISTRATE COURT-I, MAVELIKKARA. ANNEXURE A3 : AFFIDAVIT SWORN BY THE 2ND RESPONDENT. ANNEXURE A4 : AFFIDAVIT SWORN BY THE 3RD RESPONDENT. RESPONDENT (S)' ANNEXURES: NIL //TRUE COPY// P.S. TO JUDGE mbr Bier 2016/KER/42231 SUNIL THOMAS, J. Dated this the 3\" day of October, 2016 ORDER The petitioner is the accused in C.C.No.1039/2013 of the Judicial First Class Magistrate Court 1, Mavelikkara for offences punishable under Sections 452, 427, 323, 324 and 294(b) of IPC. 2. According to the prosecution, on 28.08.2013 at 5.30 p.m., the accused came to the shop of the defacto complainant, abused her and tried to assault the defacto complainant. When her husband intervened, he slapped on the cheek of the husband of the defacto complainant and when the wife intervened, he hit on her cheek as well as on various other parts. He also abused and assaulted the mentally challenged son of the defacto complainant. On the basis of the complaint lodged, crime was registered. After investigation final report was laid and the matter is now pending as C.C.No.1039/2013 of the Judicial First Class Magistrate Court I, Mavelikkara. 3. The petitioner has approached this Court on a premise that, the disputes between parties have now been voluntarily and amicably settled. it was stated that, there is no further surviving grievance of the defacto complainant. To substantiate it, 2016/KER/42231 Crl. M. C. No. 6395 of 2016 2 affidavits of the defacto complainant and her husband, who is a victim have been filed as Annexures A3 and A4. Relying on the above affidavits, learned counsel for the respondents 2 and 3 submitted that, the parties have resolved their disputes and the victims have no further grievance against the petitioner herein. 4. Learned Public Prosecutor on instructions submitted that the petitioner is not involved in any other case and the information is that the parties have resolved their disputes. 5. On the basis of these, | am satisfied that the dispute is essentially of private nature and no larger question of public interest arises. Since the parties have voluntarily resolved, the powers under Section 482 Cr.P.C. can be invoked to meet the ends of justice. In the result, Cril.MC. is allowed. All further proceedings in C.C.No.1039/2013 of the Judicial First Class Magistrate Court |, Mavelikkara stand quashed. Sd/- SUNIL THOMAS, JUDGE. Pn"
}