{
    "case_id": "SC 733/2018",
    "court": "HIGH COURT OF KERALA AT ERNAKULAM PRESENT THE HONOURABLE MR",
    "date": "2020",
    "judge": "ASHOK MENON WEDNESDAY",
    "petitioners": [
        "M.C.No.",
        "VADAKARA TALUK",
        "Crl",
        "KODIYURA P.O.",
        "L.P.No.",
        "AGED",
        "NISAR",
        "RESIDING AT VELLOLI HOUSE",
        "MC."
    ],
    "respondents": [
        "Kozhikode"
    ],
    "sections": [
        "324",
        "148",
        "308 read with Section 149 of I",
        "323",
        "482",
        "341",
        "308",
        "143",
        "147"
    ],
    "outcome": "/JUDGMENT IN SC 733/2018 OF ADDITIONAL DISTRICT COURT & SESSIONS COURT - IV, KOZHIKODE CRIME NO.290/2015 OF Valayam Police Station, Kozhikode PETITIONER/2ND ACCUSED: NISAR, AGED 34 YEARS, S/O.AMMAD, R",
    "full_text": "pera Pliesay 2020/KER/755 IN THE HIGH COURT OF KERALA AT ERNAKULAM PRESENT THE HONOURABLE MR. JUSTICE ASHOK MENON WEDNESDAY, THE 08TH DAY OF JANUARY 2020 / 18TH POUSHA, 1941 Cr1.MC.No.5386 OF 2019(C) AGAINST THE ORDER/JUDGMENT IN SC 733/2018 OF ADDITIONAL DISTRICT COURT & SESSIONS COURT - IV, KOZHIKODE CRIME NO.290/2015 OF Valayam Police Station, Kozhikode PETITIONER/2ND ACCUSED: NISAR, AGED 34 YEARS, S/O.AMMAD, RESIDING AT VELLOLI HOUSE, VELLIYODE, KODIYURA P.O., VANIMEL, NADAPURAM, VADAKARA TALUK, KOZHIKODE DISTRICT, PIN-673309. BY ADVS. SRI.J.R.PREM NAVAZ SHRI.SUMEEN S. SMT .PARVATHY S.KRISHNAN SHRI .MITHUN P. RESPONDENTS/STATE & DEFACTO COMPLAINANT : 1 STATE OF KERALA REPRESENTED BY PUBLIC PROSECUTOR, HIGH COURT OF KERALA, ERNAKULAM, PIN-682018. 2 MAJESH, AGED 21 YEARS, S/O.KELAPPAN, RESIDING AT KUNKAN HOUSE, NIRAVUMAL KODIYURA P.O., VANIMEL, NADAPURAM, VADAKARA TALUK, KOZHIKODE DISTRICT, PIN-673309. pee eealc) Binkas Crl.M.C.Nos.5386, 5391 & 5413 of 2019 2020/KERI7S5 2 3 SHIBU, AGED 21 YEARS, S/O.RAJAN, RESIDING AT KUNIYIL HOUSE, VANIMEL, NIDUMPARAMBA ,NADAPURAM, VADAKARA TALUK, KOZHIKODE DISTRICT, PIN-673309. 4 JISHNU, AGED 22 YEARS, S/O.CHANDRAN, RESIDING AT EDARIKAVU HOUSE, CHITTARI, NIDUMPARAMBA , NADAPURAM, VADAKARA TALUK, KOZHIKODE DISTRICT, PIN-673309. 5 AJEESH, AGED 26 YEARS, S/O.ASHOKAN, RESIDING AT VADAKKEL HOUSE, KODIYURA P.O., VANIMEL, NADAPURAM, VADAKARA TALUK, KOZHIKODE DISTRICT, PIN-673309. Rl BY SRI.E.C.BINEESH, PP R2-R5 BY ADV. SRI.AJOY VENU THIS CRIMINAL MISC. CASE HAVING BEEN FINALLY HEARD ON 08.01.2020, ALONG WITH Crl.MC.5391/2019(D), Crl.MC.5413/2019(F), THE COURT ON THE SAME DAY PASSED THE FOLLOWING: pera Feats Pliesay Cr1.M.C.Nos.5386, 5391 & 5413 of 2019 2020/KERI7S5 3 IN THE HIGH COURT OF KERALA AT ERNAKULAM PRESENT THE HONOURABLE MR. JUSTICE ASHOK MENON WEDNESDAY, THE O8TH DAY OF JANUARY 2020 / 18TH POUSHA, 1941 Cr1.MC.No.5391 OF 2019 (D) AGAINST THE ORDER/JUDGMENT IN SC 480/2019 OF ADDITIONAL DISTRICT COURT & SESSIONS COURT - IV, KOZHIKODE CRIME NO.290/2015 OF Valayam Police Station , Kozhikode PETITIONER/3RD ACCUSED: SAFEER, AGED 25 YEARS, S/O. SALAM, RESIDING AT ANGADI PARAMBATH HOUSE, VELLIYODE, KODIYURA P.O, VANIMEL, NADAPURAM, VADAKARA TALUK, KOZHIKODE DISTRICT, PIN-673 309. BY ADVS. SRI.J.R.PREM NAVAZ SHRI.SUMEEN S. SMT .PARVATHY S.KRISHNAN SHRI.MITHUN P. RESPONDENTS /STATE & DEFACTO COMPLAINANT: 1 STATE OF KERALA REPRESENTED BY PUBLIC PROSECUTOR, HIGH COURT OF KERALA, ERNAKULAM, PIN-682 018. 2 MAJESH, AGED 21 YEARS, S/O. KELAPPAN, RESIDING AT KUNKAN HOUSE, NIRAVUMAL KODIYURA P.O, VANIMEL, NADAPURAM, VADAKARA TALUK, KOZHIKODE DISTRICT, PIN - 673 309. pee eealc) Pees Binkas Crl.M.C.Nos.5386, 5391 & 5413 of 2019 2020/KERI7S5 4 3 SHIBU, AGED 21 YEARS, S/O. RAJAN, RESIDING AT KUNIYIL HOUSE, VANIMEL, NIDUMPARAMBA, NADAPURAM, VADAKARA TALUK, KOZHIKODE DISTRICT, PIN - 673 309. 4 JISHNU, AGED 22 YEARS, S/O. CHANDRAN, RESIDING AT EDARIKAVU HOUSE, CHITTARI, NIDUMPARAMBA, NADAPURAM, VADAKARA TALUK, KOZHIKODE DISTRICT, PIN - 673 309. 5 AJEESH, AGED 26 YEARS, S/O. ASHOKAN, RESIDING AT VADAKKEL HOUSE, KODIYURA P.O, VANIMEL, NADAPURAM, VADAKARA TALUK, KOZHIKODE DISTRICT, PIN - 673 309. Rl BY SRI.E.C.BINEESH, PP R2-R4 BY ADV. AJOY VENU OTHER PRESENT: THIS CRIMINAL MISC. CASE HAVING BEEN FINALLY HEARD ON 08.01.2020, ALONG WITH Crl.MC.5386/2019(C), Crl.MC.5413/2019(F), THE COURT ON THE SAME DAY PASSED THE FOLLOWING: Eber) Tee. a Feats Pliesay Cr1.M.C.Nos.5386, 5391 & 5413 of 2019 2020/KERI7S5 5 IN THE HIGH COURT OF KERALA AT ERNAKULAM PRESENT THE HONOURABLE MR. JUSTICE ASHOK MENON WEDNESDAY, THE O8TH DAY OF JANUARY 2020 / 18TH POUSHA, 1941 Crl1.MC.No.5413 OF 2019(F) AGAINST THE ORDER/JUDGMENT IN SC 942/2016 OF ADDITIONAL DISTRICT COURT & SESSIONS COURT - IV, KOZHIKODE CRIME NO.290/2015 OF Valayam Police Station , Kozhikode PETITIONER/1ST ACCUSED: JAMSHEER, AGED 24 YEARS, S/O.ALIKUTTY, RESIDING AT PUTHORATH HOUSE, VELLIYODE, KODIYURA P.O., VANIMEL, NADAPURAM, VADAKARA TALUK, KOZHIKODE DISTRICT, PIN- 673309. BY ADVS. SRI.J.R.PREM NAVAZ SHRI.SUMEEN S. SMT .PARVATHY S.KRISHNAN SHRI.MITHUN P. RESPONDENTS /STATE & DEFACTO COMPLAINANT: 1 STATE OF KERALA, REPRESENTED BY PUBLIC PROSECUTOR, HIGH COURT OF KERALA, ERNAKULAM, PIN- 682018. 2 MAJESH, AGED 21 YEARS, S/O.KELAPPAN, RESIDING AT KUNKAN HOUSE, NIRAVUMAL KODIYURA P.O, VANIMEL, NADAPURAM, VADAKARA TALUK, KOZHIKODE DISTRICT, PIN- 673309. pee eealc) Binkas Crl.M.C.Nos.5386, 5391 & 5413 of 2019 2020/KERI7S5 6 3 SHIBU, AGED 21 YEARS, S/O.RAJAN, RESIDING AT KUNIYIL HOUSE, VANIMEL, NIDUMPARAMBA, NADAPURAM, VADAKARA TALUK, KOZHIKODE DISTRICT, PIN- 673309. 4 JISHNU, AGED 22 YEARS, S/O.CHANDRAN, RESIDING AT EDARIKAVU HOUSE, CHITTARI, NIDUMPARAMBA, NADAPURAM, VADAKARA TALUK, KOZHIKODE DISTRICT, PIN- 673309. 5 AJEESH, AGED 26 YEARS, S/O.ASHOKAN, RESIDING AT VADAKKEL HOUSE, KODIYURA P.O., VANIMEL, NADAPURAM, VADAKARA TALUK, KOZHIKODE DISTRICT, PIN- 673309. Rl BY SRI.E.C.BINEESH, PP R2-R5 BY ADV. AJOY VENU THIS CRIMINAL MISC. CASE HAVING BEEN FINALLY HEARD ON 08.01.2020, ALONG WITH Crl.MC.5386/2019(C), Crl.MC.5391/2019(D), THE COURT ON THE SAME DAY PASSED THE FOLLOWING: Cr1.M.C.Nos.5386, 5391 & 5413 of 2019 , 2020/KER/755 COMMON ORDER [ Crl.MC.5386/2019, Cr1.MC.5391/2019, Cr1.MC.5413/2019 ] Dated this the 8th day of January 2020 Crl.M.C.No.5413/2019 is filed by the 1 accused, Crl.M.C.No.5386/2019 is filed by the 2\"* accused and Crl.M.C.No.5391/2019 is filed by the 3 accused in Crime No.290/2015 of Valayam Police Station. The case against the 1*%* accused is presently pending before the Additional Sessions Court-IV, Kozhikode as L.P.No.18/2019, the case against the 2 accused is pending before the same Court as .C.No.733/2018 and the case against the 3* accused is pending as S.C.No.480/2019 before the said Court. The cases against the accused were committed at different stages and that is why it was split up and three cases emanated from the same crime. The accused have allegedly committed the offences punishable under Sections 143, 147, 148, 341, 323, 324, 308 read with Section 149 of I.P.cC. The defacto complainant/injured are respondents 2 to 5 in all the three cases. They have appeared through a Crl1.M.C.Nos.5386, 5391 & 5413 of 2019 ; 2020/KER/755 Counsel and have filed affidavits stating that the matter has been amicably settled and they have no existing grievance whatsoever against the petitioners. A report has been filed by the investigating officer through the Senior Public Prosecutor to that effect. The petitioners do not have any criminal antecedents. Even though the offence under Section 308 of I.P.C. is incorporated, the injuries are not life-threatening. No public public interest is involved. In the result, the Crl.M.Cs. are allowed and the entire proceedings as against the petitioners in Crime No.290/2015 of Valayam Police Station, now pending as L.P.No.18/2019, S.C.Nos.733/2018 and 480/2019 before the Additional Sessions Court-IV, Kozhikode, shall stand quashed under Section 482 of Cr.P.C. and the petitioners are discharged. Sd/- ASHOK MENON dkr JUDGE Eee fa] Tape heer Elnkee Crl1.M.C.Nos.5386, 5391 & 5413 of 2019 2020/KER/755 9 APPENDIX OF Cr1l.MC 5386/2019 PETITIONER'S/S EXHIBITS: ANNEXURE Al COPIES OF THE FINAL REPORT/CHARGE SHEET IN CRIME NO.290/2015 OF VALAYAM POLICE STATION, KOZHIKODE DISTRICT. ANNEXURE A2 THE AFFIDAVIT SOLEMNLY AFFIRMED BY THE 2ND RESPONDENT/DEFACTO COMPLAINANT. ANNEXURE A3 THE AFFIDAVIT SOLEMNLY AFFIRMED BY THE 3RD RESPONDENT/ INJURED . ANNEXURE A4 THE AFFIDAVIT SOLEMNLY AFFIRMED BY THE 4TH RESPONDENT/ INJURED. ANNEXURE A5 THE AFFIDAVIT SOLEMNLY AFFIRMED BY THE 5TH RESPONDENT/ INJURED . meee Tape heer Elnkee Crl1.M.C.Nos.5386, 5391 & 5413 of 2019 2020/KER/755 10 APPENDIX OF Crl.MC 5391/2019 PETITIONER'S/S EXHIBITS: ANNEXURE Al TRUE COPIES OF THE FIR & FIS FINAL REPORT/CHARGE SHEET IN CRIME NO. 290/2015 OF VALAYAM POLICE STATION, KOZHIKODE DISTRICT. ANNEXURE A2 THE AFFIDAVIT SOLEMNLY AFFIRMED BY THE 2ND RESPONDENT/DEFACTO COMPLAINANT ANNEXURE A3 THE AFFIDAVIT SOLEMNLY AFFIRMED BY THE 3RD RESPONDENT / INJURED ANNEXURE A4 THE AFFIDAVIT SOLEMNLY AFFIRMED BY THE 4TH RESPONDENT / INJURED ANNEXURE A5 THE AFFIDAVIT SOLEMNLY AFFIRMED BY THE 5TH RESPONDENT/ INJURED . meee Tape heer Elnkee Crl1.M.C.Nos.5386, 5391 & 5413 of 2019 2020/KER/755 11 APPENDIX OF Crl1.MC 5413/2019 PETITIONER'S/S EXHIBITS: ANNEXURE Al COPIES OF THE FIR AND FINAL REPORT/CHARGE SHEET IN CRIME NO.290/2015 OF VALAYAM POLICE STATION, KOZHIKODE DISTRICT. ANNEXURE A2 THE AFFIDAVIT SOLEMNLY AFFIRMED BY THE 2ND RESPONDENT/DEFACTO COMPLAINANT. ANNEXURE A3 THE AFFIDAVIT SOLEMNLY AFFIRMED BY THE 3RD RESPONDENT/ INJURED . ANNEXURE A4 THE AFFIDAVIT SOLEMNLY AFFIRMED BY THE 4TH RESPONDENT/ INJURED. ANNEXURE A5 THE AFFIDAVIT SOLEMNLY AFFIRMED BY THE 5TH RESPONDENT/ INJURED ."
}