{
    "case_id": "Crl.MC.No.4838 OF 2017",
    "court": "HIGH COURT OF KERALA AT ERNAKULAM",
    "date": "2020",
    "judge": "P.B.SURESH KUMAR WEDNESDAY",
    "petitioners": [
        "ST.THOMAS STREET",
        "AGED",
        "THRISSUR-",
        "LOVELY",
        "KURIACHIRA",
        "CHIRAMMEL HOUSE",
        "OLLUR VILLAGE"
    ],
    "respondents": [
        "ST STAGE KUVEMBU NAGAR",
        "KUTTIKADAN HOUSE",
        "AGED",
        "GLADSTON",
        "REPRESENTED BY THE SUB INSPECTOR OF POLICE",
        "OLLUR POLICE STATION",
        "MYSOOR CORPORATION"
    ],
    "sections": [
        "498A",
        "406 read with Section 34 of the Indian Penal Code"
    ],
    "outcome": "/JUDGMENT IN CC 2724/2014 DATED 28-02-2017 OF JUDICIAL MAGISTRATE OF FIRST CLASS -III,THRISSUR CRIME NO.602/2016 OF Ollur Police Station , Thrissur PETITIONER: LOVELY AGED 32, D/O.SUNNY, CHIRAMMEL HOU",
    "full_text": "ree Bee IN THE HIGH COURT OF KERALA AT ERNAKULAM 2020/KERI695 PRESENT THE HONOURABLE MR. JUSTICE P.B.SURESH KUMAR WEDNESDAY, THE O8TH DAY OF JANUARY 2020 / 18TH POUSHA, 1941 Crl1.MC.No.4838 OF 2017 AGAINST THE ORDER/JUDGMENT IN CC 2724/2014 DATED 28-02-2017 OF JUDICIAL MAGISTRATE OF FIRST CLASS -III,THRISSUR CRIME NO.602/2016 OF Ollur Police Station , Thrissur PETITIONER: LOVELY AGED 32, D/O.SUNNY, CHIRAMMEL HOUSE, ST.THOMAS STREET, KURIACHIRA, OLLUR VILLAGE, THRISSUR- 680 306 BY ADV. SRI.G.SREEKUMAR (CHELUR) RESPONDENTS: 1 THE STATE OF KERALA REPRESENTED BY THE SUB INSPECTOR OF POLICE, OLLUR POLICE STATION, THROUGH THE PUBLIC PROSECUTOR, HIGH COURT OF KERALA, ERNAKULAM- 682 031 2 GLADSTON AGED 36, S/O.JOHNSON, KUTTIKADAN HOUSE, L/23, 1ST STAGE KUVEMBU NAGAR, MYSOOR CORPORATION, KARNATAKA STATE- 570 001 R1-2 BY ADV. SRI.M.J.POLLY THIS CRIMINAL MISC. CASE HAVING BEEN FINALLY HEARD ON 08.01.2020, THE COURT ON THE SAME DAY PASSED THE FOLLOWING: Crl.MC.No.4838 OF 2017 ; 2020/KER/O95 ORDER Crime.No.750/2014 of Ollur Police Station was registered at the instance of the petitioner against her husband, the second respondent and his parents under Section 498A and 406 read with Section 34 of the Indian Penal Code. After due investigation, the police chargesheeted the accused for the offences punishable under the aforesaid Sections and the matter was pending before the Court of the Judicial Magistrate of the First Class III, Thrissur, as C.C.No.2724 of 2014. The second respondent was the first accused in the case and his parents were accused Nos.2 and 3 in the case. Accused Nos.2 and 3 challenged the final report as against them before this Court in Crl.M.C.No.602 of 2016, and this Court quashed the final report in the proceedings in terms of Annexure-1 order. Pursuant to Annexure 1 order, the learned Magistrate dropped the proceedings in C.C.No.2724 of 2014. According to the petitioner, in terms of Annexure-1 order, this court has quashed only the final report as against accused Nos.2~ and Crl.MC.No.4838 OF 2017 . 2020/KER/O95 3 and the proceedings, in the circumstances, should have been continued as against the first accused, the second respondent. The petitioner, therefore seeks appropriate directions in this regard. 2. Heard the learned counsel for the petitioner. 3. It is seen from Annexure-1 order that in terms of the said order, this court has quashed the proceedings only as against accused Nos.2 and 3. That fact has been clarified by this court in Annexure-III order. In the circumstances, as rightly contended by the petitioner, the proceedings instituted as against the first accused namely the second respondent should have been continued by the court below. In the circumstances, the Crl.M.C. is allowed, Annexure-II order is quashed and the court below is directed to continue the proceedings in C.C.No.2724/2014 as against the second respondent. Sd/- P.B.SURESH KUMAR JUDGE AJM BRR ieee Crl.MC.No.4838 OF 2017 2020/KER/695 4 APPENDIX PETITIONER'S EXHIBITS: ANNEXURE Al A TRUE COPY OF THE FINAL ORDER PASSED IN CRL.MISCELLANEOUS CASE IN CRIME NO 602/2016 DATED 10.11.2016 OF THIS HON 'BLE COURT ANNEXURE A2 A TRUE COPY OF THE ORDER PASSED IN CC NO 2724/2014 ON THE FILE OF THE JFCM-3, THRISSUR DATED 28.2.2017 ANNEXURE A3 A TRUE COPY OF THE ORDER PASSED IN CRLI.MA NO 3227/2017 IN CRL.M.C 602/2016 DATED 4.4.2017 BY THIS HON'BLE COURT. RESPONDENTS' EXHIBITS: NIL AJM //TRUE COoPY// PA TO JUDGE"
}