{
    "case_id": "",
    "court": "HIGH COURT OF KERALA AT ERNAKULAM",
    "date": "2018",
    "judge": "B.KEMAL PASHA THURSDAY",
    "petitioners": [
        "ANZIL MANZIL",
        "RESIDING AT THEKKEDATHU HOUSE",
        "PATHANAMTHITTA DISTRICT.",
        "HARIKRISHNAN",
        "VISHNU S. NAIR",
        "AGED",
        "ARUVAPPULAM P.O.",
        "ABHIDEV",
        "RESIDING AT CHARIVILL PADINJATTETHIL HOUSE",
        "J. Dated",
        "KONNI TALUK"
    ],
    "respondents": [
        "PATHANAMTHITTA DISTRICT-",
        "ANSAL",
        "KONNI POLICE STATION",
        "AGED",
        "ARUVAPPULAM P.O.",
        "RESIDING AT ANZIL MANZIL",
        "ABHIJITH",
        "RESIDING AT VILAYIL THAZHETHIL VEEDU",
        "KONNI TALUK",
        "THROUGH THE SUB INSPECTOR OF POLICE"
    ],
    "sections": [
        "294(b)",
        "324 read with Section 34 IPC",
        "323"
    ],
    "outcome": "Petitioners are the accused in CC No.1186/2017 of the Judicial First Class Magistrate's Court-ll, Pathanamthitta, which has arisen from Crime No.1301/2017 of Konni Police Station for the offences puni",
    "full_text": "ee oS \" Nas E] ett wee IN THE HIGH COURT OF KERALA AT ERNAKULAM 2018/KER/277 PRESENT: THE HONOURABLE MR. JUSTICE B.KEMAL PASHA THURSDAY, THE 4TH DAY OF JANUARY 2018 / 14TH POUSHA, 1939 Cr1.MC.No. 8860 of 2017 CC.1186/2017 of JUDICIAL FIRST CLASS MAGISTRATE COURT-II, PATHANAMTHITTA CRIME NO.1301/2017 OF KONNI POLICE STATION, PATHANAMTITTA PETITIONERS/ACCUSED NO.1 TO 3: 1 HARIKRISHNAN, AGED 18 YEARS, S/O JAYAKUMAR, RESIDING AT THEKKEDATHU HOUSE, ARUVAPPULAM P.O. & VILLAGE, KONNI TALUK, PATHANAMTHITTA DISTRICT. 2 ABHIDEV, AGED 18 YEARS, S/O MOHANKUMAR, RESIDING AT CHARIVILL PADINJATTETHIL HOUSE, ARUVAPPULAM P.O. & VILLAGE, KONNI TALUK & PATHANAMTHITTA DISTRICT. 3 VISHNU S. NAIR, AGED 23 YEARS, S/O SURESH KUMAR, RESIDING AT THEKKEDATHU HOUSE, ARUVAPPULAM P.O. & VILLAGE, KONNI TALUK, PATHANAMTHITTA DISTRICT. BY ADV.SRI.MANU RAMACHANDRAN RESPONDENTS/STATE & DEFACTO COMPLAINANT & INJURED: 1. THE STATE OF KERALA, THROUGH THE SUB INSPECTOR OF POLICE, KONNI POLICE STATION, PATHANAMTHITTA DISTRICT, REPRESENTED BY PUBLIC PROSECUTOR, HIGH COURT OF KERATA-682031. 2. <ABHIJITH, AGED 23 YEARS, S/O AJAYAKUMAR, RESIDING AT VILAYIL THAZHETHIL VEEDU, ARUVAPPULAM P.O. & VILLAGE, KONNI TALUK, PATHANAMTHITTA DISTRICT-689640. 3. ANSAL, AGED 22 YEARS, S/O RAHIM, RESIDING AT ANZIL MANZIL, ARUVAPPULAM P.O. & VILLAGE, KONNI TALUK, PATHANAMTHITTA DISTRICT-689640. Ril BY PUBLIC PROSECUTOR R2 & R3 BY ADV. SRI.T.S.SARATH THIS CRIMINAL MISC. CASE HAVING COME UP FOR ADMISSION ON 04-01-2018, THE COURT ON THE SAME DAY PASSED THE FOLLOWING: EL ee ape 2018/KER/277 Cr1.MC.No. 8860 of 2017 APPENDIX PETITIONER(S)' ANNEXURES: ANNEXURE Al THE TRUE COPY OF THE FINAL REPORT IN CRIME NO.1301/2017 OF KONNI POLICE STATION, PATHANAMTHITTA DISTRICT NOW PENDING AS C.C. NO.1186/2017 ON THE FILE OF THE JFMC-II PATHANAMTHITTA. ANNEXURE A2 THE ORIGINAL OF THE SINGED JOINT STATEMENT BY THE PETITIONERS/ACCUSED NO.1 TO 3 AND RESPONDENTS 2 & 3 ATTESTED BY THEIR COUNSELS WHO APPEAR IN THE TRIAL COURT. ANNEXURE A3 THE ORIGINAL OF THE AFFIDAVIT DATED 30.11.2017 SWORN BY THE 2ND RESPONDENT ANNEXURE A4 THE ORIGINAL OF THE AFFIDAVIT DATED 30.11.2017 SWORN BY THE 3RD RESPONDENT RESPONDENT (S)' ANNEXURE NIL TRUE COPY P.S. TO JUDGE EL 2018/KER/277 B. KEMAL PASHA, J. Dated this the 4\" day of January, 2018 ORDER Petitioners are the accused in CC No.1186/2017 of the Judicial First Class Magistrate's Court-ll, Pathanamthitta, which has arisen from Crime No.1301/2017 of Konni Police Station for the offences punishable under Sections 294(b), 323 and 324 read with Section 34 IPC. 2. It seems that the matter has been amicably settled between the petitioners and the de_ facto complainant, who is the 2\" respondent herein. The 3 respondent is the other injured. 3. Respondents 2 and 3 have filed Annexures-A3 and A4 affidavits, affirming that the matter has been amicably settled between them and the petitioners and presently, they have no complaints against the petitioners. No purpose would be served in proceeding with the matter BE ore, 2018/KER/277 Crl.M.C.8860/2017 :2: further. Matters being so, all further proceedings against the petitioners in CC No.1186/2017 of the Judicial First Class Magistrate's Court-ll, Pathanamthitta, which has arisen from Crime No.1301/2017 of Konni Police Station, can be quashed. In the result, this Crl.M.C. is allowed and all further proceedings against the petitioners in CC No.1186/2017 of the Judicial First Class Magistrate's Court-ll, Pathanamthitta, which has arisen from Crime No.1301/2017 of Konni Police Station, are quashed. Sd/- (B.KEMAL PASHA, JUDGE) aks/04/01 // True Copy / PS to Judge"
}