{
    "case_id": "Crl.MC.No. 4 of 2019",
    "court": "HIGH COURT OF KERALA AT ERNAKULAM",
    "date": "2019",
    "judge": "K.ABRAHAM MATHEW THURSDAY",
    "petitioners": [
        "O. MUHAMMED",
        "UMMER KOYA",
        "o. MUHAMMED",
        "O. MUSTHAFA",
        "O. AHAMMEDKUTTY",
        "o. AHATTAJL",
        "Sd",
        "KIZHAKKEKANDIYIL HOUSE",
        "NEROMBARA HOUSE",
        "O. ASSAINAR",
        "KALLIDAMBIL HOUSE",
        "MUSTHAFA",
        "PALLIYALIL HOUSE",
        "AGED",
        "MUHAMMED FAYIS",
        "KOZHIKODE DISTRICT.",
        "YASHIQUE",
        "AHAMMEDRUTTY",
        "MC.No",
        "SAHIR",
        "K.ABRAHAM MATHEW"
    ],
    "respondents": [
        "IQRAHAN KHAN",
        "KOZHIKODE DISTRICT.",
        "THAMARASSERY POLICE STATION",
        "AGED",
        "O. BAPU BABU KHAN",
        "RESPONDENTS",
        "THE SUB INSPECTOR OF POLICE",
        "Kozhikode"
    ],
    "sections": [
        "324",
        "148",
        "482",
        "323",
        "341 r/w section 149 IPC",
        "143",
        "147"
    ],
    "outcome": "Petition filed under section 482 Cr.P.C. 2. Petitioners are the accused in Crime No.653 of 2018 of MThamarassery Police Station registered for the offences under sections 143, 147, 148, 323, 324 and 3",
    "full_text": "sree a geieee| Ee 5 ie IN THE HIGH COURT OF KERALA AT ERNAKULAM 2019/KER/7 PRESENT THE HONOURABLE MR. JUSTICE K.ABRAHAM MATHEW THURSDAY ,THE O3RD DAY OF JANUARY 2019 / 13TH POUSHA, 1940 Cr1.MC.No. 4 of 2019 CRIME NO. 653/2018 OF Thamarassery Police Station , Kozhikode PETITIONERS /ACCUSED NOS.1TO 6 :- 1 UMMER KOYA AGED 45 YEARS s/o. AHATTAJL, KALLIDAMBIL HOUSE, ADIVARAM P.O, KOZHIKODE DISTRICT. 2 YASHIQUE (ASHIQUE) AGED 27 YEARS S/O. MUHAMMED, PALLIYALIL HOUSE, ADIVARAM P.O, KOZHIKODE DISTRICT 3 MUHAMMED FAYIS, AGED 21 YEARS S/O. MUSTHAFA, KIZHAKKEKANDIYIL HOUSE, NEERAMTHODU P.O, KOZHIKODE DISTRICT. 4 AHAMMEDRUTTY, AGED 50 YEARS S/O. ASSAINAR, NEROMBARA HOUSE, THACHAMPOYIL P.O, KOZHIKODE DISTRICT. 5 SAHIR, AGED 23 YEARS S/O. AHAMMEDKUTTY, NEROMBARA HOUSE, THACHAMPOYIL P.O, KOZHIKODE DISTRICT. 6 MUSTHAFA, AGED 34 YEARS s/o. MUHAMMED, PALLIYALIL HOUSE, ADIVARAM P.O, KOZHIKODE DISTRICT. BY ADV. SRI.SUNNY MATHEW 3 aan ee OK 5 ie Cr1.MC.No. 4 of 2019 201KERIT 2 RESPONDENTS /STATE & COMPLAINANT :- 1 IQRAHAN KHAN AGED 19 YEARS S/O. BAPU BABU KHAN,RESIDING AT ROOM NO. 144, TARA ILLA, AIROLI, MAHARASHTRA STATE. 2 THE SUB INSPECTOR OF POLICE, THAMARASSERY POLICE STATION, KOZHIKODE DISTRICT. 3 STATE OF KERALA, (RESPONDENTS 2 AND 3 REPRESENTED BY THE PUBLIC PROSECUTOR, HIGH COURT OF KERALA, ERNAKULAM) BY ADV. SRI.S.R.SREEJITH R2 & R3 BY SRI C S HRITHWIK-PUBLIC PROSECUTOR THIS CRIMINAL MISC. CASE HAVING BEEN FINALLY HEARD ON 03.01.2019, THE COURT ON THE SAME DAY PASSED THE FOLLOWING: Bl Oa Crl.MC.No. 4 of 2019 201KERIT 3 ORDER Petition filed under section 482 Cr.P.C. 2. Petitioners are the accused in Crime No.653 of 2018 of MThamarassery Police Station registered for the offences under sections 143, 147, 148, 323, 324 and 341 r/w section 149 IPC. The first respondent is the victim. It is submitted that the matter has been settled and the proceedings in the trial court may be quashed. 3. Heard the learned counsel for the petitioners and first respondent and the learned Public Prosecutor. 4. I have perused the affidavit filed by the first respondent, who has entered appearance through counsel. I am satisfied that the matter has been settled and no public interest is involved in this case. There is no impediment for granting the prayer of the petitioners. In the result, this Crl.M.C is allowed. The proceedings in Crime No.653 of 2018 of Thamarassery Binal a eee Elz 4 te Crl.MC.No. 4 of 2019 201KERIT 4 Police Station are quashed. If any material objects have been produced in this case, the trial court may pass appropriate orders for their disposal. Sd/- K.ABRAHAM MATHEW, JUDGE SMA 5 au a El 4 ie Crl1.MC.No. 4 of 2019 2019/KER/7 5 APPENDIX PETITIONER'S/S ANNEXURES :- ANNEXURE Al A TRUE COPY OF FI STATEMENT AND FIR IN CRIME NO. 653/2018 OF THAMARASSERY POLICE STATION, KOZHIKODE ANNEXURE A2 TRUE COPY OF THE AFFIDAVIT SWORN TO BY 1ST RESPONDENT RESPONDENT (S)' ANNEXURES :- NIL //TRUE CoPY// PA TO JUDGE SMA"
}