{
    "case_id": "Crl.MC.No. 4901 of 2016 ()",
    "court": "HIGH COURT OF KERALA AT ERNAKULAM PRESENT",
    "date": "2016",
    "judge": "SUNIL THOMAS WEDNESDAY",
    "petitioners": [
        "CHITTATTINMUKKU",
        "P. A.",
        "PATHANAMTHITTA DISTRICT.",
        "AGED",
        "K.R",
        "ANIL KUMAR K.R",
        "MC.No"
    ],
    "respondents": [
        "ADOOR POLICE STATION",
        "THE SUB INSPECTOR OF POLICE",
        "PATHANAMTHITTA DISTRICT"
    ],
    "sections": [
        "3(1)",
        "2015",
        "3(2)",
        "506(i) of IPC read with Sections 3(1)(s)",
        "452",
        "294(b)",
        "323",
        "354"
    ],
    "outcome": "The petitioner herein is the sole accused in Crime No.1863/2016 of Adoor Police Station for offences punishable under Sections 452, 294(b), 323, 354 and 506(i) of IPC read with Sections 3(1)(s), 3(1),",
    "full_text": "a eaeeN 5. Orel - enclay 2016/KER/33890 IN THE HIGH COURT OF KERALA AT ERNAKULAM PRESENT : THE HONOURABLE MR. JUSTICE SUNIL THOMAS WEDNESDAY, THE 3RD DAY OF AUGUST 2016/12TH SRAVANA, 1938 Crl.MC.No. 4901 of 2016 () CRIME NO. 1863/2016 OF ADOOR POLICE STATION, PATHANAMTHITTA PETITIONER (S) /ACCUSED: ANIL KUMAR K.R, AGED 36 YEARS, S/O RAJAN, MINI BHAVANAM, CHITTATTINMUKKU, ERATHU VILLAGE, ADOOR, PATHANAMTHITTA DISTRICT. BY ADVS.SRI.D.KISHORE SMT.MINI GOPINATH SMT.MEERA GOPINATH SRI.R.MURALEEKRISHNAN (MALAKKARA) RESPONDENT (S)/STATE AND COMPLAINANT: 1. STATE OF KERALA, REPRESENTED BY THE PUBLIC PROSECUTOR, HIGH COURT OF KERALA, ERNAKULAM 682 031. 2. THE SUB INSPECTOR OF POLICE, ADOOR POLICE STATION, PATHANAMTHITTA DISTRICT 689 645. BY PUBLIC PROSECUTOR SMT.M.1T.SHEEBA THIS CRIMINAL MISC. CASE HAVING COME UP FOR ADMISSION ON 03-08-2016, THE COURT ON THE SAME DAY PASSED THE FOLLOWING: a 5 a5 Seep Ba 2016/KER/33890 Cr1l.MC.No. 4901 of 2016 () APPENDIX PETITIONER(S)' EXHIBITS ANNEXURE 1 TRUE COPY OF THE FIR IN CRIME 1863/2016 OF ADOOR POLICE STATION. RESPONDENT (S)' EXHIBITS : NIL /TRUE COPY/ P. A. TO JUDGE Pn Bee 2016/KER/33890 SUNIL THOMAS, J. Dated this the 3\" day of August, 2016 ORDER The petitioner herein is the sole accused in Crime No.1863/2016 of Adoor Police Station for offences punishable under Sections 452, 294(b), 323, 354 and 506(i) of IPC read with Sections 3(1)(s), 3(1),(w)(i), 3(2) (VA) of the Scheduled Castes and Scheduled Tribes (Prevention of Atrocities), Amendment Act, 2015. 2. The allegation of the defacto complainant is that, the petitioner herein had assaulted her. According to the learned counsel for the petitioner, actually there was a monetary dispute between the wife of the petitioner and the defacto complainant which promoted the defacto complainant to set up a false case. Even in the Fl statement, there is a reference about a monetary transaction. The learned counsel submits that, he is ready and willing to surrender before the court below. However, his apprehension is that, the bail application submitted by him is not likely to be taken up on the same day. Having regard to the limited prayer sought for by him, this Crl.M.C. is disposed of with a direction that in the event of the Bee 2016/KER/33890 Cri. M. C. No. 4901 of 2016 2 petitioner surrendering before the court below and files an application for bail, the same shall be considered by the court below on the same day, having regard to the spirit of the decisions reported in Shanu V. State of Kerala (2000 (3) KLT 452) and Ali V. State of Kerala (2000 (2) KLT 280) and also the contention of the learned counsel for the petitioner that the present case only an offshoot of a monetary dispute. Sd/- SUNIL THOMAS, JUDGE. Pn"
}