{
    "case_id": "Crl.MC.No.8395 OF 2019 (H)",
    "court": "HIGH COURT OF KERALA AT ERNAKULAM",
    "date": "8th day of January, 2020",
    "judge": "ASHOK MENON WEDNESDAY",
    "petitioners": [
        "O.KRISHNANKUTTY",
        "O.PRABHAKARAN",
        "SATHEESH.K",
        "MEPPALLAM",
        "PRABHA NIVAS",
        "C.S. HRITHWIK",
        "O.PRABOSH",
        "PRADEEP P",
        "Crime No.",
        "AGED",
        "JISHNU PRABOSH",
        "MEPPALLAM HOUSE",
        "THONNIPPALLAM HOUSE",
        "SANTHOSH.K",
        "THEKKEDESAM"
    ],
    "respondents": [
        "Palakkad",
        "SHARATH R",
        "AGED",
        "NALLEPPILLY -",
        "O.APPU",
        "O.RAVEENDRAN",
        "KURUVANNAMPALLAM",
        "PALAKKAD",
        "AJITH A."
    ],
    "sections": [
        "324",
        "308 read with Section 34 of the IPC",
        "148",
        "482",
        "323",
        "341",
        "143",
        "147"
    ],
    "outcome": "Dated this the 8th day of January, 2020 The petitioners are accused in Crime No.403/2019 of Chittoor Police Station, Palakkad for having allegedly committed offences punishable under Sections 143, 147",
    "full_text": "B inks MCI Peat BIER IN THE HIGH COURT OF KERALA AT ERNAKULAM 2020/KER/812 PRESENT THE HONOURABLE MR. JUSTICE ASHOK MENON WEDNESDAY, THE O8TH DAY OF JANUARY 2020 / 18TH POUSHA, 1941 Cr1.MC.No.8395 OF 2019 (H) CRIME NO.403/2019 OF Chitoor Police Station , Palakkad District PETITIONERS /ACCUSED: 1 PRADEEP P, AGED 25 YEARS, S/O.PRABHAKARAN, PRABHA NIVAS, MEPPALLAM, NALLEPPILLY.P.O. 2 JISHNU PRABOSH, AGED 19 YEARS, S/O.PRABOSH, THONNIPPALLAM HOUSE, THEKKEDESAM, NALLEPPILLY.P.O. 3 SANTHOSH.K, AGED 26 YEARS, S/O.KRISHNANKUTTY, MEPPALLAM HOUSE, NALLEPPILLY.P.O. 4 SATHEESH.K, AGED 30 YEARS, S/O.KRISHNANKUTTY, MEPPALLAM HOUSE, NALLEPPILLY.P.O. BY ADV. SRI.N.RAJESH (PALAKKAD) RESPONDENTS/STATE & DEFACTO COMPLAINANTS: 1 STATE OF KERALA, REP. BY PUBLIC PROSECUTOR, HIGH COURT OF KERALA, ERNAKULAM - 682031. 2 SHARATH R, AGED 23 YEARS, D/O.RAVEENDRAN, KURUVANNAMPALLAM, THEKKEDESAM.P.O., NALLEPPILLY - 678006. 3 AJITH A., AGED 25 YEARS, S/O.APPU, B inks MCI ae eae: Crl.MC.No.8395 OF 2019 (H) 2020/KERBI2 2 KURUVANNAMPALLAM , THEKKEDESAM.P.O., NALLEPPILLY - 678006. 4 MANOS M., AGED 21 YEARS, S/O.MADHAVAN, KURUVANNAMPALLAM , THEKKEDESAM.P.O., NALLEPPILLY - 678006. 5 PRADEEP S., AGED 21 YEARS, S/O.SREEDHARAN, ARANDAPPALLAM HOUSE, THEKKEDESAM.P.O., NALLEPPILLY - 678006. R2-5 BY ADV. SRI.K.ANAND R2-5 BY ADV. SRI.BENNY ANTONY PAREL R2-5 BY ADV. SRI.T.M.MUHAMED HAFEES OTHERS PRESENT: SRI. C.S. HRITHWIK, SENIOR PUBLIC PROSECUTOR THIS CRIMINAL MISC. CASE HAVING COME UP FOR ADMISSION ON 08.01.2020, THE COURT ON THE SAME DAY PASSED THE FOLLOWING: ee Crl.MC.No.8395 OF 2019 (H) 2020/KERBI2 3 ORDER Dated this the 8th day of January, 2020 The petitioners are accused in Crime No.403/2019 of Chittoor Police Station, Palakkad for having allegedly committed offences punishable under Sections 143, 147, 148, 341, 323, 324 and 308 read with Section 34 of the IPC. The defacto complainant and injured are respondents 2 to 5. They have appeared through counsel and filed affidavits to the effect that the matter has been amicably settled and that they do not have any grievance against the petitioners. There is also a counter case registered against the respondents herein as Crime No.402/2019 of the same Police Station which also has been settled. A report has been obtained from the Investigating Officer regarding the settlement. The petitioners do not have any criminal antecedents. There is no public interest involved. In the result, the Crl.M.C is allowed and the entire proceedings in Crime No.403/2019 of Chittoor Police Station stands quashed under Section 482 Cr.P.C and the accused are discharged. Sd/- ASHOK MENON JUDGE NR/08/01/20 iB wee Eerie ita eee Crl.MC.No.8395 OF 2019 (H) 2020/KERBI2 4 APPENDIX PETITIONERS' EXHIBITS: ANNEXURE Al TRUE COPY OF THE FIR NO.403/2019 OF CHITTOOR POLICE STATION, PALAKKAD. ANNEXURE A2 TRUE COPY OF THE AFFIDAVIT OF THE DEFACTO COMPLAINT /2ND RESPONDENT. ANNEXURE A3 TRUE COPY OF THE AFFIDAVIT OF THE INJURED/3RD RESPONDENT. ANNEXURE A4 TRUE COPY OF THE AFFIDAVIT OF THE INJURED/3RD RESPONDENT. ANNEXURE A5 TRUE COPY OF THE AFFIDAVIT OF THE INJURED/A4TH RESPONDENT. RESPONDENTS' EXHIBITS: NIL //TRUE COPY// PA TO JUDGE Bia EI as plea Cr1.MC.No.8395 OF 2019 (H) 2020/KER/812 5"
}