{
    "case_id": "Crl.MC.No. 6532 of 2016 ()",
    "court": "HIGH COURT OF KERALA AT ERNAKULAM PRESENT",
    "date": "3 day of October, 2016",
    "judge": "RAJA VIJAYARAGHAVAN V MONDAY",
    "petitioners": [
        "KOCHI",
        "NOUFAL",
        "PANCHA VILAYIL HOUSE",
        "THEVALAKKARA PO"
    ],
    "respondents": [
        "THE GEOLOGIST",
        "Prayer",
        "DEPARTMENT OF MINING AND GEOLOGY",
        "THE SUB INSPECTOR OF POLICE",
        "CHAVARA THEKKUMBHAGAM POLICE STATION"
    ],
    "sections": [
        "482"
    ],
    "outcome": "DATED 23.06.2016 IN CRL.M.C.NO. 3849/2016 OF THIS HON'BLE COURT RESPONDENT (S)' EXHIBITS : NIL. //TRUE COPY// P.A. TO JUDGE bp 2016/KER/42232 RAJA VIJAYARAGHAVAN.Y, J Dated this the 3 day of October, ",
    "full_text": "Dee eae saa reeens 2016/KER/42232 IN THE HIGH COURT OF KERALA AT ERNAKULAM PRESENT: THE HONOURABLE MR. JUSTICE RAJA VIJAYARAGHAVAN V MONDAY, THE 3RD DAY OF OCTOBER 2016/11TH ASWINA, 1938 Crl.MC.No. 6532 of 2016 () Cril.MC 3849/2016 of THIS HON'BLE COURT CRIME NO. 1323/2016 OF THEKKUMBHAGOM POLICE STATION, KOLLAM DISTRICT PETITIONER (S) : NOUFAL PANCHA VILAYIL HOUSE, PALACKAI, SOUTH, THEVALAKKARA PO, KOLLAM DISTRICT BY ADV. SRI.K.RAKESH RESPONDENT (S)/STATE & COMPLAINANT : 1. THE STATE OF KERALA REPRESENTED BY THE PUBLIC PROSECUTOR, HIGH COURT OF KERALA, ERNAKULAM, KOCHI 682031 2. THE SUB INSPECTOR OF POLICE CHAVARA THEKKUMBHAGAM POLICE STATION, KOLLAM DISTRICT, PIN 691001 3. THE GEOLOGIST DEPARTMENT OF MINING AND GEOLOGY, KOLLAM, KOLLAM DISTRICT, PIN 691001 R1 TO R3 BY PUBLIC PROSECUTOR AMJAD ALI. THIS CRIMINAL MISC. CASE HAVING COME UP FOR ADMISSION ON 03-10-2016, THE COURT ON THE SAME DAY PASSED THE FOLLOWING: bp BSE Frat te ise 2016/KER/42232 Cr1.MC.No. 6532 of 2016 () APPENDIX PETITIONER(S)' EXHIBITS ANNEXURE A: TRUE COPY OF THE REGISTRATION CERTIFICATE OF THE VEHICLE OF THE PETITIONER ANNEXURE B: TRUE COPY OF THE REPORT SENT BY THE 2ND RESPONDENT TO THE DISTRICT COLLECTOR, KOLLAM DATED 03.09.2016 ANNEXURE C: TRUE COPY OF THE ORDER DATED 23.06.2016 IN CRL.M.C.NO. 3849/2016 OF THIS HON'BLE COURT RESPONDENT (S)' EXHIBITS : NIL. //TRUE COPY// P.A. TO JUDGE bp 2016/KER/42232 RAJA VIJAYARAGHAVAN.Y, J Dated this the 3 day of October, 2016 ORDER 1.This petition is filed under section 482 of the Code of Criminal Procedure (hereinafter referred to as the Code' for brevity). 2.The petitioner is the registered owner of a mini lorry bearing registration No.KL-23L/6815. The said vehicle was seized on 23.8.2016 by the 2 respondent on the allegation that the same was used for the transportation of red earth. The grievance of the petitioner is that the seizure of the vehicle has not been reported before the learned Magistrate. 3.1 have heard the learned counsel for the petitioner as well as the learned Public Prosecutor. 4.It is submitted by the learned counsel that though the vehicle was seized under the provisions of the Kerala 2016/KER/42232 Crl.M.C.6532/2016 2 Minor Mineral Concession Rules, 2015 read with the Mines and Minerals (Development and Regulation) Act, 1957, the seizure of the vehicle has not been reported till date before the jurisdictional Magistrate. 5.The petitioner seeks for a direction to the 2 respondent to report the seizure of the aforesaid vehicle and to issue appropriate directions to the learned Magistrate to release the vehicle. The learned counsel refers to orders dated 1.9.2015 in W.A.1889/2015 and 1890/2015 and order dated 14.6.2016 in W.A.1126 of 2016 and 1129 of 2016 to contend that a Division Bench of this Court, in an appeal challenging the provisions, has passed interim orders directing release of the vehicle subject to conditions. Prayer is to direct release of the vehicle on the same conditions. 6.Having regard to the facts and circumstances, the 2 respondent is directed to report the seizure of the vehicle bearing registration No.KL-23L/6815 before the jurisdictional Magistrate and the learned Magistrate is 2016/KER/42232 Crl.M.C.6532/2016 3 directed to release the vehicle on deposit of an amount of Rs.25,000/- and on executing a bond for Rs.25,000/- without sureties. The learned Magistrate is directed to impose appropriate conditions to prevent alienation/transfer of the vehicle) and subsequent production of the vehicle. 7.However, the conditions imposed as aforesaid will be subject to modification later, in terms of the final orders in the Writ Appeals, referred to in para 5 above. The respondents 2 will be at liberty to seek for modification without referring the matter to this Court and in that event, the learned Magistrate is directed to pass appropriate orders in accordance with law. The petition is disposed off as above. Sd/- RAJA VIJAYARAGHAVAN.Y. JUDGE vps"
}