{
    "case_id": "Crl.MC.No. 8809 of 2017",
    "court": "HIGH COURT OF KERALA AT ERNAKULAM",
    "date": "2018",
    "judge": "B.KEMAL PASHA THURSDAY",
    "petitioners": [
        "SARATH CHANDRAN",
        "MATHEW JOSEPH",
        "Beene",
        "SHAN MANZIL",
        "O.RAMACHANDRAN PILLAI",
        "ZEENATH MANZIL",
        "OOYUR",
        "SYAM CHANDRAN",
        "MC.No",
        "KARINGANNOOR",
        "J. Dated"
    ],
    "respondents": [
        "O.SHANAVAS",
        "O.SHAJAHAN",
        "SHAHIR",
        "SHAFEEK"
    ],
    "sections": [
        "324",
        "308 IPC read with Section 34 IPC",
        "294(b)",
        "323",
        "308"
    ],
    "outcome": "Petitioners are accused in Crime No.1197 of 2017 of the Pooyappally Police Station, Kollam District, registered for the offences punishable under Sections 294(b), 323, 324 and 308 IPC read with Sectio",
    "full_text": "st al oe wT sore} Aw aoe IN THE HIGH COURT OF KERALA AT ERNAKULAM 2018/KER/266 PRESENT: THE HONOURABLE MR. JUSTICE B.KEMAL PASHA THURSDAY, THE 4TH DAY OF JANUARY 2018 / 14TH POUSHA, 1939 Cr1.MC.No. 8809 of 2017 CRIME NO. 1197/2017 OF POOYAPPALLY POLICE STATION, KOLLAM DISTRICT PETITIONER (S) /ACCUSED . 1 SYAM CHANDRAN, S/O.RAMACHANDRAN PILLAI, TELEPHONE EXCHANGE QUARTERS, KARINGANNOOR, VELINALLOOR, POOYAPPALLY, KOLLAM DISTRICT. 2 SARATH CHANDRAN, S/O.RAMACHANDRAN PILLAI, TELEPHONE EXCHANGE QUARTERS, KARINGANNOOR, VELINALLOOR, POOYAPPALLY, KOLLAM DISTRICT. BY ADV.SRI.SAJU.S.A RESPONDENT (S) /STATE & DEFACTO COMPLAINANT: 1. STATE OF KERALA, REPRESENTED BY PUBLIC PROSECUTOR, HIGH COURT OF KERALA, ERNAKULAM.682 031. 2. SHAHIR, S/O.SHANAVAS, SHAN MANZIL, PAYYAKKODE, OOYUR P.O, POOYAPPALLY, KOLLAM, PIN.691 510. 3. SHAFEEK, S/O.SHAJAHAN, ZEENATH MANZIL, PAYYAKKODE, OOYUR P.O, POOYAPPALLY, KOLLAM, PIN.691 510. R1 BY PUBLIC PROSECUTOR SRI.ALEX M.THOMBRA R2 & R3 BY ADV. SRI.VINAY MATHEW JOSEPH THIS CRIMINAL MISC. CASE HAVING COME UP FOR ADMISSION ON 04-01-2018, THE COURT ON THE SAME DAY PASSED THE FOLLOWING: Msd. Beene Crl.MC.No. 8809 of 2017 2018/KER/266 APPENDIX PETITIONER(S) ' ANNEXURES : ANNEXURE 1 A TRUE COPY OF THE FIR AND FIS IN POOYAPPALLY POLICE CRIME 1197/2017. ANNEXURE 2 THE AFFIDAVIT OF THE 2ND RESPONDENT DATED 02.11.2017. ANNEXURE 3 THE AFFIDAVIT OF THE 3RD RESPONDENT DATED 02.11.2017. RESPONDENT (S) ' ANNEXURES : NIL / / TRUE COPyY/ / P.S.TO JUDGE Msd. 2018/KER/266 B.KEMAL PASHA, J. Dated this the 4\" day of January, 2018 ORDER Petitioners are accused in Crime No.1197 of 2017 of the Pooyappally Police Station, Kollam District, registered for the offences punishable under Sections 294(b), 323, 324 and 308 IPC read with Section 34 IPC. 2. It seems that the matter has been amicably seitled between the parties. 3. On going through the facts and circumstances of the case, it seems that the matter can be permitted to be settled. It has been reported that no criminal antecedents have been reported against the petitioners. This Court is satisfied that there are no ingredients to invite an offence under Section 308 IPC in the matter. The defacto complainant and the other affected person have filed Annexure-2 and Annexure-3 affidavits affirming that the matter has been amicably settled between them and the petitioners and they have no complaints against the petitioners. Considering the Bee Boker 2018/KER/266 Crl.M.C.No.8809 of 2017 2 fact that the matter has already been settled amicably between the parties, this court is satisfied that no purpose would be served in proceeding with the trial of the case. Matters being so, Annexure-1 First Information Report in Crime No.1197 of 2017 of the Pooyapally Police Station, Kollam District, and all further proceedings in it, as against the petitioners, are liable to be quashed. In the result, this Crl.M.C. is allowed and Annexure-1 First Information Report in Crime No.1197 of 2017 of the Pooyapally Police Station, Kollam District, and all further proceedings in it, as against the petitioners, are hereby quashed. Sd/- B.KEMAL PASHA JUDGE DSV/4/1/18 4/TRUE COPY/ P.A.TO JUDGE"
}