{
    "case_id": "",
    "court": "Court",
    "date": "Saturday",
    "judge": "Sri",
    "petitioners": [
        "Addl",
        "Puthuval Puthen Veedu",
        "Jurisdictional Magistrate",
        "Neyyattinkara",
        "Prosecutor",
        "RESPONDENT",
        "Pradeep.V",
        "Perumpazhuthoor",
        "A.R. Shaji",
        "Excise Range",
        "Excise Inspector",
        "VI",
        "This Crl.M.C having been finally heard on"
    ],
    "respondents": [
        "Excise Inspector",
        "Prosecutor",
        "COUNTER PETITIONER"
    ],
    "sections": [
        "67B",
        "483",
        "2023",
        "55(i)"
    ],
    "outcome": "The above application has been filed by the petitioner under Section 483 of Bharatiya Nagarik Suraksha Sanhita (for short, BNSS), 2023 seeking regular bail",
    "full_text": "1 IN THE COURT OF THE SESSIONS JUDGE - VI, THIRUVANANTHAPURAM. Present : Sri. VISHNU K., ADDITIONAL SESSIONS JUDGE -VI Saturday, the 1 day of March, 2025 CRIMINAL M.C.No.529/2025 (Crime No.7/2025 of Excise Range Office, Neyyattinkara) PETITIONER/JACCUSED : Pradeep.V, S/o.Viswambaran, aged 34 years, Puthuval Puthen Veedu, Punnakkadu, Perumpazhuthoor.P.O, Pin 695126. By Adv.S.Lekha RESPONDENT/COUNTER PETITIONER:- Excise Inspector, Excise Range, Neyyattinkara, represented by Public Prosecutor, Thiruvananthapuram. By Addl.Public Prosecutor A.R. Shaji This Crl.M.C having been finally heard on 27..02..2025 and the Court on 01..03..2025 passed the following : ORDER The above application has been filed by the petitioner under Section 483 of Bharatiya Nagarik Suraksha Sanhita (for short, BNSS), 2023 seeking regular bail in connection with Crime No.07/2025 of Excise Range office, Neyyattinkara, registered for the offences punishable under sections 55(i) and 67B of Kerala Abkrai Act | of 1077. 2.Petitioner is the sole accused in the above crime. 3.The prosecution allegation is that on 13/02/2025 at 08:40 am, the accused was found in possession of 8 litres of Indian Made Foreign Liquor for the purpose of sale in contravention of the provisions of the Abkari Act. Thus, the accused is said to have committed the above offences. 2 4, Heard both sides. 5.The learned counsel for the petitioner submitted that the petitioner was arrested on 13/02/2025 and he has been in judicial custody. The counsel appeared for the petitioner further submitted that the petitioner is innocent and he is falsely implicated in the case. He has not committed any offence as alleged by the prosecution. 6.On the other hand, the learned Additional Public Prosecutor opposed the bail application. 7.It is seen from the report filed by the Investigating Officer that the accused is in custody since 13/02/2025. Major part of the investigation is completed. The contraband articles are also taken into custody and produced before Court. Therefore, this court is of the view that further detention of the accused is not warranted, rather, the petitioner can be released on bail by imposing conditions. In the result, Criminal MC is allowed on the following conditions; (i). The petitioner shall be released on bail on his executing bond for Rs.50,000/- with two solvent sureties each for the like sum to the satisfaction of the Jurisdictional Magistrate. (ii). The petitioner shall report before the Investigating Officer every Monday until further orders or until final report is filed. Dictated to the Confidential Assistant, typewritten by her in the computer, corrected by me and pronounced in open Court on the 1* day of March, 2025. VISHNU K., ADDITIONAL SESSIONS JUDGE - VI Compared by: Abirami Ps. Bence Cler-sindh.G. 3 ORDER IN CRIMINAL M.C.No.529/2025 DATED:01/03/2025 4 5"
}