{
    "case_id": "Crl.MC.No.3651 OF 2020(F)",
    "court": "HIGH COURT OF KERALA AT ERNAKULAM",
    "date": "2021",
    "judge": "P.SOMARAJAN FRIDAY",
    "petitioners": [
        "O. SUSEELAN PILLAT",
        "NEELIMA SUSEELAN PILLAI",
        "AYILIYAM",
        "SUSEELAN PILLAI",
        "AGED",
        "O.SUSEELAN PILLAI",
        "MINI SUSEELAN PILLAT"
    ],
    "respondents": [
        "THE SUB INSPECTOR",
        "THIRUVANANTHAPURAM-",
        "AGED",
        "MOHANAKUMARAN NAIR",
        "O.KRISHNA PILLAI",
        "VARKALA POLICE STATION"
    ],
    "sections": [
        "468",
        "34",
        "467",
        "465",
        "406",
        "471",
        "420"
    ],
    "outcome": "The offences alleged are under Sections 420,406, 465,467, 468,471,34 of IPC. The mtter is settled out of court. Defacto complainant filed a sworn statement in that behalf. Hence it will not serve any ",
    "full_text": "BAe Ta] oe a eats Lo: IN THE HIGH COURT OF KERALA AT ERNAKULAM 2021/KER/1264 PRESENT THE HONOURABLE MR. JUSTICE P.SOMARAJAN FRIDAY, THE O8TH DAY OF JANUARY 2021 / 18TH POUSHA, 1942 Crl.MC.No.3651 OF 2020(F) CRIME NO.1401/2019 OF VARKALA POLICE STATION , THIRUVANANTHAPURAM PETITIONERS /ACCUSED NO.1 TO 3: 1 NEELIMA SUSEELAN PILLAI, AGED 32 YEARS, D/O. SUSEELAN PILLAT, UTHRADAM VEEDU, KALLUVATHUKKAL P.O., KOLLAM PIN-691 578. 2 SUSEELAN PILLAI, UTHRADAM VEEDU, KALLUVATHUKKAL P.O., KOLLAM PIN-691 578. 3 MINI SUSEELAN PILLAT W/O.SUSEELAN PILLAI, UTHRADAM VEEDU, KALLUVATHUKKAL P.O., KOLLAM PIN-691 578. BY ADV. SRI.M.R.SASITH RESPONDENTS: 1 STATE OF KERALA, REPRESENTED BY THE PUBLIC PROSECUTOR, HIGH COURT OF KERLA, ERNAKULAM PIN-682 031. 2 MOHANAKUMARAN NAIR, AGED 62 YEARS S/O.KRISHNA PILLAI, AYILIYAM, JANARDANAPURAM, VARKALA PIN-695 141. 3 THE SUB INSPECTOR, VARKALA POLICE STATION, THIRUVANANTHAPURAM-695 141. R2 BY ADV. SRI.BLAZE K.JOSE PUBLIC PROSECUTOR SRI.M.R.DHANIL THIS CRIMINAL MISC. CASE HAVING BEEN FINALLY HEARD ON 08.01.2021, ALONG WITH Crl1.MC.1520/2020(H), THE COURT ON THE SAME DAY PASSED THE FOLLOWING: oS Da Crl.MC.No.3651 OF 2020(F) 2 2021/KER/1264 ORDER The offences alleged are under Sections 420,406, 465,467, 468,471,34 of IPC. The mtter is settled out of court. Defacto complainant filed a sworn statement in that behalf. Hence it will not serve any purpose, if it is proceeded further. The entire proceedings are hereby quashed. The Crl.M.C. is allowed accordingly. Sd/- P. SOMARAJAN JUDGE msp nies ieee Crl1.MC.No.3651 OF 2020(F) 3 2021/KER/1264 APPENDIX OF Cri.MC 3651/2020 PETITIONER'S/S EXHIBITS: ANNEXURE Al TRUE COPY OF THE FIR IN CRIME NO.1401/2019 OF VARKALA POLICE SATION, THT RUVANANTHAPURAM ANNEXURE A2 AFFIDAVIT FILED BY THE 2ND RESPONDENT. ANNEXURE A3 TRUE COPY OF THE COMPROMISE AGREEMENT EXECUTED BETWEEN THE PETITIONERS AND 2ND RESPONDENT DATED 9/7/20. RESPONDENTS EXHIBITS : NIL //TRUE COPY// P.A. TO JUDGE"
}