{
    "case_id": "Crl.MC.No. 13 of 2019",
    "court": "HIGH COURT OF KERALA AT ERNAKULAM",
    "date": "JANUARY 2019 / 13TH",
    "judge": "K.ABRAHAM MATHEW THURSDAY",
    "petitioners": [
        "KANDI HOUSE",
        "MC.No",
        "Sd",
        "MADHUMMAL HOUSE"
    ],
    "respondents": [],
    "sections": [
        "448",
        "427",
        "482",
        "294(b)",
        "323",
        "341"
    ],
    "outcome": "Petition filed under Section 482 Cr.P.C. 2. Petitioners are the accused in C.C.No.1428 of 2017 on the file of the Judicial Magistrate of First Class-II, Kannur. They are alleged to have committed the ",
    "full_text": "bers sl El: Te IN THE HIGH COURT OF KERALA AT ERNAKULAM 201/KER/22 PRESENT THE HONOURABLE MR. JUSTICE K.ABRAHAM MATHEW THURSDAY, THE O3RD DAY OF JANUARY 2019 / 13TH POUSHA, 1940 Cr1.MC.No. 13 of 2019 AGAINST CC 1428/2017 of J.M.F.C.-II, KANNUR CRIME NO. 436/2017 of Kannur City Police Station, Kannur PETITIONERS: 1 PRADEEP KUMAR M AGED 42 YEARS $/O. KUNJI RAMAN, MADHUMMAL HOUSE, ADI KADALAI POST, KANNUR DISTRICT - 670 002 2 SHINIL.K., AGED 28 YEARS S/O. MANOHARAN, AYILYANTHOL KANDI HOUSE, THOTTADA, ADI KADALAT POST, KANNUR DISTRICT 670 002 3 RISOON .M., AGED 28 YEARS S/O. RAMESAN, PARAKKETTIL HOUSE, ADI KADALAT POST, KANNUR DISTRICT - 670 002 BY ADV. SRI.P.K.RAVISANKAR RESPONDENTS: 1 STATE OF KERALA REPRESENTED BY PUBLIC PROSECUTOR, HIGH COURT OF KERALA, ERNAKULAM 2 GIREESHAN K. AGED 51 YEARS S/O. CHANDRAN, 51 YEARS, KANOTH HOUSE, ADI KADALAI POST, KANNUR DISTRICT - 670 002 it sf] El: ret Cr1.MC.No. 13 of 2019 2 2019/KER/22 BY ADV. SRI.D.ANIL KUMAR SRI ALEX M THOMBRA- PUBLIC PROSECUTOR THIS CRIMINAL MISC. CASE HAVING BEEN FINALLY HEARD ON 03.01.2019, THE COURT ON THE SAME DAY PASSED THE FOLLOWING: Crl.MC.No. 13 of 2019 3 201KERL22 ORDER Petition filed under Section 482 Cr.P.C. 2. Petitioners are the accused in C.C.No.1428 of 2017 on the file of the Judicial Magistrate of First Class-II, Kannur. They are alleged to have committed the offences under Sections 294(b), 323, 341, 427 and 448 IPC. Second respondent is the victim. It is submitted that the matter has been settled and the proceedings in the trial court may be quashed. 3. Heard the learned counsel for the petitioners and second respondent and _ the learned Public Prosecutor. 4. I have perused the affidavit filed by the second respondent, who has entered appearance through counsel. T am satisfied that the matter has been settled and no _ public interest is involved in this case. There is no rasan El: Te Cr1.MC.No. 13 of 2019 4 2019/KER(22 impediment for granting the prayer of the petitioners. In the result, this Crl.M.C. is allowed. The proceedings in C.C.No.1428 of 2017 on the file of the Judicial Magistrate of First Class-II, Kannur are quashed. If any material objects have been produced in this case, the trial court may pass appropriate orders for their disposal. Sd/- K. ABRAHAM MATHEW JUDGE MC/04.01.19 it sf] El: ret Cr1.MC.No. 13 of 2019 5 2019/KER/22 APPENDIX PETITIONER'S/S EXHIBITS: ANNEXURE A CERTIFIED COPY OF THE FINAL REPORT IN CRIME NO. 436 OF 2017 OF KANNUR CITY POLICE STATION NUMBERED AS C.C. NO. 1428 OF 2017 OF JUDICIAL FIRST CLASS MAGISTRATE COURT-11, KANNUR ANNEXURE B AFFIDAVIT DATED 20.12.2018 EXECUTED BY THE 2ND RESPONDENT RESPONDENT'S/S EXHIBITS: NIL MC (TRUE COPY) PA TO JUDGE"
}