{
    "case_id": "Crl.MC.No.3738 OF 2018",
    "court": "HIGH COURT OF KERALA AT ERNAKULAM PRESENT THE HONOURABLE MR",
    "date": "8th day of January, 2020",
    "judge": "ASHOK MENON WEDNESDAY",
    "petitioners": [
        "SHON VARGHESE",
        "LFC ROAD",
        "AGED",
        "O. BAIJU THOMAS",
        "NOW RESIDING AT PATTATHANAM HOUSE"
    ],
    "respondents": [],
    "sections": [],
    "outcome": "Dated this the 8th day of January, 2020 Learned Counsel for the petitioner seeks permission to withdraw the Crl.M.C permission is granted",
    "full_text": "Eiri meat oes 2020/KER/691 IN THE HIGH COURT OF KERALA AT ERNAKULAM PRESENT THE HONOURABLE MR. JUSTICE ASHOK MENON WEDNESDAY, THE O8TH DAY OF JANUARY 2020 / 18TH POUSHA, 1941 Crl.MC.No.3738 OF 2018 SEEKING TO QUASH THE FIR IN CRIME NO. 425 OF 2018 OF THE CHANGANASSERY POLICE STATION, KOTTAYAM DISTRICT PETITIONER: SHON VARGHESE, s/O. BAIJU THOMAS, AGED 20 YEARS, NOW RESIDING AT PATTATHANAM HOUSE, LFC ROAD, KALOOR, KOCHI 682 017 BY ADVS. SRI.C.S.MANU SRI.S.K.PREMRAT SMT.V.SARITHA PREMRAJ MRS .S. SREELAKSHMY RESPONDENTS: 1 STATE OF KERALA REPRESENTED BY THE SUB INSPECTOR OF POLICE ,CHANGANASSERY POLICE STATION, KOTTAYAM - 686 101(NOTICE ON WHOM IS SERVED UPON THE PUBLIC PROSECUTOR, HIGH COURT OF KERALA, ERNAKULAM - 682 018) 2 REDUL OMANAKUTTAN , S/O. OMANAKUTTAN, AGED 19 YEARS, RESIDING AT THYPARAMBIL HOUSE, VATTAPPALLY, VAZHAPPALLY EAST, CHANGANASSERY , KOTTAYAM - 686 101. OTHER PRESENT: SRI.B.JAYASURYA - SR. PUBLIC PROSECUTOR THIS CRIMINAL MISC. CASE HAVING COME UP FOR ADMISSION ON 08.01.2020, THE COURT ON THE SAME DAY PASSED THE FOLLOWING: Bae Crl1.MC.No.3738 OF 2018 2020/KER/691 2 ORDER Dated this the 8th day of January, 2020 Learned Counsel for the petitioner seeks permission to withdraw the Crl.M.C permission is granted and the Crl.M.C is dismissed as withdrawn. Sd/- ASHOK MENON JUDGE NR/08/01/20 Eiri meat mee Crl.MC.No.3738 OF 2018 2020/KER/691 3 APPENDIX PETITIONER'S EXHIBITS: ANNEXURE Al CERTIFIED COPY OF THE FIR IN CRIME NO.425 OF 2018 OF THE CHANGANASSERY POLICE STATION. ANNEXURE A2 AFFIDAVIT DT. 05.06.2018 OF THE 2ND RESPONDENT SWEARING THE TRUE FACTS OF THE CASE. RESPONDENTS' EXHIBITS: NIL // TRUE COPY// PA TO JUDGE"
}