{
    "case_id": "Crl.MC.No. 114 of 2019",
    "court": "HIGH COURT OF KERALA AT ERNAKULAM",
    "date": "2019",
    "judge": "K.ABRAHAM MATHEW WEDNESDAY",
    "petitioners": [
        "KALLIYOODU",
        "Sd",
        "ANSAR MANZIL",
        "ANAD VILLAGE",
        "S",
        "NEDUMANGAD",
        "AGED YEARS",
        "PANAVOOR P.O",
        "TRIVANDRUM.",
        "ANSAR",
        "CC HOUSE",
        "ANSA MANZIL",
        "M.M. HOUSE",
        "AGED",
        "NASSIM",
        "NOUSHAD",
        "MC.No",
        "MANZIL",
        "K.ABRAHAM MATHEW"
    ],
    "respondents": [
        "M.M. HOUSE",
        "NEDUMANGAD",
        "MUHAMMAD SHAFI.M",
        "AGED"
    ],
    "sections": [
        "482",
        "294(b)",
        "427"
    ],
    "outcome": "Petition filed under Section 482 Cr.P.C. 2. Petitioners are the accused in C.C.No.127/2013 on the file of the Judicial Magistrate of First Class-II, Nedumangad. They are alleged to have committed the ",
    "full_text": "ga Le a Raters Baa IN THE HIGH COURT OF KERALA AT ERNAKULAM 2019/KER/1009 PRESENT THE HONOURABLE MR. JUSTICE K.ABRAHAM MATHEW WEDNESDAY, THE O9TH DAY OF JANUARY 2019 / 19TH POUSHA, 1940 Crl1.MC.No. 114 of 2019 AGAINST CC 127/2013 of J.M.F.C.-II, NEDUMANGAD CRIME NO. 1291/2012 of Nedumangad Police Station , Thiruvananthapuram PETITIONERS : 1 NOUSHAD AGED 45 YEARS, S/O. AYSHA BEEVI, CC HOUSE, PETTAPALLY MURIYIL, PANAVOOR P.O, NEDUMANGAD, TRIVANDRUM. 2 NASSIM AGED YEARS, S/O. BADSHAW, ANSA MANZIL, PETTAPALLY MURIYIL, PANAVOOR P.O, NEDUMANGAD, TRIVANDRUM. 3 ANSAR AGED YEARS, S/O. NASSERUDEEN, ANSAR MANZIL, KALLIYOODU, ANAD VILLAGE, TRIVANDRUM. BY ADV. SRI.M.R.SARIN RESPONDENTS: 1 THE STATE OF KERALA REPRESENTED BY THE PUBLIC PROSECUTOR, HIGH COURT OF KERALA, ERNAKULAM. 2 MUHAMMAD SHAFI.M AGED 40 YEARS, S/O. MUHAMMED BASHEER, 11/369, M.M. HOUSE, PANAVOOR P.O, NEDUMANGAD, THIRUVANANTHAPURAM. BY ADV. V. VINAR SENIOR PUBLIC PROSECUTOR SRI.C.S.HRITHWIK THIS CRIMINAL MISC. CASE HAVING COME UP FOR ADMISSION ON 09.01.2019, THE COURT ON THE SAME DAY PASSED THE FOLLOWING: Crl.MC.No. 114 of 2019 2 2019/KER/1009 ORDER Petition filed under Section 482 Cr.P.C. 2. Petitioners are the accused in C.C.No.127/2013 on the file of the Judicial Magistrate of First Class-II, Nedumangad. They are alleged to have committed the offences under Sections 294(b) and 427 IPC. Second respondent is the victim. It is submitted that the matter has been settled and the proceedings in the trial court may be quashed. 3. Heard the learned counsel for the petitioners and second respondent and_ the learned Public Prosecutor. 4. I have perused the affidavit filed by the second respondent, who has entered appearance through counsel. T am satisfied that the matter has been settled and no _ public interest is involved in this case. There is no impediment for granting the prayer of the petitioners. x porta Bea Cr1.MC.No. 114 of 2019 3 2019/KER/1009 In the result, this Crl.M.C. is allowed. The proceedings in C.C.No.127/2013 on the file of the Judicial Magistrate of First Class-II, Nedumangad are quashed. If any material objects have been produced in this case, the trial court may pass appropriate orders for their disposal. Sd/- K. ABRAHAM MATHEW JUDGE MC/11.01.19 By ay Le a Romeo a: Cr1.MC.No. 114 of 2019 4 2019/KER/1009 APPENDIX PETITIONER'S/S EXHIBITS: ANNEXURE Al THE CERTIFIED COPY OF THE FIR IN CRIME NO. 1291/12 OF NEDUMANGAD POLICE STATION. ANNEXURE A2 CERTIFIED COPY OF THE FINAL REPORT IN CC NO. 127/13 PENDING BEFORE JFCM COURT-11, NEDUMANGAD. ANNEXURE A3 AFFIDAVIT SIGNED BY THE 2ND RESPONDENT RESPONDENT'S/S EXHIBITS: NIL MC (TRUE COPY) PA TO JUDGE"
}