{
    "case_id": "Crl.MC.No. 4064 of 2016",
    "court": "HIGH COURT OF KERALA AT ERNAKULAM PRESENT",
    "date": "2018",
    "judge": "B.KEMAL PASHA FRIDAY",
    "petitioners": [
        "KANNARA PEECHI VILLAGE",
        "FR.K.P.ISSAC",
        "O PAULOSE",
        "PARTY",
        "THOMAS NEDIYAPALAKKAL",
        "MC.No"
    ],
    "respondents": [
        "VIRIPAKKA VILLAGE",
        "O VARU",
        "O PAULOSE",
        "FR. THOMAS NEDIYAPALAKKAL",
        "PARTY",
        "C.V.KURIAKOSE"
    ],
    "sections": [],
    "outcome": "IN CRL.R.P 1002/2015 DATED 30-11-2015 OF THIS HON'BLE COURT AIII TRUE COPY OF ORDER IN I.A NO. 1663/2016 N OS. 5/2016 DATED 12-04-2016 OF IV ADDL.DISTRICT COURT, THRISSUR AIV TRUE COPY OF PETITION DAT",
    "full_text": "izaeoa 2018/KER/486 IN THE HIGH COURT OF KERALA AT ERNAKULAM PRESENT : THE HONOURABLE MR. JUSTICE B.KEMAL PASHA FRIDAY, THE 5TH DAY OF JANUARY 2018 / 15TH POUSHA, 1939 Crl.MC.No. 4064 of 2016 MC 23/1974 OF SUB DIVISIONAL MAGISTRATE COURT, THRISUR PETITIONER/'B' PARTY FR.K.P.ISSAC, S/O PAULOSE, KANDATHIL PUTHANPURAYIL, KANNARA PEECHI VILLAGE, THRISSUR TALUK, PIN-680 652 BY ADVS.SRI.S.SREEKUMAR (SR.) SRI.P.MARTIN JOSE SRI.P.PRIJITH SRI.THOMAS P.KURUVILLA RESPONDENT (S)/'A' PARTY: 1. THE STATE OF KERALA REPRESENTED BY PUBLIC PROSECUTOR HIGH COURT OF KERALA, ERNAKULAM, PIN- 682 031 2. C.V.KURIAKOSE, S/O VARU, CHEMMANNOOR HOUSE, CHELAKKARA P.O., THRISSUR,PIN- 680 586 3. FR. THOMAS NEDIYAPALAKKAL, S/O PAULOSE, VAZHANI P.O., VIRIPAKKA VILLAGE, THALAPPILLY TALUK, PIN- 680 589 R1 BY PUBLIC PROSECUTOR SRI T.R.RENJITH R2 BY ADV. SRI.P.G.JAYASHANKAR THIS CRIMINAL MISC. CASE HAVING BEEN FINALLY HEARD ON 05-01-2018, THE COURT ON THE SAME DAY PASSED THE FOLLOWING: K.V. Ba 2018/KER/486 Cr1.MC.No. 4064 of 2016 () APPENDIX PETITIONER (S) ' EXHIBITS AT TRUE COPY OF O.P NO.335 OF 2015 FILED BEFORE THE DISTRICT COURT, TRISSUR BY THE PARISHIONERS ON 30-06-2015 AIT TRUE COPY OF THE ORDER IN CRL.R.P 1002/2015 DATED 30-11-2015 OF THIS HON'BLE COURT AIII TRUE COPY OF ORDER IN I.A NO. 1663/2016 N OS. 5/2016 DATED 12-04-2016 OF IV ADDL.DISTRICT COURT, THRISSUR AIV TRUE COPY OF PETITION DATED 01.06.2016 FILED BY THE PETITIONER BEFORE THE SUB DIVISIONAL MAGISTRATE AV TRUE COPY OF ODER IN ANNUEXRUE-IV PETITION DATED 22-06-2016 OF SUB DIVISIONAL MAGISTRATE AVI TRUE COPY OF ODER IN M.C.NO.23/1974 DATED 28-06-2016 F SUB DIVISIONAL MAGISTRATE ,THRISSUR RESPONDENTS EXHIBITS: NIL / TRUE COPyY/ K.V. P.S.TO JUDGE ee 2018/KER/486 B. KEMAL PASHA, J. Dated this the 5\" day of January, 2018 ORDER Presently, the parties have made recourse to the civil proceedings and the First Additional District Court, Ernakulam, which is dealing with Church cases, is in seisin of the matter. An interim order of status quo has already been passed by the First Additional District Court, Ernakulam, in the matter pending as OS.29/2017 before that court. Therefore, the proceedings before the learned Sub Divisional Magistrate, Thrissur in MC.23/1974 have become infructuous. Therefore, the impugned order is liable to be quashed. In the result, this Crl.M.C. is disposed of and BEE aa ag piseeeiay 2018/KER/486 Crl.M.C.4064/2016 :2: Annexure-V order is quashed. The proceedings in MC.23/1974 shall be kept in abeyance till the final disposal of the civil suit. Sd/- (B.KEMAL PASHA, JUDGE) aks/05/01 // True Copy // PS to Judge"
}