{
    "case_id": "Crl.MC.No. 8975 of 2017",
    "court": "HIGH COURT OF KERALA AT ERNAKULAM",
    "date": "2018",
    "judge": "B.KEMAL PASHA MONDAY",
    "petitioners": [
        "AVIYIL HOUSE",
        "KRIPESH.K",
        "AGED",
        "RASHID M.A",
        "RIYAS.M.A.",
        "MC.No",
        "J. Dated"
    ],
    "respondents": [
        "O.MUHAMMED",
        "AT VANIYAM VEEDU",
        "KRIPESH.K",
        "AGED",
        "ASKER ALI",
        "HOSDURG TALUK-"
    ],
    "sections": [
        "324 read with Section 34 IPC",
        "341"
    ],
    "outcome": "Petitioners are the accused in CC No.1988/2017 of the Judicial First Class Magistrate's Court-l, Hosdurg, which has arisen from Crime No.409/2017 of Ambalathara Police Station for the offences punisha",
    "full_text": "Bee arp cat ios pees ieee IN THE HIGH COURT OF KERALA AT ERNAKULAM 2018/KER/742 PRESENT: THE HONOURABLE MR. JUSTICE B.KEMAL PASHA MONDAY, THE 8TH DAY OF JANUARY 2018 / 18TH POUSHA, 1939 Crl.MC.No. 8975 of 2017 C.C.NO. 1988/2017 OF JUDICIAL FIRST CLASS MAGISTRATE COURT-I, HOSDURG CRIME NO. 409/2017 OF AMBALATHARA POLICE STATION PETITIONER (S) /ACCUSED : 1 RIYAS.M.A., AGED 22 YEARS, S/O. ASEEZ, AVIYIL HOUSE, KANHANGAD VILLAGE, HOSDURG TALUK. 2 RASHID M.A AGED 20 YEARS, S/O. ASEEZ, AVIYIL HOUSE, KANHANGAD VILLAGE, HOSDURG TALUK. BY ADV.SRI.A.ARUNKUMAR RESPONDENT (S) /STATE/COMPLAINANT : 1. STATE OF KERALA, REPRESENTED BY PUBLIC PROSECUTOR, HIGH COURT OF KERALA, ERNAKULAM - 682 031. 2. KRIPESH.K, AGED 24 YEARS, S/O. KUNHIKRISHNAN, R/AT VANIYAM VEEDU, ERIYA, HOSDURG TALUK - 671 315. 3. ASKER ALI, AGED 24 YEARS, $/O.MUHAMMED, R/AT PAZHAYA KADAPPURAM, KANHANGAD VILLAGE, HOSDURG TALUK- 671 315. R1 BY PUBLIC PROSECUTOR SRI.ALEX M.THOMBRA R2 & R3 BY ADV. SRI.P.K.SUBHASH THIS CRIMINAL MISC. CASE HAVING COME UP FOR ADMISSION ON 08-01-2018, THE COURT ON THE SAME DAY PASSED THE FOLLOWING: Msd. Bee arp cat ios rears ieee Crl.MC.No. 8975 of 2017 2018/KER/742 APPENDIX PETITIONER(S)' ANNEXURES : ANNEXURE AT A TRUE COPY OF THE F.I.R IN CRIME NO. 409 OF 2017 OF AMBALATHARA POLICE STATION. ANNEXURE AIT A TRUE COPY OF THE FINAL REPORT IN CRIME NO. 409 OF 2017 OF AMBALATHARA POLICE STATION. ANNEXURE AIII A TRUE COPY OF THE AFFIDAVIT SWORN TO BY THE 2ND RESPONDENT. ANNEXURE AIV A TRUE COPY OF THE AFFIDAVIT SWORN TO BY THE 3RD RESPONDENT. RESPONDENT (S) ' ANNEXURES : NIL //'TRUE COPY// P.S.TO JUDGE Msd. 2018/KER/742 B. KEMAL PASHA, J. Dated this the 8\" day of January, 2018 ORDER Petitioners are the accused in CC No.1988/2017 of the Judicial First Class Magistrate's Court-l, Hosdurg, which has arisen from Crime No.409/2017 of Ambalathara Police Station for the offences punishable under Sections 341 and 324 read with Section 34 IPC. 2. It seems that the matter has been amicably settled between the petitioners and the de_ facto complainant, who is the 2\"? respondent herein. The 3 respondent is the other injured. 3. Respondents 2 and 3 have filed Annexures-All and Alll affidavits respectively, affirming that the matter has been amicably settled between them and the petitioners and presently, they have no complaints against the petitioners. When the matter is settled between the parties, no purpose Bel oe saree apa 2018/KER/742 Crl.M.C.8975/2017 :2: would be served in proceeding with the matter further. Matters being so, all further proceedings against the petitioners in CC No.1988/2017 of the Judicial First Class Magistrate's Court-], Hosdurg, which has arisen from Crime No.409/2017 of Ambalathara Police Station, can be quashed. In the result, this Crl.M.C. is allowed and all further proceedings against the petitioners in CC No.1988/2017 of the Judicial First Class Magistrate's Court-l, Hosdurg, which has arisen from Crime No.409/2017 of Ambalathara Police Station, are quashed. Sd/- (B.KEMAL PASHA, JUDGE) aks/08/01 1! True Copy // PS to Judge"
}