{
    "case_id": "CC 145/2017",
    "court": "HIGH COURT OF KERALA AT ERNAKULAM",
    "date": "2018",
    "judge": "B.KEMAL PASHA MONDAY",
    "petitioners": [
        "VIDYA NAGAR POST",
        "SHYAM RAJ",
        "CHALAKKADAVU",
        "POVVAL POST",
        "ANSAR SALMAN",
        "ASHWIN KRISHNAN",
        "SHAN SEBASTIAN",
        "HOUSE",
        "SAJESH B.",
        "ABDUL SIDEEQUE C.M.",
        "PERIYA",
        "ANEESH",
        "MULLIYARKAVU POST",
        "MANIPPADI",
        "MULLADUKKAM HOUSE POVVAL",
        "MANNAM",
        "AGED",
        "J. Dated",
        "RESIDING AT MULLACHERI HOUSE",
        "ABDUL SAHAD",
        "O.BALAKRISHNAN",
        "RESIDING AT SEYHUNA MANZIL",
        "KASARAGOD-"
    ],
    "respondents": [
        "CHEMANAD",
        "ERNAKULAM-",
        "CHENGALA",
        "DARUSSALAM HOUSE",
        "BILAL IBNU ASHRAF",
        "O.MOIDU",
        "AGED",
        "ABDUL SIDEEQUE C.M."
    ],
    "sections": [
        "324 read with Section 149 IPC",
        "148",
        "323",
        "341",
        "143",
        "147"
    ],
    "outcome": "Petitioners are the accused in CC No.145/2017 of the Judicial First Class Magistrate's Court-l, Kasaragod, which has arisen from Crime No.11/2016 of Kasaragod Police Station for the offences punishabl",
    "full_text": "Sree oe ah IN THE HIGH COURT OF KERALA AT ERNAKULAM 2018/KER/736 PRESENT: THE HONOURABLE MR. JUSTICE B.KEMAL PASHA MONDAY, THE 8TH DAY OF JANUARY 2018 / 18TH POUSHA, 1939 Cr1.MC.No. 8673 of 2017 CC 145/2017 OF JUDICIAL FIRST CLASS MAGISTRATE COURT-I, KASARAGOD. CRIME NO.11/2016 OF KASARAGOD POLICE STATION , KASARGOD PETITIONER (S) /ACCUSED: 1 SAJESH B., S/O.BALAKRISHNAN, AGED 23 YEARS, RESIDING AT NANDANAM, MANIPPADI, RD NAGAR POST, KASARAGOD-676519. 2 ASHWIN KRISHNAN, $/O.BALAKRISHNAN, AGED 20 YEARS, RESIDING AT PATHIPPURAM HOUSE, PERIYA, PERIYA POST, KASARAGOD-673636. 3 SHAN SEBASTIAN, S/O.SEBASTIAN, AGED 20 YEARS, RESIDING AT MATTAPALLY HOUSE, MANNAM, KANNOR POST KANNOOR-676306. 4 ABDUL SAHAD, S$/O.HUSSAIN, AGED 22 YEARS, RESIDING AT SEYHUNA MANZIL, CHALAKKADAVU, VIDYA NAGAR POST, KASARAGOD-676506. 5 SHYAM RAJ, S/O.GANGADHARAN, AGED 23 YEARS, RESIDING AT MULLACHERI HOUSE, THURIYANNI, MULLIYARKAVU POST, KASARAGOD-676306. 6 ANEESH, S/O.APPAKUNJI, AGED 19 YEARS, MULLADUKKAM HOUSE POVVAL, POVVAL POST, KASARAGOD-676306. BY ADV.SRI.P.E.SAJAL RESPONDENT (S) /COMPLATNANTS AND DE FACTO COMPLAINANT: 1. STATE OF KERALA, REPRESENTED BY PUBLIC PROSECUTOR, HIGH COURT OF KERALA, ERNAKULAM- 682031. 2. BILAL IBNU ASHRAF, AGED 20 YEARS, S/O.ASHARAF, DARUSSALAM HOUSE, PARAVANADUKKAM P.0O., CHEMANAD, KASARAGOD DISTRICT-671317. 3. ABDUL SIDEEQUE C.M., AGED 21 YEARS, S/O.MOIDU, CNZ HOUSE, INDIRA NAGAR P.O., CHENGALA, KASARAGOD DISTRICT-671541. -2- eigen i? es -2- 2018/KER/736 Cr1.MC.No. 8673 of 2017 () 4. ABOOBACKER SIDEEQUE, AGED 22 YEARS, S/O.ABDULLA, KAPPANA HOUSE, ETHIRTHOD, EDANEER P.O., KASARAGOD DISTRICT-671541. 5. SAHAD, AGED 23 YEARS, S/O.ABDUL SAMAD, SAHARULLA HOUSE, KALLAKKATTA, KASARAGOD DISTRICT-671123. 6. ANSAR SALMAN, AGED 23 YEARS, S/O.ABDUL RAHIMAN, PUTHIYILLATH HOUSE, KOPPA, HIDAYATH NAGAR P.O., KASARAGOD DISTRICT-671123. R1 BY PUBLIC PROSECUTOR SRI.ALEX M THOMBRA R2 TO R6 BY ADV. SRI.E.ADITHYAN THIS CRIMINAL MISC. CASE HAVING COME UP FOR ADMISSION ON 08-01-2018, THE COURT ON THE SAME DAY PASSED THE FOLLOWING: mbr/ eigen fl aes 2018/KER/736 Cr1.MC.No. 8673 of 2017 () APPENDIX PETITIONERS' ANNEXURES: ANNEXURE Ai- CERTIFIED COPY OF THE FIR IN CRIME NO.11/2016 OF THE KASARAGOD POLICE STATION. ANNEXURE A2- CERTIFIED COPY OF THE FINAL REPORT IN CRIME NO.11/2016. ANNEXURE A3- A TRUE COPY OF THE AFFIDAVITS SWORN BY THE 2ND RESPONDENT. ANNEXURE A4- A TRUE COPY OF THE AFFIDAVIT SWORN BY THE 3RD RESPONDENT. ANNEXURE A5- A TRUE COPY OF THE AFFIDAVIT SWORN BY THE 4TH RESPONDENT. ANNEXURE A6- A TRUE COPY OF THE AFFIDAVIT SWORN BY THE 5TH RESPONDENT. ANNEXURE A7- A TRUE COPY OF THE AFFIDAVIT SWORN BY THE 6TH RESPONDENT. RESPONDENTS ' ANNEXURES: NIL /TRUE COPY/ P.S.TO JUDGE mbx/ 2018/KER/736 B. KEMAL PASHA, J. Dated this the 8\" day of January, 2018 ORDER Petitioners are the accused in CC No.145/2017 of the Judicial First Class Magistrate's Court-l, Kasaragod, which has arisen from Crime No.11/2016 of Kasaragod Police Station for the offences punishable under Sections 143, 147, 148, 341, 323 and 324 read with Section 149 IPC. 2. It seems that the matter has been amicably settled between the petitioners and the de_ facto complainant, who is the 2 respondent herein. Respondents 3 to 6 are the other injured. 3. Respondents 2 to 6 have filed separate affidavits as Annexures-A3 to A7 respectively, affirming that the matter has been amicably settled between them and the petitioners and presently, they have no complaints against the 2018/KER/736 Crl.M.C.8673/2017 5. petitioners. When the maiter is settled between the parties, no purpose would be served in proceeding with the matter further. Matters being so, all further proceedings against the petitioners in CC No.145/2017 of the Judicial First Class Magistrate's Court-l, Kasaragod, which has arisen from Crime No.11/2016 of Kasaragod Police Station, can be quashed. In the result, this Crl.M.C. is allowed and all further proceedings against the petitioners in CC No.145/2017 of the Judicial First Class Magistrate's Court-l, Kasaragod, which has arisen from Crime No.11/2016 of Kasaragod Police Station, are quashed. Sd/- (B.KEMAL PASHA, JUDGE) aks/08/01 // True Copy // PS to Judge"
}