{
    "case_id": "CC 303",
    "court": "HIGH COURT OF KERALA AT ERNAKULAM PRESENT THE HONOURABLE MR",
    "date": "2020",
    "judge": "P.B.SURESH KUMAR TUESDAY",
    "petitioners": [
        "o. RAMANKUTTY",
        "PETER",
        "O.RAMANKUTTY",
        "P.O.",
        "SUMA",
        "MOODADI",
        "P.B.SURESH KUMAR",
        "AGED",
        "KOZHIKODE",
        "MALAYIL HOUSE",
        "Annexure Il",
        "BIJU K.",
        "PREMAN"
    ],
    "respondents": [
        "Vatakara"
    ],
    "sections": [
        "482",
        "406",
        "498A read with Section 34 of the Indian Penal Code"
    ],
    "outcome": "This is a proceedings instituted under Section 482 of the Code of Criminal Procedure for quashing Annexure - | final report and all further proceedings pursuant thereto now pending as C.C.No.284 of 20",
    "full_text": "Cll art ater | Races Elz mie 2020/KER/331 IN THE HIGH COURT OF KERALA AT ERNAKULAM PRESENT THE HONOURABLE MR. JUSTICE P.B.SURESH KUMAR TUESDAY, THE O7TH DAY OF JANUARY 2020 / 17TH POUSHA, 1941 Cr1.MC.No.24 OF 2020 (C) AGAINST C.C.NO.284/2019 OF THE JUDICIAL FIRST CLASS MAGISTRATE COURT, VATAKARA CRIME NO.1192/2018 OF THE VATAKARA POLICE STATION, KOZHIKODE RURAL PETITIONERS/ACCUSED NOS.1 TO 3: 1 BIJU K., AGED 37 YEARS s/o. RAMANKUTTY, KAIPPURATH HOUSE, MOODADTI (P.O.), KOYILANDY, KOZHIKODE (DIST) - 673 307. 2 PREMAN, AGED 46 YEARS s/o. RAMANKUTTY, KATPPURATH (NANDANAM) HOUSE, MOODADI (P.0O.), KOYILANDY, KOZHIKODE (DIST) - 673 307. 3 SUMA, AGED 41 YEARS D/O.RAMANKUTTY, KAIPPURATH HOUSE, MOODADI (P.O.), KOYILANDY, KOZHIKODE (DIST) 673 307. BY ADV. SMT.K.DEEPA (PAYYANUR) RESPONDENTS /STATE & COMPLAINANT: 1 STATE OF KERALA REP. BY THE PUBLIC PROSECUTOR, HIGH COURT OF KERALA, ERNAKULAM - 682 031. Eee a Elz a 2020/KER/331 Crl.M.C. No.24 of 2020 2 2 LINISHA.P.M 35 YEARS, D/O. BALAN, PADINJARA MALAYIL HOUSE, NADAKKUTHAZHA (P.O.), VATAKARA, KOZHIKODE (DIST) - 673 104. R2 BY ADV. AKHILA K NAMBIAR R1 BY SRI.SANTHOSH PETER, SR.PUBLIC PROSECUTOR THIS CRIMINAL MISC. CASE HAVING COME UP FOR ADMISSION ON 07.01.2020, THE COURT ON THE SAME DAY PASSED THE FOLLOWING : rig el ae 2020/KER/331 Crl.M.C. No.24 of 2020 3 ORDER This is a proceedings instituted under Section 482 of the Code of Criminal Procedure for quashing Annexure - | final report and all further proceedings pursuant thereto now pending as C.C.No.284 of 2019 on the files of the Court of the Judicial Magistrate of First Class, Vatakara. 2. The petitioners are the accused in the said case. The case was one instituted at the instance of the second respondent under Sections 406 and 498A read with Section 34 of the Indian Penal Code. 3. It is seen that the second respondent has settled her disputes with the petitioners, and an affidavit to that effect has been filed as Annexure II. 4. The learned counsel for the second respondent affirmed that Annexure Il is an affidavit sworn to by the second respondent and submitted that the second respondent has no rig el ae 2020/KER/331 Crl.M.C. No.24 of 2020 4 objection in granting the relief sought for by the petitioners. 5. In the light of the decision of the Apex Court in Gian singh v. State of Punjab, (2012) 10 SCC 303, | am of the view that this is an appropriate case where this court has to invoke the jurisdiction under Section 482 of the Code of Criminal Procedure to quash the proceedings against the petitioners. In the result, the Crl.M.C. is allowed and Annexure - | final report and all further proceedings pursuant thereto against the petitioners, pending as C.C.No.284 of 2019 on the files of the Court of the Judicial Magistrate of First Class, Vatakara are quashed. Sd/- P.B.SURESH KUMAR, JUDGE. DK Eee [ca] 2 ara 2020/KER/331 Crl.M.C. No.24 of 2020 5 APPENDIX PETITIONERS' EXHIBITS: ANNEXURE 1 CERTIFIED COPY OF THE FINAL REPORT OF CRIME NO. 1192/2018 OF THE VATAKARA POLICE STATION, KOZHIKODE RURAL. ANNEXURE II AFFIDAVIT FILED BY THE 2ND RESPONDENT TO THE EFFECT OF SETTLEMENT. RESPONDENTS' EXHIBITS: NIL //TRUE CoPpy// PA TO JUDGE DK"
}