{
    "case_id": "Crl.MC.No. 9101 of 2016",
    "court": "HIGH COURT OF KERALA AT ERNAKULAM PRESENT",
    "date": "DECEMBER 2016/6TH",
    "judge": "K.P.JYOTHINDRANATH TUESDAY",
    "petitioners": [
        "C.M.P.No.",
        "O. KAMALKSHI",
        "KEELIYODU",
        "Magistrate",
        "J. Crl",
        "USHA KUMARI",
        "MC.No",
        "Bea",
        "JUSTICE"
    ],
    "respondents": [
        "SUB INSPECTOR OF POLICE",
        "NEDUMANGAD POLICE STATION"
    ],
    "sections": [
        "380"
    ],
    "outcome": "IN C.M.P.NO. 16099 OF 2016 IN C.C.NO. 2734 OF 2016 DATED 05.12.2016 OF THE JFMC-Il, NEDUMANGAD IN CRIME NO. 2004/2016 OF NEDUMANGAD POLICE STATION. RESPONDENT(S)' ANNEXURES : NIL HfTRUE COPY// PA.TO J",
    "full_text": "Bea te ay e Blea 2016/KER/S55581 IN THE HIGH COURT OF KERALA AT ERNAKULAM PRESENT: THE HONOURABLE MR. JUSTICE K.P.JYOTHINDRANATH TUESDAY, THE 27TH DAY OF DECEMBER 2016/6TH POUSHA, 1938 Cri.MC.No. 9101 of 2016 C.M.P.NO. 16099 OF 2016 ON C.C.NO. 2734 OF 2016 OF THE JUDICIAL FIRST CLASS MAGISTRATE COURT-II, NEDUMANGAD CRIME NO. 2004/2016 OF NEDUMANGAD POLICE STATION, THIRUVANANTHAPURAM DISTRICT PETITIONER(S)/ACCUSED : USHA KUMARI, AGED 48 YEARS, D/O. KAMALKSHI, NELLIVILA PUTHEN VEEDU, KEELIYODU, MARANALLOOR, THIRUVANANTHAPURAM. BY ADVS. SRILBLAZE K.JOSE SMT.RESHMA G.MENON SMT.K.J.JISMA RESPONDENT(S) : 1. STATE OF KERALA, REPRESENTED BY PUBLIC PROSECUTOR, HIGH COURT OF KERALA, ERNAKULAM, PIN- 682 031. 2. SUB INSPECTOR OF POLICE, NEDUMANGAD POLICE STATION, THIRUVANANTHAPURAM, PIN- 695 116. BY SR. PUBLIC PROSECUTOR SMT. REKHA C.NAIR THIS CRIMINAL MISC. CASE HAVING COME UP FOR ADMISSION ON 27-12-2016, THE COURT ON THE SAME DAY PASSED THE FOLLOWING: Msd. Bea te soap Blea 2016/KER/S55581 Crl.MC.No. 9101 of 2016 APPENDIX PETITIONER(S)' ANNEXURES : ANNEXURE |: CERTIFIED COPY OF THE ORDER IN C.M.P.NO. 16099 OF 2016 IN C.C.NO. 2734 OF 2016 DATED 05.12.2016 OF THE JFMC-Il, NEDUMANGAD IN CRIME NO. 2004/2016 OF NEDUMANGAD POLICE STATION. RESPONDENT(S)' ANNEXURES : NIL HfTRUE COPY// PA.TO JUDGE Msd. aes 2016/KER/55581 K.P.JYOTHINDRANATH, J. Crl.M.C.No.9101 of 2016 Dated this the 27\" day of December, 2016 ORDER Petitioner is the accused in C.C.No.2734 of 2016 on the file of the Judicial First Class Magistrate Court -II, Nedumangad. The major offence alleged is under Section 380 of IPC. She was granted bail as per order in C.M.P.No.16099 of 2016 of the said court. While granting bail, the petitioner was directed to execute a bond for 250,000/- along with two solvent sureties. It is directed that at least one among the sureties shall be a close blood relative of the accused, for which she shall produce proof. The grievance is against the said imposition of condition. After hearing the learned Public Prosecutor and also considering the submission, the second condition imposed by the learned Magistrate is modified as follows: One among the sureties shall be a close blood relative of the accused and if one of the sureties is a close blood relative, she need not be a person having properties. If such a surety is Bea apa 2016/KER/55581 Crl.M.C.No.9101/2016 2 not available, the petitioner is at liberty to produce solvent sureties and the solvency can be verified by the court below by appropriate directions. Sd/- K.P.JYOTHINDRANATH, JUDGE. TRUE COPY P.A TO JUDGE DG BEpne Elz ae aH 2016/KER/55581 Crl1.M.C.No.9101/2016 3"
}