{
    "case_id": "cc 2256/2016",
    "court": "HIGH COURT OF KERALA AT ERNAKULAM",
    "date": "2020",
    "judge": "ASHOK MENON MONDAY",
    "petitioners": [
        "THE DIVISIONAL CHIEF EXECUTIVE",
        "Irinjalakkuda",
        "J.L. NEHRU ROAD",
        "KOLKATHA-",
        "TOBACCO DIVISION"
    ],
    "respondents": [
        "KERALA",
        "PRIMARY HEALTH CENTRE",
        "SRI .RAMESH CHAND-P.P",
        "OTHER PRESENT",
        "HEALTH INSPECTOR"
    ],
    "sections": [
        "482",
        "2003",
        "20"
    ],
    "outcome": "/ JUDGMENT IN cc 2256/2016 ON THE FILES OF THE COURT OF JUDICIAL MAGISTRATE OF FIRST CLASS , I RINJALAKUDA PETITIONER/2ND ACCUSED: THE DIVISIONAL CHIEF EXECUTIVE TOBACCO DIVISION, M/S ITC LTD., J.L. N",
    "full_text": "EI ks al repartee ia IN THE HIGH COURT OF KERALA AT ERNAKULAM 2020/KER/211 PRESENT THE HONOURABLE MR. JUSTICE ASHOK MENON MONDAY, THE O6TH DAY OF JANUARY 2020 / 16TH POUSHA, 1941 Cr1.MC.No.8982 OF 2019(C) AGAINST THE ORDER/ JUDGMENT IN cc 2256/2016 ON THE FILES OF THE COURT OF JUDICIAL MAGISTRATE OF FIRST CLASS , I RINJALAKUDA PETITIONER/2ND ACCUSED: THE DIVISIONAL CHIEF EXECUTIVE TOBACCO DIVISION, M/S ITC LTD., J.L. NEHRU ROAD, KOLKATHA-700 O71. BY ADVS. SRI .V.B.UNNIRAJ SRI .BECHU KURIAN THOMAS (SR.) RESPONDENTS/STATE & COMPLAINANT: 1 STATE OF KERALA REPRESENTED BY PUBLIC PROSECUTOR, HIGH COURT OF KERALA, ERNAKULAM-682 031. 2 HEALTH INSPECTOR, PRIMARY HEALTH CENTRE, ANANDAPURAM, THRISSUR-680 305. OTHER PRESENT: SRI .RAMESH CHAND-P.P THIS CRIMINAL MISC. CASE HAVING COME UP FOR ADMISSION ON 06.01.2020, THE COURT ON THE SAME DAY PASSED THE FOLLOWING: 2020/KER/211 Crl.MC 8982/2019 26 ORDER Dated this the 6th day of January 2020 The petition is filed under Section 482 cr.PC for quashing the proceedings in CC No.2256/2016 on the files of the Judicial First Class Magistrate's Court, Irinjalakkuda. The petitioner herein is the second accused and the allegation against him is that he committed an offence punishable under Section 20 of the Cigarettes and Other Tobacco Products (Prohibition of Advertisement and Regulation of Trade and Commerce, Production, Supply and Distribution) Act, 2003. The proceedings against the petitioner is sought to be quashed on the ground that the petitioner is shown as the accused in the case not by his name but by his official capacity as the Divisional Chief Executive of the Tobacco Division of M/s. ITC Ltd. The Company has not been impleaded. This Court had earlier considered the very same prayer of the petitioner in Crl. MC No.6587/2019 and vide order reported in 2019 (4) KLT 257 [bDivisional Chief Executive, Tobacco Division, ITC Ltd. v. State of 2020/KER/211 Crl.MC 8982/2019 3. Kerala], and by a detailed order quashed the proceedings as against the petitioner. The facts and the allegations against the petitioner are similar. The only difference is that in the decided case, the proceedings were pending before the Judicial First Class Magistrate's Court, Thrissur, whereas herein the proceedings are pending before the Judicial First Class Magistrate's Court, Irinjalakkuda. In view of the decision taken by this Court in 2019 (4) KLT 257, the very same order will have to be passed in this case as well. In the result, the entire proceedings as against the petitioner in CC No.2256/2016 on the files of the Judicial First Class Magistrate's Court, Irinjalakkuda shall stand quashed under Section 482 cr.PC and the petitioner/second accused is discharged. Sd/- ASHOK MENON JUDGE 4g EI ks al repartee OR 2020/KER/211 Crl.MC 8982/2019 -4q- APPENDIX PETITIONER'S/S EXHIBITS: ANNEXURE Al TRUE COPY OF THE COMPLAINT IN CC NO 2256/2016 ON THE FILES OF THE JUDICIAL FIRST CLASS MAGISTRATE COURT, IRINJALAKUDA. ANNEXURE A2 TRUE COPY OF THE MAHAZAR DATED 13.6.2016 PREPARED BY THE 2ND RESPONDENT FROM THE SHOP OF THE 1ST ACCUSED IN ANNEXURE Al COMPLAINT"
}