{
    "case_id": "Crl.MC.No. 898 of 2010 ()",
    "court": "HIGH COURT OF KERALA AT ERNAKULAM PRESENT",
    "date": "2014",
    "judge": "A-HARIPRASAD WEDNESDAY",
    "petitioners": [
        "MALAPPURAM DISTRICT.",
        "AREEKODE",
        "PALLIYALIYIL HOUSE",
        "ERNAD",
        "AGED",
        "PANDALAMCHERI",
        "J. Cri",
        "NARAYANAN",
        "ERNAD TALUK.",
        "KEEZHPARAMBU",
        "SHAJAHAN.PK",
        "MC.No",
        "AREECODE",
        "RAMEES",
        "MUJEEB RAHMAN"
    ],
    "respondents": [],
    "sections": [],
    "outcome": "Learned counsel for the petitioners submitted that the matter has become infructuous as the trial is proceeding in the lower court. Hence the Crl.M.C. is dismissed",
    "full_text": "eee pees 2014/KER/51 IN THE HIGH COURT OF KERALA AT ERNAKULAM PRESENT: THE HONOURABLE MR. JUSTICE A-HARIPRASAD WEDNESDAY, THE 1ST DAY OF JANUARY 2014/11TH POUSHA, 1935 Crl.MC.No. 898 of 2010 () CRIME NO.395/2009 OF MUKKAM POLICE STATION, KOZHIKODE PETITIONER(S)/ACCUSED: 1. MUJEEB RAHMAN, S/O. AHAMMED, PANDALAMCHERI, ENTHRATH VEEDU, KUNIYIL KEEZHPARAMBU, AREEKODE, ERNAD TALUK. MALAPPURAM DISTRICT. 2. RAMEES, S/O. ABDULLAI, PALLIYALIYIL HOUSE, KUNIYIL, KEEZHPARAMBU AREECODE, ERNAD TALUK., MALAPPURAM DISTRICT. 3. SHAJAHAN.PK, S/O. ABOO, AGED 26 YEARS, PAYYANATTUTHODI, VALLIAPUZHA.P.O AREEKODE, ERNAD, MALAPPURAM DISTRICT. BY ADV. SRLK.A.SALIL NARAYANAN RESPONDENT(S)/COMPLAINANT: STATE OF KERALA, REPRESENTED BY PUBLIC PROSECUTOR, HIGH COURT OF KERALA, ERNAKULAM. BY PUBLIC PROSECUTOR SHRI REJI JOSEPH THIS CRIMINAL MISC. CASE HAVING BEEN FINALLY HEARD ON 01-01-2014, THE COURT ON THE SAME DAY PASSED THE FOLLOWING: eee ates 2014/KER/S51 A.HARIPRASAD, J. Cri.M.C. No.898 of 2010 Dated this the 1* day of January, 2014. ORDER Learned counsel for the petitioners submitted that the matter has become infructuous as the trial is proceeding in the lower court. Hence the Crl.M.C. is dismissed as infructuous. All pending interlocutory applications will stand dismissed. A. HARIPRASAD, JUDGE. cks"
}