{
    "case_id": "CRL.MC NO. 484 OF 2024",
    "court": "HIGH COURT OF KERALA AT ERNAKULAM PRESENT THE HONOURABLE MRS",
    "date": "2024",
    "judge": "SOPHY THOMAS WEDNESDAY",
    "petitioners": [
        "O ADV.P.S.DEVADAS",
        "AMBADY GOPALAKRISHNAN"
    ],
    "respondents": [],
    "sections": [
        "482",
        "1973",
        "156(3)"
    ],
    "outcome": "This Crl.M.C. under Section 482 of CrP.C. is at the instance of the complainant in Annexure-A2 complaint on the file of Judicial First Class Magistrate Court-I, North Paravur, for quashing Annexure-Al",
    "full_text": "ee Bakes ea 2024/KER/4001 IN THE HIGH COURT OF KERALA AT ERNAKULAM PRESENT THE HONOURABLE MRS. JUSTICE SOPHY THOMAS WEDNESDAY, THE 177= pay oF JANUARY 2024 / 27TH POUSHA, 1945 CRL.MC NO. 484 OF 2024 MP 5998/2023 OF JUDICIAL MAGISTRATE OF FIRST CLASS - I, NORTH PARAVUR PETITIONER/COMPLAINANT : AMBADY GOPALAKRISHNAN, AGED 46 YEARS, S/O ADV.P.S.DEVADAS, PAZHAMPILLYSSERIL (H), MANJALY.P.O., MANJALY, ERNAKULAM, PIN - 683520. BY ADVS. PRASUN .S N.A.RETHEESH RESPONDENT /STATE: STATE OF KERALA, REPRESENTED BY PUBLIC PROSECUTOR, HIGH COURT OF KERALA, ERNAKULAM, PIN - 682031. SR.PUBLIC PROSECUTOR SRI.VIPIN NARAYAN THIS CRIMINAL MISC. CASE HAVING COME UP FOR ADMISSION ON 17.01.2024, THE COURT ON THE SAME DAY PASSED THE FOLLOWING: Pee Crl.M.C.No.484/2024 2 eases 2024/KER/4001 ORDER This Crl.M.C. under Section 482 of CrP.C. is at the instance of the complainant in Annexure-A2 complaint on the file of Judicial First Class Magistrate Court-I, North Paravur, for quashing Annexure-Al order dated 08.12.2023 and to forward Annexure-A2 complaint to SHO, Vadakkekara Police Station for investigation under Section 156(3) of the Code of Criminal Procedure, 1973. 2. The petitioner filed a private complaint, against the respondents therein, as MP No.5998 of 2023, alleging that they deployed minor school children for collecting amounts for the centenary celebrations of SNMHS, Moothakunnam. His prayer in the complaint was to forward the complaint for investigation to SHO, Vadakkekara, under Section 156(3) of CrP.C. But as per Annexure-Al order, learned Magistrate posted it for taking sworn statement of the petitioner/ complainant, stating that, investigation by the Police was not necessary. Pee Crl.M.C.No.484/2024 3 eases 2024/KER/4001 3. Learned counsel for the petitioner would submit that several documents are to be collected and witnesses are to be questioned and that has to be done only through proper investigation done by Police. So, it was absolutely necessary to get the investigation done through SHO, Vadakkekara Police Station, and Annexure-Ail order, by which, the MP was posted for sworn statement of the petitioner, and also the finding that investigation by Police was not necessary, are liable to be set aside. 4. Adverting to the facts and circumstances, and also on hearing the submissions made at the Bar, this Court is of the view that Annexure-A2 complaint filed by the complainant ought to have been forwarded to SHO, Vadakkekara Police Station, for investigation and report. Learned Magistrate, without assigning any specific reasons, could not have jumped into a conclusion that investigation by Police was not necessary, when the case of the complainant was that several documents have to be collected and several witnesses were to be questioned to ae Crl.M.C.No.484/2024 4 Sa Ge 2024/KER/4001 bring out the real state of affairs. So this Court is inclined to set aside Annexure-Al order dated 08.12.2023 and to direct the learned Magistrate to forward Annexure-A2 complaint to SHO, Vadakkekara Police Station for investigation and report. The Crl.M.C. stands allowed accordingly. Sd/- SOPHY THOMAS JUDGE DSV/- Bakes Crl.M.C.No.484/2024 5 sat 2024/KER/4001 APPENDIX OF CRL.MC 484/2024 PETITIONERS ANNEXURES : Annexure Al THE TRUE SCANNED COPY OF THE ORDER DATED 08.12.2023 IN M.P.NO.5998 OF 2023 OF THE JUDICIAL FIRST CLASS MAGISTRATE COURT-I, NORTH PARAVUR. Annexure A2 THE TRUE SCANNED COPY OF PRIVATE COMPLAINT DATED 08.12.2023 PREFERRED BY THE PETITIONER BEFORE THE JUDICIAL FIRST CLASS MAGISTRATE COURT-I, NORTH PARAVUR. Annexure A3 THE TRUE COPY OF THE REPORT NO.V4/1720140 /2022/DGE OF THE DEPUTY DIRECTOR, DIRECTORATE OF GENERAL EDUCATION OBTAINED BY THE PETITIONER/COMPLAINT UNDER THE RIGHT TO INFORMATION ACT, 2005. RESPONDENT S ANNEXURES : NIL"
}