{
    "case_id": "Crl.MC.No. 191 of 2019",
    "court": "HIGH COURT OF KERALA AT ERNAKULAM PRESENT THE HONOURABLE MR",
    "date": "2019",
    "judge": "K.ABRAHAM MATHEW WEDNESDAY",
    "petitioners": [
        "O.PRABHAKARAN",
        "Irinjalakkuda",
        "RAVI",
        "THRISSUR DISTRICT.",
        "RAJAN",
        "BIJU",
        "MURIYADU",
        "Sd",
        "O.VASU",
        "O.VAREEDH",
        "NADAPARAMBIL HOUSE",
        "Rs.",
        "JOSE",
        "AGED",
        "O.NARAYANAN",
        "DESOM",
        "PALLIVALAPPIL HOUSE",
        "MC.No",
        "BalsroRs Tal",
        "DISTRICT."
    ],
    "respondents": [
        "OTHER PRESENT"
    ],
    "sections": [
        "482",
        "8",
        "7"
    ],
    "outcome": "Petition filed under Section 482 Cr.P.C. 2. Petitioners are the accused in CC No. 4516 of 2012 on the file of the Judicial First Class Magistrate Court, Irinjalakkuda. They are alleged to have committ",
    "full_text": "meer | ae 5 ie 2019/KER/1058 IN THE HIGH COURT OF KERALA AT ERNAKULAM PRESENT THE HONOURABLE MR. JUSTICE K.ABRAHAM MATHEW WEDNESDAY, THE OSTH DAY OF JANUARY 2019 / 19TH POUSHA, 1940 Cr1.MC.No. 191 of 2019 ce 4516/2012 OF J.M.F.C., IRINJALAKUDA CRIME NO. 742/2012 OF PUDUKKAD POLICE STATION, THRISSUR PETITIONER/S: 1 RAJAN, AGED 51 YEARS S/O.NARAYANAN, AINIKKATHARA HOUSE, VELOOPPADAM DESOM, VARANTHARAPILLY VILLAGE, THRISSUR DISTRICT. 2 BIJU, AGED 43 YEARS S/O.PRABHAKARAN, NOCHI HOUSE, CHENGALOOR DESOM, CHENGALOOR VILLAGE, CHENGALOOR P.O., PIN- 680312. 3 RAVI, AGED 56 YEARS S/O.VASU, PALLIVALAPPIL HOUSE, AMBALLOOR DESOM, AMBALLOOR VILLAGE, ALAGAPPA NAGAR P.O., THRISSUR DISTRICT. 4 JOSE, AGED 57 YEARS S/O.VAREEDH, VATTAKKUZHY HOUSE, KALLOUR DESOM, KALLOUR VILLAGE, KALLOUR, PIN- 680317. eee a - Ez 5 ie 2019/KER/1058 Cr1l.MC.No. 191 of 2019 5 JAYAKUMAR, AGED 51 YEARS S/O.NARAYANAN NAIR, VADASSERI HOUSE, MURIYADU DESOM, MURIYADU VILLAGE, MURIYADU, THRISSUR DISTRICT. 6 JACOB K.O., AGED 58 YEARS S/O.OUSEPH, KOODALY HOUSE, MANNAMPETTA DESOM, AMBALLOOR VILLAGE, VARAKKARA P.O. (ALAGAPPANAGAR) , THRISSUR DISTRICT. 7 SONY GEORGE, AGED 43 YEARS S/O.GEORGE, PULLIKKATHAZHE HOUSE, KANNARA DESOM, PEECHI VILLAGE, KANNARA P.O., THRISSUR. 8 JOY, AGED 71 YEARS S/O.JAMES, KOTHANICKAL HOUSE (WRONGLY DESCRIBED IN THE FINAL REPORT AS POTHANIKKAL HOUSE) , KALLOUR DESOM, KALLOUR VILLAGE, THRISSUR DISTRICT. 9 GOPALAKRISHNAN , AGED 71 YEARS S/O.GOPALAKRISHNA KAIMAL, PARAPPILLY HOUSE, AMBALLOOR DESOM, AMBALLOOR VILLAGE, ALAGAPPANAGAR P.O., THRISSUR DISTRICT. 10 PHILIP, AGED 56 YEARS S/O.PORINJU, CHEVIDAN HOUSE, PUDUKKAD VILLAGE, THORAVU DESOM, PUDUKKAD, PIN- 680301, THRISSUR DISTRICT. 11 RAPPAIL, AGED 65 YEARS S/O.VARAPPAN, KUNNATHU HOUSE, KALLOUR DESOM, KALLOUR VILLAGE, THRISSUR DISTRICT. ine | Ez 5 ie 2019/KER/1058 Cr1l.MC.No. 191 of 2019 12 SEBL, AGED 46 YEARS S/O.THOMAS, ARIMBOOR HOUSE, ANCHERRY DESOM, OLLOUR VILLAGE, MARIYAPURAM P.O., THRISSUR DISTRICT. 13 SHIJU, AGED 43 YEARS S/O.SIVARAMAN, NADAPARAMBIL HOUSE, VARANTHARAPPILLY DESOM, VARANTHARAPPILLY VILLAGE, THRISSUR DISTRICT. 14 JOHNSON, AGED 53 YEARS S/O.PORINJU, PUTHUKKADAN HOUSE, PUDUKKAD VILLAGE, THORAVU DESOM, PUDUKKAD- 680301. 15 JOHN, AGED 54 YEARS S/O.PAULOSE, ARAKKAPADAN HOUSE, VENDOOR DESOM, AMBALLOOR VILLAGE, ALAGAPPANAGAR- 680302. 16 ARUN, AGED 33 YEARS S/O.RAMAKRISHNAN, MULLAKKAPARAMBIL HOUSE, AMBALLOOR DESOM, AMBALLOOR VILLAGE, ALAGAPPANAGAR- 680302, THRISSUR DISTRICT. BY ADVS. SRI.NIREESH MATHEW SRI.N.P.PRAJEESH RESPONDENT/S: STATE OF KERALA, REPRESENTED BY THE PUBLIC PROSECUTOR, HIGH COURT OF KERALA, ERNAKULAM, KOCHI- 682031. OTHER PRESENT: SRI ALEX M THOMBRA- SR PUBLIC PROSECUTOR BalsroRs Tal iene fe 4 te 2019/KER/1058 Crl.MC.No. 191 of 2019 14.. THIS CRIMINAL MISC. CASE HAVING COME UP FOR ADMISSION ON 09.01.2019, THE COURT ON THE SAME DAY PASSED THE FOLLOWING: ORDER Petition filed under Section 482 Cr.P.C. 2. Petitioners are the accused in CC No. 4516 of 2012 on the file of the Judicial First Class Magistrate Court, Irinjalakkuda. They are alleged to have committed the offences under sections 7 and 8 of the Kerala Gaming Act (for short, the Act). The proceedings are sought to be quashed on the ground that the prosecution has no case that the incident took place in a common gaming house. 3. Heard the learned counsel for the petitioners and the learned Public Prosecutor. 4, It is not in dispute that to attract sections 7 and 8 of the Act the incident should take place in a common gaming house. In this case eae 2019/KER/1058 Crl.MC.No. 191 of 2019 1.5e. the prosecution has no such allegation. It follows that the proceedings against the petitioners are liable to be quashed. In the result, this Crl.M.C is allowed. The proceedings in CC No. 4516 of 2012 on the file of the Judicial First Class Magistrate Court, Irinjalakkuda are quashed. Rs.1,00,000/- (Rupees One lakh only) out of the money seized from the petitioners shall be credited to the Chief Ministers Distress Relief Fund and the balance amount shall be refunded to the petitioners. Sd/- K.ABRAHAM MATHEW JUDGE Bka/10.01.2019 ie CE 4 ie 2019/KER/1058 Cr1l.MC.No. 191 of 2019 APPENDIX PETITIONER'S/S EXHIBITS: ANNEXURE A TRUE PHOTOCOPY OF THE FIRST INFORMATION REPORT DATED 03.06.2012 IN CRIME NO.742/2012 OF PUDUKKAD POLICE STATION. ANNEXURE B CERTIFIED COPY OF THE FINAL REPORT IN CRIME NO.742/2012 OF PUDUKKAD POLICE STATION. ANNEXURE C PHOTOCOPY OF THE DECISION, SUNIL AND OTHERS VS. STATE OF KERALA AND ANOTHER REPORTED IN 2014(1) KHC 469. ANNEXURE D PHOTOCOPY OF THE DECISION, DANYKUTTY VS. STATE OF KERALA REPORTED IN 1999(3) KLT 930. ANNEXURE E PHOTOCOPY OF THE DECISION, KUNHIKANNAN AND OTHERS VS. ASSISTANT SUB INSPECTOR OF POLICE, REPORTED IN 1985 KLT 484. ANNEXURE F PHOTOCOPY OF THE ORDER DATED 10.10.2018 IN CRL.M.C.NO. 6732/2018 PASSED BY THIS HON'BLE COURT."
}