{
    "case_id": "Crl.MC.No. 6043 of 2013 ()",
    "court": "HIGH COURT OF KERALA AT ERNAKULAM PRESENT",
    "date": "2 day of January, 2014",
    "judge": "HARUN-UL-RASHID THURSDAY",
    "petitioners": [
        "KULASEKHARAMANGALAM",
        "P. A.",
        "SUNIL AGED",
        "O. RAJAPPAN",
        "MC.No"
    ],
    "respondents": [],
    "sections": [
        "13",
        "5",
        "482",
        "3",
        "4"
    ],
    "outcome": "/JUDGMENT IN CC 38/2010 of ADDL.C.J.M. (E&O), ERNAKULAM CRIME NO. 1927/2009 OF ERNAKULAM NORTH POLICE STATION, ERNAKULAM PETITIONER (S) /PETITIONER/1ST ACCUSED: SUNIL AGED 44 YEARS S/O. RAJAPPAN, THUR",
    "full_text": "ae aes 2014/KER/246 IN THE HIGH COURT OF KERALA AT ERNAKULAM PRESENT: THE HONOURABLE MR.JUSTICE HARUN-UL-RASHID THURSDAY, THE 2ND DAY OF JANUARY 2014/12TH POUSHA, 1935 Crl.MC.No. 6043 of 2013 () AGAINST THE ORDER/JUDGMENT IN CC 38/2010 of ADDL.C.J.M. (E&O), ERNAKULAM CRIME NO. 1927/2009 OF ERNAKULAM NORTH POLICE STATION, ERNAKULAM PETITIONER (S) /PETITIONER/1ST ACCUSED: SUNIL AGED 44 YEARS S/O. RAJAPPAN, THURUTHEL HOUSE, MRAVANTHURUTHU KULASEKHARAMANGALAM, VAIKOM, KOTTAYAM DISTRICT PIN-686608. BY ADV. SRI.P.A.MUJEEB COMPLAINANT (S) /RESPONDENT/COMPLAINANT AND STATE: STATE OF KERALA REPRESENTED BY THE PUBLIC PROSECUTOR, HIGH COURT OF KERALA, ERNAKULAM, COCHIN-31. BY PUBLIC PROSECUTOR SMT.SAREENA GEORGE THIS CRIMINAL MISC. CASE HAVING COME UP FOR ADMISSION ON 02-01-2014, THE COURT ON THE SAME DAY PASSED THE FOLLOWING: BRA 2014/KER/246 Cr1l.MC.No. 6043 of 2013 () APPENDIX PETITIONER(S)' EXHIBITS ANNEXURE A1- PHOTOCOPY OF THE F.I.R IN CRIME NO. 1927/2009 OF ERNAKULAM TOWN NORTH POLICE STATION ERNAKULAM, ERNAKULAM DISTRICT. ANNEXURE A2- PHOTOCOPY OF THE CHARGE SHEET IN C.C.NO. 38/2010 NOW PENDING BEFORE THE HON'BLE ADDITIONAL CHIEF JUDICIAL MAGISTRATE COURT (EO), ERNAKULAM RESPONDENT (S)' EXHIBITS : NIL /TRUE COPY/ P. A. TO JUDGE Pn ees 2014/KER/246 HARUN-UL-RASHID, J. CIILM.C. No. 6043 OF 2013 Dated this the 2 day of January, 2014 ORDER The petitioner is the 1* accused in Crime No.1927/2009 of Ernakulam Town North Police Station, Ernakulam. The offences alleged are punishable under Sections 3,4,5 & 7 of Immoral Traffic Prevention Act. The police, after investigation, laid the charge sheet before the Additional Chief Judicial Magistrate Court (EO), Ernakulam and is numbered as C.C.No.38/2010. 3. The respondent Circle Inspector of Police conducted the search and arrested the accused. As per provisions under Section 13 of the Act, he is not an officer competent to conduct search because, the detecting officer is neither a Traffic Police Officer nor a Special Officer, who has the authority to search and conduct arrest as per the provisions of the Immoral Traffic Prevention Act. 4. In the facts and circumstances of the case, the search and arrest were not effected in accordance with the provisions of the Act. There is no possibility of the case to end in conviction. 5. In view of the admitted position in this case, that the search was not effected by the Special Police Officer and the Ele ae 2014/KER/246 Crl.M.C. No. 6043 OF 2013 ; arrest was also not in accordance with law, same has to be held per se illegal. This is a fit case wherein, this Court should invoke the inherent power vested under Section 482 of Cr.P.C. to terminate the procedure. In the result, this Crl.M.C is allowed. All further proceedings in C.C.No.38/2010 pending before the Additional Chief Judicial Magistrate Court (EO), Ernakulam is quashed. Sd/- HARUN-UL-RASHID, JUDGE. AV"
}