{
    "case_id": "Crl.MC.No.5641 OF 2019(&)",
    "court": "HIGH COURT OF KERALA AT ERNAKULAM",
    "date": "2020",
    "judge": "ASHOK MENON WEDNESDAY",
    "petitioners": [
        "Manne Bian Crl",
        "AGED",
        "O PURUSHOTHAMAN NAIR",
        "P.V.PRASANTH",
        "C.G.S",
        "VILLAGE"
    ],
    "respondents": [
        "O T.K RADHAKRISHNAN",
        "ERNAKULAM-",
        "OF KERALA",
        "ADDL.R",
        "R ANIL KUMAR",
        "P.O",
        "AGED",
        "OTHER PRESENT",
        "CHRISTEENA P GEORGE"
    ],
    "sections": [
        "34",
        "295",
        "506(1)",
        "482",
        "294(b)",
        "323",
        "353",
        "341",
        "08"
    ],
    "outcome": "/JUDGMENT IN CC 183/2018 OF CHIEF JUDICIAL MAGISTRATE ,KOLLAM PETITIONER/S: P.V.PRASANTH AGED 51 YEARS $/O PURUSHOTHAMAN NAIR, SWASTHIKA HOUSE, C.G.S,NAGAR,P.O. PAPPANAMKODE , PAPPANAMKODE , NEMAM VIL",
    "full_text": "marr o wes BlRsay IN THE HIGH COURT OF KERALA AT ERNAKULAM 2020/KERI756 PRESENT THE HONOURABLE MR. JUSTICE ASHOK MENON WEDNESDAY, THE O8TH DAY OF JANUARY 2020 / 18TH POUSHA, 1941 Cr1.MC.No.5641 OF 2019(E) AGAINST THE ORDER/JUDGMENT IN CC 183/2018 OF CHIEF JUDICIAL MAGISTRATE ,KOLLAM PETITIONER/S: P.V.PRASANTH AGED 51 YEARS $/O PURUSHOTHAMAN NAIR, SWASTHIKA HOUSE, C.G.S,NAGAR,P.O. PAPPANAMKODE , PAPPANAMKODE , NEMAM VILLAGE , THIRUVANANTHAPURAM. BY ADVS. SRI.P.G.SURESH SMT .ASWATHY KRISHNAN RESPONDENT/S: 1 STATE OF KERALA REPRESENTED THROUGH THE PUBLIC PROSECUTOR,HIGH COURT OF KERALA, ERNAKULAM-682031. 2 R ANIL KUMAR AGED 41 YEARS S/O T.K RADHAKRISHNAN ,RADHA BHAVANAM , OTTAKAL P.O,THENMALA KOLLAM, 691308 ADDL.R2 IS IMPLEADED AS PER ORDER DATED 07.01.2020 R2 BY ADVS. SANTHAN V NAIR CHRISTEENA P GEORGE OTHER PRESENT: SRI. C.S.HRITHWIK SR PP THIS CRIMINAL MISC. CASE HAVING COME UP FOR ADMISSION ON 08.01.2020, THE COURT ON THE SAME DAY PASSED THE FOLLOWING: ee ope Crl.MC.No.5641 OF 2019(&) 2 2020/KERI796 ORDER Dated this the 8th day of January 2020 Petitioner is the accused in C.C. No.183/2018 on the files of the Chief Judicial Magistrate Court, Kollam for having allegedly committed offences punishable under Sections 341, 323, 353, 294(b), 506(1) of IPC. 2. The de facto complainant and injured is the additional 2\"? respondent. He is appeared through counsel and filed affidavit to the effect that the matter has been amicably settled and that he has no grievance against the petitioner. There is also a counter case against the additional 2 respondent herein and others as C.C No.274/2018, which was also settled between the parties. A report has been called for from the investigating officer through the Senior Public Prosecutor, There is no public interest involved. The petitioner do not have any criminal antecedents. In the result, the Crl.M.C is allowed and the entire proceedings in C.C No.183/2018 on the files of the Chief Dae) Manne Bian Crl.MC.No.5641 OF 2019(&) 3 2020/KERI796 Judicial Magistrate Court, Kollam stands quashed under Section 482 of Cr.P.C and the accused is discharged. Sd/- ASHOK MENON rmm JUDGE Ips saeIE i pare nee Crl.MC.No.5641 OF 2019(&) 4 2020/KERI756 APPENDIX OF Crl.MC 5641/2019 PETITIONER'S/S EXHIBITS: ANNEXURE Al THE CERTIFIED COPY OF THE FIRST INFORMATION REPORT REGISTERED BY THE KOLLAM RAILWAY POLICE STATION IN THE CRIME NO.92/2018 FOR THE OFFENCES COMMITTED UNDER SECTION 341,353,295 (B)506(1)AND 34 OF THE INDIAN PENAL CODE DATED 08.06.2018. ANNEXURE A2 THE TRUE COPY OF THE O.P.TICKET ISSUED BY THE DISTRICT HOSPITAL, KOLLAM DATED , 08.06.2018. ANNEXURE A3 THE CERTIFIED COPY OF THE FINAL REPORT LATD DOWN BEFORE THE HONOURABLE CHIEF JUDICIAL MAGISTRATE COURT,KOLLAM IN THE CRIME NO.92/2018 OF RATLWAY POLICE STATION ,KOLLAM,DATED 30.07.2018 ANNEXURE A4 THE TRUE COPY OF THE COMPLAINT FILED BEFORE THE HONOURABLE CHIEF JUDICIAL MAGISTRATE COURT,KOLLAM AS CRL.M.P.NO.5189/2018 DATED 21.07.2018."
}