{
    "case_id": "Crl.MC.No. 5367 of 2016",
    "court": "HIGH COURT OF KERALA AT ERNAKULAM",
    "date": "9 day of January, 2018",
    "judge": "B.KEMAL PASHA TUESDAY",
    "petitioners": [
        "B-",
        "O.VARGHESE",
        "SHIBU I.VARGHESE",
        "KARINGACHIRA",
        "B.KEMAL PASHA",
        "ILLICKAL HOUSE",
        "DATED",
        "MC.No",
        "MARIA JOSEPH"
    ],
    "respondents": [
        "RESIDING EDAKKATTUKUDI HOUSE",
        "THIRUVANKULAM KARA AND VILLAGE",
        "HILL PALACE APARTMENT",
        "MARIA JOSEPH",
        "KANAYANNUR TALUK"
    ],
    "sections": [
        "107"
    ],
    "outcome": "Annexure A12 proceedings have been initiated before the Judicial First Class Magistrate's Court, Chottanikara, by the Chottanikara Police under Section 107 Cr.P.C. 2. Much discussion is not required t",
    "full_text": "REA po ce Bina IN THE HIGH COURT OF KERALA AT ERNAKULAM 2018/KER/979 PRESENT: THE HONOURABLE MR. JUSTICE B.KEMAL PASHA TUESDAY, THE 9TH DAY OF JANUARY 2018 / 19TH POUSHA, 1939 Crl.MC.No. 5367 of 2016 MC.NO. 231/2016 OF SUB DIVISIONAL MAGISTRATE COURT,FORT KOCHI CRIME NO.277/2016 OF CHOTTANIKARA POLICE STATION PETITIONER: SHIBU I.VARGHESE, S/O.VARGHESE, AGED 45 YEARS, ILLICKAL HOUSE, HILLPALACE P.O, KARINGACHIRA, ERNAKULAM DISTRICT. BY ADV.SRI.BIJU ABRAHAM RESPONDENT (S) : 1. STATE OF KERALA, REPRESENTED BY THE PUBLIC PROSECUTOR, HIGH COURT OF KERALA ,ERNAKULAM,COCHIN-31. 2. MARIA JOSEPH, D/O.ANTONY JOSEPH,AGED 44 YEARS, RESIDING EDAKKATTUKUDI HOUSE, B-3, HILL PALACE APARTMENT,APPLE FLAT PHASE I, THIRUVANKULAM KARA AND VILLAGE, KANAYANNUR TALUK, ERNAKULAM -682 015. Ri BY PUBLIC PROSECUTOR SRI.AMJAD ALI R2 BY ADV. SRI.PEEYUS A.KOTTAM THIS CRIMINAL MISC. CASE HAVING BEEN FINALLY HEARD ON 09-01-2018,THE COURT ON THE SAME DAY PASSED THE FOLLOWING : sts ies Crl.MC.No. 5367 of 2016 () 2018/KER/979 APPENDIX PETITIONER (S) 'ANNEXURES: ANNEXURE Al A TRUE COPY OF THE COMPLAINT SUBMITTED BY THE PETITIONER BEFORE THE SUB INSPECTOR OF POLICE, HILL PALACE DATED 13.3.2013 ANNEXURE A2 A TRUE COPY OF THE RECEIPT OF THE COMPLAINT ISSUED BY THE HILL PALACE POLICE STATION DATED 14.3.2013 ANNEXURE A3 A TRUE COPY OF THE JUDGMENT IN SC NO.8/2015 OF THE PRINCIPAL ASSISTANT SESSIONS JUDGE, ERNAKULAM DATED 29.2.2016 ANNEXURE A4 A TRUE COPY OF THE F.I.R. AND FINAL REPORT IN CRIME NO.64/2015 ON THE FILES OF JUDICIAL FIRST CLASS MAGISTRATE COURT, CHOTTANIKARA (C.C.NO.200/2015) ANNEXURE A5 A TRUE COPY OF THE OP NO.1779/2014 ON THE FILES OF FAMILY COURT, ERNAKULAM ANNEXURE A6 A TRUE COPY OF THE COUNTER AFFIDAVIT OF THE PETITIONER IN OP NO.1779/2014 ON THE FILES OF FAMILY COURT, ERNAKULAM ANNEUXRE A7 A TRUE COPY OF THE COMPLAINT FILED BY THE PETITIONER AS AGAINST THE 2ND RESPONDENT BEFORE THE CHOTTANIKARA POLICE STATION DATED 11.5.2015 ANNEXURE A8 A TRUE COPY OF THE ACKNOWLEDGMENT RECEIPT OF THE PETITION ISSUED BY THE CHOTTANIKARA POLICE DATED 11.5.2015 ANNEXURE AQ A TRUE COPY OF THE F.I.R. AND FINAL REPORT IN CRIME NO.297/2015 (C.C.NO.278/2015), ON THE FILES oF JUDICIAL FIRST CLASS MAGISTRATE COURT, CHOTTANIKKARA. ANNEXURE A10 A TRUE COPY OF THE COMPLAINT FILED AS C.M.P NO.522/2015 (NOW CC.NO.242/20150 ON THE FILES OF JUDICIAL FIRST CLASS MAGISTRATE COURT, CHOTTANIKARA DATED 20.5.2015 ANNEXURE A11 A TRUE COPY OF THE NOTICE IN M.C. NO.231/2016 DATED 19.4.2016 ANNEXURE A12 CERTIFIED COPY OF THE F.I.R. IN MC NO.231/2016 ON THE FILES OF SUB DIVISIONAL MAGISTRATE, FORT KOCHI. RESPONDENT'S ANNEXURES: NIL / TRUE COPY/ sts P.S.TO JUDGE 2018/KER/979 B. KEMAL PASHA, J. ee ene \"Dated this the 9 day of January, 2018 ORDER Annexure A12 proceedings have been initiated before the Judicial First Class Magistrate's Court, Chottanikara, by the Chottanikara Police under Section 107 Cr.P.C. 2. Much discussion is not required to conclude that there are no materials to initiate proceedings under Section 107 Cr.P.C. as against the petitioner. Matters being so, Annexure A712 is liable to be quashed. In the result, this Crl.M.C. is allowed and Annexure- A12 proceedings, as against the petitioner, are hereby quashed. Sd/- B. KEMAL PASHA, JUDGE. ul/- [True copy] P.S. to Judge."
}