{
    "case_id": "Crl.MC.No.55 OF 2020(F)",
    "court": "HIGH COURT OF KERALA AT ERNAKULAM PRESENT THE HONOURABLE MR",
    "date": "THE 07TH DAY",
    "judge": "P.B.SURESH KUMAR TUESDAY",
    "petitioners": [
        "O.SULAIMAN",
        "NISAR BABU",
        "P.O.",
        "SHAHUL HAMEED",
        "MALAPPURAM",
        "FOUZU MON",
        "AGED",
        "Manjeri",
        "P.B.SURESH KUMAR",
        "NABEEL",
        "ABDUL SHUKOOR MUNDAMBRA",
        "MUNEER"
    ],
    "respondents": [
        "HOUSE",
        "Annexure A",
        "OF KERALA",
        "AGED",
        "KHADEEJA MUSALIYARAKATH",
        "O.SAINUDHEEN MUSALIYARAKATH",
        "MALAPPURAM DISTRICT-"
    ],
    "sections": [
        "324 read with Section 34 of the Indian Penal Code",
        "506",
        "482",
        "341",
        "354"
    ],
    "outcome": "This is a proceedings instituted under Section 482 of the Code of Criminal Procedure for quashing Annexure A2 final report and all further proceedings pursuant thereto now pending as C.C.No.354 of 201",
    "full_text": "ERAT eet ee De 2020/KER/326 IN THE HIGH COURT OF KERALA AT ERNAKULAM PRESENT THE HONOURABLE MR. JUSTICE P.B.SURESH KUMAR TUESDAY, THE 07TH DAY OF JANUARY 2020 / 17TH POUSHA, 1941 Crl.MC.No.55 OF 2020(F) AGAINST CC 354/2019 OF JUDICIAL FIRST CLASS MAGISTRATE COURT - I,MANJERI CRIME NO.35/2019 OF AREEKODE POLICE STATION PETITIONERS/ACCUSED 1 TO 5: 1 NABEEL, AGED 32 YEARS S/O.SULAIMAN, CHOYAKKAD HOUSE, KEEZHUPARAMBA P.O., AREEKODE, MALAPPURAM DISTRICT. 2 FOUZU MON, AGED 27 YEARS S/O.SULAIMAN, CHOYAKKAD HOUSE, KEEZHUPARAMBA P.O., AREEKODE, MALAPPURAM DISTRICT. 3 MUNEER, AGED 31 YEARS S/O.SULAIMAN, CHOYAKKAD HOUSE, KEEZHUPARAMBA P.O., AREEKODE, MALAPPURAM DISTRICT. 4 NISAR BABU, AGED 35 YEARS S/O.SULAIMAN, CHOYAKKAD HOUSE, KEEZHUPARAMBA P.O., AREEKODE, MALAPPURAM DISTRICT. 5 SHAHUL HAMEED, AGED 39 YEARS, S/O.SULAIMAN, CHOYAKKAD HOUSE, KEEZHUPARAMBA P.O., AREEKODE, MALAPPURAM DISTRICT. BY ADV. SRI.P.K.MOHAMED JAMEEL Beas ae Et AT Rees, cee 2020/KER/326 Cri.M.C. No.55 of 2020 2 RESPONDENTS /COMPLAINANTS : 1 STATE OF KERALA, REPRESENTED BY PUBLIC PROSECUTOR, HIGH COURT OF KERALA, ERNAKULAM- 682031. 2 KHADEEJA MUSALIYARAKATH AGED 40 YEARS D/O.SAINUDHEEN MUSALIYARAKATH, CHOYAKKAD HOUSE, KEEZHUPARAMBA VILLAGE, ERANADU TALUK, MALAPPURAM DISTRICT- 693639. R2 BY ADV. ABDUL SHUKOOR MUNDAMBRA R1 BY SRI.AMJED ALI, PUBLIC PROSECUTOR THIS CRIMINAL MISC. CASE HAVING COME UP FOR ADMISSION ON 07.01.2020, THE COURT ON THE SAME DAY PASSED THE FOLLOWING : pee 2020/KER/326 Crl.M.C. No.55 of 2020 3 ORDER This is a proceedings instituted under Section 482 of the Code of Criminal Procedure for quashing Annexure A2 final report and all further proceedings pursuant thereto now pending as C.C.No.354 of 2019 on the files of the Court of the Judicial Magistrate of First Class - I, Manjeri. 2. The petitioners are the accused in the said case. The case was one instituted at the instance of the second respondent under Sections 341, 354, 506, 324 read with Section 34 of the Indian Penal Code. 3. It is seen that the second respondent has settled her disputes with the petitioners and an affidavit to that effect has been filed as Annexure A3. 4. The learned counsel for the second respondent affirmed that Annexure A3 is an affidavit sworn to by the second respondent and submitted that the second respondent has no objection in granting the relief sought for by the 2020/KER/326 Crl.M.C. No.55 of 2020 4 petitioners. 5. In the light of the decision of the Apex Court in Gian singh v. State of Punjab, (2012) 10 SCC 303, | am of the view that this is an appropriate case where this court has to invoke the jurisdiction under Section 482 of the Code of Criminal Procedure to quash the proceedings against the petitioners. In the result, the Crl.M.C. is allowed and Annexure-A2 final report and all further proceedings pursuant thereto against the petitioners pending as_ C.C.No.354 of 2019 on the files of the Court of the Judicial Magistrate of First Class - |, Manjeri are quashed. Sd/- P.B.SURESH KUMAR, JUDGE. DK Beas ae Et AT cee 2020/KER/326 Cri.M.C. No.55 of 2020 5 APPENDIX PETITIONERS ' EXHIBITS: ANNEXURE Al CERTIFIED COPY OF THE F.I.R IN CRIME NO.35/2019 OF AREEKODE POLICE STATION. ANNEXURE A2 CERTIFIED COPY OF THE FINAL REPORT IN CRIME NO.35/2019 OF AREEKODE POLICE STATION. ANNEXURE A3 ORIGINAL AFFIDAVIT SWORN IN BY THE 2ND RESPONDENT. RESPONDENTS\" EXHIBITS: NIL //TRUE COPY// PA TO JUDGE DK"
}