{
    "case_id": "SC 295/2017",
    "court": "HIGH COURT OF KERALA AT ERNAKULAM PRESENT",
    "date": "2018",
    "judge": "B.KEMAL PASHA THURSDAY",
    "petitioners": [
        "AMJITH",
        "ALEX M. THOMBRA",
        "KOCHI-",
        "Annexure-A",
        "AGED",
        "B.KEMAL PASHA",
        "Biph",
        "J. Dated",
        "KUNDUTHODE P.O."
    ],
    "respondents": [
        "CHELAKKAD DESOM",
        "ANAS",
        "KANDOTH THAZHA KUNI HOUSE",
        "AGED"
    ],
    "sections": [
        "324",
        "308 read with 34 of the Indian Penal Code",
        "323",
        "341",
        "308"
    ],
    "outcome": "Petitioner is the 1 accused in S.C.No.295/2017 of the Additional District and Sessions Court-IV, Kozhikode, registered for the offences punishable under Sections 341, 323, 324 and 308 read with 34 of ",
    "full_text": "gaan Biph sew ie 2018/KER/264 IN THE HIGH COURT OF KERALA AT ERNAKULAM PRESENT: THE HONOURABLE MR. JUSTICE B.KEMAL PASHA THURSDAY, THE 4TH DAY OF JANUARY 2018 / 14TH POUSHA, 1939 Cr1.MC.No. 8803 of 2017 SC 295/2017 of ADDL. D.C. & SESSIONS COURT - IV, KOZHIKODE CRIME NO. 611/2014 OF KUTTIYADI POLICE STATION , KOZHIKODE DISTRICT PETITIONER (S) /1ST ACCUSED AMJITH, AGED 32 YEARS, S/O.MOIDU, KAYAKOOL HOUSE, KUNDUTHODE P.O., MARUTHUAKARA VILLAGE, VADAKARA TALUK, CALICUT DISTRICT, PIN-673513. BY ADVS.SRI.ABU MATHEW SRI.AJU MATHEW SRI.BYJU PUTHIYADATH MEETHAL RESPONDENT (S) /COMPLAINANT AND DE FACTO COMPLAINANT: 1. STATE OF KERALA, REPRESENTED BY THE PUBLIC PROSECUTOR, HIGH COURT OF KERALA, ERNAKULAM, KOCHI-682031. 2. ANAS, AGED 28 YEARS, S/O.KUNHABDULLA @ ABDULLA, KANDOTH THAZHA KUNI HOUSE, KUTTIPPURAM AMSOM, CHELAKKAD DESOM, CHELAKKAD P.O., NADAPURAM VILLAGE, VADAKARA TALUK, KOZHIKODE DISTRICT, PIN-673506. R1 BY PUBLIC PROSECUTOR SRI. ALEX M. THOMBRA R2 BY ADV. SRI.VINUCHAND THIS CRIMINAL MISC. CASE HAVING COME UP FOR ADMISSION ON 04-01-2018, THE COURT ON THE SAME DAY PASSED THE FOLLOWING: PBS Bel 2018/KER/264 Cr1.MC.No. 8803 of 2017 () APPENDIX PETITIONER (S)' ANNEXURE'S ANNEXURE Al CERTIFIED COPY OF THE FIR IN CRIME NO.611 OF 2014 OF KUTTIYADY POLICE STATION. ANNEXURE A2 CERTIFIED COPY OF THE FINAL REPORT IN CRIME NO.611 OF 2014 OF KUTTIYADY POLICE STATION. ANNEXURE A3 NOTORIZED AFFIDAVIT DATED 09.12.2017 EXECUTED BY THE 2ND RESPONDENT/DE FACTO COMPLAINANT. RESPONDENT'S ANNEXURE NIL /TRUE coPy/ PA TO JUDGE PBS BE 2018/KER/264 B. KEMAL PASHA, J. Dated this the 4\" day of January, 2018 ORDER Petitioner is the 1 accused in S.C.No.295/2017 of the Additional District and Sessions Court-IV, Kozhikode, registered for the offences punishable under Sections 341, 323, 324 and 308 read with 34 of the Indian Penal Code. 2. It seems that the matter has been amicably settled between the parties. 3. On going through the matter, this Court is satisfied that there are no ingredients to invite an offence under Section 308 IPC in the matter All the cases relating to the matter were settled. The 2 respondent has filed affidavit as Annexure-A3, affirming that the matter has been amicably settled between him and the petitioner and he has no complaints against the petitioner. 4. When the matter has been amicably settled between the parties, no purpose would be served in proceeding with the matter any further. Matters being so, all further proceedings against the petitioner in S.C.No.295/2017 of the Additional BE ye ale 2018/KER/264 Crl.M.C.No.8803 of 2017 2 District and Sessions Court-IV, Kozhikode, can be quashed. In the result, this Crl.M.C. is allowed and all further proceedings against the petitioner in S.C.No.295/2017 of the Additional District and Sessions Court-IV, Kozhikode, are quashed. Sd/- B. KEMAL PASHA, JUDGE. sd // True Copy // P.A. to Judge"
}