{
    "case_id": "",
    "court": "HIGH COURT OF KERALA AT ERNAKULAM PRESENT",
    "date": "MONDAY",
    "judge": "B.KEMAL PASHA MONDAY",
    "petitioners": [
        "Ble",
        "MIDHUN BOSE",
        "Annexure-",
        "CHANDRA BOSE",
        "O.SUBASH CHANDRA BOSE",
        "C.C. No.",
        "GEORGE R",
        "SAKTHIKULANGARA VILLAGE"
    ],
    "respondents": [
        "O. THULASIDHARAN",
        "PADINJARE KALLADA VILLAGE",
        "SAJAYAN"
    ],
    "sections": [
        "294(b)",
        "323"
    ],
    "outcome": "Petitioner is the accused in C.C. No.2208/2014 of the Judicial First Class Magistrate's Couri-Il, Kollam, which has arisen from Crime No.1546/2013 of the Kollam West Police Station, registered for the",
    "full_text": "Bahl Elz i mi 2016/KER/64 IN THE HIGH COURT OF KERALA AT ERNAKULAM PRESENT: THE HONOURABLE MR. JUSTICE B.KEMAL PASHA MONDAY, THE 4TH DAY OF JANUARY 2016/14TH POUSHA, 1937 Cri.MC.No. 7846 of 2015 () CRIME NO. 1546/2013 OF KOLLAM WEST POLICE STATION , KOLLAM DISTRICT PETITIONER/ACCUSED: MIDHUN BOSE, AGED 34 YEARS, $/O.SUBASH CHANDRA BOSE, POURNAMI, SAKTHIKULANGARA VILLAGE, KOLLAM. BY ADV. SRILAJAYA KUMAR. G RESPONDENT(S)/STATE/DEFACTO COMPLAINANT: 1. STATE OF KERALA, REPRESENTED BY THE PUBLIC PROSECUTOR, HIGH COURT OF KERALA, ERNAKULAM. 2. SAJAYAN, AGED 31 YEARS, S/O. THULASIDHARAN, PLAVELITHARA VEEDU, PADINJARE KALLADA VILLAGE, KOLLAM- 691 001 R1 BY PUBLIC PROSECUTOR SMT. SAREENA GEORGE R2 BY ADV. SRI.M.R.SARIN THIS CRIMINAL MISC. CASE HAVING COME UP FOR ADMISSION ON 04-01-2016, THE COURT ON THE SAME DAY PASSED THE FOLLOWING: sts a bel eer ca Ble in te 2016/KER/64 Cri.MC.No. 7846 of 2015 () APPENDIX PETITIONER(S) ANNEXURES: ANNEX I: CERTIFIED COPY OF THE FINAL REPORT IN CRIME NO.1546/2013 OF KOLLAM WEST POLICE STATION. ANNEX 2: AFFIDAVIT SWORN BY THE 2ND RESPONDENT RESPONDENT(S) ANNEXURES: NIL ITRUE COPY/ P.S.TO JUDGE sis 2016/KER/64 B. KEMAL PASHA, J. ee eaten ORDER Petitioner is the accused in C.C. No.2208/2014 of the Judicial First Class Magistrate's Couri-Il, Kollam, which has arisen from Crime No.1546/2013 of the Kollam West Police Station, registered for the offences punishable under Sections 323 and 294(b) of the Indian Penal Code. 2. The matter has been amicably settled between the petitioner and the defacto complainant, who is the 2\" respondent herein. The defacto complainant has filed Annexure-2 affidavit affirming that the matter has been amicably settled between him and the petitioner and he has no complaints against the petitioner. 3. No criminal antecedents have been reported against the petitioner. When the matter has been amicably rapa ss 2016/KER/64 CRL.M.C. No. 7846 of 2015 uoe setiled, no purpose would be served in proceeding with the matter further, and therefore, all further proceedings in C.C. No.2208/2014 pending before the Judicial First Class Magistrate's Court-ll, Kollam, as against the petitioner, based on Annexure-1 Final Report, are liable to be quashed. In the result, this Crl.M.C. is allowed and all further proceedings in C.C. No.2208/2014 pending before the Judicial First Class Magistrate's Court-Il, Kollam, as against the petitioner, based on Annexure-1 Final Report, are hereby quashed. Sd/- B.KEMAL PASHA, JUDGE. Stu/04.01.2016. [True copy] PS. to Judge"
}