{
    "case_id": "Crl.MC.No.3341 OF 2017",
    "court": "HIGH COURT OF KERALA AT ERNAKULAM PRESENT THE HONOURABLE MR",
    "date": "2021",
    "judge": "P.V.KUNHIKRISHNAN FRIDAY",
    "petitioners": [
        "HOUSE",
        "RAJENDRAN",
        "KOCHI-",
        "MALAPPURAM",
        "AGED",
        "Cri .MC.No.",
        "Sd"
    ],
    "respondents": [
        "KERALA",
        "THE SUB INSPECTOR OF POLICE",
        "SEIZURE",
        "MANKADA POLICE STATION"
    ],
    "sections": [
        "60A",
        "23A"
    ],
    "outcome": "[ Crl.M.C.No.3341/2017 and Crl1.M.C.No.3343/2017 ]\nDated this the 8th day of January 2021\n\nThese Crl.M.Cs are filed with a prayer to\nissue appropriate direction to the 2Â° respondent\nto report the seiz",
    "full_text": "renee pear 2021/KER/1225 IN THE HIGH COURT OF KERALA AT ERNAKULAM PRESENT THE HONOURABLE MR. JUSTICE P.V.KUNHIKRISHNAN FRIDAY, THE O8TH DAY OF JANUARY 2021 / 18TH POUSHA, 1942 Crl.MC.No.3341 OF 2017 PETITIONER: RAJENDRAN AGED 41 YEARS,S/O. CHAMI,2/537-A, PALLIYALIL HOUSE ,ERANTHODE, VALAMBOOR (P.O) , PERINTHALMANNA ,MALAPPURAM DISTRICT . PIN-679325. BY ADV. SRI.NIREESH MATHEW RESPONDENTS/STATE & COMPLAINANT: 1 STATE OF KERALA REPRESENTED BY THE PUBLIC PROSECUTOR,HIGH COURT OF KERALA, ERNAKULAM, KOCHI-682031. 2 THE SUB INSPECTOR OF POLICE MANKADA POLICE STATION,MANKADA, MALAPPURAM DISTRICT , PIN-679324. SRI.SANTOSH PETER, SR. PP THIS CRIMINAL MISC. CASE HAVING BEEN FINALLY HEARD ON 08.01.2021, ALONG WITH Crl.MC.3343/2017, THE COURT ON THE SAME DAY PASSED THE FOLLOWING: renee reese Crl.MC.NoS.3341/2017 & 3343 OF 2017 2021/KER/1225 2 IN THE HIGH COURT OF KERALA AT ERNAKULAM PRESENT THE HONOURABLE MR. JUSTICE P.V.KUNHIKRISHNAN FRIDAY, THE O8TH DAY OF JANUARY 2021 / 18TH POUSHA, 1942 Cri .MC.No.3343 OF 2017 PETITIONER: KUNHALAVI P. AGED 42 YEARS ,S/O. KUNHAHAMMED , PULLITHODI HOUSE ,KOLATHUR (P.O) ,MALAPPURAM DISTRICT, PIN- 679338. BY ADV. SRI.NIREESH MATHEW RESPONDENTS /STATE & COMPLAINANT: 1 STATE OF KERALA REPRESENTED BY THE PUBLIC PROSECUTOR,HIGH COURT OF KERALA, ERNAKULAM ,KOCHI-682031. 2 THE SUB INSPECTOR OF POLICE PERINTHALMANNA POLICE STATION, PERINTHALMANNA , MALAPPURAM DISTRICT, PIN-679322. THIS CRIMINAL MISC. CASE HAVING BEEN FINALLY HEARD ON 08.01.2021, ALONG WITH Cr1.MC.3341/2017, THE COURT ON THE SAME DAY PASSED THE FOLLOWING: a Crl.MC.NoS.3341/2017 & 3343 OF 2017 202 1IKERIT225 3 ORDER [ Crl.M.C.No.3341/2017 and Crl1.M.C.No.3343/2017 ] Dated this the 8th day of January 2021 These Crl.M.Cs are filed with a prayer to issue appropriate direction to the 2 respondent to report the seizure of the vehicles of the petitioners to the Jurisdictional Magistrate and to direct the learned Magistrate to release the vehicles to the petitioners unconditionaly. 2. These Crl.M.Cs are pending from 2017 onwards. When these cases came up for consideration, the learned counsel for the petitioners submitted that the petitioners may be given liberty to approach the geologist concerned for compounding the offence under Section 23A of the Mines and Minerals (Development and Regulation)Act and Rule 60A of the Mines and Minerals (Development and Regulation) Rules. Eo el arte Bl amen Crl.MC.NoS.3341/2017 & 3343 OF 2017 2021/RER/1225 4 Therefore, these Crl.M.Cs are closed with liberty to the petitioners to approach the competent authority in accordance to law if they are adviced so, if such an application is permissible legally. Sd/- P.V.KUNHIKRISHNAN JUDGE DM Deere SS reese Crl.MC.NoS.3341/2017 & 3343 OF 2017 2021/KER/1225 5 APPENDIX OF Crl.MC 3341/2017 PETITIONERS 'EXHIBITS: ANNEXURE A TRUE PHOTOCOPY OF THE CERTIFICATE OF REGISTRATION IN RESPECT OF VEHICLE NO. KL53/E-7009. ANNEXURE B TRUE PHOTOCOPY OF THE SEIZURE MAHAZAR DATED 01.05.2017. ANNEXURE C TRUE PHOTOCOPY OF THE ORDER PASSED BY THIS HON'BLE COURT IN CRL.M.C NO.2164/2017 DATED 24.03.2017. RESPONDENTS' EXHIBITS :NIL Deere SS reese Crl.MC.NoS.3341/2017 & 3343 OF 2017 2021/KER/1225 6 APPENDIX OF Crl.MC 3343/2017 PETITIONERS' EXHIBITS: ANNEXURE A TRUE PHOTOCOPY OF THE CERTIFICATE OF REGISTRATION IN RESPECT OF VEHICLE NO.KL.53/D.1719. ANNEXURE B TRUE PHOTOCOPY OF THE SEIZURE MAHAZAR DATED 07.05.2017. ANNEXURE C TRUE PHOTOCOPY OF THE ORDER PASSED BY THIS HON 'BLE COURT IN CRL.M.C NO.2164/2017 DATED 24.03.2017. RESPONDENTS' EXHIBITS :NIL //TRUE COPY// PA TO JUDGE"
}