{
    "case_id": "Crl.MC.No.6457 OF 2019(F)",
    "court": "HIGH COURT OF KERALA AT ERNAKULAM PRESENT THE HONOURABLE MR",
    "date": "9th day of January, 2020",
    "judge": "ASHOK MENON THURSDAY",
    "petitioners": [
        "KORPULLITHARA HOUSE",
        "SYAM MOHAN",
        "PUTHUVYPU VILLAGE",
        "KANJIRAKAD HOUSE",
        "O.ABBAS",
        "KOCHI TALUK",
        "O.VASU",
        "NEAR SEASHORE",
        "VYPEEN",
        "MUKKATH HOUSE",
        "AGED",
        "O.MOHAN",
        "TONY",
        "NEAR ATHIRA BUS STOP",
        "ARUN",
        "SUJI",
        "ABIJITH",
        "ERNAKULAM -",
        "PANDARAPARAMBIL HOUSE",
        "O.JOHNY"
    ],
    "respondents": [
        "NJARAKKAL POLICE STATION",
        "REPRESENTED BY THE SHO",
        "ERNAKULAM DISTRICT",
        "Ernakulam",
        "OTHER PRESENT",
        "Njarakkal"
    ],
    "sections": [],
    "outcome": "Dated this the 9th day of January, 2020 The petitioners are accused in S.C. No. 849/2018 pending on the files of the 2 Additional Assistant Sessions Court, Ernakulam. It is submitted that there is a c",
    "full_text": "oe Pr rab: Sits pe a 2020/KER/1037 IN THE HIGH COURT OF KERALA AT ERNAKULAM PRESENT THE HONOURABLE MR. JUSTICE ASHOK MENON THURSDAY, THE 09TH DAY OF JANUARY 2020 / 19TH POUSHA, 1941 Cr1.MC.No.6457 OF 2019(F) TO DIRECT THE 2ND ADDITIONAL ASSISTANT SESSIONS JUDGE, ERNAKULAM TO DEFER THE TRIAL OF S.C.NO.849/2018 FOR SUCH PERIOD OF TIME AS MAY BE DIRECTED BY THIS HONOURABLE COURT PETITIONERS/ACCUSED NO. 1 TO 5: 1 SYAM MOHAN, AGED 24 YEARS, S/O.MOHAN, KORPULLITHARA HOUSE, PUTHUVYPU VILLAGE, VYPEEN, KOCHI TALUK, ERNAKULAM - 682 508. 2 ARUN, AGED 26 YEARS, S/O.ABBAS, PANDARAPARAMBIL HOUSE, NEAR ATHIRA BUS STOP, HOUSE, PUTHUVYPU VILLAGE, VYPEEN, KOCHI TALUK, ERNAKULAM - 682 508. 3 ABIJITH, AGED 25 YEARS, S/O.ABBAS, PANDARAPARAMBIL HOUSE, NEAR ATHIRA BUS STOP, HOUSE, PUTHUVYPU VILLAGE, VYPEEN, KOCHI TALUK, ERNAKULAM - 682 508. 4 TONY, AGED 25 YEARS, S/O.JOHNY, MUKKATH HOUSE, PUTHUVYPEKARA, PUTHUVYPU VILLAGE, VYPEEN, KOCHI TALUK, ERNAKULAM - 682 508. 5 SUJI @ SUJITH, AGED 29 YEARS, S/O.VASU, KANJIRAKAD HOUSE, AARAT ROAD, NEAR SEASHORE, NJARAKKAL VILLAGE, a Pr rab: Sits pe a Crl.MC.No.6457 OF 2019(F) 2020/KER/LO37 2 VYPEEN, KOCHI TALUK, ERNAKULAM - 682 508. BY ADV. SRI.P.B.AJOY RESPONDENTS /STATE: STATE OF KERALA, REPRESENTED BY THE SHO(STATION HOUSE OFFICER), NJARAKKAL POLICE STATION, ERNAKULAM DISTRICT, THROUGH THE PUBLIC PROSECUTOR, HIGH COURT OF KERALA, ERNAKULAM - 682 031. OTHER PRESENT: SRI.C.S.HRITHWIK SR. PUBLIC PROSECUTOR THIS CRIMINAL MISC. CASE HAVING COME UP FOR ADMISSION ON 09.01.2020, THE COURT ON THE SAME DAY PASSED THE FOLLOWING: Crl.MC.No.6457 OF 2019 (F) 2020/KER/TO37 3 ORDER Dated this the 9th day of January, 2020 The petitioners are accused in S.C. No. 849/2018 pending on the files of the 2 Additional Assistant Sessions Court, Ernakulam. It is submitted that there is a counter case which was pending before the Judicial First Class Magistrate Court, Njarakkal as C.C. No.947/2018. Being a case and counter case, steps were taken for both the cases being tried by the same court, and it is submitted by the learned counsel for the petitioners that the case pending before the Judicial First Class Magistrate Court, Njarakkal has now been committed to the Sessions Court and the allotment of the said case to the 2 Additional Assistant Sessions Court is awaited. 2. The prayer in this petition is only to defer the trial of S.C. No.849/2018 for such period as may be directed by this court. There is an interim stay already granted by this court. In view of the fact that the counter case has also been Ee, Stet] Crl.MC.No.6457 OF 2019(F) 2020/KER/LO37 4 transferred to the Sessions division, both the cases can be tried together by the same court. With these observations, the petition is disposed. Sd/- ASHOK MENON JUDGE NR/16/01/20 , ciate San pe a Crl.MC.No.6457 OF 2019(F) 2020/KER/1037 5 APPENDIX PETITIONERS' EXHIBITS: ANNEXURE Al THE TRUE COPY OF THE FIRST INFORMATION REPORT IN CRIME NO.745/2016 OF NJARAKKAL POLICE STATION, ERNAKULAM DISTRICT. ANNEXURE A2 THE CERTIFIED COPY OF THE FINAL REPORT IN SC NO.849/2018 ON THE FILES OF THE COURT OF 2ND ADDITIONAL ASSISTANT SESSIONS JUDGE, ERNAKULAM. ANNEXURE A3 THE TRUE COPY OF THE FIRST INFORMATION REPORT IN CRIME NO.688/2017 OF NJARAKKAL POLICE STATION, ERNAKULAM DISTRICT. ANNEXURE A4 THE CERTIFIED COPY OF THE FINAL REPORT IN C.C.NO.947/2018 ON THE FILES OF THE JUDICIAL FIRST CLASS MAGISTRATE COURT, NJARAKKAL . RESPONDENT'S EXHIBITS: NIL // TRUE COPY// PA TO JUDGE"
}