{
    "case_id": "Crl.MC.No.7356 OF 2019 (H)",
    "court": "HIGH COURT OF KERALA AT ERNAKULAM",
    "date": "2020",
    "judge": "ASHOK MENON TUESDAY",
    "petitioners": [
        "PADINJARU",
        "P.O. KATPAMANGALAM",
        "SHIVAS",
        "O.RAJAN",
        "O.LAL",
        "AGED",
        "DISAN P.LAL",
        "KODUNGALLUR TALUK",
        "THRISSUR DIST.",
        "O.SAJEEVAN"
    ],
    "respondents": [
        "O.GOPI",
        "KERALA",
        "AGED",
        "DILJITH",
        "OTHER PRESENT",
        "DISTRICT-",
        "PADINJARU DESOM"
    ],
    "sections": [
        "506 read with Section 149 IPC",
        "324",
        "148",
        "482",
        "323",
        "341",
        "363",
        "308",
        "143",
        "147"
    ],
    "outcome": "Dated this the 7th day of January 2020 Petitioners are accused in Crime No.516/2019 of Kaipamangalam Police Station for having allegedly committed offences punishable under Sections 143, 147, 148, 363",
    "full_text": "Bosh rs 5 af Fr ieee ee IN THE HIGH COURT OF KERALA AT ERNAKULAM 2020/KER/471 PRESENT THE HONOURABLE MR. JUSTICE ASHOK MENON TUESDAY, THE O7TH DAY OF JANUARY 2020 / 17TH POUSHA, 1941 Crl.MC.No.7356 OF 2019 (H) (CRIME NO.516/2019 OF KAIPAMANGALAM POLICE STATION, THRISSUR) PETITIONERS /ACCUSED 1-3: 1 SHIVAS AGED 25 YEARS S/O.SAJEEVAN, NELLIKKATHARA HOSUE, P.O. KATPAMANGALAM, KODUNGALLUR TALUK, THRISSUR DIST. 2 DISAN P.LAL AGED 26 YEARS S/O.LAL, KANNANKULATH HOUSE,P.O PERINJANAM, KODUNGALLUR TALUK, THRISSUR DIST. 3 VIPIN RAJ AGED 27 YEARS S/O.RAJAN, VADAKKOOT HOUSE, PO PERINJANAM WEST, KODUNGALLUR TALUK, THRISSUR DIST. BY ADV. SRI.VISHNUPRASAD NAIR RESPONDENTS /STATE & DEFACTO COMPLAINANT: 1 STATE OF KERALA REPRESENTED BY PUBLIC PROSECUTOR, HIGH COURT OF KERALA, ERNAKULAM-682031 2 DILJITH AGED 22 YEARS S/O.GOPI, NADUVILTHARA HOUSE, SAMSKARAM SCHOOL, PADINJARU DESOM, PERINJANAM VILLAGE, THRISSUR DISTRICT-680686 R2 BY ADV. C.DHEERAJ RAJAN OTHER PRESENT: SRI.RAMESH CHAND, PP THIS CRIMINAL MISC. CASE HAVING COME UP FOR ADMISSION ON 07.01.2020, THE COURT ON THE SAME DAY PASSED THE FOLLOWING: Peete ioe ee a 2020/KER/471 Cr. MC 7356/2019 2 ORDER Dated this the 7th day of January 2020 Petitioners are accused in Crime No.516/2019 of Kaipamangalam Police Station for having allegedly committed offences punishable under Sections 143, 147, 148, 363, 341, 323, 324, 308 and 506 read with Section 149 IPC. 2. The only defacto complainant/injured is the second respondent, who has appeared through counsel and filed affidavit to the effect that the matter has been amicably settled with the petitioners and that he has no grievance against them. A report to that effect has also been obtained from the investigating officer through the learned Public Prosecutor. The injuries Sustained are not life threatening. Even while granting bail to the petitioners, the Sessions Court was apprehensive of whether an offence under Section 308 IPC would be attracted. No public interest is involved. The petitioners do not have any criminal oo = me rin 2020/KER/471 Crl.MC 7356/2019 3 antecedents. In the result, the Criminal M.c. is allowed and the entire proceedings as against the petitioners herein in crime No.516/2019 of Kaipamangalam Police Station shall stand quashed under Section 482 Cr.PC and the petitioners/accused are discharged. Sd/- ASHOK MENON JUDGE jg co oe, = [a] ro iz iat 2020/KER/471 Cri. MC 7356/2019 4 APPENDIX PETITIONER'S/S EXHIBITS: ANNEXURE I THE CERTIFIED COPY OF THE FIRST INFORMATION REPORT IN CRIME NO.516/2019 OF KATPAMANGALAM POLICE STATION DATED 16.08.2019 ANNEXURE II A TRUE COPY OF THE FIR DATED 16.08.2019 IN CRIME 515/2019 OF KAIPAMANGALAM POLICE STATION ANNEXURE III AFFIDAVIT OF THE RESPONDENT/DE-FACTO COMPLAINANT"
}