{
    "case_id": "CC 1739/2018",
    "court": "HIGH COURT OF KERALA AT ERNAKULAM PRESENT THE HONOURABLE MR",
    "date": "2020",
    "judge": "ASHOK MENON TUESDAY",
    "petitioners": [
        "JAFFER.A.V",
        "KANDAKADAVU",
        "ERNAKULAM-",
        "ANSAR.T.P",
        "KASARAGOD DISTRICT.",
        "ARIFA MANZIL",
        "Kasargod",
        "Ci",
        "AGED",
        "MUHAMMED ASARUDHEEN M.M.",
        "KASARAGOD DISTRICT-",
        "C.K.HOUSE",
        "C.S.HRITHWIK"
    ],
    "respondents": [
        "KASARAGOD DISTRICT-",
        "THE SUB INSPECTOR OF POLICE",
        "HOSDURG POLICE STATION"
    ],
    "sections": [
        "148",
        "448",
        "506(ii) read with Section 149 of I",
        "427",
        "482",
        "143",
        "147"
    ],
    "outcome": "/JUDGMENT IN CC 1739/2018 OF JUDICIAL MAGISTRATE OF FIRST CLASS -I, HOSDURG CRIME NO.419/2018 OF Hosdurg Police Station, Kasargod PETITIONERS/ACCUSED 1 TO 3: 1 MUHAMMED ASARUDHEEN M.M., AGED 24 YEARS,",
    "full_text": "nee ae | Ci 4 te 2020/KER/553 IN THE HIGH COURT OF KERALA AT ERNAKULAM PRESENT THE HONOURABLE MR. JUSTICE ASHOK MENON TUESDAY, THE 07TH DAY OF JANUARY 2020 / 17TH POUSHA, 1941 Cr1.MC.No.8815 OF 2019 (B) AGAINST THE ORDER/JUDGMENT IN CC 1739/2018 OF JUDICIAL MAGISTRATE OF FIRST CLASS -I, HOSDURG CRIME NO.419/2018 OF Hosdurg Police Station, Kasargod PETITIONERS/ACCUSED 1 TO 3: 1 MUHAMMED ASARUDHEEN M.M., AGED 24 YEARS, S/O.SHADULI.M.M, ARIFA MANZIL, AVIYIL, HOSDURG, KASARAGOD DISTRICT. 2 ANSAR.T.P, AGED 28 YEARS, S/O.YUSUF, KANDAKADAVU(H), AVIYIL, HOSDURG, KASARAGOD DISTRICT. 3 JAFFER.A.V, AGED 36 YEARS, C.K.HOUSE, AVIYIL, HOSDURG, KASARAGOD DISTRICT. BY ADV. SMT.LAKSHMI SREEDHAR RESPONDENTS/STATE, COMPLAINANT & VICTIMS: 1 STATE OF KERALA REPRESENTED BY THE PUBLIC PROSECUTOR, HIGH COURT OF KERALA, ERNAKULAM-31. 2 THE SUB INSPECTOR OF POLICE, HOSDURG POLICE STATION, KASARAGOD DISTRICT-671315. a BR Els 4 ie Crl1.M.C.No.8815 of 2019 2020/KER/553 2 3 SUNU .K AGED 37 YEARS, S/O. KUNHIKANNAN, KALLOORAVI HOUSE, KALLOORAVI, KANHANGAD VILLAGE, HOSDURG TALUK, KASARAGOD DISTRICT-671315. 4 K.T.MADHAVI, AGED 75 YEARS, W/O.KUNHIKANNAN, K.T.HOUSE, KALLOORAVI, KANHANGAD VILLAGE, HOSDURG TALUK, KASARAGOD DISTRICT-671315. 5 NAYANA.K.T, AGED 21 YEARS, W/O.ANIL KUMAR, K.T.HOUSE, KALLOORAVI, KANHANGAD VILLAGE, HOSDURG TALUK, KASARAGOD DISTRICT-671315. R1-R2 BY SRI. C.S.HRITHWIK, SR.PP R3-R5 BY SMT. UMMUL FIDA OTHER PRESENT: THIS CRIMINAL MISC. CASE HAVING COME UP FOR ADMISSION ON 07.01.2020, THE COURT ON THE SAME DAY PASSED THE FOLLOWING: eaeKetece4C| = Beare Cr1.M.C.No.8815 of 2019 3 2020/KER/S53 ORDER Dated this the 7th day of January 2020 The petitioners are accused 1 to 3 in C.C.No.1739/2018 on the file of the Judicial First Class Magistrate Court-I, Hosdurg, for having allegedly committed the offences punishable under Sections 143, 147, 148, 448, 427 and 506(ii) read with Section 149 of I.P.C. The defacto complainant- injured are respondents 3 to 5 herein, who have appeared through a Counsel and have filed affidavits at Annexures A2 to A4 stating that the matter has been amicably settled and they have no existing grievance against the petitioners. A report has been filed by the investigating officer through the Senior Public Prosecutor to that effect. The petitioners do not have any criminal antecedents and no _ public interest is involved. In the result, the Crl.M.C. is allowed and the entire proceedings in Crime No.419/2018 of Hosdurg eaeKetece4C| af can | | Ci 4 te Cr1.M.C.No.8815 of 2019 2020/KER/S53 4 Police Station, now pending as C.C.No.1739/2018 on the file of the Judicial First Class Magistrate Court-I, Hosdurg, stands quashed under Section 482 of Cr.P.C. and the petitioners are discharged. Sd/- dkr ASHOK MENON JUDGE a BR Els 4 ie Crl1.M.C.No.8815 of 2019 2020/KER/553 5 APPENDIX PETITIONER'S/S EXHIBITS: ANNEXURE Al COPY OF THE FINAL REPORT IN CRIME NO.419/2018 OF HOSDURG POLICE STATION, KASARAGOD DISTRICT. ANNEXURE A2 AFFIDAVIT SWORN BY THE THIRD RESPONDENT STATING THE SETTLEMENT OF ALL THE DISPUTES. ANNEXURE A3 AFFIDAVIT SWORN BY THE FOURTH RESPONDENT STATING THE SETTLEMENT OF ALL THE DISPUTES. ANNEXURE A4 AFFIDAVIT SWORN BY THE FIFTH RESPONDENT STATING THE SETTLEMENT OF ALL THE DISPUTES."
}