{
    "case_id": "Crl.MC.No.4480 OF 2014",
    "court": "HIGH COURT OF KERALA AT ERNAKULAM",
    "date": "2021",
    "judge": "P.V.KUNHIKRISHNAN FRIDAY",
    "petitioners": [
        "VIDAYNAGER",
        "PETER",
        "SURAYYA",
        "Baal",
        "O.AMOO",
        "Sd"
    ],
    "respondents": [
        "MANAGER",
        "THROUGH THE STATION HOUSE OFFICER VIDYANAGER",
        "PRASAD",
        "LTD",
        "S",
        "ROAD",
        "S. MAHINDRA AND MAHINDRA",
        "FINANCIAL SERVICES LTD",
        "ERNAKULAM.",
        "OTHER PRESENT"
    ],
    "sections": [],
    "outcome": "Dated this the 8th day of January 2021 This Crl.M.C. is dismissed",
    "full_text": "Baal piskhts: * apa IN THE HIGH COURT OF KERALA AT ERNAKULAM 2021/KER/1233 PRESENT THE HONOURABLE MR. JUSTICE P.V.KUNHIKRISHNAN FRIDAY, THE O8TH DAY OF JANUARY 2021 / 18TH POUSHA, 1942 Crl.MC.No.4480 OF 2014 [CMP NO.4615/2013 ON THE FILE OF THE CHIEF JUDICIAL MAGISTRATE COURT, KASARAGOD] PETITIONER: SURAYYA W/O.AMOO, R/AT. CHELLANAD HOUSE, ALAMPADY, VIDAYNAGER, CITIZEN NAGER, KASARAGOD. BY ADV. SRI.KODOTH SREEDHARAN RESPONDENTS : 1 M/S. MAHINDRA AND MAHINDRA FINANCIAL SERVICES LTD, 2ND FLOOR, CITY CENTRE, BANK ROAD, KASARAGOD, REPRESENTED BY ITS MANAGER. PIN-671121 2 PRASAD MANAGER, M/S.MAHINDRA & MAHINDRA, FINANCIAL SERVICES LTD, 2ND FLOOR, CITY CENTRE, BANK ROAD, KASARAGOD. 671121 3 STATE OF KERALA THROUGH THE STATION HOUSE OFFICER VIDYANAGER, REP. BY ITS PUBLIC PROSECUTOR, HIGH COURT OF KERALA, ERNAKULAM. 682031 R1 BY ADV. SRI.DEVAPRASANTH.P.J. OTHER PRESENT: R3 BY SRI.SANTHOSH PETER, SR.PP THIS CRIMINAL MISC. CASE HAVING BEEN FINALLY HEARD ON 08.01.2021, THE COURT ON THE SAME DAY PASSED THE FOLLOWING: Bier = page 7 CRL.M.C.NO.4480 OF 2014 2 2021/KER/1233 ORDER Dated this the 8th day of January 2021 This Crl.M.C. is dismissed with a liberty to the petitioner to challenge Annexure-V order by filing a revision, if she is advised so. Sd/- P.V.KUNHIKRISHNAN pkk JUDGE Baal piskhts: * bes CRL.M.C.NO.4480 OF 2014 3 2021/KER/1233 APPENDIX PETITIONER'S/S EXHIBITS: EXHIBIT Al Al - TRUE COPY OF THE COMPLAINT IN CMP 4615/2013 BEFORE THE CHIEF JUDICIAL MAGISTRATE COURT, KASARAGOD. EXHIBIT A2 A2 - TRUE COPY OF THE COUNTER IN CMP 4615/2013 BEFORE THE CHIEF JUDICIAL MAGISTRATE COURT, KASARAGOD. EXHIBIT A3 A3 - TRUE COPY OF THE SEARCH APPLICATION FILED U/S.94 OF CR.PC EXHIBIT A4 A4 - TRUE COPY OF THE COUNTER IN CMP 4616/13 BEFORE THE CHIEF JUDICIAL MAGISTRATE COURT, KASARAGOD. EXHIBIT A5 A5 - TRUE COPY OF THE ORDER IN CMP NO. 4615/2013 DT. 31.5.14 OF THE CHIEF JUDICIAL MAGISTRATE COURT, KASARAGOD. //TRUE COPY// SD/- P.S. TO JUDGE"
}