{
    "case_id": "cc 1979/2015",
    "court": "HIGH COURT OF KERALA AT ERNAKULAM",
    "date": "2018",
    "judge": "B.KEMAL PASHA FRIDAY",
    "petitioners": [
        "MARY",
        "EZHATTUMUGHAM KARA",
        "O.CHERIYA",
        "O. LATE PC. JACOB",
        "JOSEPH",
        "M.C.",
        "MUKKANNUR KARA",
        "PC. THOMAS",
        "P.C. JOSEPH",
        "PUTHUSSERY HOUSE",
        "P.C.VARGHESE",
        "J. Dated",
        "MUKKANNUR VILLAGE",
        "MARY JACOB"
    ],
    "respondents": [
        "BABU",
        "EZHATTUMUGHAM KARA",
        "KERALA",
        "THROUGH THE STATION HOUSE OFFICER",
        "O.POULOSE"
    ],
    "sections": [
        "201",
        "297",
        "201 read with Section 34 IPC"
    ],
    "outcome": "DATED 22.01.2016 OF THE HON'BLE HIGH COURT IN CRL.MC.NO.4651/2015 ANNEXUURE 8:TRUE COPY OF FINAL REPORT AND THE ACCOMPANYING DOCUMENTS FILED IN CRIME NO.172/2015 OF ANGAMALY POLICE STATION RESPONDENTS",
    "full_text": "BST lacie Bae IN THE HIGH COURT OF KERALA AT ERNAKULAM 2018/KER/476 PRESENT: THE HONOURABLE MR. JUSTICE B.KEMAL PASHA FRIDAY, THE 5TH DAY OF JANUARY 2018 / 15TH POUSHA, 1939 Cr1.MC.No. 1183 of 2016 cc 1979/2015 OF JUDICIAL FIRST CLASS MAGISTRATE COURT, ANGAMALY CRIME NO. 172/2015 OF ANGAMALY POLICE STATION , ERNAKULAM PETITIONER (S) /ACCUSED 2,3,4 & 6 1 P.C.VARGHESE @ KUNJUMON, S/O.CHERIYA, AGED ABOUT 67 YEARS, PUTHUSSERY HOUSE, MUKKANNUR KARA, MUKKANNUR VILLAGE 2 P.C. JOSEPH @ THAMPI, S/O.CHERIYA, AGED ABOUT 77 YEARS, PUTHUSSERY HOUSE, MUKKANNUR KARA, MUKKANNUR VILLAGE 3 PC. THOMAS S/O.CHERIYA, AGED ABOUT 63 YEARS, PUTHUSSERY HOUSE, MUKKANNUR KARA, MUKKANNUR VILLAGE 4 MARY JACOB W/O. LATE PC. JACOB, AGED ABOUT 70 YEARS, PUTHUSSERY HOUSE, MUKKANNUR KARA, MUKKANNUR VILLAGE BY ADVS.SRI.GEORGE VARGHESE (PERUMPALLIKUTTIYIL) SRI.A.R.DILEEP SRI.MANU SEBASTIAN SRI.P.J.JOH PAUL Bese lacie Beas 2018/KER/476 Cr1.MC.No. 1183 of 2016 RESPONDENT (S) /STATE & COMPLAINANT: 1. STATE OF KERALA THROUGH THE STATION HOUSE OFFICER, ANGAMALY POLICE STATION, REPRESENTED BY PUBLIC PROSECUTOR, HIGH COURT OF KERALA, 682031 2. BABU S/O.POULOSE @ PAUL, AGED 38 YEARS, PANADAN (PUTHUSSERY HOUSE), EZHATTUMUGHAM KARA, KARUKUTTY VILLAGE 683576 Rl BY PUBLIC PROSECUTOR SRI. AMJAD ALI R2 BY ADVS. SRI.T.P.SAJAN SRI.M.MOHAMED NAVAZ SRI.P.SANTHOSH KUMAR (TR) THIS CRIMINAL MISC. CASE HAVING BEEN FINALLY HEARD ON 05-01-2018, THE COURT ON THE SAME DAY PASSED THE FOLLOWING: sdr/- Bese lacie ape eos 2018/KER/476 Cr1.MC.No. 1183 of 2016 APPENDIX PETITIONER(S)' ANNEXURES ANNEXURE 1::TRUE COPY OF FIR IN CRIME NO.172/2015 OF ANGAMALY POLICE STATION ANNEXURE 2:TRUE COPY OF COMPLAINT LEADING TO THE REGISTRATION OF ANNEX. I, FIR ANNEXURE 3:TRUE COPY OF RELEVANT PAGES OF DIRECTIONS AND GUIDELINES OF ERNAKULAM CHURCH ADMINISTRATION BYE LAW ON GRAVE ANNEXURE 4:TRUE COPY OF PLAINT IN OS.NO.393/2012 OF THE MUNSIFF'S COURT, ALUVA ANNEXURE 5:TRUE COPY OF APPLICATION MADE BY 1ST ACCUSED TO VICAR, ST. MARY'S CHURCH MUKKANNOOR ANNEXURE 6:TRUE COPY OF COMMUNICATION DATED 05.05.2015 ISSUED BY THE VICAR OF ST.MARY'S FORANE CHURCH, MOOKKANNOOR ANNEXURE 7:TRUE COPY OF ORDER DATED 22.01.2016 OF THE HON'BLE HIGH COURT IN CRL.MC.NO.4651/2015 ANNEXUURE 8:TRUE COPY OF FINAL REPORT AND THE ACCOMPANYING DOCUMENTS FILED IN CRIME NO.172/2015 OF ANGAMALY POLICE STATION RESPONDENTS ANNEXURES NIL / TRUE COPY/ PA TO JUDGE sdr/- 2018/KER/476 B. KEMAL PASHA, J. Dated this the 5\" day of January, 2018 ORDER Petitioners are A2, A3, A4 and A6 in CC No.1979/2015 of the Judicial First Class Magistrate's Court, Angamaly, based on Annexure-8 final report in Crime No.172/2015 of Angamaly Police Station for the offences punishable under Sections 297 and 201 read with Section 34 IPC. 2. On going through the allegations in the final report, it has come out that the offence under Section 297 IPC cannot be attracted. As far as the offence under Section 201 IPC is concerned, when the other offence cannot be attracted, there cannot be an offence under Section 201 IPC also. Matters being so, the prosecution of the petitioners in the case is quite unnecessary and Repeal eine 2018/KER/476 Crl.M.C.1183/2016 :2: therefore, all further proceedings in CC No.1979/2015 of the Judicial First Class Magistrate's Court, Angamaly, based on Annexure-8 final report in Crime No.172/2015_ of Angamaly Police Station are liable to be quashed. In the result, this Crl.M.C. is allowed and all further proceedings against the petitioners in CC No.1979/2015 of the Judicial First Class Magistrate's Court, Angamaly, based on Annexure-8 final report in Crime No.172/2015 of Angamaly Police Station, are quashed. Sd/- (B.KEMAL PASHA, JUDGE) aks/05/01 1! True Copy // PS to Judge"
}