{
    "case_id": "",
    "court": "HIGH COURT OF KERALA AT ERNAKULAM PRESENT",
    "date": "2015",
    "judge": "B.KEMAL PASHA THURSDAY",
    "petitioners": [
        "LOVELY RAVEENDRAN",
        "Crl",
        "Blea",
        "JIBU P. THOMAS",
        "Beene",
        "O.PRASAD GANDHI",
        "ANAYARA P.O",
        "ARATHI GANDHI"
    ],
    "respondents": [
        "LOVELY RAVEENDRAN",
        "ADDITIONAL SUB INSPECTOR OF POLICE",
        "CHIEF MANAGER",
        "S",
        "VARKALA",
        "LARA RAVEENDRAN",
        "C.LALITHA RAVEENDRAN",
        "O.RAVEENDRAN",
        "THIRUVANANTHAPURAM",
        "VARKALA POLICE STATION",
        "RAVEENDRAN",
        "K.P.P MANDIRAM"
    ],
    "sections": [
        "482"
    ],
    "outcome": "DT 20/3/2014 PASSED IN CRL.MC 1602/2014 BY THIS HON'BLE COURT. RESPONDENT'S ANNEXURES : NIL. HTRUE COPY!! P.S. TO JUDGE bp 2015/KER/794 B.KEMAL PASHA, J. ee ee ORDER The petitioner in M.C.234/2013 on ",
    "full_text": "Blea a ay aan Beene 2015/KER/794 IN THE HIGH COURT OF KERALA AT ERNAKULAM PRESENT: THE HONOURABLE MR. JUSTICE B.KEMAL PASHA THURSDAY, THE 8TH DAY OF JANUARY 2015/18TH POUSHA, 1936 Cri.MC.No. 3838 of 2014 () MC 234/2013 of JUDICIAL FIRST CLASS MAGISTRATE COURT I, VARKALA PETITIONER : ARATHI GANDHI D/O.PRASAD GANDHI, PRASADAM TC 41/448(3), CHAKKAI ANAYARA P.O, THIRUVANANTHAPURAM 695 003 BY ADV. SRILVAKKOM N.VIJAYAN RESPONDENTS : 1. THE STATE OF KERALA REPRESENTED BY THE PUBLIC PROSECUTOR, HIGHC OURT OF KERALA AT ERNAKULAM, PIN 682 031 2. ADDITIONAL SUB INSPECTOR OF POLICE VARKALA POLICE STATION, VARKALA 695 011 3. CHIEF MANAGER STATE BANK OF TRAVANCORE, VARKALA BRANCH 695 011 4, LARA RAVEENDRAN, AGED 33 YEARS, $/O.RAVEENDRAN, K.P.PMANDIRAM, KURAKKANNI, VARKALA, THIRUVANANTHAPURAM 695 141 5, C.LALITHA RAVEENDRAN, K.P.P MANDIRAM, KURAKKANNI, VARKALA, THIRUVANANTHAPURAM 695 141 6. LOVELY RAVEENDRAN, K.P.P MANDIRAM, KURAKKANNI, VARKALA, THIRUVANANTHAPURAM 695 141 7. RAVEENDRAN K.P.P MANDIRAM, KURAKKANNI, VARKALA THIRUVANANTHAPURAM 695 141. R1 & R2 BY PUBLIC PROSECUTORSRI. JIBU P. THOMAS R3 BY ADV. SRI.R.S.KALKURA, SC, SBT R4 BY ADV. SRI.T.K.ANANDA KRISHNAN THIS CRIMINAL MISC. CASE HAVING BEEN FINALLY HEARD ON 08-01-2015, THE COURT ON THE SAME DAY PASSED THE FOLLOWING: bp Blea a ay aan Beene 2015/KER/794 Cri.MC.No. 3838 of 2014 () APPENDIX PETITIONER'S ANNEXURES : ANNEXURE A: COPY OF THE REQUISITION ISSUED BYTHE R2 TO THE R3. ANNEXURE B: COPY OF THE INTIMATION DT 20/12/2012 ISSUED BY THE R3 TO THE R4. ANNEXURE C: COPY OF THE INTIMATION DT 20/12/2012 ISSUED BY THE R3 TO THE R5. ANNEXURE D: COPY OF THE INTIMATION DT 20/12/2012 ISSUED BY THE R3 TO THE R7. ANNEXURE E: COPY OF THE BAIL APPLICATION NO. 725/2013 FILED BEFORE THIS HON'BLE COURT. ANNEXURE F: COPY OF THE MC NO. 234/2012 FILED BY THE PETITIONER BEFORE JUDICIAL FIRST CLASS MAGISTRATE COURT - I. ANNEXURE G: COPY OF THE ORDER DT 20/3/2014 PASSED IN CRL.MC 1602/2014 BY THIS HON'BLE COURT. RESPONDENT'S ANNEXURES : NIL. HTRUE COPY!! P.S. TO JUDGE bp 2015/KER/794 B.KEMAL PASHA, J. ee ee ORDER The petitioner in M.C.234/2013 on the file of the Judicial First Class Magistrate's Court-l, Varkala has come up with the present Crl.M.C. under Section 482 Cr.PC. seeking a direction to the Judicial First Class Magistrate's Court-l, Varkala to issue necessary directions to ensure that how much gold ornaments of the petitioner are kept in the Joint Locker No.514 at the State Bank of Travancore, Varkala and also to ensure that an amount of %50,000/- has been deposited in the Account No.67152095505 of the State Bank of Travancore, Varkala. 2. Heard all the parties. Much discussion is not required to conclude that the present prayer is liable to be Beene 2015/KER/794 CRL.M.C.No.3838 of 2014 = 2% granted. Hence, this Crl.M.C. is only to be allowed. In the result, this Crl.M.C. is allowed and the Judicial First Class Magistrate Court-l, Varkala is directed to issue necessary directions to ensure that how much _ gold ornaments of the petitioner are kept in the Joint Locker No.514 and also to ensure that %50,000/- has been deposited in the Account No.67152095505 of SBT, Varkala. Sd/- B.KEMAL PASHA, JUDGE ul/- [True copy] PS. to Judge"
}