{
    "case_id": "Crl.MC.No.8218 OF 2019(F)",
    "court": "HIGH COURT OF KERALA AT ERNAKULAM",
    "date": "MONDAY",
    "judge": "ASHOK MENON MONDAY",
    "petitioners": [
        "O. KUNJAMMAD",
        "FAIZAL",
        "KUTTIYADY P. O.",
        "AGED",
        "KUTTIADY P. O.",
        "Kozhikode"
    ],
    "respondents": [
        "RAMESH CHAND-P.P",
        "V.K.CHANDRAN",
        "OTHER PRESENT",
        "KERALA",
        "KUTTIYADY P. O.",
        "AGED",
        "DISTRICT -",
        "KUTTIADY POLICE STATION",
        "O. POKKAN",
        "THE SUB INSPECTOR OF POLICE"
    ],
    "sections": [
        "324",
        "148",
        "482",
        "323",
        "341",
        "308",
        "308 r/w Section 149 of IPC",
        "143",
        "147"
    ],
    "outcome": "/JUDGMENT IN LP 22/2017 OF FIRST ADDITIONAL DISTRICT AND SESSIONS COURT, KOZHIKODE CRIME NO.517/2014 OF Kuttiyadi Police Station , Kozhikode PETITIONER/S: FAIZAL AGED 25 YEARS S/O. KUNJAMMAD, RESIDING",
    "full_text": "Rava Be eee a Bs IN THE HIGH COURT OF KERALA AT ERNAKULAM 2020/KER/IS6 PRESENT THE HONOURABLE MR. JUSTICE ASHOK MENON MONDAY, THE O6TH DAY OF JANUARY 2020 / 16TH POUSHA, 1941 Cri .MC.No.8218 OF 2019(F) AGAINST THE ORDER/JUDGMENT IN LP 22/2017 OF FIRST ADDITIONAL DISTRICT AND SESSIONS COURT, KOZHIKODE CRIME NO.517/2014 OF Kuttiyadi Police Station , Kozhikode PETITIONER/S: FAIZAL AGED 25 YEARS S/O. KUNJAMMAD, RESIDING AT AMBALAKANDY HOUSE, KUTTIADY P. O., KOZHIKODE DISTRICT. BY ADVS. SRI .ANOOP .V.NATIR SHRI .NIKITHA ANTONY RESPONDENT/S: 1 STATE OF KERALA REPRESENTED BY THE PUBLIC PROSECUTOR, HIGH COURT OF KERALA, ERNAKULAM - 682 031. 2 THE SUB INSPECTOR OF POLICE KUTTIADY POLICE STATION, KUTTIADY P. 0O., KOZHIKODE DISTRICT - 673 508. 3 V.K.CHANDRAN AGED 51 YEARS S/O. POKKAN, RESIDING AT PAIKKATTUMMAL (VATTAKKUNI) , KUTTIYADY P. O., ADUKKATH, KOZHIKODE DISTRICT - 673 508. R3 BY ADV. R.SREEHARI OTHER PRESENT: RAMESH CHAND-P.P THIS CRIMINAL MISC. CASE HAVING COME UP FOR ADMISSION ON 06.01.2020, THE COURT ON THE SAME DAY PASSED THE FOLLOWING: Hees Crl.MC.No.8218 OF 2019(F) 2 2020/KER/156 ORDER Dated this the 6th day of January 2020 Petitioner is the 1% accused in Crime No.517/2014 of Kuttiady Police Station presently pending before the i* Additional District and Sessions Court, Kozhikode as LP No.22/2017 for having allegedly committed offences punishable under Sections 143, 147, 148, 341, 323, 324 and 308 r/w Section 149 of IPC. 2. The only de facto complainant is the 3\" respondent, who has appeared through counsel and filed affidavit to the effect that the matter has been amicably settled with the petitioner and he does not have any grievance whatsoever against the petitioner A report has been filed by the investigating officer to the effect that the petitioner has eight other crimes registered against him, which also includes offences punishable under Sections 308 and 324 of IPC. Going by the description of the offence in the final report, it is seen that the injury allegedly sustained by the de facto complainant is not life threatening and it does not attract the offence under Section 308 in the strict sense. Deen Crl.MC.No.8218 OF 2019(F) 3 2020/KER/156 3. In view of the fact that the 3 respondent has settled the matter as against the 1* accused, no purpose will be served by proceeding with the trial as against him. The fact that the petitioner has criminal antecedents alone will not stand in the way to quash the proceedings against the petitioner. There is no public interest involved. In the result, the Crl.M.C is allowed and the entire proceedings as against the petitioner in Crime No.517/2014 of Kuttiady Police Station presently pending against the petitioner as L.P. No.22/2017 on the files of the 1* Additional District and Sessions Court, Kozhikode stands quashed under Section 482 of Cr.P.C. and the accused is discharged. Sd/- ASHOK MENON JUDGE Pa a Et eee me tae el | Crl.MC.No.8218 OF 2019(F) 4 2020/KER/156 APPENDIX PETITIONER'S/S EXHIBITS: ANNEXURE I TRUE COPY OF THE FINAL REPORT IN THE ABOVE CRIME FILED BY THE 2ND RESPONDENT BEFORE THE COURT BELOW. ANNEXURE IT TRUE COPY OF THE AFFIDAVIT ENTERED BY THE 3RD RESPONDENT IN THE MATTER SHOWING THAT THE MATTER IS SETTLED, DATED 12.11.2019."
}