{
    "case_id": "",
    "court": "HIGH COURT OF KERALA AT ERNAKULAM PRESENT",
    "date": "2016",
    "judge": "B.KEMAL PASHA MONDAY",
    "petitioners": [
        "AGED",
        "B.KEMAL PASHA",
        "SWORN TO",
        "REHIM",
        "Bp al",
        "SRM ROAD",
        "SALAMATH MAHAL"
    ],
    "respondents": [
        "MANKUMMA P.O.",
        "RAJI KRISHNAN",
        "IDUKKI DISTRICT.",
        "AGED",
        "O. BINDU"
    ],
    "sections": [
        "2",
        "156(3)",
        "376",
        "506(ii)"
    ],
    "outcome": "Alleging offences punishable under Sections 376 and 506(ii) of the Indian Penal Code, a private complaint was filed before the court below by the 2\" respondent. The matter was forwarded to the police ",
    "full_text": "Bp al : rein re ar renee [pes 2016/KER/33665 IN THE HIGH COURT OF KERALA AT ERNAKULAM PRESENT: THE HONOURABLE MR. JUSTICE B.KEMAL PASHA MONDAY, THE 1ST DAY OF AUGUST 2016/10TH SRAVANA, 1938 Cr1.MC.No. 4466 of 2016 () CRIME NO. 420/2016 OF ERNAKULAM NORTH POLICE STATION, ERNAKULAM DISTRICT PETITIONER (S) /ACCUSED: REHIM AGED 52 YEARS, S/O. KASIM RAWTHAR, SALAMATH MAHAL, P.T.LANE, SRM ROAD, ERNAKULAM NORTH. BY ADV. SRI.P.A.MUJEEB RESPONDENT (S) /STATE & DEFACTO COMPLAINANT: 1. STATE OF KERALA REPRESENTED BY PUBLIC PROSECUTOR, HIGH COURT OF KERALA, ERNAKULAM. 2. RAJI KRISHNAN AGED 37 YEARS, D/O. RADHAKRISHNAN, C/O. BINDU, THOTTUNGAL VEEDU, MANKUMMA P.O., KUMBILIKANDOM, IDUKKI DISTRICT. R1 BY PUBLIC PROSECUTOR SRI.C.K. SURESH R2 BY ADV. SRI.ANVER BASHEER THIS CRIMINAL MISC. CASE HAVING COME UP FOR ADMISSION ON 01-08-2016, THE COURT ON THE SAME DAY PASSED THE FOLLOWING: bp as ee aha pikes ae art 2 Sane Baa 2016/KER/33665 Cr1.MC.No. 4466 of 2016 () APPENDIX PETITIONER(S)' EXHIBITS Al: TRUE COPY OF THE FIR IN CRIME NO. 420/2016 OF ERNAKULAM TOWN NORTH POLICE STATION, ERNAKULAM. A2: TRUE COPY OF THE PRIVATE COMPLAINT DT. 17.3.2016 FILED BY THE 2D RESPONDENT BEFORE THE ADDL. CHIEF JUDICIAL MAGISTRATE COURT, ERNAKULAM. A3: TRUE COPY OF THE PRIVATE COMPLAINT DT. 14.5.2012 FILED BY THE SUGANDHI SANTHOSH BEFORE THE JUDICIAL FIRST CLASS MAGISTRATE COURT, KANJIRAPPALLY. Ad: TRUE COPY OF THE GAZETTE NOTIFICATION DT. 05.2.2008. A5: TRUE COPY OF THE ELECTION I.D CARD OF THE 2ND RESPONDENT. A6: TRUE COPY OF THE M.C NO. 47/2014 FILED BY THE 2ND RESPONDENT BEFORE THE JUDICIAL FIRST CLASS MAGISTRATE COURT II, KANJIRAPPALLY. Al: TRUE COPY OF THE MARRIAGE CERTIFICATE DT. 23.8.2014 ISSUED BY THE ELIKULAM GRAMA PANCHAYATH. A8: TRUE COPY OF THE AFFIDAVIT DT. 13.7.2016 SWORN TO BY THE 2ND RESPONDENT/DEFACTO COMPLAINANT. RESPONDENT (S)' EXHIBITS : NIL. //TRUE COPY// P.S. TO JUDGE bp Bn 2016/KER/33665 B. KEMAL PASHA, J. ee ORDER Alleging offences punishable under Sections 376 and 506(ii) of the Indian Penal Code, a private complaint was filed before the court below by the 2\" respondent. The matter was forwarded to the police for investigation under Section 156(3) CrPC. Initially, the police registered the Crime No.420/2016 through Annexure A-1 FIR. According to the petitioner and the 2\" respondent, the matter stands settled between them, and the 2 respondent has no objection in getting the proceedings against the petitioner quashed. 2. The learned Public Prosecutor submits that the matter was investigated into and it was found that the petitioner had not committed the offences punishable under Sections 376 and 506(ii) IPC. The matter has been referred BLS piri 2016/KER/33665 CRL.M.C.No. 4466 of 2016 = 2: by the police. The learned counsel for the petitioner has produced the attested copy of the report filed by the Circle Inspector of Police, Town North Circle, Kochi city before the court below wherein it has been made clear that the aforesaid offences were not committed in the case and therefore, the matter has already been referred. When the matter has been referred by the police and especially when the parties have come to a settlement, this Court is of the view that all further proceedings based on Annexure A1 FIR in Crime No.420/2016 of Ernakulam Town North Police Station, can be quashed. In the result, this Crl.M.C. is allowed and all further proceedings based on Annexure Ai FIR in Crime No.420/2016 of Ernakulam Town North Police Station, are hereby quashed. Sd/- B. KEMAL PASHA, JUDGE. ul/- // true copy // PS. to Judge."
}