{
    "case_id": "CRL.MC NO. 23 OF 2024",
    "court": "HIGH COURT OF KERALA AT ERNAKULAM PRESENT THE HONOURABLE MRS",
    "date": "2024",
    "judge": "SOPHY THOMAS MONDAY",
    "petitioners": [
        "Dee",
        "SREEKANTH M.V AGED",
        "AT MAVILAVALAPPIIL HOUSE",
        "Kasargod",
        "SHAKUNTHALA M.V AGED",
        "MAVILAVALAPPITL HOUSE",
        "Laxmi Narayan",
        "RESIDING AT MAVILAVALAPPTL HOUSE"
    ],
    "respondents": [
        "THE STATION HOUSE OFFICER HOSDURG POLICE STATION",
        "SREEVIDHYA T.K AGED",
        "MAVILAVALAPPITL HOUSE"
    ],
    "sections": [
        "498A",
        "482",
        "323 r/w Section 34 of IPC"
    ],
    "outcome": "/JUDGMENT CC 1142/2022 OF JUDICIAL MAGISTRATE OF FIRST CLASS -1I,HOSDRUG PETITIONERS/ACCUSED 1 AND 2: 1 SREEKANTH M.V AGED 36 YEARS SON OF SHAKUNTHALA M.V. RESIDING AT MAVILAVALAPPTL HOUSE, MONACHA, U",
    "full_text": "El Lan eC Ee aa ic? ait Tere 2024/KER/5244 IN THE HIGH COURT OF KERALA AT ERNAKULAM PRESENT THE HONOURABLE MRS. JUSTICE SOPHY THOMAS MONDAY, THE 22NP DAY OF JANUARY 2024 / 2ND MAGHA, 1945 CRL.MC NO. 23 OF 2024 CRIME NO.499/2022 OF Hosdurg Police Station, Kasargod AGAINST THE ORDER/JUDGMENT CC 1142/2022 OF JUDICIAL MAGISTRATE OF FIRST CLASS -1I,HOSDRUG PETITIONERS/ACCUSED 1 AND 2: 1 SREEKANTH M.V AGED 36 YEARS SON OF SHAKUNTHALA M.V. RESIDING AT MAVILAVALAPPTL HOUSE, MONACHA, UPILIKAT, PUTHUKAI VILLAGE, HOSDURG TALUK, KASARAGOD DISTRICT, PIN - 671315 2 SHAKUNTHALA M.V AGED 56 YEARS W/O. SREEDHARAN, RESIDING AT MAVILAVALAPPIIL HOUSE, MONACHA, UPILIKAI, PUTHUKAT VILLAGE, HOSDURG TALUK, KASARAGOD DISTRICT, PIN - 671315 BY ADVS. T.MADHU C.R.SARADAMANT RESPONDENTS/STATE AND DEFACTO COMPLAINANT: 1 STATE OF KERALA REPRESENTED BY PUBLIC PROSECUTOR, HIGH COURT OF KERALA, PIN - 682031 2 THE STATION HOUSE OFFICER HOSDURG POLICE STATION, KASARAGOD DISTRICT, PIN - 671315 3 SREEVIDHYA T.K AGED 29 YEARS W/O. SREEKANTH, RESIDING AT MAVILAVALAPPITL HOUSE, MONACHA, UPILIKAT, PUTHUKAT VILLAGE, HOSDURG TALUK, KASARAGOD DISTRICT, PIN - 671315 PP-SRI.PRASANTH M.P. THIS CRIMINAL MISC. CASK HAVING COME UP FOR ADMISSION ON 22.01.2024, THER COURT ON THE SAMBR DAY PASSED THE FOLLOWING: Dee os Dane 2024/KER/5244 CRL.MC NO.23 OF 2024 2 ORDER Dated this the 22\"! day of January , 2024 This Crl.M.C., under Section 482 of CrP.C., is filed by accused Nos.1 and 2 in Crime No.499 of 2022 of Hosdurg Police Station, Kasaragod, registered under Sections 498A and 323 r/w Section 34 of IPC, for quashing Annexure A2 final report in C.C.No.1142 of 2022 on the file of Judicial First Class Magistrate Court-I, Hosdurg. 2. The prosecution allegation is that, accused Nos.1 and 2, who are the husband and mother in-law of the defacto complainant/3 respondent, subjected her to matrimonial cruelties, demanding more gold and money. 3. When the matter is taken up for consideration, learned counsel for the petitioners submitted that the matter stands settled between themselves and the defacto complainant/3 respondent. The defacto complainant Dee os Dane 2024/KER/5244 CRL.MC NO.23 OF 2024 entered appearance through counsel, and submitted that the matter is settled, and Annexure A4 is the affidavit filed by her, endorsing the settlement. She has no intention to proceed with the prosecution. She has no objection in quashing the proceedings pending against the petitioners pursuant to Crime No.499 of 2022 of Hosdurg Police Station. 4. On instructions, learned Public Prosecutor submitted that the matter is settled, and he produced signed statement of the 3% respondent, to the effect that she is not intending to proceed with the prosecution, and she has no objection in quashing Annexure A2 final report in C.C.No.1142 of 2022. 5. Since the matter stands settled, no purpose would be served by continuing the prosecution against the petitioners. 6. In the light of the principles laid down by the Apex Court in Gian Singh v. State of Punjab and Another; RENE repo mye 2024/KER/5244 CRL.MC NO.23 OF 2024 4 [(2012) 10 SCC 303) ], and State of Madhya Pradesh v. Laxmi Narayan and Others; [(2019) 5 SCC 688], this Court is of the view that the proceedings against the petitioners can be quashed on the basis of settlement. Moreover, the dispute is purely personal in nature, and no public interest is involved in it. In the result, this Crl.M.C. is allowed and Annexure A2 final report in C.C.No.1142 of 2022 on the file of Judicial First Class Magistrate Court-I, Hosdurg, stands quashed. Sd/- SOPHY THOMAS JUDGE SSK/22/01 El Lan eC re mee rape at Tere 2024/KER/5244 CRL.MC NO.23 OF 2024 5 APPENDIX OF CRL.MC 23/2024 PETITIONER ANNEXURES Annexure-Al THE COPY OF THE FIR DATED 16/4/2022 IN CRIME NO.499/2022 OF HOSDURG POLICE STATION, KASARAGOD DISTRICT. Annexure-A2 THE CERTIFIED COPY OF THE FINAL REPORT DATED 26/5/2022 IN CRIME NO.499/2022 OF HOSDURG POLICE STATION, KASARAGOD DISTRICT Annexure-A3 THE TRUE COPY OF THE SETTLEMENT AGREEMENT DATED NIL IN O.P.NO.417/2021 ON THE FILES OF THE FAMILY COURT, KASARAGOD Annexure-A4 THE AFFIDAVIT DATED 11/12/2023 SWORN IN BY THE THIRD RESPONDENT"
}