{
    "case_id": "Crl.MC.No. 4594 of 2016 ()",
    "court": "HIGH COURT OF KERALA AT ERNAKULAM",
    "date": "2018",
    "judge": "B.KEMAL PASHA FRIDAY",
    "petitioners": [
        "KURUP",
        "CHENGANNUR TALUK.",
        "SAJEEV",
        "AGED",
        "B.KEMAL PASHA",
        "SUSAN THOMAS",
        "O.",
        "CHENGANNUR TALUK",
        "MAVELIKKARA",
        "O. E.K.KUTTAPPA KURUP",
        "DEEPA SAJEEV",
        "PENNUKKARA MURI",
        "MC.No",
        "J. Dated",
        "PATHIYOOR P.O",
        "Rapala",
        "PENNUKKARA MURL"
    ],
    "respondents": [
        "ADDL R",
        "REPRESENTED BY PUBLIC",
        "SOMAN S",
        "ERNAKULAM-",
        "IN CRL.MA",
        "RESPONDENT",
        "IN CRL.MA NO.",
        "LEELAMONY",
        "ADDL. R",
        "ADDL.R",
        "PERINGALA",
        "CHAKALAYIL HOUSE",
        "MENPALLI MURI"
    ],
    "sections": [
        "239",
        "420 read with 34 IPC"
    ],
    "outcome": "DATED 23/12/2016 IN CRL.MA 13835/2016 IN CRL.MC NO. 4594/2016. *ADDL. R3 IMPLEADED : LEELAMONY, W/O. SOMAN, RESIDING AT CHAKKALAYIL HOUSE, MENPALLI MURI,PATHIYOOR P.O, PERINGALA, MAVELIKKARA *ADDL.R3 ",
    "full_text": "Eat es Rapala ee Le Bleck IN THE HIGH COURT OF KERALA AT ERNAKULAM 2018/KER/489 PRESENT: THE HONOURABLE MR. JUSTICE B.KEMAL PASHA FRIDAY, THE 5TH DAY OF JANUARY 2018 / 15TH POUSHA, 1939 Cr1.MC.No. 4594 of 2016 CC 781/2014 of JUDICIAL FIRST CLASS MAGISTRATE COURT, KAYAMKULAM PETITIONERS/1ST AND 2ND ACCUSED : 1 DEEPA SAJEEV, W/O. SAJEEV, AGED 45 YEARS, KADYKAL PEDIKAYIL HOUSE, PENNUKKARA MURL, PERUNGALA VILLAGE CHENGANNUR TALUK 2 SAJEEV, $/O. E.K.KUTTAPPA KURUP, AGED 50 YEARS, KADYKAL PEDIKAYIL HOUSE, PENNUKKARA MURI, PERUNGALA VILLAGE, CHENGANNUR TALUK. BY ADVS.SRI.LIJU.V.STEPHEN SMT .INDU SUSAN JACOB RESPONDENT/RESPONDENT : 1. STATE OF KERALA REPRESENTED BY PUBLIC PROSECUTOR ,HIGH COURT OF KERALA, ERNAKULAM- 682031 *ADDL. R2 IMPLEADED : 2. SOMAN S/O.DAMODARAN, 62 YEARS, CHAKALAYIL HOUSE, MEENAMPALLI MURI,PATHIYOOR P.O, PERINGALA, MAVELIKKARA *ADDL R2 IS IMPLEADED AS PER ORDER DATED 23/12/2016 IN CRL.MA 13835/2016 IN CRL.MC NO. 4594/2016. *ADDL. R3 IMPLEADED : LEELAMONY, W/O. SOMAN, RESIDING AT CHAKKALAYIL HOUSE, MENPALLI MURI,PATHIYOOR P.O, PERINGALA, MAVELIKKARA *ADDL.R3 IS IMPLEADED AS PER ORDER DATED 1/06/2017 IN CRL.MA NO.5979/2017 Ri BY PUBLIC PROSECUTORSRI.C.S.HRITHWICK ADDL.R2 & R3 BY ADV. SMT.GISA SUSAN THOMAS BY ADV. SMT.G.ASHWINI THIS CRIMINAL MISC. CASE HAVING COME UP FOR ADMISSION ON 05-01-2018,THE COURT ON THE SAME DAY PASSED THE FOLLOWING: bp gee] Rapala ee iat ai Le ops 2018/KER/489 Crl.MC.No. 4594 of 2016 () APPENDIX PETITIONER(S)' EXHIBITS ANNEXURE AL: A TRUE COPY OF THE AGREEMENT DATED 30.12.2011 BETWEEN PETITIONER AND DE-FACTO COMPLAINANT ANNEXURE A2: TRUE COPY OF THE FIR NO.960/2012 OF KAYAMKULAM POLICE STATION ~* ANNEXURE A3: A TRUE COPY OF THE FINAL REPORT IN C.C.NO.781/2014 OF JFCM, KAYAMKULAM ANNEXURE A4: COPY OF THE AGREEMENT DATED 3/1/2012 BETWEEN 2ND PETITIONER AND THE LAND OWNERS. ANNEXURE A5: COPY OF THE PLAINT IN OS NO.134/2013. ANNEXURE A6: COPY OF THE WRITTEN STATEMENT IN OS NO. 134/2013. RESPONDENT'S ANNEXURES : ANNEXURE R3(a): COPY OF THE DEATH CERTIFICATE ISSUED FROM REGISTRAR OF BIRTH AND DEATH AND HEALTH INSPECTOR, MARADU MUNICIPALITY. //TRUE coPpy// P.A. TO JUDGE bp bine 2018/KER/489 B. KEMAL PASHA, J. Dated this the 5\" day of January, 2018 ORDER Petitioners are accused Nos.i1 and 2 _ in C.C.No.781/2014 of the Judicial First Class Magistrate's Court, Kayamkulam, based on Annexure-A3 final report in Crime No.960/2012 of the Kayamkulam Police Station for the offences under Section 420 read with 34 IPC. The allegation against the 1* petitioner is that she had offered to sell a petrol bunk, being conducted by her in a property, by claiming that she has every right over the property to convey, through Annexure-Al agreement. In Annexure-Al agreement she has agreed that she would make all the title holders of the property also as party to the sale deed. 2. According to the petitioners, who are the accused Nos.i and 2, they have every right to convey the property. The defacto complainant and his wife have been impleaded in the Crl.M.C. as additional respondents 2 and 3. The learned counsel for the said respondents submits that the defacto complainant has been deliberately cheated through bine 2018/KER/489 Cri.M.C.No.4594 of 2016 2 Annexure-Al agreement and the money has not been so far returned. It has been argued that the petitioners have no right to convey the property. 3. The present arguments forwarded by the learned counsel for the petitioners cannot be considered by this Court at this stage. Those matters have to be decided by the court below at appropriate stage. With liberty to the petitioners to take up all these contentions before the court below at the stage of framing charges under Section 239 Cr.P.C., this Crl.M.C. is disposed of. If the stage of Section 239 Cr.P.C. is over, the petitioners may take up all these contentions during trial. Sd/- B. KEMAL PASHA, JUDGE. ne // True Copy // P.A. to Judge"
}