{
    "case_id": "Crl.MC.No. 150 of 2015 ()",
    "court": "HIGH COURT OF KERALA AT ERNAKULAM PRESENT",
    "date": "12 day of January, 2015",
    "judge": "K.ABRAHAM MATHEW MONDAY",
    "petitioners": [
        "A IPC",
        "JIBU P. THOMAS",
        "O.ABDUL SALAM",
        "OBJECTION",
        "KANDACHIRA",
        "KULSAM BEEVI",
        "Bene",
        "NANTHAM VEETTIL",
        "MC.No",
        "SHARJAH MANZIL",
        "ZIYAD"
    ],
    "respondents": [
        "SHEMEERA",
        "VELLIMON P.O.",
        "O.NABEESA BEEVI"
    ],
    "sections": [
        "498A",
        "323"
    ],
    "outcome": "The petitioners are accused in CC.No.1351/2014 on the file of the Judicial Magistrate of the First Class-I, Kollam. It is alleged that they have committed the offences under Sections 323 and 498A IPC.",
    "full_text": "Beal ae rein Bene 2015/KER/1259 IN THE HIGH COURT OF KERALA AT ERNAKULAM PRESENT: THE HONOURABLE MR. JUSTICE K.ABRAHAM MATHEW MONDAY, THE 12TH DAY OF JANUARY 2015/22ND POUSHA, 1936 Crl.MC.No. 150 of 2015 () CC 1351/2014 OF JUDICIAL FIRST CLASS MAGISTRATE COURT-I, KOLLAM CRIME NO. 1648/2013 OF ANCHALUMMOODU POLICE STATION, KOLLAM PETITIONERS/ACCUSED NO.1 AND 2 : 1. ZIYAD, AGED 33 YEARS S/O.ABDUL SALAM, ANANTHAM VEETTIL, KIZHAKKATHIL KANDACHIRA, PERINAD P.O., KOLLAM DISTRICT. 2. KULSAM BEEVI W/O.ABDUL SALAM, AGE 60, NANTHAM VEETTIL, KIZHAKKATHIL KANDACHIRA, PERINAD P.O., KOLLAM DISTRICT. BY ADVS.SRI.K.ABDUL JAWAD SRI.MATHEW A.KUZHALANADAN SMT.VINEETHA V. KUMAR RESPONDENTSI/STATE & COMPLAINANT : 1. STATE OF KERALA REPRESENTED BY PUBLIC PROSECUTOR HIGH COURT OF KERALA, ERNAKULAM-682 031. 2. SHEMEERA, AGED 29 YEARS D/O.NABEESA BEEVI, SHARJAH MANZIL, KERALAPURAM VELLIMON P.O., KOLLAM - 691 001. Ri BY PUBLIC PROSECUTOR SRI. JIBU P. THOMAS R2 BY ADV. SRI.S.MOHAMMED AL RAFI THIS CRIMINAL MISC. CASE HAVING COME UP FOR ADMISSION ON 12-01-2015, THE COURT ON THE SAME DAY PASSED THE FOLLOWING: Mn we2l- Beal ae rein Bene 2015/KER/1259 Crl.MC.No. 150 of 2015 () APPENDIX PETITIONERS' ANNEXURES : ANNEXURE-A: CERTIFIED COPY OF THE FINAL REPORT IN F.ILR NO.1648/2013 OF ANCHALUMOODU POLICE STATION IN KOLLAM DISTRICT. ANNEXURE-B: ORIGINAL OF THE AFFIDAVIT SWORN BY 2ND RESPONDENT TO BE PRODUCED BEFORE THIS HON'BLE COURT, STATING HER NO OBJECTION FOR QUASHING THE PROCEEDINGS AGAINST THE PETITIONER. RESPONDENT(S) EXHIBITS : NIL HTRUE COPY// PA. TO JUDGE Mn 2015/KER/1259 K.ABRAHAM MATHEW, J. Cr.M.C.No.150 of 2015. Dated this the 12 day of January, 2015. ORDER The petitioners are accused in CC.No.1351/2014 on the file of the Judicial Magistrate of the First Class-I, Kollam. It is alleged that they have committed the offences under Sections 323 and 498A IPC. It is submitted that the matter has been settled between the parties and it is prayed that the proceedings in the criminal case may be quashed. 2. Heard the learned counsel for the petitioners and of the 2 respondent and the learned Public Prosecutor. 3. The first petitioner and the second respondent who is the defacto complainant are husband and wife. The second petitioner is the mother of the first petitioner. The second respondent has entered appearance through a counsel and filed an affidavit to the effect that the matter has been settled and the proceedings in the criminal case may be quashed. I have perused the allegations in the final piers 2015/KER|M259 Crl.M.C.No.150/2015. 2 report and the averments in the affidavit. I am satisfied that this is a fit case to quash the proceedings in the criminal case. 4. In the result, this petition is allowed. The proceedings in CC.No.1351/2014 on the file of the Judicial Magistrate of the First Class-I, Kollam are quashed. The learned Magistrate may pass appropriate orders for release of the FD receipt produced before him. Sd/- K.ABRAHAM MATHEW, (Judge) Kvs/- (true copy )"
}