{
    "case_id": "CC 228/2008",
    "court": "HIGH COURT OF KERALA AT ERNAKULAM PRESENT",
    "date": "2 day of January, 2014",
    "judge": "HARUN-UL-RASHID THURSDAY",
    "petitioners": [
        "CHERTHALA",
        "P. A.",
        "PURA -",
        "S.KUMAR AGED",
        "THIRUVANANTHAPURAM.",
        "O.LATE P.SUBRAMANIAN",
        "Cherthala",
        "J. Dated",
        "S. RALPH SMT",
        "ANNEXURE-"
    ],
    "respondents": [],
    "sections": [
        "205"
    ],
    "outcome": "/JUDGMENT IN CC 228/2008 of J.M.F.C.-II, CHERTHALA DATED 02-12-2013 AGAINST THE ORDER/JUDGMENT IN Crl.Rev.Pet 1017/2013 of HIGH COURT OF KERALA DATED 29-05-2013 PETITIONER (S) /ACCUSED: S.KUMAR AGED 8",
    "full_text": "pc grepeahPeas Bas 2014/KER/209 IN THE HIGH COURT OF KERALA AT ERNAKULAM PRESENT: THE HONOURABLE MR.JUSTICE HARUN-UL-RASHID THURSDAY, THE 2ND DAY OF JANUARY 2014/12TH POUSHA, 1935 Cr1.MC.No. 22 of 2014 () AGAINST THE ORDER/JUDGMENT IN CC 228/2008 of J.M.F.C.-II, CHERTHALA DATED 02-12-2013 AGAINST THE ORDER/JUDGMENT IN Crl.Rev.Pet 1017/2013 of HIGH COURT OF KERALA DATED 29-05-2013 PETITIONER (S) /ACCUSED: S.KUMAR AGED 82 YEARS $/O.LATE P.SUBRAMANIAN, T C 17/1760, PURA - 8 \"REMANIAM\" NETAJI ROAD, POOJAPPURA THIRUVANANTHAPURAM. BY ADVS.SRI.V.JOHN S. RALPH SMT .PREETHY KARUNAKARAN SRI.K.J.JOSEPH (ERNAKULAM) SRI.V.JOHN THOMAS RESPONDENT /COMPLAINANT : STATE OF KERALA REPRESENTED BY THE PUBLIC PROSECUTOR HIGH COURT OF KERALA AT ERNAKULAM, COCHIN - 31. BY PUBLIC PROSECUTOR SMT.S.HYMA THIS CRIMINAL MISC. CASE HAVING COME UP FOR ADMISSION ON 02-01-2014, THE COURT ON THE SAME DAY PASSED THE FOLLOWING: pc pena ees 2014/KER/209 Cr1.MC.No. 22 of 2014 () APPENDIX PETITIONER(S)' EXHIBITS ANNEXURE-1: TRUE COPY OF THE ORDER DATED 29.5.2013 IN CRL.R.P 1017/2013 OF THE HON'BLE HIGH COURT OF KERALA. ANNEXURE-2: CERTIFIED COPY OF THE ORDER DATED 2.12.2013 ON THE FILE OF THE JFCM COURT II, CHERTHALA. ANNEXURE-3: TRUE COPY OF THE MEDICAL CERTIFICATE DATED 19.6.2013 RESPONDENT (S)' EXHIBITS : NIL /TRUE COPY/ P. A. TO JUDGE Pn pou 2014/KER/209 HARUN-UL-RASHID, J. Dated this the 2 day of January, 2014 ORDER This Crl.M.C is filed seeking to set aside the order dated 02.12.2013 in C.M.P.No.4939/2013 in C.C.No.228/08 on the file of the Judicial First Class Magistrate Court -IIl, Cherthala. 2. The petitioner submitted an application before the court below for exempting him from personal appearance, considering his health conditions. The learned Magistrate dismissed the petition finding that, the above case being a warrant trial, the application filed under section 205 Cr.P.C. is applicable only in summons cases. The court below granted sufficient time for appearance of the petitioner. 3. The petitioner is aged 82 and it is submitted that he is a bedridden and undergoing treatment in PRS Hospital, Thiruvananthapuram. He is advised by his physician to avoid any travelling. The petitioner produced copy of the medical certificate as Annexure 3. This Court in Crl.R.P.No.1017/2013 observed that, the petitioner is an 83 year old person suffering from serious diseases and that, it is a good ground for seeking exemption from appearance. el a aie apa 2014/KER/209 Crl.M.C.No.22 of 2014 2 In the facts and circumstances, this Court is of the view that the petitioner is entitled to the relief sought for. Hence, this Crl.M.C is allowed. The order dated 02.12.2013 marked as Annexure 2 is set aside. The petitioner is exempted from personal appearance except on postings where his presence is absolutely necessary. Sd/- HARUN-UL-RASHID, JUDGE. AV"
}