{
    "case_id": "Crl.MC.No. 4917 of 2016 ()",
    "court": "HIGH COURT OF KERALA AT ERNAKULAM PRESENT",
    "date": "2016",
    "judge": "RAJA VIJAYARAGHAVAN V THURSDAY",
    "petitioners": [
        "BHOMIKA HOUSE",
        "JITHIN NIVAS",
        "KOZHIKODE-",
        "NAMBRAKOTT HOUSE",
        "JITHIN S",
        "NEAR NELLALAM POLICE STATION",
        "KOTTADATH HOUSE",
        "VELLIMADKUNNU",
        "PANATHUR",
        "ARUKANDATHIL HOUSE",
        "PRESENTLY RESIDING AT P",
        "TONY BABU",
        "KOZHIKODE -",
        "VISHAK.K",
        "ANOOP.P",
        "NELLIKUNNU HOUSE",
        "AGED",
        "AJITH KUMAR",
        "SHRAVAN K SATHEESH",
        "TIRURANGADI TALUK",
        "CHOOLUR P.O.",
        "MALAPPURAM",
        "ABDUL RAHIM",
        "O.VASUDEVAN",
        "CHERUKULATHOOR P.O.",
        "MC.No",
        "PAINGOTUPURAM",
        "Ber"
    ],
    "respondents": [
        "PZHAYAKANDATHIL HOUSE",
        "KOZHIKODE-",
        "ARTYALLUR",
        "ALI AKBAR",
        "MUHAMMED AJINAS",
        "SMT .M.SHAJNA",
        "PRANAV",
        "NIBRAS AHAMMAD",
        "PANNIYANKARA POLICE STATION",
        "PARAPANANGADI P.O.",
        "K.PURAM",
        "AGED",
        "MUBASHIR",
        "PARAPPANANGADI P.O.",
        "ABDUL RAHIM",
        "MALAPPURAM DISTRICT -",
        "PANACHARANTAPURAKKAL HOUSE",
        "PUTHANPEEDIKA",
        "THE SUB INSPECTOR OF POLICE"
    ],
    "sections": [],
    "outcome": "The learned counsel for the petitioners prays that the petition be dismissed",
    "full_text": "Ber eel peace Sears Deas oat Ti neath 2016/KER/34132 IN THE HIGH COURT OF KERALA AT ERNAKULAM PRESENT : THE HONOURABLE MR. JUSTICE RAJA VIJAYARAGHAVAN V THURSDAY, THE 4TH DAY OF AUGUST 2016/13TH SRAVANA, 1938 Cr1.MC.No. 4917 of 2016 () SC 665/2016 OF SPECIAL ADDITIONAL SESSIONS COURT (MARAD CASES) KOZHIKODE. CRIME NO.446/2014 OF PANNIYANKARA POLICE STATION, KOZHIKODE. PETITIONER (S) /ACCUSED : 1. TONY BABU, AGED 21 YEARS, S/O.IGNATIOUS BABU, BHOMIKA HOUSE, POOLAKADAVU ROAD, VELLIMADKUNNU, MERIKUNNU P.O., KOZHIKODE-673012. 2. VISHAK.K, AGED 21 YEARS, S/O.VISHVANATHAN, KOTTADATH HOUSE, MEDICAL COLLEGE VIA, CHERUKULATHOOR P.O., KOZHIKODE-673008. 3. AJITH KUMAR, AGED 19 YEARS, S/O.NARAYANI, NELLIKUNNU HOUSE, RAJAPURAM P.O., PANATHUR, KASSARGODE - 671532. PRESENTLY RESIDING AT P & T QUARTERS, 59, NEAR NELLALAM POLICE STATION, KOZHIKODE - 673027. 4. ANOOP.P, AGED 21 YEARS, S/O.VASUDEVAN, POOLAPARAMBIL HOUSE, CHOOLUR P.O., CHATHAMANGALAM, KOZHIKODE - 673601. 5. JITHIN S8.Y., AGED 21 YEARS, S/O.SHIJU, JITHIN NIVAS, THATKOTTUMCHALIL, PAINGOTUPURAM, KUNNAMANGALAM, KOZHIKODE-673571. 6. SHRAVAN K SATHEESH, AGED 20 YEARS, S/O.SATHEESH KUMAR, ARUKANDATHIL HOUSE, CHENAKKALANGADI, TIRURANGADI TALUK, MALAPPURAM - 676636. --2-- Ber eel peace Sears Deas oat Ti eee 2016/KER/34132 --2-- Crl.MC.No. 4917 of 2016 () 7. ANAS, AGED 35 YEARS, S/O.AHMEDKUTTY, NAMBRAKOTT HOUSE, CHENAKKALANGADT , TIRURANGADI TALUK, MALAPPURAM - 676636. 8. SAITHU MATHILANJERI, AGED 48 YEARS, S/O.ALI KUTTY, THRIKKANUR HOUSE, CHENAKKALANGADI, TIRURANGADI TALUK, MALAPPURAM - 673636. BY ADV. SRI.S.KANNAN RESPONDENT (S)/STATE AND VICTIMS: 1.THE STATE OF KERALA, REPRESENTED BY THE PUBLIC PROSECUTOR, HIGH COURT OF KERALA, ERNAKULAM. 2.THE SUB INSPECTOR OF POLICE, PANNIYANKARA POLICE STATION, KOZHIKODE- 673003. 3.MUBASHIR, S/O.HAMZA KOYA, AGED 22 YEARS, PANACHARANTAPURAKKAL HOUSE, PARAPANANGADI P.O., MALAPPURAM DISTRICT - 676303. 4.PRANAV, S/O.SOMASUNDARAN, AGED 21 YEARS, THAROL HOUSE, K.PURAM, THANALUR, MALAPPURAM. 5.ALI AKBAR, S/O.ABDULLA, AGED 22 YEARS, PZHAYAKANDATHIL HOUSE, PARAPPANANGADI P.O., MALAPPURAM. 6.NIBRAS AHAMMAD,S/O.ABDUL RAZAK, AGED 20 YEARS, KONARI HOUSE, ARTYALLUR, VALLIKUNNU P.O., MALAPPURAM. 7.MUHAMMED AJINAS ,S/O.MAYANKUTTY, AGED 23 YEARS, CHERKOTTU HOUSE, PUTHANPEEDIKA, PARAPANANGADI, MALAPPURAM DT. 8.ABDUL RAHIM,S/O.ABDUL KAREEM, AGED 20 YEARS, MACHINJERI HOUSE, K.PURAM, MALAPPURAM DISTRICT. RL & R2 BY PUBLIC PROSECUTOR SRI.AMJAD ALI R3 BY ADVS.SRI.K.M.FIROZ SMT .M.SHAJNA THIS CRIMINAL MISC. CASE HAVING COME UP FOR ADMISSION ON 04-08-2016, THE COURT ON THE SAME DAY PASSED THE FOLLOWING: mbr/ 2016/KER/34132 RAJA VIJAYARAGHAVAN.V., J Cri.M.C. No. 4917 of 2016 Dated 4% August, 2016 ORDER The learned counsel for the petitioners prays that the petition be dismissed as withdrawn without prejudice to their right to move afresh. It is also prayed that the original documents produced along with this petition be returned back to him. Permission is granted. This petition is dismissed as withdrawn. Sd/- RAJA VIJAYARAGHAVAN.V., JUDGE kp/-5.8.16"
}