{
    "case_id": "",
    "court": "HIGH COURT OF KERALA AT ERNAKULAM PRESENT",
    "date": "WEDNESDAY",
    "judge": "B.P.RAY WEDNESDAY",
    "petitioners": [
        "A.ZEENATH",
        "SHAFI MANZIL",
        "KOLLAM."
    ],
    "respondents": [
        "SRIL.K.JOHN MATHAI",
        "SRILP BENNY THOMAS",
        "IM IMPLEADED AS ADDL.R",
        "REPRESENTING S.H.O.KARUNAGAPALLY POLICE STATION.",
        "SRILJOSON MANAVALAN",
        "ADDL.R",
        "A.LAYLA",
        "SRILA.K.JAYASANKAR NAMBIAR",
        "CRL.MA."
    ],
    "sections": [
        "468",
        "420",
        "406",
        "463"
    ],
    "outcome": "IN OS 181/2007 of PRINCIPAL SUB COURT,KOLLAM CRIME NO.825/2011 OF KARUNAGAPALLY POLICE STATION, KOLLAM PETITIONER(S)/ACCUSED: A.ZEENATH, W/O. SHAFI MUSALIAR, SHAFI MANZIL, TKMC.P.O., KARIKODE KOLLAM. ",
    "full_text": "Fees Be fe! Seat 2014/KER/54 IN THE HIGH COURT OF KERALA AT ERNAKULAM PRESENT: THE HONOURABLE MR.JUSTICE B.P.RAY WEDNESDAY, THE 1ST DAY OF JANUARY 2014/11TH POUSHA, 1935 Cril.MC.No. 1426 of 2011 AGAINST THE ORDER IN OS 181/2007 of PRINCIPAL SUB COURT,KOLLAM CRIME NO.825/2011 OF KARUNAGAPALLY POLICE STATION, KOLLAM PETITIONER(S)/ACCUSED: A.ZEENATH, W/O. SHAFI MUSALIAR, SHAFI MANZIL, TKMC.P.O., KARIKODE KOLLAM. BY ADVS.SRI.P.VIJAYA BHANU (SR.) SMT.P.K.PRIYA RESPONDENT(S)/STATE: 1, THE STATE OF KERALA, REPRESENTED BY PUBLIC PROSECUTOR, HIGH COURT OF KERALA, ERNAKULAM REPRESENTING S.H.O.KARUNAGAPALLY POLICE STATION. * ADDL.R2 IMPLEADED 2. A.LAYLA, W/O.HASHIM, SALMA MANZIL, VEMBAYAM P.O., THEKKADE VILLAGE, THIRUVANANTHAPURAM, PIN-695615. IM IMPLEADED AS ADDL.R2 AS PER ORDER DATED 8/7/11 IN CRL.MA.3402/11 IN MC.1426/11. R1 BY PUBLIC PROSECUTOR SRI.LNOUSHAD THOTTATHIL R2 BY ADVS. SRI.E.K.NANDAKUMAR SRILA.K.JAYASANKAR NAMBIAR SRIL.K.JOHN MATHAI SRILP BENNY THOMAS SRI.P.GOPINATH SRILJOSON MANAVALAN THIS CRIMINAL MISC. CASE HAVING BEEN FINALLY HEARD ON 01-01-2014, THE COURT ON THE SAME DAY PASSED THE FOLLOWING: PJ a sia Be in Cet 2014/KER/54 Cri.MC.No. 1426 of 2011 APPENDIX PETITIONERS ANNEXURES ANNEX.1: COPY OF THE FIR IN CRIME NO.825/2011 OF KARUNAGAPALLY POLICE STATION. ANNEX.2: COPY OF THE PLAINT IN O.S.NO.390/2006 ON THE FILE OF THE SUB JUDGE, KOLLAM ON THE FILE OF SUB COURT, KOLLAM. ANNEX.3: COPY OF THE PLAINT IN OS.534/2006 ON THE FILE OF SUB COURT, KOLLAM. ANNEX.4: COPY OF THE JUDGMENT IN OS.181/2007 ON THE FILE OF PRINCIPAL SUB JUDGE, KOLLAM. ANNEX.5: COPY OF THE MEDICAL CERTIFICATE ISSUED IN RESPECT OF THE PETITIONER DATED 20/3/2011. ANNEX.6: COPY OF THE PARTNERSHIP DEED RELIED UPON BY THE PETITIONER DATED 28/3/2003 ANNEX.7: COPY OF THE PARTNERSHIP DEED (THE ALLEGED FORGED DOCUMENT) DATED 28/3/2003. RESPONDENTS ANNEXURE NIL. { TRUE COPY / P.S. TO JUDGE PJ 2014/KER/54 B.P.RAY). ~ CrLM.C.No.1426 OF 2011 Dated this the 1* day of January, 2014 ORDER Heard learned counsel for the petitioner, learned Public Prosecutor and the learned counsel appearing for the additional second respondent. 2. Petitioner has been implicated as accused in Crime No.825/2011 registered by Karunagappally Police Station alleging commission of offences punishable under Sections 406, 420, 463 and 468 of Indian Penal Code. Petitioner herein seeks to quash the proceedings pursuant to the above crime on the ground that the allegations in the complaint will not constitute the offences as alleged. 3. Learned Public Prosecutor submits that the investigation is going on and the investigation conducted so far reveals that the petitioner has committed the offence of cheating by making forged documents. 4. In that view of the matter, I am not inclined to express any opinion on the merits of the case. If the petitioner appears before the learned Magistrate within two months from today and applies for bail, a sia Biz is mi 2014/KER/54 Crl.M.C.No.1426 OF 2011 non she shall be released on bail on such terms and conditions the Magistrate deems fit. The petitioner shall co-operate with the investigation and shall not try to tamper with the evidence. Crl.M.C. is disposed of as above. B.P.RAY JUDGE jes"
}