{
    "case_id": "Crl.MC.No. 24 of 2014",
    "court": "HIGH COURT OF KERALA AT ERNAKULAM PRESENT",
    "date": "2014",
    "judge": "HARUN-UL-RASHID THURSDAY",
    "petitioners": [
        "VISHWAN",
        "KEERIKADU.",
        "VINEETHA BHAVANAM",
        "KANNAMPALLY BHAGHOM",
        "MC.No",
        "O.CHAKRAPANI"
    ],
    "respondents": [
        "ERNAKULAM",
        "RAMAPURAM -",
        "AJIKUMAR",
        "CHOOLATHERUVU",
        "UTHAMAN",
        "SUJIKUMAR",
        "KAYAMKULAM POLICE STATION -",
        "MUTHUKULAM THEKKU",
        "O.KRISHNAN",
        "O.KOCHUMANI",
        "ERUMBANILEKSHAM VEEDU"
    ],
    "sections": [
        "307"
    ],
    "outcome": "Heard the learned counsel for the petitioner and respondents. 2. Accused in Crime No.497/2012 of Kanakakkunnu Police Station pending as S.C.No.276/2013 on the file of the Additional Sessions Court (Fa",
    "full_text": "Oar ee sean BEA 2014/KER/211 IN THE HIGH COURT OF KERALA AT ERNAKULAM PRESENT: THE HONOURABLE MR.JUSTICE HARUN-UL-RASHID THURSDAY, THE 2ND DAY OF JANUARY 2014/12TH POUSHA, 1935 Crl.MC.No. 24 of 2014 SC NO.276/2013 OF ADDL.SESSIONS COURT (FAST TRACK )-II, ALAPPUZHA CRIME NO. 497/2012 OF KANAKAKUNNU POLICE STATION , ALAPPUZHA PETITIONER(S):ACCUSED: VISHWAN,AGED 44 YEARS, S/O.CHAKRAPANI, VINEETHA BHAVANAM, KANNAMPALLY BHAGHOM, KEERIKADU. BY ADVS.SRILR.SUNIL KUMAR SMT.A.SALINI LAL RESPONDENT/COMPLAINANT/CW-2 AND 3: 1. STATE OF KERALA, REPRESENTED BY PUBLIC PROSECUTOR, HIGH COURT OF KERALA, ERNAKULAM, THROUGH POLICE INSPECTOR, KAYAMKULAM POLICE STATION - 690 502. 2. SUJIKUMAR, AGED 36 YEARS, S/O.KRISHNAN, THIRUVATHIRA, MUTHUKULAM THEKKU, MUTHUKULAM - 690 506. 3. AJIKUMAR, AGED 31 YEARS, S/O.KRISHNAN, ANAKHA BHAVAN, CHOOLATHERUVU, MUTHUKULAM - 690 506. 4. UTHAMAN, AGED 42 YEARS, S/O.KOCHUMANI, ERUMBANILEKSHAM VEEDU, RAMAPURAM - 686 576. R1 BY PUBLIC PROSECUTOR SMT.S. HYMA R2, R3 &R4 BY ADV. SMT.T.M.BINITHA THIS CRIMINAL MISC. CASE HAVING COME UP FOR ADMISSION ON 02-01-2014, THE COURT ON THE SAME DAY PASSED THE FOLLOWING: Kss ae cae Fretted lee 2014/KER/211 Crl.M.C.No.24/2014 APPENDIX PETITIONER'S ANNEXURES: ANNEX.A1: COPY OF THE FINAL REPORT. ANNEX.A2: COPY OF THE AFFIDAVIT BY THE 2ND,3RD & 4TH RESPONDENT. RESPONDENT'S ANNEXURES: NIL ITRUE COPY/ P.A.TO JUDGE Kss Bil HARUN-UL-RASHID, J. NEED Cr.M.C. No.24 of 2014 Dated this the 2 day of January 2014. ORDER Heard the learned counsel for the petitioner and respondents. 2. Accused in Crime No.497/2012 of Kanakakkunnu Police Station pending as S.C.No.276/2013 on the file of the Additional Sessions Court (Fast Track)-II, Alappuzha is the petitioner. The petition is filed seeking to quash Annexure -A and further proceedings against the petitioner in Crime No. 497/2012 of Kanakakkunnu Police Station. 3. The offence alleged is punishable under Section 307 of IPC. 4. The learned counsel on both sides submit that the disputes between the parties have been amicably settled and having regard to the resolution of the disputes between the parties, continuance of the criminal prosecution against the petitioner is an avoidable irritant. In view of the settlement arrived at between the parties, the Crl.M.C is disposed of quashing Annexure-A and further proceedings against the petitioner in Crime No. 497/2012 of Kanakakkunnu Police Station. Sd/- HARUN-UL-RASHID, Judge. AL/- True copy P.A to Judge"
}