{
    "case_id": "Sc1/04",
    "court": "HIGH COURT OF KERALA AT HRNAKULAM PRESENT THE HONOURABLE MR",
    "date": "4 day of January, 2021",
    "judge": "V.G.ARUN MONDAY",
    "petitioners": [
        "SUNIL LAL G.",
        "UDAYA BHAVANAN",
        "Tipper Lorry",
        "HOLDER",
        "SUBHASH BHAVAN",
        "KOLLAM",
        "LAL G. S",
        "O GURUDASAN",
        "KER",
        "CHERRY",
        "P.O.MAYYANADU"
    ],
    "respondents": [
        "PP RENJITH T.R.",
        "OTHER PRESENT",
        "DISTRICT COLLECTOR"
    ],
    "sections": [
        "457"
    ],
    "outcome": "Dated this the 4 day of January, 2021 Petitioner claims to be the owner of a Tipper Lorry bearing Registration No.KL-23-6434. The vehicle was seized by the 2 respondent alleging violation of the provi",
    "full_text": "oti PER 2021/KER/146 IN THE HIGH COURT OF KERALA AT HRNAKULAM PRESENT THE HONOURABLE MR.JUSTICE V.G.ARUN MONDAY, THE O4TH DAY OF JANUARY 2021 / 14TH POUSHA, 1942 Cr1.MC.No.5918 OF 2020 (H) CMP 2052/2020 OF JUDICIAL FIRST CLASS MAGISTRATE COURT, PARAVUR PETITIONER/S: SUNIL LAL G. S/O GURUDASAN, UDAYA BHAVANAN, THAZHUTHALA CHERRY, THAZHUTHARA VILLAGE, KOLLAM ,REPRESENTED BY ITS POWER OF ATTORNEY HOLDER, SUBASH, AGED 47 YEARS, S/O SUDARSANAN, SUBHASH BHAVAN, THEKKUMKARA, PULLICHIRA P.O.MAYYANADU, KOLLAM. BY ADV. SRI.M.R.SASITH RESPONDENT/S: 1 STATE OF KERALA, REPRESENTED BY THE PUBLIC PROSECUTOR, HIGH COURT OF KERALA, PIN-682 O31. 2 DISTRICT COLLECTOR, COLLECTORATE, KOLLAM, KERALA, PIN-691 013. OTHER PRESENT: PP RENJITH T.R. THIS CRIMINAL MISC. CASE HAVING COME UP FOR ADMISSION ON 04.01.2021, THE COURT ON THE SAME DAY PASSED THE FOLLOWING: Een 2021/KER/146 Crl.M.C No. 5918 of 2020 -2- ORDER Dated this the 4 day of January, 2021 Petitioner claims to be the owner of a Tipper Lorry bearing Registration No.KL-23-6434. The vehicle was seized by the 2 respondent alleging violation of the provisions of the Mines and Minerals (Development and Regulation) Act, 1957. After seizure, the petitioner's vehicle was produced before the Judicial First Class Magistrate Court (Temporary), South Paravur. On the basis of an application submitted by the petitioner under Section 457 of the Code of Criminal Procedure, the learned Magistrate issued Annexure Al order directing release of the vehicle, subject to conditions. The petitioner complied with the conditions and the vehicle was Een 2021/KER/146 Crl.M.C No. 5918 of 2020 -3- released. 2. This Crl.M.C is filed aggrieved by condition No.4(7) in Annexure Al order, directing the original documents produced before the court to be retained in court custody and to issue true certified copies of those documents to the petitioner. Annexure A2 is the order passed by this Court whereby, the condition akin to condition No.4(7) in Annexure Al was modified. 3. On the facts of this case and in view of the earlier orders passed by this Court under Similar circumstances, I am inclined to grant the relief sought. In the result, condition No.4(7) in Annexure Al is modified as follows: - The petitioner shall submit an affidavit undertaking to produce the original documents of the vehicle bearing registration No.KL-23-6434 as oe al 2021/KER/146 Crl.M.C No. 5918 of 2020 -4- and when required by the court. On submission of such affidavit, the original documents of the vehicle kept in the safe custody of the court shall be released to the petitioner, after substituting those documents with certified copies. The Cr1.M.C is allowed as above. Sd/- V.G.ARUN JUDGE Sc1/04.01.2021 Bonne PER 2021/KER/146 Cril.M.C No. 5918 of 2020 -5- APPENDIX PETITIONER'S/S EXHIBITS: ANNEXURE Al TRUE COPY OF THE ORDER IN CMP NO 2052/2020 OF MAGISTRATE COURT, SOUTH PARAVUR ANNEXURE A2 TRUE COPY OF THE ORDER IN CRL MC NO 3429/2020 OF HIGH COURT OF KERALA"
}