{
    "case_id": "Crl.MC.No. 8546 of 2017 ()",
    "court": "HIGH COURT OF KERALA AT ERNAKULAM PRESENT",
    "date": "8 day of December, 2017",
    "judge": "B.KEMAL PASHA FRIDAY",
    "petitioners": [
        "KELOTH HOUSE",
        "KOZHIKODE DISTRICT.",
        "ABDUL JALEEL",
        "KUTTIYADI",
        "RESIDING AT PUTHIYOTTIL",
        "AGED",
        "J. Cril",
        "MC.No",
        "KOILANDI"
    ],
    "respondents": [],
    "sections": [],
    "outcome": "In case of surrender the petitioner before the court below within 15 days from today, the court below shall consider and dispose of the application seeking bail",
    "full_text": "Berl pee Plz a ielt 4 2017/KER/49784 IN THE HIGH COURT OF KERALA AT ERNAKULAM PRESENT: THE HONOURABLE MR. JUSTICE B.KEMAL PASHA FRIDAY, THE 8TH DAY OF DECEMBER 2017/17TH AGRAHAYANA, 1939 Cr1.MC.No. 8546 of 2017 () LP 10/2017 OF ASSISTANT ADDITIONAL SESSIONS COURT, KOZHIKODE (II-A SUB) , KOZHIKODE CRIME NO. 566/2012 OF PERAMBRA POLICE STATION, KOZHIKODE PETITIONER/ACCUSED: ABDUL JALEEL, AGED 26 YEARS, S/O.MOIDU, RESIDING AT PUTHIYOTTIL, KELOTH HOUSE, MUTHUVANNACHA P.O, KUTTIYADI, KOILANDI TALUK, KOZHIKODE DISTRICT. BY ADVS.SRI.J.R.PREM NAVAZ SRI.P.T.SHEEJISH RESPONDENT : STATE OF KERALA, REPRESENTED BY PUBLIC PROSECUTOR HIGH COURT OF KERALA, ERNAKULAM - 682 031. R BY PUBLIC PROSECUTOR SMT .SHEEBA THIS CRIMINAL MISC. CASE HAVING COME UP FOR ADMISSION ON 08-12-2017, THE COURT ON THE SAME DAY PASSED THE FOLLOWING: jo e340) E es Prt Elz i tt aH 2017/KER/49784 Crl.MC.No. 8546 of 2017 () APPENDIX PETITIONER(S)'S EXHIBITS: ANNEXUR A: THE TRUE COPY OF THE MARRIAGE INVITATION LETTER OF THE PETITIONER. RESPONDENT'S EXHIBITS: NIL TRUE COPY PA TO JUDGE Scl. BISA 2017/KER/49784 B. KEMAL PASHA, J. Cril.M.C. No. 8546 of 2017 Dated this the 8 day of December, 2017 ORDER In case of surrender the petitioner before the court below within 15 days from today, the court below shall consider and dispose of the application seeking bail that may be filed by the petitioner with advance notice to the learned Public Prosecutor in charge of the case, preferably on the same day itself. This Crl.M.C.is allowed as above. Sd/- B.KEMAL PASHA JUDGE Scl/08.12.2017"
}