{
    "case_id": "Crl.MC.No. 7086 of 2017 ()",
    "court": "HIGH COURT OF KERALA AT ERNAKULAM PRESENT",
    "date": "2017",
    "judge": "B.KEMAL PASHA FRIDAY",
    "petitioners": [
        "VINOD CRASTA",
        "NAVEEN D",
        "ST AND",
        "O.KALASTIN CRASTA",
        "MADATHADAKA",
        "O.PAUL D",
        "NEAR BELA CHURCH",
        "MC.No",
        "J. Dated",
        "KASARAGOD"
    ],
    "respondents": [
        "KASARAGOD-",
        "BADIADKA POLICE STATION",
        "THE SUB INSPECTOR OF POLICE"
    ],
    "sections": [
        "506(i) read with Section 149 IPC",
        "323",
        "341",
        "107",
        "323 read with Section 34 IPC",
        "143",
        "147"
    ],
    "outcome": "DATED 22.8.2017 OF THE SUB DIVISIONAL MAGISTRATE, KASARAGOD. ANNEXURE II THE TRUE COPY OF THE FIRST INFORMATION REPORT ALLEGEDLY REGISTERED AS CRIME 405/2017. ANNEXURE IIl COPY OF THE REPORT FILED BY ",
    "full_text": "oben eee El fs\" Se 2017/KER/49768 IN THE HIGH COURT OF KERALA AT ERNAKULAM PRESENT: THE HONOURABLE MR. JUSTICE B.KEMAL PASHA FRIDAY, THE 8TH DAY OF DECEMBER 2017/17TH AGRAHAYANA, 1939 Crl.MC.No. 7086 of 2017 () NMC.NO. 154/2017 of SUB DIVISIONAL MAGISTRATE COURT, KASARAGOD . CRIME NO. 140/2017 OF BADIADKA POLICE STATION , KASARAGOD. PETITIONER(S)/1ST AND 2ND COUNTER PETITIONERS: 1. VINOD CRASTA, S/O.KALASTIN CRASTA, AGED 32 YEARS, NEAR BELA CHURCH, BELA, KASARAGOD. 2. NAVEEN D'SOUZA, S/O.PAUL D'SOUZA, AGED 25 YEARS, MADATHADAKA, NEERCHAL, KASARAGOD. BY ADVS.SRI.T.G.RAJENDRAN SRI.T.R.TARIN SMT.ANN SUSAN GEORGE RESPONDENT(S)/COMPLAINANT AND STATE: 1. THE SUB INSPECTOR OF POLICE, BADIADKA POLICE STATION, KASARAGOD-671121. 2. THE STATE OF KERALA, REPRESENTED BY THE PUBLIC PROSECUTOR, HIGH COURT OF KERALA, ERNAKULAM-682031. BY PUBLIC PROSECUTOR SRI.C.S.HRITHWIK THIS CRIMINAL MISC. CASE HAVING COME UP FOR ADMISSION ON 08-12-2017, THE COURT ON THE SAME DAY PASSED THE FOLLOWING: TS oben eee El fs\" Se 2017/KER/49768 Cri.MC.No. 7086 of 2017 () APPENDIX PETITIONER(S)' ANNEXURES ANNEXURE! THE TRUE COPY OF THE ORDER DATED 22.8.2017 OF THE SUB DIVISIONAL MAGISTRATE, KASARAGOD. ANNEXURE II THE TRUE COPY OF THE FIRST INFORMATION REPORT ALLEGEDLY REGISTERED AS CRIME 405/2017. ANNEXURE IIl COPY OF THE REPORT FILED BY THE SUB INSPECTOR OF POLICE DATED 27.7.17. ANNEXURE IV. THE TRUE COPY OF THE FIRST INFORMATION REPORT IN CRIME 140/2017 OF BADIADKA POLICE STATION. ANNEXURE V THE TRUE COPY OF THE FINAL REPORT FILED BY THE POLICE BEFORE THE JUDICIAL FIRST CLASS MAGISTRATE COURT-II, KASARAGOD, IN C.C.NO.944/17 IN RESPECT OF CRIME 140/2017. ANNEXURE VI. THE TRUE COPY OF THE FIRST INFORMATION REPORT IN CRIME 326/17. ANNEXURE Vil THE TRUE COPY OF THE ORDER IN BA 4930/2017. RESPONDENT(S)' ANNEXURES- NIL [TRUE COPY/ PS TO JUDGE TS 2017/KER/49768 B. KEMAL PASHA, J. Dated this the 8\" day of December, 2017 ORDER On the basis of Annexure-lll report filed by the Sub Inspector of Police, Badiadka Police Station, proceedings under Section 107 Cr.P.C. have been initiated against the petitioners. The report shows that the petitioners are two among the accused in two crimes. One crime is Crime No.140/2017 of Badiadka Police Station for the offences under Sections 143, 147, 341, 323 and 506(i) read with Section 149 IPC and the other crime is Crime No.326/2017 of Badiadka Police Station for the offences under Sections 341 and 323 read with Section 34 IPC. Apart from these two crimes, no other crimes have been registered against the petitioners. 2. Based on the aforesaid aspects alone, the Beal aa 2017/KER/49768 Crl.M.C.7086/2017 :2: petitioners cannot be trapped in proceedings under Section 107 Cr.P.C. Matters being so, Annexure-l order is liable to be quashed. In the result, this Cri.M.C. is allowed and Annexure-] order is quashed. Sd/- (B.KEMAL PASHA, JUDGE) aks/08/12 // True Copy // PS to Judge"
}