{
    "case_id": "Crl.MC.No. 6297 of 2017",
    "court": "HIGH COURT OF KERALA AT ERNAKULAM",
    "date": "2018",
    "judge": "B.KEMAIL PASHA MONDAY",
    "petitioners": [
        "DR.P.S.THAHA",
        "ANNEXURE A",
        "DIRECTOR",
        "AGED",
        "MC.No",
        "VATTAPPARA"
    ],
    "respondents": [
        "NEGUMANGAD",
        "THE ASSISTANT LABOUR OFFICER"
    ],
    "sections": [],
    "outcome": "According to the learned counsel for the petitioner, the present establishment is not covered by the Kerala Industrial Establishments (National and Festival Holidays) Act, 1958 (the 1958 Act), since i",
    "full_text": "stra re eeeat a IN THE HIGH COURT OF KERALA AT ERNAKULAM 2018/KER/711 PRESENT: THE HONOURABLE MR. JUSTICE B.KEMAIL PASHA MONDAY, THE 8TH DAY OF JANUARY 2018 / 18TH POUSHA, 1939 Cr1.MC.No. 6297 of 2017 S.T.NO. 2941/2015 OF JUDICIAL FIRST CLASS MAGISTRATE COURT-I, NEDUMANGAD, THIRUVANANTHAPURAM DISTRICT PETITIONER (S) /ACCUSED: DR.P.S.THAHA, AGED 65 YEARS, S/O.THE LATE SHAHUL HAMEED, DIRECTOR, PMS COLLEGE OF DENTAL SCIENCE AND RESEARCH, VATTAPPARA, GOLDEN HILLS, VENKOD P.O., THIRUVANANTHAPURAM DISTRICT, PIN - 695 028. BY ADVS.SRI.C.S.MANU SRI.S.K.PREMRAJ RESPONDENT (S)} /COMPLAINANT AND THE STATE : 1. THE ASSISTANT LABOUR OFFICER, NEGUMANGAD, NEDUMANGAD P.O., THIRUVANANTHAPURAM DISTRICT, PIN - 695 541. 2. STATE OF KERALA, REPRESENTED BY THE PUBLIC PROSECUTOR, HIGH COURT OF KERALA, ERNAKULAM, PIN - 682 031. BY PUBLIC PROSECUTOR SRI.ALEX M.THOMBRA THIS CRIMINAL MISC. CASE HAVING COME UP FOR ADMISSION ON 08-01-2018, THE COURT ON THE SAME DAY PASSED THE FOLLOWING: Msd. attra oesge = F sae eee Crl.MC.No. 6297 of 2017 2018/KER/711 APPENDIX PETITIONER(S)' ANNEXURES : ANNEXURE AL. TRUE COPY OF THE COMPLAINT DATED 05.11.2015 FILED BY THE 1ST RESPONDENT BEFORE THE JFCM-1, NEDUMANGAD AND REGISTERED AS ST NO.2941 OF 2015. ANNEXURE A2. TRUE COPY OF THE REPLY DATED 25.05.2015 FILED BY THE 1ST RESPONDENT. ANNEXURE A3. TRUE COPY OF AGREEMENT DATED 01.06.2005 ENTERED INTO BY AND BETWEEN PMS COLLEGE AND DENTAL SCIENCE AND RESEARCH AND SREE UTHRADAM THIRUNAL RURAL GENERAL HOSPITAL. ANNEXURE A4. TRUE COPY OF THE CERTIFICATE BEARING NO .D5-187/2006 DATED 10.04.2016 ISSUED BY THE EXECUTIVE ENGINEER, PWD BUILDINGS DIVISION, THIRUVANANTHAPURAM . RESPONDENT (S) ' ANNEXURES : NIL //TRUE COPY// P.S.TO JUDGE Msd. 2018/KER/711 B. KEMAL PASHA, J. ~ Crl.M.C.No.6297 of 2017 \"Dated this the 8\" day of January, 2018 ORDER According to the learned counsel for the petitioner, the present establishment is not covered by the Kerala Industrial Establishments (National and Festival Holidays) Act, 1958 (the 1958 Act), since it has not been notified by the Government as such an establishment. Further, it has been pointed out that the same is covered by the Kerala University of Health Sciences Act, 2010 wherein provisions are there, which cover the similar instances contained in this case. 2. The question as to whether the institution is one coming within the category of _ industrial establishment as defined in the 1958 Act, is a matter to be decided by the court below. The petitioner can approach the court below with the said request, so that the court below can decide the said request. With the said liberty to the petitioner, this Crl. ape 2018/KER/711 Crl.M.C.No. 6297 of 2017 -2- M.C is disposed of. As far as practicable, the court below shall grant exemption to the petitioner from personal appearance. Sd/- B. KEMAL PASHA JUDGE bng"
}