{
    "case_id": "CrL.MC.No. 5 of 2014",
    "court": "HIGH COURT OF KERALA AT ERNAKULAM PRESENT",
    "date": "THE 2ND DAY",
    "judge": "HARUN-UL-RASHID THURSDAY",
    "petitioners": [
        "ISATH NAGAR",
        "O.MUHAMMED",
        "O.ABDUL SATHAR",
        "JOSEPH R",
        "KUDLU VILLAGE",
        "KASARAGOD DISTRICT.",
        "MELPARAMBA",
        "MUHAMMED FAISAL AGED",
        "ABDUL SATHAR AGED"
    ],
    "respondents": [
        "KASARAGOD POLICE STATION",
        "KASARAGOD DISTRICT",
        "O.BASHEER",
        "THROUGH THE STATION HOUSE OFFICER",
        "MELPARAMBA",
        "FASEELA"
    ],
    "sections": [
        "323",
        "498(A)",
        "324 read with Section 34 of IPC"
    ],
    "outcome": "Heard the learned counsel for the petitioners and respondents. 2. Accused Nos.1 & 2 in Crime No.359/2011 of the Kasaragod Police Station now pending as C.C.No.374/2013 before the Chief Judicial Magist",
    "full_text": "para oes cre oH 2014/KER/201 IN THE HIGH COURT OF KERALA AT ERNAKULAM PRESENT: THE HONOURABLE MR.JUSTICE HARUN-UL-RASHID THURSDAY, THE 2ND DAY OF JANUARY 2014/12TH POUSHA, 1935 CrL.MC.No. 5 of 2014 0 CC 374/2013 of CHIEF JUDICIAL MAGISTRATE COURT, KASARAGOD CRIME NO. 359/2011 OF KASARAGOD POLICE STATION , KASARGOD PETITIONERS/ACCUSED 1 AND 2: 1. MUHAMMED FAISAL AGED 28 YEARS S/O.ABDUL SATHAR, RESIDING AT BAITHUL AJPATH ISATH NAGAR, KUDLU VILLAGE, KASARAGOD TALUK KASARAGOD DISTRICT. 2. ABDUL SATHAR AGED 58 YEARS S/O.MUHAMMED, RESIDING AT BAITHUL AJPATH, ISATH NAGAR KUDLU VILLAGE, KASARAGOD TALUK, KASARAGOD DISTRICT. BY ADV.SRI.T.MADHU RESPONDENTS/DEFACTO COMPLAINANT & STATE : 1. FASEELA, AGED 24 YEARS D/O.BASHEER, NOW RESIDING ATKAINOTH MELPARAMBA, KALANAD PO, KASARAGOD TALUK KASARAGOD DISTRICT 671317 2. THE STATE OF KERALA THROUGH THE STATION HOUSE OFFICER KASARAGOD POLICE STATION REPRESENTED BY THE PUBLIC PROSECUTOR HIGH COURT OF KERALA, ERNAKULAM - 682 031. R1 BY ADV.SMT.BINDUMOL JOSEPH R2 BY PUBLIC PROSECUTOR SMT.SAREENA GEORGE THIS CRIMINAL MISC. CASE HAVING COME UP FOR ADMISSION ON 02-01-2014, THE COURT ON THE SAME DAY PASSED THE FOLLOWING: Elser oe: are aH 2014/KER/201 CrLMC.No. 5 of 2014 ( APPENDIX PETITIONER(S) EXHIBITS : ANNX.A1 - THE TRUE CERTIFIED COPY OF THE FIR IN CRIME NO.359/2011 OF KASARAGOD POLICE STATION. ANNX.A2 - THE TRUE CERTIFIED COPY OF THE FINAL REPORT IN CRIME NO.359/2011 OF KASARAGOD POLICE STATION. ANNX.A3 - THE AFFIDAVIT DATED 22-10-2013 SWORN IN BY THE 1ST RESPONDENT. RESPONDENT(S)' EXHIBITS : NIL /TRUE COPY/ PATO JUDGE AV an HARUN-UL-RASHID, J. 2014/KER/201 Dated this the 2\" day of January, 2014 ORDER Heard the learned counsel for the petitioners and respondents. 2. Accused Nos.1 & 2 in Crime No.359/2011 of the Kasaragod Police Station now pending as C.C.No.374/2013 before the Chief Judicial Magistrate Court, Kasaragod are the petitioners. The petition is filed seeking to quash further proceedings against the petitioners in C.C.No.374/2013 on the file of the Chief Judicial First Class Magistrate Court, Kasaragod. 3. The offences alleged are punishable under Sections 498(A), 323, 324 read with Section 34 of IPC. 4. The learned counsel on both sides submit that the dispute between the parties have been amicably settled and having regard to the resolution of the disputes between the parties, continuance of the criminal prosecution against the petitioners is an avoidable irritant. In view of the settlement arrived at between the parties, the Cri.M.C is disposed of quashing further proceedings against the petitioners in C.C.No.374/2013 on the file of the Chief Judicial First Class Magistrate Court, Kasaragod. Sd/- HARUN-UL-RASHID, JUDGE. AV"
}