{
    "case_id": "CRL.MC.NO. 9318 OF 2019",
    "court": "HIGH COURT OF KERALA AT ERNAKULAM PRESENT THE HONOURABLE MR",
    "date": "2020",
    "judge": "ASHOK MENON MONDAY",
    "petitioners": [
        "RAHMATH MANZIL",
        "PADANNAKKAD",
        "Kasargod",
        "O NJERU IBRAHIM",
        "AGED",
        "ABOOBACKER KUTTIKKOL"
    ],
    "respondents": [
        "RAMESH CHAND-P.P",
        "AGED",
        "DEVAKI",
        "OTHER PRESENT",
        "O KUNHIRAMAN",
        "KASARGOD DISTRICT-"
    ],
    "sections": [],
    "outcome": "/JUDGMENT IN CMP.NO. 8144/2019 OF JUDICIAL MAGISTRATE OF FIRST CLASS -I,HOSDRUG CRIME NO.438/2019 OF Chandera Police Station , Kasargod PETITIONER/PETITIONER/ACCUSED: ABOOBACKER KUTTIKKOL, AGED 45 YEA",
    "full_text": "Berl On| Bi. ro a 2020/KER/283 IN THE HIGH COURT OF KERALA AT ERNAKULAM PRESENT THE HONOURABLE MR. JUSTICE ASHOK MENON MONDAY, THE O6TH DAY OF JANUARY 2020 / 16TH POUSHA, 1941 Cri .MC.No.9318 OF 2019 (D) AGAINST THE ORDER/JUDGMENT IN CMP.NO. 8144/2019 OF JUDICIAL MAGISTRATE OF FIRST CLASS -I,HOSDRUG CRIME NO.438/2019 OF Chandera Police Station , Kasargod PETITIONER/PETITIONER/ACCUSED: ABOOBACKER KUTTIKKOL, AGED 45 YEARS, S/O NJERU IBRAHIM, RAHMATH MANZIL, PADANNAKKAD, KASARGOD DISTRICT. BY ADV. SRI.VIJU ABRAHAM RESPONDENTS /COMPLAINANT AND DE-FACTO COMPLAINANT : 1 STATE OF KERALA REP. BY PUBLIC PROSECUTOR, HIGH COURT OF KERALA, ERNAKULAM-682 031. 2 DEVAKI, AGED 70 YEARS, W/O KUNHIRAMAN, CHERUVATHUR AMSOM DESOM, KASARGOD DISTRICT-671 313. OTHER PRESENT: RAMESH CHAND-P.P THIS CRIMINAL MISC. CASE HAVING BEEN FINALLY HEARD ON 06.01.2020, THE COURT ON THE SAME DAY PASSED THE FOLLOWING: Bi CRL.MC.NO. 9318 OF 2019 2 2020/KER/283 ORDER Dated this the 06\" day of January, 2020 The learned counsel for the petitioner submits that the Crl.MC has become infructuous. Accordingly, the Crl.MC is dismissed as infructuous. Sd/- ASHOK MENON JUDGE asm On| Bi. ro a CRL.MC.NO. 9318 OF 2019 3 2020/KER/283 APPENDIX EXHIBITS: ANNEXURE 1 A COPY OF THE SAID ORDER DATED 10.12.2019 IN BA.NO. 8709 OF 2019 ANNEXURE 2 PETITION FILED AS CRIME NO 438/2019 BEFORE JUDICIAL FIRST CLASS MAGISTRATE COURT-1, HOSDURG. ANNEXURE 3 CERTIFIED COPY OF THE ORDER DATED 24.12.2019 IN C.M.P NO 8144 OF 2019 OF THE JUDICIAL FIRST CLASS MAGISTRATE COURT-1, HOSDURG // True Copy// PA to Judge"
}