{
    "case_id": "Crl.MC.No. 8813 of 2018",
    "court": "HIGH COURT OF KERALA AT ERNAKULAM",
    "date": "2019",
    "judge": "B.SUDHEENDRA KUMAR FRIDAY",
    "petitioners": [
        "KADAVATHUR",
        "MUTHUVANA HOUSE",
        "Cril",
        "Nos"
    ],
    "respondents": [
        "SUBEESH N.",
        "SUMESH K.K.",
        "THALASSERY TALUK",
        "O.BALAKRISHNAN",
        "O. BALAKRISHNAN",
        "RESIDING AT THAVATHU METHAL HOUSE",
        "RESIDING AT THAVATHU HOUSE",
        "PERINGANOOR AMSOM",
        "MC.No",
        "SANOOP N."
    ],
    "sections": [
        "324",
        "148",
        "427 read with Section 149 of IPC",
        "482",
        "323",
        "341",
        "143",
        "147"
    ],
    "outcome": "/JUDGMENT IN SC 464/2015 of PRL.S.C., THALASSERY CRIME NO. 662/2014 OF Chokli Police Station , Kannur PETITIONER/S: 14 ANAZP., S/O. MAMMY, AGED 26 YEARS, PUTHUSSERY HOUSE, PERNGATHUR, AMSOM, PULLURKAR",
    "full_text": "sree) oe ene IN THE HIGH COURT OF KERALA AT ERNAKULAM 2019/KERI385 PRESENT THE HONOURABLE MR. JUSTICE B.SUDHEENDRA KUMAR FRIDAY , THE 04TH DAY OF JANUARY 2019 / 14TH POUSHA, 1940 Crl.MC.No. 8813 of 2018 AGAINST THE ORDER/JUDGMENT IN SC 464/2015 of PRL.S.C., THALASSERY CRIME NO. 662/2014 OF Chokli Police Station , Kannur PETITIONER/S: 14 ANAZP., S/O. MAMMY, AGED 26 YEARS, PUTHUSSERY HOUSE, PERNGATHUR, AMSOM, PULLURKARA, KANNUR - 670675 2 RAMEEZ, S/O. ABDUL KHADER, AGED 26 YEARS, MUTHUVANA HOUSE, KADAVATHUR, MUNDATHODU, THRIPLAGATTUR, KANNUR - 670 001 3 MUHAMMED SHAKEER, S/O. ABDULLA, AGED 24 YEARS, KULANGARAKANDI HOUSE, PERINGATHUR, MOOKILPEEDIKA, KANNUR - 670 675 4 ANAZN.K., S/O. ALI, AGED 23 YEARS, AANAKETTIYATHIL HOUSE MOOKILPEEDIKA KANNUR-670675 5 SAFAN, S/O. ABDUL REHMAN, AGED 23 YEARS, THATHULAYIL HOUSE, PERINGATHUR, VAYALIL PEEDIKA KANNUR - 670675 6 SHAKEER, S/O.SHOUKATH, AGED 25 YEARS, KUVAPOONATHIL HOUSE, ALSWALAH, VAYALIL PEEDIKA, PERINGATHUR, KANNUR - 670675 7 MURSHID, S/O. MUSTHAFAMASTER, AGED 25 YEARS, PALLIKANDIYIL HOUSE, PEINGATHUR, PULLUKKARA KANNUR - 670675 BY ADV. SRI.SATHEESHAN ALAKKADAN aie ay vs 2019/KER/385 =2- Cri.MC.No. 8813 of 2018 RESPONDENT/S: 1 STATE OF KERALA, REPRESENTED BY PUBLIC PROSECUTOR HIGH COURT OF KERALA, ERNAKULAM - 682 031 2 SUMESH K.K., S/O.BALAKRISHNAN, AGED 38 YEARS, RESIDING AT THAVATHU METHAL HOUSE, PERINGANOOR AMSOM, PULOOKARA DESOM, THALASSERY TALUK, KANNUR DISTRICT-670 675 3 SUBEESH N. S/O. BALAKRISHNAN, AGED 29 YEARS, RESIDING AT THAVATHU HOUSE, PERINGANOOR AMSOM, PULOOKARA DESOM, THALASSERY TALUK, KANNUR DISTRICT-670 675 4 SANOOP N. S/O. BALAKRISHNAN, AGED 57 YEARS, RESIDING AT THAVATHU METHAL HOUSE, PERINGANOOR AMSOM, PULOOKARA DESOM, THALASSERY TALUK, KANNUR DISTRICT - 670 675 BY ADV. SRI.A.ARUNKUMAR SMT.V.SREEJA, PUBLIC PROSECUTOR THIS CRIMINAL MISC. CASE HAVING COME UP FOR ADMISSION ON 04.01.2019, THE COURT ON THE SAME DAY PASSED THE FOLLOWING: Bier 2019/KER/385 -3- Crl.MC.No. 8813 of 2018 ORDER The petitioners are accused in S.C.464/2015 on the files of the court below. The offences alleged are punishable under sections 143, 147, 148, 341, 323, 324 and 427 read with Section 149 of IPC. 2. The respondent Nos. 2 to 4 are the injured in the above case. The respondent Nos. 2 to 4 have filed separate affidavit stating that the matter has been settled by the parties and hence they have no further grievance against the petitioners. 3. Considering the nature of allegations, I am of the view that the settlement of the dispute will lead to peace and harmony in the locality. That apart, since the matter has been settled, there is no chance for culminating the trial in conviction. = ieee 2019/KER/385 -4- Cril.MC.No. 8813 of 2018 In view of the above reasons, I am of the view that it is only just and proper to quash the final report and further proceedings against the petitioners in S.C.No.464/2015 on the files of the court below in exercise of the inherent power under Section 482 of CrP.C. to meet the ends of justice. It is ordered accordingly. In the result, this Crl.M.C. stands allowed as above. Sd/- B.SUDHEENDRA KUMAR JUDGE Nkr/04.1.2019 aie ay 2019/KER/385 -5- Cri.MC.No. 8813 of 2018 APPENDIX ANNEXURE AT CRIME NO.662/2014 OF CHOKLI POLICE STATION, KANNUR DISTRICT ANNEXURE ATII CERTIFIED COPY OF THE FINAL REPORT ANNEXURE A ITI A TRUE COPY OF THE AFFIDAVIT SWORN TO BY THE RESPONDENT NO.2 ENDORSING- THE FACTUM OF COMPOUNDING OF THE SAID OFFENCES AND THE SETTLEMENT OF THE DISPUTES ANNEXURE A IV A TRUE COPY OF THE AFFIDAVIT SWORN TO BY THE RESPONDENT NO.3 ENDORSING- THE FACTUM OF COMPOUNDING OF THE SAID OFFENCES AND THE SETTLEMENT OF THE DISPUTES. ANNEXURE AV A TRUE COPY OF THE AFFIDAVIT SWORN TO BY THE RESPONDENT NO.4 ENDORSING- THE FACTUM OF COMPOUNDING OF THE SAID OFFENCES AND THE SETTLEMENT OF THE DISPUTES. RESPONDENT'S EXHIBITS: NIL"
}