{
    "case_id": "Crl.MC.No. 46 of 2014",
    "court": "HIGH COURT OF KERALA AT ERNAKULAM PRESENT",
    "date": "2014",
    "judge": "HARUN-UL-RASHID THURSDAY",
    "petitioners": [
        "SAINA MAZOOR",
        "KASARAGODTALUK.",
        "O.MUHAMMED",
        "MUHAMMED",
        "KASARAGOD TALUK.",
        "ABDUL SHAYIR.A.",
        "O.MANSOOR",
        "SUHARA",
        "ARIKKALA HOUSE",
        "MC.No",
        "MUJEEB",
        "O.MOIDEEN"
    ],
    "respondents": [
        "BARA VILLAGE",
        "AYISHATH SHIFANA",
        "O.P.M.AZEEZ"
    ],
    "sections": [
        "498"
    ],
    "outcome": "Heard the learned counsel for the petitioners and respondents. 2. Accused in Crime No.184/2013 of Bekal Police Station pending as C.C.No.1160/2013 on the file of the Judicial First Class Magistrate Co",
    "full_text": "Pleas Ae 2014/KER/226 IN THE HIGH COURT OF KERALA AT ERNAKULAM PRESENT: THE HONOURABLE MR.JUSTICE HARUN-UL-RASHID THURSDAY, THE 2ND DAY OF JANUARY 2014/12TH POUSHA, 1935 Cri.MC.No. 46 of 2014 CC NO. 1160/2013 OF JUDICIAL FIRST CLASS MAGISTRARTE COURT II,HOSDURG CRIME NO. 184/2013 OF BEKAL POLICE STATION , KASARGOD PETITIONER(S)/ACCUSED: 1. ABDUL SHAYIR.A.,AGED 29 YEARS, S/O.MUHAMMED, ARIKKALA HOUSE, P.O.PADLA, KASARAGOD TALUK. 2. SUHARA, AGED 45 YEARS, W/O.MUHAMMED, ARIKKALA HOUSE, P.O.PADLA, KASARAGODTALUK. 3. MUHAMMED, AGED 52 YEARS, S/O.MOIDEEN, ARIKKALA HOUSE, P.O.PADLA, KASARAGOD TALUK. 4. SAINA MAZOOR, AGED 27 YEARS, W/O.MANSOOR, ARIKKALA HOUSE, P.O.PADLA, KASARAGODTALUK. 5. MUJEEB, AGED 27 YEARS, $/O.MUHAMMED, ARIKKALA HOUSE, P.O.PADLA, KASARAGODTALUK. BY ADV. SRILA.ARUNKUMAR RESPONDENT/DEFACTO COMPLAINANTI/STATE: 1. AYISHATH SHIFANA, AGED 22 YEARS, D/O.P.M.AZEEZ, S.S.HOUSE, KOOLIKUNNU, BARA VILLAGE, P.O.BARA, HOSDURG TALUK. 2. STATE OF KERALA, REPRESENTED BY PUBLIC PROSECUTOR, HIGH COURT OF KERALA, ERNAKULAM -682 031. R1 BY ADV. SRILV.MADHUSUDHANAN R2 BY PUBLIC PROSECUTOR SMT.S.HYMA THIS CRIMINAL MISC. CASE HAVING COME UP FOR ADMISSION ON 02-01-2014, THE COURT ON THE SAME DAY PASSED THE FOLLOWING: Kss Pleas Ae 2014/KER/226 Crl.MC.No. 46 of 2014 APPENDIX PETITIONER(S)' ANNEXURES: ANNEXURE-A1: A TRUE COPY OF THE FR IN CRIME NO.184 OF 2013 OF BEKAL POLICE STATION. ANNEXURE-AIL: A TRUE COPY OF THE FINAL REPORT IN CRIME NO.184 OF 2013 OF BEKAL POLICE STATION. ANNEXURE-AII: A TRUE COPY OF THE AFFIDAVIT SWORN TO BY THE 1ST RESPONDENT ENDORSING THE FACTUM OF COMPOUNDING OF THE SAID OFFENCES AND THE SETTLEMENT OF THE DISPUTES. RESPONDENT(S)' ANNEXURES: ITRUE COPY/ PA.TO JUDGE Kss Bales a ee eee HARUN-UL-RASHID, J. aE 2n------------------------- 2014/KER/226 Cri.M.C. No. 46 of 2014 Dated thisthe 2 day of January 2014. ORDER Heard the learned counsel for the petitioners and respondents. 2. Accused in Crime No.184/2013 of Bekal Police Station pending as C.C.No.1160/2013 on the file of the Judicial First Class Magistrate Court II, Hosdurg are the petitioners. The petition is filed seeking to quash further proceedings against the petitioners in Annexure- AII Final Report in Crime No. 184/2013 of Bekal Police Station. 3. The offences alleged are punishable under Sections 498 A of IPC. 4. The learned counsel on both sides submit that the disputes between the parties have been amicably settled and having regard to the resolution of the disputes between the parties, continuance of the criminal prosecution against the petitioners is an avoidable irritant. In view of the settlement arrived at between the parties, the Crl.M.C is disposed of quashing further proceedings against the petitioners in Annexure AII Final Report in Crime No. 184/2013 of Bekal Police Station. Sd/- HARUN-UL-RASHID, Judge. AL/- True copy P.A to Judge"
}