{
    "case_id": "Crl.MC.No.132 OF 2020(F)",
    "court": "HIGH COURT OF KERALA AT ERNAKULAM",
    "date": "2020",
    "judge": "ASHOK MENON THURSDAY",
    "petitioners": [
        "O.ABDUL RAHIM",
        "THAZHATHUTHALA VILLAGE",
        "KOCHI-",
        "AGED",
        "LORRY BEARING REGISTRATION NO.",
        "lorry",
        "KL-",
        "MUNEER"
    ],
    "respondents": [
        "THE SUB COLLECTOR",
        "THE DISTRICT COLLECTOR",
        "CIVIL STATION",
        "PARIPPALLY POLICE STATION",
        "OTHER PRESENT",
        "KOLLAM-",
        "THE SUB INSPECTOR OF POLICE"
    ],
    "sections": [
        "457"
    ],
    "outcome": "/JUDGMENT IN CRMP 1094/2019 DATED 28-02-2019 OF JUDICIAL FIRST CLASS MAGISTRATE COURT (TEMPORARY) ,SOUTH PARAVUR, KOLLAM PETITIONER/S: MUNEER, AGED 31 YEARS $/O.ABDUL RAHIM, KILITHATTIL VEEDU, UMYANAL",
    "full_text": "sete rs Bas on IN THE HIGH COURT OF KERALA AT ERNAKULAM 2020/KER/928 PRESENT THE HONOURABLE MR. JUSTICE ASHOK MENON THURSDAY, THE O9TH DAY OF JANUARY 2020 / 19TH POUSHA, 1941 Crl1.MC.No.132 OF 2020 (F) AGAINST THE ORDER/JUDGMENT IN CRMP 1094/2019 DATED 28-02-2019 OF JUDICIAL FIRST CLASS MAGISTRATE COURT (TEMPORARY) ,SOUTH PARAVUR, KOLLAM PETITIONER/S: MUNEER, AGED 31 YEARS $/O.ABDUL RAHIM, KILITHATTIL VEEDU, UMYANALLOOR P.O., THAZHATHUTHALA VILLAGE, KOLLAM DISTRICT, (OWNER OF A LORRY BEARING REGISTRATION NO. KL-19-A-6669) . BY ADV. SRI.P.M.ZIRAJ RESPONDENT/S: 1 STATE OF KERALA, REPRESENTED BY PUBLIC PROSECUTOR, HONOURABLE HIGH COURT OF KERALA AT ERNAKULAM, KOCHI-31. 2 THE SUB INSPECTOR OF POLICE, PARIPPALLY POLICE STATION, KOLLAM DISTRICT- 691572. 3 THE DISTRICT COLLECTOR, CIVIL STATION, KOLLAM- 691572. 4 THE SUB COLLECTOR/REVENUE DIVISIONAL OFFICER, KOLLAM- 691013. OTHER PRESENT: SRI.B.JAYASURYA SR PP THIS CRIMINAL MISC. CASE HAVING COME UP FOR ADMISSION ON 09.01.2020, THE COURT ON THE SAME DAY PASSED THE FOLLOWING: au Crl.MC.No.132 OF 2020(F) 2 2020/KER/928 ORDER Dated this the 9th day of January 2020 The petitioner is the registered owner of a Tipper lorry bearing registration No. KL-19-A 6669. The vehicle was seized allegedly for the involvement of offences under the provisions of Kerala Minor Mineral Concession Rule, 2015. No FIR has been registered. The Sub Inspector of Police, Parippally has filed a report to the Revenue Divisional Officer, Kollam and thereafter the petitioner filed a petition before the Judicial First Class Magistrate Court (Temporary), South Paravur, Kollam under Section 457 of Cr.PB.C. for interim custody of the Tipper lorry belonging to him. Vide order at Annexure I, the lorry was directed to be released to the petitioner. The petitioner is aggrieved by condition No.7 which states that the original documents of the vehicle shall be kept in safe custody of the Court and the petitioner shall be issued with a true copy certified from the Court for all legal and practical purposes. The petitioner states that in view of this order, he could not ply the vehicle because it is essential that the original documents be kept with the vehicle. au Crl.MC.No.132 OF 2020(F) 3 2020/KER/928 In view of the fact that no crime has been registered against the petitioner, imposing of such condition cannot be justified. The condition No.7 is therefore modified to the extent that the petitioner shall produce the _ original documents and certified copy of the same shall be retained in the court, while the original shall be returned to the petitioner. The Crl.M.C is allowed. SD/- ASHOK MENON JUDGE rmm sete rs Bas on Crl.MC.No.132 OF 2020(F) 4 2020/KER/928 APPENDIX PETITIONER'S/S EXHIBITS: ANNEXURE 1 TRUE COPY OF THE ORDER DATED 28.02.2019 IN CMP NO.1094 OF 2019 oN THE FILE OF JUDICIAL FIRST CLASS MAGISTRATE COURT (TEMPORARY) SOUTH PARAVOOR, KOLLAM. ANNEXURE 2 TRUE COPY OF THE ORDER OF THIS HONOURABLE COURT DATED 16.12.2019 IN CRL.M.C.NO.8474 OF 2019. ANNEXURE 3 TRUE COPY OF THE ORDER DATED 07.05.2019 IN CRL.M.C.NO. 3248/2019 oF THIS HONOURABLE COURT. ANNEXURE 4 TRUE COPY OF THE ORDER OF THIS HONOURABLE COURT DATED 03.5.2019 IN CRL.M.C.NO.3152 OF 2019. ANNEXURE 5 TRUE COPY OF THE ORDER DATED 11.01.2019 IN CRL.M.C.NO.252/2019 OF THIS HONOURABLE COURT. ANNEXURE 6 TRUE COPY OF THE ORDER DATED 25.09.2017 IN CRL.M.C.NO.6419/2017 OF THIS HONOURABLE COURT."
}