{
    "case_id": "",
    "court": "HIGH COURT OF KERALA AT ERNAKULAM",
    "date": "6 day of January, 2021",
    "judge": "V.G.ARUN WEDNESDAY",
    "petitioners": [
        "Frais",
        "SR.PP.C.S.HRITHWIK",
        "THOMAS JOHN MUTHOOT",
        "THIRUVANANTHAPURAM .",
        "Ambalapuzha",
        "MISCELLANEOUS",
        "T.C.",
        "Sd",
        "J. - GrLM.C.No."
    ],
    "respondents": [
        "ASSISTANT LABOUR OFFICER",
        "S",
        "KERALA",
        "SR.PP.C.S.HRITHWIK",
        "AMBALAPPUZHA-"
    ],
    "sections": [
        "251",
        "258"
    ],
    "outcome": "The Crl.M.C is filed challenging the order passed in S.T.No.506 of 2012 of JFCM, Ambalapuzha. Being a Crl.M.C of the year 2015, pertaining to a crime of 2014, a report was called for, from the jurisdi",
    "full_text": "Bre imy eee Bae IN THE HIGH COURT OF KERALA AT ERNAKULAM 2021/KER/703 PRESENT THE HONOURABLE MR.JUSTICE V.G.ARUN WEDNESDAY, THE O6TH DAY OF JANUARY 2021 / 16TH POUSHA, 1942 Cr1.MC.No.213 OF 2015 AGAINST THE JUDGMENT IN ST 5506/2012 DATED 30-08-2014 OF JUDICIAL MAGISTRATE OF FIRST CLASS ,AMBALAPUZHA PETITIONER: THOMAS JOHN MUTHOOT T.C.4/1008(1), KURAVANKONAM, KOWDIAR P.O., THIRUVANANTHAPURAM . BY ADVS. SRI.C.M.STEPHEN SMT.JEAN ANNA STEPHEN RESPONDENTS : 1 STATE OF KERALA REPRESENTED BY THE PUBLIC PROSECUTOR, HIGH COURT OF KERALA, ERNAKULAM-682031. 2 ASSISTANT LABOUR OFFICER AMBALAPPUZHA-688561. SR.PP.C.S.HRITHWIK THIS CRIMINAL MISC. CASE HAVING COME UP FOR ADMISSION ON 06.01.2021, THE COURT ON THE SAME DAY PASSED THE FOLLOWING: Beer 2021/KER/703 V.G.ARUN, J. - GrLM.C.No.213 of 2015. Dated this the 6 day of January, 2021 ORDER The Crl.M.C is filed challenging the order passed in S.T.No.506 of 2012 of JFCM, Ambalapuzha. Being a Crl.M.C of the year 2015, pertaining to a crime of 2014, a report was called for, from the jurisdictional Magistrate Court. In the report, the learned Magistrate has stated that the S.T itself was disposed of on 17.04.2019 by imposing a fine of Rs.2100/- on the accused. In the circumstances, nothing survives for consideration in the Crl.M.C and it is accordingly dismissed. Sd/- V.G.ARUN JUDGE lgk Frais Bae 2021/KER/703 APPENDIX OF Cr1.MC 213/2015 PETITIONER'S/S EXHIBITS: ANNEXURE P1 ANNEXURE 1: TRUE COPY OF THE COMPLAINT FILED BEFORE THE JFMC AMBALAPPUZHA BY THE R2, UNDERB SEC.29(1)B OF THE KERALA SHOPS AND COMMERCTAL ESTABLISHMENTS ACT. ANNEXURE P2 ANNEXURE 2 : TRUE COPY OF THE ORDER PASSED BY JFMC AMBALAPPUZHA IN CMP 2218/13 IN ST 506/12. ANNEXURE P3 ANNEXURE 3 : TRUE COPY OF THE INSPECTION NOTE FILED BY THE R2 BEFORE JFMC DT.21-2- 2012. ANNEXURE P4 ANNEXURE 4: TRUE COPY OF THE SHOW CAUSE NOTICE FILED BY THE R2 BEFORE JFMC DT.13-6- 2012. ANNEXURE P5 ANNEXURE 5: TRUE COPY OF THE ADDRESS PROOF OF THE PETITIONER. ANNEXURE P6 ANNEXURE 6 : TRUE COPY OF THE CERTIFICATE OF INCORPORATION OF M/S.MUTHOOT FINCROP LTD. ISSUED BY THE REGISTRAR OF COMPANY OF KERALA . ANNEXURE P7 ANNEXURE 7: TRUE COPY OF THE CERTIFICATE ISSUED BY THE RESERVE BANK OF INDIA REGISTERING M/S.MUTHOOT FINCROP LTD. AS AN NON BANKING FINANCE COMPANY. ANNEXURE P8 ANNEXURE 8 : TRUE COPY OF THE MISCELLANEOUS PETITION FILED BY THE PETITIONER BEFORE JEMC UNDER SECTION 251 AND 258 OF CRPC."
}