{
    "case_id": "SC 1875/2014",
    "court": "HIGH COURT OF KERALA AT ERNAKULAM",
    "date": "THE 07TH DAY",
    "judge": "ASHOK MENON TUESDAY",
    "petitioners": [
        "o SAJILAL",
        "SUDHILAL",
        "PADIKKAL",
        "AGED",
        "CHAVARCODE",
        "A.CHANDRA BABU R",
        "A.CHANDRA BABU",
        "MULAVANA",
        "has",
        "VILLAGE"
    ],
    "respondents": [
        "ERNAKULAM-",
        "VARKALA",
        "ARJUN",
        "CHAVARCODE",
        "O KADJU"
    ],
    "sections": [
        "324",
        "2020/KER/513",
        "148",
        "308 read with Section 149 IPc",
        "482",
        "294(b)",
        "447",
        "341",
        "308",
        "143",
        "147"
    ],
    "outcome": "/JUDGMENT IN SC 1875/2014 OF ASSISTANT SESSIONS COURT , ATTINGAL CRIME NO.845/2011 OF Varkala Police Station , Thiruvananthapuram PETITIONER/ACCUSED: SUDHILAL, AGED 31 YEARS s/o SAJILAL, KIZHAKKATHIL ",
    "full_text": "Baan ope IN THE HIGH COURT OF KERALA AT ERNAKULAM 2020/KER/S13 PRESENT THE HONOURABLE MR. JUSTICE ASHOK MENON TUESDAY, THE 07TH DAY OF JANUARY 2020 / 17TH POUSHA, 1941 Cr1.MC.No.8401 OF 2019 (A) AGAINST THE ORDER/JUDGMENT IN SC 1875/2014 OF ASSISTANT SESSIONS COURT , ATTINGAL CRIME NO.845/2011 OF Varkala Police Station , Thiruvananthapuram PETITIONER/ACCUSED: SUDHILAL, AGED 31 YEARS s/o SAJILAL, KIZHAKKATHIL VEEDU, PADIKKAL, NEAR PALKULANGARA DEVI TEMPLE, KILIKOLLOOR VILLAGE, KOLLAM DISTRICT. BY ADV. SRI.P.ANOOP (MULAVANA) RESPONDENTS/STATE & DEFACTO COMPLAINANT: 1 STATE OF KERALA, REPRESENTED BY PUBLIC PROSECUTOR, HIGH COURT OF KERALA, ERNAKULAM-682031. 2 ARJUN, AGED 32 YEARS, S/O KADJU,NARAYANA MANDIRAM, CHAVARCODE, PARIPPALLY.P.O, VARKALA, THIRUVANANTHAPURAM DISTRICT-695001. R2 BY ADV. A.CHANDRA BABU R1 BY SRI.C.S.HRITHWIK, SR.P.P. THIS CRIMINAL MISC. CASE HAVING COME UP FOR ADMISSION ON 07.01.2020, ALONG WITH Crl1.MC.8407/2019(A), THE COURT ON THE SAME DAY PASSED THE FOLLOWING: Baan ops 2020/KER/513 Crl.MC 8401 & 8407/2019 -?-= IN THE HIGH COURT OF KERALA AT ERNAKULAM PRESENT THE HONOURABLE MR. JUSTICE ASHOK MENON TUESDAY, THE O7TH DAY OF JANUARY 2020 / 17TH POUSHA, 1941 Cr1.MC.No.8407 OF 2019 (A) AGAINST THE ORDER/JUDGMENT IN SC 543/2013 OF ASSISTANT SESSIONS COURT , ATTINGAL CRIME NO.845/2011 OF Varkala Police Station , Thiruvananthapuram PETITIONER/ACCUSED NO.1: SUJILAL AGED 31 YEARS S/O.SAJILAL, KIZHAKKATHIL VEEDU, PADIKKAL, NEAR PALKULANGARA DEVI TEMPLE, KILIKOLLOOR VILLAGE, KOLLAM DISTRICT, NOW RESIDING AT SINDHU BHAVAN, VRINDAVAN NAGAR, KADAPPAKADA, KOLLAM DISTRICT. BY ADV. SRI.P.ANOOP (MULAVANA) RESPONDENTS/STATE & DEFACTO COMPLAINANT : 1 STATE OF KERALA, REPRESENTED BY PUBLIC PROSECUTOR, HIGH COURT OF KERALA, ERNAKULAM-682031. 2 ARJUN AGED 32 YEARS S/O.KADJU, NARAYANA MANDIRAM, CHAVARCODE, PARIPPALLY.P.O., VARKALA, THIRUVANANTHAPURAM DISTRICT, PIN - 695 001. R2 BY ADV. A.CHANDRA BABU Rl BY SRI.C.S.HRITHWIK, SR.P.P. THIS CRIMINAL MISC. CASE HAVING COME UP FOR ADMISSION ON 07.01.2020, ALONG WITH Crl1.MC.8401/2019(A), THE COURT ON THE SAME DAY PASSED THE FOLLOWING: BIA] a rear 2020/KER/513 Crl.MC 8401 & 8407/2019 3+ COMMON ORDER [ Cr1.MC.8401/2019, Cr1.MC.8407/2019 ] Dated this the 7th day of January 2020 Petitioners in these cases are accused Nos.2 and 1 respectively, in Crime No.845/2011 of varkkala Police Station for having allegedly committed offences punishable under Sections 143, 147, 148, 447, 294(b), 341, 324 and 308 read with Section 149 IPc. The cases against the petitioners were committed and are_ presently pending as SC No.1875/2014 and SC No.543/2013, respectively, before the Assistant Sessions Court, Attingal. The defacto complainant/injured is the second respondent, who has_~= appeared through counsel and filed separate affidavits in these cases to the effect that the matter has _ been amicably settled with the petitioners and that he has no grievance against them. Even through offence under Section 308 IPC has been incorporated, the injuries are not life a piers 2020/KER/513 Crl1.MC 8401 & 8407/2019 -4- threatening. A report has been obtained from the investigating officer to the effect that the matter has been settled. The petitioners do not have any criminal antecedents. No public interest is involved. In the result, these Criminal M.Cs are allowed and the entire proceedings as against the petitioners pending before the Assistant Sessions Court, Attingal in SC Nos.1875/2014 and 543/2013 shall stand quashed under Section 482 cCr.PC and the petitioners/accused are discharged. Sd/- ASHOK MENON JUDGE ig Baan Eup 2020/KER/513 Crl.MC 8401 & 8407/2019 -5- APPENDIX OF Cr1.MC 8401/2019 PETITIONER'S/S EXHIBITS: ANNEXURE Al TRUE COPY OF THE CHARGE SHEET IN $.C.NO.1875/2014 BEFORE THE ASSISTANT SESSIONS COURT ,ATTINGAL. ANNEXURE A2 TRUE COPY OF THE AFFIDAVIT FILED BY THE 2ND RESPONDENT. Baan Eup 2020/KER/513 Crl.MC 8401 & 8407/2019 ~6- APPENDIX OF Cr1.MC 8407/2019 PETITIONER'S/S EXHIBITS: ANNEXURE Al TRUE COPY OF THE CHARGE SHEET IN SC NO.543/2013 BEFORE THE ASSISTANT SESSIONS COURT, ATTINGAL ANNEXURE A2 AFFIDAVIT FILED BY THE 2ND RESPONDENT"
}