{
    "case_id": "Crl.MC.No. 8737 OF 2017 ()",
    "court": "HIGH COURT OF KERALA AT ERNAKULAM",
    "date": "2018",
    "judge": "SUNIL THOMAS FRIDAY",
    "petitioners": [
        "RAJESH",
        "cea Ec Ed se ages",
        "Palakkad",
        "AGED",
        "PALAKKAD",
        "THADUKKASSERY P.O.",
        "MC.No"
    ],
    "respondents": [
        "ERNAKULAM -"
    ],
    "sections": [
        "Section 11(i) read with Section 12 of the Protection of Children from Sexual Offences Act",
        "Section 7 read with 8",
        "354(A)"
    ],
    "outcome": "/JUDGMENT IN CRL.M.P.NO.3241/2017 IN CRL.M.P.NO.1085/2017 OF SPECIAL COURT UNDER POCSO ACT, PALAKKAD DATED 08-12-2017 CRIME NO. 358/2017 OF KONGAD POLICE STATION, PALAKKAD PETITIONER/PETITIONER/ACCUSE",
    "full_text": "! cea Ec Ed se ages IN THE HIGH COURT OF KERALA AT ERNAKULAM 2018/KER/512 PRESENT: THE HONOURABLE MR. JUSTICE SUNIL THOMAS FRIDAY, THE 5TH DAY OF JANUARY 2018 / 15TH POUSHA, 1939 Cr1.MC.No. 8737 OF 2017 AGAINST THE ORDER/JUDGMENT IN CRL.M.P.NO.3241/2017 IN CRL.M.P.NO.1085/2017 OF SPECIAL COURT UNDER POCSO ACT, PALAKKAD DATED 08-12-2017 CRIME NO. 358/2017 OF KONGAD POLICE STATION, PALAKKAD PETITIONER/PETITIONER/ACCUSED RAJESH AGED 28 YEARS, S/O. AYYAPPAN, CHALLIPPARAMBIL HOUSE, THADUKKASSERY P.O., PALAKKAD. BY ADV.SRI.V.A.JOHNSON (VARIKKAPPALLIL) RESPONDENT/RESPONDENT & COMPLAINANT: STATE OF KERALA REPRESENTED BY PUBLIC PROSECUTOR, HIGH COURT OF KERALA, ERNAKULAM - 682 031. R BY PUBLIC PROSECUTOR SHRI.C.K.PRASAD THIS CRIMINAL MISC. CASE HAVING COME UP FOR ADMISSION ON 05-01-2018, THE COURT ON THE SAME DAY PASSED THE FOLLOWING: ae BRA -o: 2018/KER/512 Crl.MC.No. 8737 OF 2017 () APPENDIX PETITIONER (S)' ANNEXURES ANNEXURE A FREE COPY OF THE ORDER IN CRL.M.P.NO. 3241/2017 IN CRL.M.P.NO.1085/2017 IN CRIME NO. 358/2017 OF KONGAD POLICE STATION, PALAKKAD DATED 08.12.2017. RESPONDENT (S)' EXHIBITS: NIL //TRUE COPY// vgd PA TO JUDGE 2018/KER/512 SUNIL THOMAS, J. Dated this the 5\" day of January, 2018 ORDER The petitioner was granted bail in Crime No.358/2017 of Kongad Police Station, Palakkad for offences punishable under Sections 354(A) of IPC and Section 7 read with 8 and Section 11(i) read with Section 12 of the Protection of Children from Sexual Offences Act, inter alia on a condition that he shall not enter the limits of the village where the victim has been staying. 2. The petitioner has approached this Court to relax the condition stating that he is a coolie worker and is doing work near his house which situates within the village in which the victim resides. The court below by order in CMP No.3241/2017 dismissed the application seeking relaxation of the above condition. 3. It appears that, having regard to the nature of allegations and to insulate the victim involved in this case, the court below has justifiably imposed the condition. However, the case of the petitioner is that the petitioner herein is residing in the same village. He earns his livelihood by doing sundry works within that limits, it is submitted. BREST Fy, ent apse 2018/KER/512 Cri. M. C. No. 8737 of 2017 2 4. It is seen that the final report has been laid. Having considered this, | am inclined to permit the petitioner to enter the limits of the Police Station within whose jurisdiction the petitioner is residing as evident from the address of the accused. However, he shall not in any manner threaten, coerce, intimidate or try to influence the victim or the witnesses. Crl.M.C. stands disposed of. Sd/- SUNIL THOMAS, JUDGE. Pn"
}