{
    "case_id": "Crl.MC.No. 7843 of 2015",
    "court": "HIGH COURT OF KERALA AT ERNAKULAM PRESENT",
    "date": "MONDAY",
    "judge": "B.KEMAL PASHA MONDAY",
    "petitioners": [
        "SON OF GOPI",
        "PRAMOD",
        "SON OF SUBRAMANIAN",
        "SON OF JOSEPH",
        "Caroma ORDER Petitioners",
        "MEMOOKURUPARAMBU",
        "ABILASH",
        "GOPALAKRISHNAN",
        "DINESHAN",
        "SANTOSH",
        "Annexures A",
        "LANKAYIL VEETTIL",
        "ANEESH",
        "CHETITHARA VEETIL",
        "SHYAM MOHAN",
        "SON OF RAJAN",
        "JOMY JOSEPH",
        "MANNITTU THARAYIL",
        "GIREESH KUMAR",
        "LANKAYIL HOUSE",
        "EZHIKKARA.",
        "RAJEEV",
        "EZHIKKARA KARA",
        "CHAPAYAPARAMBU",
        "JOSEPH",
        "SON OF GOPALAKRISHNAN",
        "NISHAD",
        "SON OF KRISHNAN",
        "SON OF MOHANAN",
        "SRILSANU MATHEW",
        "NIKATHIL VEETIL",
        "MC.No",
        "MUJEEB"
    ],
    "respondents": [
        "SON OF LALAN",
        "MIDHUNLAL",
        "SON OF SUGUNAN",
        "SUJITH",
        "GIREESH",
        "SON OF GOPALAN"
    ],
    "sections": [
        "324",
        "148",
        "447",
        "506 (ii) read with Section 149 of the Indian Penal Code",
        "143",
        "147"
    ],
    "outcome": "Petitioners are accused in C.C. No.497/2009 of the Judicial First Class Magistrate's Court-l, North Paravoor, which has arisen from Crime No.804/2006 of the North Paravoor Police Station, registered f",
    "full_text": "Bee 2016/KER/62 IN THE HIGH COURT OF KERALA AT ERNAKULAM PRESENT: THE HONOURABLE MR. JUSTICE B.KEMAL PASHA MONDAY, THE 4TH DAY OF JANUARY 2016/14TH POUSHA, 1937 Cri.MC.No. 7843 of 2015 () CC. NO.497/2009 OF JUDICIAL FIRST CLASS MAGISTRATE COURT-I, NORTH PARAVUR. PETITIONER(S): 1. PRAMOD, AGED 36 YEARS, SON OF KRISHNAN, VALIYAPURAKKAL VEETIL, EZHIKKARA KARA, EZHIKKARA VILLAGE. 2. SANTOSH, SON OF PURUSHAN, NIKATHIL VEETIL, EZHIKKARA. 3. NISHAD, AGED 36 YEARS, SON OF GOPI, KANJIRAPPARAMBIL VEETIL, EZHIKKARA. 4. RAJEEV, AGED 33 YEARS, SON OF MOHANAN, PANEERATHIL VEETIL, EZHIKKARA. 5. MUJEEB, SON OF ALI, MANNITTU THARAYIL, EZHIKKARA. 6. DINESHAN @ PAINAPPAN, AGED 44 YEARS, SON OF RAJAN, NADITHARA, EZHIKKARA. 7. GIREESH KUMAR, AGED 33 YEARS, SON OF GOPALAKRISHNAN, KOMARAPILLI VEETIL, EZHIKKARA. 8. ABILASH, SON OF BABU, CHETITHARA VEETIL, EZHIKKARA. 9. GOPALAKRISHNAN, AGED 36 YEARS, SON OF SUBRAMANIAN, THEKKIDNEDATH VEETIL, EZHIKKARA. 10. JOMY JOSEPH, AGED 33 YEARS, SON OF JOSEPH, THADIKKARAN VEETIL, EZHIKKARA. Bee 2016/KER/62 Cri.MC.No. 7843 of 2015 11. VIKRAMAN, AGED 46 YEARS, SON OF KUTTAPPAN, MAMPAYATHU VEETIL, KEDAMANGALAM KARA, EZHIKKARA. 12. SONY, AGED 36 YEARS, SON OF ANTONY, THADIKKARAN VEETIL, EZHIKKARA. 13. SNIN, AGED 33 YEARS, SON OF MOHANAN, CHETITHARA VEETIL, EZHIKKARA. 14. SHINOJ, AGED 33 YEARS, SON OF GOPI, VALIYAPURAKKAL, EZHIKKARA. 15. RAJU, AGED 49 YEARS, SON OF MADHAVAN, LAKSHAM VEETIL, EZHIKKARA. 16. SHAN, AGED 29 YEARS, SON OF CHELLAPPAN, THUNDIPARAMBIL, EZHIKKARA. 17. NASH, AGED 33 YEARS, SON OF NARAYANAN, KOTTAZHATHU VEETIL, EZHIKKARA. 18. LENIN, AGED 28 YEARS, SON OF SUKUMARAN, CHAPAYAPARAMBU, NANDYATTUKUNNAMKARAYIL, PARAVUR VILLAGE. 19. HAMSA, AGED 39 YEARS, SON OF BEERAVU, PULLOLI VEETIL, EZHIKKARA. BY ADVS.SRI.GEO PAUL, SRILSANU MATHEW, SRILRADHIKA RAJASEKHARAN P., SRIC.R.PRAMOD, SRILS.ASHOK KUMAR. RESPONDENT(S): 1. STATE OF KERALA, REPRESENTED BY ITS PUBLIC PROSECUTOR, HIGH COURT OF KERALA. 2. SUJITH, AGED 30 YEARS, SON OF SUGUNAN, KALLACHIRA HOUSE, EZHIKKARA. 3. GIREESH, AGED 37 YEARS, SON OF GOPALAN, LANKAYIL HOUSE, EZHIKKARA. 4. MIDHUNLAL, AGED 28 YEARS, SON OF LALAN, KALLACHIRAYIL, EZHIKKARA. Bee 2016/KER/62 Cri.MC.No. 7843 of 2015 5. SHYAM MOHAN, AGED 30 YEARS, SON OF MOHANAN, TALIPARAMBU, EZHIKKARA. 6. ANEESH, AGED 31 YEARS, SON OF ABDL REHMAN, KALAKKASERRY HOUSE, EZHIKKARA. 7. SAJEESH, AGED 33 YEARS, SON OF SASI, KALATHIPARAMBU, EZHIKKARA. 8. SUMANGALA, AGED 56 YEARS, WIFE OF SASI, KALATHIPARAMBU, EZHIKKARA. 9. AMBIKA, W/O.CHANDRAN, MAMMUKKURU PARAMBIL, EZHIKKARA KARA, EZHIKKARA VILLAGE. 10. GIRIJA, AGED 51 YEARS, WIFE OF MOHANAN, TALAPARAMBU, EZHIKKARA. 11. RANJITH, AGED 34 YEARS, SON OF CHANDRAN, MEMOOKURUPARAMBU, EZHIKKARA. 12. JEEMON, S/O.RAJAN, AGED 39 YEARS, LANKAYIL VEETTIL, EZHIKKARA KARA, EZHIKKARA VILLAGE, ERNAKULAM. 13. PRATHAPAN, S/O. THANKAPPAN, AGED 51 YEARS, KALLUCHIRAYIL VEETIL, EZHIKKARA KARA, EZHIKKARA VILLAGE. R1 BY PUBLIC PROSECUTOR SMT.P. MAYA. R2 TO R13 BY ADV. SRILK.S.SREENATH THIS CRIMINAL MISC. CASE HAVING COME UP FOR ADMISSION ON 04-01-2016, THE COURT ON THE SAME DAY PASSED THE FOLLOWING: rs. Bee 2016/KER/62 Crl.MC.No. 7843 of 2015 APPENDIX PETITIONER'S ANNEXURES:- ANNEXURE A1: CERTIFIED COPY OF THE FINAL REPORT IN CC.NO.497/2009 ON THE FILES OF THE JUDICIAL FIRST CLASS MAGISTRATE COURT I, NPARAVOOR AND AFFIDAVIT FILED BY 1ST RESPONDENT. ANNEXURE A 2: AFFIDAVIT FILED BY THE 2ND RESPONDENT. ANNEXURE A3 : AFFIDAVIT FILED BY THE 3RD RESPONDENT. ANNEXURE A4 : AFFIDAVIT FILED BY THE 4TH RESPONDENT. ANNEXURE A5: AFFIDAVIT FILED BY THE 5TH RESPONDENT. ANNEXURE AG : AFFIDAVIT FILED BY THE 6TH RESPONDENT. ANNEXURE A7 : AFFIDAVIT FILED BY THE 7TH RESPONDENT. ANNEXURE A8: AFFIDAVIT FILED BY THE 8TH RESPONDENT. ANNEXURE AQ: AFFIDAVIT FILED BY THE 9TH RESPONDENT. ANNEXURE A10: AFFIDAVIT FILED BY THE 10TH RESPONDENT. ANNEXURE A11: AFFIDAVIT FILED BY THE 11TH RESPONDENT. ANNEXURE A12 :AFFIDAVIT FILED BY THE 12TH RESPONDENT. ANNEXURE A113 :AFFIDAVIT FILED BY THE 13TH RESPONDENT. RESPONDENT'S ANNEXURES:- NIL. HfTRUE COPY// P.S. TO JUDGE rs. soleikER62 B. KEMAL PASHA, J. aE Caroma ORDER Petitioners are accused in C.C. No.497/2009 of the Judicial First Class Magistrate's Court-l, North Paravoor, which has arisen from Crime No.804/2006 of the North Paravoor Police Station, registered for the offences punishable under Sections 143, 147, 148, 324, 447 and 506 (ii) read with Section 149 of the Indian Penal Code. 2. The matter has been amicably settled between the petitioners and the defacto complainant, who is the second respondent herein and the other affected parties, who are respondents 2 to 13. They have filed separate affidavits as Annexures A2 to A13 affirming that the matter has been amicably settled between them and the petitioners and they have no complaints against the petitioners. soleikER62 CRL.M.C.No. 7843 of 2015 uoe 3. No criminal antecedents have been reported against the petitioners. When the matter has been amicably setiled, no purpose would be served in proceeding with the matter further, and therefore, all further proceedings in C.C. No.497/2009 of the Judicial First Class Magistrate's Court-l, North Paravoor, as against the petitioners, based on Annexure Ai Final Report in Crime No.804/2006 of the North Paravoor Police Station, can be quashed. In the result, this Crl.M.C. is allowed and all further proceedings in C.C. No.497/2009 of the Judicial First Class Magistrate's Court-l, North Paravoor, as against the petitioners, based on Annexure A1 Final Report in Crime No.804/2006 of the North Paravoor Police Station, are hereby quashed. Sd/- B.KEMAL PASHA, JUDGE ul/- [True copy] PS. to Judge"
}