{
    "case_id": "CRL.MC NO. 262 OF 2024",
    "court": "HIGH COURT OF KERALA AT ERNAKULAM PRESENT THE HONOURABLE MR",
    "date": "2024",
    "judge": "BECHU KURIAN THOMAS FRIDAY",
    "petitioners": [
        "KODALIKKODAN HOUSE",
        "Others",
        "O KUNJAMUTTY",
        "Yogendra Yadav",
        "NOUFAL M.V.",
        "RASHEED P.P.",
        "KUNJALAN KUTTY",
        "O HASSAN KUTTY HAJI",
        "JALEEL M.C.",
        "ABDUL SALAM K.K.",
        "Malappuram District",
        "ALAVI",
        "ANVER K. K.C.KHAMARUNNISA K.SALMA JENNATH K.SHAMSUDHEEN ARUN CHAND",
        "AGED",
        "MUBARIS",
        "MALAPPURAM",
        "GAFOOR V.C.",
        "ABDUL KHADER",
        "POKKER"
    ],
    "respondents": [
        "O ABDURAHIMAN",
        "MUHAMMED",
        "ABOOBACKER",
        "MAMUKKOYA",
        "AGED",
        "OTHER PRESENT"
    ],
    "sections": [
        "1860",
        "482",
        "323",
        "341",
        "324 r/w Section 149 of the Indian Penal Code",
        "143",
        "147"
    ],
    "outcome": "/JUDGMENT CC 476/2021 OF JUDICIAL MAGISTRATE OF FIRST CLASS , PARAPPANANGADI PETITIONER/S: 1 MUBARIS AGED 24 YEARS S/0 ABDUL KHADER, MOONNAMKANDATHIL HOUSE, ULLANAM NORTH POST, PARAPPANANGADI, MALAPPU",
    "full_text": "Berl b aa ae ee reap hes 2024/KER/4535 CRL.MC NO. 262 OF 2024 1 IN THE HIGH COURT OF KERALA AT ERNAKULAM PRESENT THE HONOURABLE MR. JUSTICE BECHU KURIAN THOMAS FRIDAY, THE 194! DAY OF JANUARY 2024 / 29TH POUSHA, 1945 CRL.MC NO. 262 OF 2024 CRIME NO.995/2020 OF Parappangadi Police Station, Malappuram AGAINST THE ORDER/JUDGMENT CC 476/2021 OF JUDICIAL MAGISTRATE OF FIRST CLASS , PARAPPANANGADI PETITIONER/S: 1 MUBARIS AGED 24 YEARS S/0 ABDUL KHADER, MOONNAMKANDATHIL HOUSE, ULLANAM NORTH POST, PARAPPANANGADI, MALAPPURAM, PIN - 676303 2 RASHEED P.P. AGED 48 YEARS S/0 KUNJALAN KUTTY, PARIPARAMBATH HOUSE, ULLANAM NORTH POST, PARAPPANANGADI, MALAPPURAM, PIN - 676303 3 ABDUL SALAM K.K. AGED 48 YEARS S/O HASSAN KUTTY HAJI, KODALIKKODAN HOUSE, ULLANAM NORTH POST, PARAPPANANGADI, MALAPPURAM, PIN - 676303 4 JALEEL M.C. AGED 40 YEARS S/0 POKKER, MALIYEKKAL CHENAKKAL HOUSE, ULLANAM NORTH POST, PARAPPANANGADI, MALAPPURAM, PIN - 676303 5 NOUFAL M.V. AGED 39 YEARS S/0 ALAVI, MANALAM VEETTIL MOOTHATTIL HOUSE, ULLANAM NORTH POST, PARAPPANANGADI, MALAPPURAM, PIN - 676303 6 GAFOOR V.C. AGED 45 YEARS S/O KUNJAMUTTY, THEKKECHANATTHU HOUSE, ULLANAM NORTH POST, PARAPPANANGADI, MALAPPURAM - 676303, PIN - 676303 BY ADVS. THAREEQ ANVER K. K.C.KHAMARUNNISA K.SALMA JENNATH K.SHAMSUDHEEN ARUN CHAND RASSAL JANARDHANAN A. BHARAT VIJAY P. Berl b aa ae ee reap hes 2024/KER/4535 CRL.MC NO. 262 OF 2024 2 GOVIND G. NAIR RESPONDENT/S: 1 STATE OF KERALA REPRESENTED BY PUBLIC PROSECUTOR, HIGH COURT OF KERALA, PIN - 682031 2 ABOOBACKER AGED 49 YEARS S/0 MUHAMMED, PATTARKADAVAN HOUSE, ULLANAM NORTH POST, PARAPPANANGADI, MALAPPURAM, PIN - 676303 3 MAMUKKOYA AGED 54 YEARS S/O ABDURAHIMAN, CHERICHAM VEETTIL NANDANTHODU HOUSE, ULLANAM NORTH POST, PARAPPANANGADI, MALAPPURAM, PIN - 676303 OTHER PRESENT: SRI. M.C. ASHI (PP) THIS CRIMINAL MISC. CASE HAVING COME UP FOR ADMISSION ON 19.01.2024, THE COURT ON THE SAME DAY PASSED THE FOLLOWING: Put 2024/KER/4535 CRL.MC NO. 262 OF 2024 3 BECHU KURIAN THOMAS, J. ~ Cri.M.C.No.262 of 2024 _ Dated this the 19% day of January, 2024 ORDER Petitioners have invoked the jurisdiction under Section 482 Cr.P.C to quash all proceedings against them. 2. Petitioners are the accused in C.C.No.476/2021 on the files of the Judicial First Class Magistrate Court, Parappanangadi, arising out of Crime No.995/2020 of Parappanangadi Police Station, Malappuram District, registered for the offences under Sections 143, 147, 341, 323 and 324 r/w Section 149 of the Indian Penal Code, 1860. Respondents 2 and 3 are the defacto complainant and the injured witness. 3. According to the prosecution, the accused formed themselves into unlawful assembly and assaulted the defacto complainant with bamboo stick and thereby committed the offences alleged. 4. Heard the learned Counsel for the petitioners and the learned Counsel for the respondents apart from the learned Public Prosecutor. 5. The learned Counsel for the petitioners submitted that the matter has been settled and hence the proceedings against the petitioners ought to be quashed. It was also submitted that, Put 2024/KER/4535 CRL.MC NO. 262 OF 2024 4 considering the nature of offences alleged, no purpose would be served by continuing the proceedings. 6. In Gian Singh v. State of Punjab [(2012) 10 SCC 303], the Apex Court has held that in appropriate cases, the High Court can take note of the amicable resolution of disputes between the victim and the wrongdoer to put an end to the criminal proceedings. This view was reiterated in Narinder Singh v. State of Punjab [(2014) 6 SCC 466] and Yogendra Yadav and Others v. State of Jharkhand and Another [(2014) 9 SCC 653]. 7. | have perused Annexure 2 affidavit filed by respondents 2 and 3. The learned Public Prosecutor has submitted that upon verification, it is understood that the affidavit is genuine, and the defacto complainant and the other deponent stand by the contens thereof. | am satisfied that the matter has been settled and no public interest is involved in this case. There is no impediment for granting the prayer for quashing. The continuance of the proceedings will only be an exercise in futility. 8. Accordingly, all proceedings against the petitioners in C.C.No.476/2021 on the files of the Judicial First Class Magistrate Court, Parappanangadi are quashed. This Crl.M.C is allowed. BECHU KURIAN THOMAS JUDGE jm/ Ble el i PL nr at 2024/KER/4535 CRL.MC NO. 262 OF 2024 5 APPENDIX OF CRL.MC 262/2024 PETITIONER ANNEXURES Annexure 1 THE CERTIFIED COPY OF FINAL REPORT NO.116/2021 DATED 23/02/2021 OF PARAPPANANGADI POLICE STATION IN C.C.476/2021 BEFORE THE HON'BLE COURT JUDICIAL FIRST CLASS MAGISTRATE'S COURT - I, PARAPPANANGADI Annexure 2 THE AFFIDAVIT DATED 28/12/2023 SWORN BY THE 2ND AND 3RD RESPONDENTS Annexure 3 THE CERTIFIED COPY OF THE FIRST INFORMATION REPORT DATED 18/12/2020 BEARING NO.995/2020 OF THE PARAPPANANGADI POLICE STATION ALONG WITH THE COMPLAINT FORMING BASIS THEREOF"
}