{
    "case_id": "Crl.MC.No.8373 OF 2017",
    "court": "HIGH COURT OF KERALA AT HRNARULAM PRESENT THE HONOURABLE MR",
    "date": "2021",
    "judge": "P.V.KUNHIKRISHNAN FRIDAY",
    "petitioners": [
        "PETER",
        "PUSHPAMANT A.",
        "AGED",
        "PARAMBU",
        "KOZHIKODE DSITRICT-",
        "SATHYAPALAN",
        "Sd"
    ],
    "respondents": [
        "HOUSE",
        "KERALA",
        "AGED",
        "LAL KRISHNA",
        "POLICE STATION"
    ],
    "sections": [],
    "outcome": "Dated this the 8 day of January 2021 When this case came up for consideration, the learned counsel appearing for the petitioners submitted that the petitioners are no more. Therefore, this Cr1.M.C is ",
    "full_text": "Beer aise er 2021/KER/1241 IN THE HIGH COURT OF KERALA AT HRNARULAM PRESENT THE HONOURABLE MR. JUSTICE P.V.KUNHIKRISHNAN FRIDAY, THE O8TH DAY OF JANUARY 2021 / 18TH POUSHA, 1942 Cr1.MC.No.8373 OF 2017 CRIME NO.25/2017 OF MAARAD POLICE STATION , KOZHIKODE PETITIONERS/ACCUSED NOS.1 & 2: 1 SATHYAPALAN AGED 68 YEARS, S/O. PADMANABHAN KUTTY , CHULLIYAMKANDI PARAMBU, ARAKKINAR P.O.,MAARAD, KOZHIKODE DISTRICT. 2 PUSHPAMANT A. AGED 52 YEARS, W/O. SATHYAPALAN ,CHULLIYAMKANDI PARAMBU, ARAKKINAR P.O.,MAARAD, KOZHIKODE DISTRICT. BY ADV. SRI.S.K.SAJU RESPONDENTS/STATE & DEFACTO COMPLAINANT: 1 STATE OF KERALA REPRESENTED BY THE PUBLIC PROSECUTOR, HIGH COURT OF KERALA, REPRESENTING SUB INSPECTOR OF POLICE MAARAD POLICE STATION, KOZHIKODE-673001. 2 LAL KRISHNA AGED 20 YEARS, S/O. BABU, KATTUPARMBATH HOUSE ,ARAKKINAR P.O., MAARAD, KOZHIKODE DSITRICT- 673028. SRI.SANTOSH PETER, SR.PP THIS CRIMINAL MISC. CASE HAVING BEEN FINALLY HEARD ON 08.01.2021, THE COURT ON THE SAME DAY PASSED THE FOLLOWING: Berl Ber Crl.MC.No.8373 OF 2017 202 1KER/T241 2 ORDER Dated this the 8 day of January 2021 When this case came up for consideration, the learned counsel appearing for the petitioners submitted that the petitioners are no more. Therefore, this Cr1.M.C is dismissed recording the submission of the learned counsel for the petitioners. Sd/- P.V.KUNHIKRISHNAN JUDGE DM Deere Stee Peet Crl.MC.No.8373 OF 2017 2021/KER/1241 3 APPENDIX PETITIONERS' EXHIBITS: ANNEXURE Al TRUE COPY OF THE FIR IN CRIME NO.25/2017 REGISTERED BY THE 18ST RESPONDENT. ANNEXURE A2 ANNEXURETRUE COPY OF THE 1ST INFORMATION STATEMENT DATED 02.01.2017 GIVEN BY THE 2ND RESPONDENT TO THE POLICE. ANNEXURE A3 CERTIFIED COPY OF THE FINAL REPORT DATED 15.02.2017 IN CRIME NO.25/2017. ANNEXURE A4 TRUE COPY OF THE MEMO OF EVIDENCE ALONG WITH DEPOSITION OF ALL WITNESSES. RESPONDENTS' EXHIBITS :NIL //TRUE COPY// PA TO JUDGE"
}