{
    "case_id": "Crl.MC.No. 9087 of 2016 ()",
    "court": "HIGH COURT OF KERALA AT BRNAKULAM PRESENT",
    "date": "DECEMBER 2016/6TH",
    "judge": "K.P.JYOTHINDRANATH TUESDAY",
    "petitioners": [
        "RAJESH",
        "JAMIN KOTTAMPADI",
        "KHC",
        "Peal",
        "K.P.JYOTHINDRANATH",
        "M.P. No.",
        "PALAKKAD",
        "MC.No",
        "J. Dated",
        "AVILCHINNAPALAYAM"
    ],
    "respondents": [
        "ERNAKULAM."
    ],
    "sections": [
        "20(b)(ii)(B)",
        "1985"
    ],
    "outcome": "IN CRMP 3642/2016 OF THE COURT OF SESSION, PALAKKAD DIVISION DATED 17-12-2016 CRIME NO. 1092/2016 OF PALAKKAD TOWN SOUTH POLICE STATION PETITIONER (S) /PETITIONER/ACCUSED NO.2: RAJESH, AGED 36 YEARS, ",
    "full_text": "Pee one Eee 2016/KER/55578 IN THE HIGH COURT OF KERALA AT BRNAKULAM PRESENT: THE HONOURABLE MR. JUSTICE K.P.JYOTHINDRANATH TUESDAY, THE 27TH DAY OF DECEMBER 2016/6TH POUSHA, 1938 Crl.MC.No. 9087 of 2016 () AGAINST THE ORDER IN CRMP 3642/2016 OF THE COURT OF SESSION, PALAKKAD DIVISION DATED 17-12-2016 CRIME NO. 1092/2016 OF PALAKKAD TOWN SOUTH POLICE STATION PETITIONER (S) /PETITIONER/ACCUSED NO.2: RAJESH, AGED 36 YEARS, S/O.MANICKAN, NO. 3/140, AVILCHINNAPALAYAM, JAMIN KOTTAMPADI, SAMATHOOR, POLLACHI, TAMIL NADU STATE. BY ADV. SRI.NIREESH MATHEW RESPONDENT (S) /RESPONDENT/COMPLAINANT : STATE OF KERALA REP. BY PUBLIC PROSECUTOR, HIGH COURT OF KERALA, ERNAKULAM. BY PUBLIC PROSECUTOR SMT.REKHA C. NAIR THIS CRIMINAL MISC. CASE HAVING COME UP FOR ADMISSION ON 27-12-2016, THE COURT ON THE SAME DAY PASSED THE FOLLOWING: BKA/- Pal one Eee 2016/KER/55578 Cr1.MC.No. 9087 of 2016 () APPENDIX PETITIONER (S)' EXHIBITS ANNEXURE A COPY OF THE ORDER DATED 17.12.2016 IN CRL.M.P. NO. 3642/2016 PASSED BY THE SESSIONS COURT, PALAKKAD ANNEXURE B COPY OF THE CITATION, 1985 KHC 795 KESHAB NARAYANAN BANERJEE & ANOTHER VS. STATE OF BIHAR ANNEXURE C COPY OF THE CITATION, 2010 KHC 6262 SYAMKUMAR VS. STATE OF KERALA & ANOTHER ANNEXURE D COPY OF THE CITATION, 2012(3) KHC 411 RAMAKRISHNA PILLAI & ANOTHER VS. STATE OF KERALA & ANOTHER RESPONDENT (S)' EXHIBITS NIL //TRUE COPY// PA TO JUDGE bka/- Pal 2016/KER/55578 K.P. JYYOTHINDRANATH, J. Dated this the 27\" day of December, 2016 ORDER 1.This is a petition filed by the 2\"? accused in Crime No.1092/2016 of Palakkad Town South Police Station. The offence alleged is under Section 20(b)(ii)(B) of Narcotic Drugs and Psychotropic Substances Act, 1985. The quantum of ganja involved is 10 kg. 2.When default bail was granted by the lower court, a condition was imposed that one of the sureties must be one of his parents with landed properties. The petitioner is aggrieved by the said condition. 3.It is submitted by the learned counsel for the petitioner that the court below cannot suppose that the parents of the petitioner are having landed properties. I see force in the said submission. 4.Similarly, the petitioner is also aggrieved by the condition that the original title deed of the properties Pal 2016/KER/55578 Crl.M.C. No. 9087 of 2016 also should be produced by the sureties, not for perusal, but, has to be deposited. The petitioner is also aggrieved by the condition to deposit %1,00,000/- (Rupees one lakh only) before the court below as cash security while executing bond. 5.Heard the learned Public Prosecutor as well. 6.After hearing the learned Public Prosecutor, I feel that the condition that one among the sureties shall be one of his parents with landed properties has to be interfered with. 7.The petitioner is aged 36 years and it is submitted that his father is no more. After considering all these aspects, the second condition imposed by the court below while granting bail in Crl.M.P. No.3642/2016 in Crime No.1092/2016 of Palakkad Town South Police Station is hereby deleted. The third condition imposed is modified to the extent that after perusal of the title deeds by the court below, the said title deeds can be returned on an undertaking to produce the same as and Peal aaah a 2016/KER/55578 Crl.M.C. No. 9087 of 2016 when required. The petitioner shall also produce a photocopy of the title deed at the time of execution of the bond. I am not inclined to interfere with the 4 condition imposed by the court below while granting bail. 8.The Crl.M.C. is disposed of, as above. Sd/- K.P. JYYOTHINDRANATH JUDGE bka/27.12.2016"
}