{
    "case_id": "CRL.MC.NO. 8791 OF 2019",
    "court": "HIGH COURT OF KERALA AT ERNAKULAM PRESENT THE HONOURABLE MR",
    "date": "06 day of January, 2020",
    "judge": "ASHOK MENON MONDAY",
    "petitioners": [
        "VINEETH",
        "SHYAM KUMAR",
        "PETER",
        "O.SENSILA VOOS",
        "O.M.S.KOCHANIYAN",
        "JOSEPH",
        "ERNAKULAM-",
        "PALLURUTHY.P.O.",
        "JESLIN JOSEPH",
        "NEAR VVLP SCHOOL KONAM",
        "SOUTH KONAM",
        "AGED",
        "O.THILAKAN",
        "Ernakulam",
        "Rl C.S.HRITHWIK-SR.P.P",
        "PALLURUTHY.P.O",
        "KONAM ROAD"
    ],
    "respondents": [
        "O. PETER",
        "RESIDING AT PULIVEZH HOUSE",
        "AGED",
        "P.O",
        "ALDRIN ANTONY",
        "TIBIN PETER",
        "Pease",
        "Kochi"
    ],
    "sections": [
        "324",
        "294(b) read with Section 34 of the IPC",
        "482",
        "323",
        "341"
    ],
    "outcome": "/JUDGMENT IN CC.NO.173/2019 OF JUDICIAL MAGISTRATE OF FIRST CLASS -II, KOCHI CRIME NO.40/2019 OF Palluruthy Police Station , Ernakulam NAME AND ADDRESS OF THE PETITIONERS/ACCUSED 1 TO 3: 1 VINEETH, AG",
    "full_text": "Bl Lee Be 2020/KER/191 IN THE HIGH COURT OF KERALA AT ERNAKULAM PRESENT THE HONOURABLE MR. JUSTICE ASHOK MENON MONDAY, THE O6TH DAY OF JANUARY 2020 / 16TH POUSHA, 1941 Cri1.MC.No.8791 OF 2019 (H) AGAINST THE ORDER/JUDGMENT IN CC.NO.173/2019 OF JUDICIAL MAGISTRATE OF FIRST CLASS -II, KOCHI CRIME NO.40/2019 OF Palluruthy Police Station , Ernakulam NAME AND ADDRESS OF THE PETITIONERS/ACCUSED 1 TO 3: 1 VINEETH, AGED 24 YEARS, $/O.THILAKAN, RESIDING AT KALATHIPARAMBIL HOUSE, PALLURUTHY.P.O, PERUBADAPPU SOUTH KONAM, ERNAKULAM-06 2 SHYAM KUMAR, AGED 23 YEARS, S/O.M.S.KOCHANIYAN, RESIDING AT MOOLE PARAMBIL HOUSE, PALLURUTHY.P.O., PERUMBADAPPU SOUTH KONAM, ERNAKULAM- 06 3 JESLIN JOSEPH, AGED 25 YEARS, S/O.SENSILA VOOS, RESIDING AT KUZHIVILI HOUSE, NEAR VVLP SCHOOL KONAM, PALLURUTHY.P.O, PERUMBADAPPU SOUTH KONAM, ERNAKULAM-06 BY ADVS. SHRI .MITHUN P. SMT .PARVATHY S.KRISHNAN NAME AND ADDRESS OF THE RESPONDENTS: 1 STATE OF KERALA, REPRESENTED BY PUBLIC PROSECUTOR, HIGH COURT OF KERALA, ERNAKULAM PIN-682 031 2 TIBIN PETER, AGED 22 YEARS, S/O. PETER RESIDING AT PULIVEZH HOUSE, KONAM ROAD, PALLURUTHY P.O, PERUMPADAPPY SOUTH KONAM, ERNAKULAM-06 3 ALDRIN ANTONY, Be CRL.MC.NO. 8791 OF 2019 2 2020/KER/191 AGED 21 YEARS, S/O.ANTONY, RESIDING AT PALLI PARAMBIL, CULTUS ROAD, PALLURUTHY.P.O, PERUMBADAPPU, ERNAKULAM-06 4 TENNISON, AGED 23 YEARS, S/O.JOSEPH, RESIDING AT PUTHENPURAKKAL HOUSE, PERUMPADAPPU, ERNAKULAM DISTRICT, PIN-682,006 Rl C.S.HRITHWIK-SR.P.P R2-4 BY ADV. SHRI.RAIEEZ M ASHRAF THIS CRIMINAL MISC. CASE HAVING COME UP FOR ADMISSION ON 06.01.2020, THE COURT ON THE SAME DAY PASSED THE FOLLOWING: _ CRL.MC.NO. 8791 OF 2019 3 2020/KER/191 ORDER Dated this the 06 day of January, 2020 The petitioners are accused in C.C.No. 173/2019 on the files of the Judicial First Class Magistrate Court Il, Kochi for having allegedly committed offences punishable under Sections 341, 323, 324 and 294(b) read with Section 34 of the IPC. The defacto complainant and injured are respondents 2 to 4 who have appeared through counsel and filed affidavits to the effect that the matter has been amicably settled with the petitioners and that they have no grievance against them. A report has been submitted by the Investigating Officer through the learned Senior Public Prosecutor to the said effect. The petitioners do not have any criminal antecedents. In the result, the Crl.MC is allowed and the entire proceedings as against the petitioners in C.C.No.173/2019 on the files of the Judicial First Class Magistrate Court Il, Kochi stands quashed under Section 482 of the Cr.P.C and the accused are discharged. Sd/- ASHOK MENON JUDGE asm Pease eet By CRL.MC.NO. 8791 OF 2019 4 2020/KER/191 APPENDIX EXHIBITS: ANNEXURE Al THE CERTIFIED COPY OF THE FINAL REPORT/CHARGE SHEET, IN CRIME NO.40/2019 OF PALLURUTHY KAASABA POLICE STATION ERNARULAM DISTRICT. ANNEXURE A2 THE AFFIDAVIT, SOLEMNLY AFFIRMED BY THE 2ND RESPONDENT/DEFACTO COMPLAINANT. ANNEXURE A3 THE AFFIDAVIT, SOLEMNLY AFFIRMED BY THE 3RD RESPONDENT/DEFACTO COMPLAINANT. ANNEXURE A4 THE AFFIDAVIT, SOLEMNLY AFFIRMED BY THE 4TH RESPONDENT/DEFACTO COMPLAINANT. //True Copy// PA to Judge"
}