{
    "case_id": "CC 666/2016",
    "court": "HIGH COURT OF KERALA AT ERNAKULAM PRESENT",
    "date": "2017",
    "judge": "B.KEMAL PASHA THURSDAY",
    "petitioners": [
        "THOMAS",
        "KADAMKUNNUMMAL HOUSE",
        "O.ABDULLAH",
        "POOKOM",
        "J. Dated",
        "ASNIJA K.K"
    ],
    "respondents": [
        "CHOKLI POLICE STATION-",
        "O.MUHAMMED",
        "SAMEER K.K",
        "POOKOM",
        "SUB INSPECTOR OF POLICE"
    ],
    "sections": [
        "427 r/w Section 34 of the Indian Penal Code",
        "448"
    ],
    "outcome": "Petitioner is the second accused in Crime No.419/2015 of Chokli Police Station, which is now pending as C.C.No.666 of 2016 of the Judicial First Class Magistrate's Court, Thalassery, registered for th",
    "full_text": "Euan jae 4 ere 2017/KER/49568 IN THE HIGH COURT OF KERALA AT ERNAKULAM PRESENT: THE HONOURABLE MR. JUSTICE B.KEMAL PASHA THURSDAY, THE 7TH DAY OF DECEMBER 2017/16TH AGRAHAYANA, 1939 Cr1.MC.No. 8166 of 2017 () CC 666/2016 of J.M.F.C., THALASSERY CRIME NO. 419/2015 OF CHOKLI POLICE STATION, KANNUR PETITIONER (S)/2ND ACCUSED: ASNIJA K.K, D/O.ABDULLAH, AGED 28 YEARS, KADAMKUNNUMMAL HOUSE, POOKOM, P.O.PANOOR, KANNUR DISTRICT. BY ADV. SRI.CIBI THOMAS RESPONDENT (S) /DEFACTO COMPLAINANT/STATE: 1. SAMEER K.K, S/O.MUHAMMED,AGED 41 YEARS ,KADAMKUNNUMMAL HOUSE, POOKOM, P.O.PANOOR, KANNUR DISTRICT-670673. 2. SUB INSPECTOR OF POLICE, CHOKLI POLICE STATION-670672. 3. STATE OF KERALA, REP.BY PUBLIC PROSECUTOR, HIGH COURT OF KERALA, ERNAKULAM-682031. R1 BY ADV. SRI.K.PRAVEEN KUMAR R2-R3 BY PUBLIC PROSECUTOR SRI.C.S.HRITWICK THIS CRIMINAL MISC. CASH HAVING COME UP FOR ADMISSION ON 07-12-2017, THE COURT ON THE SAME DAY PASSED THE FOLLOWING: El jee oy ar 2017/KER/49568 Cr1.MC.No. 8166 of 2017 () APPENDIX PETITIONER (S)' EXHIBITS ANNEXURE I TRUE COPY OF THE CHARGE IN CRIME NO.419/2015 OF CHOKLI POLICE STATION ANNEXURE IT TRUE COPY OF THE DEATH CERTIFICATE OF THE 1ST ACCUSED ANNEXURE IIT TRUE COPY OF THE AFFIDAVTI SWORN IN BY THE 1ST RESPONDENT ANNEXURE IV TRUE COPY OF THE AGREEMENT ENTERED INTO BETWEEN THE PETITIONER AND THE 1ST RESPONDENT. RESPONDENT'S EXHIBITS: NIL TRUE COPY PA TO JUDGE Scl. Bipasha] 2017/KER/49568 B. KEMAL PASHA, J. Dated this the 7\" day of December, 2017 ORDER Petitioner is the second accused in Crime No.419/2015 of Chokli Police Station, which is now pending as C.C.No.666 of 2016 of the Judicial First Class Magistrate's Court, Thalassery, registered for the offences punishable under Sections 448 and 427 r/w Section 34 of the Indian Penal Code. 2. It seems that the matter has been amicably settled between the parties. 3. On going through the facts and circumstances of the case, it seems that the matter can be permitted to be settled. 4. It has been reported that no criminal antecedents have been reported against the petitioner. The first respondent has filed Annexure-III affidavit affirming that the matter has been amicably settled between him and the petitioner and he has no complaints against the petitioner. Considering the fact that the matter has already been settled amicably between the El apa 2017/KER/49568 Cril.M.C. No.8166 of 2017 -2- parties, this court is satisfied that no purpose would be served in proceeding with the trial of the case. Matters being so, all further proceedings in C.C.No.666 of 2016 of the Judicial First Class Magistrate's Court, Thalassery, in Crime No.419/2015 of Chokli Police Station, against the petitioner, are liable to be quashed. In the result, this Crl.M.C. is allowed and all further proceedings in C.C.No.666 of 2016 of the Judicial First Class Magistrate's Court, Thalassery, in Crime No.419/2015 of Chokli Police Station, against the petitioner, against the petitioner, are hereby quashed. Sd/- B.KEMAL PASHA JUDGE Scl/07.12.2017"
}