{
    "case_id": "Crl.MC.No.2628 of 2015",
    "court": "HIGH COURT OF KERALA AT ERNAKULAM PRESENT",
    "date": "2015",
    "judge": "ANIL K.INARENDRAN TUESDAY",
    "petitioners": [
        "KOZHENCHERRY VILLAGE",
        "MELETHIL KIZHAKKETHIL HOUSE",
        "K.SASI",
        "PATHANAMTHITTA DISTRICT.",
        "O.PARAMESWARAN",
        "RATHEESH",
        "ANIL K.INARENDRAN",
        "T.BJUNCTION",
        "KOZHENCHERRY MURI"
    ],
    "respondents": [
        "ERNAKULAM."
    ],
    "sections": [
        "8(1)"
    ],
    "outcome": "/JUDGMENT IN CP 11/2015 of J.M.F.C.-], PATHANAMTHITTA CRIME NO. 614/2013 OF ARANMULA POLICE STATION , PATHANAMTITTA PETITIONER : ACCUSED :- RATHEESH, AGED 28 YEARS, S/O.PARAMESWARAN, MELETHIL KIZHAKKE",
    "full_text": "a 1: axis Bisse 2015/KER/17459 IN THE HIGH COURT OF KERALA AT ERNAKULAM PRESENT: THE HONOURABLE MR. JUSTICE ANIL K.INARENDRAN TUESDAY, THE 28TH DAY OF APRIL 2015/8TH VAISAKHA, 1937 Crl.MC.No.2628 of 2015 AGAINST THE ORDER/JUDGMENT IN CP 11/2015 of J.M.F.C.-], PATHANAMTHITTA CRIME NO. 614/2013 OF ARANMULA POLICE STATION , PATHANAMTITTA PETITIONER : ACCUSED :- RATHEESH, AGED 28 YEARS, S/O.PARAMESWARAN, MELETHIL KIZHAKKETHIL HOUSE, T.BJUNCTION, KOZHENCHERRY VILLAGE, KOZHENCHERRY MURI, PATHANAMTHITTA DISTRICT. BY ADV. SRI.AJEESH K.SASI RESPONDENT : COMPLAINANT :- STATE OF KERALA, REPRESENTED BY PUBLIC PROSECUTOR, HIGH COURT OF KERALA, ERNAKULAM. BY PUBLIC PROSECUTOR SRI.ABHIJITT LESSLI THIS CRIMINAL MISC. CASE HAVING COME UP FOR ADMISSION ON 28-04-2015, THE COURT ON THE SAME DAY PASSED THE FOLLOWING: Bel 2015/KER/17459 ANIL K.NARENDRAN, J. ~ CrLM.C.No.2628 of 2015 _ Dated this the 28\" day of April, 2015 ORDER The petitioner is the 4\" accused in Crime No.614 of 2013 of Aranmula Police Station, which is now pending as C.P.No.11 of 2015 on the file of the Judicial First Class Magistrate Court-I, Pathanamthitta. The offence alleged against the petitioner is punishable under Section 8(1) and (2) of the Abkari Act. The grievance of the petitioner is that, the Magistrate Court has already issued non-bailable warrant against him and if he surrenders before the Magistrate Court there is every likelihood of the application not being considered on the very same day. Therefore, the petitioner seeks a direction to consider his bail application on the day of surrender itself. 2. Heard the learned counsel for the petitioner and the learned Public Prosecutor. 3. Considering the facts and circumstances of the case, this Crl.M.C. is disposed of directing the petitioner to surrender before the Magistrate Court within a period of two weeks from today and eet ape 2015/KER/17459 Cril.M.C.No.2628 of 2015 2 the Magistrate Court is further directed to consider his bail application on the day of surrender itself, strictly in accordance with law. The non-bailable warrant already issued against the petitioner shall be kept in abeyance for a period of two weeks. The Crl.M.C. is disposed of as above. ANIL K.NARENDRAN, JUDGE skj"
}