{
    "case_id": "Crl.MC.No. 8168 of 2017 ()",
    "court": "HIGH COURT OF KERALA AT ERNAKULAM PRESENT",
    "date": "7 day of December, 2017",
    "judge": "B.KEMAL PASHA THURSDAY",
    "petitioners": [
        "Annexure A",
        "KASARAGOD TALUK AND DISTRICT.",
        "Plt",
        "JOHN",
        "AGED",
        "THORANAM HOUSE",
        "SURESH KUMAR",
        "GOVINDAN.T",
        "MC.No",
        "J. Dated",
        "NARAYANAN.T",
        "ULLAS K"
    ],
    "respondents": [
        "ERNAKULAM-"
    ],
    "sections": [
        "324",
        "323",
        "506 (ii) read with Section 34 of the Indian Penal Code"
    ],
    "outcome": "Petitioners are accused in Crime No.357 of 2014 of Bedakam Police Station, which is now pending as C.C.No.3705 of 2014 of the Judicial First Class Magistrate's Court-I, Kasaragod, for the offences pun",
    "full_text": "pune a oes uJ Beer 2017/KER/49569 IN THE HIGH COURT OF KERALA AT ERNAKULAM PRESENT: THE HONOURABLE MR. JUSTICE B.KEMAL PASHA THURSDAY, THE 7TH DAY OF DECEMBER 2017/16TH AGRAHAYANA, 1939 Cri.MC.No. 8168 of 2017 () CC.NO. 3705/2014 OF JUDICIAL FIRST CLASS MAGISTRATE COURT-1, KASARAGOD CRIME NO. 357/2014 OF BEDAKOM POLICE STATION, KASARGOD DISTRICT PETITIONER(S)/ACCUSED 1 TO 4: 1. GOVINDAN.T, AGED 41 YEARS, (A1) S/O. CHATTHU MANIYANI, THORANAM HOUSE, PARAYAMPALLAM, MUNNAD VILLAGE, KASARAGOD TALUK AND DISTRICT. 2. NARAYANAN.T, AGED 39 YEARS, (A2), S/O. CHATTHU MANIYANI, THORANAM HOUSE, PARAYAMPALLAM, MUNNAD VILLAGE, KASARAGOD TALUK AND DISTRICT. 3. SURESH KUMAR, AGED 33 YEARS(A3), S/O. K. KRISHNAN, THORANAM HOUSE, PARAYAMPALLAM, MUNNAD VILLAGE, KASARAGOD TALUK AND DISTRICT. 4, ULLAS K, AGED 30 YEARS,(A4), S/O. CHATTHU MANIYANI, THORANAM HOUSE, PARAYAMPALLAM, MUNNAD VILLAGE, KASARAGOD TALUK AND DISTRICT. BY ADVS.SMT.HEMALATHA SRI.BINU GEORGE RESPONDENT(S)/STATE - DEFACTO COMPLAINANT: 1. STATE OF KERALA, REPRESENTED BY THE PUBLIC PROSECUTOR, HIGH COURT OF KERALA, ERNAKULAM-682 031 2/- pune a a ] 2017/KER/49569 2. Cri. MiC.No. 8168 of 2017 () 2. RAJAN.T, AGED 46 YEARS, S/O. K. KRISHNAN, THORANAM HOUSE, PARAYANPALLAM, MUNNAD VILLAGE, KASARAGOD TALUK AND DISTRICT - 671 315. R1 BY PUBLIC PROSECUTOR SRI.C.S.HRITHWIK R2 BY ADV. SRI.JOY JOHN (POTTAKKATTIL) THIS CRIMINAL MISC. CASE HAVING COME UP FOR ADMISSION ON 07-12-2017, THE COURT ON THE SAME DAY PASSED THE FOLLOWING: sts pune bm 27 a UJ pees 2017/KER/49569 Crl.MC.No. 8168 of 2017 () APPENDIX PETITIONER(S)' ANNEXURES: ANNEXURE A1_ CERTIFIED COPY OF FIR IN CRIME NO. 357/2014 OF BEDAKAM POLICE STATION. ANNEXURE A2_ CERTIFIED COPY OF FINAL REPORT IN CRIME NO. 357/2014 OF BEDAKAM POLICE STATION. ANNEXURE A3_ AFFIDAVIT DATED 16.11.2017 SWORN BY THE 2ND RESPONDENT. RESPONDENT(S)' ANNEXURES: NIL ITRUE COPY! P.A.TO JUDGE sts Plt) 2017/KER/49569 B. KEMAL PASHA, J. Dated this the 7 day of December, 2017 ORDER Petitioners are accused in Crime No.357 of 2014 of Bedakam Police Station, which is now pending as C.C.No.3705 of 2014 of the Judicial First Class Magistrate's Court-I, Kasaragod, for the offences punishable under Sections 323, 324 and 506 (ii) read with Section 34 of the Indian Penal Code. 2. It seems that the matter has been amicably settled between the parties. 3. On going through the facts and circumstances of the case, it seems that the matter can be permitted to be settled. No criminal antecedents have been reported against the petitioners. The second respondent has filed separate affidavits as Annexure A3, affirming that the matter has been amicably settled between him and the petitioners and he has_ no complaint against the petitioners. Considering the fact that Ei aael atee| Bae 2017/KER/49569 Cri.M.C. No.8168 of 2017 -2- the matter has already been settled amicably between the parties, this court is satisfied that no purpose would be served in proceeding with the trial of the case. Matters being so, all further proceedings in C.C.No.3705 of 2014 of the Judicial First Class Magistrate's Court-I, Kasaragod, in Crime No.357 of 2014 of the Bedakam Police Station, are liable to be quashed. In the result, this Crl.M.C. is allowed and all further proceedings in C.C.No.3705 of 2014 of the Judicial First Class Magistrate's Court-I, Kasaragod, in Crime No.357 of 2014 of the Bedakam Police Station, are hereby quashed. Sd/- B.KEMAL PASHA JUDGE Scl/07.12.2017"
}