{
    "case_id": "Crl.MC.No.122 OF 2020 (E)",
    "court": "HIGH COURT OF KERALA AT ERNAKULAM",
    "date": "2020",
    "judge": "P.B.SURESH KUMAR THURSDAY",
    "petitioners": [
        "SHIFANA N. P. AGED",
        "Beet El tree",
        "Vatakara",
        "PETER - PP",
        "MAYYANNOOR P. O.",
        "O. AMMED HAJI",
        "Ze",
        "AGED",
        "P.B.SURESH KUMAR",
        "Blak",
        "AYISHU",
        "SHABEER",
        "RANDAM MILE",
        "Kozhikode"
    ],
    "respondents": [
        "KOZHIKODE DISTRICT.",
        "ERNAKULAM -",
        "AGED",
        "REPRESENTED BY THE STATION HOUSE OFFICER",
        "O.KUNJAMMED HAJI",
        "RANDAM MILE",
        "VATAKARA POLICE STATION",
        "SHIFANA N. P."
    ],
    "sections": [
        "482",
        "406",
        "498A read with Section 34 of the Indian Penal Code"
    ],
    "outcome": "/JUDGMENT IN CC 1014/2016 OF JUDICIAL MAGISTRATE OF FIRST CLASS ,VATAKARA CRIME NO.318/2016 OF Vatakara Police Station , Kozhikode PETITIONER/ACCUSED: 1 SHABEER AGED 30 YEARS S/O. AMMED HAJI, THAYYULL",
    "full_text": "tate Ze soya ei te Blak anert IN THE HIGH COURT OF KERALA AT ERNAKULAM 2020/KER/919 PRESENT THE HONOURABLE MR. JUSTICE P.B.SURESH KUMAR THURSDAY, THE O9TH DAY OF JANUARY 2020 / 19TH POUSHA, 1941 Cr1.MC.No.122 OF 2020 (E) AGAINST THE ORDER/JUDGMENT IN CC 1014/2016 OF JUDICIAL MAGISTRATE OF FIRST CLASS ,VATAKARA CRIME NO.318/2016 OF Vatakara Police Station , Kozhikode PETITIONER/ACCUSED: 1 SHABEER AGED 30 YEARS S/O. AMMED HAJI, THAYYULLATHIL HOUSE, VANIMEL P. O., VATAKARA TALUK, KOZHIKODE DISTRICT, PIN - 673 506. 2 AYISHU AGED 57 YEARS S/O. AMMED HAJI, THAYYULLATHIL HOUSE, VANIMEL P. O., VATAKARA TALUK, KOZHIKODE DISTRICT, PIN - 673 506. BY ADVS. SRI.U.P. BALAKRISHNAN SRI.K.R.AVINASH (KUNNATH) RESPONDENT/STATE & DEFACTO COMPLAINANT: 1 THE STATE OF KERALA REPRESENTED BY THE STATION HOUSE OFFICER, VATAKARA POLICE STATION, KOZHIKODE DISTRICT, THROUGH PUBLIC PROSECUTOR, HIGH COURT OF KERALA, ERNAKULAM - 682 031. 2 SHIFANA N. P. AGED 28 YEARS D/O.KUNJAMMED HAJI, RESIDING AT NIBRAS HOUSE, RANDAM MILE, VAIKKILISSERI ROAD, MAYYANNOOR P. O., KOZHIKODE DISTRICT. R2 BY ADV. C.H.ABDUL RASAC SRI.SANTHOSH PETER - PP THIS CRIMINAL MISC. CASE HAVING COME UP FOR ADMISSION ON 09.01.2020, THE COURT ON THE SAME DAY PASSED THE FOLLOWING: Leganl 2020/KER/919 Cr1.MC.No.122 OF 2020 (EK) 2 Cri.M.C.No.122 of 2020 ORDER This is a proceedings under Section 482 of the Code of Criminal Procedure for quashing Annexure - 2 Final Report pending trial before the Judicial First Class Magistrate Court, Vatakara in C.C.No.1014 of 2016. 2. The petitioners are accused Nos.1 and 2 in the said case. The case was one registered under Sections 406 and 498A read with Section 34 of the Indian Penal Code. 3. It is stated that the petitioners and the de facto complainant have amicably settled the disputes and an affidavit sworn to by the de facto complainant is part of the records. 4. Heard the learned counsel for the petitioners, the learned Public Prosecutor as also the learned counsel for the de facto complainant. 5. In the light of the decision of the Apex Court in Gian singh v. State of Punjab, (2012) 10 SCC 303, insofar Pata 2020/KER/919 Cr1.MC.No.122 OF 2020 (E) 3 as the offences alleged against the petitioners are only offences punishable under Sections 406 and 498A read with Section 34 of the Indian Penal Code, | am of the view that this is an appropriate case where this court has to invoke the jurisdiction under Section 482 of the Code of Criminal Procedure to quash the proceedings. In the result, the Crl.M.C. is allowed and Annexure - 2 Final Report pending trial before the Judicial First Class Magistrate Court, Vatakara in C.C.No.1014 of 2016 is quashed. Sd/- P.B.SURESH KUMAR, JUDGE. PV Beet El tree Fe soya ete tee Bian 2020/KER/919 Crl.MC.No.122 OF 2020 (E) 4 APPENDIX PETITIONERS' EXHIBITS: ANNEXURE 1 TRUE COPY OF THE FIR IN CRIME NO.318/2016. ANNEXURE 2 TRUE COPY OF THE FINAL REPORT IN CRIME NO.318/2016. ANNEXURE 3 TRUE COPY OF THE AFFIDAVIT SWORN BY THE 2ND RESPONDENT. RESPONDENTS' EXHIBITS: NIL"
}