{
    "case_id": "Crl.MC.No. 2503 of 2017",
    "court": "HIGH COURT OF KERALA AT ERNAKULAM",
    "date": "5 day of January, 2018",
    "judge": "B.KEMAL PASHA FRIDAY",
    "petitioners": [
        "PANIPRA P.O.",
        "DHEERENDRAKRISHNAN",
        "B.KEMAL PASHA",
        "MEETHALAKATH MAHAMOOD",
        "CHAIRMAN"
    ],
    "respondents": [
        "THE MANAGER",
        "BRANCH OFFICE",
        "REPRESENTED BY THE STANDING COUNSEL"
    ],
    "sections": [],
    "outcome": "A Trust is proceeded against for non-payment of ESI contribution. Subsequently, it seems that the contribution has been paid. At the same time, even if the contribution is paid, it cannot be said that",
    "full_text": "ial 32 Et Sah .. pak 4 IN THE HIGH COURT OF KERALA AT ERNAKULAM 2018/KER/478 PRESENT: THE HONOURABLE MR. JUSTICE B.KEMAL PASHA FRIDAY, THE 5TH DAY OF JANUARY 2018 / 15TH POUSHA, 1939 Cr1.MC.No. 2503 of 2017 C.C.NO. 620/2014 OF JUDICIAL FIRST CLASS MAGISTRATE COURT, PERUMBAVOOR PETITIONER (S) /ACCUSED NO.2 : MEETHALAKATH MAHAMOOD , CHAIRMAN, M/S.BLOSSOM INTERNATIONAL RESIDENTIAL SCHOOL, PANIPRA P.O. ,KOTHAMANGALAM. BY ADVS.SRI.S.RAJEEV SRI.K.K. DHEERENDRAKRISHNAN SRI.V.VINAY SRI.D.FEROZE RESPONDENT (S) /STATE/COMPLAINANT : 1. STATE OF KERALA, REPRESENTED BY PUBLIC PROSECUTOR, HIGH COURT OF KERALA, ERNAKULAM-682 031. 2. THE MANAGER, BRANCH OFFICE, ESI CORPORATION, PERUMBAVOOR, REPRESENTED BY THE STANDING COUNSEL, HIGH COURT OF KERALA, ERNAKULAM-682 031. R1 BY PUBLIC PROSECUTOR SRI.ALEX M.THOMBRA R2 BY ADV. SRI.K.SANDESH RAJA THIS CRIMINAL MISC. CASE HAVING COME UP FOR ADMISSION ON 05-01-2018, THE COURT ON THE SAME DAY PASSED THE FOLLOWING: Msd. Eg eae ae eso 4 Crl.MC.No. 2503 of 2017 2018/KER/478 APPENDIX PETITIONER(S)' ANNEXURES : ANNEXURE TI CERTIFIED COPY OF THE COMPLAINT IN CC NO.620/2014 ON THE FILE OF THE JUDICIAL MAGISTRATE OF FIRST CLASS, PERUMBAVOOR. ANNEXURE IT TRUE COPY OF THE TRUST DEED DATED 12.7.2004. ANNEXURE IIT TRUE COPY OF THE LETTER DATED 10.2.2017 ISSUED BY THE ASST. DIRECTOR, ESI CORPORATION, ERNAKULAM. RESPONDENT (S) ' ANNEXURES : NIL / [TRUE COPY// P.S.TO JUDGE Msd. us 2018/KER/478 B. KEMAL PASHA, J. eee \"Dated this the 5 day of January, 2018 ORDER A Trust is proceeded against for non-payment of ESI contribution. Subsequently, it seems that the contribution has been paid. At the same time, even if the contribution is paid, it cannot be said that there is no offence. 2. According to the petitioner, who is the 2\"? accused, he is the Chairman of the Trust and he is not performing the day-to-day affairs of the trust. It is for the petitioner to apprise the court below with regard to the true state of affairs regarding the Trust. Without prejudice to the right of the petitioner to take up all these contentions before the court below, this Crl.M.C. ey 2018/KER/478 CRL.M.C.No. 2503 of 2017 20 is disposed of. As far as practicable, the court below shall grant exemption to the petitioner from personal appearance. Sd/- B. KEMAL PASHA, JUDGE. ul/- [True copy] P.S. to Judge."
}