{
    "case_id": "CC 1707/2014",
    "court": "HIGH COURT OF KERALA AT ERNAKULAM PRESENT",
    "date": "17 day of April, 2015",
    "judge": "K.SURENDRA MOHAN FRIDAY",
    "petitioners": [
        "VIJESH KUTTAN P",
        "BINDU PUTHIYADATH",
        "KARTHIYAYINI PUTHIYADATH",
        "THIMIRI AMSOM",
        "O.APPUKUTTAN",
        "J. Dated"
    ],
    "respondents": [
        "O.P.KRISHNAN",
        "PILIKODU VILLAGE",
        "DHANYAA.V.",
        "KASARAGOD DISTRICT-"
    ],
    "sections": [
        "482"
    ],
    "outcome": "The petitioners, accused in Crime No.737/2012 of Chandera Police Station, Kasaragode District, pending as C.C.No.1707/2014 of the Judicial First Class Magistrate-l, Hosdurg, have filed this petition u",
    "full_text": "bos ee) 3 BE] 4 : 2015/KER/17188 IN THE HIGH COURT OF KERALA AT ERNAKULAM PRESENT: THE HONOURABLE MR.JUSTICE K.SURENDRA MOHAN FRIDAY, THE 17TH DAY OF APRIL 2015/27TH CHAITHRA, 1937 Cri.MC.No. 6587 of 2014 CC 1707/2014 OF JUDICIAL FIRST CLASS MAGISTRATE COURT -I, HOSDRUG. CRIME NO. 7737/2012 OF CHANDERA POLICE STATION , KASARAGOD. PETITIONER(S)/[ACCUSED: 1. VIJESH KUTTAN P, AGED 35 YEARS, S/O.APPUKUTTAN, CHITTADI, THIMIRI AMSOM, ALAKKODU. 2. KARTHIYAYINI PUTHIYADATH, AGED 62 YEARS, S/O.APPUKUTTAN, CHITTADI, THIMIRI AMSOM, ALAKKODU. 3. BINDU PUTHIYADATH, AGED 37 YEARS, S/O.APPUKUTTAN, CHITTADI, THIMIRI AMSOM, ALAKKODU. BY ADVS.SRI.P.K.SUBHASH SRIL.K.REEHA KHADER RESPONDENT(S)/STATE/DEFACTO COMPLAINANT: 1. STATE OF KERALA, REPRESENTED BY THE PUBLIC PROSECUTOR, HIGH COURT OF KERALA, ERNAKULAM-682 031. 2. DHANYAA.V., AGED 29 YEARS, D/O.P.KRISHNAN, VARUKKOLU VAYAL, PILIKODU P.O., PILIKODU VILLAGE, HOSUDURG TALUK, KASARAGOD DISTRICT-671 310. R1 BY PUBLIC PROSECUTOR SMT.P.A.RAZIYA R2 BY ADV. SRILA.-AARUNKUMAR THIS CRIMINAL MISC. CASE HAVING COME UP FOR ADMISSION ON 17-04-2015, THE COURT ON THE SAME DAY PASSED THE FOLLOWING: mbr/ be ee 3 BE] 4 : 2015/KER/17188 Cri.MIC.No. 6587 of 2014 APPENDIX PETITIONER(S)' ANNEXURES: ANNEXURE-A1. ATRUE COPY OF THE FIR IN CRIME NO.737/2012 OF CHANDERA POLICE STATION. ANNEXURE-A II. ATRUE COPY OF THE FINAL REPORT. ANNEXURE-AIII. ATRUE COPY OF THE AFFIDAVIT SWORN BY THE 2ND RESPONDENT ENDORSING THE FACTUM OF SETTLEMENT. ANNEXURE-AIV. A TRUE COPY OF THE AFFIDAVIT. RESPONDENT(S) ANNEXURES: - NIL {TRUE COPY/ P.S. TO JUDGE mbr/ oe 2015/KER/17188 K.SURENDRA MOHAN, J. Dated this the 17 day of April, 2015 ORDER The petitioners, accused in Crime No.737/2012 of Chandera Police Station, Kasaragode District, pending as C.C.No.1707/2014 of the Judicial First Class Magistrate-l, Hosdurg, have filed this petition under Section 482 of the Code of Criminal Procedure, to quash all further proceedings in the matter. According to the petitioners, the defacto complainant is the wife of the 1* petitioner. The case had originated out of matrimonial disputes that were pending between the 1* petitioner and the defacto complainant. According to the petitioners, they are innocent of all the charges levelled against them. They have settled the disputes among themselves and seek the issue of appropriate orders quashing the criminal proceedings, since the matter has been settled. 2. Pursuant to the directions issued by this Court, affidavits have been filed by the 1* petitioner as well as the defacto complainant stating that, their disputes have already been settled and that, they are living separately. The learned Public Prosecutor also reports that, there is no objection in quashing the criminal proceedings. maa 2015/KER/17188 Crl.M.C.No0.6587 of 2014 2 In view of the above, this petition is allowed. All further proceedings in Crime No.737/2012 of Chandera Police Station, Kasaragode District now pending as C.C.No.1707/2014 of the Judicial First Class Magistrate-], Hosdurg are quashed. Sd/- K.SURENDRA MOHAN, JUDGE. AV"
}